不知道孟晚舟有几本护照，网上的消息说，她有7本护照，其中4本中国大陆的，3本香港的，不知真假。但我想提醒舆论场的是，孟晚舟这件事，不要被她的护照问题给带偏了。因为一个人有几本护照，这个数字本身的意义与它给人造成的印象很可能有很大差异。比如我告诉大家，老胡本人至少有3本护照，大家乍一听，老胡是不是很厉害你会不会猜老胡其实是个外国人，隐藏在我党内部，虚伪地把自己打扮成爱国者，忽悠中国的韭菜们我告诉大家老胡的3本护照都是什么，其中有一本是我自己办的因私护照，还有两本是公务护照，其中一本好像是因为戳	未
不知道孟晚舟有几本护照，网上的消息说，她有7本护照，其中4本中国大陆的，3本香港的，不知真假但我想提醒舆论场的是，孟晚舟这件事，不要被她的护照问题给带偏了因为一个人有几本护照，这个数字本身的意义与它给人造成的印象很可能有很大差异比如我告诉大家，老胡本人至少有3本护照，大家乍 ...全文	未
不知道就亏大了！这种蔬菜便宜又常见 吃一根顶十副药 	未
不知道我的爱豆算不算，但目前看来，我应该也算是个人生硬核玩家了，毕竟对爱豆的兴趣驱动了我对他的无尽探索	未
不知道，或者装作不知道。//@安娜hanxueping:医院为啥一直封锁消息，不知道大家都担心张医生的生命安危吗	未
不知道是不是吃药的问题，心慌失眠情绪低落，特别烦，天天这么往家一待这人有啥用啊，早上起来一直琢磨活着的意义到底是什么，想跟高育良说说，张了几次嘴又憋回去了，他最近压力也够大的，一个月我瘦四斤他瘦五斤，后来打开手机看见一个网友艾特我一条微博癌症治疗的意义，看完我明白了，活着不是一个人的事儿，是一家人的希望，等一个月复查的时候看看减减药量可能就好了。	未
不知道是不是小杨生煎吹白sai酒第一人，也不是真想喝，还想背回去的，主要这地方不给水，掏出来当水喝了，你们吃的啥不止旅行旅行新势力V影响力峰会 上海  南京西路	未
不知道最近大家有没有感受到超凶降温，反正我已经穿上棉裤了，一句话概括一下你那里现在有多冷我先来：冷空气年底冲业绩，不冻哭我们誓不罢休	未
不知道有没有人能给中浦悠花带个话，想请她起诉蒋劲夫那个爆她7P的朋友。作为一名中国网友，我们不想跟他一起丢人。	未
不知道有没有去过哈尔滨或者云南的朋友，或者当地人的可以出个攻略给大家的呢可以私信或者微信发我啊。谢谢啦！！！	未
不知道的还以为快决赛了呢，姐妹们没必要，真的没必要	未
不知道，网友能不能分清，表叔和表舅不是一个人，我们不能把他们俩人当成一个人。	未
不知道能帮上什么忙总之先扩散	未
不知道自己想要什么 没有动力 没有目标 只有一大堆的牢骚和沮丧	未
不知道自己想要什么没有动力 没有目标只有一大堆的牢骚和沮丧	未
不知道要起什么标题了，小Q给大家拜个早年吧！！！	未
不知道设在这个位置是不是合法@不羈先生-戒烟之王 @控烟之声毕无烟 @鸡龙2011	未
不知道该说什么河南男子结婚纪念日次日杀妻后致电岳母：我杀了你女儿杀妻后发视频给岳母 河南商丘男子李磊在和妻子结婚5周年纪念日次日，将妻子王平杀死在租住的宿舍里。案发当晚，岳母接到李磊电话说我杀了你女儿，还收到一段案发现场的视频，画面惨不忍睹，王平的脖子被砍断了一半。李磊还说，王平生是他的人，死是他的鬼。据悉，日常生活中，李磊多次对王平实施家暴。王平也向家里人说过，但李磊每次都态度诚恳地表示以后再也不会了，下一次就会变本加厉。王平也曾提出过离婚，李磊说要是离婚就杀了我全家。因涉嫌故	未
不知道详情，看着太揪心了，跪求转发，找到这个可怜的小女孩！ 网页链接	未
不知道，轻飘飘的网路名声对他沉甸甸的生活不重要 查看图片 //@东方特盈:@史里芬Schlieffen 这是你发了之后火的吗	未
不知道还有没有一样的人！！！	未
不知道这10000块钱是谁的，也没人来领	未
不知道这些人，登山的意义是什么//@传媒老王:这就是在玩命了，是想让人觉得你们视死如归吗	未
不知道这又是谁的老父亲，一百多斤的重量，一公里的山路，一趟只有20块钱的收入。微博视频	未
不知道这是哪里，不过我老家那边的饭店很少有这种单层门直接就是室外的，都至少弄里外两层门，实在不行也装个门帘//@JKL茶杯装备型:@重工组长于彦舒 @一块破铁 @猴淳良 原来东北现在有这么过瘾的景色吗//@杀生地藏: 等等等等等等等等丢丢丢	未
不知道这样怎么判责任，谁赔	未
不知道这种方法靠不靠谱，有大数据证明一下吗	未
不知道那些脑残为何那么喜欢抢方向盘//@樊建川:转发微博	未
不硬吧//@shangdinizaina:广告有点硬//@陈思进: 当越来越多年轻人奋斗的节奏赶不上北京疏解的步伐，在时代主导下，及时做出全新的抉择往往能跳出红海	未
不确定因素升温 欧洲股市全线低开	未
不礼让罚款200元记3分，交警曝光160辆不礼让斑马线车辆	未
不礼让行人，乱停乱放青州街头不文明行为大曝光！	未
不社交，因為沒錢。	未
不离法王如意宝：学佛不要鹦鹉学舌，但有太多人中招	未
不离法王如意宝：当今时代，人人心里都住有一个恶魔	未
不离法王如意宝：福德浅薄之人，遇不到真正的福田	未
不秃 来问网页链接	未
不种粮食种草药 泗阳这个村农民走上增收路	未
不积极履职，竹山一家单位坐上被告席！	未
不穿警服的站岗人 本溪城市交通安全志愿者侧记	未
不笑我就咯吱你//@战争史研究WHS://@zacknia:我想你们了	未
不符合工信部规范条件的光伏企业现已达41家！其中都有谁都是为何	未
不等不靠，甩穷帽，锅巴生意帮他们脱了贫！安徽泾县黄村镇沙元村的汪明祥和姚新花夫妻，通过生产手工锅巴于2016年顺利脱贫。今年他们又利用当地扶贫小额贷款和自筹资金创办锅巴厂，日均销售额400多元。不等不靠，甩穷帽，我们靠手艺脱贫，也有信心实现致富。安徽今年有望实现70万以上贫困人口脱贫 新华视点	未
不等不靠，甩穷帽，锅巴生意帮他们脱了贫汪明祥和姚新花是安徽泾县黄村镇沙元村的一对贫困夫妻，通过生产手工锅巴于2016年顺利脱贫今年他们又利用当地扶贫小额贷款和自筹资金创办了强源锅巴厂，日均销售额400多元不等不靠，甩穷帽，我们夫妻俩靠手艺脱了贫，也有信心实现致富祝福！	未
不等不靠，融水花孖村村民自发组织忙修路！	未
“不等发年终奖，我直接跳买方了！”八大案例看券商员工全线熬冬，不少一线人员月薪低到不用交税	未
「不算上重置版的话，《战神 4》距离上一款《战神》游戏已经过去了 5 年之久，圣莫尼卡工作室用这 5 年的心血铸成了《战神 4》，自早期预告片发布后，舆论对于《战神 4》并不友好，但当媒体评分出来时，《战神 4》的制作总监 Cory Barlog 哭了，他说道：这五年的心血真的没有白费。」	未
不算，只是公开爆料，崔老师身份贵重，必须让公安税务纪检找上门去主动求见_//@轻风细雨大叔:@司马3忌这也算是反腐实名举报吗	未
不算后续的后续 查看图片 //@蒜长:后面还一起喝酒了 投稿是昨晚凌晨十二点	未
不算延迟！！！！	未
不管三七二十七了，大家说说，A股不死不活的，这是在憋什么屁呢	未
不管了，我要去三亚了	未
不管人敌视什么，这一瞬之间，人就正在成为什么。若是长久的敌视，人就往这个方向慢慢地成长，直到人长成敌视的对象为止。这是尼采所说的：你凝视深渊，深渊便在凝视着你。《半山文集》	未
不管今天怎么样，明天又是新的一天	未
不管你买不买保险，这五张图看懂了，对你没坏处！	未
不管你们一定是兄妹！	未
不管你在哪个单位上班，请记住：工作不养闲人，团队不养懒人入一行，先别惦记能赚多少钱，先学着让自己值钱没有哪个行业的钱是好赚的，赚不到钱，赚知识赚不到知识，赚经历 赚不到经历，赚阅历赚到以上任何一点，就不可能赚不到钱。只有先改变自己的态度，才能改变人生的高度。	未
不管你在哪里上班，请记住以下黄金定律！	未
不管你是18cm还是20cm，戴上这个东西让你猛如虎！	未
不管你是不是曲堤的，告诉你个事，这个周末有大活动...	未
不管你是在南京生活，还是正准备去到南京旅游，一起跟着甩甩舞的节奏稳中带甩玩南京吧	未
不管你是谁，干啥的，多有钱，多牛逼在北京一定不要惹老年人 你大爷终究还是你大爷	未
不管你爱不爱钱，眼下缺不缺钱，能赚就尽量多赚点，有备无患。 没事还是多挣点钱吧，活着很贵的	未
不管你逃到哪里，昭通的警察蜀黍都能找到你	未
不管做什么，一切都是以经济利益为中心。理解了这一点，就理解了一切社会现象。	未
不管到哪里，消防安全都与您息息相关！	未
不管发生什么事，都会好的。	未
不管发生什么，都不要放弃，坚持走下去，肯定会有意想不到的风景.也许不是你本来想走的路，也不是你本来想登临的山顶，可另一条路有另一条路的风景，不同的山顶也一样会有美丽的日出，不要念念不忘原来的路。早安	未
不管在哪里都要记得常回家	未
不管怎么说，叙利亚北部的库尔德SDF这顿揍是脱不了了美军要撤，土鸡要攻，叙政府军因为之前库武SDF那个操行不愿意和他们谈，更别说提供保护，有点势还没得势就谁都不认，谁受得了啧之前伊拉克库族公投让伊拉克军警和土鸡内外夹着给揍了一顿，咋这么不长记性	未
不管怎样，还是要投的，只能说别那么较真，毕竟水分很大！！而且不止各家粉丝关注这个，媒体有时候也会关注这个榜单，数据还是蛮重要的。	未
不管感觉有多糟，起床，梳洗，露面，永不放弃。	未
不管是不是编的，骗子可是无孔不入@又氵古走: 估计是编的吧。	未
不管最后你的身边是谁，你还有自己。	未
不管有没有人欠你钱不还！都把这个放到圈子里！	未
不管有没有人欠你钱不还，都把这个放到朋友圈里吧！	未
不管梦到的是朋友还是亲人	未
不管男女老少，还是需要领舞的	未
不管过了多久，我镜头里的人还是你。 情感	未
不系安全带被拦下  一查还有“隔夜酒”	未
不纠缠了，你也有你的事。	未
不约	未
不约吊打的哦	未
不练好脚，怎么可能练好拳	未
不经意间流露出的是每一次的全情投入 微博视频	未
不绑定完美号，无法使用steam中国假消息！今天网络盛传一张图，此图中的steam团队声称steam中国上线后如果不绑定完美账号，将无法继续使用steam，此外人民币支付渠道也将被取消。然而这条消息经证实为假消息，图也是P的。在这里希望大家不要误传假消息，目前国内游戏行业刚刚有一些回暖的迹 ...全文	未
不给你买齐X1X和PS4 Pro的女人，不配说爱你反制黑鸡汤吊打咪蒙类洗脑文	未
不给你脸是道理。	未
不给我做晚饭，就知道蹦迪 微博视频	未
不给涉毒明星打码火了，还记得满屏马赛克的他们吗29日明星陈某涉毒被抓，全民热议。陈某是谁在心底的名字呼之欲出之时，党报微博第一时间送来无码高清大图网友说，别说什么情感失意事业受阻，没有任何理由能成为吸毒的借口！吸毒不光会毁了自己，害了家人，他们购买毒品的每一分钱，都会变为打在缉毒警察身上的子弹。还记得这一幕吗牺牲民警追悼会上满屏马赛克吗他叫贾巴伍各，一个彝族汉子，四川凉山布拖县缉毒民警。在山区搜捕毒贩时遭遇伏击胸部中弹，牺牲前，他拼尽全力说出的最后一句话是：不要管我，快追	未
不给涉毒明星打码火了，还记得满屏马赛克的他们吗明星陈某涉毒被抓，全民热议。陈某是谁在心底的名字呼之欲出之时，党报微博第一时间送来无码高清大图。网友说，别说什么情感失意事业受阻，没有任何理由能成为吸毒的借口！吸毒不光会毁了自己，害了家人，他们购买毒品的每一分钱，都会变为打在缉毒警察身上的子弹。还记得牺牲民警追悼会上满屏马赛克吗? （中央政法委长安剑） 不给涉毒明星打码火了，还记得满屏马赛克的他们吗	未
不给钱修墙就关政府 特朗普和民主党领袖吵起来了	未
不给钱就不断举报！嵊州这个村民拿到65000元封口费后（前方高能）	未
不给钱就不断举报！绍兴这个村民拿到65000元封口费后	未
不给青春留遗憾，来了，我的职业梦@澳门黑熊篮球俱乐部	未
不羡慕街头年轻的情侣，只羡慕白发苍苍路边互相搀扶的老夫妻。	未
不老仙妻永葆青春的秘密，竟是这样狂虐自己的身体	未
不老药找到了！每天踩一踩它，一个月后，55岁变35岁！	未
不考虑下喵喵家天猫精灵AI智能音箱吗	未
不考虑其他因素，你最想做什么职业	未
不耐烦的人可以马住了。//@刘胖胖:不知道的可以自行搜索，然后分享下自己的做操视频。	未
不聊动力不谈配置，就聊聊车名的那点事儿	未
不联系你是真的不喜欢你，绝对不可能是因为忙。	未
不肯冬眠的小黑熊丨肖冰姐姐讲故事	未
不肯留名！常州丽华三小一学生捡到钱包，按驾照地址冒雨找了20分钟送还失主	未
不肯穿秋裤，如何应对零下1度	未
不胜其扰也。极其滑稽的是，造谣者口眼错位满脸悲怆，一副拯我族于水火的江湖英雄扮相。//@书香满心://@崔紫剑:天天被造谣的不只是他们，只是他们有话语权。这个警方无法接案，非得去法院自诉，但司法维权成本很高。//@终南刺青:倪萍@司马南 余秋雨，属于天天被咬，月月被谣，谣不胜谣	未
不胜唏嘘，新时代新社会	未
不能久伴，就别靠近不能深爱，就别深拥。	未
不能任性飞！桓台警方拿下一个超人！	未
不能！但我可以理直气壮的365天不重样，1天换1套衣服	未
不能做的还不如一个H站啊//@小浪:@微公益 @微博搜索 //@李彬BinLee:绝望时搜出这个大概会哭出来吧	未
不能免俗，拍点游客照 微博视频	未
不能再拖！土耳其要求库族武装年底前撤出曼比季	未
不能卖烟了！以后珠海中小学周边50米半径内不能卖烟！	未
不能去海底深潜，那就去南宁这个水族馆膜拜海洋世界吧！	未
不能叫儿子。那就叫儿砸吧	未
不能听 会哭的	未
不能回头，再去犯相同的错误了必须向前看，要犯就犯新的错误	未
不能在KTV唱《K歌之王》，背后是一个持久版权的生意	未
不能对所有高毛利行业持有一丝侥幸了，白酒金融就是下一个倒霉蛋	未
不能忍！必须曝光张掖这家月子中心惊人的内幕！	未
不能忍！柳江河在流血！大白天竟然有人做这种事！	未
不能惯着上海街头的“炸街族”了！这个黑科技可快速锁定车辆	未
不能承受的爱：3岁女童脚痛得连路都走不动医生一问，每天2碗这种汤	未
不能拒绝的理由	未
不能接受你的观点，说的再多有什么用	未
不能放弃，不能便宜了它们	未
不能欺负本土球员啊，外援不敢重新签，老搞本土球员干啥//@中甲联赛报道:温和了很多	未
不能用道德评判此事，五星的标准没有监督吗还是从法律法规入手，避免这种事才行@哈尔滨同城早安哈尔滨生活身边事儿	未
不能直视这个词了//@是晚秋了:豁然开朗！//@卖鱼倩二号摊: 难道不是睡（动词）敌人//@光_天涯有蔷薇:阔以//@KC賭場海馬瀨人冥界線上發牌:命運的宿敵命中註定要在對方家裡過夜的敵人	未
不能给四川人丢脸「搞笑」	未
不能被老擊敗 微博视频	未
不能让人躁动的超跑不是好思域	未
不能让你知道，直到，直到你投进别人的怀抱	未
不能让“漂流瓶”成为色情广告流布的暗门	未
不能让老伴知道，那些感染艾滋病的老人经历过什么	未
不能说一点关系没有，但不是核心因素，什么舱飞机都不会等你，还是提前做功课起了作用，比如提前打好登机牌就特别重要，1点46就停止值机了，我2点01才到值机柜台，如果不提前打好就没希望了。//@橙果Inter:是因为你是商务舱吧 还有常旅客。	未
不能说的秘密！美国为了登月，曾花30亿美元求助这个小国	未
不能跟不熟的人吃火锅	未
不能转发杨超越了@火箭少女101官博 ：禁止商家企业擅自使用杨超越照片因为被封锦鲤，杨超越的肖像图一度霸屏社交媒体。不过现在用她照片的商家要注意了。22日，火箭少女101在其官方微博发声明称，近日网络出现部分商家以商业为目的，在未经授权的情况下虚构事实，擅自使用杨超越女士肖像图片，进行商业炒作行为，严重侵犯艺人肖像权名誉权。声明表示，禁止任何商家企业未经授权及许可，擅自使用杨超越女士个人形象，以及捆绑利用杜撰相关图片视频及文案等素材，进行恶意商业炒作的行为。	未
不能送人！！不然孙子孙女咋带你环球旅行//@炸天妇罗定食:哈哈//@Embosom1128:爷爷咋这样	未
不能随便跟老人开玩笑	未
不能验货自己取也不方便 快递柜是否能担起“百米”重任	未
不自己出钱，DZ老大死都不会买他王冕为平生出头：大哥玩YY是扶贫来了！	未
不良资产市场前瞻：未来三年量升价跌，处置难度不断加大	未
不良资产管理行业存痛点 广州办论坛“开方”	未
不良资产进入全面商业化时期 专家：应该以投行思维处置不良资产	未
不花白不花	未
不苦夏  乔亚洁返乡画像	未
不落下一名困难群众	未
不行了 太牛批了 有人送了小桥一箱火龙果，结果被顺丰送成这样看箱的时候我以为是一箱脑子哈哈哈哈哈哈哈哈哈哈哈哈哈@月夜桥嗷嗷嗷	未
不行了，这一对赢得太彻底//@大莉徐：绝不是巧合 查看图片	未
不行我分不清二声和四声	未
不行洛阳铲不能借//@我和基友的日常:悲伤逆流成墓哈哈哈哈哈//@五行属二:校园霸凌真的很恐怖//@镰刀刮腋毛:看刘老师视频感动了	未
不行的//@今天不想下蛋:这次用手，下次拿刀。这次脸疼，下次没命。//@昵称还没想好喔喔喔:首先我想吐槽他的七彩气泡框//@八九不乖:原谅干啥，等着挨打吗//@HelloJuvenile:不可能原谅 有一次就有第二次	未
不行，还想买东西。。。	未
不装个嵌入式玄关柜，你的鞋子包衣服都放哪！	未
不要一边抱怨，一边拒绝改变，这真是满满的正能量	未
不要与自己的平凡作对	未
不要为还没发生的事情不开心	未
不要举报我 微博视频	未
不要乱叫老家了！中国姓氏分布图出炉，看看自己的根在哪里	未
不要互相伤害	未
不要交往，否则你们全家永无宁日	未
不要以为它们跳下200米高的悬崖，就高枕无忧	未
不要以为艾滋病能治就放纵自己啊，同志们。	未
不要低估美国，也不要高估美国。	未
不要侮辱药的专业价值。//@风的节奏吹: 红毛是药，那个直销的是食品，不一样//@疫苗与科学:我已经在中国医疗自媒体联盟群里提议盟友一起来转发这篇文章，不要让丁香园独自承担压力，不要让鸿茅药酒事件重演。 查看图片	未
不要做个冷漠的人！伸出你的双手	未
不要做廉价的自己，不要随意去付出	未
不要做廉价的自己，不要随意去付出，不要一厢情愿去迎合别人，圈子不同，不必强融！	未
不要停下来	未
不要催了，已经很玩命了，本来想昨天晚上回，浙江地区最近大雾封路，没有办法啊。理解下，再快就要飞了。	未
不要充电玩手机，电视台都曝光多少次了！	未
不要再买了，家里有的都看看！	未
不要再乱停乱放了！	未
不要再乱喝茶了！这种茶的真实制作过程曝光，竟然是这样	未
不要再任性啦！台州市区启用电动车交通违法抓拍功能，一旦抓拍，除了罚款	未
不要再保护这群未成年魔鬼了	未
不要再保护这群未成年魔鬼了  不要再保护这群未成年魔鬼了	未
不要再吃垃圾食品了！这款能插电的保鲜饭盒，改变了千万人的午餐	未
不要再小米是杂货铺了，现在大家都是杂货铺了。我原来说过一句话，能够被模仿的商业形式，都不是护城河。我也很期盼看到荣耀在智能家居方面和精品电商平台上有什么样的作为。市场这样才有趣。荣耀亲选和小米有品，名字就像是一副对联。 在有品上小米除了自己的生态链产品，就是一些在价值观上和小米很像的品牌。雷军其实很会讲故事，所以我们看到有品上的很多品牌，其实也很会讲故事，至少一个让你产生情感的故事品牌，会比一些平台上冷冰冰的贴牌温暖的多。商业模式这种东西很难界定是否抄袭的。安利是传销，权健就不是传销吗有的时候东西不在	未
不要再有战争	未
不要再纠结这个图这个工作人员了行不行，服了真的，工作人员是谁重要还是门票免费正确抵制黄牛重要哪个更有正面影响哪个看上去更明事理	未
不要再给我推送@普外科曾医生 的微博了。我想多活两年	未
不要劝别人了 有时间劝劝自己	未
不要去考验，考验的结果就是你最不想看到的	未
不要去骗一个对你好的人	未
不要去骗人，因为你能骗到的，都是相信你的人。	未
不要否认！你肯定是个假广州人！我就唔信你可以全部读岩！	未
不要命了！8男1女在太原滨河快速路上滑旱冰	未
不要命了！大雾中，一辆白色私家车竟然敢在金港大道上疾驰	未
不要命了！潍坊一大爷抢夺公交方向盘，监控还原当时情况	未
不要命啦? 外卖小哥常聚集隐蔽空地 竟是大连一处黑加气点儿！	未
不要命！情侣吵架，女友突然下车躺在高速路中间15日，浙江舟山，两情侣驾车上高速闹别扭，女子突然推开驾驶座的门，怒气冲冲猛拉后车门，见拉不开后直接横躺在了高速公路上，占据了两个车道，随后她又起身隔着车窗和男子继续争执交警决定处罚200元扣6分 网页链接	未
不要命！货车自燃，旁边是加油站和危化品车辆，他们还在拍视频	未
不要命！这些人居然在湟水河中	未
不要和我说东南西北，要说前后左右。。请给路痴一点关爱	未
不要和走投无路的人一起在悬崖边跳舞不是同归于尽就是自取其辱	未
不要和这种人在一起，他们会把你害死！	未
.不要因为一个人的伤感，而去伤害更多得人。也许你不在意，也许你只是不小心，也许你只是有一点点的寒冷，但是，感情不是赌注也不是一种可以移植的产品，不要那么轻易的接受一段感情。爱情带给我们的幸福首先是心灵的幸福，只要有一颗能感受幸福的心就能创造幸福。	未
不要因为一点破事就发朋友圈！	未
不要因为不好意思，就让那些跟你生活没多大关系的人影响着你的心情，该让他们滚的时候就让他们滚。	未
不要因为今天的一点点不顺心，就随便把今天输掉。卢思浩	未
不要因为想忘记一个人而去旅行也不要因为想遇见一个人而去旅行。	未
不要在以下两件事儿上浪费时间。 李程远	未
不要在冬天砍树	未
不要在垃圾堆里交朋友。	未
不要在意这些细节	未
不要在手机里存这几张照片！	未
不要坐等救护车！学会这些，当意外发生我们就可以救身边的人！	未
不要大声责骂年轻人，他们会立刻辞职，你还是那个年轻人吗	未
不要太把自己当回事儿	未
不要害怕黑暗，因为一定有人在默默守护你	未
《不要对自己做的20件事》	未
不要对自己最亲的人设置消息免打扰，这和现实里的冷战类似，如果有什么不痛快不如通过沟通交流来消除。陈志林说，大家可以屏蔽广告骚扰但是别用它来隔绝亲近的人心。	未
不要希望会对人类谢顶有用，完全不是一个机制猴子又不熬夜加班还房贷。	未
不要带污染的GDP成发展指挥棒	未
“不要带污染的GDP”成江苏发展指挥棒	未
不要忽略关键的前提，那女孩当时喝醉了，基本丧失行动力，意识也有些模糊！	未
