不止旅行V影响力峰会重访法国 20:欧洲航空城-图卢兹我说要去图卢兹，你一脸懵逼，我说图卢兹是法国空客所在地，你终于眼睛一亮哦了一声。因为跟东航去空客接A350-900宽体客机，行走40国 终于去了法国的第四大城市-图卢兹。法国的前三大城市巴黎里昂马赛，以及尼斯戛纳阿尼维翁等著名城市8年前在欧洲自驾游时都去了。而图卢兹(Toulouse)这个法国西南部比利牛斯大区上加龙省的省会。印象中离西班牙很近，甚至我在想能不能抽空去一下夹在法国和西班牙之间的国中国-安道尔。结果因时间匆忙，这	未
不止旅行一生要去的九个地方，你都去过几个啦	未
不止旅行 再回相府第三场景：讲述陈廷敬夫人封诰命时，回忆自己从进入陈家与陈廷敬相守一生的事，不仅融入了古代结婚礼制，让游客了解传统婚礼，通过旁白的方式，展现陈廷敬夫人贤良淑德的品格探秘最山西	未
不止旅行 冬季的高原多是冰雪路，虽然318大部分都已修成了柏油路，但因很多路段经过山区，遇到泥石流或道路塌方的机率还是比较高的弯道上往往会有暗冰，除了加装防滑链外，更要减速通过，一定不要急刹车。V影响力峰会西藏旅行	未
不止旅行 周末和闺蜜来的乌镇西栅采风，不巧下起小雨。不过几个人在西栅里雨中漫步，看到雨中的西栅又是另一番的美，走走停停，很舒服不管站在哪一座桥边，都可以看到的另一座桥，故有桥里桥之称，桥里桥是乌镇最美的古桥风景，堪称桥景一绝。 一路手工作坊经典展馆民俗风情休闲场所让人流连忘返，自然风光美不胜收V影响力峰会	未
不止旅行 唐徕渠（唐渠）之名最早见于西夏，明史亦记载：唐徕渠亦汉故渠而复浚于唐者。V影响力峰会 1960年，青铜峡水利枢纽实现截流引水，之后历经裁弯取直除险加固，现干渠全长314公里，承担120万亩农田灌溉和20万亩湖泊湿地的补水。宁夏旅行 @微博旅游	未
不止旅行  巴黎上周末游行，现在继续进行中，刚离开图卢兹，第二天就开始游行示威，商店都被砸了，昨天法国人连工农红军的旗帜都摇起来了，还是天朝安逸吖	未
不止旅行巴黎上周末游行，现在继续进行中，刚离开图卢兹，第二天就开始游行示威，商店都被砸了，昨天法国百姓连工农红军的旗帜都摇起来了，还是天朝安逸吖。。 法国旅行 900光影世界	未
不止旅行布宜诺斯艾利斯的闹市区有一个叫做雅典人书店的地方，门脸不大，但走进去会让你完全惊呆！这家书店的前身是一个歌剧院，在建筑结构上还保留了穹顶舞台包厢等等，在这里看看书喝喝咖啡也是一个不错的旅行行程喔！阿根廷旅行 via@小墨MO	未
不止旅行 忘记那些昨日的灰暗，迎接五彩斑斓的未知。墨尔本街头的彩色世界，祝你夜晚有一个彩色的梦。Via@鱼鱼众生liluo 365个旅行故事	未
不止旅行 我长这么大，第一次见识零下40雪地里的日出。呼一口气瞬间结冰坐雪地摩托冲到山顶之后，头发！睫毛！刘海！全都结冰了！我再一扭头，AJ戴着头盔。结果脸颊苹果肌那块直接冻白！吓得摩托大哥赶紧让他用雪搓脸，搓到发热为止（现在AJ的脸已经冻的结痂起皮了）但是！！！这真的是我俩看到的超美的日出，整个白色的禾木村笼罩暖暖的阳光下，后面是森林的渐变色故事里的童话世界就是酱紫吧365个旅行故事冬游新疆治愈爱情渐冻人 去哪儿聪明旅行家木鱼趣世界	未
不止旅行 有时候选择一条难行的路，只是为了借道之后，看到不一样的风景至于跋涉的艰辛，全化作了对理想之境的笃信via@娄倬瑜Doris 斯里兰卡  在暴雨中寻找前行的答案	未
不止旅行 法属法亚那，如果你听说过，对，那个法国发射卫星的地方，在南美洲。咪游记走遍150国 是一个多民族，文化的大熔炉，克里奥人（混血）的人口比例则相当高，首府卡宴（对，那个豪车）到处都有传统克里奥建筑，隐隐有些美国新奥尔良风情，但又不太一样，融入了西班牙和荷兰的元素。你想在斑斓的街道上走走吗V影响力峰会	未
不止旅行 知道么我还在过夏天	未
不止旅行 说到山西，你第一个想到的是什么是煤是土豪是醋，是面条是污染是柴静还是关羽武则天我对山西的最初印象来源于郭兰英那首人说山西好风光，左手一指太行山，右手一指是吕梁而这一次，请跟随我，访古祠逛大院看古城游皇城相府探秘最山西   ...全文	未
不止旅行谈及西班牙，你的第一印象是什么是圣家堂大教堂，还是米拉之家其实不论去到哪里，记录我们旅行的方式不仅仅是照片一种，有时候换一种方式记录你的脚步，当你回忆起来也会有另一种体验西班牙旅行 via@弱冠年华	未
不止旅行 踏进银杏树的密林中，仿若要去往秋深不知处目光可及处一片的金黄连绵一条路蜿蜒到山脚下，这里就是腾冲银杏村via@吴秋煌 云南腾冲银杏村，扫黄，错过了今年金秋，又要等一年	未
不止旅行香格里拉 最接近天堂的地方	未
不止旅行 马蹄湾（Horseshoe Bend）是科罗拉多河在亚利桑那州境内的一截U形的河道，也是格兰峡谷其中的一小段，由于河湾环绕的巨岩形似马蹄，所以叫作了马蹄湾，坐在悬崖边拍照会有一种往里吸的感觉羚羊峡谷在地形上分为两个独立的部分，称为上羚羊峡谷与下羚羊峡谷，是柔软的砂岩经过百万年的 ...全文	未
不止旅行 马蹄湾（Horseshoe Bend）是科罗拉多河在亚利桑那州境内的一截U形的河道，也是格兰峡谷其中的一小段，由于河湾环绕的巨岩形似马蹄，所以叫作了马蹄湾，坐在悬崖边拍照会有一种往里吸的感觉。羚羊峡谷在地形上分为两个独立的部分，称为上羚羊峡谷与下羚羊峡谷，是柔软的砂岩经过百万年的各种侵蚀而形成的。新年旅行 V影响力峰会 Via@刘闻雯	未
不止是华为，景区宣布对所有国产手机用户半价	未
不止是华为，景区宣布对所有国产手机用户半价在河南神农山景区河北崆山白云洞旅游区广东清远古龙峡景区相继对使用华为的游客给出免票或门票优惠的政策之后，江西婺源景区也给出了类似的优惠政策。不过，与前几个景区不同，江西婺源景区给出的优惠不仅针对华为等少数手机品牌，而是宣布：使用国产手机的游客都可享景区通票半价优惠。按景区门票市场挂牌价210元/人次的5折优惠即105元/人次。（澎湃）网页链接	未
不止是华为，江西婺源宣布所有用国产手机的游客通票半价	未
不止这些，全都得举报，加急//@星星吹跑了:见举加急	未
不止雪乡长白山，东北这10个小众玩雪地，纯白素净人少雪厚，有些你也许没听过！	未
不正义必须被曝光，否则它将继续作恶	未
不死不休？高通狂削苹果在华再出狠招	未
不气不气我不气艺兴住在我心里骂人首先想一想艺兴同意不同意	未
“不法之徒”，可能比我们想象的更有秩序	未
不法分子冒用《唐探3》融资 万达影业发声明澄清	未
不法商家盗用钩尖江湖视频卖假货！大家别上当！	未
不浪费光阴！周琦休斯敦独自一人刻苦训练昨天周琦被裁的消息对于中国球迷而言无疑是晴天霹雳，很多球迷都对此感到特别遗憾。是继续留在美国寻找机会，还是回归CBA周琦暂时还没有给出明确的答案。不过，可以知道的是他并没有浪费光阴。在今天曝光一段视频中，周琦出现在休斯敦当地的一家健身房内 ...全文	未
不消毒牙刷如何进了五星级酒店？	未
不消毒的牙刷，怎么就能堂而皇之地进入五星级酒店	未
不消毒的牙刷，怎么就能堂而皇之进五星级酒店？	未
不消毒的牙刷，怎么就能堂而皇之进五星级酒店 继花总曝出多家五星级酒店一块毛巾擦所有之后，最近，微博网友管鑫Sam又曝光部分五星级酒店牙具不消毒 ，洗发水沐浴露等日化用品也是廉价勾兑而成，一瓶成本不到一元钱，所谓的品牌都是贴牌生产的。而在相关暗访视频中，疑似供应商人员称牙刷没有消毒这个工序，整个行业都没有要求。 不消毒的牙刷，怎么就能堂而皇之进五星级酒店	未
不涉伦理道德问题 美国开启基因编辑人体临床试验	未
不满从叙撤军 美分管打击“伊斯兰国”官员辞职	未
不满意就打！这群恐怖的父母，正在酝酿一场危险...	未
不满意就退费始作俑者赣州回应，有人说：不妨多些探讨和试点	未
不满足于当球员了伊布晒出惊世P图，把自己PS成了瑞典国王。ZlatanSwedenZweden	未
不炒虾了？黄晓明扮浴袍歌手嗨舞遭李易峰调侃	未
不点会后悔的全身图[给你小心心][给你小心心] 查看图片 查看图片 查看图片 查看图片	未
不烧重油了！！这家航运公司改用死鱼生产燃料！！	未
不然可能就没有后来的岛津制作所欧姆龙村田制作所。	未
不然呢 你们以为我多大岁数	未
不然就沙雕了//@扶南:可是这些对于二十来岁的人来说已经很辛苦了，虽然以后会更辛苦。//@段子楼:来吧//@这是一个很高冷的ID://@歌且行风长吟:欢迎来到成人世界//@千王后:多苦都得出来 苦就苦吧	未
不爱读书中途退学的闺蜜，当了服务员	未
不狂不放不申花，25年他们这样走来……	未
不玩游戏的女孩我不考虑	未
不玩"鸡缸杯"，改玩金融股权！刘益谦10天3场大动作	未
不环保，噪音大，没有飞机快 右边兄弟帮我刷张二等座的票谢谢//@sunwear:这条怎么才能喷中国在线等挺急的。西部人民在吃草已经不行了，上次说完一堆西部人民配烤全羊照片骂我。	未
不理前女友同性绯闻 布鲁克林牵手模特新欢热恋中	未
不理解也要执行  马蒂斯签署从叙利亚撤军的命令美国媒体23日报道，即将离职的美国国防部长马蒂斯已经签署了美国从叙利亚撤军的执行令，撤军行动数周内有望开始。本月19日，美国总统特朗普宣布从叙利亚撤军。马蒂斯因不满撤军决定，宣布辞职。（记者朱东阳 刘晨）	未
不甘心不服气是社会前进的动力，但是，过了35岁，就要认命，要甘要服，这是社会安定的基础。让下一代去不甘心不死心，前赴后继，总有机会出头天。	未
不甘落后 英国在2021年推广自动驾驶公交车和出租车	未
不用交个税！单位发的这15种补贴可免个税！	未
不用交个税！单位发的这15种补贴可免个税！ 薪问薪答	未
不用再排队到腿软办落地签了泰国推出电子落地签证！	未
不用再排队！ 城乡居民可用微信缴医保啦	未
不用再花冤枉钱啦	未
不用再被自己的身份证照丑哭，不满意可重拍3次！	未
不用再跑路，5天变1天！西安市居民境外驾照转国内驾照 可在车管所查询出入境记录	未
不用出南宁就可以吃到越南火锅，了解一下吗	未
不用去验血，一查就知道自己缺什么，请收好 ！	未
不用吃，放到枕边闻一闻，降血压，防感冒，防中风，夜夜睡的香	未
不用基因编辑，孩子的人生属于自己	未
不用基因编辑，艾滋病人能生育健康的孩子吗	未
不用多久！超级高铁要来了！广西到北京不用1个钟！	未
不用帮我打马赛克//@核仁布朗尼:活明白了。	未
不用心慌慌了！乐清老城这座危房被拆除，看看是你常走的路吗	未
不用怀疑了，这就是现在的你！	未
不用怕，不要愁，十年后，所有的事，都只是下酒菜。	未
不用急，钱还会回来的	未
不用感谢我，请叫我红领巾朋友，你的车被苏AGL凯美瑞怼了，他跑了，希望可以帮到你我叫红领巾民警根据现场留下一张印有虫儿飞乐谱字样的纸条，成功找到肇事车主原来，当天，一辆凯美瑞轿车车主李先生倒车时碰擦了大众轿车车主王先生左后侧车门，李先生当时心想：我倒车这么慢， ...全文	未
不用手机不用电脑，他们在大兴安岭森林深处放鹿喝酒发呆......	未
不用手脚我能中国品牌到底有多牛两天后和我一起围观吧！	未
不用打热线，这两个事家庭卫士都能办！	未
不用担心，基石投资者一直很稳定，危中有机，凶中有吉，大盖得长红。	未
不用担心拖欠工资了！武汉将推行建筑工人实名制	未
不用担心身份证过期啦 公安部：换证新增提醒服务	未
不用挤的牙膏每年帮助2000 多万人告别黄牙黑牙来自意大利	未
不用换卡，天津人可以在网上携号转网啦12月1日正式实施...	未
不用排队了，房县城区多家超市装上了这种设备	未
不用摇号排队！想约二价四价HPV疫苗龙华52家门诊等你挑	未
不用智能手机！普京经由互联网等渠道获取信息	未
不用暖气要交取暖费，合同里有没有住户物业费没交不给水不给电，即使是强拆现在也不允许！//@小星星ssssss:这他妈是供水供电供热合同，民事法律关系，你住着物业的房子，就算你不用电不用水不用暖气，该交的物业费也还得交，不然就是违约，业务不去起诉就算好的了，还敲诈勒索，多读点书去吧大傻子	未
不用电脑参加编程一小时用计算思维理解编程本质	未
不用登机牌28日起，温州机场凭二维码就可上飞机了！	未
不用看易经，明年jingji会很差。大家年底别乱花钱了，存一点吧	未
不用睡了今夜	未
不用等什么双十二，咱家商店现在就带你5折囤好物	未
不用绕路了，商丘市区六条重要道路同时通车！快来看都是哪些	未
不用跑一趟！潼南医保可以微信缴费了	未
不用预约！东莞九价HPV疫苗已开打，部分镇区有存量...	未
不用飞纽约，这家新酒吧将唐人街搬到上海！	未
不由得让我想起老王@科幻作家-王晋康的力作《义犬》//@一个有点理想的记者:这绝无可能，如果顺利话，这两个孩子也将上学工作结婚，生下他们的孩子。孩子的个人信息是绝对保密的，没人知道他们是谁，除了贺健奎团队的核心。//@司机007:不人道点，可以直接处理这俩小孩吗	未
不由自主地开黄腔	未
不畏严寒 带电接火12月6日，气温骤降，@国网蒙阴县供电公司 的工作人员冒严寒完成了10千伏东门线和镇直线的环网改造工程，带电作业安装联络开关一台，并进行联调，实现了野店镇城区的双电源供电，提高了电网的持续供电能力。	未
不畏严寒连夜奋战速改迁 电力尖兵攻坚克难助畅通严冬深夜，凛冽的寒风嗖嗖作响。当人们在暖气房里进入甜甜的梦乡时，国网西安供电公司10多名电力工人却在18日凌晨零点来到凤城三路的断头路段，改电缆挪电杆电力工人们有条不紊如火如荼开展工作。他们像一团团火焰，用实际行动温暖 ...全文	未
不畏严寒连夜奋战速改迁 电力尖兵攻坚克难助畅通严冬深夜，凛冽的寒风嗖嗖作响。当人们在暖气房里进入甜甜的梦乡时，国网西安供电公司10多名电力工人却在18日凌晨零点来到凤城三路的断头路段，改电缆挪电杆电力工人们有条不紊如火如荼开展工作。他们像一团团火焰，用实际行动温暖着城市，为早日打通断头路散发着自己的光和热。临近年底，西安市2018年打通断头路工作已进入白热化阶段，各级政府以及市政相关部门在全市擂台赛中你追我赶争分夺秒地推进此项工作。国网西安供电公司当仁不让，抓紧时间加快	未
不畏冬日严寒 加快农网改造12月13日，@国网黄岛区供电公司 施工人员在六汪镇柏乡二村，冒着寒风为该村新增一台200千伏安变压器。正值迎峰度冬用电高峰，该公司加快农村电网改造升级工程进度，努力提升电网供电质量，确保群众冬季生产生活用上可靠电放心电。	未
不畏寒冬！方隅再现公寓新样本	未
不畏寒冷 加快送出线路施工12月10日，在城南龙崮变电站35千伏送出7号8号铁塔组装吊立施工现场，@国网东平县供电公司 施工人员全力以赴加快工程建设，该线路送出二路，线路全长4.395千米，线路投运后，将为铁矿和化工企业提供充足电力保障。	未
不留作业、放学不超20时30分…黑龙江要这样规范民办教育机构	未
不痛不癢的处理，本质上是纵容不法科商以身試法，高科技之路只能越走越窄。	未
不痛难思来时路，痛定方可了前因！	未
不直接参与抓捕，用科技手段发现线索锁定真凶，且看神探是如何练成的	未
不相信。	未
不相信t某可以冲上来的可以滚远一点	未
不相信大仙今晚还能卑微的给我滚远点！！！	未
不相信鸡行的 可以关注我（正经点 如果因为手欠惹上麻烦别怪咱不管你 说过多少遍了 为什么就不能换个小号）//@草鲵鸡:em关注我不也艺样么//@勇哥的光芒V:说了别人的黑号不要去关注不要去互动，要是惹出事自己解决哈	未
不看不知道，原来甘肃有这么多名人	未
不看不知道！安康竟有这么多国家级水利风景区，你都去过吗	未
不看//@主治医湿:不了吧//@你爸爸的小龙狗:认真的	未
不看亏大！明年起，广西这108个景区统统免费，玉林	未
不看亏大！明年起，广西这108个景区统统免费，钦州免费的有	未
不看报道 小图还以为是玫瑰..//@渣油路:动保全是能控制动物思维的德鲁伊//@用户6879668458:活的//@是茕生://@満艦飾光頭_:草 评论欢乐//@废土守望者:还好是涡桨//@夏目蝉石 :评论活的	未
不看面单拎着就走，杭州50岁大叔一天偷三件快递自称为减压	未
不眠不休36小时，信丰警方终于找到她！	未
不着急牵手 牵手就不要放手	未
不瞒你们说，写着写着我又想去长沙辽	未
不瞒你说，当年舍不得睡觉就是怕错过老师的骚口音哈哈哈哈哈哈	未
不瞒你说，我奶奶天天看这些玩意儿。	未
不瞒你说，每一个我都能直接睡着	未
不瞒大家说，这是我第一年的时候，收到的卢本伟给的生日礼物	未
不瞒您说，塌了 网页链接	未
不知20年捐款千万的“顺其自然”是谁，那就顺其自然吧	未
不知20年捐款千万的顺其自然是谁，那就顺其自然吧丨新京报快评	未
不知20年捐款千万的顺其自然是谁，那就顺其自然吧近日，一位20年来捐款超千万的隐形好人顺其自然，引起公众的关注。28日中午，宁波市慈善总会副秘书长陈海英在电话中激动地告诉记者：又收到顺其自然捐款了，捐款金额为49万元！如果加上5天前的50万捐款，今年其捐款99万元，是捐款总额最多的一年。 不知20年捐款千万的顺其自然是谁，那就顺其自然吧	未
不知A股会否有波独立行情	未
不知不觉，2018只剩下20天了，奶奶个熊，挣钱如捉鬼，花钱如流水，一分钱没攒下，一天还瞎蹦哒，计划今年存10万，结果还差99900！ 就这一张抱紧点，撒手就没啊	未
不知不觉中，又快过年了，挣钱如捉鬼，花钱如流水一分钱没攒下，一天还瞎蹦达。起的比鸡早，吃的比猪差，干的比牛多，睡的比狗晚，人累，心更累！	未
不知不觉，从 本月9号 启用的沃达丰 Travel SIM 的 10GB 流量套餐，只身下 448MB 了 James Cook H...	未
不知不觉又300w粉了，评论揪100个宝宝送zfb红包，冲鸭！	未
不知不觉又一年要过去了，好像做过很多又好像没有做过什么。唯一确定的是，在物是人非的风景里，只想抱着你。你有遇到那个他吗这个圣诞好像喜欢你@潘紫妍Feanay	未
不知不觉这批股票已反弹超30%，这些行业竟隐藏反转型股票？	未
不知不觉都走到这了，回家咯 查看图片	未
不知为什么我总怕轮胎漏气，所以我现在开车前先绕一圈看看四个车胎。其实还应该看看前后牌，我总是忽略看后牌。	未
不知为什么，看得好爽... 标致车主如果众筹陪付款，我愿意出1000 另外我愿意再出1000教训那个乱停车的	未
不知为啥发了两次。这是一篇关于妇女的故事。	未
不知二位有无就 @平安内蒙古 下属的 @青城公安 @凉城县公安局 跨省抓人的亲身体验进行交流若交流了可跟我等分享一下	未
不知悔改！惯盗抱团作案 重蹈覆辙！见一回抓一回	未
不知所云，狡猾狡猾滴，，，，我免费围观了 @孔庆东 的回答，问题价值 433.00 元，快来一起免费围观 微博问答	未
不知放弃的植物	未
不知此山唤何名今日始唤牛肉山。贼说贼话	未
不知死活上梁哥公司闹事，梁哥分分钟让你爬出去	未
不知死活在梁哥面前找茬，在太岁头上动土被收拾	未
不知爹富王思聪 16岁才知道家里有钱，跑去找父亲求证，父亲回答这都被你发现了也不知道 我爸妈还要瞒我多久 ，一直在等他们的电话	未
不知爹富王思聪 不知妻美刘强东悔创阿里杰克马一无所有王健林普通家庭马化腾北大还行撒贝宁清华录取毁一生	未
不知爹富王思聪不知妻美刘强东普通家庭马化腾悔创阿里杰克马一无所有王健林。我爸妈还要瞒我多久	未
不知爹富王思聪 滑铲杀手范迪克 利物浦 欧冠	未
不知男主人已经去世，金毛还每天去公园老地方寻找	未
不知该哭还是该笑//@战争史研究WHS: 羞羞的地方瘙痒，初步诊断：小妹妹炎	未
不知道为了过去的蠢事错过了多少次重新开始，但下一次我依然一往无前的钻进了错误的河流。	未
不知道为什么，开个摩托这么颠	未
不知道为什么弟弟总要刁着那根萝卜走来走去 微博视频 家有儿女过场插曲	未
不知道为什么，心里总是沉甸甸的，总是压不过气来，感觉好累，真的好累。	未
不知道为什么，总觉得一边站着尿尿一边玩手机很变态	未
不知道为什么我的客户都这个鬼样子的：	未
不知道为啥，刚转发的这条，不让评	未
不知道为神马，我默默唱起了哈利路亚！哈利路亚！哈利路亚！哈利路亚......//@深圳天气: 天漏了，快帮我联系一下女娲阿姨，顺便问一下这里是龙岗坂田附近吗	未
不知道什么原因上一条微博老是显示此微博已被删除无法发布评论重新发布试试看！明天上午十点见，L见萍 论！	未
不知道什么时候才能等到资源让我截奥姆咪	未
不知道今天是个什么日子，下着雨，但全是人。。。下午两点恒隆都没几家不用排队能吃饭的餐厅，刚刚打车1km的距离司机来接我楞是因为堵车等了半个小时才上车世界怎么了	未
不知道从什么时候开始，六小龄童的口碑形象开始反噬了。除了之前被网友扒出他每年在教师节记者节医生节等节日发同样的文案和图片之外，连quot国际志愿者quot这种公益的日子，也要拿出来作秀，做了一年的公益，然后同样的文字图片吹嘘了5年。虽然他在表演上奉献了难以磨灭的经典，但这波操作，也很令人反感了。	未
不知道从什么时候开始，在什么东西上面都有个日期，秋刀鱼会过期，肉罐头会过期，连保鲜纸都会过期，我开始怀疑，在这个世界上，还有什么东西是不会过期的王家卫重庆森林	未
不知道会不会有抑郁的人儿看这篇漫画呢	未
不知道你今天怎么上班，总之我是坐公交了	未
不知道你们在介意什么 宣不宣传的都是人情往来 你们可以稍微打听一下同事出歌的时候kiki是怎么求爷爷告奶妈都求到合约期结束的品牌方那里麻烦帮忙用官皮宣传的 可是贝贝没有人帮他这样做人情 他自己也不是那种很会世故的人 或者说他本身也并不是很在意这些人情世故 而且这是人情 但凡是人情就是有往有来 你得还的	未
不知道你们有没有过这种情况	未
不知道双十二的会不会大点打开支付宝首页搜7953492领红包 领完刚好可以剁手	未
不知道发什么的看这里喽	未
.。  。  。 . 。：..不知道吃啥找胖哥   。.。  。.： 。    。.   。 .   . 。.	未
不知道哪个是哪个但是 1 和 3 好点。	未
不知道啥时候开始流行吹像素低，很多都是远景的所谓生图我一直不理解 为啥这些生图才是颜值的标准虽然鹿老师的生图也很好看但是难道不是大炮拍的高清无修大图才是检验标准吗	未
