不按常理出牌的王先生这热搜要怎么发	未
不按规定使用远光灯...要不再来坐一波小板凳?	未
不按规定停车罚款500元，驾车时有其他妨碍安全驾驶行为，罚款300元记2分！//@深圳交警: 司机称：孩子着急上厕所，找了一段路都没有找到地方，孩子又一直哭闹，情急之下，将车停在路边！//@深圳交警: 对于家长和孩子来说，这样的行为是否很危险 查看图片//@深圳交警: 这个该罚吗	未
不换号码就能更换运营商已有城市开始试点携号转网	未
不换头像不敢行天下	未
“不换床单”五星酒店测评机构：原希望能找出一家挑不出毛病	未
不换手机号，也能更换运营商！携号转网发个短信就能搞定！	未
不换//@硬嫂-Anita:model3换这个	未
不换箱走7天 重庆货物可坐车直达新加坡	未
不排除。//@西铭的夏天:他们要是跑到印度那个无政府管理的小岛或者哪个角落偷偷改造人类可怎么办呢还不是一样会出来变种人嘛	未
不提了//@黄磊子:哈哈哈哈哈//@江南大野花:气得我瑟瑟发抖//@草莓思慕雪无糖很冰://@独了个舞:是了//@沁竹沐轩:过于真实	未
不提倡，钱放媳妇那里把握些	未
不提到地名简单几个字描述一下你是哪儿的人.	未
不搞一刀切！江苏省第一批停限产豁免企业名单出炉	未
//@不搞许凯不可能:转发微博	未
不撅起屁屁，都不知道你能跳这么高	未
不撞不撞	未
不撞南墙不回头	未
不撞南墙不回头不存在的	未
//@不撸白不撸酱://@伊谢尔伦的风://@绮蝶夕://@小药_文力开发中:转发微博	未
不收女徒弟	未
不收男票钱就是爱慕虚荣 .	未
不放弃任何机会，抓住任何题材都要造司马南的谣，先生真是我的知己呀，嫌我的知名度太低，你先把自己弄成脊梁，这样谣言的效力才会更大。//@黄山友人:@司马南 你在美帝卧底辛苦了，远离祖国不感觉孤寂吗回来吧，投入到祖国母亲的怀抱，参加建设伟大祖国的伟业中！	未
不放弃！安倍启程赴阿根廷 要与普京再谈领土问题	未
不敢买中长期理财产品 银行理财转让功能了解一下？	未
不敢去美国了。。	未
不敢叫航母日本给改造后的出云号取了一个奇葩名字	未
不敢吃。//@菜畦的小家：叔，您吃了那虫子了吗	未
不敢想。//@学经济家:转发微博	未
不敢想象：13岁男孩独自去山西见美女网友 ，幸亏锦州乘警......	未
不敢想象，40年前的武汉，竟然是这个样子的......	未
不敢想象一个月之后脖子会是什么样 转	未
不敢想象公共澡堂会怎样//@不愿透露姓名的隋艺先生://@王志安:在国内住酒店，牙膏牙刷洗发沐浴露全都需要自备，不管是几星级的酒店。明白了吧！	未
不敢想象我的领导接到是什么表情	未
不敢死，不敢穷，不敢远嫁，因为父母只有我 你赞同远嫁吗	未
不敢用	未
不敢相信。	未
不敢相信！大海居然被浓缩在这么小的东西里	未
不敢相信！央视突然宣布！传说中的超级高铁就要来了	未
不敢相信！恩施这个地方曾经有个小香港	未
不敢相信，明天旺苍金溪这个地方人山人海 ... ...	未
不敢相信！武当山机场12月的票价竟然成这样了！	未
不敢相信自己的眼！雪乡明码标价标间880元 万象又到了去看雪的季节，整改后的雪乡却再次让网友惊呆：标准间 880元/天，节假日还上浮15，有的甚至都没有独卫。 不敢相信自己的眼！雪乡明码标价标间880元	未
不敢相信！超级高铁要来了！未来泉州到北京只要30分钟	未
不敢看朋友圈，哭声一片，因为税。	未
不敢看第二次的电影，太难受了//@影视大魔王: 最可怕的是，这是真实事件改编的	未
不敢碰一切物体的「静电季」又来了！3招让你的冬天不再“炸毛”	未
不敢碰一切物體的「靜電季」又來了！3招讓你的冬天不再炸毛	未
不敢碰不敢碰 微博视频	未
不敢脑补	未
不敢跟家人联系，父亲哪一年去世的都不知道...辗转逃亡13年，这个红通逃犯如何落网	未
不敢远离海岸线，就别想发现新大陆安德烈纪德	未
不数不知道，原来从广州搭地铁将直达大湾区这么多城市！	未
不文明养犬引云浮人热议，话题讨论等你来上墙！	未
不文明养犬让宠物背恶名 治理既靠规范也靠自觉	未
不文明曝光继续！看看有没有你认识的人上榜（第65期）	未
不文明现象曝光  脏乱差依然存在  需各方积极整改	未
不文明现象曝光  随地大小便要不得	未
不文明行为曝光台屡禁不绝的小广告	未
不文明行为曝光台请将车停好！	未
不文明行为曝光台请抬头，是红灯！	未
不文明随手拍凤凰城小区不文明停车，妨碍通行给邻居添堵	未
不断严惩，不断宣传，方能止住！	未
不断情执难生西方（广钦老和尚）	未
不断补货！本周的冷空气有点虐	未
不旅行难受鸭敢想敢玩下午三点，趁着阳光正好，抛开懈怠与疲惫，给自己的大脑放个假！年轻的态度就要敢想更敢玩，抓住今年的尾巴逃离高楼大厦，去森林里寻找梦境。玩得畅快才能活得精彩，show出你的非去不可，和@东风雪铁龙CITROEN一起交换时刻感受旅行的意义！网页链接	未
不旅行难受鸭敢想敢玩 夜色如水的晚上满街华灯，一个人正漫无目的的到处逛。没想到还有一个地方会这样吸引我如此向往。让我不由得想与@里里Aaron 交换时刻。酒吧门口，昏黄又温暖的一盏街灯。门外是落寞，门内有喧嚣，而我手握酒杯游离在中央。你在哪你想去哪在这里网页链接都能找到你想去的地方。	未
不旅行难受鸭敢想敢玩有没有什么事情，你一直想做却始终没有行动与其每天在立下的flag中自我安慰，不如跟随云逸来一场交换挑战，换一种方式体验生活，享受美好的时光戳网页链接进入交换时刻， SHOW出你的Fancy Moment，更有机会赢得超级旅行大奖！	未
不旅行难受鸭 敢想敢玩此时此刻，我刚对完了一段超超超伤感的台词，我想要与 @外太空有你cen交换此刻，去平潭海滩听海浪涛，与那片海来一次灵魂与大自然的对话。右侧传送门，戳 网页链接 进入交换时刻！	未
不旅行难受鸭 敢想敢玩此时此刻我刚推门离开我常去的小店，回味着身边咖啡的气息，恰好看到一辆雪铁龙驶过，好巴黎的感觉。如果能与 @东风雪铁龙CITROEN交换时刻，前往秘密海滩，在沙滩篝火旁看漫天烟花，就好了。戳 网页链接 即刻进入交换通道！	未
不旅行难受鸭敢想敢玩饥肠辘辘的到处觅食中，一个不经意却让我看到了你的火锅。我想与@里里Aaron 交换时刻。这一口沸腾着煽动味蕾的火锅分我一半可好想吃想玩想体验更多专属你的时空隧道网页链接一点就停不下来。	未
不早不晚，三中家属院为啥供暖刚刚开始时要改造暖气	未
不早了，晚安，大家就别做选择题了。	未
不明白工作的意义，每一天都是白干！	未
不明白快手上为什么会有那么多未成年主播，大部分年龄都在10岁以下利欲熏心的企业，赚几岁孩子的血汗钱你们拿着安心吗坚决抵制快手！！	未
不明觉历  2018年12月5日	未
不易！张庆鹏半月板损伤，休息两天后参加训练，将带伤出战北控	未
不是AV中的情节日本流行DNA相亲 ：对的人闻起来香香的据了解，日本正流行一种DNA相亲。男男女女都戴着面具入座，各自不透露年龄职业年收入等，只提供双方DNA的相容性。如果双方配对的字卡数字出现70以上，就被认定为相容的。主办单位表示负责免疫力的HLA 基因是判断DNA相容性的基础。这个配对方式是基于一个T恤实验。研究人员要求男性穿上T恤，并将穿过充满体味的T恤交给其他女性，请她们依嗅觉来评断对这些T恤气味的偏好。结果显示，女性对不同我分享了 @中国青年报 的头条文章 万	未
不是iPhone，不是Mac，苹果的未来就靠它了！	未
不是一个级别的对手	未
不是一般人的文强他是毛泽东的表弟，黄埔四期学员，林彪的同班同学，第一次国内革命战争中，周恩来亲自介绍他加入中国共产党，参加过南昌起义，担任过中共四川省委常委兼军委书记红一师师长兼政委后来却进入军统，成为戴笠的得力助手淮海战役时，作为杜聿明的中将副参谋长，负责陈官庄空投事 ...全文	未
不是不想试浅色的，而是找不到，一层楼跑完也没看到几件 上海  八佰伴	未
不是不知道，而是不想说	未
不是不过确实也是老师。//@林淘气饲养员:这说的是冰鱼吧	未
不是东方，当时欧洲受工业革命影响，同样有将旧世界的一切扫入历史的尘埃的思想//@珠簾大寨主:并不只是中国，整个东方世界当时都弥漫着自我否定的风气//@洛梅笙:是的，直到今天依然是//@苏苓sonata:五四这套最可怕的是早已不再只是放在历史语境中讨论，而是影响了之后整个人文教育体系	未
不是亲生儿，胜似亲生儿！	未
不是什么事都是理所应当。	未
不是什么票都有机会在老湿微博露脸这是一些小白很不解的地方。毕竟，老湿微博是自己的，也是老湿粉丝的，不是每个人都有鉴别风险的能力。凡是玩的太脏的票，无论涨多少都不会在我这里露脸，就算我看到了，也不会去评论，不会去帮他们提高曝光度勾引新韭菜老湿不需要整天围着牛 ...全文	未
不是你不够好，只是没有遇对人	未
不是你离向往太远，而是你没这样走一遭，91.8美图秀想带你走一走	未
不是，你要是工作过程中你的治疗对象突然站起来了，就问你怕不怕吧//@网瘾少年何教授: 也基本没有医闹	未
不是你说了算	未
不是假币，新人民币来了，居然长这样	未
不是傻，树冠羞避只在少数树林有发现，还基本是热带森林。香樟是没有这种现象的。那些树为什么会像拼图一样谁也不挨谁，还没有定论。有人说树的嫩枝一旦被旁边树叶擦伤或遮阴，就会停止生长	未
不是冤家不聚头，性格不同的人该如何维护婚姻	未
不是冷静一下听我说这怎么还有带打投群的 查看图片	未
不是，准备弄个微信粉丝群，100个人左右就好了，一起玩玩游戏，吹吹牛逼，帮我偷下梗 有说法不	未
不是创业，是直接把本属于乡镇的企业据为己有。//@暖阳冰丞:这个曹德旺开起来傻乎乎的，其实他哥哥好像是什么省长吧不然他创业哪里来的资金	未
不是卖关子，没实锤的东西不能乱说//@Diablo_X:呵呵，牛逼了，怪不得当时媒体曝出车和家工厂实为力帆工厂的时候，车和家还坚持说是100自有工厂，原来是卖了个关子	未
不是口号！关键是行动！六安这些地方，该下猛药整治了！	未
不是， 可是，算了，哎（ 我的好小肉肉要长好了，已经在物色守夜游戏了，铁子们，放心， 建群的事情暂时不急)	未
不是同一个人，这个去派出所拍照的翠芬，不是马二，马二把业务转包了给他，鸡贼得很	未
不是吧！为什么要出家啊	未
不是呢光影征途//@moyano_:蓝莓	未
不是周五吗//@喜脉洗脉:以为过年了//@趴下继续笑:真的以为周五了。。。。	未
不是啊，运费问题，本来我团购的话快递费是6块的，但是很多妹子不是要放在卖家的大店好和双十二拍的一起包邮吗，所以卖家才放在大店的，卖家运费一直都是九块，不是因为团购要赚运费钱，我还没有喊妞妞改运费呢。	未
不是善不善良的问题1，我前面说了我不在的时候阿姨每天都去喂猫和帮我收门口的快递，不可能邻居看见阿姨了还觉得我家猫是不是死了2，最近我一直在买东西，快递不断，但是第二天都会被阿姨收到屋里，邻居通过这点也该知道家里是有人搭理的3，这个阿姨给我打扫了两年，如果邻居记得住我长啥样， ...全文	未
不是喜欢js你姑奶奶么js的黑今天暴毙，死于车祸，明年的今天就是你的祭日此条开光	未
不是因为男祥林嫂少，是因为女性总是喜欢跟女性抱怨，男性却选择跟男性喝酒找乐子然后跟红颜抱怨婚姻不幸福	未
不是天堂，是雨崩	未
不是广告最高99元！威县一大波人在偷偷领红包，还不知道的赶紧看	未
[不是广告]有奖找茬，还不快点来！	未
不是开玩笑，张家坝江湾城开始整治机动车乱停乱放！	未
不是很想说话	未
不是很懂雷军为何一直用小米mix2S，并不是用小米mix3	未
不是很放心么//@财富密钥: //@但斌: 转发微博	未
不是很重不过还是有伤感觉刑事责任应该没了，如果明确王宝强自己动手的话，行政拘留几天逃不掉了，私闯民宅主要看房子业主是谁，剪刀带着没有法律意义，主要看后续是不是拿出来作为凶器使用，就看警方怎么处理了，相信舆论会在警方通告之后产生一个新的走势	未
不是我不爱你，而是因为你让我觉得，我在打扰你。微博视频	未
不是我们特别好欺负（好骗），而是我们特别善良	未
不是我勤劳工作，而是我那么穷	未
不是我变了，而是我懂了（说到心里去了）	未
不是我吹，《铁齿铜牙纪晓岚》里的这一段，国外还真拍不出来	未
不是我，是俄罗斯//@过路的JLF:哦，原来是老六搞的鬼	未
不是我转的，系统寄几转的//@Lv_吃土部队:当年的小蘑菇头看了都要红着脸躲避//@老叉子x: 我彻底昏迷直接被推去做肾移植手术甚至不用打麻药//@八鸡叽叽囤积场:怎么这么会扭//@橘花边炉锅://@说什么泥不泥的:就完事儿了！！！	未
不是我高冷只是不擅长交流//@萌了个包://@尸姐:我真的只是害羞而已//@这是一个很高冷的ID://@你肠宝://@李撕咬:	未
不是所有人单身都代表是可撩状态 有些人只想安安静静读几年书然后发财	未
不是所有人都活在2008//@极品榜://@饲养员研究中心://@贴吧娘:接受//@别叫我张涛:嗯//@何安:确实	未
不是所有人都能找到相爱的人	未
不是所有的温开水都是温泉，今冬武汉人只去这5个虚浮地方！	未
不是所有被俘乌海军都是孬种，也有硬汉，誓把俄国人的牢底坐穿！	未
不是报酬，是期间可能发生的费用。真相是父母并不知道事实真相。//@塔子玙滋:看别的报道，参与这个项目的父母得到的报酬是28万。所以真相哼可怕....	未
不是拍电影！墨西哥女子当街枪杀6人	未
不是新加坡富商？曝张柏芝第三胎生父另有其人	未
不是新加坡富商？曝张柏芝第三胎生父是大陆富商	未
不是曼联飘，而是穆里尼奥已经提不动刀	未
不是，朱一龙你是有多嫌弃自己做的东西啊哈哈哈哈哈哈哈哈哈哈！！！一直不满意地想动手去调整，哥哥可以了可以了你是最棒	未
不是步行，是开车。//@崔彦战:步行100多分钟怎么也得1万多步走啊，晚上8点一家三口饿又累。珞妮吃了着实不少发头条文章赢得红包长春宋记粥铺吃了顿饱饭，还好。话说这5分钟车程有点气银	未
不是死在跳山山的路上就是死在小怪的路上，我不做王惹	未
不是段子系列 俄罗斯在线地图 Yandex Maps 模糊了数百个土耳其和以色列军事基地的位置，包括建筑物机场港口掩体仓库基地营房，核设施和其它随机建筑物。反而意外暴露了机密信息。。。这不仅确认了它们的位置，模糊的范围还暴露了它们的确切尺寸和形状。。。（via：solidot）	未
不是每一场相遇都有结局 但每一场相遇都有意义 微博视频	未
不是每一年，常州人都能在雾中赏枫叶的！	未
不是每个人在歹徒尖刀刺来时都能毫无畏惧，但他做到了！	未
不是民用的吗动用军事装备给私人企业站台，将纳税人置于何地！一定有什么裙带关系or金钱往来，都是体制的问题，建议改成划拳制_军事集结号 V影响力峰会	未
不是没收：巫山这批违停车再不认领或将报废	未
不是流浪猫越来越多，而是不负责任的人越来越多	未
不是《浪费》原型？炎亚纶：和我们没关系	未
不是海绵不是起司，海绵宝宝原型是海洋生物	未
不是特别理解那些排好长时间队去买一些网红食品或饮品的朋友对我来说，只有一种东西我会去排队那就是，，，免费的	未
不是特殊日子的升国旗仪式	未
不是狐狸，也要学点老谋深算	未
不是王宫，估计是给纪念碑献花很小，周边都有过往车辆和行人//@对闲窗畔e: 看来是没清场啊，那安全隐患还没有排查完毕。	未
不是白日梦！女大学生收到芜湖送来的五吨零食！网友：可以开小卖部了	未
不是的不是的不是的//@渡边鱼子酱:我装备齐全就是特别干燥//@江南大野花:窗外现在在砸雪子，回来路上直接哭了//@花泽美美:最高抗寒水平秋裤吗//@吃不胖的小5:装备齐全还是冷得不行//@段子楼:环境优良你人呢过来感受下环境优良！！	未
不是的不是的，找他有用。//@旗帜201805: 找了也没用//@崔永元:有困难，找警察！//@民警吕宏伟:什么情况，发我私信！//@大名管天下小名管自己:@民警吕宏伟这位人民警察靠谱！	未
不是的！狐狸头是不动的！你别害怕！//@志理家的酸欠灰塵: 太可怕了吧//@狐狸社社长乱狐:我的理想就是把这个小狐狸设计成挂钟，狐狸头作为指针233//@猫的快乐哟: @狐狸社社长乱狐是狐球球//@瓜皮的id酱 :看了100下终于掉了	未
不是空军等不及了，是某些军迷坐不住了而已//@angadow:其实这几年最大感觉是：这些股东和粉丝，应该都没有在机构齐全的单位上过班，或者在单位非常非常边缘化，他们对各种事情的认知就两个字：幼稚。//@Zodzod_张浩:看来精神股东，黑粉现象不仅仅存在于消费数码和娱乐领域啊	未
不是箱包厂吗	未
不是美国不是欧洲 她成了乌克兰救命稻草！英国为何出头有4点原因	未
不是耸人听闻，不建议在车内挂这种杀伤物网友：我是理赔员，有个案子，方向盘正中间logo上沾满水晶装饰，发生事故时候气囊弹出，驾驶员的眼睛被崩没了（交通安全蜀黍）五进送平安	未
不是耸人听闻，不建议在车内挂这种杀伤物网友：我是理赔员，有个案子，方向盘正中间logo上沾满水晶装饰，发生事故时候气囊弹出，驾驶员的眼睛被崩没了蜀黍说安全	未
不是脱发！不是老寒腿！8090后最关注的问题竟是	未
不是自己的东西不能要   襄阳环卫工捡根金条还失主	未
不是西方文明了，而是中国有钱了。所以你才不会再看到Stan Lee去搞这些东西。	未
不是，认真求个课代表。认真的！真的莫名其妙，我真就支持下抵制网络暴力，一堆人说对我失望了。我是真不知道咋回事儿，贴吧。我真的很久没去了。	未
不是说5K万刀搞定了嘛	未
不是说做公益不好，而是别拿公益洗白自己。	未
不是说猫狗双全，相亲时会特别讨好的吗	未
不是说黑色显瘦吗	未
不是谣言！北京大兴禁摩了！	未
不是超能力，是孤独	未
不是身子懒得动，是我跟被子情意重。朱广权	未
不是迪斯尼么	未
不是道歉就可以解决的事情，你已违法！@凯迪仕智能锁	未
不是钱多！解放军同类武器总买好几个型号，背后藏致胜密码	未
不是错别字！江苏鼓励见义智为	未
不是雅诗兰黛不是阿迪达斯新的。两个人都没有的领域。很贵。花钱买到的话也不一定能使用。	未
不是高难三分居然也进了	未
不是鼓励大家买，而是告诉大家这个股票还是要关注着	未
不服三轮车被扣 郑州收废品老人咬断交警手指 12月8号早上7点多，在郑州市建业路和陇海路交叉口处，郑州市交警四大队多名交警在路口执勤时，发现一辆收废品的三轮车，前去暂扣时，遭到三轮司机的强烈抵触，不让民警暂扣三轮车，民警在制服男子时，男子突然咬着民警右手小指，鲜血直流李彬 ...全文	未
不服的，今晚广场尬舞	未
不服输的倔强让人心疼	未
不杀年猪不吃个长桌宴都不好意思说是开年会啦！	未
不来抓我一下吗[米奇比心][给你小心心]	未
不来的车你别等 不对的人你别爱 海的尽头也吻不到天 伸出双手也摸不到星辰 别再编一些自欺欺人的理由骗自己	未
不枪毙真的要留着过年吗！	未
不查不知道，一查吓一跳	未
不样摸头蔡	未
不止一个华为！把美国吓尿的，还有这些你没听过的中国制造！	未
不止一次！杨梅绿荫超市里这妇娘，你真坏水！	未
不止华为，江西婺源宣布所有国产手机游客均通票半价	未
不止听歌  周末又到了，来段「罗马假日」吧！	未
不止张学友 逃犯为看周杰伦演唱会也落网了！	未
不止旅行12月去哪儿玩 作为印尼的世界遗产之都日惹，如果想要近距离的接触这些世界遗产，那就是住近世界遗产里在日惹的婆罗浮屠，周围方圆三公里内有很多不错的酒店，我所入住的是Plataran Heritage Borobudur Hotel酒店分为Hotel和Resort两个部分，Hotel部分的色调以黑白为主，线条简洁， ...全文	未
不止旅行12月去哪儿玩 作为印尼的世界遗产之都日惹，如果想要近距离的接触这些世界遗产，那就是住近世界遗产里。在日惹的婆罗浮屠，周围方圆三公里内有很多不错的酒店，我所入住的是Plataran Heritage Borobudur Hotel。酒店分为Hotel和Resort两个部分，Hotel部分的色调以黑白为主，线条简洁，有很浓郁的欧式风格和田园风光。而Resort则是以更加私密空间为主的度假风，站在Resort大堂的观景台，极目远眺就是让人着迷的婆罗浮屠。Plataran距离婆罗浮屠车程1	未
不止旅行 V影响力峰会 印尼南婆罗洲Lok Baintan水上集市他们待在小船上，忙于采购出售水果和蔬菜。等到黄昏时分，购物者和商贩或自己划船回家，或者搭个顺风车。这种顺风车是指将小船用链子串联在一起，前面用一艘大船牵引而形成的一溜儿船队。	未
不止旅行 V影响力峰会 毕业旅行第二站日本 别问我第一站攻略在哪里大概是在路上哈还有很多不足，请多多包涵哟这一次真的是十分悠悠闲闲，基本都是中午下午才出门 旅行嘛，自己喜欢就好了呀！(拒不承认是懒)P1 行前准备 行程概览P2 东京-京都P3 京都-大阪P4-P6 大阪P7 东京P8 镰仓-东京P9 东京-厦门	未
不止旅行V影响力峰会这不是干货不是攻略，这只是一段又一段热门非热门欧洲目的地的掠影。发布了头条文章：《一张车票两个人三个星期环游欧洲 记一次火车的奇幻旅程》 遇见！全世界 @微博旅游一张车票两个人三个星期环游欧洲 记一次火车的奇幻旅程	未
不止旅行V影响力峰会 ：这段时间行走40国 除了出国旅行和和参加国内各地活动，余下的少量空闲时间，就是一个人呆在十几年前买的广州江景房里设计改造这所房子，因为有106个国家带回的纪念品要展示，并且我个人是黑科技控，所以我把广州珠江边的这所高层房屋装修主题定为：百国智能家庭博物馆，还有1个月广州的房子就装好了。京-广-芭提雅-曼谷 四城候鸟生活，有4个月没有回北京的家了。冷落了北京的房，这回接到邀请，我终于可以回北京跟那些梦想一致的久违的死党相聚了！跟行走40国看世界	未
不止旅行V影响力峰会重访法国 18:A350-900宽体大飞机有何不一同行走40国 跟中国东方航空去法国空客买飞机，第一次不在机场飞，而是在图卢兹的空客工厂交付中心直接起飞飞上海因此在我十七年旅行100多国的登机牌中，这次不在机场发出的登机牌最有纪念价值东航董事长刘绍 ...全文	未
不止旅行V影响力峰会重访法国 20:欧洲航空城-图卢兹我说要去图卢兹，你一脸懵逼，我说图卢兹是法国空客所在地，你终于眼睛一亮哦了一声因为跟东航去空客接A350-900宽体客机，行走40国 终于去了法国的第四大城市-图卢兹法国的前三大城市巴黎里昂马赛，以 ...全文	未
