不少人恨不得一夜之间就让自己瘦下来，就去疯狂地运动但运动也应要掌握一个度，不正确的运动方式往往会让身体受到伤害运动不可急于求成，只有与饮食相搭配才能更好地达到瘦身目的，想通过大量运动达到快速减肥是非常不正确的，还应要饮食上控制热量的摄入，这样才能让你真正地瘦下来	未
不少人说，他之所以没有成功是因为没有机遇，没碰上伯乐。当你有这种被动，抱怨的心态时，机遇之门不会被打开。机遇是创造的结果，你得先变成千里马才有可能碰到伯乐。我们常常对梦想的结果充满期待，而不脚踏实地的努力，最终是空想。	未
不少同学对于电动车的充电时间有误解，以为怎么得充俩小时其实现在如果用超充的话速度已经很快了，以 Model 3 为例，最常用的充电区间 20-80 仅需 34 分钟，半个小时的时间，把车扔在超充站去吃个饭就充完了。当然如果你家车位有充电桩更好，你的生活中就没有加油这个事情了。这也是电动车比汽油车强的一点，你不可能在家加油，但你可以在家充电。	未
不少外国人来中国，即使是个外国一事无成的洋垃圾，也能找个好工作好女友，面对中国人的时候，特别有优越感，不是外国人有多优秀，而是很多中国人自甘下贱	未
不少朋友在找原图，补个链接：网页链接	未
不少标的 这次挺含蓄了 开在3附近，没有吃独食。直接顶板 命短。都聪明了，这样就看市场 接力如何了。比直接顶天花板 好多了。下面就看 5 7阈值 市场会有何种接力的态势	未
不少皇马球员家属，随队出征阿布扎比。图1：马塞洛妻子Clarice Alves图2-图6：卡塞米罗妻子Anna Mariana图7：纳乔妻子图8：马科斯-略伦特Patricia Noarbe图9：马里亚诺女友Yaiza Moreno马科斯-略伦特Patricia Noarbe。	未
不少省份今年推迟启动新高考？教育部：在进程当中	未
不尝试咋晓得好不好网红早餐的走红，传统早餐怕也是要反省一下！//@了不起的成都: 红油耳片面包除了吃个新鲜还有啥成都人的早餐桌上，绝不能少了包子稀饭豆浆油条！	未
不就是寒冰掌嘛 微博视频	未
不就是赚一点外快至于这样大力宣传	未
不就逛个公园，招谁惹谁了	未
不工作的人过着怎样的生活真的不想上班啊 也不知是冬天来了，还是年关将至，最近常常听到朋友抱怨工作。但大部分人只是抱怨，最终会因其实在哪上班都差不多而接受现实继续工作。我们不喜欢工作的原因是，在工作中我们被抹去人性成为机器零件。这给人造成极大的不适不工作的人过着怎样的生活	未
不工作的时候呢	未
)不帅怎么做你大哥	未
不干家务的男人容易得糖尿病？男同志们还等啥，赶紧动起来！	未
不幸！山东一3岁小女孩患乳腺癌(图)	未
不幸莫过于学医出身金融从业的人，还要在下班后忍受洗头小妹讲头皮生理学理发小哥讲办卡经济学下次，我要把学位证工作证挂脖子上！	未
不应失传的中医绝招：失去的是宝贝，受苦的是百姓！	未
不应该发生的事情	未
不应该在家睡觉的	未
不应该是antipossible吗	未
不应该是这样。	未
不应该行拘，应该刑拘！	未
不延续仇恨，只愿和平长存。	未
不开口，没有人知道你想要什么不去做，任何想法都只在脑海里游泳不迈出脚步，永远找不到你前进的方向。	未
不开工的时候，我才发现，有人偷玩我的玩具	未
不开心的时候，想一想，其实你没那么重要，只是一直高估了自己在别人心中的地位，很多烦恼也就迎刃而解了！	未
不开玩笑！在开平开这种车的司机注意，交警要对你们动手了	未
不开玩笑！看到这类车牌，请务必让行！！！	未
不开离职证明，吃亏在眼前！ 人力资源法律	未
不开花和绿萝差不多，开花后却受到万千宠爱	未
不当使用红领巾做营销活动，上海一企业被罚130万7月底，上海臻海实业有限公司邀请日本成人影片某演员作为助学使者，参加在云南德宏州举办的公益活动并佩戴红领巾事件引起网友极大愤慨。记者今日从上海浦东新区市场监督管理局获悉，已对该公司违法行为做出行政处罚，罚款100万元，另案罚款30万元。这是迄今为止上海市场监管部门对于此类案件的最高处罚，也是目前全国关于不当使用红领巾行为的最高处罚。（记者 贺琦）	未
不当使用红领巾做营销活动，上海一企业被罚130万7月底，上海臻海实业有限公司邀请日本成人影片某演员作为助学使者，参加在云南德宏州举办的公益活动并佩戴红领巾事件引起网友极大愤慨记者今日从上海浦东新区市场监督管理局获悉，已对该公司违法行为做出行政处罚，罚款100万元，另案罚款3 ...全文	未
不当使用红领巾营销炒作企业被依法处罚7月29日，上海臻海实业有限公司邀请日本某演员做入校活动并佩戴红领巾近日，上海市浦东新区市场监督管理局依法对上海臻海实业有限公司不当使用红领巾的违法行为做出行政处罚，处以罚款100万元，另案罚款30万元红领巾的尊严不容侵害！转发警示！	未
不当使用红领巾行为的行政处罚全文发布	未
不当使用红领巾被罚，这家企业被处最高处罚7月29日，上海臻海实业有限公司邀请日本某演员作入校活动并佩戴红领巾。近日，上海市浦东新区市场监督管理局依法对上海臻海实业有限公司不当使用红领巾的违法行为做出行政处罚，处以罚款100万元，另案罚款30万元。红领巾的尊严不容侵害！转发警示！	未
不当湿胖子，胖大多因为脾湿重。红豆薏米粉祛湿----红豆薏米粉薏仁粉现磨熟即食营养冲饮不去濕代餐粥男女士早餐食品 25元券微博专享限时领券	未
//@不当粉头别搞我了:喵喵()	未
不当粉头说双十二红包很大我来抢她生意了//@WHKLXXNM:也还行！ 查看图片 //@WHKLXXNM:好像没之前大了，不过还行！ 查看图片	未
不当贫困户，要当光荣户！来一起看看丁大爷家的脱贫路	未
不当资产现金交易年末激增 上交所多番问询严防套现	未
不当资产现金交易年末激增，上交所多番问询严防套现	未
不当闪电侠，冬季防静电有妙招	未
不影响本小区及邻近小区用气 可认证壁挂锅炉用户	未
不征关税了？特朗普召见德国车企巨头：加大在美投资	未
不得不再次紧急通知！明早8点起，大货车禁止穿越城区	未
不得不又要多了一岁	未
不得不受印度支配 全民信仰藏传佛教的雷龙王国不丹	未
不得不承认我是个很天真的人	未
不得不承认，这代人很难回到正常人的轨道。	未
不得不说，一年来，这家伙替我们干了很多事，无论白天还是晚上，不知疲倦，即便是任务翻番的情况下为地震信息播报机器人的忠于职守点个赞	未
不得不说今年A股市场的走势，确实做到了给特朗普施压中国壮胆的目的另外，A股的投降主义，不仅给了美方勇气，也让投资者没了底气，进而引发质押爆仓的系统性风险给管理层添乱到现在，监管层还是不明白，如果不改预期，指数在2600点的风险并不比3000点就低，所谓市盈率，25倍15倍5倍，甚至PB ...全文	未
不得不说，你确实是个人才二代目撩车	未
不得不说，我打开了几个视频，又默默关上了。有几个看了照片就不敢打开了。有几个看到照片就知道打开应该会收获快乐。有几个呢，直接看评论就很喜人了	未
不得不说，时间真是个好东西，可以冲淡一切。以前拼命想要得到的，后来就发现也不是特别想要了。 和前任分手之前我们吵起架来头脑发热，我让他往东他偏要往西，我觉得他应该道歉他偏要对我冷暴力。那时候我们两个人都倔强的不肯低头也不肯听对方的话，最听他话的一次，是分手的时候，他对我说：别再找我了。我就真的再也没有回过头。 只是他不知道，我忍住了多少次想找他的冲动，我多少次开着飞行模式给他发消息，我多少次一睡着就梦见他和别人在一起然后哭着醒来。他也不知道，以前总是劝他别熬夜的我现在整晚整晚睡不着，总是怕他吃辣长痘的我	未
不得不说，现在人的素质越来越高了。	未
不得了。	未
不得了！81岁老军医干了一件大事	未
不得了！万州人都聚集在这个地方，到底发生了什么人山人海...	未
不得了不得了//@JDS-叔:我哭了！！！！！！！！//@小界的小小世界:妈呀 他为什么这么嗲受不了受不了	未
不得了不得了 希望不会有跳票的呜呜呜//@辣条娘: 努力活下去（。//@M大王叫我来巡山:惊了超体还能有2//@江南大野花:帐篷已买好，我驻扎影院//@Sun翠花儿_://@R池水清又清://@佐荧_教授:不得了不得了//@道下一三:好几部都是居然还有2	未
不得了！俯瞰巴彦淖尔，飞行员竟看到这样的景色	未
不得了！利川666人驾驶证逾期未审验，快看其名单...	未
不得了！城口农村的屁爬虫竟然这么值钱！还成了城里人的壮阳药	未
不得了！当涂到北京竟然只需要17分钟超级高铁要来了！	未
不得了！昨天，很多涪陵人都聚集在这个地方，发生了什么	未
不得了！村里几个婆娘杀猪	未
不得了//@渣蜀黍:太可怕了//@颜文字君:这么厉害_)//@追风少年刘全有:居然还显示时间。。。//@三年二班王钢蛋:你是没见过更高端的 查看图片	未
不得了！蔡甸7个村将会火，这次有你们村！	未
不得了，@集渔泰式海鲜火锅 在春熙路又开店了，老板跟我说在厨房插了管子直通北海，勒些虾鲍鱼等海鲜都是直接从海里运过来的，鲜活得很！十多种甜品都免费吃，每天很多人来排队！12月21-23日开业期间，每天6.8折，还送LV包包！今天刷我滴卡，抽10个朋友，每人送一份价值210元的双人餐！转起来撒！	未
不.得.好.死！牛在哀嚎悲鸣，注水牛肉现场大.公开，殘.忍.无比！	未
不必厚着脸皮 壮着胆子 耐着性子 攒着劲儿 去取悦一个不可能的人	未
不必在乎每分每秒的意义，不是每段关系都存在意义，看不惯不顺眼用你态度来表达，生活总有一件件的烦心事，但这些没有什么是一根口香糖解决不了的！近朱者赤，近我者甜，就在今天，@口香糖有限无责任研究所 已空降成都三福百货青年路2店！ 更有大神@周彦辰 亲自加持哦你饿不饿来找我，我拿口香糖给你吃啊！就到本月30号喔！	未
不必对全世界失望，百步之内，必有芳草。亦舒《花解语》	未
不必把镜头一直对着主席台，有些角落也是蛮有意思的。办会是一件很辛苦的事。嘉宾数量众多，上厕所要排队。	未
不必苦苦追问他是不是在乎你，如果他真的在乎，他会比你更怕错过。	未
不必谈艾色变！河源艾滋疫情处于低流行水平，6医疗机构可免费检测	未
不忍心看，那么小而脆弱的生命	未
不忍直视，屁股都烂了！永清爱心人士看望堂二里一患病女子！	未
不忘养育之恩，孝，从每一个人做起。	未
不忘初心四个字早被世人说到烂俗，但他这么说，也一直在这么做，不是为了做给谁看，是自省后的坚持和操守。	未
不忘初心学党史你应该知道的郓城籍抗日英雄梁仞仟（二）	未
不忘初心，归来仍少年	未
不忘初心跟党走  龙泉社区开展主题党日活动	未
不忘历史 吾辈自强12月13日，南京大屠杀遇难者国家公祭日，国网江苏检修公司泰州运维站尖锋党员突击队不忘血泪国耻，驻足默哀遇难同胞，并随后展开保电特巡，在平凡岗位上牢记使命自强自立，为复兴中华履职尽责。	未
不忽悠！超级高铁来了，诸暨到北京只要30分钟	未
不怕人远，就怕心远。	未
不怕冷 中国建造全球首艘4.45万吨级极地凝析油轮	未
不怕制裁!乌克兰驻北约前特使:乌有能力造核武器	未
不怕制裁！乌克兰驻北约前特使：乌有能力造核武器	未
不怕制裁！乌克兰驻北约前特使：乌有能力造核武器近日，刻赤海峡事件使俄乌冲突重回国际视野，乌方与俄方的表态也备受关注据俄罗斯卫星通讯社报道，乌克兰驻北约前特使彼得加拉什查克在接受乌克兰电视台采访时表示，乌克兰拥有发展和生产核武器的知识组织和财力美国和俄罗斯都无法制造出 ...全文	未
不怕！华为在美国市场上还有Amazon	未
不怕学渣交白卷，就怕他们放飞自我的叛逆答案哈哈嗝！	未
不怕小孩打架，就怕大人眼里只有自家小孩。磕磕绊绊吵吵闹闹都是成长的一部分，护孩心切总怕孩子吃亏，反是害了小孩。	未
不怕挫折，在爱情里越战越勇的生肖	未
不怕有寄生虫吗 微博视频	未
不怕狼虎当面阴，就怕交人两面心。	未
不怕神一样的对手，就怕猪一样的队友	未
不怕神一样的对手，就怕猪一般的队友！	未
不怕贼偷就怕贼惦记，胆子不小啊，关键还抓到把柄了//@w秀秀: 转发微博	未
不怕这个世界对我们残忍，怕的是对自己的放纵。运动V势力	未
不思议来客 每天等位500桌的火锅店有多火最美国风少年@哈妮克孜 为你一一揭秘。	未
不思议来客 跟bridge在星空餐厅喝一口雾霾	未
不怪别人的//@M大王叫我来巡山:我确实是有点难搞//@辣条娘:我就很善变啊//@Tiger公子://@veriseung:是//@歌且行风长吟:是我//@空橘君://@Crepusculivresse:。	未
不悔梦归处 只恨太匆匆	未
不惊扰别人的宁静，就是慈悲 不伤害别人的自尊，就是善良。 人活着，发自己的光就好，	未
不惧寒冷 盐密取样 12月18日，国网检修公司输电中心二班人员对所管辖东三线路的空挂盐密绝缘子串进行高空取样和测量。他们通过测量得到的盐灰密结果来检查线路沿线污秽程度，从而判断现有的绝缘配置是否达标，为冬季防污闪工作提供数据支撑，切实做好线路保障工作。	未
不惧抗议美联储再加息，或为经济放缓留政策空间	未
不惧美元加息，央行高调表态流动性充裕后祭出“定向降息”	未
不惧美方最后通牒！普京：你们若研发导弹 俄罗斯将效仿	未
不惧美联储加息，央行高调表态流动性充裕后祭出“定向降息”	未
不想一辈子打工他5年帮1381人赚钱，摆脱打工命	未
不想上班 假如这个世界不需要钱，那我们是不是就不用上班了！	未
不想上班 却不得不上班的我	未
不想上班 却又不得不上班的我	未
不想上班，因为没有钱又不得不上班的我	未
不想体验人间百态，只想清风徐来水波不兴	未
不想做饭，但是也不想吃外卖，也不想吃速冻食品。然而好饿	未
不想凌晨起床，大人孩子都遭罪于是晚上出发，到机场附近住下酒店从5点钟起每隔20分钟有一趟班车去航站楼，明早就不会太折腾了在酒店的餐厅吃了一点东西，别提多难吃了我始终想不明白，贵都贵了，你干嘛就不能往好了弄弄呢	未
不想减肥了！//@A526ACA:想喝一杯芝士	未
不想出去的理由 。。。	未
不想出门就看直播吧！南马周日鸣锣 多条公交线路临时改道	未
不想办法去解决问题，而是想法子去解决提问题的人！这样的思维，如何去创建独家曝光事发恒馨社区，女网友向市长热线反映诉求，却遭社区书记恐吓和谩骂！	未
不想办，觉得结婚是很私人的事情，不愿意别人掺合。其次，肯定也没人愿意掺合，没什么人愿意浪费自己的生命在祝福别人上的，即使是一小段时间 网页链接	未
不想勉强谁对我好 我只图安心 你若相惜 我必还心 就这么简单 情感V时代	未
不想在同学聚会上被伤害，你需要TA！	未
“不想妨碍总统！”斯里兰卡新总理宣布辞职	未
不想开空调（因为太闷太干了），又想一整个房间暖和一点，怎么办我说我想搞盆碳在屋里烤，顺便还能丢个红薯进去解决一顿饭。基友：你想自杀可以，别影响到邻居谢谢。	未
不想当美女的警察不是好赌徒	未
不想当贫困户咱洛宁这宣讲你一定得听	未
不想承认，我赚钱的功力还不如 12 岁的小朋友！	未
不想拖累子女，柳州一老太欲割腕自杀12月17日，柳州滨江西路河堤，一名八旬老太尝试用剃须刀割腕自杀，所幸被热心市民发现，经救治后无大碍老太称，因为身患重病难以治愈，她不想拖累子女（南国今报）	未
不想拖累孩子们，老夫妻跳河自杀！12月2日，安徽省六安市，寿春路大桥的下游打捞出一对老夫妻的溺亡尸体。周边群众说，这对老夫妇同时患病，孩子们都已结婚成家生子，为了不给孩子们带来负担，一起跳河自杀	未
。不想接受//@Tiger公子://@追风少年刘全有:了//@林熊猫://@然后下面就没了:这是啥	未
不想撞南墙了，只想撞王俊凯先生的胸膛	未
不想放羊，不想养鸡，不想喂兔子扶贫干部有办法	未
不想独立坚强 只想长期被宠爱。	未
不想生、不敢生、托育难？计生协将着力解决这些问题	未
不想生不敢生托育难计生协明年将建立网上婚孕检服务信息平台2019年计生协将继续做好生殖健康咨询服务和优生优育指导等工作，着力帮助群众解决不想生不敢生托育难等问题。计生协还将建立网上婚孕检服务信息平台开展优生优育进万家活动，提高出生人口质量。	未
不想生、不敢生、托育难？计生协明年着力解决这些问题	未
不想生不敢生托育难?计生协明年着力解决这些问题	未
不想生不敢生托育难计生协明年着力解决这些问题12月20日，中国计划生育协会八届六次常务理事会暨改革工作推进会上发布消息，2019年计生协将继续做好生殖健康咨询服务和优生优育指导等工作，着力帮助群众解决不想生不敢生托育难等问题。网页链接	未
不想生却意外二胎的妈妈们，她们经历了怎样的心路历程	未
//@不想瘦就多吃竹子炖猪肉:第一地方政府税收优惠实际都是地方政府垫资，主要是让企业进来能留下。企业搬迁成本高，很多搬迁的企业还会损失客户资源，地方政府不能公开补贴，只能以垫付税款的方式补贴。第二很多企业钻空子，建立一个空壳企业，对外开发票套取税金，地方政府发现漏洞企业就必须自己补缴	未
不想离开被窝//@温温LHH :每天早上离开被窝都需要很大的勇气啊	未
不想结婚，只想一直拍拖！男友和他妈妈会不会介意啊	未
不想被处罚企业安全生产主体责任的十八项清单出炉，赶紧收藏！	未
不想被小孩叫叔叔阿姨保养要趁枣！	未
不想被等待	未
不想让你的住房公积金在账户上睡大觉，就请看看这条吧	未
不想说晚安的1760 收快递的时候，你有看到过什么沙雕收件人名字或者你一般收快递叫外卖都会写什么名字	未
不想负债太多，滨江的千亿目标今年完不成了在大本营杭州，滨江集团实现了234.5亿的流量销售规模，与第一名绿城仅差0.1亿，比第三名万科多出5.87亿。在权益榜单上，滨江集团实现了135.59亿规模，仅次于万科和融信，但与万科相差了47.59亿。从销售规模来看，业绩实现不及预期。不想负债太多，滨江的千亿目标今年完不成了	未
不想走CalcioMercato：尤文图斯拒绝了曼联对巴西边锋道格拉斯-科斯塔的54M英镑报价，球员本人明确表示冬季不会离开球队，明年夏天再说。科斯塔本赛季出场16次，但只有4次首发。尤文图斯希望从曼联得到博格巴。	未
不想起，想睡到地老天荒	未
不想麻麻抱别的宝宝	未
不感动，不敢动	未
不愧是体院小哥哥！轿车开下台阶，学生冒雨合力抬上5日晚，武汉体育学院西门清和广场，因为雨天路滑一辆黑色轿车在停车场行驶时误掉下台阶，身单力薄手忙脚乱的车主向路过的学生求助12位体院学生冒着冷雨，合力将车子抬回台阶上确定车辆到达安全区域后，学生们婉拒车主请客，直接离开了现 ...全文	未
不愧是体院小哥哥！轿车开下台阶，学生冒雨合力抬上5日晚，武汉体育学院西门清和广场，因为雨天路滑一辆黑色轿车在停车场行驶时误掉下台阶，身单力薄手忙脚乱的车主向路过的学生求助。12位体院学生冒着冷雨，合力将车子抬回台阶上。确定车辆到达安全区域后，学生们婉拒车主请客，直接离开了现场。（楚天都市报）网页链接	未
不愧是律师//@Emma古小月: 懂法太可怕了//@专业戳轮胎熊律师:不是应该赶快找到自己的肉身，强行和她发生关系，然后摄像发自己邮箱这样第二天，要么他娶你，要么他赔一大笔钱	未
不愧是父子	未
不愧是 @霜叶 大V的粉丝，素质真是高。这个话题我想起来两件事，一个是郭老师一句名言：我这人心善，方圆20里内见不得穷人。另一件事凉山的孩子们打自由搏击谋生，被一群善人口诛笔伐，甚至逼迫孩子们离开俱乐部。键盘侠们真的厉害，怕了怕了	未
不愧是黑心律师//@魔力的真髓:最右厉害了//@开水族馆的生物男: 最右轻车熟路啊//@鹿拔刀:_//@专业戳轮胎熊律师:不是应该赶快找到自己的肉身，强行和她发生关系，然后摄像发自己邮箱这样第二天，要么他娶你，要么他赔一大笔钱	未
不愿交360元停车费业主撞坏小区道闸杆被刑拘	未
不愿喜上加喜？曝梅根怀孕将不会参加好友婚礼	未
不愿意	未
不愿意花时间跟你培养感情的人，就别那么上心了。	未
不愿意进棺材的尸，不愿意去阴间的鬼	未
不愿砸向人群，飞机失控后撞山坠毁，40名专家牺牲，2名是将军	未
//@不愿透露姓名的唐先生:看看愿许着倒次一这那	未
不懂。	未
不懂三级配电二级漏保，别好意思说你是干安全的	未
不懂为什么要排这么久@科科科仔	未
不懂六稳的政治意义，表明根本不明白股市。	未
不懂得体面拒绝的人，究竟有多累	未
不懂技术的人，很容易产生技术恐惧症，觉得技术有多难，中国会赶不上，人家封锁我们就完了以我看今天格局，技术差距没那么大，大的是产业政策今天技术领域最顶级不过是人工智能，中国并不差，完全可以和世界一流水平平起平坐但芯片却有距离，原因何在产业政策，上世纪80年代，投芯片业，韩国 ...全文	未
不懂数据分析的正确姿势，比彻底不会数据分析更可怕！	未
“不懂球的胖子”刘国梁当选新一届中国乒协主席	未
“不懂的去问百度”：医生还能这样看病？	未
不懂的时候不要说，懂的时候别乱说，才是一个真正有修养的人！ 你不了解我，就别在背后议论我	未
不懂财经却将执掌台“金管会”，只为捅刀国民党？	未
不懂项目管理，将来在企业无法生存	未
不懂风情往往就会发生车祸！例如......	未
不打招呼直达现场对全市近20家医疗机构开展医疗废物污水处置夜间突袭检查！	未
不打水印被盗图怪你自己和被qj就怪你穿着暴露逻辑基本一致我完全不能认可。	未
不打自招//@天涯迷妹的跟贴日常: 太搞了你们几个//@平价安利菌: 识破//@手游君: 对不起，下次还敢	未
不承认克里米亚属于俄罗斯，乌克兰海军强闯刻赤海峡，全军覆没	未
不把大魔王rookie放在眼里LCK新人取名中单之王！	未
不担心找不到资 源了	未
不拍戏也不会被观众忘记的明星 他曾十年没拍电视剧	未
不拍户外游记的日子，在北京也没少开车，家住东北六环，这一周的节目拍摄地点不是在南六环，就是今天的西六环，每天也是往返上百公里比在无人区不差的累我还是回无人区吧	未
不招不架 ，就是一下，清朝镖师杀人如剪草	未
不招墩子不招小二，只招儿媳妇！这家餐馆的操作666...最近，成都一家餐馆的招聘启事火了，这家店既不招墩子，也不招服务员，招的竟然是儿媳妇！据悉，这份招人展板的主人公是店主老陈的外甥伟伟（化名）。来自攀枝花的伟伟在西南财经大学就读，毕业之后留在成都工作。展板上详细地介绍了主人公83年出生身高173cm年薪20万等信息，还列举出了对女方的要求，例如：愿年龄25-35岁孝敬父母身材苗条等等。招儿媳妇的展板从第一天摆在门口，就吸引了不少路人的眼球。不少路过的人，还把展板拍下来发了朋	未
不拼经济拼政治？台湾政务仍然在空转	未
不按套路出牌 俄：不会与乌克兰开战 “葫芦里卖的什么药”？	未
不按常理出牌	未
