商务部:对原产于澳的进口大麦进行反补贴立案调查	未
商务部:对原产澳大利亚的进口大麦进行反补贴调查	未
商务部对外贸易司负责人就《机电产品国际招标代理机构监督管理办法（试行）》进行解读	未
商务部将严厉打击“双11”各项不规范网售行为	未
商务部：将尽快印发跨境电商零售进口监管方案	未
商务部 工业和信息化部公告2018年第59号 关于《黄豆酱》等212项国内贸易行业标准调整标准主管部门的公告	未
商务部市场建设司负责人对《全国农产品市场体系发展规划》进行解读	未
商务部市场建设司负责人就《关于加快发展农村电子商务的意见》进行解读	未
商务部市场秩序司负责人对《全国药品流通行业发展规划（2016-2020年）》进行解读	未
商务部市场秩序司负责人就《商务部办公厅关于印发的通知》进行解读	未
商务部：希望美方克制使用贸易限制措施	未
商务部：愿与葡萄牙密切贸易往来	未
商务部披露：中美90天谈判中方从这几项做起	未
商务部新闻发布会 就热点话题回答提问	未
商务部新闻发言人孙继文就《中华人民共和国外国投资法（草案征求意见稿）》公开征求意见发表谈话	未
商务部：有关工业城市“空心化”的担心 大可不必	未
商务部：望G20国家共同维护自由贸易和多边贸易体制	未
商务部：未来90天将以取消所有加征关税为最终目标	未
商务部条法司：进一步放宽市场准入的余地仍然很大	未
商务部条约法律司负责人就《外商投资企业设立及变更备案管理暂行办法》进行解读	未
商务部：欧盟同意向中国开放10600吨新的禽肉关税配额	未
商务部:欧盟同意向中国开放10600吨新禽肉关税配额	未
商务部：正抓紧研究《电子商务法》相关配套法规	未
商务部　海关总署公告2018年第82号（公布货物进口许可证件申领和通关作业无纸化有关事项）	未
商务部 海关总署公告2018年第82号 公布货物进口许可证件申领和通关无纸化作业有关事项	未
商务部　海关总署公告2018年第82号（公布货物进口许可证件申领和通关无纸化作业有关事项）	未
商务部电子商务司负责人就《“互联网+流通”行动计划》进行解读	未
商务部电子商务司负责人就《国务院办公厅关于深入实施“互联网+流通”行动计划的意见》进行解读	未
商务部:确有计划中美明年1月举行贸易会谈	未
商务部等9部门关于印发《中国服务外包示范城市动态调整暂行办法》的通知	未
商务部等9部门关于进一步规范对钢铁企业支持措施的函	未
商务部组织起草了《鲜蛋冷链流通规范》公开征求意见	未
商务部给企业吃定心丸：“海淘”新政将是相对长期安排	未
商务部：美国企业对我口袋打火机产品提起337调查申请	未
商务部：美国企业对我皮卡车折叠盖板产品提起337调查申请	未
商务部：美更新“301调查”报告罔顾事实	未
商务部谈世贸组织改革 提出中方五点主张	未
商务部 财政部 税务总局 质检总局 统计局 外汇局关于开展2018年外商投资企业年度投资经营信息联合报告的通知	未
商务部：赋予11家企业成品油非国营贸易进口资质	未
商务部：进一步放宽市场准入的余地仍然很大	未
商务部：通过对话协商妥善化解矛盾与分歧	未
商务部驳斥“中美谈判中方做出重大让步”说法	未
商南人速看！明天起，这些新规将影响你的生活	未
商友江到城区调研督导环卫工作	未
商品互换市场建设与发展系列一：什么是商品互换？	未
商品互换市场建设与发展系列二：谁参与商品互换？	未
商品期货夜盘开盘涨跌不一 甲醇低开3.2%领跌	未
商品期货夜盘收盘普跌	未
商品货币大跌美元兑加元涨幅超过0.5，刷新2017年5月中期以来高位至1.3572，较日低反弹84点。澳元兑美元下跌约0.6，刷新10月30日以来低点至0.7064。纽元兑美元下跌逾0.8，刷新刷新11月13日以来低点至0.6720。(华尔街见闻7x24直播 不止是快) 实时快讯	未
商品过去当下未来  复盘	未
商场4楼招商儿童教育机构商户开业后 才知消防通不过池先生租用西安城东公园南路的上和商业广场4楼一处800平方米场地，做儿童一站式教育服务机构，今年9月28日该机构正式开业。日前，消防来检查，商场4楼十多家经营儿童项目的商户，都收到了限期整改通知。这时池先生才知道，相关法规规定4层及以上不得开设儿童活动场所。检查当日，商场曾给池先生打电话，让把机构内墙壁上的孩子和幼儿等字样遮盖住。池先生质疑商场招商时有所隐瞒，律师认为商场应承担商户损失。	未
商场4楼招商儿童教育机构商户开业后 才知消防通不过池先生租用西安城东公园南路的上和商业广场4楼一处800平方米场地，做儿童一站式教育服务机构，今年9月28日该机构正式开业日前，消防来检查，商场4楼十多家经营儿童项目的商户，都收到了限期整改通知这时池先生才知道，相关法规规定4层及以上 ...全文	未
商场4楼招商儿童教育机构 商户开业才知消防通不过	未
商场不同业态共用水电费计算和分摊方案，你知道吗	未
商场不开门，注意避开游行街区！	未
商场偶遇小青蛇，素颜照的真面目曝光	未
商场全责//@司马子潇潇e:对，还是走法律程序。//@卡尔超越理想:商场没做好防护，应负全责！还是用法律解决吧！宝宝一路走好！	未
商场内发生电线走火后，出现了一位闲庭信步的拖鞋哥	未
商场写字楼滴转供电用户注意啦你的电费下降了！	未
商场惊现魅影！柜台商品连连失窃 监控却拍不到他的身影一大型商业综合体安保人员反映情况，该商场近日连续发生2起化妆品柜台失窃警情侦查员立即赴商场查看，失窃的化妆品铺面由于内部装修，有部分柜台布展于铺面的门口，处于监控盲区，民警并未发现有效线索11月20日深夜，贼影再次出现在 ...全文	未
商场成战场！为抢货开枪射伤2人，美帝人民黑五疯狂买了一万亿美金	未
商场拆迁拖12年 开发商:最大钉子户是2名公职人员微评：说的是吉林省扶余市一棚户区改造项目，当时承诺2008年原址回迁，结果2018年还没拆迁完，最大钉子户是刑警大队长和法院副院长。虽然我不赞成用公权力逼住户拆迁，但更不赞成用公权力捞好处。可以想象，此地政府执行力差，营商环境差。吉林商场拆迁拖12年 开发商:最大钉子户是2名官员	未
商场拆迁拖12年 开发商：最大钉子户是2官员	未
商场拆迁拖12年 开发商：最大钉子户是两名官员近日，吉林省扶余市的群众反映，他们原本是当地华夏商场店铺的业主，2007年，当地进行棚户区改造，对商场进行拆迁，当时承诺第二年能原址回迁。结果2018年都快过完了，商场还没拆完。开发商说，因为这其中的大钉子户之前是当地刑警大队队长和法院副院长，他们提出了不合理要求，得不到满足，就谁也不肯拆。个中真相如何商场拆迁拖12年 开发商：最大钉子户是两名官员	未
商场来了得瑟女给钱就舞，刷爆朋友圈	未
商场男厕被女性征用 工作人员：基本都是女顾客，请男士理解18日，有成都市民反映，她在金牛区一大型商场上卫生间时，发现三楼的两个卫生间，都是女性在用，其中一个明显还看到立着几个男士小便器，她纳闷：是标识贴错了，还是特意设置成这样的呢商场工作人员表示，三楼商家和客户多为女性 ...全文	未
商场男厕被女性征用 工作人员：基本都是女顾客，请男士理解18日，有成都市民反映，她在金牛区一大型商场上卫生间时，发现三楼的两个卫生间，都是女性在用，其中一个明显还看到立着几个男士小便器，她纳闷：是标识贴错了，还是特意设置成这样的呢商场工作人员表示，三楼商家和客户多为女性，所以才征用男厕给女性用。二楼和四楼设有男士厕所。成都一商场男厕被女性征用工作人员：基本都是女顾客，请男士理解	未
商场试衣服的我	未
商场里买来的面条中全是虫子，厂家说	未
商场里偶遇了小鹏G3，这ModelX同款挡风玻璃看着还挺过瘾的，就是晴天开车可能要涂防晒霜 北京世纪金源	未
商场里来了一只流浪猫，躲在宠物食品区，不走了，嘤嘤给喵买个罐头吧	未
商城县2018年全县71个重点项目建设情况的通报，哪个项目与你有关...	未
商城县女老赖专场！看有你认识的吗	未
商城县要在这里建妇幼保健院妇女儿童保健中心，看看是哪里...	未
商城县金穗小区遇到什么麻烦了给社区写这样的申请...	未
商城的一天，浓缩成一个视频...	未
商城通相亲网第37期：女，21岁，未婚，商城县苏仙石人	未
商城通相亲网第38期：女，23岁，未婚，商城县余集人	未
商城通相亲网第40期：女，21岁，未婚，商城县城关人	未
商城通相亲网第41期：女，27岁，未婚，商城县余集人	未
商城通相亲网第42期：女，37岁，离异，商城县观庙人	未
商城通相亲网第43期：女，31岁，离异，商城县达权店人	未
商城通相亲网第44期：女，24岁，未婚，商城县鄢岗人	未
商城通相亲网第45期：女，24岁，未婚，商城县河凤桥人	未
商城通相亲网第46期：女，21岁，未婚，商城县河凤桥人	未
商城通相亲网第47期：女，29岁，离异，商城县苏仙石人	未
商城通相亲网第49期：女，42岁，离异，商城县城关人	未
商家出售疑似猫皮马甲？专家：不符逻辑 哗众取宠	未
商家打架了5.6入手！	未
商家打架了5.8入手！	未
商州公安分局快速破获城区系列砸车玻璃盗窃案	未
商师文谭人文学院 李可亭：寻找墨翟路	未
商店里断断续续逛了几天，发现本地买手真的能订到最繁琐的款式。我现在确实能理解到白衬衫卡其裤的美了，对不起，对不起，以前没有综合起来考虑，现在觉得亦舒还可以。	未
商户们花费数十万装修刚租下的门面准备经营，竟收到市场属于违建要拆除的通知，怎么办	未
商机已与2万多家快递网点合作，原因是这公司有神器	未
商机德国废水处理技术寻求投资	未
商机德国牛奶加工企业转让	未
商机无处不在！	未
商机无限光泽西关沿街1一5层的酒店出租或转让！	未
商机英国光伏面板玻璃涂层制造商寻求投资	未
商标局放大招了！无纸化办公正式运行，以后没有纸质文件了！	未
商标注册证明公示系统拟于2018年11月27日上线运行	未
商汤SensePosture3D人体骨架检测技术引燃OPPO R17 Pro体感游戏	未
商河济阳北济阳西收费站恢复通行//@济南交警: 因济青北线大雾，对济南东绕城机场郭店济南东收费站限行两客一危及黄牌大货车。	未
商洛一周内连发两起因取暖一氧化碳中毒事件，5人逝去生命！	未
商洛一妇女公交上多次掌掴拳击驾驶员丈夫！	未
商洛人，2018年底前：这笔钱别忘了交，这三笔钱记得领！	未
商洛人，近日商洛各地火灾一氧化碳中毒等不安全事故频发，关于冬季安全这些内容要知道！	未
商洛城区这片区域今晚将停水，不看小心明天么水洗脸！	未
商洛西街大都汇将市民购买的商铺私自出租   称若走司法程序将不再提供优惠	未
商用卫星“井喷”4家民企10颗小卫星一同飞天	未
商界一带一路 《越南篇丨越南新娘相亲流水线》 一边是2万元娶一个越南新娘的宣传，一边是无数人无法找到中意妻子的现实。一个中国商人用他的亲身实践，打开了一个崭新的跨国婚介市场。 越南篇丨越南新娘相亲流水线	未
商界：中国快递已经到了不得不变的时候！	未
商界杂志精选文章 换位思考也危险换位思考也并不是解决矛盾的万能钥匙。 换位思考也危险	未
商界杂志精选文章雷军股权术 从创立到IPO，雷军始终把控着小米的控制权。如此局面，建立在6轮10次融资的股权稀释背景下，雷军的手腕不可谓不高超。 雷军股权术	未
商誉高悬、现金流吃紧 洛阳国资纾困金冠股份	未
商议大事	未
商贩占道经营，农贸市场管理员边踩踏蔬菜边大喊：赶紧走11月26日，云南绥江县农贸市场管理员踩踏菜农蔬菜的视频在网上热传当地城管局发布通报，称菜农占道经营且不听管理员安排，旁边的商贩煽风点火致管理员行为过激目前管理员被停职，并向菜农道歉赔偿其损失 网页链接	未
商贸门口豪车被三轮车刮擦，为这个车主默哀三分钟	未
商超硬核改造进行时 盒马等新物种快速被复制	未
商都部分村名的由来，看看有你们村没有	未
商量啥呢俩人	未
商铺一再延期不交房 创业青年网上求助获解决(图)	未
商铺油烟噪声扰民 南京鼓楼区推进整改落实	未
商鞅能与四公子相提并论么四公子是列国的嫡系王族平原君是赵武灵王的儿子孟尝君是齐威王的孙子信陵君是魏昭王儿子，唯一有那么点像就是春申君了商鞅是改革家政治家啊春申君没把楚国变为NO1//@多摩青雷亭的米狼: 秦国有商君啊！	未
啊。	未
啊140	未
啊()//@Amortentiaz:死亡	未
啊//@三十岁的朱一龙:男的	未
啊！三连跌后油价又有新变化！仁怀司机速看... ...	未
啊不是往脖子上缠就完事了//@M大王叫我来巡山: 虽然一直在马，但自己围出来总是和视频里不一样//@江南大野花: 类似的马了无数个，每个冬天还是围成自尽状//@夏目雪音:我一围围巾就跟脖子上围了个绳子要上吊似的	未
啊！不是有绳索吗。我看了视频。很专业的救援方式	未
啊不然咧	未
啊不能调度数的	未
啊之前完全不知道	未
啊..............二月河過世了..............	未
啊，今天是国际消除针对妇女暴力日	未
啊 冬天那么冷的话 积点雪给我们南方小孩吧！	未
啊！凡凡去打LOL了，还去全明星了！skr	未
啊原来有医学速写这种东西//@云卷儿De腊肉_湉TAN: 哈哈哈哈哈哈	未
啊 吸一口欧气！//@日本情报站:听说转发可以吸欧气	未
啊呀会有的//@夏目家的小诗哥:希望你们都能遇到这样的人//@不想网恋的男孩:试问谁不想拥有呢//@一个弃号886:还有那种生活中不经意的小惊喜	未
啊....呸呸呸//@苦逼的快递哥小马:	未
啊呸//@柠小文从今天开始变勇敢: 打卡//@樾时光:举报	未
啊咿呀 还有一个小时 赶不上也焦急等待	未
啊哈哈哈。你是奇葩雷达，我是随便在自己家里说说也会被奇葩的雷达搜到的群伤体质。 查看图片	未
啊哈哈哈哈哈哈哈哈哈//@Matcha_blue: 查看图片	未
啊哈哈哈哈 开豪车大辛巴有了新娘，于是皮皮波投入了自行车坐垫的怀抱	未
啊哈，外卖送了个咸鸭蛋	未
啊//@唐小熊_衛宮鍛冶学徒: 「誰為思間違筈」 「多人笑。間違思」	未
啊啊啊一定需要听....	未
啊啊啊！合肥已经下雪了，就在这里！市区何时下气象台说	未
啊啊啊啊今晚又白又瘦的少奶奶被少爷接回家了，整天被情敌碾压的桑桑心很痛，现在有什么比一哭二闹更管用的办法吗在线等	未
啊啊啊啊啊，一觉睡到现在	未
啊啊啊啊啊！今天在办公室熬秃黄油，拆了四个小时的蟹粉，被打扫的大叔连蟹壳一起倒掉了！就在刚刚！满满一盆啊！啊怄得满地打滚@艾格吃饱了	未
啊啊啊啊啊卧槽心都给你勾过去了//@苏酥甜心鸡:[米奇大哭][米奇大哭][米奇大哭]	未
啊啊啊啊啊啊啊啊啊啊啊啊啊	未
啊啊啊啊啊啊啊啊啊啊啊啊啊啊啊啊啊啊啊啊啊啊啊啊啊啊啊啊啊啊啊啊啊啊啊啊啊啊啊啊啊是我们拢龙	未
啊啊啊啊啊啊啊啊啊啊啊啊啊啊啊啊//@大仙儿是个蓝胖子 :	未
啊啊啊啊啊啊啊啊啊啊疯了	未
啊啊啊啊啊啊啊啊啊小巍	未
啊啊啊啊啊啊啊啊啊我来了	未
啊啊啊啊啊啊啊啊啊这也太好磕了	未
啊啊啊啊啊啊啊啊我在广场了我从几个月的小黑屋里出来了吗	未
啊啊啊啊啊啊啊啊//@锥爹 :哇哇哇//@美羊羊120408 :哇哦//@给里给气拔毛母鸡 :我起了	未
啊啊啊啊啊啊啊我的天哪	未
啊啊啊啊啊啊啊最后一张我死了	未
啊啊啊啊啊啊啊！！！！！//@段段以及南墙:我靠，买买买	未
啊啊啊啊啊啊团什么时候开始	未
啊啊啊啊啊啊图一图四 我的妈	未
啊啊啊啊啊啊我儿出现了！！！	未
啊啊啊啊啊啊比我的妈呀	未
啊啊啊啊啊，弱弱的问问你们。 你们手里还有多余的票吗 有的话，帮我三连冠一下吧。 今天也帮我再投一次吧。拜托拜托。 戳这里 和我去见大V吧 点我	未
啊啊啊啊啊我在办公室要尖叫了//@热度60秒:看到最后一张我哭了你呢//@我脑子有泡:大家都来品品这是什么绝妙爱情//@小矫情鬼哦:内容过于真实 举报了//@wenny-B:划重点！360度无死角！！！醒醒吧姐们	未
啊啊啊啊啊我要见到张主理人了	未
啊啊啊啊啊是宝贝面面！！//@风蚀魔菇:我的崽	未
啊啊啊啊啊竟然更了等这么多年	未
啊啊啊啊啊阿雀奶茶送到家热的都成去冰了	未
啊啊啊啊 心化了	未
啊啊啊啊 血槽已空	未
啊啊啊啊行吧，聚餐。//@Coco鮮芋烏龍奶茶://@一颗会讲故事的柠檬:哈哈哈，没事儿的，大家都是聚餐//@没有耶你看啊:终于明白人家那才叫婚礼，我的那只能叫聚餐	未
啊啊啊坤哥@蔡徐坤	未
啊啊啊！泉州人今年吃火锅，千万别点这东西！会上瘾	未
啊啊啊第四张！隔着屏幕的爱真的恨过年啊！	未
//@啊啦啊啦lu:姐姐去过外地，没有安全感，去外地遇到的也不是什么好人。2017年应该是最好过的一年了教她跳广场舞，写写书没事一起买菜做饭。她一个人久了有时会情绪崩溃，有时候会特别想要安慰。家人对她来说是又爱又恨的。最主要不想因为做错事担心受怕，也不想自己事情连累别人自己事情自己承担	未
啊(土拨鼠尖叫	未
//@啊垃垃圾君的小忍A梦: 转发微博	未
啊好在目前看来小梅的胃口还是很好的[给你小心心]黑黑呀，你是不是偷偷在獭星保佑着小梅呢没有我在跟你抢吃的，要吃胖点哦推：chobichobi1225摄于鸟羽水族馆	未
啊好甜[親親]//@扣仔很忙:啊//@金鱼骨_:转发微博	未
啊，巨大的性肿皮！ 花老师带你逛动物园 微博公开课微博视频	未
啊.... 微博视频	未
啊忘记说，预购截止时间为12月15日24点整，所有新品都根据预购数量制作，所以不一定有现货。希望大家奔走相告最好在预购期间拍下哦！	未
啊我也要吸！//@歪果热门视频: 磨人小妖精	未
啊我想	未
啊，我才发现陌生人关注这栏，看得出来对方是不是已经关注了你的啊我是猪	未
啊，我的甜姐儿。	未
啊救命啊圆圆跟妈妈回家啊	未
啊！数据肯定不会有这么大！。。。	未
啊斑马斑马	未
啊，是熟悉的味道//@身体柔软安倍桑:工厂停工，商店关门，政府停顿，股市无法交易，有钱人拖家带口奔向海外，本地老百姓急于把货币换成食物，许多家庭更是在门口张贴标语表达诉求，街上充满着爆炸物残留的火药味，人们大都无所事事，成天酗酒，打牌，青少年儿童成群结队去讨钱，整个国家仿佛陷入了崩溃	未
啊，求助帖！我的平板会在视频播放得好好的时候，突然跳出搜索界面，但是我并没碰它一根手指。持续好久了，咋回事啊	未
啊//@油大的YUDA: 哎。。。	未
啊 游侠君的小心脏被暖到了 (via reddit)	未
啊//@电影费洛蒙: 赤裸裸的诱惑//@可以给我打钱吗:明天就去吃火锅！！！//@两色同学:看饿了//@找图少年:哈哈哈哈哈哈哈//@米其林海星大厨:哈哈哈哈哈哈哈哈哈沙雕	未
啊翻红了	未
啊！//@老狼的羊蹄子:飞速赶来！//@miss水:哇//@吃土部部员枕头chi:还是会去商场！吃饭！//@眼瞎活该没钱赚的一棵菜:宜家终于有商城了！！！//@蛋黄酱盖饭: 好//@大几几几: ！！！！！//@法拉第笼塔: 耶！	未
啊自首了	未
//@啊蛮蛮啊://@林需药:[黑線]	未
啊//@財布桑:什么毛病不内撕会死是怎么的，咋地我们这些挺华为的女性因为名字没挂女权就被开除女籍了是吗//@裴屠最不喜被人盗号:有意思，尽管我出声了几天了，但这个时候就成了女权无一人出声 ，这个时候还要玩一玩对内，我倒想知道:我这类经常被扣上田园帽子的到底在你们眼里支不支持女权	未
啊还是有几个会念错。。。	未
啊！这该死的无处安放的嘴欠	未
問題不是沒人記得 而是沒機會8	未
啟事  李陽公益題寫匾額（2018年11月题写名单公布）	未
啤酒倒进食盐里，不看可惜，每个家庭都用的到，为家人收好！	未
啤酒倒进食盐里太厉害了，解决了很多家庭的烦恼，为家人收藏！	未
啤酒倒进食盐里，每个家庭都用的到，为家人收好！	未
，啤酒妹 Madison Beer 在西好莱坞出街前往 The Delilah 餐厅。	未
啤酒妹Madison Beer第二波海滩度假照 -	未
啥，At the end of a long escape是她作词的//@游戏时光VGtime:	未
啥//@ChulYang://@Bubble泡泡酱://@77应该已经疯了://@马玉兰还在害人: 第二张图就看得我头皮发麻！！！！！	未
啥也不想说了，今天中午12点重开	未
啥也不说了，先点个赞。@NanNanSpecial传销窝点	未
啥事局长们上台宣讲，群众来了一大院子！	未
啥人都有！涿州网友讲述奇葩经历！你遇到过吗	未
啥！你娃这么大啦！我之前以为是你妹妹[Aloha]	未
啥几把胡说，不同规格甚至同批次不同个体的肌间脂也可能有差别，三倍体虹鳟跟大西洋鲑去皮切块基本无法分辨。视频中这种没见过世面的东西少出来丢人现眼//@直男和狗:@开水族馆的生物男 水哥这样是正确的吗	未
啥创业失败客户要负责的意思//@颜文字君:这逻辑我没懂，拉客户垫背子)//@江南大野花:一个白眼，想上演什么患难姐妹情深//@天真爱丽丝:哈哈哈哈不然呢 给你陪葬吗 //@扶南:哈//@北美小桥段:我瞎了么，这说的是啥//@专业戳轮胎熊律师: 什么傻屌思维	未
啥叫两口子（建议夫妻都看看）	未
啥吉林垫底都不如新疆西藏认同吗	未
啥哈尔滨市民贷款6000元，却前后掏出18000元补6000元的窟窿，结果本金竟然一点没少！借贷宝客服：你赶紧报警！	未
啥型号的车	未
啥子事今天，一大波网红都对资阳这些地方进行了直播	未
啥小丑不小丑的，乐呵乐呵得了	未
啥情况，34家主流媒体报道邻水！	未
啥情况?偃师这个广场围满了人	未
啥情况出租车司机朝孕妇吐口水 因着急交接班杭州爆料 据@19楼网友 爆料：近日，通过滴答平台叫了一辆出租车，路上因为交通堵塞问题司机一直在哪骂骂咧咧，之后司机问我怎么走，由于在打电话告诉他说:我不知道，按导航走吧。到达目的地之后由于拿的东西多，我说下车付款，然后司机就一直催，自己回了一句:这么急不要接单，司机居然就走过来之后朝我脸上吐了口水，自己气不过也打了司机的头，因为有人在看，司机骂骂咧咧的回了车上，自己小腹已经在坠痛了，知道孕期生气对宝宝不好，尽量控制自己的情绪，但还是被惊到也气到	未
啥情况北京路边，一网约车司机盯上充电桩，竟然是为了	未
啥情况巨鹿救护车开进邢台火车站，还有警摩开道护航！	未
啥情况德化尚逸影城大门紧闭！会员卡里还有钱的，赶紧看看	未
啥情况，漳平万成来了一只酸奶牛，它是只什么牛呢12月3日(星期一)上午亲临现场有免费试饮！！！	未
啥情况男子冒充中国美院主任授课 还以美院的名义颁发结业证书杭州爆料 据网友@JDorKL 爆料：一名名叫王笑野的男子打着中国美院主任的名义开班授课，还以美院的名义颁发结业证书。但这个人根本和中国美院没有一点关系，据@19楼 调查，@中国美术学院 回应没有这名叫王笑野或者倪静的教师或者任职人员，美院人事部也明确答复可以报警处理。美院没有跟任何机构合作，根本没有王笑野所谓的美院直属培训项目。@中国美术学院 @杭州网警 @杭州公安 求查证！城市V聚力	未
啥情况网约车司机闭眼开车，睡着了客服：不可能	未
啥情况这个部队的军官退役仪式在企业举行	未
啥情况?金坛这个地方发生什么事，竟然出动了直升机！	未
啥情况 金牛区小学生校园里骑着摩托开着车	未
啥情况面包车超载被查，交警却带头为乘客捐款	未
啥意思。	未
啥时候也能这么近	未
