别怕，他们很快就老了//@张效羽:看结构，31岁以上只占14，22岁以下占40。这也可以解释为何微博舆论持续低幼化非理性化反智化，因为微博主体是低龄缺乏社会经验人群//@八大山债人: 转发微博	未
别怕，我们和你在一起四川兴文地震 珙县共青团组织的志愿者们下午15：40左右到达震区兵分2组入户，徒步入户共计35余户，救助被困老人2人，疏散群众100余人，志愿者们连续奋战5个小时，没有时间休息现在继续在安置点搭建帐篷，让受灾群众尽快住入帐篷，并为群众们发放物资志愿者们，辛苦 ...全文	未
别怕！杞县的农民工兄弟们，市里已经出手了！	未
别急 你一定会找到一个最偏袒你的人	未
别急！别慌！铁骑蜀黎会争分夺秒送你就医	未
别急！广东九价宫颈癌疫苗，明年供应将缓解	未
别急！我告诉你当发票错开时怎么办	未
别急着洗车，这天气憋大招儿呢！周三就来	未
别怪我没有提醒你	未
别总把生活拍给别人看一个27岁女孩临终前的忠告	未
别总是为了蝇头小利斤斤计较，也别总是对旁人的看法过于看重	未
别总是把自己困在过去，你还有许多未来，等着你来自定义。运动V势力	未
别惊讶！标普500指数近半成份股已跌入熊市尽管美国股市标普500指数尚未陷入熊市领域，但近半成份股已跌入熊市。受全球经济增长忧虑打压，标普500指数周一一度下挫达1.89，之后才扳回跌幅，逆转收高0.18。但该指数12月迄今累计跌幅4.44。标普500指数自10月以来就处于许多投资人所谓的修正领域，自高点已跌10或更多，但跌幅尚未超过被普遍视为熊市定义的20门槛。别惊讶！标普500指数近半成份股已跌入熊市	未
别想什么对方给你个说法或者道歉，人渣永远不会觉得自己是错的，先闪人再法子还击，腾讯今天的瓜也很大啊//@天狼星alpha: 呵呵这愿望。。我在想万一什么时候国家咸蛋疼，是不是划出一个城市来恢复到明朝宋朝的（各种制度）玩玩，大型集体官方穿越现场啊（大狼，起来喝药了）	未
别想骚扰司机！深圳这些公交车试点安装隔离门！	未
别慌，主力和你一样迷茫	未
别慌玉米跌了，过一段还能涨回来！	未
别懂事太早，别涉世太深，别爱的太满，别睡的太晚，别吃的太饱，别对人太好，别信的太多。	未
别懂事太早 别涉世太深 别爱的太满 别睡的太迟 别吃的太饱 别对人太好	未
别扎堆！南宁这些人的缴费业务，可延至明年1月底办理临近年底，在南宁市社会保险事业局服务网点一些办理社保费业务的窗口，不少市民扎堆缴费。工作人员表示，办理2018年灵活就业参保人员社会保险费缴费业务可延至2019年1月底，请市民错峰缴费。网页链接	未
别扑空！大庆这13家A级景区暂停营业	未
别打架斗殴	未
别找了！压缩机常见故障原因与操作，在这里.......	未
别把国内学术会议搞成面子工程	未
别把宽容和忍让， 当成应该	未
别把我的忍让，当成理所当然。	未
别把最爱你的人当成情绪的垃圾桶，无论你心情多烦躁。做个温暖的女孩，温柔地对待这个世界，并被温柔相待。	未
别把爷爷逼急了	未
别把辛苦钱拱手送人！多看一眼这个视频准没错！	未
别抱幻想，治霾还将长期靠风什么时候我们才能不管有没有风，都不会出现雾霾呢冬季在不利的气象条件下出现雾霾，这种局面我们暂时是改变不了的，大家不要抱幻想国家城市环境污染控制技术研究中心研究员彭应登对财新记者表示 别抱幻想，治霾还将长期靠风	未
别抱怨驾考太难，看看印度的S弯，不光窄还得倒回来！	未
别担心，一切都会朝着你预期的方向变好的！	未
别担心 我可是混世魔王啊你快去保护你的小公主吧	未
别担心，遇到困难时，蜀黍一直都会在你身边！	未
别拦我，我去偷小孩了	未
别拦着，我要去常信院穿刘亦菲同款，看成精的树木穿毛衣！	未
别拿你脏手碰朕的小熊 ( )	未
别拿保险不当事儿！没想到一张保单意义居然这么大。	未
别拿弹视频的速度，来挑战姐把你拉黑的技术。	未
别拿弹视频的速度，来挑战姐把你拉黑的技术	未
别拿独生子女说事儿！独生子女像你这样对待老人的真不多！这么大了还说混帐话，怕是个个傻子吧！当然，从小的教育估计也有问题！独生子女就是要啃老	未
别拿生命开玩笑，17名幼童塞进9座面包车 ，面包车不是营运客车，更未取得校车资质	未
别拿自己的生命不当回事！开车的都看看吧！	未
别拿顾客脚臭当成你不想上钟的借口	未
别挤好不好 微博视频	未
别搞砸你们的团队文化！	未
别搞错了，这不是去抢别人地盘是解决自己内部问题关那些外人鸟事！你以为人家吃饱饭会去管这名不正言不顺的事就跟你家里兄弟闹矛盾分家产，你以为外人会站出来对你这制裁那制裁放屁！它们只会在边上煽风点火不嫌事大看热闹！//@ZKBS我:然后欧美日印介入！经济封锁，经济制裁，房地产崩盘，经济崩盘	未
别撩了，我懒得回	未
别整反了	未
别整那么吓人，咱中国的中国癫痫诊疗指南.2015年修订版，怎么说的其他国家的指南呢为啥美国的指南要无条件接受//@帅炸的小陈:2015AmericanHeartAssociationGuidelinesUpdateforCardiopulmonaryResuscitationandEmergencyCardiovascular Care//@飘之队-唐朝:你们老是说指	未
别昏昏沉沉的了，今天才周二！	未
//@别沐橙7:还有倒拿话筒的时候 查看图片	未
别沮丧，女孩子下半身减的慢，正常//@丿后来时光里的背影:看了您昨天的话题问答，从11.5号开始在家用哑铃，阻力带，沙袋这些做小重量无氧，配合6.5速度跑步机快走，期间没称过体重，今早空腹称了一下体重和之前一样，但是腰围小了4cm，臀围小了3cm，大腿小腿纹丝不动，还是很沮丧	未
别活在自己的小世界里	未
别活的跟支烟似的，让人无聊时点起你，抽完了又弹飞你。记住，你要活的和毒品一样，要么不能弃，要么惹不起。	未
别犹豫 转走会有让你欢呼的好事发生	未
别猜了，他就是不爱你。	未
别玩了 回家背稿吧！	未
别用了，这东西已被禁8年！从化几乎家家都有！	未
别用了！这东西已被禁8年，伤过很多人！怀集很多人家里都有	未
别用了！这东西已被禁8年，冬季致很多人受伤！	未
别用了！这东西已被禁8年，河南几乎家家都有	未
别用了！这东西已被禁8年，致多人受伤！快看你家有没有	未
别用了！这东西已被禁8年，致很多人受伤！你家或也有	未
别用了！这东西已被禁8年，致很多人受伤！很多人家里都有	未
别用了！这东西已被禁8年，致很多人受伤！镇江新区几乎家家都有！	未
别用了，这东西已被禁8年！顺德几乎家家都有！	未
别用生命去夜屎桂林2男子围观车祸凑热闹，结果一死一伤	未
别白跑！门头沟这些景区封山停业！扩散提醒	未
别的不论，马鹿洋子和凯西这硬度是足足的	未
别的不说，法国警察的装备真好啊。。。那么厚的护甲，那么瓷实的头盔，那么得劲的防爆盾。。。忍不住想问一句：FUZE 干员，一起去救人质吗	未
别的女生撒娇VS你老婆撒娇...	未
别看不起眼，人家也能翻出浪来	未
别看在挪威，那也是中国造	未
别看它个头小，云城这条村54户农民将靠它脱贫致富！	未
别看就个小事，还真是件难事。全国还有多少机场火车站和地铁之间，在进行费时费力而且毫无必要的重复安检	未
别看我一身肥膘，要是真有人和我打起来	未
别看我好像挺瘦的。。我12周建卡时营养科的评估是隐性肥胖13周做NT检查的时候，医生和我说，你是不是平时老锻炼啊我：没有啊，我基本不动。她说：你肚皮透声性不是很好，感觉有很多肌肉。我：或许你说的是脂肪她说：不是吧，你看起来这么瘦，很多胖的女孩子才这样。我：我就是脂肪她还在努力为我挽尊：那可能是肌肉加脂肪的组织吧。	未
别看我默读出了哪本就第一时间立马下单买了哪本，实际上它们至今还躺在我的书架上落灰快递包都还没拆。	未
别看芬兰小，造起武器来一点都不差，这辆装甲车一点不比美国差	未
别眨眼，比飞机还要快的超级高铁来了！怀集到北京不超2小时	未
别着急 你看这年复一年春光不必趁早 冬霜不会迟到过去的都会过去 该来的都在路上一切都是刚刚好	未
别着急，后面还有一大波，抽的不多算我输	未
别着急，是你的终究是你的。	未
别睡那么早，23:55准时来波红包！	未
别碰！弄不好你要养他一辈子浙江车祸现场一幕曝光！结局令人心头一酸	未
别碰！弄不好你要养他一辈子车祸现场一幕曝光！结局令人心头一酸	未
.别等不该等的人，别伤不该伤的心。爱上一个人的时候，总会有点害怕，怕得到他，怕失去他。不用等待的人，是幸福的。我们真的要过了很久很久，才能够明白，自己真正怀念的，到底是怎样的人，怎样的事。爱的时候，让他自由不爱的时候，让爱自由。	未
别等了你的齐天大圣在来的路上被别的猴子迷了眼	未
别 等 了（心酸的痛）	未
别等了！朋友圈疯传5条公交线延至沈阳南站，是！假！的！	未
别等你们的教练了	未
别等到戴上手铐的那一刻，才领会到赖的代价！	未
别等地铁了。我开电驴送你吧 ..	未
别等失去了，才知道珍惜	未
别管李易峰了 //@棉棉的游乐场://@钱串串个球:冲//@HaloXiaoXin__:回家了回家了//@草盐团子 :困了困了。	未
别紧张，尚未证实阿尔茨海默症是传染病	未
别纠结，生。//@很喜欢小时候的卡通片:纠结中。	未
别给我发60秒语音了20条成年人社交潜规则。	未
别缠着往事不肯走，别赖着曾经不放手。	未
别美化自己，你的乡亲们在pia县，不在省城！	未
别老盯着中国，美国自己才是控制芬太尼滥用的关键Even if China did the utmost in controlling illicit fentanyl， someone else will fill the need  most likely in the black market. Fentanyl is easy to synthesize. As long as the demand is high， supply will flourish. If you cut off	未
别自发号召了，不弄	未
别花冤枉钱，教你如何鉴别汽车假故障。！ 别花冤枉钱，教你如何鉴别汽车假故障。	未
别苛责“那块屏幕”了，它为贫寒子弟打开一扇窗还不够？	未
别被坑了，美容店大几百元的项目，自己动手10多块就能完成	未
别被忽悠了！你真的了解喀什吗	未
别被急救土方法坑了！9种正确的急救技能，人人都该会！黑龙江大庆一名9岁女孩的手指被防盗门夹伤，奶奶慌忙中采取土办法，用花椒面止血感染截肢你知道吗，这些急救土方法都是错的！人人都该会的正确急救技能关键时刻用得上，转存！	未
别被这张心理压力测试图骗了，眼见本就不一定为实	未
别让5年后的你瞧不起你自己	未
别让人生，输给了心情心情不是人生的全部，却能左右人生的全部。心情好，什么都好，心情不好，一切都乱了。我们常常不是输给了别人，而是坏心情贬低了我们的形象，降低了我们的能力，扰乱了我们的思维，从而输给了自己。控制好心情，生活才会处处祥和。好心态塑造好心情，好心情塑造最出色的你。	未
别让低质量的勤奋毁了你 最重要的是让一切变得有意义 知道自己想做的是什么 要的是什么 接下来才能拼尽全力地去做 这样才不会浪费自己的努力	未
别让养狗成“养患”	未
别让“内部竞争”影响故宫文创品牌	未
别让别人偷走你的梦想	未
别让想太多毁了你	未
别让“晚长”的孩子在等待中错失长高的机会	未
别让朋友圈，停滞你的生活。	未
别让“校服返点”成为商业贿赂的衣裳	未
别让生命，止于侥幸，请主动检测	未
别让老年人徒增烦恼 数字生活呼唤“适老化”	未
别让英雄寒了心	未
别让这些坏习惯，偷走你的时间	未
别让阳光大男孩成为暴力的保护伞	未
“别让雪冻住了您的雨刷器” 宁波雪夜11岁女孩为邻居留便条	未
别误判华为事件！三大财咖深度剖析背后逻辑与影响	未
别说了，给人家留点隐私！//@全国帅逼代表队队长:我认识一个，一暑假挣了一辆3系吧	未
别说了阿猪，我相信你。蓝方是什么已经不重要了，我都怀疑你贿赂了蛤蟆，居然可以逢赌必赢。因为怀疑你而吃的亏还历历在目，以后我逢猪必押阿荒也要加油噢，八火给他们颜色瞅瞅莫伊，到此为止了，蓝方的杂鱼们。	未
别说今早的雪不正经，因为大雪真的来啦......你关心的信息都在这！	未
别说你爬过的山，只有早高峰	未
别说话看图	未
别说这个吴宝春了，85度C不照样有人买。对岸演艺圈这种嘴巴有骨气的也一抓一大把。这些人为了人民币装死，这边的群众是真的失忆。	未
别说这康同学还真挺奇怪的从经济上看的吧. 加拿大外交官工资不很高，慢慢爬上去，最后也不差。进政府还要考试呢，也不要了。而且政府工作非常稳定， 一般也不会被炒，退休也很好了。 这人干到一半就不干了，去了个非常可疑的非政府组织当顾问，这单位也不解决过多少危机哪来的钱到处给人处理危机，还能给康同学发工资。(刚看了，著名的胡舒立女士也是这组织的董事）。也许真是好几处领工资的人。。。	未
别说雄安的就和四十周年没关系啊，雄安关系挺大的，迟早炒到雄安，每周一股冀东装备 sz000856[股票] 周一我给的时候考虑的时候就是四十周年的扩散，所以雄安的票还是可以留意，灵魂板我之前给了一个，你们可以看看。	未
别贪心总是想留住身边每一个人，Dont be greedy and always want to keep everyone around you.别让自己的热情最终烫伤了自己。Dont let your passion eventually burn yourself.	未
别费事了，30多年的老家伙，都飞着掉零件了，再升级也打不过歼15	未
别走错了！胶州三里河派出所搬新地址了！	未
别跑空了！今天起，梦园闭园！开园时间是	未
别跑空：因拆迁，牡丹区不动产登记主服务大厅已搬迁！	未
别跑错啦！市人社局这些业务窗口即将搬进政务中心	未
别躲了！出来自首！	未
别转myk这个锦鲤了，他给自己许愿的电台DJ 从13年许到18年都没实现，这个锦鲤一点都不灵的。	未
别转了，河南这个城市不限行！	未
别转了，河南这个城市不限行近日河南郑州安阳多地开始单双号限行，日前，一条许昌限行的消息说的是有模有样有板有眼，引起了广大许昌车友的恐慌和广泛转发，还好交警蜀黍立刻联系记者请求支援，许昌市交管部门授权当地媒体进行辟谣别转了，河南这个城市不限行	未
别转发了！泸州人朋友圈刷屏的小男孩4小时后，找到家人了	未
别轻易用基因编辑婴儿打开“潘多拉魔盒”	未
别轻易说出自己对未来规划实现了再说也不迟	未
别过来啊，我可是大货车啊微博视频	未
别逼他	未
别遇到一点鸡毛蒜皮的事情就一蹶不振，你才20多岁，你怕什么！	未
别那么没出息 处处留意他的消息	未
《别错把平台当成你的本事！》 当你身居高位，看到的都是浮华春梦当你身处卑微，才有机缘看到世态真相。 别错把平台当成你的本事！	未
别错过  宁夏机场公司招聘工作人员！学历要求低！	未
别问 在自杀的路途中了	未
别问广东人这些问题	未
别闹，跟我回家 微博视频	未
别骗我了。我就不会吸烟。也一直单身。	未
别骗我像骗个孩子，别爱我像爱个朋友	未
别骗我像骗个孩子，别爱我像爱个朋友。情感V时代 Dont cheat me like cheating a child.Dont love me like loving a friend.	未
别麻痹大意！掸北滚弄已拦截下男男女女数十人	未
刬袜步香阶，手提金缕鞋，比买股票强多了//@八大山债人: 真香。。。//@ISABELLE翠：投资一双gucci鞋，穿过两年之后卖闲鱼还能回本，中间收获快乐。投资一只股票，持有两年之后股价跌到，中间收获痛苦。很显然，买鞋更价值投资！	未
刮油清肠排毒，每天一碗，掉肉10斤！！	未
刮过乡村的杀猪风。	未
到2020年，全省未达标地级及以上城市 PM2.5年均浓度比2015年下降18以上都知道 到2020年，全省未达标地级及以上城市PM2.5年均浓度比2015年下降18以上地级及以上城市环境空气质量优良天数比例达到83.5地级及以上城市集中式饮用水水源水质优良比例达到97.6近日，省委省政府出台关于 ...全文	未
到2020年，全省未达标地级及以上城市 PM2.5年均浓度比2015年下降18以上都知道 到2020年，全省未达标地级及以上城市PM2.5年均浓度比2015年下降18以上地级及以上城市环境空气质量优良天数比例达到83.5地级及以上城市集中式饮用水水源水质优良比例达到97.6近日，省委省政府出台《关于全面加强生态环境保护坚决打好污染防治攻坚战的实施意见》，勾勒出四川打好污染防治攻坚战的规划图。据成都商报 摄影郭鉴 到2020年，全省未达标地级及以上城市 PM2.5年均浓度比201	未
到2020年河北每个设区市至少建1家互联网医院	未
到2020年 龙泉驿区规划设置二级以上医院10所在城市不断建设发展中，医疗卫生服务配套是老百姓十分关心的话题。为落实现场办公会会议精神，针对龙泉驿区提出的21个卫生健康工作有关问题，市卫计委积极调查研究商讨分析，加快推动相关问题解决，推动重大要求落地落实。截至目前，已解决问题15个，下一步，市卫计委还将针对医疗规划布局高端项目引进新城公服体系完善卫生信息化建设等正在推进的6个问题，进一步加强统筹协调，持续推进相关问题解决见效。到2020年 龙泉驿区规划设置二级以上医院10所	未
到2022年，重庆将新建成轨道交通70.51公里，涉及40座车站！	未
到2022年，重庆将新建成轨道交通70.51公里，涉及40座车站！有你家附近的吗	未
到2030年代中時，解放軍海軍可能擁有多達6艘航母。這樣一來，解放軍南海艦隊，北海艦隊與東海艦隊都各能有兩艘航母。	未
//@到上流击水:	未
到上海啦 明天开始录godlie今晚跟李震吃个饭休息一下	未
到东京太晚，没有公共交通能去酒店了呜呜呜 只能打车然后17公里花了600（俺不想活了已经	未
到东北看雪，不只有雪乡	未
到了一定层面与高度，你会认同世界是灰色的，必须用灰度管理模式，任正非与马化腾最认同的管理理论就是灰色管理理论非此即彼，爱憎分明这样思维的人很难成功	未
到了一定年龄必须扔掉四样东西 没意义的酒局 不爱你的人 看不起你的亲戚 虚情假义的朋友	未
到了冬天，食欲的存在感总是非常强烈，不自觉的贴上了一层一层抗寒的膘！！每天忍不住吃完烤肉涮火锅，回家站在体重秤默默流泪。可第二天醒来仍然投入美食的怀抱。最近，芭姐终于get到了一个方法既能大口吃肉还能减肥生酮减肥法，跟芭姐一样的无肉不欢星人需要了解一下！ 听说现在流行一边大口吃肉一边变瘦！	未
到了国外，还是吃麦当劳//@大仙儿是个蓝胖子 :原来如此！	未
到了，复兴号还是很快的，4个半小时到 北京北京南站	未
到了太原嘞明儿见果然最冷的还是帝都，哪个臭崽子说太原超冷的，结果本熊裹的里三层外三层像个熊一样的就过来了	未
到了，实在太凶险了，我们还没找到酒店 摩洛哥马拉喀什	未
到了年末，KPI还没有完成，压力山大呀	未
到了应该单独立法保护工作中的公交车司机的时候了。	未
到了斗智斗勇的阶段了 微博视频	未
到了某个地步你会发现，对别人的坏是没有任何价值的。。。希望坏人们早日领悟。	未
到了泰北就像到了云南，哈哈阿姐说泰国	未
到了 美国Fairbanks	未
到了 让我想想能锁在哪	未
到了酒店，在个鸟不拉屎的地方，拐进弄堂的时候，看到路口有个全家，放下行李箱，想出去吃个夜宵，结果酒店的电梯停了，来回出去看了三次，电梯就是停了，这才死心，不出去吃好吃的了嗯，我住五楼，能让我管住嘴的唯有懒了	未
到了，重庆最早的富人区！	未
到了额尔古纳，开始下雪了，这建筑，不知道的以为到了红场	未
到今晚24点结束//@深海_1874:天啦，才知道你有店铺。而且今天最后一天活动现在出门办事，下午回来买	未
到你不得不离开的那一刻，你也可以敲开天堂之门。	未
到公司了吗12月的第一个工作日，早安！成都爆料成都身边事	未
到农村去！竹山26名年轻干部到基层任职，快看你家乡去了谁	未
到北京出差今年第一次零下穿得多无所畏惧	未
到北京的第一件事是	未
到北方看不出谁没钱，到南方看不出谁有钱	未
到厦门过春节，购物不愁，大部分超市都会开门。	未
到台南的流浪狗園捐飼料順便玩狗	未
到后来真的不再去介怀的时候回头看很多事情其实早有答案 但该流的泪还是要流 该走的弯路还是要走 这样才能体会到重见天日有多快乐	未
到哪里申请快告诉我//@遗忘的抱抱我:老何可以申请低保了	未
到啦，分享一下蓝蓝的天空白白的云，外套可以脱了 微博视频 香格里拉 (Live版)	未
到啦 辛苦@TFBOYS-易烊千玺 查看图片	未
到地老天荒吧//@哈德门烟头:我们沙东到底要被你消费到什么时候	未
到场馆啦遇见这个坐着轮椅的无情旁边就能看到我w 今天没摊位相见是缘	未
到处陷阱不可怕，怕的是很多人在找这些陷阱	未
到大连1小时，到北京3小时！这不，又要打通中韩陆海空大通道	未
到家了，一会两点去机场飞长春。	未
到家后在车里发呆的你，究竟在想些什么	未
到宿迁赴一场真正的佛系旅行	未
到山东只要40分钟！渤海海底隧道开始规划..	未
到年底了！这些事一定要注意！关系到你的钱袋子	未
到广南县医院新生儿科领养弃婴真相是	未
到底什么情况//@衣锦夜行的燕公子:天哪，看着好难受啊	未
到底什么样的酒店，才最中国	未
到底什么算精日南京这个条例给你答案！	未
到底取消的是哪些高速省界收费站还收费吗	未
到底吃什么才能明目猪肝蓝莓还是胡萝卜	未
到底哪个对明天要考了//@Lee-Ser：明明是反馈调节好不好//@Winters温上尉：供给侧结构性改革//@拉玛西亚胜负师:主要是发现舔狗产量不足了	未
到底归谁管！路面坍塌现10余平米大洞！通州居民盼早修复！	未
到底是不是侵占中国领土？删掉历史书里这句话，就能改变历史吗？	未
到底是什么驱使着你去送礼  社论前沿	未
到底是多爱阜阳一小区地下室晚上还有人打牌	未
到底是战斗民族，火灾现场救出来的猫都和别人家的不一样	未
到底是民宿还是别墅	未
到底是环保局的工作人员造谣，还是当地政府抓了烧燃煤的人，自己判断吧//@敦煌郡公:转发微博	未
到底是生育或不生育才会对女性有更多一点的健康	未
到底是直播源卡还是up主卡啊	未
到底是觉得他有叫小姐还是我的错不相信他	未
到底是谁借给了青少年这种勇气，通山人你遇到过没	未
到底是谁制约了物业公司的发展	未
到底是谁开了第一枪？揭秘俄罗斯与乌克兰的千年情仇	未
到底有什么事瞒着我	未
到底有什么区别呢 看完就知道啦	未
到底有多重要	未
到底要不要告诉她	未
到底该不该转行这里有9点建议	未
到底谁是一本正经的傻逼//@押沙龙:这个文章拿你献没献过血来堵别人的嘴，真是蠢到家了。每个公民都有权批评公共政策。不然的话评论国防开支，你当过兵么评论官员制定的政策，你当过官儿吗这不傻逼吗	未
到底谁是妹夫解说称麦金尼是库里妹夫	未
到底谁是方舟子//@xiongyongqiang:果然人渣都抱团_//@奥卡姆剃刀://@疫苗与科学:哈哈，你一个吃瓜群众，根本没有影响力，疫苗企业怎么会和你有利益相关我不加狗头，你真当自己是根葱啊//人渣碰到较真的居然好意思说是调侃 查看图片	未
到底还是拉手了！孟美岐何炅拉手作捂脸害羞状	未
到底还是翻车了	未
到底还有多少条轻轨线要经过渝北！	未
到底选啥//@一伊:科技V生活 _//@蚁工厂:不会的选C	未
到建宁，重温红军反“围剿”	未
