@司马3忌 @所有水军狗军快来围观啊，你们的水狗司令死马山鸡实在太丟鸡啦@马延明先生 专程到了你的地盘杭州专门到了你的楼下专门到了你小区派出所，只是找你对质，你却这样当缩头乌龟，连马先生人都不敢见，还假称去淮安买家具去了淮安可是周总理故乡，你别丢他老人家脸了，赶紧换个地方， ...全文	未
司马义·艾买提是谁?这名字在新闻联播里再也听不到	未
司马义-艾买提 这个名字你在新闻联播再也听不到了	未
司马义·艾买提遗体将安葬于乌鲁木齐烈士陵园民族区	未
//@司马子潇潇e:世界第三极，人类最后一片净土。	未
//@司马子潇潇e://@公路美学-:一大批银行柜台人员会下岗了。	未
//@司马子潇潇e://@军事历史之古今评谈:转发微博	未
//@司马子潇潇e:区块链本无不好，现在的问题是被疯狂了。	未
_//@司马子潇潇e://@卡尔超越理想:这些买假药应枪毙！这都是救命药！能乱搞吗	未
//@司马子潇潇e:对了哈//@一个院长的思考:看过这位102岁老奶奶跳伞，估计以后不会再有人敢称老！	未
//@司马子潇潇e:年底，严防年报地雷。//@曹中铭:绕开年报地雷 要看这三招	未
//@司马子潇潇e: 张育军楼继伟项俊波也进来了是金融还是段子王 //@牛市sky:换个话题聊吧//@苏世山价值投资:怀念肖光了//@小散首领:@侯宁 @苏世山价值投资 @牛市sky @司马子潇潇e @股市股道 @斯麦尔博士 @飞行行天下 @血色军刀999 老师们看看品品	未
//@司马子潇潇e:老兵越来越少了，社会应该给予更多关爱。	未
//@司马平邦:	未
//@司马平邦: 转发微博	未
//@司马平邦:这里的视频平时很少看到，看过这些，你就会支持对暴恐分子除了严厉打击没有第二种方法。	未
叹为观止//@浙江的记者: 转发微博	未
叹为观止！镇江六旬老汉跟20多岁孕妇搞网恋，大着肚子两人见面了！	未
叹息！广西一26岁小伙挥刀自宫！5小时后才送医，还好接接上了！	未
叹息！绍兴东昌小学附近河中捞起一具尸体！	未
叼着小鳄鱼上沙发玩儿 微博视频	未
吃//@Tiger公子://@Edwin埃德文: 刚刚图片拼的有问题，现在已修正	未
吃一周柿子会咋样？胃里长出4颗结石差点要了他的命	未
吃一堑，长一智。	未
吃下去的是外卖的饭，给出去的是健康税的钱	未
吃不好也睡不着 乌兰察布两名村委会干部主动向纪委监委投案	未
//@吃不胖的小5://@触手蜀黍:莫因恶人小而不抓//@尸姐: //@夏正正://@妖妖小精:转发微博	未
吃不饱怎么干活油灯报警后不加油会有什么影响	未
吃东西，尤其是有味道的东西真的不能忍，因为我也饿。。。一个人占两个座，明明可以把自己的东西放在地上或旁边非要占一个座，你累人家也很累，让别人有座位没有这么难。小孩子太调皮大人纵容不管的，嗷嗷叫也还能理解了毕竟小孩子有时候真的不好控制他情绪。但是小孩子拿Jio各种踢影响别人，在地铁上到处跑，首先安全隐患是个问题吧。外放零容忍，不想知道你在看什么听什么 在地铁上，你见过哪些奇葩	未
吃个农家饭	未
吃个午餐肉都是成都地铁的形状（图据网友）	未
吃个午饭啊@天才少年豌豆公主池 的一直播（下载App-gt网页链接）	未
吃个宵夜撞上在逃人员，穿棉鞋狂追一条街！	未
吃个宵夜撞上逃犯！确认过眼神，警察蜀黍穿着棉鞋狂追一条街	未
吃个宵夜撞上逃犯，穿棉鞋狂追一条街！	未
吃个晚饭聊会天@一枝南南 的一直播（下载App-gt网页链接）	未
吃个瓜，顺便科普。1.海关查验区是禁止拍照区域。2.图四的美赞臣婴幼儿液体配方奶是禁止入境物品。3.全球各国或地区的海关查验都是在履行国家职责，打击走私犯罪，守护国门生物安全，无论你是谁都应配合执法。	未
吃个饭也不老实，饭馆监控拍下这个！	未
吃了10年降糖药，血糖竟飙升三倍，55岁杭州大妈走不了路，只因少做了这件事	未
吃了一节甘蔗，台州女子下巴掉了，爱吃这个千万注意！	未
吃了个饭他丢了高管职位！老婆却天天和别人约会，最后还如此疯狂…	未
吃了四天健康食品，激发了我对垃圾食品强烈的向往。	未
吃了碗面，低糖生活。	未
吃了这么多年的菜薹，原来都是冒牌货	未
吃了那么多奶油 你知道天然奶油与人造奶油的区别吗？	未
吃亏要趁早！	未
吃人的水塘	未
吃入侵种，为生态分忧	未
吃内脏类凉菜配蒜碟	未
吃午餐了，领一个吃饭直接用。	未
吃午餐了，领一个当餐补用了。	未
吃，午饭了吗	未
吃午饭了，领一个当餐补了，最近的比较大。	未
吃午饭了，领一个当餐补用吧	未
吃午饭了，领一个直接用。	未
吃午饭喽，午饭早是因为早饭早，，， 微博视频	未
吃午饭用	未
吃吃吃食研室创始人殷俊：创业前期的几个思考	未
吃吃，看看味道如何//@闲翻书98977:买了。家里收到了，我还没回到家。	未
吃喝玩乐一条龙，连我都想去现场当个咸鱼	未
吃嘴帮帮	未
吃土101大赛怎样用10块钱在西政度过一天	未
吃土也要买	未
“吃土”包治百病，曾有人如此坚信	未
吃土吧	未
吃土津贴 双十一剁手不过瘾小佳暖冬基金如期而至，你是否准备与我相约现转发并关注@佳农-Goodfarmer @康佳冰箱洗衣机，12月8日康哥抽1人送100元现金。这个双十二拒绝吃土，力争做个果中贵族 佳农水果领鲜一步	未
吃土预警来了！这会吸完雾和霾你可能还得吃土	未
吃在你嘴里胖仔我身上	未
吃在信阳 找一个愿意陪你吃早餐的人吧	未
吃在重庆 工作日你的手机闹钟设了几点	未
「吃堂」这家在昆明开了25年的老字号，可能比你还老昆明	未
吃多少才是八分饱对你来说吃多少才是八分饱_______	未
吃大萝卜的人，都看看！	未
吃大量头孢，喝了半瓶酒！漯河一男子寻短见，城管出手...	未
吃大餐重庆生活	未
吃太少伤胃还伤脑	未
吃孟庭苇的瓜，结果被她12岁的儿子圈粉	未
吃完东西逛商场，我说商场这铃儿响叮当真是单曲循环没个完啊。店员翻了个白眼说，隔壁店一首病变从我穿短袖放到我都穿羽绒服了。	未
吃完了去超市了 微博视频	未
吃完午饭后，靠墙站10分钟。	未
吃完啤酒鸭，开车被查出酒驾鸭鸭:你把我灌醉，我让你心碎原来，当晚他吃了啤酒鸭，为了更好的口感，一共放了7瓶啤酒炖鸭子经过血液检测，最终杨某还是以饮酒驾驶机动车被处罚，吊销驾驶证6个月，罚款1000元美味清香啤酒鸭，自己学着做 啤酒不要加太多哦	未
吃完啤酒鸭被查出酒驾收藏关于酒驾，你一定要知道这些！	未
吃完啤酒鸭被查出酒驾酒驾的关键是血液中的酒精含量，至于酒精从哪里来，是喝的酒，还是吃鸭子喝的酒，不能成为免责的条件。否则，官员巨富必然以此漏洞任性酒驾！	未
吃完啦，信用卡也拿到了	未
吃完才发现雪糕已过期一年 会有便利店售卖过期一年的雪糕网友:在会有便利店买到了过期一年的雪糕，还基本上吃完了，让我这个孕妇的玻璃心都碎一地了！能不能给我个说法！我还觉得你们三寰糊弄人呢！！！！大连爆料	未
吃完早餐后跟师兄巴斯克斯去健身房打卡 皇马世俱杯 皇马 halamadrid 微博视频	未
吃完明瓦廊的易记再绕到旁边陆家巷吃项记，严格贯彻迟大使的方针政策。现诚邀皮肚面推广大使@迟斌 与地级市美食博主@叁叁肆计划 合作开发皮肚面探寻之旅，制定成熟的旅游路线。为了丰富主题，亦可邀请@南京先锋书店 的鸭血粉丝汤加入。携手并进，将南京非官方旅游宣传事业做大做强。[加油]	未
吃完晚饭又把病历啥的翻出来一顿看，看看淋巴清扫都扫哪了，是不是给我扫漏了，逐字逐句的品味病理结果，品半天也没品明白，后来一想医院给你咋治你就咋治得了，人家一个肿瘤医院的主任还不如你了你算个什么东西自己还会看病了想到这儿把病历又收拾收拾塞回箱子里了，然后走到客厅抓住高育良踢了两脚，踢的他满脑袋问号。	未
吃完核桃别扔壳，用水泡一泡，治病不花1分钱！	未
吃完饭散步消食路上碰到的大妈这就很厉害了	未
吃完饭要赶快把碗洗了！否则，10小时分裂10亿个细菌！ 	未
吃完默默自闭//@小羊爱吃酱肘子: 查看图片 //@吃瓜群众CJ:今天在家休息了一天什么都没干，拼命吃//@大神说:我本人哈哈哈哈哈 //@一起吃饭:太真实了吧	未
//@吃小诗敏的EGG://@来个甜甜圈吗://@简之未知://@Fwilliame://@LouiseStyles://@過期汽水:轉發微博	未
吃得苦中苦 方为人上人 ，我并不想做什么人上人	未
吃惊丨真狠！26岁小伙挥刀自宫！还有人往那塞针...塞酒瓶	未
吃惊丨简直疯了！男子为拍抖音，竟端起沸腾的火锅泼向了...	未
吃惊丨自己如胶似漆的未婚妻竟是丈母娘得知真相小伙	未
吃感冒药后开车“断片” 径直冲向路灯杆	未
吃手手，呲溜呲溜 微博视频	未
“吃掉”有机污染物 “消化”成无污染物	未
吃掉煎饼海绵宝宝 微博视频	未
吃掉配偶	未
//@吃掉驴子：密集恐惧症啊	未
吃斋有什么好处不吃斋有什么不好处宣化上人金刚棒喝	未
吃早餐，怎么能少的了红包	未
吃晚餐了，领一个当餐补用吧。	未
吃晚饭了，领一个当餐补用吧	未
吃根香蕉牙齿就松动了	未
吃橘子的注意了，现在知道还不晚！别忘了告诉家人！	未
吃激素、吃鸡睾丸？别被这些不靠谱丰胸方法忽悠了	未
吃点儿@天才少年豌豆公主池 的一直播（下载App-gt网页链接）	未
吃点啥	未
吃瓜围观	未
吃瓜大会新瓜：谁给了佛系男子当头一棒	未
吃瓜大会 来预告啦！今晚8点新一期大家久等的MVreaction，最近年末小哥们太忙一直没有时间拍，已经断更两周了，知道大家等得着急熬夜剪了 老规矩还准备了追星基金，懂我的意思吧！	未
吃瓜奋斗日，带你啃瓜吃	未
//@吃瓜姐妹社://@冷知酱://@瓜组兔区鹅://@圈圈每日爆料://@团子熊por://@一只炸宝:Fine//@高小里Maaya:好//@曼哈顿青蛙://@张斑斑的十九壶茶:多和自己喜欢的人在一起，家人，朋友，恋人，有趣的陌生人//@玛莉海--晴天 :Yep！还有回避找你传播负能量的人	未
吃瓜群众	未
//@吃瓜群众CJ:	未
//@吃瓜群众CJ: //@七百里加急递煎饼:为什么瓜田收获的时刻总在深夜	未
。。。。//@吃瓜群众CJ: 什么样的家长会送孩子去这种鬼地方//@江宁婆婆:8012年了，这样的邪教还有市场	未
//@吃瓜群众CJ:带字幕的采访视频来了	未
//@吃瓜群众CJ: //@当时我就震惊了://@Vista看天下:122位科学家发联合声明：强烈谴责首例免疫艾滋病基因编辑婴儿	未
//@吃瓜群众CJ:现场表演一个双标	未
//@吃瓜群众CJ://@芸豆和雨豆:这条也转一下，兼听则明。但依然认为量刑过重，希望轻判！	未
吃瓜群众上线	未
吃瓜群众！众球员推特调侃三方交易乌龙事件NBA记者Adrian Wojnarowski和NBA著名记者Zach Lowe联合报道，多位消息人士透露，太阳灰熊奇才的三方交易已经泡汤，关于这笔交易中太阳得到的究竟是狄龙-布鲁克斯还是马尚-布鲁克斯的问题双方未达成一致，灰熊不会把狄龙-布鲁克斯放进这笔交易中，最终导致交易泡汤。这场交易乌龙事件也引得火箭后卫克里斯-保罗爵士后卫多诺万-米切尔等多位球员发推围观调侃。克里斯-保罗：摇头。多诺万-米切尔转发了记者Adrian Wojnarowski的推	未
吃瓜群众：叫你平时少偷吃点就是不听！！！卡住了吧哈哈哈哈哈哈哈哈哈哈	未
吃瓜群众吃的什么瓜	未
吃瓜群众大讨论//@大连牙医老滕://@北京牙医苏建宏:你挂十分钟试试//@浑身正义:要我就硬刚//@北京牙医苏建宏::赤身窗外挂，手松香魂陨//@广州牙齿美容邹波博士:这是干嘛呢//@北京牙医苏建宏:我怎么总感觉好像是长发//@老马自奋蹄:生不带来，死不带走	未
吃瓜群众眼中的基因编辑婴儿事件	未
吃瓜群众表示看不懂	未
吃瓜《阿斯报》:阿扎尔已经与皇马达成协议，比利时球星愿意在明夏加盟。切尔西方面不会轻易放人，蓝军要价1.7亿欧元。	未
吃瓜阿斯报:阿扎尔已经与皇马达成协议，比利时球星愿意在明夏加盟切尔西方面不会轻易放人，蓝军要价1.7亿欧元	未
吃番茄要细嚼慢咽	未
吃的太饱真的不适合坐公交车，刚好今天周六乌央央一大车人，窗户禁闭空气稀薄还闷热，我在车上像一条快要搁浅的沙丁鱼，弱小无助又可怜。车一晃胃里一顿翻江倒海，好家伙要不是晚上吃的这顿烤肉太贵了我非得吐车上不可	未
吃的安全，放心，是消费者的最低要求，谁都不能打折。 月售千单的饿了么外卖店，其实连个执照都没有	未
吃碗面去机场	未
“吃”粉笔的老师——记曾在中国任教的西班牙语教师卡斯特多	未
吃素=不吃肉？你真的会吃素吗丨国际素食日	未
吃肉的时候没赶上，挨板子的时候一次没跑掉	未
吃苦，每个人都要面对的	未
吃蝌蚪吃蜥蜴，搞科研的谁还不是贝爷呢	未
吃货1-10	未
吃货互撩一人一句家乡话：你们那里管这个叫什么	未
吃货互撩你或身边人醉酒后发生过什么趣事儿	未
吃货互撩说一个你想去的地方，去过的人来讲讲。	未
吃货们马了试试看	未
「吃货历」11月25日  以后等公交 再也不用挨冻啦！	未
吃货心态崩了！小货车高速自燃 4000斤螃蟹葬身火海	未
吃货心碎瞬间！货车自燃 4000斤螃蟹被烤熟堆成小山	未
吃货 晚报菌的深夜食堂 饿了！晚报菌提问 你想和sei一起吃呀______ via.@杭州日报	未
吃货正在抢救一场重大事故	未
吃货江湖比雪花先开始漫天飞舞的圣诞大餐 我们为你挑了这5家进入十二月以后，帝都也已经遍地铃儿响叮当了。不论过与不过圣诞，圣诞都在那里。不必给节日附加太多意义，我们只是需要一个借口来享乐来团聚来纪念或者仅仅为了饱饱口福也无不可gtgtgt比雪花先开始飞舞的圣诞大餐	未
吃货注意！这有一份浙江台州农展会逛吃攻略！	未
吃货流泪：小货车高速自燃，4000斤螃蟹全烤熟	未
吃货流泪！小货车高速自燃，4000斤螃蟹全烤熟12月22日，沈海高速宁波方向宁海南收费站附近发生一起小货车自燃事故。司机杨师傅称，他从台州将大概4000斤左右螃蟹运往舟山，货车右后轮突然着火，一车螃蟹全烧光，损失10万元左右。目前，事故原因还在调查中。（都市快报）吃货流泪：小货车高速自燃 4000斤螃蟹全烤熟	未
吃货爆料吴吃堡街上的这家餐厅真壕！居然免费请人吃霸王餐！	未
吃货的世界里无所不能	未
吃货的天堂	未
吃货的日常	未
吃货的浮力//@爱拆快递的安妮: 下午开啦	未
吃起来啊 微博视频	未
吃辣条还是那一帮人 微博视频	未
吃过生态亏的赤水吃上了生态饭 还发起了绿色财	未
吃过红薯的人注意，现在知道还不晚	未
吃过这种泡泡糖的举个手。	未
吃进去的藻类氧化	未
吃遍长治 长治火车站旁的炒担担面大清早就在排队	未
吃那么胖，滚回家待着去	未
吃醋是女孩的天性没毛病	未
吃里爬外！台当局3天连扣3艘大陆渔船 台网友哀叹：对日本就从未硬气过	未
吃长治西火十大碗，你会发现有一直端不完的菜吃遍长治长治爆料 图@山西一飞	未
吃面会上瘾	未
吃面的时候，一位流浪汉在门口打开门，问：老板你好，我好几天没吃饭了，请问能送我一碗饭吃吗老板娘说稍等，流浪汉也许是怕弄脏店里，就在门口静静等着。老板娘进去打了满满一盒饭我看到上面还有上海的辣酱浇头。出去递给了他，我还隐约听到一声慢慢吃。夜凉如水，生活不易，兄弟愿你只是遇到了一时的困难。愿这碗饭给你再去相信的勇气，越过谎言去拥抱新的生活。愿好人有好报	未
吃韭菜盒子了（举报人 @杨帅ssy ）金州勇士汤普森	未
吃食堂也能减重26斤，我总结了3个要点！	未
吃饭了//@WHKLXXNM:今天大红包也太多了 查看图片	未
吃饭了吗晒一哈午饭	未
吃饭前开水烫碗专家：这样洗洗烫烫只是心理安慰...	未
吃饭，太多太少都伤胃	未
吃饭时千万别看他朋友圈！哈哈哈哈哈哈哈哈哈哈...	未
吃饭来个电话，整桌人全跑了！	未
吃饭用你们的家乡话怎么说	未
吃饭的时候该不该玩手机蜀黍要强调的是开车的时候坚决不能玩手机或者看手机！	未
//@吃饭__睡觉__打豆豆:后轮碾压颅骨及多处软组织挫伤	未
吃饭行情要来了？G20后首个交易日，这些市场全线飘红	未
吃饭装牛，遇上牛人服务员	未
吃饭路上@ChongSuKei_ 的一直播（下载App-gt网页链接）	未
吃饱了 微博直播	未
吃饱了撑着怎么办(    )	未
吃鱼也要挑挑拣拣	未
吃鸡卡不卡	未
吃鸡吃鸡，两组看谁先消灭对方 微博视频 pew pew	未
吃鸡玩成了江湖乱斗也是厉害的拳王出击秦王绕梁飞天神射还有啥招式是泥萌不会的鸡友们有什么独家绝招不，秀出来吓吓鸡仔绝地求生刺激战场	未
吃鸡雪地地图初评。	未
吃鸡黑百合 作者：AyyaSAP	未
各个场次的最新情况	未
各个官博我19号营业。我也19号营业！我们家也19号营业！十九号的微博，小宇宙一起来看是流星宇	未
各个段位的真实心理活动，大家是这样么（via：BeerGame）英雄联盟	未
各个路口都查！临漳公安局开展大清查集中行动！	未
各个都是段子手	未
各个领域常见的一些bug汇总	未
@ 各位初入职场的小白，你需要做好这些事情长知识近期，应届毕业生求职进入高峰期从学生到职员，角色的转换使每个人必须重新定义自己初入职场工作量大，难以适应怎么办如何在工作中实现自己的人生意义刚刚踏上工作岗位的你，赶快来看一下吧via@央视新闻	未
各位剁手党前两天双12买的东西到了没反正我的收到啦	未
各位，双12有什么可以买买的吗	未
@各位司机！哈密交警提醒！全面抓拍下列行为，注意安全！	未
各位司机注意！下个月起，这几天全国统一查酒驾！	未
各位哥哥姐姐弟弟妹妹大妈大爷仙女仙男们 看到这个狗头账号 顺脚踩踩我好吗	未
各位大连的宝宝注意了，7号不要君发布的一条远方音乐节大连站转发抽票的链接竟然不翼而飞了（也有可能是不要君夜游干的），总之由于不要君的疏忽对大家说声抱歉！为了弥补各位转发过微博的宝宝，只要符合条件（大连本地在校生）私信不要君并带上当时的转发截图，立刻赠票！截止10号当天上午10点哦！	未
各位天然气用户请注意，明日奉节这几个地方将会进行停气作业！	未
各位好友，想知道李四光到底预测了哪四大地震吗，请戳这里网页链接	未
各位 家中临时有事要出去一趟买个东西，今天直播顺延至明天哈 抱歉	未
@各位家长 千万注意！ 干燥剂处理不当 会有危险！	未
各位小伙伴：上周一和周四开的两个转发活动礼品 已被快递小哥哥取走 16个小礼物不成敬意 正在天南海北的路上冬日暖阳 北京中国气象局	未
各位律师们，法律爱好者们，各位朋友们，你们来说说，这个怎么结案呀	未
各位快收手吧，因为钓鱼我在医院躺了半个月...	未
各位总裁，我现在在免税店，很多人在排队，我想问下是不是不要钱，如果不要钱我也准备去排队了。	未
各位 我真的没走的我会每天上来打卡的126日滴小0在线卡	未
各位旅客：动车已从名山开到雅安，请做好准备！	未
各位旅客：您等候的CRH成雅列车已经进站	未
各位早啊 长春微视点	未
各位早安最近又开始降温了，各位召唤师们注意保暖不要生病咯。今日话题是，聊一聊你最喜欢的一首能够代表你心中 电竞 的歌，安利给大家吧。它可以是某赛季的主题曲或是出征曲，又或者是是选手们的歌单其中一首，听到哪首歌你能够想起英雄联盟电竞呢官博君的是 Hero - RookieampCool	未
各位毛迷，你们买的是哪一年的米兰球衣	未
各位玩家，现《战舰少女R》服务器出现了网络波动问题，我们已经在紧急修复并将尽快解决，我们会于明日发放相关补偿，给各位玩家带来的不便非常抱歉。	未
各位球迷都在上班上课的路上呢吧，今天天气真的是冷冷冷。简直冷爆了	未
各位用户： 今晚8点左右，亲橙里盒马店内一档口灶头冒烟，触发烟感警报。门店立即启动应急预案，迅速完成顾客疏散，无人员受伤。门店已于8点27分恢复正常营业。给您造成不便非常抱歉，尚未完成用餐的顾客可联系门店处理退款，或重新安排就餐。	未
各位留学生，你的英文水平真的过关吗来测一测吧！	未
各位看官，一直好奇酒店这红布干嘛用的	未
各位网友，说说您23岁的故事	未
各位老乡麻将玩还是少打，说的对对接！	未
各位老师er中午都吃的啥瑟瑟发抖中的蜀黍只能望图充饥了	未
@各位老板   请注意！电子营业执照来啦，还不赶快去下载！！！	未
各位读者：如果我不能继续为你们免费服务了，你们去找@来去之间 吧。我会很快推出其他平台的收费服务。到时候，相关平台的法务部门就有索赔依据了。煮老师：你准备好一点小钱。我肯定有机会让你出点盗版费的！	未
各位车主注意！城区又有10条道路局部封闭施工	未
各位都点点	未
各位金主爸爸们 最近有什么能挣钱的活动或者差事吗 什么工作都行临时工都行 只要能赚钱不违法的工作就行有多少就都砸向我 我可以24小时工作！感恩！	未
各单位注意！关于公车改革，国家做出新部署！	未
各县市区举报电话公布！如有这类问题，可拨打...	未
各国军警都有EOD拆弹人员，这基本可以是对这个职业的嘲弄了，而这个职业是需要至高的专业技能和奉献甚至是牺牲精神的，这个广告太煞笔，无论是不是外包广告，审核发布的肯定还是@凯迪仕智能锁公司。	未
各国国家队名单由该国管理员负责更新。不过您提出来了我一会也可以去看看能不能帮忙更了。	未
各国宇航局都准备开始营救钢铁侠了，作为航天大国，中国宇航局是时候出手了	未
各国对于是否塞入东西做法不同，不要塞入东西并不是一个医学共识，结合咱们国家的指南，讨论由什么人塞入，是否需要塞入，在什么时间塞入东西，塞入什么东西这些更有意义，塞入东西不是掐人中，顺便说一下我是中医黑，瞧我这讨人厌的各种立场。医生救人挺好个事，让你们弄脏了！	未
各国年轻人都在“黑五”血拼？错，月光族不再盛行！	未
各国星巴克价格竟差这么多最便宜10元就能喝到，中国价格算贵的了！	未
各国洋人基本凑齐了！1952年志愿军战俘营“奥运会”老照片	未
各国用汉字一字述年:2018年,这几个字"C位"出道	未
各国领导人之间是怎么通电话的？	未
各国高考轶闻：伊朗考生可报100个志愿	未
各地人事变动频仍 这一重要岗位8个省份都还空缺	未
各地出招管理电动自行车 立法明确登记上牌成趋势	未
各地加大举措让“文明养犬”渐成自觉	未
各地区各部门召开专题民主生活会，严明政治纪律净化政治生态	未
各地医保局密集挂牌 负责人背景多元化	未
各地各部门学习新修订党纪处分条例综述	未
各地建筑节能实施情况将迎“国检” 检查结果作为国家生态文明建设目标评价考核依据	未
各地整治干部用名贵特产谋利：宁夏贺兰筛查千元一斤的枸杞	未
各地整治干部用名贵特产谋利 这地筛查千元1斤枸杞	未
各地村民请注意 冬季一定要做好这七件事！	未
各地消费金融贷款增速有意识放缓，多银行互联网贷款外省业务停摆	未
各地物价涨势如何?涨得最多和最少的都是西部省份	未
各地物价涨势如何？涨得最多和最少的都是西部省份	未
各地环保头条	未
各地环保头条 12月12日，随着河北省最后一份入户调查数据经过审核提交至生态环境部电子政务专网，河北省入户调查数据入专网率达到了100。河北省依据国家普查数据入专网时序要求，完成了近18万污染源数据的录入审核与提交工作。污染源普查	未
各地的经销商注意了！12月底前，国家将加强对电动自行车生产销售等环节进行专项整治	未
