唐山身边事 唐山人注意啦！此处交通标志有变，千万别走错路站前路与新华道交叉口南侧，位于公交枢纽前的人行横道已经被涂抹取消，护栏原本的行人通道已进行了封堵。同时，交警部门在原人行横道南侧约50米位置设置了新的人行横道，供行人通行。使该路段机动车通行更加畅通，行人也更加安全。同时提醒，行人请经人行横道穿越道路，机动车遇人行横道请注意让行。	未
唐山身边事 唐山博物馆21日起，暂停对公众开放！因场馆改造，唐山博物馆自2018年12月21日起，暂停对公众开放，恢复开放时间另行公告。 给您带来不便，敬请谅解。	未
唐山身边事 唐山新体育中心的最新进展来了！唐山新体育中心位于南湖景区1号门东北侧，新体育中心项目包括一场两馆，即体育场游泳馆及体育馆三项主体工程，已于2018年3月3日正式开工。两馆2018年底主体完工，2019年整体完工，体育场2020年6月底整体完工。	未
唐山身边事 唐山现代医院被查封最新消息：暂停该院医保服务12月6日，接到关于唐山现代医院手术台上加价的举报后，唐山市卫生计生委高度重视，迅速召开专项会议安排布置查处工作，12月8日上午，唐山市卫生计生委综合监督执法局立即行动，依法依规对该医院进行查封。	未
唐山身边事 唐山这家药店被医保部门终止服务协议！唐山市医疗保险事业局近日，根据群众举报，对唐山协和医药有限公司博爱抗肿瘤店进行了医保核查，发现该药店存在代划社会保障卡行为。经研究，依照《唐山市基本医疗保险定点零售药店服务协议》第二十四条第一款规定，终止与该药店医保服务协议。	未
唐山身边事 填补这个路段无公交的空白！唐山中心区这条公交线路调整为了填补河东路（龙华道长宁道）路段无公交线路的空白，唐山公交公司于11月29日对52路公交线路沿途部分路段进行调整。具体调整如下：	未
唐山身边事 @所有唐山人！中心城区马上要有城市书房，还是免费的！首家城市书房位于唐山市路北区建华道北侧河东路东侧金域蓝湾小区一期2-8号底商，未来，城市书房将逐渐融入唐山市民的精神生活中。开放时间，周二至周日9:00-20:00	未
唐山身边事 扩散！唐山中心区N多小区停气因施工作业，12月7日13:30开始，团结楼等小区和单位停气。	未
唐山身边事 扩散！在这个加油站买加油卡的唐山人速去退款，截止时间是12月11日，唐山市直机关加油站有限公司在《唐山劳动日报》刊发通知，因租赁到期，开始办理实名制退款，退款时间9时30分16时30分，退款日期截止到2018年12月31日。	未
唐山身边事 明后两天（2728日）唐山这些区域计划停电！快看有你家吗！	未
唐山身边事 绕行路线公布！唐山市区这段路半幅断交施工，工期约50天2018年11月27日至2019年1月20日，开平区马北路（唐马路大唐北郊热电公司）半幅断交施工，工期约50天。	未
唐山身边事 计划年底开工！新华道这段路要维修11月26日，河北省住建厅网站发布新华道桥维修北幅工程的招标公告，该工程计划于2018年12月24日开工，工期30天	未
唐山身边事 还记得震后唐山35万多间简易房吗你住过吗或经历过吗	未
唐山身边事 《雾霾天两米之外六亲不认！防雾霾5大方法哪种最管用》雾霾天两米之外六亲不认！防雾霾5大方法哪种最管用	未
唐山这个区任务清单及时间表公布！禁增工业园区动态出清此类企业...	未
唐山这些地方下午要停水！另外，这份黑名单公布，事关	未
唐山长河淤积严重，要求拆除所有手续不全企业。一刀切是否合理据中国之声《新闻纵横》报道：滦河水系主要分布于坝上高原燕山山地与河北平原，是河北省北部东部的主要水源，最终汇入渤海。长河是滦河的一级支流，全长110公里，在迁西县境内长56公里，流经该县所辖28个村。近日，河北省唐山 ...全文	未
唐山雪景 唐山又下雪了	未
唐山雪景 影像唐山 初雪下的煤医道	未
唐川任重庆市渝北区委书记	未
唐川任重庆市渝北区委书记(图/简历)	未
唐德：李晨拍《巴清传》是测试 未取消高云翔戏份	未
唐总扮猪吃老虎，他大骂FOMC，最后还不是双手一摊，我国政府不能干预市场，SORRY	未
唐播虎 唐播虎版2018年十大网络用语发布近日，国家语言资源监测与研究中心发布了2018年度十大网络用语。唐播虎amp秋香版的锦鲤杠精skr佛系确认过眼神官宣C位土味情话皮一下燃烧我的卡路里，你最喜欢哪个	未
唐朝女性真的只是以胖为美吗	未
唐杰忠子女为其遗产起纠纷 最终庭外达成和解	未
唐杰忠子女为遗产起纠纷 妹妹状告哥哥后庭外和解	未
唐武宗还搞过灭佛运动。//@盖饭星人: 僧人法琳曾说李唐是鲜卑胡裔，劝李世民崇佛抑道，太宗大怒，将其流放致死(初唐的名将李靖李勣苏定方薛仁贵裴行俭也多是汉人，到了盛唐府兵制废弛，才开始多用番将)//@洛梅笙:	未
唐河临县一满载10吨汽油的油罐车坠桥，其中一人被困... ...	未
@唐河人，这类行为构成犯罪，公安全力通缉这9名在逃人员，最高奖励9万元！	未
唐河县人民政府关于调整部分县政府领导分工的通知	未
唐河县委原李德成书记心驻唐河难说再见！附李书记短文一篇	未
唐河县安排2019年城乡居民医保费征缴工作	未
唐河司机速看！唐河高速路段易发生团雾路段公布！上高速千万要避开！	未
唐河司机速看：河南全省高速临时交通管制，无法上路行驶！	未
唐河家家都有的这东西已被禁8年，千万别用了！致很多人受伤！	未
唐河工资3000元左右的，2019就要面对现实了！	未
唐河文明交通志愿岗的微信聊天记录曝光！内容也太... ...	未
唐河村里天然气管道装在墙外的，赶紧都看看吧！	未
唐河经常发语音聊天的赶紧看，一定要警惕了！	未
唐河网友爆料现在花生收2.5元一斤，问年底还会涨价吗	未
唐河谁认识这个骑电动车的，忍不住曝光他！	未
唐河这位摩托车司机在马路上S型行驶，被交警拦下竟然发现... ...	未
唐洲雁到青州市调研政协工作	未
唐//@涂鸦日记Z://@黑月乱://@阿八布噜布噜:转发微博	未
唐烨执导话剧《我家门前有棵树》：讲述当代青年的故事	未
唐烨督导易地扶贫搬迁集中安置点建设工作	未
唐生智(1890年10月12日1970年4月6日)，字孟潇，号曼德，湖南省永州市东安县人1912年入保定陆军军官学校，毕业后进湖南陆军1929年任国民党政府军事参议院院长第五路军总指挥1931年5月宁粤对立期间任广州军事委员会兼军事参议院院长1934年12月兼任国民训练总监部总监1935年4月，被 ...全文	未
唐砖番外 澜儿，我还欠你一场婚礼	未
唐筛不等于糖筛易县孕妈妈孕期唐筛检查大解读！	未
唐舍娃，西安一名拾荒老人，十年前，2008年2月29日，他在拣破烂时，从拉土车倒出的土堆中无意间发现两块石碑，他从刻字上判断此碑属文物，当即选择无偿捐献给了国家。经鉴定，这两件文物为《唐故普康公主墓志铭》与道教五方真文镇墓石。他拒绝了考古所要给他的奖金，他连连摆手说：我不要钱，只要给我打个条子就行了。十年后，2018年11月18日，唐舍娃像往常一样拾荒时，看到垃圾台水泥台上有个黑色书包，将包拿起后发现里面装着不少东西，还有剩的馍馍，书包里装着3万元现金，这一次，他直接交给了警察。人活一生要耿直，就	未
·唐良智辞去成都市人民政府市长职务 罗强为成都市人民政府代理市长	未
唐蕃古道文物展在青海开展	未
唐诗中的名山，你知道几座	未
@唐酸酸SKI77 不会做衣服的厨子不是好老板。	未
唐鸭鸭心碎现场，垂头丧气鸭	未
唐鸭鸭走在人群中仿佛一个游客，帽子太有戏了	未
唔喺同斗门人讲笑！26岁女子婚后迟迟不孕原是男的！	未
唔明你嘅人，讲几多都嘥气！	未
唔知死梅州: 一男子无证骑摩托载人， 还在路上炫车技走S型， 知死么? 跌死奔汝...	未
唔//@脑海群岛环游记:.....//@瓜子和栗子:过分真实了//@徐林夕的617号瓮:	未
唠一唠丨到底要投多少份简历才能得到一个offer	未
唠叨一下即将逝去2018年的收获和遗憾。长春微视点	未
唠嗑....@汤圆Mamma 的一直播（下载App-gt网页链接）	未
//@唧唧咕咕咕:马了抄作业//@夏影 ://@花生酱加量_olo :先一下//@小仙女大鼻孔 :姐妹出来抄作业了！	未
//@唧唧子://@-喻白: //@扶招://@仟淮:/@加贝爱蟠桃://@吵死-: //@ALUK_江南_SHOOTER://@卖鱼倩二号摊:/@_向剛花_://@堂本刚的腿毛由我守护://@丨大姨太丨://@裆铺老板汤大咚:	未
唧唧歪歪 hello亲爱的少侠们，今儿想和大家聊聊在家里你有没有与梦幻相关的东西呢，比如周边，比如远古点卡等等，来秀一波呗恭喜@爱大蜜桃的隆隆获得本期300点点卡	未
唧唧歪歪 hello亲爱的少侠们，这天啊是一天天冷下来了，握着鼠标也是直哆嗦啊，今天想和大家聊聊，这个冬天什么东西和玩梦幻是标配呢 恭喜@猪猪宝比宝获得本期300点点卡	未
@唧唧歪歪翔：怀疑这家卖假酒的，江小白兑水似的	未
售价25.88-33.08万元，马自达CX-8上市之际，长安马自达领导接受采访时表示：虽然今年中国汽车市场很严峻，但是我们一点都不惊慌。只生产客户需要的车。马自达此前称不参与降价竞争，通过价值营销确保销量。11月马自达在华大跌42.8至19179台，1-11月减少8.9为25万台。网页链接	未
售价36000，进价40，央视曝光了！很多人买过	未
售价36000，进价40央视曝光了，很多人买过	未
售价8千多的防卒中quot神药quot实为保健品 成本300多元种种套路，各种表演，最终的目的就是把进价仅为345元的普通保健食品以8000余元的价格卖给上当受骗的老年人，真正的专家告诉我们，在这场骗局当中，老年人损失的不仅是钱财。	未
售价8千多的防卒中quot神药quot实为保健品 成本300多元种种套路，各种表演，最终的目的就是把进价仅为345元的普通保健食品以8000余元的价格卖给上当受骗的老年人，真正的专家告诉我们，在这场骗局当中，老年人损失的不仅是钱财售价8千多的防卒中神药实为保健品 成本300多元	未
售价不变全系减配，东风雪铁龙新款爱丽舍上市，售价8.38-10.48万元。全系取消驾驶员车窗一键升降，时尚版可选装电动天窗，同时取消后视镜电动调节后排座椅比例放倒。动力依旧1.6L自然吸气发动机。网页链接	未
《售价同国V车型一致 2019款昂科威国VI车型上市》。全系四缸机，好样的这句居然有些苦涩的味道 详细阅读点这里网页链接	未
售后/反馈/求助1我吃秋林里道斯红肠吃出塑料片怎么办啊（图1.2）我吃红肠的时候，突然吃到一个很硬的东西，我以为是骨头，就吐出来一看，发现是塑料片！我又放回到红肠上拍的照片，但是可以看到塑料片上还有红肠的肉，证明确实是红肠里吃出来的，不是我乱放上污蔑秋林里道斯红肠的！2之前我发过一次屈臣氏11.11秒杀的东西发的不对，现在客服说可以换货（图3）3你好毛，想咨询一个事情。双十一的。我买的保宁洗衣液，11月14日从天津发的货，到今天24日了，依然还显示在天津，联系客服也没给个明	未
唯一儿子在越战中殉国，歼灭敌方11人，如今七旬父母以收破烂为生	未
唯一区别是，局座的带套，我的不带套//@佳佳得乐36:两位都用华为保时捷//@高晓松:哈哈哈局座是我们节目的老看官了。与局座小聚聊聊军事历史，不亦乐乎。局座时隔40年再次喝到了北冰洋汽水！幸甚至哉，歌以咏志。	未
唯一在不断衰弱的常任理事国，未来地位很可能不保	未
唯一知道真相的千秀妍	未
唯为  赵括之为将也	未
唯利是图的人，也能为他人争取权利而战丨日签	未
唯物主义式怕鬼	未
唱完国歌士兵突然晕倒 马克龙方了	未
唱本中初知阆中，踏上这片土地方觉：良人如玉莫若阆中...	未
唱的还凑合吧，大冷天的也不容易。就帮他扩散一下 微博视频	未
唱齐天吗求票//@弱女子啊:看到《齐天》我就放心了	未
唾液不自觉就分泌了//@去日本吃什么:酸汤面，听着就很开胃//@彩虹:饿了，想吃啊//@偷蜜的大熊:转发微博	未
啃老指的是已成年具有社会生存能力的年轻人，还依靠父母或亲戚养活自己，在不断奶的状态下生存。是一种消极的现象。	未
啄木鸟因为要吃虫子，把树给啄了一个大洞，是有强迫症吗	未
啄木鸟将大厦外墙当成树 半小时啄了3个洞	未
商丘106岁独居老太种菜做饭，还能穿针引线：不给晚辈添麻烦12月3日，河南民权县，今年106岁的独居老人晁玉兰有三个儿子，为了不给晚辈添麻烦，她自己开垦菜园子种菜做饭她喜清淡爱吃素，虽然年事已高，但腿脚利索，还能穿针引线，给孩子们缝衣服，做棉衣商丘106岁独居老太种菜做饭，还能穿针引线：不给晚辈添麻烦	未
商丘6个贫困县要摘帽 就市级初审工作张建慧提出多项要求	未
商丘一女子驾越野车侧翻入绿化带被困！大雾天气，小心慢行！	未
商丘一少妇被陌生人拉上车，看完惊出一身冷汗！	未
商丘下周这些地方要停电，快看有你小区吗！	未
商丘人注意：这些取暖方式要不得，致很多人受伤，几乎家家都有！	未
商丘俩小伙吃饭不带钱，真有才	未
商丘光头哥同学聚会，到饭店一见，几个同学想找个地缝钻进去！	未
商丘全市动员 只为找一名军嫂	未
商丘又多了座一等火车站附近区域即将腾飞！厉害了大商丘！	未
商丘女子银行卡里27000元不翼而飞 一查竟是被儿子偷走12月16日，商丘市民权县的杨女士到银行取钱时发现银行卡里的3万元存款只剩3000元，杨女士一直将卡放在柜子里，只有她一人知道。杨女士遂怀疑其银行卡被不法分子盗刷。报案后，经过民权县公安局伯党派出所查询，发现盗刷银行卡的不法分子 ...全文	未
商丘家里有电动车的，都看一看！	未
商丘工学院关于印发《学生人身安全防范和伤害事故处理实施细则》的通知	未
商丘市生活垃圾焚烧发电项目建设用地征收土地公告	未
商丘市第二人民医院招聘124人	未
商丘教师路边捡到14万元巨款  十分钟不到将钱物归原主	未
商丘有孩子的家庭，要记住这个电话，关键时刻能救命！	未
商丘洛阳郑州...河南的都看看吧，别拿生命开玩笑！	未
商丘第二座五星级大酒店，希尔顿或进驻	未
商丘第二座五星级大酒店要来了? 快看在哪	未
商丘车主注意：油价又有新变化啦！四连跌	未
商丘这两条街区将受保护，评审已通过	未
商丘这哥们在车上接了老娘和闺女一个电话，被司机愤怒赶下车	未
商丘这处60辆车被拖走！具体咋回事	未
商丘锦绣家园业主怒啦：自来水长期间发黄黄！这水还能喝	未
商丘锦绣家园小区业主怒了自来水长期间断性发黄！这水还能喝	未
商丘高速交警开展冬季道路交通安全百日攻坚行动连查多起涉牌涉证交通违法行为	未
商业与科技的未来在哪里这4位大咖全说明白了	未
商业促销活动为何进了校园丨党风政风前哨	未
商业保险都给买的老板，还会不给助理买社保吗	未
商业化落地 谷歌自动驾驶怎么玩	未
商业印刷的老虎来了：合版厂收割传统厂，电商盘商快印店收割跑单中介。多出来的印刷机能去哪	未
商业银行年底大多时候是因为贷款收不回而被动成为了房主，所以选择打包出售。	未
商业银行扎堆“补血”， 交行拟发行800亿元二级资本债	未
商业银行理财子公司管理办法发布	未
商业银行理财子公司管理办法正式落地	未
商业银行理财子公司管理办法落地	未
商事登记豁免的制度逻辑与法理依据	未
商人杨幂造富史:登上福布斯 带迪丽热巴等人＂捞金＂	未
商人送100万“麻将基金”供这位厅官打麻将	未
商务印书馆出版“陈原小丛书”	未
商务听力How Tim Cook Makes and Spends His Millions	未
商务听力The Brexit Deal for Small Businesses	未
商务委召开溪翁庄镇2018年度安全生产培训会	未
商务部：11月份社会消费品零售总额增速有所放缓	未
商务部2018年第73号公告 2019年化肥进口关税配额总量、分配原则及相关程序	未
商务部：2019年燃料油进口允许量为1620万吨	未
商务部：WTO改革不能缺少任何一个成员的支持	未
商务部世贸司负责人就《贸易政策合规工作实施办法（试行）》进行解读	未
商务部：中方将会根据自身节奏出台改革开放的举措	未
商务部：中日韩自贸区第十四轮谈判在北京举行	未
商务部：中美90天磋商目标是取消所有加征关税	未
商务部：中美90天谈判中方将从这几项做起	未
商务部：中美不再对其他新的产品加征新的关税	未
商务部：中美举行经贸问题副部级通话	未
商务部：中美双方有计划在明年1月举行会谈	未
商务部：中美双方有计划明年1月就在更广范围实现贸易休战举行谈判	未
商务部：中美将根据磋商进展需要随时安排包括会面、通话等磋商活动	未
商务部：中美有计划在1月份举行会谈，近日副部级通话主要涉及贸易平衡等问题	未
商务部：中美沟通密切 正为1月当面谈判做准备中国将在明年3月底之前，实现在负面清单以外的领域，内外资企业在市场准入方面标准一致 商务部：中美沟通密切 正为1月当面谈判做准备	未
商务部：中美确有计划在明年1月举行贸易会谈	未
商务部:中美经贸磋商正推进 讨论了下次互访等安排	未
商务部令2018年第6号 关于修改《外商投资企业设立及变更备案管理暂行办法》的决定	未
商务部公告2018年70号 关于对原产于日本和印度的进口邻二氯苯反倾销调查初步裁定的公告	未
商务部公告2018年78号 2019年食糖进口关税配额申请和分配细则	未
商务部公告2018年第11号 关于原产于日本、韩国和欧盟的进口取向电工钢反倾销案株式会社POSCO价格承诺的公告	未
商务部公告2018年第40号 关于原产于美国、欧盟和新加坡的进口卤化丁基橡胶反倾销调查最终裁定的公告	未
商务部公告2018年第41号	未
商务部公告2018年第42号 关于原产于印度的进口间苯氧基苯甲醛反倾销调查最终裁定的公告	未
商务部公告2018年第43号 关于原产于韩国、台湾地区和美国的进口苯乙烯反倾销调查最终裁定的公告	未
商务部公告2018年第44号 关于终止对原产于美国的进口高粱反倾销反补贴调查的公告	未
商务部公告2018年第45号 关于终止对原产于印度的进口磺胺甲噁唑的反倾销措施的公告	未
商务部公告2018年第46号 关于原产于巴西的进口白羽肉鸡反倾销调查初步裁定的公告	未
商务部公告2018年第48号 关于对原产于欧盟的进口甲苯胺反倾销措施进行期终复审调查的立案公告	未
商务部公告2018年第49号 关于对原产于美国和日本的进口氢碘酸反倾销调查初步裁定的公告	未
商务部公告2018年第50号 关于原产于美国、沙特阿拉伯、马来西亚和泰国的进口乙醇胺反倾销调查初步裁定的公告	未
商务部公告2018年第52号 关于对原产于美国和欧盟的进口相关高温承压用合金钢无缝钢管反倾销措施发起期间复审调查的立案公告	未
商务部公告2018年第53号 关于对原产于美国的进口非色散位移单模光纤倾销及倾销幅度期间复审裁定的公告	未
商务部公告2018年第54号 商务部关于建立中央储备冻牛羊肉承储企业备选名录库的公告	未
商务部公告2018年第56号 商务部批准《商品交易市场建设与经营管理术语》等11项国内贸易行业标准的公告	未
商务部公告2018年第57号 关于对原产于日本、美国的光纤预制棒反倾销措施期终复审裁定的公告	未
商务部公告2018年第60号 关于对原产于日本、韩国、新加坡和台湾地区的进口双酚A反倾销措施进行期终复审调查的立案公告	未
商务部公告2018年第61号 关于对原产于韩国和日本的进口丁腈橡胶反倾销调查初步裁定的公告	未
商务部公告2018年第62号 关于对原产于欧盟、日本、韩国和印度尼西亚的进口不锈钢钢坯和不锈钢热扎板/卷进行反倾销立案调查的公告	未
商务部公告2018年第62号 关于对原产于欧盟、日本、韩国和印度尼西亚的进口不锈钢钢坯和不锈钢热轧板/卷进行反倾销立案调查的公告	未
商务部公告2018年第66号	未
商务部公告2018年第67号 关于对原产于台湾地区、马来西亚和美国的进口正丁醇反倾销调查初步裁定的公告	未
商务部公告2018年第68号 关于对原产于美国、韩国、日本和台湾地区的进口聚氯乙烯反倾销措施进行期终复审调查的立案公告	未
商务部公告2018年第70号 关于对原产于日本和印度的进口邻二氯苯反倾销调查初步裁定的公告	未
商务部公告2018年第72号 2019年原油非国营贸易进口允许量总量、申请条件和申请程序	未
商务部公告2018年第73号 2019年化肥进口关税配额总量、分配原则及相关程序	未
商务部公告2018年第76号 关于对原产于日本和台湾地区的进口立式加工中心进行反倾销立案调查的公告	未
商务部公告2018年第77号 关于2019年上半年部分反倾销、反补贴措施即将到期的公告	未
商务部公告2018年第78号 2019年食糖进口关税配额申请和分配细则	未
商务部公告2018年第80号 关于对原产于美国和日本的进口氢碘酸反倾销调查最终裁定的公告	未
商务部 公安部 生态环境部 海关总署 国家药品监督管理局公告2018年第83号 关于调整麻黄草出口管理政策的公告	未
商务部公布中国关于WTO改革三大原则五点主张	未
商务部公布中国关于WTO改革的三大原则五点主张	未
商务部关于《关于修改的决定（征求意见稿）》公开征求意见的通知	未
商务部关于印发《2018年度甘草及其制品出口配额第二次招标中标企业名单及其中标额度表》的通知	未
商务部关于印发《2018年蔺草及其制品出口配额第二次公开招标中标企业名单及其额度表》的通知	未
商务部：农产品、能源、汽车等具体事项中美双方已达成共识	未
商务部副部长王炳南对台商参与大陆经济发展提三点建议	未
商务部办公厅关于中国（浙江）自由贸易试验区开展保税燃料油混兑调和加工贸易业务的复函	未
商务部办公厅关于做好2019年度汽车和摩托车出口资质申报工作的通知	未
商务部原副部长：预计三至五年内人民币将成全球第二大货币	未
商务部反垄断局负责人关于《关于经营者集中附加限制性条件的规定（试行）》的解读	未
商务部、发展改革委有关负责人就《国务院关于支持沿边重点地区开发开放若干政策措施的意见》接受中央主流媒	未
商务部、发展改革委有关负责人就《国务院关于支持沿边重点地区开发开放若干政策措施的意见》接受中央主流媒体采访	未
商务部发布中国关于WTO改革立场文件 提出三个原则和五点主张	未
商务部发布《互联网旧货交易平台建设及管理规范》公开征求意见函	未
商务部发布吴相仁等7人职务任免	未
商务部合作司负责人解读《对外投资备案（核准）报告暂行办法》	未
商务部回应WTO改革	未
商务部回应WTO改革热点问题	未
商务部回应：不掌握有关情况	未
商务部回应“中美双方明年1月份举行会谈是否属实”	未
商务部回应中美磋商:对落实有信心	未
商务部回应中美经贸磋商热点：双方计划明年1月会谈	未
商务部回应中美经贸磋商热点 驳“中方重大让步说”	未
商务部回应中美经贸磋商等问题	未
商务部外贸司负责人就汽车平行进口试点情况接受中央主流媒体采访	未
商务部外贸司负责人谈2017年1-12月我国对外贸易情况	未
商务部外资司负责人就《自由贸易试验区外商投资备案管理办法（试行）》进行解读	未
商务部：对于仍然加征25%的关税 中美将朝着取消的方向加紧谈判	未
商务部：对原产于澳大利亚的进口大麦进行反补贴立案调查	未
商务部对原产于澳大利亚的进口大麦进行反补贴立案调查	未
