参考快评 美国新非洲战略落地，不看广告看疗效随着中国在非洲的影响力越来越大，美国终于坐不住了酝酿了一段时间的美国新非洲战略近日正式落地舆论注意到，过去两年，美国政府对非洲事务关注度有限，更多地集中在反恐事务上，并有意大幅削减对非援助美国这一次宣布在军事经济上 ...全文	未
参考快评 美国新非洲战略落地，不看广告看疗效随着中国在非洲的影响力越来越大，美国终于坐不住了。酝酿了一段时间的美国新非洲战略近日正式落地。舆论注意到，过去两年，美国政府对非洲事务关注度有限，更多地集中在反恐事务上，并有意大幅削减对非援助。美国这一次宣布在军事经济上对非洲战略的调整该如何解读呢 美国新非洲战略落地，不看广告看疗效	未
参考我的分析	未
参考文化中国海军的这个重大决定开创了历史十年前的今天2008年12月26日，是开创历史的一天。《参考消息》当年在头版头条记录了这一重大事件中国海军新锐出击亚丁湾。中国海军的这个重大决定，不仅关乎国家尊严，更直接关乎每个在海外中国人的安危。 中国海军的这个重大决定开创了历史	未
参考日历历史上的12月17日发生了什么距今113年的1903年12月17日，人类第一次飞上了天空！莱特兄弟制造的第一架飞机飞行者1号在美国北卡莱纳州试飞成功。1998年12月17日凌晨，由英美两国针对伊拉克发动的一场大规模的空袭行动沙漠之狐开始。	未
参考//@选股宝APP:slay了slay了！	未
参观也要门票，这家酒店为什么牛 全球海拔最低的五星级酒店开业	未
参访台中花博变风俗店之旅日市长：小姐脱衣我就跑了日本山口县美祢市长西冈晃本月初拜访台中花博，却被爆料出入声色场所，他日前紧急召开记者会，称自己不慎走入色情场所，起初以为只是普通的卡拉OK餐厅，却看到3名女子来到身边，对方甚至脱去衣服裸露上半身他强调，他没有道德伦理上的问 ...全文	未
参赛号查询确认2018福建土楼永定国际马拉松赛	未
参赛和观赛的小伙伴请注意保暖路面湿滑注意安全	未
又1名孩子死亡，建昌恶魔司机背景曝光，村民竟然说出这些！	未
又get一件新羽绒服，真不让人操心呢//@SixxxCoins:眼罩好像小宝宝滴口水兜兜	未
又一三甲医院有新进展！天府新区医疗资源将不再稀缺	未
又一个上当受骗的小朋友实力现身说法，@程翀的围脖 号称包治百病。新浪这个平台应该净化整顿这样的江湖术士。@曹国伟 @CCTV律师来了//@JoseyChane:骗子不要相信这个傻逼 @程翀的围脖	未
又一个免签！最新73个免签/落地签国家和地区全名单12月21日起，中国和卡塔尔关于互免签证的协定正式生效，卡塔尔成为第14个与我国互免普通护照签证的国家！73个免签/落地签国家和地区最新全名单 明年你最想去____	未
又一个关晓彤？北电艺考第七高考626分，家世更不一般	未
又一个内裤穿反的案例	未
又一个加拿大公民！目前，此案正在进一步审理中	未
又一个华为工程师倒下了，替遗孀转发。我想说，狼性不代表没有人性。	未
又一个吃出来的大病！第四高让1.7亿人深受困扰	未
又一个回国自首了！	未
又一个小国将对中国免签，曾因一座饭店震惊奥斯卡，如今却被誉为非洲小瑞士	未
又一个「岛国敢拍」，全程让人脸红心跳	未
又一个年轻女孩离世！记住，它们千万不能混在一起吃！	未
又一个年轻女孩离世！记住，这些东西千万别混用！	未
又一个搅局者：东风汽车拿到网约车牌照	未
又一个村主任被抓，看看你认识吗....	未
又一个没有分寸的。	未
又一个浙江城市来沪对接，李强会见，共商落实国家战略	未
又一个！百名红通人员蒋雷回国投案12月14日，在中央反腐败协调小组国际追逃追赃工作办公室统筹协调下，在新西兰执法部门的协作配合下，经中央有关部门和北京市追逃办密切合作，百名红通人员蒋雷回国投案。这是第55名归案的百名红通人员。百名红通人员蒋雷回国投案	未
又一个！百名红通人员蒋雷回国投案14日，在中央反腐败协调小组国际追逃追赃工作办公室统筹协调下，在新西兰执法部门的协作配合下，经中央有关部门和北京市追逃办密切合作，百名红通人员蒋雷回国投案这是第55名归案的百名红通人员@中国新闻网 网页链接	未
又一个！百名红通人员蒋雷回国投案14日，在中央反腐败协调小组国际追逃追赃工作办公室统筹协调下，在新西兰执法部门的协作配合下，经中央有关部门和北京市追逃办密切合作，百名红通人员蒋雷回国投案这是第55名归案的百名红通人员网页链接	未
又一个老板跳楼了 ， 你肯定认识！	未
又一个老板跳楼了，你肯定认识	未
又一个被抓，抄家现场，这么多钱你见过吗	未
又一个被捕，抄家现场，这么多钱您见过吗	未
又一个购物全返的盘被撸死，260万人欲哭无泪。丨无路可套中云动力	未
又一个陶企跟央视签约了，看看他们要搞什么！	未
又一中央级媒体调研集成改革江阴样本！	未
又一“京字头”律所落户南京，南京执业律师已超 6500 名	未
又一代购落网！留学回国携带35万物品，21块名表，海关现场刑拘...	未
又一代购落网！留学回国携带35万物品，海关现场刑拘	未
又一企业出售旗下照明业务聚灿2亿元增资子公司兆驰拟回购公司股份  行业动态	未
又一位明星从霍尔果斯撤离	未
又一位晋剧女包公，高手在民间	未
又一位陪读妈妈气到脑梗：在虐惨80后这件事上，00后赢了	未
又一先进事物！麻涌首家儿童健身房挤爆了！	未
又一公交车事件，这次，群众出手了:请记住，这世界你并不是独自一人	未
又一冲击波  公安再次开展大清查，数字背后有看点......	未
又一区块完成销号！截止目前 ，城中村签约完成了多少看这里！	未
又一区间贯通！石家庄地铁12号线最新进展！看看经过你家没	未
又一只锦鲤诞生！在春丽吃饭公司吃煎饺抽到了尖叫之夜的门票果然蔡徐坤的粉丝运气都不会差，你与爱豆的距离就差一张尖叫之夜的门票了。春丽吃饭公司打卡抽门票吧，晚了可就没了	未
又一名从远安走出去的千万身家企业家，快戳进来看是谁	未
又一名“加拿大人”被处理 是位中国贪官(图)	未
又一名华为工程师倒下了。昨天，华为驻肯尼亚代表处的数通工程师齐智勇的妻子，在网上公布了他丈夫的死讯。他太需要休息了。	未
又一名在逃人员落网！歌神张学友年底再助攻	未
又一国家对华为转身！纠正针对华为手机的错误做法	未
又一地公布补贴，本月起发放！请仔细看看补贴流程（附咨询电话）	未
又一地出手治理养犬乱象：河南全省限养区禁养这50种狗近日，《河南省限养区内禁养犬只名录》（征求意见稿）公布，规定限养区内禁止饲养犬只名录，包括秋田犬中华田园犬等约50种。若违反规定，由公安或具有城市管理行政执法权的部门没收犬只，并处5000元以上1万元以下罚款。所谓限养区域尚无明确规定，按照现有条例，禁止在物业管理区域内饲养烈性犬和大型犬，物业是指已建成投入使用的建筑物及其附属设施设备和相关场地。（大河报）50种猛犬拟禁养，违者最高罚万元	未
又一城市12月底前执行带量采购，规定基药采购比例	未
又一城市跟进，26日起，安阳加入单双号限行队伍！	未
又一城放松楼市调控！广州市调整“商住房”政策	未
又一城放松楼市调控！广州调整“商住房”政策	未
又一堵点被打通！清川立交大学路方向主线明早通车	未
又一大老虎，一屋子全是钱	未
又一大老虎被抓，拥有100套房，100个车库...大同人快看	未
又一奇葩相亲男曝光！吃饭逃单，发1.29元红包，不单身天理不容！	未
又一家中国风酒店落地奉化！	未
又一家公司拟进场抄底 爱建集团子公司拟投不超过1.8亿元用于证券投资	未
又一家区域交运集团进入网约车行业	未
又一家合资券商股东分手 外资以退为进谋独立	未
又一家外资私募开业：进入中国，择机而非择时	未
又一家跑路！南京高淳明尊健身会所突然关门	未
又一家轮胎制造商，打算上市	未
又一家银行公布存管数据，对接19家P2P全部全量上线	未
又一居民楼失火，8人死亡  如何消除区域火灾风险	未
又一巨头被做空！沽空机构：虚增营收，3000万数据暗网叫卖	未
又一年	未
又一年圣诞节，去年陪你过圣诞节的那个人还在吗圣诞节 圣诞响叮当微博视频	未
又一年汽车V峰会 ，当天还会有老司机的网友开放日活动（图1），先去会场踩个点儿。23号我们又要见面啦	未
又一年用四个字描述一下你今年的经济状况 每日笑话微博	未
又一年银杏	未
又一库吹 汤普森谈库里里程碑亲自摇旗：我知道史蒂芬会再次得到15000分的，他还有15000分要拿，也许更多。他非常努力，他是如此了不起的领袖，他身上流露出的自信和快乐会使你愿意支持他，我和他在一起八年了，我无法要求一个更好的控球后卫。水花大旗永不倒	未
又一座岷江特大桥今开工，跨江仅需10分钟，预计明年通车！	未
又一强国驻军亚太地区， 打压中国， 中国只淡定回应四个字	未
又一批启东城区交通违法行为曝光了！看看有没有你	未
又一批回头看典型案例：湖南25名（永州12人）相关负责人被处理	未
又一批失信人曝光！霸州谁认识赶紧告诉他们：快还钱！	未
又一批岳阳车主被曝光，不文明的手什么时候能收住	未
又一批电子警察即将启用，象山这些路口路段要当心！	未
又一新机场！岳阳三荷机场26日首航据官方消息，岳阳三荷机场将于12月26日通航，目前首航航班杭州岳阳昆明已经上线，所有机票已全部售完。除此之外，西安岳阳海口上海浦东岳阳北海岳阳贵阳成都岳阳上海虹桥岳阳北京等一系列航线正在推进中，预计2019年元旦过后陆续上线。网页链接	未
又一新物种被命名为特朗普：因为同样“眼瞎”	未
又一条，开始试运行！	未
又一条新的国家级高铁干线途径邵阳！怀邵衡铁路也进入通车倒计时！	未
又一条蛇耍流氓，跑进去资中人家中过冬	未
又一条道路预计年底通车，醴陵交通跑起来了！	未
又一条高铁获批：铜仁至吉首高铁即将开建	未
又一样板！巴林右旗融媒体中心成立	未
又一次无缘零封的德赫亚，还是继续给自己喂鸡汤吧	未
又一次来到了中俄边境 额尔古纳  室韦俄罗斯族民族乡	未
又一民生大好事！运城人以后这8类证明将一网通一次办！	未
又一民营巨头拿到18亿quot救命钱quot！券商大手笔驰援，实控人已质押近10012月13日晚，贵州百灵公告称，华创证券与其实际控制人姜伟及其一致行动人姜勇张锦芬签订了民企支持战略合作框架协议华创证券管理的纾困基金将为贵州百灵提供流动性支持，总规模不少于18亿元，专项用于解决股票质押率过高 ...全文	未
又一气霸黑恶势力被铲除！赣州这个县气价每罐约降20元！	未
又一波回忆杀	未
又一波土拍潮来袭 12月底日照市区6宗地块即将拍卖	未
又一波曝光！对于漯河限行我不反对，但有一个倡议！	未
又一波药品检查表公布！许多家门口的药房都被曝光了！	未
又一省全面取消劳务资质！3月1日起，500万以上的项目实行按月发放工资	未
又一省废止《清真食品认证通则》陕西废止《清真食品认证通则》地方标准 据陕西省市场监督管理局网站12月18日消息，陕西省市场监督管理局决定废止陕西省地方标准《清真食品认证通则》。通告全文：各有关单位：根据《关于废止陕西省清真食品认证通则的函》（陕民委2017175号），结合新修订的《 ...全文	未
又一省废止《清真食品认证通则》陕西废止《清真食品认证通则》地方标准 据陕西省市场监督管理局网站12月18日消息，陕西省市场监督管理局决定废止陕西省地方标准《清真食品认证通则》。通告全文：各有关单位：根据《关于废止陕西省清真食品认证通则的函》（陕民委2017175号），结合新修订的《标准化法》要求，我局决定废止陕西省地方标准《清真食品认证通则》（DB61/T 564-2013），现予以公布。特此通告。陕西省市场监督管理局2018年12月10日陕西省市场监督管理局网站截图此前报道：甘肃废止《清真食品认	未
又一省明确村医身份，待遇高于卫生院医生！	未
又一精日被抓 称南京大屠杀系凭空捏造12月10日宜春网民周某航，分别以昵称南屠30万和屠刀之下无冤魂73316在微博发表精日言论，挑战法律底线。他在网上发布屠刀之下无冤魂钓鱼岛是日本的南京大屠杀是凭空捏造的等一系列不当言论。经网友举报，日前，警方将其抓捕。 ...全文	未
又一精日被抓 称南京屠刀之下无冤魂12月10日宜春网民周某航，分别以昵称南屠30万和屠刀之下无冤魂73316在微博发表精日言论，挑战法律底线。他在网上发布屠刀之下无冤魂钓鱼岛是日本的南京大屠杀是凭空捏造的等一系列不当言论，经网友举报，日前，江西宜春警方将其抓捕。又一精日被抓 称南京大屠杀系凭空捏造(图)	未
又一“精日”被抓 称南京“屠刀之下无冤魂”(图)	未
又一组全景模式拍出的恐怖照，感觉比鬼片还吓人......	未
又一组行人闯红灯照片曝光 看过来！	未
又一罕见病药品加速上市  可治疗A型血友病	未
又一老戏骨患癌却拒绝治疗曾是香港电影四大恶人之一	未
又一老牌坠落！先锋将被收购并退市正在推进经营重建的先锋（Pioneer）公司12月7日发布消息称，将归入向亚洲企业投资的亚洲投资基金霸菱亚洲投资基金 （Baring Private Equity Asia）旗下霸菱亚洲将出资1020亿日元收购先锋先锋将成为霸菱亚洲的全资子公司，从东京证券交易所退市力争 ...全文	未
又一考古向最近在整理以前的移动硬盘原来有这么多没发的片子啊猜猜我是会吐还是不会吐呢数了数好像起码有56套呢	未
又一联合水泥公司挂牌开业！一年多成立了14家！	未
又一英文解说离开LPL：这是我心系的地方今天，之前在担任LPL英文流解说的Rusty发布公告，表示夏季赛将离开LPL前往OPL赛区当教练。继猫猫之后，又一位我们熟悉的英文流解说要离开LPL了。大家好，你们可能已经看到我对于2019赛季计划的消息了，如果还没有的话我来告诉大家：我打算离开LPL加入OPL的Avant Gaming战队做主教练。我已经关注LPL有快4年了，但是现在到了我该说再见的时候了。但这并不会是永别，而是我要离开很长时间，看看我自己的能力，在一个全新的方向去发展自己。这次机会感觉很不	未
又一被耽误的瑜伽博主 王晓晨高难度瑜伽秀好身材	未
又一规模场发生疫情！农业农村部公布京陕黑三起疫情	未
又一起从施工到投入使用，校稿验收等全环节缺失，全靠网友曝光的典型案例。//@大连地铁:已经通知相关部门立即整改，感谢网友发现问题。	未
又一起！偃师这老丝儿酒驾，A照瞬间没了！	未
又一起！内蒙古3名冬钓者掉入冰窟 2人获救1人死亡	未
又一起！大妈抢过公交车方向盘一阵猛拽，只因2块钱！结果	未
又一起实拍梅州一骑摩托男子闯红灯被撞飞	未
又一起！恶俗婚闹，致遵义新郎被车撞飞，婚闹岂能没底线	未
又一起！揪心的10秒	未
又一起！新郎被人用胶带绑路灯杆上泼调料，这样真的喜庆吗	未
又一起，浙江一位大妈坐霸王车过站猛拽谢师傅公交车方向盘	未
又一起！男子冰面行走落水，离岸40米！今年入冬辽宁已6人死亡	未
又一起！福州闹市斑马线上 渣土车和电动车相撞！骑手双腿被碾断！	未
又一起！福建驴友徒步穿越不慎滑坠20米山谷中！七小时连夜大搜救！	未
又一起网络拉货不看证件就装箱的盗车事件！！/ KTM网上卖厂车，近200万标价碉堡了 车坛头条11.29	未
又一起！“霸座女”大闹高铁车厢被拘留	未
又一轮雾霾将至，江苏15日下午将启动重污染天气黄色预警	未
又一轮雾霾将至 江苏明日启动重污染天气黄色预警	未
又一辆高铁取消滕州东停站	未
又一部扎心国产纪录片要上映，《一百年很长吗》昨晚南京路演	未
又一项慈善药品援助项目启动 肝癌等患者可申请	未
又一首富被抓，下一个是谁	未
又不知道明天开啥车了	未
又两位，走了！	未
又为争屋地，茂名这里三人棒打围殴一老人。。。	未
又他一个底政策底蒙错又改成改革40周年底了！	未
又伤今天鹈鹕客场挑战雄鹿，浓眉哥戴维斯在一次篮下防守中倒地，他直接走回更衣室！伤病滚粗啊！NBA比赛日	未
又作妖!美“友台派”要在台和“独派”组“新团伙”	未
又作妖，美“友台派”要在台和“独派”组“新团伙”	未
又偷窥我的生活//@李知了:是谁在我头顶放了监控，我举报了啊//@野比大雄:整数发博！//@趴下继续笑:老是中枪可咋整//@虫治先森:这条微博提到了我//@天文在线:天天监视我//@别吵我我还想睡觉:哈哈哈哈有人监视我	未
又像鳄鱼又像蜥蜴的动物，已经存在了一百多万年却鲜有人知	未
又冷又有霾的冬天咋过当然是找个深山老林泡温泉！	未
又凉了！Google中国版搜索本决定将于2019年回归中国的Google搜索，据The Intercept消息称Google决定关闭该中国版项目，内部投注资源已转移到其他发展中国家如印度印尼巴西等。谷歌中国版已彻底凉了，但Google在发给媒体CNBC的邮件中说到依然很想服务中国的用户。	未
又出事！16岁少女因喝奶茶引致突发心肌炎这两种人要慎喝！	未
又出事！3男子喝金银花泡的酒，差点没命	未
又出事了！5死18伤！请为平舆学生扩散此文！！	未
又出事了！5死18伤！请为潢川的学生扩散此文！！	未
又出事了！奥迪车撞倒多名小学生！请为息县学生扩散此文！	未
又出事了！请为固始学生扩散此文！！	未
又出事了！这样的小鸡你还敢飞吗	未
又出事！美容神器麻醉眼膏查出假货很多美容店售价100多元钱一支的麻醉眼膏，被女性用户追捧为美容神器但近期警方查出了一起制假售假案件，这些假美容品制造成本仅为1元消费者在使用过程中容易造成细菌感染，警方提醒消费者要选择有资质的美容机构，不可贪图便宜而危及健康安全（中国新闻网） ...全文	未
又出事！美容神器麻醉眼膏查出假货很多美容店售价100多元钱一支的麻醉眼膏，被女性用户追捧为美容神器。但近期警方查出了一起制假售假案件，这些假美容品制造成本仅为1元。消费者在使用过程中容易造成细菌感染，警方提醒消费者要选择有资质的美容机构，不可贪图便宜而危及健康安全。（中国新闻网）美容院秘密武器成本仅1元 浙江台州警方捣毁制假窝点	未
又出新盘了！海信地产！临地铁！能看海靠着山！位置就在...	未
又出现打独行侠的情况了！真醉！	未
又到一周曝光时间！对不文明行为，你说不了吗	未
又到一年1213	未
又到一年公祭时//@秦祎墨: 转发微博	未
又到一年冬季时，去广西德保骑一骑矮马，看一看满山的红枫叶吧	未
又到一年抢袋时	未
又到一年招聘季，临床不再需要低学历护士吗	未
又到了一年一度晒一晒身边没见过世面的南方人季节	未
又到了一年一度的贺卡节，写到手软！我也很想给你们寄些，但是以前试过，只有少数人能收到。那就让我默默地把祝福送到你们心里吧！	未
又到了云养小小马女儿的时间 微博视频	未
又到了互相伤害的时候	未
又到了发超话必糊的阶段，广体且养且珍惜，热搜拜拜。	未
又到了变盘时间点！！！	未
又到了周末晚餐大型晒图现场，你昨天晚餐吃了什么	未
又到了和被窝作斗争的时候	未
又到了在屋里穿背心都热，开窗又冷的季节了小区烧暖气的大爷太实在，可劲儿的烧啊，屋里三十多度也是一种困扰	未
又到了左右为难的时候了！ 微博视频	未
又到了我最喜欢的来人啊大v欺负小透明啦！一言不合就拉黑啦！的环节啧啧，来我家后院拉屎还不许我锁门了，我就欺负了，我不光拉黑我还删除并拉黑，禁言三天，报警抓我啊	未
又到了抄作业的时候，请小可爱们在评论区共享一下今天吃啥好不好	未
又到了橙子和草莓的季节叻//@机智达人:好想吃喔//@我朋友是个奇葩:看水果名看得我疯狂分泌口水//@渣蜀黍:了周末买//@锦鲤蛋:好接下来我一个个吃！//@优惠女孩的日常:被评论种草了阳山水蜜桃！！	未
又到了每天戳开评论，拿小钱钱的时候了。	未
又到了洗澡靠毅力 穿衣靠耐力 起床靠爆发力 出门考动力的季节	未
又到了滑雪的季节，而我在工作	未
又到了火锅啤酒的季节，小心痛风性关节炎 市人民医院举办  世界关节炎日健康大讲堂	未
又到了直男拍照时间.......	未
又到了行动放慢64699791391949倍的季节 无脸男重出江湖	未
又到了该说晚安的时候了 给你个网站！想要什么搜什么！网页链接	未
又到了走在马路上，闻到烤红薯香的季节！	未
又到冬天了，要记得抱紧身边的人啊	未
又到周五了！转发里抽两位平分1000元后天开下周游戏二测记得来玩	未
又到周末了耶路过一家店正在放SOLO- 下意识的跟着跳了起来今天就乱发发图吧 「翻手机发现好多照片没发过」	未
又到年底冲业绩，沙雕网友们又出新操作，从设计师到房产中介纷纷开始拜起了娱乐圈销售总监光良，只求保佑完成KPI，年底冲业绩的网友们试一下不看广告看疗效	未
又到年底，平山人开始各种送（下拉第二条）	未
又到扶贫日，鹿邑这么多干部情系贫困户！	未
又到旧货市场来扫货了整车干	未
又到晚饭时间了！扫到大额一定要记得用掉噢！ 查看图片 //@Lotte-F:又到了午餐时间大家扫一下就可以用啦//@Lotte-F:这两天真的蛮多大额的 我已经看到好几个23了 大家真的可以试一下（我又在卑微请求 查看图片	未
又到深夜疑难解惑时刻	未
又到腌菜季 宿迁这位89岁老太战争年代曾给部队腌咸菜	未
又到银杏季，成都锦里中路的银杏叶已经黄透了！赶紧去pie哦！	未
又到除草季 常州两幼儿误服农药中毒	未
又到雾霾季了。。。猫这边也是重度。。	未
又刷爆了！顺德71岁阿伯开宝马酒驾，还说：小伙子，不怪你们，我们算是不打不相识	未
又加了昂你们厉害	未
又卡老子干几把毛我这两天也没有替天行道网页链接帮我卡一下这只脏猪	未
又去了几个老地方看雪（via 豆友宋乐天的广播：网页链接 ）	未
又又12后的我微博视频	未
又又又又又把钥匙锁家里了，经常帮我开锁的师傅回四川了，他帮我联系了他开锁的朋友，他朋友也不在。忽然想到派出所出警的时候可能有需要开锁救人的情况，于是冒昧跑到隔壁的派出所求助警察叔叔，他们还真给了我一个开锁的电话号码。等会儿我就可以进家门啦。	未
又双叒修路了为期近一个月的车辆限行，赶紧了解！	未
又双叒地震了！两天内第8次！泉州地震预警神器，提前10秒预报！	未
又双叒地震了，福建人的第一反应居然是福州螺洲大桥震裂了这些消息不可信！	未
又双叒掉下去了！普宁这个路口可能是不少司机的噩梦	未
又双叒是盒马鲜生！火龙果发霉长毛还在卖工作人员：百分百没问题	未
又双叒是盒马鲜生！火龙果发霉长毛还在卖工作人员：百分百没问题盒马发霉火龙果 有网友爆料，说自己在逛盒马鲜生时，发现了发霉的水果。谁知店内工作人竟表示：霉变的只是表皮，削了皮照样能吃，还反复强调了几次百分百没事。店员还表示这并不影响口感，食用没问题：就是因为皮不好看，才打五折，没事的。@盒马 盒马鲜生销售发霉长毛火龙果 工作人员:皮一削就没事	未
