哪有人下午五点钟 要去迪士尼也就只有我会理你 上海上海迪士尼乐园	未
哪有什么岁月静好，只是有人为你负重前行！向中国军人致敬	未
哪有什么岁月静好大连身边事大连爆料	未
哪有什么消费降级？双11健康账单告诉你年轻人究竟把钱花在哪儿……	未
哪有什么纯绿茶，大家都是混合饮料	未
哪有女孩不爱红色红色五号 网页链接	未
哪有那么多，视频净瞎编。判的是罚22万美元，先一次性罚10万美元，之后每月缴500美元，持续20年。//@ToforgiveN:820万，分期二十年。	未
哪村办丧事，这一幕太不像话！娄底人都看看！	未
哪村婆姨胡编，一套一套的，真不孬！	未
哪村小伙编的！人才啊！	未
哪村的一家人，不是一般的厉害	未
哪村的大姐跳舞火了	未
哪村的大姑娘，真会胡吊扯，一套一套的...	未
哪村的婚礼仪式，太势大了	未
哪村的婚礼仪式，阵势大了！	未
哪村的婚礼现场，把新娘气跑了	未
哪村的媳妇， 家中自录视频， 要火	未
哪村的新人婚礼突遇降雪，宾客头顶塑料袋冒雪吃酒席！	未
哪村老娘们胡咧咧，一套一套的，真干老！	未
哪村老娘们胡扯，一套一套的，真不孬！	未
哪来地戾气！凌晨小偷偷不着东西暴踹电脑	未
哪来的底气！临安这个村的人，要生活在4A级景区	未
哪来的脑残小学鸡动不动开口放炮地团泡菜没姓名地团韩国粉丝够把你打到轮回重生三十六亿八千九百七十八次了//@看什麼看滾去:同理可得你割割在泡菜没姓名咯	未
哪种动物的交配方式很奇葩红人的诞生V影响力峰会	未
哪种油最降血脂	未
哪种疫苗不是剂次越多保护性越强//@xiongyongqiang:回复@咪仔去哪儿:不懂可以看文献，这里都有微博正文详细分析网页链接麻疹剂次目前来看越多保护性越强，且额外剂次几乎毫无危害，只是费钱费力	未
哪那么多的刘强东舔狗被你们洗的我都快觉得他是被强上的一样防务微观察	未
哪里做对了 讲真，如果管理真能输出的话，随便从秦城送一套班子到亚非拉那些小破穷去，都能改变当地的落后面貌吧无论如何，过去三十年，虽然有很多问题，但一定也有非常关键的哪里做对了这些经验不应同脏水一起泼掉	未
哪里//@前田哲也sakida:哪里//@空山幽静:哪里//@空气娘Kuuki:哪里	未
哪里去找俄罗斯女孩呢 微博视频	未
哪里可以叫到这样的硬核出租车，那上班就再也不用迟到了	未
哪里地震了成都震感明显。	未
哪里找这样的私教 微博视频	未
哪里有一折的矿卡，收两个交火玩	未
哪里有出票或者抽票麻烦艾特一下我，我一定立马赶到谢谢	未
哪里有卖ES6的脚垫和坐垫的我得提前准备一下了。	未
哪里有卖重庆生活	未
哪里有腰斩哪里就有机会！	未
哪里有视频某些女权表眼瞎看不见怎么办//@颠颠爆爱猪猪:你快点看看视频完整版，那个女的又打又骂，还用脚踹民警，民警只是用膝盖按住叫她冷静不要袭警！键盘侠你应该向民警道歉！	未
哪里有问题呢//@歪果热门视频: 僵住了呀	未
哪里有需要评论的就评论艾特我。我看到就会立马赶到	未
哪里有鞋哪里就有白敬亭哈哈哈哈哈哈！笑死人了！白敬亭是不是每天在搜鞋现在已正也加入晒鞋大营了	未
哪里来的回哪去！青岛海关退运1436.3吨洋垃圾27日，记者从青岛海关获悉，日前1436.3吨禁止进境固体废物被退运出境。前不久，海关在对3批进口铅矿砂实施现场查验过程中，发现货物夹带大量金属碎料塑料碎料等疑似固体废物。经取样送权威部门鉴定，上述货物被确认为禁止进口的固体废物。该些固体废物共计1436.3吨，海关部门共分两批次将其退运出境。今年以来，青岛海关持续加强进口固体废物监管，严厉打击洋垃圾走私，已连续开展四轮打击洋垃圾走私专项行动。对于查获的固体废物，海关将其原状退运出境，坚决	未
哪里来的自信说我有白金信用卡！（//@辣条娘: 噗//@我掉碗里了:从来没接到过这种有趣的电话 是不是他也知道我没钱被骗//@銭袋一只:我也想要嘻嘻嘻//@江南大野花:不抓紧装个逼白瞎这场骗局了//@妖妖小精://@人间指南志:很需要	未
哪里没几个脑残货，哪里没几个叵测者//@郭晏平: 只能说，商场比战场更复杂，更冷酷。	未
哪里赶尽杀绝了我对方骗子充其量算是自卫反击吧。//@有多少人跟我抢名字：那王局为啥对方舟子赶尽杀绝说不定将来你用的上这个骗子哦//@王志安:做人留一线，来日好相见。赶尽又杀绝，自己常完蛋！	未
哪里还有什么市场底，2449就是大底了。微博上还有很多人在盼市场底，估计大盘涨到3000点，这些人才会反应过来，拍着大腿喊，卧槽！掉队了！	未
哪里逃！阿巴嘎旗追扣超限超载运输逃逸车辆全纪录	未
哪里都可以是办公室//@古月中心相心: 程序员婚礼现场也得处理线上问题查看图片	未
哪里都有禽兽不如的东西。	未
哭了！2019年放假时间表出炉，光明人的五一小长假没了...	未
哭了！五一只放一天假专家的这个建议考虑一下	未
哭了！农大岳麓山的枫叶红了不！是红叶疯了，枫叶还没人多呢	未
哭了差 0.05 个航段没到金卡刚才一看我去香港来回的机票都不是国航的，这个里程航段啥时候清零啊是年底吗	未
哭了//@杰克波比:只能是昔日了//@喜脉洗脉:！！！	未
哭了看不到小哥哥了//@想暴富的阿柒_:我的兵哥//@廊坊热心群众:lay了//@奶盐蛋挞: 我要骂人了//@没在呕的:真的停了//@腐会长:妈的 想想就气@以团之名过来挨骂	未
哭了//@组织上需要我://@反手一个安利酱:哭辽//@废物循环:更正：出意外的话在医院一个人过。	未
哭了！苏州雾霾天气一直持续到12月！这些清肺食谱快收下	未
哭了！苏州雾霾天气要一直持续到12月蒙蒙哒的你，该怎么办	未
哭了这个自杀的10岁小女孩，刷爆了博野人的朋友圈...	未
哭哭	未
哭墙上又增26人国家公祭日前夕，纪念馆将收集到的26位遇难者姓名刻在哭墙上。今天，88岁的佘文彬老人携家人第一次参加家祭仪式。佘文彬老人为新增遇难者名单揭幕，他弯着腰深情地看着父亲的名字说：以前想念父亲时，只能看看他的遗像。从今以后，这面墙上的姓名成为我祭奠父亲的又一个寄托。 （文/图via@南京日报崔晓 ）	未
“哭墙”再次延长  新增26个南京大屠杀遇难者姓名	未
“哭墙”再次延长 新增26个南京大屠杀遇难者姓名	未
“哭墙”再次延长，新增26个南京大屠杀遇难者姓名	未
“哭墙”新增26个南京大屠杀遇难者姓名	未
哭惨了！2019年放假通知出炉！嘉兴人，你的五一小长假没了	未
哭惨了！这个自杀的10岁小女孩，刷爆了蠡县人的朋友圈...	未
哭惨了！这个自杀的10岁小女孩，留下了3分钟告别视频...	未
哭惹//@噗尺:我在讨饭//@董小姐不要姓董_:正解	未
哭死了	未
哭死//@神探_夏洛虾:最初的六个，最终的六个	未
哭泣的动物艺术家 Julien Nonnon 用光线取代颜料，在悬崖峭壁上投射下濒危动物壁画，呼吁人们重视生态系统保护，把野生动物赖以生存的家园还给他们。匠仓 从美到美好	未
哭泣的玳瑁：东海警方破获一起贩卖野生保护动物标本大案 ！	未
哭穷，究竟有多可怕	未
哭笑不得！28年前存了2000元，如今能取出这么多	未
哭笑不得！28年前存了半年工资2000元，如今能取出	未
哭笑不得！28年前存了半年工资2000元，如今能取出这么多	未
哭笑不得！28年前存了半年工资2000元，如今能取出这么多假设你有本金2000元，放在银行存了28年，请问现在能取出多少钱这件事近期就发生在大连一位80岁的老先生身上。老先生表示，28年前，2000元的本金是他半年多的工资，而如今连本带息，尚不足半个月退休金。哭笑不得！28年前存了半年工资2000元，如今能取出这么多	未
哭笑不得！6岁男孩带女同学私奔：我只是想带她去看小火车	未
哭笑不得！两梯四户设大天井，邻居入户门肩并肩反人类设计02	未
哭笑不得嘉定这个笨小偷连续多次偷窃快递！还把包裹留在自己住处	未
哭笑不得因不懂拐弯让直行！她在大兴开车追尾了...	未
哭笑不得！小区出新“变美”门牌号却成了大花脸	未
哭笑不得！这名司机太喜感	未
哭笑不得！阿伯28年前存了半年工资2000元到银行，如今能取出这么多	未
哭辽，五块钱仨的包子涨价三块钱一个了，也没变大多少啊呜呜呜p(q) 微博视频	未
哭辽！苏州雾霾天气要持续到12月！防霾攻略快收好！	未
哮天犬偷食月亮的下场简直了......	未
哮天犬竟然被猪八戒欺负了，网友：快把二郎神请来对付老猪！	未
@哲Wong：黑牛城道石材边道，河西段新八大里附近，汉语拼音是天津新八里可是通讯的讯字是错别字啊啊啊啊啊啊有点粗心啊	未
哲理短篇：关机一日	未
哲言 付出，得遇上对的人	未
“哺乳”不再是哺乳动物专属？中国科学家发现会长期哺乳的蜘蛛　　　	未
“哺乳”不再是哺乳动物专属？中国科学家发现会长期哺乳的蜘蛛	未
哺乳动物家族新成员Da（大）姨（蚁）猪（蛛）	未
哺乳类也这样的！ 查看图片 //@植物人史军: 这虫子估计也是个一个饭点儿换个吃饭地儿的主，应该教育它们，不要浪费粮食。不过这也是被自然选择出的行为，因为总在一个地方啃食，植物会做出相应的对策，比如释放多酚类物质，老在一个地儿啃，就会被毒死。可以被理解的，如果从虫子的角度看的话。	未
哺育我们的未来 今天是12月20号 国际人类团结日 请和我们团结起来为忍受饥饿和营养不良的儿童发声。	未
哺育我们的未来 今天是12月20号 国际人类团结日 请和我们团结起来为忍受饥饿和营养不良的儿童发声。孩子是我们的未来，希望他们能够健康快乐的成长！@微公益 @微博公益 @星光公益联盟	未
哼，取消明天早上的叫醒服务	未
哼哼哼看吧//@吼猴:蛮好//@从我浴室滚出去:nice啊兄弟//@M大王叫我来巡山:我觉得可以//@傅二摩斯://@拉面拉面辣:住手！！！//@醉酒的捕鲸人:求求你不要啊//@神之鼻息s55 :	未
哼，看你们打飞机。扛四次捅，因为我成本低，耐捅。至于追那是不可能的，你们自己慢慢捅自己吧！老湿别的本事没有，就是横	未
唇动黑色巧克力味蛋糕500g2袋，  37.9 超市也有这个，记得之前买的一斤就是二三十的价了	未
唉。	未
唉//@Alexis_Quin:12月还没过完七个了，已婚妇女平均一周两个的速度被打死	未
唉//@Sun翠花儿_:难过//@阿下:哎//@夏目家的小诗哥: 十年真的太重了 不能这样啊//@吃瓜群众CJ:唉，还是觉得太重//@衣锦夜行的燕公子:难受。	未
唉 一下就长大了把小宝贝还给我	未
唉！一言难尽的第三节。。。	未
唉，不知道这是一剂正能量春药吗，何必戳穿。	未
唉今年《囧的呼唤》播放量的形势非常....怎么形容呢可以说是稳得一匹吧。平时就算我不发视频，日均点击率也有十万进帐，一旦新视频发布，一天之内点击率可以陡增到一百万左右水平。诚然今年《囧的呼唤》只能在B站发布对系列传播造成了一定影响，但依然能保持全网两百万左右点击，明年继续努力！	未
唉//@债见吧旁友:总是如此	未
唉又要找新男票了上一个刚刚被我抵押还了双十一的花呗 想买的东西留到了双十二 ，再没新的出现，双十二的花呗就没抵押物了吧捉急啊 1212人民的宝贝总决选跪求帮我清空购物车，或者给我介绍个男票啊	未
唉呀妈呀，我这是来到了巨人国吗	未
唉，周六的生意也那么好但愿今天能排上这是我今天份的中国梦 郑州古荥镇(惠济区)	未
唉，哪日我等有难处，不知是否有人伸出援手呢。帮，是情义，岂能计较钱多钱少//@鄢烈山:李泽厚同志自以为比李白更有资格打秋风	未
唉//@大仙儿是个蓝胖子 :转发微博	未
唉尽人事，听天命吧。//@崔彦战:鼻头发酸眼眶一热，N多次了。为人父母为子女万般甘愿！如庄主为珞妮儿，古今中外难寻	未
唉，岁岁荷花开，转眼近中年。画幅荷花，聊表感慨。	未
唉捡到一个小姜丝大热天的停电啦（一）	未
唉。。//@昵称是马甲家的大学生: 哦，闯馆算什么。还有组团穿孝服抬着棺材跑总领馆门口哭丧出殡的。总领馆明明提供了巨大协助，就因为无理要求没被满足，就这么对待自己国家的外交机构。	未
唉，涨了才想买，不涨不想买，结果 一涨就板，下不去手	未
唉！看了这份年终总结！感到脸疼年终总结这玩意儿你一定不陌生，每到年底都要写一份，晒成绩，晒功劳，晒苦劳下面这些年终总结或许有点扎心，看看你在哪一份里找到了自己的影子（中国新闻网）	未
唉！看了这份年终总结！感到脸疼年终总结这玩意儿你一定不陌生，每到年底都要写一份，晒成绩，晒功劳，晒苦劳下面这些年终总结或许有点扎心，看看你在哪一份里找到了自己的影子（王凯 倪雯冰）	未
唉！真是拿你没办法。	未
唉！离乡漂泊这么多年，微博上终于有个老家的粉丝@馨宁果园给我在苹果熟了的时候不远千里快递两箱苹果令我喜极而泣老家曾有句很长一段天天在央视广出现的广告语：爱在烟台，难以离开。像我这种离开家乡的貌似被认为是不爱家乡的人。其实，我比家乡任何一个被抓起来的贪官都更加深爱我的故乡	未
唉，老六绝食，怕她不行了 。我送4S去寄养几天。	未
唉 被私生追着奔跑在马路上 这个场景怎么看怎么心疼	未
唉，这一年//@大头和他的朋友们://@谷大白话:常老走好哎，今年赶紧过去吧。//@杭之冯玥均建国后成精:	未
唉，这个对我来说还是太淡了点，下一箱喝完就换其他牛奶吧	未
唉，这是法律在帮银行进行风控，这样银行就可以肆无忌惮地发卡！//@阿喀琉斯信使:信用卡就是信用消费，怎么会入刑你可以打成老赖进行信用管控，但是靠国家机器介入催收	未
唉，这种事也就人干得出来，畜生都干不出来。//@竹林清风2: 是个人都干不出来！	未
唉//@阿沧：所以乘警乘务员真的很辛苦接待各路奇葩	未
唉//@雪里蕻炖六宝:逼你滚回家生孩子，还有一批有工作非得要回家生崽的妇女三天打鱼两天晒网的工作，呵呵	未
唏嘘不已。这姑娘看上去发展得真好，希望别犯糊涂。其实一直很好奇，那些最后找到了中国亲生父母的发展得很好的美国养女们，和她们的亲生父母后来的故事，会如何发展。	未
唏嘘！杜牧墓变成菜地当地文保部门：未发生文物破坏	未
唐一军到辽阳市调研	未
唐七亿痛失斗牛篮球场。 查看图片	未
唐人已经不是以前的唐人啦	未
唐人神控股股东解押部分股份，转让近7%引入国资	未
唐代大诗人杜牧的 安息之地在少陵塬上	未
唐代女性为什么地位高陕西师范大学历史文化学院教授@于赓哲 认为，这与唐朝的文化来源密切相关。唐朝的文化主要来源有北方草原游牧民族文化和南朝文化。南朝更多保留的是汉魏以来的中国传统文化，而北朝的文化对女性的影响就特别大。另外，唐朝封建礼教还没有完全固化，儒学没有像宋朝渗透到社会各个方面。唐朝的经学是官方的经学，但是学界很多人认为，唐朝的儒学只是停留在官方的学说以及上层社会层面，还没有达到能够操纵人们社会生活的层面。这是一个历史的缝隙，在这个缝隙当中唐代女性找到了自己茁壮发展的空间。更多干货，欢迎订阅	未
唐代女性为什么地位高陕西师范大学历史文化学院教授@于赓哲 认为，这与唐朝的文化来源密切相关唐朝的文化主要来源有北方草原游牧民族文化和南朝文化南朝更多保留的是汉魏以来的中国传统文化，而北朝的文化对女性的影响就特别大另外，唐朝封建礼教还没有完全固化，儒学没有像宋朝渗透到社 ...全文	未
唐代诗人杜牧墓成菜地 专家呼吁建纪念馆(图)	未
唐代诗人杜牧墓被曝已成菜地:7米墓土曾被村民挖尽	未
唐代诗人杜牧墓被曝已成菜地，专家呼吁恢复建纪念馆	未
唐代诗人杜牧的墓地沦为菜地，我们的文化怎么不备重视的	未
唐僧虽然吃素，但是很避讳芹菜因为那是叶柄，不是真经。	未
唐图关注毒瘾发作......可怕！看看一个瘾君子的典型生活	未
唐太宗：白皮人面兽心，一旦微不得意，必反噬为害！	未
唐太宗让逼迫房玄龄纳妾，正妻一个举动，唐太宗再也不敢提了	未
唐嫣太狠了，这种面料的衣服都敢穿走红毯，明星里独一个！	未
唐嫣领奖不理朱丹引尴尬？双方回应：美丽的误会	未
唐嫣领奖，演讲后快速离开，被问及婚后生活却只是挥手离开！	未
唐宁：资本要有耐心陪着科创企业走十年以上中国不缺钱，缺的是长期的钱耐心的钱有温度的钱更缺，我们的人民币创投拿不到真正十年以上的钱。唐宁说，十年磨一剑，我们的科创企业需要有耐心的资本陪伴他们走上十年。而其中一个重要的创新形式就是市场化母基金。股权创投母基金正在帮助中小微企业得以更好的发展，金融创新支持数字经济支持新经济。唐宁：资本要有耐心陪着科创企业走十年以上	未
唐宋快讯午后市场传言唐山环保将加强消息，据我网了解目前迁安地区正在召开环保会议，会议正在进行中，后续情况跟进中迁安下午会议主题为环境管理培训钢厂表示与停限产无关据SMM钢铁了解，迁安下午4点的会议主题为《2018年企业环境应急管理工作培训会议》，钢厂表示属于环境管理培训会，常规会议，与停限产无关。SMM钢铁	未
唐宋清明七天”黄金周”：斗鸡 踏青 马球 戴柳……	未
唐家发生抢人事件:女学生被假警察强拉上面包车?真相是	未
唐家堡村民在线发问，究竟如何才能将建模师祭天	未
唐山：11月26日至11月30日限行提示！	未
唐山：12月3日至12月7日限行提示！	未
唐山40家放心肉菜示范超市公示！快看有你家附近的吗	未
唐山一小区被省台曝光！	未
唐山一花市突发火灾！现场火势凶猛！（内附视频）	未
唐山主城区核心区域违建开始拆除，这条断头路将打通	未
唐山交通热线即将停用，相关服务会转网至......	未
唐山人到这儿看书不花钱！中心区首个城市书房明起免费开放	未
唐山人注意！油价又有大变动！	未
唐山企业职工注意！我省出台意见，事关你的养老金！	未
唐山：关于纵横钢铁6号门内交通事故情况说明	未
唐山十项重点工作11月计划清单公布！涉及道路公园修建和站西片区设计...	未
唐山又现2起“包皮术中加项”：麻药快散了 加收3万	未
唐山发生2.5级地震！	未
唐山：嚣张！一男子街头拦车要钱，必须曝光他！	未
//@唐山大概齐:唉呀真不容易呀，现在，已经很少有人去关心底层的老百姓了，@happy热哥 依然能够为底层民众呐喊实在令人感动！	未
//@唐山头条:唐山爆料 居然还有这种人	未
唐山市人民检察院对两名狱警立案侦查	未
唐山市直各部门单位团体开展无偿献血活动	未
唐山师范学院党委常委、纪委书记李可君接受调查	未
唐山微博曝光台	未
唐山微博曝光台 大伙儿怎么看	未
唐山微求助	未
唐山微求助 @R小脾气-：这种情况应如何处理呢	未
唐山微求助 了解的说说	未
唐山微求助 健身卡转让	未
唐山微求助 匿名求助：老爸老妈结婚纪念日，送花的话送什么花好呢	未
唐山微求助匿名：请问大家，这个合理吗	未
唐山微求助 大家来支招	未
唐山微求助 大家来支招，这种情况怎么处理	未
唐山微求助 感觉荷花坑会有	未
唐山微求助 @我是静静吖lj ：马上要过年了，公司年会给大家都发什么啊	未
唐山微求助 招合租	未
唐山微求助 招聘信息	未
唐山微求助 有了解的吗	未
唐山微求助 有了解的没	未
唐山微求助 有人去吗	未
唐山微求助 有清楚的没	未
唐山微求助 有知道的没	未
唐山微求助 求丰南兼职	未
唐山微求助 求短租	未
唐山微求助 煤医道，了解的说说	未
唐山微求助 爸爸姓田，大家帮忙想想名字呀	未
唐山微求助 电影票转让	未
唐山微求助 知道的说一下	未
唐山微求助 请唐山各位大佬支招	未
唐山微求助 近视眼手术了解的来说说	未
唐山微求助 闲置手机壳转让	未
唐山惊现无名女尸，请大家帮忙扩散，寻找线索！	未
唐山打卡行动 打卡地：南湖	未
唐山打卡行动 打卡地：大理	未
唐山提个醒儿 出行注意安全	未
唐山“教科书式耍赖”肇事者黄淑芬财产分割案二审将开庭	未
唐山新闻明日（11月24日 周六） 限行提示	未
唐山新闻明日（11月25日 周日） 限行提示	未
唐山新闻明日（11月26日 周一） 限行提示	未
唐山新闻明日（11月27日 周二） 限行提示	未
唐山新闻明日（11月29日 周四） 限行提示	未
唐山新闻明日（11月30日 周五） 限行提示	未
唐山新闻明日（12月1日 周六） 限行提示	未
唐山新闻明日（12月2日 周日） 限行提示	未
唐山新闻明日（12月3日 周一） 限行提示	未
唐山新闻明日（12月5日 周三） 限行提示	未
唐山无人机“黑飞”案4被告人被追刑责：惊动战机，民航改线	未
唐山  月底前别忘了做这件事，否则你的医保待遇受影响！	未
唐山：有家不能回！不买车位不让开车进小区！	未
唐山某地发生一起命案！	未
唐山：突发火灾！现场浓烟滚滚...（视频）	未
唐山身边事 12月23日开抢春运首日火车票！这份订票时间表请收好12月23日，就可以购买春运第一天（2019年1月21日）的火车票和汽车票了。12306网站APP有购票时间，每天晚上11：00到早上7：00不售票，属于网站维修时间。有消息称，在2019年春运期间，或将取消晚上11：00限制购票的时间。这样一来，购票时间被拉长，也有利于旅客抢票。2019年寒假学生火车票已经全面开售，广大学生旅客可以购买今年12月1日至2019年3月31日期间的优惠火车票。	未
唐山身边事 1948年12月12日，唐山解放。	未
唐山身边事 冬日大练兵，唐山这些警察蜀黍帅过大片唐山市路南区域警务一体化严格落实全市战时巡控等级和公安部四项机制要求，12月19日上午，组织开展应急处突演练。@唐山长安网	未
唐山身边事 别了，纸质火车票！刚刚传来大消息！中国铁路总公司宣布，电子火车票来了！从此和纸质车票说再见吧！从中国铁路总公司获悉，11月22日，铁路部门在海南环岛高铁实行电子客票服务试点，刷身份证扫码进站！除了二代身份证外，外国人居留证港澳居民来往内地通行证台湾居民来往大陆通行证也可直接刷证检票进站上车	未
唐山身边事 北新道与卫国路口实施直行待行通行模式！继新华道与友谊路交叉口实行直行待行通行模式后，卫国路与北新道交叉口由南向北方向也开始实行机动车直行待行，广大驾驶人在此路口通行时请留意交通标志标线及相关提示语。大家来说说你对实施直行待行通行模式有什么看法吧，或者有什么影响	未
唐山身边事 唐山中心区一大型露天市场全面取缔！迁到这儿，打造早市升级版存在了30多年的赵庄早市日前被彻底依法取缔，大多数经营者目前已转入渤海生活广场标准化市场继续经营。国内领先水平的硬件设施租金减半的政策优惠和全面的管理让这里呈现出繁荣有序的经营状态，打造出赵庄早市的升级版！	未
唐山身边事 唐山人注意：周一，单双号限行继续周一单双号限行没有解除，周一(17日)机动车尾号双号禁行，即尾号是02468的机动车禁行12月18日及以后，唐山继续按照周一至周五每天限行两个尾号。	未
