各地纷纷出招解决“成长的烦恼”，当好中小企业“娘家人”	未
各地追公交	未
各地追公交，有没有你	未
各地都在下雪但是盐边 却蓝天白云，没有雪景刷屏...妥妥的被冬樱花和油菜花刷屏了！！到攀枝花去，感受四川最早的春天@四川旅游	未
各地银保监局今日上午10点集中挂牌	未
各地银保监局揭牌	未
各地陆续公布新晋“千年古县”：晋豫皖川鄂5省共有7地	未
各地频频立法 保护华侨权益	未
「各城市康扣发售信息汇总」这次康扣量非常大，大家获取消息的渠道也都很透明的，我就不再每个城市发提醒了。大家可以把自己所在城市发售情况PO在评论里，说说是先到先得还是抽签，互相分享一下吧！	未
各大厕所报给出的巴萨今晚预测首发	未
各大新闻媒体入驻快手平台目前快手平台处于上市筹备阶段，各大新闻媒体入驻快手平台，其中包括中国长安网人民日报新华社新华社现场新闻央视财经央视新闻移动网共青团中央共青团福建省委四川公屏团等等，纷纷入驻快手平台监管，可以说是快手步入了主流媒体时代！	未
各大航空公司每月机票打折日，可以蹲一蹲 .	未
各大航空公司每月机票打折的日期，马住日后买机票用得着！	未
各大航空公司每月机票打折的日期，马住日后买机票用得着！  榜哥分享	未
各大航空公司每月的机票打折日期，以后买机票有用，马住！！！	未
各大航空公司每月的机票打折日期，留个备忘	未
各大航空公司每月的机票打折日期，马住以后买机票有用！	未
各大航空公司每月的机票打折日期，马住以后买机票有用	未
各大航空公司每月的机票打折日期，马住以后买机票有用！Ps：泥萌还有没有别的资源，欢迎补充鸭	未
各大车友会，你们是啥车友	未
各家券商整理的近两年四年六年中央经济工作会议内容对比加班辛苦了！	未
各家的5G之争开始了，12.10日，去看看努比亚会怎么玩	未
各家第三方产品	未
各市州订阅甘肃禁毒微信情况通报	未
各平台首次内测已经开启，请注意NDA协议，不要公开任何视频和图片资料。	未
各抒己见，打手吕布也有不同套路！	未
各文学网站清理整改官场亚文化等不良倾向网络小说情况通报	未
各方全面发力WTO改革，中方首度确认独立方案正在研究	未
各方发声回应基因编辑婴儿  沪一大学生拿公用洗衣机洗鞋  2000元存28年利息500元	未
各方回应基因编辑婴儿：不属实未资助认真调查小南早报	未
各方紧盯菲律宾政权交接 新总统外交政策引国际关注	未
各显神通应对赎回压力 百亿级明星私募“凛冬”鏖战清盘线	未
各有家室的一对男女因同学聚会产生婚外情，被曝光后相约自杀	未
各村35岁以上的，再忙也看吧！	未
各村42岁以上的，2019年就要面对现实了！	未
各村42岁以上的，2019年要注意了！	未
各村42岁以上的，2019年要面对现实了！	未
各村42岁以上的，再忙也看吧！	未
各村42岁以上的，再忙也看看吧	未
各村45-60岁的，再忙也要看一下	未
各村45岁以上的，2019年就要面对现实了！	未
各村45岁以上的，再忙也看吧！	未
各村45岁以上的，再忙也看吧	未
各村交220元2O19新农合的看看把	未
各村交22O元2019新农合的看看	未
各村交了220元2019新农合的看看	未
各村交了220元2019新农合的看看！新消息...	未
各村交了220元2019新农合的看看 最新消息...	未
各村交了220元2O19年新农合的看看把	未
各村坏干部注意了，年底马上就要收拾你了！	未
各村坏干部注意了，马上就要收拾你了！	未
各村坏干部注意，马上收拾你了！	未
各村坏村官注意了，马上就要收拾你了	未
各村有社保卡的老乡速看！现在还不晚	未
各村的村干部注意，关于你们的政策出来了	未
各海淘网站的圣诞大促来了，错过黑五的这次不要再留遗憾！！给你们整理了一份海淘攻略请查收Feelunique圣诞节力度超级大！低至4折还有买三免一！比黑五还划算！ 传送门戳网页链接	未
各界人士热议改革开放启示 香港未来定位更加凸显	未
//@各界舆情:听说这些驴友们私生活很乱，经常出去乱搞，不知道是真是假	未
各种交通横横竖竖的标线你都明白吗 各种交通横横竖竖的标线你都明白吗	未
各种全球最无法解释的超自然现象，看了直流汗！	未
各种口味的小海苔都在这了啊	未
各种各样的职业描述 nurse 护士 doctor 医生teacher 教师 headmaster 校长technician 技术员engineer 工程师supervisor 主管cashier 收银员receptionist 柜台招待员driver 司机programmer 程序员analyst 分析员manager 经理director 董事长cook 厨师reporter 记者editor 编辑author 作家accountant 会计师lawyer	未
各种大佬言论虚虚实实	未
各种大神开挖机上板车，最后两个要把老板气死！	未
各种整理法，就不会变乱的家庭指南，不妨试试	未
//@各种有财大瓶-矜持冷静自控:我觉得这块儿特别可怕。水书记知道刘总工那边的技术不如FRC先进，特意提出引进FRC。实际上FRC也不是最先进的技术，而是国外早已成熟成型的技术。水看过宋运辉的稿子，明知道还有更先进的技术，却提出一个不那么先进但却比厂里现有技术先进的技术，老谋深算得很	未
各种水果的挑选方法	未
各种眼熟。。	未
各种眼熟，幼时的环境和回忆	未
各种系的三连哈哈哈哈哈哈	未
各种自动化设备加工过程	未
各种薯片包装里空气含量的百分比	未
各种跳水，A股年末基本就这样了，抄底仓位也止盈了，回到20仓位，这轮运气好，抄底的个股涨了快20（在近期热点上）分批卖了差不多15收益，熊市从来不贪心，超额收益立刻兑现，就这样吧	未
各科医生说出真相，6种可怕疾病根本不用跑医院	未
各站队已经开始招兵买马为明年的战队赛做准备了，非常怀念那个时代，然后我看到了大师兄和白琉璃小姐姐//@神之梯炉石线上赛: TG牛逼！！！！（破音）	未
各类补贴，月休八天，招220人！	未
各级主流媒体高频报道庐江这项工作，为啥	未
各级各相关部门，市长对安全生产工作提出了要求......	未
各色蔬菜大量进入市场 多种蔬菜卖出了“白菜价”	未
各路大咖网红大V涌入资阳，来做什么	未
各路资金扫货	未
各进站口铺设防滑垫 四大火车站扫雪除冰应对首场雪	未
各退役军人群体信息采集诉求建议汇总交流	未
各部门都喊人少，加人不增效：定编别靠拍脑袋！	未
各镇街区大评比后，林红玉书记这样说	未
各高校探索“金课”建设 全面落实仍存挑战	未
合伙人合的不是钱，而是人品格局和规则！	未
合伙人要退股 男子一起之下将自己的轿车点燃	未
合作一年多的女主播江江，因为要去别的城市定居，今天是好彩频道最后一期节目，网友们很悲情。昨日东流水，宴席不散，欢迎再来。	未
合作内容校园里的致命红包	未
合作内容纹身师讲述诡异故事	未
合作市公安局关于调整辖区省道306线管理时速的通告	未
合作方被约谈 支付宝宣布相互保更名为相互宝 已有2000万人加入的相互保刚刚宣布，因合作伙伴信美被约谈，相互保将升级成相互宝。新的相互宝是一款基于互联网的互助计划，背后不再对接《信美人寿相互保险社相互保团体重症疾病保险》。新的相互宝出现三大变化：管理费由原先的10降至8，用户明年分摊总金额188元封顶，人数低于330万也不会立刻解散。合作方涉嫌违规，支付宝宣布相互保升级为相互宝	未
//@合力大队姑爷子://@长春一根烟:烟哥说事//@38度南阳:尽管有点儿调侃，还是比较中肯滴！	未
合力泰实控人发生变更	未
合力泰：实控人变更为福建省国资委	未
合区前奏青梅九伐单独同时维护引发合区论！青梅九伐会合区吗这两个区合到一起很合适，目前官方没任何公告！	未
合华转债今日发行	未
合同明年夏天到期镜报：加拉塔萨雷有意28岁的阿森纳前锋维尔贝克，在上个月脚踝手术后球员正处于康复期，枪手很可能不会与他续约	未
合同管家——为你的企业保驾护航	未
合味道搞事情	未
合唱国歌时前排士兵突然倒地不起 马克龙吓坏了	未
合川公益燕窝镇6旬老人颈部长30cm大肉瘤，求助合川热心网友！	未
合川区税务局开展民营企业大调研大走访活动	未
@合川市民 今天起，让我们一起文明养犬！	未
合并快车专车 滴滴成立网约车平台公司	未
合影_@公安部打四黑除四害 @紫光阁 @江宁公安在线	未
合成作战锲而不舍，莱阳公安破获系列入室盗窃案！！	未
合村并镇将启动，是好是坏农村人要留意了！	未
合村并镇已板上钉钉了权威消息来了：不得强制搬迁和集中上楼！	未
合格我回答了@Ronnie韩大胖 的问题，大家快来花1元围观 微博问答	未
合格的SEM竞价员11项工作日常，你平时做了几个?	未
合格的中国家长有多少这项调查揭开了家庭教育的真相...	未
合法不合法谁说了算	未
合法同居 船长害羞的真相	未
合法的伤害：以过期为由不确认纳税担保	未
合浦一后生仔开摩托车飞上绿化带，人躺在那里动不了...	未
合浦人最爱吃的这些东西，千万不能吃！快告诉家人真相！	未
合浦人注意绕道！亚叉岭立交桥保质期到了，正封闭维修！	未
合浦廉阳大道至文体中心这段路被曝光，是因为...	未
合浦文蔚坊船闸前几天晚上聚集了一大帮人，没想到竟是在...	未
合浦用微信收款的速看，已多人中招！	未
合浦网便民信息合辑第289期：合浦招聘网丨房屋租售丨二手买卖等	未
合浦网便民信息合辑第291期：合浦招聘网丨房屋租售丨二手买卖等	未
合浦车主注意，看到这种黑盒子赶紧扔！已有多人中招！	未
合浦这几百个面包车老司机，你们被曝光了！	未
合照要不要抢C位 后边小哥不仅抢了C位，还抢了镜！不过，C位可以抢，镜也可以抢，但是，上路可千万别抢行，抢红灯！要重细节平安行！@武汉东西湖交警	未
合照要不要抢C位 社会我喵哥，站哪里都是C位，一路躺赢还用抢	未
合生元奶粉月底将正式在澳大利亚上市。有OPO。	未
合着是他们一家子人开的，这关系有点乱搞笑幽默趣闻	未
合着还是卖模板行吧越看越多越了解就觉得这个新闻越扯淡洗洗睡吧啊	未
合肥3岁半女童12楼阳台坠亡：妈妈出去晒被子 阳台未安装防盗窗12月17日早8时，合肥市芙蓉路与翡翠路交口翠微苑商业大厦公寓发生一起悲剧，妈妈去楼顶晒被子时，3岁半的女儿不幸从家里12楼阳台坠落至5楼平台，最终因伤势过重身亡据悉，女童家的南阳台未安装防盗窗3岁半女童从12楼阳台坠落 众人援手却未救回孩子	未
合肥6旬老人街头痛哭，妻女消失9年，至今音讯全无...	未
合肥IC之都底气何来	未
合肥一公司三天内连辞3名孕妇，事后公司还扬言...	未
合肥一女员工给偶像安检后，说上下摸了个遍...	未
合肥一女教师抗癌12年从未提病痛 2天募集40余万善款	未
合肥一小区月薪9700聘清洁工赶紧辞职去应聘！	未
合肥一房地产广告现“一脱到底” 市区两级监管部门调查	未
合肥一消防员请婚假途中救火灰头土脸照走红  回应：职责所在近日，一张灰头土脸的灭火照片在社交网络引起热议，照片上的男子是肥东消防中队指导员夏新升12月10日16时26分，合肥市肥东县绕城高速肥东服务区，一辆满载日用百货的大货车轮胎突然起火正在请婚假途中夏新升，得知这一警情后，考虑失 ...全文	未
合肥一消防员请婚假途中救火灰头土脸照走红回应：职责所在近日，一张灰头土脸的灭火照片在社交网络引起热议，照片上的男子是肥东消防中队指导员夏新升。12月10日16时26分，合肥市肥东县绕城高速肥东服务区，一辆满载日用百货的大货车轮胎突然起火。正在请婚假途中夏新升，得知这一警情后，考虑失火地点距离自己较近，他立刻决定驱车赶到事故现场。他表示，当时唯一的念头就是得赶紧去救火，这是一名消防员的职责所在。准新郎消防员婚假途中救火致灰头土脸 回应：职责所在	未
合肥交警公布52名终身禁驾者名单	未
@合肥人，12月凭身份证和高铁票半价游黄山！只因这趟高铁要开了....	未
合肥人才落户将有租房补贴：本科1万，硕士1.5万	未
合肥人都看看吧，还敢往外借钱吗	未
合肥今冬的初雪真的要来了吗	未
合肥今起启动重污染天气级响应！渣土车禁止上路，农用车禁入二环以内！	未
合肥六中九中新校区建设又有新进展！还有新合肥西站 合肥早新闻	未
合肥，共享单车的坟墓！	未
合肥出发只要45分钟，一片120万立方米的水库美哭了，附近还能泡温泉.....	未
合肥出台医疗保险医药机构协议管理暂行办法了	未
合肥出现大雾天气 高层楼宇若隐若现【组图】	未
合肥卫生部门突检60多家四星级以上酒店客房清洗	未
合肥园林年卡今起发售：实体卡刷卡乘公交地铁 80元单人卡游多景点15日起，2019年合肥园林年卡发售，分实体年卡和电子年卡，价格分别为单人卡80元/张，情侣游卡140元/张，合家欢卡180元/张，可全年不限次数畅游合肥多个景区其中，实体年卡合肥通可刷卡乘公交和地铁合肥园林景点年卡15日发售 实体卡能当公交卡刷	未
合肥地铁3号线全线贯通 攻克小曲线“S”弯难题	未
合肥地铁3号线地下盾构区间全线洞通：全线总长37.2公里 共设车站33座12月20日，合肥轨道交通3号线地下盾构区间实现全线洞通。合肥3号线起于经开区方兴大道与翡翠路交口，止于新站区相城路与淮海大道交口，全线总长37.2公里，共设车站33座，其中地下站29座高架站4座。合肥轨道交通3号线地下盾构区间全线洞通 期待！	未
合肥地铁3号线盾构区间全线洞通	未
合肥地铁78号线站点设置首次公开，经过你家附近吗7号线北起白莲岩路站，行至巢湖南路站。线路全长38.37km，设车站29座，其中换乘站9座，投资估算约290亿元8号线北起北城高铁站，行至珠江路站。线路全长44.78km，设站25座，其中换乘站10座，投资估算约330亿元。合肥地铁78号线站点设置首次公开	未
合肥城区禁放效果显著：违规燃放警情降95 重点时段实现零燃放2018年1月1日合肥市燃放烟花爆竹管理规定施行至今，合肥警方接报违规燃放烟花爆竹警情189起，处罚115起，较去年同期降95基本实现跨年夜小年夜春节元宵节清明节等重点时段零燃放工作目标合肥城区禁止燃放烟花爆竹效果显著 违规燃放同比降95	未
合肥小伙约美女开房，接下来发生的事让他万万没想到.......他后悔死了！	未
合肥小伙约美女开房，接下来发生的事让他后悔死了！	未
合肥工商抽检天猫和淘宝等洗涤卫生用品：2批次不合格，不合格率18近日，合肥市工商局对全市的天猫淘宝等网络平台销售的洗涤卫生用品等商品进行抽检。本次监督抽查共抽取样品11组，产品不合格企业2家不合格批次2批，不合格率18不合格产品涉及女性护理湿巾和母婴抽纸。合肥工商抽检天猫淘宝等洗涤卫生用品 不合格率18	未
合肥市人民政府人事任免通知	未
合肥市卫计委：14家餐饮具消毒企业8家被评不合格，你用过吗12月5日，合肥市卫计委通报2018年全市14家餐饮具企业卫生学评价结果，其中8家不合格：合肥洁帅保洁服务有限公司肥西县山南镇海波消毒餐具配送中心巢湖市永健餐具清洗消毒中心巢湖市顺通餐具配送服务有限公司长丰县水湖镇科隆消毒餐具服务部合肥市康升餐具保洁配送有限公司合肥黄金餐具保洁有限公司庐江县万山镇洁尔餐具清洗服务部。（资料图）合肥洁帅保洁服务有限公司等8家餐饮具消毒企业不合格	未
合肥市失业保险金标准调整到每月1395元	未
合肥市成立多个部门联合调查组 严查炒卖房号行为	未
合肥市政务办公区500多套新型分类垃圾桶“上岗”	未
合肥市绿色建筑与节能管理中心原主任帅兵被公诉	未
合肥建立健全维护律师执业权利快速联动处置机制	未
合肥开通首条至莫斯科直飞航线	未
合肥掀起新一轮文明创建浪潮 全面整治不文明养犬行为按照不文明养犬专项整治行动，合肥将全面整治遛狗不拴绳和犬只随地便溺等不文明养犬行为，重点查处无证养犬非法饲养大型犬和烈性犬行为。合肥文明创建再出组合拳 将设立文明养犬曝光台	未
合肥政务区网红银杏林刷爆朋友圈，外地游客特地前来打卡	未
合肥新桥机场女安检员骚扰男艺人?通过录像查看发现...	未
合肥新闻频道连喝两场开车上路 自投罗网被刑拘	未
合肥方言 老鼠家的七大姑八大姨来我家做客了....	未
合肥有医保卡的注意！重大变化不看亏了！	未
合肥某位网友买了海王的票但去不了了，赠给大家。今天14:10的场次 ，当地网友用下面兑票码去换票吧，先兑先得（如果所有人都抱着肯定有其他人先兑了的想法估计最后那个位置都是空的） 我是不是该打个买票你来看的tag了啊，这种情况太多了	未
合肥某公司微信群聊天记录曝光，揭露了一个重要真相	未
合肥某楼盘用女子脱内裤图做广告 写着“一脱到底”	未
合肥楼盘用女子脱内裤图做广告 写着“一脱到底”	未
合肥滨湖科学城中央公园最新进展！合肥还有这些大动作！	未
合肥男子车内做这事！交警回怼！视频火了！	未
合肥空降最凶猛的奶茶，喝前狂摇15下我等不及了	未
合肥突击检查星级酒店卫生状况！抹布竟然有五种颜色...	未
合肥经开区建成两条“无广告示范道路”	未
合肥莫奈姐姐的玻璃花房	未
合肥蜀山区一年查扣共享单车花费近百万	未
合肥街头发生的真实一幕！男司机竟现场给交警塞钱！	未
合肥街头惊现百万元双胞胎奔驰：长得一样牌号也一样！	未
合肥街头拴着七旬老人，脚锁铁链！家人有苦难言	未
合肥街头，男司机现场给交警塞钱！视频全曝光！	未
合肥警方侦破11.08特大网络组织卖淫案 抓获64名违法犯罪嫌疑人豪华会所藏身繁华商业街内，以海选莞式服务为噱头，通过网络预约实体运作的模式，组织30余名中外失足妇女偷偷卖淫。12月15日晚，@合肥警方 出动百余名警力，成功捣毁位于包河区某商业街内的一处卖淫窝点，现场抓获64名违法犯 ...全文	未
合肥：记者探访淝河监狱艾滋病专管监区，每一个艾滋病服刑人员都是一段故事	未
合肥身边事合肥的消防员哥哥们真的超级赞一只白色泰迪掉在学校的池塘里打了消防电话，小哥哥们立马就赶到！二话不说系了安全绳就下池塘把小狗抱了上来！将近十点打的电话，极短的时间就赶到现场！不辞劳苦！即使是一个小生命也毫不懈怠！走的时候腿上都是淤泥道了谢，轻描淡写一句没事儿就留 ...全文	未
合肥身边事早安   今天下午在合肥市天鹅湖北岸市民健身广场将举办警民一家亲 相约天鹅湖大型警务广场开放日活动，到时合肥消防最贵的消防云梯车会出现在现场，欢迎大家去体验举高高哦！友情提示：要早点去排队哈	未
合肥这个地方火了！竟被一大群情侣找上门，原来是	未
合肥阳光汇景：小区门口大打出手，保安咋成古惑仔宇成物业要抄业主家业主心惊胆战......	未
合肥首次开通直飞俄罗斯航班	未
合肥高架桥上！车辆异常，女司机浑身是血...多方警力紧急出动！	未
合肥鼓励街道设不文明养犬曝光台：社区免费发放宠物狗嘴套，支持请转！合肥将全面专项整治遛狗不牵绳和犬只随地便溺等不文明养犬行为，重点查处无证养犬非法饲养大型犬和烈性犬行为。同时，鼓励街道社区等成立社区文明养犬志愿服务队设立不文明养犬曝光台。合肥鼓励街道社区设立不文明养犬曝光台	未
合肥鼓励街道设不文明养犬曝光台：社区免费发放宠物狗嘴套，支持请转！合肥将全面专项整治遛狗不牵绳和犬只随地便溺等不文明养犬行为，重点查处无证养犬非法饲养大型犬和烈性犬行为同时，鼓励街道社区等成立社区文明养犬志愿服务队设立不文明养犬曝光台合肥鼓励街道社区设立不文明养犬曝光台	未
合规检查大限将至，合作P2P平台超50家的这家银行仍未通过白名单	未
“合謀罪”法案開始審議 安倍稱反恐對策是責任	未
合资券商拿全牌照节奏正加快 申港证券又添两项业务	未
合适的人，不是你拼命追赶的人	未
合阳108国道路域环境将强硬手段治理	未
合阳临时停电公告	未
合阳交警精准布控，10分钟查获两起无证驾驶违法行为	未
合阳便民信息2018年11月25日	未
合阳便民信息2018年11月26日	未
合阳便民信息2018年11月28日	未
合阳便民信息2018年12月1日	未
合阳便民信息2018年12月2日	未
合阳便民信息2018年12月4日	未
合阳便民信息2018年12月7日	未
合阳县12月份停电通知，请相互转告！	未
合阳县违规大棚房拆除，快来看看县政府要求！	未
合阳拆除违建现场	未
合阳汇报新建水渠27.2公里 村民测量只有8.3公里渭南合阳县新池镇街道社区村干部刘中民反映，该社区张家庄村新建农田水利灌溉项目修建长度不到10公里，与宣称的完工27.2公里相差甚远刘中民向合阳县水务局反映此事，县水务局负责人回复，修渠资金按村委会要求用了部分资金修路大概在今年9月， ...全文	未
合阳这些家庭被表彰，看看都有谁家！	未
合阳随手拍2018.11.23合阳这些事	未
合阳随手拍2018.11.24合阳这些事	未
合阳随手拍2018.11.25合阳这些事	未
合阳随手拍2018.11.26合阳这些事	未
合阳随手拍2018.11.27合阳这些事	未
合阳随手拍2018.11.28合阳这些事	未
合阳随手拍2018.12.6合阳这些事	未
合隆镇龙城富苑小区，现在供暖是小锅炉，小区的老人脚都冻了，玻璃都上冻了。	未
合青高铁泗洪站选址了！这个方案你同意吗	未
//@合顺计划: 转发微博	未
合龙口	未
吉AY4448 //@长春饭店小奶油:手机忘出租车上了，回拨电话不承认手机不是自己的	未
吉兆，前程似锦 。	未
吉利与宁德时代正式签定协议成立合资公司，宁德时代持股为51，吉利为49，成为继上汽和广汽之后第三家与宁德时代合资汽车企业。cars01车闻 汽车V峰会	未
吉利并购戴姆勒股份事件调查结果：吉利控股集团将不会受到任何罚款12月15日，界面记者得知，吉利已经获知了德国金融监管局对吉利集团购买戴姆勒集团9.69股份一事的调查结果：此案已经终结，吉利控股集团将不会受到任何罚款。吉利控股集团无需再接受关于此事的其他调查。吉利并购戴姆勒股份事件调查结果：吉利控股集团将不会受到任何罚款	未
吉利投资90亿在汉建整车厂 年产15万辆日前，湖北省发改委批复核准了浙江吉利汽车有限公司在武汉建设年产15万辆乘用车项目，该项目3年建设总投资90.44亿元项目地点位于汉南区纱帽街薇湖路主要项目达产后，将形成年产15万辆乘用车多品种混流生产能力，车型涵盖传统燃油车和纯电动车型混合动力 ...全文	未
吉利新款博越曝光吉利新款博越申报图曝光！新车主要针对外观进行了大幅度调整，尾部中央的吉利品牌LOGO也被GEELY字母标识代替尺寸方面，新车长宽高分别为4544/1831/1713mm，轴距2670mm动力方面，目前新款博越搭载1.5T直列三缸发动机的车型，其最大功率177马力，峰值扭矩或为255牛米，传动 ...全文	未
吉利新款博越曝光吉利新款博越申报图曝光！新车主要针对外观进行了大幅度调整，尾部中央的吉利品牌LOGO也被GEELY字母标识代替。尺寸方面，新车长宽高分别为4544/1831/1713mm，轴距2670mm。动力方面，目前新款博越搭载1.5T直列三缸发动机的车型，其最大功率177马力，峰值扭矩或为255牛米，传动系统预计匹配手动或7速湿式双离合变速箱，并提供四驱版车型。新车公社	未
