去年双12我经历了什么啊。。。	未
去年和疯陪到底滴闺蜜们来了一场一日杭州游，早班机到杭州，烧香品茶吃晚饭，赶着晚班机再回京。今年更加疯狂，今早班机到灵隐寺烧香，现在正在去萧山机场的路上，准备回京。分享灵隐寺内的一幅对联：人生哪能多如意，万事只求半称心。美妆V赏出色挑战赛 @微博时尚	未
去年外国人入境2814.2万 出境旅游人数达1.22亿	未
去年大陆外籍艾滋病感染者2154例 其中学生100例	未
去年夺地振臂高呼的房企，如今笑不出来	未
去年就有人爆了吧	未
去年就给我整反了	未
去年带小白菜去贵州就遇到过，给孩子们准备的礼物和糖果女孩子不吃说要拿回家给弟弟//@别动我有双下巴:因为很多家里重男轻女 很多女孩把牛奶带回去父母要让女孩让给哥哥或者弟弟 就是针对这个原因 很多地方发的免费牛奶就不让带回家了。	未
去年年底许的什么愿望今年复制粘贴吧，我累了不想再重新想怎么发微博发朋友圈了	未
去年应该是，近期没看到相关部门再提这事儿。。	未
去年我们提醒你警惕厦门关注西安贵阳，在追加了上千个数据后，现在我们又有了一些新发现	未
去年拿到但是没有来现场，今年又拿	未
去年春节写的，看的心酸了。	未
去年检察机关共立案侦查原省部级以上干部23名	未
去年烂一地没人要，一斤1毛8丢沟里，今年却逆袭8元一斤	未
去年爆红，今年被嘲网友们因为这条马路上的落叶吵翻了！结果	未
去年留学生毕业典礼空气是甜的丢尽脸，今年这位终于扬眉吐气一把。	未
去年的今天，卡卡退役。。。国际足球	未
去年的十二月	未
去年的吧	未
去年站手上，今年我就扒到了肩膀，再接再厉	未
去年累死累活并没有什么卵用	未
去年脱单的flag还在迎风飘遥，19年快到了还是孑然一身，不如点链接再次立下新一年的flag网页链接，据说这是一条可以帮你实现flag的锦鲤，转起来！言出必行 拒绝真香	未
去年！苍南殡仪馆火化遗体7169具	未
去年这个新闻倒是很少被注意。	未
去年那会儿前任对我爱理不理大师说他最近心思多，是我的烂桃花，要多留意，趁不注意看了眼他手机，渣男果然出轨了大师微博@八字测算师刘景易 后来大师又算了我2018未来的桃花，连对象的长相性格何时出现，啥啥都被说中了！现在对象和大师当初描述的一模一样真滴超准！！大家一定 ...全文	未
去年那会儿前任对我爱理不理大师说他最近心思多，是我的烂桃花，要多留意，趁不注意看了眼他手机，渣男果然出轨了大师微博@周易算命刘景易 后来大师又算了我2018未来的桃花，连对象的长相性格何时出现，啥啥都被说中了！现在对象和大师当初描述的一模一样真滴超准！！大家一定要 ...全文	未
去年重庆测土配方施肥技术覆盖率达85.1%	未
去年陪你看雪的人 今年还在吗	未
去库存效果明显，前三季度湖南商品房量价齐升	未
去开发区红梅这家店吃饭，吃到一半才发现桌上的肉竟是	未
去意已决！高拉特离队已获得重大进展！	未
去成都一定要打卡的地方	未
去成都不再要去什么宽窄巷子啦，看看这个再去玩吧 .	未
去成都再也不要去什么宽窄巷子啦，看看这个再去玩吧	未
去成都这八条街逛逛吧一说起成都的街，不是动不动就春熙路锦里，成都这么大，这8条街也是很有故事嘞！	未
去成都这八条街逛逛吧一说起成都的街，不是动不动就春熙路锦里，成都这么大，这8条街也是很有故事的！	未
去找班车，进站的时候见到一个很piu亮的外国小姐姐，偷偷想这么复杂的班车停靠点，她有很大几率会向我求助，甚至不由在内心暗暗雀跃。结果几辆车中途一出来，截掉我视线，没看到她人。我自己跑了一圈也没找到停靠点，最后还是求助了工作人员等我找过去之后，发现人家熟练早已找到地方在那里等车了。当时一句广告词回荡在我脑海里：哟，行家啊！	未
去拍照重庆生活	未
去拜年，爷爷给大伯家儿子200，给我说今年没钱，欠着明年给	未
去拿快递，快递员一直找不到，于是转身问我：你是不是小件货	未
去捡鱼钩！绍兴一老人不幸身亡！	未
去接小孩，自己拿吧！5元11个这家佛系馒头店火了！	未
“去接小孩，自己拿吧 ” 靠诚信 小小馒头店“无人售货”10多年无赖账（视频）	未
去新疆的时候，我看到北斗七星就在我侧脸旁边。在海南了，我看不到北斗七星了。 三亚  河西路	未
去旅游时一定要注意，千万别买这些冒充翡翠的东西	未
去日本可以不买SKII，这个一定要买	未
//@去日本吃什么:	未
去时的大雪完全停了，我打开天窗，车顶残留的雪落了我一头，能看到很多星星，凉凉 的空气好得不像话，喇叭里的音乐也从重金属变成了钢琴曲，突然我就伤感起来了：你只是勤奋工作，努力做好自己，结果很多你的同行就要倒闭了，生命真残酷啊	未
去机场，因为汉堡没有优步（德国只有在慕尼黑和柏林有小规模运营，其他城市都禁止），下了个德国的叫车app：mytaxi。打开以后功能和滴滴一样，可以叫车，预定，电子支付，预估价格等一目了然。和滴滴比只有出租车，没有顺风车或者专车，还有一个选项是可以和他人拼出租车，收费价格更低。叫了以后很快 ...全文	未
去机场，因为汉堡没有优步（德国只有在慕尼黑和柏林有小规模运营，其他城市都禁止），下了个德国的叫车app：mytaxi。打开以后功能和滴滴一样，可以叫车，预定，电子支付，预估价格等一目了然。和滴滴比只有出租车，没有顺风车或者专车，还有一个选项是可以和他人拼出租车，收费价格更低。叫了以后很快有人接单，距离2分钟，收拾完下楼出租已经到了，新E柴油，司机打招呼，确认地点，然后把两个大箱子放到后备箱发出发。到机场大约30分钟，30欧，主动加了10小费，多种支付方式，因为绑定了paypal，直接扣款，很方便。司机	未
去机场将只用半个钟！一文了解龙岗2018交通建设新进展！	未
去机场将只用半个钟！龙岗2018年交通最新进展都在这了！	未
去机场接锅锅爸了	未
去杠杆下半场 急速泛海系按下“慢进键”？	未
“去杠杆”下成本抬升 浙民企聚主业寻突围	未
去杠杆去一半，又要加起来了	未
去杠杆挤泡沫 新经济行业如何过冬投资人认为，寒冬里还有机会。快手产品副总裁徐欣认为，在这个阶段，最重要的仍然是为用户创造价值。网易有道CEO周枫同样认为，在市场低迷资源匮乏的时候更应该强调匠心和创新。 去杠杆挤泡沫 新经济行业如何过冬	未
去某网客服呆了半年，我的一位朋友的弟弟开的书单	未
去某银行办业务，因为是午休时间中午，开的窗口很少，一个接待普通客户一个接待VIP客户。大厅等待的人比较多，顾客就开始抱怨。然后一位女职员过来解释，中午职员都去吃饭了。顾客说，我们也没吃饭，其实你们可以安排轮着吃，窗口可以多开几个。可能顾客的语气比较强硬，突然冒出来一个男职员，说了句就当我们这里人都死光好了，我们就两个窗口。哇，不敢相信这是2018年大城市的服务性行业，太可怕了，一副死猪不怕开水烫的样子。白眼翻上天，想着要不要把钱拿出来，把账户关了。戾气好重。	未
去梅溪湖板块购房者七成是外来人口	未
去毒之路：纺织行业在中国的绿色挑战中外对话气候传播项目负责人武毅秀：纺织行业消除有毒化学品的行动在中国已进行了7年，成果如何去毒之路：纺织行业在中国的绿色挑战查看图片	未
去泡温泉的博罗人请看看，你泡的是真温泉抑或是锅炉水	未
去泰国买什么不超过100块的好物清单，拿走不谢！ 亲测确实不赖啊	未
去泰国旅游到底多便宜月薪两千也能说走就走！！	未
去泰国逛吃逛吃	未
去泸沽湖游玩，如果有条件一定要住湖景房，晨起推开窗帘看湖景的心情是无法轻易用言语来表述的云南旅游攻略君（如需报名参加豆花名宿的旅游行程，请提前7天以上预订，感谢你的关照！）豆花名宿旅拍团泸沽湖旅拍两日游	未
去洗车时偶尔上装逼的老同学，没想到是最后	未
去测测看吧	未
去海边 by @左简- 胶片的味道	未
去湖南玩吗各位	未
去澳大利亚旅游的时候可以钓哪些鱼	未
去濮阳的注意了！今天开始濮阳城区实行单双号限行	未
去特么的足球梦。]每日笑话微博	未
去珠峰的都是硬核玩家	未
去琉璃厂看鼻烟壶 百余件清末民国内画鼻烟壶罕见展出	未
去的是乐天世界滑冰场 已经确认离开后才上传的视频 查看图片	未
去看病，医生让我去买这个药......我：	未
去看看被海洋环抱的城市吧	未
去看看被海洋环抱的城市吧三亚客户：@冉妮Near-	未
去看雪重庆生活	未
去眼袋的帮手五个穴位	未
去睡会，快收盘了再起来看吧。。	未
去瞄了一眼，享骑在2楼，还有14楼，都在2楼办理退款。	未
去经历，然后去后悔，去做你想做的，去选你爱的，而不是别人眼里正确的，你的一辈子应该为自己而活。	未
去肯德基喝咖啡，竟然牵了王源白宇的手	未
去苗寨旅游姑娘的这个东西，千万不要拿，除非你想负责到底	未
去莫干山睡几晚，不如在这里过一生。	未
去萨尔瓦多，先要知道这些	未
去蛇馆看各种蛇，估计蛇冬眠了，一动不动，完了旁边一个中年人使劲儿在那丝丝丝丝丝的吐舌头，还敲玻璃，似乎想唤醒蛇感觉现在城里的中年人令人难以理解	未
去血液中心献，去流动献血车献，只要想献，总是可以做到的。//@anarchy_whale:回复@疫苗与科学:不献，谢谢。北京市医院不支持公共献血。	未
去西安就是要吃吃吃	未
去西安应该怎么玩	未
去西藏的人，为什么一定要去大昭寺朝拜?	未
去见你想见的人吧，趁阳光正好，趁微风不噪，趁他还在，趁你未老。	未
去见你的路上 风都是甜的	未
去赏灯的朋友们请注意	未
去超市可不是 go to supermarket，老外从来不这么说！ 美语笔记	未
去超市，我只看吃的	未
去超市戴眼镜，减少外卖和外餐。天王星金牛座 自己的身体自己负责。	未
去过100次枫泾古镇，你也未必知道这些隐藏的地道玩法梦里的江南水乡，一排排红灯笼挂着，舟船木桨摇曳着其实你去过很多次枫泾古镇，但你知道这里最地道的逛法是什么吗今天一起来学习下！	未
去过上海迪士尼的人，都到这里打卡了	未
去过丽江的人怎么评价丽江 在丽江买过房子的举手	未
去过冬天的西藏，才算看过真正的雪域天堂	未
去过猊鼻溪，怀念啊	未
去过的地方越多，越知道自己想回什么地方去。见过的人越多，越知道自己真正想待在什么人身边。	未
去过这个村的人都惊讶，张家港居然还有这一手！	未
去过这些地方以后，再也不想出国了！	未
去过这些地方，再也不想出国了	未
去过这些地方，就再也不想出国了！	未
去过那么多次三亚，这次真的是一次最特别的三亚游了，可能是因为有阿崔在身边，连以前浏览过的风景这一次都有了新的感觉不仅打卡了许多小众景点和特色美食去三亚国际免税店陪阿崔血拼买买买，还体验了一场极致梦幻的灯光秀身边有最爱的人，一起看最美的风景，还有什么比这样的旅程更令人向往呢， ...全文	未
去过那么多次三亚，这次真的是一次最特别的三亚游了，可能是因为有阿崔在身边，连以前浏览过的风景这一次都有了新的感觉。不仅打卡了许多小众景点和特色美食去三亚国际免税店陪阿崔血拼买买买，还体验了一场极致梦幻的灯光秀。身边有最爱的人，一起看最美的风景，还有什么比这样的旅程更令人向往呢，带上你的挚爱，一起来体验这场与众不同的SK-II灯光秀吧	未
去这些地方旅行，去做做这些事。世界这么大，慢走慢点儿，慢慢看！ .	未
去这儿吃麻辣烫，你要不知道这些，你就亏大了！！	未
去逛了豫园，买了张小画。	未
去逸站搜了下 发现以前确实看过 但总觉得是在电视上看的	未
去過尼泊爾道路真的很危險 喜歡這個國家，住著很多「神」... 願善良純樸的他們能避免所有災難， 逝者安息我相信你們已經在天堂，無病無痛，自由自在！	未
去银行取钱的都注意啦，新闻已曝光，都看看！	未
去长沙坐火车的赶快告诉家人火车站出的事！	未
去雪乡旅游到底要花多少钱	未
去雪乡旅游遇纠纷第一时间先行赔付！黑龙江省设立旅游诚信基金	未
去青岛，除了旅游，原来还可以做这件事	未
去非洲娶黑妞，过奢侈糜烂的资产阶级生活	未
去靠近一个给你正能量的人。	未
去韩国首尔必买的纪念品！地铁站牌钥匙扣5000韩元一个在明洞观光信息中心就能买到对于追星汪来讲，图9那站是必入的吧哈哈哈哈地址：   66   1cr.Instagram	未
去飞吧，少年	未
去餐饮商家的供货源头吃吃喝喝，你说能不爽吗丨XX玩乐团	未
去香港扫货，这些东西不能带干海参，濒危动物制品干海马，进口水果，香料用的小豆蔻，白色珊瑚，来源不明的肉类产品，濒危物种制品双吻前口蝠鲼鳃，各种燕窝，肉粽咸鸭蛋乳猪及各种生或熟肉类制品等，这些统统都不能带！违反者还可能被处以罚款5000元以下的行政处罚。情节严重的将面临刑事处罚。	未
去高原旅游，这些准备一定要做好	未
去鲅鱼圈要注意！所有22处高清电子抓拍地点公布，互相转告！	未
县中医院召开科室工作会应对四季度病人就诊高峰	未
县交警大队：交通安全日宣传活动走进幼儿园	未
县人大常委会召开食药品安全工作专题询问会	未
县人大常委会调研农村道路畅通工程	未
县人大开展食品药品安全赣鄱行活动	未
县供电公司2018年停电预告（12月3日-12月9日）	未
县供电公司2018年周停电预告（11月26日-12月2日）	未
县公安局交警大队致全县职业驾驶人的一封公开信！	未
县公安机关以岐石镇为重点，开展冬季追逃1号统一清查 行动	未
县公安通告	未
县公路站：道路植树添新绿	未
县区危房改造移民搬迁转移就业补贴......有关政策	未
县区涉及危房改造移民搬迁转移就业补贴有关政策	未
县区西乡召开全县网信工作会议	未
县医院出的事！大家都看看	未
县医院和中医院实现医保跨省结算住院费，附办理流程！	未
县医院大夫提醒两点注意事项，让你少受吃亏少跑路！	未
县医院工作人员在二中门口垃圾桶捡到一女婴真相来了...	未
县医院里来了位“洋”医生  一位病人看到他竟然吓跑了……	未
县医院门口一女婴被遗弃，求领养，疯转运城人朋友圈真相是	未
县司法局深入石窑开展走访慰问	未
县城五星街一楼顶发生火情，消防队火速救援！	未
县城城市外环线最新进展来了！	未
县城新增多处电子警察	未
县城空气中闻到臭味！?网友说像	未
县城管局着力整治乱停乱放三轮四轮车辆	未
县妇联联合宿松公益协会开展四净两规范活动	未
县委书记与女副局长床照被曝光	未
县委书记与女副局长床照被曝光，结果...	未
县委书记与女局长不雅画面被直播，视频有人想卖5000万！	未
县委书记与女干部光着身子在床上办公的照片被刷屏！	未
县委书记佘龙到省扶贫办汇报脱贫攻坚工作	未
县委书记刘博夫到虞姬乡陈埝村走访慰问脱贫户	未
县委书记卧室被偷拍，床上视频流出！女主角竟是小23岁副局长	未
县委书记卧室被偷拍性爱视频流出！女主角竟是小23岁副局长	未
县委书记和女副局长性爱视频曝光！还牵出5000万敲诈勒索案	未
县委书记和女副局长的这个视频曝光！还牵出5000万敲诈勒索案	未
县委书记大肆卖官鬻爵牵出34人，市委让该县尽快“站起来”	未
县委书记张长瑞以一名普通党员的身份参加了县委办公室党支部党员大会	未
县委书记：当官的让老板请吃饭那是不要脸前段时间，因为一段为解决百姓孩子上学现场喊话上访群众的视频，现年52岁的安徽省阜阳市阜南县委书记崔黎成超级网红。日前，他又因为当官的让老板请吃饭，那是不要脸！的雷语刷屏网络......昨日，阜南县委书记崔黎的一段视频疯传朋友圈，并被各大门户网站转载传播。阜南崔书记又现视频：当官的让老板请吃饭，那是不要脸！	未
县委书记房延生实地调研城区供暖，投诉电话公布	未
县委书记林昌富现场核实第25批转办信访件	未
县委书记蔡淡群先后深入到隆江葵潭这些省定贫困村调研！	未
县委书记被偷拍私密视频，敲诈5000万！（视频）	未
县委书记赵宇调研矿山秩序整顿工作	未
县委副书记刚提名县长人选因车祸殉职 车上2死1伤	未
县委副书记县长刘兵到韩村镇苏沙窝村指导软弱涣散村整顿工作	未
县委副书记林志成约谈县创卫工作6个责任单位	未
县委宣传部召开第一期通讯员轮训总结暨舆情工作安排会	未
县委巡察组对第四轮被巡察单位反馈巡察意见	未
县委巡察组将对这4个单位开展巡察	未
县委巡察组进驻6家单位，看看这些单位负责人怎么说	未
县委常委会议研究一村一辅警和城市快警建设	未
县委政法委深入联系村开展调研慰问活动	未
县委正巡查南部这个镇，多种举报方式公布	未
县委第一第二第三巡察组分别进驻前杨镇大榆树堡镇高台子镇开展巡察及巡察回头看工作	未
县委第七轮巡察开始，这些单位将要接受体检	未
县委第三巡察组巡察县政务中心情况反馈会召开	未
县市场监管局召开作风纪律整顿调度会	未
县市监局深入乡镇村寨开展打传防传工作	未
县广播电视台全台党员进村开展五个一结对帮扶活动	未
县应急办开展应急知识户外宣传活动	未
县底冠堂村里，这五万多钱的东西，一下子就...	未
县底镇龙山村民们，夜晚时，你地冇有使惊了！	未
县总工会：开门办工会，惠民政策活起来	未
县执法局持续开展流浪狗专项整治行动	未
县政协主席陈建华一行到县公安局视察调研全县交通秩序综合整治工作	未
县政协八届三次全会重点提案办理协商会召开	未
县政协召开九届第十二次常委会	未
县政协召开对县直单位民主评议专题常委会	未
县政府办到安良组织开展植树添绿党旗增辉主题党日活动	未
县政府发布重要通知！永清人注意！	未
县文明办一行到我院实地考核	未
县文明办陈香云主任到我院实地考核	未
县旅游安全生产专委会对沙堆紫鸡岩度假区复核检查	未
县检察院切实加强生态检察工作	未
县民政局关爱毛市镇南剅小学留守未成年人	未
县法院举行公众开放日活动	未
县直幼儿园闯进一名劫持者	未
县督查组对企业招工招聘秋季专项行动进行督查考核	未
县税务局：双送到田间 缴费网上行	未
县税务局组织干部职工接受廉政文化教育	未
县红十字会走进城南工业园开展应急救护培训	未
县级广播电视缺节目？政府掏钱打造全省电视节目共享平台	未
县级政府城投债意料违约 担保齐全仍逾期会成为常态吗问题最早出在第五期产品上，本息兑付的时间是10月3号，但几天过去都没动静于是，我们找城投公司负责人和县领导层面开始沟通，对方说要延期一个月兑付一位投资者顾先生告诉记者12月5日，经济观察报获得的材料显示，这款名为三都水 ...全文	未
县级融媒体中心建设路径，必须规避这些前车之鉴！	未
县纪委通报2起发生在群众身边的腐败问题典型案例	未
县综治工作检查组来慈利公安检查综治工作	未
县行政执法局多举措开展中兴菜市乱象整治行动	未
县里医生进了村，老伴哎，我们赶紧去看看	未
县里发话，安福这类人将要严打！	未
县长亲上央视吆喝：又到奉节脐橙香甜时！	未
县长办公会事关消防安全整治凤城城厢申请设立社区居委会	未
县长帮咱搞卫生！	未
县长石小松上门送服务，协调解决企业在发展中遇到困难和问题！	未
县长赵甲宏检查禁毒工作站建设工作	未
县长镇长村长都要被清查，国家发放补贴拿不到农村苍蝇详细举报方式（扩散）！	未
县领导到上塘镇进行扶贫项目督导调研	未
县领导吴宗发赴县人民医院讲授专题党课	未
县领导每天都在忙什么	未
县领导调研网格化管理监督指挥中心工作开展情况	未
县领导走访慰问维和部队军人家属	未
县领导走访省农博会遂昌参展企业	未
参kao消息真让我大开眼界，光看标题还以为是洋葱新闻	未
参与NBA吐槽大会话题讨论，超多现金红包等你拿！	未
参与NBA吐槽大会 话题词讨论抢红包咯	未
参与三峡马，遗憾没带摄影师不要紧，这里可以免费下载照片！	未
参与了吗	未
参与制定规则——大众体育发出“中国声音”	未
参与博山人，文明城市创建应知应会，你get没（一）	未
参与//@喜脉洗脉:评论哈哈哈//@Hey寄居蟹你家住哪:蹲一个评论	未
参与逐年递增的艾滋病，关于这些问题，和县人你能回答多少	未
参加1000公里的山地竞赛用什么车	未
参加一个活动，在活动场所的院子门口堵四十五分钟。现在想回家了。	未
参加了这次国考，还能报2019年省公务员考试吗	未
参加同学聚会，发现穷儿媳是董事长女儿！	未
参加失业保险就能领到失业金吗需要三个条件滨海新区政民互动 网民留言：我是由于种种原因，自愿辞职的。是否可以在社保局领取失业金需要办理什么手续。我生活不太好，需要钱。自己也没什么门路。领几个月是几个月。我听说被辞退才能领取是吗自愿辞职可以领吗有说法吗去哪里咨询这些问题天津市人力社保局回复：失业人员具备下列条件的，可以领取失业保险金：（1）失业前所在单位和本人按照规定参加失业保险，且累计缴纳失业保险费满一年（2）非因本人意愿中断就业（3）已办理失业登记，并有求职要求。	未
参加婚礼，被音响震得心脏嘎嘣嘎嘣疼，感觉自己要窒息了	未
参加小区党员换届选举大会，没想到现场乌泱乌泱的人，这么小的小区居然有五个支部，我们这个支部接近50人，感觉平均年龄应该得有60岁，最年长的90多岁  十分钟删	未
参加就业培训后，这些雄安人纷纷走上工作岗位	未
参加工作后似乎第一次一个月没飞。能飞真好，机场餐真香，机场水泡茶真甘甜。。。这就是传说中的贱吧	未
参加省委书记的座谈会 扬州这位校长说了啥	未
参加职工医保还是城乡居民医保，看这里全明白了！	未
参加这种比赛 ，女选手自曝遭猥亵 事发在无锡这个偏僻的地方	未
参战老兵为生死约定，一诺三十多年！	未
参照这个季节分布，现在对一个身在北方的妹子说：想你，从秋季穿越冬季大家认为是否可撩	未
参禅：全神贯注，念者是谁	未
参禅的目的，在明心见性，就是要去掉自心的污染，实见自性的面目。污染就是妄想执着，自性就是如来智慧德相。如来智慧德相，为诸佛众生所同具，无二无别。若离了妄想执着，就证得自己的如来智慧德相，就是佛，否则就是众生。	未
参考今天凌晨费莱尼对贡多齐的这个动作，C罗当初对阵瓦伦西亚的欧冠小组赛中被红牌罚下是不是太冤了	未
参考价来了 九寨黄龙同季跟团游最高价差1200元	未
参考快评印度试射洲际导弹针对中国这个解读为何狭隘近日，印度试射了可以覆盖中国全境的烈火-5洲际导弹，有媒体开始炒作，这一洲际导弹是为中国量身定做的专家称，不能因为印度试射烈火-5洲际导弹就将其视为向中国释放所谓警告信号印度始终希望成为全球大国，因此不必对此 ...全文	未
