响水服务区修理卡车要交场地费连盐城本地人都宰！	未
响水水岸桃园这辆车撞的不轻，又是酒驾	未
响水街头卖鞋垫的夏大爷 捡到手机还失主	未
响水谁认识苏JG382车主，请转告他，我已经报警了！	未
响水这群小记者走近中国好人周仁甫	未
响螺湾区域规划建设医院 正在进行选址工作滨海新区政民互动 网民留言：响螺湾区域内是否有引进大型医院等举措滨海新区政府回复：经向规国局咨询，其表示，所属片区正在选址，有建设医院的规划。	未
哎。	未
哎//@Utopia_G1:婚姻法在保护谁呢//@床上的Alice:害怕 //@尸姐:哎//@楚惜刀://@春风十里桃花至：30这个数据的来源 查看图片	未
哎//@一只长蘑菇哒兔兔:其实无论谁输谁赢，倒霉的总是那群手无寸铁的人而已//@发今天的芽儿咯:残忍的历史里总是欺负着女人与小孩	未
哎不是有人知道啥情况么这合作该不会是说华米准备自个儿发射卫星吧	未
哎，不要以身试法，非要不信邪，那是拿自己一辈子开玩笑。	未
哎，保险调查员什么都好，就是每个案子都太简单了每个单元都虎头蛇尾	未
哎，北京购车指标3万块，北京户口80万，就冲这报价，居然还能有人上当，我只能说，傻子太多，骗子都不够用了 过两天有人问你大熊猫100万一只，你敢买吗不敢不敢就对了！违法啊！！指标和户口也一样，买卖违法啊！	未
哎呀，不要说出来嘛	未
哎呀，怎么就火了呢	未
哎呀，我刚成都落地收到快递电话，日历寄到北京家里了等我回去看！！！好心水//@套鹿你丫:手账和笔袋很搭	未
哎呀//@洲坑里的狮子:我要看照片	未
哎呀，爷爷被妖精暗算了	未
哎呀，看把你能的，你个小偷敢跟张家口的警察赛跑，累不死你...	未
哎呀！礼物忘记抽了！哈哈哈哈哈！说话算数，送一个娇兰的隔离吧！评论12点前喊停ChouSong！	未
哎哟喂进袋袋（我在发什么神经	未
哎哟，好乖好暖的豆爹！！可惜是绿的/家宴 注意屏蔽关键词	未
哎哟，我们大一哥看到詹姆斯就把今天当成总决了	未
哎哟，我被这金色大连撞了一下腰	未
哎哟，还冻起来，太吓人了！	未
哎哟这暴脾气！挡了路还理直气壮砍别人的车！这样的人你也认识	未
哎 大噶看一下今天能不能扫大的出来kkkkk我刚起床 看下等下能不能点了！今天也拜托大噶了！	未
哎大夫，你上班咋还带耳罩啊。	未
哎，我今天不想再讲道理，我直接转发人家这个把道理说的清清楚楚的。我就想说，对许多人来说进道理根本没有用，评论和转发区看似大型秀智商现场可你们猜猜，这里头有多少人是真的听不懂不是不想让人知道她们懂	未
哎，我和没什么感觉的男生聊天，几句话就聊到他要约我出去，但是和喜欢的男生，几句话就把对方聊冷场了，我真的骚不到点上。	未
哎，我这个记仇的人，又想起来2014年7月在重庆，因为粉丝（不是只他一个人的）送机人太多惹恼了机场工作人员，sdfj推他一个人出来给机场道歉的事情了。可能对哥哥来说这没什么，是男人就要有担当有责任感，可对我来说，想起当年才13岁的你就要这样识大体，不心疼是假的	未
哎，晚上没鸟事。。。	未
哎，晚上没鸟事	未
哎！毕竟有生育之恩，能给就给点吧，不给是本分，给了是情分，记者就别跟着瞎掺和了！	未
哎没事，我们连三峡工程都搞定了，50万个麻醉师也能搞定。//@川云自去留:按一七年数据，全国麻醉师八万多人，想达到美国每万人麻醉师比例，缺口有三十到五十万人，这可真不是一点钱和十来年的差距。整个教育体系全面倾斜连轴转，也不是短期赶得上的。这是个百年底蕴的差距	未
哎，球迷性眼的成天哈说。	未
哎，看了一下mwz事件，各路自媒体的解读，令人感叹，大部分自媒体小编连乡镇和街道的组织结构都搞不清楚，就敢对国际重大事件进行全方位解读了，图样图森破啊	未
哎！真是晚了。。。	未
哎，老鼠说，这世界变得一天窄似一天。 当初它是那样辽阔，辽阔得我都害怕了。	未
哎，艰难维持在西部第五吧，还好有同城兄弟快船，今天也输了	未
哎，这年头光驱现在也是稀罕物了酒店附近找了三家图文店都读不了光盘哎，明天还得全城找光驱啊 郑州  未来路街区	未
哎//@这是一个很高冷的ID:什么//@嘤嘤嘤哭泣的小绵羊://@开水族馆的生物男:啧啧啧啧//@战争史研究WHS://@北京人不知道的北京事儿:再回顾一下这段表演，重新感受一下这仨的演技。。。交通事儿的秒拍视频	未
哎这猛兽养得啊花老师带你逛动物园 微博公开课微博视频	未
哎，领先太阳二十多分了，打球不中用，摆烂又不会，你刺干啥中用......NBA吐槽大会	未
哎//@黄鱼Veda: 去酒店还是要自带睡袋	未
@哏er都青年小彤tong爱生活：外环线15号桥津淄公路马上过桥奔市里方向，中间分路的那里缺了几个，有行人从这里过，开车很危险	未
@哑巴张的生死劫：现在在五号线从丹河北道到一附院的车上，车上的显示站点的都坏了，上车都蒙圈了	未
哑巴父亲养大的女儿，看哭所有人	未
哑火米兰0-0战平弗罗西诺内后，已经连续4轮意甲没有进球，这是1984年12月以来的队史最差纪录。	未
哔哩哔哩宣布收购网易漫画资产 加强ACG生态布局	未
哗众取宠还是确有其事基因编辑婴儿背后疑点重重	未
哗哗哗！嘉定金沙路水管破裂！供水部门连夜抢修！	未
哗啦啦！今日，东湖2宗2200平米的违建被拆除	未
哟，出什么事了主力都被老虾天天念经烦死了是吧只好不磨了，赶紧拉起来，否则，他们也要崩溃了！嘻嘻	未
//@哟您在这儿呢:然而向谁征税呢向交易所的豺狼银行大王国家债权人食利者和工业家去征税吗这不是取得资产阶级对于共和国同情的办法。《1848年至1850年的法兰西阶级斗争》	未
哟，都开始爆粗口了。爆粗口就有理了谁嗓门大，谁更会骂娘，谁就更有理了呗最关键，你不是很有理吗怎么还把我拉黑了让我都没法转我的丑闻了。这个所谓Anna队长的微博，居然都拿出来当实锤了，怕了怕了。这个G25买家就在北京，要不要约出来，找个第三方鉴定机构鉴定一下还有这个所谓安娜队长所污蔑的，我的每条车源，其中但凡只要有一台有事故泡水火烧，我自封微博如何明眼人一看就知道这分明就是个小号，而且完全是为黑而黑，大家看图3以及翻阅他所有微博就明白了。对于这种明显捏造的傻逼，我们可爱的草老师居然把它当做	未
哥 2号了都 还不回家啊	未
哥伦比亚一辆载有篮球队的大巴翻车 致13人死亡	未
哥伦比亚中卫穆里略租借加盟巴塞罗那	未
哥伦比亚共和国外交部长将访问中国 外交部回应	未
哥伦比亚发布对华U型和L型钢材反倾销调查终裁	未
哥伦比亚外长特鲁希略将访华	未
哥伦比亚熔化枪炮建反战画廊	未
哥伦比亚的无名冰川湖 .	未
哥，你不上我就上了//@虾饺蛋糕甜甜圈:哥哥上呀！！！//@万事风过耳://@卡李://@作者C://@临界丘://@染烟烟烟烟烟:哥，上吧//@cpyoverdosed:忒修斯.魔法部社保部部長.斯卡曼德//@吸吸不健康:来了	未
哥你别再说了，再说下去我都感觉你是不是被薛请来的公关专家了。 查看图片	未
哥俩好据报道，近日，边检站民警发现，一旅客面相与证件照片虽然很相似，但细节及气质却有差别，于是果断将其移交后台进一步甄别。钟某某供述了事实：听说在香港购买奶粉质量好又价格便宜，但工作较忙办证又嫌麻烦，他想到双胞胎弟弟办有往来港澳通行证，便萌生了用双胞胎弟弟证件非法出境的想法。	未
哥到北京了，今天只有-4太冷了，有没有什么土办法可以取暖	未
哥哥不愿把父亲的遗产分给妹妹，说“就算坐牢也不给钱”	未
哥哥不愿把父亲遗产分给妹妹：就算坐牢也不给钱	未
哥哥也要健康啊[给你小心心]	未
哥哥：你手机里有游戏吗	未
哥哥和弟媳及子女长期住一起警方一查，发现埋藏25年的秘密	未
哥哥因《伪装者》出名 弟弟曾获影帝 大家却不知两人是兄弟	未
哥哥在吗表情包哈哈哈哈哈哈哈评论里有毒	未
哥哥嫂嫂不孝，小姑子录下了这段视频，看哭千万人	未
哥哥当兵七年没回家 ，一回家就遇到妹妹被人欺负，他爆发了！	未
哥哥患有精神疾病，在家人不知情的情况下，他签署的房屋拆迁协议具有法律效力吗	未
哥哥的公司为了让职工尽孝，实行了这样一个法子	未
哥哥能三秒正中靶心，明年的奶粉钱可准备好	未
哥哥诶，今天都28号了，北京警方26号行动拘捕的人，你们一丁点也不知道	未
哥嫂为了拆迁款赶走弟弟，3年后弟弟回家，结局太解气了！	未
哥布林杀手到底长什么样网友发挥恶搞功力！	未
《哥布林杀手》剑之圣女并不是最惨的那一个，而她更让人心疼！	未
哥斯拉2：怪兽之王哥斯拉 正面刚 三头龙王者基多拉，下一秒会发生_________(看了很多遍还是被哥斯拉的甩肉跑姿萌到)	未
哥斯拉2:怪兽之王 海报哥斯拉基多拉魔斯拉拉顿四大怪兽齐聚一堂，哪一只才是怪兽之王?	未
哥斯达黎加图里亚尔瓦火山喷发 火山灰直抵圣何塞	未
哥本哈根的黄昏，夕阳的余晖给这座安静的城市带来了几分喧嚣	未
哥的电话来了， 赶紧接。接通， 瞬间涨停板，发达了	未
哥的电话来访，你接不接	未
哥空难客机坠毁时燃油耗尽	未
哦//@Lessess_：他可能比较想把这个灯牌骗回家//@清晨来到树下读书:凭借这个灯牌能不能把王源骗回家/	未
哦//@R等于U比I6482984355:这个博主要先关注才能评论，那这个博主我问问你，你用的难道不是一种卑鄙下作的方式去炒作想火吗，你还有什么脸天天在这喷这个喷那个。不敢出面，用网络暴力攻击别人。你这种人有什么资格瞧不起二本专科 我看你的素质更像没上过大学。	未
哦//@一心只想吃西瓜:[米奇大哭]//@喜脉洗脉:哭了//@暴暴三:哭了//@喜脉洗脉:服了//@坚持努力再努力X:哦是的	未
哦，今天忘记发微博了哈，因为下午没啥事，就在酒店休息，然后现在出发去和@冷面Lim 见面喝个酒，顺便问问他最近有没有带制作！	未
哦你妈哦 我这暴躁脾气//@桃施:经常遇见这种客服//@李知了:哈哈哈哈哈哈什么沙雕//@鬼才君:客服的本质就是复读机//@一只炸宝:这个客服是复读机，破案了	未
哦，原来他们指点的不是只有历史学工作者啊	未
哦，原来美国马路上掉东西也不要命的抢啊	未
哦！原来这样算的呀	未
哦吆，居然有图示。//@shajkdfjfjopfahf: 查看图片 //@奶粉揭秘 :说的就是大牌啊，小牌子也不敢买上千元啊。//@Jessica99018 :大牌也是这样	未
哦哟，泸州妹儿为什么急得跳脚原来为这事儿	未
哦哦哦改名开撕：田子鸡，不客气！曝料：冕徒一组星星飞机就给睡，手握开房记录！王冕拉群跟大哥要钱	未
哦，懂了//@无小广:前几个月提出的，地方六稳会有开过几次	未
哦//@我千:天哪，你们知道广东终于降温了吗，今天19度	未
哦 没影响，我早知道，年年扫盲	未
哦，猪瘟。厦航恢复猪肉餐食供应：对非洲猪瘟防御理解有误@厦门航空 24日称：近日因配餐部门对有关疫情防御措施理解有误，计划暂停机上餐食的猪肉供应。现经我司全面核查，厦航采购的所有猪肉产品均经过相关部门检疫合格，符合食品安全标准。目前航班的猪肉餐食正常供应。	未
哦老虎的部队也调过去了，现在他命令自己的部队在代尔祖尔省沿幼发拉底河南岸布防，随时准备越过幼发拉底河对东岸的IS发动进攻 查看图片	未
哦豁！自贡贡井十六路总站，一公交车刹车失灵撞到药店	未
哨位日历 今天不小心进入了哨位淘宝店铺的评论区被甜到了，也被感动到了传送门宝贝详情一号哨位2019哨位日历军人军属军迷台历原创设计	未
哨位日历 今日份儿口令 穿行在孤寂的边境线和无人知晓的岗哨，背对繁华，直面孤独，边防，边防，再见，边防一号哨位2019哨位日历原创设计军人日历创意台历军属军迷礼品	未
哨位日历 今日份儿口令 要有很多很多的钱，如果没有，那就有很多很多的爱，如果都没有，那有健康也是好的嗯一号哨位2019哨位日历原创设计军人日历创意台历军属军迷礼品	未
哨位日历 今日份儿回令 大家都收到日历没，可以组队用起来啦[笑而不語][笑而不語]一号哨位2019哨位日历原创设计军人日历创意台历军属军迷礼品	未
哨位话题  什么时候你觉得当兵光荣不记得这是什么时候哪位粉丝发给哨位君的了，再看还是感动 你呢，哪一刻被感动到，觉得当兵光荣一号哨位	未
哨位话题 兵哥的体力究竟多流弊[並不簡單]哨位妹跟我说，野外巡山，到山顶时她生无可恋地问兵哥：你都不喘吗兵哥淡淡地看了她一眼说：没有，还是要喘一点的。哨位妹的背囊兵哥在帮忙背，至于两人的背囊，不重，也就七八十斤吧诸位战友，都招了吧咱当兵的体力究竟多好，已经瞒不住了，是时候真相了一号哨位	未
哨长凌尚前：甘为南疆“守边树”	未
哪10个是你认为最不注重安全细节的交通违法行为	未
哪6家日化企业，在国内拥有过亿城市家庭购买	未
哪一个宝贝，是你看着TA长大的	未
哪一位同学和右边谈，谈成了提成3万。//@钓鱼岛主:我问了几次怎么移民缅甸了，你就装瞎！	未
哪一刻，你发现你爸妈在默默的守护着你看完这些答案，发现父母的爱真是全世界最容易忽略的事情。	未
哪个博主不穷站出来//@互联网的那点事:膨胀啊 AMG车主就是不一样//@来去之间:_//@flypig:考虑过我们这种真的很穷的博主的感受吗。。。	未
哪个品牌的客户对保时捷纯电动车Taycan最感兴趣答案是：特斯拉保时捷北美ceo在接受采访时表示，目前的预订量，已经超过了我们的产能，如果他们都买的话，很快就会销售一空预定客户有超过一半的人没有拥有过保时捷，主要是来自bba品牌的客户，当然最多的预订者来自特斯拉用户保时捷首款电动车T ...全文	未
哪个哈怂扫的雪把人气坏了！	未
哪个城市最安全？北京上海未入前十 原因令人意外	未
哪个城市最安全北京上海未入前十 原因令人意外近日一份有关公共安全的报告显示2018年全国城市公共安全感指数排序前4位依次是拉萨西宁杭州福州，四大一线城市都没进入前四，北京为第20位。而关于超大城市公共安全感指数偏低的原因，报告称：他们存储了更丰富的安全知识，对于安全感的评价更加真实另一方面政府突发事件信息披露也更加充分，大量接触灾害事故公共危机等方面的信息会在一定程度上降低他们的安全感。（来源：21世纪经济报道）	未
哪个城市最安全 ?北京上海未入前十 风险意识成安全感的一部分 12月15日，公共安全感蓝皮书：中国城市公共安全感调查报告（2018）在北京发布，位居2018年全国城市公共安全感指数前三的分别是拉萨西宁杭州北京上海广州深圳等一线城市由于风险意识曝光率焦虑等因素，生活安全感 ...全文	未
哪个城市最安全：北京未入前十 原因想不到 ，你的家乡呢	未
哪个女人录的太牛了！	未
哪个女孩不想活成欧阳娜娜，私服每一套都想pick	未
哪个女孩看了不落泪 热门 加热	未
哪个小可爱会被选中呢//@爱拆快递的安妮: 下午开啾！	未
哪个小姐姐不想拥有一个这样的婆婆	未
哪个我想围观看看//@风的节奏吹:100公里，支付100元，合理。那个巨婴删帖了吧	未
哪个时刻你突然发现，自己不是小孩了每晚一聊	未
哪个村儿的170万拆迁款刚到手，大祸就降临了..	未
哪个村出殡这场面第一次见	未
哪个村白事现场！实在太卖力气了...	未
哪个村的小媳妇，在家里录小视频，要火了！	未
哪个村的猪肉摊猜码，一街人看！	未
哪个村里扭秧歌，红火日塌了	未
哪个瞬间你理解了父母的某个思想或行为小时候好多次，妈妈抱我的时候，我总闻到她手上不好闻的味道。次数多了就略带嫌弃，问她时她总辩解：怎么会，我刚刚用香皂洗过的。 我就会执着地拿起她的手，大力吸鼻子：真的有味道。 妈妈就只好说：那我再去洗洗吧，或者岔开话题。是很 ...全文	未
哪个瞬间觉得自己老了	未
哪个瞬间让你觉得自己不是亲生的怀疑自己不是亲生的	未
哪个道理是你出了社会才懂的____________________________	未
哪些东西不能和奶粉一起冲调，这篇都有了	未
哪些东西你用过后再也不考虑其他牌子的了	未
哪些交通事故是不能私了的赶快了解一下！	未
哪些人可以参加城居保在同一单位连续工作超10年，单位有权终止劳动合同吗12333告诉你	未
哪些人需要检测艾滋病弋阳人进来看看	未
哪些从民航辞职的人，现在过得怎么样	未
哪些企业家候选改革开放百杰：BAT掌门和两家央企在职主帅	未
哪些企业榜上有名？社科院发布企业社会责任蓝皮书	未
哪些卖片的人为啥不找份正经工作删到我烦了	未
哪些城市出境游消费猛增 大数据统计结果让人意外	未
哪些属于违建大棚房鲅鱼圈专项清理整治，严守耕地保护红线！	未
哪些废品可以投给小黄狗最常见的可回收垃圾清单来啦！	未
哪些开车行为最消耗汽车寿命 哪些开车行为最消耗汽车寿命	未
哪些成都元素让人民日报连发3篇报道！	未
哪些操作属于挂证证书被公司扣下怎么办	未
哪些曾被集体免职	未
哪些植物人易唤醒最近，有关因意外成为植物人的车王舒马赫苏醒的消息刷屏。虽然后经求证，该消息并不准确，2014年舒马赫就已不再昏迷，但植物人这个词再次获得了关注。什么样的人才叫植物人苏醒几率多大	未
哪些消费不高不用签证的国家适合旅行	未
哪些皇马球迷是南方人，你们是不是这样过冬的	未
哪些药品可致过敏性休克	未
哪些菜让你感觉像发现了新大陆	未
哪些行业社会评价低？ 除了房地产还有几个想不到	未
哪些道理，几年前你不懂，现在懂了	未
哪些项目不计入工资总额，在计算社会保险费缴费基数时应予剔除	未
哪些食物让你被酒驾交警做了个实验男子吃完啤酒鸭，开车被查出酒驾喊冤：我只是放了7瓶啤酒！其实，蛋黄派豆腐乳荔枝等食物，药酒部分口服液（如藿香正气水左卡尼汀口服液环孢素A口服溶液）糖浆（止咳糖浆养阴清肺糖浆人参蜂王浆等糖浆剂）酊类药品（复方五味酊云 ...全文	未
哪些食物让你被酒驾交警做了个实验 男子吃完啤酒鸭，开车被查出酒驾喊冤：我只是放了7瓶啤酒！其实，蛋黄派豆腐乳荔枝等食物，药酒部分口服液（如藿香正气水左卡尼汀口服液环孢素A口服溶液）糖浆（止咳糖浆养阴清肺糖浆人参蜂王浆等糖浆剂）酊类药品（复方五味酊云南白药 ...全文	未
哪些食物让你被酒驾交警做了个实验男子吃完啤酒鸭，开车被查出酒驾喊冤：我只是放了7瓶啤酒！其实，蛋黄派豆腐乳荔枝等食物，药酒部分口服液（如藿香正气水左卡尼汀口服液环孢素A口服溶液）糖浆（止咳糖浆养阴清肺糖浆人参蜂王浆等糖浆剂）酊类药品（复方五味酊云南白药酊)，都可能让你被酒驾。济南交警实验室测试结果	未
哪些食物让你被酒驾交警做了个实验 男子吃完啤酒鸭，开车被查出酒驾喊冤：我只是放了7瓶啤酒！其实，蛋黄派豆腐乳荔枝等食物，药酒部分口服液（如藿香正气水左卡尼汀口服液环孢素A口服溶液）糖浆（止咳糖浆养阴清肺糖浆人参蜂王浆等糖浆剂）酊类药品（复方五味酊云南白药酊)，都可能让你被酒驾。济南交警实验室测试结果 via生命时报	未
哪些食物让你被酒驾交警做了个实验男子吃完啤酒鸭，开车被查出酒驾喊冤：我只是放了7瓶啤酒！其实，蛋黄派豆腐乳荔枝等食物，药酒部分口服液（如藿香正气水左卡尼汀口服液环孢素A口服溶液）糖浆（止咳糖浆养阴清肺糖浆人参蜂王浆等糖浆剂）酊类药品（复方五味酊云南白药酊)，都可能让你被酒驾。济南交警实验室测试结果一图解读	未
哪件是真正哺乳装不喜欢没哺乳就被看出来的哺乳装。	未
哪会有真正的佛系青年啊！只要是个普通人就一定会有在乎的东西，甚至你活着的理由也是因为在乎力不过你若真遇到一个啥都不在乎的人，那恭喜你，你遇到的绝对不是普通人，他是佛祖派来视察人间的真佛青年啊 佛系青年还俗了 网页链接	未
哪位乘客，昨坐100路丢了两张卡昨天上午9点左右，100路公交驾驶员李咸泉来到麦德龙停车场，进行发车前的车厢打扫工作。清洁到车厢前部的时候，他在投币箱旁边的角落里发现了两张面值1000元的家乐福超市购物卡。由于联系不到失主，李师傅第一时间将购物卡上交到了车队。据李师傅推测，这两张购物卡很可能是某位乘客上车刷卡的时候，从包里掏公交卡不小心掉出来的，乘客自己也没有意识到。如果失主看到信息，可以到100路公交车的终点站认领，也可拨打无锡公交服务热线82588088咨询。为了避免冒领，无锡公交将根据乘客提	未
哪位人才编辑的	未
哪位大神给我科普一下，在黄河上面电鱼违法吗	未
哪位大神能够告诉我，住在北京到底要怎样不被电哥一天被静电袭击的量如果能存起来的话我都可以当闪电侠了来自天天被静电袭击北漂小吴的呼唤	未
哪位好心的要买请帮我带一本！！！！	未
哪位沽源朋友钥匙丢了过来取一下！	未
哪位警察朋友科普一下这属不属于专业制服动作。	未
哪位课代表说一下这个字念什么克拉克拉	未
哪位领到的0.1是不是评论被吞了来找我，我给你红包	未
哪儿来的勇气你这是交警唐僧式执法，司机都乐了！	未
哪儿来的勇气你这是靖宇交警唐僧式执法，司机都乐了	未
哪十大品牌掌控着你的生活（来源：网易数读）	未
哪句话曾让你瞬间清醒	未
“哪吒”的“哪”应读 né，拼音没错	未
哪块区域的呀南都	未
哪天你不喜欢我了，一定要和我讲	未
哪家供暖公司有室温的截图或视频吗	未
哪家便宜用哪家！@山西人：移动联通和电信，你选谁	未
哪家商场//@一位不愿透露姓名的吃瓜猹：我在商场也经历过这事，相机不行但手机可以拍。问商场工作人员为什么的时候他告诉我反正规定就是不许用设备拍照	未
哪家 我要同款	未
哪家的熊孩子，居然躺铁轨，逼停火车！业主头顶竟有7个卫生间今天的节目预告请你查收	未
哪庄的送老殡，喝酒喝成这样...	未
哪庄送老殡，喝酒喝成这样...	未
哪怕不上班！我竟然现在就醒了并且睡不了懒觉了！！！太恐怖了！！这不是我！！	未
哪怕买了库里南，在某些方面依然节省，比如洗车。	未
哪怕抛掉出身的因素，我觉得你也未必干得过别人。	未
哪怕是28号当天给我一张票，我也会奋不顾身背着书包带上身份证带上一个充电宝和一台手机冲到机场买一张飞机票飞过去，再不疯狂，就没机会了 16年超少，朋友说他们在那拍戏，问我过不过去，我本来没打算去的，最后被说动了，看到最近的一趟班车是20分钟后，我背上包就冲到车站，没有直达车，半路还得下车换车，后来我为了省那十几块钱，从车站走过去目的地，那天我没看到他，又走回车站赶着最后一班车回去的。17年跨年，一直没有求到票的我还是带着俩小妹妹去了长沙，在最后一分钟花了6000买了两张票进去，那是我第一次花这么多钱买票	未
哪怕是多年以后 在某个路口看到那个和你相似的身影我的心也会猛得一颤	未
哪怕是差不多的ID设计，会营销的即使后发布，也占有先机。事实就是这么残酷。即使你事情都做对了，也有一个运气比你好，实力比你强的把你挤走。死了的，也不会得到半点怜悯。	未
哪怕最后失败了，也能给别人提供力量。	未
哪怕核电再危险，我们也还是忍不住造啊！	未
