别了纸质火车票！铁路总公司：电子客票明年全国推广近日，中国铁路总公司宣布：电子客票将于明年在全国全面推广旅客通过互联网订购车票之后，到达高铁站，无需换取纸质车票，直接可持二代身份证等有效身份证件通过进站口和验票闸机直接乘车即使没带身份证也没关系，进站前，在刷脸快速通道对着 ...全文	未
别了纸质火车票！铁路总公司：电子客票明年全国推广近日，中国铁路总公司宣布：电子客票将于明年在全国全面推广。旅客通过互联网订购车票之后，到达高铁站，无需换取纸质车票，直接可持二代身份证等有效身份证件通过进站口和验票闸机直接乘车！如果是在车站购票，旅客可以拿到一张购票信息单。有点像超市购物的小票，上面记录了旅客购票的车次座位号等信息，但这个不作为乘车凭证。同时，在绝大多数一二线城市将开通刷脸进高铁站！即使你没带身份证也没关系，进站前，在刷脸快速通道对着人脸识别机器看一眼，就可以直接进站乘车！vi	未
别了！纸质火车票！高铁电子客票的时代来临	未
别了，纸质车票！刚刚宣布！会计人赚到了！	未
别了，纸质车票！电子客票明年全面推广High speed trains in China will move towards paperless tickets in 2019， announced China Railway Corp recently. Passengers will be able to tap ID cards against a card reader at the ticket barrier to enter the station. Meanwhile， they	未
别了，纸质高铁火车票，电子客票明年将在全国推广	未
别了，纸质高铁火车票！铁路总公司宣布重大消息，明年全国推广	未
别了，网约车别了，装X的乘客！	未
别了，老布什！	未
别了，老蒲城！别了滨州这些地方的征收补偿标准出炉！范围庞大！又一大波村庄将	未
别了！荆州街头的158座报刊亭，是时候说再见了！	未
别了！药店！今天起，北京便利店可卖药	未
别了，药店！刚刚，北京正式宣布！	未
别了，药店！刚刚，北京正式宣布，又一场巨变来了！	未
别了，飞机 ！	未
别了，飞机！	未
别了，飞机！中国超级高铁要来了！从沧州到北京竟然只要3分钟！	未
别了，飞机！北京刚刚传来大消息...	未
别了，飞机！北京宣布：超级高铁要来了！	未
别了，飞机！央视刚宣布：超级高铁要来了！4000公里/小时	未
别了，飞机！央视宣布：超级高铁要来了！	未
别了，飞机！央视宣布：超级高铁要来了！常州到北京只要17分钟！	未
别了，飞机！央视宣布：超级高铁要来了，横跨全国仅需30分钟	未
别了，飞机！央视宣布：飞行列车要来了，横跨全国仅需30分！	未
别了，飞机！央视报道超级高铁要来了！郑州到北京只要10分钟	未
别了飞机！张家口人速看刚刚宣布：超级高铁要来了！	未
别了，飞机！超级高铁来了！太原到北京只要10分钟！	未
别了，飞机！超级高铁要来了 	未
别了，飞机！超级高铁要来了	未
别了，飞机！超级高铁要来了！4000公里每小时，广州到北京只要30分钟	未
别了，飞机！超级高铁要来了！临汾10分钟到北京！	未
别了，飞机！超级高铁要来了！丹东到北京只要13分钟	未
别了，飞机！超级高铁要来了！义马到北京只要12分钟	未
别了，飞机！超级高铁要来了！九江到北京只要20分钟	未
别了，飞机！超级高铁要来了！从化到北京只要30分钟	未
别了，飞机！超级高铁要来了！从岳阳到北京不到20分钟	未
别了，飞机！超级高铁要来了！从昆明出发到北京只要45分钟	未
别了，飞机！超级高铁要来了！从洛阳到北京不到20分钟	未
别了，飞机！超级高铁要来了！从漯河到北京不到20分钟	未
别了，飞机！超级高铁要来了！信阳到北京只要16分钟！	未
别了，飞机！超级高铁要来了！兰州到北京只要23分钟	未
别了，飞机！超级高铁要来了！到海南只要40分钟	未
别了，飞机！超级高铁要来了！北京到广州只需半小时	未
别了，飞机！超级高铁要来了！北京到郑州只要10分钟	未
别了，飞机！超级高铁要来了！南充到北京不到90分钟	未
别了，飞机！超级高铁要来了，南宁到广州只用8分钟你敢坐吗	未
别了，飞机！超级高铁要来了，南昌到北京只要20分钟！	未
别了，飞机！超级高铁要来了！南昌到北京只要20分钟	未
别了，飞机！超级高铁要来了！南昌到北京只要30分钟	未
别了，飞机！超级高铁要来了！南通到北京不到1个半小时	未
别了，飞机！超级高铁要来了！合肥到上海只要8分钟	未
别了，飞机！超级高铁要来了！吉林到海南不到40分钟	未
别了，飞机！超级高铁要来了！呼和浩特到北京不到10分钟	未
别了飞机！超级高铁要来了！哈尔滨到海南仅需40分钟！	未
别了，飞机！超级高铁要来了！哈尔滨到海南只要40分钟	未
别了，飞机！超级高铁要来了！哈尔滨到海南只要40分钟（视频）	未
别了，飞机！超级高铁要来了！唐山去北京不到3分钟！	未
别了，飞机！超级高铁要来了！太原到北京只要10分钟（视频）	未
别了，飞机！超级高铁要来了！威海到北京只要十几分钟！	未
别了，飞机！超级高铁要来了！婺源到北京只要20分钟你敢坐吗	未
别了，飞机！超级高铁要来了！安阳到北京只要10分钟	未
别了，飞机！超级高铁要来了！常州到北京不到30分钟	未
别了，飞机！超级高铁要来了！广州到北京只要30分钟	未
别了，飞机！超级高铁要来了！延吉到北京只要10分钟！	未
别了，飞机！超级高铁要来了！当涂到北京不到17分钟你敢坐吗	未
别了，飞机！超级高铁要来了！德州到北京只要5分钟！	未
别了，飞机！超级高铁要来了！忻州到北京大约要6分钟！	未
别了，飞机！超级高铁要来了！昆明到北京只要40分钟你敢坐吗	未
别了，飞机！超级高铁要来了！未来中山到北京只要30分钟	未
别了，飞机！超级高铁要来了！未来江门到北京只要30分钟	未
别了，飞机！超级高铁要来了，杭州到北京不到30分钟！	未
别了，飞机！超级高铁要来了！株洲到北京仅需45分钟	未
别了，飞机！超级高铁要来了！横跨中国仅1小时	未
别了，飞机！超级高铁要来了！江北人到北京只要30分钟！	未
别了，飞机！超级高铁要来了！沈阳到北京只要10分钟	未
别了，飞机！超级高铁要来了！沧州到北京只要3分钟	未
别了，飞机！超级高铁要来了！泰安到北京只要7分钟！	未
别了，飞机！超级高铁要来了！洛阳到北京只要12分钟	未
别了，飞机！超级高铁要来了！洪洞到北京只要10分钟！	未
别了，飞机！超级高铁要来了！济宁到北京只要15分钟	未
别了 ， 飞机！超级高铁要来了！淄博到北京仅需9分钟	未
别了，飞机！超级高铁要来了！滕州到北京只要10分钟	未
别了，飞机！超级高铁要来了！潍坊到北京只要8分钟	未
别了，飞机！超级高铁要来了！烟台到北京只要10分钟！	未
别了，飞机！超级高铁要来了！盖州到北京只要10分钟	未
别了，飞机！超级高铁要来了！石家庄到北京只要5分钟	未
别了，飞机！超级高铁要来了！石家庄到广州只要30分钟	未
别了，飞机！超级高铁要来了！秒杀高铁和民航，济宁到北京只要15分钟	未
别了，飞机！超级高铁要来了！绍兴到北京只要20分钟你敢坐吗	未
别了，飞机！超级高铁要来了！衡阳到北京只要20分钟	未
别了，飞机！超级高铁要来了！贵港去北京不到30分钟	未
别了，飞机！超级高铁要来了！赤峰到北京只要10分钟	未
别了，飞机！超级高铁要来了！辽阳到北京只要10几分钟	未
别了，飞机！超级高铁要来了！邯郸到北京只要7分钟	未
别了，飞机！超级高铁要来了！郑州到北京只要10分钟	未
别了，飞机！超级高铁要来了！银川到北京只要18分钟	未
别了，飞机！超级高铁要来了！锦州到北京只要8分钟	未
别了，飞机！超级高铁要来了！长春到北京只要10分钟！	未
别了飞机！超级高铁要来了！长春到北京只需10分钟！	未
别了，飞机！超级高铁要来了！长治到北京只要9分钟	未
别了，飞机超级高铁要来了！阳江附近到北京只要30分钟	未
别了，飞机！超级高铁要来了！韶关附近到北京只要30分钟	未
别了，飞机！超级高铁要来了！驻马店到北京只要12分钟	未
别了，飞机！超级高铁要来了！驻马店到北京只要20分钟	未
别了，飞机！超级高铁要来了！鲅鱼圈到北京只要10分钟	未
别了飞机 超级高铁要来了 鹰潭到北京只要20分钟	未
别了，飞机！超级高铁要来了！黄冈到北京只要15分钟	未
别了，飞机！超级高铁要来了！黑龙江到北京只要20分钟	未
别了，高铁票！	未
别了，高铁票！别了，广告位！	未
别争着卖粮！厂家正在试探性降价	未
别人P照片他P马路！苏州男子把双黄实线涂成虚线12月19日，苏州交警大队民警发现，长沙岛有一名男子拎着黑色油漆和刷子，将道路中央部分黄色标线涂成了黑色，原先的双黄实线，变成了双黄虚线。经询问，男子为长沙岛一饭店员工。他说，因为道路中央是双黄实线，过往车辆无法转弯掉头，影响了饭店的 ...全文	未
别人倒茶给你，为何一定要敲三下桌面	未
别人借你钱不还的经历你有遇到过吗朋友之间要不要经济往来	未
别人偷我的车，那我就偷别人的！男子化悲痛为动力，结果......	未
别人公司年终奖900万 而我正在想咋让老板看到这篇文章据美国媒体报道，电子烟初创公司Juul Labs内部人士透露，在与万宝路香烟生产商奥驰亚集团达成128亿美元投资协议后，Juul管理层决定发放20亿美元年终奖，以特别股息形式向公司的1500名员工发放，平均每人将得到130万美元，相当于一个硅谷底层码农的10年底薪。别人公司年终奖900万 而我正在想咋让老板看到这篇文章	未
别人再好，也是别人自己再不堪，也是自己，独一无二的自己	未
别人卷裤脚是为了秀腿，娄艺潇卷裤脚却为了秀鞋子，令人笑喷！	未
别人发文拼的是忙碌医生拼的是思路！	未
别人吃香蕉通便你吃香蕉便秘，想知道原因吗？	未
别人家学校食堂！不仅仅是给学生餐卡返钱	未
别人家扫出来的红包码，前排吸一波欧气先	未
别人家泡的药酒	未
别人家的两个儿子	未
别人家的公司！人均130万美元年终奖在与万宝路香烟生产商奥驰亚集团达成128亿美元投资协议后，电子烟初创公司Juul管理层，决定发放20亿美元年终奖，以特别股息形式，向公司的1500名员工发放，平均每人将得到130万美元！相当于一个硅谷底层码农的10年底薪...via.@新浪财经	未
别人家的公司：让你目瞪口呆的超级年终奖！1500名员工人均130万美元作为与万宝路（Marlboro）香烟生产商美国奥驰亚集团（Altria Group）达成的投资协议的一部分，美国电子烟创业公司Juul Labs将获得20亿美元的一次性股息，而公司决定将这笔资金作为年终奖，发放给旗下1500名员工，也就是说 ...全文	未
别人家的公司：让你目瞪口呆的超级年终奖 1500名员工人均130万美元作为与万宝路香烟生产商美国奥驰亚集团达成投资协议的一部分，美国电子烟公司Juul Labs将获得20亿美元的一次性股息，而公司决定将这笔资金作为年终奖，发放给旗下1500名员工，平均每个人能拿到130万美元。据悉，Juul Labs是目前 ...全文	未
别人家的公司：躺着也能挣钱？睡够6小时就发钱！	未
别人家的女儿	未
。。。别人家的婚礼	未
别人家的婚礼//@房舍扶摇:这得多少钱//@我是你的好人:实名羡慕	未
别人家的婚礼现场竟然有陈！小！春！看完想马上到格乐利雅结婚！	未
别人家的学校系列，把运动会走成了cosplay	未
别人家的孩子！7岁男童测评玩具年入1.5亿元	未
别人家的宠物洗澡时是这样的，而自己家的，哎	未
别人家的导师，礼物都这么有心	未
别人家的小镇	未
别人家的小镇（2）	未
别人家的方便面	未
别人家的未成年人保护	未
别人家的汉堡。。。	未
别人家的汉堡，看饿了。。。	未
别人家的狗子	未
别人家的狗子送养儿子34年后求助遭拒	未
别人家的男朋友永远都不会让人失望 搞笑	未
别人家的空气质量	未
别人家的车（机）库	未
别人家的运动会，鉴定完毕，是一群狼人！ 微博视频	未
别人对你好 你要争气 图日后有能力有所报答别人对你不好 你更要争气 望有朝一日 扬眉吐气	未
别人怎么对你，你用相同的态度回应就是了，生而为人，谁都是第一次。	未
别人怎么对待我，这是我的因果。我怎么对待别人，这是我的修行。	未
别人怎么对待我，这是我的因果我怎么对待别人，这是我的修行	未
别人恐惧时贪婪，行情不好时跟着巴菲特应该没错！当股市行情岌岌可危时，坐拥1000亿美元现金，由股神巴菲特掌舵的伯克希尔哈撒韦公司看起来是一个不错的选择。由于该公司重仓苹果富国银行和美国银行等银行股，截至周一，该公司投资组合损失约300亿美元。 别人恐惧时贪婪，行情不好时跟着巴菲特应该没错！	未
别人想什么，我们控制不了别人做什么，我们也强求不了。唯一可以做的，就是尽心尽力做好自己的事，走自己的路，按自己的原则，好好生活。即使有人亏待了你，时间也不会亏待你，人生更加不会亏待你！	未
别人拍的粘土人照片，再看看自己拍的照片	未
别人撒盐伤不了你，除非你身上有溃烂之处。	未
别人是女娲用手捏出来的，你是女娲用脚搓出来的	未
别人村的干部！扶贫朋友圈是这样的....	未
别人毁谤你，是因为你优秀别人利用你，是说明你有价值别人嫉妒你，说明你走在他前面别人用言语打击你恶意炒作你，说明你很有影响力所以不要生气要争气，要开心不要伤心，要突破不要看破生活原来像镜子，你笑他也笑，你哭他也哭，坚持做原创的你近君子远小人，笑对生活！ ...全文	未
别人用来洗衣服的东西，广东人拿来做糖水！事实竟然是	未
别人的18岁！澳大利亚女孩欲打造“房车”旅行	未
别人的23岁重庆事儿	未
别人的31岁 总是那么的可望不可即	未
别人的嘴，自己的路	未
别人的孩子不幸遭遇车祸，悲痛欲绝，她居然笑的出来！ 网页链接	未
别人的恋爱是段，我的却是一段一段一段	未
别人的手...	未
别人的证件照 哎	未
别人眼中玩vr游戏的你 还要在外面玩VR游戏吗哈哈哈哈！	未
别人眼中的你，工作了5年，还不如回家养猪	未
别人眼中的青岛你同意吗青岛生活	未
别人请客，吃的是你的定数！	未
别人赖床是因为有钱 微博视频	未
别人都下班回家了，剩我一个对着屏幕发呆。 天辉夜魇 （@必威电竞必威就是betway）	未
别人都忙着做奶奶，62岁的她却活成了18！	未
别人都是失踪，只有他，是真正的死者......	未
别人都是跳通电波浪舞，伟伟看起来是真滴通了电	未
别从别人的嘴里认识我，一万个人口中一万个我。	未
别以为只有流量的粉丝有饭圈的操作，每个圈子聚集起来粉丝，「捧一踩一」「拉踩」「双标」「带节奏」这些用语都十分熟悉。	未
别以为大雾把你们挡住了！对违建说不，城管蜀黍一直在路上！	未
别以为好玩，这可是犯罪行为！	未
别以为这是特朗普的“虚弱时刻”	未
别以施与者心态看待贫困县学生倒牛奶	未
别任性！大同交警开展百日安全行动，严查这些交通违法行为！	未
别传了！蒙城这个地方目前暂无拆迁计划！	未
别低头，皇冠会掉//@虐狗狂人巴普洛夫:汉库克//@sxxxjie:做瑜伽吧//@银教授:嘴角向上，蒸蒸日上//@纯良大叔:哈哈哈哈哈傲娇//@喜脉洗脉:很傲娇嘛//@艾嵠以风:哈哈哈可爱//@永远年轻永远热泪盈:它可能觉得自己是匹狼	未
别侥幸，多一个也不行！洛阳交警查处一起面包车超员典型案例！	未
别侥幸！富川交警开展清剿酒驾毒驾(3N)夜查行动	未
别做他人眼中的“反面教材”	未
别做无谓的社交，别交无谓的朋友，还有亲人和老友待你去关怀。	未
别再乱吃了！公认的第一类致癌物竟然是它！真的没猜到	未
别再乱扔了，化州家里种有甘蔗的看看！	未
别再乱扔了，广西人家里种有甘蔗的，赶紧看	未
别再乱扔了，永州家里种有甘蔗的看看！	未
别再乱扔了，河池家里种有甘蔗的看 看！	未
别再乱扔了，湛江家里种有甘蔗的看看！	未
别再乱扔了，雷州徐闻家里种有甘蔗的看看！	未
别再任性啦！台州市区启用电动车交通违法抓拍功能，一旦抓拍，除了罚款	未
别再去听讲座，领鸡蛋了梅州这12人被抓...	未
别再去！广州塔和花城广场被人从众挤爆！灯光秀无人机表演点进来看	未
别再发朋友圈了：这些地震逃生知识，你一定要知道！	未
别再吃了，已大量进入市场，快告知家人朋友！	未
别再吃了！已大量进入市场！快告诉家人朋友！	未
别再吃了，正在大量上市，速通知家人朋友！	未
别再吃了，请通知家人朋友！	未
别再吃了，销往全国各地，速通知家人朋友！	未
别再在朋友圈里买这个药了！都是毒...	未
别再头疼君子兰夹箭了！给它来个塑料袋，侧芽长，开花停不下	未
别再幻想雾霾天会一下子变蓝	未
别再开地图炮啦，快来看看你有没有误会他们	未
别再弄错了，去年就给我整反了	未
别再当垃圾扔掉了，这东西一分钱不花，刷碗去油效果好，还能防滑！	未
别再往后躲了大头村。	未
别再整整天为爱呼天抢地，现在这个年纪是用来脱贫的，不是用来脱单的	未
别再整整天为爱呼天抢地现在这个年纪是用来脱贫的不是用来脱单的	未
别再泡假温泉了！曝光！赶紧看！	未
别再泡假温泉了！赶紧看！	未
别再玩手机了，为了家人都看看吧！	未
别再玩手机了，都看看这个女人！	未
别再用了！这东西已被禁8年，致很多人受伤！几乎家家都有！	未
别再用了！这东西已被禁8年，致很多人受伤！几乎家家都有	未
别再用了！这款贴身炸弹已经被禁8年，很多增城人还在用	未
别再用垃圾货辣眼睛，这才是配的上我的至尊豪串！	未
别再用油炒胡萝卜了！	未
别再用警察吓唬孩子！	未
别再笑小乔丹罚球三不沾，技术犯规罚球他都敢上了	未
别再给我整反了	未
别再花冤枉钱了，只要一个塑料瓶，油烟机一辈子都不用洗！	未
别再花钱买假蜂蜜了，深山养蜂人告诉你不为人知的真相...	未
别再被电视剧骗了，这才是晚清真实的太监	未
别再被直播骗了！少走弯路多挣钱才是王道！	未
别再被骗了！这些车实际是同一款，你知道几个	未
别再说什么家丑不可外扬，这丑陋，必须曝光出来《中国反家暴纪实》	未
别再说我给你的号码不管用，云南扫黑除恶已批捕1438人	未
别再跃跃欲试，在固原市区中央隔离栏这样掉头才对！	未
别再转了，河南这个城市不限行！	未
别再这么喝汤了！3岁女童竟然痛风！路都走不动这事仙游人也常干	未
别再违停啦！这里有新增的泊车位和600多个位置的停车场...	未
别再迷信独角兽！2018港股十大科技独角兽上市以来平均跌46.2青兰研究统计，自2017年9月至2018年9月，港股上市了十只科技独角兽，包括小米美团，腾讯系易鑫集团阅文集团等。截至2018年12月24日，这些股票平均跌幅达46.2其中，易鑫集团近12个月跌幅达76.2电竞第一股雷 ...全文	未
别再飘忽不定难以捉摸了 请你坚定一点 拒绝我或是向我走过来	未
别再骂东莞的女司机了！男司机不靠谱起来更恐怖好吗	未
别再骂虎门的女司机了！男司机不靠谱起来更恐怖好吗	未
别冲动！大亚湾一面包车撞上小车，还飞上了绿化带...	未
别到失能才谈“康复”	未
别动不动就付出真心，他给你的糖可能也给过别人。	未
别去三里屯了！海淀这个玩乐圣地，让大批潮男潮女都去打卡了	未
别去养老院找我，在邮轮靠岸时来看我	未
别去整那些不靠谱的社保规避！ 劳动法库	未
别去添乱了，真变成旅游大桥就	未
别又被成功学骗了！JK罗琳的成功不是逆袭而是V型反转！	未
别反了(红色加粗黑体33号)//@鞭鞭于白水:别弄反了//@江南大野花:我求求了//@切腹菌:祈祷	未
别发了，没人买的。	未
别只拿单反装逼了，开始做个摄影大师吧！	未
别只知道芦笋炒虾仁了！加点它，差点鲜掉下巴	未
别只顾着玩游戏，你们都在司机的视觉盲区里！  全国交通安全日	未
别叫我停下来	未
别吃土了，我给你回点血吧。	未
别吵了！这个离化州最近的机场名字早确定了！预计2020年投入使用！	未
别吵吵，分布式锁也是锁	未
//@别吵我我还想睡觉:可闭嘴吧你//@-譚慧瑩通:但是可以在水里浮起来	未
//@别吵我我还想睡觉:哈哈哈哈哈哈//@草惊蛇:腿：手你慢点，我跟不上啦	未
//@别吵我我还想睡觉:差点就相信了哈哈//@縷縷歌:我居然一瞬间相信了是因为好吃	未
//@别吵我我还想睡觉://@李眼熟:对想见的人说放假一起吃火锅	未
//@别吵我我还想睡觉://@王小浪://@扶南:我在茫茫人海中找到你，又把你送回人海里 。	未
别和我谈初心	未
别和熟人上床（建议所有人看看）	未
别和熟人发生 关系（建议所有人看看）	未
别和重要的人计较不重要的事今日份背景图 原戳5[给你小心心]	未
别嗨了，金融白领，你的工作还不如出租车司机！	未
别回复恶评好吗！//@鳗鱼肉酱饭:来空瓶啊	未
别在意那些在你背后说三道四的人，那只不过说明你走在了他们的前面。	未
别在红安随便吃饭了，才收到消息...别怪我没告诉你！	未
别在酒后解锁开车技能，否则后果不堪设想，劝止酒驾小米也在行动	未
别在随州随便吃烤鱼了，才收到消息...别怪我没告诉你！	未
别坐错车！今天起，南昌13条公交改线	未
别墅总价100万！让人一见钟情的新中式合院，未来距鄞州万达不到半小时！	未
别墅里的保姆和小孩正在吃饭，突然有把刀对着他们...	未
别墅里的四具焦尸，每天晚上都会来找你图解638	未
别大意！这4种情况下请立刻更换轮胎 别大意！这4种情况下请立刻更换轮胎	未
别好了伤疤忘了痛。才几年这一组2年前针对日本游客的旅游推广。就应该专门在央视播出	未
别妄想90后接盘楼市了，这届刚需不够刚！（老罗说说房）	未
别宅了！85岁老人和4岁小孩，都在海淀公园做这件事！	未
别家的哥哥是上帝派下的情书，我的哥哥可能是上帝派下的战书	未
别对我大呼小叫，我小时候被狗吓过	未
别幸灾乐祸了，图们江大桥锁死了谁的出海口	未
别当烂好人，因为总有人把你的忍让与迁就当成软弱无能来践踏。	未
别心存侥幸！48天纠违5万多人次！延吉交警调整上岗及撤岗时间！	未
别心急！前往官塘大桥莲花山隧道打卡的市民，这些事情要注意	未
别忘了你为什么出发！	未
别忘了答应自己要做的事情，也别忘了答应自己要去的地方，无论那有多难，有多远。	未
别忘了，股指期货放开后，人家机构有了套保功能，不一定非要做多才能赚钱！机构的配置是，现货持有股票仓位，在反手配一定比例的期指空单仓位，就能够对冲风险！我们散户大多不做期指，因为有资金门槛（50万）和实战经验的限制，所以面对调整行情，我们只能控制仓位，选择观望来回避风险市场的活气和 ...全文	未
别忙了，今天让我们慢慢的走回家	未
别忙着微博吃瓜了，冬天要吃堡，还得靠他	未
别忽视甲减！这些“亚健康状态”可能与甲减有关	未
别怀疑，这是雪后的泰安！	未
别怕，也别怂。感情就是这样，没有失去你不会成熟 生活也是这样，没有遇到点险恶，你不会长大。你想要的，老天不一定会给你，你只有努力去争取别辜负爱你的人，别辜负你自己。	未
