又双叒是重污染！今冬为何如此频繁最新消息，12月1日3日，京津冀及周边地区汾渭平原长三角地区北部将发生一次大气重污染过程。今冬重污染为何如此频繁专家称，大气稳定逆温又逢高温，是导致重污染出现频率较高的关键气象因素。而气污染和气象条件之间存在相互反馈机制。via 中新网 京津冀等地再遭重污染天气 今冬重污染为何如此频繁	未
又双叒涨了 今年上海毕业生平均月薪曝光，00后比你挣得还多	未
又发现反人类设计，端起来喝汤，洒一脸一腿	未
又发现日本奇葩一站，你还见过什么奇葩的车站这才是日本	未
又发生莆田公交司机被乘客暴打这才是真相！	未
又变成起床困难户的肯定不止我一个	未
又可以扫了，希望大家都扫出大的！（评论最小那个别委屈，我给你发红包）	未
又向本地人确证了下，1500欧是华沙的平均月薪，波兰官方统计的全国平均月薪水平是1150欧（4600兹罗提）左右。人均收入的话，因为要算上无业子女和失业者，数字比这个低//@战争史研究WHS:大学生起步月薪900欧元左右（波兰的平均月薪是1500欧）//@venetians:大学生理工科学生起步年薪是多少	未
又喝.倒一个，同桌9人赔六十万！别再劝酒了	未
又喝.倒一个，同桌9人赔六十万！哈尔滨别再劝酒了	未
又喝倒一个，同桌9人赔六十万！岳池吃宵夜喝酒要小心！	未
又喝死一个！同桌9人赔61万！两镇一区老乡都看看吧	未
又喝死一个！同桌9人赔61万！所有人都看看	未
又喝死一个！同桌9人赔61万！菏泽都看看吧	未
又喝死一个！同桌9人赔61万！都看看吧	未
又喝死一个！同饮者赔61万！都看看吧	未
又喝走一个，家属向同桌索赔147万！五华人都看看！	未
又回重庆咯	未
又因海砂，罚款367万元！这两座隧道被责令破拆返工！	未
又在Steam折扣期买买了	未
又在我耳边飞 同一只的话按他们的寿命算百(千岁老人了吧	未
又在监视我系列	未
又在看死神来了，在想一个问题，话说如果你在坐船，飞机，高铁，火车，长途汽车等等等等的时候，有一个人突然疯狂哭泣说要下去，说这趟会出事，你会跟着下去吗	未
又地震了，一天3次！震感强烈！竟然还有人在	未
又地震了！台湾海峡1天5震！福建省地震局权威发声！	未
又地震了，樟树这家人感受强烈（含视频）！	未
又地震了！连发6次地震！！终于看清了莆田人的真面目！	未
又坐小车车了 拜拜	未
又培训了700多名食安工作者还不是因为	未
又堵门不让走 微博视频	未
又堵门 微博视频	未
又多了一个考北大的理由	未
又多了一位！A股6位90后董事长都是啥来头8090后董事长在A股已经是一股不小的力量截至目前，A股董事长年龄在30岁以下有17家观察数据可以发现，由年轻人掌门的公司，往往市值较小，均在70亿以下，中位数为29.92亿体量最小的是申科股份，市值仅13亿（来源：财看见）又多了一位！A股6位90后董事长都是啥来头财看见	未
又够一周的朋友圈了	未
又大又慢的寒潮渗透南下，雪线正跨过长江占据整个东亚中心气压高达1075百帕的西伯利亚冷高压正处于青壮年，引导寒冷气团持续堆积并南下冷高压前部降雪前锋对应的1035百帕等压线已南压至江汉平原-武汉-皖南山区-杭州一线今天白天，长江中下游沿线都可能见到短时飘雪而周六，随一小块冷高 ...全文	未
又大又慢的寒潮渗透南下，雪线正跨过长江占据整个东亚中心气压高达1075百帕的西伯利亚冷高压正处于青壮年，引导寒冷气团持续堆积并南下冷高压前部降雪前锋对应的1035百帕等压线已南压至江汉平原-武汉-皖南山区-杭州一线。今天白天，长江中下游沿线都可能见到短时飘雪而周六，随一小块冷高压单体分裂南下，沿长江一线和湖南江西浙江北部将迎接一轮更大范围的广泛降雪。	未
又失英才！中科院院士施教耐病逝，今年逝世院士已超10位	未
又失踪了@苏苏里斯	未
又好笑又心酸//@头像集: 哦	未
又年底了，卖门一年，究竟能赚多少钱真不敢相信！	未
又开启吃土买买买的模式	未
又开启日天模式了	未
又开始了//@浪里赤条小粗林: 一年一度打孩子我寻思着年底了，确实要开始了爱过。（我不磕冒，可冒是如此美妙）	未
又开始了等待	未
又开始挑事！侦察机窜到黄海北部干吗？	未
又开始虐狗了	未
又开火了！印度安全部队与东北部叛军激烈交战，伤亡惨重！国内很少有人知道，印度东北部的纳萨尔派武装，是一支毛派革命武装，他们的旗帜是一面红旗，上面绣着镰刀和斧头 又开火了！印度安全部队与东北部叛军激烈交战，伤亡惨重！	未
又开火了！印度安全部队与反政府武装激烈交战，伤亡惨重！	未
又快到双十二， 买买买时须警惕！	未
又怕冷空气不来，又怕冷空气乱来	未
又恢复关系了怎么办	未
又想回老家了。长大后特别想回老家，就自己呆着，在熟悉的街道里寻找安全丢掉幻想，被童年的自己拥抱着。	未
又想回老家了长大后特别想回老家，就自己呆着，在熟悉的街道里寻找安全丢掉幻想，被童年的自己拥抱着	未
又想骗我养刺猬	未
又想骗我吃新cptwi桜餅 (@ p3puhehehe)	未
又感动，又虐觉得繁体字要写很久//@Tiger公子://@浪里赤条小粗林: 我真得羡慕了明明只是应该从小教的最普通的事啊。//@关爱卷福健康成长:羡慕两个字我都说倦了	未
又扒出4个引力波事件数量达到两位数	未
又找到两个	未
又找到了几张	未
又把“越界”当理由，台当局3天扣押3艘大陆渔船	未
又把越界当理由，台当局3天扣押3艘大陆渔船12月1日至3日，闽东渔61119号闽东渔65098号闽狮渔06897号三艘渔船被台当局以越界为由扣押。据台湾中央社12月3日报道，这些渔船越界捕鱼，澎湖海巡队随即登船检查并扣押调查。这3艘渔船上的活物目前已被台方登船人员海抛。至于对这些被扣船只的处理，则会采取没收罚款留置等手段重罚。针对台当局这种做法，有岛内网友人直言：两岸一家亲，何必呢。又把越界当理由，台当局3天扣押3艘大陆渔船	未
又抓2人！永州人打鸟打出事了！	未
又抓2人！永州有人醉心打野味盯上国家森林公园！	未
又抓两个！刺探中国一百年，日本间谍在中国的前世今生 军情晚报	未
又抓了一个加麻大的。	未
又抖了！台海多次地震，梅州人今晚再次感觉到了...这事要注意！	未
又抹杀了诚信2字！	未
又拆了@一个抹布向前 的一直播（下载App-gt网页链接）	未
又拍住了！漯河这几个路口需要注意	未
又招人了！滦南县公安局招聘海上综合执法协勤人员	未
又拽又夹生！南京这10家网红馆子千万别带朋友来！	未
又捡到一只小可怜，淋得湿哒哒的在工作室外面嗷嗷叫一会儿先带它去医院检查下吧	未
又接新的业配了，这次代言的是拉瓦萨（Lavazza Caff，闻名于世的都灵咖啡公司）咖啡公司，马指导的发际线越来越高了。马尔基西奥	未
又摊上事儿了！曝盒马鲜生销售过期产品 两听椰浆过期两个多月近日，有网友爆料称，12月1日在盒马鲜生@盒马 上海金桥店购买了两听丽尔泰椰浆，到家后发现该商品已经过期两个多月。阿里巴巴官方客服留言称，确实是盒马方面的责任，并提出了十倍赔偿的方案。对此，消费者并不买账，并已向相关部门反映此事。此前，盒马曾陷标签门。(新京报)	未
又收到TA的捐款quot顺其自然quot20年捐款超千万23日，宁波慈善总会再次收到署名quot然其quot的51张汇款单，合计50万元。捐款署名在quot顺其自然quot几个字里排列组合，使用不存在的地址1999年起，每年11月下旬或12月初，总有一份特别的爱如约而至。20年来，TA累计捐款已达1005万元。致敬！（央视）	未
又收到顺其自然捐款49万！20年累计捐款1054万	未
又早班机	未
又是一个40年，这次的主人公和每个常州人都相关	未
又是一个人的平安夜，今天晚上你们准备怎么过呢我：打游戏.....	未
又是一个看不下去的路人粉的建议有广场体质的小汤圆快看一下，我有点忙不过来了	未
又是一个站撸怪	未
又是一个阴云天@成都气象 预计今天白天阳光明媚暖意融融的概率很小，天空大多时候被厚重的云层盖着，不过偶尔会有穿透云层的阳光洒落，最高气温9左右早上气温低，局部地方有轻雾，小伙伴们要注意保暖和行车安全哦	未
又是一位酒后驾驶营运货车的主儿	未
又是一大堆的骗子@新浪财经客户端获取全球市场724实时滚动播报: 网页链接	未
又是一对英国父女飞行员！ 他们在同一家航空公司。。可惜女儿学的是空客，爸爸飞的是波音。。为了在退休前能跟女儿飞一把，爸爸毅然从飞了1万多小时的波音改学空客。。现在航空公司把他们编成了一组。 爸爸机长。女儿副机长，每天一起飞对了，他们是英国第二对父女正副机长，之前第一对在英航	未
又是一年中国决，最是绝杀壮悲烈！	未
又是一年中的海鸥季，云南哪些地方有海鸥昆明（滇池海埂公园大观楼翠湖等）大理（洱海的小普陀）泸沽湖（大落水码头里格码头）云南旅游攻略君	未
又是一年云南海鸥季 微博视频	未
又是一年光棍节，可我还是光棍	未
又是一年南飞时，万只大雁过山西	未
又是一年新旅程，苦了累了，一定要挺住。	未
又是一年枫叶红	未
又是一年银杏飘满地，潼南的银杏叶黄了	未
又是一年雁南飞......	未
又是一年雪花飘 带你回顾冬季的谣言老梗大雪纷纷，冬季的那些谣言老梗又沉渣泛起。科技时代，各个年龄层似乎都不能对谣言完全免疫。穿秋裤会丧失抗寒基因冬天骨头会变脆电热毯有辐射会致癌带你回顾下那些年上过的那些当！又是一年雪花飘 带你回顾冬季的谣言老梗	未
又是一年雪花飘 带你回顾冬季的谣言老梗大雪纷纷，冬季的那些谣言老梗又沉渣泛起科技时代，各个年龄层似乎都不能对谣言完全免疫穿秋裤会丧失抗寒基因冬天骨头会变脆电热毯有辐射会致癌带你回顾下那些年上过的那些当！又是一年雪花飘 带你回顾冬季的谣言老梗	未
又是一起	未
又是一起惨烈车祸，融水寿星北路小车与电动车猛烈相撞	未
又是主动早起非常振奋的周一了呢著名网黄猫日	未
又是乞讨！濮阳一老人快车道上敲车窗，要钱不要命！	未
又是他！高邮这位老师要把你家小孩带去中央电视台，去不去	未
又是充电起火！网友称杨箕一高层清晨有浓烟，这次是电动轮椅车	未
又是兼职刷单，QQ聊天记录还原被骗全过程	未
又是别人家的公司！1500名员工人均130万美元年终奖据美国媒体报道，电子烟初创公司Juul Labs内部人士透露，在与万宝路香烟生产商奥驰亚集团（Altria）达成128亿美元投资协议后，Juul管理层决定发放20亿美元年终奖，以特别股息形式向公司的1500名员工发放，平均每人将得到130万美元 ，相当于一个硅谷底层码农的10年底薪。据一位了解相关条款的人士表示，每名员工所得奖金多少将取决于多个因素，包括他们在公司工作的时间以及持股数量。也就是说，那些工作最为熟练的老员工将获得更多的奖励。（新浪）	未
又是别人家的食堂	未
又是周日，新的启程对我后期影响很大的一期节目，遇到一个有趣的人，也许，他就会影响你的灵魂告诉我，你的感触，看我们是不是一样今晚8点 西瓜视频  丹行线	未
又是回到房间直接困睡着了 美国基黑	未
又是因为这个事！南宁这些车主被曝光并且记3分罚150元...930新闻眼	未
又是大货车！24小时内柳州发生三起车祸，3人遇难	未
又是大跃进	未
又是大车！莱芜苗山发生车祸，据称一人...大车盲区到底有多可怕	未
又是大面积大雾，江苏高速全面封闭！转朱阁 低绮户走村道 坐地铁，辗转四个小时之后，终于到了南京禄口机场，赶上了飞往福州的灰机！结果，飞机还延误，漂亮！靠，累死本帅了，不辣么敬业行吗	未
又是天津港！这次不是爆炸，是港口高层在反腐风暴中投案自首！	未
又是天然气置换出状况。。城市V聚力大连爆料	未
又是套路！专柜验货背后藏猫腻，爱网购的广州人注意啦！	未
又是套路！支持专柜验货背后藏猫腻随着各种网购平台的快速发展，中国老百姓不用出国，就可以在网上购买很多国外知名品牌的商品，既省时又实惠。近日，福州的婷女士网购了一支进口口红，原本是自己的生日礼物，结果却有些尴尬......网页链接 （via.央视新闻）	未
又是套路贷！从2万虚增到570万！上海严厉打击套路贷案	未
又是女司机！	未
又是女司机顺德某富人区雷人一幕！	未
又是小飞龙惹祸！多车连撞，奥迪车头基本废据@无锡同城会 网友奔跑的蜗牛爆料：今天早上，洋溪桥发生连环车祸，下图蓝色奥迪车头基本废了，非机动车道也被撞坏的护栏挡住。事故造成交通拥堵，请由南往北车辆注意避让，过往的电动车注意安全。据称这又是一辆小飞龙造成的惨剧	未
又是斑马线！又一个生命的消逝！上海一司机被刑拘	未
又是新的一天，这两天20元以上的好多，你的手气如何	未
又是早班出发//@KEAIDUO___:北京到达 查看图片	未
又是曝光女孩	未
又是极端分子	未
又是柚海时！平和海拔400600米的柚海布达拉宫你去过吗	未
又是毫无悬念的高开低走，多注意2515点一带能否产生支撑吧。	未
又是没栓绳跑丢的吧，博主辛苦啦//@莫名地喜欢你:@开水族馆的生物男 水哥求扩散	未
又是滴滴	未
又是电动车一小区凌晨着火，火苗窜六层楼高，现场一片狼藉	未
又是电动车深圳一小区凌晨着火，火苗窜六层楼高，现场一片狼藉	未
又是_______的周一	未
又是老套路！美海军需要400战舰后，空军又要100架轰炸机	未
又是老铁666//@王兵的围脖:_//@nownow:环球时报疯了吧，雪山之上这么污染环境，垃圾随手丢，坚持无耻然后国家级大媒体竟然转发站台接下来一堆脑残都跟风去拍	未
又是艳阳天！游客冬季到拉萨观鸟晒太阳近日，内地许多城市出现大雾天气，但在有日光城美誉的拉萨依然艳阳高照万里晴空吸引了众多游客来到拉萨感受阳光的温暖布达拉宫脚下的宗角禄康公园里热闹非凡，冬天公园的湖里栖息着大量越冬的赤麻鸭斑头雁等鸟类，这也引来了许多市民和游客驻足 ...全文	未
又是苦战	未
又是荒废工作的一个上午	未
又是西湖雪景时，杭州变临安！（图转自朋友圈）	未
又是谁偷看我滴呢原po评收	未
又是谣媒带节奏难道没办法处理这些勒色吗	未
又是起飞失败！深夜，镇江新区平昌新城发生惊险一幕......	未
又是辅警	未
又是这样！人民医院附近摩托车撞上小车，司机...	未
又是连续几辆公交都没挤上去的一天，那么问题来了，是会迟到迟到还是迟到呢仙菇前几天连续坏了两台电脑，是水逆本逆了，水逆赶紧退散吧拜托拜托水逆退散	未
又是重度雾霾天，也不知道治理没治理，反正人们的意识淡了，认了	未
又是雨雨雨，晾晒被子要赶紧了 降温降雨又来啦！大二男生买金銮殿床帘，每天像皇帝就寝，结果...	未
又暖又揪心！8秒视频曝光连环死亡救人法，千万别学！	未
又暖又高的节奏。	未
又暴雷！白金汉老板失联！福州厦门校区接连停课！泉州的学员们急了......	未
又曝光了一款儿童禁用药，快看看你家有没有！	未
又曝酒店针孔摄像头正对着床，竟藏在这！住客：有大量不雅视频12月11日，西安市北辰大道北钱村附近的麦子快捷酒店被曝出现对着床的针孔摄像头，爆料人发现里边16G的储存卡已经拍了14G，约有1200个视频。记者进入其中一间客房后，发现里面的插座有四五处，遍布在房间的多个位置。而爆料者当时是在床尾的插座上发现的针孔摄像头。11日下午，记者获悉，事发后，民警迅速出警，对唐某拆下的插座进行提取，做进一步处理。并对该酒店进行全面排查，未发现其它房间安装摄像头。目前，该酒店已暂停营业。老板及相关人员正在接受调查，	未
又更新了！快刷《昆明警方发布》抖音	未
又有1000多人被终生禁驾，名单公布，希望没你！	未
又有12名高明人拍违停照，喜提100元购物卡！	未
又有2批次化妆品未准入境 你爱的马油护发素在列	未
又有4434人拟被认定为南海人才！有你的名字哦	未
又有47对粤港学校结成“姊妹花”	未
又有6人被拍到，西安车主，请改掉这个坏习惯！	未
又有一个国家将汉语列为必修课！这一次是个非洲国家	未
又有一国将汉语列为必修课 这次是个非洲国家	未
又有两个城市单双号限行！河南省2018最新限行政策查询！	未
又有两种感冒药被禁！赶紧看看你家有没有！！	未
又有人发小米MIX4的曝光图了恕我直言，这图做的质量连菜市场的大妈都不信	未
又有人害鸟 沣河岸边粘网网住国家二级保护动物长耳鸮12月11日一张带夹飞行的受伤黑鹳的照片，引发许多市民的关注，相关部门和志愿者数百人搜寻未果昨日，市民又发现一处长十多米的粘鸟网困住了一只国家二级保护动物长耳鸮，欣慰的是它被及时发现，将得到专业救治请爱鸟护鸟，不要捕捉伤害 ...全文	未
又有人害鸟 沣河岸边粘网网住国家二级保护动物长耳鸮12月11日一张带夹飞行的受伤黑鹳的照片，引发许多市民的关注，相关部门和志愿者数百人搜寻未果。昨日，市民又发现一处长十多米的粘鸟网困住了一只国家二级保护动物长耳鸮，欣慰的是它被及时发现，将得到专业救治。请爱鸟护鸟，不要捕捉伤害猎杀野生鸟类。又有人害鸟 沣河岸边粘网网住国家二级保护动物长耳鸮	未
又有人害鸟 西安沣河岸边粘网网住国家二级保护动物长耳鸮12月11日华商报A01版刊发了一张带夹飞行的受伤黑鹳的照片，引发许多市民的关注，相关部门和志愿者数百人搜寻未果昨日，市民又发现一处长十多米的粘鸟网困住了一只国家二级保护动物长耳鸮，欣慰的是它被及时发现，将得到专业救治华商报记 ...全文	未
又有人害鸟 西安沣河岸边粘网网住国家二级保护动物长耳鸮12月11日华商报A01版刊发了一张带夹飞行的受伤黑鹳的照片，引发许多市民的关注，相关部门和志愿者数百人搜寻未果。昨日，市民又发现一处长十多米的粘鸟网困住了一只国家二级保护动物长耳鸮，欣慰的是它被及时发现，将得到专业救治。华商报记者将十米长的粘鸟网收拢后用火烧掉。华商报再次提醒，请爱鸟护鸟，不要捕捉伤害猎杀野生鸟类。又有人害鸟 沣河岸边粘网网住国家二级保护动物长耳鸮	未
又有人掉进去了！冬季游玩警惕冰封的假象	未
又有人来信宜骗老人了！这里的送盆活动，一大帮阿婆阿伯排队	未
又有人被自己养的银环蛇给咬了，浙江23岁姑娘心脏骤停昏迷不醒！23岁的海归陈小姐在上海工作，一个月前网购了一条银环蛇当宠物11月23号晚上，她在给蛇喂食时被咬伤后在上海就医24日凌晨，她的家人紧急赶到杭州市中医院取了两支血清送往上海，但她还是出现了心脏骤停的情况，并进入昏迷状态最 ...全文	未
又有人被自己养的银环蛇给咬了，浙江23岁姑娘心脏骤停昏迷不醒！23岁的海归陈小姐在上海工作，一个月前网购了一条银环蛇当宠物。11月23号晚上，她在给蛇喂食时被咬伤后在上海就医。24日凌晨，她的家人紧急赶到杭州市中医院取了两支血清送往上海，但她还是出现了心脏骤停的情况，并进入昏迷状态。最后，她在杭州市中医院重症监护室住了一周才慢慢有所好转。她说养银环蛇是因为比较漂亮。浙江23岁姑娘养银环蛇被咬，心脏骤停昏迷不醒！医生：年轻人养蛇...	未
又有人被自己养的银环蛇给咬了，浙江23岁姑娘心脏骤停昏迷不醒！嘉兴爆料 23岁的海归陈小姐在上海工作，一个月前网购了一条银环蛇当宠物11月23号晚上，她在给蛇喂食时被咬伤后在上海就医24日凌晨，她的家人紧急赶到杭州市中医院取了两支血清送往上海，但她还是出现了心脏骤停的情况，并进入 ...全文	未
又有人被自己养的银环蛇给咬了，浙江23岁姑娘心脏骤停昏迷不醒！嘉兴爆料 23岁的海归陈小姐在上海工作，一个月前网购了一条银环蛇当宠物。11月23号晚上，她在给蛇喂食时被咬伤后在上海就医。24日凌晨，她的家人紧急赶到杭州市中医院取了两支血清送往上海，但她还是出现了心脏骤停的情况，并进入昏迷状态。最后，她在杭州市中医院重症监护室住了一周才慢慢有所好转。她说养银环蛇是因为比较漂亮。浙江23岁姑娘养银环蛇被咬 心脏骤停昏迷不醒	未
又有千亿药企来港股上市！A股上市刚过半年	未
又有华人被押下飞机 航空业者揭露坐飞机千万别任性	未
又有大动作！今天海南日报用16个版聚焦这座西部城市	未
又有套路被曝光！这些支持专柜验货背后藏猫腻！	未
又有市民将感谢信送给了7路公交司机赵荣梅 因为啥	未
又有很多同学问，那既然气囊并不是在一切撞击情况下都会爆开，那怎么才能尽可能保证发生事故的人身安全呢我明确的回答你：系！好！安！全！带！系！好！安！全！带！系！好！安！全！带！重要的事情说三遍！请扔掉你的安全带卡扣！其次是合理的车速，知道为什么ncap碰撞测试中的车速只有60km/h吗（理论上大多数事故都会有刹车动作，实际撞击车速60km/h）因为再快的事故撞击事故，就只能听天由命了	未
又有很多同学问，那既然气囊并不是在一切撞击情况下都会爆开，那怎么才能尽可能保证发生事故的人身安全呢我明确的回答你：系！好！安！全！带！系！好！安！全！带！系！好！安！全！带！重要的事情说三遍！请扔掉你的安全带卡扣！其次是合理的车速，知道为什么ncap碰撞测试中的车速只有60k ...全文	未
又有新内容！快刷《昆明警方发布》抖音	未
又有新头像安排了	未
又有新泉眼济南求你放过其他城市吧！	未
又有新的交通组织变化和停电计划...你一定要知道！	未
又有新的幺蛾子了	未
又有新规实施了	未
又有煤气中毒的，汉中人烤火千万注意！	未
又有砂石大货车在泾县冲卡！快看现场视频！	未
又有种要感冒的预感，后天就要签售了怎么办。希望这次的预感不准。	未
又有经销商被查！有资质有3C的电摩也不让卖很多人不知道这两点！	未
又有网友求救：他的iPhoneXS，时不时的显示（绿光）出来呢，怎么办呢	未
又有老外“辱华”？这一次美国人出手了	未
又有老外辱华这一次美国人出手了12月3日，美国著名游戏软件开发公司维尔福公司（V社）发布公告称，禁止曾发表辱华言论的菲律宾选手Kuku参加即将于中国重庆举行的《刀塔2》（DOTA2）特级锦标赛。11月初，菲律宾TNC战队的选手Kuku被曝在游戏中使用辱华词汇ching chong。这个词源自汉语中清朝的发音，并没有明确的字面意思，但长久以来一直被认为是辱华词汇。此举引发众多中国玩家和网友的愤怒，对此，Kuku辩称无心辱华，而其战队TNC则于11月3日在新浪微博开设账户，发布	未
又有超百亿纾困资金跑步入场，A股还有哪些高比例质押？	未
又有逃犯落网 已有80余犯人在张学友演唱会期间落网	未
又有酒驾司机被查！锦州整治行动行拘16人	未
又来一个。	未
又来了	未
又来了又来了哈哈哈哈哈朱一龙看这里朱一龙看这里朱一龙朱一龙朱一龙这里这里这里	未
又来了！济南一车主拳打公交司机！狂追2公里逼停公交！结果，一车乘客不愿意了	未
又来到上海了	未
又来市区18辆车被划！这回凶手锁定了！	未
又来骗钱了 我买不行吗//@M大王叫我来巡山:不二家嗨啾小蜘蛛我要拥有！//@你说什么我怎么听不到:啊啊啊！//@关于优衣库的一切:优衣库又来骗钱了	未
又没中	未
