判死刑的娃，榆林人谁认识！	未
判死刑的娃，榆林谁认识！	未
判死刑的娃，永宁银川哪个家长认识！	未
判死刑的娃，河南谁认识	未
判死刑的娃， 渭南谁见过?	未
判死刑的娃，漳县人都看看	未
判死刑的娃，灵石人谁认识！	未
判死刑的娃，甘肃人谁认识！	未
判死刑的娃，甘肃谁认识！	未
判死刑的娃，甘肃都在看	未
判死刑的娃，看哭无数人！	未
判死刑的娃，看看有认识的	未
判死刑的娃，菏泽谁认识！	未
判死刑的娃，谁认识！	未
判死刑的娃，贵州人谁认识！	未
判死刑的娃，资中人谁认识！	未
判死刑的娃，赣州人谁认识！	未
判死刑的娃，赤峰谁见过	未
判死刑的娃，辽宁谁见过	未
判死刑的娃，陕西谁见过	未
判死刑的娃，陕西都在看	未
判死刑的娃，青海人谁认识！	未
判轻了，是花钱买的吧?在有枪的美国，这样逞能斗狠者，砰，一枪解决了！等不到法院来判！	未
刨根问底：公务员的饭碗究竟有多铁	未
利亚德拟1.5亿元至3亿元回购公司股份财联社12月17日讯，利亚德拟回购公司股份，回购价格不超过人民币10元/股（含），回购股份的资金总额不低于人民币15000万元（含），不超过人民币30000万元（含），回购股份期限自董事会审议通过之日起不超过12个月	未
利亚德拟回购1.5亿元至3亿元公司股份	未
利兹与青鸟 回家发现BD还没到货	未
利剑斩黑恶 重拳治乱象 这个视频告诉你，扫黑除恶重点范围	未
利剑高悬  3个巡察组正式进驻吉首市这6家单位！	未
利剑高悬 惩腐打"伞"	未
利勃海尔采矿大型挖掘机	未
利好！6000万专项资金提前下达！涉及邢台三县！	未
利好！云南全面实施个体户全程电子化登记改革	未
利好！公务员将有加班补助，还可提前退休	未
利好  明年起，泸州大病保险报销新政出炉，起付标准1万元！	未
利好柳州将新增7条高速公路对接贵州湖南等地，这群人要沸腾了	未
利好！江苏出台两项通行费优惠政策，这些车辆全免车辆通行费！	未
利好省界收费站有望取消！今后自驾嗖一下就过了	未
利好高开后的操作策略@李开宇-价量兵法 的一直播（下载App-gt网页链接）	未
利姆鲁是男是女除了史莱姆还有这些人的性别也未解	未
利安隆拟6亿元全资收购凯亚化工100%股权	未
利安隆 拟6亿元收购凯亚化工	未
利安隆拟6亿元收购凯亚化工	未
利安隆拟6亿元收购凯亚化工100%股权	未
利川11月最色赖村曝光，有你们村吗	未
利川人注意，今年回家 可能不用排队取火车票了	未
利川人注意，最近有2个自称高速路网的问路人借钱.....	未
利川八旬夫妻成最后的穴居人，在崖洞里住了一辈子，将生活过成了桃花源	未
利川，农村老汉坐公汽车的过程	未
利川又有这么多地方要停电！焦人！赶紧看看！	未
利川城区将有4路公交线路暂停运营，利川市民请合理安排出行	未
利川最后的崖居人家，八旬夫妻住岩洞，与世隔绝！	未
利川欠钱不还的人注意啦，刚刚，法院开展专项行动！	未
利川游子第六期，我在浙江宁波，我为利川带盐！	未
利川红椿至黄泥坝公路改造工程进入尾声，沿途美到无法形容	未
利得科技：子公司自查期间集团其他业务照常运行	未
利比亚东南部一城镇遭袭至少５人死亡	未
利比亚可能于明年2月举行宪法公投	未
利比亚外海一艘移民船翻覆 15人死亡10人生还	未
利比亚或于明年2月举行宪法公投	未
利比亚政府要求武装分子立即撤出沙拉拉油田	未
利比亚：海湾富国斗法的新战场	未
利民股份：新沂市纾困投资基金向公司控股股东借款1.35亿元	未
利民路上，一名司机酒驾撞上保时捷，急忙之下...	未
利润低，玩不起更多花样。说实话，其实我很讨厌双十一双十二，打个9折后几乎没钱赚，就赚个忙。但还不能不参加，不然看着别人大卖自己没生意更郁闷//@南原168:萍姐万年不变的模式	未
利物浦。。。	未
利物浦，今晚不会爆冷吧	未
利物浦反超！范戴克助攻，刚被换上场3分钟的菲尔米诺进球！	未
利物浦后卫戈麦斯左腿骨裂伤停六周	未
利物浦后防大将左腿骨裂 将错过数场焦点大战	未
利物浦回声报：英格兰国脚阿诺德无缘双红会。这意味着红军防线阿诺德戈麦斯和马蒂普三员大将都因伤停赛，洛夫伦训练受伤尚未完全康复，米尔纳和维纳尔杜姆或许会应急补位。	未
利物浦本场36次射门，是曼联的6倍其中射中10次，比曼联的总射门次数还多4次	未
利物浦现在场上有五个中场	未
利物浦现在应该请个角球教练	未
利物浦！瞧你干的好事！	未
利物浦竟是欧洲丢球最少球队！都坐下，这是范迪克的常规操作	未
利物浦-纽卡斯尔可怕！！利物浦已经4-0领先了！	未
利物浦续签戈麦斯至2024年	未
利物浦罗马沙尔克04已经是巴萨16强潜在对手，剩下的明天就知道了	未
利物浦群星儿童医院送关怀圣诞即将到来，在繁忙比赛间隔期，萨拉赫范迪克亨德森等利物浦众将来到当地儿童医院，为孩子送去圣诞祝福与关怀	未
利物浦首发：阿利森阿诺德 ，洛夫伦，范迪克，罗伯逊沙奇里，维纳尔杜姆，亨德森马内，萨拉赫，菲尔米诺替补：米尼奥莱，克莱因，法比尼奥，拉拉纳，斯图里奇，凯塔，奥里吉	未
利特 回复：是的 但是现在也会说特儿特儿呢//@CenturyBlue百年唯蓝: 查看话题详情评论：是说着特儿特儿的那个时候呢 哥	未
利特评论：利特到达澳门了 查看图片	未
利特 评论：张八将 金钟云 评论：张八将 查看图片	未
利用QQ群开设赌场 流水金额超1亿元！	未
利用善良是最大的恶	未
利用威廉指标预知涨跌	未
利用家族兴风作浪，汉阴这个厉害的恶势力团伙被一窝端了！	未
利用小区公共区域的地面车位属于全体业主，业委会可授权委托物业代为管理但即使如此租赁固定车位也应有合同，哪怕只有一张纸。如果没有业委会授权的话，物业根本没权利收费或指定把哪个车位以什么价格租给谁。//@半仙0724:不是说车位属于全体业主么没有私人车位吧	未
利用期现工具服务铁矿石供应链	未
利用“跨境电商”走私奶粉1.38亿元	未
利用集体建设用地建设租赁房 两部门确定北上广等13个城市试点	未
利群大润发这些青岛人常去的超市上黑榜！蔬菜鸡蛋不合格	未
利群大润发青岛曝光多家店！即墨有5家！	未
利辛，今年7月至11月酒驾人员名单，过来看看可有你还有客货运车辆...	未
利辛蒙城两县融媒体中心挂牌	未
利辛这事进入倒计时，已有90多万人参与！还没做的抓紧了	未
利辛部分区域最新停电信息	未
利通电子：首次公开发行2500万股 12月12日申购	未
利通电子首次公开发行A股上市仪式	未
利通电子：首次公开发行股份12月12日申购 发行价19.29元/股	未
@别cue小刘 求签 第五十六末小吉 生涯喜又忧未老先白头 劳心千百度芳遇贵人留解签链接-gt 网页链接	未
别上当了！上海市燃气行业承诺不主动上门推销燃气器具便民提示@上海燃气行业发布 说，近期有不法分子借燃气公司名义上门诈骗，相关燃气企业已将此情况向警方报案在此请广大市民保持警惕，谨防上当受骗！如遇到此类人员可以拨打报警电话110市民如有燃气服务需求可以拨打燃气热线962777， ...全文	未
别上当了！上海市燃气行业承诺不主动上门推销燃气器具便民提示@上海燃气行业发布 说，近期有不法分子借燃气公司名义上门诈骗，相关燃气企业已将此情况向警方报案。在此请广大市民保持警惕，谨防上当受骗！如遇到此类人员可以拨打报警电话110。市民如有燃气服务需求可以拨打燃气热线962777，燃气公司将会派人员为您服务。	未
别不信，什么脾气就是什么命	未
别不信，如今睡觉差不多都是这个流程	未
别不好意思拒绝别人，反正那些好意思为难你的人 也不是什么好人 。	未
别不好意思拒绝别人，反正那些好意思为难你的人都不是什么好人。 许灵子	未
别不承认，8090后，小时候都这样玩！	未
别不承认了，80后全都是中老年人！	未
别不拿双创当回事，看看东坡区是怎样当真逗硬的！	未
别为了赚钱把老家的妈妈忘记了别留他孤零零的像个留守老人常回家看看突然回老家爸妈的反应	未
别为难自己，一辈子那么短，何苦呢（读完受益匪浅）	未
别买	未
别买车了！这就是10年后的交通工具，大开眼界！	未
别乱停！电驴乱停车也会被交警拖走！	未
别乱艾特我。我疯了。我看到艾特就评了跪下了我	未
别乱跟注！河牌中明三条那位，说你呢	未
别了，323路公交车！	未
别了丨火车票！铁路总公司宣布大消息，明年全国推广	未
《别了   中国最后的王朝》姬艳萍	未
别了！以后再也不需要火车票了，直接上车	未
别了，公摊面积朔州人速看！央视媒体媒集体发声！	未
别了，公摊面积！金乡买房没买房的速看！央媒集体发声！	未
别了，国企医院《财经》封面统计显示，至2017年，仍有2000多家国企医院没有完成改制，其中30多家三级医院。但是，当看到国资委的决心没有动摇，2018年前十个月，国企医院的剥离速度陡然提升。国资委企业改革局副局长吴同兴在10月表示，90以上的国企医院完成了剥离工作。与此同时，另一个战场已悄然开启，对优质医疗资源的争夺愈加激烈。不过，正如一家医疗集团高管所言，医院投资只有30跟投资有关，70是社会管理工作。对于资本或接收方来说，国企医院改制的下半场，才刚刚开始。别了，国企医院《财经》封面	未
别了，抢票软件！铁路部门将推出候补购票功能	未
别了，播音员、主持人！刚刚新华社传来大消息…	未
别了，支付巨头躺着赚钱的日子！	未
别了，支付巨头躺着赚钱的日子！央行特急通知！万亿备付金账户下月全部撤销	未
别了，无锡火车站周边这块百年工房！高墩桥下的华新里，一转身就是百年！无锡老城最后一片工房即将远去，你和它有过故事吗如今这里拆迁签约率已90，大部分居民家已搬空。华新里与永泰华盛丝厂有内在关系，通江街道的副主任杨凯表示，他们也做了一些史志整理的工作，寻访了一些华新里的资料，会好好保存。华新里及火车站附近，在未来城建中会如何变化详细戳作别百年工房	未
别了，无锡火车站周边这块老地方！	未
别了，《海绵宝宝》之父	未
别了！火车票！	未
别了，火车票！一个关系到人人出行的大消息传来	未
别了，火车票！以后再也不怕因为没取票错过车啦	未
别了，火车票！刚刚传来大消息！以后坐火车方便多了	未
别了，火车票！刚刚传来的消息！	未
别了，火车票刷脸时代要来了铁路总公司宣布大消息...速来围观	未
别了，火车票国家传来重大消息，以后将......	未
别了，火车票！扫码或刷身份证直接进站，再也不用担心车票丢了！	未
别了，火车票！无锡人刷证扫码即可进站！	未
别了，火车票！明年将在全国推广...	未
别了，火车票！涿州人速看！铁路总公司宣布大消息	未
别了，火车票！潜江人以后这样坐车	未
别了，火车票！电子客票将于明年在全国全面推广	未
别了，火车票！番禺人刷证扫码即可进站！	未
别了，火车票！花都人刷证扫码即可进站！	未
别了，火车票！铁总宣布重大消息！明年全国推广	未
别了，火车票！铁路即将告别纸质时代！	未
别了，火车票！铁路宣布大消息...	未
别了，火车票！铁路总公司宣布大消息	未
别了，火车票！铁路总公司宣布大消息中国铁路总公司宣布，电子火车票来了！和纸质车票说再见吧！11月22日，铁路部门在海南环岛高铁实行电子客票服务试点刷身份证扫码进站！无论何种渠道购票，都会收到铁路部门推送的电子客票通知单，并可根据需要选择是否打印报销凭证。别了，火车票！铁路总公司宣布大消息	未
别了，火车票！铁路总公司宣布大消息！事关每个洛阳人！	未
别了，火车票！铁路总公司宣布大消息，全国将全面推广...	未
别了，火车票！铁路总公司宣布大消息，即将全国推广	未
别了，火车票！铁路总公司宣布大消息，手机扫码直接进站...	未
别了，火车票铁路总公司宣布大消息！持身份证能直接进站..	未
别了，火车票！铁路总公司宣布大消息，明年全国推广	未
别了，火车票！铁路总公司宣布大消息，明年全国推广坐火车，最怕排队取票，一旦遇上高峰期，分分钟被耽误，简直生无可恋！近日，中国铁路总公司党组书记总经理陆东福在智能高铁发展暨京津城际铁路开通十周年论坛上宣布：电子客票将于明年在全国全面推广！	未
别了，火车票！铁路总公司宣布大消息，明年全国推广电子票	未
别了，火车票！铁路总公司宣布大消息，明年将全国推广！	未
别了，火车票！铁路总公司宣布大消息！海安乘客注意	未
别了，火车票！铁路总公司宣布大消息！经常去外地的安阳人来看看	未
别了，火车票！铁路总公司宣布大消息，鄂州明年将	未
别了，火车票！铁路总公司宣布：明年全国可刷身份证进站！	未
别了，火车票！铁路总公司宣布：明年全国推广	未
别了，火车票！铁路总公司宣布消息，以后将......	未
别了，火车票！铁路总公司宣布消息，明年全面推广	未
别了，火车票！铁路总公司宣布重大消息，明年全国推广	未
别了，火车票！铁路总公司消息，明年全国推广！	未
别了，皇姑屯火车站！	未
别了，皇姑屯火车站！见证沈阳百年历史的车站，正式关闭！	未
别了，纸火车票！明年起仅凭身份证即可检票进站近日，中国铁路总公司总经理陆东福表示，电子客票将于明年在全国全面推广！旅客通过互联网订购车票之后，在高铁站无需换取纸质车票，可直接持二代身份证等有效身份证件通过进站口和验票闸机直接乘车。也就是说身份证手机将成为全国通行卡！	未
别了，纸质火车票！	未
别了，纸质火车票！一个大消息传来	未
别了，纸质火车票！一个大消息传来，明年全国推广！	未
别了，纸质火车票！一个大消息传来，明年将全国推广！	未
别了，纸质火车票！一个大消息传来，明年推广	未
别了，纸质火车票！中国铁总宣布大消息，明年全国推广电子票	未
别了，纸质火车票！中国铁路总公司宣布这则消息	未
别了，纸质火车票！中国铁路总公司近日宣布，电子客票将于明年在全国全面推广，同时在绝大多数一二线城市开通刷脸进高铁站。铁路部门已于11月22日在海南环岛高铁实行电子客票服务试点刷身份证扫码进站。今后购票成功，旅客会收到电子客票通知单，并可根据需要选择是否打印报销凭证。（新华社）	未
别了，纸质火车票！今年春运济南人或可凭身份证乘坐高铁！	未
别了，纸质火车票！以后就这样回家吧	未
别了，纸质火车票！刚刚传来大消息！明年全国推广	未
别了，纸质火车票！刚刚传来大消息！电子火车票真的来了！以前，坐火车如果没有纸质火车票是不会让你上车的，到后来，高铁开始可以刷身份证，再到现在，火车票又有了全新的形态电子火车票！	未
别了！纸质火车票！明年全国推广	未
别了，纸质火车票！明年全国推广刷脸出行！	未
别了，纸质火车票！明年全面推广电子客票！	未
别了，纸质火车票！明年只带身份证就能进站！	未
别了 纸质火车票！明年起仅凭身份证即可检票进站	未
别了，纸质火车票！明年起仅凭身份证即可检票进站	未
别了纸质火车票！明年起仅凭身份证即可检票进站	未
别了，纸质火车票！明年起仅凭身份证即可检票进站11月22日中国铁路总公司官网称，自11月22日起，铁路部门将在海南环岛高铁实行电子客票服务试点，将纸质车票承载的旅客运输合同凭证乘车凭证报销凭证功能相分离，依据有关法律条文规定，以电子数据作为铁路旅客承运合同凭证。别了，纸质火车票！明年起仅凭身份证即可检票进站	未
别了，纸质火车票！明年起仅凭身份证即可检票进站铁路总公司有关部门负责人介绍，现有的铁路旅客车票，为红色条码票和蓝色磁介质车票两种，均采用实名制，集铁路旅客承运合同凭证乘车凭证报销凭证等功能于一体，旅客需凭车票乘车。实行电子客票，就是将纸质车票承载的旅客运输合同凭证乘车凭证报销凭证功能相分离，依据有关法律条文规定，以电子数据作为铁路旅客承运合同凭证，推进乘车凭证无纸化和多样化，报销凭证逐步电子化。实行电子客票后，旅客购票检票乘车等流程都将更加方便快捷。（via 中国证券报）别了，纸质火	未
别了，纸质火车票！明年起仅凭身份证即可检票进站铁路总公司有关部门负责人介绍，现有的铁路旅客车票，为红色条码票和蓝色磁介质车票两种，均采用实名制，集铁路旅客承运合同凭证乘车凭证报销凭证等功能于一体，旅客需凭车票乘车实行电子客票，就是将纸质车票承载的旅客运输合同凭证 ...全文	未
别了，纸质火车票！明年起全国推广仅凭身份证即可检票进站	未
别了纸质火车票明年起全国推广仅凭身份证即可检票进站实行电子客票是将纸质车票承载的旅客运输合同凭证乘车凭证报销凭证功能相分离依据法律条文规定，以电子数据为铁路旅客承运合同凭证，推进乘车凭证无纸化报销凭证逐步电子化。旅客购票检票乘车等流程都将更加方便快捷别了，纸质火车票！明年起全国推广仅凭身份证即可检票进站	未
别了，纸质火车票！明年起全国推广仅凭身份证即可检票进站近日，中国铁路总公司党组书记总经理陆东福在智能高铁发展暨京津城际铁路开通十周年论坛上宣布：电子客票将于明年在全国全面推广这意味着，坐火车，再也不用怕排队取票，或者大意把票弄丢了，仅凭身份证即可检票进站 ...全文	未
别了，纸质火车票！明年起全国推广仅凭身份证即可检票进站近日，中国铁路总公司党组书记总经理陆东福在智能高铁发展暨京津城际铁路开通十周年论坛上宣布：电子客票将于明年在全国全面推广。这意味着，坐火车，再也不用怕排队取票，或者大意把票弄丢了，仅凭身份证即可检票进站。无论通过何种渠道购票，购票成功后旅客都会收到铁路部门推送的电子客票通知单，并可根据需要选择是否打印报销凭证。 别了，纸质火车票！明年起全国推广仅凭身份证即可检票进站	未
别了 纸质火车票明年起全国推广仅凭身份证即可进站坐火车，再也不用怕排队取票，或者大意丢票了！ 近日，中国铁路总公司党组书记总经理陆东福在智能高铁发展暨京津城际铁路开通十周年论坛上宣布：电子客票将于明年在全国全面推广！别了 纸质火车票明年起全国推广仅凭身份证即可进站	未
别了纸质火车票！明年起全国推广电子客票 仅凭身份证即可检票进站中铁总公司宣布：电子客票将于明年在全国全面推广。旅客网络订票后到达高铁站，无需换取纸质车票，持二代证等有效证件通过进站口和验票闸机直接乘车。忘带身份证，可在快速通道刷脸进站乘车。（新华网）别了，纸质火车票！明年起仅凭身份证即可检票进站	未
别了，纸质火车票！明年起刷身份证扫码即可检票进站！	未
别了，纸质火车票！武汉已支持刷脸进站	未
别了，纸质火车票！电子客票即将全面推广	未
别了，纸质火车票！电子客票将于2019年在全国高铁推广	未
别了，纸质火车票！电子客票将于明年全面推广	未
别了，纸质火车票！电子客票将于明年在全国高铁推广！	未
别了，纸质火车票！电子客票将全面推广！刷身份证即可乘车	未
别了纸质火车票！电子客票明年全国推广近日，中国铁路总公司宣布：电子客票将于明年在全国全面推广。旅客通过互联网订购车票之后，到达高铁站，无需换取纸质车票，直接可持二代身份证等有效身份证件通过进站口和验票闸机直接乘车。即使没带身份证也没关系，进站前，在刷脸快速通道对着人脸识别机器看一眼，就可以直接进站乘车。（央视新闻）	未
别了纸质火车票！电子客票明年全国推广近日，中国铁路总公司宣布：电子客票将于明年在全国全面推广。旅客通过互联网订购车票之后，无需换取纸质车票，直接可持二代身份证等有效身份证件通过进站口和验票闸机直接乘车。没带身份证也没关系，进站前对着人脸识别机器看一眼，就可以直接进站乘车。别了纸质火车票 铁路总公司：电子客票明年全国推广	未
别了，纸质火车票！电子客票明年全面推广	未
别了！纸质火车票！电子客票明年全面推广！要报销咋办	未
别了，纸质火车票！电子客票明年全面推广飞机托运行李可跟踪状态	未
别了，纸质火车票，电子客票明年将在全国推广	未
别了，纸质火车票！电子火车票时代来临！	未
别了，纸质火车票！电子火车票真的来了手机扫码直接进站	未
别了，纸质火车票！电子车票终于要来了！	未
别了，纸质火车票！男子收藏了500张火车票，最便宜才3毛钱	未
别了，纸质火车票！第四代火车票来临！身份证检票进站，明年全国推广！	未
别了，纸质火车票！财务无纸化时代已经全面来临！	未
别了，纸质火车票！近日，中国铁路总公司宣布：电子客票将于明年在全国全面推广。旅客通过互联网订购车票之后，到达高铁站，无需换取纸质车票，直接可持二代身份证等有效身份证件通过进站口和验票闸机直接乘车。即使没带身份证也没关系，进站前，在刷脸快速通道对着人脸识别机器看一眼，就可以直接进站乘车。	未
别了，纸质火车票！这个大消息和你们都有关	未
别了，纸质火车票！那些年积攒的路程凭证	未
别了，纸质火车票！郑铁局下属6个高铁车站部分车次可刷证进站	未
别了，纸质火车票！铁总刚刚宣布大消息，明年将全国推广	未
别了，纸质火车票！铁总宣布大消息，明年全国推广	未
别了，纸质火车票！铁总宣布大消息，明年将全国推广	未
别了！纸质火车票！铁总透露大消息！刷脸就能进站！	未
别了，纸质火车票！铁路总公司刚刚传来大消息！明年全国推广	未
别了，纸质火车票！铁路总公司宣布	未
别了，纸质火车票！铁路总公司宣布大消息！	未
别了，纸质火车票！铁路总公司宣布大消息，已有旅客使用...	未
别了，纸质火车票！铁路总公司宣布大消息，明年全国推广	未
别了，纸质火车票！铁路总公司宣布大消息，明年全国推广刷脸出行！	未
别了，纸质火车票！铁路总公司宣布大消息，明年如皋人可刷脸出行！	未
别了，纸质火车票！铁路总公司宣布：电子客票将于明年全国推广	未
别了，纸质火车票！铁路总公司宣布：电子客票将于明年在全国全面推广！	未
别了，纸质火车票！铁路总公司宣布，电子客票明年全国推广	未
别了纸质火车票 铁路总公司：电子客票明年全国推广此次不仅全面取消高铁车票，在绝大多数一二线城市将同时开通刷脸进高铁站！即使你没带身份证也没关系，进站前，在刷脸快速通道对着人脸识别机器看一眼，就可以直接进站乘车！据悉，目前北京上海广州深圳杭州武汉等绝大多数一线二线城市都已经支持刷脸进站快速服务别了纸质火车票 铁路总公司：电子客票明年全国推广	未
