“到敌人后方去，把鬼子赶出境”——记共产党领导下的第一个敌后抗日根据地	未
到时见	未
到明天夏天就不用愁自己胖了//@Makeup-Fever:减肥是每个女孩的终身事业	未
到時見！	未
到村儿里办电竞的时代到来了	未
到柳州咯嗦粉咯嗦的臭臭的明天去见你们怎么样	未
到武汉长沙机票200元左右！日照出发，这些地方可以约了！	未
到沈阳去看雪吗//@大连户口身份证:沈阳下雪了	未
到派出所帮朋友调解纠纷 网上逃犯“自投罗网”	未
到海南干防水去！海南自贸区第一批上百个重点项目集中开工	未
到澳门参加中国网络社会组织联合会主办的论坛，来去匆匆，记得多年前第一次来澳门玩，临时恶补知识，专门买了本书如何精通百家乐，结果带着参考书在赌场门口被拦下，还有很多赌徒恶狠狠看着我，发生了什么事	未
到点了，放个毒	未
到特区行政长官“家”里做客——香港礼宾府举办开放日	未
到特立尼达的路上遇到一座高塔跟当地大哥聊天得知这叫Manaca Iznaga Tower什么什么塔楼梯很陡，一口气爬到塔顶有点小累不过风景非常不错！我畅和 @好多小红花 @大董古董 这几个家伙比较懒，净买东西了，都没爬塔哼 古巴特立尼达	未
到现在为止不知道还是哪个孙子在刷我购物车从6号刷到今天此时此刻！ 让我的数据异常真tm神烦	未
到现在，依然能见到网上很些人强烈要求其为加拿大人美国人	未
到现在都没睡，看到中毒怎么说呢，高下立判	未
到现在都还是	未
到田里啃泥去了	未
到目前为止，你去过离家最远的地方是哪里	未
到目前为止 你已经从所有你认为不会过去的事情中幸存了下来	未
到目前为止，关于免疫艾滋病的基因编辑婴儿 没有一个部门或领导声称对此负责，该甩锅的都甩锅了，估计是贺建奎独自两手空空在自家车库完成的	未
到看守所去霸位吧	未
到站前推送了，北京嘎嘎冷啊，飕飕的！	未
到芜湖城东的老司机懵了！一个路口两个信号灯交警部门表示大家要淡定	未
到西安大医院看病，却频频被忽悠快报记者直击内幕，太惊人！	未
到跟前了你的手机没拍到正脸	未
到达一加6T 迈凯伦版发布会现场，现在不知道发布会里面有没有放迈凯伦的跑车	未
到达已编辑	未
到达沈阳。还好，没有长春那么冷。对高铁停靠沈阳的站点不熟，下次会记着事先查阅一下经停车站是否有北站。住进事先定好的酒店，房间没有网上说的那么大，也就是所标面积的三分之二吧。这不是问题，有问题的是酒店说中央空调坏了。多要了一床被子，加了两个电暖器。服务态度没得说，你甚至不好意思退宿了。	未
到达济南，正驶往市区。	未
到连州的朋友们注意了！明天起，市区这个十字路口将封闭（附绕行路线）	未
到迪拜了，打打土豪劣绅。	未
到银行汇款，车临时停路边上，为了怕交警罚就把朋友留下看车，跟他说有查车的过来了告诉我一声。进去几分钟果然有交警来了，那个朋友风风火火地闯进银行大声吼道：大哥，警察来了，快走啊！尼玛，偌大的一个大厅几十号人，顷刻间寂静无声，然后人潮像洪水一样涌出银行，接着我就被五六个保安按在了地上真他妈冤！不怕神一样的对手，就怕猪一样的队友！	未
制万路通车日期延后 预计明年上半年恢复交通滨海新区政民互动 网民留言：制万线是连接大港城区和中塘镇河西片的交通要道，两年前因为修黄港铁路断交施工，工期一拖再拖。天津市住建委回复：经调查，因为南港铁路的施工，大港制万路进行了封闭道路施工，封闭范围一直到与津淄公路交口处，由于制万路与南港铁路立交工程设计方案的调整，原定通车日期需要进行延期，目前铁路设计单位正在完善设计方案，待交通行业主管部门通过方案后开展施工，预计2019年上半年恢复交通。	未
制作人辻本良三确认还将在几天后公布《怪物猎人 世界》的最新消息！	未
制作现场令人作呕 广州查获700公斤毒鸡爪子近日，广州警方打掉一个生产销售毒鸡爪子的黑作坊，抓获嫌疑人2名，查获毒鸡爪子700公斤警方现场取证发现，该作坊并不具备合法的食品生产执照，系违规经营，卫生环境十分恶劣，生产原料多为变质伪劣产品，生产用水也是未经过消毒处理的井水，对 ...全文	未
制假团伙昼伏夜出  日产假烟7500条	未
制假黑心贩子造名酒 这次够你喝一壶	未
制冷设备的轴承黄油千万别上太多！否则要人命.....	未
制发退役军人优待证，这省凭啥快人一步	未
制售假疫苗最高罚货值金额30倍	未
制度型开放，需扩大规则制度“进出口”	未
制服12.2 plmm好，请问有妹子收到why君背心裙了吗，我的刚拿到拆完定位线褶子就怪怪的，想知道只有我的是这样还是属于正常情况，麻烦洞娘带图拉 谢谢	未
制服12.4晚 姐妹们好鸭 在中牌买了福袋但是听说他们会把以前上架过的山裙放在福袋里面 所以想问一下大家这两条格裙是不是山的	未
制服12.6吐槽一下深夜家的发货速度 10.20付的尾款锦鲤 12.6都没给我发货。我敲了客服了好几次 每次都说会尽快的 但是仍然没有给我发上周六说好的给我发 结果周四了都没发等大半天都没客服回复我也能理解客服说话态度是很好 可是根本不解决问题。 11.27号那天客服说今明两天会发出 但它又撤回了 我就希望客服能解决问题 而不是一拖再拖 带图	未
制服想问问各位桥本环奈，大家在展子上被拍照会摆什么pose啊，该不该笑（感觉自己一笑脸就会僵orz丑死）想向妹儿们求几个游场万能pose！感谢！	未
制服打扰妹子们也辛苦洞娘了，投稿主要是想问一下why君家现在是怎么回事呢我是三年前入过坑现在又重新入坑，所以对他家的印象还停留在当初褶子割腿毛口碑很好萌新首选的国牌店，一眼种草他家的天鹅绒也毫不犹豫买了，拿到手发现布料很薄很软褶子一言难尽，翻了翻树洞也有妹子在吐槽，裙子翻车，没有客服，官博不更新，他家是不想做了吗	未
制服最近收了一条日制 标是tombow的 求问是校拱吗 是的话求一下校名 在此谢过各位百香果双响炮啦！	未
制服求问各位桥本环奈在东京大阪北海道有什么出校供的中古店吗寒假去想逛逛...重点是可能有萌款掉落或者是种类多的店 球球了！！！	未
制服求问这个是谁家 求阿常带图 蟹蟹	未
制服网页链接各位小甜饼，佛系买家又一次上线了，后续是我去滴滴了客服，客服表示我买的65长度没有了，因为标签贴错的原因清理库存的时候误将55当了65，本佛系买家本着10cm吧没啥问题，申请退了差价，所以我的裙子比较顺利的发货了，顺丰也比较给力，隔日达，但是我拆开包裹发现小物品没给我寄，（一个领带和长柄）为什么！为什么我的首次购物体验如此的不佳...，总而言之，我也看了深夜在上一条的回复，当时是客服没有表达清楚，我也承认你们家事后公关做的不错，裙子也非常好看，但是这一件事然后我孱弱的身躯都扛了下来我实在	未
制服逛tb逛到的麦子家（树洞风评不好妹子们不要买）评论姐妹们品品 麻烦洞娘带图	未
制止暴力侵害妇女行为国际日（11月25日 ）暴力侵害妇女和女童行为是当今世界上最普遍最持久和最具破坏性的侵犯人权行为之一暴力侵害妇女和女童行为是当今世界上最普遍最持久和最具破坏性的侵犯人权行为之一然而，在有罪不罚沉默污名化和羞耻等因素的笼罩下，大多数此类暴力行为仍未得到 ...全文	未
制止暴力侵害妇女行为国际日（11月25日 ）暴力侵害妇女和女童行为是当今世界上最普遍最持久和最具破坏性的侵犯人权行为之一。暴力侵害妇女和女童行为是当今世界上最普遍最持久和最具破坏性的侵犯人权行为之一。然而，在有罪不罚沉默污名化和羞耻等因素的笼罩下，大多数此类暴力行为仍未得到报告。自1981年起，妇女权利活动家就将11月25日作为反抗性别暴力的纪念日。2000年，联合国将11月25日设立为制止暴力侵害妇女行为国际日。2018年的主题是：橙色点亮世界倾听我也是 @联合国网页链接	未
制裁落下!奥巴马宣布驱逐35名俄情报人员	未
制造100起暴力事件，色诱发展百万信徒它被称世界五大疯狂邪教之首	未
制造业强国科技 科技日报刊文：国产22纳米光刻机治不了咱们的芯病！近日，中科院研制的超分辨光刻装备通过验收。在验收会上有记者问：该光刻设备能不能刻芯片，打破国外垄断光电所专家回答说，用于芯片需要攻克一系列技术难题，距离还很遥远。据悉，中科院的22纳米分辨率光刻机跟荷兰ASML垄断的光刻机不是一回事，说前者弯道超车，就好像说中国出了个竞走名将要超越博尔特。	未
制造业“补短板”或在明年发力 更大范围减税势在必行	未
制造孟津一公司搞智能化改造，我们赚了	未
刷一刷，用毛线钩的小动物，瞬间就像真的一样（附教程）	未
刷了1W条抖音，我们发现这8类抖音必火	未
刷到库兹马这条推特，下面一堆说祝你在鹈鹕好运之类的话，看得我一脸懵逼。又搜了下貌似是有什么流言说12月15号后要交易来戴维斯...但是关键问题是浓眉现在根本没有表达不满跟鹈鹕闹啊，鹈鹕脑子抽了才会主动把他送给别人吧	未
刷到这条微博的你，说说在哪个城市，下雪了吗	未
刷刷新闻就能赚钱小心收徒模式变传销！	未
刷单返现有这好事儿别把自己刷进去......	未
刷卡时为零可以买一些玫瑰，发给每一个上街群众手里，然后手持玫瑰到爱舍丽宫。。具体操作可参照其在格鲁吉亚的方法	未
刷屏！世界首例免疫艾滋病的基因编辑婴儿在中国诞生...官方回应来了！	未
刷屏了！中央和省级主要新闻媒体密集关注青联换届	未
刷屏！南宁马拉松现场多图流出...	未
刷屏！杭州今天真的真的下雪了！	未
刷屏的扶贫干部送老婆是怎么回事52岁贫困户摘帽又当爸！2017年，周应雄的帮扶联系人本想帮他贷款5万元发展养殖业，但又考虑到女性能顶半边天，不如送老婆给他，最终对口扶贫干部将本单位的女子，介绍给周应雄，去年4月俩人喜结连理，成就了扶贫送老婆的一段佳话。 婚后，在扶贫干部和签约服务的家庭医生帮助下，黄冬梅成功怀孕产女。（人民网）	未
刷屏的毕节小男孩找到家，然而	未
刷屏！资中这个镇因为两座建筑火了，你去过吗	未
刷屏 超级高铁要来了 厦门到北京只要30分钟?	未
刷屏 超级高铁要来了 漳州到北京只要30分钟?	未
刷新下链接：网页链接 提取码：6xf0	未
刷新高官内幕交易新纪录，他投4.9亿炒股	未
刷漆师傅说那这个没办法	未
刷爆容县人朋友圈！隔壁一对新人结婚，网友纷纷表示......	未
刷爆朋友圈！从化多个镇街都被这个东西给霸占了！！	未
刷爆朋友圈原来丰顺还有这样一条龙的服务！	未
刷爆朋友圈！女孩从车上滚落，他紧急刹车...	未
刷爆朋友圈报社门被围的水泄不通，到底怎么了	未
刷爆朋友圈的压力测试图，其实真相是	未
刷爆朋友圈的压力测试图，真相是	未
刷爆朋友圈的基因编辑婴儿事件持续发酵，真相到底是什么	未
刷爆朋友圈的大雾还要持续3天还有一个坏消息	未
刷爆朋友圈的捏脸游戏，暴露了你的真实性格	未
刷爆朋友圈的毒液，竟然真的存在！	未
刷爆  母亲给4个儿子的遗书：谢谢你们照顾我，但我后悔生下你们！	未
刷爆河池微信群，大妈内急直接车上解决，把车上乘客都惊呆了！	未
刷爆网络的这个视频戳中泪点，“你还是个孩子，却已成祖国的卫士”	未
刷爆襄阳朋友圈的这段视频，背后竟隐藏这样一个故事	未
刷爆  这几天这个视频刷爆了澄海各个微信群！你也看到了吗	未
刷牙的时候想到：人类行为分刻板与探索两个模式。刻板模式下，我们专注于特定动作，如开车时紧张地注意其他车辆，顾不上路边美景。探索模式下，我们会对所需信息之外的一些情况感兴趣，也就就是说注意力会发散，会不带预设地尝试新方法，吸收新的未知信息。刷牙是这两种模式的融合。	未
刷牙的时候想到：我这辈子还是对社会做了一点有益的工作的，比如这个。	未
刷牙的时候记得刷舌苔。有研究发现，刮舌苔可以比单纯刷牙多降低 30 口臭气体。	未
刷的链接已出详情昨晚的文章写了还有很多图在拍就这样	未
“刷脸”入园 农行金穗五山旅游联名卡正式发行	未
刷脸坐飞机 美机场将启用人脸识别美国亚特兰大国际机场是全世界旅客运输总量最大的机场，它的国际航站楼将从12月1号起正式启用人脸识别技术。搭乘测试航班的乘客不再需要出示身份证件或登机牌，只需站在人脸识别仪器前拍一张照片。这是美国海关和边境保护局与总部位于亚特兰大的达美航空的合作项目，今年十月中旬起就已经在部分指定航班试用。新的人脸识别系统安装在国际航站楼内的值机设备安检区域以及登机信道，机场摆放了告示牌，向乘客进行说明和指导。而不愿意接受人脸识别扫描的乘客，也可以选择往常的方式办理登机。许多搭乘测试	未
刷脸就能坐火车丨电子火车票时代来临！别了，纸质火车票！	未
刷脸支付产品蜻蜓上市，它承载了蚂蚁金服怎样的野心支付宝方面的数据显示，其刷脸支付已在全国三百多个城市，几万家门店，几百万的消费者中落地在支付宝线下推广刷脸支付一年多后，近日它又发布了刷脸支付软硬一体化产品蜻蜓这背后，是蚂蚁金服想要通过技术模式创新，渗透更多商业场 ...全文	未
刷脸进高铁站！铁路总公司宣布大消息，明年全国推广	未
刷身份证扫码进站！别了，火车票！	未
刷遍朋友圈的宁乡网红路，却让交警忙坏了！	未
券业豪门已在金融科技风口上，不会编程的人可能没法谋到金融好差事	未
券后59元起，买买买网页链接	未
券商：5G将是下一阶段通信行业投资主线	未
券商一致看多2019，你懂的，现在谁敢唱空	未
券商上报科创板初选名单 静候沪伦通业务资格	未
券商也有难言之隐，只能看多	未
券商加入卖房大军，部分上市公司主动打折卖房依然卖不出去	未
券商多条线减员减预算，却仍有部门逆势增员？比研发投入，比研发人员占比，看券业抢跑者如何布局	未
券商多渠道补给：741亿“弹药”待落地	未
券商大集合产品改造细则落地，将转为公募基金或私募资管计划	未
券商大集合产品适用资管新规路径明确 规范进度不搞“一刀切”	未
券商女高管癌症离世，入职16年，今年已有多位金融英才过过早离世	未
券商市场化并购或将持续	未
券商整合时代来临 中信证券拟收购广州证券，后者成为越秀金控全资子公司仅两个月	未
券商理财产品成上市公司“新宠” 11月买了800多亿理财产品	未
券商的选择题	未
券商砸盘，大爷的，祝这些空头断子绝孙啊，没关系，不影响题材股，不理他！	未
券商紧急备战科创板，高要求物色首批企业	未
券商经纪业务转型放大招：中投证券要被改名"中金财富"	未
券商经纪自白： “工作20年业绩优秀，我还是会被裁掉”	未
券商股反手砸盘，中信建投一度逼近跌停，股指承压快速回落，新股发行照旧，生态问题没有任何改善，市场还将是弱势反复的过程。	未
券商股被集体剔除出上证50指数，短期有影响长期靠业绩	未
券商股集体砸盘，股指快速下挫	未
“券商裁员降薪”又上“热搜” 是大盘见底信号之一？	未
券商转型，更名还要更新观念	未
券商闻风而动 “掘金”银行理财子公司潮起	未
券错了网页链接羽绒服团价是598，之前预告也写的598，帖子里写贵了	未
“刹车入弯”，嫦娥四号进入环月轨道！	未
“刹车入弯”，嫦娥四号进入环月轨道	未
刹车失灵只知道往墙上蹭还有这些救车办法！	未
刹车突然失灵这几招关键时刻能保命！	未
//@刺客棉条: //@北美小桥段:好好活着就好，其他的敢想吗//@然后下面就没了://@M大王叫我来巡山:比例这么高。。真的心凉//@尸姐: 哎//@楚惜刀://@春风十里桃花至：30这个数据的来源 查看图片	未
//@刺客棉条:这//@Tiger公子:放家里有点凉飕飕的//@汤粉儿: 先不说主机外观，这个配置，确实是跑逆水寒的配置。哈哈哈哈哈哈哈哈哈哈哈哈哈哈//@鸡老师的肉身:查看图片	未
刺情回顾时光飞逝，2018年又来到了尾声。那么，热刺在这一年里都发生了什么以3个月一期，我画你猜，刺迷们猜得出我们13月的大事件都是什么吗	未
刺激到我无法呼吸	未
刺激战场奇怪君350  几乎单人四排的带粉吃鸡 绝地求生刺激战场	未
刺激战场奇怪君352 学校混战一波四杀，王牌局四排14杀吃鸡	未
刺激战场奇怪君353 决赛圈三杀伏地魔，王牌局四排11杀吃鸡	未
刺激战场奇怪君354 大菠萝瞬间四杀，带仨粉四排20杀吃鸡	未
刺激战场能开60帧，因为机身体积硕大，散热有优势，全程性能很OK。因为屏幕过大，操控也比其他手机好得多，这才是游戏手机当然触控IC估计没调好，有些轻微的误触或者粘连情况。总的来说，要是4000左右，给爸妈买很合适	未
刺激战场里的我	未
刺激战场里的我 你为什么偷窥我打游戏	未
刺激//@没话说没所谓:把车门焊死，谁都别想下车！//@城南邮局:评论快鸡断腿了//@肾肾先生:这不是去幼儿园的车！评论快停车！	未
刺激//@阿粪青:太吓人了。//@朴果啦啦啦啦:我靠太可怕了//@李某人LeeDoo:这路况也太野了	未
刺猬胎，豆渣胎，脱皮胎......网购问题轮胎纷纷出炉！	未
刺痛我的不是过去，而是失去你的现在，和没有你的未来。不知道还要心碎多少次，你才能戒掉自己一厢情愿的天真。	未
刻不容缓！司机撞人下车查看后逃逸，汝州交警大海捞针擒元凶！	未
刻意去找的东西，往往是找不到的。天下万物的来和去，都有他的时间。	未
刻意去找的东西，往往是找不到的。天下万物的来和去，都有他的时间。三毛	未
刻赤海峡事件后 美向乌克兰海军拨款1000万美元	未
刻赤海峡事件后 美国向乌克兰拨款6900万	未
刻赤海峡俄乌差点擦枪走火，特朗普推迟了“普特会”	未
刻赤海峡冲突乌克兰海军吃大亏，美国军援安排上了，金额令人吃惊	未
刻赤海峡冲突升级 刻赤海峡究竟发生了什么?	未
刻赤海峡冲突将如何撬动地缘政治	未
刻赤海峡冲突开启危险先例 俄乌两国各有哪些小算盘？	未
刻赤海峡危机 乌克兰目的已达	未
刻骨铭心的一天，在美股创记录的一天，我们走成这样子有没有坏人做空股指期货，做空我A姑	未
剁手20岁与40岁中间，原来只差一个Tony老师！	未
剁手了，回个血吧！ //@我们都是球鞋控:试试手气领个红包吧！	未
剁手吃土消费降级，90后输了吗	未
剁手节过后田东人，你吃土了吗	未
剃头佬菜刀当飞剪 专帮靓妇娘乸理发 生意红火（本土白话）	未
剃头匠：第101-110话	未
剃头匠第171到173话	未
剃头匠第200到201话	未
削弱伊朗影响力，伊拉克政府谁也不亲：什叶派武装头目被暗杀	未
前10月17城房地产新增意向投资负增长 海口降幅最大	未
前10月台湾平均月薪增2.61% 加物价因素实质不及17年前水平	未
前10月宿州市电商交易103.46亿元	未
前10月空气质量相对较差20城公布 徐州上榜	未
前11个月25家保险资管公司产品注册规模达3483.16亿元	未
前11个月山东省进出口总值17483.7亿元	未
前11个月广东省实现贸易顺差1.2万亿元	未
前11个月房地产开发投资11万亿元，住宅投资增速回落	未
前11月万科销售额行业第一，郁亮称6300亿回款问题不大	未
前11月中国对外非金融类直接投资1044.8亿美元	未
前11月保险资管债股权产品规模3483亿 基础设施债权投资计划约占七成	未
前11月各地投资增速反差大：中部最快，西北大半地区负增长	未
前11月常州财政支出八成用在民生	未
前11月房地产销售涨幅收窄 开发投资仍“热”	未
前11月百亿规模私募平均业绩不敌中小私募	未
前11月私募业绩分化加剧	未
前4月销量为“0”，吉利汽车怕拖后腿甩卖知豆？	未
前5000件第2份0元精武颗粒鸭脖盒装500g 32到手真空小袋包装，不用担心吃不完会坏掉，不吃辣的吃麻辣的就好了，5000件很快抢完的	未
前99步我是不会迈的	未
前9月全国纪检监察机关处分省部级及以上干部56人	未
前AC米兰后卫安东尼尼在接受RMC体育采访时说道：米兰知道他们应该做的是什么，他们需要的是在欧洲级别能排的上号的球员。顶级球员谁不想要关键是人家不愿意来啊	未
前bbq UOL辅助选手Totoro加入LCK新军BtC曾效力于bbq Olivers，Unicorns of Love的辅助选手Totoro日前宣布加入LCK新军BtC（Team BattleComics）。Totoro自2015年开始便效力于bbq的前身ESC Ever。ESC从韩国次级联赛打入LCK后更名为bbq，我们所熟知的LokeN，SKT刚签下不久的上单Crazy都曾是他的队友。2017年赛季结束后，他加入了欧洲队伍Unicorns of Love。	未
前《Doom》系列制作人将在今天公开新作据外媒PC Gamer报道，制作人John Romero在发布的一封邮件中透露，将在今天公开一款新作，并写到为5做好准备（Prepare for 5），鉴于今天12月10日是《Doom》系列的生日，或许本作也将与《Doom》有关。	未
前FDA官员认错：过去30年的营养建议给错了，代价惨重	未
前一秒还在过生日 后一秒出警铃响了（视频）	未
前一阵不是说和菜菜姬霄里泽林玩率土之滨每天跟军训一样吗我现在是发现了，这不仅是军训，军训完了还要学习，每天盟主都会发在线教学，我们这种萌新看的津津有味，为了打好游戏真的太拼了还有这个游戏的妹子有多被重视你们看下我图四图五就知道了，专门给圈地发育，专门建小号捧场，嫉妒的我想变性 ...全文	未
前一阵在朋友的公司，他突然接到电话，电话那头说刚从内蒙给他带过来几只刚宰的羊，说是送给他的，朋友懵了，这羊往哪儿放后来又琢磨半天，冰箱放不下啊，扔了也可惜的等我再去找他已经是两天后了，然后我看见他办公室里放着一个巨大的冰柜有时候我感觉自己活的不如几条羊腿	未
前一阵拔牙所以先查了乙肝，没有抗体，所以赶紧去打乙肝疫苗了，我这边社区医院打都是免费，你也可以选自费的，没多少钱。体检每年做。我是无法理解为何有人可以画大手笔买包买衣服，但是健康上的钱出一毛都嫌多，体检催死也不去，不做婚检。	未
前三名就看谁能沉的住气了，这个时候千万别自己出错一下子掉下去，	未
前三季度各省份经济增速普降 下行压力仍存	未
前三季度国家质量专项监测：电动自行车等引发伤害最多	未
前三季度山东137个区县GDP排名：看菏泽七县二区排在哪	未
前三季度私募基金9656亿元投资于境内未上市未挂牌企业股权	未
前不久延吉被曝光的那家咖啡店，又来啦！	未
前两天在巴拉德罗海边喝酒，迷迷糊糊地跟服务员说了一句muchas aligado	未
前两天在微博上发了潼潼和朋友家娃把数字字母写反的图片，发现评论中很多娃也有类似的情况。查阅了一些相关文献，才发现，这种现象在4-7岁的孩子之间非常普遍，绝大部分都属于阶段性的正常情况，并非一定意味着读写障碍，和智力运动能力以及左利手均无关联。研究者发现，这种被称为镜像书写 ...全文	未
前两天在洗手间碰到一位长得特别像雷佳音的帅锅，偷瞄他的工牌想这是哪个团队新来的，没想到工牌上白底黑字的印着@雷佳音 本雷！花名居然叫阿拉雷新来的支付宝会员体验官阿拉雷你好啊，为了迎接你，今儿我们的会员频道全面升级，更名为支付宝会员，100多权益兑换上线！	未
