定了！蚌埠市出租车运价调整！	未
定了！行业传来大消息！一场大风暴正在席卷全国！！！！	未
定了！衢城公交线路这样调整！有你常坐的吗	未
定了！西充有车族速看：高速路省界收费站将取消......	未
定了！西充有驾照的速看：高速路收费站将取消！	未
定了！西安地铁四号线开通具体时间是	未
定了！证监会对两大债市开展统一执法	未
定了赤峰两旗县撤县设市内蒙古撤县设市名单公布最新消息来了...	未
定了！赶快去缴费，社保又出新政策，社保不追缴要重罚！	未
定了！这件事即将在临沂举办，涉及临沂所有人！	未
定了！途径沙湖的这条高铁被国家发改委批复，下一步	未
定了！邹平这群人工资要涨！	未
定了！重庆又多一批轨道交通线路	未
定了！金华这个滑雪场下月试营业，浙江规模最大！	未
定了 金正恩将于明年9月访问韩国	未
定了！铜玉铁路本月通车，列车时刻表公布，铜仁到贵阳1小时40分	未
定了！长春轨道8号线30日试运营 途经站点大全	未
定了！阆中有车族速看：高速路省界收费站将取消！	未
定了！阜阳出租车迎来涨价，相关听证会即将召开！	未
定了！青岛地铁这些线路开建，1号线4号线15号线走向定了！	未
定了！青盐铁路年内开通盐城首开动车！下月5日起，实行新列车运行图	未
定了！青盐铁路明年1月5日通车！具体车次和时刻表出炉，速戳	未
定了！青盐铁路明年1月5日通车，列车时刻在这里	未
定了！青盐铁路明年1月5日通车(附:具体车次和时刻表)丨12.5新闻早餐	未
定了！青连铁路开通时间！青岛西站发车时刻表车次公布！	未
定了！顺德旧楼加装电梯新规正式出台！	未
定了！香港科技大学（广州）落地南沙，面积是本部两倍大	未
定了！高陵水景公园年底前全部拆除围墙......	未
定了！鲁南高铁通车时间！	未
定了！黑龙江中小学生1月16日起放假	未
定了！黔江最低工资上调至1800元！过年能买肉吃了	未
定仔忙着血拼定仔的日常微博视频	未
定位低价越野平台，212仍有无限遐想。。。//@喜欢吉普-男人帮:你难道没有想法买一辆如果是带手动低速分动箱的单电机版本，买回来前后桥加电锁，攀爬利器啊！！！只是不知道北汽有限会做成前后双电机版本还是做成单电机带分动箱版本。	未
定位重型皮卡 雪佛兰2020款索罗德HD官图发布	未
定做一个自己送给女盆友，她发怒时我就可以走开了	未
定南交警曝光10月份酒驾人员名单，看看都有谁	未
定南便民信息：招聘求职房屋租售等（2018年11月25日）	未
定南便民信息：招聘求职房屋租售等（2018年11月27日）	未
定南便民信息：招聘求职房屋租售等（2018年12月2日）	未
定南县打击传销暨扫黑除恶进社区六个一活动	未
定南扫黑除恶办关于检举揭发黄晓平廖智武谢家栋等人违法犯罪行为的通告	未
定南老城岭北即将有人民法庭啦	未
定南这些地方要停电，请大家相互转告！	未
定向降息！美联储议息前夜 央行端出了一碗特麻辣粉	未
定向降息！美联储议息前夜，央行端出了一碗“特麻辣粉”	未
定型了给//@剧小鲜: 真心的啊//@剧透揭秘: 确实//@一线剧透: 竟然是因为这个事	未
定塘街头发生惊险一幕！好在，被一顶安全头盔救命了！	未
定妆粉应该要换了。。。	未
定安县关工委：9万元助学金资助 45名失依少年	未
定安发生一起枪击案 警方2万元征集线索	未
定安见龙大道发生交通事故 1人当场死亡11月24日中午，定安县定城镇见龙大道发生一起交通事故，一辆大巴车在行驶中为避让一辆掉头行驶的小客车，不慎撞向路旁一辆自行车，导致自行车驾驶人身亡据悉，该自行车驾驶人为男性定安县交警部门正在对事故原因做进一步调查（记者邓钰）	未
定州KTV行业惊现奇葩，他们居然这么玩儿......	未
定州两姐妹因为土地，闹上了省电视台......	未
定州农商行招标公告！	未
定州北部某广场万人聚集抢免费家电了	未
定州医保局：医保卡激活不用扎堆，个人账户40元不会清零！	未
定州定深路发生火灾，现场火光冲天，浓烟滚滚！一片火海...	未
定州将对新建改建的住房学校医院商场大检查！	未
定州市区内全面叫停销售储存燃放烟花爆竹！违者罚款拘留！附举报电话	未
定州年轻女子为何在马路边哭泣竟因城管干了这件事......	未
定州年轻小伙出国归来突然消失两个月，音讯全无......	未
定州心机女骗婚骗房竟然还拥有2个身份证...	未
定州新闻 4岁双胞胎男孩遇害 工厂噪音扰民 轿车翻车 查酒驾时间表	未
定州新闻 停电 电厂路车祸 元旦看房团报名 农村妇女两癌免费筛查 大气污染综合治理专题会	未
定州新闻 偷狗贼 楼顶设驾校 建筑节能 上百米沙尘暴	未
定州新闻 居民楼发生爆炸 老旧小区改造 农民工工资支付 搬迁公告	未
定州新闻 管网温度进行上调 被老师掌掴致耳聋 焦化厂转型绿色企业 携号转网	未
定州新闻 贫困户家电车被盗 孙女给奶奶下灭鼠药 搬迁公告 小学浴室安摄像头	未
定州这两个部门搬迁至此，需要前往办事的群众请关注！	未
定州这个KTV用这种套路，居然暗藏着......	未
定州这俩人打架被拘留，看看你们认识吗	未
定州这几个饭店后厨环境曝光！你还敢来吃饭吗	未
定州这家因为分地闹上了电视台！	未
定式火星语，这是挖机机机定仔的日常微博视频	未
定时了，1点钟抽！还有一会//@软软:不如ysl这支今晚就开吧 你们觉得怎么样//@软软: 转中再挑一位送YSL一支！查看图片	未
定时扩散。打扰见谅	未
定时条长微博，来说个比较无聊的话题（起码我认为是），那就是骁龙 855 移动平台到底有没有 NPU 这个玩意。在这点上我们要先下定义了，啥是 NPU按照我观察不少人的理解，概括的来说就是处理器的某个东西仅用于处理人工智能，细节的来说就是有张量加速器。要是以前者来说，骁龙 855 的第四代人工智 ...全文	未
定期开展消防巡查12月9日，国网江苏检修公司特高压东吴站运维人员开展消防定期巡查。运维人员对主控楼继保室等站内消防设施的有效期及封装剂的压力进行细致检查并做好记录，确保站内消防器材的安全合格，保障了消防系统的可靠运行。	未
定期检查 专业专注11月26日，国网扬州供电公司高压用电检查班的工作人员对专变用户用电情况进行检查，并对检查过程中发现的安全隐患提出相应的整改意见，确保专变用户的用电安全。	未
定期筛查可大幅降低乳腺癌死亡率	未
定档了吗想看。 //@响马:想看哈哈哈哈哈//@XiNGRZ:草	未
定水发生车祸！！	未
定海一村落将征迁！大洋世家项目明年落户	未
定的三点半，三点十分到的。结果说五点半开始拍。行我等到了五点半开始拍。店长说拍完吃便饭。我们这边还没等拍完呢，一个不知道什么级别的人带着一桌客人问我们拍完了吗什么时候拍完还需要拍什么对着客人说你们等一会这边马上就完事。然后问我，菜品可以撤了吗OK，fine。我带着摄像打个招呼立刻就走。拍完了。没拍完也拍完了。真的很牛逼呀从业以来第一次遇到赶节目组编辑组走人的我休息日跑这么远冒着风雨到现在坐在地铁上就加了这么一个班。出于职业精神我会做好我应该做的内容，出于个人角度	未
定的酒店不能播，真的要昏过去了！9点你们OK吗	未
定罪抢夺方向盘，当从治安管理处罚法中剥离出来	未
定襄：11月24-27日限行通知	未
定襄11月25日这些车禁止上路	未
定襄11月26日限行！你的车不能走	未
定襄11月2728号这个地方两天停电	未
定襄12月2日限行！这些车不能上路	未
定襄12月这几个村停电了	未
定襄17时10分发布预警信号	未
定襄2526日这些地方要停电	未
定襄26日又有好多地方要停电	未
定襄65岁以上老人养老金将上调	未
定襄交警122闹大了	未
定襄交警大队发布限行通告	未
定襄交警通知！12月1日-4日大车小车都限行了！	未
定襄人抓紧办截止12月20日	未
定襄人抓紧办这事！耽误不得	未
定襄人注意！大棚房清理整治了	未
定襄人注意 大棚房要整治了	未
定襄今天限行好多车被拍了	未
定襄刚刚查酒驾抬住了	未
定襄办低保先看看这个规定	未
定襄医保缴费通知	未
定襄原城镇居民医保缴费通知	未
定襄县2018年部分事业单位公开招聘工作人员公告（二）	未
定襄县委书记张文斌实地查看集中供热运行情况	未
定襄县社保卡办理流程及用途！请相互告知！	未
定襄后营村姐妹聚会闹红火了	未
定襄城区11月24日-27日单双号限行	未
定襄城区12月1日-4日单双号限行	未
定襄城区实施单双号限行通知	未
定襄外环路限高了！紧急扩散	未
定襄大车把小车挤进沟里了	未
定襄：失联出租车司机找到了	未
定襄寻人启事！紧急扩散	未
定襄急通知！限时！禁止驶入	未
定襄撞进骨头店旁怕撒哇	未
定襄明天(26日)停电通知	未
定襄明天( 26日)这些车限行了	未
定襄明天(28号)这个地方停电	未
定襄明天(2号)这些车禁止上路	未
定襄明天后天(25.26日)停电通知	未
定襄明天后天这几个村停电了	未
定襄星级公厕你去上过吗	未
定襄晋HT1548失联！急找	未
定襄有以下问题的不能办低保	未
定襄机动车不礼让行人抓拍了	未
定襄来的太原出租车碰烂了	未
定襄气象局发布大风蓝色预警	未
定襄神山四有文逗笑了	未
定襄秧歌《赶上骡骡车娶过你》	未
定襄紧急寻人启事！谁认识	未
定襄紧急扩散！外环路限高了	未
定襄紧急通知！社保卡不清零	未
定襄紧急通知！这个时间段限行！不罚款	未
定襄紧急限行通知！调整启动重污染天气橙色预警的通告	未
定襄詹丽华的事电视台报道了	未
定襄谁没有社保卡赶紧看	未
定襄谁的三轮车翻了	未
定襄谁的车限行让拍照了	未
定襄这7个人去趟交警队	未
定襄这个时间段限行！不罚款	未
定襄这个村的村长和村民上电视了	未
定襄这些人的退休工资又涨了	未
定襄这些人：赶紧去趟交警队	未
定襄这条道路已纳入县城规划	未
定襄退役军人和其他优抚对象信息采集了	未
定襄限行！11月30日0时至12月3日0时启动重污染天气黄色预警	未
定襄限行了！这些车辆不能走	未
定襄限行！火车站拍到的一幕	未
定襄限行解除通知！27日0时	未
定襄限行通知！27日0时解除	未
定襄集中供暖县里头又开会了	未
定西娃，你妈喊你回家杀年猪了	未
定西家里有电动车的，都看一看	未
定西岷县惊现二级国宝	未
定西市举报涉枪涉爆违法犯罪线索奖励办法	未
定西市采取32项措施精准治理扶贫领域腐败和作风问题	未
定调2019，中央经济工作会议全文来了：实施更大规模减税降费	未
定调2019，八个关键词速读中央经济工作会议	未
定调明年楼市三大信号	未
定边一女子深夜一氧化碳中毒！冬天到了，烧炉子一定要注意安全	未
定边二手车 大众本田奥迪宝马等 更新至2018-12-06	未
定边县人民政府办公室关于进一步做好非洲猪瘟防控工作的通知	未
定边县公安局召开雷霆禁毒2018第四战役专项行动部署会	未
定边县民政局及时下拨农村特困分散供养人员各类补助资金	未
定边县气象台发布蓝色寒潮预警	未
定边县消防大队组织开展消防演练 防患于未燃	未
定边招聘 招聘累计人数8万多 更新至2018-11-25	未
定边查处扶贫领域腐败和作风问题39件，党纪政务处分29人	未
定边法院 开展扫黑除恶专项斗争宣传活动	未
定边这家中医馆里居然发生这样的事	未
定边这家店即将开业！现现高薪诚聘各岗位人员33名！	未
定远一家三口驾车撞灯杆 命悬一线交警速救援	未
定远关于这项工作，书记是这么说的......	未
定远大街上酒驾逃跑交警抓捕录像	未
定远夹雨伞骑车闯黄灯被撞，已上安徽新闻	未
定远志愿者赴合肥捐献造血干细胞	未
定远：村民喜提新车放鞭炮庆祝不料烧了自己家	未
定远警方第60期：铁腕治盗采 ！	未
定骨石村干部小心了，快收拾你呀！	未
定鼎路唐宫路路口的香酥牛肉饼	未
宛如智障//@我是一颗橙橙橙:@开水族馆的生物男 水哥来看热闹	未
宛如灾难片！韩国电信公司突发大火 大半个首尔瞬间断网当地时间11月24日(周六)上午11点左右，位于首尔的韩国电信公司(KT)阿岘分公司突发大火。KT是韩国三大电信运营商之一，火灾虽然没有造成人员伤亡，但因为KT地下室的通信设备受损，导致韩国的警察医院金融等社会基础设施被迫停转。由于手机无法通话也上不了网，许多人在平时无人问津的电话亭前排起长队。	未
宜丰司机注意，全国统一查酒驾时间表公布！这几天必查！	未
宜丰家住七楼以上的注意了！不曝光，咱还真不知道！	未
宜人宜情单位里的95后都开车上班了，我还在骑着电驴坐着公交，感觉自己在单位抬不起头！	未
宜人宜情女人真的是不可理喻，为了她家一只猫，居然叫我滚蛋！	未
宜人贷遭业绩股价双腰斩，CEO一周四场演讲秀为挽狂澜？	未
宜信唐宁：下一个40年由新经济定义	未
@宜兴人，一图读懂江苏户口新政！	未
宜兴人可以和飞机说再见了！超级高铁要来了！宜兴到北京不到30分钟	未
宜兴人请注意！宜兴车辆管理所11月27日暂停办理业务一天！	未
宜兴公安向人民报告！	未
宜兴发展继续东进！王婆河以东地区规划都公示了！	未
宜兴城里最后的江南庭园	未
宜兴女孩揭秘有毒茶具销往全国，93的人正在接触	未
宜兴女孩揭秘紫砂行业潜规则，常喝茶的人一定得知道！	未
宜兴女孩首次曝光紫砂市场真相	未
宜兴的雪已经上线，出行注意安全！	未
宜兴超多小宝贝冬天不回家的秘密终于被我发现了，居然都在这里。。。	未
宜兴这个毒狗的贼被逮个正着！背后主使竟是无良狗肉贩子！	未
宜兴这些景区型水库，你都知道吗	未
宜兴这群不挣钱不工作的女人，一夜之间成了焦点！你认识吗	未
宜华生活：部分董监高合计增持公司股份1.07%	未
宜家（中国）召回格利瓦伸缩型餐桌	未
宜家出品：战斗民族的新宠鲨鱼，一口吞掉你的焦虑	未
宜家出现一群流浪狗，有吃有喝，还霸占了样板间网友：背后的故事太暖了！	未
宜家商品标签将"中国""台湾"并列 曝光3个月还这么卖	未
宜家狂打5折，最低4.9蚊！连续1个月！还有这些好物...	未
宜家的一条小鲨鱼，居然莫名其妙就火了...菠萝家分享	未
宜家的购物体验，再次让我震惊了如果您拆了包装，需要拿着箱子，自己去店里退货。如果您完全没拆包装，就是快递上门去取我特别想知道，如果我有时间去线下实体店买的话，我为什么要选择网购呢！	未
宜宾5.7级地震 包括成都绵阳重庆在内的多地网友表示震感强烈，网友家的吊灯都扭起来了，希望平安无事！	未
宜宾5.7级地震四川省地震局：已启动3级应急响应 存在4.5级余震可能12月16日下午，四川省地震局召开新闻发布会，通报此前在宜宾兴文县境内发生的5.7级地震相关情况。四川省地震局立即启动地震应急预案，决定实施3级应急响应截至目前，震区通讯交通基本正常，少数房屋出现拉裂梭瓦等破坏现象，局部地区出现滚石现象，尚未收到房屋倒塌和人员伤亡情况报告。初步研判：兴文地震为主余型地震，短期发生更大地震地可能性不大，但存在发生4.5级左右强有感余震的可能。四川日报	未
宜宾5.7级地震已造成兴文县10人受伤截止16：00，宜宾市兴文县全县共有10人受伤，均在乡镇卫生院治疗，无生命危险各乡镇有房屋不同程度受损，因地震产生的小范围道路电力通讯受损，正在抓紧抢修恢复，其他灾情正在收集核实中。@兴文发布	未
宜宾5.7级地震 成都震感强烈12月16日12时46分在四川宜宾市兴文县（北纬28.24度，东经104.95度）发生5.7级地震，震源深度12千米。成都绵阳德阳南充等四川各地网友均表示震感强烈，你那里还好么	未
宜宾5.7级地震  网友家的吊灯都扭起来了，希望平安无事！	未
宜宾一10岁小朋友报警称书包被抢！包里有作业，真相竟是	未
宜宾一女子强行拿别人的衣服穿手中还持刀具，竟然是......	未
宜宾一村支书猥亵女教师致其流产，拘留5天，大家怎么看	未
宜宾一男子坐过站，竟暴打公交车司机！监控还原全过程！	未
宜宾一男子清晨出门，竟在家门口捡到玛莎拉蒂车钥匙，皮草，YSL高跟鞋	未
宜宾一货车开下高坎，驾驶员不幸身亡！	未
宜宾三江口挤满了人，原来是在做这件事......	未
宜宾临港加气站，搬了！要搬到这个地方...年前就开业！	未
@宜宾人 今天起，中心城区出租车每趟次加收1元燃油费	未
宜宾人快看，你的社保有大变化！医保养老金失业保险	未
@宜宾人 明天起，这些新规将影响你我生活！	未
宜宾人注意！宜宾长江桥北A匝道已封闭！	未
宜宾人注意！明天起，这些新规将影响你的生活！	未
宜宾公交司机又被殴打，又是因为乘客错过站，监控还原全过程！	未
宜宾公安21小时速破伪造交通违停罚单案	未
宜宾兴文5.7级地震 8个矿山救护队赴灾区开展救援工作	未
宜宾兴文5.7级地震，县城居民：摇得太凶了飞叉叉跑上楼顶	未
宜宾兴文5.7级地震 村民看到山体滑坡	未
宜宾兴文5.7级地震 消防在震中开展侦察搜救12月16日中午宜宾市兴文县发生5.7级地震后，四川消防应急队伍紧急前往救援16时许，宜宾消防支队12车72人抵达震中周家镇，现场救援力量划分9个搜救小组，对周家镇周边乡村进行拉网式搜救17时许，泸州支队10车54人抵达震中周家镇，按照现场指挥部统一 ...全文	未
宜宾兴文5.7级地震 消防在震中开展侦察搜救12月16日中午宜宾市兴文县发生5.7级地震后，四川消防应急队伍紧急前往救援。16时许，宜宾消防支队12车72人抵达震中周家镇，现场救援力量划分9个搜救小组，对周家镇周边乡村进行拉网式搜救17时许，泸州支队10车54人抵达震中周家镇，按照现场指挥部统一部署，泸州支队救援力量赶赴九丝城镇，开展侦察搜救工作。目前搜救工作仍在进行中。（记者 陈松）	未
宜宾兴文5.7级地震 系四川今年来最大的地震	未
宜宾兴文5.7级地震 网友家的吊灯都扭起来了，希望平安无事！	未
宜宾兴文县5.7级地震 地震局上市公司回应在此！今日（12月16日）12时46分，四川宜宾兴文县内发生5.7级地震，震源深度12千米。对于此次地震，《每日经济新闻》记者展开了多方采访。网页链接	未
宜宾兴文县5.7级地震 地震局上市公司回应在此！今日（12月16日）12时46分，四川宜宾兴文县内发生5.7级地震，震源深度12千米对于此次地震，每日经济新闻记者展开了多方采访网页链接	未
宜宾兴文县5.7级地震多地有震感 暂无伤亡报告	未
宜宾兴文地震震后第一夜，他们做了这些	未
宜宾军分区240余名官兵和民兵驰援震区宜宾兴文5.7级地震 ，四川省军区迅即启动应急指挥机制，省军区相关负责人第一时间赶到作战指挥中心，了解情况研判灾情，紧急部署救灾工作宜宾军分区共出动8个搜救分队，今晚将连夜进村入户搜救转移群众，确保群众生命财产安全截至记者发稿时，宜宾军 ...全文	未
宜宾副食店惊现神酒五步蝮蛇王，里面居然加了这个东西！	未
·宜宾县将撤县设区	未
宜宾又多一座特大桥！明天起这条路封闭施工，所有车辆禁止通行！还有	未
宜宾又有两条高速公路动工！要经过	未
宜宾发生3.1级左右地震中国地震台网自动测定：11月28日12时29分在四川宜宾市兴文县附近（北纬28.14度，东经105.10度）发，最终结果以正式速报为准（ @中国地震台网 ）	未
宜宾变形计！我们把22个乡村儿童接到城里，连续6周	未
宜宾叙府商城遭窃！万元貂毛大衣竟然千元销赃！结果......（视频）	未
@宜宾司机 注意了！下周起，宜宾这些路段启用电子监控设备！	未
宜宾地震亲历者讲述惊险一刻：晚几秒就被成吨巨石砸中	未
宜宾地震四川宜宾5.7级地震：多地有震感 暂无伤亡报告据央视，四川兴文5.7级地震发生后，四川宜宾乐山眉山绵阳成都等地震感明显，重庆亦有震感报告。兴文县当地农房出现明显裂缝，有瓦片砖块掉落。目前，灾情正在进一步核实，暂未收到人员伤亡报告。	未
宜宾地震四川宜宾5.7级地震：多地有震感 暂无伤亡报告据央视，四川兴文5.7级地震发生后，四川宜宾乐山眉山绵阳成都等地震感明显，重庆亦有震感报告兴文县当地农房出现明显裂缝，有瓦片砖块掉落目前，灾情正在进一步核实，暂未收到人员伤亡报告	未
宜宾地震已致6人轻伤 存在4.5级余震可能16日12时46分，四川宜宾市兴文县发生5.7级地震。截至14时40分报告，兴文县部分房屋有被拉裂现象，6人受轻伤，震区附近有轻度滑坡滚石等地质灾害出现。（人民日报） 人民日报的微博直播 .	未
宜宾地震，重庆没感觉！但愿平安无事！	未
宜宾地震，麻烦你请让我优先！12月16日12时46分在四川宜宾市兴文县（北纬28.24度，东经104.95度）发生5.7级地震，震源深度12千米。目前，震区通讯交通基本正常，部分房屋出现拉裂梭瓦等破坏现象，局部地区出现滚石现象，部分地区断电。地震发生后，武警四川省总队立即启动应急预案，加强值班值守，第一时间派出先遣组前往兴文县，了解灾情动态。13时40分，武警宜宾支队队长聂刚己率机动中队执勤四中队和兴文中队110名兵力赶往一线，并于下午16时到达兴文县周家镇龙洞村，携带铁锹铁镐绳索生命探	未
宜宾女子打牌居然抽老千，场场赢啊！	未
宜宾女子打牌居然盘盘赢！原来秘密是这个	未
宜宾女子打麻将居然每次都赢，原来其中有名堂！	未
宜宾女子持刀走进干洗店强行拿衣服穿，没人敢靠近，好黑人啊！	未
宜宾市兴文县发生5.7级地震地震快讯中国地震台网正式测定：12月16日12时46分在四川宜宾市兴文县（北纬28.24度，东经104.95度）发生5.7级地震，震源深度12千米@中国地震台网速报	未
宜宾市兴文县附近发生4.4级左右地震地震快讯中国地震台网自动测定：12月16日12时45分在四川宜宾市兴文县附近（北纬28.27度，东经104.89度）发生4.4级左右地震，最终结果以正式速报为准@中国地震台网速报	未
宜宾市兴文县附近发生5.7级地震中国地震台网正式测定：12月16日12时46分在四川宜宾市兴文县（北纬28.24度，东经104.95度）发生5.7级地震，震源深度12千米。中国地震台网速报微博 宜宾市兴文县附近发生5.7级地震查看图片	未
宜宾市兴文县附近发生5.7级地震中国地震台网正式测定：12月16日12时46分在四川宜宾市兴文县（北纬28.24度，东经104.95度）发生5.7级地震，震源深度12千米中国地震台网速报微博 网页链接	未
宜宾开始降温！寒潮蓝色预警来袭，最低只有4度.........	未
宜宾惊现路怒司机，车辆擦挂后竞对前车拳脚相向，后车司机说.....	未
宜宾新机场已修成这样，明年7月投入运行！最新进展来了	未
宜宾新闻今天  宜宾霸屏了（视频）	未
宜宾新闻企业家，你们看到了吗（视频）	未
宜宾新闻关于艾滋病，你不知道的一个惊人事实（视频）	未
宜宾新闻原来宜宾有那么多重点实验室！（视频）	未
宜宾新闻宜宾城区乘坐出租车的请注意了！（视频）	未
宜宾新闻宜宾这条高速公路动工  将途经这些地方（视频）	未
宜宾新闻成都宜宾泸州德阳聚一起  共同要干这件事（视频）	未
宜宾新闻是什么，让这些人留在了宜宾（视频）	未
宜宾新闻朋友圈疯传的金雕，不！真相在这里（视频）	未
宜宾新闻消防人士警示：这些是秋冬季节火灾高发原因（视频）	未
宜宾新闻种茉莉花也能发财，了解下（视频）	未
宜宾新闻翠屏区区长李强拟任县（市区）党委书记	未
