实况天气 清晨，气温较低。7点丰县-7.3度，听着都冷！上班路上注意防寒保暖。	未
实况天气 清晨，气温较低，上班路上注意防寒保暖	未
实况聚焦 15时50分实况，苏州部分区县近20啦	未
实况聚焦目前雨雪停歇，全省都是阴到多云的天气凶猛的冷空气让全省的气温大跳水，早上8时，各城市温度在-5到0左右，最低的连云港北部只有-5.1	未
实力他不允许啊//@5X霹雳火:@胡正阳- 你啥时候转型做的农业装备啊！	未
实力坑爹 女儿借了老爸三十万 竟然用假存单还钱 j江苏启东人吴某某今年三十岁，为了做生意两年前问父亲借了30万。去年开始生意出现亏损，眼看钱还不上了，她竟伪造了张存单还给父亲。今年6月父亲去银行取钱时被工作人员当场识破后报警，案发后吴某某主动投案并供述了自己的罪行。日前。法院 ...全文	未
实力打脸！女明星微博爆料称遭深圳海关刁难，现场监控还原真相大反转！	未
实力科普 一夜爆红的芬太尼是什么?与这些上市公司有何关系?一款被称为芬太尼的药物，横空出世抢了不少眼球。芬太尼到底是什么它和大A股有什么联系吗这是因为芬太尼不仅是药品，同时又是继传统毒品合成毒品之后的第三代毒品实验室毒品中的重要成分。一夜爆红的芬太尼是什么与这些上市公司有何关系	未
实力科普 免疫系统能有效保护我们免受周围环境中病原体的侵袭，但是，所有系统都会有美中不足的地方。研究者描述了一个能使病毒免于被免疫系统探测到的基因，而该基因原本具有保护身体免受自体免疫性疾病（人体内的异常免疫反应攻击正常细胞）伤害的功能。至于最终的结果如何，取决于有多少病毒试图进入人体。能使病毒隐身的基因：超过阈值才会被免疫系统发现 能使病毒隐身的基因：超过阈值才会被免疫系统发现	未
实力科普 国家卫健委中国科协回应基因编辑婴儿事件国家卫生健康委副主任曾益新今天接受记者表示，我们始终重视和维护人民的健康权益，开展科学研究和医疗活动必须按照有关法律法规和伦理准则进行。目前媒体所报道的情况严重违反国家法律法规和伦理准则，相关部门和地方正在依法调查，对违法违规行为坚决予以查处。国家卫健委中国科协回应基因编辑婴儿事件	未
实力科普 王立铭：我们比以往任何时候都需要了解生命科学近日，关于基因编辑的新闻引起了全球范围内的关注，同时引发了法律和伦理方面的争议。基因编辑技术是否成熟未来的生物技术将把世界引向何方此时此刻，我们比以往任何时候都更需要了解生命科学，更需要深刻地理解地球生命和人类智慧。王立铭：我们比以往任何时候都需要了解生命科学	未
实力科普 空间站微生物威胁宇航员健康近日发表在开放获取期刊《BMC微生物学》上的一项研究显示，科学家在国际空间站内发现了一些肠杆菌菌株，这些细菌与在一些医院中发现的传染性病菌相似。太空中的这些菌株对人类而言并非致病菌，但研究者认为应该研究其对未来的航天任务承担者可能造成的健康影响。	未
实名举报变成举报人公告！还用反腐举报吗如此专注精准证据确凿（有图有真相）的实名举报！历时一年五个月无结果去年6月底开始先后多次向各级纪委监察委和党政领导邮寄举报信137份详细举证了犯罪线索的情节时间地点贿赂双方的人证物证近20页，十个月后却变成举报人公告 ...全文	未
实名公布！我省又一批终生禁驾人员名单曝光，莱芜7人！看看有你认识的吗	未
实名！哈尔滨这68人被终生禁驾，80后90后占5成以上	未
//@实名晨枫:	未
实名曝光  桂林这100名失驾人员将不能驾驶机动车了！	未
实名曝光！淮南这个路口一周闯红灯人数竟多达	未
实名曝光第三十六期：不按规定停放机动车看看有您的爱车吗	未
实名曝光！阆中这家蒸馍厂生产的蒸馍不合格....	未
实在太忙！韩国瑜再次婉拒出席两岸交流活动	未
实在太有诱惑力了	未
实在太牛逼了，已经可以进行这么复杂的环境判断，可以打开门，还懂得让没有机器手的同伴先过了。又想到了中国知名机器人独角兽公司优必选，主要任务就是把语音助手放到铁盒子里进行融资。	未
实在忍不住好奇拉开了！闻到淡淡抹茶味。然后无论如何想搞清楚里面有什么，索性就剪开了。发现底部有些绿色的粉末，继续查成份确定是小麦草粉。这是欺诈！商品名不该写空气，该写草粉吧好吧，至少我的好奇满足了。 查看图片	未
实在忍不住笑。 //@小草发芽x: 那就是中国河南省台湾县高雄村2组三大队。	未
实在无聊买个地球仪吧世界那么大你不但可以看看还可以转转	未
实在是困了，就在这睡吧	未
实在没想到有一天我也成为了实实在在的抠脚大汉这两天撕脚皮撕的好爽冬天我的后脚跟实在太干了，平时用的磨砂膏什么的根本救不了我，一直不管的话脚上的死皮还会变硬这个脚膜用完几天，脚上的死皮就可以一整片扯下来巨爽现在我脚丫白白嫩嫩可以去拍广告除了过程猥琐一点以外没毛病，但撕脚皮真的好过瘾啊！！！！么么晗的美妆笔记 看出来我换了个壁纸吗，最近我把整个家又装一遍，再换个灯我就心满意足了	未
实地排摸查看，制定解决方案，小桥头片区文明拆除进行中	未
实地探访“学生倒免费奶”事发学校:牛奶专供专派	未
实地探访“学生倒免费奶”事发学校：牛奶专供专派	未
实地调查：福岛的食品到底还能不能吃 实地调查：福岛的食品到底还能不能吃	未
实地走访、专家会诊，妙招解难题	未
实地踩盘，但这次标题交给大家...	未
实实在在的便民措施！	未
实属罕见，金寨史河惊现国家一级保护动物！	未
实干 把蓝图变为现实	未
实干，把蓝图变为现实	未
实录	未
实录！华为董事长接受国内媒体群采，透露了什么？	未
实录：爽一下，他被儿子暴打	未
实录：监控下的梦游人	未
实录那些上位小三告诉我们的	未
实战总结：进入冬季无游客景区如何迈过淡季经营这个坎！	未
实战用是实战用啦，但是料想也轮不到他挨刀，不然不会做得这么花里胡哨。	未
实战记录：目前仓位1成，上午卖出一只创投股获利1.4万，还有一只也是创投股，小浮赢。下午择机再说，开不开跑看心情。大彪不错，接任二营长后，打了5次伏击，5战5胜！虽然战利品不多，但也鼓舞士气。下午再战！	未
实抓严管！光山交警开展城区僵尸车清理专项行动，及时清理交通垃圾	未
实拍12月1日傍晚鸡西园林路灯出现特效	未
实拍6公里3万6，不报警是孫子！	未
实拍D&G北京门店:店内无顾客 店外有人＂拍照留念＂	未
实拍:video	未
实拍：一头5吨重野象漫步高速公路，迎面而来的货车疯了	未
实拍一客家后生哥捉蛇， 结果被过山峰咬， 躺一边...	未
实拍一枪爆头！	未
实拍  三门峡这家足浴店除了在做足疗，竟然还在做这种事	未
实拍不下车就捅死你！你咋这么狂	未
实拍东北农村干仗，呜嗷喊叫一顿砸！	未
实拍东北农村干仗，生死已经看淡	未
实拍:东明9旬老人拉板车卖香菜，直到遇见他们.....	未
实拍：东明菜园集2个村台最新进展！	未
实拍：东明这些人冒雨这么干，这些地方真要大变样了！	未
实拍！中江清河一6座黑校车竟然塞了25个娃！	未
实拍！中江这个贼娃子，3秒撬开U型锁偷走电瓶车......	未
实拍人狗撕咬大战！真猛！	未
实拍今天大雾天，肃宁两起车祸	未
实拍！今晨一红色轿车在远安县西门路某院内起火烧成壳	未
实拍！仙游某公园惊现蛇洞，蛇头蠢蠢欲动...	未
实拍俄军最先进轰炸机飞抵美国后院 美高官：有啥用 就是浪费钱	未
实拍俄军苏25战机巡航刻赤海峡 以应对乌克兰行动	未
实拍俄罗斯钢厂堆钢，哥们淡定抽着烟！	未
实拍全城地铁围挡大回撤：经纬街中段征仪路珠江路通乡街新疆大街都通了	未
实拍农村做粉条全过程，看完想回漳县吃粉条了	未
实拍！农村结婚！	未
实拍农村结婚现场！汤阴老乡们快来沾沾喜气...	未
实拍: 农村结婚现场！现在结婚都这样子了	未
实拍农村蒸馍，家的味道！	未
实拍北京杜嘉班纳门店：我不进店，我就拍个照	未
实拍北京胡同发现一民间高手，真是深藏不露	未
实拍北康居的事 蔚县领导亲自到家中解决.....	未
实拍：南湖秦腔晚会	未
实拍南部伏家大堰每天堵成长龙，到盘龙的路何时能修好！	未
实拍印尼火山爆发：海水狂袭吞没城市 人们惊慌逃散	未
实拍！又是一年老王会	未
实拍台湾6.2级地震:千人狂奔避难 超市瓷碗碎一地	未
实拍命大，阎王都不敢收	未
实拍咸阳农村过事吃饸饹，这阵势！	未
实拍商丘四人高空玩杂技，突然绳断人坠落！	未
实拍喝酒闹事！谁认识这位大哥白事上居然能喝成这个样子...	未
实拍！固安惊现疯狂黑校车！车内竟塞了这么多孩子...	未
实拍在外的怀来人， 请赶快回家一趟吧 因为	未
实拍在街上为环保捡起瓶子的美女小姐姐，她发现被拍后不好意思笑了 微博视频	未
实拍地道五台农村婚礼！唢呐吹起来 大桌饭吃起来！！	未
实拍地道忻州农村婚礼！唢呐吹起来 大桌饭吃起来！！	未
实拍墨西哥女杀手	未
实拍壮汉一人单挑十几个黑社会 这战斗力太猛了！	未
实拍多图泸州城西客运站最新进度，快看修成什么样即将试运营投用	未
实拍：多大的仇男子竟然与人同归于尽！	未
实拍  夜晚东里街头拍下的一幕！这些人有你认识的吗	未
实拍大冷天的！汤阴农村一群人围在这里，恁庄上有吗	未
实拍天气赢红包	未
实拍！天水街头整容了，你发现了吗最新图片抢先看！	未
实拍：天空中不明生物，龙，凤凰，天使，鸟	未
实拍女员工跟老板激烈一幕！结果没想到	未
实拍女孩上班下班判若两人	未
实拍威县农村毛驴排子车（地排车），现在很少见了！	未
实拍：婚礼上撕起来了新娘子都跑了磕碜不！	未
实拍宁县婚俗新娘出嫁(收陪纺新娘上轿)！	未
实拍定西农村葬礼！	未
实拍宝马司机人头落地恐怖一幕	未
实拍，家乡攸县丫江桥赶集，你有多久没有经历过了?	未
实拍：小伙徒手切磋，结果让他一辈子留下阴影！	未
实拍小孩在院子玩耍时被灵体攻击全过程！	未
实拍巴城一醉鬼睡在地上，还阻止别人救他！	未
实拍：带你看看黑河联通紧急抢修现场	未
实拍：平乐二塘网吧，这是真砍	未
实拍：庄浪县医院异地扩建仪式	未
实拍庆阳60多年老院子	未
实拍庆阳姑娘出嫁	未
实拍德国的小作坊生产铁铲，过程着实严谨！	未
实拍成都上班族通勤辛酸故事，平均每天花费3小时	未
实拍打架一脚踢停！	未
实拍！拆！霸州违建夜间被拆！	未
实拍拼多多纸尿裤黑工厂：旺季月销百万片，全是三无垃圾货	未
实拍攸县人洣水河畔冬泳，厉害了！	未
实拍攸县本地榨油坊实况，你还记得吗?	未
实拍日式拉面熬汤车间 猪骨到成汤需要4天时间	未
实拍日本全透明玻璃公共厕所，你敢上吗?	未
实拍日本农村照片，原来他们的乡村生活是这样的组图	未
实拍日本游乐园里的过山车，隔着屏幕看都感觉发麻	未
实拍早胜塬习俗过三年	未
实拍昨天大集上拍到的视频	未
实拍昨天小姐姐有点事情耽搁了，今天会给大家出的宝贝详情	未
实拍，昨晚西环车祸！	未
实拍：暴力讨债人拉帮结伙带卡车堵门 不想对面有装载机	未
实拍曾富可敌国的古村落：黄金筑墙馒头为窑	未
实拍：村民上山捉野猪，多条狗围攻！	未
实拍：村民上山捉野猪，多条狗围攻！结果...	未
实拍村里结婚酒席，看看这些菜过劲不！	未
实拍：杨河乐正广场喜庆活动	未
实拍林州火车站	未
实拍:林州火车站，你见过吗	未
实拍林州火车站火车穿梭而过，你见过吗	未
实拍：林州环保大厦	未
实拍！桂林一中学附近刚发生的事，谁认识这个豆子鬼！	未
实拍！桂林芦笛路突发大火！现场浓烟滚滚，火光冲天！	未
实拍：榆林南郊电厂近百米冷却塔拆除，瞬间倒下！	未
实拍武乡炒指全过程，令人怀念啊	未
实拍：武功再高也怕菜刀，又是个练家子啊！	未
实拍武警特战队员实弹射击考核	未
实拍武警防化官兵实案演练	未
实拍永泰庄附近一轿车起飞失败，为抓司机，特警都来了！	未
实拍汤阴农村400元一桌的结婚酒席，看看这些菜带劲不！	未
实拍沙漠翻车七七四十九圈，车都散架了别说人了	未
实拍：没卡不让进小区！路虎女司机狂扇保安！你怎么看	未
实拍法国陆军演习 世上最贵主战坦克的炮口为何带着“套子”	未
实拍波兰与德军联合实弹军演 插满树叶的狙击手活像“稻草人”	未
实拍：济南和贵阳海市蜃楼，太平洋海市蜃楼	未
实拍！深夜的天津1号线：每个人的生活里都没有容易二字...	未
实拍火箭军十余发导弹集群发射 如彗星照亮夜空	未
实拍：狂犬病发作瞬间，好吓人...	未
实拍甘肃农村坐席吃席，直接抢起来了，大人小孩直接抢不上！！	未
实拍用土打墙，谁见过	未
实拍电梯内的一幕！	未
实拍男人只用30秒，徒手爬上了4层楼救了一名小孩	未
实拍看到他被群殴，我也就放心了	未
实拍真下得去手啊！	未
实拍突然漏电，吓死个人了	未
实拍：绥德野外烧土豆，几代人的回忆！	未
实拍美國911飞机撞大楼高清视频！	未
实拍老太上演碰瓷神技！网友：这是奥斯卡本卡了	未
实拍聪明人会干活！	未
实拍藏马熊做客牧民家	未
实拍行凶现场！	未
实拍：街头打架，好暴力啊	未
实拍衡东乡下老奶奶做霉豆腐...	未
实拍衡东农村捡瓦...	未
实拍该视频容易引起极度舒适感...	未
实拍！贵南高铁控制性工程最新进展	未
实拍  贵州凯里鸟山清晨遛鸟	未
实拍：赣州农村结婚，比城市的喜庆！	未
实拍赴美生子：去美国生孩子的她们，都过着怎样的生活	未
实拍路怒直接干架，俩哥们动作片看多了！	未
实拍轻轻一拐，三条命！	未
实拍这么不安分的吗	未
实拍！连接潢川彩虹桥与华英大道，这条新建道路到底咋样了...	未
实拍  通渭丧事安葬记实	未
实拍：邢台三车相撞，车头都撞烂了！	未
实拍：镇原丧事唢呐，悲音四起！	未
实拍：镇原屯字白事唢呐祭奠全程！	未
实拍镇巴西乡高速公路建设进度	未
实拍闽南猴齐天附身，好多人排队	未
实拍限行后，晋城人民广场众人排队等公交！！现场.....	未
实拍青年赶往上海总决赛视频青年黑粉老弟发来视频请问这个是青年吗哈哈哈哈哈哈哈哈！	未
实拍静宁沙尘天气	未
实拍静宁狮子采青	未
实拍香港街头现金“从天而降”路人疯抢 撒钱人疑虚拟货币玩家	未
实拍龙口大雾！天气突变，明天后天	未
实拍龙口第一场雪！七甲石良下丁家这些地方下的忒大了	未
实探同仁堂quot过期蜂蜜门quot供应商：不许拍照不准进厂近日，江苏电视台城市频道南京零距离栏目曝光了盐城金蜂公司将大量过期临近过期的蜂蜜回收，宣称将退给蜂农喂蜂，实际上却运入了原材料库，再加工后销售。近日，12月18日下午与19日上午，媒体记者多次致电盐城金蜂相关负责人，但该负责人表示，他和董事长目前均已出差，不在公司，不接受电话采访。厂区工作人员还阻止记者现场拍照。对于蜂蜜的保存期限和合理利用，一养蜂人士说，将过期的蜂蜜喂给蜜蜂是正常现象，但味道已经发酸，人不能再吃。实探同仁堂	未
实探同仁堂quot过期蜂蜜门quot供应商：不许拍照不准进厂近日，江苏电视台城市频道南京零距离栏目曝光了盐城金蜂公司将大量过期临近过期的蜂蜜回收，宣称将退给蜂农喂蜂，实际上却运入了原材料库，再加工后销售。近日，12月18日下午与19日上午，媒体记者多次致电盐城金蜂相关负责人，但该负责人表示 ...全文	未
实探银隆控股注册地：魏银仓办公室空置已久 办公设施已被撤走记者进入银隆控股大院看到，院子里共有三栋低层洋楼用作办公，两栋为二层高，第三栋高三层。据了解，第三栋楼房原为银隆控股及银隆新能源高管办公大楼，魏银仓办公室就在这里。但是记者进入后发现，该办公楼已经处于无人使用状态，相关办公设施等已经全部撤走。第一栋楼在前厅供有关公塑像，但楼门紧闭第二栋楼标记银通能源展示厅，仅在午间看到有一位工作人员进出。实探银隆控股注册地：魏银仓办公室空置已久 办公设施已被撤走	未
实施“五心工作法”搭建“红色强磁场”	未
实施换股吸收合并 外运发展12月13日停牌直至退市	未
实施方案！内蒙古自治区人民政府印发	未
实施更大规模的减税降费	未
实施更大规模的减税降费12月19日至21日在北京举行的中央经济工作会议指出，宏观政策要强化逆周期调节，继续实施积极的财政政策和稳健的货币政策，适时预调微调，稳定总需求积极的财政政策要加力提效，实施更大规模的减税降费，较大幅度增加地方政府专项债券规模稳健的货币政策要松紧适度，保持 ...全文	未
实施更大规模的减税降费12月19日至21日在北京举行的中央经济工作会议指出，宏观政策要强化逆周期调节，继续实施积极的财政政策和稳健的货币政策，适时预调微调，稳定总需求积极的财政政策要加力提效，实施更大规模的减税降费，较大幅度增加地方政府专项债券规模稳健的货币政策要松紧适度，保持流动性合理充裕，改善货币政策传导机制，提高直接融资比重，解决好民营企业和小微企业融资难融资贵问题。32条干货，带你速读中央经济工作会议！（人民日报）	未
实施道路运输从业人员教育改革应认清三大问题	未
实时10:42 这条海底捞 速度。	未
实时：冷空气脚步入粤北，按照这样的速度，进入深圳，应该是在晚上22点前后	未
实时播报：11城市药品集中采购拟中选结果公示 药价平均降幅52国家医保局8日表示，国家组织药品集中采购试点工作顺利推进，47城市药品集中采购拟中选结果于7日开始进行公示，31个试点通用名药品有25个集中采购拟中选，与试点城市2017年同种药品最低采购价相比，拟中选价平均降幅52，最高降幅96。（中新网）	未
实时播报：11月CPI今公布，涨幅或连续5月处于2时代根据安排，国家统计局今日(9日)将公布11月份居民消费价格指数(CPI)。机构普遍预计，11月份CPI同比涨幅有望小幅回落，但涨幅仍处于2时代。根据Wind统计，近期19家机构对11月份 CPI同比涨幅的平均预测值为2.4。（中新经纬）	未
实时播报：IMF委员会将考虑在12月18日批准对乌克兰的援助协议。	未
实时播报：LME期铜收涨1.2LME期铜收涨1.2，报6145美元/吨。LME期锌收跌0.2，报2587美元/吨。LME期铝收涨1.0，报1955美元/吨。LME期铅收涨0.6，报1995美元/吨。LME期镍收涨0.6，报10910美元/吨。LME期锡收涨0.4，报19000美元/吨。	未
实时播报：PIMCO投资组合经理Ed Devlin：并不认为美国经济会立即陷入衰退。加拿大央行必须密切留意美联储的预测。	未
实时播报：PPP规范叠加环保强监管 环保产业或迎涅槃之变在专家和业内人士看来，无论是PPP规范还是环保强监管，都是一柄双刃剑，在给环保行业带来压力的同时，也将倒逼其强化内功从而实现涅槃之变。环保强监管的推进理应激发环保强需求，在引入系统性环境经济制度和政策工具之后，这个趋势将变得更明显，环保产业应该抓住其中的机遇。（经济参考报）	未
实时播报：ST成城：大股东控制权变更 公司实控人变更为李冬ST成城早间公告，赛伯乐投资将持有的赛伯乐绿科100万元股权，以100万元的价格转让给东方绿科。股权转让完成后，东方绿科持有赛伯乐绿科51的股权，成为赛伯乐绿科的控股股东，并通过赛伯乐绿科的全资子公司绿科伯创持有公司7.67股份。因此，公司实际控制人由朱敏变为东方绿科的实际控制人李冬，公司第一大股东未发生变化，仍为绿科伯创。	未
实时播报：一列载有189名乘客从江玲驶往首尔的高铁脱轨，14人受轻伤。 （韩联社）	未
实时播报：万达电影：收到《中国证监会行政许可申请受理单》，中国证监会对公司提交的《上市公司发行股份购买资产核准》行政许可申请材料进行了审查，认为该申请材料齐全，符合法定形式，决定对该行政许可申请予以受理。	未
实时播报：三五互联：与中移动签署《移动通信转售业务正式商用合作协议》三五互联12月3日晚间公告，公司与中国移动签署了《移动通信转售业务正式商用合作协议》。公司将尽快按照工信部及相关法律法规的要求准备相关申请材料，向工信部申请更换电信业务经营许可证。公司取得移动通信转售业务正式商用牌照后，将通过移动通信个性化差异化的业务发展战略，努力做大做强移动通讯转售业务。	未
实时播报：三六零：参股公司TME在美国纽约证券交易所挂牌上市。	未
实时播报：三星注册新商标 或研发区块链智能手机据外媒报道，三星提交了三星欧洲商标申请，与区块链智能手机相关。三星提交的三项商标名称为Blockchain KeyStore（区块链密钥库）Blockchain KeyBox（区块链密钥箱）和Blockchain Core（区块链核心），适用于智能手机用于移动设备的软件应用程序计算机软件平台应用软件。	未
实时播报：上交所：2018年圣诞节期间不提供港股通服务上交所公告，根据《关于2017年岁末及2018年沪港通下港股通交易日安排的通知》（中投信201711号），现将2018年圣诞节期间沪港通下港股通（以下简称港股通）交易日安排通知如下：一12月24日（星期一）下午至12月26日（星期三）不提供港股通服务。二港股通交易的清算交收事宜，根据中国证券登记结算有限责任公司的安排进行。	未
实时播报：上海华信国际集团17华信Y2公司债无法按期付息。	未
实时播报：上海启动空气重污染蓝色预警 采取一系列响应措施上海市空气重污染应急工作组办公室决定，本市自11月27日19时起启动空气重污染蓝色预警，启动级响应措施。室外作业人员采取必要的防护措施。（上海发布）	未
实时播报：上海国际能源交易中心：若2018年12月27日（星期四）未出现单边市，当日收盘结算时起的交易保证金比例和下一交易日起的涨跌停板幅度调整如下：原油期货合约的交易保证金比例调整为11，涨跌停板幅度调整为9。...（微信24小时播报：FinancebeCom4）	未
实时播报：上海已有超过11万纳税人开始填报专项附加扣除信息本周上海税务部门已经展开对企业的全面培训，特别是对明年1月初即发工资的单位进行点对点精准培训，目前已有超过11万纳税人开始填报专项附加扣除信息。税务部门表示，如果因出差等原因没有及时填报信息，导致明年1月无法扣除，之后每个月可以顺延扣除。（文汇报）	未
实时播报：上海市公布2018年碳排放配额分配方案，确定2018年度碳排放交易体系配额总量为1.58亿吨（含直接发放配额和储备配额）。	未
实时播报：上海新世纪机器人有限公司召回部分代步机器人国家市场监管总局消息，日前，上海新世纪机器人有限公司向国家市场监管总局备案了召回计划，将召回部分2013年12月至2017年4月期间制造的型号为i-ROBOT-LAi-ROBOT-SC的代步机器人（包括部分在维修过程中为客户更换电池包的产品），涉及数量1341台。此次召回范围内代步机器人的锂离子电池可能发生内部短路，在极端情况下，存在过热起火安全隐患。	未
实时播报：上海清算所表示，中国华阳经贸集团超短期融资券到期兑付存在不确定性。	未
