实时播报：华菁证券副总经理郭胜北：美元兑发达国家货币难以持续走强。对新兴市场货币取决于缩表进程，如缩表不能及时结束，则美元的相对强势仍将维持。	未
实时播报：南非锰矿因铁路脱轨无法发货，或影响中国1月锰矿进口11月30日，南非国家运输公司Transnet宣布铁矿石和锰矿无法按时交货，原因是11月28日的一起事故导致铁路桥受损，铁路运营终止。Transnet表示会重建这座桥，并于两周后恢复安全运营。由于铁路脱轨，南非锰矿Assmang与UMK于saldanha港口装运的锰矿船只无法发货，有市场人士分析认为，此次事件将影响1月份中国进口南非锰矿15至20万吨的当量。	未
实时播报：卢森堡首相Bettel：英国不应当对爱尔兰保障计划感到惶恐不安。	未
实时播报：发改委同意建设长江口南槽航道治理一期工程，总投资18.77亿元。	未
实时播报：台湾海峡地震 厦门始发多趟列车晚点中国地震台网正式测定，11月26日7时57分在台湾海峡（北纬23.28度，东经118.60度）发生6.2级地震，震源深度20千米。受地震影响，从厦门始发的多趟列车出现晚点。（新华社）...（微信24小时播报：FinancebeCom4）	未
实时播报：号召员工增持高管频频抛售 乐金健康新玩家身陷泥淖尽管顶着大健康的光环，但乐金健康上市7年多业绩却差强人意，半数年份业绩下降。去年以来，包括财务总监董秘等在内的高管接连减持，原实控人金道明也由于股权质押高企，转让股份给资本大鳄吕向阳，吕向阳通过增持和受让股份成为新的大股东。然而，在控股权易手后，乐金健康依然跌跌不休，如今吕向阳也被套其中。	未
实时播报：各地银保监局揭牌：先运转，一个月后再出省级及以下三定从接近监管人士获悉，目前各地银保监局的安排是先挂牌开始运转，再定省级及以下派出机构的三定，估计一个月后有结果。（一财）	未
实时播报：唐山要求各钢企严格落实高炉错峰生产唐山市发改委日前下发《关于严格落实钢铁行业高炉装备错峰生产要求的函》的通知。各钢铁企业应按照错峰生产期高炉完全停产方式实施管控和限产，不得采用焖炉等方式代替限产任务量，不得以高炉控风减氧短期检修等减产方式代替错峰生产限产，并不得将其减产量计入错峰生产限产量。	未
实时播报：商务部发布《全国零售药店分类分级管理指导意见（征求意见稿）商务部发布关于《全国零售药店分类分级管理指导意见（征求意见稿）》公开征求意见的通知，到2020年，全国大部分省市零售药店分类分级管理制度基本建立，工作机制运行良好药品零售行业信息化管理水平大幅提高，行业监管科学性和有效性显著提升。到2025年，在全国范围内统一的零售药店分类分级管理法规政策体系基本建立药品零售行业信息化集约化和标准化程度进一步提高，行业现代化水平达到国际领先标准。	未
实时播报：四川兴文县5.7级地震 轻伤16人中5人出院截止到今天（12月16日）20点，兴文县5.7级地震共造成16人受伤，其中兴文县15人珙县1人，均为轻伤或轻微伤，目前已有5人出院。据当地初步统计，房屋严重受损223户，完全倒塌1户。灾后当地已设置应急救灾物资调度点和应急救灾临时避难点，目前社会秩序正常。(央视）	未
实时播报：四川将正式对电竞运动员实行注册制从四川省电子竞技运动协会获悉，四川将正式对电竞运动员实行注册制。目前，四川暂时有《英雄联盟》《王者荣耀》《QQ飞车》《炉石传说》这四个项目可申请注册成为电子竞技运动员，以后将会有更多的项目增加进来实行注册。（四川日报）	未
实时播报：国产格列卫再降价 比印度药贵的历史将终结近日，47城市药品集中采购拟中选结果对外公布。江苏豪森药业的甲磺酸伊马替尼片中标，中标价格为623.82元/盒。据媒体报道，相比近三年的平均中标价，该药降价幅度约为24。值得一提的是，一位参与国家组织药品集中采购的专家在接受记者采访时表示，这个药在经过医保报销之后，比印度的仿制药还便宜。（证券日报）	未
实时播报：国内半导体产业逆势扩张 明年或成最大市场国际半导体产业协会（SEMI）近日数据显示，2018年第三季度，中国大陆半导体设备销售额达39.8亿美元，同比大增106，季度销售额首次超越韩国。今年以来，全球半导体产业处于景气下行周期。但是中国大陆市场设备销售额在2018年和2019年依然有望分别实现44及46的高速增长。该协会预测，2019年，中国大陆半导体设备全年销售额也有望超过韩国，成为全球最大半导体市场。（中国证券报）	未
实时播报：国内期市收盘涨跌互现，乙二醇上市首日跌超5，主力合约成交逾67万手，PVC螺纹钢线材跌近2，原油涨超3，燃油涨超2，动力煤沪银涨超1。	未
实时播报：国内钢价先涨后抑，铁矿石市场涨跌不一国内现货钢价先扬后抑，总体略有小涨，但成交并不太理想。铁矿石市场涨跌不一，矿石需求强度有所下降。相关机构分析认为，国内钢价虽迎来短暂的超跌反弹，但价格上涨后下游的需求力度跟不上，市场预期并不太乐观。钢材市场的需求淡季特征进一步体现。（新华社）	未
实时播报：国家卫健委：制定全国辅助用药目录，做好辅助用药临床应用管理有关工作《通知》明确，要建立健全管理制度和工作机制，加强辅助用药遴选采购处方调剂临床应用监测评价等各环节的全程管理。各省二级以上医疗机构，需要将本机构辅助用药以通用名并按照年度使用金额（2017年12月1日至2018年11月30日）由多到少排序，不少于20个品种，形成辅助用药目录。各省级卫生健康行政部门汇总后，以通用名并按照使用总金额由多到少排序，将前20个品种信息上报国家卫健委。国家卫健委将制订全国辅助用药目录并公布。	未
实时播报：国家卫健委：梳理139种临床易短缺药品清单 多数恢复供应在27日举行的国家卫健委新闻发布会上，国家卫健委体改司监察专员姚建红介绍，卫健委建立健全短缺药品监测语境和分级应对体系，确定500多个短缺药品监测哨点，梳理139种临床易短缺药品清单，绝大部分已恢复生产供应。（中国新闻网）	未
实时播报：国家卫健委科技部关于免疫艾滋病基因编辑婴儿有关信息的回应国家卫健委科技部发布关于免疫艾滋病基因编辑婴儿有关信息的回应：我们高度关注11月28日第二届国际人类基因编辑峰会有关免疫艾滋病基因编辑婴儿信息，相关部门正在进行调查核实。我们始终重视和维护人民的健康权益，开展科学研究和医疗活动必须按照有关法律法规和伦理准则进行，对违法违规行为坚决予以查处。	未
实时播报：国家发改委划定房企融资标准线：前20强中9家负债率未达标根据国家发改委在文件中的要求，资产总额营业收入可按照企业最近一年经审计财务数据或最近三年经审计财务数据的平均数进行计算，取孰高。申报企业原则上应同时满足该两项指标。统计2017年销售额排名前20的房企后发现，资产负债率超过85的房企有9家。其中，资产负债率超过90的有两家，分别为中南置地和融创中国。另外7家负债率超过85的分别为，绿地控股碧桂园正荣地产中国恒大新城控股阳光城和泰禾集团。（澎湃新闻）	未
实时播报：国家发改委：同意上海城市轨道交通第三期建设规划(20182023年)。	未
实时播报：国家知识产权局：依法严格保护民营企业知识产权近日，国家知识产权局印发《国家知识产权局关于知识产权服务民营企业创新发展若干措施的通知》。《通知》提出依法严格保护民营企业知识产权加强民营企业知识产权快速协同保护和扩大民营企业知识产权质押融资覆盖面等十项知识产权服务民营企业创新发展工作措施。	未
实时播报：国家知识产权局办公室公示第三批国家级知识产权保护规范化市场包括上海第一医药商店扬州工艺品交易中心天津金元宝滨海农产品交易市场天津友谊商厦红星美凯龙乌海狮城商场等16家市场。	未
实时播报：国家知识产权运营公共服务平台北方平台落户长春新区日前，长春新区与国家知识产权运营公共服务平台在北京签署了全面合作协议，国家知识产权运营公共服务平台北方平台正式落户长春新区。长春新区将以建设科技部长吉图国家技术转移转化示范区为契机，将技术转移转化和知识产权运营交易建设成跨区域综合性平台，最终在长春新区构建集保护运营交易维权多项职能为一体的国家知识产权运营特惠（自贸）区。	未
实时播报：国防科工局批准向4家单位发放武器装备科研生产许可证国防科工局24日消息，根据《武器装备科研生产许可实施办法》规定，近日，国防科工局批准向4家单位发放武器装备科研生产许可证。	未
实时播报：在美反诉高通案明年春季将开庭从苹果供应商律师方面得到消息，明年春季，苹果的供应商在美国提起的一项反垄断诉讼即将开庭，要求赔偿金额为90亿美元。负责该案的律师对记者表示，根据美国法律该案的判罚金额可以达到三倍，即 270 亿美元。（一财）	未
实时播报：坚瑞沃能：与大股东签署债务抵消协议坚瑞沃能12月24日晚间公告，近日，公司与大股东李瑶签署了《债务抵消协议》，李瑶同意以其对公司5037.45万元的债权冲抵其应付公司的业绩补偿款。作为业绩补偿义务人，李瑶已确认无法完成对公司的业绩承诺，并确认对公司的补偿金额为52亿元补偿的上限。同时，李瑶同意以对公司的5037.45万元债权进行冲抵。	未
实时播报：基因编辑婴儿项目操盘者贺建奎：历史将会证明伦理站在我们这一边11月26日，贺建奎的优酷视频账号贺建奎实验室更新了多个视频。在名为《设计婴儿是一种误解》的视频中，贺建奎称，历史将会证明伦理站在我们这一边，请您在听到指责声音的时候不要忘记，还有许多沉默的家庭，他们眼睁睁地看着孩子饱受遗传疾病的痛苦。（新京报）	未
实时播报：大连确定天然气置换期间的临时销售价格12日，大连市召开新闻发布会，通报了天然气置换期间的临时销售价格，居民和非居民的负担均有所降低。据悉，根据听证会和社会各方面的反馈意见和建议，综合考虑全市经济发展水平居民承受能力，大连市天然气置换期间临时销售价格为：居民生活用气每立方米3.40元，暂不实行阶梯气价，相当于同热值人工煤气的价格为每立方米1.35元，每立方米降低0.25元。非居民用气在每立方米不超过4.20元的范围内由供需双方协商议定，实际负担也有所降低。（辽宁日报）	未
实时播报：天壕环境澄清称，媒体报道中提及的基因编辑婴儿事件与本公司的经营业务无关，不影响公司的经营成果与财务状况。	未
实时播报：天沃科技：权益变动完成，上海电气成为公司控股股东，上海市国资委成为公司实控人。	未
实时播报：央视：刷新闻赚现金低质传播碰触到法律底线记者调查发现，一批资讯类平台打出刷新闻赚现金的噱头，来拉动用户下载，为了能收获用户忠诚度，这些平台开始传播低俗低质内容，侵害消费者利益，甚至触碰法律底线。据统计，目前市面上至少已出现了五六十款这类软件。	未
实时播报：如是金融研究院院长首席经济学家管清友表示，房地产总量扩张的黄金时代已经结束，未来是结构分化的白银时代，存在结构化机会。	未
实时播报：孟晚舟保释听证会将在下周一继续央视快讯：当地时间7日下午，加拿大不列颠哥伦比亚省高等法院对孟晚舟的保释申请未作出裁决，听证将在当地时间10日下午1点继续进行。	未
实时播报：孟晚舟保释条件1000万加元保释金（其中700万是现金），包括她丈夫在内的5位担保人，交出护照，佩戴电子监控设备，外出时间和地域限制，由专业的团队进行全天候监视等。（CCTV）	未
实时播报：宁夏已完成1746所问题培训机构的整改在校外培训机构专项整治工作中，宁夏全区共发现问题培训机构1801所，截至目前，已完成整改1746所，完成整改率96.95，将于年底前完成全部整改工作。（新华社）...（微信24小时播报：FinancebeCom4）	未
实时播报：安信策略：春季行情渐行渐近安信策略研报认为，中央经济工作会议已明确明年减税降费力度将更大，具体措施及推进值得关注，同时2019年地方专项债发行工作提前等因素也有望使得明年初社融同比增速出现至少阶段性的企稳反弹。总的来说，我们认为明年初市场流动性预期及风险偏好有望呈现改善，A股市场有望展开一轮反弹行情，投资者需要逐步伺机加仓。	未
实时播报：安徽江淮汽车集团股份有限公司召回部分江淮iEV5纯电动汽车日前，安徽江淮汽车集团股份有限公司向国家市场监督管理总局备案了召回计划，决定自2018年12月8日起，召回2015年1月27日至2015年12月28日生产的部分江淮iEV5纯电动汽车，共计4248辆。 本次召回范围内部分车辆，电池包电气部件由于生产波动，在车辆使用过程中可能发生局部过热，导致电池热失控，存在安全隐患。	未
实时播报：安徽证监局多举措纾解民企股权质押风险记者获悉，为进一步加强对安徽辖区上市公司股票质押情况进行纾困化解，安徽证监局坚持组织到位沟通到位协调到位践行到位监管到位的五到位原则，积极推动政府相关部门和金融机构多举措排查化解辖区股权质押风险，同时组织设立超百亿纾困基金。其中，国元证券成立总规模达60亿元的纾困基金，华安证券资设立的基金总规模达50亿元，安徽省投资集团与海通证券共同发起设立总规模达100亿元的上市公司高质量发展基金。（中证网）	未
实时播报：宝能城发证实余英因个人原因辞职此前宝能投资集团高级副总裁宝能地产总裁宝能城市发展集团总裁余英正在办理离职手续，对此，宝能城发集团相关负责人予以证实，并表示，余英因个人原因向公司提出了辞职申请，目前正在办理离职手续。感谢余英为公司发展付出的努力，祝愿其一切都好。	未
实时播报：宝钢下调2019年1月份期货价格宝钢研究决定，2019 年1 月份（1 季度）宝钢股份宝山东山梅山基地及青山基地冷轧系列电工钢内销价格在2018 年12 月份（4 季度）价格基础上调整如下：热轧基价下调300 元/吨普冷基价下调200 元/吨。搪瓷钢电池钢双层焊管电磁纯铁2019 年1 季度在2018 年4 季度基础上下调200 元/吨。热镀锌基价下调300 元/吨。电镀锌基价下调300 元/吨。镀铝锌基价下调200 元/吨。	未
实时播报：富士康拟投90亿美元在珠海建芯片厂据日经新闻报道，中国富士康集团将在珠海建设一家总投资约90亿美元的芯片厂，总投资总额可能达到600亿元人民币左右，即90亿美元。富士康预计将与日本电子集团夏普和珠海政府组建一家合资企业。另据路透社，夏普没有参与珠海芯片厂项目的谈判。据悉，珠海芯片厂项目计划最早于2020年开工建设。	未
实时播报：对冲基金Appaloosa Management创始人兼总裁David Tepper：美联储向市场释出不好的信息，美联储主席鲍威尔基本上告诉世人，美联储推动股市上涨的时期已死。美联储完成了支持股价的任务，所以，现在坚持现金为王策略并非坏事。	未
实时播报：屠光绍：中投正扩大跨境投资的朋友圈中国投资有限责任公司副董事长总经理屠光绍12月15日在2018上海金融论坛上指出，作为长期资本的重要来源，主权财富基金正成为支撑全球增长的重要力量。屠光绍表示，中投在中国跨境投资上发挥着重要作用，构建了多维度的跨境投资生态系统，正扩大跨境投资的朋友圈。与此同时，中投正积极争取落实境外投资资金来源，稳步加大另类资产和直接投资业务，力争到2022年底时，使其占中投境外投资总组合的比重达到50左右。（上证报）	未
实时播报：山东到2022年将建成充电桩10万台国网山东省电力公司12月24日表示，截至今年11月底，国网山东电力已累计建设投运充电站1286座充电桩7370台，覆盖全省17市。按照山东省新能源产业发展规划，到2022年，山东全口径计划建成充电桩10万台，占全国建设份额10，其中国网山东电力自建充电桩将达15000台，占全省充电桩总数的15。	未
实时播报：山西电力完成5次煤改电用电市场化交易国网山西电力消息，今年以来，该公司与山西省44个涉及煤改电的县级政府签订煤改电打捆交易委托代理协议，省综合能源公司共与新能源企业开展煤改电用电交易5次，累计交易电量2.19亿千瓦时。代理煤改电用户打捆参与市场化交易是国网山西电力公司帮助用户降低取暖成本，助力大气污染防治攻坚战及蓝天保卫战取得实效的重要举措。	未
实时播报：工信部公示第一批小品种药（短缺药）集中生产基地建设单位工信部公示第一批小品种药（短缺药）集中生产基地建设单位，第一批共有三家，分别是上海医药集团股份有限公司牵头组建的联合体中国医药集团有限公司牵头组建的联合体成都倍特药业有限公司牵头组建的联合体。	未
实时播报：工信部批复建设3条国际互联网数据专用通道近日，工信部批复在山西省转型综合改革示范区广东省珠海市横琴新区和浙江省桐乡市新建3条国际互联网数据专用通道，全国专用通道总数达到27条。据了解，国际互联网数据专用通道是面向外向型产业园区建设的直达我国互联网国际出入口局的专用链路，以优化提升园区国际通信服务能力。	未
实时播报：工信部拟注销19家企业跨地区增值电信业务经营许可据工信部消息，近期，北京爱朗格瑞科技有限公司等19家企业向工信部申请终止经营相关增值电信业务。为维护电信用户合法权益，妥善解决用户善后问题，根据《电信业务经营许可管理办法》规定，现公示拟注销跨地区增值电信业务经营许可的相关信息，公示期为自2018年12月6日起至2019年1月5日。	未
实时播报：工行山东分行：拟出资20亿元参与上市公司纾困基金工行山东分行投行部总经理葛效瑾透露，工行山东分行今年积极参与了山东区域内的纾困项目的推动。工行山东分行积极参与山东省上市公司纾困基金。日前，山东省国资委安排山东国惠中泰证券牵头组建100亿元上市公司纾困基金，首期规模约40亿元。工行山东分行已出具了20亿元的出资意向函，目前也已经有了具体沟通对接的项目标的。（证券日报）	未
实时播报：巴基斯坦卡拉奇领馆遭袭 驻巴使领馆发布安全预警据中国驻巴基斯坦使馆消息，当地时间23日上午，中国驻卡拉奇总领馆遇遭恐怖袭击。三名恐怖分子被击毙，两名巴警察牺牲，总领馆人员均安全。驻巴基斯坦使馆提醒中国在巴机构和人员强化忧患意识风险意识和底线思维，加强安全防范，保证驻地安全措施到位，减少不必要外出，确需外出时务必配备足够的安保力量。（CCTV）	未
实时播报：巴西对我无缝碳钢管发起反倾销日落复审调查据商务部消息，近日，巴西工贸服务部在《联邦政府公报》上发布公告，决定对原产自中国的无缝碳钢管发起反倾销日落复审调查。涉案产品的南共市税号73041900。	未
实时播报：巴黎今举行黄背心运动 警方拘留278人法国8日将举行黄背心运动，警方今天清晨即在巴黎拘留278人，以防上周的暴力冲突再次在首都上演。法国当局共出动了8万9000名警员在全国各地严阵以待，其中8000警力部署在巴黎。埃菲尔铁塔等地标今天关闭，商店也纷纷在橱窗外钉上木板，防止暴民进行破坏和掠夺。多国政府已相继发出警告，促请在法国的本国人民保持警惕。（联合早报）	未
实时播报：市场流动性改善 停复牌改革成效初显数据显示，截至12月10日，沪深两市停牌家数为14家，停牌率（停牌家数占全部上市公司的比例）为0.39。市场分析人士指出，监管层今年上半年收紧停牌监管，坚决依法从严监管股票停复牌行为，要求上市公司尽量不要停牌，有效保障了市场流动性，维护了市场交易秩序，避免2015年股市异常波动的千股停牌引起踩踏事件再次发生，为防范系统性风险奠定了市场基础。（中国证券报）	未
实时播报：市场监管总局召开食品企业座谈会 构建覆盖全过程的监管制度近日，市场监管总局召开食品企业座谈会，与部分民营食品企业家座谈交流，听取意见建议。市场监管总局副局长孙梅君指出，重点是落实四个最严要求，构建覆盖全过程的监管制度，保障人民群众舌尖上的安全，推动食品产业高质量发展。要落实放管服改革要求，放活管好服优，继续深化食品生产经营许可改革，完善市场准入与退出机制发挥信用监管作用，建立黑名单制度，对失信企业和人员实施联合惩戒，支持诚信守法企业做大做强。	未
实时播报：市场评论：周一WTI原油录得三个月来最大单日跌幅，收盘跌至两年来最低水平。因对全球原油产量增加以及全球经济放缓的担忧，市场对原油的偏好大大下降。	未
实时播报：平治信息公告称，持有公司首次公开发行前股份的股东陈国才先生陈航先生吴剑鸣女士拟在本减持计划公告之日起3个交易日后的六个月内以大宗交易方式或集中竞价方式分别减持本公司股份2，771，408股3，693，725股1，890，000股，合计占总股本的比例为6.9。	未
实时播报：广东卫健委表示，全面推广药品集团采购，允许医疗机构自行选择在省广州深圳药品采购平台上采购，鼓励三个平台有序良性竞争。（证券时报）	未
实时播报：广东省卫健委：已针对基因编辑婴儿事件展开调查。（南方都市报）	未
实时播报：《广东省智能网联汽车道路测试管理规范实施细则（试行）》公示，文件明确了测试主体测试驾驶人及测试车辆封闭道路场地和测试道路测试申请及审核等方面的细则。	未
实时播报：广东省深圳市成立联合调查组 全面调查深圳基因编辑婴儿事件据广东省卫生健康委员会消息，11月27日，广东省深圳市已成立联合调查组，开展对深圳基因编辑婴儿事件的全面调查。注：贺建奎在第二届人类基因组编辑国际峰会表示道歉，基因编辑实验已经暂停，事先也没有公布数据，研究也没有经过同行评议。	未
实时播报：广东组建企业海外知识产权维权联盟广东企业海外知识产权维权联盟启动仪式于昨日举办，联盟由广东省知识产权研究与发展中心和中国国际贸易促进委员会知识产权服务中心广东分中心牵头发起。联盟将致力于促进联盟成员在知识产权领域的交流与合作，协调联盟成员间的关系。通过与政府法院组织机构合作，构建便捷的海外知识产权维权途径。实现资源共享优势互补，为外向型企业的海外知识产权发展保驾护航。（央广网）	未
实时播报：广东铁路安全新规1日起生效：禁止高铁霸座 保护区内禁飞无人机记者30日从铁路部门了解到，《广东省铁路安全管理条例》将于12月1日起施行。记者了解到，这一新法规对当前铁路运行安全中存在的一些问题进行了针对性规定，高铁霸座在铁路沿线500米内飞无人机和放风筝等行为均被禁止。（新华社）	未
