实时播报：上海金融机构资管产品信息统一报送至人民银行12月27日，中国人民银行上海分行召集上海各金融机构就上海资管统计工作召开会议，会议提出《金融机构资产管理产品统计制度》。该会议主要强调所有金融机构的非标资管数据全部统一报送至人民银行，不再分别向证监会银保监会单独报送，这将意味着资管市场实行统一标准，并将面临统一监管，有助于消除不同监管体系下的信息不对称。（中国经营网）	未
实时播报：上线一年多的网易薄荷直播12月31日关停，原因是业务调整12月3日，网易薄荷直播发布停服公告称，由于业务调整原因，将全面关停网易薄荷的运营。12月3日，停止App下载服务及充值服务。12月31日0点起 ，全面停止网易薄荷的运营，关闭服务器，届时及以后用户将无法登录无法使用网易薄荷的任何功能。	未
实时播报：不到40天两家上市券商卖房 16处房产估值近1.2亿元近日，上海联合产权交易所披露的一则信息显示，某上市券商计划转让旗下1套位于上海的房产，转让底价为1570.32万元。而在12月3日，该券商还曾在上海联合产权交易所挂牌转让4套位于上海的房产，转让底价合计达3541.7万元。值得注意的是，这是不到40天以来第二家准备出售旗下房产的上市券商。在此之前，另一家上市券商也曾公告称，拟出售位于郑州市北京市河源市的11处房产。（证券日报）	未
实时播报：东方园林：公司实控人拟转让5公司股份东方园林发布公告，公司实际控制人何巧女女士唐凯先生与北京市盈润汇民基金管理中心（有限合伙）签订《股份转让协议》。何巧女女士将其持有的公司股份 8293万股（占公司总股本的3.09）唐凯先生将其持有的公司股份 5133万股（占公司总股本的1.91），共计 1.34亿股（占公司总股本的 5）转让给北京市盈润汇民基金管理中心。	未
实时播报：东方集团：终止收购安徽燕之坊食品有限公司86.36股权。	未
实时播报：两部门：举报欺诈骗取医疗保障基金行为最高奖励10万据国家医保局消息，日前，国家医疗保障局办公室财政部办公厅印发《欺诈骗取医疗保障基金行为举报奖励暂行办法》。《办法》指出，举报奖励坚持精神奖励与物质奖励相结合原则，统筹地区医疗保障部门可按查实欺诈骗保金额的一定比例，对符合条件的举报人予以奖励，最高额度不超过10万元。	未
实时播报：两部门印发农村危房改造脱贫攻坚三年行动方案近日，住房城乡建设部联合财政部印发《农村危房改造脱贫攻坚三年行动方案》，把建档立卡贫困户放在突出位置，全力推进建档立卡贫困户低保户农村分散供养特困人员和贫困残疾人家庭等4类重点对象危房改造，并探索支持农村贫困群体危房改造长效机制。	未
实时播报：中企在孟加拉国新签承包工程合同额居南亚首位中国驻孟加拉国大使张佐日前表示，今年前9个月，中资企业在孟新签承包工程合同额达到38.4亿美元，在同期中企同南亚国家新签承包工程合同额中居首位。在8日于孟加拉国首都达卡举行的主题为中孟关系：预知未来研讨会上，张佐表示，近年来，中孟关系发展步入快车道。今年前9个月，中孟双边贸易额达139亿美元，同比增长19.3中国对孟非金融类直接投资额达1.2亿美元，同比增长201.9。（新华社）	未
实时播报：中体产业公告称，财政部同意华体集团有限公司等国有股东与公司的重大资产重组方案。本次重组事项尚需公司股东大会审议通过证监会核准后方可实施，尚存在不确定性。	未
实时播报：中国动力：因正在筹划多元证券组合方式优化资本结构资产注入相关事宜，股票自12月14日停牌。	未
实时播报：中国央行副行长潘功胜：无论自称是数字金融金融科技Fintech还是Techfin，概念的游动不应影响对金融活动本质的判定。（21世纪经济报道）	未
实时播报：中国央行就金融控股公司监管办法征求意见 管控关联交易据悉，管理办法要求金融控股公司的非金融资产不得超过总资产的20。对于非金融资产超过该限额的公司，必须单独设立新公司。	未
实时播报：中国最大凝析气田天然气 日处理达2000万立方米我国最大凝析气田迪那2气田油气处理厂扩建工程2日投产，其天然气在原有日处理能力1600万立方米的基础上提升至2000万立方米，将有效破解气源地憋气现象，提升向西气东输工程供气的保障能力。（中新网）	未
实时播报：中国民用航空局和空客签署安全谅解备忘录近日，中国民用航空局与空客高层安全指导委员会会议（TSSC）在京召开。会后，中国民用航空局和空客签署安全谅解备忘录。未来5年，双方将持续加强在飞行运行及航空安全维修实践和组织结构管理培训等民航安全领域的合作，并将通过定期会议培训等形式加强双方信息交流与沟通。	未
实时播报：中国流动人口已连降3年 全国儿童中有12.8为流动儿童根据国家卫健委最新发布的数据，全国流动人口规模从2015年之前的持续上升转为缓慢下降，2017年下降到2.44亿人。流动儿童的快速增长始于20世纪90年代，从1990年的459万人增加至2000年的1982万人，增加了3倍以上20002010年继续快速增加，2010年增加至3581万人，增幅高达40以上，全国儿童中流动儿童的占比上升至12.8。（四川工人日报）	未
实时播报：中国电建拟以集中竞价交易方式回购股份，回购股份比例1-2。	未
实时播报：中国科协回应基因编辑婴儿：以零容忍态度处置科研道德伦理不端行为今天，中国科协党组书记常务副主席怀进鹏今天就基因编辑婴儿一事表示。这次事件性质极其恶劣，严重损害中国科技界的形象和利益，对涉事人员和机构公然挑战科研伦理底线亵渎科学精神的做法表示愤慨和强烈谴责，将进一步加大面向科技界的科研伦理道德的教育力度，以零容忍的态度处置严重违背科研道德和伦理的不端行为，取消贺建奎第十五届中国青年科技奖参评资格。（CCTV）	未
实时播报：中国细胞生物学学会干细胞分会：科研伦理的高压线不容碰触中国细胞生物学学会干细胞分会发布关于基因编辑婴儿事件的声明：科研伦理的高压线不容碰触。贺建奎课题组的研究属于个人行为，该研究既违反中国目前的科研管理规则和伦理规范，同时也存在巨大的安全隐患。我们坚决反对这一研究，建议涉事单位各级政府积极进行调查，采取必要手段厘清事实，对于违反法律法规的涉事人员予以严肃处理。	未
实时播报：中弘退：预计公司股票将于12月27日后被终止上市12月23日晚间，中弘退(000979)披露风险提示，公司股票已被深交所决定终止上市，将在退市整理期届满后被摘牌，预计公司股票将于4个交易日（或者于12月27日）后被终止上市。...（微信24小时播报：FinancebeCom4）	未
实时播报：乌克兰将限制俄罗斯成年男子入境乌克兰总统波罗申科宣布，在战时状态下，乌克兰将限制16到60岁的俄罗斯成年男子入境。波罗申科表示，该决议是为了防止俄罗斯在乌克兰秘密组织反对力量。（人民日报）	未
实时播报：乙二醇期货下周一正式挂牌 煤制乙二醇不会进入交割乙二醇期货合约的规则与其他化工品有相似的地方，同时也有一些区别。相似之处在于交易单位交易保证金交割方式合约月份等方面。不同之处，主要是交割细节上，避免了煤制乙二醇进入交割。（证券时报）	未
实时播报：互联互通北向15.5亿元净流出A股今日15.5亿元通过沪股通和深股通流出A股，为连续3个交易日资金净流出。	未
实时播报：亚星化学公告，近期，公司在浦发银行潍坊分行的 5，000 万元贷款已全部归还。	未
实时播报：交通运输部：取消省界收费站设置和设置审批交通运输部20日发布《收费公路管理条例(修订草案)》，面向社会征求意见。《草案》提出，提高收费公路设置门槛，建立收费公路发展刚性控制机制。取消省界收费站设置，取消收费站设置审批。...（微信24小时播报：FinancebeCom4）	未
实时播报：享骑出行共享电动车规定：想退押金 必须来上海 近日，享骑出行的诚信金退还出现了问题，部分用户在其APP申请退还299元诚信金，一个多月都无法到账。11月23日傍晚，记者前往享骑出行上海总部了解情况时发现，享骑出行要求用户必须持本人身份证亲自到上海总部才能当场退还押金，否则只能登记后等待。（每日经济新闻）	未
实时播报：京东成BATJ首家自营P2P近日，京东金融上线名为和丰网贷的P2P产品，其介绍称，和丰网贷是京东金融旗下专注于提供网络借贷中介信息服务的平台。上周，京东还一度上线了旭航网贷的P2P产品。如今，在网贷行业充满危机和不确定之际，京东上线京东小金投和P2P产品，不仅是成为BATJ中首个明确布局网贷并直接运营P2P平台的互联网巨头，或意味着P2P行业迎来新局面。（中国基金报）	未
实时播报：京新药业：公司仿制药品仿制药品瑞舒伐他汀钙片左乙拉西坦片苯磺酸氨氯地平片拟中标47城市药品集中采购。	未
实时播报：京津冀三省市：清洁取暖不硬压指标 不搞一刀切近日在北京天津河北实地采访发现，为打赢蓝天保卫战，三省市措施到位责任到位，全力以赴做好清洁取暖各项工作。京津冀三省市相关负责人均表示，以气定改，宜气则气宜电则电宜煤则煤，有多少资源，有多大能力，办多少事情，不硬压指标，不搞一刀切。清洁取暖成效几何，天然气供应问题至关重要。京津冀都将天然气保供摆在突出位置，多措并举，抓紧抓实。（人民日报）	未
实时播报：人民日报微评：别打开潘多拉魔盒人民日报微博11月26日评论，相关事件仍然迷雾重重，但公众焦虑挥之不去：潘多拉魔盒一旦打开，谁来收场?技术无罪，但失控的技术可能带来灾难。弘扬学术道德和科研伦理，这是科技工作者的安身之本。无治理则无伦理，让科技趋利避害，除了寄希望于科学家的道德自觉，更须立法跟进。	未
实时播报：今起4天持续低温 北京发布今冬首个低温蓝色预警北京市气象台12月6日10时30分发布今冬首个持续低温蓝色预警信号。受持续补充冷空气影响，预计6日至9日，北京将出现持续低温天气，平原地区日最低气温将下降至零下10左右。...（微信24小时播报：FinancebeCom4）	未
实时播报：任泽平：建议2019年不少于4次降准恒大研究院任泽平表示，年内社融货币供给增速下行压力仍较大，明年1季度社融增速可能迎来拐点。针对目前经济金融形势，需要几家抬做好政策协同。逆周期的货币政策和财政政策可以更积极，未来降准减税可期。建议2019年应不少于4次降准。（中证网）	未
实时播报：伊拉克油长：愿意将减产协议延长至4月，期间将一直观察油价的变动。	未
实时播报：优博讯：筹划收购佳博科技股权 明起停牌优博讯12月10日晚公告，公司正在筹划以非公开发行股份及支付现金方式购买佳博科技不低于76.69股份。同时，公司拟定增募集配套资金，用于支付本次交易现金对价补充上市公司流动资金支付发行费用及中介机构费用。预计此次交易涉及的金额将达到重大资产重组的标准，股票自12月11日起停牌。	未
实时播报：传瑞银与微软达成合作 将把数据迁入后者云端据彭博社援引知情人士消息报道，瑞银集团（UBS Group）已同微软达成一项价值数亿瑞士法郎的交易，以使用后者的云服务来降低成本，同时亦保持对瑞士隐私法的合规性。...（微信24小时播报：FinancebeCom4）	未
实时播报：伦敦街头现黄背心骚乱?抗议者封桥大喊：立刻脱欧继法国之后，黄背心示威活动在欧洲蔓延，英国也开始出现类似活动。一群英国抗议者日前身穿黄色背心，封锁了伦敦威斯敏斯特桥，导致当地交通瘫痪。英媒称，抗议者们还在示威活动中谴责英国首相特蕾莎梅，并且高喊需要一位新伦敦市长。当地警方表示，尚不清楚示威活动是否有备案。（海外网）	未
实时播报：住建部副部长黄艳：城市规划建设要摒弃急功近利和大拆大建住建部副部长黄艳日前在2018中国城市规划年会上说，当前我国在城市规划和建设中要摒弃急功近利和大拆大建，注重绣花功夫，突出地方特色和人居环境的改造。（新华社）...（微信24小时播报：FinancebeCom4）	未
实时播报：俄罗斯能源部长诺瓦克：俄罗斯计划在1月份减产5万-6万桶/日。	未
实时播报：健康体检机构问题频出 上海卫监部门将建立退出机制日前，爱康集团董事长兼CEO张黎刚在中国企业领袖年会上曝出体检行业假体检丑闻：用护士假冒医生看超声抽了血，没做检查就扔掉，直接出结果对此，记者采访市卫监部门获悉，上海尚未发现此类情况。下阶段，上海将对健康体检的社会办医疗机构依法执业情况进行全面的评估，同时建立退出机制，清退评估不合格的机构。（东方网）	未
实时播报：兆驰股份：不排除让风行独立上市公司在互动平台上表示，将研究各业务板块资本化运作的可行性。未来根据风行在线的发展状况及需求，不排除让其独立上市。	未
实时播报：全国报告存活艾滋病感染者85万 性传播是主要途径11月23日，据中国疾控中心联合国艾滋病规划署世界卫生组织联合评估，截至2018年底，中国估计存活艾滋病感染者约125万，估计新发感染者每年8万例左右，全人群感染率约为9.0/万。参照国际标准，与其他国家相比，中国艾滋病疫情处于低流行水平，但疫情分布不平衡，而性传播是主要传播途径。（中新网）	未
实时播报：全国零售药店拟分类分级商务部市场秩序司就《全国零售药店分类分级管理指导意见》征求意见，提出将零售药店划分为三个类别：一类药店可经营乙类非处方药二类药店可经营非处方药处方药（不包括禁止类限制类药品）中药饮片三类药店可经营非处方药处方药（不包括禁止类药品）中药饮片。到2020年，全国大部分省市零售药店分类分级管理制度基本建立。	未
实时播报：全球商业展望报告：美国近半CFO担心明年陷入经济衰退美国杜克大学周三公布的首席财务官全球商业展望报告(CFO Global Business Outlook)显示，48.6的美企CFO认为明年年底前，美国经济将陷入衰退，82的CFO认为，衰退将在2020年底前开始。（中国证券报）	未
实时播报：八菱科技：控股股东《股权转让意向协议》终止，此前拟向南京红太阳转让20股份。	未
实时播报：公关回应假装外国人ofo秒退押金：我睡觉刚醒，不知道这事，应该不可能近日，一位网友称想退ofo押金，但听说打电话要打很久，就假装外国人写了封投诉邮件。网友称ofo火速退了押金，还回复了一封英文道歉信，此事引发热议。（全景网）...（微信24小时播报：FinancebeCom4）	未
实时播报：兴业银行：拟100亿设立兴银投资 从事债转股业务兴业银行(601166)12月21日晚公告，公司拟出资100亿元，投资设立兴银金融资产投资有限公司，主要从事银行债权转股权及配套支持业务。	未
实时播报：内蒙古：争取每个旗县至少有一个综合型职业培训基地记者从内蒙古自治区政府获悉，内蒙古将加大职业技能培训资金投入力度，通过对口支援联合办学等形式确保每个旗县（市区）至少有一所规模适度的综合型职业培训基地，以满足当地职业培训工作需要。对国家和自治区级高技能人才培训基地分别给予500万元和100万元建设项目资金支持，对国家和自治区级技能大师工作室分别给予10万元建设项目资金支持。（新华社）	未
实时播报：内蒙古将于12月末接入全国高铁网从中国铁路沈阳局集团有限公司内蒙古自治区通辽市政府获悉，内蒙古第一条接入国家规划的八横八纵高铁网的高速铁路新通高铁（新民北至通辽高铁）将于12月末开通运营。（新华社）...（微信24小时播报：FinancebeCom4）	未
实时播报：农业农村部：中国非洲猪瘟疫情总体可控农业农村部消息，截至昨天(14日)，全国共有22个省份发生87起家猪感染非洲猪瘟疫情2起野猪感染非洲猪瘟疫情，当前全国非洲猪瘟疫情仍处于点状散发态势，没有出现大面积流行，疫情发生总体可控。农业农村部有关负责人介绍说，目前，已有12个省份的42个疫区按规定解除封锁。（央视新闻）	未
实时播报：农业农村部国家林草局印发关于强化家猪野猪非洲猪瘟联防联控工作的通知通知要求，要根据辖区内家猪养殖（含散养）屠宰废弃物处理运输和野猪人工繁育野外分布的情况，共同将存在家猪野猪疫情交叉传播风险区域确定为重点区域。要切断引种传播途径，禁止家猪种猪场野猪人工繁育场野外引种。要提前做好区域隔离，禁止野猪杂交后代野外散放，禁止在野猪经常出没区域散养家猪，必要时设立物理隔离带。	未
实时播报：农业农村部支持海南建设南繁科技城 赋予农作物种质资源进口审批权海南省农业农村厅在海口召开新闻发布会，就《农业农村部贯彻落实实施方案》的14条具体支持措施进行通报。《实施方案》明确要推动南繁硅谷建设，其中支持海南建设南繁科技城，积极稳妥建设动植物种质资源引进中转基地，赋予海南更大的农作物种质资源进口审批权，试点建设与国际接轨的非免疫无规定动物疫病区。（南海网）	未
实时播报：农业农村部：短期内彻底灭除非洲猪瘟难度极大 做好打持久战的准备11月29日，农业农村部组织召开非洲猪瘟联防联控机制成员单位会议。会议指出，通过各地各有关部门采取有力措施，我国非洲猪瘟疫情传播势头得到有效遏制，总的看，疫情呈多点散发的态势，防控工作总体可控。但是，考虑到我国非洲猪瘟防控工作的复杂性艰巨性长期性，短期内彻底灭除非洲猪瘟难度极大，必须在继续打好攻坚战的同时，做好打持久战的准备。	未
实时播报：农商行首次提出设立理财子公司近日，广东顺德农商行拟召开2018年第二次临时股东大会，其中一项重要的议案就是投资设立理财子公司。记者了解到，目前已有20家银行拟设立理财子公司，其中包括5家国有银行9家股份制银行和6家城商行。顺德农商行系首家公开提出设立理财子公司的农商行。（每经）	未
实时播报：农行董秘：农行把推进互联网金融服务三农作为今后一段时期的一号工程中国农业银行董事会秘书周万阜在论坛活动表示，农业银行积极运用金融科技，探索互联网化数字化智能化开放化的服务三农新模式，打造互联网金融服务三农平台。去年以来，农业银行把推进互联网金融服务三农，作为今后一段时期的一号工程。着力打造具有互联网融资支付和电商三大功能的惠农e通平台，为广大农民客户提供线上线下一体化的金融服务。（国是直通车）	未
实时播报：前意大利总理蒙蒂：意大利政府正意识到需要着眼现实，预算案面临的情况与最初预想的不一样。	未
实时播报：加大支持民营经济 上清所首次提供多品种信用风险缓释工具配套服务为加大对民营企业的金融支持力度，上海清算所近期与相关市场中介机构密切配合，首次为民营企业债务融资提供CRMWCDS和CRMA三种信用风险缓释工具相关配套服务，顺利协助完成该次民营企业债券发行，多样化支持民营企业融资。（上证报）	未
实时播报：加拿大央行行长Poloz：特朗普贸易主张所引发的关系紧张可能会推高加拿大的通胀和国债收益率。	未
实时播报：加拿大自然资源部长：宣布16亿加元石油和天然气行业援助资金。	未
实时播报：北京二手房成交均价三个月连跌，议价空间扩大至5.2。（新京报）	未
实时播报：北京启动史上最严核查 给假高新技术企业卸妆有企业透露，北京市已经开启了史上最严高新技术企业审查模式，除了书面审核以外，还将进行实地核查和随机抽查，给冒牌高新企业卸妆。多个渠道均证实了该企业的说法。北京市科委人士称，早在2016年，科技部等部门曾印发《高新技术企业认定管理工作指引》，对部分企业进行实地核查是明确写在其中的，经过一段时间的缓冲期，我们在2018年正式启动了这部分工作。（每经）	未
实时播报：北京大兴出台禁限行新规 涉载货汽车及外埠载客车北京市大兴区政府今天发布通告，宣布自2019年1月1日起，北京市大兴区将对大兴新城部分道路采取交通管理措施。在禁限行区域内，每日6时至23时，禁止载货汽车专项作业车通行工作日7时至9时17时至20时，禁止外省区市核发号牌(含临时号牌)的载客汽车通行。负责人谈到，此次出台禁限行管理措施，是为了缓解大兴区交通供需矛盾和交通运行压力，改善大兴区空气质量降低机动车污染物排放。（中新网）	未
实时播报：北京将启动空气重污染黄色预警23日从北京市空气重污染应急指挥部办公室获悉，北京市将于24日12时启动实施空气重污染黄色预警 。经中国环境监测总站会商京津冀及周边地区环境监测中心，受不利气象条件影响，24日26日，环北京地区将出现重污染过程。另据生态环境部通报，此轮京津冀及周边地区的区域性重污染天气过程，影响范围包括京津冀中南部山西东南部山东中西部河南北部。 （新华社）	未
实时播报：北京市政务服务中心不迁入副中心 元旦起实行一窗接办新组建的北京市政务服务管理局12月10日上午首次召开新闻发布会，会上透露，北京市委市政府在机构搬迁中早有考虑，所有直接为企业市民提供服务的各级各类政务大厅办事窗口都不迁入副中心。2019年元旦起，位于六里桥的市政务服务中心正式实施前台综合受理后台分类审批窗口统一出件的一窗综合受理模式，不再按部门设窗，企业市民可通过任一窗口直接找政府。（北京日报）	未
实时播报：北京首个分区规划今起征民意 其他分区规划将陆续公示今日，北京首个分区规划房山分区规划开始征求公众意见，其余区的分区规划也将陆续启动公告工作。到2035年，北京房山区森林覆盖率将不低于38集中建设区道路网密度力争达到8公里/平方公里千人医疗卫生机构床位数6.5张左右。（新京报）	未
实时播报：华大基因联合31家同行发布倡议书：共同坚守伦理规范针对近期基因编辑婴儿事件，华大基因集团联合31家同行发布《自律倡议书》：作为负责任的生命科学研究和技术应用机构，完全拥护国家有关部门对涉事方的调查和问责，强烈呼吁同行共同坚守伦理规范，决不把推动科技进步当成突破底线的借口。	未
实时播报：华尔街日报评英国11月CPI数据英国11月CPI年率有所放缓，接近英国央行设定的2的目标水平。油价下跌抵消了烟草和酒精价格上涨的影响，并成为此次英国CPI放缓的驱动力。英国央行预计，通胀压力将持续存在于经济现状中，因强劲的就业市场刺激了更快的薪资增速。	未
实时播报：华海药业：公司6个品种拟中标47城市药品集中采购华海药业晚间公告，今日，公司参加了联合采购办公室组织的北京天津上海重庆和沈阳大连厦门广州深圳成都西安11个城市（以下简称 47 城市）药品集中采购的投标。公司已通过国家药品监督管理局仿制药质量和疗效一致性评价的仿制药品厄贝沙坦片厄贝沙坦氢氯噻嗪片赖诺普利片利培酮片氯沙坦钾片盐酸帕罗西汀片等6个品种拟中标本次集中采购。	未
