熊猫守护者 滚滚小课堂 文房四宝是笔墨纸砚，那大家知道秦岭四宝是什么吗 除了滚滚这一宝以外，还有朱鹮金丝猴和羚牛哦！今天，滚滚就给大家介绍一下朱鹮吧 1981年，朱鹮一度濒临灭绝，陕西省洋县秦岭南麓的7只野生朱鹮被称为全球拯救朱鹮的最后希望。经过保护者三十多年的守护和努力，朱鹮才在重返自然的道路上重新展翅高飞[给你小心心]朱鹮究竟是一种怎样的存在呢戳下图一起来看看吧	未
熊猫守护者 近期，守护君在秦岭大熊猫文化主题展上发现了好多与滚滚相关的老物件哦没想到大家对滚滚的喜爱由来已久呢这些物件陪伴着一代人走过青春，承载着他们的专属记忆，简直就是击中泪点的神器守护者们还知道哪些和滚滚相关的老物件吗转评本微博，并配图说明，守护君将随机抽取3位幸运小可爱送上滚滚专属明信片哦（素材来源于陕西林业科学）	未
熊猫宵夜 @ 一位你认为2019年也不会脱单的人吧	未
熊猫小食堂，一家店带火一栋楼	未
//@熊猫帝帝:还以为是抓获现场的视频	未
熊猫把玩饲养员遗忘的菜刀，大熊猫繁育研究基地：已通报批评12月26日，一段熊猫把玩菜刀的视频引起关注。视频中，熊猫萌萌双手拿住一把菜刀并放到脸上，有游客看到后对着熊猫喊：太危险了，扔掉，扔掉！随后萌萌将菜刀扔开。12月27日，成都大熊猫繁育研究基地对此回应称，26日当天当值 ...全文	未
熊猫眼也分套路当心了！	未
“熊猫”空客350首抵禄口机场	未
“熊猫袋鼠-2017”中澳陆军联合训练在昆明开训	未
熊猫被子固定器25件 6.9记得拍第一项！内含：解扣器8个熊猫扣8个长钉8个短，有了它，再也不担心被子跑棉了！	未
熊猫说廉洁第一期丨巧立名目变相发放津补贴	未
熊猫说廉洁第二期  变相组织公款旅游	未
熊猫醉水听听熊猫小姐讲诉你不知道的那些滚滚故事	未
熊猫金控逾期进展：上交所对实控人赵伟平予以监管关注	未
熊粉夜间聊天室 留下手机尾号的后四位，一样的交个朋友吧！	未
熊粉夜间聊天室看看你的手机号后4位对应的是_____	未
[熊貓][熊貓][熊貓]	未
熊隆东任四川达州市委常委、市纪委书记	未
熊黛林承认怀孕 穿背带裤开工小腹凸出孕味浓	未
熏疼！民警徒手从排泄物中分拣毒品 一个月都不想吃宵夜杭州爆料 据@平安下城 ：日前，下城长庆派出所民警根据线索抓获一名涉嫌人体运毒的犯罪嫌疑人贾某。落网后，嫌疑人承认吞食了藏有海洛因的胶囊，但多少数量自己也记不得了。在随后的三天时间里，为防止发生意外并尽快固定犯罪证据，民警轮番上阵在医院病房内协助犯罪嫌疑人贾某进行体内排毒。每次排泄后，民警都顾不得恶臭，徒手从中分拣清洗出毒胶囊，并称重登记，先后清理出73粒含高纯度海洛因的胶囊，累计400克。事后同事们调侃，干完这票活，一个月都不想吃宵夜	未
熔岩像洪水一样流动	未
熟人与陌生人的区别	未
熟人坑朋友介绍31万买家具，提成拿了10万！	未
熟人帮忙帮出的刑事案件丨周末分享	未
_//@熟睡中666:谢邀，告辞	未
熟睡女子半夜被一道光惊醒，地上还有一串脚印……	未
熟睡的晓姨	未
熟睡的某一天，我跌进了梦中的黑洞那里的色彩斑斓，像我的梦想一样，可以自由自在，沉浸在其中，我不愿醒来可是黑洞就是黑色，为什么会有彩色呢，就像生活不尽如人意，我喜欢用幻想在梦中装饰它我想跌进黑洞，不想在面对现实，梦里每天都开心快乐闹铃响了，新的一天开始，生活的现实残酷，何时 ...全文	未
熟肉版视频在此：adidas Football的秒拍视频	未
熬夜到早上一觉醒来没往窗外看经人提醒才知道杭州下雪了 杭州	未
熬夜女孩，都抢到想要的衣服了吗可以像豆地主一样睡觉觉咯	未
熬夜，正拉大你与同龄人的距离！	未
熬夜真的会死！机关干部加班应急保养指南	未
熬夜真的忍不住//@Sheila昔尧: 其实现在最心平气和的时候 就是凌晨//@快快快快快快而特:对的吧//@辣条娘:总觉得睡得早就亏了//@水晶男孩鸡大帅:晚上一个人在被窝玩手机简直太爽	未
熬夜这习惯是改不了，没想到剁手这习惯也改不了	未
熬夜险走红 你会投保吗 网友：身体好才是最大的投资近日，一款名为熬夜险的保险产品在网上走红。因为其中包含了猝死内容，且最高保额达20万元，备受网友关注。熬夜险到底是什么参保情况和排除情况如何规定记者进行了详细了解。详情：熬夜险走红 你会投保吗 网友：身体好才是最大的投资查看图片	未
熬夜险走红，各类奇葩保险千奇百怪，却有这四个共同点	未
熬汤应用冷水水既是鲜香食品的溶剂，又是食品传热的介质。水温的变化，用量的多少，对汤的营养和风味有直接的影响。用水量一般是熬汤主要食品重量的3 倍，而且要使食品与冷水共同受热，所以不宜用热水，如果一开始就倒热水，肉表面突然受到高温，外层蛋白质会马上凝固。	未
熬过2016，你还能分清善与恶吗？	未
熬过4年异地相思苦 感恩节福州90后情侣步上红毯	未
熬过了湿冷，明天将迎来干冷，可见阳光，不要大意了，最低气温下降至10以下，换种冷魔法，准备防寒！	未
熬过了那段漫漫长夜，才会等来充满希望的黎明。但是有多少人都倒在了黎明到来的黑夜里。	未
熬过“交付死”的造车新势力能否蹚出新路子	未
熬过今晨的寒冷 气温很快就要回升了	未
熬过这波冷空气 还有一波冷空气	未
燃！一直播熊猫直播美拍这些全网最牛直播平台今天都来如皋了！咋回事	未
燃！今日份郑航飞机餐体验来了	未
燃料和核慢化处理装置聚合反应设备奇瑞这是要搞核动力汽车	未
燃料油期货1905合约一度封于跌停	未
燃料油期货1905合约创该合约上市以来新低	未
燃气具企业生产启示录：这些事情没做好，全都要整改！	未
燃气工人井下维修，2人不幸身亡	未
燃气泄漏能自动报警闭阀 智能化燃气表明年投入四万户家庭试点	未
燃气管道接通后无法开通天然气业务今后这样的情况不再有	未
燃油助力车=机动车  酒后驾驶一样受罚	未
燃油税引发法国大示威，12月8日最新一轮示威，13万人参与其中，1700余人被捕。	未
燃油费居高不下，航空公司纷纷减肥	未
燃油车时代终结大众2026年推出最后一代内燃机	未
燃油附加费下降  12月5日起买机票省10元以上国航海航大新华航空首都航空祥鹏航空等航空公司近两日相继宣布下调国内航线燃油附加费自12月5日(出票日期为准)起，800公里(含)以下航线燃油附加费每航段由20元下调为10元800公里以上航线燃油附加费每航段由50元下调为30元需要注意的是， ...全文	未
燃炸了每日格斗	未
燃烧我的卡路里//@一只学霸 :乡村死亡摇滚//@我与美食的日常 :哈哈哈哈燃烧我的卡路里	未
燃烧我的卡路里丨这里有一本《懒癌患者自救指南》请查收！	未
燃烧我的埃梅里	未
//@燃烧的浮清霖:哇妮妮美死我了 呃喷血而亡	未
燃燃燃！！年度片单查漏补缺的时候到了！//@深度电影圈:帅炸了！//@宇宙台长:先//@设计系奶子:5555好燃！！	未
燃！看完七星关的这场表演，你确定他们是中老年人吗	未
燃起来！广州公安特警开展冬训大比武	未
燕塘站执行A口绕行，BC口只出不进三级客流控制。提请大家及时留意。	未
燕子不进寒门，家狗不咬女婿，农村的俗语，揭示了什么道理	未
//@燕子来时123:我们这有个女广播员，一生未嫁，广播员，人中翘楚，谁也看不上。现住一廉价敬老院，已潦倒的不及同龄人。潮来舟高，潮去舟低。	未
燕子矶花园城今天开业！城北人民都沸腾了	未
燕子矶花园城开业！城北人民都沸腾了	未
燕窝可以治咳嗽贵不贵该如何分辨真假	未
燕窝热销 商人们呼吁解除对燕子的法律保护	未
燕窝被央视曝光了万万想不到它竟...太惊人！	未
燕谷坊与乡村供应链合伙人雷山签约	未
燕赵新作为致敬40年 @燕赵都市报无人驾驶：真的拜拜了老司机重要的事情说三遍：无人驾驶已经出现在我们生活中了！无人驾驶汽车甚至跑上了雄安的路面！2017年12月20日，7 辆无人车从安新县凯盛酒店出发，全程无人驾驶的模式下行驶了约4公里路程。这是百度 Apollo自动驾驶车辆在雄安道路上的一次实际道路测试。当天，百度还与河北雄安新区管委会签署战略合作协议，将雄安新区打造成为全球智能城市新标杆。网页链接源/	未
燕郊12月份限号日历，互相转告！	未
燕郊为什么有这么多的小偷答案就是......	未
燕郊几十万百万富翁跨省上班！	未
燕郊到北京：我的上班路，就像一场战斗	未
燕郊又上央视了！	未
燕郊发现一名被遗弃的男婴谁认识扩散！	未
燕郊地铁地点或落实	未
燕郊、涿州首付贷、首付分期重出江湖 首付8万买三居	未
燕郊这个违建，终于被拆掉了	未
燕郊进京车主注意！1月1日起，这里早晚高峰外地车禁行！	未
燕郊进京车主注意！大兴出台外地车牌限行新政，1月1日起实行	未
燕都微阅读知河北 阅天下2019年节假日安排出炉到2020年，每个设区市 至少建1家互联网医院生活垃圾分类智能回收箱 称重返现当场完成驻日美军2机相撞5人失踪驻日美军2机相撞5人失踪崇礼喊你去滑雪！未来两天气温持续走低 坝上地区最低气温达-30...c网页链接	未
燕都微阅读 知河北 阅天下20年后拦路打老师男子被抓装修贷竟成了套路贷找竹竿 喊大人 小学生智救落水老人高邑刘秀公园新晋五星级我省法院集中宣判 18起涉黑恶案件考研冲刺明年起非国标电动车不得上路日本或退出国际捕鲸委员会...要闻	未
燕都微阅读知河北 阅天下全城出动！帮3岁男童找耳蜗！祖孙三代人冰窟中救起落水兄妹未来三天我省大部气温略升 中南部局地有重度霾献县10岁男孩下楼扔了趟垃圾就不见了后续 失踪男孩已不幸身亡绿化带跑水 50米路面成冰场...网页链接	未
燕都微阅读知河北 阅天下全城出动！帮3岁男童找耳蜗！祖孙三代人冰窟中救起落水兄妹未来三天我省大部气温略升 中南部局地有重度霾《献县10岁男孩下楼扔了趟垃圾就不见了》后续 失踪男孩已不幸身亡绿化带跑水 50米路面成冰场...要闻	未
燕都微阅读知河北 阅天下冀南初雪从绘本里走出来省气象台 连发预警 最低温将 持续走低蔬菜供应未受降雪影响最长早高峰 那抹暖心的荧光绿石市发布供热预警 降雪降温 力保屋里温度不降拿不到血汗钱，赶紧打电话！承德石家庄 新增至琼海厦门往返航线...网页链接	未
燕都微阅读知河北 阅天下冀南初雪从绘本里走出来省气象台 连发预警 最低温将 持续走低蔬菜供应未受降雪影响最长早高峰 那抹暖心的荧光绿石市发布供热预警 降雪降温 力保屋里温度不降拿不到血汗钱，赶紧打电话！承德石家庄 新增至琼海厦门往返航线...要闻	未
燕都微阅读知河北 阅天下寒冬雪趣又一轮雾霾天气将至 省大气办提前发布重污染天气橙色预警210家企业招才引智 6000余岗位虚位以待2018河北大工匠 年度人物揭晓11月份十大谣言你中招了吗网页链接	未
燕都微阅读知河北 阅天下寒冬雪趣又一轮雾霾天气将至 省大气办提前发布重污染天气橙色预警210家企业招才引智 6000余岗位虚位以待2018河北大工匠 年度人物揭晓11月份十大谣言你中招了吗要闻	未
燕都微阅读知河北 阅天下法国这个周末不好过 马克龙改革有点儿悬周末持续低温 外出注意防寒保暖省会每个社区 建两个菜篮子零售点行唐露真容四学生捡到8000余元 风雪中苦等失主半小时来看看这八大标杆示范区...要闻	未
燕都微阅读知河北 阅天下石家庄环城水系开始清淤省人大常委会机关 举行机关开放日活动大风降温继续 未来三天多地有弱降水河北文创设计大赛 进入决赛预评阶段312个行政村的大喇叭 每天准时响起因逾期还款产生的疑问和纠纷最多...网页链接	未
燕都微阅读 知河北 阅天下耳蜗没找到 可耳朵找回来了 好心人捐款4.8万元，男童配上了新耳蜗12起案件抓获59名网络水军 河北警方严厉打击网络水军违法犯罪活动明年1月5日铁路调图肃宁90后女孩国家博物馆讲解改革开放40年崇礼国际滑雪节开幕明年，市民可坐地铁去正定新 ...全文	未
燕都微阅读 知河北 阅天下耳蜗没找到 可耳朵找回来了 好心人捐款4.8万元，男童配上了新耳蜗12起案件抓获59名网络水军 河北警方严厉打击网络水军违法犯罪活动明年1月5日铁路调图肃宁90后女孩国家博物馆讲解改革开放40年崇礼国际滑雪节开幕明年，市民可坐地铁去正定新区德再赔偿大屠杀幸存者...要闻	未
燕都微阅读 知河北 阅天下高度关注基因编辑婴儿事件92号汽油有望回归6时代波音737飞机有了石家庄号明起17种抗癌药 正式纳入我省医保石家庄拟公布 首批历史建筑名录俄乌会否发生正面冲突...要闻	未
燕都快讯俄堪察加半岛东部海域发生7.2级地震 俄罗斯堪察加半岛东部海域20日发生7.2级地震。目前尚无人员伤亡报告。俄罗斯科学院地球物理研究所堪察加分所发布公告说，地震发生在莫斯科时间20日晚8时1分左右，震中位于堪察加半岛东岸的乌斯季堪察茨克镇以东170公里处，震源深度85公里。公告说，此次地震后发生了几次5级左右的余震。据俄罗斯紧急情况部消息，此次地震没有造成人员伤亡或重大损失。另据美国地质调查局地震信息网消息，此次地震的震级为7.4级。（新华网）	未
燕都快讯四川宜宾市兴文县附近发生4.4级左右地震中国地震台网自动测定：12月16日12时45分在四川宜宾市兴文县附近（北纬28.27度，东经104.89度）发生4.4级左右地震，最终结果以正式速报为准 @中国地震台网	未
燕都快讯最新！石家庄下周起单双号限行！公交免费注意啦！石家庄市于12月9日0时起启动重污染天气级应急响应，解除时间另行通知。12月10日起，全市限行区域内实行单双号限行，限行时段为早7时至晚时，届时城市公交车免费，法定节假日和双休日不限号。（记者李春炜）	未
燕都报道外卖小哥需持证送餐！石家庄为这些领域定规矩今后，外卖小哥送餐也需要持证上岗啦！12月14日，从石家庄市政府举办的新闻发布会上获悉，即日起至2019年3月底，市食药监局将在全市范围内开展为期4个月的食品药品监管领域隐患大排查大整治行动，集中对食品药械和保健品三方面 ...全文	未
燕都报道外卖小哥需持证送餐！石家庄为这些领域定规矩今后，外卖小哥送餐也需要持证上岗啦！12月14日，从石家庄市政府举办的新闻发布会上获悉，即日起至2019年3月底，市食药监局将在全市范围内开展为期4个月的食品药品监管领域隐患大排查大整治行动，集中对食品药械和保健品三方面进行整治。（记者王萌）	未
燕都报道最新公布！承德市区居民用水价格将上调0.75元今天，记者从承德市市区自来水价格调整方案听证会上了解到，居民用水价格将上调0.75元/立方米。据介绍，此次居民用水价格调整的范围包括双桥区和高新区。价格调整标准为居民生活用水基础价格由2.75元/立方米上调至3.50元/立方米，调整金额0.75元/立方米非居民用水基础价格由5.70元/立方米上调至6.50元/立方米，调整金额0.8元/立方米特种行业用水价格不做调整。享受城乡最低生活保障待遇的居民用水继续实行优惠政策，基础价格由1. 60元	未
燕都报道痛心！失踪38天的沧州10岁男孩找到了，但不幸身亡11月4日，家住沧州市献县十五级乡小营村的10岁男孩李泽宇帮妈妈扔完垃圾后走失家人十分担心他的安危昨天噩耗传来，失踪38天的李泽宇现已找到，但已不幸去世目前，案件正在进一步侦查中期待警方早日查明真相！（记者代晴）	未
燕都报道真的！石家庄元氏县单双号限行到年底！！3日，一张元氏县政府启动单双号限行的通知在网上流传，是真的吗记者从石家庄市交管局核实，元氏县单双号限行消息属实，从今年12月4日起持续到12月31日，法定节假日和公休日也照常限行。（记者刘涛）	未
燕都报道真的！石家庄元氏县单双号限行到年底！！3日，一张元氏县政府启动单双号限行的通知在网上流传，是真的吗记者从石家庄市交管局核实，元氏县单双号限行消息属实，从今年12月4日起持续到12月31日，法定节假日和公休日也照常限行（记者刘涛）	未
燕都报道石家庄中华大街和平路立交桥北向南通车 预计12月底全部通车17日上午10时，石家庄市中华大街和平路立交桥北向南匝道上车辆顺序通过，南向北西向北东向北匝道正在进行桥面及护栏作业，预计月底全部通车，届时中华大街与和平路交口拥堵情况即将改善（记者 李会嫔）	未
燕都报道石家庄和平路西延中华大街跨线桥及匝道桥梁通车12月26日下午3时，石家庄和平路西延桥梁工程按时间结点施工实现桥梁通车。由石家庄市城投集团建设的和平路西延中华大街桥梁工程为石家庄市委市政府重点工程。和平路西延中华大街跨线桥及匝道道路工程，和平路方向西起WN2匝道东至老中 ...全文	未
燕都报道石家庄和平路西延中华大街跨线桥及匝道桥梁通车12月26日下午3时，石家庄和平路西延桥梁工程按时间结点施工实现桥梁通车。由石家庄市城投集团建设的和平路西延中华大街桥梁工程为石家庄市委市政府重点工程。和平路西延中华大街跨线桥及匝道道路工程，和平路方向西起WN2匝道东至老中华大街以东，长497m。中华大街方向北起市庄路南至宁安路，长1070m。设计时速40km/h。（记者李会嫔）	未
燕都报道石家庄地铁2号线塔谈站至石家庄站实现洞通石家庄地铁在建工程又传佳音！26日下午3点18分，2号线一期工程塔谈站石家庄站区间实现双线贯通，这是全线第七个双线贯通的区间。在紧邻石家庄火车站的盾构接收现场，记者看到，左线盾构机的刀盘顺利出洞，这也标志着地铁2号线03标段的2个区间建设任务均圆满完成。（记者李春炜）	未
燕都提醒今冬首场降雪对石家庄机场航班无影响2018年第一场冬雪就这么悄无声息地来了，但今天要坐飞机出门的旅客不禁担心，机场的航班还行不下雪会不会影响自己的航班呢 记者刚刚从石家庄机场了解到，这点降雪对石家庄机场没有影响，各趟航班均正常起降中工作人员同时提醒，今后遭遇 ...全文	未
燕都提醒今冬首场降雪对石家庄机场航班无影响2018年第一场冬雪就这么悄无声息地来了，但今天要坐飞机出门的旅客不禁担心，机场的航班还行不下雪会不会影响自己的航班呢 记者刚刚从石家庄机场了解到，这点降雪对石家庄机场没有影响，各趟航班均正常起降中。工作人员同时提醒，今后遭遇大雾或雨雪天气，旅客可第一时间致电自己所乘航班航空公司查询航班情况，也可致电96360了解石家庄机场航班动态信息。（记者王萌）	未
燕都提醒注意绕行！明天冀之光灯塔漫水路封堵记者从石家庄市城市水系管理处获悉，接水务部门调水通知，自2018年12月1日上午10时上游水库开始向下游调水 ，途径石津灌区太平河等河道流向滹沱河，水流量将达到20立方米/秒。估计12月1日下午三点左右，水流到达冀之光塔橡胶坝。为确保游客安全，届时太平河管理中心，将根据水流量大小，适时对冀之光塔漫水路进行封堵，并增派人员进行巡查，请大家远离水岸或绕行此路段。放水持续时间未明确，另行通知。由此带来的不便，敬请谅解。（记者蔡艳荣）	未
燕都提醒石家庄谈固西街谈固北大街附近区域停水通知因供水管线施工，石家庄主城区部分区域停水停水时间为：2018年12月19日9时30分至2018年12月20日9时30分停水范围为：谈固西街（跃进路中山路）东西两侧区域谈固北大街（北宋路中山路）西侧区域停水（记者李会嫔）	未
燕都提醒邢台市明起单双号限行，公交免费！邢台市自12月10日0时启动重污染天气红色预警，市主城区对机动车实行单双号通行，限行时间为700至2000，法定节假日和公休日不限行。外地牌照车辆与本地车辆同样受限行限制。限行期间，加大公共交通运力，公交免费。（记者张会武）	未
燕都提醒邢台市明起单双号限行，公交免费！邢台市自12月10日0时启动重污染天气红色预警，市主城区对机动车实行单双号通行，限行时间为700至2000，法定节假日和公休日不限行外地牌照车辆与本地车辆同样受限行限制限行期间，加大公共交通运力，公交免费（记者张会武）	未
燥扎！！！（这又是抽空拿电脑随手搞出来的bgm对吗_(:DJ )_	未
燥起来	未
爆一张在泰国夜市拍的照片	未
爆个猛料！再过两天，这家商场放大招了，南充人注意啦！	未
爆了爆了	未
爆仓！双十一过去半个月，嘉兴这个快递点又被爆了	未
爆光：沂水多个小区惊现二维码，注意这个不要轻易加！	未
爆内幕！亚磷酸钾事件是药害还是敲诈沉默已久的当事方终于出来说话了	未
爆冷！艾因点球淘汰河床率先闯入世俱杯决赛	未
爆各队争榜幕后现象，为抢榜必须关掉直播。梦三争榜呈现躲着打趋势！大家认为躲着打无可厚非，还是迎难而上磨炼自己！	未
爆！宝骏RS-5或将携新标上线！现如今的自主品牌众多。而要说到宝骏，相信没几个国人不认识，旗下几款热门车型红遍大街小巷，颇受消费者喜爱。近日网上流出了宝骏RS-5全新车标的图片，造型更有设计感，透出高品质感。车友纷纷表示新车标可以C位出道了！。来评论区给新车标打个分吧。	未
爆戴姆勒欲拿走北京奔驰控股权，官方发声回应！	未
爆戴姆勒欲拿走北京奔驰控股权，官方声明:对合作关系满意	未
爆料  2名中国人在金边持枪抢劫同胞后逃窜，大家一定要小心！	未
爆料DampG辱华言论者是越南女模越南女模麦克拉（Michaela Phuong Thanh Tranova）一直将其社交平台Instagram的账户设为非公开状态。直至数天前，她才决定将账户设定改为公开，并张贴与涉事DampG设计师的对话记录。麦克拉发文说，尽管自己不是中国人，却希望让他人看到设计师因种族歧视而攻击自己及中国。爆料DG辱华言论者是越南女模	未
爆料Pilib De Brn（曾为talkSPORT和NBC Sports工作过）：我被告知格雷泽家族正在积极寻求出售曼联，这并不令人惊讶，但确实可以解释很多事情	未
爆料！Smlz在和SwordArt蛇蛇疯狂双排，看来Smlz要去SNG了你也在网上啊	未
爆料丨平潭一电动车突然着火，火势凶猛，整辆烧成灰烬！	未
爆料丨流水西楼村一栋旧民房起大火，屋顶都烧穿了！！	未
爆料 临汾一小轿车起飞失败，上了树	未
爆料 临汾一老人马路上遛狗不栓绳，咬到孩子怎么办	未
爆料 临汾公交车上发生的一幕，真丢人....	未
爆料 九州花园附近一警务车与送鸡蛋三轮发生碰撞，情况...	未
爆料：今天城北农贸市场路口捡到身份证一张，失主速来认领！	未
爆料：今天捡到身份证一张，手机一个，失主速来认领！	未
爆料今早，简阳往江南方向发生一起车祸，汽车直接撞出路边...	未
爆料他用五年时间征战北京爱亚卡普 ，从未输过！	未
爆料！传阿里人靠脸吃饭，真相是......	未
爆料先爆这里（shgzs_1），想提前看的，快来吧	未
[爆料] 全椒妇计中心的态度	未
爆料！公司强制员工每月走18万步，少1步扣1分钱！这合理合法吗	未
爆料农村小伙自制天落逮捕机关，火了！	未
爆料北京送蔚县新公交了	未
爆料南部肖家电鱼视频曝光，国家终放大招严处电鱼了！	未
爆料南部这个健身房老板携款潜逃	未
爆料！又一供暖糟心事！看看你中枪没	未
爆料嘉定一小区6幢30层的高楼停电长达近9小时！祸因竟是	未
