爆料固安某小区上演堵门大战！业主愤怒堵大门讨公道！	未
爆料！国家发改委批准！茂名真正的高铁来了，途经	未
爆料：在沂水买了房子住，老家村里的卫生费还要交合理吗	未
爆料在蔚县干这些缺德事 被抓 请看视频！	未
爆料塘厦林村一小车掉入河涌，司机不幸身亡！	未
爆料！多名业主向中梁壹号院讨要采光权！！	未
爆料！天府新区惊现一处空中花园...	未
爆料：女DJ高清无码偷拍	未
爆料好黑人！小河村有个大马蜂窝，蜂子飞出来像乌云一样	未
爆料如此高难度车祸也能发生，真牛，但愿受伤者平安！	未
爆料小区住户喊话楼上邻居：这样做要不得哦非洲猪瘟不传人	未
爆料！平潭两辆公交车相撞，一辆直接陷入田里！两人受伤	未
爆料开源小区：楼道照明灯忽然断电为哪般	未
//@爆料弟://@网友烟云:这丫应该够得上黑恶势力了吧！//@微观昭通: 据@Mr徐立仁微博爆料:内蒙古兴安盟乌兰浩特市泰华农产品批发市场老板的哥哥对讨薪农民工说：我拿一百亿买你全家！ 评：欠薪老板如此嚣张，他的底气从何而来	未
爆料张家口民警 高速上 飞车追截杀人犯 破窗抓捕 场面爆燃！	未
爆料护栏倒塌井盖缺失，这样的河北桥，走着忒不踏实！	未
爆料拆拆拆蔚县又拆快看这是蔚县哪儿?	未
爆料，据说也很牛逼的大V，瞎鸡JB接粉丝的账户，亏出翔了。	未
爆料！揭西钱坑路段两辆大巴车双双冲出公路...揭西大岭埔村路口一孩子大腿遭大货车碾压！	未
爆料！新华北路一物流公司将400多件快递堆放在路边！最后	未
爆料昨天在石海广场看到的这些行为，简直要不得！非洲猪瘟防控知识	未
爆料：昨日高桥附近一辆大货车起火！	未
爆料晚上蔚县广场拍到的，快看视频	未
爆料！有个作业盒子学生家庭作业都不用手写了	未
爆料：沂水下雪教练感慨，学车的4个娘们都...	未
爆料：沂水商铺前的停车位是谁的能不能停车	未
爆料：沂水某公司辞职书有点霸道也是有原因的...	未
爆料：沂水某小区业主门上多了一个盗暖纸条，摊上事了	未
爆料：沂水某洗衣店把衣服给人家洗脏了这事整的....	未
爆料：沂水茶庵街，家门口多了一排围挡谁弄得出入不大方便！	未
爆料：沂水茶庵街，我家门口这些围挡谁弄得	未
爆料：沂水马站这个老麻嘛真厉害，一开口，大家都安静了	未
爆料：沂水骑手小哥顶翻小三轮！这得多大劲就不能慢点	未
爆料！河婆济襄桥这是要改成不让机动车通行了吗	未
爆料！洛门这家店的特别服务，引起了多少男人的热议...	未
爆料：济阳这个小区供暖不热！还有哪些小区不热	未
爆料：济阳这个小区供热不热，真闹心！还有哪些小区不热呢	未
[爆料] 海鲜，猪肉不敢吃?莆田人的酒桌都变成这样了	未
爆料！滨州一小区供暖不达标，看电视需裹被子开空调！	未
爆料滴滴司机：这派单玩的是什么套路	未
爆料！王老吉要出私人定制罐平台了！这是要搞大事的节奏啊！	未
[爆料] 环保局个位领导过来到杨桥工业园看看	未
爆料  移民局突袭检查某赌场，目击者：抓了几车人！（视频）	未
爆料第8910三根大条的形状透露出信鸽信息	未
爆料！营山往绿水方向一大货车翻了..........	未
爆料蔚县42岁以上的，2019年就要面对现实了！	未
爆料蔚县二级路发生的这事 上了省台	未
爆料蔚县办喜事饭店发生的一幕！	未
爆料蔚县南门洞发生的，请看视频！	未
爆料蔚县城区开展厕所革命请看视频	未
爆料蔚县桃花发生，电线上跑来跑去的是啥请看视频	未
爆料蔚县汽车站发生的一幕，你怎么看！	未
爆料蔚县要来大明星了12月22号，请看视频！	未
爆料蔚县逢驾岭老汉拍的 这事曝光了	未
爆料  西港又上线专为中国人服务的色情平台	未
爆料！赣州有大人物要来！	未
爆料达人VenyaGeskin1 曝光了三星Galaxy S10和S10 Plus的渲染图，从图片来看，两者均采用了屏幕开孔的设计，都位于屏幕右上角，但前者前置单摄，后者前置双摄，后者的双摄形状更被网友戏称为药丸，不过大家可以接受打孔屏这种设计吗还是觉得其他全面屏解决方案更好一些三星S10/S10 Plus渲染图曝光：设计有不同	未
爆料！这个出租车师傅我从上车开始，他就一直在弄手机	未
爆料遇到这样开车的师傅我算是服了！有图有真相非洲猪瘟小常识	未
爆料钱佳明牌科技，一夜暴涨2w粉丝牌坦言收到某女主播不雅视频，小星也收到了！	未
爆料 靳家庄十字路口发生两起车祸，前后距离不到200米	未
爆料高端纸尿裤露安适要进军羊奶粉了	未
爆料！鸭嘴鲟竟然在大悟某餐厅公开售卖！	未
//@爆款手推车:转发微博	未
爆款“故宫口红”到底是不是故宫出的？故宫声明：是	未
爆款童装被检出致癌物！武汉人千万莫买，附详细名单	未
爆款童装被检出致癌物！潢川人千万莫买，附详细名单	未
爆款童装被检出致癌物！荆门人千万莫买，附详细名单	未
爆款童装被检出致癌物！西安人千万别买，附详细名单	未
爆款童装被检出致癌物！铜陵人千万别买，附详细名单	未
爆款资讯短视频的传播特征及生产要素丨芒种观点	未
爆款  面对无处不在的雾霾，你需要的是这款能随身携带的空气净化器！	未
爆汁橘子来了！成都周边6个采摘地，赏花钓鱼逗猴子，当天来回！	未
爆炒鱿鱼，get	未
爆炸不在公司内	未
爆炸事故中的3名失联人员...附近村的双胞胎 儿子 丈夫 爸爸 哭了	未
爆炸分类及处理措施	未
爆炸原因公布	未
爆炸头配喇叭裤跳进成都博物馆 这是上个世纪的广场舞	未
爆炸性内幕，沿江小学即将扩建	未
爆炸 想吃 DQ	未
爆炸新闻一声巨响，贵阳一住户家中液化气爆炸，双火源绝不能同室使用！	未
爆炸新闻佳木斯一小区发生燃气爆炸，致1死2伤，伤者有一名孩子！(视频图片)	未
爆炸新闻温州一小区住户厨房煤气爆燃，4人受伤，现场一片慌乱狼藉！	未
爆炸新闻石家庄一小区疑似因天燃气泄漏发生爆燃，大火熊熊！2人受伤（现场视频）	未
爆炸新闻聊城台州接连发生液化气爆炸事故，这些液化气使用规则必须知道！	未
//@爆炸的卡夫卡://@苍蓝钢铁:后街女孩	未
爆炸瞬间，他用身体挡住战友！(图)	未
爆炸让他们险些丧命，留下永远无法治愈创伤	未
爆点：男女之间能发生的事，所有人躺枪！！！	未
爆燃原因初步查明！	未
爆猛料：高州这片区的事，朋友圈都炸开锅了	未
爆笑漫画一样的吃货不一样的浙江人	未
爆笑，野猪误闯清远玻璃天桥吓得劈叉	未
爆米花！游戏！小学生包里果然就是这些玩意儿！	未
爆红的芬太尼｜美方为何如此关切这款阿片类药物	未
爆红让阿姨活不下去的14岁男孩，没错14岁！是男孩！	未
爆胎到底有多恐怖，看完后怕！	未
爆降10几度！超凶冷空气要来惠东了	未
爆降10几度！超凶冷空气要来惠阳了	未
爬上来，自己动！	未
爬冰卧雪斗严寒，卫勤尖兵迎挑战	未
爬冰卧雪缉拿毒贩 化妆侦查直捣黄龙听缉毒民警为你讲述禁毒故事	未
爬到高的地方才能把问题看清楚 56岁，他倒在工作现场	未
爬山439线作业  青山见我应如是 阿木	未
//@爬树犭孟男1966:我们哥们，为了祖国，一年跟媳妇都见不上几次。致敬。	未
爬犁是啥//@无边介: 爬犁//@罗兰老李:图四是啥	未
爬线杆钻窨井的兵：我的脚已和这片土地粘在一起	未
爬过n座山又怎样还是那个恐高的达叔 微博视频 糖分	未
爱一个人就是时刻提醒她该吃药了	未
爱一个人时，不知道如何表白不爱一个人时，又不知道如何离开 。接受了，不知何时相处相处了，又不知如何面对未来 。 -- 爱得纠结，不自信的人总是很累很累的 「情感」	未
爱上了今生注定不能在一起的人，是该相拥还是放手	未
爱上南通 在通外国友人体验传统重阳民俗	未
@爱上子夜飘飘：地铁安检严格本没有错，但是不能之前就拿着机器一扫而过，忽然间就严格的快跟机场安检一样，一如既往的严格没有人会说什么，会把时间提前安排好，留出安检的时间，这样忽严忽松，真的是醉了！	未
爱上旅行后，你果然变了......	未
爱上沈阳的理由 城市V聚力 因为阿联的意外受伤，广东队紧急征调万圣伟奔赴沈阳参加今晚的辽粤大战，他有望本赛季第二次登场，万圣伟和韩德君两人的体重超过500斤，如果万圣伟能上场，今晚两人将上演一次cba最重量级的本土对决。期待吗	未
爱上洗面奶的泡沫，没有为什么丨每日健康问答	未
爱上阆中这座城，不一定是因为某个人！而是因为...	未
《爱不可及》曝最新海报，爱情没有是非对错！	未
爱，不是去改变对方，而是一起成长。	未
爱不能让我们永远在一起，但利益可以	未
爱不闲置大学生回收军训服为郑州城市美容师添衣今天（11月30日）上午，郑州环城快速公路管理处与东方今报猛犸新闻阿里巴巴天天正能量联合举行衣往情深公益捐赠活动每年大学新生军训后只穿几周的军训服都会被闲置，粗略计算一套崭新的军训服装价格在百元左右，而长期工作在一线的 ...全文	未
爱不闲置大学生回收军训服为郑州城市美容师添衣今天（11月30日）上午，郑州环城快速公路管理处与东方今报猛犸新闻阿里巴巴天天正能量联合举行衣往情深公益捐赠活动。每年大学新生军训后只穿几周的军训服都会被闲置，粗略计算一套崭新的军训服装价格在百元左右，而长期工作在一线的环卫工人每年发放的工作服损耗严重，补充购买也是一笔不小的开支。这次衣往情深公益活动倡导爱不闲置，传递同城的小善温暖，邀请在郑州的广大高校学生参与回收军训鞋服，集中清洗消毒后捐给郑州城市的美容师。据了解，河南农业大	未
爱与绿色为伴？树多了也惹人烦，这些业主好悲催…|荔枝维权	未
爱与艾，都不应该被误解！五分钟让你了解艾滋病毒，受益终生！	未
爱书人的旅行打包清单总会和别人有点不一样	未
爱了没有结果。	未
爱，人人都会说，但是一旦面临伴随爱而来的责任和道义，人，忽然就变了。	未
爱人先爱己择人先问心	未
爱，从感恩开始小萌娃们向警察蜀黍的花式表白	未
爱，从我看你时，你不敢看我开始。	未
爱但拒绝艾，请多一点关爱	未
爱你们 真的//@61是个小朋友:hhhhhhh我也真的是从play那个视频开始关注的	未
爱你是我最大的天份	未
爱你的你觉得是缰绳是束缚，董小姐你向往草原。你爱的你又觉得是野驴是种马，你要宽厚的肩膀和无边无际的安全感。	未
爱你@鱼姜 送你小心心	未
爱健康隔一天喝一大杯奶茶！16岁女生突发重病！医生：这两种人不要喝	未
爱健身的女孩身材真不是吹的	未
爱像风筝断了线，拉不住你许下的诺言	未
爱八卦明年坐高铁，诸暨人将告别纸质车票！报销怎么办	未
爱刷信用卡的桐城人注意！这样用卡构成犯罪，最高可判无期！	未
爱卡下午茶 你精心打扮了一番，发现男朋友无动于衷，将会发生什么呢	未
爱卡下午茶 猴子都是相当机智的，大多数知道一次拿俩	未
爱卡下午茶 现实版的功夫熊猫	未
爱卡下午茶 胖怪我喽不怪你，让我躺枪就怪你了！	未
爱卡午休 小老弟，你的想法被我发现了	未
爱卡后市场 卡友：10年的时候开始惦记二手的陆尊，终于2012年10月份到沈阳提了08年12月上牌的二手尊子，当时验车的时候一窍不通，就启动听了发动机声音，然后试驾30多公里，行驶很平顺，感觉很稳。看了原车主的信息，是个43岁的老妈子，猜都能猜到保养不怎么样，提车当天晚上换了机油和格子，办好手续直接开回云南了。从北到南的路途，5天6夜到家了。第4天回到广西南宁检查了机油，就剩了一格，给卖二手车的老板打电话啥回事，说是别克车都这样。好吧，大洋已经在别人手里，磨磨唧唧都是无济于事。陆尊LZC换3900	未
爱卡后市场 卡友：为什么选择奔驰的一款C级去设计DIY呢，因为之前想给家中的老虎换一台车子，刚好看上C，因为自己也有前科没入手先中毒改装，因为之前在国内的话看到的改件就那么屈指可数，就这么两款，一款是AMG的套件，还有一款是卡尔森的，可能看得久了有一些审美疲劳，并且自己是做外贸的，就去外网浏览看看有没有让人耳目一新的套件，结果就找到了奔驰官方黑版的C级谍照，个人感觉非常不错，不过不知道为什么一直没有发布，于是自己就有个大胆的想法，把它实现出来。奔驰C级C200改装变身进化C65套件上车，最	未
爱卡后市场 卡友：因为原车没有无线充电，想要就只能买车的的时候原厂选配，选配套餐是绑定的，被绑定的其他功能感觉用不上无意义！当初就放弃选装了。想着以后再说，大不了自己加装一个，半年来一直用的是插在SB接口的那个，说实在的不是很方便，而且还占用的空间太多了，偶然的机会，大车友群里发现了这个原车位置安装的专用设备，这个直接替换的，随便自己就可以安装，实在不想动手，外边随便找师傅安装，给点工时费就搞定！我是尝到过改装的乐趣，自我感觉还是有点强迫症的那种，一定要自己弄，弄好后车里整洁了多了，充电没有那么多	未
爱卡后市场 卡友：大家都知道，劲情的POLO原车的摄像头是在牌照灯上的，但是牌照灯位置比较低，会造成摄像头角度比较低，视线不良，但是其他地方又没有合适的地方，考虑再三，结合实际，进一步改善了摄像头位置，使摄像头角度更广，看的更清楚。二手POLO之改进安装倒车可视摄像by：拖拉机来了网页链接	未
爱卡后市场 卡友：高六入手开了4个月 累计行驶7千公里 ，由于前车主把原车卤素大灯改了氙气大灯 具体配置是 Q5透镜 欧司朗D1S灯泡 未知名的安定器，这次收了一套海拉的GTI事故大灯 带海拉三透镜 价格么 一对550 人民币。周末抽时间晚上开始先拆解事故大灯。网页链接	未
爱卡汽车：基石资本的控股兼并样本	未
//@爱古风:哈哈，我不配//@凌晨三点的蔷薇花: 不配不配我们不配	未
//@爱古风: 最是人间留不住， 朱颜辞镜花辞树。	未
//@爱古风://@迷妹倾尘: 彼岸花开开彼岸 她的花语有一条是 绝望的等待 她的别名是曼珠沙华 黄泉花 我最喜欢的花是彼岸花 因为她代表一种救赎吧	未
爱吃凤爪注意了！广西最新抽检，14 批次食品不合格！	未
爱吃凤爪的你小心！这些毒鸡爪吃了致癌！	未
爱吃凤爪的你小心！这样的毒鸡爪吃了致癌！	未
爱吃凤爪的常德人小心这些毒鸡爪吃了致癌	未
爱吃南瓜的，别忘了告诉家人	未
爱吃夜宵的注意了！广西各地这4种地方禁止露天烧烤，最高罚2万元！	未
爱吃柚子的招远人注意了，现在知道还不晚！别忘了告诉家人	未
爱吃柿饼的荣成人赶紧看！电视台曝光了，速通知家人朋友！	未
爱吃橘子的爷爷 变成了“小黄人”	未
爱吃海鲜的福建人注意！这条微信一定要看，否则亏大了！	未
爱吃甘蔗的威远人看看，比毒蛇更毒！	未
爱吃红薯的唐河人都看看吧，告诉家人朋友！	未
爱吃红薯的新化人都看看吧，告诉家人朋友！	未
爱吃红薯的栾川人都看看吧，告诉家人朋友！	未
爱吃红薯的永年人都看看吧，告诉家人朋友！	未
爱吃红薯的浏阳人都看看吧，告诉家人朋友！	未
爱吃羊肉的白银人赶紧看，太缺德了！	未
@爱吃重庆串串香：求教！在总医院做产检如何挂生育险的号因为之前单位没给办医保，一直都是挂的自费号，现在给办了医保卡也开通了生育险，想换成生育险的号，直接报销，已经临近预产期，挂号都是主任医师直接拿医卡通给预约下一次的号，不清楚这种方式下怎么换成生育险的号，有没有一直在总医院做产 ...全文	未
@爱吃重庆串串香：请教下各位宝妈们，单位给办理了医保卡，开通了生育险，那产检费用跟分娩费用都是怎么报销的是每次去医院，先拿医保卡挂号缴费，然后保留发票交回单位给报销吗我们单位刚刚医保改革，从上到下没一个清楚这些政策的有没有明白的的过来人给指点下	未
@爱吃零食的你：这23批次食品被检出不合格，快看看你家有没有	未
爱和钱怎么选，她200年前就想清楚了丨日签	未
爱喝白酒的烟台人注意啦！大家都在传这个消息一定要看看	未
爱喝酒的宋朝人	未
爱喝酒的看看，今后酒桌上这些情况要坐牢	未
爱因斯坦“上帝之信”手稿拍出289万美元高价	未
爱因斯坦“上帝之信”：科学家需要信仰什么？	未
爱因斯坦为什么没办个公司	未
爱因斯坦的“上帝之信”：宗教与科学精神未必就水火不容	未
爱因斯坦的“上帝之信”被拍卖，成交价240万美元	未
爱因斯坦离世前一年的信件拍卖 原来他是这样看待上帝的	未
爱国主义教育基地深溪沟地震遗址	未
爱国是个筐，啥都望里装。	未
爱国者有线鼠标7.9起掐指一算，我就知道你们玩游戏又把鼠标砸坏了吧	未
爱国高于一切小广说「上时事课，老师说有个阿姨有好几本护照，其中有几本是香港的。按照惯例只能有一本，而阿姨居然同时有几本，有议员要求港府解释，估计势必影响香港特区护照诚信，以后出国旅行不方便了」。我谆谆教导出国有什么好祖国的壮丽山河咱还没看够呢，祖国在我心里，中国人要团结。	未
爱在暖冬：报道引起管委会重视，号召教育系统凝心聚力	未
爱在油城！我市市民想要伸出援手帮帮小鑫宇	未
爱在长春单身交友@下面为大家带来一首凉凉 1995.09.06猪天蝎座163本科职称讲师看书无房无车毕业于长春中医药大学，正常家庭，现在是中公教育的一名医疗讲师，性格温和。需要一名178以上的一名男士，顾家，有房，没有大男子主义，肯积极奋斗的。月老牵线 幸福相伴长春月老，让陌生人的相识重归简单	未
爱坐地铁的奥斯卡影帝，曾不喜欢自己的雀斑	未
爱大连，请善待这座城市大连爆料	未
爱奇艺CEO龚宇：摒弃以明星为卖点靠明星博眼球的错误做法	未
爱奇艺为金融业务招兵买马，玩够了导流，要自己开发借贷产品了	未
爱奇艺压中内容风口：成本依旧高企	未
爱奇艺在线已更新在原帖：航海王 第864集	未
爱奇艺招聘金融产品总监，要自己搞借贷产品今日，IT之家从爱奇艺官网招聘页面了解到，12月5日，爱奇艺贴出了金融产品总监职位招聘信息详情点击：爱奇艺招聘金融产品总监，要自己搞借贷产品	未
爱奇艺计划发行5亿美元可转换优先债券	未
爱奇艺这次到底买没买版权啊(看到有人说好像买了 买了就看起 没买就还是挥别帅哥(特指姚驰	未
爱妻李亚男产女 王祖蓝搞笑留言暗露女儿长相	未
爱家者联盟今天，我准备喊话几个兄dei，他们是经常做饭，也不做油腻青年@方太电商一杯水也可以喝出生活的品质感@沁园集团去年的衣服，也可以穿出崭新的feel@金纺Comfort每个爱家的人，都有一百万个爱的理由12月6日方太amp沁园amp金纺，厨卫狂欢CP趴！不止满减，还有大转盘赢迪士尼圣诞双人之 ...全文	未
爱尔兰总理带头接受艾滋病病毒检测	未
爱尔兰环境保护署12月5日发布的排放数据显示，在过去五年中，爱尔兰的奶牛数量增加了26，而该行业的温室气体排放量同比增加了10。	未
爱就爱婚介朋友圈里的四种渣男	未
爱康CEO曝体检乱象：护士假冒医生，网友评论亮了爱康集团CEO张黎刚在2018中国企业领袖年会曝出体检领域丑闻用护士假冒医生看超声抽了血，没做检查就扔，直接出结果抽了血不做检查错误率只有千分之三，因为真正得癌症的比例只有千分之三。网页链接	未
爱康董事长曝体检行业黑幕 记者走访发现多处“问题”	未
爱建集团：拟以1.8亿元进行证券投资业务	未
爱心18岁的生命就忍心让他说再见吗请您伸出援助之手！	未
爱心企业家情系重病教师朱占全	未
爱心传递北马小学三年级的小超超，白血病复发......	未
爱心传递 帮老人回家谁认识她的家人帮忙扩散一下12月2日上午，@深圳龙华交警 福南中队铁骑在南坪塘朗山隧道附近发现这位老人家，老人含着热泪和铁骑队员诉说这自己为找女儿迷路的经过，从市区经塘朗山隧道走了好久都没找到路，只知道女儿住在南山区，在铁骑队员协助下，老人坐上了警用拖车，来 ...全文	未
爱心传递新沂市中医院现有一名无主病危患者急寻家人！	未
爱心外卖开起来，好前任隐身救你无关风月	未
爱心家庭和南京大屠杀幸存者一起做月饼过中秋	未
爱心接力！一岁宝宝突遭意外溺水，恳请好心人帮助！	未
爱心接力！东安一岁宝宝突遭意外溺水，恳请好心人帮帮我们！	未
爱心接力！太原好心人看过来！儿子患尿毒症，母亲含泪求助！	未
爱心接力有你有我 2018年12月12日，旅客张先生乘坐C1301次旅客列车在大安站下车时不慎将手包落在车上，包内有现金5000余元银行卡2张及其它贵重物品。车站客运值班员程晓曦了解情况后及时联系C1301次列车长帮助寻找，并最终将张先生的失物找回后当面归还。为了表示感谢，张先生于次日将一面写有爱岗敬业，为民解忧的锦旗送给客运值班员程晓曦。	未
爱心接力有你有我2018年12月5日，旅客杨先生乘坐K1190次旅客列车在白城站下车时不慎将手包落在车上，包内有现金4000余元银行卡3张及其它贵重物品。杨先生在无助的情况下找到车站客运值班员李春海。李春海了解情况后，及时联系K1190次列车车长帮助寻找，终将杨先生的失物找回后交还杨先生。为了表示感谢，杨先生于次日将一面写有敬业正直无愧标兵，优质服务为民解忧的锦旗送给客运值班员李春海。	未
爱心接力有你有我2018年12月6日，旅客王小姐在白城车务段长山屯站乘车时，不慎将手机落在了候车室座椅上，车站客运员方栗言帮助王小姐找回手机并当面交还，王小姐连连致谢。	未
爱心接力，镇雄坪上一男子至今昏迷不醒6天了向大家求助，他是一家人的顶梁柱！	未
爱心重在参与，不在于捐多少。希望看到的朋友，能捐款1元钱，也不希望你们多捐。我作为活动发起人，就带头先捐！ 被无情父亲放弃的孩子-陈宇泽	未
爱思考为什么天冷的时候爱流鼻涕	未
爱怼媒体的特朗普，为何提名此女主播任驻联合国大使	未
爱怼媒体的特朗普，为何提名这位女主播任驻联合国大使	未
爱恨张家界，都有你不曾见过的武陵源	未
爱恰鱼的注意，这3大部位一定要割了扔掉！	未
爱悦读无数的中小企业初创公司分批倒下，曾经的商业新秀巨头也岌岌可危。资本寒冬下，未来的企业将何去何从大数据之父数据时代的顶级预言家维克托迈尔-舍恩伯格，带来了他关于大数据市场的新观点和新预言数据资本时代即将来临。 爱悦读资本寒冬数据资本时代来临，你不得不知的未来趋势	未
//@爱情:	未
爱情三十六计之这事你咋看长春爱情故事	未
爱情不是睡出来的	未
爱情会有的，狗也会有的Photo by ：Hello Darlin Photography	未
爱情可以没钱，但结婚不行。	未
爱情如雪 新雪丰美 残雪无奈木心《素履之往》想和你在雪中漫步，一路到白头	未
爱情是一个精心设计的谎言	未
爱情是一束带刺的玫瑰，充斥着火红的诱惑，总让人神不守舍，可是，稍不留神会被扎个鲜血淋沥。《公考》	未
爱情是别人开的车//@两口栗子:哈哈哈哈哈哈我本人//@银教授:爱情是什么是错过了可惜，没错过重伤	未
爱情是需要被人知道的，一切的地下情 都是在耍流氓！ 微博视频	未
爱情最折磨的不是别离，而是感动的回忆，你站在原地还以为回得去。	未
爱情来到时候似明媚天气它走了 突然骤变雪落雨飞	未
爱情，要不慌不燥，天生一对的人，正如约而至。追剧攻略	未
