烟草局待遇究竟有多好真实内幕是	未
烟草巨头巨资押注的未来：电子烟与大麻产业万宝路香烟生产商美国奥驰亚集团近期接连曝出大动作：不但要收购两家加拿大明星级大麻生产商，还将入股美国市场份额最多的电子烟企业。媒体称，在纸质烟消费量逐年下降之际，这标志着奥驰亚投身于一个全新的竞争领域。烟草巨头巨资押注的未来：电子烟与大麻产业	未
烟草是块肥肉，谁会轻易放弃。还记得当年韩峰局长的性爱日记吗卖烟喝酒玩小谭，人生最大的正能量莫过于此。烟草行业全国布局建吸烟室 遭控烟专家质疑在日前举办的评析中国烟草业文明吸烟环境信息交流会上，控烟界的专家提醒公众一个新现象烟草公司开始在各地兴建吸烟室，以创建文明吸烟环境为由，并希望得到一些地方政府部门的资金支持。控烟界认为，文明吸烟是个荒诞概念，建吸烟室的根本目的还是为了卖烟，地方政府部门应该站在维护公众健康的角度，以防为烟草行业背书。烟草行业全国布局建吸烟室 遭控烟专家质疑	未
烟道体验，一定要看清楚逃生路线，不要盲目瞎跑毛巾要打湿，折成8层哟 微博视频	未
烟雨南山开画本  中企南山墅	未
烟雨朦胧话江南——记忆篇	未
烟雾滚滚刺激性气味四散赶快了解一下，发现这种地方一定要警惕	未
烟青潍三市交界处的村庄：莱州海沧村	未
烤猪蹄绝对是宵夜必点C位出道啊//@差评菌:木屋烧烤真的是深圳人的深夜食堂啊	未
烤着吃最营养，店里一个2元实在太贵，自己动手30元能吃到撑	未
烤箱版凤尾虾球无需油炸的凤尾虾球，吃货们马起来试试看	未
烤红薯原来这么简单，不加一滴水，只需电饭锅，流着糖汁香甜软糯！	未
烦事天天有，贵在心放宽。	未
烦！广州顺丰寄来的短款样衣，因为雾霾天气飞机飞不了，所以两天了还卡在深圳。我本来计划今天拍完明天去杭州的，如果今天拍不了明天还要去杭州的话30号才能回来，可能就赶的太急了...不过因为第二次申诉到现在还没结果，1号能不能正常上架还未可知...反正问题多多，卫衣的视频暂时发不了，上新可能也要4号的样子了。以上！	未
烦死了！艹！再也不乱买周边了！！诚信有问题的人出的周边一概不买！！	未
烧..	未
烧了15天的加州山火几近扑灭，但新的恐惧产生了......	未
烧了17天的加州山火 终于100被控制住了美媒报道，加州消防局当地时间25日公布，本月8日加州北部燃起的山火终于100得到控制。根据消防数据，山火共造成85人死亡，3名消防员受伤，烧毁住宅13972栋，商业建筑528栋，以及4293栋其他建筑。报道称，此次山火是该区域有史以来最严重的火灾。加州野火	未
烧伤女孩周岩：我很好，没什么好澄清。	未
//@烧伤超人阿宝:刚找到这位正在北京治疗的民警兄弟，谨代表个人捐款一万元。并告诉他如果北京治疗期间有任何困难均可直接联系，我们一定尽力想办法帮忙。	未
//@烧伤超人阿宝:手指砍断，一个顶级外科专家，废了。	未
//@烧伤超人阿宝:莆田系的术中开发没有医管部门和警方的配合是不可能的，因为很多患者事后回过味来会尝试维权。维权的时候警方就推说是经济纠纷，医管部门也各种包庇推脱，媒体更是早就喂的饱饱的没人肯管。实在患者闹的厉害就退点钱。每一家莆田系医院的背后，都是一大批贪腐的媒体和官员。	未
烧包在12岁之前没吃过猪肉没见过汽车，不能怪他	未
烧完的蜡烛罐不要浪费，用来种一棵迷你松。	未
（烧得昏呼呼的也还是要玩手机）。。刷到这个，目前还没有令人信服的答案出现，有大手子来给解解惑的吗	未
烧水壶里水垢多，容易得尿路结石？	未
烧炭取暖小心了市民阿敏一家住江心西园。12月15日，阿敏一家烧炭取暖。睡梦中，阿敏感觉胸闷，呼吸费力，起身后觉得浑身乏力，随之呕吐。阿敏发现妻子6岁的儿子及长辈都出现不同程度的头晕乏力呕吐等症状。急救人员确定四人均为一氧化碳中毒，立即给予高压氧对症治疗，患者意识慢慢清醒。	未
烧炭取暖小心了市民阿敏一家住江心西园12月15日，阿敏一家烧炭取暖睡梦中，阿敏感觉胸闷，呼吸费力，起身后觉得浑身乏力，随之呕吐阿敏发现妻子6岁的儿子及长辈都出现不同程度的头晕乏力呕吐等症状急救人员确定四人均为一氧化碳中毒，立即给予高压氧对症治疗，患者意识慢慢清醒	未
烧炭自杀29岁女子门窗用胶带封住自杀身亡！现场留有遗书：希望妈妈挺住！	未
烧烤//@宿管大妈把门焊死啊:香菜	未
烧烤店无证营业 城管现场拆门头	未
烧煤也拘留看看老农的手！又黑又裂，底层最辛苦的农民，烧煤取暖竟然唉。	未
烧煤开始了	未
烧煤被行拘，曲阳“一刀切”治污就不怕老乡挨冻？丨凤凰网评论	未
烧脑！太原滨河东西路实施阶段性限行，快来看看你能记清吗	未
烧草人好像蛮有意思的	未
烧过的肉肯定香！	未
烧钱扩军美军现在情况有变，美国再难称霸世界	未
烫手山芋再转手 华讯作价1亿卖掉飘亮购物中心	未
热1  永康一女子啪啪啪后，腹痛难忍，竟是这东西破裂了	未
热1  永康这三个地方出现10只巨型大桶，是为了	未
热1突击检查我市星级宾馆和快捷酒店，结果是这样的！	未
热一才2k 源家评论都在前排 不难控的 来人！！！！	未
热事梦回古埃及，CHANEL走进法老的圣殿	未
热事沉迷飞行的富二代遇到卡地亚发生什么	未
热到穿衬衣别嘚瑟了！硬核级强冷空气马上杀到，还有雨雨雨！最低气温或将降至...	未
热刺2-1反超！孙兴慜射门被扑出，阿里补射破门！	未
热刺F4，能在曼联打上主力吗	未
热刺对阵伯恩茅斯的比赛正式开始！COYS	未
热刺扳平巴萨！小卢卡斯破门！国米那边也平了	未
热刺球迷护送波切蒂诺上班的升级版：球员护送（via SPORTbible）	未
热刺输球的原因找到了！	未
热力管道泄露行人被烫伤！明晚将陆续恢复供暖	未
热力管道紧急改造 巡视人员现场指导 11月23日，莱芜10千伏西郊线刘封邱支线17号杆附近有挖掘机设备进行热力管道改造破土施工，@国网莱芜供电公司 工作人员立即到现场进行监督指导，要求在靠近电缆时要改为人工开挖，防止破坏电缆，造成线路故障。	未
热团  韩国大宇暖风机，3秒速热，不干不燥 孩子冬天写作业不怕冻！	未
《热土》12月28日公映 以小人物经历折射改革开放40年巨变	未
热在三伏三伏天是一年中最热的时段。虽然昨天立秋，但8月12日才进入三伏中的末伏，8月22日出伏。所以，酷暑炎热还要持续一段时间，所以大家要多喝水多吃水果蔬菜出门做好防晒工作，户外活动时应每2-3小时补涂一次防晒霜。	未
热地在拉萨林芝山南考察调研	未
热巴心酸地表示自己很有钱的代价竟然是这些...	未
热帖试用期后被减薪了，该留下还是转身走人	未
热带水果红心火龙果在2800米的青藏高原 “安家”	未
热度不够，继续来人！！！！	未
//@热心人士M酱://@千鹤秋水 ://@菜鸟阿喵 ://@黄葵红锦墨旱莲 :！//@腐女子的本愿 ://@白萝卜站在火锅里大喊拖延症去死 ://@滚滚最爱吃竹叶青青 ://@琳琅Viola : 希望能普及影响到家庭教育，很多时候是家长需要扭转观念//@辣油大枣Anego :可以啊！//@猫井harumi :不容易！！！请推广//@老蛇_苍	未
热心僵尸粉不用告诉我它女朋友是谁，这事跟它女朋友没有关系。再说了，摊上这种卵子和括约肌都有问题的双标狗已经够惨了，万一害得人家分了手，为了社会和谐你愿意接盘吗体面点自己辞职得了，人生还长着呢。顺网线查户口这种事，当然可以做得到，但没必要。	未
热心公交人帮她找回毕业论文	未
热心天津人助11岁甘肃男孩回家	未
//@热心市民陈小二: 为什么和我学的英语不太一样//@冈瓦纳:字幕有乱来么 我的英文太破了。	未
热心的二傻子	未
热心的环卫大叔@平阳水头网首席执行官：早上在二中北路水头一中一个学生骑自行车时被一辆助动车撞倒，这位环卫工人叫车主把小孩送到医院检查，又到学校告知此事学生的车子我们已去取回放传达室保管，麻烦表扬一下这位环卫工人，谢谢了！水头一中发来感谢	未
热心的网友也许可以帮你排忧解难//@歪歪半天: 转发微博	未
.热情与野心在过去都用完了再也沒有挑灯夜读也沒有急着寻找谁心如止水沒有定数	未
热情好客没错　纪律红线踩不得	未
热情服务 基操勿6丨康正江苏苏州吴江车城的工作日常	未
热情这个东西，被忽略几次以后，就再也提不起来了。	未
热搜心愿树不打，跟着小无和军军走，号召的就做，不号召的就不参与。//@ECHO骑着小毛驴去拉萨:收到，不打。	未
热搜撤了记得编辑微博把无关人员编辑掉噢	未
热搜星愿树最后竟然是摩登兄弟和张云雷争第一，组里说流量梯队都怎么了	未
热搜星愿树网页链接	未
热搜来了，不要慌1先控热门广场yxh2拿原创微博占热门3控住了之后转安利	未
热搜第一热门微博 微博正文 后排有热评造谣，虽然比较靠后，但避免被点上来，大家迅速将这两个黑评后面的评论点一点，将黑评压到更后的位置。不要回复，只点赞无关热评。举报其他有害网页链接，网页链接	未
热搜里那个300斤胖子挤地铁被北京大爷臭骂的事儿就甭发我了都是演的，人家11月12号就拍好视频加好字幕了一个动不动就张嘴辱人的大爷，还有一个挨两句骂就哭了的胖子，这俩在这社会中生存都难，更甭说这么巧凑一块儿了您说是不是	未
热搜里那个300斤胖子挤地铁被大爷臭骂的事儿就甭发我了都是演的，人家11月12号就拍好视频加好字幕了一个动不动就张嘴侮辱人的大爷，还有一个挨两句骂就哭了的胖子，这俩在这社会上生存都难，更甭说这么巧凑一块儿了您说是不	未
热撩 在评论里留下你的手机号后2位，如果有一样的就交个朋友吧	未
热撩 提起你的家乡，别人一般会想到什么	未
热数据11月成都123个楼盘入市，近半楼盘剩房可直接认购	未
热气球俄罗斯将用浮空器保护重要军事设施俄媒14日援引俄罗斯国防部消息，2018和2019年，俄军将收编多个AKV-05浮空器，首批价格为1.2亿卢布报道称，AKV-05正在叙利亚进行测试，旨在保护和监控军事基地附近区域AKV-05包括在越野车基础上制造的地面控制站系留气球绞车和移动加气系统组成 ...全文	未
热气球俄罗斯将用浮空器保护重要军事设施俄媒14日援引俄罗斯国防部消息，2018和2019年，俄军将收编多个AKV-05浮空器，首批价格为1.2亿卢布。报道称，AKV-05正在叙利亚进行测试，旨在保护和监控军事基地附近区域。AKV-05包括在越野车基础上制造的地面控制站系留气球绞车和移动加气系统组成。常规AKV-05浮空器是一种光电监控系统，内置热像仪，可进行全天候监控。其强大的摄像头可以在300米的高空看到2公里以外的汽车牌照。在正常气象条件下，有效视频侦察范围为10公里。	未
热气腾腾洗个澡澡地铁君已经被这炯炯的目光，盯到不敢直视了小可爱们知道这是咱家几号线地铁列车吗 @成都地铁运营	未
热气腾腾的上海攻略 作者：努力变瘦的贺胖几 论本吃货一人如何在一天半花了700块（含车费住宿）暴走魔都探店网红20家P1出行准备P2住宿amp交通P3路线安排amp整理P4景点P59 20家店铺按顺序游玩amp测评最大程度节省出游的时间，提高效率。心满意足的带着一手机的照片和一肚子的肉。	未
热水器从天而降砸伤人谁该负责？	未
热水治不了百病，情话过不了一生。	未
热火朝天！新区这场骑行活动一扫冬天的寒冷	未
热炕头11月28日早上天还没亮，青岛市北区永吉路旁的一处供热管道上趴满了萌物，不少猫咪把露于地表表面温热的供热管道当成了热炕头，蹬腿贴肚，好不惬意近日青岛进入了供热季，温热的供热管道成为了一些流浪动物的御寒之所，周边好心的居民也会为它们提供一些食物（半岛记 ...全文	未
热点18岁的你还在转发锦鲤看00后新兵正在干什么	未
热点 4个月大小汪咬了警察要坐牢英国网友们不乐意了	未
热点6名网上在逃犯在乌兰察布被抓！包头警方征集这5人犯罪线索！	未
热点90岁老人忍寒40分钟拾路上玻璃碴身份证相片可以重拍三次ATM机狂吐钞票，众人抢细心的哥救下17岁轻生女孩	未
热点丨24小时供热服务电话，为何有的打不通有的没人接	未
热点丨中组部负责人就印发《条例》答记者问	未
热点丨奇了！3岁女童竟然痛风！路都走不动医生一问，每天2碗老火汤	未
热点丨平潭这3条路有了新进展！中楼乡和平大道征迁清零	未
热点丨平遥大西高铁沿线环境整治现场，出动机械20余台....	未
热点丨沈阳人注意！国家发布最新流感防治方案，赶紧收藏！	未
热点丨注意！洛溪大桥下月起实行交通管制，为期5年！这些车辆全天禁止进入！	未
热点丨统一行动，重拳出击！全市整治校外培训黑机构最新数据出炉！	未
热点丨编辑婴儿背后的基因生意：贺建奎旗下公司总注册资本过亿	未
热点中卫市中国好人名单，看看都是谁	未
热点  中国大豆之殇转基因的前世今生！看完你就全懂了！	未
热点  中科大最新研究成果：电动汽车电池价格或大幅降低	未
热点丰台这个赌点列入明年疏堵计划，今年已完成101项	未
热点为啥有人睡觉爱把脚伸到被子外这怪癖其实很有道理	未
热点  为躲雾霾十几位阿姨理直气壮攻占酒店大堂跳广场舞	未
热点乘梦飞翔，开尔2019全面建立信鸽DNA身份证数据库！	未
热点事件央视纪录片《我们一起走过》引发关注	未
热点事关晋城限行！省重要通知！这轮重污染天气或持续到	未
热点五星级酒店一块抹布擦所有 首张罚单来了！罚款2000，你满意吗	未
热点交警唐僧式执法惹爆笑闹市广场楼顶惊现空中驾校女子婚后不孕，竟是男儿身警察喊了声嫌疑人名字，竟然	未
热点介休市中医院喜迁新址已投入使用，地址三贤大道西郭家村口	未
热点  他们快被贸易战拖垮了	未
热点  @六师人，文明出行你做到了吗	未
热点关注丨红星湖治理进行时	未
[热点关注]儿子逃出来了，但他爹没有	未
热点关注别了，纸质火车票！一个大消息传来	未
热点关注违规生产一律断电！散乱污整治行动不手软	未
热点关联  初雪来临，请孩子们小心地（de）滑，老年人小心地（di）滑！	未
热点兴化多名失信被执行人光荣上榜，看看有你认识的吗	未
热点  兵团22家单位被命名首批谁执法谁普法示范点（附名单）	未
热点  @兵团人，文明出行你做到了吗	未
热点  兵团党委七届四次全会决议	未
热点内蒙古又上央视，这次是甘其毛都	未
热点击两死五伤！包头一辆通勤车撞上护栏，只因网曝内蒙古撤县设市(区)名单是假的	未
热点击凌晨，东河区的一个小巷内，轿车突然起火把车交给无证的好友开，两人双双被罚	未
热点击记者实地调查，包头这个停车场竟有两种收费标准！深夜醉酒大打出手 伤人潜逃车站落网	未
热点刑事诉讼法制定实施以来第三次重要修改 都改了啥	未
热点刘松生：奔走6年，只为嵩县底层民众治病的权利！	未
热点  别了，火车票！铁路总公司宣布大消息，明年全国推广	未
热点  北京这座地铁站，为何建了9年	未
热点南阳城区路面惊现彩色3D线条！做什么用的	未
热点后续丨把3路公交车司机打昏的施暴者   处理结果出来了！	未
热点  在北京地铁上抢座还打人行拘7天！	未
热点基因编辑婴儿事件震惊世界，同学们应该知道些什么	未
热点  基因编辑婴儿事件震惊社会，官方启动伦理调查	未
热点基因编辑孩子的未来谁负责伦理专家批先干起来再说！	未
热点夏邑出现这些行为绝不手软！将被严查（附举报电话）	未
热点大学生给省领导留言：建议降低公务员工资，人社厅这样回复！	未
热点头条刚刚，X箭摊上大事，警察出动！	未
热点女兵的野炊，怕是要让你馋到流口水	未
热点定了！铜玉铁路本月通车，铜仁到贵阳只用1小时40分	未
热点寒夜里有人坠河！危急时刻，下了班的辅警出手了	未
热点嵩县司法局宪法宣传周：嵩县律师集体向宪法宣誓！	未
热点  平遥街头出现了一批小黄人，他们在干嘛	未
热点平遥高速发生惊险一幕！女司机随意倒车被大巴追尾，多人受伤！	未
热点您家附近有这样的棚亭么问题多多	未
热点我县三年减贫7.1万人 计划2019年脱贫摘帽	未
热点  手机交通一卡通的开卡费都去哪儿了?	未
热点执勤辅警检查站收钱37段视频被曝光！最新情况通报来了！	未
热点把钢针扎进被监管人指甲缝，干这事的竟然穿着制服	未
热点拜耳抗癌药真的广谱吗专家这样说	未
热点 按下农村电商快捷键 好山货变身俏网货	未
热点新区这些路段禁停！14辆车载移动电子警察随时抓拍	未
热点晋城一名3岁孩童独自过马路被交警抱开！真相竟是	未
热点晋城到太原1.5小时92.5元太焦高铁票价预测...	未
热点晋城新建大煤矿试运行 还拿到新建矿井通行证	未
热点曝光台！嵩县闯红灯的这些司机，你被拍了！，还要交罚款！	未
热点曾经的卡恩接班人回家了	未
热点最近，这件事引发全城关注，梁平人都要看！	未
热点来了	未
热点河南9个市启动重污染天气预警！这个周末，焦作人出行口罩和秋裤一个都不能少！	未
热点  @滨海人，出租车起步价拟调至3公里11元	未
热点火速围观！30个家庭齐聚梁平这个地方，只为一件事！	未
热点焦作人速看！你天天喝的这种水大多不合格，细思极恐	未
热点男子偷电缆被电晕！古矿上千户居民水电暖全停！	未
热点经济普查！介休统计人已出发	未
热点绝不手软！这些行为将被严查（举报电话在这里）	未
热点编辑婴儿背后的基因生意	未
热点聚焦教育部加强中小学冬季安全工作教育部通报民办义务教育发展问题	未
热点聚焦明天起，这些新规将影响你的生活	未
热点聚焦烟草公司建吸烟室 遭控烟专家质疑在日前举办的评析中国烟草业文明吸烟环境信息交流会上，控烟界的专家提醒公众一个新现象烟草公司开始在各地兴建吸烟室，以创建文明吸烟环境为由，并希望得到一些地方政府部门的资金支持。控烟界认为，文明吸烟是个荒诞概念，建吸烟室的根本目的还是为了卖烟，地方政府部门应该站在维护公众健康的角度，以防为烟草行业背书。你吸烟吗你怎么看烟草行业全国布局建吸烟室 遭控烟专家质疑	未
热点  自摸杠上开花太兴奋，47岁女子死在麻将桌上	未
热点芒市首次发现冠斑犀鸟	未
热点  茅台酒酿酒作坊正式认定为第二批国家工业遗产	未
热点  被堂姐冒名顶替上大学！当事人接到神秘电话：你看看要多少钱	未
热点  警察子女的14岁生日礼物都和我们 不一样！网友：哈哈哈含泪吃下...	未
热点词汇Day 2：区块链信息流广告植入式广告	未
热点话题  微信红包要不要交个税	未
热点说法治安管理处罚法规定：吸食注射毒品的，处10日以上15日以下行政拘留，可以并处2000元以下罚款情节较轻的，处5日以下行政拘留或者500元以下罚款（小编说：虽然行政拘留最多15天，但出来之后不一定能继续开演唱会的）	未
热点资讯非洲猪瘟排查简明手册	未
热点资讯非洲猪瘟是个什么鬼其实它并没有那么可怕	未
热点  身份证手机就是通行卡！铁路电子客票将于明年在全国全面推广！	未
热点  车企扎堆进入网约车市场 新巨头是谁	未
热点轮状病毒无特效药五价疫苗来廊坊了！哪里有误区小编告诉你	未
热点辨析：国际规则应由国际社会共同制定	未
热点远离邪教，为佛山打call	未
热点连震三次！莆田震感强烈！网友：裤子都没穿就飞下去了	未
热点追击还记得这根被烧得好惨的天线么丨事故分析报告来了，戳进来看	未
热点追踪  可口可乐反家暴艺术展：今天，让我们不再沉默	未
热点逃课请发条状态检讨 不少于50字 并集赞50个近日，中国药科大学一位辅导员制定规定：但凡逃课的，需要发空间说说，写不低于50字感想，并集赞至少50个！网友：还好我毕业早你怎么看 网页链接	未
热点透视：秦皇岛朋友圈里卖蜂蜜网红杨霞到底是谁必须向公众交代清楚......	未
热点速看！新区道路正规停车场点位和收费标准公布！	未
热点鄂伦春旗草原综合服务轻骑兵小分队深入村屯开展服务	未
热点：镇雄龙腾广场旁边自助取款机也会贪污	未
热点除了南阳城区机动车下周开始限行，河南省这些市县机动车已经限行！	未
热点非洲猪瘟不传人，黑水正规渠道猪肉放心吃！	未
热点首例！晋城一个微信群主被刑拘，你知道是谁吗	未
热点  马来西亚与新加坡围绕水空域再现争执	未
热点黄石这个公交司机火了！新华社微信头条推送，因为这件事	未
热热热！广东很热！但即将杀到的强冷空气会很虐...	未
热电啥情况着了大连身边事大连爆料	未
热盘丨社区型商铺，风险低，离消费群体近，在哪	未
热线  东兴一独居老人，凌晨突然求助居委会！	未
热线丨乘坐9路纯电动公交车容易犯晕记者体验未晕车医生说	未
热线反映：供暖施工后，人民北路鑫富源酒店附近路段路面未硬化	未
热线反映魏风小学午间播放音乐影响周边居民午休	未
热线国泰宏城商场口红机，三分钟吃掉百余块	未
热线  顺义这家中介拿民房当办公出租顾客急了	未
热线  顺义这条街，有个早餐亭长期霸占人行道	未
热苏斯双响斯特林替补破门萨内两传，曼城3-1埃弗顿北京时间12月15日晚20:30，英超联赛第17轮，曼城主场迎战埃弗顿。上半场比赛米纳失误，萨内助攻热苏斯率先破门，半场结束前热苏斯再入一球但因越位被吹。下半场比赛萨内再送助攻，热苏斯头球破门梅开二度，卡尔弗特-勒温头球扳回一城，替补登场的斯特林头球扩大比分，最终全场比赛结束，曼城主场3-1战胜埃弗顿。先赛一场的曼城以17胜2平1负积44分的成绩暂时位列积分榜首位，领先身后少赛一场的利物浦2分。	未
热苏斯回忆自己的世界杯：quot我去世界杯时是主力，但最后却没能进球。这对你影响很大。我一度很害怕。人们会一直记得，热苏斯去了世界杯却没有进球。但我还想继续踢，我一直渴望进步，然后做一些出色的事情。quot 加油，小耶稣，你的未来还很长！[加油]	未
热血高校-小栗旬一位劝人从良的理发店老板不为人知的过往	未
热议丨明年，平遥古城全部居民将彻底告别燃煤取暖！	未
热议丨是你生得好还是人家养得好34年后，年薪55万送养儿拒绝生母求助	未
热议你现在骑的电瓶车3年后或禁止上路！这个省昨天正式宣布！	未
热议信阳人，当心了！别再泡假温泉了！赶紧看	未
热议 再见了，飞机！超级高铁要来了！泉州到福州不用三分钟	未
热议固安人疯传！县医院工作人员在二中门口捡到一女婴真相来了...	未
热议！城里人能到农村买宅基地你怎么看	未
热议大学男生用公用洗衣机洗鞋，丢鞋后写告示遭同学群怼	未
热议女方工资4000只够自己用，还需要承担家庭开支吗	未
热议  妈！他们都说温哥华女多男少，但为啥我单身那么多年	未
热议小区门口谁干的缺德事儿 学生老人中招	未
热议！我们每个人都是义不容辞的21.7万分之一	未
热议  换国籍要趁早弃籍税快要落地中国	未
热议改革开放40周年大会｜农村发生了翻天覆地的变化	未
热议改革开放40周年大会｜改革没有完成时，只有进行时	未
热议放着20万客婆不要，还打掉个孩子莆田这家人真的要哭惨了	未
热议政策市场联动，医药经济下行压力增大，答案是	未
