热议气炸！公交司机正开车，突遭乘客暴揍，连续锤头十几下！现场视频曝光	未
热议河南潢川：虚报冒领农村客运油价补贴及乱收费情况汇总	未
热议漳州市区多路人行道取消停车位，城市面子也要顾及民生	未
热议男子跑马拉松两次晕倒，医生救醒后还要跑！拦都拦不住	未
热议  科技美容仪器热起来了，传统手法还要吗	未
热议西峡公交6条线路，你坐那一条	未
热议要钱被拒，她对前夫的孕妻狠下毒手：当街泼汽油并纵火	未
热议  身份证相片不满意可重拍3次！网友评论扎心了！	未
热议近日，网友在广胜寺镇路边实拍到的一幕，二十来只羊	未
热议邓伦的颜引发组鹅讨论，对于他是否真的帅这一点有很多不同声音	未
热议  陕西这位医生火了！被硬塞5000元红包，他反手一个神操作	未
热议  雾还是霾苏州启动入冬后首个重污染天黄色预警！你需注意这些！	未
热评BOOK描述XS	未
热评一打开，二级回复点自家，控评没在怕滴	未
热评往下哗啦也能看到我了。大家在帮忙点点。我在测试	未
热评杨清清：G20十年再出发，需凝聚新的共识	未
热评汇总大家切号	未
热评第一条大型相亲现场//@风和树里：暗示了这个冬天，我们南方人都能遇上嘴硬心软的傲娇北方人谈一场甜甜的恋爱	未
热身赛国足1:2不敌伊拉克 球迷看衰亚洲杯前景	未
热转易烊千玺的粉丝在干嘛原博是wy粉丝吗就一个个在热转上升wy还污染他广场了有这个时间为什么不为搁浅净化一下词条直接关联难听了搁浅做错了什么	未
热转热评，我还活着	未
热辣头条黄冈中院党组书记院长肖笛到小池调研法庭规范化建设工作	未
热那亚希望在冬窗租界斯皮纳佐拉。	未
“热钱”离场 互联网家装平台路在何方？	未
“热钱”离场，互联网家装平台路在何方？	未
热门  下月起，成都坐动车直达厦门 新铁路运行图有这些变化	未
热门今天，谷饶惊现单膝跪地求婚的英歌兄，这下火了！	未
热门传疯！今天整个潮汕都在看这个视频...	未
热门招考民政局招183人，今天开始报名！	未
热门新款50元纸币来了！网友却说：好久没用现金，我都忘了50的钱长啥样了	未
热门昨日，潮汕一火锅店上演全武行 引发多人围观	未
热门第六 垃圾又上来了 我们继续稳住 查看图片	未
热门网友爆料在喜茶里喝出了透明套套最新回应来了！	未
//@热门视频精选: 休息休息眼睛吧	未
热门话题洒水车到底有什么用	未
热门课程 “僧多粥少” 老年大学新招应对“一座难求”	未
热门赛事鹿岛争天皇杯 英超曼联VS阿森纳	未
热门转发评论	未
热闻汇总|倪匡谈金庸去世，唐嫣罗晋婚礼现场照曝光	未
热闻汇总|孟庭苇工作室回应张志鹏，高圆圆缺席贾静雯婚礼	未
热闻汇总|歌手张咪女儿曝光，殴打孕妇的网红Saya出狱后发声	未
热闻汇总|炎亚纶发长文悼念外婆，李诞自曝已结婚	未
热闻汇总|炎亚纶回应被曝劈腿三男，“百花奖”提名名单出炉	未
热闻汇总|王俊凯工作室宣布与D&G解约，周一围方否认出轨	未
热闻汇总|疑似黄景瑜结婚证曝光，王祖蓝凌晨发文为李晨庆生	未
热闻汇总| 罗晋与唐嫣正式宣布婚讯，哈文发文宣布李咏去世	未
热闻汇总|阿娇否认怀孕传闻，TVB视帝陈展鹏海上举行婚礼	未
热闻汇总|陈坤零点整为周迅准时庆生，伊能静首回应女儿视力问题	未
热闻汇总|马蓉否认转移财产，邓超孙俪启程参加金马奖	未
烽火独狼：战地惊梦---狰狞的地雷（上）	未
//@烽火狼骑：弱肉强食，说法律都是屁话	未
烽火通信华东总部基地在滨江开发区动工	未
烽烟竞起 群雄见招拆招 | 年度盘点之人物	未
焖焖不乐//@望着透过你侧脸的那片蓝天://@肾肾先生:我还能炸的稀巴烂//@城南邮局://@李知了://@八鹅吃瓜酱://@话提:不敢炸也炸不起，只好一直小声出气了。//@图院长://@知小乎://@全国美帅代表:煮成一团浆糊	未
焚烧炉烟气数据作假，江西东江环保公司总经理等3人被判刑	未
無餓不坐的运城人，你们来这里坐了吗	未
焦作一匹骏马街头狂奔撞上宝马，责任咋划分一匹脱缰的骏马，当街狂奔，径直撞上了一辆行驶的宝马越野车。这种二马相撞的稀奇事儿，12月17日就发生在焦作市解放东路上，事后交警部门认定为交通事故，但在责任认定方面，作了难。网页链接	未
焦作扫黑除恶第一案开审，涉黑团伙“老大”坐轮椅出庭	未
焦 啥都能转 恩俊emmmmmm，你们觉得这个会是谁抄谁，我觉得一开始就是八组的帖子然后这几位搬了还互相举报? 好的我错了，八组的帖子我贴评论了，应该是涉嫌抄袭那位仁兄最先发。	未
焦啥都能转恩俊 疯起来连自己都转	未
焦头烂额的创业初期，四处招人，可你缺的是人才吗	未
焦小平：合规的10%限额内的PPP支出责任不是隐性债务	未
焦灼之战终分胜负 大盘剑指2700点	未
焦炭夜盘收跌0.79%	未
焦炭期货主力合约涨幅持续扩大	未
焦点22死22伤！张家口化工厂附近凌晨爆炸	未
焦点丨银川又查封两家黑作坊，还能不能放心吃羊杂碎了！	未
焦点丨银川各县市相关负责人，今晚将接受提问！！！	未
焦点中卫一名女士骑摩托车回家，不慎连人带车栽进水沟，结果......	未
焦点全程直播，于都三名老lai被抓过程。。。	未
焦点：山东青州恒发案，谁有管辖权	未
焦点张家界再次被黑，到底是笔者的炒作还是景区自身的原因	未
焦点拆违风暴首例上海鸽友民告官胜诉	未
焦点  昨晚第三十四期《电视问政》曝光了这些问题听听各县区是怎么答复的	未
焦点晋城这2老师谁认识? 当地人都轰动了	未
焦点晋城这个村分房事宜引发关注！！	未
焦点科普：大禹治水和夏朝 都有了新证据	未
《焦点访谈》曝光的这家妇科医院已关门	未
[焦点话题]下月5日， 连盐铁路通车， 响水到北京只要（附初步运行方案）	未
[焦点话题]定了！2019年放假安排，看看你能休几天	未
[焦点话题]定了！响水县站1月5日开通运行！在响水停靠的有...（附运行时刻表）	未
焦点银川择校费上央视焦点访谈了	未
焦糖玛奇朵，拍3件，先锁单！	未
焦虑的互联网：前十年采集流量，后十年金融变现  特稿	未
焦虑的互联网：前十年采集流量，后十年金融变现  馨分享	未
焦虑的童星梦：签了15年约，想解约要赔500万	未
焦虑的西方在调制一杯毒鸡尾酒	未
焦裕禄：生也沙丘，死也沙丘，父老生死系(图)	未
焦黄绿绿的，熏得回家连饭都没吃！通河县西侧排水管排出大量污水，味道刺鼻难闻！通河县环保局：我们是知情的！但为什么没处理呢	未
//@然后下面就没了://@M大王叫我来巡山://@全国美帅代表://@柳三便://@银教授:靶向攻击//@段子楼://@辣条娘:酒精出来挨打//@不听话就艹哭你哟 :嘻//@绿歙_olo :精准醉酒	未
//@然后下面就没了://@回忆专用小马甲://@大望路女青年://@颜文字君://@国资小新:怕个啥想当初，全国科技人员不足5万人，核心技术被全面封锁，一样搭建了全产业链的工业格局，一样搞出两弹一星而现在，仅央企就有153.5万科技人员233万技师56万余件有效专利，这些都是我们应对卡脖子的底气	未
//@然后下面就没了://@格兰芬多公共休息室:帅炸了！！！！！！！	未
//@然后下面就没了:请你善良一点//@M大王叫我来巡山:劝你谨言慎行//@全世界最英俊的人: //@尸姐:OK//@赤道少女:。//@触手蜀黍:慢性自杀啦//@吃不胖的小5: 自己反省反省//@天秀bot:本人	未
//@然后下面就没了 ://@风吹铃铛响叮叮 ://@尸姐 :好的//@奔现 ://@大头和他的朋友们 ://@范里砂 ://@粽粽粽粽粽粽粽 ://@西升月 ://@歌且行风长吟 ://@-腐兔- :Yep//@8giao :真的，所有事情都是这样	未
然后下飞机可能又发一条推翻飞机上发的//@陶短房:他在专机上就能发谢谢。再说这个协议怎么看都是一个暂停哨而已，除了休息就只有应该继续谈这么个共识了	未
然后今天带毒了，为用户推送病毒 网页链接	未
然后刚刚他把我一个快递又弄丢了 满家找都找不到他在客厅里打转 我说你干啥他说他叫团团 这样就是团团转 急的团团转	未
然后博格巴立马发了这个：来，取个标题	未
然后实现真正的社会主义//@陈如是说: 从征税技术上看，我朝会在三年内，也许用不了三年，就会全面赶超帝国税务。	未
然后就世界大乱，到处塞车，我延误了4小时了//@Drowsyboi:今日洛杉矶下大雨啊	未
然后就可以加入车友会了	未
然后就早恋了//@我是小糗君:长大后发现嫁不出去	未
然后斯特林也打高了	未
然后有个悲剧时，今天坐到影院里听到主角开口时，才意识到票买错了昨晚买时没注意看，买成了国语配音的后来我突然在想，咱们的各大电影购票软件，是否可以考虑下出个类似语种/版本确认提醒的功能。具体是说，可以根据用户历史购买电影票时，绝大多数选择的是原版还是配音版，进行最终的 ...全文	未
然后看了下提名，还是算了吧。并没有看出有改变的决心，还是那样。	未
然后还坐优步，起始地显示是从国安出发，都被截下来当证据了这也是美国海外情报监视法的威力，美国可以分析美国公司的海外运营数据。几个月前国内几个论坛上也出现了美情报机构的钓鱼贴，不过中文还稍稍有待改善。	未
然后这位选手语音正常了，又听不见游戏声音了	未
然//@老李飞刀的刀刀:是这个道理，我们不是说这件事一定不是医疗纠纷，但起码在没有确凿证据前，没必要提医疗纠纷，就是一起伤人事件。医护人员对于这类事件极其敏感，感同身受，官微的表态更应该斟酌严谨。	未
然而他们并不看这个视频...	未
然而，伴随着农村人口大量向城镇转移，大城市尤其是特大型城市的土地资源日渐稀缺，城市建设用地正在逼近天花板。与此同时，乡村占地并没有随着人口大量向城镇转移而趋于缩小，反而也进一步扩大。	未
然而北方的冬天不只有暖气，还有不怎么妙的空气啊（	未
然而@奶爸猫律师 还是没有猫//@MebiuW: 转发微博	未
然而，好多越南制造其实还是中国人过去的//@于帅洋是琢玉郎:这就是我国技术要素已经具有竞争优势的体现之一//@钟鸿钧://@兰小欢:转发微博	未
然而并不是放血冰低温急冻的，压根不值钱，且大洋世家的零售价水粉更大//@刘氏子攀:目测这条应该是真的了。东方金枪鱼Thunnus orientalis（Pacific bluefin tuna）	未
然而我们中的某些人依然抱有幻想张嘴中美夫妻论//@书房点兵:以斗争求团结，则团结存，以妥协退让求团结，则团结亡！这话是谁说的来着//@张国庆看天下:以斗争求和，则	未
然而我们更相信，人死不能复生	未
然而我月薪不到一万//@黑潮君://@磁暴步兵蟹什卡://@北方机械制造生产联合体:新税法//@神算子哈里谢顿://@林水妖:终于看明白了	未
然而睡了两小时才起床。	未
然而，红色小轿车早已看穿了一切！	未
然而这样的服务才收100	未
//@煎蛋总司令大人://@银河鲨鱼护卫队:转发微博	未
煎饼。。。	未
煎饼摊大妈:我月入3万，怎么会少你一个鸡蛋读了985，211的你，为什么一无所有?	未
煎饼摊大妈：我月入3万，怎么会少你一个鸡蛋！读了985，211的你，为什么一无所有	未
煞风景！“孔子身上”赛车 资阳一雕像被“玩坏”	未
煤改气之后，泾阳人今年咋过冬	未
“煤改气”后没接通气源，西安一学校1600名学生挨冻上课	未
“煤改气”后没通气源 西安1600名学生已被冻一个月	未
“煤改气”后没通气源 西安1600名学生已被冻了一个月	未
“煤改气”后没通气源 西安一学校1600名学生挨冻上课	未
煤改气如何开通使用，戳进来一起看	未
煤改电呢先烧气发电，再用电取暖，酱得有多爽微博正文 //@文光围脖: //@于帅洋是琢玉郎:不夸张煤改气是最愚蠢的能源政策建议和政策，没有之一	未
煤改电造福老旧小区居民建设巷是该市老旧居民小区之一，居民多为老年人，冬天基本采用烧煤取暖。今年煤改电工作中，汉中供电公司主动上门，为小区居民宣讲电力惠民政策，改造用电线路，受到了他们的欢迎。图为12月17日，@国网汉中供电公司 党员服务队深入建设巷改造低压线路。（李哲)	未
煤气泄漏  男子按下打火机瞬间爆炸	未
煤气罐喷火燃烧，随时要爆炸！这次出手的又是他们	未
煤气罐爆炸，原阳17岁少女烧伤80父亲割皮救女：要我全身的皮都行	未
煤气罐爆炸，新乡17岁女孩80烧伤！父亲割皮救女：要我全身的皮都行	未
煤气罐爆炸，父亲割皮救女！	未
煤气罐起火怎么办这样的操作你敢吗	未
煤监局19人任免名单！	未
煤省山西严控煤炭消费总量防治大气污染	未
煤省山西出台最严治污法规：地方立法控制煤炭消费总量	未
《煤矸石综合利用管理办法》 2014年第18号令	未
煤矿井下防爆电气设备失爆判定标准及常见失爆现象	未
煤矿实拍：矿工下井的那一刻，矿嫂哭了！	未
煤矿工人不安全行为界定标准（征求意见稿）	未
煤老板	未
煤老板的手终归还是有地方放的	未
煤补助学金失业金鄂尔多斯人你关心的问题市长热线是这样解答的	未
“煤都”太原今冬将彻底告别数千年采暖烧煤历史	未
照料公婆十余载！泗阳的这位儿媳，十里八乡都在传……	未
照片上加字，画龙点睛还是毁于一旦 摄影早自习第928天	未
照片不寂寞 @深圳天气	未
照片中的历史 1942年12月7日， 美国海军BB-62新泽西号战列舰号在费城海军造船厂下水， 这艘船是由曾担任海军部长的新泽西州州长查尔斯爱迪生的妻子卡洛琳爱迪生砸香槟。	未
照片中的历史 1944年，意大利那不勒斯，美国陆军的防空列车。	未
照片中的历史 一名川军士兵手持美制M1928A1汤姆生冲锋枪射击。	未
照片中的历史 加拿大陆军装备的萤火虫坦克和M4A3（105）谢尔曼坦克停放在荷兰城市街道上，1944年底。	未
照片中的历史美国军工厂女工为20毫米M2机炮进行测试射击	未
照片买卖灰产调查 19元网上可买35位女士海量生活照	未
照片是京都，所以他在京都吗京都的特番	未
照片是窗口还是镜子	未
照片来了就是他！水深5米跳水舍己救人的涿州英雄！	未
照片质疑法官的办公室，怎么可以没有卷	未
照着这几张图做，衣柜从此告别乱糟糟家居微盘点	未
照这样下去，发现琥珀长颈鹿不是梦	未
照金北梁红军小学的“变”与“不变”	未
照顾失智老人每月4天假 政府买单“喘息服务”的意义	未
照顾好自己，注意防寒保暖，别感冒哦//@Evangeline雪心: 真的是太冷了_受不了了	未
照顾服务老年人，乌海市出台新政策	未
照顾某个脆皮病号，喝水，擦汗，冷敷唔，现在准备睡了。睡前再看看四个居仔。明天不知道几点醒了	未
照顾苦命老人为其送终，老人却用一句话报了恩	未
煮内裤吐痰的酒店热水壶，你还敢用只有它才能让你随时喝上放心的热水	未
煮老师又在盗版我了。盗版集团的账号@供大爷您浏览 而且使用我的原创图片头像，盗版的一字不差，一条不少，机器盗版，瞬间到账。我无法投诉，因为投诉按钮是灰色的。@傅柒柒同学 @曹增辉	未
煮过水果胜过药，水果熟吃更健康！比如：柚子蒸熟可以减少血栓的形成，预防中老年人中风。苹果蒸食服用可以止泻排毒易消化。	未
煮雪烹茶，听雪敲竹	未
煮鸡蛋加点它太厉害了，鸡蛋香嫩可口不粘壳，可惜很多人都煮错了！为家人收藏	未
煲一碗汤，将营养喝进头发里	未
煲剧无法成为野兽的我们，至少要对自己好一点呀	未
煲汤类食材，不分包，容易造成脆类食材破损，导致整个汤料品相破碎，客诉，容易一个食材霉变，影响其他食材，一个食材味道，窜给另外一个味道，我做汤料这么多年，我所在意的是你们想不到的，我们的用心就是食材的安心。这是我坚持的态度！	未
熄灯号  一名军恋女孩的真情告白	未
熄灯号丨2月17日，我们家的特殊日子	未
熄灯号丨喊一声班长，一生就是你带的兵	未
熄灯号丨我和父亲的雪域情怀	未
熄灯号丨每个远行者的梦中 都有一条家乡的小路	未
熄灯号丨说不喜欢部队，是我嘴硬	未
熊AI会说那是理论//@自田丌尸丷十人:仔细看最右的图，尤其是老熊高亮线标注的文字可知95是个非常保守的估值，比如美国2岁以上儿童接种率大于80就可以阻断麻疹传播//@疫苗与科学: //@xiongyongqiang: 查看图片	未
《熊出没·原始时代》发首款预告 揭秘史前世界	未
熊出没原始时代定档2019年大年初一。一次偶然的意外，转行成为导游的光头强无意间与熊大，熊二从一个奇异的山洞穿越到了一个陌生的新世界。这里，竟然是史前石器时代！奇特复杂的地形地貌凶猛的原始野兽熊强面临着前所未有的险阻和困境，更糟糕的是，混乱中，熊大与熊二光头强不幸失散。作为《熊出没》第六部大电影，《熊出没原始时代》会带给我们更多惊喜吗	未
熊咋回事啊哈哈哈哈哈或或或或或或或或或	未
熊大@彩虹熊_白玮 请看qq	未
熊妈：别管男的女的赶紧带一个回家照顾你。吓得本熊把刚塞进嘴里的柚子喷出去熊妈思想就是和其他的家长不一样恩	未
熊妈遛娃 绕树干躲猫猫	未
熊娃到底该不该体罚美国儿科学会发话了！	未
熊孩子不怕危险躺铁轨，逼停火车后逃离！	未
熊孩子从28楼扔下15个啤酒瓶 屁股被家长打开花据网友爆料，之前，合肥一小区发生一起高空抛物事件，一名业主家的小孩将34层的啤酒瓶拖到28层，从窗户扔下来一共15个瓶子，幸未造成小区人员伤亡。家长得知后，将孩子屁股打开花。（新京报）你认为该打么	未
“熊孩子”，你到底是谁家的？法官带你找“妈妈”	未
熊孩子偷偷拿爸爸微信买了只乌龟 竟是保护动物	未
熊孩子冲上铁路突然“卧轨” 逼停火车后竟跑走了	未
熊孩子在地铁车厢内小便，这几位苏州妈妈是这么说的…	未
熊孩子学手机视频偷开装载机，过瘾却闯祸！	未
“熊孩子”屡屡成新闻主角 是谁惯坏了孩子	未
熊孩子徒步十多天从靖江来到如东后	未
“熊孩子”打不得？这项新规让法国人急了	未
熊孩子打赏女主播16万：家长与直播平台私了	未
熊孩子无知弄伤小蛇，蛇仙找上门却来报恩	未
熊孩子毁灭机丨今日最黑	未
熊孩子溜进铁路内横卧铁轨上 火车刹住时距离小孩只有几米远	未
熊孩子用“一百分贝”统治机舱，同机乘客手绘奥特曼引她安静	未
熊孩子系列近日，傍晚时分，一位小学生独自在13号线南京西路车站里玩耍，不停的翻越闸机，引起了服务员高丽的注意将小朋友带进办公区域，原来是犯错后怕父母责备就从家里逃了出来，服务员管馨怡赶紧拿来巧克力牛奶蛋糕给小朋友垫饥值班站长钱进翻看书包寻找线索，终于找到了学校的联系方式 ...全文	未
熊孩子系列近日，傍晚时分，一位小学生独自在13号线南京西路车站里玩耍，不停的翻越闸机，引起了服务员高丽的注意。将小朋友带进办公区域，原来是犯错后怕父母责备就从家里逃了出来，服务员管馨怡赶紧拿来巧克力牛奶蛋糕给小朋友垫饥。值班站长钱进翻看书包寻找线索，终于找到了学校的联系方式。熊孩子系列小学生反复翻越闸机引起工作人员注意 原来是因为	未
熊孩子！美国两未成年男孩偷飞机回家，飞行15英里后被捕(图)	未
熊孩子被他们带走时嚎啕大哭，最后	未
熊孩子锅盖卡脖出不来，求助公安消防蜀黍想办法！	未
熊小默，一个不会开车的视频博主，发了一个试驾广告。匪夷所思。有没有钢琴品牌要找我打广告。	未
熊小默在线发糖： 微博视频	未
熊小默：我上半年老看到有留言说，那些油腻公知 gay，比如熊小默竹顶针飞猪什么的...我：艹，为什么我排第三	未
熊小默：我建议你去雪乡拍一期 vlog。	未
熊市也有熊市的好处，筹码都便宜了，出奇的便宜！问题是你敢捡吗寻找：牛市找不到的安全边际，现在就在你面前	未
熊市抄底别抄错了	未
熊市猎人：中国人正处在从不诚信到诚信，从不靠谱到靠谱的时代里，大家的合作成本越来越低，会带来更多的企业利润，创业的成功率也会越来越高，中国的未来会越来越好 靠谱的人千篇一律，不靠谱的人各掉各的链子	未
熊市猎人：能和美国竞争，是我中华百年之愿！愿和华为站在一起，共御外敌！ 任正非不会屈服	未
熊市见底的一个标志是之前极度看多满仓的标志性人物突然有点害怕了，开始看空了。那就差不多了。	未
熊市里如何应对黑天鹅@李开宇-价量兵法 的一直播（下载App-gt网页链接）	未
熊：怎么肥事小老弟	未
熊明新任湖北鄂州市人民政府副市长	未
熊本县厅广场路飞铜像揭幕仪式集中报道更新帖（大量图片）	未
熊本县厅广场路飞铜像揭幕仪式集中报道更新帖（大量图片）地址：网页链接这个早前我们报道的路飞铜像揭幕仪式原帖更新了大量图片，欢迎大家观赏。我专门放一波路飞铜像多角度特写图吧。	未
熊本熊互动话题 今天有好多吃瓜群众！打出你知道不知道然后一直按下去，看看会出现什么话	未
熊本熊互动话题 用输入法打出只要你不，接上后面的句子，比比谁过的更心酸	未
@熊本科技 在现场，有人要来围殴他么我负责指路	未
熊爸连向日葵都不放过@叮阁咸鱼	未
熊猫为什么能靠竹子生存	未
熊猫: 你得国宝已经饿了 微博视频	未
熊猫圈我看到的时候都惊呆了//@豆你玩:有东亚人的地方就有（）	未
熊猫守护者 为了让滚滚饭后百步走，澳门石排湾郊野公园熊猫馆的饲养员们也是煞费苦心呢看到别的大熊猫居住环境那么棒，滚滚还真有点羡慕呢	未
熊猫守护者 为保护自然去探险！野生动物保护没有你想象地那么难，只要你愿意，户外徒步探险的过程就是为守护野生精灵尽一份心力的过程！@欧阳凯kyle 一位90后美国探险者和摄影师，就参与了@猫盟CFCA 组织的带豹回家，重走太行天路的活动，让我们跟随他的镜头去看看这一路的美丽和奇遇吧！	未
熊猫守护者 偶遇雪豹是怎样的体验青海省玉树藏族自治州的居民就遇到了雪豹逛街，甚至还和他们玩起了躲猫猫的游戏 看来该地区对于雪豹盗猎等威胁较小，人类和野生动物相处很和谐呢！	未
熊猫守护者 印度尼西亚女画家Elicia Edijanto从儿童与野生动物的角度勾勒出了人与自然的和谐关系。画面中孩子跟动物亲密无间，像朋友一样共同生活和成长。守护君呼吁大家，将野生动物保护的理念传承延续下去，让我们的下一代能够与野生动物和大自然和谐共处！[给你小心心]	未
熊猫守护者 咦，东北虎们已经开始增膘过冬了么看它们圆滚滚的样子还真的有点像滚滚 不说了，滚滚要去吃点东西继续贴冬膘了，可不能落后了今天守护者们为滚滚种竹子了吗熊猫守护者	未
熊猫守护者多彩滚滚梦 滚滚这么认真立下的flag，到底是该信呢，还是不该信呢 考虑到滚滚每天不是在吃饭就是在睡觉，这个flag守护君是万万不敢相信滴！各位守护者们敢信么（图片来源于：@阿尨along ）	未
熊猫守护者 探访熊猫守护者项目地 守护君一开始看到这冰火两重天的景象还纳闷呢，原来是这个原因呀！守护者们都了解了吗	未
熊猫守护者 没有买卖就没有伤害。请大家关注和守护这些濒临灭绝的野生小精灵们，让这样的恶性循环不再发生！ //@头条新闻: 是怎样的诱惑让不同国家不同水域的三种物种濒临灭绝如何才能让恶性循环停止呢看完下面的视频，也许你就会明白。	未
