老詹和老司机	未
聊天，说起：经常有人称临死前看到黑白无常我随口：可能他们属于地府培训部门的，每次看人快去世了，就愁于增加工作量：这个新鬼又要我带了！他还不入职我还要等几天啊，赶得上新一期培训不，要不只能安排在下期了这么一想，死也不可怕了友：死后还要上班，分明更可怕了	未
聊天送闲置@永山野田妹 的一直播（下载App-gt网页链接）	未
聊寨  别了，纸质火车票！明年起全面推广电子票...	未
聊寨  永康还没结婚的注意！全面婚俗改革来了！	未
聊聊二孩这些事	未
聊聊代沟这件事	未
聊聊吧，如果是你，你会选择那个	未
聊聊天交个朋友吧/相逢就是缘分 微博直播	未
聊聊游戏你觉得现在，游戏占据了你生活中的百分之几	未
聊聊游戏 周末又至，大家准备玩什么游戏呢一样的一起加个好友吧	未
聊聊游戏 在你的印象中有哪些非常火却昙花一现的游戏	未
聊聊游戏是什么原因让你仍坚守绝地求生这款游戏又或者是什么原因让你放弃绝地求生这款游戏	未
聊聊游戏 有哪些你曾经很喜欢的游戏最终还是弃坑了为什么	未
聊聊游戏 有哪些曾让你通宵游玩的单机游戏	未
聊聊游戏 玩游戏时，你都见过哪些奇葩的喷人原因	未
聊聊，聊聊	未
聊聊脱贫那些事儿！	未
聊辽天丨白卫生纸和黄卫生纸到底哪个好	未
聋人带娃回家车子没油，求助交警！	未
聋人是不是属于低保户能不能办低保	未
聋人王大爷有新闻要讲	未
聋哑人可以申请低保吗99的聋人都不知道！	未
聋哑人强迫聋哑人乞讨，从被害人变成帮凶5人获刑	未
聋哑学校路口一辆车连撞3辆车，好吓人。	未
聋哑孩子交流不便   83家商户自学手语方便他们购物就餐	未
聋哑摄影人用镜头“说话” 40多年来残疾人生活发生巨变	未
职Q问答 你的职场路上有哪些不为人知的辛酸	未
职Q问答 如果可以，你想对入职场时的自己说些什么	未
职Q问答 有哪些事情，只有在北上广才能体会	未
职业倾向测试	未
职业假摔选手蔡徐坤 了解一下	未
职业卫生调查的难点在哪里	未
职业拳手不会轻易被KO，就是因为这些训练	未
职业捞尸人月入十万。给不起钱，就让尸体在水里泡着！ 职业捞尸人月入十万。给不起钱，就让尸体在水里泡着！	未
职业球员要有基本准则，曼联球员要有基本态度。就说这么多了。	未
职业男足俱乐部：苏粤“经济斗法”背后的另类“角力”	未
职业病“头号杀手”知多少？看专家教你如何防治尘肺病	未
职业病防治工作推进会召开，透露的几个关键，你看懂了吗	未
职业育儿的EXO成员kai金钟仁	未
职位发布知名律师团队招聘:行政助理专职律师实习生@北京招聘	未
职位集中在基层 国税海关为招人大户 现涉及北京新机场的职位	未
职场中，如果你不会与别人沟通，非常影响自己的工作。沟通其实没那么难，关键在转变思维，请看《职场沟通课1》	未
职场女性亚健康只是压力的表象	未
职场女性跨境冻卵：生育自由，还是工作束缚	未
职场如战场，需要处理的事太多：要有计划，要有武器，要有战友，还要保持英姿飒爽的同时提防暗处的冷箭最重要的，还要有舒适的生活来提供粮草与支援！解决好了后顾之忧，大好世界等你来！双12来@网易考拉官方微博 跨品类满188减100起跨品类2件5折起！考拉黑卡用户还可再享96折/9折！叠加黑卡专享大额券还有更多优惠哟领券通道在这里哦：网页链接	未
职场建言：无论你是领导还是下属，都要学会这15条！	未
职场破事 求职季 学的是汽修但是对这个行业毫无兴趣 也没学到有用的技术，家里在北京做生意的 开了个饭店目前还算稳定 父母就推荐去汽车制造厂 或者就在店里帮忙接手生意，但是每天都在店里忙着 感觉接触的圈子很小 父母都是农村的 眼界和格局也被限制了，麻烦有相同经历的小伙伴给些建议 ...全文	未
职场那些事儿	未
职场那些事儿 微博视频	未
职工延迟退休的本质是，减少养老金支出。现在，女工退休年龄是50岁，平均寿命是78岁。领取养老金年度，和工作年度，差不多都是28年。这钱哪来啊假设，推迟到60岁退休，工作36年，领取退休金是18年，多交少取，企业成本下降，出口价格和商品价格才有少涨不涨的可能性。如果年年提高 ...全文	未
职工教育经费的计算基数，明确了！	未
职工朋友注意！工作生活中千万别掉进这些押金坑	未
职工超生即辞退辽宁拟修改应对规定	未
职称改革的大方向：有为就有位	未
职称评审与外语计算机脱钩	未
职称重大利好：自主参加评审，不受单位结构比例限制！	未
联丰路旁有人种菜？这是绿化带，不是你家菜园	未
联储褐皮书：关税及美息问题令乐观情绪消退美国联储局发表称为褐皮书的地区经济报告，指大多数地方联储所辖地区的经济以温和或者缓和的速度增长物价温和上升，其中输入成本的升幅超过商品价格的涨幅。褐皮书提到，美国整体消费者开支稳定，但称关于关税造成成本上升的报告数量增加，关税仍然是製造业的一个顾虑之处。联储局又称，大多数地区的信贷增长，惟部分地方联储提到信贷增速放缓问题，至于关税美国加息等问题令部分地区的乐观情绪消退。	未
联创互联：实控人提议年报10转8派0.2元	未
联创互联开盘涨停，实控人提议年报10转8派0.2元	未
联创互联收关注函：说明利润分配预案是否炒作股价	未
联动追逃、亲情劝返 夫妻双双投案自首	未
联南苏团朱巴战区司令视察中国第五批维和步兵营	未
联合专案组 @迟夙生律师	未
联合利华CEO Polman将退休 由Alan Jope接任联合利华表示，首席执行官Paul Polman将退休，并由现任全球个人护理业务总裁Alan Jope继任，明年1月1日起生效。Polman将于明年上半年协助交接工作，现年54岁的Jope于1985年作为市场营销培训生的身份加入联合利华。联合利华CEO Polman将退休 由Alan Jope接任	未
联合利华首席执行官将退休 由Alan Jope继任	未
联合国世界国际品牌发展委员会同意召开2018中国峰会	未
联合国世界粮食计划署旗下联合国人道主义空运服务 (UNHAS)有92架飞机 每天在忙碌飞行，为世界各地送去人道主义援助物资，圣诞节 也是如此，飞行员圣诞老人	未
联合国会议同意限制基因驱动，支持者和怀疑者都认为胜利了	未
联合国先遣队抵达也门监督各方落实停火等协议	未
联合国前秘书长潘基文：中国改革开放在世界历史上有重大意义	未
联合国副秘书长赴也门了解人道主义局势	未
联合国卡托维兹气候变化大会开幕 气候资金问题或为谈判焦点	未
联合国：去年有8.7万女性被杀 近6成死于至亲之手我们常说家是一个人的避风港，但联合国方面公布的一项最新研究显示，家对女性来说却称得上是最危险的地方在2017年，全球共有近8.7万女性被杀害，而近6成的女性都是死于家庭成员或是亲密伴侣之手综合英国BBC等媒体报道，当地时间25日，联合国 ...全文	未
联合国：去年有8.7万女性被杀 近6成死于至亲之手我们常说家是一个人的避风港，但联合国方面公布的一项最新研究显示，家对女性来说却称得上是最危险的地方。在2017年，全球共有近8.7万女性被杀害，而近6成的女性都是死于家庭成员或是亲密伴侣之手。综合英国BBC等媒体报道，当地时间25日，联合国毒品和犯罪问题办公室公布了一项最新研究。研究指出，全世界在去年共有近8.7万名女性遭到杀害，其中有5万多人都是被伴侣或是家庭成员所杀，占到了58。近3万人死于她们的亲密伴侣之手，另外2万人则是被亲属谋杀。	未
联合国呼吁促成阿富汗政府与塔利班和谈	未
联合国大会将每年１月２４日定为国际教育日	未
联合国大会正式通过《移民问题全球契约》	未
联合国大会通过《难民问题全球契约》	未
联合国大会首次就消除农村贫困问题通过决议	未
联合国女性维和军官国际培训班结训	未
联合国安理会举行伊核问题公开会	未
联合国安理会  刚刚召开会议讨论黎以边境局势。本月4日，以色列 宣布，发现黎巴嫩真主党 修建了多条从黎巴嫩延伸至以色列境内的地道，并已发起北盾行动予以摧毁。联合国负责维和事务的副秘书长拉克鲁瓦向安理会表示，联合国驻黎巴嫩临时部队（UNIFIL）确认，在被称为蓝线的黎以临时边 ...全文	未
联合国安理会召开紧急会议讨论俄乌冲突，俄：遵守了国际法	未
联合国安理会对伊朗发射弹道导弹视若不见联合国安理会本周二应法国和英国邀请，就伊朗发射弹道导弹开启闭门讨论。英国常驻联合国代表凯伦皮尔斯向记者表示，这是一次非常好的谈判。联合国安理会对伊朗发射弹道导弹视若不见	未
联合国安理会通过决议 核可叙利亚停火协议	未
联合国官员对中国赴黎维和工兵给予高度评价	未
联合国宣布启动全球反塑料污染行动	未
联合国寻求筹集40亿美元 为也门提供人道主义援助	未
联合国将就其在也门荷台达港的作用与有关方面谈判	未
联合国成立数字金融工作小组  刘振民、井贤栋加入	未
联合国报告：2017年8.7万名女性被杀 近6成系亲友所为	未
联合国报告：2019年全球1亿多人口需人道主义援助	未
联合国推出ActNow聊天机器人：宣传气候变化	未
联合国教科文组织前总干事伊琳娜·博科娃访问暨大	未
联合国教科文组织驻华代表处考察蔡甸这些地方，看来有大发展！	未
联合国欲促缅甸解决罗兴亚问题 俄称草案不合时宜	未
联合国欲促缅甸解决罗兴亚问题，俄称该决议草案不合时宜	未
联合国毒品和犯罪问题办公室25日发布报告，称去年大约有8.7万名女性被杀，这其中约有5万人是被伴侣或者家庭成员杀害。	未
联合国气候会议：各国为经费和公报措辞艰苦谈判	未
【联合国气候变化大会】中方：须明确“共同但有区别”原则	未
联合国气候变化大会：倾听世界人民发出自己的声音	未
联合国气候变化大会发布新报告 强调发达国家实施气候行动的进展和差距	未
联合国气候变化大会：各缔约方通过《巴黎协定》实施细则	未
联合国气候变化大会在波兰召开 就《巴黎协定》实施细则进行谈判	未
联合国气候变化大会开幕 将就《巴黎协定》实施细则进行谈判	未
【联合国气候变化大会】马尔代夫代表：我们还不想走向死亡	未
联合国气候大会召开 世界多地民众游行反气候变化	未
联合国气候大会青年日：年轻人讲述自己的环保故事	未
联合国特使与胡塞武装会谈：希望将伤员送国外治疗	未
联合国特使：也门和谈双方就战俘交换达成一致　	未
联合国特使：也门和谈双方就战俘交换达成一致	未
联合国环境署署长请辞：两年花50万美元旅行，被指不低碳	未
联合国确定预算分摊比例 中国超日本升至第2联合国大会第五委员会（行政和预算）近日同意了2019年至2021年各成员国分摊联合国常规预算的新比例。上世纪80年代超越前苏联后一直稳居第二位的日本的分摊比例跌至第三，中国升至第二，该结果反映出了日本与中国的经济实力。联合国	未
联合国秘书长2018年消除对妇女的暴力行为国际日致辞	未
联合国秘书长准备会见沙特王储 讨论如何结束也门内战	未
联合国秘书长准备会见沙特王储，讨论如何结束也门内战	未
联合国秘书长叙利亚问题特使下周会晤俄伊土高官	未
联合国秘书长古特雷斯发言人：对黑海克里米亚半岛局势表示高度关注	未
联合国秘书长古特雷斯:对老布什去世深感悲痛	未
联合国秘书长呼吁俄乌保持克制 避免局势恶化	未
联合国秘书长呼吁俄乌保持克制避免局势恶化	未
联合国秘书长对美国履行《巴黎协定》表示乐观	未
联合国秘书长对黑海局势表示高度关注	未
联合国秘书长：防艾工作“处于十字路口”	未
联合国粮农组织：土壤污染加剧，危及食品和粮食安全观察	未
联合国观察员抵达也门监督停火 确保人道救援	未
联合国观察团先遣队抵达荷台达 监督也门政府和胡塞武装落实停火协议	未
联合国观察团先遣队抵达荷台达 监督停火	未
联合国观察团开始监督荷台达停火	未
联合国计划在2019年向9360万人提供人道主义援助	未
联合国通过决议支持也门和平协议	未
联合国通过“移民契约” 美国等10国拒签	未
联合国通过《移民问题全球契约》	未
联合国通过《移民问题全球契约》 中方回应	未
联合国部队证实黎巴嫩 - 以色列边界有隧道	未
联合国预算分摊中国超日本 ：升至第2该结果反映出了日本与中国的经济实力。日媒称，日本国内有人担忧，分摊率的下降将导致日本在联合国内的影响力降低。联合国正式决定预算分摊比例:中国超日本升至第二	未
联合国预算分摊中国超日本能力越大，责任越大	未
联合国驻黎巴嫩临时部队确定黎巴嫩与以色列边境存在地道据俄新社获取联合国驻黎巴嫩临时部队新闻处声明的复印件发布消息称，临时部队确定黎巴嫩和以色列边界存在地道。联合国驻黎巴嫩临时部队确定黎巴嫩与以色列边境存在地道	未
联合声明科学家刘会生：“基因编辑婴儿”后代永携改造基因	未
联合惩戒发威！江西这样狠治老赖！	未
联合执法队出动整治， quot小飞龙quot违法上路发现一辆查扣一辆昨天上午，市公安局交警支队巡特警支队城管等部门治非决胜非标电动(燃油)三四轮车路面整治联合执法实战拉练仪式启动，联合执法队走上街头，分头前往市中心太湖新城中央车站等进行小飞龙联合整治，截至中午全市共查扣小飞龙42辆。交警部门呼吁小飞龙驾驶人，在本月30日前尽早到全市5个置换点办理车辆回收置换手续。从明年开始，一经查获小飞龙将不仅收缴车辆，还要对驾驶人进行处罚。	未
联合整治！隆昌这个曾经的商业集散中心面貌正在改变	未
联合新闻[防弹少年团粉丝向金硕珍故乡果川市捐赠女性用品]3日，京畿道果川市接到防弹少年团粉丝quotARMYquot捐赠的价值600万韩元的344套女性用品.据悉，此次捐赠是为了庆祝故乡位于果川市的防弹少年团成员金硕珍12月4日的生日，以粉丝俱乐部上个月募集的600万韩元进行了此次捐赠.另外果川市 ...全文	未
联合早报：传刘强东欲以5000万美元与性侵女私下和解	未
联合早报：韩朝完成互检边防哨所拆除情况韩国国防部12日表示，韩朝军方当天结束对非军事区内试点拆除哨所情况进行的互检工作。韩联社报道，韩方检查组于当天上午9时许在军事分界线附近与朝方人员会合，随即在对方人员的带领下赴朝开展检查工作。在韩方结束检查后，朝方人员于下午2时许访韩检查，于下午4时53分许完成检查并越过军事分界线返回。国防部官员表示，韩方在现场检查了哨所内所有武器装备及兵力是否完全撤除监视口等地面设施是否拆除以及地下设施的拆除情况。下午朝方也以相同方式检查了韩方哨所拆除情况。这是韩朝自195	未
联合清理小区私家菜园20余处	未
联合调查组要求百度清理商业推广 禁超页面30%	未
联大主席：相信各方能就《巴黎协定》实施细则达成协议	未
联大正式通过《移民问题全球契约》	未
联大正式通过《移民问题全球契约》，美以等五国投了反对票	未
联大正式通过《移民问题全球契约》 美等5国反对	未
联大通过支持巴以“两国方案”的决议草案	未
联大通过《移民问题全球契约》美以等五国投反对票	未
联大通过《难民问题全球契约》	未
联大通过《难民问题全球契约》，美国、匈牙利投票反对	未
联姻触礁紧急叫停！小黄车与网贷平台牵手背后：押金与获客的算盘	未
联建光电：收到深圳证监局行政处罚决定书e公司快讯 e公司讯，联建光电(300269)12月20日晚间公告，收到深圳证监局的行政处罚决定书，公司信披违法案现已审理终结。经查，2014年至2016年，分时传媒共虚增营业收入约6178万元，虚增利润6047万元，导致联建光电相关财报存在虚假记载。深圳证监局决定对公司责令改正，给子警告，并处60万元罚款对何吉伦周昌文朱贤洲给予警告，并分别处30万元罚款对刘虎军褚伟晋等人给子警告，并处3到20万元不等罚款。 网页链接	未
联影展示人体“全息电影”：肉眼可见药物在人体流动代谢全程	未
联想S5Pro GT版就发布了我都来不及打字了，看图吧 北京联想总部（北京）园区	未
联想Z5 Pro 855版发布：全球首发12G内存，起售价仅2698元	未
联想Z5s发布1398元起售 Z5 Pro GT 855版同期发布	未
联想 Z5S 打孔屏手机 12 月 6 日发布这是摆明想抢三星和华为的风头	未
联想Z5官方自曝：搭载安卓9.0系统 “秒杀”MIUI	未
联想为什么不如华为了倪光南：联想路线走错了北京时间周日(12月23日)，第二十届北大光华新年论坛在北京举行，中国工程院院士倪光南出席并发表演讲。倪光南在演讲中表示，华为联想这30年来犹如龟兔赛跑，在1988-1995第一阶段，联想的技工贸胜过了华为的贸工技，在1995年，联想销售额67亿元，是华为的4.5倍。谈及联想和华为的差距，倪光南表示是路线问题。一方面，华为始终坚持研发投入，此外，华为股权对科技人员产生了激励。联想现在做得不好，一是因为路线不对，而是知识产权0股权对公司发展没有	未
联想你们员工@小狼叔DXB小狼叔DXB的主页 是不是要给他看一下心里医生毕竟孟女士一家工作这么多年在海外的房子价值都比不上@杨元庆杨总丰年时候一年的收入，真担心他哪天心里失衡拿刀子去捅杨总就不好了。看他自己上载照片有工卡，应该是@联想员工吧	未
联想公司的人就是这个素质	未
联想副总裁给雷军送生日祝福，为碰瓷小米致歉12月16日早晨6点钟，联想副总裁常程突然发布了一条庆生微博，表示：多有得罪，生日快乐。并@小米董事长雷军。当天是雷军49岁生日，常程借送祝福表达歉意。最近，联想为了宣传自己的新手机，官方发布了四张海报，每一张都在海报中挂出了小米8，宣发自己在各个方面专治小米8，进行碰瓷营销。	未
联想双12你的品智生活 不知道自己减的到底是肥还是水好奇你不在家时猫主子在干啥健忘星人出门总忘带钥匙怎么办今日份智能产品省钱快报已为您备好关注@智慧联想  转评赞本条微博，抽送智能插座一只！网页链接	未
联想常程：年初就已规划高端手机 5G手机暂无时间表	未
联想：截胡！挖孔屏的首发是我们的！	未
联想控股旗下金融控股公司正奇金融披露港股招股书	未
联想控股认购弘和仁爱8亿港元可换股债券	未
联想新机 Z5s 将于 12 月 6 日（后天）发布，不出意外就是全球首款挖孔全面屏机型了	未
联想方面找过来说那人去年已经离职。那么从他的照片来看他现在就是在滴滴了。不过考虑到他已经删帖我也就不再继续追究了	未
....@联想 的一直播（下载App-gt网页链接）	未
联手，你家娃的社保卡领了吗?洪洞这个银行半个多月领了6万余张...	未
联手出狠招！江西这样曝光让老赖无处遁形	未
联手地方国资 中青旅二度拟参与受让古北水镇股权	未
联手整改 南京餐饮店油烟环保信息将"挂牌"公示	未
联播快讯网络视听监管新规拟明年二月实施，黑河联通机房失火当地集体断网	未
“联盟MS-09”号飞船将于12月20日早返回地球	未
"联盟MS－11"飞船携3人飞赴国际空间站	未
联盟号宇宙飞船破洞成谜 俄宇航员太空采样解密	未
联盟快要失传的那些转身！科比虚晃转身投篮麦迪运一步转身投篮帕克旋转陀螺！ NBA吐槽大会	未
联盟担心浓眉学詹姆斯据知名记者扎克-洛维报道，联盟有些人担心浓眉哥会效法詹姆斯，选择签约短期而非长期合同。根据此前《露天看台体育》记者Eric Pincus报道，联盟不少球队高层普遍认为，阿眉会在2019-20赛季前被送到湖人或者凯尔特人。今天，知名记者洛维又更新了有关戴维斯去向的新动态。据他透露，联盟中有的人已开始担心戴维斯效法詹姆斯，选择签下1-2年的短期合同。只有到了某个年龄段，或者生涯的某个阶段，戴维斯才会选择签下长期合同。喂喂喂，这些都是眉有的事啊，你们不要湖说行吗！NBA吐槽大会	未
联盟第一防守球队，觉醒之后从未经历连败，三外线场均5.6抢断	未
联系上下文 查看图片	未
联系当时的背景可以理解，但今天还在信奉这一套，那才是中国必亡。//@白日妖鬼: 那时候国家快死了，文人这么想其实也情有可原。	未
联系方式公布！宿迁市委巡察组进驻五家单位开展巡察！	未
联赛复盘，欧冠抽签，再吹会牛，谈谈心@梁祥宇 的一直播（下载App-gt网页链接）	未
联赛杯曼城和莱斯特90分钟1-1战平，德布劳内破门，阿尔布莱顿扳平，点球大战莱斯特连续三罚不中，曼城3-1有惊无险进入下一轮！	未
联赛现在可能变得更容易了巴尔韦德：还有很多可以做的，差距并不重要。与其他球队相比，我们没有太大的优势。在这里获胜对我们来说很重要，但还有很多可以做的。	未
联运站后方铁路小区房屋出租！理工南苑坡火锅店转让！	未
联通与德国电信达成合作，中国企业可在欧洲部署物联网	未
联通史记 你见过当年拉光缆的照片吗1996年4月，安徽联通开始GSM130移动电话网的建设。第一条过长江光缆在安徽芜湖的成功敷设，实现了千里天堑一线牵。戳图感受下当时的艰苦施工条件改革开放40周年	未
联通各地天网覆盖鱼米之乡为实现微山湖水乡视频监控全覆盖，近日，山东微山联通承建了微山湖区第二期天网工程。2013年建成的第一期天网工程有2300个监控点，打造了鱼米之乡安全环境，运行以来深得湖区人民的称赞。第二期天网工程在原有基础上再增加多个高清视频图像采集点，包括终端设备网络支撑数据存储网络安全应用系统公安机房等。山东微山联通组织专家力量和施工队伍，克服湖面沼泽河叉堤坝等建设困难，为湖上微山岛南阳岛以及湖中的高楼张楼西平赵庙昭阳等渔村增加监控点11	未
联通政务云：让信息跑路代替群众跑腿	未
联邦司法部发言人麦克莱奥德Ian McLeod：孟女士持中国护照过境加拿大，在温哥华机场被拘捕孟女士是中国国籍，质疑的都退散吧	未
联采办：“4+7”药品带量采购拟中选价平均降幅达52%	未
联钢几乎做到零排放（视频）	未
联黎部队呼吁黎以双方避免采取单边行动	未
联黎部队证实黎巴嫩南部与以色列边境有4条地道	未
聚乡情，汇人才，泰兴人在西安有了一个共同的新家	未
聚会就用的上了	未
聚会撒面粉有风险！这些防火知识要知道	未
聚会问借钱，借唔到仲蚀晒本！	未
聚力文化 董事长余海峰尚未增持	未
聚勒近距离射门打高，随后基米希一次近在咫尺的头球攻门也被莱比锡门将不可思议的扑出	未
聚散无常，别来无恙原圖 戳 坪 收	未
聚焦122《闫知有理》之一：车内摆件 隐患重重	未
聚焦122《闫知有理》之四：车撞人与人撞车都跟它有关！	未
聚焦  2018年全国游泳救生员教师培训班的通知	未
聚焦2019年放假通知来了！五一小长假没了	未
聚焦！5年后的这家医生集团长啥样	未
聚焦YouTube免费生意要怎么做	未
聚焦  一周新闻概览	未
聚焦一周新闻概览	未
聚焦一堂一队一传播 增进文明修养	未
《聚焦三农》大曝光 捐衣箱里猫腻多	未
聚焦三轮车，请自觉退出城市舞台	未
聚焦上杭县委领导分工有调整，看看你单位是哪位领导分管	未
聚焦上杭要对机关干部这6大作风问题进行重点整治，请全社会给予监督！	未
聚焦  东坝创卫那些事儿	未
聚焦两高下发《决定》：上调恶意透支型信用卡诈骗罪定罪量刑标准	未
聚焦丨2018年G20峰会	未
