男孩弑母后被释放 学生家长反对其返校：怕他又犯事	未
男孩患白血病370天花掉210万，移植后变黑人12月6日，濮阳17岁高中生张文政从入院到现在，已有370天没认真看过窗外世界了，在这370天里，他由黄种人突然变成全身黝黑的黑人，他的左眼再也看不见这个世界的任何色彩如今，张文政每天的治疗费少则两万，多则四五万，若停止治疗，后果不堪设 ...全文	未
男孩患白血病370天花掉210万，移植后变黑人12月6日，濮阳17岁高中生张文政从入院到现在，已有370天没认真看过窗外世界了，在这370天里，他由黄种人突然变成全身黝黑的黑人，他的左眼再也看不见这个世界的任何色彩。如今，张文政每天的治疗费少则两万，多则四五万，若停止治疗，后果不堪设想。目前一家依然在坚持，爸爸：只要还有一丝希望，我们就不会放弃。	未
男孩校门口丢自行车 竟在一辆大巴行李箱里找到了邹女士和儿子来到学校门口将自行车停放在了人行道边上的停车区域后便离开去办事过了一会儿，一辆大巴士悄然停在了路边，从车上下来一名中年男子，他在自行车旁来回转悠，并不停环顾四周发现四下无人后，男子打开了大巴行李厢的侧门，直接把 ...全文	未
男孩求救后突然挂断电话 真相：拨打110吓同学	未
男孩玩游戏找不到笔用狗爪当触控笔 狗子表情亮了	未
男孩留学2年败光200万 22岁哈尔滨男生弃学成巨婴：吃饭要喂哈尔滨刘女士与丈夫离婚，儿子与奶奶一起生活，从小性格孤僻。高中时，刘女士将其送到国外，两年最少花了200万，却连预科毕业证都无法取得。回国后也天天在家玩游戏，吃饭都是奶奶送到跟前，甚至一口口喂。（人民网）	未
男孩突发疾病晕倒街头 警民联手救援送医救治	未
[男孩] 约1978年5月出生十几天后从陕西省铜川宜君县蔡家庄大队抱养到山东菏泽的肖进东寻亲	未
男孩贪玩爬火车被卡住，从浙江卡到上海11月25日下午四点多，南翔铁路段货运列车的工作人员在巡视时，发现有一名男孩身体被卡在车体与车内存储容器附属的梯子中间，胸腔处被挤压，已经出现呼吸困难说不出话来的情况，十分危急。于是立即向消防部门求助，消防队员到场后通过破拆，成功将男孩救出。经检查，男孩身体没有大碍。据了解，男孩姓饶，今年15岁，当天他从嘉善站攀爬至这列火车的车厢内，由于身体被卡住脱不了身，就一路随车来到南翔。目前，铁路公安已经将男孩送至嘉定区救助站，救助站表示已经联系到了孩子家属，近期会送他回	未
男孩赌气爬70米高压线塔 怎么上去的？	未
男孩问女孩：你为什么不高兴 女孩说：你管我我高兴！	未
男怕入错行，女怕嫁错郎。	未
男性不育弱精少精不只会影响生育，更可怕的是	未
[男性] 寻找1975年出生2018年失踪广东省佛山市南海区狮山镇湖景湾花园刘国卫	未
男性，无论什么时候都克制不住无实物投篮的生物	未
男性骑士和女骑士谁更败家	未
男护士高就业率引关注 为什么社会需要男护士	未
男排体罚 排超联赛八一男排主教练在球队输球后体罚队员在体育圈炸了锅，而在一天过后对于该事件的进展处理处罚声明却毫无消息。事件主人公八一男排主帅陈方和被体罚队员袁党毅皆未发声，不过这不能阻挡网友讨论的热情。网友喊话八一男排主帅下课真是输球又输人，这教练还留着干嘛，据说队员事后都被救护车拉走了明摆着教练用球打人了，还有递球的那个也还是人拖着车递这么快真是输球又输人，这教练还留着干嘛，据说队员事后都被救护车拉走了陈方必须下课，这是一名党员，一名军人，一名教练该做出来的事	未
男排体罚 男排几辈子上一回热搜，还是这种新闻。哎！	未
男排体罚 这游戏太有意思了吧 微博视频	未
男教师在学校公共浴室偷拍女老师洗澡，长达一年！调查后	未
男教师夜闯女教师宿舍欲猥亵 校方不处理反还晋升	未
男教师竟在学校公共浴室安装摄像头！偷拍的代价真有这么低	未
男旅客裤内有一坨屎！海关一烧惊见价值2.8万金浆印度德里国际机场日前安检时，发现一名从杜拜来的男性旅客的裤子内夹黏了一坨大便，整条屎看起来浓稠恶心，海关进一步查验这条深黄色糊状的物体，发现这根本不是人类的大便，而是价值约2万871美元的真黄金。	未
男旅客裤内有一坨屎！海关一烧惊见价值2.8万「金浆」印度德里国际机场日前安检时，发现一名从杜拜来的男性旅客的裤子内夹黏了一坨大便，整条屎看起来浓稠恶心，海关进一步查验这条深黄色糊状的物体，发现这根本不是人类的大便，而是约650公克的「金浆」，整条价值2万871美元的真正黄金。 ETtoday新闻云 报导：网页链接 (agent)	未
男旅客裤内有一坨屎！海关一烧惊见价值2.8万金浆印度德里国际机场日前安检时，发现一名从杜拜来的男性旅客的裤子内夹黏了一坨大便，整条屎看起来浓稠恶心，海关进一步查验这条深黄色糊状的物体，发现这根本不是人类的大便，而是约650公克的金浆，整条价值2万871美元的真正黄金  ...全文	未
男旅客裤内有一坨屎！海关一烧惊见价值2.8万「金浆」印度德里国际机场日前安检时，发现一名从杜拜来的男性旅客的裤子内夹黏了一坨大便，整条屎看起来浓稠恶心，海关进一步查验这条深黄色糊状的物体，发现这根本不是人类的大便，而是约650公克的「金浆」，整条价值2万871美元的真正黄金。报导：网页链接	未
男更衣室装监控头 负责人：备案过，只有男更衣室有，女更衣室没有杭州爆料 据@西湖之声 网友吐槽：前几天跟朋友去浴乐汤去洗澡，更衣室里面有一排监控！换衣服的地方，进澡堂肯定要脱光的！我们进去的时候，并没有告知我们里面有监控。酒店方负责人表示：监控摄像头是非常非常明显的。只有在男更衣室有，女更衣室没有的。监控只有派出所才能调，其他人无权，包括总经理。是只作为公安报备的一个安全防盗措施。更衣室设监控头，是否合适是否涉嫌侵犯个人隐私对此，你想说____ 城市V聚力	未
男朋友在网上搜了一下口腔溃疡的病因后，就要和我分手	未
男朋友嫌你太作懂得分手的真实缘由，才能挽回败局！	未
《男朋友》宋慧乔-朴宝剑，海边相遇公开相反的表情引发好奇(GETITK)	未
男朋友宠你能宠到什么程度一到十级你是哪个	未
男朋友有口臭，每次KISS都想分手，怎么办在线等！！！	未
男朋友用手机全景功能给我拍照，看到照片后我哭了......	未
男朋友的地位果然不可撼动！ 没毛病每日笑话微博	未
男朋友的拍摄视角没错了！	未
男朋友看你化妆的时候！直男对化妆的理解 哈哈真想知道你们是怎么找到女朋友的	未
男朋友睡觉打呼怎么办 里贝里的妻子清楚国王打不打呼，阿拉巴估计也知道	未
《男朋友》第5集：宋慧乔朴宝剑大胆认爱却备受阻挠（图）(图)	未
《男朋友》第七集：替罪羊朴宝剑调任离开 宋慧乔将如何应对【组图】(图)	未
《男朋友》：请了宋慧乔+朴宝剑，却只演了个风光片？	未
《男朋友》：这份憋屈的爱情，女观众很难吃下	未
男朋友连化妆品都会挑告诉你男朋友，化妆品不懂可以问，别瞎用行吗！	未
男朋友追我的时候挺诚心，被他追到手之后才发现他欠了很多钱，现在平时都是我花钱	未
男朋友长相丑到扎心是什么感受	未
男模Lee	未
男模在此	未
男生与男生之间到底能有多甜简直太tm可怕了啊啊啊啊！	未
男生卧铺车上2次手伸女孩被窝:我是学生 不是故意的在大连到郑州的T369次列车上，一男子2次把手伸进对铺女孩被窝里猥亵。女生找乘警求助，男子一直称自己是学生，并不是故意的。女孩说，车上几个阿姨还劝她，说传出去名声不好，让她算了吧。你们怎么看	未
男生和女生睡觉翻身的区别！	未
男生因抓不到娃娃怒开2家抓娃娃店，月入近3万	未
男生必知女生发的朋友圈到底什么意思	未
男生怎么看待追自己的女生搞笑	未
男生撞衫后 VS 女生撞衫后：	未
男生用38只活蟑螂拼成“I love U”告白被拒(图)	未
男生疑求爱被拒 凌晨剪断防盗栏潜入杀害高中宿舍女生	未
男生的乳房越来越大 不料却和女友用的这东西有关	未
男生的正常操作不都是脱下来先闻闻么	未
男生要和你分手的十个征兆	未
男生过了25岁以后那个就慢慢不行了嘛	未
男的怎么想的我不清楚，女的怎么想的我也不清楚。果然是人以群分。	未
男的打女的一定是因为女的活该//@吹响笛:女的打男的一定是因为男的活该	未
男的比女的美女的比男的帅简直太tm可怕了啊啊啊啊！	未
男盗女娼。	未
男硕士在面馆伸手摸女孩臀部 被女孩抡起凳子打	未
男科疾病冬季，警惕这些男科疾病找上门	未
男童公交车上发病，司机一声吼：闯红灯行不40名乘客：闯！15日，重庆阿姨抱着发烧的2岁孩子乘公交去医院。行驶到某路口等红灯时，男孩突然瘫倒，不停抽搐。司机廖方利大吼：我要闯红灯，得行不车上约40名乘客回答有些齐：闯！男孩被及时送医治疗。（重庆晨报）	未
男童在地铁上抢夺陌生乘客蛋卷 家长：吃完再要上周，重庆的程小姐在地铁时，一七八岁模样的男孩突然伸手抓扯她手里的蛋卷，你给我，我要吃。程小姐有点害怕就给了蛋卷。但孩子大人在一旁不仅没有管，反而让孩子吃完了再要。 要是你碰到了，会怎么办	未
男童手指被戒指“咬”住 云南禄丰消防为其做“手术”	未
男童摸女老师咪咪，该不该挨揍	未
男童玩射钉枪误杀表妹 宝田村村民庞先生告诉记者，已听闻此事件。小女孩的父母都出门打工了，家里主要是老人在照顾，老人以务农为生。庞先生称，平时孩子就在村里的小学上学，事发当天是周末。我们也不知道为什么老人家里有这个改装的射钉枪，平时也没听说村里有人用这个。	未
男童被一脚踹下滑梯，肇事家长抱熊孩子就跑！	未
男童被店门口肉钩刺伤 老板喊冤：让你来了吗？	未
男童贪玩走失 西华民警爱心救助	未
男童遭同学扔飞盘脱裤霸凌 老师拍视频笑他假哭	未
男童饭量大成重要线索 民警朋友圈助熊孩子寻亲近日一封派出所发布的寻人启事火了：熊孩子，爱吃肉，饭量大，速认领一名男孩与父母走失被带到派出所，孩子说不出家长的电话和地址唯一的特点是能吃！这样的特征竟然还把孩子找到了走丢的原因更让人哭笑不得男童饭量大成重要线索 民警朋友圈助熊孩子寻亲	未
男篮世预赛中叙之战：吴前三分开挂，阿联上演暴扣	未
男篮世预赛中黎之战：郭艾伦送妙传阿联统治篮下	未
男粉丝怎么办	未
男粉有多拼来看看这位哈登球迷	未
男粉有多拼这个话题让胖虎突然想到CJ现场小熊和墨宝身边围绕着里三圈外三圈的男粉辣是真的疯狂，胖虎根本无法挤进去	未
男网友见面后送女子回家，途中她突然尖叫：放我下车！	未
男网友进来相亲	未
男辅导员突击检查女生寝室，可我还没穿衣服	未
男闺蜜半夜闯进女子房间，还捂住她的嘴！原因让人哭笑不得…	未
男青年玩火烧了自家客厅 楼上邻居忙报警 (图)	未
//@町弟噹導: //@YOGA想去故宫养胖达:找不到需要再开一次颅骨 看到这里坐不住了	未
//@町弟噹導: [给你小心心]	未
//@-町盯叮丁-:绝望//@NIieechi:叹为观止	未
画一些女孩 （作者：@番薯唛 ）	未
画中的特警梦	未
画像40年丨杨生玉：高考改变了我的命运	未
画册长这样 查看图片	未
//@画家刘云水: 早知如此何必当初，憋坏了老实在家呆着吧！//@侯宁://@牛市sky: 看了下评论//@小浪://@Khvarenah:2009年5月19日凌晨，警方接到举报，朝阳区Co	未
画家唐志冈：一个“不长大”的艺术家的叛逆史	未
画家妈妈给女儿画速写，出生九个多月画了200多幅	未
画家林墉：不能画画生命就失去意义	未
//@画画的张旺://@楚惜刀://@万事风过耳: 卧槽！！//@喝莲子羹降鸡血马甲://@铃木Inuki ://@山崎夏_ : //@阿九九哈哈哈哈 :太可怕了	未
画者要自甘寂寞	未
“画说”四十年(图)	未
画说艾滋病那些事儿	未
画说重大 风吹动的落叶飘过眼梢，黑板上的白字一笔一划深秋悄悄说了再见，冬日不初新，搓暖着手掌等待来年春日一分一秒，在校园的不同角落中溜过但愿这每分每秒，尽是重大留给你的，独一无二的美好（动图by戴思佳  宋智霖 付雨琪）	未
畅想一下十年后，我们会有什么新的出行方式	未
畅游京津冀！这个冬天，是时候来一场泡汤之旅啦	未
畅游宿迁宿迁雨夜 摄影：是名字都重复	未
畅游宿迁温泉滑雪大马戏如果有人再问你，这个冬天到宿迁怎么玩，就把这条微信甩给ta！带着微博去宿迁@畅游宿迁@宿迁文旅@江苏项王故里景区@江苏三台山国家森林公园@泗洪洪泽湖湿地景区	未
畅游宿迁湿地的鸟儿	未
畅缘晋城今晚ktv交友，仅剩2个名额！	未
畅通武汉12月1日起，地铁阳逻线末班车收班时间延后半小时延时后，地铁阳逻线工作日（周一至周五）运营时间为6:00至22:00，双休日（周六周日）运营时间为6:30至22:00。末班车发车时间方面，往后湖大道方向的末班车21:00自金台站发出，抵达后湖大道站的时间为21:47往金台方向的末班车22:00自后湖大道站发出，抵达金台站的时间为22:46。行车组织安排方面，地铁阳逻线工作日早晚高峰最短行车间隔为6.7分钟双休日高峰时段最短行车间隔为8.4分钟。	未
畅通武汉15日起三环线部分路段维修改造，交管：请合理规划出行线路13日，从武汉市公安交管部门获悉，2018年12月15日起，三环线友谊大道立交鲁磨立交匝道将进行第三阶段路面维修改造，届时该两座立交的部分匝道禁止机动车通行。武汉交警发布绕行建议，提醒广大驾车出行市民，注意禁行区域及时间，合理规划出行线路。	未
畅通武汉 今天明天和后天地铁7号线和2号线（含机场线）将临时调整行车方案取消大小交路套跑所有列车都能开往终点去野芷湖和机场的小伙伴不用担心坐错车了 今起3天，地铁2号线7号线出行有新变化	未
畅通武汉 巡查组督办催生高速公交，80台新车年内在292路231路上线运营近日，不少网民在长江网武汉城市留言板上投诉，原通行岱黄高速公路福银高速公路武汉阳逻长江大桥多年的公交292路和231路改线，站点改变通行时间延长，使往返于新城区和中心城区的居民出行极为不便。11月初，巡查组与市交委分管领导及相关部门负责人商谈解决方案。目前，据市交委反馈的最新消息，新车采购已完成，80台公路版公交客车日前已经到汉，新车为更加环保的天然气车，在高速公路上的运营时速最高可达到100公里/小时对相关司	未
畅通武汉配合白云路排水工程施工，武汉11条公交线路中途走向调整从市公交办获悉，为配合洪山区白云路排水工程施工，根据道路交通管制要求，尽可能方便市民出行，从12月8日起，公交297路382路等11条公交线路的中途走向将临时调整。配合白云路排水工程施工，武汉11条公交线路中途走向调整	未
界头的群众看这里，谁是你的派出所所长谁是你的社区民警都在这里	未
界最短航班：不到3公里只飞47秒	未
界江波涛和边关黑土，这是老兵退伍回乡的行李在寒意渐重的时节，高山海岛大漠边陲的座座军营里，一场场送别讲述着边关老兵的离愁别绪。几年前，他们从家乡来到遥远边疆献身国防。如今他们回望边关，才知道曾经的远方也变成了家，家的名字叫边疆。（刘建伟迟博） 界江波涛和边关黑土，这是老兵退伍回乡的行李	未
界面回望2018转发锦鲤，当社会人，广告主争夺流量的7种新尝试2018年的一个趋势是，那些真正被大众所熟知甚至引发跟风效仿的营销事件，或许并不在于创意有多精巧故事多么复杂，而在于对人性的巧妙洞察，当然也不乏一些铤而走险的尝试。回望2018 转发锦鲤，当社会人，广告主争夺流量的7种新尝试	未
//@界面文化:如果说雇主和保姆的关系具有着坚固的内在的不平等性，那么保姆们是否有机会在这种不平等的关系和鄙视链条中获得自身的权力，甚至反转整个权力关系呢当这一刻到来，除了《温柔之歌》那样血腥悲剧的结局，这些保姆去向了何处	未
界首：100多万斤萝卜要烂在地里，送你20斤来不来	未
界首一工地：小伙爬上30多米高的塔吊！欲寻短见	未
界首今年的雪已经在路上了，到达日期就在...	未
界首公安局：一场属于警察的盛会，竟然有人流泪	未
界首农村已失传的老手艺，30岁以下都没见过...	未
界首发生交通事故，驾驶车辆竟然逃离现场，结果...（视频）	未
界首各村42岁以上的，2019年就要面对现实了！	未
界首大型安置区获批复！有你家吗	未
界首打工者注意：送你一份讨薪维权攻略！	未
界首未来6天停电信息，范围大，快看可有你家扩散告知	未
界首沙河南边上新闻了！可有你认识的	未
界首这个村拆迁安置方案已公示！是你家吗安置房确定！	未
界首这是哪庄的女子要账，说的太牛！	未
畏惧不允许我这样做//@离城的真实:不愧是战斗民族	未
留一些骄傲与心疼给自己	未
留一句话吧	未
留七分正经以度生，留三分痴呆以防死	未
留七分正经以度生，留三分痴呆以防死。陈继儒《小窗幽记》	未
留下qq号后两位	未
“留下一支带不走的医疗队伍”	未
留下你QQ号的后三位，看看哪两个QQ无意在这里成了情侣号！	未
留下你们手机尾号最后4位数一毛一样的互关交朋友啦长春微视点	未
留下你名字的缩写，相同的互粉互聊旅行君的是wrg 你是什么	未
留下你姓名的数字键 让别人猜一下你叫啥	未
留下你电话号码的后3位 看没有跟你一样的亲故	未
留下你的qq号后三位	未
留下你的QQ号后三位，看哪两个的QQ在无意间成了情侣号吧	未
留下你的姓，别人给你取一个古风名字	未
留下你的姓名拼音的首字母，看看评论会叫你什么___________	未
留下你的姓名拼音缩写，让大家给你起个沙雕名字。例如我的：ZZX	未
留下你的姓名缩写，让别人来猜猜你的名字	未
留下你的姓氏，其他人来说说你看这个姓第一个想到谁	未
留下你的姓氏，让大家为你起一个土味名字	未
留下你的姓，让别人给你取个古风名字。	未
留下你的姓，让网友给你起一个沙雕的名字_____________。	未
留下你的生日	未
留下你的生日日期，如果遇到一样的互相关注互相认识一下	未
留下你的生日，相同的交个朋友吧。	未
留下你的自拍，网友们假装杠精在评论里杠一下	未
留下地址	未
留下姓名的缩写，看评论会叫你什么	未
“留下就是最好的协议”——“留欧派”英国民众集会呼吁取消“脱欧”协议	未
留下来的不一定都是精英，有可能是马屁精！这个社会水太深！	未
留作技术储备苏-57为何如此多难晨枫：俄罗斯苏-57为何如此多难 尽管已经签约的批量只是象征性的2架，有说法第一批最终有可能达到12架甚至15架，首批的其他飞机将在未来几年里签约。在更早的6月30日，俄罗斯副总理尤里鲍里索夫宣称：苏-35是今天世界上最先进的战斗机之一，所以没有必要加 ...全文	未
//@留几手:李阳老师，这条微博仅仅是拿您家庭暴力事件举个例子，性生活部分确实属于揣测，如有冒犯，向您表示道歉//@李阳疯狂英语 : 你特么咋知道我没性生活	未
留园网论坛里一位老同志的帖子	未
留在人间的光明，泗县这位老人捐献眼角膜遗爱人间	未
留在深圳的一千个理由，这些想不到的数据告诉你真相	未
“留声40年”主题列车、地铁站现京杭 	未
留声四十年：那些改变你我的故事	未
留存灵璧城关镇经委干部朱洪流。	未
留学2年败光200万，22岁哈市男孩弃学成巨婴22岁的晨宇则成了全家最大的愁事从小性格孤僻，不愿与人交流18岁出国留学，两年败光200万元却连预科都没毕业回国后到大专院校求学，不到两个月就弃学回家与游戏为伴，吃饭都是奶奶送到跟前，甚至一口口喂仅剩下的交流就是向家人要钱 ...全文	未
留学2年败光200万 22岁巨婴留学生 败光200万吃饭还要奶奶喂哈尔滨刘女士与丈夫离婚，儿子与奶奶一起生活，从小性格孤僻。高中时，刘女士将其送到国外，两年最少花了200万，却连预科毕业证都无法取得。回国后也天天在家玩游戏，吃饭都是奶奶送到跟前，甚至一口口喂。（新晚报）22岁留学生弃学回家成巨婴：吃饭要奶奶一口一口喂	未
留学2年败光200万22岁男生吃饭要靠喂哈尔滨刘女士与丈夫离婚，儿子与奶奶一起生活，从小性格孤僻。高中时，刘女士将其送到国外，两年最少花了200万，却连预科毕业证都无法取得。回国后也天天在家玩游戏，吃饭都是奶奶送到跟前，甚至一口口喂。（新晚报）22岁哈尔滨男孩留学两年败光200万，失去了与人交流的能力查看图片	未
留学2年败光200万 22岁男生弃学成巨婴：吃饭要喂22岁，正值青春韶华。可对于家人而言，22岁的晨宇却成了全家最大的愁事从小性格孤僻，不愿与人交流18岁出国留学，两年败光200万元却连预科都没毕业回国后到大专院校求学，不到两个月就弃学回家与游戏为伴，仅剩下的交流就是向家人要钱留学2年败光200万 22岁男生弃学成巨婴：吃饭要喂	未
留学2年败光200万 22岁男生弃学成巨婴：吃饭要喂哈尔滨刘女士与丈夫离婚，儿子与奶奶一起生活，从小性格孤僻。高中时，刘女士将其送到国外，两年最少花了200万，却连预科毕业证都无法取得。回国后也天天在家玩游戏，吃饭都是奶奶送到跟前，甚至一口口喂。（新晚报）	未
留学2年败光200万 22岁男生弃学成巨婴：吃饭要喂哈尔滨刘女士与丈夫离婚，儿子与奶奶一起生活，从小性格孤僻高中时，刘女士将其送到国外，两年最少花了200万，却连预科毕业证都无法取得回国后也天天在家玩游戏，吃饭都是奶奶送到跟前，甚至一口口喂（新晚报）	未
留学2年败光200万 22岁男生弃学成巨婴：吃饭要喂哈尔滨刘女士与丈夫离婚，儿子与奶奶一起生活，从小性格孤僻。高中时，刘女士将其送到国外，两年最少花了200万，却连预科毕业证都无法取得。回国后也天天在家玩游戏，吃饭都是奶奶送到跟前，甚至一口口喂。（新晚报）22岁哈尔滨男孩留学两年败光200万，失去了与人交流的能力	未
留学2年败光200万 22岁男生弃学成巨婴：吃饭要喂哈尔滨刘女士与丈夫离婚，儿子与奶奶一起生活，从小性格孤僻高中时，刘女士将其送到国外，两年最少花了200万，却连预科毕业证都无法取得回国后也天天在家玩游戏，吃饭都是奶奶送到跟前，甚至一口口喂（新晚报）22岁哈尔滨男孩留学两年败光200万，失去了与人交流的能力	未
留学2年败光200万，22岁男生弃学成巨婴：吃饭要喂！哈尔滨刘女士与丈夫离婚，儿子与奶奶一起生活，从小性格孤僻。高中时，刘女士将其送到国外，两年最少花了200万，却连预科毕业证都无法取得。回国后也天天在家玩游戏，吃饭都是奶奶送到跟前，甚至一口口喂。（新晚报）22岁哈尔滨男孩留学两年败光200万，失去了与人交流的能力	未
留学2年败光200万，22岁男生弃学成巨婴：吃饭要喂！哈尔滨刘女士与丈夫离婚，儿子与奶奶一起生活，从小性格孤僻高中时，刘女士将其送到国外，两年最少花了200万，却连预科毕业证都无法取得回国后也天天在家玩游戏，吃饭都是奶奶送到跟前，甚至一口口喂（新晚报）22岁哈尔滨男孩留学两年败光200万，失去了与人交流的能力	未
