老詹和老司机	未
老詹最后还补了一句：我刚才是不是把伦纳德漏了把他也加上，明年他就是自由球员了。我咋觉得，老詹前面那些人都是说着玩的，最后才是认真的呢	未
老詹点赞了BR发的图，圣诞礼物，你想要啥，图上写的老詹想要湖人交易浓眉，老詹点赞了nba吐槽大会	未
老詹爆扣四连拍	未
老詹说，要是浓眉能来我湖的话，那也太不可思议了，如果真能搞来浓眉，也太令人难以置信了 ps：这是老詹这场比赛前说的，大家不要想多了，眉有的事，不要湖想	未
老詹赛后晒图，同时三双很棒 NBA吐槽大会	未
老记者眼里的中国改革开放40年：总有写不完的大新闻	未
老许：冬日里的秋香	未
老话20句：不做中人不做保，一生一世无烦恼	未
老话有时候蛮有道理的，比如有情，无义	未
老话讲：老虎舔一下，一块皮掉下，是真的吗看完懂了！	未
老谭电商 20-60岁，人生差距怎么拉开的马云一席话，残酷而真实马云的故事大家听的太多了，比如他去肯德基面试，24个人里只有他一个没有通过。之后的奋斗之路也都并不顺畅。是不是和现在很多迷茫的年轻人有点像呢所以，深有感触的马云会经常在演讲中给年轻人一些建议，希望他们能够少走些弯路。 20-60岁，人生差距怎么拉开的马云一席话，残酷而真实	未
老谭电商 傅盛：如何用沟通解决80的工作问题一个CEO的几条沟通建议工作中80的问题都是沟通造成的。绝大部分工作问题，不来自于技能本身，而来自于沟通。沟通的本质，不是你说了什么，而是别人听懂了什么。但问题是，你怎么确认对方听懂了沟通真的太难了。 傅盛：如何用沟通解决80的工作问题一个CEO的几条沟通建议	未
老赖吕勇他是全国最有名的老赖吗南京政协委员吕勇的经济纠纷案之一，赖工程款480万辛苦钱：材料费，人工工资，机械费等，反而想倒过来向工程公司要50万。是不是奇葩胆大原文转自中国裁判文书网。网页链接吕勇涉经济纠纷十几起，金额从几百万，几千万，几亿不等，共同的特征是欠钱不还，最牛	未
老赖吕勇的公司图谱老赖吕勇成立了新的集团公司若航工业技术有限公司	未
老赖吕勇老赖吕勇拿地能力商界无人能及，跟腐败市长缪瑞林有没有关联	未
老赖哪里逃！合肥市中院首次发布打击拒执白皮书	未
老赖强占房屋9年，养11条恶犬壮胆，法警用麻醉枪开路腾屋	未
老赖强硬抱团网贷催收难，出借人上阵能否破局	未
老赖，我想对你说	未
老赖撒泼耍赖！被抓现场画面太解气！附独家视频！	未
老赖欠21万拖10年，见了手铐大喊我要还钱	未
老赖，欠下的是钱，可摧毁的是市场规则	未
老赖耍赖高招，男的装病，女的玩儿失联，结果	未
“老赖”难再“躲猫猫” 云南高院全力解决执行难	未
老赖黑名单上城市头条	未
老赵下午发微信给我说：下雪了。我去窗户看了眼，回复：毛毛雪，你那里下的大吗他说：我们隔得很远吗，还你那里。我：你离开我超过十米我就觉得很远。他：太肉麻了，你别和我说话了。	未
//@老赵:查查他的俄罗斯背景 //@时蝇喜箭:厉害了	未
老赵说，要是我当面抓到他抽烟，罚100元，没有当面抓到，闻到烟味罚50元。刚才回来看到卫生间有一盒烟和一个打火机，卫生间的门还关着，这能不能罚钱@赵先生与西瓜皮的故事	未
老远的地方来了一群重要客人，给咱枣小传经送宝！	未
老道消息被封很正常，知道这个消息的时候我一点都不惊讶，当然并不是我赞同被封啊，我是说看老道那个尺度，我就一直纳闷咋还没被封，在网上时间长了，对尺度每个人还是有感知的是吧。再比如像那谁谁，还没被封我也挺奇怪的，当然我不希望他被封，但是被封我觉得太正常了。	未
老郑看漳州漳州南山威惠庙罕见千年珠鳖古树古井传奇	未
老金和他的挂历小店	未
老铁们为@小土大橙子拉票吧知道大家不差钱，不过系统有随机的几毛钱红包发V影响力峰会gtgt和我去见大V吧	未
老铁们，你觉得国足在亚洲杯能走多远	未
老铁们，打开zfb首页搜索8729170，这两天红包越来越大了，够咱们一起吃顿肉了。	未
老铁这你们觉得小象纹身怎么样	未
“老长沙”泡澡，有擦背的有修脚的	未
老阿姨之间的聚会	未
//@老阿姨在看着你:原来动态看是这样的	未
老陈的橙子已卖了近3000斤	未
老马招你了 查看图片 //@中国BOY-Hans:我没有骗你啊 查看图片 //@我是怪异君:猩机boy//@中国BOY-Hans:要在里面发自己的裸照，要不然你的超级话题会消失	未
//@老马自奋蹄:转发微博	未
//@老马自奋蹄://@通信王峰: 转发微博	未
老马训小马，小马横马槽。害群非你我，万马知路遥。	未
老骗局又卷土重来，你准备好接招了吗	未
老高电商俱乐部 复盘2018 洞见2019上海耐威克宠物用品有限公司创始人 黄华隆，分享主题：电商红利消失后我们的核心竞争力在哪里分享内容：1从大促反映出很多问题，例如获客成本越来越高流量越来越少电商品牌生命周期短等等。2电商红利期已过，我们应该如何应对首先，要静下来，人生 ...全文	未
老高电商报 12月14日电商晚报简讯 阿里与山东省商务厅签订合作备忘录，将建新型农村电商生态体系交通部回应1月5日物流停运：谣言三类家电产品抽查不合格 空气净化器检出率超30华为事件殃及加拿大鹅 股价蒸发80亿星巴克与天猫合作加码 会员体系全面打通... 老高电商报 12月14日电商晚报简讯	未
《老高电商报 12月19日电商晚报简讯》 1万家工厂接受改造 淘宝要做制造商合伙人天猫新增生鲜虹鳟行业标准，12月25日生效台积电创办人张忠谋:台湾市场太小了 很难出现独角兽森马拟1.22亿元转让韩国电商ISE20股权临近考研，淘宝搜索指数同比增长105... 老高电商报 12月19日电商晚报简讯	未
老高电商报 12月20日电商早报简讯二次元商业化 淘宝联谊B站深耕内容电商屈臣氏关闭天猫京东海外旗舰店，或将抛弃海外业务1688商人节收官:不到9小时交易额超去年全天京东到家否认裁员：项目调整，员工可内部转岗ofo创始人戴威发全员信：为欠的每一分钱负责，勇敢活下去  ...全文	未
老鸦岭记事二十五代窑，明珠蒙尘	未
老鸦岭记事二十六古庙惊梦	未
老鸨（卖淫培训师）应定何罪	未
老鹰的扎克-厄茨和妻子朱莉撒狗粮体坛百咖秀	未
老黄家境很好的，隔壁按摩店就差点	未
老黑商场偷东西被抓，中国女友：你们没权利抓他！	未
老黑辛苦了！	未
老鼠：mmp	未
老鼠：你怎么回事啊小老弟//@冷知酱:怎么啥都敢吃啊哈哈哈哈哈哈哈//@農呋:我去哈哈哈哈哈哈哈//@颜文字君:?(_?怎么还跟老鼠抢吃的//@张奶霞:又好笑又心疼//@高小里Maaya:哈哈哈哈哈哈哈哈血惨	未
老鼠：你是魔鬼吗，能不能来个痛快的。	未
老鼠：兄弟，来个痛快的。	未
老鼠:士可杀不可辱。。。 微博视频	未
老鼠很怕它，把它放墙角，老鼠来一只逮一只，家里再也没有老鼠了	未
老鼠:我好想逃，却逃不掉转V影响力峰会 红人的诞生	未
老鼠梦中向村民求救，村民出手相帮，多年后老鼠报恩救了一村人	未
老鼠活多久，还得看猫的心情。	未
老鼠皇帝首席村妇看世界 2008年6月10日，贵州赤水四洞沟我们住在房东老蔡家，每天除了除出外游玩拍照，大部分时间都是帮着老蔡夫妇干活儿，包括烧饭做菜，剁煮猪食，往家里背猪草，陪老蔡养的猴子玩儿（给猴子拉琴听音乐），跟他们夫妇一起除草整地等村妇自小到大头一回干了这么多不同的活 ...全文	未
老鼠，知道吗你这次差点闯大祸！	未
老鼠：给个痛苦吧！	未
老鼠：被针对	未
老鼠都快吓死了	未
老龄化加剧！30年后香港长者比例将翻倍至34香港政务司司长张建宗今日（8日）出席健康香港2025郁一郁健康啲宣传运动启动礼时表示，香港65岁及以上人口的比例在30年后将上升一倍，由2017年的17升到2046年的34张建宗鼓励市民养成健康的生活习惯，包括少油盐糖，及少吃肉类多吃蔬果，并 ...全文	未
老龄化少子化的社会，还需要很多服务老人的科技发明	未
考11年驾照终成功的男子为自己正名：我不是马路杀手！近日，江苏一男子考11年驾照终成功这一事件引起热议。有网友质疑：这种马路杀手还是不要上路了！陈先生说，我技术好着呢！一直没考过是因为总卡在科目一上......。此外他还向记者袒露了11年学车的坎坷之路男子驾考11年一直卡在科目一 自称不是马路杀手	未
//@考cpa的赵金花女士:以后这种新闻就别报道了，快气死了。	未
考上哈佛后回中国寻亲二十多年前的一个早上，姐姐出门买菜，看到楼道口有一个女婴正在哇哇大哭。我们住的是税务局的家属楼，在外人看来是县城里条件不错的单位，所以有人把孩子扔在这里，也是想让她有个不错的人家收养。围观的人很多，议论纷纷，但没人抱走。姐姐看女婴哭得撕心裂肺，一时冲动，将她抱回家了。妈妈看到孩子，没指责姐姐，只是说：这个事情还要问一下弟弟的意见。我当时在外地读书，回家才知道这件事。我是无所谓的，反正也养得起。女婴在我家生活了一段时间，一个亲戚得知这件事，希望将孩子送给她。她家住在省城，条件更好。	未
考上哈佛后回中国寻亲满满正能量的新闻，必须点赞，被遗弃孩子本身是一个让人悲伤的话题，好在主人公最终的结局很让人欣慰，考上哈佛大学。虽然身在异国他乡，但是，其回中国寻亲的行为，还是很值得称赞的。	未
考上哈佛后回中国寻亲知道感恩，不忘本不忘根，集中体现在哈佛女孩身上滴水之恩 当涌泉相报，这是中国传统文化的基因即使父母抛弃自己，也要苦苦寻找他们，确实令人感动令人思考的是，在目前的中国确实存在一些知恩不报甚至恩将仇报的现象对此，也需要平常心看待这也许是社会发展的一个历 ...全文	未
考上这6所大学，躺着当公务员！比很多985都值！	未
考下这三本证书后，请你跳过年薪10万以下的工作	未
“考古中国”项目扫描：破解谜团 找到“王的居所”	未
考古并非男人垄断，女考古学家汇聚南京，聊聊考古中的“女性话题”	未
考古。拢龙	未
考录哈尔滨体育学院招聘14名工作人员，11月30日至12月6日报名	未
考录黑河市爱辉区事业单位招聘42名工作人员，12月10日至16日报名	未
考录《黑龙江日报》招聘10名新媒体采编人员，报名截至11月29日	未
考拉的双12，来上车了！	未
考拉网页链接开黑玩具城全场低至299-160起面包超人低至55绘本低至299-160乐高低至188-100	未
考斯沃斯的大佬Bruce Wood表示：按照目前的设计阿斯顿马丁Valkyrie的6.9L V12引擎需要在每10万公里进行一次引擎更换。cars01车闻 汽车V峰会 他强调，按照考斯沃斯的预期，这台引擎的使用寿命为10万公里，所以当有Valkyrie行驶到此里程时，考斯沃斯需要重新检测整个引擎，考虑重新更换，当然能驾驶Valkyrie超过10万公里的车主可能并不存在	未
考核不合格暂停执业活动！省实施细则公布，唐山人速看！	未
考研乌龙接二连三，需要更深入问责和反思	未
考研“乌龙”接二连三 高校别挥霍“自命题权”	未
考研“乌龙”接二连三，高校别挥霍“自命题权”	未
考研倒计时10天 逢考必过，天气大好	未
考研倒计时，你准备好了吗？	未
考研冲刺进行时	未
考研大学生孔子雕塑下摆＂供品＂ 这几样东西亮瞎眼	未
考研季郑州大学现“学霸班” 一个班30人全部保研	未
考研学生备考忙	未
考研政治：57个史纲高频数字知识点你猜，这带「两个」「三个」的知识点，会不会承包你的多选题	未
考研班大打押题牌 揭开“神押题”的几大谎言	未
考研生个人信息被张贴于展板 校方:方便考生找考场	未
考研的同学看过来天气话你知 天气剧透 考试期间，广州多云为主，22日气温较高，但夜间起（不那么强的）冷空气补充，23日有零星小雨，对赴考影响不大，最高气温有所下降，要多加一件衣。总体还是适宜考试的，大家加油！！小编等你们的好消息！[加油][加油]	未
考研的热与难	未
考研直接发答案？山东教育厅：相关责任人停职	未
考研“直接发答案”，高校别打烂了“自主”的好牌	未
考研直接发答案?高校:工作失误将安排补考报销费用	未
考研结束 考试期间的真实状态，你是这样子吗	未
考研自命题如“儿戏”，又何谈人才的培养？ 丨凤凰网评论	未
考研英语单词“难”到上热搜？专家：单词未超纲	未
考研英语难度太大上热搜 这俩单词难倒无数人	未
考研英语难度太大上热搜！这俩单词难倒无数人…	未
考研试卷出错考生枯坐3小时交白卷 电子科大回应	未
考神日签 分手吧四六级 希望的灯一旦熄灭，生活刹那间变成了一片黑暗。普列姆昌德	未
考神日签 卓越的人一大优点是：在不利与艰难的遭遇里百折不饶。贝多芬	未
考虑中《阿斯报》：齐达内收到了曼联的合同，但尚未回应。	未
考虑到孟女士在中国和其他地方都没有刑事犯罪记录，以及目前存在健康问题，加上她本人目前愿意居住在温哥华等诸多情况，决定同意她保释。	未
考虑到快递寄送时效，此刻起不再回复邮寄地址，没有及时参与的糖蜜我们下次活动见吧[米奇比心]照片还在路上的也不要担心，收件时间截止到12.5晚八点	未
考虑到我是重量级汽车KOL，给了我两张蔚来ES6发布会的门票，会不会送我两辆体验车我家里已经没有车位了，这可怎么办	未
考虑转发和签一下这个请愿。华裔高中生王彼得在今年的情人节， 佛罗里达高中 Marjory Stoneman Douglas HS 的枪杀案中为了让同学尽快离开现场顶住门而牺牲，年仅十五岁。这样的英雄壮举是我们普通人无法做到和难以想象的。今年感恩节，这场枪杀案的幸存者，彼得生前的同学Kyle Kashu ...全文	未
考评组来白蕉，赞村貌换新颜！还提出这些要求...	未
考试季 完型填空困难户的救星来了！ 考研英语完形填空常用词组送给你微课堂	未
考试院发布“高考说明”和“小高考说明”	未
考辛斯计划本周参加球队的全部训练勇士主帅史蒂夫-科尔在接受采访时透露，中锋考辛斯已能完成5v5训练，他计划在本周参加球队的全部训练内容。据悉，上赛季遭遇左脚跟腱完全撕裂的考辛斯恢复情况良好，勇士之所以推迟他的复出日期是为了让他能以最佳状态重返赛场，考辛斯归来后，勇士队的恐怖阵容本赛季能走多远呢	未
考题泄露、错发答案… 2019考研，这些高校怎么了？	未
考驾照就是一场噩梦，看看这些花式挂科姿势，你都有过吗汽车科普贴考驾照就是一场噩梦，看看这些花式挂科姿势，你都有过吗	未
考驾照是一种怎样的体验	未
考驾照是一种怎样的体验看完不想学车了 教练 我不想学车了	未
考驾照是一种怎样的体验说多了都是泪啊！！！	未
考驾照的内幕：吃饭加钱递香烟！	未
考驾照说白了：科二看心态，科三看细节！	未
考验手速的时候到了，一墨迹水在杯里就成冰了	未
考验普京的时候到了 新的战争正一触即发！	未
考验普京的时候到了 新的战争正一触即发	未
考验眼力的时候到了！刷屏的这部大片，竟然藏了这么多彩蛋.....	未
耄耋的三星，蹒跚的步履	未
耄耋老人摔倒磕伤流血，平山一群仗义青年出手相救	未
者海三多多村发生一起交通事故！	未
者腊乡这几名村干部胆子真大，私设小金库终于被处分了。	未
而且他的角色还都活到了最后孤城闭红色预警	未
而且你们知道么！我看这篇的时候由于受没事就做饭导致我以为作者也是个厨神还去求证了一下，结果作者说她其实不太会做饭，好吧，反正云做饭的水平很高超就对了，特别佩服	未
而且我觉得歌词应该会批评社会一些现象，估计会很辣，话题满满 查看图片	未
而且是一家子都打，看着让人恼火。//@嗯嗯牛牛:打屁股就算了！ 这种打法的有点太过了！	未
而且是精装的，不过价格肯定是比市场价低的，我和代理商要一个团购价//@浅饮三生-:当然是越便宜越好啊，200-300可以，毕竟是彩印	未
而且朋友已经吐槽我一天了，说你见爱豆之前难道不应该激动忐忑吗你干嘛了！你去买公益午餐！要见到朱一龙了你居然还记得支付密码！	未
而且，确定关注了吗为什么就说取关了呢也许没关注呢	未
而且站不起来遥遥领先	未
而且还嘴硬，你还说不过它	未
而且还经常买最后一排情侣座//@阿里影业: 发现最近买的电影票都从一张变成了两张	未
而且这文章偷换概念，我们的报道之前说得很清楚，出问题的是聊天记录，这些西方人仍然在装傻说只是广告。不知道是他们智商有限，还是故意的。	未
而今百不缺，唯独缺良心。这是我送给贵局对 @刘成昆 案全体办案人员的一句话。有些案子讲点事实后不用讲法律，讲点良心就够了。 抄送 @平安内蒙古	未
而从实际情况来看，凡是需要依靠出售资产扮靓业绩和混日子的公司，大多是一些小企业小公司，象券商这种在很多人眼里高大上的公司，则很少出现过这种现象。	未
而是，再晚我也要回家	未
耍快手的媳妇看着老公越看越气多，竟然给老公的水里放上了...	未
耐人寻味，国防教育基地再变身	未
耐得住神经病就更无敌了！ //@DAIJING-SIN:知道吗，得耐得住寂寞才能成大事	未
耐心的等我的车车	未
//@耐撕的01: 收集一波	未
耒阳17岁少女独自上峨眉山离奇失踪帮寻！	未
耒阳29999元天价罚单结果出炉，这个所长被免职了	未
耒阳一干部驻村扶贫的同时，自掏腰包资助孤苦小孩	未
耒阳一男子被拐19年，终于回家团聚了！	未
耒阳一贫困户困扰十几年的难题终于解决了！	未
耒阳人注意！南正街惊现孙悟空专坑单身拍照收费！	未
耒阳周末天晴，明天可以去赶这个乡镇的集！	未
耒阳城管管得还真宽	未
耒阳小伙伴们，家乡的糯瓜熟了	未
耒阳市东湖圩镇的街道路灯照明工程涉及贪腐！	未
耒阳市经济开发区即将扩区，范围扩至白沙路	未
耒阳的外卖到底为不卫生	未
耒阳这个地方的人有多质朴元明坳村民：养牛是能赚钱，但对家乡环境不好，我不做养牛钉子户！	未
耒阳这几类人可获就业援助，但有房有车的人除外...	未
耒阳这名村书记用这招套取扶贫资金，结果	未
耕地保护、权益保护、妇女保护 ——全国人大常委会分组审议关注涉土地立法“权益保护”	未
耕地保护、权益保护、妇女保护——全国人大常委会分组审议关注涉土地立法“权益保护”	未
耕地占用税法草案、车辆购置税法草案再次提请全国人大常委会审议	未
耗尽家财扶助家乡学子，阳江籍港商黄文石被评为中国好人	未
耗资15亿美元！印度购买5175枚俄制“针”防空导弹	未
耳不闻人之非，目不视人之短，口不言人之过。	未
耳再造手术简单！我觉得我们可能需要谈一谈！@郭树忠教授 网页链接	未
耳友我被青春撞了一下腰	未
耳友相爱容易相处难	未
耳友风中的承诺	未
耳屎，第2562部 网页链接	未
耳朵摆的整整齐齐	未
耳朵消失变成了小海豹哈哈哈哈哈	未
//@耳机吧羊驼:38秒的时候发生了什么。。。//@蓝鲸财经记者工作平台:	未
耳机补货了97新 散装 Bose SoundSport 无线耳机-黑色 wireless 耳塞式蓝牙耳麦 运动耳机 智能耳机网页链接	未
耳蜗这个看到争议了，有说是澳大利亚这家耳蜗公司的事件营销行为，哪位能判断清楚咱们的善意被带节奏了吗//@渡渡鸟:帮转！愿所有人都助力，对不需要的人一文不值，对于小明是量身定制，一个人的全部音域世界	未
耶稣来到世上（道成肉身）的意义是什么	未
耶鲁人物  吉姆罗杰斯教你如何骑着摩托车把世界的钱都赚了！	未
＂耽美网文作者判十年＂二审焦点：如何鉴定淫秽书籍	未
“耽美网文作者判十年”二审焦点：淫秽书籍鉴定程序是否有瑕	未
“耽美网文作者判十年”淫秽书籍鉴定程序是否有瑕	未
耽误多年的淮阴区原东郊医院规划方案获批！设置床位约220张...	未
耿市长最新回复：杏花岭区宜家家居项目有了新进展！	未
耿市长最新回复：涉及供暖，杜儿坪东岗巷拆迁等17个问题！	未
耿市长最新回复！涉及富力金禧城，杜儿坪东岗巷拆迁等17个问题	未
耿彦波出王炸 ！把这里打造成了世界级的大景区！	未
耿彦波回复！涉及富力金禧城，杜儿坪东岗巷拆迁等17个问题	未
//@耿直的PallasCat:@paingod	未
//@耿直的PallasCat:普法的机会大家不要错过。与很多在这个新闻上糊弄事的媒体不同，我们详细给大家展示了这4条案例（也是最高检发布的第12批指导案例）。请大家仔细阅读，知法懂法用法。	未
聂勇局长为刘少奇故里管理局政工支部讲授党课	未
聂珍玉到县农牧局上专题党课	未
聂辰席：加快建立网台联动管理机制  网上网下同一标准	未
聂鑫车祸，黄维德一个人就捐了6W，做好事也不声张，爆吹黄维德这种实力派	未
聆佳说没事少矫情，有空多赚钱	未
聆听40年 每一秒都是心跳的节奏	未
聆听！他们在第5个南京大屠杀死难者国家公祭仪式现场表露心声	未
聆听佛音沟通不是为了说服别人，而是为了理解别人	未
聆听佛音能有这样的母亲，何止富...	未
聆听旋转两用u盘128G 39到手128G这个价真的是没得说了，抓紧入	未
聆听旋转优盘两用u盘128G 39到手128G这个价真的是没得说了，价钱很便宜	未
聆听 旋转优盘两用u盘128G 39到手128G这个价真的是没得说了，价钱很便宜，还是天猫店的东西，抓紧入	未
聆听生命的万年“回响” 周口店遗址发现一百周年记	未
聆听群众哨声深化基层治理	未
聊一会。一句话证明你老了。	未
聊一会天 网页链接	未
聊一聊与供电相关的法律	未
聊一聊你遇到过哪些奇葩室友都有什么特点	未
聊一聊国外贵的离谱国内便宜的东西	未
聊一聊秋裤塞进袜子里还是在袜子外不管了我先穿为敬12月5日，南京官宣入冬。不用妈妈提醒，很多人已经自觉地穿上了秋裤秋裤，在冬天的衣物里有着不容置喙的地位，但是它的位置到底在哪里，却始终有着争论，并导致了两个流派的形成。一派认为，秋裤应该塞进袜子里。剩下一派认为，秋裤腿应该套在袜子外面。详情秋裤塞进袜子里还是在袜子外不管了我先穿为敬 你是怎么穿秋裤的	未
聊半小时就去睡觉好不好呀@克拉克拉KilaKila闲聊KilaKila:Tiger公子的直播间	未
聊城15张通缉令！悬赏5000元，快看你见过这些人吗	未
聊城29岁小伙捐大半个肝脏为父续命，父亲在一家人才算团圆	未
聊城一女司机用卫生巾遮挡车牌，你猜扣了多少分！	未
聊城一男子与美女护士聊天记录曝光！内容实在是...	未
聊城人别再传这个消息了！假的！有孩子的速看！	未
聊城人注意！今年年底前，聊城将淘汰排放标准为国二及以下柴油货车！	未
聊城人注意！国家发布流感防治方案，赶快收藏！	未
聊城人都在发的扫码红包怎么回事真相在这里！赶紧看	未
聊城发布大雾红色预警！这周雾霾和雨雪都要来了	未
聊城启动预警，这些企业停工停产！这些群体要特别注意！	未
聊城建122个艾滋病快速检测点，基本实现检测全覆盖	未
聊城禁燃烟花爆竹条例 明年1月1日起施行	未
聊城这三家医院公开招聘70人！附岗位表	未
聊城这些小区充电桩为何成摆设，到底卡在哪	未
聊城重大机密不慎流出！内部人员9.9元秒杀！嗨爆全城！	未
聊天中有哪些要遵守的纪律	未
聊天帖在这个冬天，你最难割舍的前三名是什么	未
聊天帖评论里@ 一个你认为2019也不会有对象的人	未
聊天时能用来装13的文言文有哪些	未
聊天记录曝光！玉溪网友把信用卡借给朋友后却听到这四个字，心寒！	未
