留学2年败光200万 22岁男生弃学成巨婴：吃饭要喂 哈尔滨刘女士与丈夫离婚，儿子与奶奶一起生活，从小性格孤僻。高中时，刘女士将其送到国外，两年最少花了200万，却连预科毕业证都无法取得。回国后也天天在家玩游戏，吃饭都是奶奶送到跟前，甚至一口口喂。（新晚报家报）网页链接	未
留学2年败光200万  22岁男生弃学成巨婴：吃饭要喂哈尔滨刘女士与丈夫离婚，儿子与奶奶一起生活，从小性格孤僻高中时，刘女士将其送到国外，两年最少花了200万，却连预科毕业证都无法取得回国后也天天在家玩游戏，吃饭都是奶奶送到跟前，甚至一口口喂（新晚报）对此，你想说___	未
留学2年败光200万 22岁男生弃学成巨婴：吃饭要喂哈尔滨刘女士与丈夫离婚，儿子与奶奶一起生活，从小性格孤僻高中时，刘女士将其送到国外，两年最少花了200万，却连预科毕业证都无法取得回国后也天天在家玩游戏，吃饭都是奶奶送到跟前，甚至一口口喂（新晚报）网页链接	未
留学2年败光200万 22岁男生弃学成巨婴：吃饭要喂哈尔滨刘女士与丈夫离婚，儿子与奶奶一起生活，从小性格孤僻高中时，刘女士将其送到国外，两年最少花了200万，却连预科毕业证都无法取得回国后也天天在家玩游戏，吃饭都是奶奶送到跟前，甚至一口口喂每个熊孩子的背后都有一个熊家长， ...全文	未
留学2年败光200万 22岁男生弃学成巨婴：吃饭要喂哈尔滨刘女士与丈夫离婚，儿子与奶奶一起生活，从小性格孤僻。高中时，刘女士将其送到国外，两年最少花了200万，却连预科毕业证都无法取得。回国后到大专院校求学，不到两个月就弃学回家。与游戏为伴，仅剩下的交流就是向家人要钱吃饭都是奶奶送到跟前，甚至一口口喂。（新晚报）网友：教育出了什么问题	未
留学2年败光200万 22岁男生弃学成巨婴：吃饭要喂哈尔滨刘女士与丈夫离婚，儿子与奶奶一起生活，从小性格孤僻。高中时，刘女士将其送到国外，两年最少花了200万，却连预科毕业证都无法取得。回国后天天在家玩游戏，吃饭都是奶奶送到跟前，甚至一口口喂。	未
留学2年败光200万 22岁男生弃学成巨婴：吃饭要喂哈尔滨刘女士与丈夫离婚，儿子与奶奶一起生活，从小性格孤僻高中时，刘女士将其送到国外，两年最少花了200万，却连预科毕业证都无法取得回国后天天在家玩游戏，吃饭都是奶奶送到跟前，甚至一口口喂	未
留学2年败光200万！22岁男生成巨婴：天天玩游戏，吃饭还要喂哈尔滨刘女士与丈夫离婚，儿子与奶奶一起生活，从小性格孤僻。高中时，刘女士将其送到国外，两年最少花200万，却连预科毕业证都无法取得。回国后天天在家玩游戏，吃饭都是奶奶送，甚至一口口喂。（新晚报）留学2年败光200万！22岁男生弃学成巨婴：吃饭要喂	未
留学2年败光200万 他弃学成“巨婴”：吃饭要喂	未
留学两年败200万：别让骄纵教育浇灌出“巨婴”	未
留学博士在同学食物里下毒 中山大学毕业后到加拿大皇后大学攻读博士的王某因对同胞下毒未遂，并且对行为保密且无悔改之意，近日被判入狱7年。这让人想起了多年前北大的那件事，而且为什么到国外犯事的总喜欢对同胞下手嫉妒这种心理难道只有同胞之间会有么如果无法适应国外的生活环境，又为什么要逼迫自己去有再多的委屈和怨恨，也别痛下杀手，解决问题不是只有你死我活！	未
留学博士在同学食物里下毒受害人目前与妻子和两名孩子住在多伦多，但他要求匿名，以免自己的事业和家庭受到伤害。他说，自从26岁的王子杰对他下毒后，生活已经乱套。皇后大学不再与他续合同，他认为是事件给校方带来坏的影响。为了不想被人问起，他不能将事情告诉亲友，包括在中国的父母。受害人认为被告虽然认罪，但是并没有悔过。王子杰使用的有毒物质不是来自皇后大学的库存。他从哪里拿到毒药，或制作毒药的材料，依然是个谜。	未
留学博士在同学食物里下毒在中加关系如此紧张微妙的历史时刻，皇后大学发布这个消息必然牵动两国公众敏感的神经。这一定会超出对案件本身的探讨。这首先是极端案例。其次是博士。而后才是中国人。希望话题沿着正常的轨道前进。	未
留学博士在同学食物里下毒对于王某对同学下毒这件事，我认为这是一种有预谋的行为，因为他明明知道这种化学试剂会对人体造成无法挽回的后果，而且还天天给同学的食物中投放。竟然长达一个月，才被发现。感觉就是一种阴谋，这个太可怕了，他不会是被某些组织利用而拿自己同胞做实验吧如果是这样，这罪可以杀头。如果仅仅只是嫉妒同学也不至于这么长时间残害同学，若不是被同学发现，他还会继续这种行为。这种人真是太可怕了，一定要严惩，不能为社会留下隐患。	未
留学博士在同学食物里下毒法官称：他那有计划的邪恶攻击是有原因的，但他对自己的作案动机保密，也无悔改之意，为此否决了他的律师提出的4年的刑期，支持了检方要求判处7年的刑期。据说他下毒动机就是论文名字被排在了后面，所以就下毒，当然这事他自己不说，没有任何人会知道。这世界可怕的地方就在于你某天被害，还真不是你伤害了别人，你长得好看，学术水平高，社会地位高，有钱日子过得好，都可能成为被杀的理由。因为你们的好，让我不舒服了，不开心了。	未
留学潮涌：从“出国热”到“归国潮”	未
留学热催生咨询热 半数留学顾问是海归	未
留学生为什么选择回国整形随着国内医疗美容行业的飞速发展，整形已经不再是一个禁忌话题，越来越多的人愿意通过整形改变自己的外貌，甚至改变自己的未来。@整形医生巫文云	未
留学生们看过来，跟他们换钱要当心！这群人自称红领巾，却专骗留学生！	未
留学生低龄化问题多 多伦多华助中心帮解决	未
留学生入境带35万物品 千万不要试图以人身藏匿等方式躲避检查，更不要相信网络上一些声称能躲避查验的方法。 留学生入境带35万物品	未
留学生回国自救生存指南：每天三杯一点点，出门只带手机	未
留学生注意！穿加拿大鹅危险了，有人专门抢穿鹅的亚洲人	未
留学生游客注意！有人扬言要在东京站杀人 日本警方强化警戒读卖新闻报道，因一则社交媒体发帖，东京警视厅从12日晚开始加强对东京站周边警戒报道称，12日晚9点20分左右，日本警方110接到报警，称推特上有人发帖称要在东京站杀人，且明确称要杀10人，接警后，警方随即强化安保工作，并调 ...全文	未
留学生的“爬藤”路能不能少一些套路	未
留学生看过来，吉林省出入境蜀黍为你划重点	未
留学百问  生病前：好烦啊在国外还交保险钱。生病后：嗯，真香。	未
留学记｜在瑞士隆德大学留学是怎样一种体验？	未
留学读书引波澜 胡歌的任性到底值不值？	未
留守儿童圆梦行动 建行长租房的故事	未
留守儿童是这个时代的痛才15岁，一个花样的年纪，就感染上了艾滋。由于他们缺少关爱和监护，很容易误入歧途，也容易被有心人利用，对社会产生不可估量的后果。深圳市疾控中心艾滋病防制所所长杨峥嵘呼吁：要多关心和注意留守儿童，避免再出现这样的病例。	未
留守儿童直播都准备好了吗	未
留守土楼的志愿者蔡腾辉：相信自己就是力量的泉源	未
留守妇女经常用6种方法解决寂寞，尤其是第6种！	未
留守老母亲双十二买买买	未
留尼旺宵禁解除，但黄马甲的影响仍在继续据法媒11月25日报道，因局势好转，法国海外领土留尼旺决定解除已持续5天的宵禁。当地警察局在一份公告中表示，鉴于局势好转，警方决定不再继续执行宵禁，当地的30所加油站将重新获得燃料补给，但建议居民在非必要情况下限制出行。蔓延全法的黄马甲抗议运动在失业率高达22.8，贫困率40的留尼旺演变为暴力骚乱，自11月17日至今，当地共有143人被捕，公共交通及教育遭受严重影响，法国总统马克龙曾表示将动员军队稳定当地局势。近距离看法国	未
留恋新疆	未
留意一下榜哥帮帮忙	未
留意下你家门口，小心有这个	未
留意了！未来一周，番禺这些地方又实行停电，最长停12小时	未
留意了！未来一周这些地方将短时停电，快看看有没有你家！	未
留意这些路牌！昌吉黄标车闯限行区将罚200元记3分！	未
留洋那些事儿：羁绊下的足球梦想	未
留用//@LebAng_X7:转发微博	未
留白原木	未
留的会是个祸害//@王志安:不到十四岁，不需要承担法律责任。过几天就回家了。	未
留着	未
留着之后去看看	未
留着以后帮各种互联网造车新势力代工	未
留着，元旦走起来	未
留着慢慢看看	未
留着有用：生什么病忌什么口！	未
留着过年	未
留着过年吗	未
留着过年过去拍雪	未
留着需要的时候看看	未
留神！乘电梯千万别做“低头族”	未
留神点！年底了谨慎小区住户门口出现小偷标记！	未
留神，电热毯使用不当会变杀手！	未
留福周营石槽卞路口北杨集快看你们村的老赖又曝光啦！看有认识的没?	未
留给东契奇的时间不多了NBA吐槽大会 //@76人球迷俱乐部: NBA吐槽大会 儿子的NBA最年轻三双记录会被破吗	未
留给中国车迷的时间不多了	未
“留置第一案”王晓光案文书展出 家属在通知书上签字	未
“留置第一案”王晓光案文书展出，家属在通知书上签字按手印	未
留美就业美国会计师事务所BlueCo招聘税务审计报销春季实习生	未
留言不见多但粉丝数噌噌涨，所以，是谁在给我买粉	未
留言回复：出去闯闯	未
留言回复：团建	未
留言帖5分钟抢完！排队也约不到！改革币竟然这么抢手！	未
留言有奖外交部回应孟晚舟被拘押：澄清理由并立即释放  2019放假安排出炉正义网早播报	未
留言有奖张家口燃爆事故15人被控制  万豪酒店5亿用户信息外泄正义网早播报	未
留言有奖欠税超10万将被限制出境  沪车辆超80分贝限行正义网早播报	未
留言板  老人申请免费家政服务为何年龄门槛不一民政部门回应	未
留言的，今天用系统抽10个每个88元送给你。	未
留言贴改革开放纪念币你约到了吗约了多少	未
留言赢电影票与盐亭相关古诗词你知道多少	未
留隍人家里几乎都有的这东西，再过不久都要换...	未
留隍茶背街道路段今起动工维修	未
畜生：28岁还没娶到媳妇， 男子喂哥哥全家吃老鼠药， 8岁侄女都不放过！	未
畜生！一12岁小学生持刀弑母，共砍20余刀，只是因为...细节曝光(附视频)...	未
略伦特: 14	未
略伦特：Listos para la semifinalHalaMadrid RMCWC	未
略伦特被放倒。	未
略伦特转发paddy:	未
略略子，投稿一个因为散件土蜘蛛不够及格线的击杀大蛇的配置，用了日女土蜘蛛，下面是御魂	未
略略子这里投稿 野队遇到求解传记的白藏主 我寻思着我带个跳妹没啥问题	未
略略我又来了 投稿树哥清姬推秘闻 灯10蛇10吸血姬10之类的都可以！	未
略略 投稿一下 弟弟食发鬼也能击杀今天的	未
略略，投稿一个在贴吧看到的关于八岐大蛇如何成为式神的解释	未
略略投稿，发现一个bug。在解锁传记的一瞬间，快速点击另一个没有解锁的传记就可以查看这个未解锁的传记	未
略略投稿投稿今天的大蛇开局除了食发鬼丑女全部普攻标记红蛋 红蛋快死的时候 追月提前开大 清明给星	未
略略投稿：昨天中奖了一个解压石，就是有点像运动手环那种，可以监测呼吸频率，判断是否焦虑和压力过大的，结果我带上打斗技时报警了三次呼吸过促我觉得这是我头秃的主要原因	未
略略！略略投稿！我寮会长小姐姐知道我骷髅印记差一次4400，开了八九个嘤兵小号帮我拿印记！	未
略过。。	未
番友@波斯貓丶分享泰国签证现金抽查信息，请勿存有侥幸心理。统一回复下，暂免落地签期间要求的是10000泰铢人，20000泰铢家庭。之前的要求是20000泰铢人，40000泰铢家庭。可以带等值人民币美元等。泰国旅行泰国签证	未
番禺你送我检  10分钟快检出结果，食品安全看得见	未
番禺区寒冷黄色预警预计今晚起受冷空气影响，气温明显下降，番禺区气象台于12月6日17时17分发布寒冷黄色预警信号，请注意防寒保暖。网页链接	未
番禺区寒冷黄色预警预计今晚起受冷空气影响，气温明显下降，番禺区气象台于12月6日17时17分发布寒冷黄色预警信号，请注意防寒保暖网页链接	未
番禺司机注意！全国统一查酒驾时间公布，这些路段可能会查！	未
番禺的乡村小店，凌晨4点还有人在饮茶	未
@番禺街坊，出行请注意！这条公交线路调整咯！	未
@番禺街坊，快来提意见！广州公立医院要调价，事关你的钱袋子！	未
@番茄不爱吃番茄i：晚上17点55在卫津路上，一辆准备右转的612公交车强行变道挤道，头挤进去了，后屁股与我们家正常道行驶的车挨的特别近，家人一直按喇叭示意，公交车也没有停下来的意思，一直挤，把后视镜都挤的别回去了，也有些掉漆然后就这么开走了新买的车好心疼啊，但是也不知道该找谁解决 ...全文	未
@番茄不爱吃番茄i：晚上17点55在卫津路上，一辆准备右转的612公交车强行变道挤道，头挤进去了，后屁股与我们家正常道行驶的车挨的特别近，家人一直按喇叭示意，公交车也没有停下来的意思，一直挤，把后视镜都挤的别回去了，也有些掉漆。然后就这么开走了。新买的车好心疼啊，但是也不知道该找谁解决。公交车司机真是太霸道了。仗着自己个子大，天天变道加塞。大家以后小心点吧！也希望公交车司机能规范小心驾驶。	未
//@番茄市长://@文科班校花酱://@颜文字君://@微博客服:为遇难同胞致哀//@不要投诉我啊嘤嘤嘤:	未
番茄越红越熟越防癌 5种公认防癌菜吃起来	未
//@番薯W:	未
異國殺妻騙保.............人神共憤！！！	未
畲族村落半月里。	未
畸形的医疗服务价格，什么时候能改	未
畸形追星只会给偶像招黑	未
畹町：“太阳当顶”的边关重镇	未
疏堵保畅，我们一直在路上......	未
疏整促回头看   东风乡给电动车建新家，停有位，行有序！	未
疏整促顺义今年留白增绿390余亩！	未
疑中浦悠花伤情鉴定书曝光，臼齿后牙脱落，后脑左胸均受伤	未
疑中浦悠花好友曝光验伤报告29日，疑中浦悠花好友@Doo_椎名柘榴zakuro 经悠花律师同意后，在微博曝光了验伤报告报告表明中浦悠花10月8号被同居者打伤，臼齿和后牙脱落，10月11日两颊造成伤势，左大腿被踢成皮下出血，12日殴打造成两颊后脑左胸受伤，需要疗养一个半月才能痊愈此前，蒋方律 ...全文	未
疑中浦悠花好友曝光验伤报告29日，疑中浦悠花好友@Doo_椎名柘榴zakuro 经悠花律师同意后，在微博曝光了验伤报告。报告表明中浦悠花10月8号被同居者打伤，臼齿和后牙脱落，10月11日两颊造成伤势，左大腿被踢成皮下出血，12日殴打造成两颊后脑左胸受伤，需要疗养一个半月才能痊愈。此前，蒋方律师曾质疑两颗牙被打断一说。	未
疑中浦悠花好友曝光验伤报告29日，疑中浦悠花好友@Doo_椎名柘榴zakuro 经悠花律师同意后，在微博曝光了验伤报告。报告表明中浦悠花10月8号被同居者打伤，臼齿和后牙脱落，10月11日两颊造成伤势，左大腿被踢成皮下出血，12日殴打造成两颊后脑左胸受伤，需要疗养一个半月才能痊愈。此前，蒋方律师曾质疑两颗牙被打断一说。via新浪娱乐	未
疑中浦悠花好友曝光验伤报告29日，疑中浦悠花好友@Doo_椎名柘榴zakuro 经悠花律师同意后，在微博曝光了验伤报告。报告表明中浦悠花10月8号被同居者打伤，臼齿和后牙脱落，10月11日两颊造成伤势，左大腿被踢成皮下出血，12日殴打造成两颊后脑左胸受伤，需要疗养一个半月才能痊愈。此前，蒋方律师曾质疑两颗牙被打断一说。 如果蒋劲夫女友中浦悠花不愿庭下和解，蒋劲夫或面临15年以下有期徒刑和50万日元（约3万元人民币）罚金！	未
疑中浦悠花好友曝光验伤报告29日，疑中浦悠花好友@Doo_椎名柘榴zakuro 经悠花律师同意后，在微博曝光了验伤报告。报告表明中浦悠花10月8号被同居者打伤，臼齿和后牙脱落。此前，蒋方律师曾质疑两颗牙被打断一说。	未
疑中浦悠花好友曝光验伤报告29日，疑中浦悠花好友在微博曝光了验伤报告报告表明中浦悠花10月8号被同居者打伤，臼齿和后牙脱落，10月11日两颊造成伤势，左大腿被踢成皮下出血，12日殴打造成两颊后脑左胸受伤，需要疗养一个半月才能痊愈此前，蒋劲夫 方律师曾质疑两颗牙被打断一 ...全文	未
疑中浦悠花好友曝光验伤报告29日，疑似中浦悠花好友经悠花律师同意后，曝光了验伤报告。报告表明中浦悠花10月8号被打伤，臼齿和后牙脱落11日被打，两颊造成伤势12日殴打造成两颊后脑左胸受伤，需要疗养一个半月痊愈。此前，蒋方律师曾质疑两颗牙被打断一说。中浦悠花好友曝光验伤报告皮下出血臼齿脱落	未
疑中浦悠花好友曝光验伤报告 @Doo_椎名柘榴zakuro 经悠花律师同意后，在微博曝光了验伤报告。报告表明中浦悠花10月8号被同居者打伤，臼齿和后牙脱落，10月11日两颊造成伤势，左大腿被踢成皮下出血，12日殴打造成两颊后脑左胸受伤，需要疗养一个半月才能痊愈。	未
疑中浦悠花好友曝光验伤报告，中浦悠花的好友在微博晒出了验伤报告，现在就等待警方的调查结果了，想知道蒋劲夫到底为什么下手这么重。。。	未
疑中浦悠花好友曝光验伤报告在微博曝光，报告表明中浦悠花10月8号被打伤，臼齿和后牙脱落，10月11日两颊造成伤势，左大腿被踢成皮下出血，12日殴打造成两颊后脑左胸受伤。。。这是往死里打啊，好恐怖。难怪蒋劲夫女友不愿庭下和解，都伤到需要一个半月的休养才能痊愈，已经不是简单的家暴了吧。。。	未
疑中浦悠花好友曝光验伤报告。报告表明：中浦悠花10月8号被同居者打伤，臼齿和后牙脱落，10月11日两颊造成伤势，左大腿被踢成皮下出血，12日殴打造成两颊后脑左胸受伤，需要疗养一个半月才能痊愈。	未
疑中浦悠花好友曝光验伤报告 椎名柘榴经悠花律师同意后，在微博曝光了验伤报告。报告显示中浦悠花10月8号被同居者打伤，臼齿和后牙脱落！10月11日两颊造成伤势，左大腿被踢成皮下出血！12日殴打造成两颊后脑左胸受伤，需要疗养一个半月才能痊愈！可怕，之前蒋劲夫的律师，还曾经质疑伤势，这下锤来了	未
疑中浦悠花好友曝光验伤报告疑中浦悠花好友曝光验伤报告：臼齿及后牙脱落事情真是越来越大了，但我们还是希望得到蒋劲夫本人或者律师确认，还原事件真相...	未
疑中浦悠花好友曝光验伤报告疑似中浦悠花好友曝光验伤报告！网友说这牙齿这么奇怪所有的信息都不是来自官方或其本人，而是一个不具名的好友，着重渲染伤情，而不是事件因果你不觉得奇怪吗	未
疑中浦悠花好友曝光验伤报告看看这些脑残粉的逻辑思维，挺可笑的，不管什么原因，打人者都是错的，更何况打女人别整天把地域黑挂嘴边，特别那些墙头草，风往哪边吹他就往哪边倒，这些人挺可怜的，活着不知道为了什么连自主的思维都没有，跟狗没区别，逮住谁就咬谁，哪怕国人客观评论，一样被咬，说它们是蛆一点都不为过，活着连是是非非都分不清楚	未
疑从四川被拐卖至河北邯郸的苗苏磊寻亲	未
疑似2具失联者遗体都被发现！杭州驴友安吉看雪失联7天，刚刚坏消息传来12月8日，浙江北部地区迎来大雪，杭州两名驴友结伴赏雪，结果失联至今继今早10点多，疑似女性驴友被发现后，在附近位置，11：30发现另一具疑似驴友遗体安吉警方派出法医等上山勘查现场	未
疑似一位博兴的老人走失到广饶了，快看你认识吗	未
疑似中浦悠花好友曝光验中浦悠花验伤报告！10月8号被同居者打伤，臼齿和后牙脱落，10月11日两颊造成伤势，左大腿被踢成皮下出血直径15cm，12日殴打造成两颊后脑左胸受伤，需要疗养一个半月才能痊愈。	未
疑似圆明园流失龙首法国拍出240万欧元 专家称未必是	未
疑似圆明园流失龙首法国拍出240万欧元(图)	未
疑似圆明园流失龙首铜像在法国拍出240万欧元(图)	未
疑似无证狗咬伤女孩鼻子后续：已找到狗主人，现已将犬只控制城市V聚力 据@平安下城 ：昨天上午6点，朝晖九区发生一起狗咬人事件，民警接报警后，当即开展了现场走访，监控调取等查证工作，并在今天下午1点左右通过发动社区居民查找联系上了狗主人冯某。经过核实，现已确认该事件系被咬女子余某及其朋友在事发小区内逗玩由冯某牵引的宠物犬引起，期间未发生任何治安纠纷。目前派出所已将相关情况移交给城管部门，朝晖城管中队已依法受理并开展立案调查 ，现已将犬只控制，并将依据相关法规做出后续处理。下一步，派出所也将积极	未
疑似李诞出轨工作人员否认11月24日，有网友在社交平台曝出一段视频，疑似李诞在望京某酒吧与一名女子亲吻，举止十分亲密爆料者还肯定该女子不是李诞老婆黑尾酱有记者求证李诞工作人员，对方承认视频中人是李诞，但称李诞只是在讲话网曝李诞激吻视频疑出轨工作人员：没亲！	未
疑似李诞出轨，工作人员承认这是李诞，只不过在与女子说话。 微博视频	未
疑似李诞出轨 有网友爆料，在望京一家酒吧，遇到疑似某网综红人与一个女生舌吻，评论区有人猜是李诞，但女生明显不是黑尾酱。	未
疑似杜牧墓成菜地，当地勿以真假难辨推卸责任丨新京报快评	未
疑似流失生肖龙首法国拍出240万欧元，专家称未必是圆明园	未
疑似白鳍豚现身南京夹江，专家：没有影像资料，无法确定	未
@疑似绝缘Osric飞：麻烦问下，黑牛城道快速路辅路，奔友谊路方向，尖山路至隆昌路一段，辅路有三条道，其中有两条车道有标识线，最左侧车道是直行线，一中间车道是直行加右转线，最右侧车道没画标识线，请问这是机非混行车道还是非机动车道	未
疑似耍手法骗钱被宁津网友人肉通缉：一男子在超市行骗，手法快，不易察觉	未
疑似重型半挂牵引车肇事致人死亡后逃逸公安1万元征集线索	未
疑似阿普利亚RS660的测试谍照	未
疑似陈羽凡被带走的小区：明星扎堆 单价10万+	未
疑似骗子！信宜这个乡镇来了一帮人免费送盆，一大帮阿婆阿伯排队	未
疑似龙首铜像现身 华人买家以2400万元人民币购得	未
疑借钱不遂行凶 弃尸大海 弒父逆子自台回港归案香港仔华贵邨对开海面红白蓝尼龙袋藏尸案真相大白，警方人员经抽丝剥茧后闪电破案，揭发独居于屯门的男死者早前疑遭上门借钱不遂的逆子弒害，有人先后以尼龙袋及行李箧双重密封尸体，再弃于大海企图毁尸灭迹，然后潜逃台湾。惟天网恢恢，死者遗体终浮上海面被发现，疑犯至前晚回港投案，昨日被押回弃尸现场协助警方重组案情。警方将案列作谋杀案处理，由西区重案组跟进。网页链接	未
疑因刷交通卡生口角，男乘客竟一拳挥向正开车的公交司机	未
疑因女司机边开车边喂女儿零食，轿车瞬间失控	未
疑因学习压力大离家出走 如东15岁少年失联音信全无	未
疑因违建拆除 云南宣威一妇女在镇人大主席家上吊自杀	未
疑圆明园龙首在法被拍卖 专家:尚未付款 不必炒作	未
疑山东编导艺考泄题，调查组初步认定为考生作弊事件	未
疑惑衡阳网约车司机要考证啦！怎么考去哪考那么耒阳呢	未
疑惑！都昌洒水车路边洒水，竟能把车玻璃打碎	未
