盘点，亲自上场抓过歹徒的韩国艺人1.张东允演员张东允就是凭借抓强盗的汉阳大暖男变得有名并且出道的。2015年10月，去便利店买东西的张东允看见正挥舞凶器抢劫的强盗。当时张东允并未慌张，而是假装和朋友打电话的样子报了警。因为张东允的机智，强盗被顺利抓获，张东允也被电视采访变得有名。之后他在SNS上成为话题，并接到了现公司的橄榄枝成了演员出道。2.李光洙演员出道前，李光洙作为模特活动，有一天他去超市时碰到了流着血昏倒在地上的老夫妇。经了解，是喝醉了酒的顾客伤害了老夫妇。李光洙并未离开而是直接报了警。这	未
盘点：你不一定见过的红军长征老照片	未
盘点全国最奇葩风俗，女子初夜权给父兄朋友或高僧！	未
盘点冬季“谣言”老梗：穿秋裤会丧失抗寒基因	未
盘点：史上规模最大的13次人口大屠杀	未
盘点 换乘王12号线沿线的15个新盘	未
盘点日本人爱去的7大有名温泉胜地，你都泡过哪些	未
盘点明星拍吃戏：孙俪吃10斤瓜子，王传君吃到怀疑人生，但都不如他	未
盘点  本周政采人应知的10件事	未
盘点杨幂投资账本：嘉行传媒一年股价打8折	未
盘点杭州周边十大滑雪胜地！这个冬天就可以去滑雪啦！ 杭州爆料 如果不想跑远出国门，不想跑去遥远的哈尔滨，杭州周边十大滑雪胜地，让你在家门口就可以玩尽兴！这个冬天要不要来一场滑雪之约 先马了收藏吧！ [米奇比心]	未
盘点武警鄂尔多斯支队防沙治沙路：从沙进人退到绿进沙退，守热土洒绿色	未
盘点没有“整容”的女演员，佟丽娅上榜，最后一位成整容界模版	未
盘点  没看过本赛季F1的比赛不要紧，看过这十大超车就够了！	未
盘点济宁10大最伤人违法行为，你中枪了吗	未
盘点：物流企业向平台转型的五条路径	未
盘点男星的绅士手，张艺兴秒变小学生	未
盘点“脸熟却叫不出名字”的明星,宋佳伦上榜,他是国家一级演员	未
盘点贪官“藏钱术”:手法就像在演谍战片	未
盘点近年世俱杯半决赛遭淘汰的南美球队2010巴西国际2013巴西米内罗竞技2016哥伦比亚国民竞技2018阿根廷河床	未
盘点那些WEC赛场上的F1老司机们！ 体育V势力	未
盘点那些同堂受审的贪官与情人	未
盘点那些退役后破产的球星！他们曾都是富豪！	未
盘王节恭城瑶族人自己的盘王节	未
盘致火腿公司沙淤养殖场施工洽谈公告	未
盘面上看高开低走回补缺口，底部区域不管怎么走都不会有风险，一定要坚定耐心持有，目前看这个位置调整已经到位，随时连续大涨	未
盘龙大道和巨龙大道交叉路口能否建立人行天桥官方回复来了	未
盛产美女的乌克兰搅局，双普会又黄了	未
盛京金控集团百亿母基金首单落子中和资本	未
《盛唐幻夜》收官 “夜幕CP”执手共生死	未
盛唐幻夜 郑业成 吴倩 相信爱情的，就亲！使劲亲！想起来了吧。 微博视频	未
盛大开张！天坛医院神经介入中心开张仪式	未
盛希泰：寒冬来了，风口停了，资金紧了考验投资和管理能力的时候到了	未
盛智文谈改革开放：我了解和信任中国的体制	未
盛松成：不大主张通过降基准利率来解决小微企业融资难融资贵	未
盛松成：为什么人民币汇率保“7”很重要？	未
盛松成：为什么人民币的关键关口“7”很重要	未
盛松成：人民币兑美元汇率7是重要的心理关口中国央行参事盛松成在华尔街见闻Alpha峰会表示：人民币兑美元汇率7是重要的心理关口汇率跌破关键关口会引发大面积止损性交易，人为地制造汇率贬值汇率如果跌破重要关口，维持汇率稳定需要付出更高代价，也会使货币当局更加被动 ...全文	未
盛松成：仅靠降息未必能解决企业融资贵的问题	未
盛松成：明年房价既不会大幅下降也不会“报复性反弹”	未
盛松成：明年房价难现反弹，必要时可考虑降准而非降息	未
盛极而衰，凤凰涅槃从ofo的陨落说说上海凤凰被资本裹挟的ofo即将走完自己的短暂而辉煌的一生，却留下一地烂车。更为惨烈的是，本来就濒临亏损的上海凤凰成了资本游戏的牺牲品。传统的实体企业，受伤很深。谷歌浏览器	未
盛泽圆明小镇芳容初露 盛泽镇人大调研圆明小镇建设情况	未
盛路通信：公司与华为在5G方面有合作	未
盛达矿业重组调查：金山矿业矿石品位数据存疑	未
盛运环保再曝短债违约 称正与四川能投推进相关债务重整等工作	未
盛运环保的烦恼：儋州项目延宕3年无果	未
盛骏今日现役入伍18日下午，经纪公司表示，盛骏已于今日以陆军身份现役入伍，将进入位于江原道2师团老道新兵教育队，结束为期5周的基础军事训练后，分配到部队服役。并表示因尊重本人想安静入伍的意愿，希望大家谅解在当天宣布这个消息。盛骏会诚实履行完兵役，以更加健康和成熟的面貌回归。	未
盛骏今日现役入伍18日下午，经纪公司表示，盛骏已于今日以陆军身份现役入伍，将进入位于江原道2师团老道新兵教育队，结束为期5周的基础军事训练后，分配到部队服役并表示因尊重本人想安静入伍的意愿，希望大家谅解在当天宣布这个消息盛骏会诚实履行完兵役，以更加健康和成熟的面貌回归	未
盟委督导组到阿盟检察分院督察指导扫黑除恶专项斗争工作	未
盟市要闻	未
盟纪委监委扫黑除恶专项斗争督导组到阿盟检察分院督导工作	未
目不转睛 3岁男童洗澡总盯浴霸险失右眼	未
目不转睛，3岁男童洗澡总盯浴霸险失右眼	未
目击＂小轿车冲上人行道＂的村干部:6老人1孕妇遇难	未
目击山东2019年美术统考评卷现场 试卷分10档评分	未
目击  张家口爆炸系乙炔爆炸引起 现场曾一片火海	未
目击渔民抓鲎现场	未
目击潮汕渔民抓鲎现场	未
目击者：张家口爆炸现场一片火海 疑运煤车爆燃盛华化工公司工作人员表示，爆炸并非发生在该公司，而是该公司南边的一家企业，据说是一家新能源企业目击者称，现场的火不是柴火和棉被着了那种火，而是空气着火的感觉，空气里面都是刺鼻的味道，能见度不足两米 目击者：张家口爆炸现场一片火海 疑运煤车爆燃	未
目击还原土耳其机场恐袭：地面被扯碎，母亲遮住1岁稚子眼睛	未
目前16度气温，不冷不暖有点凉，就是阵风有点大，沿海和高地最大阵风6-7级明天将会是晴天干燥日子，保暖和补水要同时进行	未
目前，3号线故障已修复，线路运营已恢复正常。	未
目前不可能出现在港珠澳大桥上的一群人，他们这样表达心情	未
目前中國的洲際彈道導彈潛艦已經現身，只有長程轟炸機仍未正式公開。不過，近期有關轟-20的報導漸增，雖然訊息有限，但已暗示這款長程核打擊支柱將很快與國際社會見面。 《國家利益》報導說，雖然對轟-20所知有限，但從各方數據仍可大約描繪出它的規格。預估轟-20最大未加油作戰半徑將超過5000英里(約8000公里)，有效載荷約處於現役轟-6轟炸機的10噸和美軍B-2轟炸機的23噸之間。重要的是，如果轟-20確實具有上述的航程與隱形能力，它將改變美國和中國之間的戰略形勢，使得美國的太平洋基地與艦隊暴露於中共空軍的	未
目前为止，你谈过几次恋爱	未
目前为止罚球都丢了十几分...	未
目前五大联赛射手榜情况。	未
目前，人在宿州。	未
目前人类可以阻止小行星撞击地球吗	未
目前仓位85今天这个v，惊为天人，我昨天减仓了两层多仓位，今天低点在我发了靠近新低那条微博之后也t了一把，基于的是情绪的打破，说直白一点，跌得多了，需要反人性一下，就像昨天，美股周五还是大跌，但是拉尾盘，昨天尾盘你是不是觉得A股就摆脱美股影响了然后今天继续跌打破你的认知，这就是反人性。在中国做事，聪明人都喜欢反人性，反着来，你最认为怎么样的，结果往往相反。在中国股市，这个道理也无往而不胜，你觉得一致的时候，它突然炸了分歧，你今天觉得泰永分歧了的时候，大资金想打造标杆给你造个一致。今天的v对于前段时间	未
目前以色列只有两个阿拉伯国家的建交国，显然只有它是地区的大国	未
目前全市大部分地区相对湿度都接近100，大家尽量不要打开朝南的门窗吧。	未
目前全市气温普遍又降到9-10，然而不仅气温低，部分地区风力也有5-6级，各位睡前注意安置好阳台物品	未
目前农村空置宅基地有3000万亩，相当于目前所有城市建成区的37，专家建议允许城市人购买，如果宅基地政策放开了，城市居民会不会去农村买个宅子没事的时候去钓钓鱼泡泡茶，或者干脆装修成私人会所，周末了去打牌喝酒，甚至北方退休的老人直接到南方农村养老，因为气候好一些，有这个可能吗	未
目前南京水务集团正在组织抢修，供水节水管理处将及时跟进了解抢修情况。	未
目前南京江东门隧道无法通行，已临时封闭，大家注意安全，提前绕行。	未
目前发现的《更路簿》版本有20余种	未
目前各家媒体给你仁安排的	未
目前咱们也抓了他们两个，不行的话继续抓	未
目前因为全面屏逼迫，厂商做出来的解决档案有：刘海水滴升降滑盖打孔双屏，哪一种会最后成为主流	未
目前因大雾影响，北仑辖区所有高速都已经封闭，北仑收费站车流聚集较多。请过往车辆绕道通行	未
目前国内市场确实对端游不太友好，从上线时的四面楚歌一路走到现在，《逆水寒》在做出变化和努力。	未
目前土地流转.通信.新股新次股.高送转股.农业股，白酒股等暂时领先	未
目前地球上拥有完全成熟的核动力航空母舰，只有美国一家。航母用核反应堆的研制难度很大。例如在潜艇用核反应堆研制方面功底深厚的苏联，直到解体也没有开发出大功率的可靠的安全性好的航母专用核反应堆。 于是髪国人就做了个大胆尝试，在戴高乐号核动力航空母舰上直接采用核潜艇的反应堆。采用两台K-15一体化压水堆，这座反应堆最初是为了凯旋级战略核潜艇和未来的梭鱼级攻击核潜艇研制的。单堆的功率只有可怜的3.8万轴马力，总功率7.6万轴马力。这对于排水量4.2万吨的戴高乐号航母来说是小马拉大车。相比之下，中国航母辽宁舰	未
目前地球上拥有完全成熟的核动力航空母舰，只有美国一家航母用核反应堆的研制难度很大例如在潜艇用核反应堆研制方面功底深厚的苏联，直到解体也没有开发出大功率的可靠的安全性好的航母专用核反应堆 于是髪国人就做了个大胆尝试，在戴高乐号核动力航空母舰上直接采用核潜艇的反应堆采用 ...全文	未
目前处于这个现状，介绍的不想处，自己找又找不到，家里边又催。哎，活在当下我真羡慕以前那些刚生下来就定了娃娃亲的！	未
目前太平洋实际上是不太平的，将来为我们管了，才算是太平洋1958年6月28日中央军委扩大会议小组座谈会讲话	未
目前，学府街南向北方向美茵街双向车流量较大，提醒广大驾驶员朋友雨天路滑，注意减速慢行，遵守交通规则，听从执勤人员指挥。	未
目前，宁河一中片区，这个地方搬迁工作暂停，具体启动日期另行公告	未
目前已拖车166辆！违停整治风暴持续中 你的爱车是否会被拖移	未
目前已有5省叫停货车双证！离全国取消不远了！	未
目前市面上已经有了无色无味的液态冰毒冰毒吸一次必上瘾，如果被人有意投毒，就太可怕了//@我不是谦哥儿://@午后狂睡: 珍爱生命，远离毒品。//@稻穗kitty:珍惜生命 远离毒品，还是这句slogen	未
目前我已经开了3000多公里了，感同身受	未
目前拉了几位一起在弄这事找问题的 作图的 想文案的顺便申请了话题这事不会糊弄过去的	未
目前是上海综合指数的点位偏离大了一些，主要原因是50指数破位下跌造成。而创业板指数的1256点和深成指的7370点偏离不算大。理应有一波反弹	未
目前本市城区气温为-8左右，气温较低，体感寒冷，再加上北风较大，不想出门啊一定要做好防风防寒，尤其是头部脚步和背部保暖，谨防感冒和心脑血管疾病抽烟的童鞋们，这大风天儿的，可不能乱扔烟头，（没风也不行啊大风更不行！）风干物燥，太危险，谨防火灾	未
目前本市正处于大雾黄色预警中，部分高速路因大雾采取封闭措施，具体有：京平高速 吴各庄至市界，双方向京台高速 佃子出京方向出行请关注路况信息，并注意交通安全	未
目前正弘城店中午11点12点间下午5点半左右来大概率不用排队哦@白石的深夜食堂	未
目前，江东快速路南向北方向的主线依然在封闭中，所有车道全部走辅道。为了应对即将到来的晚高峰，交警四大队也对江东快速路进行了三层管控，一，应天高架由东向南下高架的匝道封闭二，江东门隧道南进口主线封闭三，流量如果持续增大，江东中路水西门大街路口南向北将实行封闭。	未
目前，@深圳交警机动训练大队 的蜀黍正在调查，这样的操作，实属少见，分析一下存在哪些危险！//@深圳交警: 随手拍举报交通违法 时间地点提供一下，请@深圳交警机动训练大队 严查！这样开车，到底是想干啥	未
目前火箭虽遇三连败，但队员们仍持有一定的信心。哈登也认为，球队在过去几场比赛中各方面都有了进步：我们没啥问题，只需要继续好好打球，分析比赛录像，个人能力和球队都努力变得更好。	未
目前现场缓行车辆较多，李家塘互通往北方向实施分流管制！	未
目前的A股市场仍然是一个散户市，这是确信无疑的。而且在未来相当长一段时期内，A股仍然还会是散户主导的市场。	未
目前的积分情况如下图PS：另外说一下发别的队新闻的问题：有很多小伙伴总问我为啥总发别的队的东西其实吧，这个东西得辩证地看。我发的一般都是争冠形势啦对手动态啦，或者旧将旧帅们的消息，你要说光发切尔西的东西，不发英超对手欧联对手之类的东西，那谁知道咱们现在处在啥环境里呢不 ...全文	未
目前的积分榜形式仍然在前四意甲联赛	未
目前看没凶兆。	未
目前看游资被监管后，4个板就是天花板了，尤其所谓的龙头品种，不是低位买的，千万别追高！昨天创投龙头集体阵亡后，知识产权龙头光一科技，今早卒！期货概念龙头，新华锦，今早卒！汽车降低关税概念龙头万通智控，今早卒！庄股龙头朗迪集团，熄火！。。。。等等，这么恶劣的环境，又回到了监管放宽前的状态，操作难度剧增！多看少动，没有买卖没有伤害！静等下一次的好机会。	未
目前真正迫切需要代购婴幼儿配方奶粉的国家是澳大利亚和英国。不出意外的话，很快就会有专供英国市场的欧洲代购了。希望代购们能积极发挥人道主义精神，可以考虑一下将中国产的低端奶粉代购到英国去。	未
目前研究发现，甜食和奶制品（全脂奶和脱脂奶）都会加重痤疮。爱长痘痘的同学们，爆痘期间一定要注意了。	未
目前给大家展示一年的账户，就是个短线小账户，解闷玩的。不是侠哥的主力。主力部队的下一小目标是先赚一个亿的。能不能实现那不管，目标还是要有的。	未
目前脉脉仍处于从零到一的阶段，未来还有一到十和十到百。脉脉CEO林凡说他们的志向是成为千亿美金的公司，现在也才十几亿美金，还有很长的路要走。 脉脉林凡：中国社交江湖，尚未满座	未
目前至少有三十款手机App可以提供电话标记服务，在用户接听来电时或者拨打电话时，这些App均能显示号码的标记信息。一些公安部门电话都被标记了不实信息，有的甚至是被恶意标记为快递电话中介电话。而因为电话号码被错误标记的情况越来越多，一些网站也做起了收费查询标记来源的买卖。	未
目前苏城农贸食品量足价稳  后期菜价呈向下走势	未
目前英超积分榜的排列顺序到赛季末会发生什么样的变化	未
目前街面雪不小，大家在路上注意安全	未
目前西甲联赛积分榜，巴萨少赛一轮与塞维利亚和马竞同分....可怕	未
目前西部和东部有短时零星小雨，预计半小时左右结束，今天我市大部分地区仍会陆陆续续出现短时零星小雨，出门仍需带好雨具	未
目前貌似没人占用哦，//@司马3忌: 建议考虑@神油七叔	未
目前货机市场上，的确在这个大小级别上的确出现了断层。目前波音737和767货机之间出现了断层，只能改装退役的757客机。而竞争对手空中客车A321的确越飞越远，但客改货也才刚起步，没有全新货机解决方案。	未
目前还有部分社团未领取衣物，请各位看见的小可爱尽快通知一下自家社团 考虑到衣物已经打包捆好有点占仓库地方对我们的发货造成了一定的不便，过一周再无社团认领的话就顺延给其他社团啦	未
目前这样儿	未
目前这账号人也不多，要不然试着把帝国系列放个全版出来	未
目前，镇海辖区所有高速进口已全部开放。@镇海交警	未
目前阿圭罗能否出战同切尔西的比赛依然要画上一个问号，在启程前往伦敦之前，曼城需要通过周五的最后一次训练，来了解阿坤的身体是否符合出场要求	未
目标库尔德武装！土总统威胁数日内进攻叙东北部	未
目测这货在进入动物园以前，有一段很长的吸烟史。。。	未
目测雀心眼er都是这样希望19年雀心眼er都可以脱单	未
目的地: 瓦伦西亚欧冠曼联足球俱乐部	未
目睹亲人被杀，自己沦为性奴，这个90后姑娘打败特朗普获诺贝尔和平奖	未
目睹动物演员被遗弃 孙俪心疼收养《甄嬛传》白猫	未
目睹海军也门撤侨 远洋船员辞职从军	未
目瞪口呆。。。	未
目瞪口呆！13岁少年竟偷开父亲汽车送小伙伴来忻城，通宵往返160公里...	未
目瞪口呆. jpg	未
目瞪口呆！广西13岁少年竟偷开父亲汽车送小伙伴，通宵往返160公里	未
目瞪口呆！柳州13岁少年竟偷开父亲汽车送小伙伴，通宵往返160公里	未
盯唇狂魔，要忍不住亲上去了//@狮子尾五虐_://@-加州墨织-:嘿！回神了！//@且嗔:怪不得对戏的时候会不自觉亲上去//@__Aqua六音:???注意一下	未
盯着我盯着我	未
盱眙城区电动三（四）轮车禁止上路，有车怎么办惠民政策来了	未
@盱眙粤海水务 别再逃避责任了	未
盲人歌手银行办业务遭拒 信息无障碍受关注	未
盲人路怒	未
盲人过马路你会搀扶吗？南京街头发生的一幕瞬间戳中你的心	未
盲僧基础连招少了最后一步就没有灵魂（图片来源于网络）英雄联盟	未
盲区，除了车前车后靠人眼或借助外后视镜看不到的位置外，其实还有因车身构造而导致的A柱盲区内轮差盲区，因驾驶技巧而导致的超车盲区泊车盲区等等，今天我们来教您如何扫盲，排除隐患。	未
盲道铺在停车桩下 已返工整改|荔枝追踪	未
直以为塞小卡片的是男生，这次倒是有点意外了	未
直击00后新兵野营拉练：3天负重20余斤步行百余公里	未
直击ofo退押金现场：抱孩子母亲落泪，挣100块容易吗	未
直击@XP-何小鹏 ：小鹏G3在24小时内销售1573台小鹏汽车董事长何小鹏今晚在朋友圈宣布，从昨晚（12.12）发布会后，小鹏G3在24小时内销售了1573台 他表示，智能汽车核心是运营，制造只是基础，未来小鹏会经历两个月左右产能爬坡，希望能在春节过后实现大规模交付直击何小鹏：小鹏G3在24小时内销售1573台	未
直击中国棍棒教育家庭，爷爷打爸爸老子打儿子，儿子又狠揍老子	未
直击中国电视大会丨短视频围攻下的电视，要这样突围！	未
直击中老缅泰湄公河联合巡逻执法船艇实操演练	未
直击人类基因组编辑国际峰会：贺建奎尚未露面，或已退房离开	未
直击人类基因组编辑国际峰会：贺建奎尚未露面，或已退房离开11月28日，全球的目光聚焦到了香港大学李兆基会议中心，日前宣布首例免疫艾滋病的基因编辑婴儿诞生的南方科技大学副教授贺建奎本应现身第二届人类基因组编辑国际峰会。但据香港当地媒体报道，贺建奎在11月27日已经从主办方安排的酒店退房离开。峰会现场人士也表示，11月27日所有嘉宾全员合影时，叫到贺建奎名字时他并未出现。（澎湃）直击人类基因组编辑国际峰会：贺建奎尚未露面，或已退房离开	未
直击今早占陇一商铺突然失火	未
直击今早普宁市占陇镇一商铺突然失火	未
直击！仲恺大道部分路段围蔽首日，现场交通状况如何	未
直击何小鹏：与李斌赌局是双赢 目前没有上市时间表在今日的媒体沟通会中，小鹏汽车董事长再度回应了与李斌的万辆交付赌局，并表示双方的的赌注发生了一些变化。何小鹏认为最终李斌赢的概率非常大，但对于新造车势力来说是双赢的赌局，赌局的核心点是我们都应该把品质做好。直击何小鹏：与李斌赌局是双赢 目前没有上市时间表	未
直击！凌晨，虞东公路古里一路口轿车飞入河中，离奇的是	未
直击印尼巽他海峡海啸现场：海滩一片狼籍(组图)	未
直击  又有32人无证驾驶被行拘！澄海交警开展交通整治统一行动，你还敢心存侥幸吗	未
直击可怕的奥斯维辛集中营焚尸炉每天可焚烧8000具尸体	未
直击  可恶！这地方有人灌装假燕京等大品牌桶装水	未
直击台湾选举现场韩国瑜：卖菜郎的逆袭	未
直击四川滑坡救援现场：像剥洋葱一样剥离废墟	未
直击四川滑坡雨夜大救援：像剥洋葱一样剥离废墟	未
直击国家公祭日！全国多地悼念南京大屠杀遇难同胞今年的12月13日是第五个南京大屠杀死难者国家公祭日，也是南京大屠杀惨案发生81周年。今天，全国多地同步举行默哀活动，记者在北京南京重庆沈阳和哈尔滨，实时直播当地纪念仪式。国行公祭，祀我国殇！@中国新闻网 中国新闻网的微博直播 .	未
直击国家公祭日！全国多地悼念南京大屠杀遇难同胞今年的12月13日是第五个南京大屠杀死难者国家公祭日，也是南京大屠杀惨案发生81周年今天，全国多地同步举行默哀活动，记者在北京南京重庆沈阳和哈尔滨，实时直播当地纪念仪式国行公祭，祀我国殇！@中国新闻网 中国新闻网的微博直播 .	未
直击国际咏春拳大赛现场背后的坑，原来比赛还能这样，寻止戈桥	未
直击宁乡警营冬季大事件	未
直击宜春人身边不文明现象！随手拍第一期来了	未
直击审计一线  当审计遇上黑科技	未
《直击山东人竟靠发布会现场卖餐饮为生，KOL生活如此艰辛》	未
直击峰峰警方40天抓获67名逃犯（附抓捕视频）	未
直击！开展道路交通秩序大整治，澄海交警又有新动作	未
直击张家口化工厂爆炸事故搜救现场11月28日0时41分，河北张家口市桥东区河北盛华化工有限公司附近发生一起爆炸起火事故，已造成22人死亡22人受伤，50余辆车被烧毁。目前搜救工作和事故原因调查仍在进行中。@新京报 记者正在现场直播最新进展。 腾讯新闻的微博直播 .	未
直击惊心17小时：抓捕保险柜大盗	未
直击晋城某县(市/区)公安局主要领导变动！	未
直击武警新兵野外徒步行军拉练	未
直击武警魔鬼周极限训练：负重不低于30公斤 每天训练不少于16个小时这样的强度，一般人早趴下了，而参加武警海南省总队魔鬼周极限训练的特战队员们，还要完成深入丛林追击暴恐分子步手枪夜间搜索射击高地俯角射击抢占山顶特种狙击野外生存极限体能夜间按图行进抗干扰 ...全文	未
直击武警魔鬼周极限训练：负重不低于30公斤 每天训练不少于16个小时这样的强度，一般人早趴下了，而参加武警海南省总队魔鬼周极限训练的特战队员们，还要完成深入丛林追击暴恐分子步手枪夜间搜索射击高地俯角射击抢占山顶特种狙击野外生存极限体能夜间按图行进抗干扰记忆30公里武装奔袭等十余个特战科目。特战尖兵就是这样炼成的，大写的服！（蒋波 雷辙）	未
