男子结婚朋友随礼6.66元，喝了4瓶五粮液，带走2包中华这种奇葩朋友可以拉黑了	未
男子结婚朋友随礼6.66元 喝完4瓶酒还带走2包中华杨先生结婚，婚礼前一晚，他带朋友们吃饭，8人喝了4瓶五粮液，还顺带拿走了两包中华烟之后，大学室友给他在微信上发了红包6.66元这让杨先生很郁闷，并感觉难以接受究竟是杨先生太小气，还是朋友们太渣 via勒是山城	未
男子结婚朋友随礼6.66元 喝完酒还带走2包中华杨先生今年28岁，家住南岸区弹子石，今年刚结婚的他就遇到了这样一件奇葩的事，多年未见的大学室友李先生获邀前来，并给他在微信上发了微信红包，打开一看只有6.66元我给他们定的都是五星级酒店，没想到他随礼真的只随了6.66杨先生 ...全文	未
男子结婚朋友随礼6.66元 喝完酒还带走2包中华烟	未
男子结婚朋友随礼6.66元 喝完酒还带走2包中华烟杨先生今年28岁，家住南岸区弹子石，今年刚结婚的他就遇到了这样一件奇葩的事，多年未见的大学室友李先生获邀前来，并给他在微信上发了微信红包，打开一看只有6.66元。我给他们定的都是五星级酒店，没想到他随礼真的只随了6.66。杨先生很郁闷，父母安慰也许本来是666，发错了。但等到李先生结婚，在婚前单身聚会上，杨先生聊起这事，才发现李先生在其他几个朋友结婚时也都只给了6.66。最终，杨先生和朋友们都只给李先生发了10块钱红包，没有去参加他的婚礼	未
男子结婚纪念日次日杀妻后发视频给岳母：我杀了你女儿河南商丘男子李磊在和妻子结婚5周年纪念日次日，将妻子杀死。案发当晚，岳母接到李磊电话我杀了你女儿，及一段现场视频，妻子脖子被砍断一半。据悉，李磊曾多次家暴王平。因涉嫌故意杀人，目前此案已移交法院。网页链接	未
男子结婚纪念日次日杀妻后发视频给岳母：我杀了你女儿河南商丘男子李磊在和妻子结婚5周年纪念日次日，将妻子杀死案发当晚，岳母接到李磊电话我杀了你女儿，及一段现场视频，妻子脖子被砍断一半据悉，李磊曾多次家暴王平因涉嫌故意杀人，目前此案已移交法院网页链接	未
男子结婚纪念日次日杀妻后致电岳母：我杀了你女儿，家人希望用30万私了江苏昆山，8月，河南男子李磊将妻子王平杀死在租住的宿舍里。行凶后，李磊致电岳母说我杀了你女儿，并发来案发现场视频。李磊被抓获后，李家人曾委托所在村委会主任找到王平所在村村委会协调，希望用30万私了此事。 （上游新闻）网页链接	未
男子结婚纪念日次日杀妻后致电岳母：我杀了你女儿，家人希望用30万私了江苏昆山，8月，河南男子李磊将妻子王平杀死在租住的宿舍里。行凶后，李磊致电岳母说我杀了你女儿，并发来案发现场视频。李磊被抓获后，李家人曾委托所在村委会主任找到王平所在村村委会协调，希望用30万私了此事。  ...全文	未
男子结婚纪念日次日杀妻后致电岳母：我杀了你女儿，家人希望用30万私了江苏昆山，8月，河南男子李磊将妻子王平杀死在租住的宿舍里。行凶后，李磊致电岳母说我杀了你女儿，并发来案发现场视频。李磊被抓获后，李家人曾委托所在村委会主任找到王平所在村村委会协调，希望用30万私了此事。 男子结婚纪念日次日杀妻后致电岳母：我杀了你女儿	未
男子结婚纪念日次日杀妻后致电岳母：我杀了你女儿，男方家人希望用30万私了江苏昆山，8月，河南男子李磊将妻子王平杀死在租住的宿舍里行凶后，李磊致电岳母说我杀了你女儿，并发来案发现场视频李磊被抓获后，李家人曾委托所在村委会主任找到王平所在村村委会协调，希望用30万私了此事  ...全文	未
男子结婚纪念日次日杀妻 打电话岳母：我杀了你女儿	未
男子结婚纪念日次日杀妻 打电话给岳母：我杀了你女儿	未
男子给女友发红包8万6，谁知红娘闺蜜和丈母娘竟是	未
男子给荡秋千睡着的女儿拍照 竟暗藏娃患血癌征兆	未
男子缓刑期内还醉驾，或收监！	未
男子缓刑期间当9岁女儿面杀害前妻 司法局评估报告曾称其关心妻女据华商报报道，6月30日晚，陕西省延安市，男子高某举刀砍向刚与其离婚4天的前妻朱某。女儿小燕子认出爸爸，被妈妈推开后，用陌生路人的手机报警。小燕子称，妈妈平时跟她说过，我如果大喊，你就赶紧跑，不要管我。据悉，高某因敲诈当地官员，正处在缓刑期间。高某于28岁与16岁的朱某举行了婚礼，在此之前，高某曾有过两段婚姻，还有一对儿女。据朱某家人说，由于高某嫌妻子朱某接触外人，他曾将朱某锁在家中，并多次殴打过朱某，经过双方家长的调解，两人和好继续	未
男子网上相亲 2杯红酒喝掉1700元	未
男子网恋一个月，发出红包8万6，谁知女友红娘丈母娘竟然	未
男子网聊遇男知音，那个他却不是那个他	未
男子网购“金银花”治感冒 喝的竟是“断肠草” 结果进了ICU	未
男子翻屏蔽门闯入地铁轨道，深圳3号线今早大延误	未
男子翻铁门腿部被钢筋刺穿 保亭消防火速救援	未
男子聚会见到10年未见的兄弟，回家性情大变	未
男子脑袋插着一把刀，活4年自己都不知道！医生愣住了	未
男子腰上长疹子 邻居在他腰间写下这句话来治病	未
男子腹如刀绞，医生在他肚子里竟然看到这东西！	未
男子自制房车拉着爱人去西藏	未
男子自制“房车”拉着爱人去西藏 全程徒步不搭车	未
男子自制挖掘机，不耗油不用电！	未
男子自办爱嗨嗨舞曲网 结果被执法人员找上门	未
男子自助结账区耍花招，598元的红酒只花39元	未
男子自拍视频说要挑战整个龙口，结果...	未
男子自称玉皇大帝女婿，手写玉旨封神收徒，竟有人相信	未
男子花1万5买生发产品！头发没长出来，结果	未
男子花1万6在南宁租房，入住后被要求搬走！这钱还能要回来吗	未
男子花1万买辆二手本田CRV，修车工：买这比买哈弗H6好多了	未
男子花390英镑买二手保险箱 里面竟有580万英镑现金	未
男子花390英镑买二手保险箱 里面竟装了580万英镑	未
男子花390英镑买二手保险箱 里面竟装了580万英镑保险柜原主人委托律师联系这名幸运买家，希望出价465，000英镑（60万美元）拿回这笔现金，但这个提议被拒绝。随后原主人将价格提到了930，000英镑，成交。微评：明显不是拾金不昧。但这样的处理结果，似乎又能让社会接受。男子花390英镑买二手保险箱 里面竟装了580万英镑	未
男子花5年将14吨玉石雕刻成鱼缸，专家无法评估其价值！	未
男子花70元一斤买螃蟹，开壳后看到的一幕让他惊呆了	未
男子花三年搜集妻子出轨线索 用盐酸泼在情夫脸上	未
男子花百万整形成肌肉男，这肌肉你喜欢吗	未
男子荒废水库里钓到珍宝，市场难求，估价至少500一斤！	未
男子荒野求生12天，被救后他说看到满山都是被枪扫射的人	未
男子街上闲逛与不同人聊天，每次成交竟能获利上千元！真相是	未
男子街头粉笔画蒙娜丽莎走红	未
男子街头被人强行剪头发！网友：是刚下班的托尼老师干的吗	未
男子衣着光鲜，却为了42块钱干出这档事，脸都丢尽！	未
男子被10根30厘米长钢钉刺穿身体，医生紧急施救成功	未
男子被10根30厘米长钢钉刺穿身体 医生紧急施救成功49岁的周某作业时被机械手臂砸到，10根长达30厘米粗约1.5厘米的钢钉刺穿其右胸部右肩部右手部。钢钉钢板异物对术前影像检查造成极大干扰，但湘雅医院手显微外科团队迎难而上，顺利取出全部钢钉。周某最终转危为安。（胆小者慎点图片）	未
男子被一两吨重的钢架砸到头变形，颅脑损伤危在旦夕！	未
男子被困在狭小的棺材里，还不断有沙子往里灌，原来是被活埋了！	未
男子被拐25年后携妻回家 补办婚礼	未
男子被暴打出血，女友收到前男友短信：问他爽吗	未
男子被查酒驾不服：我没喝酒，只是吃了这道菜！真相是	未
男子被流浪狗赖皮上，无奈妥协收养它，带去医院后才知捡到宝了	未
男子袭击清洁员救蟑螂：它也有生命！清洁工用喷雾机向坑渠喷杀虫剂，23岁男子游某大叫蟑螂也是有生命的，随即用锯子袭击清洁工，令其手腕骨折，肌腱断裂。游某在庭上辩称自己有宗教信仰，相信众生平等，当时只想打走喷雾机保护蚊虫。陪儿子出庭的游母极力辩解，称从小就教儿子爱护动物。	未
男子见初雪兴奋爬上护栏玩倒立，结果	未
男子见初雪兴奋爬上护栏玩倒立，结果这种激动北方人不会懂	未
男子见初雪激动爬护栏上倒立，结果摔下陡坡（现场）	未
男子见警察弃车就逃，原来是名瘾君子......	未
男子视频喊话交警干什么吃的我酒驾没人查后入狱6个月	未
男子讨了堂客就去打工 ， 2年后回老家傻眼了	未
男子讨了老婆就去打工 ， 2年后回家傻眼了	未
男子说不走就杀了你，还抢警察的枪，你猜他为何这么疯狂	未
男子豪掷千金买6枚大钻戒求婚 网友:贫穷限制想象	未
男子豪掷千金买下6枚大钻戒求婚  网友：贫穷限制了想象每日邮报12月4日报道，近日，美国男子32岁的布朗为确保求婚万无一失，于是他精心准备了六枚巨大的钻石订婚戒指，让未婚妻挑选现年32岁布朗，曾是一名职业橄榄球运动员，后来转行当了模特和演员他在Instagram上写道，我和她一起赢 ...全文	未
男子豪掷千金买下6枚大钻戒求婚网友：贫穷限制了想象《每日邮报》12月4日报道，近日，美国男子32岁的布朗为确保求婚万无一失，于是他精心准备了六枚巨大的钻石订婚戒指，让未婚妻挑选。现年32岁布朗，曾是一名职业橄榄球运动员，后来转行当了模特和演员。他在Instagram上写道，我和她一起赢得了生命的胜利，所以她值得从第6枚戒指中做出选择。男子豪掷千金买下6枚大钻戒求婚 网友：贫穷限制了想象	未
男子赴婚宴随礼6.66元 喝4瓶五粮液还带走2包中华烟朋友结婚随礼，一般你随多少随礼金额可能跟各地风俗有关，但在某种程度上，会影响朋友间的关系假如你结婚朋友只送了6.66元，却来大吃大喝，你会怎么想网页链接	未
男子趁浴客熟睡偷手机 为解锁对着机主的脸狂刷	未
男子足球赛薅头发不多见啊	未
男子跑多地给自己寄快递 原来是在做这种勾当	未
男子跑马拉松两次昏迷倒地，医生救醒后还要跑！拦都拦不住11月25日，在2018绍兴国际马拉松上发生惊魂一幕，一名选手身体状况不佳，腿部肌肉痉挛倒地不起，赵建峰医生觉得他可能心脏有问题，想劝阻他停止比赛。没想到这位选手又再次加入马拉松大部队中。刚跑出去50米，这位选手再次摔倒，赵医生赶紧为他做心肺复苏。5分钟后这位选手终于恢复了呼吸和心跳。可令人惊讶的是，他竟然又打算起身去继续跑步。最终在赵医生志愿者和警察的拦阻下，这位选手被送往医院进行治疗。赵医生后来得知这位选手是突发性房颤，如果当时没有被及时拦	未
男子跑马拉松两次晕倒，被医生做心肺复苏救醒后还想跑	未
男子路边停车睡觉，一查竟是酒驾12月12日清晨，一男子将车停靠在南宁市秀厢大道三秀市场路口后，在车内呼呼大睡交警巡逻时将该男子叫醒，经酒精测试，他已经达到饮酒驾标准该男子一开始并不承认自己酒后开车，说是朋友将他送到这个路口的民警调出监控，证实了他就是驾驶员最后，民警对唐某 ...全文	未
男子路边停车睡觉，一查竟是酒驾12月12日清晨，一男子将车停靠在南宁市秀厢大道三秀市场路口后，在车内呼呼大睡。交警巡逻时将该男子叫醒，经酒精测试，他已经达到饮酒驾标准。该男子一开始并不承认自己酒后开车，说是朋友将他送到这个路口的。民警调出监控，证实了他就是驾驶员。最后，民警对唐某进行了批评教育，处以1000元罚款，记12分，暂扣驾驶证6个月。详情：网页链接	未
男子路边晕倒 女孩怕急救手法不专业直掉眼泪	未
男子蹲守6天找到捡手机的人，女子拒不归还：捡到就是自己的12月6日，湖南王先生的妻子丢了手机调看监控发现，一女子捡走手机，王先生蹲守6天后找到该女子但女子对捡手机后意图据为己有毫无歉意，反而认为quot捡到的东西就是自己的quot王先生在警方帮助下拿回手机，仍决定起诉该女子你怎么看（ ...全文	未
男子蹲守6天找到捡手机的人，女子拒不归还：捡到就是自己的12月6日，湖南王先生的妻子丢了手机。调看监控发现，一女子捡走手机，王先生蹲守6天后找到该女子。但女子对捡手机后意图据为己有毫无歉意，反而认为quot捡到的东西就是自己的。quot王先生在警方帮助下拿回手机，仍决定起诉该女子。你怎么看（潇湘晨报）蹲守 6 天找到捡手机的人，女子拒不归还：捡到的东西就是自己的	未
男子蹲守6天找到捡手机的人，女子拒不归还：捡到的东西就是自己的12月6日，王先生的妻子将手机掉落。调看监控视频发现，一女子捡走手机，王先生蹲守6天后找到该女子。但该女子对捡手机后意图据为己有毫无歉意，反而认为quot捡到的东西就是自己的。quot王先生在警方帮助下拿回手机，仍决定起诉该女子。	未
男子蹲守6天找到捡手机的人，女子拒不归还：捡到的东西就是自己的12月6日，王先生的妻子将手机掉落调看监控视频发现，一女子捡走手机，王先生蹲守6天后找到该女子但该女子对捡手机后意图据为己有毫无歉意，反而认为quot捡到的东西就是自己的quot王先生在警方帮助下拿回手机，仍决定起诉该女子	未
男子身穿＂吃鸡装备＂手拿长枪大跳广场舞 吓坏路人	未
男子身背5命被通缉:老人孩子都没放过 喜欢＂泡妞＂	未
男子车辆被法院查扣 一路尾随趁司机加油把车开走	未
男子轻生被前女友舍身相救，当场再续写爱的故事，想不到结局...	未
男子连做七天恶梦，刚下葬的母亲梦中呼救，挖开坟后太意外了！	未
男子连偷四家女性内衣：非常想成“网红”	未
男子连续4个月在小区高空抛狗屎，被抓后称工作压力大。（封面新闻）	未
男子送女友上班，骑电动车被撞飞在空中！交警：电动车负全责！	未
男子造成一死一伤警方最高悬赏30000元通缉他！	未
男子逼停公交9秒殴司机10拳 公交车狂晃司机未还手	未
男子遇到蜀黍夺路逃跑，原来他是...	未
男子酒后当女儿面虐杀宠物狗 小狗哀嚎响彻小区	未
男子酒后撬五家店铺 就像神游一样12月5日晚，杭州男子李易和朋友酒足饭饱后，一脚将一家空调店大门踹开，经过一番搜罗拿了把锁离开随后又撬开了五家店的大门才回家被抓后，李易称其他东西都被丢在了路上，就只留了两部手机，就想搞破坏，顺便偷些东西，一切就像神游一样 ...全文	未
男子酒后杀多年好友埋在厨房地下 导火索为1000元	未
男子酒后点燃巨型圣诞树 一审获刑5年	未
男子酒后跌下悬崖边 工作人员救援遭怼:不要你们管	未
男子酒后骑电动车 撞死路边等公交车的老太(图)	未
男子酒驾被查！还自称我喝的是药酒，不是酒！	未
男子酒驾遇查，开车跑进刑警队：知道这是哪吗	未
男子酒驾遇查拔腿就跑交警：我是二级运动员，你能跑过我近日，湖北当阳一男子酒后驾车在荆宜高速公路遇查，其趁@湖北高速交警当阳大队交警不备拔腿就跑，没想到百米后即被抓获。面对交警我是国家二级运动员，你能跑过我啊我让你先跑100米！，男子无奈表示，真的跑不过。经检	未
男子醉酒后当女儿面虐狗深圳南山区西海明珠小区有人在阳台虐杀狗，脚踢拳打刀棍状物击打，狗狗最终死亡。据悉，男子施暴时，他年幼的女儿也在场。物业管理处表示，男子当晚疑似醉酒。邻居报警后，男子被警方带走。网页链接	未
男子醉驾将车开进海里 跳车后不上岸竟往深水里游	未
男子醉驾撞人逃逸，返回现场打探消息，结果	未
男子醉驾送老父急救 交警亲自代驾到医院后再执法23日早高峰在广东珠海斗门，交警执勤时发现一辆小车不断变道插队，涉嫌危险驾驶，示意其停下，小车竟不理会。强制拦停后，发现司机曾某身有酒精味，曾某此时疾呼，车上还有其胃出血复发的老父，再不送医来不及了！交警见状，立即安排一人为曾某代驾，一人在前方用警车开路，将曾某父亲顺利送达医院。随后了解到，曾某事发前一晚参加婚宴时喝了一斤多白酒，但早上突然接到父亲求救电话，就在宿醉状态下开车上路了。目前，曾某已被刑拘，但他对交警表示了感谢。（珠海交警）男子醉驾送老爸急	未
男子银行柜台前上演幻影手，1秒偷走2000元！受害人却不愿报案	未
男子银行柜台监控前上演quot幻影手quot 一秒偷走柜台2千元一般而言，银行的监控设施相对完备，安保较为严密。可是，有人竟然在这样的情况下，当着银行柜员的面多次盗走现金，手法神速。这究竟是怎么回事呢男子银行柜台监控前上演幻影手 一秒偷走柜台2千元	未
男子银行柜台监控前上演＂幻影手＂ 1秒偷走2000元	未
男子银行柜台监控前上演幻影手，1秒偷走2000元！为什么有受害人不愿报案	未
男子银行柜台监控前上演"幻影手" 一秒偷走2千元	未
男子银行柜台监控前上演“幻影手” 一秒偷走2千元	未
男子长期帮朋友打工却没签合同，受伤后朋友不认账了	未
男子闯红灯被杭州交警拦下，一查竟是现实版光头强12月10日下午，江干交警拦下了一名明目张胆闯红灯的光头男子。民警发现，男子所骑电动车来源不明，要求查看身份证时，男子更加慌张了。经查，光头男子竟是一名网上逃犯！去年6月，他在因盗伐林木罪被立案侦查，为刑拘在逃人员。男子闯红灯被杭州交警拦下，一查竟是现实版的光头强	未
男子陪客户做大保健，服务的人竟然是亲哥的老婆...	未
男子陶醉在自己的歌声中，而旁边的猫就。。	未
男子隐私部位长出“鸵鸟蛋”！和这个爱好有关	未
男子隐私部位长出鸵鸟蛋！和这个爱好有关	未
男子隐私部位长出鸵鸟蛋！因为他爱好这个......	未
男子雇人逼女友喝流产药强行引产 将其拘禁于酒店	未
男子雨天撞车，下来一看对方居然是亲爹	未
男子雪天发现女儿跟陌生男子上了车 真相大跌眼镜	未
男子预知能中千万大奖，狂奔去买，结果你猜中了多少......	未
男子餐厅吃牡蛎咬到硬物 一看是价值4000美元珍珠	未
男子餐厅吃牡蛎咬到硬物 喜提价值4000美元珍珠	未
男子餐馆内突然昏倒，交警这套动作救了他的命！ 微博视频	未
男子饭店内伸手猥亵女孩，被女孩抡起凳子打	未
男子饭店点了一碗面条，准备大吃时，揉眼一看后，不淡定了	未
男子驾考11年获驾照、一直卡在科目一，自称绝不是马路杀手	未
男子驾越野车爬49级台阶闯孔庙 发视频炫耀被拘留	未
男子驾车堵派出所大门 自称喝了酒还无证开车	未
男子驾车顶着辅警狂飚 200多米后把人甩下逃逸	未
男子驾车顶着辅警狂飚，200多米后把人甩下逃逸	未
男子驾车驶入乡道躲避检查 无证套牌仍被封开交警查获	未
男子骑车舞红缨枪 警方：系赵云崇拜者25日，江苏镇江，一男子骑自行车舞红缨枪，民警迅速赶往现场将其控制并移交辖区派出所。经查，20岁男子柏某某，患有精神疾病，因崇拜三国人物赵云，网购红缨枪骑自行车舞枪，因未造成人员伤亡及财产损失，公安机关决定对其批评教育，责令家属送医治疗，严加看管，并对红缨枪予以扣押。 网页链接	未
男子骑车被半挂车碾压身亡，车祸原因不禁让人后怕  重细节平安行	未
男子高喊：我往左，你往右！每日笑话微博	未
男子高烧40℃睡不着觉，张开自己的嘴一看，吓了一大跳......	未
男子高烧40睡不着觉，张开自己的嘴一看，吓了一大跳......	未
男子高速上往车外扔了个烟头，结果安全出行关乎生命！	未
男子高速上往车外扔烟头 结果将自己的车烧着高速收费站附近，一辆着火的皮卡车从高速匝道冲下，幸好收费员及时赶到将火扑灭。司机称，快下高速时，他抽了个烟，然后顺手把烟头往外一扔，这时刚好刮起一阵风。他判断可能是这阵风，把没熄灭的烟头，刮到了后车厢里，点着了里面的塑料笼子，把车烧着了男子高速上往车外扔烟头 结果将自己的车烧着	未
男子高速上抢夺方向盘 被4名乘客死死按住(图)	未
男子高速路上抢司机方向盘，四名乘客死死把他摁住！	未
男子高速路上施展格斗术，和民警battle！却称以为自己在做梦	未
男子高铁上抽烟打乘警，乘客：他堵在过道用裤裆位置顶人，继坐霸后高铁又出烟霸，必须严惩！以后禁乘高铁吧高铁上抽烟打乘警	未
男孩不停开关电梯家长视若无睹 被困后急忙找物业	未
男孩为拍抖音将手伸进运行中的洗衣机，手臂断成三截！	未
男孩从12米高屋顶摔落砸朋友背上，两人毫发无损！	未
男孩儿请回答	未
男孩全家已连夜搬家12月5日上午10时10分，记者从振兴小区附近的一家中介处了解到，黄良义的出租房是和其妹妹一家合租的，他们从今年二月开始租住在这里，租期一年1.7万元上午9点50分，记者赶到黄良义位于乐清市虹桥镇振兴小区的出租房，据邻居赵女士透露，凌晨两点多，黄良义一家人连夜搬家	未
男孩动物园喂兔子被咬伤手指 家长索偿：没人提醒我兔子会咬人广西南宁的林先生称，他4岁的儿子在南宁动物园喂小白兔时，几只兔子为了争夺食物，突然跃起将孩子的手指咬出了血。他带孩子打了疫苗，并要求动物园赔偿，但双方目前还没达成一致意见。林先生称，在喂养点，没有任何工作人员提醒他兔子会咬人。园方表示，有立牌提醒严禁用手拿饲料直接喂兔子，但不太可能一对一提醒，家长也是有看管责任的。（南国早报）	未
男孩压力大欲轻生 外卖小哥紧抱救人：只希望孩子能好	未
男孩含了两块吸铁石，舌头遭罪了	未
男孩地铁不让座被踹：如果你太善良，这个世界会让你遍体鳞伤。	未
男孩失联志愿者接到嘲笑电话失联事件真相大白后 男孩失联志愿者接到嘲笑电话然而乐清全民公益快找人负责人郑佰洪却成了受害人，为了寻找孩子他也把自己手机号公布在网上，但现在每天都会接到辱骂和嘲笑的电话...（这也是为什么我经常建议类似寻人信息留派出所电话的原因之一）男孩失联真相大白 志愿者：每天接到嘲笑电话_手机新浪网男孩失联真相大白 志愿者：每天接到嘲笑电话_手机新浪网男孩失联真相大白志愿者：每天接到嘲笑电话	未
男孩子别凑热闹了行吗！该上就上，不该上就不上！预告：晚上 8点 女孩子健身大赛，腹肌啥的都可以，其他的不要露哈	未
男孩子去了会变少女吗//@粽粽粽粽粽粽粽://@喜脉洗脉://@幕斯://@风吹铃铛响叮叮: //@尸姐://@EsczYep:西澳，粉红湖，只有上海广州能直飞到达perth，沿1号公路向北开车6-7百公里，可以在杰拉尔顿坐飞机空中观赏，建议天气晴朗，澳洲春夏季去，不然不粉。	未
男孩子在外一定要保护好自己，太可怕了（来自网友投稿）	未
男孩子在外面一定要懂得保护自己，这些女孩子坏的很呀	未
男孩子在外面注意保护自己	未
男孩子对大姨妈到底有多少误解。	未
男孩子就是心大，扫地机来了都不躲，被扫地机推开才走，女孩们都躲高高了。闹闹是一听到开机就爬高了，六六是靠近的时候窜上去的，就呆呆厉害，可能到时候会骑上去的也只有他。	未
男孩子，注意安全。	未
男孩害怕打针逃跑 警民联手寻找	未
男孩寄信给在天堂的爸爸，收到了回信 三分钟法治新闻全知道	未
[男孩] 寻找1982年出生1986年失踪湖南省花垣县茶洞镇邮电局门口的杨勇	未
