老詹和老司机	未
//@肋骨不是喵:原博主@嘉华爱猫人 已经迫于压力把微博删了并且从众多来爆料的学生口中得知，这种做法已经是这个学校的惯用伎俩了，包括之前食堂爆炸事件希望我主页的各位朋友都能转发起来，把这个事情的关注度提起来，这次不让这个学校继续用打压的态度把事情压下去！ 查看图片	未
肋骨遭西北狼重击，日本空手道高手当场跪地！	未
肌肉对女人的吸引力有多大看看她们这反应有多直接！	未
肌肉照红遍全球！澳洲浩克袋鼠罗杰过世了主人悲痛PO死讯澳洲一只堪称袋鼠界浩克的袋鼠罗杰（Roger），2015年因一张秀肌肉压扁铁桶的照片，瞬间在网路爆红，但它迈入老年后却饱受关节炎之苦负责饲养它的巴恩斯8日在脸书难过表示，被数百万人喜爱的12岁罗杰已过世ETtoday新闻云 报导 ...全文	未
肌肉照红遍全球！澳洲「浩克袋鼠」罗杰过世了主人悲痛PO死讯澳洲一只堪称「袋鼠界浩克」的袋鼠罗杰（Roger），2015年因一张秀肌肉压扁铁桶的照片，瞬间在网路爆红，但它迈入老年后却饱受关节炎之苦。负责饲养它的巴恩斯8日在脸书难过表示，被数百万人喜爱的12岁罗杰已过世。ETtoday新闻云 报导：网页链接 永远不会忘记你的[淚](shelly)	未
肌肉版果郡王，想和你白首不分！	未
肌肉男吃1个月垃圾食品，结果会怎么样	未
肖云镇唐王庄村两家人为了巴掌大的一块地方挣得面红耳赤到底值不值！	未
肖伏清任湖北黄冈市副市长、代理市长(图/简历)	未
肖伏清任湖北黄冈市委副书记 提名市长候选人	未
肖伏清任黄冈市代理市长	未
肖佩安：没拿自己当援疆干部看，这儿就是我家乡	未
肖八肖四全背会能拿55分吗	未
肖央携新片上海首映 自曝和杜鹃王晓利皆有吻戏	未
肖央新片自导自演 小沈阳：他每场戏都拍很多遍	未
肖央自导自演《天气预爆》	未
肖央自编自导自演《天气预爆》	未
肖央谈＂跨界经历＂：《天气预爆》是有温度的电影	未
@ 肖子韩。	未
肖家河古桥能否重见天日？民间学者欲为其争取文物身份	未
肖庆康深入城区检查指导污水管网铺设和市区污水处理厂建设工作	未
肖扬一蓑风雨任改革至今犹怀法治梦	未
肖旗篇丨在宝丰，有一种逛街叫赶会 肖旗老乡转起来！（文中附全县会谱）	未
肖知兴：我接触管理30年，才发现她原来是这么陌生的一个女子	未
肖祥洪:把荣昌陶做得"上得厅堂 下得厨房"	未
肖编辑杂谈 一会晚上吃点啥呢	未
肖编辑杂谈 全巴黎胆最肥的车主	未
肖编辑杂谈 泰勒/杰伊拉维奇尼，今年9岁。3岁时，在玩耍时，左眼被一支玩具箭射中，所幸经过救治没有大碍。6年后的今天，他在跟朋友玩Nerf枪时，左眼再次被软弹射中。这次没有那么幸运，因为损伤及感染，泰勒的左眼被摘除。目前他的家人正在为其筹款，以安装一个合适的假眼。	未
肖肖因为家里临时有很重要的事 回老家了更不了微博 还在还爱他啦	未
肖质彬到乡镇开展三走访三签字活动	未
肖金人注意！显胜黑老锅大变样，现场图片曝光！	未
肖金家里有三轮车的都看看	未
肖金镇非洲猪瘟防控工作情况汇总	未
肖钢：实行真正的国库单一账户制度，推进国家金库工程建设	未
肖钢：推进股票发行注册制改革	未
肖骁颜如晶加时再战 再开撕！肖骁颜如晶傅首尔黄执中，又约了一局加时赛而且少奶奶这次火力全开别等了，快来瞧一眼Airbnb爱彼迎的微博直播	未
肚子赘肉多教你一招，显瘦10斤都不止	未
肝开始病变时，睡觉会有4种迹象，若1个不占，肝病离你还很远！	未
肝愿为你！小伙捐60肝脏为父续命 暴瘦14斤	未
肝癌复发怎么治？  中美专家联手为患者解忧	未
肝癌诊治多学科联诊是王道 中国医师协会肝癌MDT联盟在宁成立	未
肝硬化最怕大肉和窝头	未
肝纤维化：洪水猛兽可防可控可治！	未
肝脏 三分病七分养	未
肝脏是体内的一个代谢器官，它也是一个比较沉默的器官，不擅长表达，一般出现问题的时候，身体的表现都不是很明显，需要仔细观察才能看得到。肝脏不好的时候，身体很多方面都会出现些异常表现，如果你是一个细心的人，发现了之后要注意及时调理肝脏。健康一冬 张淋琳健康频道 一晨起后感觉口苦肝脏不好，肝气不顺的时候，我们在早晨起床的时候通常会感觉口苦，还会有口臭，让人感觉不适，不过这种症状出现的时候不是很严重，很多人会选择忽视它。二尿液的颜色变得更深了一般我们的尿液是淡黄色的，其中没有杂质。肝脏不好的时候，身体当	未
肝过其中一个的的，默默转走吧	未
肠癌多是拖出来的，一旦身体出现3多2痛，趁早就医，能保命！	未
肠道细菌竟能入侵大脑，但是我们为什么直到现在才发现	未
股东扎堆减持 “清仓式减持”重现！这些公司引关注	未
股价坐上过山车 蒂芙尼“千禧策略”喜忧参半	未
股价大涨战投弃买 八菱科技股权转让终止	未
股价接近腰斩之后 FB宣布计划回购至少90亿美元股票Facebook FB 周五表示，计划回购90亿美元以上的股票，以提振市场信心。近期，Facebook股价暴跌。Facebook在一份监管文件中表示，其董事会此前已授权高达150亿美元的股票回购，作为2017年启动的计划的一部分。该公司表示，周五宣布的90亿美元回购并不包含在此前的150亿美元回购中。股价接近腰斩之后 FB宣布计划回购至少90亿美元股票	未
股价绵跌8月，她究竟是一个怎样的都市丽人业务逐渐复苏的都市丽人（02298），却遭遇公司上市以来第二次市值崩塌。都市丽人股价自2018年5月以来已经累计下跌超过43，几乎将今年前四个月的涨幅收回，颇有黄河之水天上来，奔流到海不复回的意味。 股价绵跌8月，她究竟是一个怎样的都市丽人	未
股价重挫 皇庭国际拟回购股份护盘	未
股价长期低于1美元 纽交所决定对网秦启动退市程序 近日，凌动智行（Link Motion Inc./原网秦公司）发布公告，纽约证券交易所决定对其启动退市程序。 凌动智行于2011年在纳斯达克上市，今年以来由于创始人与董事长的矛盾公开化，其股价暴跌96，市值仅剩余1500万美元左右。 查看图片	未
股份回购细则9大看点：回购6个月后可卖出，允许借钱回购	未
股市一万本金一天赚一个点一年赚多少一年的交易日大约为250天。一万本金乘以1.01的250次方，再减去本金。即：10000(1.01250)120000，120000-10000110000。一年可以赚11万元。以此类推，一万本金每天赚一个点，10年之后的身价是25万7千多亿！ 所以天天喊抓涨停的都是骗子。每天宣称能稳赚一两个点的也是骗子	未
股市一跌，各种人才都出来了...	未
股市不是提款机，我们因何而投资（雪球）	未
股市反弹引爆债券市场调整	未
股市反弹致债市加速调整	未
股市嘚吧嘚  中长线如何择股择时	未
股市"地震"后A股去哪儿？	未
股市套路深！不想被割韭菜，须掌握公募基金选购大法	未
股市如此低迷，建议暂停新股发行，同时免除印花税，用行动支持股市健康稳健发展。	未
股市明早再分析吧，下周全是大事，本周末也发生了一些大事。	未
股市消息每天都多如牛毛，不是啥消息都能影响股市的，要看重点和核心内容方面的，要看消息的力度和实效性，要看消息是口水还是实质，要看消息是长期还是短期。不是啥消息都是重大利好的！	未
《股市牛人解盘》：本周后半周预计有快速调整！未来什么时候抄底	未
股市的主要作用是融资，而不是投资。所有来问跌到某某点位国家怎么办的人，都是不了解这个基本逻辑。股民赚钱国家分不到，反而上涨的风险国家担着，这样的买卖精明的人不会干。物尽其用，把剩余价值最大程度的榨干，然后推倒重来养老金才好进去。第一是收归最优质的公司，第二是让钱生钱。	未
股市越跌ETF申购越多，金融机构都开始“抄底”了	未
股市这个冬天有点冷！	未
股市锦囊为什么港股银行股比A股银行股便宜那么多雪球用户ice_招行谷子地：1.因为港股的投资体系以外资机构投资者为主，外资机构投资者对于不了解的政治经济体系一直保有一定的怀疑态度。2.整个港股市场是一个长期流动性不足的市场。香港本地的投资者所提供的流动性不足以支撑港股的估值。而且，其流动性又长期受到欧美货币政策的影响。3.海外投资者比较看中内生性增长和公司的现金回报能力。而国内目前具备这两点的只有工农建招等少数几家银行。所以，你会看到这几家的两地差价不太大。其他几家银行的投资价值受到海外投资者的质	未
股指展开反弹。重仓的待拉升后再减仓。网页链接	未
股指期货今日低开	未
股指期货保证金及交易手续费标准下调 有助于恢复市场流动性	未
股指期货再松绑	未
股指期货再松绑：沪深300、上证50交易保证金降至10%	未
股指期货再迎“松绑”式调整	未
股指期货弱势震荡	未
股指期货新合约上市通知	未
股指期货早盘全线低开	未
股指期货松绑 留意两大关键词	未
股指期货走向“常态化”：降低交易成本或为下一步	未
股权中的6751343020究竟代表了什么意义	未
股权质押堰塞湖逐渐缓解 两市逾280家公司发布解押公告	未
股权质押堰塞湖逐渐缓解，两市逾280家公司发布解押公告	未
股权转让通产丽星（3连板）竞价涨停	未
股权转让频频 下半年6家信托公司股东“变脸”	未
股比放开，外资险企入华还有哪些问题没解决？	未
股民们一定要培养个爱好，像我一样练练字什么的，或者健身运动之类的，多陪陪家人切记不要谈恋爱，因为谈恋爱和炒股一样，既要花钱又要花时间，最后还可能血本无归，怎么看都不划算，股民若没个发泄的地方，很容易屈出病来，不过炒股对心脏好，像咱们常年在股市浪的人，也都历练出来了，只 ...全文	未
股民务必注意：非法咨询7大套路摆出迷魂阵，牢记3点特征运用5种方法避开骗子陷阱！	未
股民惨啊//@阿龙一说: 哎！！//@苏渝:转发微博	未
//@股民朱古力: 现在在里面写悔过书呢	未
//@股民朱古力:美股A股//@金融段子王:回复@乐天91258://@乐天91258:统计报表vs经营实况	未
股民的日常！	未
“股海钓鱼者”金力泰：卖壳大师 并购狂魔	未
股海钓鱼者金力泰：卖壳大师 并购狂魔上市7年，账面毫无商誉，金力泰看起来是不是很像A股的一股清流殊不知，人家的资本运作是年年有戏看，只是时不来运不转，纷纷都夭折。股海钓鱼者金力泰：卖壳大师 并购狂魔	未
股灾1.0的时候，姚老板出手万科，这是大资金抢蓝筹的开始股灾2.0，孙宏斌出手乐视，与此同时安邦出手中国建筑，而孙宏斌兵败乐视时隔两年以后的今天，A股大熊市的下半场，陈发树入股云南白药，平安保险入股华夏幸福，这说明了什么问题唠唠 标杆的意义机构加仓路线研究（2018-12-13）	未
股神巴菲特的经验告诉你，这5大财务异常信号必须警惕！	未
股神巴菲特私生活曝光：养两个老婆生活不能自理！	未
股神操盘的公司，股价也曾三度腰斩！他如何收复失地，屡创新高?	未
股票ETF和短债基金爆红之后 基金公司正打造新爆款 瞄准三大方向！多位业内人士表示，被动投资仍处在发展初期阶段，明年权益ETF仍是不少公募布局的重点。不过，随着收益率优势的萎缩，明年短债基金风口难再，未来公募将打造特色化风格化的产品线，分析并培育爆款基金的生成基因。股票ETF和短债基金爆红之后 基金公司正打造新爆款 瞄准三大方向！	未
股票亏惨了 指数基金定投能救钱包吗？	未
股票发审委“瘦身”预示股市生态嬗变	未
股票型基金净值大面积“回血”	未
股票策略私募迎战2019：熬过严寒 苦盼春天	未
股级干部贪扶贫款3500万 感叹＂为什么没有人发现＂	未
股转系统隋强：新三板已进入提质增效新阶段	未
股转系统隋强：新三板的初创任务已经完成 将全力做好存量改革工作针对新三板的定位问题，隋强表示：下一步新三板的改革仍要坚持独立市场，公开市场，集中市场的定位目标，国务院关于《全国中小企业股份转让系统有关问题的决定》，对此有明确的规定，不容质疑。他明确要坚持创新型创业型成长型中小微企业的服务宗旨，这是新三板设立的初心和使命， 不忘初心方得始终。以下是今天的解读新三板投资早参	未
//@股道热肠也:今年死庄家！//@六国虹:上海纾困基金没出手?//@XuStephen在魔都03://@拆那钟碧莹:庄股崩盘了	未
//@股道热肠也:回复@thcoffeehsu:高铁人家也还给你了，别有点好东西就到处显摆，到处得瑟。国之重器不可示人。//@thcoffeehsu:馬來西亜是噁心誰一個窮國就靠華人姿态這高//@股道热肠也:很务实，佩服！	未
//@股道热肠也:把一个释老毛的社会改造为一个现代的市场经济的法治社会，不是一朝一夕的事儿。天天说都不行，更不能不说。//@释老毛:市场经济，依法治国，说了这么多年，还要反复说，也是一种悲哀。	未
//@股道热肠也:把美国汽车关税降低到2.5。和美国对等。日本对我国有很大顺差，看看怎么缩小吧！	未
//@股道热肠也://@投行老人:转发微博	未
//@股道热肠也:没那么邪乎！已经是底部区域，涨跌都是平常事，拿着分红就好了。	未
//@股道热肠也:看中国政府的了，美国这几个小兄弟太他妈欺负人了。//@洪水中的小蚂蚁:对华为打击最大的不是孟晚舟被抓，而是所有高管都不敢出国了。华为本来就有所提防，所以孟晚舟没敢美国转机，没想到所以西方发达国家其实都不保险。//@洪水中的小蚂蚁: 华为孟晚舟被美国人扣住了，要求引渡美国受审	未
//@股道热肠也://@腾腾爸:这个措施确实很白痴	未
//@股道热肠也:说到根上了！	未
//@股道热肠也:集体性癔症。//@股道热肠也:集体说谎，取悦领导。	未
股长11年冒领扶贫资金超3500万，监管成“牛栏关猫”	未
肥东一处2层高自建房该归谁 一槌难定音	未
@肥东人，这里有一份干部任前公示公告有你认识的吗?	未
肥东县白龙镇三家村大桥旁挖塘时，着实让人吓了一大跳！	未
肥东将下雪！安徽多地已经下雪，暴雪范围有变，连续4天有雪！	未
肥东教师资格通过人员名单公示啦看看有没有你认识的	未
肥东无偿献血第一人龚英良公益不断  这次又	未
肥东计划停电通知：2018年12月03日-12月07日！	未
肥发，俺也木有。	未
肥嘟嘟会冒汁水的生蚝，一口吸掉一个！	未
肥城人注意！2018年年底前，泰安将淘汰排放标准为国二及以下柴油货车！	未
肥城市教育局公布全市校外培训机构规范治理举报电话！	未
肥墩墩	未
肥宅不是我的错，都怪城市太难走果壳AI夜话 管住嘴迈开腿是减肥的老生常谈，对有的人来说，迈不开出行的腿，可能是被环境阻挡了脚步：狭窄的街道繁忙的车流曲折的路线 那如果路边是小吃摊公园和咖啡馆呢你最爱的一次散步发生在哪里来聊聊吧： 不是我不爱出门，是这个城市设计真的不行	未
肥成球//@夏正正:真是一坨又一坨的//@这是一个很高冷的ID:哈哈哈哈哈哈哈哈哈哈哈//@Tiger公子:啊哈哈要减肥啦//@江南大野花:这也太大坨了吧//@你不要脸的样子真可爱:天哪嘎嘎嘎嘎哈哈哈还好还好哈哈哈哈哈哈//@萩风号：上次去有个路过的游客说这是野猪吗 查看图片	未
肥熊妈妈下令了 赶紧来接旨！关注@PONY中国 置顶微博，现在登记通道还在开放中（登记邮件：pony1972@yeah.net），小编提示下此时此刻邮件已炸	未
肥猪旺福己亥年50家生肖原地邮局正式公布	未
肥肉还不减，留着过年吗	未
肥肠好奇把我们月半小壮壮@就是谢小仟 辣得直掉眼泪的牛肉串到底什么味道啊反正打卡曼谷火车头夜市准没错旅行囧记 旅行灵感季	未
肥胖是会呼吸的痛！胖星人快快get√起来！	未
肥西县将建残疾人之家每个乡镇都有	未
肥西县改区最新进展，官方这样回复..	未
肥西家里有这种灯的注意了，央视已曝光！	未
肥西首个残疾人综合服务中心明年6月将落成投用	未
肩扛信息安全守卫者责任，点融铸数据隐私护盾	未
肩膀头头的小纹身，什么时候才能舔到呢	未
肮脏，跟美国哥大一样//@焦黄的韭菜盒子:照片拍完了，让小妹儿进来吧	未
肯定2月中旬往后了，务必安排起来	未
肯定做了亏心事	未
肯定晚上去跳了广场舞，白天练练 微博视频	未
肯定有滴就想着等陈某某出来了，继续嗨只不过没想到警方把辟谣了//@玙璠爱吃酸: 陈羽凡有没有被抓，你们心里没有笔数	未
肯定有滴就想着等陈某某出来了，继续嗨只不过没想到警方辟谣把事儿给揭了//@玙璠爱吃酸: 陈羽凡有没有被抓，你们心里没有笔数	未
肯定系白色嘅！	未
肯定酒泉又发火箭了，或者额济纳旗又进行反导试验了......	未
肯尼亚当局回应＂用港口给中国抵债＂：没这回事	未
肯尼亚西南签证中心在重庆成立	未
肯巴-沃克面对詹姆斯已经27连败，还真是邪乎，看来唯一能打破这一僵局的办法就是同队了吧	未
肯当局回应“肯尼亚用港口给中国抵债”	未
肯当局回应“肯尼亚用港口给中国抵债”：没这回事	未
肯德基任意消费12元就能换购一个	未
肯德基全球塑料产品唯一供应商居然是台州企业！	未
肯德基爷爷在中国“变绿”了，上海这家首店让“不吃鸡”的你还有...	未
肯德基的顾客在鸡腿中吃出像大脑一样的东西（图片） 《每日邮报》报道称，澳大利亚悉尼的一位女居民在肯德基午餐中发现了像大脑一样的东西。网页链接	未
肯豆Bella着迷的“腋下包”	未
肯豆年度约1.55亿人民币，我适合吃土了	未
育儿专家说我就不信你们这群小仙女不爱在朋友圈晒娃，骗人！哼！不管不管，反正菌菌我已经给你们整理好给娃拍照的技巧了，保准让你称霸朋友圈，朋友圈见吧	未
育儿做好这6件事，不愁孩子没生活自理能力晚上不睡早上不起，上学总迟到丢三落四，书包里的物品每天都在丢下课光顾着玩，上课再往厕所跑正在苦恼的家长们，孩子不是不适应学校生活，而是缺了生活自理能力，才让他们似乎输在了起跑线上。专家说，可以从以下6个方面着手培养孩子的生活自理能力，快戳图对照，看看还需要在哪方面重点加强。Via@微言教育	未
育儿食谱：妈妈是否还在为襁褓里的宝宝吃什么愁得慌	未
育碧《孤岛惊魂:新黎明》（Far Cry:New Dawn）泄露，废土题材。TGA上将公布具体信息。	未
育行线秋林头至招虎山路段修好了！	未
育雏记	未
育鹦日记嘎嘎是在断奶后才领回家的，那时候我很想亲手喂他，但是因为我没经验，店主怕我养不活，不愿意早点给我，不过那天我把嘎嘎领回家的时候，他给了我一张cd，说里面有嘎嘎小时候的很多照片，你可以看看。因为鸡仔已经接到了，我就一直没急着看那张cd，现在已经过去一年多了，我才想起来看看。里面有几十张照片，记录了嘎嘎的成长，店主还真是贴心，我也才知道，原来嘎嘎一共有三个兄妹，其中还有一只黄色的仔仔，也就数黄色仔仔最好看了，嘎嘎小时候太丑了！哈哈哈哈	未
肺好的人，四肢不会出现4种标记，若你也是，肺部还算健康！	未
肺小结节是肺癌前期？别自己吓自己了	未
肺小结节等于肺癌早期？不要自己吓自己	未
肺癌成我国第一癌 免疫治疗助晚期患者“带瘤生存”	未
肺癌每年新发病例78万，专家：发现率在提升，死亡率在下降	未
肺移植，手术是不是看起来很简单 微博视频 Warm Nights	未
肾不好手脚会出卖你，医生：出现这4种现象，谨防尿毒症	未
肾仔入屋偷野，笑到仆街！	未
肾六浓浓的求生欲（他老板这等于是往化粪池里丢了个炮仗啊，五，四，三，走你）（这时其实应该喊@吐槽鬼 ）	未
肾最怕1个字，你却天天在犯！这些症状提示肾虚，收好这份超简单补肾法	未
肾病饮食别总听他们说！ 医生：饮食记住4点，放心吃	未
肾科医生教你，如何能避免发展到尿毒症	未
肿眼皮不怕啦	未
胃口比自身体重还大，只有两种东西不吃，躲在地下一斤80元	未
胃寒宫寒四肢寒凉的人，巧用厨房中的散寒药，你家也有！	未
胃最怕的这8样东西，第2样你就总是戒不了	未
胃部隐隐作痛了一整个晚上，结果到现在发展到了绞痛，急需一个快速止痛的药。	未
胃酸多，远离七种食物	未
胆囊切除后报告显示形态正常 体检中心：不小心记录错	未
胆够大！北海一改装车司机酒驾撞飞护栏后逃逸！	未
胆够大！固原市成功破获一起重特大杀害野生保护动物案	未
胆大  中卫司机驾驶超载大货车还组团冲卡...	未
胆大包天！内江一乡镇财政所所长竟利用私权做这事，这哈着登了！	未
胆大包天！台州一处大型海塘坝，竟被人挖开了	未
胆大包天！合肥这12人霸占太平间阻挠拉尸体，结果...	未
胆大包天，汉中男子2分钟偷走800元！	未
胆大包天！百色7名路霸高速服务区蒙面抢劫，百名警力出动	未
胆大包天！看中别人家7万多元摩托车，他居然直接雇车拉走！	未
胆大包天！看中别人家7万多元摩托车，小偷居然直接雇车拉走！	未
胆大包天！绵阳情侣打印700多张20元面值假币，现场还查获大量原材料...	未
胆大司机驾驶报废车，交警蜀黍查你没商量！	未
胆大地瞟了眼A站的三次元老婆评选，何止孙一峰。。还有黄旭东IG战队分部的Macsad也上榜了哈哈哈。。。这届玩家肿么了	未
胆大！外国小哥徒手攀登近百米高教堂	未
胆大妄为 ！旅客喝醉酒后火车上放火焚烧列车座椅	未
胆大妄为！灌南两大青年，深夜撬了手机店的门.....	未
胆大妄为！赣州一80后干部挪用扶贫款上百万	未
胆大妄为！赣州一80后干部挪用扶贫款上百万，判了！	未
胆大！早酒后无证驾驶报废车上路被行拘！	未
胆大！有人竟敢在新兴这里开非法改装摩托车进行飙车，结果......	未
胆大！河池宜州8人结伙拦路，索要过路费并私分，结果....	未
胆大！男子组团印假钞，还敢在佛山火车站出售	未
胆大的来玩一下，把你刚刚复制的东西粘贴到评论区，看看都有什么鬼东西	未
胆大！萍乡出现万能车牌，号码瞬间变脸，结果......	未
胆太大！这个点都敢下手！朝阳文化路某小区一幕！	未
胆太肥！北海一货车司机搭载2岁婴儿逆行冲卡！	未
胆太肥！男子光天化日毒弩偷狗，被拘15天开着面包车，发现狗后，在车上用毒弩射杀，然后将狗偷走射洪男子在城区偷狗一幕，被监控拍个正着。射洪警方接到报警后，三个小时抓获嫌疑人。经查，该男子两天偷狗4条，均卖往遂宁。目前，该男子已被警方行政拘留15天，罚款1000元。	未
胆太肥！贫困户的钱也敢动！昆明楚雄这些人被严处	未
胆子大！凉山这一客车竟然超载了14人	未
胆子大！遂宁男子公交车上行窃，旁边乘客手机拍下全过程！	未
胆子忒大！核载7人却坐了21人，信丰一幼儿园女司机栽了......	未
胆子忒大！梅州一幼儿园校车竟超载100！司机当场逃跑！	未
胆子真大！一男子毒驾上高速，仙桃交警拦下他后	未
胆子真大！上海一20月大婴孩坐大人怀中开宝马！12月15日12时许，一辆小汽车在松江区沪松公路上行驶，车内，一男子抱着儿童坐在驾驶座位上，两人同时扶着方向盘。这一幕恰巧被边上车上的乘客拍下传至微博，引发网友热议。今天下午，这名怀抱儿童驾车的男子因驾车时有其他妨碍安全行车的行为被松江警方依法予以记2分罚款200元的处罚。上海一20月大婴孩坐大人怀中开宝马上路 驾驶员被处罚	未
胆子真大！娄底多名干部，冒领私分土地补偿款！	未
胆子真大！男子为获高额报酬，冒充警察帮朋友讨债，结果	未
