老詹和老司机	未
聚焦丨2018年中国商业论坛在莫斯科举行	未
聚焦丨个税抵扣细则正式落地！	未
聚焦丨中共中央印发《中国共产党支部工作条例（试行）》	未
聚焦丨中央经济工作会议	未
聚焦丨从庭审现场传出的正义之声	未
聚焦丨宝丰县举行县退役军人事务局揭牌暨解放广场竣工仪式	未
聚焦丨我们很久没有拥抱了！为这，老两口儿拍了组裸照！	未
聚焦丨抗癌药入医保，别再让穷病治不起	未
聚焦丨改革开放：“逐梦”四十年	未
聚焦丨规划10年桥未修！福保居民等白头，有关部门这么说......	未
聚焦丨解决儿童看病难，深圳将做这些事！	未
聚焦丨这几处卡口小路改造月底完工 走到这再也不用绕道儿啦	未
聚焦丨银行理财子公司管理办法正式发布	未
聚焦中共中央印发《中国共产党支部工作条例（试行）》	未
聚焦中卫市市场监督管理局召开全市市场监管系统扫黑除恶专项斗争工作推进会	未
聚焦中原工学院和我县结成了帮扶对子	未
聚焦中央党校三生融合模式探索调研组来我市开展社会调研	未
聚焦中央政法委《法治周未》报大篇幅报道我县321工作法	未
聚焦中央生态环保督察回头看信访投诉问题调查处理情况通报（第九期）	未
聚焦中央生态环保督察回头看信访投诉问题调查处理情况通报（第十期）	未
聚焦中宁县公安局组织开展12.4宪法宣传日活动	未
聚焦中宁县公安局驰而不息正风肃纪   狠抓队伍监督管理	未
聚焦中组部负责人就印发《条例》答记者问	未
聚焦中组部负责人就《档案工作条例》答记者问	未
聚焦 临汾一货车进加油站时与摩托车相撞，致一人当场毙命...	未
聚焦 临汾开展打击欺诈骗取医疗保障基金专项行动  附各县举报电话	未
聚焦临近年底，公职人员注意，这些事不能做......	未
聚焦为了介休乡村振兴发展，这些人今天走进乡村视察调研	未
聚焦义乌 义乌胡庆余堂国医药项目签约昨日，义乌市与杭州胡庆余堂医药控股有限公司签订了合作协议，总投资5000万元的义乌胡庆余堂国医药综合体项目正式落户义乌。胡庆余堂于1874年(清同治十三年)在杭州创建，为首批中华老字号。经多年发展，该公司已形成了集药材种植饮片加工成药生产商业零售医疗科研工业旅游等于一体的中药产业链。义乌胡庆余堂国医药综合体项目计划打造胡庆余堂浙中地区总部，以义乌为浙中区域中心，建成浙中中医医疗服务与零售中心，并逐步在金华东阳浦江等周边市县建立分馆。项目分	未
聚焦义乌 有法可依，今后养犬要按规矩来犬类问题整治一直是城市管理的难点和重点，同时也是义乌市文明城市创建的一项重要内容。文明养犬是文明城市的应有之义，为进一步做好我市犬类管理工作，昨日《义乌市犬类整治实施方案》下发。据悉，这是继去年10月1日起施行的《义乌市区犬类管理暂行规定》之后，义乌推出的又一项犬类管理举措。根据新出台的实施方案，此次犬类整治行动从即日起开始，共分为宣传发动集中整治和长效管理三个阶段，采取宣传与整治相结合日常管理与专项整治相结合的方式，持续深入推进犬类管理工作。	未
聚焦义乌 本月底，义乌这条道路将投入使用！开往佛堂赤岸方向的司机注意！近日义乌环城南路（稠佛路口）立交改造工程（二期）迎来尾声，预计于本月底前投入使用。本工程设计起点为佛堂大道与环城南路交叉口，终点为佛堂大道与环徐线交叉口，道路全长640米。	未
聚焦义乌赤岸急救站开通昨日，义乌市急救中心赤岸急救站开通。至此，全市已开通15个急救站(点)，24小时值班的救护车从17辆增至18辆，弥补了义南方向尤其是赤岸山区急救车不足的缺陷。	未
聚焦九寨沟县召开挂职干部人才集中培训会	未
聚焦书记项目 湖塘镇：撒下一张网 打通城市管理经脉	未
聚焦京津冀  北京一分钟	未
聚焦京津冀  河北一分钟	未
聚焦人力资源管理转型：从共享服务到运营专家	未
聚焦人在网中行 事在格中办！武进网格化社会治理织就基层服务一张网	未
聚焦今后身份证相片可重拍3次！网友评论亮了	未
聚焦今天坐地铁的大连人，你们看到这个了吗	未
聚焦今天是交通安全日，这些事关乎你的生命安全！	未
聚焦  今天是宪法日，你了解多少！	未
聚焦  从贫困村到示范村，山西这个村18年来只做了一件事	未
聚焦他是界首志愿遗体捐献第一人  昨天 他回家了	未
聚焦伤天害理 晋城这37人终于落网	未
聚焦全县村（社区）主干培训班开班	未
聚焦全国首个胸痛急救地图发布，甘肃9家，庄浪县人民医院图上有名	未
聚焦  全市大型餐饮企业餐厨垃圾处置工作会召开！	未
聚焦八千里路云和月中国内地首台9HA燃机正式发运	未
聚焦兰花旗下企业某工程1人死亡事件最新公示	未
聚焦关于基因编辑婴儿事件，科技部表态了！	未
聚焦关注宁夏两名曾被问责处理的干部重新受到任用引发关注	未
聚焦关键少数让群众画像，述职述廉监督设特殊考场	未
聚焦农房党员带头拆村民主动拆	未
聚焦农房八旬党员顾大局 诚劝兄弟拆老房	未
聚焦农房面积再小，也要主动拆！	未
聚焦冬日里，统战青年的又一场大学习！	未
聚焦凤台街上，晋城一司机撞人又撞车！！	未
聚焦别了，火车票！铁路总公司宣布大消息	未
聚焦别白跑。顺义这几家有名的店铺都跑到这里来了	未
聚焦@包头人，你最关心的非洲猪瘟防控20问（下）已整理好，戳进来了解...	未
聚焦十天十夜抓捕逃犯 回家后他对着生病的女儿落泪11月21日，西华县公安局刑警大队教导员牛新军远赴新疆抓捕，得知女儿重病一直喊着要爸爸，却无法及时赶回。经过十天十夜异地追逃，完成追逃任务的牛新军赶到家后面对生病的女儿时，他再也抑制不住眼眶中的泪水，乖巧的女儿看着从不流泪的爸爸，紧紧抱着他不知所措...这一幕感人的场景被牛新军的妻子拍下来发到了微信群中，视频发出后引发众多网友关注。人民网环球时报央视网新闻中心等各大媒体也相继报道了这感人的一幕聚焦！十天十夜抓捕逃犯 回家后他对着生病的女儿落泪	未
聚焦华为CFO孟晚舟被捕背后，究竟隐藏着什么	未
聚焦单车难题 整顿停车秩序西青在行动为推进全区共享单车停车秩序的整治，区运管局联合交管西青支队区市容园林委区综合执法局摩拜公司OFO小黄车公司召开共享单车停车秩序管理工作协调会，协调采取停车点位施划停车秩序协管等措施，加强共享单车管理，破解共享单车乱停乱放的难题。	未
聚焦！南京将开辟24条过江公交，快看有没有经过你家......	未
聚焦南宁人注意！超级冷空气马上杀到，广西气温可能跌破0！	未
聚焦原本势同水火的两家民营企业，自愿合并实现双赢，只因检察院用了这样一个妙招	未
聚焦县政府常务会通过这些事项，与我们息息相关！	未
聚焦又一非洲猪瘟疫情现身 通辽人注意	未
聚焦吴祖云听取全市村（社区）两委党组织书记调整配备情况汇报强调 严肃纪律严格程序严守责任 确保圆满完成换届工作任务	未
聚焦  呼市检察院党组第四督导组 深入新城区检察院进行第二轮工作督导	未
聚焦  团市委召开干部大会	未
聚焦国家宪法日  相约至乡村，到公园学宪法	未
聚焦国家要先试点再推广，上杭人你今后不用担心这事了！	未
聚焦国考开始，这个法律热点词语，你了解吗	未
聚焦地方性法规尚未修改前，涉及河南省机构改革的行政机关职责拟这样过渡	未
聚焦地铁13号线或将纳入四期规划，东延线将延伸至简阳市，家门口坐地铁的日子又更进一步了！	未
聚焦地震来了，上杭人你掌握这些就不会惊慌了！	未
聚焦基因编辑婴儿事件继续发酵，小编整理了这些最新消息	未
聚焦基因编辑婴儿：未报备卫计委 贺建奎2月从学校停薪留职The first gene-edited babies have led to mass controversy. After Shenzhen HarMoniCare Women amp Childrens Hospital， which reportedly approved the project through its medical ethics committee， claimed that it did not	未
聚焦境在我，不让其峰  湖南张家界禾田居度假酒店	未
聚焦大动作，紧盯干部八小时以外	未
聚焦大单品 椰岛酒业欲构建“闭环式”生产系统	未
【聚焦大理】现场速测农残留 吃安心“宾果儿”	未
聚焦大连四方会谈！谈的是钱途	未
聚焦大连这些加油站已恢复营业！还有14个在停业	未
聚焦天北街道回复 了天通艺园里的公共卫生间晚上没有照明的问题！	未
聚焦  天津今冬是否统一停工市生态环境局长这样说！	未
聚焦！央视暗访揭开旧衣物回收箱背后惊人的秘密！	未
聚焦奇葩圣诞日历大盘点（上），奇怪的倒计时到底是什么	未
聚焦定远交警等，近日重点在做这件事	未
聚焦@宜昌人，没欠费却停了水电气，那您可能摊上了这件大事！	未
聚焦山东省枣庄市山亭公安分局一行来我局考察交流	未
聚焦市区政协组织杨四龙等本土企业家到金龙村，要干什么大事	未
聚焦平度:地铁14号线建议书已批复 潍莱高铁2020年竣工通车！	未
聚焦平遥一群学生走上街头，体验乡村环卫工人的辛苦劳动！	未
聚焦平遥城管对北大街3家规划外的建筑物进行拆除！	未
聚焦平遥有座凤鸟栖台，曾有凤凰栖其上！你知道在哪么	未
聚焦  庙山村出了个鸽子王！	未
聚焦！康平县委书记滕增泰接受《沈阳日报》记者专访	未
聚焦影视工作室接补税通知，追责至2016年！多方陆续发声	未
聚焦彻底排查严格整治，全力筑牢安全防线  我市收听收看全国省晋中市危险化学品安全生产专题视频会议	未
聚焦总目标  作风再整顿当群众的暖心人，时刻把群众利益放在心坎上	未
聚焦慈利：通报2起提篮子1起环保督察问责典型案例	未
聚焦：“成果為零”卻不再對抗 暴露日本政府權宜外交	未
聚焦我区组织召开非洲猪瘟防控工作专题会	未
聚焦我市召开农村集体产权制度改革观摩推进会	未
聚焦我市治理水土流失面积达186.3万亩	未
聚焦我市督办中央生态环境保护督察回头看交办件办理情况	未
聚焦我是一名共产党员，那就一定要冲锋在前战斗在前	未
聚焦  @所有人，《干部人事档案工作条例》已印发，请查收	未
聚焦扫清黄赌毒，明光市公安局在行动！	未
聚焦把严落实到每个支部每名党员	未
聚焦改革开放遵义改革开放40年：转折之城大转身	未
聚焦救灾帐篷里的领袖像	未
聚焦新刘棚改拆迁补偿款银行存单身份信息采集工作开始啦	未
聚焦新华路这片儿地规划要调整，涉及一幼六小新华书店热力公司......	未
聚焦时刻绷紧安全弦，我市召开11月份安全生产例会	未
聚焦时政李军到三塘泉湖镇督查脱贫攻坚工作	未
聚焦时政杨洪峰到泉湖谭子山督查脱贫攻坚工作	未
聚焦时政  杨洪峰督查近尾洲柞市茅市鸡笼等地脱贫攻坚工作	未
聚焦明天起开始实施的这些新规，将影响你的生活	未
聚焦春节假期延长至15天人大代表提议淄博人你怎么看	未
聚焦晋城大巡察开始了 附举报电话	未
聚焦晋城某县(市/区)公安局主要领导变动！	未
聚焦有关部门回复了北一10号楼西头的野狗和废品堆积 问题	未
聚焦来开脑洞，一起围观哈牡高铁线有哪些黑科技	未
聚焦  来自微友家中的甲醛测试，结果让人震惊！（附视频）	未
聚焦桑植高铁站的站台都建好了，黔张常通车还远吗	未
聚焦棚改食品公司北侧地块未拆除房屋拆除工作紧张推进	未
聚焦模范机关创建省检察院党组成员参加支部组织生活并讲党课	未
聚焦武威周末播报	未
聚焦毒战之中宁公安绝不放过你	未
聚焦民营企业司法保护福建高院向党外人士纳诤言求良策	未
聚焦永春县村（社区）主干培训班进行现场教学	未
聚焦汉阴通用机场项目获得军方正式批复	未
聚焦江口公安： 公开招聘2名文职警务人员	未
聚焦江口县公安局到江口县信用联社 组织召开2018年第四季度安全培训会	未
聚焦污水零排河，福清这个镇治污有一套！	未
聚焦  没想到一上红通，没多久警车就开到了我面前。	未
聚焦河南交通职业技术学院一周要闻	未
聚焦  法制日报：江苏省人大常委会首次专题询问公益诉讼工作	未
聚焦  法国带头归还非洲文物 网友：中国的呢	未
聚焦海南儋州的生活垃圾焚烧发电项目 为什么难产了3年	未
聚焦海沧半马 11月25日嵩屿码头至鼓浪屿内厝澳码头售票方式有变厦门身边事大家注意啦，11月25日，2018建发厦门（海沧）国际半程马拉松赛即将举行，届时，前往嵩屿码头的部分路段，将实行交通管制嵩屿码头至鼓浪屿内厝澳码头，12:30之前的航班船票，将全部以现场售票方式出售！在此时段，打算 ...全文	未
聚焦淄博一大叔驾suv逆行冲入人群，现场狼藉1人死亡，事发交通安全宣传日	未
聚焦淮安传达学习秦岭别墅问题通报精神	未
聚焦清查整治不停息，中卫沙公扫黑除恶治乱在行动！	未
聚焦湖北省9项大遗址纳入国家保护项目库，潜江龙湾遗址上榜！	未
聚焦湖北近两万纪检监察干部，每人收到了一张卡	未
聚焦煤炭运输过境车辆通行专线，河北2020年将达90！	未
聚焦王菲带案下访督导中央生态环境保护督察回头看交办信访件办理情况	未
聚焦环保风暴降临  港口如何应考	未
聚焦环城东路1.6余万平方米违建将被拆除	未
聚焦男子偷电缆被电晕 古矿上千户居民水电暖全停	未
聚焦省市专家对黄龙县中医医院创建二级乙等医院进行评审	未
聚焦省级环保督察整改脱贫攻坚证明事项清理安全生产市政府常务会重点了解一下	未
聚焦科学养殖猕猴，孟津猴倌返乡创业忙	未
聚焦第33个国际志愿者日丨沈阳高校志愿者服务肿瘤病患   走过五年抗癌路	未
聚焦：细雨蒙蒙中的新车站广场！	未
聚焦罗琼到乡镇调研脱贫攻坚乡村振兴农村教育河道巡察等工作	未
聚焦罗琼调研环保督查脱贫攻坚河道巡察信访包案落实等工作	未
聚焦美联储年终议息会议 加息路径将如何变化因美联储官员近期由鹰转鸽的态度变化，使得美联储将于近期召开的2018年最后一场议息会议备受关注。而将美联储11月议息会议纪要与9月对比可发现，其更加注意加息对经济的负面影响。聚焦美联储年终议息会议 加息路径将如何变化	未
聚焦老板最多省份浙江：政商关系是如何处理好的	未
聚焦“考古中国”重大研究项目进展	未
聚焦职责挖线索 铲除黑恶"保护伞"	未
聚焦舒城在宁波的数万创业老乡有新家了！	未
聚焦花都实现不动产登记零跑动，不见面审批！	未
聚焦西藏大检察官出庭履职：我是一名检察长，但首先是一名检察官	未
聚焦访惠聚  拉克火了 牧民富了	未
聚焦访惠聚背靠大树敢担当，后方有粮心不慌	未
聚焦评论员观展手记从两张餐费收据说起	未
聚焦评论员观展手记除夕夜里一顿饭，恍如隔世四十年	未
聚焦这件事，关乎每个人的生命安全！	未
聚焦这位警察竟然对百岁老人这么大声说话，为何	未
聚焦连续两天，阜宁发生了两件大事！	未
聚焦@退伍军人 信息采集工作已经开始了	未
[聚焦重庆民营经济]这家企业如何抓公共安全难题	未
【聚焦重庆民营经济】进击的江小白：“我不只是一瓶酒”	未
聚焦金融风险防范 首届北京金融安全论坛即将开幕	未
聚焦针对反映四区篮球场及运动场扰民问题 ，天南街道回复了	未
聚焦阜宁86岁老人成了网红！33年来只做一件事！	未
聚焦青岛三民市公安局：出台65项便民服务，群众办事只跑一次	未
聚焦青岛三民市法制办：取消全部自设证明事项，这33项证明不用开了	未
聚焦顺义人产假128天起，陪产假生育津贴全都有！	未
聚焦顺义这司机酒驾撞多辆车，已被捕	未
聚焦驰而不息正风肃纪！淮安集中整治形式主义官僚主义	未
聚焦黄山区：梳理排查涉黑涉恶问题线索6件立案6人	未
聚酯产业链风险管理将再添新工具	未
聚集淄博2019年放假时间表出炉！春节居然这样放假看完想哭！	未
聚鸣投资刘晓龙：如何做一个孤独的逆向投资者	未
聪明人，一辈子，三不说	未
聪明人，一辈子不问这 3 件事	未
聪明反被聪明误	未
聪明反被聪明误！开平一男子地车牌上动手脚，就能任性开车了吗	未
聪明女人的处世之道	未
聪明女人，这3个隐私绝不告诉丈夫，傻女人才会老实交代	未
聪明的女人，不会在这里花冤枉钱	未
聪明的女人，从不将就	未
聪明的学员都是121月份学车，明年2月偷着乐	未
聪明的平乐人每天吃饭前都会扫这张图，多的能领二十几块钱	未
聯合國安理會將舉行部長級會議討論朝核問題	未
聯合國海洋大會宣言草案要求停用一次性塑料	未
聽說今天是北京今年最冷的一天，在擦路邊護欄的時候，幾分鐘就凍到手腳發麻，但卻是他們每天都要去做的事情，感謝這群城市的美容師，是他們讓北京這座城變的更美。謝謝 @韩红爱心慈善基金会 邀請，真心呼籲大家：不亂丟垃圾，隨手撿起看到的垃圾，為這城市盡一點綿力。陪你一起过冬天 致敬環衛工作者，為愛溫暖前行。	未
聿见就这样伸着，展着，跳着，齐步着，朝气蓬勃着	未
聿见我们是跨界老师！	未
肃北县党员冬季集中教育全面展开	未
肃北县遵德守礼家庭乌兰其其格家庭	未
肃北这些地方将要停电，请查收！	未
肃南首次发现世界濒危物种国家一级保护动物白尾海雕	未
肃宁11月26日至30日停电信息！	未
肃宁15岁男孩走失，请帮忙扩散寻找。	未
肃宁停电通知 （11月28-12月3日）看看都有哪村。	未
肃宁停电通知，看看有你村吗 附肃宁招聘信息。	未
肃宁公交免费后，乡村公交有了新消息。	未
肃宁凌晨失火，情况危急！两名老人被困......	未
肃宁发射10枚火箭弹开展人工增雪作业 现场图	未
肃宁各村42岁以上的，以后面对现实吧	未
肃宁各村有社保卡的都看看。	未
肃宁周边  婚礼现场，新娘子被娘家人强行拽走，因为啥	未
肃宁周边老公公把儿媳打了...	未
肃宁支铁办工作进展：四个涉铁项目...	未
肃宁最新停电通知，部分村庄停电10个小时！附天气预报	未
肃宁用天然气取暖的注意了	未
肃宁用天然气的注意了 这事必须要知道	未
肃州再次在全省露脸 这次还是因为TA	未
//@肆Lc:转发微博	未
肇东三个市级以上老区贫困村，年底可摘帽！	未
肇东即将开启速冻模式！ 黑龙江寒潮预警，尽量多穿点吧！	未
肇东法院新闻发布会，关于3起危险驾驶罪的典型案例...	未
肇东男子胆囊切除三年，怎么又发了炎还得重新开刀	未
肇事后，岂能一逃了之！哈市交警一天破获三起交通肇事逃逸案	未
肇事撒泼耍赖！青州这个女人在省台火大了！	未
肇事撒泼耍赖！青州这个女人火大了！	未
肇事者找到了，6 岁“熊孩子”在南京一通信广场制造了火灾	未
肇事者找到了！警方已经通过爪印迅速地确认了嫌犯	未
肇事逃逸后良心不安 司机喝半瓶农药:以为撞死人了	未
肇事逃逸后赶紧修车 雨眉断痕处丝状物 让其低头认罪17日20时许，@武汉江岸交警 巡逻时发现，三环线附近发生一起交通肇事逃逸事故，导致一名男子死亡。江岸交警走访修理厂，最终将肇事车司机齐某查获，齐某竟矢口否认。民警收集人证物证，齐某最终认罪！（魏娜 王美慧）汉警微镜头肇事逃逸后赶紧修车 雨眉断痕处丝状物 让其低头认罪	未
肇事逃逸！嘉兴警方凭一个二维码快速破案	未
肇事逃逸  平原全城寻找这个红色电动轿车！	未
肇事逃逸心存侥幸，层层调查难逃法网，沁水交警抽丝剥茧擒获元凶！	未
肇事逃逸！现场只留下了一个耐人寻味的收款二维码	未
肇事逃逸 罪责难逃 投案自首 才是出路	未
肇俊哲发文质问辽足中超联赛 中超2018	未
//@肇嘉浜路文化小流氓:第四条说的这个道理，，，不知道有没有德国网友会喷，，	未
肇庆一台教练车撞穿厂房的墙，车子竟然没有明显变形，甘劲个	未
肇庆一小车逆行狂奔连撞三车！上晒DV现场	未
肇庆一男子当街打女人上了DV现场！	未
肇庆一老板跑路四年终落网，工人几万蚊工资失而复得！	未
肇庆不只有眼前的拥挤， 还有100米的诗和远方	未
肇庆交警出动警力1200人次，检查重点车辆1300多辆，只因...	未
肇庆 人，和火车票说再见吧！铁路总公司宣布大消息，明年开始	未
肇庆人在家门口就能看书了！ 流动图书馆搬进社区	未
肇庆人注意！修理机动车也要实名登记啦！否则面临...	未
肇庆城区这条路全面通车！从此告别塞车	未
肇庆天宁北路的交通组织方式有新调整 市民表示不适应！	未
肇庆天宁北路通行方式有变化，走路的开车的朋友都进来看看！	未
肇庆好多单车直接被拖走，现场一排一排车，好阴公	未
肇庆市2018年11月份第4周治安警情提示	未
肇庆市公安局开展扫黑除恶宣讲进社区活动	未
肇庆市公安机关召开创文工作动员推进会	未
肇庆市四部门联合开展打击欺诈骗取医保基金专项行动，在封开可以这样投诉	未
肇庆市结核病防治所人才招聘信息！	未
肇庆建设路18卡特殊商铺拆除！换来星湖大道旁500多平方的临街商铺	未
肇庆恐龙展货不对板被人投诉到上晒DV现场！	未
肇庆某景区有恐龙主题公园货不对板！现场视频曝光	未
肇庆某村几十人冲入酒楼打人，女人都打！上晒DV现场！	未
肇庆某村有几十人冲入某酒楼疯狂打人，上晒电视台，究竟乜事	未
肇庆河堤边上竟然挖出炸弹，引爆现场浓烟滚滚！	未
肇庆疯传：一男一女大白天在车内XXX！视频被曝光，不过...	未
肇庆绿步事件！几十名村民冲入某酒楼打伤一家四口	未
肇庆街头上演现实版速度与激情，场面吓人！现场好多街坊围观	未
肇庆西江路7岁小孩竟然因为这个原因而被困阳台外，太惊险了...	未
肇庆车城发生嘅呢件事好大锅，阿SIR都雷埋，仲有人被捉！	未
肇庆这位17岁的小伙子因为这件事情火了，原因竟然是这个...	未
肇庆这种特产可以防癌！价值10万元/斤，最近家家都在晒！	未
肇庆附近城市的一位男子，将这种东西塞进肛门，结果...	未
肇庆高要：一字之错，两项目环评不予通过审核	未
肉丸作坊蝇虫乱飞藏身毛坯房 成品送至三亚文昌等	未
肉价波动空间有限 生猪出栏价挑战7元/斤大关	未
@肉圆是冰冰酱：小区圈地停车收费，地点：南开区青年路环岛，天明桥去往雅园里小区的路上 头几次去停的时候没有人也没有墩子挡着， 昨儿晚上去停车，有个大爷，说这地方收费，我们说那不停了要走，大爷站车前面不让走 ，原因是前几天停都没找我们要钱，他凭脑子记忆就是这辆车给30不然死活不让走，解 ...全文	未
@肉圆是冰冰酱：小区圈地停车收费，地点：南开区青年路环岛，天明桥去往雅园里小区的路上。 头几次去停的时候没有人也没有墩子挡着， 昨儿晚上去停车，有个大爷，说这地方收费，我们说那不停了要走，大爷站车前面不让走 ，原因是前几天停都没找我们要钱，他凭脑子记忆就是这辆车给30不然死活不让走，解释没看见有人管，也不见有收费的所以停，就给10块钱，开到小区楼下车被划了 ，想问问这个地方到底是不是官方收费停车点，还是大爷自己圈地要钱	未
肉岐我想你了	未
肉日焼鳥食。	未
肉末土豆泥	未
肉松的武汉广州游记	未
肉疼！钱库一辆铲车撞到一赌墙，10万元没了！	未
肉眼可见的变穷。争取这个月支出不超过2k吧...	未
肉食控	未
肉馅、蛋黄馅月饼禁止邮寄或携带入境	未
