车神舒马赫苏醒了 据多家外媒报道，德国车王舒马赫已经从近五年的昏迷后苏醒，也无需通过插管维持生命，据英国每日邮报报道称：舒马赫并没有卧床不起，也不是靠输液维持生命舒马赫接受着最为精心的看护和治疗，预计每周的费用超过5万英镑 实时快讯	未
车神舒马赫醒了？！	未
车票，还是几张一起的//@是岩蛋不是臭蛋://@零食少女:零食小礼包的卡券//@隔壁家李二狗:一张五十的一张二十的//@大懒糖:自行车钥匙//@西升月:我消失好久的u盘又出现了！//@阿粪青:发现过钱）超开心//@别再给我apple:洗过的一坨纸巾	未
车票那些事儿车票变形记	未
车祸	未
车祸今天（12月1日）人民路东头车祸：慢些开吧你！	未
车祸伤员倒地不起，路人提醒最好别碰台州民警： 出事情责任我担	未
车祸伤者急需输血 医生双手暖血袋40分钟	未
车祸凶猛！防城港两货车相撞，车头严重变形，现场一片狼藉	未
车祸刚刚！普州大道天桥下一行人过马路被撞伤........	未
车祸前后的两个自拍照：莫桑比克一名男乘客在车祸前后拍摄的两张自拍照。这辆巴士当时正从克利马内(莫桑比克东部城市)开往贝拉(莫桑比克南部城市)途中翻车了。从照片中可以看到，这名男子在上车前摆出自拍的姿势和车祸后差不多。	未
车祸后一家3口到交警队调解被肇事者刺死：刀刀毙命女儿驾驶小轿车载着父母，与刘某的货车发生刮擦双方数次协商无果后，交警通知双方到交警中队处理。就在交警离开办公室去取相关文书时，刘某用藏于衣内的尖刀捅向三人，致其死亡。凶手已被检方批捕，交警是否涉嫌渎职，警方已介入调查。车祸后一家3口到交警队调解被肇事者刺死:刀刀毙命	未
车祸后到底该怎么做交警提示：牢记这五字诀自保！	未
车祸女生亡灵寻命，做人切勿偷奸耍滑！	未
车祸断臂父亲离世都匀一少年人生连遭打击	未
车祸时女儿把父亲推开，孩子临终的话让父亲落泪，七天后父亲上吊	未
车祸时常发生，网友问霞浦这个红绿灯什么时候能正常	未
车祸昨天晚上安国保衡路附近发生车祸！面包车报废！	未
车祸是怎么发生的，不论你是否开车都该看看 车祸是怎么发生的，不论你是否开车都该看看	未
车祸  梅城环城路一小车撞倒行人，行人倒地不起	未
车祸猛于虎，北海一天内发生2起车祸，3人当场死亡！	未
车祸猛于虎！雍河湾外人行道发生车祸。	未
车祸现场	未
车祸现场 微博视频	未
车祸现场看热闹被扣18分罚400看完监控才知道罚得好	未
车祸 电瓶逆行真大胆，远光撞出节奏感！临沧的司机注意！	未
车祸获救家属锦旗致谢凌云中队消防员	未
车祸蔚县人民路东头车祸：慢些开吧你！	未
车祸：速度快到看不清！你咋不起飞呢	未
车窗当雾之急，怎么办	未
车窗抛物杀伤力有多大在高速上等同于扔炸弹！	未
车窗被炸飞车门炸变形 罪魁竟是车上的一箱“全无敌”	未
车窗被砸   肇事者告诉你这个理由...	未
车站为何这般清冷只因充满了漂泊和离别 今晚七点四六级终极一直播 安慰你我孤独的心	未
车站出的事，河池人赶快通知家人	未
车站地区海岸城地区启动严管整治专项行动，小飞龙见一辆查一辆目前，全市正在开展道路交通文明整治行动，市政府专门下发《关于开展非标电动（燃油）三四轮车辆专项整治的通告》，开展小飞龙专项整治工作。昨天，车站地区和海岸城地区启动了交通严管整治专项行动，严查严处交通违法行为，对小飞龙发现一辆查处一辆。（江南晚报）小飞龙见一辆查一辆，车站地区海岸城地区启动严管整治专项行动	未
车站外拍到，看了头皮发凉！	未
车站外拍的，看了头皮发凉！	未
车站已经进入春运状态了。春节的脚步越来越近了。 苏州上海虹桥火车站(苏州市)	未
车站拍的，都看看！	未
车站爆炸太恐怖了既然和我们日常有看关！安康人赶快观...	未
车站的女人，英国，1947年	未
车管所搬迁期间停办业务的通知	未
车管所：最严信号灯新规下达，以后闯红黄绿灯都将被罚！	未
车联网数据海啸下的出路  GGAI视角	未
车联网时代呼唤更多的CFMOTO	未
车胎爆了俩，困在五台山了。好在人没事儿。	未
车胎老化引发车辆自燃   路警消防齐上阵及时救援	未
车船税申报如何办理	未
车被建湖交警扣押，还赠送锦旗表示感谢，是怎么个情况呢	未
车要咋开危险系数才最低？雾天行车安全指南请查收	未
车见不平一声吼！郑州一公交公司设壮士座，乘客踊跃上岗	未
车让人是规矩，是文明也是道德。//@甄的爱你zwc:司机全责，但是说实话，开车时特别讨厌行人对我做停车手势，你特么又不是交警，凭什么拦我，我刚把速度加起来你特么强行过马路还挥手让我停车，还一点不怕，知道我不敢撞你，我一般会礼让，但超不爽，这种人早晚得出事，拿命抢着过马路，因果报应。	未
车评精选 GT86改装成AE86的难题，劳斯基该怎么办！	未
车越开动力越肉这几个地方出了问题，当然没力气跑 车越开动力越肉这几个地方出了问题，当然没力气跑	未
车身布满名人签名	未
车轮上的40年从自行车到自行车	未
车轮上的机器人酒店房间//@人工智能那点事: quot其自动旅行套房配备了基本的睡眠，工作和洗手间设施，使客人能够更有效率地使用他们的旅行时间。quot	未
车轮学院 与其等待救援不如自救！逃生知识	未
车轮打滑陷入泥坑，一分钟解决！不学后悔终生！	未
车轮碾过铁轨的声音总会让躺在小床上的我想象它带着一车的人奔向何方，那些坐在昏黄闪烁灯光里的旅客吃着茶叶蛋就着辣咸菜喝小啤酒的样子，哐当哐当，很神秘地越过我的家乡，偶尔几声鸣笛，像受了委屈的人在哭	未
车辆一夜忘记熄火 你知道会发生什么吗 车辆一夜忘记熄火 你知道会发生什么吗	未
车辆不让进小区：新修马路变身停车场	未
车辆乱停乱放的时候，有没有考虑过其他人的感受呢	未
车辆发生故障时，正确摆放三角警示牌！别敷衍	未
车辆启动后，把钥匙扔出车去还能继续行驶吗 车辆启动后，把钥匙扔出车去还能继续行驶吗	未
车辆在行驶过程中如果轮胎出现故障，带来的后果无法想象。所以清楚的了解自己车胎状况可以避免故障发生。以下五项简单易学的鉴别轮胎方法，快来看看！	未
车辆坠下15米深崖，百色德保一干部扶贫路上不幸身亡	未
车辆坠下深崖，百色一干部扶贫路上不幸身亡12月16日，百色德保县敬德镇团委书记陇正村挂村扶贫工作队队长黄志强，在开展扶贫工作途中发生交通事故，车辆坠下深崖，经抢救无效不幸身亡，年仅33岁。网页链接	未
车辆坠下深崖，百色一干部扶贫路上不幸身亡12月16日，百色德保县敬德镇团委书记陇正村挂村扶贫工作队队长黄志强，在开展扶贫工作途中发生交通事故，车辆坠下深崖，经抢救无效不幸身亡，年仅33岁网页链接	未
车辆套牌法不容 交警查处不放松揭西交警查获一辆套牌面包车	未
车辆抛锚别怕 蜀黍来帮忙近日早上9时许，交警巡逻至郑和中路高架时，发现南向北一小车抛锚，占据一股车道经了解，该车右前轮跑气无法行驶，需要换胎，可是驾驶人自己不会换，民警迅速上前帮忙，车主连声感谢蜀黍提醒车友熟悉车辆性能，了解车辆简单自救常识蜀黍换胎时候，可以跟着学习哦	未
车辆无保险合格标志被查 一查车主竟是逃犯	未
车辆碰擦用此神器，过半用户10分钟内就完成操作！便民提示你知道快处易赔吗TA是由上海公安交警会同上海保险业共同打造的交通事故快处神器每当发生机动车物损交通事故，只要通过上传照片等步骤，就能实现事故网上处理在线定责和保险报案等@警民直通车-上海 近期针对快处易 ...全文	未
车辆碰擦用此神器，过半用户10分钟内就完成操作！便民提示你知道快处易赔吗TA是由上海公安交警会同上海保险业共同打造的交通事故快处神器。每当发生机动车物损交通事故，只要通过上传照片等步骤，就能实现事故网上处理在线定责和保险报案等。@警民直通车-上海 近期针对快处易赔用户进行了使用体验度调查，结果显示，51的用户能够在10分钟之内完成事故快处易赔相关操作，超九成用户认为使用快处易赔处理事故快捷方便。详	未
车辆翻滚 车内飞出一人凯里云谷田园车祸：原来驾驶员喝酒了！	未
车辆自燃如何自救来看这位老司机的操作	未
车辆路中间违停让孩子尿尿罚800元，记2分14日，深圳一小车停在路中间让小孩尿尿，持续几分钟，造成后方车辆被堵，影响交通。司机不按规定停车驾车时有其他妨碍安全驾驶的行为，@深圳交警 对其罚款800元记2分。司机称：孩子着急上厕所，一直哭闹，情急之下才将车停在路边。你怎么看	未
车辆路中间违停让孩子尿尿 罚800元记2分14日，深圳一辆小车停在路中间让小孩尿尿，持续了几分钟，造成后方车辆被堵司机不按规定停车驾车时有其他妨碍安全驾驶的行为，@深圳交警 对其罚款800元记2分司机表示：孩子着急上厕所，一直哭闹，情急之下才将车停在路边这事儿你怎么看___ ...全文	未
车辆转弯时，危险正悄悄降临！致命细节不容忽视！	未
车辆转让扎兰屯市鸿途机动车驾驶员培训学校8台教练车转让	未
车辆过户新旧车主都未到场 细心警察一查原来是盗抢车	未
车辆限行取缔流动摊贩...光山县学校周边环境整治行动中！	未
车迷猜猜猜 下图中司机有哪些违法行为（来自单身狗的怨恨）	未
车迷问答2018小康家庭标准，你是哪一档	未
车迷问答你今年挣到钱了吗	未
车迷问答你是自己开车比较稳，还是载着朋友家人时比较稳（图自网络）	未
车迷问答你的驾照在哪儿考的?和沈腾尹正是一个驾校吗	未
车速已经开到140迈 乘客还掐住出租司机威逼加速	未
车道想变就变不仅让人讨厌，还会发生危险！  重细节平安行	未
车道检测相关资源列表Awesome Lane Detection by Amusi GitHub: 网页链接	未
车里有一些看不见的东西，怎么办	未
车里有这些东西的，想活命就赶紧拿下来！ 车里有这些东西的，想活命就赶紧拿下来！	未
车银优最新画报今日公开 强烈眼神凸显外貌	未
车门已经焊死了	未
车门紧锁，车内孩子正在哭泣	未
车门被撞飞，卡友围个床单就上高速，边开边冻得瑟瑟发！被交警拦下后......	未
车门都没关//@微影帝:卧槽我以为那只是个消防栓！	未
《车问》选车到提车 价格竟然差了辆凯美瑞	未
车间巡诊把关严，只为用电更安全11月22日，@国网临朐县供电公司 员工在某锌钢有限公司开展用电检查，对该企业生产用电设备车间供电线路进行仔细巡视，帮助规整散落地上的线路，紧固松动的电源线连接设备接头，及时消除隐患缺陷，保障企业安全生产。	未
车间现场的标识管理，印染企业可参考。	未
车间里灯光昏暗，温度也是和室外差不多，头顶上天车在换换前进，发出的警示笛音甚是烦人。我们都把手踹到了兜里，一旁的焊接加工飘来略微刺鼻的味道，走了两步，发现在半成品设备之间蹲着一个年轻人，应该正在调试机器，其实现场的光线远比摄像头里呈现出的要昏暗，但他还是聚精会神地工作。我问了老板，现在这些人的工资大概多少，老板说，大概五千多，还要包吃包住。	未
“车闹”怎样入刑？法律界意见不一	未
车险员提醒：这4个救援项目都是免费的，但很少有车主知道！	未
车顶行李架这种东西你还认识吗	未
车驾管服务璧山交巡警发布流动车管所12月份出行服务计划	未
车驾管服务重庆交巡警发布流动车管所12月份出行服务计划	未
轨交徐家汇站3号出入口桂林路站5号出入口即日起临时封闭便民提示1911号线徐家汇站3号出入口因配合周边改造施工，即日起实施封闭，封闭期间请乘客改从其他出入口进出车站。预计从2019年12月底重新投入使用。9号线桂林路站5号出入口因配合新线建设施工，即日起实施封闭。	未
轨交徐家汇站3号出入口桂林路站5号出入口即日起临时封闭便民提示1911号线徐家汇站3号出入口因配合周边改造施工，即日起实施封闭，封闭期间请乘客改从其他出入口进出车站预计从2019年12月底重新投入使用9号线桂林路站5号出入口因配合新线建设施工，即日起实施封闭	未
轨交速写全国最深地铁站，最大埋深达94.467米，相当于31层楼的高度，91部电梯绕晕你，从地面到检票口，要连续搭8段扶梯，走8分钟！	未
轨道4号线一期竣工验收，23分钟从唐家沱“飙拢”重庆北站	未
轨道5号线大石坝站今开通 首末班车时间请收好	未
轨道上的长三角要干些啥	未
轨道之霾还是沙尘暴	未
轨道交通12号线，已开工建设25个车站	未
轨道交通1号线试乘：河滨公园至喷水池不到5分钟！	未
轨道交通时代，让城市无界	未
轨道六号线支线二期王清区间隧道全线贯通	未
轨道族注意！重庆轨道环线东北半环年底通车啦	未
轨道环线抢鲜体验：全程50分钟 未来可换乘9条轨道线	未
《轩辕剑7》女性角色建模疑似曝光有网友在fanatical网站上找到一篇介绍《轩辕剑》系列的文章中发现了一张《轩辕剑7》女性角色的建模。从图中可以看到，该角色衣服上有着墨家的标志，但身份不明。	未
转。	未
转：29日上午，有部分影视工作室陆续接到税务部门通知，补税工作正式实施，共分为四个阶段：自查自纠约谈补税税务上门辅导检查以及重点检查（税务抽查）总体来说，工作室补缴税款需要按工作室总收入的20左右计算一个税务严管时代悄然来临了	未
转一下。	未
转一下大芳的回下血，万一中了我还血赚366元，我真是个天才	未
转一下，说抓这么多流浪猫是为了冒充猪肉做火腿肠。这真是魔鬼。有条件想领养猫的朋友可以关注一下。//@Chilly就酱://@喵呜不停: 天津的朋友，求助哇。看到猫咪在墙角躲成一摞，想必之前遭到极大恐吓，实在难受！	未
转一个！	未
转一个。//@中韭889:黄总，现你说的这样，现中国人对莆田人的态度，就是外国人对中国人的态度，这个不是偏袒莆田人，没有良心地骗钱，是该诛，有经过调查就知道，现在外面做医院真的就只有莆田一个镇（东庄镇），可大家反感的是整个莆田，在国外也希望，也是少部分中国人，可反感的是所有中国人！	未
转一圈冈仁波齐，远不止是一次徒步	未
转一波	未
转一转，单车变摩托	未
转下。	未
转：不要拒绝走那些漫长的道路，这也许是带你通往新世界的一条重要的线索。	未
转专访	未
转业军人入警两个月就有“粉丝”送锦旗：“长得真帅 办案真快”	未
转业降职安置到底合不合法	未
转个需	未
转：中国央行：我们注意到网上关于中央经济工作会议决定不减税不降费等传闻，这与事实相反。(来自财联社APP)	未
转了	未
转了一圈一个小伙伴都没遇到，不甘心回家	未
转了再说	未
转了慢慢看	未
转：人活着不应该靠心情，更应该靠心态	未
转会专家：张伯伦每出场超过20分钟，阿森纳就需付一万镑转会专家格农在他的新书《转会市场:内幕》中透露：当时张伯伦为阿森纳效力期间，只要他每一次出场超过20分钟，阿森纳就需要向南安普顿支付1万英镑。在2011年张伯伦转会阿森纳之后，枪手球迷对这位中场球员缺乏上场时间感到越来越沮丧。他主要在第71分钟之后是替补上场的，在他的合同细节曝光之后，一切都清楚了：当他每一次出场20分钟或者更多时间的时候，阿森纳就不得不向南安普顿支付1万英镑。2011年年仅17岁的张伯伦加盟了阿森纳，但却没有在主力阵容中站稳	未
转会专家：张伯伦每出场超过20分钟，阿森纳就需付一万镑转会专家格农在他的新书转会市场:内幕中透露：当时张伯伦为阿森纳效力期间，只要他每一次出场超过20分钟，阿森纳就需要向南安普顿支付1万英镑在2011年张伯伦转会阿森纳之后，枪手球迷对这位中场球员缺乏上场时间感到越来越沮丧他 ...全文	未
转会传闻切尔西一线队里面，有两位已经不在萨里计划当中的本土青训球员，后腰德林克沃特和边锋摩西。来自英媒的消息，水晶宫有意在冬窗将摩西带回塞尔赫斯特公园球场，蓝军要价1200万镑。现年27岁的摩西，本身就是出自水晶宫的青训，2007-2010曾经在水晶宫一线队踢了三年，之后在2010年冬窗转会去了维冈。鉴于水晶宫要保级，扎哈和汤森德都已经推上锋钱，加上他们有回购青训球员的案例，所以这笔潜在转会还有一定的参考性。	未
转会传闻据donbalon报道，恒大与哥伦比亚国脚金特罗传出绯闻。河床已经与恒大达成一致。河床同意以2000万欧元的价格把金特罗出售给恒大，金特罗有望加盟。但情况在过去24小时发生了变化，恒大似乎已经放弃这桩转会。因为在保利尼奥转会后，巴塞罗那和恒大保持着良好的关系。巴萨可能会以约6000万欧元的价格把马尔科姆出售给恒大。与金特罗相比，马尔科姆更年轻。	未
转会传闻据希腊媒体fosonline报道，奥林匹亚科斯对恒大外援阿兰感兴趣，阿兰有望加盟希腊豪门。奥林匹亚科斯计划引进一名前锋，他们想找到理想的解决方案。奥林匹亚科斯显然已经找到一些目标，恒大外援阿兰的名字在他们的引援名单上。此外，本菲卡球员费雷拉西汉姆联球员佩雷特诺维奇球员奥利维拉也是引援目标。	未
转会传闻据报道，博卡中场巴勃罗佩雷斯这个冬窗有可能离队，中超 是其转会目标之一，但具体球队未知。	未
转会大戏阿贾克斯中场弗兰基-德容的父亲表示他的儿子将在春天决定自己的未来，不过德容有95的可能在明年夏天离开阿贾克斯德容的父亲希望德容能够选择巴萨	未
转会市场网2019中国足协杯页面已经上线，目前已经制作完资格赛的赛程。资格赛将于12月2131日举行，今年不进行赛会制比赛，仅进行一轮淘汰赛制的预选赛，胜利者和其余报名的业余球队全部进入正赛。具体访问链接为网页链接	未
转会期Deft的专访	未
转会期风云格里芬今天度假了吗度了。在普吉岛哦虽然今天风平浪静，但是格里芬表示，管你们腥风血雨还是风平浪静，我不仅要旅游，我还要po照片给你们看！图源：Griffin官方FB英雄联盟	未
转：作为从小一直是别人家的孩子，我是如何一步一步认清自己的平庸的。	未
转 你们 怎么看我是孩子亲戚，孩子出来了，但我们一家的生活却无法回到从前。现在民愤太大，孩子爸爸他们还住在镇上宾馆，生活来源有很大的困难。小孩不让再在当地上学，其他家长也怕他回学校出事，孩子的教育问题该怎么办我们一家人都非常着急。下文是我和小孩爸爸昨天提交给村干部的家庭情况说明，实在是走投无路，才会向政府，向社会求助，希望大家也能对孩子多一些包容。我是西南村村民吴某，2018年12月2日晚我们家发生了巨大灾难，因家庭冲突，我儿子拿刀杀死了我妻子。突然而至的悲剧将我的家庭撞的支离破碎，一边是丧妻之痛，	未
转债市场午后探底回升	未
转债指数微涨 个券涨跌互现	未
转债指数微跌 个券涨跌互现	未
转//@傅峙峰:转发微博	未
转关，11月30日（本周五）抽5个小可爱各得红包 100元//@辣目洋子:内容过于真实了 生活对我下手了	未
转关我和@小豹姐姐呀 今晚抽一人精灵，家里还有几个，每天一台送完算了，占位置，烦！ 不过滤 不过滤 不过滤！	未
转关我和@猫巷小仙今晚抽一人精灵，家里还有几个，每天一台送完算了，占位置，烦！ 不过滤 不过滤 不过滤！	未
转关 抽10位粉丝平分1000元震惊大表哥知道你们这个月吃了不少土安慰金奉上缓解一下你的吃土情况明晚就抽[並不簡單]（不开过滤[並不簡單]）	未
转关，抽一个人送Taylor Swift的神专Red的黑胶！抽中的人2019年一定会Red一整年昂	未
转关，晚上照例抽一个200元沾喜气红包，吃瓜辛苦了！	未
转关的揪一个同款，明天八点就开	未
转：内蒙古自治区呼和浩特市开展文明养犬专项整治行动，新城区街道办事处给辖区养狗居民免费发放宠物犬嘴套牵狗绳等用品，防止狗伤人的情况发生。对这样加强服务善意引导的规范养犬管理措施点个赞。	未
转：内蒙古自治区呼和浩特市开展文明养犬专项整治行动，新城区街道办事处给辖区养狗居民免费发放宠物犬嘴套牵狗绳等用品，防止狗伤人的情况发生对这样加强服务善意引导的规范养犬管理措施点个赞	未
转出来之后又要被喷说你们上海人没有爱心，人家累了坐下来怎么了但我们只想说这是又没有家教的问题。从小父母就教育，再苦再累，有些事还是不要去做。	未
转发//@mayo回归://@大号被BAN的_某S://@大佐://@YING每天都想喝奶茶:电视台不去 公安局还逼家属签自杀坠亡 热搜被撤。有权有势有钱的人就可以无法无天。广州公安太令人失望了！平民的命就不是命吗！	未
转发一只	未
转发一段令人深思的讨论	未
转发上周证监会上交所召集了中信中金华泰瑞银四家券商，就关于科创板的制度设计安排，进行了小范围的沟通，主要有以下几个方面内容，制度突破很大。1上市标准设定了六种情况：第一套市值10亿元以上，连续两年盈利，两年累计扣非净利润5000万元第二套市值10亿元以上，连续一年盈利，一年累计扣非净利润1亿元第三套市值15亿元以上，收入2亿，三年研发投入占比10第四套市值20亿元以上，收入3亿，经营性现金流超过1亿元第五套市值30亿元以上，收入3亿第六套市值40亿元以上，产品空间大，知名机构投	未
转发丨12月份州中医院专家到牟定坐诊时间表	未
转发丨禹城交警大队征集交通事故线索	未
转发中 ，抽5位私信随机发红包	未
转发为他保密	未
转发了一下还是删了，看了下评论，建议大家也不要去增加回复了。大家想看的可能都是是懂车的人和不懂车的键盘侠之间的battle，不想看空瓶或者解释。何况电粉和面粉如果能听解释的话也不会这么执着一定要当复读机了。	未
转发了，网友们一起来玩哇	未
转发了解！坐等年终奖这些你要知道！辛苦了一整年，终于快到年关，是不是在坐等年终奖！可是人人都有年终奖吗新进职工有份吗提前离职能不能拿个税改革对你的钱袋子有影响吗戳图，关于年终奖的那些疑问与自己的权益息息相关，转给身边的小伙伴！	未
转发什么锦鲤 转发这个来年什么都不做 也有的打工仔给你打工 不用想宣传 不用做美工 躺着收钱	未
转发今天，为她转发：向暴力侵害妇女行为说不！	未
转发冬季水性木器漆施工 千万要注意这些	未
转发删除2018年剩下日子的坏运气	未
转发即代表喝了	未
转发原微博，并@ 两位您尊敬的人，一位宽脸，一位窄脸，两天后抽5位朋友送大象公会主题贴纸。 查看图片	未
转发原微博并关注，在转发里抽1人送200元吃货基金	未
转发原微博，抽两人入住酒店啦	未
转发受限的问题建议大家耐心等待一下，账号恢复后不要进行过于频繁的转发操作噢	未
转发，向和平年代的英雄致敬，一路走好！刀尖刺向受害人，危急关头他挺身而出生命最后一刻，他迎向歹徒毫无退缩警察，是和平年代流血最多，牺牲最大的职业群体。一个多月多名公安民警不幸牺牲。平安不会从天而降，岁月静好，只因有人用生命保万家安宁，2019年最期待平安。	未
