车专言平原微博，安排1位锦鲤，666块现金安排上。既然吧，写都写了（由于机器用过了），那我就给钱吧！哈哈哈哈哈哈哈哈哈哈哈哈哈。	未
车专评原文揪一个同学赐500	未
车个网纹，觉得怎么样	未
车主们！不懂这些别说你会开车好吗！	未
车主们快看，一小时连内碰瓷三辆车，得手后一路小跑！	未
车主们注意了！龙台镇黑漆房子附近，已有两辆车滑入沟壑出不来	未
车主们注意了！龙溪立交黄村立交今起围蔽施工，绕行这样走..	未
车主们注意啦！油价四连跌 加满一箱油少花5块钱国家发改委发布通知，自12月14日24时起，国内汽油价格每吨降低125元，柴油价格每吨降低120元这是油价连续第四次下跌，全部回吐今年年内涨幅，车主们加满一箱油将少花5元左右调价后，全国多数地区92号汽油零售限价在6.7-6.9元/升走吧， ...全文	未
车主们注意啦！泉州这126家运输企业被蜀黍曝光！竟然是因为它们百日安全行动	未
车主们注意啦！绥中新增多处区间测速，明天开始实施	未
车主们注意！天通苑开始贴条了！	未
车主们注意！罚5000元扣12分，这些事儿您千万别做！	未
车主们要警惕啊年底了，小偷也要过年了 车轮上的世界	未
@车主们，邳州这12000辆车将要被淘汰！看看有你们的吗	未
车主们震惊了！这段记者暗访视频火了	未
车主俱乐部 66岁的老司机驾驶劳斯莱斯在隧道内撞墙，隧道这地方的设计是不是有问题呀！	未
车主俱乐部 你能认出来这保时捷918 Spyder旁边停的是什么车吗	未
车主俱乐部 兰博基尼Aventador SVJ	未
车主俱乐部 兰博基尼LM002蛮牛超跑的前世，法拉利之前肯定想不到做拖拉机能成为自己最大的敌手，所以大家千万不要怀疑自己的梦想，只要敢想敢干就能成就不一样的自己！	未
车主俱乐部 哈哈哈哈哈哈哈哈你是哪个俱乐部的会员呢	未
车主俱乐部布加迪Veyron Vitesse Unicorn	未
车主俱乐部 当超跑变身超级赛车	未
车主俱乐部 新交付的迈凯伦SENNA撞车，过年的钱都撞没有啦！	未
车主俱乐部 新款阿斯顿马丁Vantage，听说是刚提车不久就撞啦！	未
车主俱乐部 红色法拉利LaFerrari	未
车主俱乐部 路边发现一头蛮牛，你说它是怎么跑过去滴	未
车主俱乐部 迈凯伦SENNA	未
车主俱乐部 马自达RX-7，曾经转子引擎的诱惑！	未
车主办免费保养卡1年多保养19次 4S店拒绝再履约	未
车主在违停单上写＂有种把我拖走＂ 交警将车拖走	未
车主忘锁车门，妙龄女竟进去方便郑州一名车主停车后忘锁车门，深夜，一名妙龄女子出现在车边，可能是内急，先是东张西望看是否有人，后来直接拉开车门就进去方便。第二天车主欲带孩子外出时，后座的屎尿弄了孩子一身，才发现这桩奇葩事。目前，车主已经报了警，并希望那名女子能站出来向他 ...全文	未
车主摇到豹子号00000兴奋不已，但看了网友评论却...	未
@车主朋友 10日起海口市国省道限速60km/h 超速行驶将被抓拍	未
车主气炸！3万3就把偷我的百万豪车给卖了！近日，武汉光谷，一盗贼进入某汽修行行窃时，顺手牵羊，偷走一台百万豪车，可是他转手就以3万3的白菜价将车卖掉。随后，车子被转手多人。后来，车主施先生收到一条来自恩施的短信：想赎车9万！@平安光谷 民警循线追踪，最终将盗车收车的悉数抓获！目前，盗车男子陈某已被刑拘，案件正在进一步审查办理当中。（魏娜 李雨生 闻期骏）汉警微镜头 百万豪车被盗后被贱卖 买家发来短信：9万赎车！	未
车主注意：12月1日起，井陉这两处电子抓拍设备正式启动！	未
车主注意！即日起南京新增7处电子监控	未
车主注意！即日起，莲花路部分路段围蔽施工	未
车主注意！建新路福贤路12月起将进行半封闭施工	未
车主注意！长沙县将新增20个抓拍电子警察路口，地址在...	未
车主注意！长沙县新增20个电子警察，已开始抓拍	未
车主要注意了！大湖溪洛塘渠玉台桥将临时封闭	未
车主请注意！车上的这个设备千万别乱用，否则将闯大祸！	未
车主贪便宜蹭ETC，交警笑了：看他下高速时，还怎么玩	未
车主速看！亳州老城区道路辅路分时段禁停！	未
车主速看！江门市区这些路将临时封闭！今晚去这地方千万注意！	未
车乱停罚你没商量！	未
车事侦察站 新款捷豹XE谍照曝光 将日内瓦车展发布日前，我们从海外媒体处获悉了一组新款捷豹XE的路试谍照。新车在外观方面进行小幅升级，并将推出混动版车型。据了解，新车将于2019日内瓦车展发布。新款捷豹XE谍照曝光 将日内瓦车展发布	未
车企抱团之风加剧，宝马、戴姆勒被曝考虑联手打造核心零部件	未
车企纷纷布局网约车市场 醉翁之意不在销量？	未
车企过冬指南（上）：该裁的裁该卖的卖，把钱花在刀刃上	未
车位100元/年租给企业，体恤也要有所不为	未
车位100元/年租给企业，体恤也要有所不为丨新京报快评	未
车位只卖不租无车位的车辆禁止入小区！这样的霸王条款你遇到过吗...	未
车位太紧张，宾利直接停奔驰后面，网友：奔驰车主不敢挪车了	未
车俊任浙江省委副书记 李强另有任用	未
车俊任浙江省委副书记，李强另有任用	未
车俊出任浙江省委副书记 李强不再担任	未
车俊同志任中共浙江省委副书记（图/简历）	未
车停楼下，被钢弹击中！苏州沈先生吓出一身汗！	未
车停空地一年多 玛莎拉蒂被拆的只剩空壳12月15日，浙江宁波一辆玛莎拉蒂停放在广场外空地一年多时间，车主来取车时发现车子被偷的只剩空壳。喇叭电视音响四个轮胎窗户车牌框等，都被拆得干干净净。 L新京报我们视频的秒拍视频  @新京报我们视频  网页链接	未
车内咋变样了呢	未
车内噪音很大这件事你一定没做	未
车内悬挂佛串被罚50元 你的车里又挂饰吗___?近日，一段发生在衡水故城县的小视频在朋友圈流传视频发布者称，因为在车内后视镜悬挂佛串被罚款50元经了解，确有此事道路交通安全法明令禁止在驾驶室前后窗范围内悬挂放置妨碍驾驶人视线的物品对此交管部门提醒：不仅仅是车内 ...全文	未
车内有刺客他有你没有原因在这里！	未
车内有支麦克风上班因为堵车要迟到了怎么办赶紧拿起车内麦克风，给自己来一首卡路里打打气鸭！@比亚迪汽车	未
车内有支麦克风 以前下班：大伙我们一起去唱K吧！现在下班：大伙来我车上唱K吧，仅限四位，先到先得！@比亚迪汽车	未
车内有支麦克风新手开车遭遇路怒怎么办，谁说新手就没脾气直到遇见秦Pro不同凡响的黑科技，发烧级移动K吧后，路怒啥的烦心事就全部抛在脑后吧！	未
车内有支麦克风 终于找到属于本麦霸的战场了，我觉得我坐在副驾驶唱起来，苍南开车不用按喇叭了@比亚迪汽车	未
车内有支麦克风 非常适合路怒症患者，以后开车遇到不文明行为的时候可以化愤怒为歌声了@比亚迪汽车	未
车内没有裸露管 男司机给扶手全带“红手套”	未
车内藏了一把唐刀，车主称“为了辟邪”	未
车厘子价格战：当人家现在卖69/斤，你卖39.9/斤，还赚死！	未
车厘子和驯鹿撞进心田，酿一瓶甜润 mopo3ob 酒	未
车友专栏东北交警唐僧式执法，司机都忍不住笑了....	未
车友专栏交警贴条擦车事件：交警公布执法记录仪视频	未
车友专栏安全出行，这些交通指挥手势信号你都认识吗	未
车友互助 微博网友@Chen_les 提问：20万左右的车哪一款性价比最高！最近五年内不换车！现在有看阿特兹，蒙迪欧，迈腾这三款答：这三款车之间，从保值率或者后期出手难易程度来说，迈腾应该优于其余两个选项，但是日常用车成本较高这三款车（20万价位可以买到的具体型号）在日常驾驶中，蒙迪欧的 ...全文	未
车友互助 微博网友@Chen_les 提问：20万左右的车哪一款性价比最高！最近五年内不换车！现在有看阿特兹，蒙迪欧，迈腾这三款。答：这三款车之间，从保值率或者后期出手难易程度来说，迈腾应该优于其余两个选项，但是日常用车成本较高。这三款车（20万价位可以买到的具体型号）在日常驾驶中，蒙迪欧的动力应该是最充沛的，而阿特兹的驾驶感受应该是最直接犀利的，迈腾则属于中规中矩的类型，家用商用都很合适。其实20万左右的价位，还可以看看凯美瑞或者雅阁，性价比都算是比较高的。各位网友，如果这几款车让你开5年，你会选	未
车友互助 微博网友@Lucky-to-have-you 提问：路上偶遇这款车，哪位老司机认识它呢	未
车友互助 微博网友@王十三8724 提问：自己是大学生，家里给了50万，想买一辆30万左右的车，自己每月兼职可以赚4000元，其中1000元用来养车看了英菲尼迪Q50L进享奔驰C260L运动版沃尔沃S60L和凯迪拉克，不要SUV，朋友建议加钱上5系，但是感觉没必要，现在家里给买的20几万足够了不知道该选什么 ...全文	未
车友互助 微博网友@王十三8724 提问：自己是大学生，家里给了50万，想买一辆30万左右的车，自己每月兼职可以赚4000元，其中1000元用来养车。看了英菲尼迪Q50L进享奔驰C260L运动版沃尔沃S60L和凯迪拉克，不要SUV，朋友建议加钱上5系，但是感觉没必要，现在家里给买的20几万足够了。不知道该选什么，麻烦各位网友给一些意见。现在的大学生真幸福，各位网友觉得30万左右应该选什么车，您又有什么更好的推荐呢@购车帮帮忙	未
车友互助 微博网友@谁叫我洪洪 提问：母亲喜欢卡罗拉，但是觉得配置不高。提问者比较偏向凌派或者缤瑞，配置较好。这几款车如何或者13万左右有什么车可以推荐一下答：卡罗拉的配置的确在同级别的对手之间略显寒酸，不过对于配置实用性的重要性永远大于数量，比如凌派和缤瑞的座椅加热倒车雷达主动安全系统都属于比较实用的配置，从配置层面来看卡罗拉的性价比并不高。如果在选车时，配置优先，其实缤瑞还是比较合适的，价格也相对便宜如果从保值率和用车养护成本来看，丰田较为省心，比较适合日常家用。各位网友会在这三款车型	未
车友互助 网友向各位老司机求助：轮胎正常，新车无任何故障灯。新款Espece在慢速转弯的时候，总会有转向过度的感觉，是车的问题还是我不适应	未
车友们，赶紧查查自己爱车有没有违法未处理的。	未
车友会	未
车友惠开通贷款业务！需要的看过来！	未
车友注意油价又要变！赶紧看！	未
车合格油达标，怎么一到车检尾气就超标了	未
车后有眼 倒车不愁自己动手无损安装倒车影像	未
车和家收购力帆汽车 江淮蔚来抠标这种事儿，车和家花6.5亿搞定了 江淮蔚来抠标这种事儿 车和家花6.5亿搞定了	未
车和家李想再怼李开复：请把你自己的家里的车公司给你配的车卖掉	未
车和家江苏生产基地已停建，或由力帆代工理想智造ONE	未
车圈新闻北京推迟2019年实施国六 国五车仍在正常销售乘联会秘书长崔东树认为，国六标准的推进对企业来说并不难，从国一到国五的推进，没有哪家企业会掉队，只是成本和节奏问题，目前很多车企没有反应过来，没想到国六标准会提前实施12月11日，北京市政府热线电话表示，北京市将在2020年1月1日 ...全文	未
车圈新闻发改委严控电动车产能过剩：十省新能源项目难获批2018年12月18日，国家发改委正式发布了《汽车产业投资管理规定》（以下简称《规定》）。该《规定》将包括新建纯电动企业项目在内的汽车整体投资项目的管理权限，从中央下放到地方，并将管理方式由核准制改为备案制。新《规定》的出台，将规避新能源汽车的产能过剩，并遏制投资泡沫。从鼓励支持新能源汽车投资建厂，到提高新建纯电动汽车企业生产门槛严控新项目的审批，再到新规定放开准入但通过事中事后监管严进严出，国家发改委对于新能源汽车产业的发展规划，提出了	未
车圈新闻因转向系统问题 保时捷全球召回74585辆Panamera保时捷表示，将在全球召回74，585辆Panamera轿车，其中约19，200辆在美国和加拿大，以修复可能导致电动转向系统短时间无法使用的软件问题。这次召回范围包括2016年3月6日至2018年12月6日生产的新一代Panamera。在中国市场，第三季度保时捷在 ...全文	未
车圈新闻因转向系统问题 保时捷全球召回74585辆Panamera保时捷表示，将在全球召回74，585辆Panamera轿车，其中约19，200辆在美国和加拿大，以修复可能导致电动转向系统短时间无法使用的软件问题。这次召回范围包括2016年3月6日至2018年12月6日生产的新一代Panamera。在中国市场，第三季度保时捷在华新车交付量暴增25.59，达到2.3万辆，前三季度累积销量超过5.6万辆，中国市场继续蝉联保时捷全球最大单一市场。按照这一增长势头，保时捷2018年在华销量超过去年的7	未
车圈新闻大众将于2026年推出最后一代内燃机汽车大众首席战略官Michael Jost表示，这家德国汽车制造商的核心品牌将在2026年开发推出最后一代内燃机汽车大众汽车在2015年曝出柴油尾气造假丑闻后，采取了转向电池驱动汽车的战略这起丑闻导致大众汽车支付了270多亿欧元的罚款 2026年将是最后 ...全文	未
车圈新闻天津一汽丰田广汽丰田召回部分汽车国家市场监管总局消息，日前，天津一汽丰田汽车有限公司广汽丰田汽车有限公司向国家市场监管总局备案了召回计划，决定自2019年2月22日起召回以下汽车，共计19896辆：天津一汽丰田召回2018年9月14日至2018年11月27日期间生产的奕泽（IZOA）汽车，共 ...全文	未
车圈新闻 年末将至 八成自主车企恐难完成销量目标突如其来的车市寒流，令大部分车企都将很难完成2018年的销量目标上汽乘用车与奇瑞汽车在年度目标达成上表现较好，其余几家都承受较大压力而市场的下行对于弱势的自主品牌来说，更具挑战	未
车圈新闻广州拟在空气污染红色预警期间实行汽车单双号行驶据新华社11月30日消息，广州市环保局日前公布了关于环境空气污染天气期间实施临时交通管理措施的通告（修编征求意见稿），提出在环境空气污染天气期间实施临时交通管理措施根据通告，黄色预警期间，广州将禁止散装材料运输车渣土 ...全文	未
车圈新闻广州拟在空气污染红色预警期间实行汽车单双号行驶据新华社11月30日消息，广州市环保局日前公布了《关于环境空气污染天气期间实施临时交通管理措施的通告（修编征求意见稿）》，提出在环境空气污染天气期间实施临时交通管理措施。根据通告，黄色预警期间，广州将禁止散装材料运输车渣土运输车建筑垃圾运输车在本市行政区域内道路通行。橙色预警期间，在黄色预警采取措施的基础上，增加中型重型柴油货车实行单号单日双号双日限行。红色预警期间，在橙色预警采取措施的基础上，增加汽车在广州市行政区域内实行单号单日	未
车圈新闻 新势力烧钱大战未了 奇点汽车疑似掉队造车新势力的烧钱大战依然在如火如荼进行，然而已有车企疑似在这场战斗中掉队。近日，有传言称，奇点汽车陷入资金紧张困境。有内部员工对外宣称，奇点汽车从10月份开始，暂缓发放薪酬。奇点汽车是否会成第一个掉队者呢	未
车圈新闻 新势力烧钱大战未了 奇点汽车疑似掉队造车新势力的烧钱大战依然在如火如荼进行，然而已有车企疑似在这场战斗中掉队近日，有传言称，奇点汽车陷入资金紧张困境有内部员工对外宣称，奇点汽车从10月份开始，暂缓发放薪酬奇点汽车是否会成第一个掉队者呢	未
车圈新闻 日产再陷质检门 将召回15万辆汽车日产汽车表示，由于在日本的两座工厂中发现车辆出厂前的最后检查不当，将在日本再召回15万辆汽车。过去一年中，日产已经披露了几起不当检查案例，这是该公司在一年内发现的第二起不当行为。自去年十月，日产汽车因检查不当已经召回100多万辆汽车。	未
车圈新闻法拉第未来调整业务营运：不得不进一步采取停薪留职今早，据外媒消息称，今天至少又有250名员工被待岗安置FF表示，公司现金流的紧张状况仍将持续，不得不采取进一步的成本削减措施来应对当前的财务状况，包括进一步采取停薪留职措施，预计此次的临时措施会持续到12月底	未
车圈新闻混合动力车不是新能源深圳：新规不影响新能源车增量调控政策近日有自媒体称，根据国家发改委相关新规，2019年起混合动力车将正式退出新能源行列，划归为燃油汽车，新政后续将对混动车辆上牌补贴等造成影响。对此，深圳市交委明确表示：国家发改委的规定不会对新能源车辆增量调控 ...全文	未
车圈新闻电动自行车市场大洗牌！电动车自行车新国标将上线！2019年4月15日，电动自行车新国标就要正式实施了新国标规定，最高车速不得超过每小时25千米有人表示：车速降下来，对骑行者自身行人以及汽车驾驶者都有利也有人表示：车速不是问题，问题是不遵守交通规则对此，你怎么看	未
车圈新闻 马斯克：特斯拉可能会收购几家通用关闭的工厂特斯拉首席执行官埃隆马斯克在一次电视采访中表示，他的公司有可能收购几家通用汽车计划关闭的工厂如果马斯克兑现了他所说的，那么意味着这将不是特斯拉第一次在其他公司关闭工厂后接管，也不是该公司第一次接管通用汽车使用的工厂	未
车圈话题 你所在的地方，车主买新车交付时有什么习俗吗	未
车圈资讯：大众福特欲建立全球化汽车联盟日产拒绝雷诺提名董事会主席特朗普要求德系车企增加在美投资通用坚持裁员与关停工厂计划	未
车圈趣闻 同样是车友会，差别可真大所以知道该选什么车了吗	未
车在兴宁，却收到平远的罚单，还不止一张，怎么回事	未
车在哪儿领	未
车场小保安意外调戏到美女总裁，原以为会被辞退，结果他竟...	未
车型面面观大众品牌新途观L疲劳监测系统人的感官容易出现偏差，是坚持驾车还是停下休息，有时会让人无法准确判断。新途观L疲劳监测系统能够通过传感器记录驾驶者的操作，并实时评估其疲劳程度，对疲劳驾驶说NO！	未
车型面面观大众品牌途昂行车辅助系统开车视线有盲区不存在的！途昂配备360度鸟瞰式全景可视行车辅助系统，可借助围绕车身的4个190度超广角高清摄像头了解车身周围环境，时刻保障行车安全。	未
车型面面观斯柯达品牌柯珞克全景天窗柯珞克拥有1.17的全景大天窗，车内空间备显通透，外界景色被毫无保留的纳入车内，开车不再无聊。	未
车型面面观斯柯达品牌柯珞克自动驻车功能柯珞克的Auto Hold自动驻车功能在等红绿灯时，只要车辆完全停稳，自动驻车系统就会自动锁住四个车轮，以免发生溜车。轻踩油门后，刹车自动解除，车辆继续前进，特别方便。	未
车城西路，梧桐叶黄@十堰晚报 十堰  人民商场	未
车多的烦恼就是，总得想着保养这次给大S也换上了新出的极护SUPERCAR 0W-40（以前SUPERCAR系列只有20和60粘度），给这么佛系的一台车也加上这么高性能的机油，完全是因为我开车的习惯是几乎不热车，而且上主路的第一脚通常都会踩的比较深	未
车夫拉了一窝黄鼠狼，几年后自己幼子死而复生！	未
车头全变形满地碎玻璃 湖北阳新一客车与货车相撞 已致3死10伤	未
车子停在金华某菜市场附近，被人划了一条长长的划痕，车主查监控发现	未
车子半路没油，别轻易向别人借！ 车子半路没油，别轻易向别人借！	未
车子坏了回屋拿工具，出来的时候就发现车上站了一只猫，喵子王by/FB/Catper Rakkiat	未
车子突然熄火，原因可能你想不到！	未
车子被人用记号笔写了字，好无奈，可是有什么办法呢杭州爆料@19楼 网友发帖：有人在这辆车上写下这句话，表达了内心的愤怒，一般我都是打114的，也有可能打了114也联系不上车主。有网友觉得比直接拿钥匙划客气多了，也有网友觉得还是用A4纸贴告知条最合适。对于这种做法，你怎么看	未
车市周期性回调： 汽车金融能否成为新引擎？	未
车市寒流加剧新造车企业危机感 蔚来汽车称窗口期短至半年其实留给我们的时间窗口不是三年五年，只有一年，或者说只有半年。谈到新造车企业在2019年面临的挑战，蔚来汽车用户发展副总裁朱江说。尽管蔚来汽车在产品交付量和融资规模上，目前都跑在了新造车企业的第一名。此前威马汽车创始人沈 ...全文	未
车市遇冷 产业链上下游的危与机	未
车库快评炸了！明年新能源车型数量将翻倍！因为工信部发文了！	未
车底下捡到只流浪猫，洗干净老婆却说捡到宝了	未
车开的好不好，得看你会不会刹车！	未
车抛锚在上坡路上了。挂不上挡。下雪了还。	未
车撞车	未
车显示上为什么有个小人在拉屎	未
车架号有什么用应该怎么查看	未
车检新规将带来什么	未
车棚出租11年零违规，海曙这个小区靠的是什么	未
车没熄火停在环岛中央 司机呼呼大睡	未
车流滚滚，男子爬电线过马路据英国《每日邮报》12月7日报道，越南首都河内一条繁忙的大街上，本周三早高峰时上演奇葩一幕。一名心急火燎的男子试图横穿马路，却因为道路上车流滚滚，一时找不到走过去的机会，于是突发奇想。	未
车烧剩壳！九台一村民家起火，车库和车全烧了...(视频)	未
车牌上作假 高科技一眼认出	未
车牌号为吉A的犊子，请赶紧滚出长春！	未
车牌号为渝G的司机，你摊上事了！丰都人速看！	未
车牌号为甘J的司机，请你立刻离开定西！	未
车牌号为甘J的司机，请你立刻离开漳县！	未
车牌号为粤K的司机，请你离开信宜！	未
车牌号为苏的司机，请立刻离开徐州！	未
车牌号为豫H的司机，请你马上离开武陟！	未
车牌号桂的司机，请你立刻离开！	未
车牌号浙A的司机，请你马上离开杭州！	未
车牌号湘F的司机，请你马上离开岳阳！	未
车牌号豫J97G66的车主，你摊上大事了！	未
车牌号：鲁A Z2W85	未
车牌固封螺丝坏了丢了怎么办武汉交警上线固封螺丝申领功能！	未
车牌照片能打开停车道闸，网友担心有安全隐患	未
车牌被雪遮挡了，会被扣12分吗	未
车牌！！车牌呢	未
车牌都有点意思//@迪拜-24:香港的天桥摄真是爽	未
车狠，司机更狠	未
车王舒马赫“又醒了”？	未
车王舒马赫已苏醒，并已离开医院，转入康复中心，舒马赫目前可以和妻子和孩子交流	未
车王舒马赫“急停”五载 何时“放下手刹”	未
车王舒马赫醒了！无需插管维持生命 交流仍存障碍	未
车王苏醒曝舒马赫已不再卧床不起 无需插管维持生命2013年，德国车王舒马赫在滑雪时发生意外，头部与岩石相撞，5年来始终处于昏迷状态。据外媒报道，康复状况一直不太明朗的舒马赫，目前已经不再卧床不起，也无需通过插管来维持生命体征，不过仍需接受护理与治疗。车王苏醒曝舒马赫已不再卧床不起 无需插管维持生命	未
车留下，我打个车送你先回家，因为只有一个头盔，不安全	未
车真的是很多人的另一个生活空间，我是很注重车内气味的，直接影响健康和乘坐体验，明天上午十点小程序上的车载香薰，精致又实用，孕妇小孩都可以，外观和香味很提升品味，不止于车上，放在任何你想增添香气和装饰的地方，讲究又不将就！宜样生活	未
车知识缩短发动机寿命的五种操作，99的驾驶人表示中招	未
