转发，向和平年代的英雄致敬，一路走好！刀尖刺向受害人，危急关头他挺身而出生命最后一刻，他迎向歹徒毫无退缩警察，是和平年代流血最多，牺牲最大的职业群体一个多月来，多名公安民警辅警不幸牺牲平安从来不会从天而降，岁月静好，只因有人用生命保万家安宁铭记他们，转发，致敬！	未
转发！向环卫工人说声：辛苦了！他们总是起早贪黑，无论寒冬酷暑悬崖峭壁街头巷尾都有他们的身影。有时为了一个塑料瓶，他们甚至要拼上性命去捡，却常常因劝阻乱扔垃圾遭到言语上的羞辱他们是城市的美容师，用一身汗水换来整洁的环境。转发承诺，不乱扔垃圾，尊重他们的劳动！	未
转发！向环卫工人说声：辛苦了！微盘点他们总是起早贪黑，无论寒冬酷暑悬崖峭壁街头巷尾都有他们的身影。有时为了一个塑料瓶，他们甚至要拼上性命去捡，却常常因劝阻乱扔垃圾遭到言语上的羞辱他们是城市的美容师，用一身汗水换来整洁的环境。转发承诺，不乱扔垃圾，尊重他们的劳动！	未
转发周知：12月13日1000南京大屠杀死难者国家公祭仪式开始10011002防空警报鸣响期间，主城区范围内道路上（不含高速公路绕城公路高架隧道）行驶的机动车（正在执行紧急任务的特种车辆除外）应当停驶鸣笛致哀，火车船舶同时鸣笛致哀，道路上的行人和公共场所的所有人员（正在从事特种 ...全文	未
转发周知：明天12月13日1000南京大屠杀死难者国家公祭仪式开始10011002防空警报鸣响期间，主城区范围内道路上（不含高速公路绕城公路高架隧道）行驶的机动车（正在执行紧急任务的特种车辆除外）应当停驶鸣笛致哀，火车船舶同时鸣笛致哀，道路上的行人和公共场所的所有人员（正在从事 ...全文	未
转发和评论前二	未
转发图片仅18次阅读被索赔十万公号转发黑猫警长图片被索赔10万 博主：仅18次阅读1月31日某公众号转发一篇文章，文中配有黑猫警长图片，这篇文章的阅读量为18次，无点赞和评论。今年8月，该公众号所在公司法人万先生收到法院传票，上海美术电影制片厂起诉侵权并索赔10万元。公号转发黑猫警长图 仅18次阅读量被索赔10万	未
转发完了怎么保护她们呢//@霸道大锤爱上我:触目惊心//@洛晨Andrew_Tom://@buzzinglarrie://@安提戈涅_WhiteBlade:转发微博	未
转发，寻人	未
转发寻人，在印尼的朋友如果有任何线索请提供给博主	未
转发寻人！大雾天，扬州一女子走失4天，您看到过她吗	未
转发寻人宝鸡四岁女孩失踪已两月你见过她吗宝鸡眉县首善镇王长官寨村的四岁女孩李紫瑶，10月5日从村子里失踪，两个多月来，孩子的家人和警方多方寻找但仍杳无音讯李紫瑶今年4岁，身高1.1米，短发大眼睛单眼皮浓眉圆脸皮肤黑，会说陕西话和普通话，能说清父母名字失踪时她上身穿黄色 ...全文	未
转发寻人宝鸡四岁女孩失踪已两月你见过她吗宝鸡眉县首善镇王长官寨村的四岁女孩李紫瑶，10月5日从村子里失踪，两个多月来，孩子的家人和警方多方寻找但仍杳无音讯。李紫瑶今年4岁，身高1.1米，短发大眼睛单眼皮浓眉圆脸皮肤黑，会说陕西话和普通话，能说清父母名字。失踪时她上身穿黄色卫衣，胸前印有小猪佩奇图案，下身穿黑色裤子，右裤腿印有紫色帽子图案，脚穿粉色凉拖鞋，鞋面有小猪佩奇图案。12月14日，女孩的妈妈李女士说：10月5日上午，只有我和两个孩子在家，早上大概9点多，我给紫瑶洗完头，吹干头发她	未
转发寻找光荣的您  信宜市白石镇为退伍军人信息库现场采集的通知	未
转发就是希望事儿哥帮帮忙	未
转发！//@张思莱医师:转发！	未
转发微博	未
转发微博//@于双子鱼:二十四节气-大雪在线：二十四节气-大雪今日大雪	未
转发微博今天是全国交通安全日。	未
转发微博//@名曰老饕:如果你停止进食会怎么样	未
转发微博//@名曰老饕:花式汉堡家庭自制	未
转发微博，向消防英雄致敬他们寒冬救火，自己却全身结冰他们风雪中逆行，只为排查沿途险情他们用臂膀托起一个个生命，自己却常常因救援而倒下哪里有危难，他们就在哪里。和平年代，他们与牺牲如此接近，只为守护你我平安。转发，致敬消防英雄！愿你每次出发，都能平安归来！	未
转发微博，向消防英雄致敬他们寒冬救火，自己却全身结冰他们风雪中逆行，只为排查沿途险情他们用臂膀托起一个个生命，自己却常常因救援而倒下哪里有危难，他们就在哪里和平年代，他们与牺牲如此接近，只为守护你我平安转发，致敬消防英雄！愿你每次出发，都能平安归来！ （人民日 ...全文	未
转发微博，向消防英雄致敬他们寒冬救火，自己却全身结冰他们风雪中逆行，只为排查沿途险情他们用臂膀托起一个个生命，自己却常常因救援而倒下哪里有危难，他们就在哪里和平年代，他们与牺牲如此接近，只为守护你我平安转发，致敬消防英雄！愿你每次出发，都能平安归来！（人民日报）	未
转发微博大雾黄色预警中，目前京平高速仍处于封闭状态，出行请关注路况信息并注意交通安全。	未
转发微博//@文踪旅迹:我虽与塔河只有一面之缘，但那里的天地之纯，主人之诚以及洋溢在眉宇间的善良，真是在心里扎着呢。	未
转发微博棉裤预警全国大部地区气温创新低，北京市气象台也已发布了持续低温蓝色预警信号，受持续补充冷空气影响，预计6日至9日，本市将出现持续低温天气，平原地区日最低气温将下降至零下10左右，小伙伴们出行注意防寒保暖哦	未
转发微博注意安全使用家中电器，谨防火灾	未
转发微博，致敬逆火而行的英雄！25日，受寒流影响，新疆北部地区城市气温骤降10到15，局部地区伴10到12级大风塔城地区户外木材堆着火，消防员赶到火灾现场，接下来的这一幕很震撼致敬，烈火中的英雄！@新疆消防	未
转发 微博舞蹈那个大微来电	未
转发微博，说实话，因为不知道应该怎么说，只能转发微博	未
转发微博//@赏影猎人:一年了。也给自己纪念一次。	未
转发微博遇到大型车辆，请保持适当距离！注意安全！	未
转发微博//@黄成城食品-荣昌卤鹅:冬天来了，还有很多人没有冬衣，您有多的冬衣可以捐出来么	未
转发微薄	未
转发打捞，有意请私信	未
转发扩散！	未
转发扩散！密山铁西火道口立交桥，通车了！	未
转发扩散！思茅区旅游环线（佛莲山隧道）路段本周五交通管制！	未
转发扩散！明天密山西火道口立交桥，正式通车了！	未
转发扩散！浙江11岁男孩失踪5天仍未找到！11月30日下午，11岁的乐清男孩小黄在放学回家路上失踪，自此之后，家人警方和志愿者开始了全城搜索，今天上午男孩爸爸已经连发80多条朋友圈，酬金从20万涨到50万然而一些说孩子已经找到的消息开始疯传，还有骗子打电话索要5万元目前各方仍在全力 ...全文	未
转发扩散！紧急寻找家属，阳泉一走失老人......	未
转发扩散！致全市人民的一封信！	未
转发扩散！谁在公交车上丢了3万元昨天16路公交车司机朱师傅从始发站（会西社区站）发车后，开了大概十几分钟（快到盛岸新村站时）就听见有车厢里的乘客在议论，说捡到了一只装有很多钱的袋子。这个蓝色的无纺布手提袋里，除了三万元左右的现金，里面还有一张银行提款单。由于袋内并没有失主信息，随后公交公司也调取了监控视频，然而因为乘客太多看不清人，一时之间也无法找到失主。如果有消息的话，可以在此条微博下留言。（无锡博报）	未
转发扩散转给身边儿的人，明儿别再去现场了！今儿去了的至少排了俩三个小时，就这么在外面冻着，而且排了也是白排，都按线上申请的顺序退	未
转发扩散重庆生活	未
转发抽一人送500元	未
转发抽两位平分1000元红包，后天开	未
转发抽两位平分1000元红包后天开冲鸭	未
转发抽两位平分1000元红包，后天开少爷再不来撑不住了	未
转发抽两位平分1000元红包，后天开[米奇比心]	未
转发抽两位平分1000元红包[米奇比心]后天开	未
转发抽送AI智能音箱吐槽你 在工作中遇到的效率问题，随手关注@WPS官方微博 @九牧Jomoo，让你以后高效办公，12月13日抽取3名粉丝，送出小爱同学mini快来抓住18年最后的好运吧	未
转发抽顽皮狗的艺术相信各位玩家对于顽皮狗工作室一定不会陌生，作为古惑狼杰克与达斯特最后生还者的开发工作室，受到了众多玩家的喜爱如今，将顽皮狗三十年的作品结集成书的顽皮狗的艺术已经在@星之所在科幻书店 开启预售，对这家充满奇思妙想的工作室感兴趣的玩家千万不要 ...全文	未
转发提醒！元旦假期火车票今天开售！	未
转发提醒！元旦假期火车票今天开售！你打算去哪儿跨年	未
转发提醒：安远美食城停车场开始收费了	未
转发提醒！工程车盲区有多大眼前站着80多个小朋友都看不见	未
转发提醒！工程车盲区有多大站80多个小朋友都看不见	未
转发提醒：漳县经常不吃早餐的人看一看吧	未
转发提醒！路过你身边，就能刷走你的钱！已经发生多起！你有没有遇到这种事银行卡明明都还在自己的手上，也没有借过给其他人，莫名奇妙地卡上的钱却不翼而飞。这是怎么回事11月中旬以来，广州南沙区一派出所接连接到群众报案称被人盗刷银行卡资金。据警方介绍，犯罪分子用的手法居然只是简单的靠一靠，钱就到手。现在，很多人都开通了闪付功能，小金额的消费不需要输密码或者签名，pos机感应到芯片卡的这个闪付功能，就会自动消费的了。犯罪团伙就是利用这个便捷支付方式，将一部设置好的pos机，装进一个比较薄的钱包里面，然后就	未
转发 摩托车寻人启事，赶紧点开看看是不是你的！	未
转发支持，需要解决问题，而不是解决发现问题的人！	未
转发，收到一笔意外之财	未
转发收藏！2019年放假安排出来了！五一没有小长假元旦：2018年12月30日至2019年1月1日放假调休，共3天。2018年12月29日（星期六）上班。春节：2月4日至10日放假调休，共7天。2月2日（星期六）2月3日（星期日）上班。清明节：4月5日放假，与周末连休。劳动节：5月1日放假。端午节：6月7日放假，与周末连休。中秋节：9月13日放假，与周末连休。国庆节：10月1日至7日放假调休，共7天。9月29日（星期日）10月12日（星期六）上班。（人民日报）	未
转发收藏！2019年放假安排出来了！五一没有小长假元旦：2018年12月30日至2019年1月1日放假调休，共3天2018年12月29日（星期六）上班春节：2月4日至10日放假调休，共7天2月2日（星期六）2月3日（星期日）上班清明节：4月5日放假，与周末连休劳动节：5月1日放假端午节 ...全文	未
转发收藏！2019年部分节假日安排元旦：2018年12月30日至2019年1月1日放假调休，共3天。2018年12月29日（星期六）上班。春节：2月4日至10日放假调休，共7天。2月2日（星期六）2月3日（星期日）上班。清明节：4月5日放假，与周末连休。劳动节：5月1日放假。端午节：6月7日放假，与周末连休。中秋节：9月13日放假，与周末连休。国庆节：10月1日至7日放假调休，共7天。9月29日（星期日）10月12日（星期六）上班。@中国政府网	未
转发收藏！2019年部分节假日安排元旦：2018年12月30日至2019年1月1日放假调休，共3天2018年12月29日（星期六）上班春节：2月4日至10日放假调休，共7天2月2日（星期六）2月3日（星期日）上班清明节：4月5日放假，与周末连休劳动节：5月1日放假端午节：6月7日放假，与周末连 ...全文	未
转发收藏2019放假安排 假日日历元旦：12月30日1月1日放假共3天12月29日周六上班春节：2月4日至10日放假共7天2月2日周六2月3日周日上班清明：4月5日放假，与周末连休劳动：5月1日放假端午：6月7日放假，与周末连休中秋：9月13日放假，与周末连休国庆：10月1日至7 ...全文	未
转发收藏2019放假安排 假日日历元旦：12月30日至1月1日放假共3天。12月29日周六上班。春节：2月4日至10日放假共7天。2月2日周六2月3日周日上班。清明：4月5日放假，与周末连休。劳动：5月1日放假。端午：6月7日放假，与周末连休。中秋：9月13日放假，与周末连休。国庆：10月1日至7日放假共7天。9月29日周日10月12日周六上班。	未
转发收藏，关键时候能救命！其实很多火灾的发生，都是因为我们不注意生活中的小细节引起的。你对防火知识了解多少戳图学习家庭防火小贴士并转发给你关心的TA，关键时刻能救命！	未
转发救命接力！车牌号陕AN3X05！看见这辆医疗车请让出生命通道！郑州一800克早产儿感染罕见病菌，病情危急，需紧急转入北京治疗。因高铁和救护车转运存在困难无法克服，将由专业医疗转运车将患儿送至北京。今天下午患儿已启程。转送车牌号陕AN3X05，从郑大一附院出发，走陇海快速路，直接上高速去往北京八一儿童医院，时长约8-9个小时。路上看见这辆车请让出生命通道！感谢好心人！	未
转发普及//@平安北京:如果遇到网络威胁，可向所在地公安机关报警，同时也可以向平台举报该用户。	未
转发有点残酷，但还是要转发	未
转发本条微博，并集齐38个赞，大连突发微博每人可以玩儿一天城市V聚力大连爆料..............三天之后我在编辑加上附加条件：给你点赞的人，粉丝必须8000万以上。	未
转发查找线索！//@泰迪Police熊:求转发，有被害人或知情人请积极向湖里派出所提供线索！ //@厦门警方在线:追缉 希望大家积极提供线索！	未
转发此微博的，我今晚抽10个发188现金。	未
转发此条微博着 能不能送博主个蓝朋友	未
转发，求1280北京站门票	未
转发混个眼熟，没准就送你[米奇比心]	未
转发温江这张大雾退散福，未来每天都心明眼亮	未
转发点赞评论者，你最近操心的事情会有好的结果	未
转发“烹狗”视频，公职人员还是别蹚这浑水了	未
转发照片，跪求标题或说明	未
转发猜一下一加6T迈凯伦版的价格，前三名猜对的每人送50元现金，以转发猜的为准	未
转发的同学里抽一个送一百元红包吧，一小时后抽	未
转发看「180斤惊人」视频，你是魔鬼吗那怎么可以少了我震惊哥！！	未
转发科普	未
转发积德，大家经过一定要小心，自开通以来造成事故死亡人数最多的10个长大下坡路段分别为：1云南昆明市境内嵩待线省道77公里加800米至66公里加400米段，自2003年开通以来，11.4公里长下坡累计发生218起道路交通事故，造成279人死亡。2广东韶关市境内G4京港澳高速北行1882公里至1858公里段，自2003年开通以来，24公里长下坡累计发生173起道路交通事故，造成174人死亡。3甘肃天水市境内G310国道天巉公路1515公里至1528公里段，自2001年开通以来，13公里长下坡累计发生	未
转发给两个月后赶春运回家的人。	未
转发继续抽 5 个 199 现金红包	未
转发：网友求帮忙找到这名见义勇为的司机。	未
转发老曹的推	未
转发致敬！2018年刷爆朋友圈的中国军人戍边守防，他们保卫着祖国界碑边境排雷，他们不畏牺牲和伤残即将退伍，但只要祖国需要，他们就时刻准备无论是高山海岛大漠戈壁，还是雪域高原2018，他们一直都在把危险和黑暗挡下，把责任扛在肩上！今天，致敬中国军人！河北退伍军人奋不顾身勇斗歹徒 身中5刀仍拼死救人	未
转发，致敬了不起的战友！醉酒男纵火轻生，民警闯火海：我先上，万一我倒了把我拖出来！	未
转发致敬！珠峰监测者不惧死亡 坚守11年	未
转发致敬缉毒英雄  我对吸毒零容忍缉毒警察，和平年代最具风险的警种之一，每次执行任务都是出生入死目前中国为毒品牺牲的警察已超300名吸毒花的每一分钱，都可能变成打在缉毒警察身上的子弹！一起致敬这些献出生命的缉毒英雄！陈羽凡吸毒被抓值得深思，你能接受涉毒艺人吗	未
转发致敬英雄！周口牺牲消防战士获批烈士！12月6日，河南郸城，一排污渠在清淤时发生坍塌，消防支队班长闫亚隆带队前往救援，救援中现场突然坍塌，造成3名指战员被土方埋压，闫亚隆同志经全力抢救无效，不幸牺牲，年仅22岁。（大河报）	未
转发警示	未
转发警醒	未
转发，让更多人关注！145头领航鲸搁浅死亡 拿什么保护你近日，在新西兰南岛南部边远海岸搁浅的145头领航鲸已全部死亡这是今年以来新西兰海域发现的最大规模鲸群搁浅环保部24号得到报告，但由于事发地点遥远，人力机械难以到达，26号时已有一半领航鲸死亡，剩下的一半生还希望渺茫，因此环保 ...全文	未
转发，让更多人关注！145头领航鲸搁浅死亡 拿什么保护你近日，在新西兰南岛南部边远海岸搁浅的145头领航鲸已全部死亡。这是今年以来新西兰海域发现的最大规模鲸群搁浅。环保部24号得到报告，但由于事发地点遥远，人力机械难以到达，26号时已有一半领航鲸死亡，剩下的一半生还希望渺茫，因此环保部决定对其实施安乐死。新西兰海域几乎每年都会发生较大规模的鲸群搁浅。有专家认为，这一现象可能与恶劣天气有关。转发，让更多人关注！	未
转发评论原微博，抽3人平分777元抵制DG红包	未
转发评论原微博，抽3人平分777元红包嘿嘿	未
转发评论原微博！摸一个老姐妹带走一根YSL小金条嗷	未
转发评论，看看你能认出几个	未
转发诗人携剑看山的评论：故乡今岁种西兰花巨亏而有关部门却以六十岁以上长者无证驾三轮摩托运菜罪罚不啻雪上加霜曾悲卖炭翁，今变故乡农。菜贱人瞋命，车封吏为公。倾家愁不止，罚款计无穷。无妄灾监狱，中唐阙此凶。	未
转发，请你吃糖	未
转发赠书624波 你知道吗，大象其实也分左撇子和右撇子！鳄鱼就算闭上嘴，牙齿也会漏在外面！北极狐在冬天会长出白色的毛，而夏天则会换上棕色毛！你能想象吗，某天你的门牙掉了，你嘴巴里长出了两颗大象的牙齿。又或者，某天你起床站在地上，发现脚变成了袋鼠的。猜猜看，会发生什么这些有趣的想象，都来自《如果你有动物的鼻子》这套书。全套共5册，每本书选取一个主题（鼻子牙齿头发耳朵或脚）来介绍动物的特点。上市以来，这套书创下24小时卖出25000册的奇迹。试读年龄：4，转发并评论本微博，随机抽取5人	未
转发赠书  一个人的味觉里，藏着一辈子遇见的人和经历的事走得再远，惦念的依然是家乡味道小味道：藏在味蕾里的乡愁，在回味每一种食物的经历时，也在咂摸时间的滋味为你打开味蕾，就好像打开记忆那扇门，从容道来的故事里都是心心念念的熟悉味道，那是故乡的滋味转发关注，送3本 ...全文	未
转发赠书 古语有云quot读万卷书行万里路quot，然而很多人一到旅游景点就开启拍照与游玩模式，即使有专人讲解，我们旅行中真正记住的东西并不多。《世界地图：跟爸爸一起去旅行》《中国地图：跟爸爸一起去旅行》根据儿童的性格特征，选取孩子们喜欢的事物和地理趣味点进行创作，从自然地理人文地理美食地理等多方面介绍中国与世界各地。书中手绘精美地图翻翻页设计以及浅显易懂的讲解，不仅让孩子快乐地学地理，还能作为旅行前的地理百科全书！转发并评论本微博，就有机会获得其中一册（北斗童书出品），共五个名额。	未
转发赠书神奇树屋 冷知识实验室为什么有种恐龙被叫做窃蛋龙因为人们是在一窝恐龙蛋化石的旁边发展现了他，人们以为他想要偷走恐龙蛋，所以叫做窃蛋龙，后来才知道人家是在看护自己的宝宝呢。想知道更多的冷知识和有趣的问题，关注@中国作家富豪榜和@神奇树屋中文版 转发并@ 1位好友，我们将抽出5名粉丝随机送《神奇树屋》一本，让你在书中寻找答案！	未
转发超过120，抽10个//@一毛成林: 多抽几个吧，希望有我！//@新财富杂志 :是的，2019整年//@我在深圳爱着你 :新的一年想更加努力提升自己。@对冲基金评级与投资 是2019年整年的电子杂志吗	未
转发转的我头晕眼花	未
转发这个微博，跟我一起马上放架	未
转发这个撒钱的派大星，年底你会有花不完的钱	未
转发这个斯卡曼德兄弟的万咒皆终，2018所有破事都终结在这里。	未
转发这些招财猫，你将会在一个月内收到意外之财	未
转发这份清单给首页[米奇比心]	未
转发这只熊，这个月会有好事发生	未
转发这只竹质锦鲤，二零一八年的最后几天会有好事发生。	未
转发这只露出笑容的梅花鹿，未来几天鹿鹿续续会有好事发生！	未
转发这张图，下周开始会有一件你日思夜想的好事发生，到时候记得来还愿	未
转发这张黄金万两，今后的日子红红火火。	未
转发这条，2019年的你这些好事都能通通实现！	未
转发这条微博，2019年脱单！！	未
转发这条微博，三天内将收到一笔巨款！	未
转发这条微博，你们身上多余的肥肉会转移到这只小猪身上	未
转发这条微博，你会像那只狗一样被人宠爱	未
转发这条微博，十二月剩下的日子会有好事发生 [米奇比心]长春微视点	未
转发这条微博，愿你12月一切如愿[给你小心心]	未
转发这条微博，抽两个人送《毒液》官方周边一套！抽中的人一定也会有汤老师这样的男朋友滴！	未
转发这条微博抽两位女网友打钱，打多打少随缘。 两小时后就开	未
转发这条微博的人最近会有一笔新的进帐	未
转发这条微博的人 这几天都会陆续都会收到钱。	未
转发这条微博，踩死2018年所有让你不开心的人和事。	未
转发这条焦虑你将帮我分担一点谢谢好心人	未
转发这条真锦鲤！农村大妈养锦鲤年入千万河南镇平县向寨村的刘英梅被称为锦鲤大妈，家有几百亩鱼塘年收入上千万大儿子大学毕业后回村跟母亲一起养鱼，是村里唯一做高端锦鲤市场的，高端锦鲤一条能卖到1万元以上。尽管已经脱贫致富，刘英梅依然每天4点起床喂鱼打包发货，致富不能指望转发锦鲤，还要靠双手勤劳奋斗。大妈目前最大的心愿是，给在哈工大读研的小儿子找对象，彩礼不是问题，我们家有几万条锦鲤呢。中国人的一天 中国人的一天  真锦鲤！河南大妈养锦鲤不靠转发 年入千万	未
转发这条视频祝他早日康复！网友：其实他们也是普通人，也会受伤，只不过是穿了这身衣服，他们只有勇往直前。希望所有的你们都可以平安回家。	未
转发这条锦鲤，12月将收到一笔巨款。	未
转发这条锦鲤大王，本月必有大好事发生	未
转发这条锦鲤，年末会有好事发生	未
转发！进隧道不开灯罚200元 明起上海启用机动车隧道内不开灯电子警察开始抓拍由于隧道出入口光线的变化，在隧道口容易产生黑洞或白洞效应因此隧道也是交通事故的高发路段12月15日起，将在长江隧道正式启用查处机动车隧道内不开灯的电子警察设备，公安交警部门将对违反隧道 ...全文	未
转发！进隧道不开灯罚200元 明起上海启用机动车隧道内不开灯电子警察开始抓拍由于隧道出入口光线的变化，在隧道口容易产生黑洞或白洞效应。因此隧道也是交通事故的高发路段。12月15日起，将在长江隧道正式启用查处机动车隧道内不开灯的电子警察设备，公安交警部门将对违反隧道开灯警告标志指示的车辆进行进行处罚。进隧道不开灯罚200元！明起上海启用机动车隧道内不开灯电子警察...	未
