软银电信部门正式在日本上市 开盘跌6.4%	未
软银聘请首位女合伙人帮助管理愿景基金 曾FB任职8年软银集团已任命Facebook前高管科西嘉雷迪为软银投资顾问公司合伙人，帮助管理1000亿美元的愿景基金。雷迪是其中的唯一一名女性管理者。她曾在Facebook印度和美国工作8年，并担任斯坦福商学院管理委员会主席。软银聘请首位女合伙人帮助管理愿景基金 曾FB任职8年	未
软银计划明年抛售英伟达股份	未
软银集团将旗下电信子公司首次公开发行的指导价设在1500日元	未
软饭吃的理直气壮	未
轰一声巨响，普京做出一响彻全球的决定，世界各国最致命打击来了	未
轰一声！扬州一人家门窗被炸飞！	未
轰动全国：桂林开车撞警察的文明哥审判了！整整十七年！	未
轰动全国的恐怖抛尸案，扑克牌女尸惨死真相！	未
轰动全城！！！再过1天，垫江这个地方要被挤爆了，人山人海	未
轰动全城新乐宾馆的大门都被挤爆了！发生了什么......	未
轰动全城！明天就明天，云阳这个地方要被挤爆了，因为	未
轰动全城！明天就明天，眉山这个地方要被挤爆了，因为	未
轰动全城，最后三天，合川这个地方要被挤爆了，人山人海	未
轰动全城！近日，桂平这里被挤爆了！因为....	未
轰动全球的基因编辑到底是什么回事看这个秒懂！	未
轰动！大余将出现新型停车付费方式！刷卡取票现金全弱爆了！	未
轰动！大连将出现新型停车付费方式！刷卡取票现金全弱爆了！	未
轰动广西的桂林撞车案终于判了！故意杀人罪，17年	未
轰动！德化汇都购物广场有大事，快看看	未
轰动！玉林将出现新型停车付费方式！刷卡取票现金全弱爆了！	未
轰炸机“擦头皮”降落 女记者淡定报道	未
轰炸机部署到委内瑞拉，5000公里核导弹覆盖全美？美：起飞就击落	未
轰隆一声！广西一民房发生爆炸，瞬间腾起蘑菇云	未
轰鸣声	未
轱辘不好用了吗不怕，五年保修的，去换一个就OK了，但话说目前北京的rimowa售后在哪啊听说换地方了	未
轴承安装错误示例，提前了解少走弯路！	未
轵城一工地惊现美猴王，还给了哮天犬一耳光	未
轻井泽，一个让人恍惚走进了欧洲小镇的地方	未
轻刑快诉，不超10日 港闸首例速裁程序刑案提起公诉	未
轻度污染影响上海，预计持续两三天！又是“锅盖”惹的祸？	未
轻度脂肪肝，饮食注意七点	未
轻生女站上8楼窗台，消防索降营救	未
轻货变半挂 超长货车被查获	未
轻轻扶一把就拯救一个家庭，这个世界是暖的	未
轻轻的我走了正如我轻轻的来我轻轻地招手作别西天的云彩波光里的艳影在我心头荡漾寻梦撑一支长篙向青草更青处漫溯旅行灵感季 @微博旅游 墨西哥	未
轻轻的，《极品基佬伴》完结了，带走一车毒舌	未
轻钢住宅：从“样板”到“我家”有多远？	未
载50名师生客车高速上侧翻 4人受伤司机被控制	未
载中国游客大巴在泰国清莱侧翻 乘客轻伤无大碍	未
载中国游客小巴在澳遇车祸 3死多伤！事发地为澳“最危险”高速	未
载中国游客小巴澳洲遇恐怖车祸 已致3死多伤	未
载中国游客小巴澳洲遇恐怖车祸 已致3死多伤On Dec. 9， a horrific car accident occurred on a busy highway in Western Australia. A small bus carrying Chinese tourists collided with a car， causing three deaths and sending many others to the hospital with injuries. The accident	未
载中国游客小巴澳洲遇恐怖车祸 已致3死多伤据外媒报道，当地时间9日，澳大利亚西部一条繁忙的高速公路上发生一起恐怖车祸。一辆载有中国游客的小型巴士和一辆汽车正面相撞，此起车祸已经导致3人死亡，多人被送往医院接受治疗。据悉，车祸发生的地点是澳大利亚西部珀斯以北约127公里的一条高速公路上。有数十名消防员护理人员和警察感到现场花了几个小时解救这些被困人员。相撞的2辆车中共载有约12人。（海外网）载中国游客小巴澳洲遇恐怖车祸 已致3死多伤(图)	未
载中国游客小巴澳洲遇恐怖车祸 已致3死多伤据外媒报道，当地时间9日，澳大利亚西部一条繁忙的高速公路上发生一起恐怖车祸一辆载有中国游客的小型巴士和一辆汽车正面相撞，此起车祸已经导致3人死亡，多人被送往医院接受治疗据悉，这起恐怖的车祸发生的地点是澳大利亚西部珀斯以北约127公里的一 ...全文	未
载中国游客小巴澳洲遇恐怖车祸 已致3死多伤据外媒报道，当地时间9日，澳大利亚西部一条繁忙的高速公路上发生一起恐怖车祸。一辆载有中国游客的小型巴士和一辆汽车正面相撞，此起车祸已经导致3人死亡，多人被送往医院接受治疗。据悉，这起恐怖的车祸发生的地点是澳大利亚西部珀斯以北约127公里的一条高速公路上。有数十名消防员护理人员和警察感到现场花了几个小时解救这些被困人员。相撞的2辆车中共载有约12人。	未
载中国游客小巴澳洲遇恐怖车祸 已致3死多伤据外媒报道，当地时间9日，澳大利亚西部一条繁忙的高速公路上发生一起恐怖车祸。一辆载有中国游客的小型巴士和一辆汽车正面相撞，此起车祸已经导致3人死亡，多人被送往医院接受治疗。据悉，这起恐怖的车祸发生的地点是澳大利亚西部珀斯以北约127公里的一条高速公路上。有数十名消防员护理人员和警察感到现场花了几个小时解救这些被困人员。相撞的2辆车中共载有约12人。（图片来源：@海外网 ）载中国游客小巴澳洲遇车祸 载中国游客小巴澳洲遇恐怖车祸 已致3死多伤	未
载中国游客小巴澳洲遇恐怖车祸已致3死多伤据外媒报道，当地时间9日，澳大利亚西部一条繁忙的高速公路上发生一起恐怖车祸。一辆载有中国游客的小型巴士和一辆汽车正面相撞，此起车祸已经导致3人死亡，多人被送往医院接受治疗。据悉，这起恐怖的车祸发生的地点是澳大利亚西部珀斯以北约127公里的一条高速公路上。有数十名消防员护理人员和警察感到现场花了几个小时解救这些被困人员。相撞的2辆车中共载有约12人。（海外网）载中国游客小巴澳洲遇恐怖车祸 已致3死多伤(图)	未
载中国游客小巴澳洲遇恐怖车祸 已致3死多伤据外媒报道，当地时间9日，澳大利亚西部一条繁忙的高速公路上发生一起恐怖车祸。一辆载有中国游客的小型巴士和一辆汽车正面相撞，此起车祸已经导致3人死亡，多人被送往医院接受治疗。据悉，这起恐怖的车祸发生的地点是澳大利亚西部珀斯以北约127公里的一条高速公路上。有数十名消防员护理人员和警察感到现场花了几个小时解救这些被困人员。相撞的2辆车中共载有约12人。载中国游客小巴澳洲遇恐怖车祸 已致3死多伤(图)	未
载中国游客小巴澳洲遇惨烈车祸 已致3死多伤	未
载中国游客小巴澳洲遇惨烈车祸 已致3死多伤据外媒报道，当地时间9日，澳大利亚西部一条高速公路上发生一起恐怖车祸。一辆载有中国游客的小型巴士和一辆汽车正面相撞，已经导致3人死亡，多人被送往医院接受治疗。有数十名消防员护理人员和警察感到现场花了几个小时解救这些被困人员。相撞的2辆车中共载有约12人。（海外网）	未
载中国游客小巴澳洲遇车祸 已致3人死亡，多人送院治疗外媒报道，澳大利亚当地时间9日，一辆载有中国游客的小型巴士和一辆汽车正面相撞，2辆车中共载有约12人此起车祸已经导致3人死亡，多人被送往医院接受治疗据悉，这起恐怖的车祸发生的地点是澳大利亚西部珀斯以北约127公里的一条高速公路上 ...全文	未
载中国游客小巴澳洲遇车祸 已致3人死亡，多人送院治疗外媒报道，澳大利亚当地时间9日，一辆载有中国游客的小型巴士和一辆汽车正面相撞，2辆车中共载有约12人。此起车祸已经导致3人死亡，多人被送往医院接受治疗。据悉，这起恐怖的车祸发生的地点是澳大利亚西部珀斯以北约127公里的一条高速公路上。有数十名消防员护理人员和警察赶到现场花了几个小时解救这些被困人员。via.@人民日报海外版-海外网 载中国游客小巴澳洲遇恐怖车祸 已致3死多伤(图)	未
载中国游客小巴澳洲遇车祸 已致3死多伤据外媒报道，当地时间9日，澳大利亚西部一条繁忙的高速公路上发生一起恐怖车祸。一辆载有中国游客的小型巴士和一辆汽车正面相撞，此起车祸已经导致3人死亡，多人被送往医院接受治疗。据悉，这起恐怖的车祸发生的地点是澳大利亚西部珀斯以北约127公里的一条高速公路上。有数十名消防员护理人员和警察感到现场花了几个小时解救这些被困人员。相撞的2辆车中共载有约12人。@人民日报海外版-海外网	未
载中国游客小巴澳洲遇车祸 已致3死多伤据外媒报道，当地时间9日，澳大利亚西部珀斯以北约127公里的一条高速公路上发生一起车祸，一辆载有中国游客的小型巴士和一辆汽车正面相撞，车祸已导致3人死亡，多人被送往医院接受治疗（海外网）	未
载中国游客小巴澳洲遇车祸当地时间9日，澳大利亚西部一条繁忙的高速公路上发生一起恐怖车祸。一辆载有中国游客的小型巴士和一辆汽车正面相撞，此起车祸已经导致3人死亡，多人被送往医院接受治疗。据悉，这起恐怖的车祸发生的地点是澳大利亚西部珀斯以北约127公里的一条高速公路上。有数十名消防员护理人员和警察感到现场花了几个小时解救这些被困人员。相撞的2辆车中共载有约12人。	未
载人登月登了个登  毛子登完三哥登	未
载有50人大巴苏通大桥上翻车12月2日下午，一辆载有50人的大巴车，由南向北经过苏通大桥桥面时突然发生侧翻，所幸的是，事发后大巴车横卧在桥面上，车上乘坐人员仅有4人受轻伤。事故导致苏通大桥由南向北中断3小时，造成车辆严重积压。（图为据网友在事发后拍摄的截屏图片）载有50人大巴苏通大桥上翻车查看图片	未
载有50人大巴苏通大桥上翻车 4人受轻伤	未
载有俄罗斯、美国和加拿大宇航员的俄罗斯飞船发射升空	未
轿车与厢货车相撞 冲击集市行人致2死5伤 12月9日9时许，河北石家庄裕华区发生一起轿车与厢货车相撞冲击行人事故，造成2死5伤，现场一片狼藉。据石家庄市交管局，肇事司机已被控制，目前，事故原因在进一步调查中。 @河北长安网	未
轿车与电动三轮车相撞 消防车紧急"变身"急救车	未
轿车冲下北三环未竣工高架桥，女司机被困车内救出时已无生命体征28日夜，一辆白色轿车从北三环高架桥东四环10多米高的桥面上坠落，驾车女子被救出时已失去生命体征目前警方正在对该起事故进行调查处理郑州轿车冲下未竣工高架桥 女司机救出时已无生命体征	未
轿车冲入水渠 多名教师齐施救	未
轿车冲进饭店抢C位！这波操作竟是因为	未
轿车刹车失灵冲进水仙小学 撞毁围栏幸未伤人	未
轿车在日照一加油站内突然起火！监控记录惊心90秒！	未
轿车坠河司机被困 两外卖小哥跳入冰冷河水中救人	未
轿车坠河女司机被困 外卖小哥跳入冰冷河水救人	未
轿车撞倒多名学生建昌二小门前 市民自发点3600支蜡烛悼念遇害学生11月23日，东北小城辽宁建昌迎来入冬来的第一场雪。一天前，一场悲剧打破了这个小城的平静只因夫妻矛盾和个人性格，一男子驾驶奥迪轿车冲撞人群。据官方通报，截至目前已造成5名未成年人死亡19人受伤，其中重伤3人。23日晚，当地市民自发摆起3600支蜡烛，悼念逝者。烛光在纷飞的雪花中摇曳，孩子们一路走好 建昌二小门前 市民自发点燃3600支蜡烛悼念遇害者	未
轿车撞倒多名小学生 最新消息：5人遇难，均为学前班学生今天中午，辽宁葫芦岛市建昌县第二小学校门前，发生严重车祸，已致5人遇难19人受伤5名遇难者均为未成年人(学前班学生)，伤者中有2名老师，1名路人，其他为未成年人肇事嫌疑人已被抓获，事故原因正在调查(央视)	未
轿车撞隔离墩空中翻转360度坠地 司机仅受皮外伤	未
轿车斜插长栏杆 宿迁高速路上“兜风”被抓现形	未
轿车无人驾驶 冲进地下车库（视频）	未
轿车狂摁喇叭！给前边的外卖小哥整懵圈了！	未
轿车瞬间爆炸，男子趴地上嗷嗷叫！	未
轿车突发自燃，3位公交司机拎着灭火器跑来(图)	未
轿车被大货车压扁，人一点事没有，命太大了！	未
轿车路口撞击妇女后者不幸身亡	未
轿车车窗被砸破，车内满是所有人看完怒了！	未
轿车追尾后自燃 交警果断砸窗救出昏迷司机(图)	未
轿车高速撞击护栏后 妻儿当即被甩出车外 丈夫一句话道出原因	未
较强冷空气南下 辽宁今日降雪又降温	未
较强冷空气将影响北方大部地区 局地降温15℃以上	未
较强冷空气将自西向东席卷我国，雾、霾天气3日起逐渐消解	未
较强冷空气继续影响我国 南方地区多阴雨	未
较强冷空气继续影响我国 南方多阴雨	未
“较真怂人”花总：下次不会站出来了 我承受不起	未
辅助不奶你的原因守望先锋	未
辅助边框修眉法适用于新手手残党！	未
辅导女儿做作业的第二十分钟，默默下楼开了瓶啤酒	未
辅导班营销术：拿“别人家的孩子”、以培养习惯为名放大焦虑	未
辅警上班路上追小偷 追回96岁大爷的7000元治病钱近日，四川一阿婆在小区看见一陌生男子，在与其简单对话后，回到家中准备带96岁的老伴前往医院治病时，却发现装有7000元现金的包不见了随即，她想起那名陌生男子不对，立即回头追上去正在上班路上的辅警郭小东看见这一幕，立即下车一路狂追，最 ...全文	未
辅警下班途中遇车祸，第一时间冲上前...	未
辅警向货车司机收受钱物37段视频曝光	未
辅警喷射辣椒水事件：头痛医头脚痛医脚，庸医也	未
辅警招聘关于贵港市公安局第二批招聘辅警留置对象看护岗位增加招聘名额的公告	未
辅警招聘贵港市公安局交警支队2018年度公开招聘警务辅助人员最新报名情况出炉	未
辅警捡了7000元 风雪中站一小时等来失主	未
辅警收钱视频曝光！处理结果	未
辅警沈银亮被追授“南通青年五四奖章”	未
辅警生日当天受了伤，女友亲手制作了一份礼物送给他...	未
辅警转警察名单正式公布！	未
辅警这个举动，让7岁小男生在作文里写“gan动极了！”	未
辅警队长充当“保护伞” 在多家娱乐场所兼职保安	未
辅警队长兼职多家娱乐场所保安，通风报信当“保护伞”	未
辉山乳业的“重生”与债权人的博弈	未
辉山乳业重整时：第三方财富机构的“刚兑漩涡”	未
辉山乳业重整计划方案浮出水面 先清偿职工债权、小额敏感类普通债权	未
辉瑞与AbbVie达成和解，推迟Humira类似药美国上市时间	未
辉瑞和葛兰素史克将联手打造非处方药巨头- 辉瑞公司和葛兰素史克计划将二者旗下的消费者保健业务合并，由此组建的合资公司最终将被分拆出去，成为Advil退烧药和Sensodyne牙膏等药店必需品的全球第一大卖家。葛兰素史克称预计交易将于2019年下半年完成，合资企业将在三年内被拆分出去，在英国上市。 ...全文	未
辐射76BUG太多 玩家们将其制作成明信片留念辐射76自发售以来不断出现各种大大小小的BUG，不过乐观的玩家们也能从让人烦恼的BUG中找到乐趣，Reddit的一位玩家PaulrusKeaton利用游戏中的照片模式将BUG制作成了一张张有意思的明信片，随后许多玩家也加入了进来，制作了许多明信片纪念他们 ...全文	未
《辐射76》明年推出无PVP限制模式：玩家或可大乱斗《辐射76》自发售以来，B社一直在忙于修复各种Bug，但他们也有在制作新的游戏内容详情点击：《辐射76》明年推出无PVP限制模式：玩家或可大乱斗	未
辐射我州四个县 中缅油气楚攀天然气管道工程今天正式通气	未
辐射楚雄州大姚等四个县 ：中缅油气楚攀天然气管道工程正式通气	未
输了，两连败，全队除了球哥，三分铁成狗。防也防不住，被对面的拉塞尔加丁伟迪和哈里斯打爆，最后拉塞尔还来一个致命三分。唉，这场真的很迷	未
输了，你总结下这场比赛吧。	未
输了，谈谈你对这场比赛的看法吧。	未
输入607618353 领巨款 拿去花，钱很多	未
输入口令就能领钱，刷屏的支付宝红包是什么套路	未
输入姓名，测出你最缺少的东西是什么...再见了朋友们网页链接	未
输入我真的怕，看看手机会自动联想出什么	未
输入我真的怕看看手机会自动联想出什么[並不簡單]	未
输入法打CLS	未
输入法打出我明天会，出来的将会是你明天的状态	未
输入身份证号 即可查询你的棉田交售信息	未
输出医闹了	未
输出我很，看看后面会出现什么	未
输在起跑线的民营医院，也许是败在了医院名字上	未
输掉第11场比赛，火箭比上赛季快了一个多月	未
输液速度控制，护士一定要知道！	未
输球又输人！网曝八一男排体罚国手：八一男排主教练赛后用球猛砸队员，曾当众扇其耳光，你怎么看职业体育体罚行为	未
输电线路改造惠民生12月11日，@国网沂源县供电公司 员工和外围施工队员冒着严寒，在悦庄镇35千伏悦良线16号杆进行输电线路改造工作，此工程的完成将大大提高整个悦庄镇约十万客户的用电质量。	未
输给拜仁后，韦尔纳表示既然在德甲已经为莱比锡红牛效力，将来如果转会还要留在德国，就只有一支球队可以考虑。目前韦尔纳还没有在新合同上签字，他目前的合同还有一年半到期。	未
输血变造血脱贫攻坚路上的返乡创业者们（来自@共青团中央 的一直播）APP下载地址：网页链接	未
“输血”更要“造血”：民营企业发展不能一昧依赖银行	未
辖区收费站解除管制	未
辗转万里 挖出虚开团伙主谋509虚开增值税发票案侦破纪实	未
辛亏方向盘抓的紧，不然就甩出去了	未
辛口镇净化校园及周边食品安全环境西青在行动连日来，该镇食药监管办联合食品安全协管员对各中小学托幼机构等校园周边的食品店餐饮单位小卖铺等开展了专项监督检查，并与食品经营负责人签订《西青区校园及周边食品经营者承诺书》。此举一方面规范了食品经营户依法依规经营，进一步保证了校园周边经营单位的食品安全另一方面切实保障了广大师生生命健康安全，更加深入地推动创城工作顺利进行。	未
辛口镇召开落实一制三化会议西青在行动会议强调各科室所有业务要下沉到窗口办理，要践行服务承诺，实行首办负责，规范文明用语，全面推行微笑服务，高效办事，做到让企业群众办事只进一扇门最多跑一次，为企业和办事群众提供贴心暖心放心的优质服务。	未
辛口镇开展安全防范集中宣传西青在行动日前，该镇综治办工作人员协同镇扫黑办成员派出所民警禁毒专职人员来到第六埠村集市上开展安全防范集中宣传活动。内容围绕扫黑除恶专项斗争工作禁毒反邪教铁路护路反间防谍等，群众反响热烈，参与度高。	未
辛口镇开展村级权力清单解读培训西青在行动日前，该镇党委研究制定了《辛口镇村级权力清单范本》并对内容进行解读培训：一是明确村级重大事项适用六步决策法的相关规定二是对该镇村级权力清单职责分工情况进行说明三是针对六步决策法的程序为各村制定相关模板，并对模板的使用进行详细讲解。	未
辛口镇开展诚信宣传教育活动西青在行动连日来，该镇社会事务服务中心运用多种形式开展诚信宣传教育活动。一是公开诚信为民承诺书二是举行了服务承诺书签名活动三是结合实际工作，制定了诚信建设红黑榜，在服务大厅全面公开。	未
辛口镇开展调味品排查专项行动西青在行动为严防假冒伪劣调味品流入，该镇积极组织38名食品安全协管员开展调味品大排查大抽检大整治专项行动。此次排查面向大型商超农贸市场等食品销售集散地，小超市小食杂店小餐馆等零散经销场所和使用单位，重点关注村居闲置厂房私房出租屋农用大棚棚中房屋等易隐蔽生产加工调味品的黑作坊黑窝点。目前，相关专项排查工作仍在进行中。	未
辛口镇开展食品安全专项检查西青在行动近日，该镇食药监管办联合市场监管所组织开展了食品安全专项检查，对镇域内77家餐饮场所超市的食品进货渠道食品存放食品保质期等情况进行了认真查询，对各食品经营单位的经营许可证食品流通许可证从业人员健康证店内环境卫生加工制作清洗消毒等相关情况进行了逐一检查。	未
辛口镇积极落实门前三包西青在行动该镇综合执法大队组织开展了与辖区内经营户门前三包责任书的签订工作，尤其针对步行街集贸市场背街里巷乱涂乱画店外经营门前堆物等现象，以此调动各商家积极参与环境卫生管理的主动性和积极性，增强环境保护意识。	未
辛巴ks大号疑被盗，600万后台余额危险！吴迪大号解封携团队出游，与众粉丝合影喊口号！	未
辛弃疾文化公园的凉亭照片曝光，引网友热议！	未
辛德勇《发现燕然山铭》编辑出版始末	未
辛德勒的名单。婉氨「一只获得拯救正准备放生的黑腹穿山甲。穿山甲是全球走私规模最大的哺乳动物。它的鳞甲用于中药贸易却和人的指甲是同一种材料既不能治病也无法壮阳。」	未
辛德勒那个看这里 查看图片	未
辛春生督查非洲猪瘟防控工作 看望哨卡值守工作人员	未
辛杜首局的心理活动大概是14-6看到希望了16-16靠，这也能追平，老娘快绝望了20-17松一口气，又有希望了20-19我靠，又要追平，逼着我绝望啊21-19可吓死本收银员了羽毛球年终总决赛	未
辛苦！	未
辛苦一年 农民朋友有啥新收获？算算一年增收账	未
辛苦了大半辈子房子建好了就退休养老了	未
辛苦了//@少女时代吧视频组: 查看话题详情查看话题详情 辛苦了	未
辛苦了//@少女时代吧视频组: 查看话题详情查看话题详情 辛苦啦	未
辛苦了//@潮州供电: 供电蜀黍没有四季//@广东电网: 请体谅一下无论春夏秋冬都得穿长袖的供电蜀黍好吗	未
辛苦写的游记没几个人看到来8264帮你宣传	未
辛苦劳作，最终可能一场空听说欧联也可能有12分出不了线的	未
辛苦却又坚持着丨在西安，这10种职业最心酸......	未
辛苦啦//@M鹿M:@Lstars电子竞技俱乐部的兄弟们辛苦了，澳门决赛圈等你们	未
辛苦小丁了	未
辛苦我啦 微博视频	未
辛苦整理。	未
辛苦，注意安全	未
辛苦消防小哥	未
「 辛苦的80后，奔四的80后 」	未
辛苦辛苦 微博视频	未
辛苦这么多年，我在孩子眼中只是个多余的中年妇女！	未
辛辛苦苦换来致命一击 用多年的汗水，换来十几秒的画面红人的诞生 V影响力峰会微博视频	未
辛集15个乡镇大比拼！结果是	未
辛集一处废旧的锅炉厂被拆除！占地3000平，将被用来建造这个项目！辛集那些事	未
辛集一级甲等综合性医院最新信息！附辛集医保定点医院名单！辛集那些事	未
辛集一街便民市场建成后是这个样子的	未
辛集事业单位招聘宋若雷等5名拟聘用名单公示	未
辛集交警今天上午文化宫广场发生了什么事儿辛集那些事	未
辛集公务员门诊医疗补助须知	未
辛集公布农村清洁取暖热线电话！	未
辛集公布拖欠农民工工资举报电话！重点打击这些情况！辛集那些事	未
辛集办理排水许可证详解	未
辛集又增一条高铁线路！辛集那些事	未
辛集城管将新建公益广告（925000.00元）	未
辛集家长注意！这家幼儿园被通报，快看看你家小孩是在这上学嘛！辛集那些事	未
《辛集市养犬管理办法》2月1日起施行	未
辛集市最新扶贫政策！涉及医疗教育就业......低保等辛集那些事	未
辛集市百企帮百村一览表	未
辛集市红贝贝幼儿园全市通报批评	未
辛集康达家园门口惊险一幕！千万注意安全！辛集那些事	未
辛集新狗市来了！	未
辛集最新停电通知（11月30日-12月4日）	未
