回复@阿琛桑:里昂不好踢啊。//@阿琛桑:回复@尤文菲戈:哈哈是吧，巴萨晋级最轻松估计，里昂才是最弱的对手	未
国家公祭日 今天是第五个南京大屠杀死难者国家公祭日。侵华日军南京大屠杀遇难同胞纪念馆的集会广场上，庄严而肃穆。清晨7时，这里即将举行升国旗和降半旗仪式。七点，迎着初冬的晨曦，伴随着雄壮的国歌声，国旗缓缓升起到旗杆的顶端，随后，又徐徐下降三分之一，为死难同胞降半旗致哀。这是中国第五次以国之名义，祭悼南京大屠杀死难者。（本台记者 张倩）	未
国家公祭日。今天，此刻，转发，让更多人了解真相！勿忘历史！	未
国家公祭日 今年64岁的南京城市治理志愿者李冠军，是第四次参加南京大屠杀死难者国家公祭日城市志愿服务。在他60岁退休那年，他就决定以后每年都参加南京大屠杀死难者国家公祭日的相关志愿服务。李冠军说，等老伴退休，也会带动家人参与公祭仪式，牢记国耻，缅怀逝者，珍爱和平。（本台记者 徐仁飞）	未
国家公祭日以国之名，向30万遇难同胞致哀，铭记历史，为了和平与正义长存！	未
国家公祭日以国之名，用音乐缅怀逝者，铭记历史，守护和平。南京大屠杀国家公祭日	未
国家公祭日仪式倒计时2天，我们祭奠遇难同胞，是为了不能忘却的历史，也是为守护现世和平12月13日国家公祭当天，@侵华日军南京大屠杀遇难同胞纪念馆馆长张建军将做客新浪江苏独家微访谈，与网友一起回望历史，守望和平。提问入口正式开启时间：12月13日15:00	未
国家公祭日 前事之不忘，后事之师。愿逝者安息，我们一起来守护这来之不易的和平！	未
国家公祭日 勿忘...	未
国家公祭日勿忘	未
国家公祭日 勿忘历史，守望和平！	未
国家公祭日勿忘历史，守望和平！不忘初心，奋力拼搏	未
国家公祭日 勿忘国殇，吾辈自强。愿逝者安息，和平永存。	未
国家公祭日 勿忘国耻！	未
国家公祭日勿忘国耻	未
国家公祭日 勿忘国耻，吾辈当自强	未
国家公祭日勿忘国耻，吾辈当自强，以国之名，向30万遇难同胞致哀。	未
国家公祭日 勿忘国耻，吾辈自强。	未
国家公祭日勿忘国耻，吾辈自强！	未
国家公祭日 勿忘国耻！吾辈自强！公祭日	未
国家公祭日 勿忘国耻，吾辈自强。愿逝者安息	未
国家公祭日勿忘国耻，吾辈自强，铭记历史，珍爱和平。//@M鹿M:逝者安息，和平永存国家公祭日	未
国家公祭日 勿忘国耻，珍爱和平	未
国家公祭日 勿忘国耻，珍爱和平！今天，我们在建邺祭奠死难同胞今天是第五次国家公祭，我们以国家的名义，祭奠30万死难同胞。今天，位于建邺区的侵华日军南京大屠杀遇难同胞上新河丛葬地同步举行悼念活动。此外，南苑街道吉庆社区也举行了南京大屠杀死难者国家公祭日活动。停驶鸣笛致哀，这一刻，我们在建邺默哀	未
国家公祭日勿忘国耻，珍爱和平！缅怀所有遇难同胞	未
国家公祭日勿忘国耻，铭记于心	未
国家公祭日 勿忘国耻，铭记历史，守护记忆，守望和平//@杨幂:国家公祭日守护国家记忆，守望和平	未
国家公祭日 勿忘国耻 铭记在心	未
国家公祭日 勿忘国耻，默哀。	未
国家公祭日勿忘，愿和平！	未
国家公祭日 南京，向世界传递和平	未
国家公祭日 向30万遇难同胞致哀。以史为鉴，守护和平。	未
国家公祭日 吾辈自强 勿忘国殇！	未
国家公祭日 和平永存！//@李宇春疯狂工作室:国家公祭日铭记历史，珍爱和平！	未
“国家公祭日和平许愿墙”现身南京地铁	未
国家公祭日“和平许愿墙”现身地铁站 妈妈教女儿铭记历史祈愿和平	未
“国家公祭日和平许愿墙”现身地铁站点 众市民书写祈福和平	未
国家公祭日国家公祭11:30左右，参加和平徒步的第一方阵完成了8公里的行程，到达终点-南师大随园草坪。大屠杀幸存者夏淑琴为大家颁发了和平奖牌。夏淑琴老人说看见这么多年轻人，很开心。	未
国家公祭日国家公祭300位中外人士重走南京安全区一起为和平徒步gtgt网页链接81年前，20多位外籍人士冒着生命危险留在南京建立南京安全区国际委员会，庇护25万多中国难民。今天上午，@侵华日军南京大屠杀遇难同胞纪念馆 联合新浪江苏举办了第三届南京安全区和平徒步活动，包括南京大屠杀幸存者国际友人后人留学生市民在内的300多名爱好和平人士从南师大大草坪出发，怀着感恩的心，重走当年的路。	未
国家公祭日国家公祭九点五十三分，参加重走安全区徒步的嘉宾到达了位于小粉桥1号的拉贝故居并进行了打卡和参观。致敬拉贝！	未
国家公祭日国家公祭今天写下和平寄语，明早8点50 ，荔枝直播南京安全区和平徒步活动。没能抢报现场名额的小伙伴，请点网页链接，参与新浪线上徒步或观看荔直播！	未
“国家公祭日”在即，江东门纪念馆气氛庄重	未
国家公祭日 坚守岗位 缅怀历史12月13日上午，南京供电公司变电运维人员在国家公祭日各保电站点进行值守巡视，利用机器人等先进装备强化巡视保电质量。警报拉响时，全体工作人员脱帽默哀，祭奠遇难同胞，深刻铭记历史。	未
国家公祭日 守护与铭记历史，让和平与正义长存	未
国家公祭日守护国家记忆，坚决捍卫和平 设立国家公祭日，就是要在我们心中竖起一面历史的回音壁，就是要抹去历史的灰尘擦清历史的镜子，汲取战争的惨痛教训构筑民族的共同记忆如此，捍卫和平才能更有动力，国殇民难才能不再重演（高海滨） 国家公祭日守护国家记忆，坚决捍卫和平	未
国家公祭日守护国家记忆，守望和平，吾辈当自强！	未
国家公祭日守護國家記憶，守望今世和平。	未
国家公祭日 快手网红纷纷禁娱一天，祁天道张二嫂高迪浩南驴家阿宇，唯独浩南禁娱三天！12月13日铭记历史，勿忘国耻	未
国家公祭日悼念30万遇难同胞今天是绝对不能被遗忘的日子，铭记历史，珍爱和平//@黄晓明:国家公祭日 勿忘殇痛，珍惜当下，砥砺前行！	未
国家公祭日 悼念30万遇难同胞，吾辈当自强！//@侯明昊Neo:国家公祭日 铭记历史，守望和平！	未
国家公祭日悼念30万遇难同胞守护国家记忆，守望今世和平。	未
国家公祭日悼念逝者，牢记历史， 守望和平。	未
国家公祭日 愿亡魂安息，和平永存。	未
国家公祭日 愿逝者安息，和平永存！//@井柏然:国家公祭日 缅怀.铭记.愿和平长存.	未
国家公祭日此刻，南京大屠杀死难者国家公祭仪式正在直播。我们以国之名祭奠81年前的遇难同胞！铭记历史寄托哀思守望和平！新华视点的微博直播	未
国家公祭日 毋忘國恥，振興中華	未
国家公祭日每一个生命，都值得被铭记	未
国家公祭日 牌牌琦转发并点赞人民日报共同祭奠死难同胞的博文，并留言愿逝者安息 和平永存勿忘国耻铭记历史吾辈当自强。	未
国家公祭日 牢记使命，护航公祭	未
国家公祭日牢记历史，珍惜和平//@王俊凯KarryWang工作室:国家公祭日历史永不忘记，铭记于心，奋勇图强！//@TFBOYS-王俊凯:今天是第五个国家公祭日，勿忘国耻，吾辈图强！//@TFBOYS组合:国家公祭日 铭记历史，珍爱和平	未
国家公祭日牢记历史，自强不息，保卫祖国，珍爱和平！	未
国家公祭日牢记国家历史，守护和平永存！	未
国家公祭日珍爱和平 愿逝者安息	未
国家公祭日 祭奠同胞，勿忘国耻	未
国家公祭日：第71集团军驻淮某旅开展祭奠纪念活动|荔枝军事	未
国家公祭日第五个国家公祭日，勿忘国殇，砥砺前行。	未
国家公祭日 纪念南京大屠杀81周年历史不会被忘记（图集）	未
国家公祭日 让我们一起守望和平	未
国家公祭日，这个展告诉人们上海抗战英烈的故事	未
国家公祭日 逝者安息，吾辈自强，铭记历史，守望和平	未
国家公祭日 逝者安息，和平永存。吾辈自强，砥砺前行。//@王子异:国家公祭日 铭记历史，珍爱和平，吾辈自强，砥砺前行。	未
国家公祭日 铭记历史，不忘苦难，守望和平！	未
国家公祭日铭记历史，奋勇前行//@TFBOYS-王俊凯:今天是第五个国家公祭日，勿忘国耻，吾辈图强！//@TFBOYS组合:国家公祭日 铭记历史，珍爱和平	未
国家公祭日 铭记历史，守护和平愿逝者安息 //@angelababy:国家公祭日向30万遇难同胞致哀。永远牢记历史，守护来之不易的和平。	未
国家公祭日 铭记历史 守望和平	未
国家公祭日 铭记历史，守望和平。	未
国家公祭日 铭记历史，守望和平	未
国家公祭日 铭记历史，守望和平，吾辈当自强	未
国家公祭日 铭记历史，守望和平，愿逝者安息	未
国家公祭日 铭记历史，守望和平。愿逝者安息，和平永存	未
国家公祭日铭记历史，守望和平！ 查看图片	未
国家公祭日 铭记历史！守望和平！//@英格兰队球迷俱乐部:国家公祭日 勿忘国耻！吾辈自强！	未
国家公祭日 铭记历史，愿逝者安息，和平永存	未
国家公祭日铭记历史，珍爱和平，愿和平永存！	未
国家公祭日 //@鹿晗工作室:国家公祭日铭记历史，珍爱和平！//@M鹿M:逝者安息，和平永存国家公祭日	未
国家公祭日默哀！我会永远记得曾经发生了什么！！！！！！每个华人必须铭记！！！！	未
“国家公祭”牌安装完毕 众人江东门纪念馆外感受庄重氛围	未
国家公祭金陵，永生！图：江苏广电融媒体新闻中心	未
国家兴衰行业盛衰，2019将是价值回归年国家周期是100年，行业周期是20年。1919年，一战结束，巴黎和会召开，美国正式问鼎世界。按照世界霸主100年必生变的规律，必然有国际大事件发生，引发国际秩序的重组。这个周期非常精准，我们就以房地产和互联网为例做一个探讨... 国家兴衰行业盛衰，2019将是价值回归年	未
国家出手！全面婚俗改革来了！	未
“国家利益， 是我追求的最大公益”	未
国家动力电池创新中心成立，要赶超日本、韩国电池技术	未
国家区域发展最新路线图点名12座中心城市 打开区域协调发展新局面	未
国家医保局如何强化保障功能？独家对话首任发言人	未
国家医保局官方解读4+7带量采购：本次集中采购总体降幅符合预期	未
国家医保局：药品集中采购 百姓受益行业获利	未
国家医保局解读采购新政：确保中选药品进医院用得上	未
国家博物馆来了一群抚州明星！新华社央视也来打Call！（附视频）	未
国家博物馆现场报道 “老物件”带你穿越40年时光	未
国家卫健委公布医改“成绩单” 居民基本医保参保率达95%	未
国家卫健委：“十三五”以来超九成城市开展分级诊疗	未
国家卫健委宣布了这个好消息！涉及每个滁州家庭	未
国家卫健委：明年将启用新版出生证明国家卫生健康委员会官方微博@健康中国 3日发布消息：旧版出生医学证明(第五版)签发截止到12月31日，自2019年1月1日起，将启用新版出生医学证明(第六版)出生医学证明(第六版)将出生医学证明(第五版)封底中华人民共和国国家卫生和计划生育委员会监制 ...全文	未
国家卫健委：自2019年1月1日起将启用新版出生证明	未
国家卫生健康委体改司来阜阳调研医改工作	未
国家卫生健康委召开新闻发布会，介绍我国艾滋病防治工作进展情况	未
国家卫生健康委调研组来大方县考察调研	未
国家卫计委推出健康生活理念：每天发呆5分钟	未
国家发展和改革委员会公告 2015年第29号	未
国家发展和改革委员会公告 2016年第17号	未
国家发展和改革委员会公告 2016年第18号	未
国家发展和改革委员会公告 2016年第22号	未
国家发展和改革委员会公告 2016年第23号	未
国家发展和改革委员会公告 2016年第4号	未
国家发展和改革委员会公告 2016年第7号	未
国家发展和改革委员会公告 2017年第2号	未
国家发展和改革委员会公告 2017年第8号	未
国家发展和改革委员会公告 2017年第9号	未
国家发展改革委与澳门特区政府签署《关于支持澳门全面参与和助力“一带一路”建设的安排》	未
国家发展改革委、交通运输部印发《国家物流枢纽布局和建设规划》	未
国家发展改革委副主任宁吉喆主持召开中泰铁路合作联合委员会第26次会议	未
国家发展改革委副主任宁吉喆赴阿联酋 推动中阿共建“一带一路”重点领域务实合作	未
国家发展改革委 商务部令 2017年第33号	未
国家发展改革委 工业和信息化部 国家质检总局 2016年第12号公告	未
国家发展改革委、澳门特别行政区政府签署《关于支持澳门全面参与和助力“一带一路”建设的安排》	未
国家发布支持文化企业发展新政 影视产业获多项免税大礼包	未
国家发改委：下一步要着力放宽服务业准入。指哪些服务	未
国家发改委、交通运输部：规划建设212个国家物流枢纽	未
国家发改委发言人：贯彻房地产调控决策是坚决的、一贯的	未
国家发改委同意长江口南槽航道治理一期工程，总投资逾18亿	未
国家发改委启动“十四五”规划前期调研	未
国家发改委启动十四五规划前期调研 经济增速或放慢	未
国家发改委启动十四五规划前期调研 经济增速或放慢 国家发改委启动十四五规划前期调研 经济增速或放慢	未
国家发改委：多措并举发展壮大实体经济	未
国家发改委年末高频批复城市轨交规划，基建补短板力度渐强	未
国家发改委：我国资源枯竭城市转型已取得阶段性成果财联社12月15日讯，国家发改委副秘书长周晓飞近日在全国资源枯竭城市转型发展暨采煤沉陷区综合治理经验交流现场会上表示，我国资源枯竭城市转型已取得阶段性成果，社会民生历史遗留问题基本解决，生态环境状况逐步好转，城乡面貌持续改善，接续替 ...全文	未
国家发改委批复上海轨道交通三期建设规划，总投资近3千亿元	未
国家发改委批复新建西安至延安铁路，总投资551.6亿元	未
国家发改委振兴司原司长建言东北制造：创新机制环境还需优化	未
国家发改委新任纪检监察组长来自中纪委：张巍接棒穆红玉	未
国家发改委：根据科技型中小企业特点给予多方面金融手段支持	未
国家发改委正编制《长三角区域一体化发展规划纲要》	未
国家发改委能源局原局长徐锭明：数字化为能源革命赋能	未
国家发改委：资源枯竭城市转型已取得阶段性成果	未
国家发改委：采煤沉陷区转型任务艰巨，要集中力量破瓶颈	未
国家发改委领导来我县考察调研指导工作	未
国家发文支持工业旅游 漳州时间小镇了解一下	未
国家发红包！满足要求的赶紧申请	未
国家发话！每人每年4000元补贴！这些霍山人可领取！	未
国家发钱啦！每人每年4000元！符合条件的丰都人快去领！	未
国家发钱啦！这些峨眉人都有份，符合条件最多可领一万元！	未
国家品牌联通5G全球首个：5G网络下全景远程监控视频回传无人驾驶智能集装箱卡车示范项目在天津落地完成	未
国家国库金条！一克长城金，今日开抢！	未
《国家地理》：中医药是有待现代医学发掘的“最大宝库”	未
《国家地理》原创交响乐澳门上演	未
国家地震救援浙江大队72小时综合实战拉动演练	未
国家基本公共卫生服务，14项全免费	未
国家外汇局旗下投资平台再添新成员，5亿元成立中汇储投资	未
国家多次出手打击老赖，冠群积极履行监管政策	未
国家大剧院11周年免费开放日，机器人成导游	未
国家大剧院原创民族舞剧《天路》二度上演	未
国家大剧院奏响“中国与世界”主题音乐会	未
国家大剧院建院十一周年：将呈50余场现场演出及活动	未
国家大剧院版歌剧《唐璜》露真容：风流倜傥	未
国家大科学装置“聚变堆主机关键系统综合研究设施”启动建设	未
《国家宝藏》宋金项饰揭开沉船谜团 再现海丝之路昔日辉煌	未
《国家宝藏》第二季27件文物揭晓！	未
《国家宝藏》第二季：中山古国现千年美器	未
国家宝藏第二季，哔哩哔哩将于12月10日，零点上线，敬请期待	未
《国家宝藏》第二季王菲黎明守护国宝 濮存昕翟天临同台飙诗	未
《国家宝藏》第二季迎河北博物院专场	未
《国家宝藏》联手王者荣耀，让国宝“活”起来	未
国家宪法日，一起学宪法！	未
国家宪法日 上海158名高级法官庄严宣誓	未
国家宪法日丨我市举办形式多样的主题宣传活动	未
国家宪法日丨用照片记录这一刻有奖征集活动开始啦！	未
国家宪法日 为更好的学习宪法，当好法治宝山建设先行者，12月3日，宝山区区委政法委组织全区政法系统进行法律知识竞赛经过激励角逐，宝山公安分局荣获一等奖三等奖和优秀奖通过这次比赛，促进了民警学法用法的积极性，提升法律素养执法水平和实战能力@警民直通车-上海	未
国家宪法日今天，80余名人大代表记者学生和社区居民走进济南中院，参加公众开放日活动！网页链接	未
国家宪法日南沙活动多！现场观礼宣誓仪式是什么样的感受	未
国家宪法日天职师大师生这样做	未
国家宪法日 广平普法知识进课堂	未
国家宪法日，普法宣传不停歇	未
国家宪法日  环绕在你我身边的那一抹温暖的宪法红	未
国家宪法日系列活动法律知识竞答抢红包倒计时1天！	未
国家宪法日让我们与法同行！	未
国家宪法日！通州少年走进检察院观摩提讯，比拼才艺！	未
国家宪法日，重温习近平关于宪法的10句重要论述(图)	未
国家宪法日高墙里的烹饪大师，今日为你呈现一道宪法主菜	未
国家将花千亿确保这件事 快看你家受益多少？	未
国家将花千亿确保这件事 看你家受益多少?	未
国家将要推广无痛分娩，长宁这家医院已达到80，全国领先！	未
国家工信部节能司司长高云虎到沧州渤海新区重点企业调研	未
国家开发银行2018年定点扶贫工作座谈会在道真召开	未
国家开发银行与中华全国供销总社签署脱贫攻坚合作协议	未
国家开发银行发行24亿美元境外债 为中资行今年单次最大单	未
国家心血管病中心高血压专病医联体成立一周年	未
国家惠民工程！在涞水，遇到他们千万别错过！	未
国家扶贫政策来了！临沧这些家庭可以享受补助，快看看你家符合	未
国家投入800万，让我们身边的每个人都能看云阳人家。	未
国家支持带来黄金契机 2018料成“香港创科腾飞元年”	未
国家文创实验区版权服务中心在京揭牌	未
国家新闻出版广电总局办公厅 国家税务总局办公厅关于联合举办2017年全国税收公益广告作品征集暨展播活动的通知	未
国家新闻出版总署原署长柳斌杰为《美术编辑学概论》作序(图)	未
国家旅游局：未来3年将为西藏输送游客2000万人次	未
国家林业和草原局：我国石漠化扩展趋势得到有效遏制	未
国家林业和草原局：新版《植物检疫证书》元旦正式启用！	未
国家林草局：三北工程坚持生态治理与改善民生协同推进	未
国家林草局：三北工程是未来国土绿化主战场	未
国家林草局发文：开展乡村绿化行动  发展森林康养生态观光旅游	未
国家林草局：石漠化扩展趋势得到遏制，生态状况稳步好转	未
国家标准：煤矿巷道锚杆支护技术规范，今日正式实施！（内附高清无水印版免费下载）	未
国家毛衫纱线资源共享平台在高新区启动	未
国家游泳跳水花游队参观《伟大的变革》	未
国家滑雪队择“东方瑞士”阿尔山蓄力冬奥	未
国家点名郑州等12个城市！赋予重任！意义重大！	未
国家烟草专卖局中国烟草总公司招录30人！	未
国家田径队冬训备战2019新赛季	未
国家电影局：加快发展人民院线，给主旋律影片更大放映空间	未
国家电网党组成员、工会主席刘广迎出任中国大唐集团副总经理	未
国家电网“混改”提速  特高压首次开放	未
国家电网“混改”提速：首次向社会资本开放特高压建设投资	未
国家电网混改提速：首次向社会资本开放特高压建设投资国家电网25日宣布，将在特高压直流工程增量配电综合能源服务抽水蓄能电站电网信息通信产业电网直升机作业服务等十大领域引入社会资本，加快混合所有制改革。其中，将首次引入保险大型产业基金以及地方政府投资平台等社会资本参 ...全文	未
国家电网混改提速：首次向社会资本开放特高压建设投资国家电网25日宣布，将在特高压直流工程增量配电综合能源服务抽水蓄能电站电网信息通信产业电网直升机作业服务等十大领域引入社会资本，加快混合所有制改革。其中，将首次引入保险大型产业基金以及地方政府投资平台等社会资本参股，以合资组建项目公司方式投资运营新建特高压直流工程。（央视新闻）	未
国家电网混改提速：首次向社会资本开放特高压建设投资国家电网25日宣布，将在特高压直流工程增量配电综合能源服务抽水蓄能电站电网信息通信产业电网直升机作业服务等十大领域引入社会资本，加快混合所有制改革。其中，将首次引入保险大型产业基金以及地方政府投资平台等社会资本参股，以合资组建项目公司方式投资运营新建特高压直流工程。还将在通航运营带电作业电网基建施工等业务领域开展混合所有制改革。国家电网混改提速：首次向社会资本开放特高压建设投资	未
国家监委召开第一届特约监察员聘请会议，50人获聘	未
国家监委召开第一届特约监察员聘请会议 杨晓渡出席	未
国家监委第一届特约监察员获颁聘书	未
《国家相册——改革开放四十年的家国记忆》出版发行	未
国家督学张力：面向2035，中国教育现代化开启新征程	未
国家知识产权局条法司：专利法修正草案有望在明年得到通过（上证报）	未
国家知识产权局条法司原司长：专利法修正草案有望在明年得到通过	未
国家知识产权运营公共服务平台：聚焦高价值专利培育和运营	未
《国家科技重大专项（民口）资金管理办法》解读	未
国家税务总局：1月初发工资也来得及享受专项附加扣除 800万人已开始填报相关信息	未
国家税务总局：一图了解我国税制改革40年历程。	未
国家税务总局：全力以赴确保个税改革平稳落地	未
《国家税务总局关于全面实施新个人所得税法若干征管衔接问题的公告》出来了快讯！全面实施新个人所得税法若干征管衔接问题明确	未
国家税务总局副局长孙瑞标介绍当前税收改革发展的四个重点	未
国家税务总局副局长孙瑞标：研究推出新一轮更大规模普惠减税降负措施	未
国家税务总局局长王军：全力以赴确保个税改革平稳落地	未
国家税务总局：平稳有序推进税制改革  落实好更大规模的减税措施	未
国家税务总局：平稳有序推进税制改革，落实好更大规模的减税措施	未
国家税务总局总审计师：“个人所得税”APP已上线	未
国家税务总局：抓紧研究完善普惠性税收减免及增值税改革等措施	未
国家税务总局：抓紧研究推进增值税等实质性减税措施	未
国家税务总局：深化税收改革 加强国际税收交流与合作	未
国家税务总局：落实好更大规模减税措施	未
国家税务总局：要将税收工作重大决策部署落实到位	未
国家粮食和物资储备局领导班子两个重要岗位“新人”到岗	未
国家级媒体首发中国营商环境评价报告 综合排名前十城市出炉	未
国家级媒体首发中国营商环境评价报告 综合排名前十城市出炉中央广播电视总台举行中国城市营商环境报告2018发布仪式，这是首份由国家级媒体发布的中国营商环境评价报告，具有独立第三方编制和权威性的特点在发布会上，公布了2018年中国城市营商环境综合排名前十位城市榜单，依次是：北京上 ...全文	未
国家级！巴中柳津湖上榜国家水利风景区名单！	未
国家级新区里的“获得感”	未
国家级示范城市！唐山再添一张新名片！	未
