回复@阿琛桑:里昂不好踢啊。//@阿琛桑:回复@尤文菲戈:哈哈是吧，巴萨晋级最轻松估计，里昂才是最弱的对手	未
回复@陆小茸_一只鹿茸://@陆小茸_一只鹿茸:带颗钻就好了，越大越好	未
回复@陈东早:这眼力属实不行。//@陈东早:不是//@武汉刘正涛:哥，是不是财经界的颜值担当说！	未
回复@难得迷糊:中国50万资金以上的股民占比不到5，这5有一半去玩沪港通了，试问没有韭菜在科创板，那些大股东割谁去几乎可以肯定是死板一个//@难得迷糊:癌股投机性更强	未
回复@雷霆-总冠军:他説了啥?//@雷霆-总冠军:朱老师你对王猛评价威少的言论怎么看	未
回复@霸气的我就是我_6:前几个月去过一次，有机会围着湖跑一次！//@霸气的我就是我_6:回复@但斌:来西昌天天都是太阳	未
回复@静心管理自己_寻找缺失的信仰:一并感谢！//@静心管理自己_寻找缺失的信仰:这次没买会员，买个666的酒以示支持。//@侯宁:好女婿//@zQzhou:666六瓶?买点给老丈人尝尝	未
回复@靴下猫腰子:狐狸村的狐狸周边太棒了，而且想托人带写真集，印刷质量上乘！狐狸藏王狐狸村//@靴下猫腰子:@狐狸社社长乱狐 还有这个！	未
回复@颜颜小苑:今晚8点拍！暖暖的羊毛袜子！男女都有哈！礼盒装买起来！都是5双一盒！也可以分两双给粑粑麻麻哦！//@颜颜小苑:刚需，买给自己过节！	未
回复@风忘带走的叶子:嘿嘿，是它哦！天生大脸蛋！//@风忘带走的叶子:是它吗 查看图片	未
回复@风清佳://@风清佳:肥伦的后半生都会伴随这个梗	未
回复@风铃羽殇:这些猫头鹰也太美了吧！//@风铃羽殇:@狐狸社社长乱狐	未
回复@飞翔吧蓝鹰:大棋党可真了不起//@飞翔吧蓝鹰:回复 @跳跳可爱虎:外交水面下的动作，你知道什么新闻报道之前，你作为数码博主，又掌握了哪怕任何一个细节不懂不要装懂	未
回复@飞螺旋:图片评论 查看图片 //@飞螺旋:f35b的设计最适合改装激光。风扇一拆，刚好一个纵向桶形空间，上下各一个激光头。	未
回复@香蕉你不拿拿个: 压力储氢罐要到七八百个大气压才有实用意义，即使这样单位体积能量也只有汽油的三分之一。材料上目前只有碳纤能接受，其它都不行。丰田倒是做过储罐枪击和撞击试验，但坐在这么个高压容器上消费者心理恐怕不易接受。 查看图片	未
回复@驰文Clarma:中冠颁奖呀//@驰文Clarma:那你到底是去那个的?	未
回复@骑着毛驴上高速_:我觉得比券商预测的要靠谱//@骑着毛驴上高速_:你别说 还真有可能这么走	未
回复@高兴就挺好:不会再有太多大牌了，放心吧。有财政公平政策了，工资帽了。	未
回复@高金伯爵:挑战越大，未来的机遇也越大！活下去，就有历史性机会！//@高金伯爵:股市财经频道应该比2008年更可怕吧你没有实业不知道而已！这场经济危机应该比2008年的金融危机来的厉害！	未
回复@魏玉W_Y:抖音啊快去点赞评论吧//@魏玉W_Y:在哪有	未
回复@黄大大微:看了很多留言，我覺得你的這個很有趣。親愛的粉絲，請不要燒我，不然我就變燒鵝了 哈//@黄大大微:有点像鹅	未
回复@默潭噢:但真的没钱。我只有一套房还没有电梯，要换电梯房还买不起，只能期待加装。请在我微博搜电梯//@默潭噢:复旦中文系教授没钱那该谁有钱//@严锋:回复@打工仔甲:我住的客房大概5个平米，照片如图。这家酒店唯一的亮点是顶楼餐厅，中文系教授很有钱吗 查看图片	未
回头看典型案例通报（二十二）丨陕西韩城市焦化企业敷衍治理污染突出中央生态环保督察回头看 2018年11月9日至12日，中央第二生态环境保护督察组对陕西韩城市开展下沉督察，督察发现当地一些焦化企业敷衍治理，环境问题突出。陕西韩城市焦化企业敷衍治理污染突出	未
回家！	未
回家！12万件泰兴号沉船德化青花瓷归国今天，广州黄埔码头举行12万件珍宝回归开启仪式，这是德化青花瓷归国后的首次亮相。泰兴号1822年不幸沉没，1999年被国外团队打捞出水，珍贵文物流落海外。央视新闻微直播带你了解这批宝贝的前世今生（央视记者张莉莉） 央视新闻的微博直播 .	未
回家！12万件泰兴号沉船德化青花瓷归国今天，广州黄埔码头举行12万件珍宝回归开启仪式，这是德化青花瓷归国后的首次亮相泰兴号1822年不幸沉没，1999年被国外团队打捞出水，珍贵文物流落海外央视新闻微直播带你了解这批宝贝的前世今生（央视记者张莉莉） 央视新闻的微博直播 .	未
回家做！	未
回家做来试试！	未
回家做来试试	未
回家再创业，他带着村民养泥鳅！创造了2条惠民产业链	未
回家前先打个电话，到家后一定能吃到最喜欢的那道菜，这是我最能确定的一件事。关注转发说说你有哪些确定会有的温暖，抽送暖心的天王表一只。这一刻有点暖	未
回家可以做来试试！	未
回家喽！奥地利出生的大熊猫龙凤胎即将返回中国在奥地利出生的龙凤胎福伴福凤很快就要踏上回乡的旅程。得知它们要回中国的消息，很多熊猫粉丝专程来到维也纳美泉宫动物园，在雪中与这对熊猫宝宝道别，其中包括奥地利总统范德贝伦夫妇。@成都商报1视频 成都商报1视频的秒拍视频	未
回家喽！奥地利出生的大熊猫龙凤胎即将返回中国在奥地利出生的龙凤胎福伴福凤很快要踏上回乡的旅程得知它们要回中国的消息，很多熊猫粉丝专程来到维也纳美泉宫动物园，在雪中与这对熊猫宝宝道别，其中包括奥地利总统范德贝伦夫妇	未
回家尝试一下	未
回家的小伙伴可以关注了	未
回家练练了	未
回家练起来	未
回家试试！	未
回家试试吧	未
回家试试看	未
回家，过年的味道	未
回广州陪父母三天，免不了陪看@北京卫视-养生堂 ，惊喜地发现，这个过去被我多次抨击坑骗老人的节目有了很大的改变，多了很多现代医学知识，没有看见那些开祖传骗方的神医，连郎导代言的骗术莎普爱思也不见了，看来科学观还是有很大的进步，赞！	未
回归教育 传播文化 让古老书院活在当下	未
回归教育 传播文化 让古老书院活在当下	未
回归教育，传播文化，让古老书院活在当下	未
回忆啊	未
回忆，是弱者的方式看着前方走，才会胜利。	未
回忆杀  一次时光隧道的旅行	未
回忆杀！天津二三十年前的公交车，每一趟都满载时光！	未
回忆杀！海宁小伙走遍浙江各地，寻找百年前老照片里拍摄过的地方！	未
回忆  澄海的小伙伴们是否还记得，小时候爱看的那棚纸影戏	未
回想十年前汶川地震时，每个人都很诚心诚意的去帮助灾区的人民。说一件很多人都不知道的小事，十年前，林俊杰的经纪人连续打了四个电话给四川卫视，说希望参加当时的赈灾晚会，并且分文不收。当年四川台的一个工作人员在博客上记录了这件事，否则也没人会知道当年他的心意。	未
回手掏，走位，走位。。搞笑幽默趣闻 红人的诞生 V影响力峰会	未
回新加坡以后心血来潮想写个泰国自由行攻略 记录一下这吃吃喝喝拍拍走走的6天5夜。	未
回族女孩嫁给了汉族男孩，一个真实的故事...	未
回望三十年：希望工程老友记	未
回望四十年之三十一：1996年三明市全球通移动电话正式开通	未
回望四十年之二十三：1992年交通先行工程正式实施	未
回望四十年之二十二：1992年三明市首获国家卫生城市称号	未
回望四十年之二十八：1995年实施再振三明工业雄风战略	未
回望四十年之二十六：1993年鹰厦电气化铁路全线正式开通运营	未
回望四十年之十七：1985三明市区管道煤气工程破土动工	未
回望四十年之十九：1988年三明市成为全国对外开放城市之一	未
【回望四十年 奋进新征程】江苏开放大学与时代同频共振  绽放芳华	未
[回望四十年 奋进新征程] 陈竟，年俗的守望者	未
回望柳州交管交通安全设施  岁月更迭中的不变标志	未
回望柳州交管从三尺岗台到智能交通  交通秩序管理与改革同行	未
回来了！回来了！弋阳2名援非医疗队员载誉而归！	未
回深圳啦等下万象天地Chanel见哦！	未
回眸2018贡米之乡的新苹果经：今年产值将超三亿元！	未
回眸40年建设不夜城  高起点迎接新世纪	未
回眸40年静安区危棚简屋改造工作回忆	未
回眸 宁波交警改革印记壮阔东方潮，奋进新时代，岁月不惑，春秋正隆。今年是我国改革开发40周年，为充分发挥新媒体的传播优势，宁波交警在全面深化改革创新社会管理服务保障民生规范执法办案坚持科技强警等方面取得的丰硕成果，唱响新时代最强音。	未
回眸 宁波交警改革印记壮阔东方潮，奋进新时代，岁月不惑，春秋正隆。今年是我国改革开发40周年，为充分发挥新媒体的传播优势，宁波交警在全面深化改革创新社会管理服务保障民生规范执法办案坚持科技强警等方面取得的丰硕成果，唱响新时代最强音。@宁波交警	未
回眸涂料行业的2018，没什么比活下去更重要	未
回眸百货业66年，它用失败见证了两大中国首富诞生	未
回答各位问题：1这是网店 2这是我们订制了书店的VI视觉系统 3我们会和出版社联名 尽量控制价格且配合附送小周边。以上是目前确定的事情 还待继续完善	未
回血红包	未
回覆@少年昆特之烦恼:湖人總冠軍！//@少年昆特之烦恼:朱老师奶两口我湖辣鸡球队吧，这第四看着不稳啊//@朱彥碩:我雷是爛隊，求輕虐...........	未
回迁小区一流品质一流管理 政府购买服务惠民生	未
回迁房建设大气治理...... 你关心的就是珍礼区长关注的！	未
回酒店的路上随手拍了几张，虽然并没有开超级夜景，但依旧觉得小米MIX3的夜拍棒棒的 唐山	未
回音壁中国凤阳微信公众号的网友们大家好，来和小编互动吧！	未
回顾2010，以史为镜，正视未来	未
回顾2018韩国乐坛：有喜有忧五味杂陈【组图】(图)	未
回顾6	未
回顾9（模式内赚钱效应）	未
回顾Goldschmidt 响尾蛇生涯的高光表现体坛百咖秀 体育V势力	未
回顾一下越南神僧Levi的神奇抢龙操作，Welcome to LPL！	未
回顾与前瞻重庆史发展路径 专家学者齐聚重庆	未
回顾医疗洞见聚合共享第四届山东省医院院长年会即将盛大开启	未
回顾十几年的礼仪设计指导工作，我与我的礼仪工作室伙伴们一直在砥砺前行！希望我们的工作能赋予每部戏剧仪式感。未来依然会坚守前行，不忘初心	未
回顾卡斯特罗一生：硬汉是怎样炼成的	未
回顾合肥城管一周要情速览	未
回顾周琦一年半火箭生涯，本赛季出场1分钟得2分	未
回顾  在海洋上创业的他，邀请你在5年内住进世界首座漂浮城市！	未
回顾  山脉奥森店冬夜煮酒回顾，快来听听唐三石大Tim在四姑娘山上的故事！	未
回顾强强联手今日体坛	未
回顾恒大那些年的圣诞礼物，今年是否会有惊喜呢2010年：冯潇霆张琳芃姜宁杨君2011年：赵旭日荣昊李建滨彭欣力2012年：埃尔克森2013年：雷内2014年：邹正张佳祺2015年：徐新李源一2016年：金亨镒2017年：邓涵文唐诗杨立瑜2018年：传闻中的球星	未
回顾我们相聚无锡，空手而去满载而归！	未
回顾  滴滴出行产品专家刘飞：用户驱动时代的产品思维	未
回顾现场遂溪县2018年全国交通安全日主题活动启动仪式暨平安行晚会	未
回顾红骑之旅决战井冈之巅2018环大井冈红骑之旅总决赛	未
回顾老布什夫妻的恩爱瞬间	未
回顾莫斯科田径锦标赛 体育V势力	未
回顾詹姆斯07年总决赛20佳球	未
回首2018他们，是最美逆行者！请记住这些消防英雄！漫漫黄沙中，他们不顾全身泥土灭火战斗后，他们还不忘安抚受惊的小动物冬寒抱冰，夏热握火，在最危险的地方出生入死，他们，是真正的英雄网友：愿每次出发，都能平安归来！消防英雄，值得我们转发致敬！	未
回首2018，留下是对职责的忠诚守望2018即将结束，2019翘首以盼，回望过去这一年，我们的军队有太多闪光的点滴。有多少迷彩为了梦想矢志奋斗，有多少军人为了责任默默坚守，有多少故事直击你我心田，有多少瞬间令人泪流满面。回顾2018年的军营，曾经感动你我的人和事，仍一一浮现在眼前，在年终岁尾之际，中国军网开始发布年终系列策划图集《军人镜头里的2018》，向寒来暑往中奔波一年的战友们致敬！网页链接 （郭朋）	未
回首2018，留下是对职责的忠诚守望2018即将结束，2019翘首以盼，回望过去这一年，我们的军队有太多闪光的点滴。有多少迷彩为了梦想矢志奋斗，有多少军人为了责任默默坚守，有多少故事直击你我心田，有多少瞬间令人泪流满面。回顾2018年的军营，曾经感动你我的人和事，仍一一浮现在眼前，在年终岁尾 ...全文	未
回首2018：重习金句	未
回首2018 重温习近平这18句话	未
回首2018，重温习近平这18句话	未
回首四十年  农家乐  从离开乡土到拥抱田园，农家之乐到底为啥吸引人	未
回首四十年  旅游  世界这么大，我们一起去看看	未
回马德里过圣诞节啊	未
因一见钟情，他山居12年，改造1930年民国老别墅，陪女儿慢慢长大	未
因一部剧走红却很快过气，结婚9年幸福美满，43岁身材不输小鲜肉	未
因为一个梦，爱上一座城。云南，我有故事，你有酒吗	未
因为一些事再次特别提醒大家一下，有相同的爱好很可贵，但是第一次见面，女生尽量不要单独去不安全的地方，也不要泄露重要的个人信息，请大家多多注意个人安全！	未
因为一场大火，内江再获央视关注！	未
因为一座不包邮的桥，我们和更好的生活相遇	未
因为不懂这项技能，你错过了多少次升职机会	未
因为不能养我一辈子，请别从小娇惯我！值得深思	未
因为你们，这个冬日很暖	未
因为你年轻过，爱过//@司马子潇潇e:莫名的感动。是老了吗	未
因为你很重要	未
因为你是有素质的人	未
因为你眼瞎，看不到满大街到处被破坏，如果国民的素质高怎能让一个方便公众的公司倒闭//@可爱本可爱了：是公司倒闭资金链断裂车都回收废了，又不是都被弄坏了	未
因为你知道，懂得爱自己，别人才会来爱你。	未
因为信任，才会交心！	未
因为同样的爱好更喜欢对方世界上最好的爱情不是有人懂你的言外之意 而是有人懂你的欲言又止啊	未
因为同样的爱好更喜欢对方，但就算没有共同爱好，那个人是你，我也想和你共度一生。这是爱情最好的模样。	未
因为同样的爱好更喜欢对方你好，篮球男孩。	未
因为同样的爱好更喜欢对方刷爆朋友圈的漫画，这才是最不容易分手的恋爱模式！	未
因为同样的爱好更喜欢对方 嗯，我就是！你是否也想拥有一段和读书有关的爱情	未
因为同样的爱好更喜欢对方 嗯，没错！我想拥有一段和篮球有关的爱情	未
因为同样的爱好更喜欢对方对于宽粉来说，最幸福的事莫过于找到一个和自己一样爱好的另一半，每天有聊不尽的宽窄之道，身边发生了什么事都想第一时间给对方说，因为喜欢宽窄，而更珍惜彼此。说出你的爱好是啥在评论里找找有没有你的ta！宽窄尬聊 微博视频	未
因为同样的爱好更喜欢对方最不容易分手的恋爱模式感动了无数情侣的漫画，谢谢你，一直爱着我呀	未
因为同样的爱好更喜欢对方比如喜欢相同风格的音乐，所以会觉得彼此大概都是同一种人吧。 爱好越相同，就越能从生活中找到更多的话题。你的爱好是什么呢说出来评论里找一个好朋友呀。	未
因为外表美丽被张艺谋发掘，今55岁被老公宠爱了30年	未
因为奋斗而不平凡。	未
因为奋斗而不平凡	未
因为她随州产业将大变样！！	未
因为它，什邡的街道美出新高度，还不赶紧去打卡！	未
因为彼此有所羁绊，所以见面才会有所期盼  心理书签 NO.2	未
因为往年的纸商倒闭了阿哈哈哈只能换纸了意外的还不错呢谢谢返图	未
因为我们会更大更强！老外懂个屁，他们不懂我们体制的优惠性。//@Glaucous: 因为我们的生活会越来越好！	未
因为收拾了才敢拿出来发这么整齐的时候不多生活的模样母婴v时代母婴自媒体大赏育儿盛典大柱小花	未
因为是免费的，所以更好吃了！	未
因为是这座小城，所以深深爱着！若你累了，金昌等你回家......	未
因为有了温暖的你，Ta们的世界才变得有温度被救助的流浪狗蜜糖在知名摄影师@贾蕾lainka  温柔的怀抱里定格下温暖的一刻动物虐待其实离我们很近，请尽己所能为动物发声，帮助Ta们远离人间的恶魔永远做一个温暖的人	未
因为有他们，数字化才有未来  2018新华三杯	未
因为有山才能依偎着云	未
因为有爱所以温暖 户外拓展让宿迁留守儿童“嗨”起来	未
因为自行车这个共同的爱好聚在一起	未
因你而起不知所终 感恩 今年我还在@TFBOYS-易烊千玺	未
因受版号相关利好消息影响，众多网络游戏及电子竞技等概念股票纷纷逆势大涨	未
因地制宜 精准督办 浙江水源地整治任务推进顺利水源地保护攻坚2018为解决饮用水水源保护区内农业面源污染和村庄生活污水排放问题，丽水市遂昌县实施饮用水源取水口上移工程为了做好水源地保护，推动工业企业长远发展，宁波市象山县成立专项工作小组，完成3家企业补偿搬迁为彻底消除饮用水水 ...全文	未
因地铁 6 号线木马塅站施工，临空南路将禁车近两年为确保轨道交通 6 号线木马塅站工程施工的顺利进行和施工期间道路的交通安全畅通，施工期间将实行如下交通限制措施：从 2018 年 12 月 13 日 16 时至 2020 年 12 月 3 日 24 时止，对临空南路（大元路 - 天祥路段）禁止机动车通行	未
因塔侬山现在已经到6度了，想感受凉爽可以去了，哈哈阿姐说泰国	未
因大雾，临时封闭京沪高速济阳西济阳北商河收费站，青银高速靳家济阳遥墙收费站交警报路况	未
因工作业务扩展招聘新媒体编辑1名！欢迎加入我们的团队！	未
因推荐位原因今天休息，今早播到快7点有点吃不消！望各位理解！么么哒！	未
因果故事我仅仅建造了这样一所小泥屋，想不到获得了这么大的福报	未
因  根  造  景	未
因残致贫有良药 扶贫帮困暖人心 打通联系服务群众最后一微米	未
因泰立激光雷达项目落户西青开发区投资西青近日，因泰立科技（天津）有限公司落户开发区，该项目将主要从事激光雷达的研发组装及测试，注册资本500万元，坐落赛达检测认证园二期，租赁厂房1003.9平方米。新公司建成后，将主要进行激光扫描传感器激光车辆检测器等产品的研发组装及测试，涵盖了机械式半固态式和全固态式三种激光雷达的技术方向。预计2019年销售额将达3000万元人民币。	未
因港得名，向海而生！这次重要调查，摸清连云港海洋经济家底	未
因爱筑童梦 温暖留守心  梦想碧桂园百城公益行关爱祖国花朵走进湛江太平文里小学	未
因病致贫家庭的福音！南通出台救助办法 元旦起实行	未
因病致贫最高救助15万！满足这些条件的乐从市民都可申请！	未
因百名网红直播而出名的东风风光580被车主曝1月修了5次	未
因盐通高铁施工，东台市政府发布重要通告！请转发提醒！	未
团中央书记处常务书记汪鸿雁(女)当选全国青联主席	未
团中央书记处常务书记汪鸿雁当选为全国青联主席	未
团中央书记处常务书记汪鸿雁当选全国青联主席	未
团伙开西餐厅用美女勾搭男网友 10元酒勾兑卖上千	未
团区委印发《河东共青团进一步服务青年促进青年成长的实施办法》	未
团区委召开党风廉政建设专题学习会	未
团哥来送温暖啦	未
@团团，十一月团情速递，十二月工作展望！	未
团团又来送对象啦，单身的青们赶快戳进来	未
团团在等你喔()	未
团团想问问小伙伴们，你喜欢现在的自己吗为什么	未
团团营-滇池卫士昆明市滇池保护志愿服务项目开始申报啦！	未
团团说早安 团团微互动 团子们，早哎你们呷早饭冒咯今天大家用家乡的方言互道早安吧！	未
团团送你一封家乡的明信片！	未
团城山老下陆新下陆新增650个探头，覆盖37个社区，快看你家附近有没有	未
//@团子熊por://@花生了咩://@還是恩里://@六神_清凉解暑://@坂本奇恩://@_鲶小鱼__://@夏目雪音://@林纾言://@SNH48-荒妻://@暴躁母猩猩://@与風吟:	未
团学警彩我院举办2018级新生不忘跟党初心，青春共筑警察梦合唱比赛	未
团市委举办机关开放日暨走进青年团干部恳谈日活动	未
团市委召开共青团电商示范村建设工作推进会 成立共青团电商示范村青春合力队工作站 本报讯（记者 拓玲）近日，团市委召开共青团电商示范村建设工作推进会，研究推进共青团电商示范村建设的方法和路径，安排部署下一阶段重点工作。会上，为共青团电商示范村负责人颁发了共青团电商示范村 ...全文	未
团市委召开青年新媒体人才座谈会	未
团市委吉祥物团团圆圆毛绒公仔发布	未
团市委市预防办举办2018年度苏州市重点青少年群体成长护航工程示范项目 评审会	未
团市委开展纪念12.4宪法日 法治巡讲进校园活动	未
团市委组织召开我为创文作贡献 志愿服务主题活动市青年志愿服务分队活动部署会	未
团市委调研组一行到光山开展党建带团建 夯实基层基础专题调研工作	未
团干部技能大赛初赛	未
团战无敌，非要一个一个浪 搞笑	未
团支风  东风扬起，决赛之巅	未
团杭州市委书记马利阳赴江干调研共青团工作	未
团省委到市二十一学校调研指导青少年活动基地建设工作	未
团省委到我市开展党建带团建 夯实基层基础专题调研	未
团省委副书记王广庆一行深入武都区调研新媒体青年大学习工作	未
团省委《风流一代》杂志2019年办刊工作座谈会在我院召开	未
团票人数也是倒数第一，不要看加群的有八九百，要知道团的Q群都快2000人了	未
团结协作 快速完成高压业扩12月15日，@国网东明县供电公司 渔沃所带电作业站工作人员协作，快速完成高压用户表计安装，并随后开展带电作业接火，压缩业扩流程，减少时限，保证了城市建设项目早日用电。	未
团结就是力量，这两款App Store排名第一与第三人海游戏让我沉迷！	未
团结香港基金会发布香港医疗体系研究报告	未
团结香港基金：建立以基层医疗为主导的综合医疗平台	未
团综多么美好啊我在办公室流出热泪//@大仙儿是个蓝胖子 :妈咪太爱了//@KellyLeeeee : 我哭了 这是一个多么吵闹的团啊	未
团讯厉害了，我的团支部！猎豹汽车荆门公司机关综合线团支部开展主题观影活动	未
团购奶粉踩着你们的蛋了，我很开心。已经有很多国内外乳企主动跟我谈过了，明年会有更多的品牌更好的资源加入团购，我自己公司成立后每天都会有特价款国行国产奶粉，你们的蛋会碎的。只有让更多的中国妈妈用最实惠的价格买到合法安全靠谱的婴幼儿配方奶粉，才是对你们最致命的打击。	未
团购陈信宏的女朋友专享	未
团队协作	未
团风地标宴：团风乌林宴	未
团高效温和的黑科技抗老精华（特殊团购价最后一团）	未
囤囤菌来给你们送温暖啦	未
囤着不送了解//@凯撒蓝护卫队:螃蟹们赚取积分 囤着不送 遇JF帖 多多互动[加油][加油]	未
囤货分享 整理部分怀孕的故事，希望可以分享给大家，有点帮助。还有玩具书籍其他经验待整理	未
囧囧如约给大家带来首尔美食攻略啦！对于吃货旅行者来说旅行中的美食什么的才是重头戏！ 其实韩国料理不止泡菜年糕还有超正宗的烤肉韩定食... 以及韩剧中出现的各种好吃的.(gtlt) 想为你的美食之旅增添点灵感 可以先参考一下专业吃货月半仟为你推荐的美食攻略哟 @首尔旅游局@微博旅游 旅行囧记城市美食季 带着微博去韩国最炫打卡地旅行新势力 旅行灵感季 韩国旅行	未
