回复@阿琛桑:里昂不好踢啊。//@阿琛桑:回复@尤文菲戈:哈哈是吧，巴萨晋级最轻松估计，里昂才是最弱的对手	未
园区企业办事不过江！30分钟拿到营业执照哈尔滨新区政企合作新模式让企业竖起大拇指！	未
园区唯亭老菜场拟重新选址建设  原址将建街心公园	未
园区大作战！不出百步一网打尽你的吃喝玩乐！	未
园博园今开通可免费乘坐公交专线 首日有15辆新能源公交车	未
园博园门票价出炉 分4类基准价60元记者从第十二届园博会筹办指挥部获悉，第十二届中国（南宁）国际园林博览会于12月6日开幕，会期为6个月南宁园博园从12月7日起正式对公众开放，开园前及开幕当天园博园不对公众开放。目前门票分4种类型，即普通票优惠票普通团队票学生团队票。其中，普通票: 60元/人优惠票: 30元/人普通团队票: 40元/人学生团队票: 25元/人。同时，有三类人群可享受免费入南宁园博园，三类人群可享受半票入园，享受免票及半票政策市民游客均需出示有关证件入园。（南宁新闻网）	未
园博园门票价出炉 分4类基准价60元记者从第十二届园博会筹办指挥部获悉，第十二届中国（南宁）国际园林博览会于12月6日开幕，会期为6个月南宁园博园从12月7日起正式对公众开放，开园前及开幕当天园博园不对公众开放目前门票分4种类型，即普通票优惠票普通团队票学生团队票其中，普通票 ...全文	未
园林小景	未
园林小确幸北半园迳抱幽山，居然城市间北半园即陆氏半园，是始建于清代中期的汉族古典园林。虽然面积不大，但五脏俱全，是苏州园林中精致派系的代表作之一。进园即见水池居中，周边环以船厅水榭曲廊半亭，一个都不少，苏州园林的别致之处，入眼入心。	未
园林小确幸环秀山庄三亩天地上的山景园环秀山庄是以假山为主的古典园林，可以称得上是山景园的代表。虽只有三亩天地，但空间紧凑布局巧妙，构成一个封闭而宁静的小世界。湖山池水树木建筑，融为一体，禅意满满。	未
园林泰斗陈从周百年诞辰纪念活动在苏州举行	未
园艺疗养与养老养生如何与农业园区结合（详细）	未
困得一匹。。。	未
围场全城寻找58名有斑人士，做为本店形象代言人，免费为您祛斑...	未
围堆堆庆祝改革开放40年，社区群众歌唱美好未来！	未
围堆堆祝贺！广汉市党外知识分子联谊会和新的社会阶层人士联谊会正式成立啦	未
围墙一道道 名堂一套套 宿迁的墙，原来这么美	未
围棋之美与科技之魅的激荡 2018华为手机杯中国围棋甲级联赛落下帷幕	未
围棋后人工智能再胜人类，这次是预测“难缠”的蛋白质结构	未
围棋基础训练  吃子练习（一）动态图5	未
围炉取暖	未
围甲联赛大局已定 江苏夺冠衢州降级	未
围绕"数字新经济" 2018世界物博会9月在无锡举行	未
围观10岁雨点年年直跳五百 次次不死必归	未
围观2018 上海绿色施工样板观摩主会场，海量图片为你揭秘！	未
围观2018年汉中事业单位高层次人才公开招聘进入体检考察人员名单出炉	未
围观5集枣庄专题记录片登陆央视，滕州元素在这一集！	未
围观yyf充值300万连升3级！榜二：1900万，安排上了！	未
围观一下	未
围观一封《给热力公司的一封信》传遍魏县人朋友圈！	未
围观  一群斜杠青年们的南少林周末时光	未
围观 上月，蛋蛋塔伦埃格顿在ins上晒出了一名男子的照片，并配文小可爱，我的男孩一名网友留言问这是不是意味着他现在又男朋友了并获得大量的点赞近日，塔伦在接受英国广播时报采访时，回答澄清了该问题塔伦说：我不是同性恋，但在我15岁时，有两个好朋友出柜了 ...全文	未
围观下今年的巴黎名媛舞会，有三名中国女孩，分别是任正非之女Annabel Yao，贝聿铭孙女Anna Pei和香港盈科老总女儿Angel。觉得中国的名媛一代比一代好看了，今年也是历届中国女孩最多的一次。	未
围观丨井研大佛水库今天好闹热，今年预计能打捞30万斤生态鱼！	未
围观丨回忆杀！他用35年为太原城拍下几十万张照片	未
围观丨布达拉宫小小讲解员要诞生啦！	未
围观丨每人每年4000元！符合条件的宝丰人，请领取这项补贴！	未
围观丨第三届永春好声音第三场海选赛名单时间定了！你们准备好了吗	未
围观丨第三届永春好声音第三场海选赛名单时间定了！有你吗	未
围观丨蛋白质科学研究国家重大科技基础设施通过国家验收	未
围观丨西藏堆龙民泰村镇银行股份有限公司要招人啦！	未
围观中卫市人民医院放射科推出新服务啦，具体是	未
围观  中卫这段铁路有新进展，总投资86.7亿！未来发展不可限量！	未
围观！临朐这个90后大学生回家乡养鲟鱼走出致富路！你认识吗	未
围观二哈现身说法：在广州如何优雅地养我	未
围观云南寻甸北大营草场	未
围观！井研中学表扬大会！	未
围观京沪线又驶出一列张家港号高铁！	未
围观《人民日报》等多家报纸为我区这家企业点赞，这是为啥	未
围观！介绍十几个靓女靓仔给你们认识！	未
围观光影征途	未
围观全县水利基础设施建设及三防工作如何县长申翰杰深入调研	未
围观！六安将新增一座高铁站！@六安这对全能造假夫妻火了......	未
围观出门遇冬，转身即景，打卡诗意双桂湖，这份宝典了解下！	未
围观！博兴家有暖气的注意！这样一招，让你家里变更暖！赶紧试试！	未
围观  合图12月活动汇总来啦！！	未
围观吧。。	未
围观  吴江高淳邳州已开启上门服务！	未
围观啦	未
围观围观	未
围观围观//@lesliesay: 欢迎围观	未
围观！围观！围观！科普还能这样搞！	未
围观固原市妇幼保健计划生育服务中心微信挂号缴费查询正式启用	未
围观！国际音乐大师空降福清！竟是为了......	未
围观！安远县第二幼儿园一波美照曝光！	未
[围观] 定了！济青高铁即将通车！高密出发15分钟飞达青岛！	未
围观寻甸大街小巷你关注了吗	未
围观《市北新声》一份属于咱们市北居民自己的报纸，快瞧瞧有啥新鲜事	未
围观应急演练，让我们有备无患！	未
围观成都轨道建设粉丝团的对话 那些关于3号线二三期你想问的都在里面啦！粉丝团的日常科普对话，了解一下@成都地铁建设	未
围观！文化和科技融合十大技术应用场景发布	未
围观新变化！公务员加班补助要来了	未
围观  新城区人民检察院多措并举为扫黑除恶专项斗争保驾护航	未
围观时光在这里驻留梁平两处历史建筑上榜这项市级名单！	未
围观！昨天涪陵这些土特产在浙江火啦！	未
围观有奖寻找网络大咖	未
围观  杭州主城区下雪了！全国网友纷纷发来贺电	未
围观梁平老乡上央视！《乡约重庆梁平区》明晚播出！记得准时收看	未
[围观]歙县新安小学操场上人山人海，有你家孩子吗?(现场图)	未
围观江门新户籍制度出炉！内附详细入户细则！	未
围观河北省蔚县蔚州古城LOGO评选喊您来点评！	未
围观洪江七千棵行道树穿上冬衣啦！	未
围观洪江区少年女足对阵会同县少年男足，比赛太精彩！	未
围观  滕州最新机动车选号方案公布！速速扩散！	未
围观！潍坊40个村入选山东首批森林村居名单！快来看看有你家乡吗	未
围观火了！央视《味道》栏目组明日（12月8日）来梁，开启寻味模式！	未
围观灯饰来添彩，万盛这个地方开启新模式	未
围观！瑞金村干部涨工资啦	未
围观百年难遇的好雌 女悍将佛哈根之快车小姐	未
围观省经济合作局副局长易旸一行赴九寨沟县调研重大项目招商引资工作	未
围观看这里！60位中俄蒙三国佳丽12月8-9日将空降河东发达广场	未
围观瞧！信阳这座桥立体花架换时令花卉啦，一起出门赏花吧	未
围观！福鼎两地拟确认为2018年星级农村幸福社区	未
围观  简州新城首个城市综合体项目开工啦！	未
围观  管道君带你漫游肃州地下城	未
围观！自贡二中改造项目方案调整出炉了，天桥篮球场都有！	未
围观诏安这位会给小鸡唱歌的青年上央视啦！	未
围观！象山又一家新菜场即将开业！	未
围观赤坎东滘龙公路命名：学院路	未
围观走过路过，不要错过！第二届冬季大集12.1开集啦	未
围观这场消防培训及时雨来得好	未
围观这条800米的栈道，许你一往情深！	未
围观，这条健身步道给龙游人带来了什么	未
围观钓鱼台食品生物科技公司来我市考察	未
围观@锦阳明珠业主，现在全上高的人都在羡慕你们！	未
围观！长春这家医院走廊开课！收获大批粉丝，竟在讲	未
围观！《韶关市野外用火管理条例》公益动画宣传片发布	未
@固原人，全国胸痛急救地图发布，记住宁夏这3家医院，必要时可救命！	未
固原今年取暖又有新变化，这种取暖方式非常赞！	未
固原文化旅游形象宣传口号和标识征集公告	未
固始11月份醉驾曝光来了！看看这期谁上榜了	未
固始一退伍军人勇救落水女子，被CCTV点赞报道！	未
固始要结婚的注意！1天后这钱有望省了！最高能省数万元...	未
固安交通大爆发！工程最新进展曝光！固雄路预计完工时间>>	未
固安交通大爆发！工程最新进展曝光！固雄路预计完工时间约12月底	未
固安交通整治再发力！主城区106国道交通大变样！将影响52万人出行！	未
固安县打击违法占地冬季集中拆除整改专项行动-东湾片区拆除 顺利结束	未
固安又一个小区通过验收，快来看看有没有你家！	未
固安拆除土灶有奖励吗住建局回复啦！	未
固特异牧马人系列泥地胎（名字是牧马人，不是只能给牧马人用）。第二梯队档次的泥地胎，非主流，没啥特点，不太推荐。	未
国之栋梁！	未
国之重器。	未
国之重器	未
国乒交出年终答卷 日本将成东京奥运最大对手	未
国乒队深藏“演说家”	未
国产200吨重载自动导引牵引车研制成功	未
国产5G通信基站芯片通过认证	未
国产AR-3火箭炮发射“神秘”重型弹 个头就像战术导弹	未
国产HPV疫苗有望明年上半年上市 价格或将大幅拉低目前，国内的HPV疫苗由葛兰素史克和默沙东生产值得一提的是，国内生物医药企业万泰生物近日公布的信息显示，公司的二价HPV疫苗有望于2019年上半年获批上市国产HPV疫苗的上市有望惠及更多消费者一位业内人士向证券日报记者表示，预计国产H ...全文	未
国产，不充电不烧油续航1200KM，全球限量500辆！	未
国产全磁悬浮人工心脏将临床试验，此前成功救治三例危重患者	未
国产农机质量力争到2025年赶上国际先进水平	未
国产大手笔 《仙剑奇侠传7》制作成本超过5000万！据仙剑之父姚壮宪在贴吧称，本次新作《仙剑奇侠传7》投资成本已经达到5000万元。本作采用虚幻4引擎于2019年发售，敬请期待。	未
国产当自强	未
国产战机"三剑客"同框 构成完整打击体系	未
国产战机三剑客同框 构成完整打击体系	未
国产手机欲破高端市场天花板	未
国产手机游客可享景区半价江西婺源某景区发布公告：使用国产手机游客可享景区半价优惠，能省百元。	未
国产新一代宝马3系将于2019年5月投产国产新一代宝马3系（G20）将于2019年5月在铁西工厂正式投产，新车基于CLAR平台打造， 融合了宝马最新的家族式设计语言。动力方面，预计将提供高低功率的2.0T涡轮增压发动机和1.5T涡轮增压发动机可选。	未
国产新一代宝马3系将于2019年5月投产国产新一代宝马3系（G20）将于2019年5月在铁西工厂正式投产，新车基于CLAR平台打造， 融合了宝马最新的家族式设计语言。动力方面，预计将提供高低功率的2.0T涡轮增压发动机和1.5T涡轮增压发动机可选。新车公社	未
国产新一代宝马3系将于2019年5月投产国产新一代宝马3系（G20）将于2019年5月在铁西工厂正式投产，新车基于CLAR平台打造， 融合了宝马最新的家族式设计语言动力方面，预计将提供高低功率的2.0T涡轮增压发动机和1.5T涡轮增压发动机可选新车公社	未
国产新型无人机打靶成功，身怀绝技无人工操作也能作战！	未
国产游戏《仙剑奇侠传7》成本超过5000万人民币仙剑之父姚壮宪今日意外现身百度贴吧，亲自回复网友帖子，表示《仙剑奇侠传7》成本已超过5000万人民币。本作预计将在2019年明年暑假以及下半年之间发售，同时游戏的整体将回归初代几部作品的风格，采用虚幻四引擎制作。	未
国产游戏加速“出海”  借力传播中华文化	未
国产的矢量推进系统会不会在歼20上搭载？搭载更强型号，潜力无限	未
国产纪录片了解一下	未
国产纪录片 先马	未
国产集成电路设备重大突破 中微半导体5纳米刻蚀机通过台积电验证	未
国产首家！460亿大品种，要上市了	未
国人为偷懒一年花掉160亿 95后/广东人荣登榜首根据淘宝最新发布的《懒人消费数据》显示，2018年中国人为偷懒花了160亿元，其中95后懒需求增长最快。另外，数据显示东北和西北是懒人消费相对较低的地区，广东人荣登最善于偷懒排行榜榜首，人均懒人产品消费频次居全国第一。你是图中的哪种人	未
国人振奋！俄罗斯媒体出炉一消息，中国这领域已超美日欧	未
国人要永远感恩的23人，因为他们，中国的腰杆挺直了	未
国企  900人！中储粮集团招聘啦！	未
国企！云南建投建材科技招聘60人，五险一金	未
“国企开放日”在汕头举行：聚“交”城市发展	未
国企招聘ing永定河投资公司又招人啦！	未
国企招聘丨你想知道的电力企业招聘，全在这里啦！	未
国企招聘  宁夏中关村产业园科技投资有限公司招聘！缴纳五险一金！	未
国企招聘  宁夏六盘山水务有限公司招聘公告！	未
国企招聘年薪15w天津和平投资发展集团有限公司招聘，不限专业	未
国企招聘  日照科正建设工程质量检测有限公司招聘啦	未
国企新盘来了！宜宾将打造一座森林公园里的天空之城！就在主城区	未
国企正式工！3000-5000元/月！云南民族村2018-2019年招聘公告	未
国企法治建设公交集团开展多项法治宣传活动 推进法治公交建设	未
国企法治建设首旅集团召开2018年法治工作大会	未
国企“混改”持续发力 不断向纵深推进	未
@国企职工！2019年1月起，你的工资将有新变化！	未
国信弘盛荣膺《亚洲银行家》2018中国财富与社会企业成就奖	未
国信证券15日举行中国金牛私募杭州站巡讲	未
国信证券深圳泰九分公司各营业网点周末值班情况	未
国债供给“翘尾” 需求端支撑较强	未
国债期货10年期主力合约高开0.2%	未
国债期货19日走强 10年主力合约收涨0.26%	未
国债期货午后拉升，10年期主力合约现涨0.33%	未
国债期货午后拉升，10年期主力合约现涨近0.29%	未
国债期货大幅高开，10年期主力合约一度涨0.23%	未
国债期货尾盘小幅拉升	未
国债期货尾盘拉升，10年期主力合约收涨0.26%	未
国债期货涨幅扩大 10年期期债涨0.24%	未
国债期货高开，十年期国债主力合约涨0.23%	未
国债期货高开高走，10年期主力合约现涨0.26%	未
国债逆回购已连续4日飙升，14天年化收益率最高达5.5%	未
国元证券信用业务综合管理软件取得计算机软件著作权	未
国内20个旅行体验，实现10个算你厉害。不止旅行 V影响力峰会 @微博旅游	未
国内 SNKRS 上线一周年，有不少鞋迷都收到了 Nike 的免费礼物。康扣发售在即，美国 Nike 也给部分鞋迷免费送了过去。 我难道是下了个假的 SNKRS   牙蚂艹于 / 十一二十1 / i咖喱给给 / 刘腻恺 / 没心没肺的活着就好了/ rico trimble / Twitter	未
国内千余冬泳爱好者横渡长江三峡	未
国内原油期货主力合约跌超3%，创上市以来新低	未
国内古建掀数字化保护热潮：数字化之后如何衍生	未
国内合资品牌SUV市场中，丰田汉兰达一直备受关注，自2015年完成换代，终端加价加装饰提前几个月订车成为了汉兰达销售市场的常态。2018年3月，汉兰达进行中期改款，外观内饰以及配置部分升级，产品力进一步提升。今天给大家带来汉兰达，2018款 2.0T 四驱豪华版 7座的3年用车成本解析。	未
国内唯一省级山地自行车定向赛西安开赛12月22日，2018陕西省第四届山地自行车定向锦标赛在西安欧亚学院举行，共有来自全省各地25支参赛队100余名自行车及定向运动爱好者参加了此次比赛。陕西省山地自行车定向锦标赛从2015年开始，已在西安和汉中等地连续举办了三届，该项比赛作为我省独创的跨界跨项目群众性体育赛事活动，结合了山地自行车和定向越野两项户外运动属性，集冒险智力和趣味性于一体，是国际定向联合会承认的四个定向比赛项目之一，也是我国目前唯一一个省级山地自行车定向锦标赛。本届比赛由陕西省体育局主	未
国内外专家学者齐聚宿迁 共商乡村振兴大计	未
国内外专家热议长江经济带绿色发展“阀门”	未
国内外地质公园专家齐聚屏南 献策宁德世界地质公园发展	未
国内外近千名选手报名参赛 “东疆决”国际武术精英赛在通开幕	未
国内奶粉品质很好了，没必要买国外的。	未
国内官方天猫上架了，冲啊！ 宝贝详情	未
国内市场地暖安装材料对比分析 助消费者明智决策	未
国内应届生平均期望薪资8431元/月，排名前三位的城市依次是北京12992元/月上海12070元/月南京9771元/月，女生更爱成都，男生偏好杭州你大学毕业后的工资是多少	未
国内思想周报｜“后人类”的困境；隐秘崛起的民营经济	未
国内成品油价迎来年内首个“三连跌”，跌破7元大关	未
国内我最喜欢去的城市，拉萨，成都，西安，重庆，青岛，厦门，上海，大连，哈尔滨！都是待着就不想走的节奏！！！	未
国内最适合一个人旅行的8个地方 一个人也要有精彩的旅行，找机会一个人出去走走，看看风景，发发呆	未
国内最适合女孩独自旅行的十个地方，你去过几个	未
国内最适合穷游的5个地方，月薪3000就能去！	未
国内最适合穷游的5个地方，没钱没时间都不是理由！	未
国内最适合自驾的10条公路，来这里感受诗和远方	未
国内有哪些城市「哪怕只为了吃都值得特地跑一趟」	未
国内有哪些绝美的海岛可以去旅行	未
国内期市夜盘收盘 焦煤收涨2.21%	未
国内期市夜盘收盘，焦煤、焦炭分别收涨1.14%、0.66%	未
国内期市开盘，原油跳涨0.8%	未
国内期市收盘	未
国内期市早盘开盘延续隔夜分化	未
国内期货夜市开盘，原油高开0.9%	未
国内某长盛不衰家族传说：祖先帮助将军变帝王	未
国内油价创近十年最大降幅，现加满一箱能省21元	未
国内球员最高税前1000万参加2019亚洲杯2022世预赛的国脚可增加20，应该！！都为国效力吧！打重要比赛！！工资高！！！！	未
国内直飞最快3.5小时，有个超级好吃的国家，在路边就能尝到米其林！  国内直飞最快3.5小时，有个超级好吃的国家，在路边就能尝到米其林！	未
国内知名心理咨询团队负责人方舟到访圣运律所 取经专业化发展奥秘  圣运聚焦	未
国内第一位女性网球银牌裁判长：打篮球的喜欢上了网球	未
国内第一家免费的育种数据分析软件正式上线！	未
国内网红景区银基冰雪世界，好想和喜欢的人手牵手在雪里，一起白了头	未
国内肯定是东北啦1.今年的哈尔滨冰雪节在圣诞节左右试营业，元旦那天正式开园，喜欢冰雕的朋友快准备起来2.可以滑雪，网友们对亚布力这边的滑雪场评价还挺好3.有雪乡，而且今年雪乡也调整了很多。没见过雪朋友，想象下在雪地里打滚，睡在暖和的大炕上的感觉4.最后在长白山走一趟，感受下天池雪雕林海，作为北方人的小景觉得爽爆了。最后结束了可以在哈尔滨市区逛逛，运气好赶上下雪，在俄罗斯式的街头拍一波童话般的照片就更完美啦！国外的话离得近北海道，请个年假也够了。前几天刷爆微博的那条北海道雪国列车看到了吧，就是那么	未
国内藏了一座神似小巴厘的温泉之乡，首创船上泡汤，人均300奢享！	未
国内要闻目录（11月28日）	未
国内要闻目录（11月29日）	未
国内要闻目录（11月30日）	未
国内要闻目录（12月10日晚上）	未
国内要闻目录（12月11日晚上）	未
国内要闻目录（12月12日晚上）	未
国内要闻目录（12月13日晚上）	未
国内要闻目录（12月15日晚上）	未
国内要闻目录（12月16日）	未
国内要闻目录（12月17日）	未
国内要闻目录（12月18日）	未
国内要闻目录（12月19日）	未
国内要闻目录（12月1日）	未
国内要闻目录（12月20日）	未
国内要闻目录（12月21日）	未
国内要闻目录（12月22日）	未
国内要闻目录（12月23日）	未
国内要闻目录（12月24日）	未
国内要闻目录（12月25日）	未
国内要闻目录（12月2日）	未
国内要闻目录（12月3日）	未
国内要闻目录（12月4日）	未
国内要闻目录（12月5日）	未
国内要闻目录（12月6日）	未
国内要闻目录（12月7日）	未
国内要闻目录（12月8日）	未
国内适合闺蜜的旅行地1：丽江古城（云南省丽江市）2 ：三亚（海南省）3：西塘古镇（浙江省嘉善县）4：凤凰古城（湖南省湘西土家族苗族自治州）5：阳朔（广西壮族自治区桂林市）6:拉萨（西藏）7：九寨沟（四川省阿坝藏族羌族自治州）8：大理古城（云南省大理白族自治州）9：鼓浪屿（福建省厦门市）	未
国内配额15辆，有实力的同学上前一步	未
国内首个健康产业企业社会责任评价指标体系启动	未
国内首个冰雪汽车拉力锦标赛2月在长白山开赛	未
国内首个“国地工程实验室”在成都新都揭牌	未
国内首个地下立体式智能共享单车停车库在成都启用	未
国内首个民航认证楼顶机场在汉试飞成功12月8日从中船重工701所获悉，武汉亚心总医院高架直升机场已完成首次直升机试飞工作这是国内首个民航认证的高架直升机场，试飞成功意味着机场具备投入运营使用的条件楼顶机场是一种直升机起降平台，最少需要100多平方米的空地，除医疗救援外，还可 ...全文	未
国内首个民航认证楼顶机场在汉试飞成功12月8日从中船重工701所获悉，武汉亚心总医院高架直升机场已完成首次直升机试飞工作。这是国内首个民航认证的高架直升机场，试飞成功意味着机场具备投入运营使用的条件。楼顶机场是一种直升机起降平台，最少需要100多平方米的空地，除医疗救援外，还可用于城市交通和消防救援。国内首个民航认证楼顶机场在汉试飞成功	未
国内首台静脉用药配置机器人在沪上岗，最多可同时配药16瓶	未
国内首家！亚洲最大民营火箭制造基地交付使用	未
国内首家外资网约车公司正式启动，宝马想要的不仅是出行市场	未
国内首家民营火箭制造基地交付使用近日，国内民营火箭研制企业蓝箭航天在湖州的智能制造基地一期工程通过竣工验收并交付使用。这是国内首个民营火箭和发动机生产制造基地，未来将保障每年超过200台液氧甲烷发动机的生产制造能力。（新京报）	未
国内首座3D打印桥年内上海投用：35天一次成型可用30年	未
国内首座3D打印桥年内上海投用！敢不敢去走走首座3D打印桥在沪完成今年年内，国内首座可投入使用的3D打印桥将亮相上海桃浦智创城中央公园，和传统桥梁不同，新桥将不用一点钢筋水泥。这座桥是一座人行桥，长15.25米，宽3.8米，高1.2米。桥身呈乳白色，采用树脂材料。经过抗压加载等测试后，市民将能近距离接触到这座3D打印作品。我国首座3D打印景观桥将在沪安装 全长15米材料强度高	未
国内首座3D打印桥现身！打印35天可用30年	未
