回复@阿琛桑:里昂不好踢啊。//@阿琛桑:回复@尤文菲戈:哈哈是吧，巴萨晋级最轻松估计，里昂才是最弱的对手	未
国内首张航空年票来了，喜欢出行的朋友们可以关注一下花椒直播今天晚上22:00《剁手吧老铁》的这个活动，春秋航空放出一批不限次数不限地点不限时间说走就走的机票，1万元还只是参考价，网友们可以任意打折抢购，最终成交价有希望低至1000元不到。	未
国内首次！南方电网直升机带电X光检测作业成功	未
国内首次！成都造整机航电系统飞上蓝天11月24日下午，刚参加完成都市民营经济健康发展大会，成都赫尔墨斯科技股份有限公司董事长刘仲承，便迫不及待地将了解到的利好 消息分享给自己的团队目前，该公司自主研发的整机综合航电系统在国内首次顺利完成装机飞天，与中国海军中国空军中国 ...全文	未
国内首次！沪杭甬地铁刷码互联互通，明年有望覆盖长三角主要城市	未
国内首款太赫兹视频SAR研制成功	未
国内首部全科医生题材电影《你若安好》全国公映	未
《国剧盛典》主持团阵容公布，有你熟悉的TA吗	未
《国剧盛典》变认亲现场 苗圃为金瀚疯狂打call	未
国办印发今年食品安全重点工作安排  推动掺假造假行为直接入刑	未
国办印发《关于加快发展体育竞赛表演产业的指导意见》	未
国办印发《关于进一步激发社会领域投资活力的意见》	未
国办印发兴边富民行动“十三五”规划  支持边境地区加快发展	未
国办印发《实施方案》  加快推进政务信息系统整合共享	未
国办印发《意见》  医疗联合体建设试点全面启动	未
国办印发意见提出，推进畜禽养殖废弃物资源化利用	未
国办印发指导意见  完善国企法人治理结构	未
国办印发《政府网站发展指引》	未
国办印发《方案》  深化科技奖励制度改革	未
国办印发《规划》  推进“十三五”时期结核病防治	未
国办印发《贫困地区水电矿产资源开发资产收益扶贫改革试点方案》	未
国办印发通报对2016年落实重大政策措施成效明显地方予以表扬激励	未
国办印发通报对2017年落实重大政策措施真抓实干成效明显地方予以督查激励	未
国办发出通知24条措施激励地方真抓实干	未
国办发出通知将督查激励措施由24项增至30项 进一步加大对地方激励支持力度	未
国办发文大力发展职业赛事，体育产业板块异动拉升	未
国办发通知：将督查激励措施由24项增至30项	未
国办：对真抓实干成效明显地方进一步加大激励支持力度	未
国办：将督查激励措施由24项增至30项 加大对地方激励支持	未
国办：继续推进国有经营性文化事业单位转企改制	未
国办表扬典型经验做法  千万工程等5项浙江经验在列	未
国办:调整督查激励措施 加大对地方支持	未
国办:调整督查激励措施 向基层倾斜	未
国办：调整督查激励措施 向基层倾斜	未
国办转发《中国传统工艺振兴计划》	未
国办通报表扬！安徽这2市上榜	未
国办通报表扬长治潞州区：沃土育出双创花	未
国务委员兼外交部长王毅介绍中美元首会晤情况	未
国务委员兼外交部长王毅向中外媒体介绍中美元首会晤情况	未
　　——国务委员兼外交部长王毅谈习近平主席访问西班牙、阿根廷、巴拿马、葡萄牙并出席二十国集团领导人第十三次峰会（1）	未
　　——国务委员兼外交部长王毅谈习近平主席访问西班牙、阿根廷、巴拿马、葡萄牙并出席二十国集团领导人第十三次峰会（2　全文完）	未
国务院：2025年体育竞赛表演产业规模达2万亿元	未
国务院关于上海市进一步推进“证照分离”改革试点工作方案的批复	未
国务院关于加强质量认证体系建设促进全面质量管理的意见	未
国务院办公厅关于加快发展体育竞赛表演产业的指导意见	未
国务院办公厅关于印发促进科技成果转移转化行动方案的通知	未
国务院办公厅关于印发文化体制改革中经营性文化事业单位转制为企业和进一步支持文化企业发展两个规定的通知	未
《国务院办公厅关于完善国家级经济技术开发区考核制度促进创新驱动发展的指导意见》解读	未
国务院办公厅关于对真抓实干成效明显地方进一步加大激励支持力度的通知	未
国务院办公厅关于推进农业高新技术产业示范区建设发展的指导意见	未
国务院办公厅关于推进电子商务与快递物流协同发展的意见	未
国务院办公厅关于支持社会力量提供多层次多样化医疗服务的意见	未
国务院办公厅印发《关于加强电梯质量安全工作的意见》 落实房屋建设单位主体责任	未
国务院办公厅印发《关于加快发展体育竞赛表演产业的指导意见》	未
国务院办公厅印发《关于完善支持政策促进农民增收的若干意见》	未
国务院办公厅印发《深化医药卫生体制改革2017年重点工作任务》	未
国务院办公厅印发《老年教育发展规划（2016－2020年）》	未
国务院办公厅发出通报：表扬新疆阿勒泰地区大力推进旅游消费	未
国务院办公厅通知！事关每个人的切身利益！	未
国务院：加大对民营经济和中小企业支持	未
国务院：加快发展体育竞赛表演产业 到2025年产业规模达2万亿	未
国务院印发《关于做好当前和今后一个时期促进就业工作的若干意见》	未
国务院印发《关于支持自由贸易试验区深化改革创新若干措施的通知》	未
国务院印发《“十三五”促进就业规划》	未
国务院印发《“十三五”卫生与健康规划》	未
国务院印发《“十三五”国家信息化规划》	未
国务院印发《“十三五”推进基本公共服务均等化规划》	未
国务院印发《“十三五”深化医药卫生体制改革规划》	未
国务院印发《“十三五”现代综合交通运输体系发展规划》	未
国务院印发《“十三五”生态环境保护规划》	未
国务院印发《国家教育事业发展“十三五”规划》	未
国务院印发《意见》 做好当前和今后一个时期促进就业工作	未
国务院印发意见促进就业	未
国务院印发《意见》鼓励社会力量兴办教育促进民办教育健康发展	未
国务院印发指导意见“互联网+政务服务”提速	未
国务院印发方案  全面深化上海自贸试验区改革开放	未
国务院印发规划  “十三五”国家老龄事业发展目标确定	未
国务院参事室副主任：聚焦改革开放需把握四个坚持	未
国务院参事室副主任：聚焦改革开放需把握好四个“坚持”	未
国务院参事室社会调查中心发布中国社会变迁课题成果(图)	未
国务院参事点赞！重庆市上报的31个黑臭水体整治完成率为100%	未
国务院参事：长江经济带发展是硬道理，保护也是硬道理	未
国务院反垄断委员会专家黄勇：中国竞争政策走向成熟	未
国务院发布关于做好当前和今后一个时期促进就业工作的若干意见e公司讯，国务院发布关于做好当前和今后一个时期促进就业工作的若干意见。意见指出，发挥政府性融资担保机构作用支持小微企业。充分发挥国家融资担保基金作用，引导更多金融资源支持创业就业。各地政府性融资担保基金应优先为符合条件的小微企业提供低费率的担保支持，提高小微企业贷款可获得性。加大稳岗支持力度。对不裁员或少裁员的参保企业，可返还其上年度实际缴纳失业保险费的50。	未
国务院发布新一轮东北振兴战略	未
国务院：发挥政府性融资担保机构作用支持小微企业	未
国务院发文明确支持申办世界杯 最好时机恐怕是2034年	未
国务院发文"稳就业" 北上广等6市劳动需求增加	未
国务院发文"稳就业" 研究称北上广等6市劳动需求增加	未
国务院召开全国安全生产电视电话会议 马凯出席并讲话	未
国务院国资委：坚决打赢处僵治困攻坚战  夯实企业高质量发展基础	未
国务院增加督查激励措施 进一步加大对地方激励支持力度	未
国务院：大力发展职业赛事 积极培育冰雪体育赛事国务院办公厅印发关于加快发展体育竞赛表演产业的指导意见，到2025年，体育竞赛表演产业总规模达到2万亿元，基本形成产品丰富结构合理基础扎实发展均衡的体育竞赛表演产业体系。鼓励银行保险信托等金融机构研发适合体育竞赛表演产业发展特点的金融产品和融资模式。实时快讯	未
国务院：实施所得税优惠促进创业投资发展	未
国务院将实施30项督查激励措施 进一步加大激励支持力度	未
国务院常务会议决定实施所得税优惠促进创业投资发展 加大对创业创新支...	未
国务院常务会议决定延续和完善跨境电子商务零售进口政策并扩大适用范围等	未
国务院常务会议：加大对民营经济和中小企业支持	未
国务院常务会议：实施所得税优惠促进创业投资发展从明年1月1日起，对依法备案的创投企业，可选择按单一投资基金核算，其个人合伙人从该基金取得的股权转让和股息红利所得，按20税率缴纳个税或选择按创投企业年度所得整体核算，其个人合伙人从企业所得，按535超额累进税率计算个税。	未
国务院常务会议部署加大对民营经济和中小企业支持等	未
国务院扶贫办主任率队参观改革开放40周年展：继续真抓实干	未
国务院扶贫办党组书记、主任刘永富：把握精神实质 决胜脱贫攻坚(图)	未
国务院扶贫办发布《企业扶贫蓝皮书（2018）》	未
国务院扶贫办社会扶贫司司长曲天军率队到丹寨调研	未
国务院扶贫办:贫困县摘帽不得搞庆祝活动	未
国务院批转《关于2017年深化经济体制改革重点工作的意见》	未
国务院放大招 税收优惠刚落地创投圈就沸腾了	未
国务院教育督导办发话了：确保学校周边及交通安全！	未
国务院新闻办发表 《改革开放40年中国人权 事业的发展进步》白皮书	未
国务院新闻办发表《改革开放40年中国人权事业的发展进步》白皮书	未
国务院：继续推进国有经营性文化事业单位转企改制	未
国务院金稳会：当前资本市场风险得到较为充分的释放，已经具备长期投资价值国务院金融稳定发展委员会办公室召开资本市场改革发展座谈会。会议认为，当前资本市场风险得到较为充分的释放，已经具备长期投资价值，改革面临比较好的有利时机。下一阶段，要坚决落实市场化原则，减少对交易的行政干预。要借鉴国际上通行做法，积极培育中长期投资者，畅通各类资管产品规范进入资本市场的渠道。监管部门要加强与市场沟通，积极倾听市场声音。	未
国务院金融委办公室召开资本市场改革与发展座谈会	未
国务院金融委办公室：推动尽快启动永续债发行	未
国务院金融委办公室：资本市场已具备长期投资价值	未
国务院金融委召开资本市场改革与发展座谈会	未
国务院金融稳定发展委员会办公室召开资本市场改革与发展座谈会	未
国务院金融稳定发展委员会办公室召开资本市场改革与发展座谈会12月20日，人民银行副行长国务院金融稳定发展委员会办公室副主任刘国强主持部分商业银行证券公司保险机构信托公司基金公司负责人座谈会，听取对当前资本市场改革发展的意见建议。银保监会证监会有关负责同志出席会议。与会 ...全文	未
国务院金融稳定发展委员会办公室召开资本市场改革与发展座谈会会议认为：当前资本市场风险得到较为充分的释放，已经具备长期投资价值。希望领导们再顺着这个思路想下去，既然已经具备长线投资价值为什么A股还在跌跌不休既然已不是估值问题，那是不是资金面出了问题流动性方面出了问题那是不是在 ...全文	未
国务院降创投企业税负，专家：更符合其“商业模式”	未
国务院：鼓励符合条件文化企业进入中小企业板等融资	未
国务院：鼓励符合条件文化企业进入中小企业板融资	未
国务院：鼓励金融机构研发适合体育产业的金融产品体育要搞起的样子！	未
国务院：鼓励金融机构研发适合体育竞赛表演产业发展特点的金融产品和融资模式	未
国务院：鼓励银行保险信托等金融机构研发适合体育竞赛表演产业发展特点的金融产品和融资模式国务院办公厅印发关于加快发展体育竞赛表演产业的指导意见，完善相关投入机制。推动体育竞赛表演产业与资本市场对接，引导社会力量参与，鼓励社会资本设立产业发展投资基金。鼓励银行保险信托等金融机构研发适合体育竞赛表演产业发展特点的金融产品和融资模式，进一步拓宽体育竞赛表演机构的融资渠道。充分利用现有资金渠道，对相关项目给予必要资助。鼓励有条件的地方通过体育产业引导资金等渠道对体育竞赛表演产业予以必要支持。	未
国医古方养生：阿胶怎么吃都没用，怎样才算好膏滋！	未
国博举办李苦禅诞辰120周年艺术展学术研讨会	未
国博展讯  都  城我们与这座城市开幕	未
国博“文心万象——中国古代文人的绘画与生活”展览在塞尔维亚举行(组图)	未
国台办：2018两岸企业家峰会年会成果体现经济合作对两岸同胞有利	未
国台办：“31条惠台措施”的落实和推进取得显著效果	未
国台办：上海-台北双城论坛即将举行 希望不断加强两岸城市交流合作	未
国台办，不支持不反对不表态最好，让烂党自己揣摩，拿行动说话。结果喝了鸡血一样，凌晨连夜表态献媚。。一下子就让烂党看穿了。。唉//@盒心高地6785182357:国台办这帮孙子真没出息，这点鸟事就猴急冲动的表现表演，跳入坑中，唯恐他人不知道他们在做事似的，活该被骂。	未
国台办：两岸“三通”十周年 实现了两岸“一日生活圈”	未
国台办：两岸企业家峰会年会成果体现经济合作对两岸同胞有利	未
国台办：两岸工商界在合作受益中不断走近走实	未
国台办：“九二共识”是两岸关系和平发展的共同政治基础	未
国台办介绍《山东省台胞投资保护条例》有关情况	未
国台办发言人：团结广大台湾同胞，走两岸关系和平发展道路	未
国台办发言人谈大陆热播剧 “点赞”导演和主要演员都来自台湾	未
国台办：台湾同胞可享受新个税法优惠安排	未
国台办：《告台湾同胞书》在两岸关系发挥历史性、指导性作用	未
国台办回应林毅夫入选“100名改革开放杰出贡献拟表彰对象”	未
国台办回应韩国瑜认同“九二共识”：欢迎在此基础上增进两岸城市交流	未
国台办：团结广大台湾同胞 走两岸关系和平发展道路	未
国台办:团结广大台胞,走两岸和平发展道路	未
国台办：在对两岸关系性质有正确认知基础上加强两岸城市交流合作	未
国台办：坚持“九二共识” 坚定不移为两岸同胞谋福祉	未
国台办：惠台“31条”实施近1年 千家台企享税收优惠	未
国台办:欢迎台更多县市参与两岸城市交流	未
国台办：欢迎高雄等台湾更多县市参与两岸交流合作	未
国台办：欢迎高雄等更多台湾县市参与两岸城市交流合作	未
国台办评“三通”十周年：坚持“九二共识”，两岸交流合作就能不断深入	未
国台办谈“九合一”选举后大陆对台政策：继续坚持九二共识	未
国商控股：多举措化解民企融资难题 有力支持实体经济	未
国商控股：深度践行“实业兴邦”的企业使命	未
国土增绿，排出时间表 大规模国土绿化行动开启日前，全国绿化委员会国家林业和草原局印发《关于积极推进大规模国土绿化行动的意见》，明确国土绿化时间表路线图到2020年，全国森林覆盖率达到23.04，村庄绿化覆盖率达到30，草原综合植被盖度达到56，国土生态安全屏障基本形成到2035年，国土生态安全骨架基本形成，生态状况根本好转，美丽中国目标基本实现到2050年，生态文明全面提升，实现人与自然和谐共生。国土增绿，排出时间表 大规模国土绿化行动开启	未
《国土安全》我最喜欢的其中一点就是谈判台词，大多是开门见山，先问what do you want，然后再看自己能不能给值不值得给。可以就deal，不可以就fuck you，这才是优秀的沟通方式。	未
国土部出台养老设施用地政策	未
国外79岁老爹用《Wii Fit》健身 坚持时长高达3186天今日，Reddit用户AmbivalenceForNow向网友们分享了自己79岁老爹用体感游戏《Wii Fit》健身的经历。他表示自己79岁的父亲几乎每天早上都要用《Wii Fit》锻炼身体，并晒出截图表示他已经坚持了3186天了，按照一年365天来算，这位老爹已经用《Wii Fit》健身超过了8年时间。不少网友开玩笑称自己甚至都不能保证每天可以按时醒过来（俺也一样）也有网友调侃到：没想到你的Wii还能用啊《Wii Fit》总共包	未
国外一个父亲得知自己的儿子遭受校园霸凌，采用不同的方式去解决问题，结局很暖。收获大量称赞	未
国外一位网友本想发信息问朋友关于穿搭的意见，结果不小心发给了陌生人，收到的这个回复也是很暖很可爱了	未
国外一监控摄像头拍到的，一只路过的大象看到地上有垃圾，竭力把垃圾扔进垃圾箱！给大象点个赞！！	未
国外专业车迷手绘F1剖面图 今日体坛	未
国外名模惊现米脂中瑞雄雁购物中心，速来围观！！！	未
国外大学科普攻略  你不知道的南安普顿大学...	未
国外媒体体验自动驾驶出租车Waymo One：稳如老司机当地时间周三，Alphabet旗下的自动驾驶公司Waymo在美国亚利桑那州凤凰城郊区正式推出了首个商业自动叫车服务Waymo One。科技媒体记者在该公司推出自动驾驶出租车前一周亲自进行了试乘详情点击：网页链接	未
国外新生儿现场拍摄视频-使用技巧！	未
国外新闻外景拍摄排污管道内探头而出的神秘生物！	未
国外最近挺火的鲨鱼石，据说看到30s内转走会有好运	未
国外爆料达人 allthenewsisgoodnews 又从客户端文件中挖出了一大波雪地饰品皮肤以及枪械皮肤，绝地暖暖	未
国外玩家互相玩梗：向新手推荐能造墙的亚索一名堡垒之夜玩家来到英雄联盟的Reddit发帖是时候成熟了，我要放弃堡垒之夜来玩英雄联盟，堡垒之夜在国外的刻板印象是小学生游戏，非常受到低龄（十岁左右）小朋友们的喜爱。最高赞评论给他推荐了两个英雄：艾翁和亚索。艾翁的理由是：可以建造草丛，和堡垒之夜里能藏人的草丛一样。和堡垒之夜里的人一样有个护盾。如果你一个人玩LOL感到孤单的话，甚至还有个伙伴可以carry他。西部牛仔亚索的理由是：可以造风墙，还有子弹。还有个刺刀枪。还喜欢飞。游戏V势力	未
国外的一个加湿器......酷炫得简直丧心病狂啊。戳 （via 豆友小野二的广播：网页链接）	未
国外的一位博主根据手中的迷你版模型，全世界实地打卡，实名羡慕了。	未
国外的圣诞相当于我们的新年了吧	未
国外知乎网站Quora上关于怎样才能成为学霸	未
国外网友 Eldroch 分享了他自己制作的《传送门》BOSS GLaDOS 形象的吸顶灯。真的是太强了	未
国外网友拍到一位老爷爷手拿鲜花等待老奶奶的一幕，老爷爷衣服穿的很潮啊！这才是嫁给爱情的样子！	未
国-外网友拍到一位老爷爷手拿鲜花等待老奶奶的一幕...这才是嫁给爱情的样子！	未
国外豪开布加迪上山，上山开车下山拖车，维修费可买保时捷！	未
国大药房 家用电子体温计温度计，券后9.9家里没有的一定备一个，全身防水，还带记忆功能哦一眼就能看出体温升高还是下降了	未
国子策吴小平：相比个税减税 发放代金券是一个更加高效的温和刺激政策吴小平建议可以考虑发放大面积购物券(代金券)。购物券刺激最直接，最精准，最到位。各国经济学专家都对发放购物券的实践做过研究，整体效果和反馈是比较正面积极的。因为这是一个把购物权力全部交给穷人（或者说适格接受者）的政策，这种开支最不浪费，最具有信号作用。国子策吴小平：相比个税减税 发放代金券是一个更加高效的温和刺激政策	未
国学新八德教育宣讲走进平安乡小学校园	未
国宅风范荣盛华府最后一批双拼联排，即将盛大开盘，敬献蓟州	未
国安足协杯夺冠，进球功臣张稀哲：现在还是蒙的状态	未
国宝1977年12月21日，山东省临沭县常林大队女社员魏振芳发现1颗重158.786克拉的优质巨钻，全透明，色淡黄，可称金刚石的中国之最。魏振芳将它献给国家。上级召开千人庆功大会，给魏振芳披红戴花，奖给她千元奖金，给她办理了农转非户口，安排她到八O三矿当了工人，奖给常林大队24马力拖拉机一台。	未
国宝亲你一下 微博视频	未
国宝人寿吉祥物征名活动 你觉得这两只熊猫该叫什么呢抽5位送200新年红包，被选中的名字，还有10000元现金奉上，共游熊猫基地一盘。取名玄学还不快用起来	未
国宝回家!苏轼唯一真迹回归祖国 拍得4.636亿港币	未
国宝带你游多彩贺州  扬帆新时代 锦绣新广西	未
国宝级文物修复师：让千年织物重现往昔光华	未
国宝《赵城金藏》500卷真经回归洪洞广胜寺啦！	未
国家17部门联合出台促进乡村旅游可持续发展指导意见	未
国家5A级景区 海螺沟 高薪招聘	未
国家中医药局第六期中医医院职业化管理高级研修班结业，我省一名院长获表彰	未
国家主席习近平抵达布宜诺斯艾利斯	未
国家互联网金融安全技术专家委员会秘书长吴震: 金融科技需要安全和发展并重	未
国家京剧院2018年重点复排剧目《劫魏营》在京上演	未
国家京剧院再次启动“名师传艺”  于魁智李胜素等将传艺青年演员	未
国家京剧院再次启动“名师传艺” 于魁智李胜素等将传艺青年演员	未
国家京剧院启动第二批“名师传艺”	未
“国家从未忘记”——香港在国家改革开放中的重大贡献	未
国家体育总局冬季运动管理中心综合训练馆“冰坛”封顶	未
国家体育总局副局长杜兆才获提名参选亚足联副主席	未
国家体育总局解读《关于加快发展体育竞赛表演产业的指导意见》	未
国家使命，在召唤！	未
国家保护知识产权的力度越来越大//@陇海路夜未眠:郑州皮皮鲁餐厅改名了，这是法制的胜利	未
国家信息中心发布《2019年医药行业发展报告》 明年医药制造业固定投资额将达6782亿元《报告》展望，2019年医药行业投资增速将继续上升。初步估计，2019年医药制造业固定资产投资额将达到6782亿元左右，同比增长约10。《报告》预计，2019年受医药行业改革政策驱动，医药并购活动将继续保持活跃，二 ...全文	未
国家信访局局长人民日报撰文：开创新时代人民信访工作新局面	未
国家公交都市建设示范城市正在公示中！银川上榜！	未
国家公共信用信息中心到我县西刘庄村结对共建活动	未
国家公祭以国之名，祭奠亡灵！今天，全国19家纪念馆将联动公祭国家公祭日	未
国家公祭 勇士们，永垂不朽......国家公祭日	未
国家公祭在即 南京大学生上演《东京审判》铭记历史	未
国家公祭在即 南京奏响和平之声	未
国家公祭撞响和平大钟，勿忘国耻！	未
国家公祭日10点01分，南京防空警报划破上空，机动车停驶鸣笛行人驻足默哀。即便此刻阳光明媚，勿忘过去黑暗沉沉。1937年的今天是这座城市最惨痛的印记，国家公祭为南京大屠杀遇难同胞默哀	未
国家公祭日 12月13日国家公祭日当天，南京地铁公交均有调整！	未
国家公祭日 一年前的节目，纪念依然	未
国家公祭日不忘历史，守望和平。让我们一起点亮紫金草，让和平之花绽放心间。	未
国家公祭日 不忘国耻，铭记历史，守望和平。	未
国家公祭日 为公祭日保驾护航12月13日，国网南京市高淳区供电公司用电检查班为高淳老街新四军第一支队司令部纪念馆举行的公祭日活动进行保电，确保公祭日活动顺利进行。	未
国家公祭日之记忆传承：我的母亲李秀英	未
国家公祭日今天，南京大屠杀死难者国家公祭日！我们爱好和平，但永不遗忘！转发祭奠同胞，祈愿和平	未
