自从学会这个方法，15分钟就能煮好一锅粥，冬天的早晨再也不用早起了！	未
自从梦幻西游嘉年华大爆料的大爆料后，新等级，新地图，新宠物，专属内丹，珍兽新时装，新神兽灵儿简直一本满足！！那么问题来啦，热爱梦幻西游手游的你最关心哪个爆料呢快在评论区和大家讨论起来叭！	未
自从用上华为冬天的电量也是实打实的，不会虚电，这点特别实用。不知道现在最新的iphone是不是电池也好了	未
自从知道了微博故事会根据热度互动发红包以后，我决定以后有空就多发发微博故事你们多跟我互动互动，点个赞评个论啥的，然后我收到浪浪给的红包以后再把红包都发给大家！这么一套下来，等于是大家跟我互动，给自己赚钱，真是个小机灵鬼呢hhh刚才给大家发了红包，你们的手速真的太快了我自己刚发完点进去一看就已经没了。不过没抢到的小姐妹们也别不开心啦！我以后还会发的，而且抢红包怎么说呢！就是图个开心对不对！抢到了会觉得自己很幸运，没抢到也没啥，别不开心	未
自信自强 笃定前行 大型政论片《必由之路》主题歌《梦想阳光》发布	未
自信自强 笃定前行 大型政论片《必由之路》主题歌《梦想阳光》发布	未
自创节奏术，狂野稳步低保不是梦	未
自制2000多个零部件 四川高校学子纯手工打造港珠澳大桥模型	未
自制捕鼠神器，一晚可抓很多只	未
自制的肉松最放心	未
自制辣条几块钱一把的腐竹，这么操作，轻轻松松变辣条！既可下饭，还可作零食很得劲！	未
自加压力，雷厉风行！他和团队共同推进全域土地综合整治	未
自动化锻造 //@机械科技:锻造	未
自动挡技术成熟，手动挡车还有存在的必要吗 自动挡技术成熟，手动挡车还有存在的必要吗	未
自动挡的车到底怎么开别越搞越复杂了，戳图看看，只要记住以下7点，你就能驾轻就熟！get	未
自动挡的车到底怎么开别越搞越复杂了，戳图看看，只要记住以下7点，你就能驾轻就熟！get 更多精彩内容，可以进我微博看！	未
自动驾驶安全需多方参与，中国标准有望引领世界	未
自助开放夜间不打烊！龙游新增两个高人气去处	未
自助找券：网页链接女装：网页链接美妆：网页链接男装：网页链接零食：网页链接家居：网页链接母婴：网页链接文体：网页链接数码：网页链接还是找不到想要的就留言或私信吧，百科会努力完成宝宝们各种需求	未
自助滑梯 微博视频	未
自助餐泡泡秀小丑表演魔术大型亲子活动即将在富源启动！	未
自发热暖足贴20片 1.7！！！买不了吃亏买不了上当！！可以买个保暖！！	未
自发热暖足贴20片 卷后1.7自发热暖足贴20片 卷后1.7自发热暖足贴20片 卷后1.7	未
自古深情留不住 唯有套路得人心红人的诞生V影响力峰会	未
自古红蓝出cp，可口可乐百事可乐合体！这些味道，你喝过哪些	未
“自古脑洞得人心”，徐福记电商一招圈粉年轻人无数	未
自古评论出人才	未
自在田园 骑乐无穷 深圳坪山华侨城龙田文旅小镇自行车嘉年华	未
自备饮料！	未
自女子蝇量级创立之初，她就被认为是未来的量级统治者，明天是否会是子弹王朝的开始点赞如果你支持舍甫琴科夺冠！UFC231  明早9:00副赛/11:00主赛  @PP体育 @BesTV百视通 直播	未
自如发力集中式长租公寓  力推“整栋托管”合作模式	未
自如：延续稳租金措施 全国续约平均涨幅不超5%	未
自定义婚照主题风格潮爆无穷尽深圳客户：@花期遇雨欲语却不遇你	未
自尊自爱，自由自在。	未
自己交社保，怎么交才最合适，最划算	未
自己做份一人餐！ 微博视频	未
自己做，更卫生！	未
自己做，更卫生	未
自己做珍珠奶茶，喝着更放心	未
自己做的更卫生	未
自己刷墙步骤是什么 简单5步让你在家也能刷墙	未
自己动手做的更有意义！	未
自己发的红包可以抢吗我刚刚在自己发的红包你会抢吗pk中，选择了不会，怕抢个手气最佳，然后还得再发一个快进入话题表态吧！自己发的红包你会抢吗	未
自己喜欢的东西就不要问别人好不好了自己喜欢就行开心就行	未
自己在家做一盘简单美味的炒面	未
自己收了学着做做看吧	未
自己没承担养育的责任，就不要想得到回报了	未
自己还没转，谢谢何总	未
自己门市来了一位陌生老人，乐山小伙儿这样做，让人竖起大拇指！	未
自带光环的你不容错过-全城寻找会发光的舞者	未
自带圣光的猫	未
自带流量的小米Play，梦幻蓝，暮光金	未
自带潜水动力装置	未
自带过滤PM2.5功能！西安300辆纯电动公交投放	未
自带雷达的招风耳 （转）V影响力峰会红人的诞生	未
自帶輸入法也可以好方便，我現在發微博都直接用語音的 查看图片 //@鲩鱼：微信有语音输入的功能，有普通话和粤语版本的，说得标准一点都能识别，有时真的懒得打字	未
自建机场中转站！亚马逊向快递业迈出重要一步亚马逊上周宣布，计划在得克萨斯州的沃斯堡联盟机场自建一个地区性航空枢纽，为一些每日航班和包裹分类的基础设施提供支持这对老牌快递巨头UPS 和FedEx 构成了威胁自建机场中转站！亚马逊向快递业迈出重要一步	未
自强不息，奋勇向前体育V势力	未
自强达人秦春娟：坐在轮椅上的她挥着隐形的翅膀追逐梦想	未
自我事业家庭如何管理巾帼法律人齐聚 春华秋实 交流秘籍	未
自我完善的过程	未
自我实现者的十四个特质	未
自打有了孩子，各种大大小小的节日，我都格外重视，没别的，就希望孩子高兴，他们的日子，有我的存在，能变的有期盼，有温度，再累我都乐意去做这些年，每到圣诞总有人问我圣诞树的事儿，但之前我买的质量不是太满意，不敢轻易推荐，我自己也一直在寻找，今年才找到我真正心仪的： ...全文	未
自打有了孩子，各种大大小小的节日，我都格外重视，没别的，就希望孩子高兴，他们的日子，有我的存在，能变的有期盼，有温度，再累我都乐意去做。这些年，每到圣诞总有人问我圣诞树的事儿，但之前我买的质量不是太满意，不敢轻易推荐，我自己也一直在寻找，今年才找到我真正心仪的：网页链接 lt戳 精致的，看起来不大，但特能盛的圣诞情侣马克杯。质感超棒，又萌又暖的鹿角保温杯。不用自己费心搭配的，能用好多年的圣诞树套装。装扮家的，送朋友的，送孩子的圣诞好物，我都想到了，就酱紫吧，好好享受生活里的每一个小温暖吧。	未
自有喜相逢。	未
自有奇逢佳境。	未
自杀式单身快消品隐形贫困人口万能好运绝缘体90后新词汇了解一下	未
自治区优秀民营企业拟表彰名单公示 有乌海这些企业！	未
自治区创特验收组到我县开展评定工作	未
自治区十三届人大一次会议开幕	未
自治区召开座谈会 集中治理诚信缺失问题提升全社会诚信水平	未
自治区召开第八批中央和国家机关 中央企业援疆工作总结表彰大会	未
自治区成立60周年4天小长假！容县侬，帮你悭钱！	未
自治区文明单位候选单位文明村镇候选村镇出炉！林芝市入围名单点这里	未
自治区春节藏历新年电视联欢 晚会协调领导小组召开会议	未
自治区爱国卫生工作现场会与会人员在东胜观摩	未
自治区纪委监委制定办法 鼓励主动交代问题和投案自首	未
自治区纪委驻商务厅纪检组举办党规党纪知识竞赛	未
自治区通报对我市食品安全满意度调查结果：主要指标达到示范创建标准	未
《自然》发布年度十大人物 贺建奎以"反面"人物入选	未
《自然》年度十大人物:贺建奎作为＂反派＂入选	未
《自然》：最新研究称格陵兰岛冰盖融化已达到极速	未
《自然》杂志刊登我国科学家最新研究成果 首次在三维空间发现量子霍尔效应	未
自然界对雄性极不友好。第一，雄性都要通过激烈的竞争甚至打斗，赢家才有机会入帷。第二，赢家通常都会贿赂雌性，比如屎壳郎（蜣螂）会迅速地卷一个大粪球，送给雌性，边卷边抖动，表示：你看我力气真大！我能提供给你好多的粪球！其他大部分的昆虫，有的是头部有裂缝，能分泌出一种珍贵的蛋白质，雌虫抓住它边交配边吃，有的是设法抓住一个昆虫，包裹在唾液粘液里，送给雌性。雌虫吃的时候，它赶紧利用机会。有意思的是，它能捕获的猎物越大，雌虫吃的时间越久，它得到的交配时间越长。要是没有猎物昆虫呢就是说，没本事贡献礼物的呢嘿嘿，	未
自然笔记  与岩松鼠相伴相约的日子	未
《自然》网站评出2018年重大科学事件，克隆猴等上榜	未
自然而亲密的交流--记台湾“棒球小子”入住深圳家庭	未
自然+艺术+教育 溧水虫子谷国际艺术村项目启动	未
《自然语言生成：让机器掌握自动创作的本领 - 开放域对话生成及在微软小冰中的实践》by 武威 网页链接 pdf:网页链接	未
自然资源部第二海洋研究所 李家彪院士：边缘海地质研究我国大洋中脊调查研究中国大陆架划界技术理论体系  附专访视频	未
自然资源部自然资源确权登记局局长冷宏志：抓紧启动不动产登记法立法，为税收征管提供依据冷宏志透露，要不断巩固和提升不动产统一登记成果，抓紧启动不动产登记法立法通过不动产统一登记，最大限度避免企业和群众私权的重登漏登权利交叉重复，保护合法权益保障交易安全要完善自 ...全文	未
自然资源部调研大关脱贫攻坚等工作	未
《自然》选出十位中国科学之星	未
自然醒 Real Love将来终有一天，当一年过去了三分之一，当太阳和月亮在天空相遇的时候，我们也将从海里上岸，接着走，忠实于祖先的誓言在最寒冷的冬天，我们会回到这里跳舞，然后继续帝企鹅的征途！电影帝企鹅日记图  南极企鹅摄  王少青	未
自然醒 乐观是希望的明灯，它指引着你从危险峡谷中步向坦途，使你得到新的生命新的希望，支持着你的理想永不泯灭。达尔文图  挪威罗弗敦群岛	未
自然醒 穿山虎居延城外猎天骄，白草连山野火烧暮云空碛时驱马，秋日平原好射雕护羌校尉朝乘障，破虏将军夜渡辽玉靶角弓珠勒马，汉家将赐霍嫖姚出塞作王维（唐）图  内蒙古达里诺尔湖西北岸的火山锥摄  杨孝	未
自由式滑雪U型场地国家集训队B组开启新周期训练	未
自由式滑雪空中技巧国家集训队备战北京冬奥周期揭幕战	未
自由恋爱！飞地经济签下沈城第一单	未
自由行与团游 不同，除了能根据自己的喜好选择自己想看的美景想尝的美食外，还可以深入市井体验不一样的风土人情，感受中华民族的另一种可能性。小编整理了17条自由行粉丝总结的台湾特色，没想到这些宝岛的日常居然也会让大家觉得很特别呢！不知道您是否也有同感呢具体请看评论链接	未
自由行买一送一！周末出国海边度假去！机票酒店签证都包含！	未
自由行血泪史！北海道道东：大地尽头的雪国秘境好玩吗	未
自由贸易，惠及百姓。	未
自留的大象灰lindy先试背几天哈你们的大货很快就可以上啦	未
//@自种天然:华贵之鸟	未
自称“认识中组部领导”，厅官为谋副省级待遇送上4008万	未
自缚手脚 交换人质 以命换命漯河这名特警感动一座城，背后有何故事	未
[自罚三杯才愿意分享出来的高级灰粉系列！！]什么都不多说质感好的要溢出屏幕评赞抽2位感受同款[小仙女] 暴走的萝莉秋冬压缩收	未
自衛隊2017年度綜合訓練概要出台	未
自豪！爸爸妈妈为我戴上大红花12月5日，陆军第七十四集团军某新兵旅邀请数十名家长代表走进新兵新训比武考核表彰大会现场家长代表在全体官兵的注视下，亲手为自己的孩子戴上大红花，并颁发奖牌和证书（周怡  丁立敏   徐金鑫）	未
自贡一中初中部已修成了这样，附现场图！	未
自贡交通新规划出炉，这里新增两个大型汽车枢纽站！	未
自贡市委政法工作会议：奋力开创政法工作新局面	未
自贡彩灯来到法国，海外规模最大中国彩灯节开幕	未
自贡村官：不忘初心 筑梦立志春风化雨沐华夏，改革开放乘东风初心，可能是一份远大的志向，世界能不能变得更好，我想要去试试，初心，可能是一份简单的愿望，凭知识改变命运，靠本事赢得荣誉。@四川共青团村官感悟四川自贡村官：不忘初心 筑梦立志	未
自贡的小朋友停车都非常有规矩，大人们可别落后哦！@四川共青团 图源@自贡市贡井区交警大队	未
自贡身边事 城市V聚力 来一睹清代民居大宅的真容V影响力峰会 //@自贡同城:	未
自贡银行：畅通政银合作渠道 搭建银企合作桥梁	未
自贸区为改革开放配置“高功引擎”	未
自贸区：从五年深耕读懂中国开放	未
自贸区成对外开放新名片  促区域经济协同发展	未
自贸区成对外开放新名片 促区域经济协同发展	未
自贸区改革53条出台 支持个人投资境外证券	未
自贸试验区建设五周年上海自贸区：深耕试验田 创新不停步2017年11月17日，上海浦东新区行政服务中心一楼大厅，多了一块铭牌找茬专窗政府邀市民来找茬，表明自己积极向市场市民拜师求艺，也意味着政府改革不是闭门造车这5年，上海自贸区还做了哪些探索呢请看  ...全文	未
【自贸试验区建设五周年】河南自贸区：构筑中部改革开放前沿	未
【自贸试验区建设五周年】 辽宁自贸区：打造东北振兴新引擎	未
自采自产自销，衡阳人自己的品牌果脯，绝对原生态！晚报君请客恰！	未
自闭症小伙画画救父 现已成家里顶梁柱一年前，一元购画火爆网络，一群特殊的残障孩子因为他们的画作而为人们关注，现年24岁的自闭症小伙李捷麟就是其中之一。09年，父亲患重疾，母亲带着捷麟从汕头来到广州为父亲治病，捷麟的画家潜质意外被人发现，命运就此发生改变。不仅被签约，有稿费 ...全文	未
自闭症小伙画画救父 现已成家里顶梁柱一年前，一元购画火爆网络，一群特殊的残障孩子因为他们的画作而为人们关注，现年24岁的自闭症小伙李捷麟就是其中之一。09年，父亲患重疾，母亲带着捷麟从汕头来到广州为父亲治病，捷麟的画家潜质意外被人发现，命运就此发生改变。不仅被签约，有稿费有工资，还开设画展。近年来，他父亲两次病重，在家中已负债累累之时，正是他救了父亲的命。从负担变成骄傲，如今，他已成了家里的顶梁柱，几乎一家的开销都从他的画作和工资中产生。（秦松 陈忧子）网页链接	未
“自首”：2018年反腐最热关键词	未
自首了//@可可的QQ空间:蒋先生可以早日自首吗	未
自首图出了！ 查看图片	未
自驾川藏318国道那些不可错过的风景，你想知道的这里都有！	未
自驾川西丨行走在云端的日子里，和你看一场秋天的童话	未
自驾招募！12.1日49元兰陵宝山前野生动物园自驾游	未
自驾挪威，在极夜中追寻极光	未
自驾探秘徐霞客游记开篇地！还有森林温泉，国家级健身步道，古老石头村等你来寻	未
自驾攻略  两人一车一世界，车轮上的湖泊与山林	未
自驾攻略台湾全景全海拨落地环岛悠闲自驾独享台湾慢生活	未
自驾攻略雪乡虎峰岭查干湖自驾之旅	未
自驾游车主请注意这两个时间段，景德镇所有路面划线公共停车位免费！	未
自驾环冰岛游记一边记下我们的旅程一边整理了一些干货分享给打算去冰岛旅游的小仙女 吼吼 作者：@绿旅鹿	未
自驾皖南川藏线，您又多了一条绿色旅游通道！	未
至2020年，宁波杭州湾新区将新增菜市场11处！	未
至少还有每一次相遇值得我们去期待好事总会发生在下个转弯	未
至强对阵职业选手精彩集锦胖虎又发现了一个技术hin强的小哥哥不知道小哥哥还收徒弟吗	未
至所未致午夜阳光下的格陵兰	未
至此高端有了星标准，新日星耀版正式上市	未
至爱梵高	未
@至美丝绸：虾哥星期一大盘又要狂泻了，老美又公布加关税了具体日期为3月2日晚上12:00开始！回复：慌什么慌忘了咱们都是留一手的人吗千交代万交代一定要会留一手，别把最后张牌那么急着打出去，然后你才能真正做到涨跌随意，心态特好！还有，本身咱们的海棠票都是剩下一两折不到的，还能跌到哪去来吧看谁怕谁就这！	未
至美窗景，胜却人间无数！	未
至青春，至新浪	未
致不平凡的我们，致亦平凡的我们。	未
致全体广大市民朋友的一封信	未
致全县人民的感谢信	未
致全县人民群众的公开信	未
致全市人民的一封平安信	未
致全市思想宣传战线广大工作者的倡议书	未
致全旗广大参保人员的一封信	未
致公党十五届二中全会在京召开	未
致公党十五届二中全会在北京召开	未
致力为公，四海洪门，来自全球的致公党华侨和各界朋友们相聚台北，为两岸和平发声。我作为民建的一员以陈主席朋友的身份参加。期待尽快合作，一同开拓两岸酒店市场	未
致力于实现喷气涡流纺产品少浆与免浆 京奕特纤博士后工作站开题	未
致力双提升 公安为民情刑拘在逃逛超市 行踪暴露即被捉	未
致力双提升  公安为民情民警熟知辖区情 窃贼出手就现形	未
致和我一样嘴上不会说的人！（感动）	未
致在梦想路上的你。	未
致天蝎别把自己看得太高，这个世界离开谁都行别把自己看得太低，这世上你独一无二。每个人的一生都有自己的使命，不用和别人比，好好活自己。	未
致富不忘乡亲，大龙这对夫妇太赞了	未
致富睡莲种睡莲乡野开出致富花！今晚《脱贫致富电视夜校》	未
致常宁广大粮农的一封信	未
致广大丹阳市民朋友的一封信	未
致广大游客朋友的一封信	未
致敬！11月中国好人榜发布，安阳2人上榜	未
致敬！11月中国好人榜发布，河南13人上榜	未
致敬2018杭州游泳世锦赛 默默无闻的守卫者杭州爆料 世游赛正在紧张激烈的进行中，泳坛健儿在水中劈波斩浪，但有这么一群人却在岸上日行万步。他们是杭州特警支队的民警，每天冒着刺骨寒风，全天巡守在安保岗位上，日均步行数扶摇直上，毫无悬念地破万！小编特地要来了微信步行数截图，感谢他们的付出！@杭州公安	未
致敬，22个春秋	未
致敬，28位扶贫者的生命丰碑5年，558.9万人，挥别贫困阴霾，开启美好生活！5年，28人，倒在脱贫战场，告别冲锋陷阵的热土！不负时代，不负人民！他们用生命和信仰树立扶贫战场上的精神丰碑，铸就攻坚火线上的坚实脊梁。 致敬，28位扶贫者的生命丰碑	未
致敬30岁的他用生命守护绿水青山	未
致敬40周年，看濮阳巨变，濮阳网友采风走进南乐！	未
致敬40年2001年7月，钱江新城开建。17年转瞬即逝，昔日的菜地，摇身一变，成了杭州的CBD。钱江新城的崛起之路，也是杭州从西湖时代迈向钱塘江时代的历程新地标里看改革，一起来看40年杭州巨变！网页链接	未
致敬40年 40年微电影 亲历中国铁路40年 初心这是一个铁路世家的故事，他们是铁路发展的参与者建设者和见证者，穿越40年时空，有血脉亲情，也有家国情怀，为铁路奉献一生的誓言和初心从未改变，那些传递在三代人之间有些泛黄的文字，成为铁路人奋斗和奉献的真实写照，向他们致敬！	未
致敬40年：一个伟大的时代，始于尊重人性与常识	未
致敬40年 “一棒接着一棒跑下去”	未
致敬40年丨君乐宝魏立华：奶业捍卫者，奶粉破局者！	未
致敬40年丨曹树民：13年，让光明集团更加光明！	未
致敬40年中国高铁 中国之造	未
致敬40年亲历中国铁路40年一点不差，差一点也不行的传奇故事小东站始终坚持严字当头铁的纪律，用忠诚责任担当培育和践行了一点不差，差一点也不行的小东精神，70年坚持标准不走样。	未
致敬40年亲历中国铁路40年再见！皇姑屯火车站 2017年6月27日8时至30日17时，因京沈客专工程建设需要，皇姑屯站拆除综合楼候车室。	未
致敬40年元谋公安守护的万家灯火	未
致敬40年  克明面业陈克明：做中国面条代言人	未
致敬40年公正之路100人获改革先锋称号，法律人有他们（附全名单）	未
致敬40年  华润怡宝刘洪基：百亿新畅想！	未
致敬40年四十年风雨 初心从未改变	未
致敬40年 壮阔东方潮 奋进新时代 40年车  穿越时空的中国车如果说，铁路巨变是改革开放40年的一面镜子，机车车辆升级则是铁路发展的一个缩影，一种车型，一份记忆，一款涂装，一番体验，一组组新老照片对比，绝对触动你的神经，带你回到那些与火车有关的温暖岁月	未
致敬40年 壮阔东方潮 奋进新时代 中欧班列（义乌）架起开放合作新桥梁	未
致敬40年家是一面镜子，每个人透过它，既可以了解过去，也可以看到未来，改革开放四十年祖国的变化举世瞩目，我们家庭的变化也是相当巨大哦！我家这40年主题海报第二弹来咯，团子们，一起来找找1978-2018我家这40年客厅到底发生了怎样的巨变吧@湖南卫视 @中车株洲所 @三一重工官方微博 @中联重科股份有限公司 @远大科技集团 @步步高广场湘潭店 @格力电器 @小米公司 @海信电视 @李宁官方微博	未
致敬40年工作人员宣读名单时，给予受表彰者特写或图片介绍，这是对改革者的致敬是对奋进者的激励是对创造者的推崇是对先驱者的缅怀，庄严神圣触动人心！	未
致敬40年 扶贫路上的慢火车	未
致敬40年 改革开放杰出贡献人员 邱娥国：人心需要真情暖，火灾务必用心防。	未
致敬40年新时代安全榜样用责任和担当擦亮安全航灯大连电务段信号工长迟振象171组道岔207架信号机209个轨道电路区段8处道口设备是他工队管内设备的家底，检查100余台转辙机上千余个螺丝巡视上千台继电器是他和工友每天的工作。	未
致敬40年新时代安全榜样用责任和担当擦亮安全航灯大连电务段信号工长迟振象1995年，24岁的迟振象结束军旅生涯，退伍分配到大连电务段，成为一名普通的信号工。刚上班时，他什么都不懂，面对专业知识的匮乏，他并没有退缩，反而激发起了他的斗志。	未
致敬40年新时代安全榜样用责任和担当擦亮安全航灯大连电务段信号工长迟振象2014年，为满足运能需要，金州二场工队管辖的80多组ZD6型单机牵引道岔要更换为新型的ZYJ7S型液压和双机牵引道岔施工，期间，持续强降雨天气使信号设备大面积进水，迟振象组织职工盯守在水害现场，对管内21处低洼设备不间断巡视检查，及时排除设备内部积水，全力确保设备安全，保证线路的畅通。在保证施工质量高标准的同时，他没有放松日常巡检维修质量，经常工作到深夜。	未
致敬40年新时代安全榜样用责任和担当擦亮安全航灯大连电务段信号工长迟振象一段时间下来，信号设备的三大件成为了他的朋友，各种常用继电器被他常挂在嘴边，联锁微机监测他已烂熟于心。	未
致敬40年新时代安全榜样用责任和担当擦亮安全航灯大连电务段信号工长迟振象中国铁路沈阳局集团有限公司大连电务段金州信号车间金州二场工队信号工长迟振象，一个把设备质量视为生命把设备安全当做责任的人，他用实干和奉献诠释了勤奋进取爱岗敬业的情怀，用责任和担当守护着绵延铁道线的安全畅通。从什么都不懂，到成为技术大拿，用强烈的责任意识和精湛的业务技能，不断奋勇前行。 新时代安全榜样用责任和担当擦亮安全航灯	未
致敬40年新时代安全榜样用责任和担当擦亮安全航灯大连电务段信号工长迟振象他在作业中处处留心师傅的每一句话，模仿师傅的每一个动作，下班后自己仔细琢磨。他利用休息时间啃下了《铁路信号基础》《计算机联锁》《铁路信号基础设备维护》等技术书籍，将书上面概念难点重点问题做好笔记。	未
