脚步不停，所以到处看风景	未
脚步不停 旁边的惊呆了 微博视频 脚步不停	未
脚步不停 旅行新势力 V影响力峰会 黄河边看到这个，不知做什么用的@微博旅游@新浪旅游 微博视频 脚步不停	未
脚步不停 旅行新势力 不止旅行 本溪太子河边的雾凇好美哦！@微博旅游@微博旅游@微博旅拍 微博视频 脚步不停	未
脚步不停 无边泳池，室外温泉，周末，也是冬至，就在花溪沐温泉酒店过了，你今天在哪儿冬游本溪 称心如意 不止旅行 V影响力峰会 本溪花溪沐温泉餐厅微博视频 脚步不停	未
脚步不停 海洋量子号上的船长Sindre Borsheim，一位非常和善的挪威人。去年冬天在一次同航线的旅途中，一名中国籍游客上海出发两个小时后突发疾病，就是这位船长果断下令满载4000多人的游轮不计代价原船返航，才得以挽救这名游客的生命。不止旅行 旅行新势力 V影响力峰会 脚步不停	未
脚步不停 生活里的仪式感 听说这是每个南方人从小就会的取暖方法。 V影响力峰会 视频V势力 @微博视频微博视频 脚步不停	未
脚步不停 的香港地名打卡你最喜欢哪一站呢不止旅行 旅行新势力 V影响力峰会 Via@钢小侠 微博视频	未
脚步不停 老人在车流中过马路，也是勇敢的很啊 微博视频 脚步不停	未
脚步不停 驾驶摩托车旅行，更是一种非比寻常的感受。@微博故事微博视频 脚步不停	未
脚法技术胜于前锋的后卫	未
脚踏实地，不漠视，不虚度，有缘无缘，一切随缘，保持一份好心情，就算心碎也要拥有最美的姿态。佛教	未
脚踏烈焰，吼阵四方，藏獒神杆初现世！	未
脱下军装还是兵 宿迁市长城保安公司沈习武摘下省级一颗星	未
脱下军装还是“兵” 宿迁沈习武摘下省级一颗“星”	未
脱单不如先让我脱贫吧！这个比较重要	未
脱单的我仍然保持着单身的空瓶水准	未
脱发女孩快马走啦	未
脱发女孩本孩这次必须拥有！！！//@Pearlzeng:SCALABO的去油头皮护理液	未
脱掉的秋裤最好还是穿回来 成都明晚起将迎降温	未
“脱欧”协议闯关继续 英首相多管齐下争取支持	未
“脱欧”协议闯关继续，英首相多管齐下争取支持	未
脱欧后，自由穿梭欧盟和英国就靠它！	未
脱水研报：医疗器械正在崛起，各个细分领域个股布局如文所示	未
脱缰的房地产走上回归之路	未
脱缰野马桑巴SOLO（内附2 个 拉丁舞 视频）	未
脱衣有肉的阿隆索。阿隆索加盟切尔西两年半时间内，已打入15球。	未
脱贫	未
脱贫不脱政策！河南省焦作市用地方立法推进健康扶贫	未
脱贫之星叶挺：在脱贫致富的道路上努力奋斗	未
脱贫四川扶贫任务年度考核方案出台，阆中将迎来大考！	未
脱贫扶志凭双手脱贫摘帽 靠勤劳改变生活	未
脱贫攻坚一线正能量用勤劳的双手拔穷根，我家今年要脱贫	未
脱贫攻坚云水村贫困户居住环境改善项目动工啦！	未
脱贫攻坚交警特警齐登台，他们的演出让村民大呼过瘾！	未
脱贫攻坚，作风先行	未
脱贫攻坚先借后补三变改革 汉阴县苏陕扶贫协作成效显著	未
脱贫攻坚兴义打造新市民子女入学一条龙工程初见成效兴义网	未
脱贫攻坚内蒙古发展改革委易地办考察组到兴义考察易地扶贫搬迁工作兴义网	未
脱贫攻坚冬季充电进一步深化农村产业革命主题大讲习启动仪式举行，孙志刚作批示	未
脱贫攻坚冲刺  陆祥红到党隘村检查脱贫攻坚迎检准备工作	未
脱贫攻坚决战贫困圆梦小康徽县脱贫攻坚工作纪实	未
脱贫攻坚刘畅：扶贫路上的女汉子	未
脱贫攻坚！和合乡：产业扶贫供岗增收	未
脱贫攻坚喀斯特峭壁上行走的安全饮水管道仓更镇戈厂村安全饮水工程建设小记兴义网	未
脱贫攻坚四川启动脱贫攻坚年度大考：时间安排出炉 有这些变化	未
脱贫攻坚土地集约化种植激活乡村发展动力	未
脱贫攻坚在宁德宁德人民医院党总支组织党员干部参观摆脱贫困之路宁德扶贫开发主题展示馆	未
脱贫攻坚在新邵向曙光调研大坻村脱贫攻坚工作	未
脱贫攻坚在行动  博州打通最后一公里，让致富路通向家家户户！	未
脱贫攻坚在行动第二十四期：范县开展志智双扶，让776名残疾人创业就业！	未
脱贫攻坚在路上忧贫困户之忧，长塘镇要把脱贫路越走越宽阔！	未
脱贫攻坚 夏秋攻势丨翠里乡扶贫肥来了 贫困户乐了	未
脱贫攻坚奇韬镇：五龙鼎珠新型农村社区造福工程加快推进	未
脱贫攻坚宋亚胜：让村民尝到幸福的味道	未
脱贫攻坚小课堂第四课：易地扶贫搬迁政策	未
脱贫攻坚小贴士精准扶贫基础工作有哪些	未
脱贫攻坚小贴士贫困户和帮扶干部十三个说得清	未
脱贫攻坚小贴士非贫困户和帮扶干部六个说得清	未
脱贫攻坚  市供销联社深入扶贫一线 为贫困户送去扶贫产业项目分红资金	未
脱贫攻坚必须较真务实	未
脱贫攻坚我们在行动我县开展我的扶贫脱贫故事宣讲活动	未
脱贫攻坚  我县多措并举抓好就业创业工作	未
脱贫攻坚战中绽放的税务力量	未
脱贫攻坚战星光行动 中国乡村版迪士尼是什么样跟随张一山 一起到江西大余县大龙山A哆乡村了解一下@张一山官方后援会 @一山数据打投团@江西日报 @人民网江西频道	未
脱贫攻坚战星光行动伴随迎宾曲，三石弟弟吴磊 来到海南白沙黎族自治县扶贫调研，感受黎族人民的热情，挑战勇敢者的游戏竹竿舞，再遇高考作文题绿水青山就是金山银山。	未
脱贫攻坚战星光行动吴磊来到海南白沙橡胶林，了解传统支柱橡胶产业，橡胶如何割采快跟三石弟弟一起科普一下	未
脱贫攻坚战星光行动 张一山 @张一山 走进江西大余，看望贫困户，探访脐橙产业及乡村旅游发展新态势，脱贫攻坚一个都不能掉队江西大余是如何做的张一山将如何用他的爱心帮助更多的贫困户呢戳直播网页链接	未
脱贫攻坚战星光行动 来到青海湟中，这个地方并不陌生，但第一次因为扶贫来到这儿，看到了易地搬迁的成果，参观了古菜籽油坊，体验了我喜欢的传统银铜器制作有困难，也有机遇，希望以我们的力量，实实在在地帮助乡亲们[加油][加油][加油]	未
脱贫攻坚战星光行动青海湟中的易地搬迁工作正如火如荼的进行，黄渤 帮助老乡搬新居，一起看看老乡们的新居新生活	未
脱贫攻坚战星光行动黄渤 呼吁大家多多支持脱贫攻坚产品，为湟中菜籽油代言，湟中菜籽油，99吸收。	未
脱贫攻坚战正酣 康县推进脱贫攻坚工作纪实	未
脱贫攻坚战进入倒计时，省妇联脱贫攻坚工作聚力永仁县宜就镇	未
脱贫攻坚扶贫帮扶日范县各单位持续开展办实事美户容暖民心活动！	未
脱贫攻坚 扶贫扶志在行动榆林横山：脱贫摘帽 奔小康	未
脱贫攻坚 扶贫扶志在行动蓝田县府君寨村贫困户这个冬天不再冷走进蓝田县安村镇府君寨村贫困户张会贤的新房里，幸福不忘共产党7个火红大字的牌匾最先映入眼帘。穿着一身新棉衣的张会贤在牌匾下腼腆地笑着说：俺的日子现在越过越好了，感谢党和政府，感谢扶贫干部和江西商会，这些恩情不能忘！脱贫攻坚 扶贫扶志在行动  蓝田县府君寨村贫困户这个冬天不再冷	未
脱贫攻坚  扶贫政策解读	未
脱贫攻坚技能培训：贞丰组织101人到贵阳学习挖掘机技术	未
脱贫攻坚政策宣讲小窗口丹寨易地扶贫搬迁	未
脱贫攻坚政策宣讲小窗口贫困劳动力全员培训	未
脱贫攻坚暖人心  丁景玺：做贫困群众的贴心人	未
脱贫攻坚未雨绸缪心念群众  点滴入手改变现状	未
脱贫攻坚标兵 庙峁村第一书记戴俊东	未
脱贫攻坚步伐正朝着更深更远的地区迈进	未
脱贫攻坚民主监督工作现场交流暨2018年度成果会商会在桂召开	未
脱贫攻坚洒金2018新市民居住区建设项目主体完成96兴义网	未
脱贫攻坚澧县2018年教育健康安居就业扶贫政策	未
脱贫攻坚灵寿县妇联开展白内障免费筛查诊治健康扶贫活动	未
脱贫攻坚  热心助人的劳务经纪人马玉琴	未
脱贫攻坚！狮山乡巾帼志愿帮情暖贫困户	未
脱贫攻坚王岩辞：锁定目标任务，聚焦问题和短板，确保脱贫攻坚成果持续巩固	未
脱贫攻坚用生命的光辉照亮扶贫之路 记安平县大子文镇扶贫办副主任王桥	未
脱贫攻坚节禾田生长万物   爱心播撒人间	未
脱贫攻坚范县收听收看全省扶贫宣传和教育培训工作视频会，努力提高扶贫队伍的综合能力！	未
脱贫攻坚西安在行动解码周至县的富仁脱贫模式贫困之冰，非一日之寒破冰之功，非一春之暖。地处黑渭湿地的周至县富仁镇，如何破贫困之冰，助群众脱贫就让我们一起走进富仁镇下高村富仁村，解码产业扶贫的富仁脱贫模式。@周至宣传	未
脱贫攻坚进行时  东川区召开精准扶贫档案和大数据工作推进会	未
脱贫攻坚进行时和田村民外出拾花，拾出幸福好生活	未
脱贫攻坚进行时用真情帮亲戚走上致富路	未
脱贫攻坚  陕西省出台打赢脱贫攻坚战三年行动实施意见	未
脱贫攻坚  青年先锋  人民日报：大山深处飞天梦	未
脱贫攻坚风采录	未
脱贫故事头雁领着雁群飞！全南这位退伍军人干的事业有名堂	未
脱贫新征程，驻村工作组让丰宁北头营乡河南营村的村民生活有盼头	未
脱贫有了新法宝 高科技的农业机械让老区人走出贫困	未
脱贫有了新法宝：高科技的农业机械让老区人走出贫困	未
脱贫榆中：青年志愿队再出发 五净一规范助脱贫	未
脱贫榜样陈书清百草园里谋富路	未
脱贫榜样 青峰镇张道成 小车间托起大梦想	未
脱贫比脱单更重要。	未
脱贫热线家门口的就业路 来看看泾阳县的扶贫工厂！	未
脱贫路上第期：汗牛乡干群齐心拔穷根！	未
脸上有这三个特点的人，早晚出人头地，一辈子大富大贵！	未
脸圆有肉，说明晚年很有福气，能安享晚年。印堂低陷人中短，鼻曲脸圆法令宽，性格开朗活泼，心直口快藏不住事，印堂低陷，预示着先天性心脏功能较差，再结合整体面相，早年艰难，生活不济。人中短，人中短的女人性子比较急，最大的缺点就是只喜欢听到别人的赞美和恭维，如果有人灌她迷汤，拍她马屁，不管对方是出于真心诚意或欺骗谎言，都照单全收。	未
脸大有福气，晓得不！ 红人的诞生 萌宠是戏精V影响力峰会	未
脸要穷养，脚要富养心要穷养，肺要富养，养好身体才好	未
腊味嘉年华  2018广东第一峰（秤架）瑶乡腊味文化节暨首届乡村赶集节	未
腊戌发大火！热水塘查走私！曼德勒招标！	未
腊月20开业！日照这家新增的便民市场真宜当！位置在这！	未
腊月首惠 商城消费满399立返T-61	未
腊梅飘香	未
腐乳花式吃法，赶紧get起来！！	未
腐竹还可以这样吃	未
腕表界的冰雪女王快来pick	未
腚老五 微博视频 海绵宝宝片尾曲	未
腮！这是腮！大家快来看腮！！！	未
腰线越高越时髦，高腰裤才是初冬穿搭主角	未
腰腹力量对于打球有多重要，想必大家都很清楚！今天教大家几个在家就能练出腹肌的动作，根据自身情况每个动作做10-20次，赶紧马住练起	未
腰酸背痛是上班族的日常写实了，可以学下这些按摩手法，有空按按放松一下	未
腹痛诊断六步走 ！腹痛是临床上最常见的症状之一。及时而正确的对腹痛作出病因诊断并进行合理的治疗，有着特别重要的意义。因为有些腹痛需要外科急诊手术处理，如延误诊断，必将造成严重的后果，甚至危及生命。第一步是急性腹痛还是慢性腹痛急性腹痛起病急变化快病情重，有些属急腹症范围，如急性阑尾炎胆管炎肠梗阻等常需急诊手术治疗慢性腹痛起病隐匿，变化缓慢，病情相对较轻。不同急性腹痛的临床特点第二步是腹部疾病还是腹外疾病腹外疾病包括：胸部疾病，如心肌梗死肺炎胸膜炎心包炎中毒代谢疾病如：糖尿病酮症铅中	未
腹肌训练图解，每个动作都有详细说明，动作可安排3到4组，每组15次，跟着虐起来吧！	未
腹肌训练打卡！ 微博视频	未
腹部运动合辑，需要虐腹的小伙伴们看过来，不用羡慕别人的腹肌马甲线，每天虐一下腹部，马甲线人鱼线腹肌你也是可以拥有的。	未
腹部运动合辑，需要虐腹的小伙伴们看过来，不用羡慕别人的腹肌马甲线，每天虐一下腹部，马甲线人鱼线腹肌你也是可以拥有的。  （全球健身中心）	未
腾冲西山坝至中和镇边合区即将建一条连接道路，中和人有福了！	未
腾冲银杏村：谁是当下旅游生力军拥有中国大妈就拥有半壁江山	未
腾讯2018员工大会：马化腾刘炽平张小龙等谈战略马化腾刘炽平张小龙任宇昕等高管今日召开2018年度腾讯员工大会讲话。马化腾表示，过去一年最大感受是责任，借助腾讯20周年契机，反思了腾讯使命和愿景。任宇昕表示，面对智能手机普及，推出了史上最严青少年防沉迷系统。腾讯2018员工大会 马化腾刘炽平张小龙等谈战略	未
腾讯上线功能游戏新官网  搭建产品、赛事、活动体系	未
腾讯与泸州老窖达成战略合作	未
腾讯云再增印度数据中心，南亚市场双可用区格局正式确立	未
腾讯云再增印度数据中心 南亚市场双可用区格局确立	未
腾讯云助富途证券打造香港首个金融专有云	未
腾讯云发布新一代移动金融开发平台	未
腾讯云+社区开发者大会开幕 详解全链路开发者服务体系	未
腾讯云联手百洋智能科技：B端医疗信息化和AI渗透的想象力	未
腾讯公布《使命召唤》手游宣传片12月17日，腾讯正式公布了《使命召唤》手游！并且中文官网同步上线。现在，官方也公布了《使命召唤》手游宣传片，满满的大片既视感，我们来看一下吧。详情点击：腾讯公布《使命召唤》手游宣传片	未
腾讯公益尘砾助学 项目共计筹款307631.40其中，助学金支出265000元，运营人员成本加专业人员成本支出共33427.87元中华社会救助基金会提取监管费9228.94元助学地区为湖南，江西，贵州.....均为尘肺病家庭的孩子，谢谢捐款的爱心人士更为详细的表格会在我们的公众号上及基金会微博上公示	未
腾讯发布《2018年互联网理财指数报告》，中国财富管理市场进入2.0时代	未
腾讯发布带屏智能音箱，产业链打开市场空间	未
腾讯叮当智能屏发布 主打视听体验、海量内容、儿童模式	未
腾讯叮当智能屏发布：整合腾讯视听内容尝鲜价699元	未
腾讯回血1000亿，马化腾重回首富！中宣部一则消息，这个行业沸腾了	未
腾讯孟美岐 财经V峰会	未
腾讯季卡29也是相当划算了	未
腾讯将进军物流业正申请商标企鹅物流依托腾讯在AI云计算IoT等领域的数据和算法积累泛腾讯系生态丰富的应用场景，应用移动机器人SLAM感知规划控制和云平台等关键技术，可提供智能移动服务，如智能路径实时定位多模交互场景物联等。详情点击：腾讯将进军物流业正申请商标企鹅物流	未
腾讯市值重返3万亿港元，多家投行给出“买入”评级	未
腾讯影业与派拉蒙影业联合出品电影《大黄蜂》和《壮志凌云》续集	未
腾讯控股创11月来最大单日涨幅 恒指探底回升收涨0.51%	未
腾讯控股转涨，现涨近2%	未
腾讯携程成最大赢家？	未
腾讯教育行业总经理龚振：构建新工科人才生态	未
腾讯教育龚振：构建新工科人才生态	未
腾讯新闻打造纪实访谈节目《不止于她》 探寻杨幂胡静等女性力量	未
腾讯智能英雄大小姐也能这么萌的吗@王者荣耀智能机器人 ，我觉得带她回家能带我上分，靠你了，小香香！	未
腾讯智能英雄天啦噜，居然有这么智能又鬼畜的机器人@王者荣耀智能机器人 ，和大小姐一起打游戏一定很鬼畜嘿嘿。	未
腾讯有梦想：解密云时代的腾讯梦云上数据库及智能DBA一刻演讲	未
腾讯欲进军云游戏业务中国商标网显示，腾讯近期申请了WEGAME CLOUD商标，或将进一部强化云游戏相关业务。11月15日，腾讯合计申请了四个国际分类下的WEGAME CLOUD商标。据描述，该商标可能涉及的商品或服务范围包括为商品和服务的买卖双方提供在线市场计算机游戏软件云计算电子数据存 ...全文	未
腾讯游戏启用人脸识别 《王者荣耀》率先“试水”	未
腾讯：潜心构建开放共享平台(庆祝改革开放40年·百城百县百企调研行)	未
腾讯理财通联手晨星权威评测 第二届金企鹅奖即将揭晓	未
腾讯理财通金企鹅专区上线！12月15日，第二届腾讯理财通金企鹅奖暨财富高峰论坛在深圳举办，大咖齐聚一堂。并于当晚颁发涵盖最佳货币基金奖最佳债券基金奖等20个奖项，同时上线金企鹅专区对所有获奖产品进行展示，说明获奖理由以及风险分析。网友表示：基金的指路明灯终于有人点亮了！腾讯理财通金企鹅奖 网页链接	未
腾讯神鸮入选首届市场监管领域十大社会共治案例	未
腾讯程武：面向未来 重识游戏价值	未
“腾讯系”公司迎来上市潮 中金公司保荐业务“近水楼台”	未
腾讯系又添一家上市公司！就在你手机12宫格的左下角，蘑菇街6日赴美上市	未
腾讯系的同程艺龙上市首日涨超26%，主要业务依赖微信小程序	未
腾讯视频VIP6周年今日一问：今天你们碰蛋了吗还没有的赶紧来和V总碰蛋鸭寻找V总身边的蛋皇前6名蛋皇可以获得14种VIP各6年的大礼包！听歌看书游戏给你安排的明明白白！快来做那个最壕锦鲤网页链接 在评论里晒出你的战绩让V总看看你都碰到了啥呢	未
腾讯视频vip会员12个月，99，还可以买	未
腾讯视频会员，领quan买，拼夕夕的，一年99元，戳网页链接季卡，劵后价29元，网页链接月卡，劵后价10元，网页链接	未
腾讯视频新推出的尝鲜季，一般只有三四期的量，刚上线的《高能玩家》，垂直类素人综艺的帽子，但是没说教不难懂，反倒很刺激很野蛮	未
腾讯音乐IPO背后 在线音乐平台的缩影腾讯音乐终于IPO，这并不容易最新消息显示，这家互联网巨头旗下的数字音乐流媒体业务腾讯音乐集团（TME）将于周三晚间登陆纽交所，确定IPO发行价在13美元/ADS，而此前招股书显示腾讯音乐发行区间为13.0015.00美元腾讯音乐IPO背后 在线音乐平台的缩影	未
腾讯音乐IPO：腾讯持股59，音乐格局已定北京时间12月12日晚，腾讯音乐将在纽交所上市，股票代码为TME。据招股书显示，腾讯音乐将发行8200万份ADS，招股区间为1315美元。据华尔街日报报道，腾讯音乐IPO定价为13美元/ADS，位于区间低端，估值达213亿美元。按此计算，公司的联合主席谢振宇和谢国民身价也将分别达8.5亿美元8.7亿美元。目前，腾讯控股有限公司则是腾讯音乐最大股东，太盟投资集团是第二大股东，其次是Spotify Technology SA。（投资界）腾讯音乐IPO：	未
腾讯音乐上市估值1466亿，音乐领域亿万富豪诞生在即	未
腾讯音乐上市估值1466亿 音乐领域亿万富豪诞生在即不出意外的话，今日，腾讯音乐将在纽交所挂牌上市。招股书最新信息显示，腾讯音乐拟发行ADS股份8200万股，按照13美元发行价计算，拟募集资金为10.66亿美元。腾讯音乐此次上市或造就几位音乐领域亿万富豪，也将一改音乐清贫怪相。腾讯音乐上市估值1466亿 音乐领域亿万富豪诞生在即	未
腾讯音乐上市估值1466亿，音乐领域亿万富豪诞生在即腾讯音乐预计于今日在纽交所挂牌上市数据显示，截至2018年1月，腾讯音乐的市场份额遥遥领先，达到40.7据公开消息，腾讯音乐娱乐集团IPO发行价定为13美元，取发行价区间13美元到15美元下限12月3日晚间，腾讯音乐更新招股书，招股书最新信息 ...全文	未
腾讯音乐下周登陆纽交所：拟募12.3亿美元 腾讯持股六成	未
腾讯音乐下周登陆纽交所：拟募12.3亿美元，腾讯持股六成	未
腾讯音乐今夜将登陆纽交所 发行价确定为13美元	未
腾讯音乐今晚将登陆纽交所 行业竞争差距将拉大	未
腾讯音乐今晚正式登陆纽交所	未
腾讯音乐在纽交所上市	未
腾讯音乐在美正式敲钟上市，发行价每股13美元腾讯公司此前发出的公告显示，本次TME的IPO发行价定在每股13美元。按此计算，本次IPO拟募集资金共为10.66亿美元，相比之前的一系列传言有所缩水。与此同时，TME的估值也被确定为213亿美元。 腾讯音乐在美正式敲钟上市，发行价每股13美元	未
腾讯音乐娱乐CEO彭迦信上市致辞：创造音乐无限可能	未
腾讯音乐娱乐官网上线：含QQ音乐/酷狗音乐/酷我音乐/全民K歌腾讯音乐娱乐集团正式登陆纽交所，开盘价报14.15美元，较13美元的发行价涨近9。截至到今天，腾讯音乐娱乐市值达到221亿美元。腾讯音乐娱乐官网也已经上线详情点击：腾讯音乐娱乐官网上线：含QQ音乐/酷狗音乐/酷我音乐/全民K歌	未
腾讯音乐将于双 12 上市董明珠与雷军十亿赌约胜出......  TGO 每日速递	未
腾讯音乐将指导发售价区间定在13-15美元/ADS	未
腾讯音乐更新招股书，拟募集10.66亿美元至12.3亿美元	未
腾讯音乐正式登陆纽交所：首日收盘价14美元 市值约229亿美元	未
腾讯音乐登陆美股 估值达213亿美元	未
腾讯音乐赴美上市 腾讯音乐提交IPO申请 招股区间13-15美元据IFR消息，腾讯音乐今日将提交美国IPO申请，招股区间为13至15美元，估值介于220至250亿美元。（新浪科技）	未
腾讯音乐赴美上市 腾讯音乐提交IPO申请 招股区间13-15美元据IFR消息，腾讯音乐今日将提交美国IPO申请，招股区间为13至15美元，估值介于220至250亿美元（新浪科技）	未
腾讯音乐赴美上市 腾讯音乐美股上市首日收涨近8。	未
腾辉传媒早安心语永不停歇，无限风光在顶峰！	未
腾辉传媒早安心语社会不相信庸俗，成功需要汗水和寂寞铸就	未
腾飞吧信阳！	未
腾龙数据中心一期有望2019年投用 交付2200个机柜	未
腿控心动转发//@系红领巾的猴子: 没有人可以质疑林更新腿的真实性，真人腿看起来有我人这么长	未
臧鸿飞蒙面普及高音知识 摩登现学现秀BBOX	未
自2007年以来首位本土中超金靴武磊接受FIFA采访！在经历了一个成功的赛季之后，他还有哪些目标呢详情戳网页链接	未
自上赛季开始，戈麦斯在英超已经完成了48次成功拦截，比同期任何利物浦球员都要多签下新约的戈麦斯表示：这份新约对我来说就是全世界，我爱利物浦，我在这里踢球和学习成长，我很高兴这一切能够继续如此英超，怎能不爱	未
自上赛季英超联赛至今，@曼城足球俱乐部MCFC  前锋斯特林在21个主场比赛中参与了26个进球（17球9助），主场效率惊人英超比赛日	未
自主品牌广汽传祺2018年度奖金方案：发放10个月奖金。今年1-11月广汽传祺累计销售新车484，926辆，同比增长4.28，仅完成70万辆目标的69网页链接	未
自主找卷，想要什么搜什么！女装网页链接 .男装网页链接美食网页链接美妆网页链接内衣网页链接 配饰网页链接鞋包网页链接 百货网页链接	未
自主找卷，想要什么搜什么！母婴网页链接 居家网页链接箱包网页链接数码网页链接家纺网页链接 运动网页链接	未
自主教育让海岛学子会生存、会学习、会负责、会追求	未
“自亮家底”：南京浦口区八部门“向人民汇报”	未
自从1994年PlayStation 诞生之年起，PlayStation Awards 就每年举办一次，今年是第24届一年一度的 PlayStation Awards 2018在今天盛大举行，索尼将为我们回顾一年来在亚洲地区最受玩家们欢迎的 PS4 游戏，并为它们颁奖从明天起在PS Store所有获奖作品都将以特价销售！ PlayStation Awards 2018获奖游戏名单汇总	未
自从2017年1月输给埃弗顿后至今，@曼城足球俱乐部MCFC 在对阵所有除英超六强以外的球队中保持不败，取得了44胜7平的战绩并拿下了153个积分中的139分英超比赛日	未
自从去过泰国后，一直念念不忘，因为喜欢一个地方，必有你喜欢的理由旅行 V影响力峰会不止旅行与EOS共进 泰国芭提雅深度游：白天看海夜游红灯区，人妖秀也很精彩！	未
