育碧家的《彩虹六号:围攻》（Tom Clancys Rainbow Six Siege）给玩家送圣诞礼物了。即日起到2019年1月1日，登陆游戏的玩家将会获得礼包，包含一个免费的dlc干员若是玩家已经拥有全部干员，则可获赠25000点声望。但是目前这份礼物出了点小问题，拥有全部干员的玩家无法获赠25000声望，官方已表示会尽快修复这个bug	未
育碧将发布孤岛惊魂系列新作《圣歌》TGA预告将专注故事和角色3DM晚报	未
肺癌每年新发病例78万 专家：发现率在提升死亡率在下降	未
肾友必备手册，转给需要的人！	未
肾性贫血创新药率先在华获批，尚未在任何国家上市	未
肿瘤患者可享个性化治疗	未
肿瘤放射生物与多模态诊疗专业委员会第二届年会暨放射治疗新进展系列培训班在京召开	未
「胃炎的用药和养护」，我们直播给你听	未
胃里大结石 喝喝可乐居然治好了	未
胆大 净峰老司机开了20年的车，竟是98年买的假证/肖厝海域水质已符合养殖标准	未
胆大！北海一货车司机搭载2岁婴儿逆行冲卡！	未
胆子够大！莱阳高格庄萝卜节开幕式选在寿光市	未
胆子越来越大，自虐越来越过私享世界旅行灵感季佛罗里达旅行 这次去玩tree trek，挑战第三段的时候，我是真的怂了。记得东野圭吾说过：放弃不难，但坚持一定很酷。 可我，是真的因为没有退路了。硬着头皮跳下的时候，说了一句：我真的很怕。（前几天还说，最近很自虐。然后发现，自虐还升级了，在第三段一个体验中，要跳下去的瞬间，感觉像蹦极前那样。）奥兰多树林徒步探险公园（OrlandoTree Trek Adventure Park）距离凯西米华特迪士尼世界度假村就几分钟的车程。里面有97场树木游	未
背上羽绒服做商场里回头率最高的仔	未
背单词很痛苦清华学霸11招教你高效记单词！	未
《背影》《荷塘月色》实景重现 扬州朱自清公园开园	未
背景图了解一下	未
背景图戳个赞 三天内你会收到一个好消息	未
背景圖戳个赞 三天内你会收到一个好消息	未
背着母亲打工15年 百善孝为先，真汉子！祝福他找工作时可以顺利一点。每个人都应该好好赡养自己的父母！	未
“背篓检察官”成长记：一步一个泥脚印	未
背身接球转面框进攻，脚步的移动在这其中起到了非常重要的作用，9个非常厉害的脚步练习	未
胎动，可以说是生命的最初律动了	未
胎盘“类器官”可长期稳定培养：研究人体发育有了简化模型	未
胖东来万达新田360广场许昌人最喜欢逛的地方是哪里	未
胖东来首家社区超市开业！	未
胖友们周五啦！评 论点 赞上一条微博：微博正文，今晚手动在评论揪三位胖友，一人66元请喝奶茶哟，大家冲鸭（这条抽完会删哈）	未
胖友们，周五啦，评 论点 赞原博，今晚手动在评论里揪两位胖友请吃同款新品烧仙草	未
胖友们，天冷了需要炸鸡来御寒咯！评 论点 赞上一条微博，戳这里：微博正文，今晚手动在那条评论里揪2位胖友，送出图片中的一人过瘾炸鸡桶（可折现），大噶冲鸭这条开完浆会删，原博评论里会公布中浆名单	未
胖友们，评 论点 赞原博，今晚手动在评论里揪两位胖友，请吃同款热辣玉米片脆皮鸡！！一人一桶吃到爽歪歪哟	未
胖哥撩新车 别克GL8，新增两款可满足国六排放标准车型，售价区间为25.29-27.29万元。新车在外观内饰部分相比现款车型无明显变化，搭载2.0T SIDI直喷涡轮增压发动机，最大功率260马力，最大扭矩350牛米匹配6速DSS智能启停变速箱。胖点评：神车这个称呼，快从大众车上转移到这个车上了吧，还是说， ...全文	未
胖哥撩新车 新款奥迪Q7，售价区间为69.98-98.48万元原40 TFSI舒适型，车型名称更改为45 TFSI舒适型原40 TFSI S Line运动型名字更改为45 TFSI S Line运动型原45 TFSI升级为55 TFSI车型，同时全部配备第三排座椅动力系统是2.0T252马力370牛米，和3.0L机械增压333马力，440牛米，匹配8速自 ...全文	未
胖哥撩新车 新款奥迪TT Roadster二十周年纪念版，基于现款奥迪TT Roadster打造，限量999台新车将搭载2.0T发动机，推出两款不同动力输出的车型，其中40 TFSI车型的最大功率为197匹，而45 TFSI车型为245马力，匹配7速DSG变速箱胖点评：已经不是新车了，因为以后不会再有两门的TT了TT以后就只有 ...全文	未
胖哥撩新车 蔚来ES6，定位纯电动5座中型SUV新车基本沿用了ES8车型的设计风格，细节上有所差别标配全铝车身双电机四驱动力系统，0-100km/h加速时间将低于5秒（图片来自谍报家）胖点评：现在人们更关心的是，续航	未
胖哥撩新车 雪佛兰探际者，定位为中大型SUV。长为5189mm，轴距3071mm。将搭载2.0T涡轮增压与3.6L自然吸气两款发动机，最大功率分别为192kW和228kW，峰值扭矩分别为400Nm和360Nm。匹配9速手自一体变速箱，还将搭载Twin clutch智能全路况四驱系统。胖点评：换壳的昂科雷。另外，2.0T和3.6自吸， ...全文	未
胖哥汽车频道 2018年11月汽车销量排行出炉：轿车前十依次为轩逸新朗逸捷达桑塔纳卡罗拉速腾新英朗新宝来科沃兹思域。SUV销量排名前十依次为哈弗H6途观宝骏510奇骏本田CR-V博越传祺GS4长安CS55本田XR-V荣威RX5。MPV销量排名前十依次为五菱宏光宝骏360别克GL8宋MAX宝骏730欧诺瑞风风行别克GL6艾力绅。	未
胖哥汽车频道 wecar说新车 下一代奥迪S3，内饰变化好大啊	未
胖哥汽车频道wecar说新车 北汽绅宝智道上市，售价为7.9912.29万元，主打AI卖点，全系标配1.5T发动机，匹配6MT和CVT变速箱。发布会一直强调大格局(_)。新车和之前的绅宝智行一起构成北汽双智星矩阵。大家如何评价这款车	未
胖哥汽车频道 wecar说新车 雷克萨斯UX开启预售，预售价格区间为26.99-37.30万。UX 200车型搭载最新的Dynamic Force系列2.0L发动机，最大热效率达41，最大功率170马力，匹配Direct Shift CVT变速箱。UX 260h车型采用了2.0L混动系统，总输出达到178马力。UX 260h车型还带有四驱版本车型，该车型在后桥位置额外增加一个电机实现四驱功能。这个价格，大家怎么看	未
胖哥汽车频道 WEY两周年品牌之夜，两年时间成为20万车主的选择。您认为WEY的前景如何	未
胖哥汽车频道 一只诙谐幽默的大象，抖了个小包袱	未
胖哥汽车频道 北汽新能源旗下高端品牌ARCFOX的旗舰车型ARCFOX-7。由原大众首席设计师沃尔特德席尔瓦主持设计。碳纤维车身强劲电驱系统，0-100km/h的加速时间为2.7秒。据说售价可能高达千万元人民币。（看到这个LOGO，我就想起了一个段子：what does the fox say?大楚兴！陈胜王！）	未
胖哥汽车频道 奥迪Q4谍照，基于MQB平台打造，将在2019年发布，Q4不仅仅是Q3的轿跑版本，它会拥有更多属于自己的独特设计。（图3为奥迪TT offroad概念车)您期待奥迪Q4吗	未
胖哥汽车频道 敢别大公交，勇气可嘉，勇气可嘉啊！	未
胖哥汽车频道 试驾斯柯达柯迪亚克GT的2.0T高功率版（国六），匹配7速双离合。220马力开着也还可以，没觉得劲儿小了。转向手感和底盘都非常大众。就是隔音没有特别好，速度不快风噪和发动机的声音就进来了，好在发动机声音不错，没有招人烦。但是车里聊天声音得稍微大点儿。最满意的是座椅，又厚实又长，软硬也合适。运动档稍微试了一下，感觉还是D档开着舒服总体来说还不错，没有大毛病，也没有什么大亮点，优惠完大概1626万的售价，您觉得如何呢	未
胖哥选车 25万预算，SUV可以接受二手车普拉多途锐撼路者	未
胖哥选车 您好！准备给媳妇买台12一15万的小型紧凑型SUV。目前看对吉普自由侠领克02缤智XR-V或者其他。您给推荐一下！	未
胖哥选车 胖哥，你好，我现在开的是奥迪Q5，想换一辆后排空间大，舒适性高的轿车，平时一个人开，然后会带孩子和老人出去玩，之前关注的有大众辉昂，沃尔沃S90，雷克萨斯ES，感觉性价比都还不错，这三个推荐哪一个或者还有什么推荐车型	未
胖哥选车  @胖哥汽车频道   胖哥，想在年入手一款紧凑SUV，看的有本田缤智丰田ChR大众途岳，还有三菱奕歌，很纠结，各有千秋，家用车，偶尔玩玩，考虑动力，在意油耗和空间，求推荐啊，求解答胖哥杨力	未
胖猫物流开启清洁能源战略 联合业界巨头共推LNG重卡	未
胖猫物流联合业界巨头共推LNG重卡 开启清洁能源战略	未
胖鱼们购买完课程可通过Pc端课程详情页加群，参与互动答疑和有奖活动哦	未
胜利1216 BVIP_1116 ins	未
胜利大街棉六非机动车道围挡施工 ，路面通行混乱 。	未
胜利精密获东吴创投施援手 “四千亿纾困资金”效果渐显	未
胜地寻踪丨 带你了解灌阳十景的前世今生	未
胜绝杀伯恩利，波切蒂诺成为了@托特纳姆热刺足球俱乐部 在英超联赛中的第一位百胜教头，他一共用了169场比赛，而温格开始执教阿森纳时获得百胜则用了179场比赛英超比赛日	未
胜诉公告河南拆迁案例：街道办城管局作限拆通知，京平助力确认违法	未
胡一天一叶鲜境鲜女膜法书免单心愿票选结果公布！让我们来看看小鲜女们的选择！！12月24日平安夜晚上21点，在全国294个地级市及4个直辖市任一城市下雪就可以实现免单心愿！欢聚一叶鲜境大家是不是已经开始默默期待了呢还不快抢先预定 网页链接	未
胡一天 没有什么突然好想你，因为一直就在心里呀@胡一天啊 你是每一天的心动	未
胡先煦在高能玩家把选手认成刘昊然了哈哈哈哈哈哈哈瞳孔地震真的太帅！	未
胡兵力挺胡歌 胡兵采访中力挺好友胡歌：胡歌的人很好，不过每个时代有每个时代的表达方式，网友也好，媒体也好，作为艺人的话就是把自己的事做好，演员把戏演好，我在做模特儿便把模特儿做好，胡歌拍戏拍很好了，这就够了，他跟网友之间有自己私人感情要传递，我觉得这样很正常，我个人没认为他是人设崩塌，胡歌是感性一些，他的表述我能理解。 除了力挺胡歌，胡兵直言：反倒是后面跟着他写的一些演员，感觉好像缺少文化，不知道想表达什么，看不太懂。	未
胡军主演话剧拉开世界巡演大幕 北京首演一票难求	未
胡军打破季节界限 演技派将戏剧人生搬上T台	未
胡可晒一家四口温馨合影庆生：请陪着我慢慢变老	未
胡可晒出照片，小鱼儿和安吉暴风成长，兄弟关系亲密样貌如复制	未
胡同里的洋老板40位外籍专家评北京巨变-第03集	未
胡塞武装代表团在联合国特使陪同下启程前往瑞典	未
//@胡子格-微语录:国史古风	未
胡宏俊evo石头stoneboog 今晚见！喊出来啊啊啊！！！！	未
胡小闹漫画极品爸妈（8）胡小闹漫画来啦，捂好你的肚子，快来读吧	未
胡忠雄当选湖南岳阳市人大常委会主任 刘和生当选岳阳市人民政府市长	未
胡忠雄现场督查中央生态环保督察回头看重点信访件整改工作	未
胡新民丨国家公祭南京大屠杀的意义：铭记伸张正义之艰难	未
胡春华和法国财长勒梅尔共同主持第六次中法高级别经济财金对话	未
胡晓明出任蚂蚁金服总裁 井贤栋表示：热烈欢迎回归	未
《胡杨的夏天》正在热映 朱时茂陈佩斯再合体	未
胡林秋色 丽江巨甸古镇(民主路)	未
胡梅尔斯发推：第100次代表拜仁出场，昨晚是一场关键的胜利！还有很多场将要到来！	未
胡梅尔斯因为背部伤病不得不中断热身，博阿滕临时取代其首发，祝你早日康复，胡梅尔斯！Mats Hummels muss wegen einer Gelenk-Blockade im Rcken das Aufwrmen abbrechen， fr ihn rckt Jerome Boateng in die Startelf. Gute Genesung， Mats	未
胡梅尔斯新交的女盆友黑珍珠 哈梅斯新交的女盆友圣诞树	未
胡椒提醒 龙吉高速龙山服务区停电停水，暂停加油服务，预计明天来电，请广大驾驶人注意好油量。	未
胡椒蜀黍微互动你是哪一年拿到驾驶证的	未
胡椒蜀黍微互动 又到周末的最后一个晚上了，你们今晚是宅在家还是出去浪	未
胡椒蜀黍微互动 周末到！来跟蜀黍说说你们的晚饭都怎么安排	未
胡椒课堂车内除雾全攻略雾里看花的朦胧美确实另有一番意境，但对于开车的朋友来说，雾里看路是万万不能的，冬季行车玻璃易起雾，您是用布擦干还是用空调吹对于车内的水雾我们还有什么办法可以解决一路平安	未
胡歌 12.26荣耀活动名单公布啦网页链接 请名单内的小伙伴赶快加群噢没选上的等下次还有机会哒	未
胡歌要带我去人民广场！！！ 走 我们跳广场舞去不过胡歌尬舞绝对尬不过我要不看我去相亲	未
胡歌说：公益不在大小最重要是坚持公益是长远的事业只靠明星公众人物的力量远远不够 希望更多的人参与其中公益一小步帮助一大步[加油]	未
胡江辉在全区组织工作和宣传思想工作会议上提出 统一思想  凝聚共识 真抓实干 奋力开创全区组织工作和宣传思想工作新局面	未
胡润《2018中国创新品牌50强》：华为、VIPKID、小米登榜	未
胡润80后富豪榜发布 王思聪在继承榜仅排第11	未
胡润发布全球房价指数：北上广涨幅跌出全球前50	未
胡润发布全球房价指数：北上广涨幅跌出全球前50位	未
胡润发榜：佛山600万元资产家庭数量排全国地级市第一！这个地方有钱人最多	未
胡润百富榜发布，举牌万科的姚老板一年赚了千	未
胡润研究院与猫片联手发布文学价值榜 《将夜》《择天记》列前十	未
胡润财富榜：1790户佛山家庭身家过亿！	未
胡玮炜卸任摩拜CEO 总裁刘禹接任胡玮炜称自己完成了阶段性使命，平稳交棒给刘禹，没有宫斗和不和。  并表示，摩拜和共享单车的未来没有最初认知的那么简单，也不该像外界评价的那么悲观，应该站在至少3-5年的周期上看待 胡玮炜卸任摩拜CEO 总裁刘禹接任	未
胡玮炜式放手，戴威式坚持，哪一种才是最好的虽说阿里全资收购饿了么之后，张旭豪仍将出任董事长，不过联想到被阿里收购企业创始人一贯出局命运，比如优酷创始人古永锵大润发创始人黄明端等，出任饿了么董事长张旭豪命运值得关注。对于出局传闻，张旭豪仍旧表示：我并不是离开公司，身份是董 ...全文	未
胡经之文化美学理论与文化创新实践研讨会综述	未
胡迎春：“归雁”创业助脱贫	未
胡适的此去经年，谁许我一纸繁华，沈从文的一指流沙，我们都握不住的那段年华，梁实秋的陌上谁人依旧，固守流年，周作人的时光阡陌，你一直未曾走远，还有张恨水的烟雨纷繁，负你一世红颜和郁达夫的倾城春色，终只是繁华过往最狠的是鲁迅先生，风弹琵琶，凋零了半城烟沙 ...全文	未
胡锡进:用这方式打击华为的人 良心或脑子让狗吃了	未
胡闹！小夫妻在高速路上演全武行....	未
胡静人民的名义里女总裁好火呀	未
胡静 人民的名义里女总裁好美呀	未
胥涧线（柳树瞿阝街里段）改建工程完工通车！	未
胪岗镇：加大拆迁力度 推进中港河截污管网无障碍施工	未
胶州60余人上榜山东好人，看看你认识谁！	未
胶州：修路！56条公路195座桥	未
胶州市公安局招聘辅警啦！	未
胶州抢房节来啦！还有这些电器开秒杀专场！而且	未
胶州高州路铁路桥路段通车啦！竟然修成了这样	未
胶州高速：货车侧翻起大火，火光冲天！	未
胶警高达素组图。还挺帅。戳此预订宝贝详情	未
胸口碎大石怎么做到的蜀黍说安全	未
胸弟们！双十二活动结束倒计时开始啦！大哥的秘密库房错过了就得等明年了！表说大哥没提醒你们哟 美妆V赏时尚V势力终极种草清单福袋来了 加拿大总理墙裂安利	未
胸罩步！//@山水城的画图匠:阴影谱面//@鲎帆:胸罩步！//@dj_baka: 哦哦哦哦哦哦哦哦哦哦哦哦哦哦	未
能不忆江南？首届江南文脉论坛举行专场文艺演出	未
能不爱成都	未
能不能在温暖的被窝里给边防将士一个赞	未
能不能带可鹅去香港玩就看这波了谢谢支付宝，港澳随意玩来自慈父的自动转发。 圣诞老人的暗号	未
能不能拍一张你现在下班路上最好看的景，我想在围脖上旅游	未
能不能有点良心	未
能不能相亲成功，就看这个袋子了	未
能人话丰收丨在抖音看农民网红讲致富经	未
能人领着干 满山油茶香(图)	未
能住上新楼房，太高兴啦！本市中心城区最后大片棚改项目昨启动	未
能作为冠军队的一员 这都是命啊 如晶G.O.A.T.@颜如晶 @黃執中 @奶茶_商振博 @赵帅plus @风趣美女李逗逗@欧阳超咆哮 奇葩说	未
能做到的举手	未
能力不在脸上，本事不在嘴上！要脚踏实地做实事，生活不会因为某个节点而变得与众不同，未来的幸运都是过往努力的积攒！	未
能力有限，领红包啦！打开Zhi付寳搜索584800499领取	未
能力越大，也意味着萌力越大	未
能动嘴绝对不动手	未
能吃的编钟你见过吗湖北的小伙伴们有口福了	未
能和大家一起参与这件有意义的事真的很开心	未
能哥换下皮亚尼奇，复出了！！！	未
能喝！刘大美方丈一手相聚玩嗨，啤酒瓶摆满桌。闷倒驴办活动性情痛哭！放声为仙洋鸣不平，二人感动相拥。	未
能够被送到急诊科应该是没有穿透胸腔的大血管，这样的幸运应该就是人们说的奇迹！	未
能够走路，是世上最美之事。何处皆能去得，何样景致皆能见得。心中有些微烦闷，腹中有少许不化，放步去走，十分钟二十分钟，便渐有些抛去。若再往下而走，愈走愈到了另一境地，连美景亦一一奔来眼帘。旅行。就是，走路。一直，不停地，走下去。《最远的旅行，是从自己的身体到自己的心》	未
能工巧匠！十名砌筑工现场“凹造型”	未
能工巧匠大比武	未
能帮抢春运火车票吗宝贝详情	未
能打人吗//@愁容骑士典当记:安慰别人的时候比惨就行了，没人想听你的幸福生活。//@堪破三春景不长:你好可怜啊，但是你看看我我活得可开心了//@夏目家的小诗哥:每次看到别人的不幸 假的吧 我怎么没遇到过 我爸妈男朋友对我可好了//@风吹铃铛响叮叮:能把这种哈批打一顿吗//@沈三废: 一时语塞	未
能打球，能晒鞋，so Swaggy。	未
能扫雷吗//@电玩口袋社区: 是时候找机会评测下特斯拉的游戏性能了	未
能拿回，真是福气了........微博赚钱季 2019的黑天鹅和白天鹅	未
能挂目标的圣诞树，听起来还挺励志的	未
能明白这一段话，你的心会舒服点	未
能有这张卡的淮安人据说可以省下近1000人民币.....	未
能梦见你是我的过人之处费尔南多佩索阿	未
能源互联网将催生新变革	未
能源内参原油重挫近8再创年内新低证监会核准中国铝业向中国人寿等发行股份购买资产世界银行将加大投资推动治理气候变化新奥拟收购金鸿控股旗下3家子公司华电集团40亿元债转股项目落地中国石化资本公司正式运营 注册资本100亿元人民币。 能源内参  原油重挫近8再创年内新低证监会核准中国铝业向中国人寿等发行股份购买资产	未
能源基金会邹骥：从五方面评判全国碳市场是否成功	未
能源局将多管齐下 促地热产业发展	未
能源消耗年度考核结果发布12省份为超额完成等级  20181206要闻	未
能满足你所有旅行需求的国家	未
能用好久	未
能给你留面子 也希望你长脑子	未
能花掉线下券的买才划算	未
能获得你们今日的垂青吗每天都可以扫哦，昨天扫了的今日依旧可以扫哦，过了12点了哈哈！爱你们！今天我看到有人扫了40块，我今天扫了7块，解决了我今天的饭钱。	未
能让你少奋斗20年的说话技巧！ 打开支忖宝搜 515041699 领99元红包 瓜分15亿.	未
能让火百炼钢化为绕指柔的只有pcy本人 太漂亮了我螺旋倒地	未
能讲一个你通过坚持不懈取得成就的事件吗	未
能量 Card ：学会放下过去，握住最重要的现在	未
//@能量中国官方:居沙成塔，共同建成100所朱一龙健康体育室！	未
脐橙免费送！2000斤正宗秭归脐橙南昌人免费送！可以喝着吃的多汁脐橙，还不抓紧！	未
脐橙采摘旅游季丨我为脐橙代言，随手拍拿大奖，于都橙园等你来！	未
脑中浮现的是Mickey和ian的脸//@Tiger公子:嗷嗷嗷！//@商小略:可爱//@格纹雷嘻嘻嘻:然而狗做错了什么呢//@卡伽弥 ://@普通选手梧克 : //@CHRISROSE现充中 :放过狗//@疯子511 ://@sawaki呀 ://@Mikisaki :艹爱了	未
脑子一热五分钟就订好了去北海道的机票，又可以去看雪啦！	未
《脑残粉》11月2日上映 “宝莱坞之王”沙鲁克·汗分饰两角	未
脑洞大开 5G智慧医院=5G+医疗“黑科技”	未
脑洞大开 惊悚电影《午夜整容室》今日公映	未
脑洞大开的科幻 Remedy工作室公布《控制》新截图505公司和Remedy工作室公布了一批《控制》的新截图，展示了一些风格独特的场景。《控制》是一款科幻题材超自然能力动作冒险游戏，采用沙盒设计，以剧情为主要驱动力，用Northlight引擎打造。玩家将拥有超自然能力，同时也可以使用大量高科技装备，进行高度自定义并与环境进行高度互动，对抗神秘世界。《控制》预计2019年发售，支持实时光线追踪技术。	未
脑洞超市 方便面	未
脑海里就这三件事：减肥 挣钱 游天下	未
脑电信号神经反馈训练可增强抗压性	未
脑瘫女孩写出13万字小说 向“云上的奶奶”致敬	未
脑瘫少年10岁养鸡 18岁赚钱养家 如今认真养鸡 报答奶奶抚养之恩山东菏泽，一名脑瘫少年自幼由奶奶抚养长大。今年，18岁的他开始养殖柴鸡，通过网上销售，挑起家庭重担。患有先天性脑瘫。奶奶一手带大。如今认真养鸡，报答奶奶抚养之恩	未
脑瘫患儿赞志愿者“你们真善良”	未
脚上有这3个信号就能长寿！你中了几个	未
脚后跟干裂龟裂防手足开裂皲裂脱皮马油膏足部护理冻疮膏护手霜女 15元券微博专享限时领券	未
脚手架搭设标准化图册，以后搭设脚手架就看这里吧！	未
脚步不停 365个旅行故事 寂寞星球里住着无数的小星星，冰岛的空气是冷的，心却炙热。旅行新势力 冰岛旅行 @带着微博去旅行 @微博故事微博视频 脚步不停	未
脚步不停 一步一年的旅行 年四岁 看看能不能逃离这雾霾 微博视频 脚步不停	未
脚步不停 世界上最高的峰叫什么峰 微博视频 脚步不停	未
脚步不停 世界第一崖，百分之99的人不敢挑战。 想试下嘛 微博视频 脚步不停	未
脚步不停 今天貌似全国的天气都这样啊，不是雪就是雨，你那里是不是不止旅行 旅行新势力 V影响力峰会微博视频 脚步不停	未
脚步不停 内江微分享 都说不到长城非好汉，那就来登一盘长城吧北国的冬天，呼呼的风真的够冻。我的江豆们一定要注意保暖。 微博视频 脚步不停	未
脚步不停 冰岛 在夕阳下的最北边，冰岛海看到两只喷水的鲸鱼，喜欢这种不期而遇的小幸运冰岛旅行 365个旅行故事 V影响力峰会 @微博故事 @带着微博去旅行微博视频 脚步不停	未
脚步不停 别有洞天啊 微博视频 脚步不停	未
脚步不停 去香港一定要做的天星小轮，你们猜猜一张船票多少钱旅行新势力 不止旅行 V影响力峰会微博视频 脚步不停	未
脚步不停 回程飞机上拍的，感觉暖烘烘软绵绵，很好吃的样子，这大概就是传说中的慕容云海吧。 微博视频 脚步不停	未
脚步不停 尖沙咀码头看维港，最右那个是2块钱的天星小轮，可以坐到对面的中环不止旅行 旅行新势力 V影响力峰会微博视频 脚步不停	未
脚步不停 尖沙咀重庆大厦的兰芳园茶餐厅，丝袜奶茶已经有66年历史了，是港式奶茶的鼻祖，众多明星喜欢的店，谭校长强烈推荐不止旅行 旅行新势力 V影响力峰会微博视频 脚步不停	未
脚步不停 工作不容易 微博视频 脚步不停	未
脚步不停 巴黎左岸拉丁天堂，她们跳的这个曲子叫啥来着不止旅行 旅行新势力 V影响力峰会微博视频 脚步不停	未
脚步不停 巴黎左岸拉丁天堂，舞跳得非常好，但是我唯一不理解的是她们为什么要喊哈哈不止旅行 旅行新势力 V影响力峰会微博视频 脚步不停	未
脚步不停 成都太古里这算是口罩还是面巾 微博视频 脚步不停	未
