天气清晨起床看不见还好我们还有中午的太阳！	未
天气渐冷，不要再用这个东西取暖了，很多人都受伤了！	未
天气渐冷，咳嗽增多，记住这个小方法，一分钟止咳。	未
天气渐冷无锡部分市民自己动手腌制咸菜	未
天气渐冷，杭州最全泡汤攻略都在这里了！	未
天气渐冷，约个人去吃火锅吧	未
天气渐冷，艾特想和他一块儿吃火锅人。 .	未
天气甚寒，何不赴一场风花雪月	未
天气的变化，人情的冷暖，不同的风景都会影响你的心情	未
天气真好想就地一躺当场入睡（	未
天气真的越来越冷了	未
天气虽然有点冷，没关系！蜀黍依然会在路上等你！	未
天气要闻 目前我市除了南沙以外各区都挂上寒冷预警啦，天气逐渐转阴冷，注意适时添衣加被哦 冷空气今日夜间入穗 风力增大  天气转阴冷 需注意防寒保暖	未
天气话你知 不怕冷小编：一件长袖表达我对冷空气的尊重	未
天气话你知 之前问花期的同学们注意啦预计萝岗香雪梅花花期较往年略偏晚。预计12月28日前后进入初花期，2019年1月11日前后进入盛花期2019年1月22日前后进入凋谢期。	未
天气话你知 喝水也拯救不了鼻子	未
天气话你知 小编已经预料到明天会有一大波穿多的跑过来说小编是骗几，在这里再给大家划个重点：明天多云为主，气温比今天稍微高一些，后天冷空气前锋才会抵达，所以大家明天穿衣可以比今天少一件，小编觉得短袖/长袖配个薄外套就好，毕竟早晚还是比较凉的啦	未
天气话你知 小雨扰人路面湿滑，大家出行注意交通安全。	未
天气话你知 有局部番茄炒蛋呢，北边的小可爱们带伞了吗注意躲避哦	未
天气话你知 湿漉漉湿漉漉，市区湿度均保持在80以上衣服基本上很难晾干	未
天气话你知 现场版乱穿衣	未
天气话你知 雨水的范围进一步扩大，目前花都白云从化都有小雨，鸡腿图的北部也开始染上代表个位数的深蓝色了	未
天气越发寒冷  关于流感的那些事你必须知道	未
天气越来越冷，为什么启动车时瑟瑟发抖	未
天气越来越冷了。。。	未
天气越来越冷了，你的车上多了哪些配备和措施呢	未
天气越来越冷了 大家记得保暖	未
天气越来越冷了，很多流浪猫狗会靠夜景地灯或者暖气管取暖，请不要难为它们。如果在你楼道里进来了流浪小动物，请不要驱赶它们，若家里有不要的剩饭剩菜可以施舍给他们点，拿个不用的小碗放在角落就行。再用大的饮料瓶剪开放点水，往水里放点糖搅拌，这样水会结冰得慢点。举手之劳，爱心接力！	未
天气越来越冷了，最近急需一些好吃不贵还能补充能量的点心，偶然发现聚划算在做一个汇聚澳门的活动，据说都是来自澳门的本地老字号产品，几十上百年的传承，独特的风味纯手工制作，别具匠心，吃完说不定还会增加好运气重要的是现在满199-10，第二件半价等优惠特别多，现在打开手机淘宝，搜索好运澳门一键直达聚划算汇聚系列好运澳门	未
天气越来越冷了，汽车周围成了流浪小动物的避风港，但它们也可能因此被碾压或烫死。开车前别忘检查一下，拍拍引擎盖，按按喇叭。转给司机！央视新闻	未
天气越来越冷了注意保暖	未
天气越来越冷了，请为它们转发一条微博！今年也请多关照。 关爱流浪猫狗	未
天气越来越冷啦，你那里下雪了吗不知道我的小宝贝们冷不冷穿上秋裤了没啊转发评论告诉郑太你的保暖小绝招，抓一个小可爱送出jie个可口可乐保温杯这个冬天，郑太暖你鸭	未
天气越来越冷，开车前，请拍拍猫！	未
天气越来越冷，御寒小物可以拿出来啦	未
天气越来越冷是不是想要入手一件御寒装备来应对寒冷的冬天！让outside年度户外装备大奖为你支招！作为全球最权威的户外奖项之一，该奖项深受消费者关注，是户外生活的风向标。2019 Outside户外年度装备大奖宣布波司登荣获羽绒服品类唯一中国品牌。波司登以专业与质量说服每个国内外运动爱好者们，大家还不快跟上一件神装，一起来波司登感受户外旅行的独特魅力！	未
天气越来越冷，胎压要不要升高一点河南交警说	未
天气越来越冷，要注意保暖呀(ins：itsmaysmemes )	未
天气趋势今天夜间本市西部和中部地区阴有中到大雪明天早晨到上午，全市仍有雨夹雪或小雪，中午起转为小雨后天（10日）又将迎来一次明显降雨过程预计下周三（12日）开始，本市的连阴雨（雪）天气才有望结束另外，按目前的气温走势，上海此次入冬几无悬念	未
天气跟踪 冷！昨天夜间到今天早晨，观象台最低气温为-6.8，城区站点的最低气温在-7-5之间不过这还没开始，冷空气明天还要放大招，小伙伴们请做好防寒的准备	未
天气跟踪北京时间06:10，目前全市大部分地区北风风力在23间4级，西部北部局地阵风较大，早晨上班要注意防风防寒	未
天气跟踪 受河北大雾影响，部分高速路段已封闭，请大家及时关注最新路况信息，注意交通安全	未
天气跟踪昨夜平原地区最低气温普遍跌破-11，汤河口跌破-20。有句话怎么说来着我这条命夏天是空调给的，冬天是暖气给的	未
天气转冷了，早点进被窝了！	未
天气转冷，把这些冬季防火小知识教给家里的老人	未
天气转冷，收好这份降温天里的生存法则！近日，超凶降温出现！保暖工作提上日程。大风降温天气，如何穿衣更保暖保暖做不好，哪些疾病找上门了解降温天里的生存法则快快转走吧！	未
天气转冷火锅半成品食材畅销 市民购买要当心	未
天气转凉啦，你觉得冷空气和什么最配呢	未
天气这么冷，为什么游资还选择了炒作5G1政Z正确2有群众基础（大家不懂5G，但都用手机）3媒体强关注（华为）4有想象空间（概念特征明显）5符合预期主流（属科创类）6券商策略会会陆续推荐（围猎神助攻）。理由太多，讲政Z的游资怎么舍得放弃这么好的围猎机会，即使上周 ...全文	未
天气这么冷，你知道怎么取暖吗	未
天气这么冷，好想一把扎进你的怀里闻一闻你身上的味道。	未
天气@连云港人 冲出霾伏，还要再等几天	未
天气连续三天下雨，安阳西城公园玻璃护栏...	未
天气 追追赶赶，高高低低气温坐上了摩天轮，昨天降了点，未来几天又升回去，再过几天又大降。可这样跟它荡来荡去，无畏无惧 @广州天气	未
天气逐渐降温，谷饶这群小黄人穿街走巷送棉被...	未
天气那么冷，这件事关生存的大事该做了	未
天气阴沉 心情应好今早天空的基调就基本定调了今天全天了。11时全市均温6.3，@成都气象 预计午后天空模式不变，局部地方有点零星小雨，午后最高9。傍晚到夜间裹着云层的蓉城，气温波动也小，夜间最低4。没啥说的，这天就是和晚上早点睡，明早睡醒起呀！	未
天气阴沉 心情应好今早天空的基调就基本定调了今天全天了11时全市均温6.3，@成都气象 预计午后天空模式不变，局部地方有点零星小雨，午后最高9傍晚到夜间裹着云层的蓉城，气温波动也小，夜间最低4没啥说的，这天就是和晚上早点睡，明早睡醒起呀！	未
天气阴沉 心情应好成都午间天气今早天空的基调就基本定调了今天全天了11时成都市均温6.3，@成都气象 预计午后天空模式不变，局部地方有点零星小雨，午后最高9傍晚到夜间裹着云层的蓉城，气温波动也小，夜间最低4没啥说的，这天就是和晚上早点睡，明早睡醒起呀！	未
天气降温！这份自来水管的防寒生存指南，如皋市民请收下！	未
天气霾再次袭来，安阳一公交车到站未停乘客大吼，结果...	未
天气霾去霾又来	未
天气静宁天气又要变脸，保暖你还在靠抖吗	未
天气预告！今晚强冷空气降临	未
天气预报	未
天气预报丨冷冷冷！未来三天锡盟气温持续偏低！	未
天气预报冷空气发飙，保定气温狂降到-11！	未
天气预报延庆区气象台发布持续低温黄色预警信号	未
天气预报显示：下周末长沙下雪！你信不信长沙生活	未
天气预报 未来三天全国天气预报12月06日	未
天气预报未来三天，冷空气继续肆虐！	未
天气预报要从晴变成多云了，而且部分地区还有雨未来三天预报	未
天气预报说周六成都下雪，你信吗成都	未
天气预报（附限行措施）	未
《天气预爆》：只适合不挑剔的观众随便打发下时间	未
《天气预爆》曝＂神仙不易当＂特辑 肖央艰难＂成神＂	未
《天气预爆》曝“防寒秘籍” 肖央杜鹃变导购	未
天气预警近期通化地区持续降温路况复杂，通化交警为您整理的危险路段注意查收	未
天气风雪停 周一冷	未
天気	未
天氣涼涼 大家趕快回家一起看聲林之王By喜鵲小粉絲	未
天水一吊车在施工中突然侧翻	未
天水一家麻辣条小作坊被查，太可怕了！	未
天水一无证辣条作坊被查	未
天水一男子半夜突然肚子疼，知道真相后立马卖车卖房，他竟然是为了...	未
天水一色泸沽湖	未
天水三中新校区主体工程全部完工，搬迁时间在......	未
天水交警执勤过程中被打伤，现场视频曝光！	未
@天水人，你常座的公交线路有调整！	未
天水人注意：明后两天这些地方要停水！快来看看有没有你家	未
天水人注意：最新道路交通管制来袭，关系到你的出行！	未
@天水公务员  新变化，公务员加班补助要来了	未
天水又有一条路上停满了僵尸车，影响市民安全出行	未
天水双玉兰堂景区即将开工，要建......	未
天水周边出现罕见沙尘暴，堪比科幻大片！我市天气是否遭受影响（附视频）	未
天水城东要开挂七里墩片区改造各种项目开工在即，详情戳	未
天水城区出租车计价器全部更换，新增的这些业务你得知道！	未
天水市交警在羲皇大道执勤被打，现场视频曝光！	未
天水市公安局招聘公益性岗位工作人员面试通知	未
天水市召开全市宣传思想工作会议(图)	未
天水市城镇企业职工大额医疗保险办法(全文)	未
天水市常务副市长赵四辈：出租车驾驶员服务态度明显好转(图)	未
天水市秦州城区交警集中销毁假牌空牌200余副	未
天水市第一人民医院招聘编外医生公告	未
天水市自来水公司发布11月28日29日停水通知	未
天水惊现塑料做的油饼，一起来看看真相...	未
天水最新道路交通管制来啦速看关系到你的出行	未
天水湖湖面尚未完全结冰，市民千万别上去！	未
天水网约车真来了！三家网约车平台的60多名学员接受培训！	未
天水羲皇大道为何变成了停车场	未
@天水老司机，这条路上的电子警察即将上岗	未
天水街头，一个拉着棺材的小伙要去西藏...	未
天水郡至七里墩的路段，花式停车让交警和住户头都大了！	未
天河体育场的座椅拆除了。	未
天河体育场的座椅拆除了	未
天河公园南门广场建好又拆原来这次围蔽施工是因为	未
天河区组织召开寄递物流行业治安管控工作培训会议	未
天河区黄村立交南引桥将封闭，车主出行请留意！	未
天河工程落地记 黄河之水何以天上调来像游戏里的超级武器天气控制机一样，一项名为天河工程的科研项目旨在构建南水北调空中走廊，将三江源长江流域的丰富降水从天上搬运到黄河流域，以解北方缺水之困从项目酝酿开始，天河工程团队便不断与多家机构建立联系，有着复杂的朋 ...全文	未
天河工程落地记 黄河之水何以天上调来像游戏里的超级武器天气控制机一样，一项名为天河工程的科研项目旨在构建南水北调空中走廊，将三江源长江流域的丰富降水从天上搬运到黄河流域，以解北方缺水之困。从项目酝酿开始，天河工程团队便不断与多家机构建立联系，有着复杂的朋友圈。该项目并非停留在纸上谈兵的初始阶段，已有一部分设备实体落地，并可能涉及一个大规模人工增雨计划。项目发起人王光谦在清华大学水利工程系官网发表的最新个人回应中，似乎意识到空中跨流域调水的困难。他的回应再未提到 诱导空中	未
天河工程被指是荒诞幻想项目 王光谦院士回应质疑天河工程研究团队的负责人，中国科学院院士王光谦表示：从地上调水是方案之一。南水北调西线工程，我本人是支持的，但确实在造价生态环境方面都有压力。我们就在想别的办法。如实给你讲，2013年前我都没想到办法。2013年我有机会到青海工作。青海的云和北京的云不一样，青海的云压着我的头，我感觉，天上的水和地上的水是连着的，我想到了天河动力学理论。没错，地上的水利人有时候需要往天上看看，河流动力学和天河动力学是相通的。天河工程被指是荒诞幻想项目	未
天河工程被指荒诞后 清华等牵头参与单位三缄其口	未
天河工程被指荒诞后，清华青海大学青海省科技厅三缄其口。(澎湃)	未
天河工程被指荒诞幻想，项目负责人全国政协委员王光谦院士回应了！都是你想知道的	未
天河工程负责人回应质疑：项目价值在创新引领	未
天河工程负责人回应质疑：项目价值在创新引领跨区域空中调水项目天河工程被气象学家质疑是缺乏科学基础和技术可行性的荒诞幻想后，天河工程研究团队负责人中科院院士王光谦称，项目在创新引领方面有价值，且有很多气象学家参与，项目仍处于探索研究阶段 天河工程负责人回应质疑：项目价值在创新引领	未
“天河工程”负责人王光谦院士回应质疑	未
天河工程质疑声中上马 气象专家称其为荒诞幻想	未
天河工程遭质疑 项目参与者：自有考量科学网援引多位气象大气领域专家意见，称天河工程气象学界集体缺席前期论证荒诞幻想项目等对于质疑，三江源生态与高原农牧业国家重点实验室首席科学家黄跃飞回应：天河工程有自己的考量，我们就做自己的事，现在不接受采访(新京报)  ...全文	未
天津1917年，街道水深数尺马路均可行船	未
@天津8890	未
天津ofo小黄车5月份的工资欠了半年多不给怎么解决应该找哪里能给解决下呢@媒体人 @劳动仲裁 @奏耐天津	未
天津一17岁少年身受刀伤 尖刀留在腹腔 情况危急医生全力抢救	未
天津一个月的连拍，蓝天雾霾一目了然，隔着屏幕让你来感受一下	未
天津一商场内圣诞树起火 官方：已扑灭 无人员伤亡	未
天津一商场内圣诞树起火 楼顶宣传条幅被点燃	未
天津一对老人在寒风中等车，这一幕暖哭所有人了！果然狗粮还是陈年的好	未
天津一小伙坐公交只投一块钱，理由奇葩：我只坐一站地	未
天津一汽丰田召回部分威驰汽车 共计5032辆	未
天津一汽丰田、广汽丰田等公司召回部分汽车	未
天津一汽丰田部分威驰汽车将被召回滨海微服务 据国家市场监督管理总局网站消息，日前，天津一汽丰田汽车有限公司根据《缺陷汽车产品召回管理条例》和《缺陷汽车产品召回管理条例实施办法》的要求，向国家市场监督管理总局备案了召回计划，决定自2019年1月31日起，召回2002年10月23日至2003年4月15日期间生产的部分威驰汽车，共计5032辆。本次召回范围内车辆的副驾驶安全气囊装配了高田公司生产的未带干燥剂的硝酸铵气体发生器。在安全气囊展开时，气体发生器可能发生异常破损，导致碎片飞出，伤及车内人员，	未
天津三家银行试点科技立项贷	未
天津三星通信技术有限公司将于12月31日正式停产，该厂主要负责三星部分手机的生产制造。西青管委会方面透露，对于天津三星通信的员工，前期将协助企业做好员工赔付工作，后期帮他们就业，已有员工安置预案。---这回不裁员了，直接关厂。	未
天津下雪 天津今天下了第一场雪，还上了热搜，你那里下雪了吗外面的温度是多少	未
天津专项治理来了！路口发小广告的终于要没了！	未
天津专项治理来了！驾乘人员接受路口小广告购买商品也挨罚！	未
天津东丽区又多了一处新公园，您了去过了吗	未
天津两火车站更名：蓟州站改为蓟州北站，蓟州南站改为蓟州站	未
天津严查黑出租，罚款3000元以上！这些区域重点治理！	未
天津中医药大学第一附属医院2019年公开招聘第一批人员（博士）及总会计师人员方案及岗位计划	未
天津：中央督办外逃人员和“红通”人员实现“清零”	未
天津：中小学幼儿园紫外线消毒灯须由专人管理	未
天津中小学普及性别平等教育：小男子汉、小女生是刻板印象	未
天津中小学普及性平等教育 其实专家们说的性别刻板印象就是我们常说的性别偏见，一种人们对固定性别产生的固定印象。其实无论是父系氏族或者是母系氏族，又或者是现代社会也好，人们对性别的偏见从未停止，其实这也是人类对于性别认知的一种简化形式，将性别细化成一个个标签。但不知什么时候开始，这种标签变得越来越歪，让某些人认为，男的或者是女的就应该干这种事。比如男的就应该是一家之主女的就应该在家相夫教子等等。其实这种标签具有时代性，社会在发展，这种固有的标签或者叫偏见也应该随着社会在改变。	未
天津互联网企业两年内全部单独建立党组织	未
天津交警2019年度残疾人（下肢残疾）机动车专用通行证换领须知 2019年度残疾人（下肢残疾）机动车专用通行证换领须知	未
天津交警220名大中型驾驶人记12分被降级11月20日至12月19日，本市又有220名大中型客货车驾驶人在一个记分周期内记满12分，被依法被注销了最高准驾车型。上述人员名单及具体违法信息已在天津市公安交通管理局交通安全综合服务管理平台（天津市公安交通管理局互联网交通安全服务管理平台）公告公布中公开公示，并向信用 ...全文	未
天津交警交管部门又曝光176辆涉牌违法名单 近期，交管部门综合运用大数据分析比对等技术手段再次锁定了176辆车的涉牌违法行为，并精准还原了其真实号牌上述车辆已被停办所有车务手续，提示涉牌违法车主或驾驶人尽快配合接受处理同时提示驾驶人朋友，切勿再打使用伪造变造遮挡号牌主 ...全文	未
天津交警交管部门又曝光176辆涉牌违法名单 近期，交管部门综合运用大数据分析比对等技术手段再次锁定了176辆车的涉牌违法行为，并精准还原了其真实号牌。上述车辆已被停办所有车务手续，提示涉牌违法车主或驾驶人尽快配合接受处理。同时提示驾驶人朋友，切勿再打使用伪造变造遮挡号牌主意，在大数据分析比对面前，此类违法已经无处遁形。 交管部门又曝光176辆涉牌违法名单	未
天津交警今年以来，交管部门综合利用大数据分析比对稽查布控系统等多种科技手段对涉牌违法进行专项治理，截止目前已陆续锁定1089辆涉牌违法机动车已有近半数车主在接到依法传唤或通知后主动配合接受了处理，截至目前已有448辆涉牌违法机动车接受处罚下一步将继续排查梳理涉牌 ...全文	未
天津交警今年以来，交管部门综合利用大数据分析比对稽查布控系统等多种科技手段对涉牌违法进行专项治理，截止目前已陆续锁定1089辆涉牌违法机动车。已有近半数车主在接到依法传唤或通知后主动配合接受了处理，截至目前已有448辆涉牌违法机动车接受处罚。下一步将继续排查梳理涉牌违法车辆，一旦锁定，将立即停办该车所有车务手续，并开展全区域布控查缉。提示驾驶人涉牌属严重交通违法行为，切勿图一时方便因小失大。 今年以来 交管部门锁定涉牌违法车辆1089辆 已处罚448辆	未
天津交警在行动近日，@天津汉沽交警 积极组织警力持续加强大型货运车辆道路交通违法行为治理	未
天津交警在行动近日，@天津河北交警 新开河大队辅警陈志翔在京津桥岗执勤时捡到一个钱包，内有身份证银行卡及少量现金，陈志翔立即联系大队值班室通过身份证查找失主，当晚，失主陈先生来到大队认领钱包，并对陈志翔表示感谢	未
天津交警在行动近日，@天津河北交警 组织夜检，专项治理酒驾和微面小客车违法行为	未
天津交警在行动近日，@天津津南交警 双港大队在天津大道持续开展大货车闯禁行的治理，期间共查获违法行驶的大货车30余辆，并依法对全部违法驾驶员进行了处罚	未
天津交警在行动近日，@天津津南交警 津港公路大队在治理时连续查获两辆运送外来务工人员的小型客车存在超员的违法行为。民警在对司乘人员进行道路交通安全教育后，责令违法驾驶员对超出人员进行转乘，并依法对违法驾驶员进行了处罚并记分。	未
天津交警在行动近日，@天津津南交警 津港公路大队在治理时连续查获两辆运送外来务工人员的小型客车存在超员的违法行为民警在对司乘人员进行道路交通安全教育后，责令违法驾驶员对超出人员进行转乘，并依法对违法驾驶员进行了处罚并记分	未
天津交警地铁5号线多个站点临近完工 施工路段道路恢复双向通行近日，随着本市地铁5号线西南楼站大直沽西路站下瓦房地铁站施工接近尾声，因施工期间调整的多条道路目前均已恢复双向通行 地铁5号线多个站点临近完工 施工路段道路恢复双向通行	未
天津交警地铁5号线多个站点临近完工 施工路段道路恢复双向通行近日，随着本市地铁5号线西南楼站大直沽西路站下瓦房地铁站施工接近尾声，因施工期间调整的多条道路目前均已恢复双向通行。 地铁5号线多个站点临近完工 施工路段道路恢复双向通行	未
@天津交警  @天津交通广播  @天津发布  @奏耐天津  @都市报道60分  我今天在黑牛城道上解放南路至尖山路路段，骑自行车逆行被河西支队解放南路支队两位交警同志进行了处罚，对于我自己的违法行为，我十分认同也欣然接受了处罚但是两位交警同志在处罚我的同时，有另一位男同志骑着哈啰单车和我违反了 ...全文	未
天津交警天津市2018年三季度交通运行报告 天津市2018年三季度交通运行报告	未
天津交警市区第二处行人闯红灯人脸识别曝光系统上岗本市和平区南京路营口道交口宝坻区和滨海新区多个路口启用人像识别系统抓拍曝光行人和非机动车闯灯交通违法行为后，对市民自觉做到尊法出行起到了不小作用，行人非机动车守法率明显上升。近日，市区第二处行人闯红灯人脸识别曝光系统在 ...全文	未
天津交警市区第二处行人闯红灯人脸识别曝光系统上岗本市和平区南京路营口道交口宝坻区和滨海新区多个路口启用人像识别系统抓拍曝光行人和非机动车闯灯交通违法行为后，对市民自觉做到尊法出行起到了不小作用，行人非机动车守法率明显上升。近日，市区第二处行人闯红灯人脸识别曝光系统在围堤道贵州路交口正式投入使用，且自8月底试运行以来，平均每天都有10至20名闯灯违法者被抓拍曝光。此种设备还在增设中，预计明年市内六区的投用总数将达到30套，同时还会联合天津广播电视台，通过电视节目对违法者进行了曝光。 市区第	未
天津交警我市交管部门公布案例 不拘小节危害敲警钟随着移动智能设备的普及，驾车骑车走路时也忍不住打手机刷微信，似乎已经成为很多人的习惯然而这样不拘小节的行为到底有多危险交管部门日前公布了一批今年以来发生在我市的真实交通事故案例，其中不乏导致人员伤亡的悲剧，着 ...全文	未
天津交警本市发布寒潮蓝色预警 驾车遇大风路面结冰需当心 本市发布寒潮蓝色预警 驾车遇大风路面结冰需当心	未
@天津交警：本月8千余驾驶人驾照有效期满需换证，警邮平台一站式医院及交管窗口平台均可办理本月8千余驾驶人驾照有效期满需换证	未
天津交警本月8千余驾驶人驾照有效期满需换证，警邮平台一站式医院及交管窗口平台均可办理 本月8千余驾驶人驾照有效期满需换证	未
