天堂使者徐申权接到组织通知的那天，徐申权的内心是失落的。作为部队里为数不多的光学技师，徐申权曾多次立功受奖。当时，父母妻子都坚决反对。一些战友听说他被分配到殡仪馆，也纷纷劝他辞职，一起经商。但他最终决定接受挑战，并且干一行专一行，做好对逝者本人生命尊严的最后一次呵护。抚慰了千千万万伤心家属。 天堂使者徐申权	未
天堂和地狱都在我们每个人自己身上	未
天堂很远，昭苏很近	未
天堂的门票（好文）	未
天塌了个窟窿吗@深圳天气 @米兰幽兰 深圳盐田港	未
天境云宿，让你把日出云海搬进卧室	未
天壕环境：参股公司基因编辑婴儿事件与本公司的经营业务无关	未
天壕环境：确认间接投资贺建奎旗下公司，但与公司主营无关	未
天士力控股集团副总裁、天士力资本总经理马强： 产融结合困境根源在于盈利模式	未
天大医教联合体成立 6家附属医院揭牌今日，天津大学医教联合体在天大成立。天大与海河医院儿童医院环湖医院胸科医院和中西医结合医院5家医院签署全面合作关系协议，分别合作共建附属医院。仪式上，5家医院正式揭牌。此外，已成立的天津大学天津医院此次同期揭牌。	未
天大地大竟然没有我安身之地	未
天，大家给他出出主意！	未
天大设全国首个研究生教育学专业	未
@天天乐道-津津有味：随拍大雪未见雪，只是天已寒！（20181207）	未
天天做家务，女子肩膀惊现15颗珍珠！太煎熬	未
天天做家务，女子肩膀惊现15颗珍珠！实在太煎熬	未
天天做家务，杭州女子肩膀惊现15颗珍珠！实在太煎熬	未
天天做家务，浙江女子肩膀惊现15颗珍珠！实在太煎熬	未
天天写这些干啥啊他直播的时候也是低声下气要1400元呀	未
天天刷朋友圈， 不如刷一周三期的《每周文摘》	未
天天加班累死累活， 在外打工的才懂， 在两广朋友圈火了！	未
天天发团：天天发团 四人成行 跳岛假期 泰国普吉岛攀牙5天4晚	未
天天发广告烦不烦有这样的拍卖活动请再来一打！	未
天天可以领红包，领不上大红包，我也不会告诉你啦！	未
天天听法，师父竟然说：不要相信我！丨《楞严经》8	未
天天喊着减肥却爱吃奶油蛋糕的举手	未
天天喝咖啡，你却不知道种咖啡的农民有多难	未
天天坐公交的我_//@A子非渔:才29就开a6，我还是小电驴，感觉应该轻生厌世的是我	未
天天开汇10条铁路新线将投入运营！看看涉及你家吗今年底，哈牡高铁杭黄铁路等10条新线将开通运营。2019年1月5日起，全国铁路实施新列车运行图，承德日照雅安等城市首开动车，多个城市间列车运行时间大幅缩短。调图涉及哪些线路火车出行有哪些变化自主选座高铁订餐你都会用吗戳转需！ 网页链接（来源：人民日报）	未
天天开汇 春运首日火车票本月23日开售，这份抢票时间表请收好！距离春节虽然还有不到两个月时间，但春运抢票的日子快来了！你知道吗除夕当日票最早将于1月6日开抢！买火车票有哪些途径没抢到票有几次捡漏机会还有候补购票自主选座等新功能戳图了解九图在手，回家不愁！网页链接（来源：人民日报）	未
天天开汇转发了解！坐等年终奖这些你要知道！辛苦了一整年，终于快到年关，是不是在坐等年终奖！可是人人都有年终奖吗新进职工有份吗提前离职能不能拿个税改革对你的钱袋子有影响吗戳图，关于年终奖的那些疑问与自己的权益息息相关，转给身边的小伙伴！网页链接（来源：人民日报）	未
天天开汇转发微博，向消防英雄致敬他们寒冬救火，自己却全身结冰他们风雪中逆行，只为排查沿途险情他们用臂膀托起一个个生命，自己却常常因救援而倒下哪里有危难，他们就在哪里。和平年代，他们与牺牲如此接近，只为守护你我平安。转发，致敬消防英雄！愿你每次出发，都能平安归来！网页链接（来源：人民日报）	未
天天开汇速速转存！2019放假安排来了！春节假期从除夕到初六共7天，五一只休一天2019全年放假安排，戳必知，转存！微博正文（来源：人民日报）	未
天天开汇随手转发，你就可能挽救一条小生命！近日来天气越来越冷，一些流浪的小动物们开始寻找温暖的住所。曾有小动物在车底取暖惨遭碾死，提醒各位开车的小伙伴：开车前，拍拍引擎盖，按下喇叭，前后检查下以确保没有熟睡的小动物！为了您和它们的安全，转发扩散！网页链接（来源：人民日报）	未
天天微导读我省完成村（社区）两委换届河北紧急通知：做好近期大风强降温天气应对工作河北：坚决遏制系统性区域性安全问题发生我省开展高校毕业生就业服务周活动今晨我省平原大部有浓雾塞罕坝林一代任仲元：见证绿色奇迹，此生无怨无悔。头版源/河北日报	未
天天批判这个dw那个dw的 团婊们倒是把自己头像都换成七个人的啊 省得每次顶着我爱豆头像出去嘴欠 招来的rs全都要唯饭收拾[淚]	未
天天拍车COO张延伟：广告流量红利将退烧，2019二手车商将走向专业化日前，国内二手车拍卖平台天天拍车COO张延伟在接受记者采访时预测了2019年二手车行业将会发生四个变化：信息不对称暴利时代已终结，车商将走向专业化规模化直卖模式悄然退场，二手车拍卖正在崛起跨区域流通越烧越火，成交易增长主要驱动力广告流量红利将退烧，真实口碑考验企业竞争力。天天拍车COO张延伟：广告流量红利将退烧，2019二手车商将走向专业化	未
天天早盘@狂龙十八段 的一直播（下载App-gt网页链接）	未
天天正能量正能量主播琪琪Alina：此生万幸，和这样的你们相逢人生多艰，我们常说人间不值得。但还好，每次总有你们在身边，或经年累月的默默守护，或在一刹那的挺身而出阿里天天正能量第50期公益直播正在进行中，敬请关注，参与互动！	未
天天正能量的网友分享了自己被陌生人递纸巾的一些暖心事，这个世界总有些残忍，生活也不会经常对你温柔以待，但你注意到了么，关键时刻，总会有善良的人给你温暖！转起传递温暖！	未
天天看到那个有几十亩工厂的老板开着别克朝八晚六的上下班人小小一只	未
天天看池州  下周，阴雨代替大雾接管池州  12月1日起 城区再增2处交通技术监控设备	未
天天看池州  平天湖：候鸟，我们给你越冬的家  安徽车主注意！这些加油站油品不合格！	未
天天看池州  我市在省少数民族传统体育运动会斩获1金4银6铜  主城区禁止乱贴小广告 违者将严厉查处	未
天天看池州  我市首家融媒体中心揭牌  殷汇和杏花村上榜千年古镇古村落候选名单公示	未
天天看池州  清理私家菜园  建设免费停车场  昨夜今晨 安徽50县市发布大雾预警	未
天天红枣枸杞的我	未
天天网上冲浪，看别人家的男朋友，别人家的喵，现在居然让我看别人家的圣诞节！！！而且居然现在才看见！！！听说，天猫Club为超级会员举办了一场海底奇遇圣诞派对，体验超豪华海王同款神奇水底套房！不过现在还有机会，打开淘宝APP-拍立淘，也许赢得入住三亚亚特兰蒂斯天猫超级样板间惊喜大奖的人就是你！戳链接：网页链接	未
天天被他带着在电竞圈体育圈航空业跑，时长忘记我其实是娱乐圈的lwjj	未
天天被筱青揍，终于找到一处可以藏身，小三三你也有今天	未
天天说天天说，福安交警还是一天内查获5人酒驾！	未
天天说股午后仍将震荡！	未
天天跟你讲情怀的，是大忽悠天天跟你讲奉献的，是大骗子。	未
天天这种事儿，各种言之凿凿：	未
天天防火	未
天太冷 可是姐妹相约 怎能不聚 冷的我在客厅小暖风机旁坐着化妆	未
天太黑还是没注意，法国公交车司机撞倒行人竟然没发现法国格勒诺布尔11月22日凌晨发生一起公交车意外冲撞行人事件，造成一人受伤。事发凌晨1点左右，这辆公交车在撞倒一名20岁的行人后继续行驶，司机当时误以为撞到石头因此并未停车，伤者由于头部遭到撞击被送往医院接受救治，但并无性命之忧。根据介绍，这名司机未被检测出酒驾或毒驾，相关调查目前已经展开。近距离看法国	未
天奇股份：天奇循环产投拟利用自有资金5850万元受让锂致实业65%股权	未
天奇股份：股东天奇投资所持4026万股将解禁	未
天子之怒 没啥，朕只是让你体验一下。	未
天子山索道招聘信息	未
天安门前敬礼的那位最年长老兵走了！明天上午遗体告别	未
天寒人心暖：东营一孕妇车祸受伤 民警脱下警服为其御寒	未
天寒地冻不要怕 四款冬季药膳保暖又驱寒	未
天寒地冻，十万火急寻人。	未
天寒地冻，心不寒，昆武交警为民服务永远在路上	未
天寒地冻忙检修 电网安全度冬峰12月18日，@国网莱芜供电公司 工作人员在35千伏雪野变电站开展35千伏母线检修工作。本次检修工作将持续11天，先后完成1号主变更换1号主变35千伏侧开关维修间隔设备试验等检修任务，大大提高变电站精益化运行水平，保障电网安全迎峰度冬。	未
天寒地冻！急寻年迈母亲青州又现要钱的...	未
天寒地冻，温酒一壶，看大秦帝国之裂变，感慨万千，真希望央视重播赳赳老秦，共赴国难赳赳老秦，还我河山一国家一民族一企业一家庭，从中都能学到许多	未
天寒地冻风劲吹 热火朝天忙检修12月19日，@国网淄博供电公司 组织员工，在凛冽的北风中对10千伏沈岭线槲林支线进行检修消缺，消除线路运行隐患，提高安全供电水平。此次检修共更换横担18组绝缘导线8900米，同时开展了护区清障工作，进一步提升山区供电可靠性，确保群众可靠用电。	未
天寒血热 "三北"地区部队这样冬训	未
天寒风大  防风防寒今天白天晴，北风四级左右（阵风六七级），最高气温2夜间晴间多云，北风二三间四级，最低气温零下9。今天上班时北风三四级，气温零下8到零下4。已发布大风蓝色预警信号，今天风寒效应明显，出行注意防风防寒天干物燥，注意补水保湿和用火用电安全。 早安 @气象北京	未
天将降大任于斯人也，必先苦其心志，劳其筋骨虽然他们这个家庭是不幸的，但有幸的是社会上有这么多好心人帮助他们！小鑫宇一定要做一个坚强的小男子汉，加油！	未
天山南北花盛开用真情为村民办实事解难题	未
天山生物蛇吞象并购后遗症：6亿元配套融资前景难测12月25日，天山生物发布的公告显示，大象广告涉及多起诉讼未及时披露，原实际控制人存在资金挪用违规担保等违法违规情况，部分银行账户被冻结。值得注意的是，虽然大象广告已于2018年4月过户，但重组事宜仍未完成，天山生物还需募集配套资金约6亿元，用于支付资产购买的现金对价和中介费用等。如今大象广告问题爆发，而中国证监会的核准批文有效期仅剩1个月，天山生物能否如期完成配套融资尚不可得知。天山生物蛇吞象并购后遗症：6亿元配套融资前景难测	未
天已冷，但行动不止华灯整治整点开始	未
//@天师-卞赟:	未
//@天师-卞赟:说一点，诸将最怕蒋公手谕，大家都是等着最不了解现场情况的人做判断	未
//@天幕红尘://@清溪龍溪覅變偏僻地: //@310盐水包大能猫://@黑黑_gunner://@-風行雲上-:情商高的体现//@京畿盗图大魔王: //@Mittermeyer_FIA川舵:[米奇比心]//@铃仙丶优昙华院丶稻叶 ://@夜語菲 : //@瞬间炸号肥面包 : //@峨眉峰还他女马独照 :	未
天干物燥，加湿器一开，这一地白雾，也是酸爽了。。。	未
天干物燥 小心她闹 表情包	未
天干物燥 注意用火安全今天晴，北转南风23级，最高气温7。天干物燥，注意用火用电安全，谨防火灾。未来两天天以晴到多云为主，气温较前期明显回暖，调整衣物需注意，谨防着凉感冒。 今日限行尾号2和7。	未
天干物燥，潭山镇人民政府有话对您说...	未
天，平生最怕的就是蜘蛛	未
天府仁寿大道下月通车，仁寿变身成都新南门预计明年1月中旬，天府仁寿大道就可以直通仁寿城区。记者从眉山市仁寿县交通运输局了解到，目前，天府仁寿大道已全线贯通，城区段已经进入最后施工阶段。通车后，成都到仁寿的距离将缩短至30多公里，最快只需要半个多小时。从成都天府广场一路向 ...全文	未
天府仁寿大道下月通车，仁寿变身成都新南门预计明年1月中旬，天府仁寿大道就可以直通仁寿城区。记者从眉山市仁寿县交通运输局了解到，目前，天府仁寿大道已全线贯通，城区段已经进入最后施工阶段。通车后，成都到仁寿的距离将缩短至30多公里，最快只需要半个多小时。从成都天府广场一路向南便可直达仁寿，天府城市百里中轴线完美呈现，仁寿成为大成都组成部分，变身成都新南门。记者 袁丽霞	未
天府公安 每月之星  十一月篇	未
天府大道北延线开工：百里中轴线串起成都德阳	未
天府市民云华西医院挂号服务上线近日，天府市民云又添新功能，华西医院挂号服务正式接入天府市民云平台市民只需登录天府市民云APP首页，点击华西医院栏目，即可享受预约挂号缴费候诊查询等一系列线上服务至此，市民可在天府市民云上享受18家医院的挂号就医等服务 ...全文	未
天府市民云华西医院挂号服务上线近日，天府市民云又添新功能，华西医院挂号服务正式接入天府市民云平台。市民只需登录天府市民云APP首页，点击华西医院栏目，即可享受预约挂号缴费候诊查询等一系列线上服务。至此，市民可在天府市民云上享受18家医院的挂号就医等服务。（成都晚报）	未
天府市民云发布了头条文章：@所有人，有奖吐槽看病时踩过的那些雷区！  @所有人，有奖吐槽看病时踩过的那些雷区！	未
@天府新区人速看 ！天府新区骨干地铁线6号线传来进展 ！	未
天府新区人速看 ！成都地铁5号线一二期南段有重大进展...	未
天府新区再启开挂模式，一天落户两个重量级项目	未
天府新区再开通一条公交线路，主要通往正兴这些地方	未
天府新区又开挂了！这2件刷屏全国的大事，大咖都来了	未
天府新区新增设两家预防接种门诊，就在这两个地方	未
天府新区电子监控交通违法处理窗口推出延时服务今日，据成都交警七分局，从即日起成都交警七分局在新增五处电子监控交通违法处理点位的基础上，推出工作日外的延时服务便民新举措，具体工作时间由周一至周五上午9时至下午17时延时至晚上20时，周六周日工作时间为上午9时至下午17时具体戳图 ...全文	未
天府杯决赛首局陈耀烨胜申真谞占先机	未
天府绿道给成都带来了什么他们给你答案今天在锦城湖跑了7.4公里，虽然很冷，但是很爽！这是市民王磊12月9日在朋友圈发的一条动态配图中，是虽时值深冬却依然绿意盎然的绿道景色一座红色的钢桥穿插在满眼绿意之中，显得格外醒目之前绿道还只是见诸报端的规划和效果图现在经过一年多 ...全文	未
天德日与德合日	未
天性 人性 孝顺  张金	未
天房发展：第一大股东所持3800万股解除质押	未
天才再出山天空体育：前埃弗顿，曼联，桑德兰和西汉姆主帅莫耶斯愿意和刚刚解雇休斯的南安普顿谈判	未
天才出少年，凯尔特人同15岁前锋登贝莱签署职业合同凯尔特人俱乐部方面称，他们已经同15岁的小将卡拉莫克-登贝莱签署了他人生中的第一份职业合同，球员将至少会在这里待到2021年。2013年的时候，登贝莱就加盟了凯尔特人的青训营，2016年，年仅13岁的卡拉莫克-登贝莱为凯尔特人U20的比赛中替补上场，上演了首秀。卡拉莫克-登贝莱在凯尔特人官方网站上表示：在凯尔特人开启职业生涯对我来说意义重大。我很小的时候就来到了这里，在和家人一起经历了很多事情之后，加盟这里让他们感到了骄傲，这是件好事。我想对大家说	未
天才在左，疯子在你们这儿	未
天才//@如梦不落千重影:行	未
天才编程儿童，批量生产  锌式	未
天才都是孤独的[蠟燭]	未
天文专家：清明在阳历4月4日－6日之间变动 5日最多	未
天文台预测香港下周一气温跌至12度受冬季季候风影响，本港天气开始转凉。天文台昨表示，一道冷锋在昨早抵达华南沿岸地区，随后的强烈东北季候风会在未来数天持续影响华南，本港气温会进一步下降及有几阵雨，预测在下周一和周三最低气温均会低至12度，有机会发出今年入冬以来首个寒冷天气警告，呼吁市民做好御寒措施。而长者安居协会亦呼吁长者届时要穿足够御寒衣物，但不要过度臃肿，以免影响血液循环，导致晕眩等症状，加大跌倒的风险。网页链接	未
天文在线群管理均为严格，大家加群因此需要文明用语，并且要认真阅读群公告，本线将不定期冒泡（红包）。	未
天文学家发现一颗系外行星“像气球一样膨胀”	未
天文学家观测到太阳系迄今最遥远天体	未
天文抚仙湖上空的星空看看我刚刚使用手机拍摄的昴宿星团（七姊妹星团）以及夏季大三角（织女星牛郎星天津四）参数：ISO1250，曝光25秒环境：希尔顿酒店光污染严重！	未
天文观测证实原行星盘中存在旋涡结构	未
天文酷图 11月14日在山脉隘口见到的崎岖雪峰，下方则是位在意大利多罗迈高山里的阿尔塔巴迪亚区之拉维拉村在山凹的小村灯火上方，可见到悬在北方地平面上方的北斗七星不过，影像中最让人赞叹不已的，是明亮的火流星@陨尘NANG  早安	未
天文酷图 2018年2月12日，加拿大卡尔加里的天空覆盖着油彩[小仙女][小仙女][小仙女][小仙女]	未
天文酷图 仙女座星系是一个螺旋星系，距离地球大约250万光年，是除麦哲伦云以外最近的星系位于仙女座的方向上，是人类肉眼可见最远的深空天体 仙女座星系被相信是本星系群中最大的星系，直径约20万光年，外表颇似银河系本星系群的成员有仙女星系银河系三角座星系，还有大约50个小星系 ...全文	未
天文 金星与月牙以及太阳射电望远镜	未
天新邛快速路邛崃段二期工程今日开工，去成都又多了一个选择！	未
天方夜谈其实电梯就是一个大型蒸箱，叮得一声打开门，门里也许还有个熟人。	未
天时卡言，往早仔唔洗亿，伊胶己洗脚	未
天星镇便民信息招聘启事旺铺转让机械租赁地基转让.....	未
天是冷的 情是暖的荔波公安给这群老人送去冬日暖阳	未
天是真的冷了，一个个缩那么里面，不过就在刚刚，我坐床上发这条微博的时候，灰灰翻越了楼梯口的围栏，爬上了楼	未
天晴不代表升温，乌市入冬最冷天气马上到！	未
天晴气爽  寒冷依旧市气象台11时发布：今天下午晴，南风二三级，最高气温2夜间晴间多云，南风二级转北风三四级，最低气温零下8。天晴气爽，午后较适宜户外活动和开窗通风，但气温较低，外出需注意防风保暖，而且目前河湖冰面较薄，请勿冰上嬉戏游玩风干物燥，注意用火用电安全。	未
天暖和了这么多人爬山啊，从视频里可以看到今天是有轻微灰霾的，注意地平线方向的分界线。	未
天有大异像！触目惊心的征兆，信徒惊呼：人子近了！	未
天朗蔚蓝东庭顶层住户饱受漏水之苦 物业修十余次不见好家住西安城东广运潭西路天朗蔚蓝东庭的张先生自从两年前住进新房，就因为屋顶漏水的事饱受苦恼。张先生说称物业陆续修了十余次，但漏水的问题仍未完全解决。华商报记者在张师傅家中看到，时隔两年，他家屋顶明显存在漏水造成的涂料起泡脱落的情况。物业工作人员称，他们将会尽快把这个问题反映上去，周一将会安排专业人士及物业负责人前往张先生的家中查看，随后拿出具体解决方案。天朗蔚蓝东庭顶层住户饱受漏水 物业维修十余次未见好	未
天柱交警查处重点交通违法行为50起	未
天柱停水通知	未
天柱公安局交警大队开展夜查统一行动	未
天柱山下有个俄罗斯村：实为天柱山武术院 成中俄文化交流平台天柱山下俄罗斯村其实是位于半山度假小镇茶庄村的天柱山武术院，这里每年都吸引数以万计的俄罗斯游客前来养生度假。如今俄罗斯村不仅是观光旅游和休闲养生的优选之地，也是中俄文化交流重要平台。俄罗斯高级公务员献计天柱山俄罗斯小镇建设	未
天桥上植物栽植器挂了又摘下，园林局说因有安全隐患武汉市江汉区常青公园门前的人行天桥护栏上挂满栽植器，栽植器中装满泥土，种上绿植，整座桥梁因为绿植摆脱了钢筋混凝土桥梁的固有形象，显得生机勃勃。在距离常青公园人行天桥约百米的位置，红旗渠路人行天桥横跨常青路，它建成后桥梁两侧的栏杆也被挂上栽植器，总数超过20个。在不少人看来，一座绿植环绕的桥梁又将出现，然而栽植器被挂上桥梁后没有栽种绿植就于近日被取下。12月2日，长江日报记者来到红旗渠路人行天桥，桥梁上的栽植器已经全部被取下，部分桥梁栏杆留下直径约为1厘	未
天梭手表大使安踏的迈克尔乔丹，还有汤普森金州勇士NBA吐槽大会	未
·天梯上的养蜂人	未
天棚水泥层脱落险些砸中住户	未
天椒公司包场，请亲友观看正正的世界，呼吁关爱留守儿童，我们不能为了孩子的未来，丢了孩子的现在	未
天气	未
天气12月10日，星期一，农历十一月初四，多云转阴有雪，-33，相对湿度：4075，偏北风转东北风45级。晴暖的脚步还没站稳，新的天气系统就又要来搅局了，夜间到周二大连市自南向北又将出现一次明显的降雪过程，不排除降雪量会超过刚刚过去的这一轮降雪的可能。随后三天我市天气将转为以晴为。	未
天气12月25日，星期二，农历十一月十九，晴间多云，-103，相对湿度：3060，西南风56级阵风7级转偏北风67级。预计明天滨城阳光还不错，市区最高气温在3左右。不过到了下午气温会开始下降，北风逐渐增大，夜间随着强冷空气主体抵达，气温也将大跳水，预计市区最低气温将降到-10附近，所以，周三早上出门大家一定要多穿啊！	未
天气一冷一热的　注意保暖防生病	未
天气一冷人果真就乏了，不到11点就困了喝瓶饮料提提神吧	未
天气一冷，开车膝关节就痛对付腰酸腿疼，这几招很管用	未
天气一冷我就会给自己放假，那我为什么每天这么努力工作因为深圳一年冷不了几天。	未
天气  @三亚市民，出门记得添衣，三亚将持续阴冷模式	未
天气下雨不冷，雨停冻懵！大连人，明天多穿点！	未
天气不再靠眼力 风雨欲来看云图	未
天气严寒，途中珍重	未
天气丨10年驾龄老司机不认识雾灯！你呢戳这篇自检一下！	未
天气丨今冬首发寒潮预警！珲春最低温-18！不是冷，是天真冷！	未
天气丨号外！华北霾将走沙来袭，南方大雾超长待机	未
天气丨平阳人注意，一强股冷空气已发货！秋裤准备起来	未
天气丨明早也许找不到上班的路...需提前出门！	未
天气丨沈阳的雪发来电报：在路上相信我马上到！大风降温也来凑热闹！	未
天气丨海南朋友，星期一上班遇到这样的冷风冷雨，是不是只想和床在一起	未
天气丨短期内，濮阳小雨为主，雾霾维持	未
天气丨@银川人，本周请戴好口罩走四方！因为	未
天气 今天还有雪！今天我市多云有时阴有小阵雪，西北风5到6级阵风7级，市区全天气温将下滑到-10-5之间。天气寒冷程度加剧，防风保暖不可大意。周六我市天气多云转晴，西北风风力由5到6级减弱到4到5级，市区全天气温将回升至-8-4之间。市气象台12月7日6时发布。 @大连气象	未
