天佑开会绝密内部录音曝光！诚恳发声：我犯了错回不来。七兄弟样南表明立场站仙家！喊话迪家粉丝：不带节奏绝不蹭你们热度。	未
天使line要给哥哥披衣服/art_951013	未
天使与魔鬼穆里尼奥，真的是充满变数的一个人，各种让人想不到。在怼完墙之后，他又展示出天使的一面。。。。	未
“天使之旅”再启程 18名蒙古国先心病患儿抵内蒙古治疗	未
“天使之旅”再启程 18名蒙古国先心病患儿抵达内蒙古治疗	未
天使之翼《拯救我》1374	未
天使和VC阶段的创业者可以找我，或者你想投资好的天使和VC项目，也可以找我很多股友搞不清天使和VC是干什么的，简单介绍下天使投资主要投资早期创业公司VC投资中期高速发展型创业公司PE介入即将上市或被兼并收购的成熟企业天使投资投资主要看人，创始人很大程度上决定了项目的好坏早期 ...全文	未
天使和恶魔同时爱上了一个女孩并发誓一直守护着她可是人们都说这个女孩是灾难就在天使痛下决心杀了女孩时才发现恶魔已为她杀了所有人	未
天使团房客暗访视频曝光：五星酒店2000一晚，用毛巾擦厕所，看完你还敢住吗	未
天使救援演练 中国维和医疗分队选派考官中国赴黎维和医疗分队完成联黎部队东部战区天使救援演练考核评估工作贝鲁特当地时间11月27日上午，代号东区天使2018-3的应急医疗救援演练在黎以边境蓝线附近拉开帷幕演习主要依托出兵国前出医疗组展开应急救治和医疗后送，进一步检验 ...全文	未
天使的笑颜 微博视频	未
天儿太冷了，我缩在被窝里靠放屁取暖。	未
天儿越来越冷，你的电动车还好吗	未
天//@八组兔区热议:点了视频哈尔滨大学城那些事儿的微博视频	未
[天公] 你见过莆田女孩骑鬼火飚车吗?3男1女一起飞...	未
天冷不撸串，人生路难走！乌鲁木齐这10家串串界的扛把子来了！	未
天冷也是有好处的不是嘛你看，这里冻住了一只鬼	未
天冷了，不用冰了，以前我挺爱吃的，现在110斤的我无力再爱了。。。	未
天冷了，东台骑电动车出行的速看！已有人因车上这东西......	未
天冷了，他们行动了！菏泽这些市民都收到了一份特殊的礼物...	未
天冷了，仙桃人又开始腌萝卜丁子了！看到第2个就开始流口水	未
天冷了，你城市那裡的銀杏，是否也早已一遍金黃了，我還記得那年的這個季節，你對著滿山的銀杏許下的承諾，如今，景還是那樣的美景，故人已不再是同樣的故人了。我們還是將心中的那點心事收藏好吧！收下金黃色的跳舞蘭，願彼此安好[鮮花][米奇比心][圍脖]红人的诞生V影響力峰會宝宝的少女心大V见面会天气即天意水逆退散	未
天冷了，你若发现流浪乞讨人员可拨打24小时求助热线！	未
天冷了，医生也戴上了耳包。	未
天冷了！去涪陵这家羊肉汤锅打卡了	未
天冷了，周末下午两点以后，不要在联合收费处门口说冻手 大连身边事大连爆料	未
天冷了喝碗鲫鱼汤	未
天冷了回家煲汤喝	未
天冷了，地油子路滑，蒲麻开车的人注意！	未
天冷了，布加迪这是躲起来取暖了	未
天冷了，开车前请按一声喇叭！	未
天冷了！您在哪临高一90岁老人走丢，至今下落不明，请大家帮忙扩散	未
天冷了，想换工作，又不想出门，怎么办看这里@所有人	未
天冷了，手机可别踹兜里！拿在手里放在自己的视线范围内才安全	未
天冷了，抱抱爱的人吧杭州市气象台发布寒潮蓝色预警今天下午17点22分，杭州市气象台发布寒潮蓝色预警信号：北方较强冷空气已经开始影响杭州，气温将继续下降，预计7到9日平均气温降幅可达8-10度，8到9日最低气温1度左右，并伴有雨雪天气过程。今天傍晚到明天最大偏北风5级阵风6到7级。在杭州的小可爱不要乱跑哦，注意防寒保暖，照顾好自己哦！爱你们[给你小心心][给你小心心]	未
天冷了，救助站请流浪人员回“家” 可拨打救助热线	未
天冷了，无锡动物园萌宠“花式”过冬	未
天冷了早上起来第一件事不是穿衣服喝水！可惜知道的人太少	未
天冷了，早起第一件事不是穿衣服喝水！而是......	未
天冷了，晋江这位辅警自己出资买冬装，捐给山区的孩子们	未
天冷了，没睡的留言打个卡 吧	未
天冷了，滨海骑电动车出行的速看！已有人因车上这东西当场死亡！	未
天冷了！漳县家里有三轮车的都看看...	未
天冷了，照顾好自己（致我最牵挂的人）	未
天冷了离家在外的齐河人，你能回老家看看吗	未
天冷了 请为它们转发这条微博中央气象台今日发布寒潮蓝色预警，局地降温10以上！明天，又到了大雪节气，天气越来越冷了，汽车周围成了流浪小动物的避风港，但它们也可能因此被碾压或烫死。开车前别忘检查一下，拍拍引擎盖，按按喇叭。转给司机！	未
天冷了 请为它们转发这条微博中央气象台今日发布寒潮蓝色预警，局地降温10以上！明天，又到了大雪节气，天气越来越冷了，汽车周围成了流浪小动物的避风港，但它们也可能因此被碾压或烫死开车前别忘检查一下，拍拍引擎盖，按按喇叭转给司机！	未
天冷了 请为它们转发这条微博中央气象台今日发布寒潮蓝色预警，局地降温10以上！明天，又到了大雪节气，天气越来越冷了，汽车周围成了流浪小动物的避风港，但它们也可能因此被碾压或烫死。开车前别忘检查一下，拍拍引擎盖，按按喇叭。转给司机！ 偷猫窝点被查封	未
天冷了 请为它们转发这条微博中央气象台今日发布寒潮蓝色预警，局地降温10以上！明天，又到了大雪节气，天气越来越冷了，汽车周围成了流浪小动物的避风港，但它们也可能因此被碾压或烫死开车前别忘检查一下，拍拍引擎盖，按按喇叭转给司机！ 偷猫窝点被查封	未
天冷了 请为它们转发这条微博中央气象台今日发布寒潮蓝色预警，局地降温10以上！明天，又到了大雪节气，天气越来越冷了，汽车周围成了流浪小动物的避风港，但它们也可能因此被碾压或烫死。开车前别忘检查一下，拍拍引擎盖，按按喇叭。转给司机！@央视新闻	未
天冷了 请为它们转发这条微博中央气象台今日发布寒潮蓝色预警，局地降温10以上！明天，又到了大雪节气，天气越来越冷了，汽车周围成了流浪小动物的避风港，但它们也可能因此被碾压或烫死开车前别忘检查一下，拍拍引擎盖，按按喇叭转给司机！ （央视新闻）	未
天冷了 请为它们转发这条微博中央气象台今日发布寒潮蓝色预警，局地降温10以上！明天，又到了大雪节气，天气越来越冷了，汽车周围成了流浪小动物的避风港，但它们也可能因此被碾压或烫死。开车前别忘检查一下，拍拍引擎盖，按按喇叭。转给司机！ 源/@央视新闻	未
天冷了，请为它们转发这条微博今天，又到了大雪节气，天气越来越冷了，汽车周围成了流浪小动物的避风港，但它们也可能因此被碾压或烫死开车前别忘检查一下，拍拍引擎盖，按按喇叭	未
天冷了 请为它们转发这条微博博闻广记中央气象台今日发布寒潮蓝色预警，局地降温10以上！明天，又到了大雪节气，天气越来越冷了，汽车周围成了流浪小动物的避风港，但它们也可能因此被碾压或烫死。开车前别忘检查一下，拍拍引擎盖，按按喇叭。转给司机！据@央视新闻	未
天冷了 请为它们转发这条微博博闻广记中央气象台今日发布寒潮蓝色预警，局地降温10以上！明天，又到了大雪节气，天气越来越冷了，汽车周围成了流浪小动物的避风港，但它们也可能因此被碾压或烫死开车前别忘检查一下，拍拍引擎盖，按按喇叭转给司机！据@央视新闻	未
天冷了，请为它们转发这条微博天气越来越冷，汽车周围成了流浪小动物的避风港，但它们也可能因此被碾压或烫死。开车前，检查一下车底车轮或发动机上有没有小动物拍一拍引擎盖上车后再按一按喇叭。开车前只要简单三步，可能就能挽救一条小生命。转给司机们！安徽：名山降雪只是预演 暴雪今明拉开序幕	未
天冷了，请为它们转发这条微博天气越来越冷，汽车周围成了流浪小动物的避风港，但它们也可能因此被碾压或烫死开车前，检查一下车底车轮或发动机上有没有小动物拍一拍引擎盖上车后再按一按喇叭开车前只要简单三步，可能就能挽救一条小生命转给司机们！网页链接	未
天冷了，请为它们转条微博开车前，拍拍引擎盖，按下喇叭，确保没有熟睡的小动物！今年也请多多关照！	未
天冷了，这些老人家围坐一起为孤儿织毛衣	未
天冷了，这些老人家围坐一起为孤儿织毛衣12日上午，长江日报联合阿里巴巴天天正能量武汉市慈善总会武汉市青少年发展基金会主办的2018针心针意我给孤儿织毛衣大型暖冬公益活动走进万松街商务区第一社区，社区杨奶奶巧手工作室的志愿者们开展公益编织课堂并发放毛线，吸引了数十名社 ...全文	未
天冷了，这些老人家围坐一起为孤儿织毛衣12日上午，长江日报联合阿里巴巴天天正能量武汉市慈善总会武汉市青少年发展基金会主办的2018针心针意我给孤儿织毛衣大型暖冬公益活动走进万松街商务区第一社区，社区杨奶奶巧手工作室的志愿者们开展公益编织课堂并发放毛线，吸引了数十名社区居民的参与。天冷了，这些老人家围坐一起为孤儿织毛衣	未
天冷了，连云港骑电动车出行的速看！已有人因车上这东西......	未
天冷了，阜宁骑电动车出行的速看！已有人因车上这东西当场死亡！	未
天冷了！阜阳人请别再用这东西！被禁8年，致很多人受伤......	未
天冷了，骑电动车出行的速看！	未
天冷人心暖，青龙公安民警帮助群众寻回救命钱	未
天冷人暖！母子滑入东风渠中 众人手牵手搭绳子拉上岸11月25日，郑东新区东风渠与熊儿河交汇处发生惊险却温暖的一幕，一对母子不慎坠落河水之中。河堤和河床湿滑，1米多深的河水冰冷。紧急关头，附近一家楼盘十几名工作人员手牵手将落水母子拉上岸。 （大河报）	未
天冷人暖！郑州一母子滑入东风渠中 众人手牵手搭绳子拉上岸11月25日，郑东新区东风渠与熊儿河交汇处发生惊险却温暖的一幕，一对母子不慎坠落河水之中。河堤和河床湿滑，1米多深的河水冰冷。紧急关头，附近一家楼盘十几名工作人员手牵手将落水母子拉上岸。天冷人暖！郑州一母子滑入东风渠中 众人手牵手搭绳拉上岸	未
天冷人暖！郑州商丘 他们从冰冷的河水中救出3个生命	未
天冷人暖！郑州醉酒乘客打的付了8050元 的哥：钱还回去才心安12月5日凌晨，在紫荆山公园北侧路边，郑州晨曦出租车公司夜班司机王深红拉到一名醉酒乘客零点37分，乘客扫码支付车费后即下车醉酒乘客到地儿后给的哥转了8050元车费好在两个人都在找对方，很快，多给的车费完璧归赵 ...全文	未
天冷人暖！郑州醉酒乘客打的付了8050元 的哥：钱还回去才心安12月5日凌晨，在紫荆山公园北侧路边，郑州晨曦出租车公司夜班司机王深红拉到一名醉酒乘客。零点37分，乘客扫码支付车费后即下车。醉酒乘客到地儿后给的哥转了8050元车费。好在两个人都在找对方，很快，多给的车费完璧归赵。天冷人暖！郑州醉酒乘客打的付了8050元 的哥：钱还回去才心安	未
天冷人暖！醉酒乘客打的付了8050元 的哥：钱还回去才心安12月5日凌晨，郑州一出租车公司夜班司机王深红拉到一名醉酒乘客，醉酒乘客到地儿后通过扫码支付给的哥转了8050元车费王师傅发现这笔巨额车费时，已是3个多小时后好在两个人都在找对方，很快，多给的车费完璧归赵王师傅：不该得的 ...全文	未
天冷人暖！醉酒乘客打的付了8050元 的哥：钱还回去才心安12月5日凌晨，郑州一出租车公司夜班司机王深红拉到一名醉酒乘客，醉酒乘客到地儿后通过扫码支付给的哥转了8050元车费。王师傅发现这笔巨额车费时，已是3个多小时后。好在两个人都在找对方，很快，多给的车费完璧归赵。王师傅：不该得的钱还回去了自己才能安心。（河南商报）网页链接	未
天冷到给车都冻傻了思铂睿Si和ES8今天报了同样的偶发故障，都是碰撞系统和车道保持失效	未
天冷只想窝在这样的房间里	未
天冷是一种什么样的体验你在北方的暖气里穿着短袖，我在南方的艳阳里瑟瑟发抖 。那么冷的天气，不如领个红包温暖一下：553977835	未
天冷注意用火用电安全！今早长沙车站路与解放路交界处附近一楼房起火希望没有造成人员伤亡！ 微博视频	未
天冷用气量大 有西安市民家天然气灶打不着火	未
天冷穿得多，警察蜀黍有一份防扒攻略送给你	未
天冷膝盖疼，用这个一贴就好，恒温发热，3分钟缓解酸痛	未
天冷自发热食品又变“火” 安全隐患不容忽视	未
天冷，谨防中风！德州脑卒中急救地图发布，快速急救请到这15家医院	未
天冷路滑开车注意啥赶紧看 大庆这些路桥通过要警惕	未
天冷还停电！这次共70个台区，请提前准备	未
天冷雨夹雪，出门在家都要当心哦！	未
天凉了，保温杯该上场了！记住千万别用它装这4种水！	未
天凉了，关于供共暖哪点事	未
天凉了，吃点热乎的吧听到这句话，你想起了谁	未
天凉多雨的温哥华，正是生蚝肥美时	未
天凉未必秋，心寒方觉冷。	未
天刚黑时路过一居民小区，对面走来一戴大金链子的肌肉猛男，忽然开始咳嗽，接着又过来四五个男的，也统一咳嗽我顿时有些紧张，他们在对暗号不会要抢劫吧我有点怕怕，又不敢跑，直到我走到他们开始咳嗽的地方，我也咳嗽了，谁家炒菜放辣椒那么呛！	未
天助我也是什么	未
天南地北宜都人，明天一起回家！	未
@天南地北武穴人，妈妈喊你回家尝年粑！	未
《天南地北江苏兵》寻找典型故事	未
天原集团：距震中较远 未受宜宾兴文县地震影响12月16日中午，四川宜宾市兴文县内发生5.7级地震，震源深度12千米。地震对宜宾市的上市公司是否造成影响下午，《每日经济新闻》记者致电宜宾天原集团(002386，SZ)董秘何波，何波表示：由于震中距离公司厂区较远，这次地震未对公司造成影响，公司生产经营情况正常。天原集团：距震中较远 未受宜宾兴文县地震影响	未
天原集团：距震中较远 未受宜宾兴文县地震影响12月16日中午，四川宜宾市兴文县内发生5.7级地震，震源深度12千米地震对宜宾市的上市公司是否造成影响下午，每日经济新闻记者致电宜宾天原集团(002386，SZ)董秘何波，何波表示：由于震中距离公司厂区较远，这次地震未对公司造成影响，公司生 ...全文	未
天台实施万户百村下山移民工程	未
天台消防保姆为空巢老人撑安全伞	未
天呀，才2岁，牛的一塌糊涂！	未
天呀，才4岁，牛的一塌糊涂！	未
天呐。。。	未
天呐	未
天呐！81岁老太，真是太厉害了！	未
天呐，一定要警惕身边有这样的朋友！！	未
天呐！五一只放假一天，2019年放假安排正式公布	未
天呐！你确定这么丑的孩子是我生的！	未
天呐！内江一女子晚餐误食玻璃片，竟长达1.6厘米	未
天呐！别再乱吃阿胶了，一个长期吃阿胶的人后来竟然变成这样！	未
天呐！咸鱼上竟然有人在卖虐猫视频	未
天呐！固安市民活动中心游泳健身每天只需2.5块钱不知道就亏大了 ！	未
天呐天呐天呐！双11剁掉的手还没长好，又要到双12吃土节了！ 前几年真的害怕购物节，看到打折两个字我就控制不住自己啊！买回一大堆莫名其妙的东西。今年我痛定思痛，绝对不会再冲动消费一分钱，翻了翻购物车，还算满意！ 想知道我的购物秘诀吗，你们也在买买买时为自己的不理智买过单吗今晚20:00，我将以翼支付超会花专家的全新身份进行直播，和大家讲讲我的购物心得，一起计算传说中的颤抖指数，希望帮你们在年末买得开心！ 今晚20:00，记得来看我直播哦，等你们！	未
天呐，她才11岁！牛的一塌糊涂！	未
天呐，她还是人类吗！	未
天呐 好会修 哥哥好像一幅画啊 我hsvakxgakxbskxmchak[淚][淚][淚]	未
天呐，希望那几家人都外出了，都平平安安的	未
天呐！平顶山这个胖子在办公室遭同事暴打，围观的人竟拍手叫好！	未
天呐！广西一26岁小伙挥刀自宫，最后居然......	未
天呐！广西蜜桔2毛5一斤没人要，烂在马路边堆成山！	未
天呐，微信语音也能被克隆她确认是爸爸的声音后，依然上当	未
天呐，我还有广州的客人	未
天呐！晚上9点，女童驾车冲向路中间，妈妈竟在一旁玩手机	未
天呐！杭州街头女童驾车冲向路中间，妈妈在一旁玩手机	未
天呐！杭州街头女童驾车冲向路中间，妈妈竟在一旁玩手机	未
天呐，江工竟然有这样一群人...	未
天呐！玉林一小车劳斯莱斯追尾，几百万的车啊！	未
天呐，现在都玩这么大了么	未
天呐！看了这段视频监控，你还敢不戴头盔吗	未
天呐真的，知情人别透露信息给他。。//@M大王叫我来巡山: 别再帮他找了//@江南大野花:起诉该女生来寻人！变态到恐怖//@唧唧子:恶心//@扶他柠檬茶:要是那姑娘真的出什么事，去一遍遍当美谈发这些视频的媒体全都是帮凶	未
天呐！！！真的诶！！！细思恐极 查看图片 //@友客鑫市:哥哥的身体被剖开了，画的是肋骨	未
天呐！美国芝加哥一电梯从95层坠至11层！这些致命操作你做过吗	未
天呐著名作家二月河去世，享年73岁，先生走好	未
天呐！街头女童驾车冲向路中间，妈妈竟在一旁玩手机	未
天呐！超级高铁要来了！未来龙岩到北京不用一个小时	未
天呐这也太暖了叭	未
天呐，这伤口....//@我与老公的日常:	未
天呐！野生海鲜竟然可以全南靖配送上门从渔港到你家！速看！	未
天呐！野生海鲜竟然可以全安海配送上门从渔港到你家！速看！	未
天呐！野生海鲜竟然可以全揭阳配送上门从渔港到你家！速看！	未
天呐！野生海鲜竟然可以全浦江配送上门从渔港到你家！速看！	未
天呐！野生海鲜竟然可以全肇庆配送上门从渔港到你家！速看！	未
天呐！野生海鲜竟然可以全莆田配送上门从渔港到你家！速看！	未
天呐！野生海鲜竟然可以全虎门配送上门从渔港到你家！速看！	未
天呐！野生海鲜竟然可以全连杭配送上门从渔港到你家！速看！	未
天呐！野生海鲜竟然可以全黄冈配送上门从渔港到你家！速看！	未
天呐//@電話那頭的妳:转发微博	未
天呐！鹰潭气温变得这么低，而且这些地方还停电！	未
天呢！美锅剪指甲和辛巴一样乖！一个爆哭！	未
天和防务：公司高管及核心人员完成增持计划	未
天哇，才4岁，牛的塌糊涂！	未
天哪	未
天哪他们去了新西兰啦！梦想去的地方！没想到遇到毛贼，辛苦了gtlt	未
天哪，你们知道广东终于降温了吗，今天19度	未
天哪，你是在逗我吗，在我说出了那种话以后	未
天哪，你的搜索记录里都是些什么东西！2.0	未
天哪噜！广东人去布达拉宫免票！！！一直到春节，还有这286个景点下月起也免票！！！	未
天哪！山西永和发现天然瀑布，专家惊呆了	未
天哪！开平人常抓来吃的这种鱼，竟是水中人参，最补肾	未
天哪，彻彻底底的被这位试婚纱的小姐姐迷倒了	未
天哪我俩老公同框了	未
天哪 我看到了两个天使	未
天哪！永州人以后坐车，不用半小时就能到北京！	未
天哪！现在连鲜花也开始卖版权了！	未
天哪！益阳人以后坐车，不用半小时就能到北京！	未
天哪这两个人跑到黄瓜寨一深坑探险，受伤被困.....	未
天哪！邵东人以后坐车不用半小时就能到北京！	未
天啊//@SOUTHAPRIL1515://@M大王叫我来巡山:才57岁今年真的是怎么了太多人离开了//@谷大白话:影响了无数人的童年的人 RIP查看图片 //@史莱姆无孔不入就是晏晏://@英剧-英剧:天啊，太快了//@Jocelyn很怪异:2018，太魔性了，可怕。	未
天啊！一刷朋友圈发现一大部分人都出国旅游了！原来真相是...	未
天啊。//@七七呀猫://@颜文字君://@江南大野花://@AlohoFelic:总结 这个小姐姐被一个有入室抢劫前科的渣男多次入室虐待，16日凌晨被虐待一整夜被毁容，被伤了腿之后站不起来。期间报警后，警方多次回电但每次都被渣男发现抢走了手机。渣男在逼她同意不起诉之后离开。	未
天啊，你预定的服饰今天紧急降价1折起，再不抢就没啦！	未
天啊噜，每个月上缴工资的耙耳朵，放言给老婆买万元包！	未
天啊！宜黄天气又有新变化......	未
天啊，居然是小微企业。	未
天啊成都这个车是怎么做到的。。。	未
天啊！！我又发现个漏洞！！多芬玫瑰菁油沐浴慕斯200ml2瓶拍下减68手慢无！！！拍下不改说明漏洞被发现！宝宝们抓紧了啊	未
天啊，我居然目睹了一场自行车骑行意外事故，也就看了好几十遍吧	未
天啊！昭平有人用假钞吃了两碗粉！还找得真钱！监控视频曝光！	未
天啊..现场live还失聪//@吃汉益达: 转发微博	未
天啊//@要给钟铉写小情书的阿觉://@M大王叫我来巡山:_gt日本的朋友还是注意一下//@江南大野花:太吓人扩一下提醒日本的华人，希望只是个键盘变态	未
天啊这个贵气！！！在群里看到特意摸过来转发！	未
天啊 这也太冷了吧！狗的魔宁 各位小伙伴...希望你们的周末可以在被窝里度过！  可能只有我一个人还需要早起了 _	未
天啊这女的原来这样啊，算了//@李撕咬:狗东西，也不知道在外面劈了多少腿 查看图片	未
天啊！鄢陵到郑州只需2分钟时速4000公里	未
天啦噜，现在还有人拿着爆炸物去炸公交车害怕，对坐公交车产生了深深地恐惧	未
天啦噜，甜到炸，想谈恋爱了	未
天啦噜 过年的年货都有了来转一发	未
天啦：筠连邻县多辆微型车超载，拉得最多的达23人！	未
天啦！这票变态啊！北京/上海，直飞洛杉矶，往返含税只要2K整...	未
天啦！镇雄多张微型车超载，拉得最多的达23人！	未
天啦//@黑客凯文:我给大家把脸截出来，至于视频就别看了太可怕了 查看图片	未
天喵国际黑五抢神劵网页链接一次性口罩5.1到手现在出去带口罩，这个天空气不太好的	未
天喵国际黑五抢神劵网页链接泰国天然护颈乳胶枕头送枕套 38到手200的大卷，晚上放下手机，枕上乳胶枕	未
天喵国际黑五抢神劵网页链接英国Trespass/趣越，三合一两件套冲锋衣 239到手英国挺有名的滑雪品牌，打鬼子的时候他家就开始做各种制服了，男女都有的，马上入冬了，玉龙雪山，林海雪原.....要不要约一下	未
《天国的嫁衣 》也要翻拍了内容提要：陶家花店，是早年艾青的爷爷与过世的奶奶一起开办的鲜花店，坐落在远离上海市中心的老街区。艾青从小在店里长大，对它有着深厚的感情。然而外出归来，艾青却发现花店被哥哥卖掉了，为了爷爷的花店，艾青找到买主，却发现竟是几天前与自己发生过争执的子皓。命运早在不经意间把两人纠缠在了一起。因为花店，艾青和子皓斗智斗勇，却也总能在危机时刻化解对方的难题。在这个过程中，两人之间的感情发生着某种微妙的变化，然而子皓的身边有着超模卡璀娜，艾青的身边也站着青梅竹马的程海诺，两人想要走到一起	未
《天国的嫁衣》将翻拍，不再只讲爱情故事	未
天地不仁，以万物为刍狗。优胜劣汰，都是自然选择。	未
@天地无情游ttkl：因路面施工，路边立了标识，然鹅，标识不在了，钉子还在！坐标：楚雄道	未
“天地板”暴力收割游资火拼 “核按钮”式出逃闷杀打板客	未
天坛“武林”卧虎藏龙	未
天堂人满，地狱打烊，所以我留在人间	未
