大雾锁城，今天的你，在东台迷路了吗	未
大雾锁城，今天的你，在海安迷路了吗	未
大雾锁城 今早南昌这些公交停发	未
大雾锁城，天长你在哪	未
大雾锁城 无锡境内多条高速公路限行	未
大雾锁城，河南所有高速全部封闭！/这件事，关乎每个人的生命安全！	未
大雾锁城  浦东警方启动预案 全力护畅	未
大雾锁城芷江浓雾弥漫隔河难望，第1张图片就惊到我	未
大雾锁城，青州如被蒙上一层薄纱！周边高速路口已全部封闭	未
大雾锁江城还将持续4天，36米能见度99吴江人不知道行车要开这个	未
大雾预警继续！南京未来三天降温多阴雨！	未
大雾频现，汉中一外地牌照轿车撞护栏后又撞摩托车，2人受伤！	未
大雾黄色预警：山东安徽上海等8地部分地区有浓雾	未
大雾黄色预警 山东江苏浙江等6省有浓雾	未
大雾黄色预警 江苏河北等8省有大雾或浓雾	未
大雾黄色预警：河北山东江苏等7省市有大雾	未
大雾黄色预警：河南安徽湖北等地有大雾局地强浓雾	未
大雾黄色预警继续发布：河北上海等11地有大雾	未
大雾黄色预警解除 辽宁山东湖北等地部分地区仍有大雾	未
大雾黄色预警，请市民们注意安全	未
大雾黄色预警高挂！上海这些高速公路和轮渡受影响	未
大雾黄色预警高挂！上海这些高速公路和轮渡受影响天气预警小伙伴们早上出门请注意啦！上海今晨4时22分已发布大雾黄色预警：预计今天上午以前本市大部郊区有能见度小于500米的浓雾，局部地区小于200米，请大家注意防范。截止7时，受大雾影响，相邻省市封闭的路段有：G15沿江高速G2江苏段G50江苏段本市高速限速80公里/小时至40公里/小时。此外，6时20分起崇明客轮全线停航。Via上海发布	未
大霄看了半天盘，终于反弹了，忍不住发微博，然后...就没有然后了。	未
大霄老师预测2019收阳。	未
《大霄说》第五百七十六期A股将被纳入标普道琼斯全球指数《大霄说》第五百七十六期A股将被纳入标普道琼斯全球指数上证指数 sh000001	未
《大霄说》第五百七十四期A股抵御外部风险能力增强《大霄说》第五百七十四期A股抵御外部风险能力增强上证指数 sh000001	未
《大霄说》第五百八十一期经济数据不佳影响A股表现《大霄说》第五百八十一期经济数据不佳影响A股表现上证指数 sh000001	未
《大霄说》第五百八十四期市场观望情绪犹重《大霄说》第五百八十四期市场观望情绪犹重上证指数 sh000001	未
大震声威！的哥被打，数十台出租车火速到场围攻声援！	未
@大露露爱吃鱼：在天津的4s店两年前贷款买的车，上的是唐山牌照，贷款目前已结清，现在要去唐山的车管所办理汽车解抵押，但是车管所说需要抵押备案人一起去，可是4s店说根本没有什么备案人，他们这些业务都是外包的，现在他们给出的办法就是让自己花600块钱，他们给找黄牛去车管所办这个事，这样合理么 ...全文	未
@大露露爱吃鱼：在天津的4s店两年前贷款买的车，上的是唐山牌照，贷款目前已结清，现在要去唐山的车管所办理汽车解抵押，但是车管所说需要抵押备案人一起去，可是4s店说根本没有什么备案人，他们这些业务都是外包的，现在他们给出的办法就是让自己花600块钱，他们给找黄牛去车管所办这个事，这样合理么，当初买车时4s店根本没提过这事，现在还得自己花钱找黄牛去办，这钱合着都让4s店赚了，请问还有别的办法吗	未
大霾已经逼近三百外面已经是魔幻都市，真愁人 PS：现在下午三点多，大霾已经300多喽（微博编辑功能，我已经弄明白了）	未
大面积停电奇葩证明 谁在拖西安营商环境后腿	未
大面积浒苔入侵胶州湾 绿潮成片如草原	未
//@大革文化命:是啊，政府在国际上再多的申辩，抵不过这一次实验的恶劣影响。	未
大韩航空修改退票规则粉丝见完偶像就退票下机，大韩航空决定修改规则根据韩媒的报道，在一架即将从香港起飞前往韩国仁川的国际航班上，四名中国粉丝近距离接触到自己的偶像后，便以有急事为由下了飞机。机上360多名乘客不得不重新安检，飞机也因此延误1个多小时。按照涉事大韩航空公司的规定 ...全文	未
大韩航空修改退票规则粉丝见完偶像就退票下机，大韩航空决定修改规则根据韩媒的报道，在一架即将从香港起飞前往韩国仁川的国际航班上，四名中国粉丝近距离接触到自己的偶像后，便以有急事为由下了飞机。机上360多名乘客不得不重新安检，飞机也因此延误1个多小时。按照涉事大韩航空公司的规定，当天购票当天退的话，手续费比较低。所以这四名影响社会秩序的乘客，并未付出太大成本。不过，现在事情有了转机。韩媒纽西斯通讯社18日说，大韩航空公司准备完善现有的规则，计划从明年1月1日起，所有购买国际航班机票的乘客，如果进	未
大额回购频现！近200亿资金在路上，这些公司回购下限超5亿元	未
大额存单成银行揽储新宠	未
大额打赏直播平台，短时间内身体暴瘦，短时间内大额消费，给妻子巨额投保，这些线索确实很容易产生一些具象的联想。张英尸检浑身是伤，不知道被谋害的过程中是否意识到是自己的丈夫痛下杀手，也不知道当时她挣扎时心情是有多复杂。	未
大额红包码：500666，每天领一下试试手气吧！如果前几天红包都是1毛钱，可以再换一个码试试看：578210937	未
大风低温 棉裤预警中	未
大风大雪！注意，新疆很多车友都在做这件事！	未
大风大雾双预警！青岛降温前夕的天气让人挠头！	未
大风寒潮来袭，气温继续下降！感冒高发期来啦！这些知识要知晓	未
大风！寒潮！结冰！山西省气象台一天之内连发三道预警！	未
大风导致吉林市一房盖掉落，砸坏车辆属于天灾你能接受吗	未
大风惹祸多起！长春红旗街亚细亚楼下广告围挡被风刮倒！4人受伤！	未
大风还在继续刮！阿城糖机小区房盖被吹掉！	未
大风降温，宿迁开启“速冻模式”大家注意防风保暖	未
大风预警大连市气象台2018年12月11日05时18分发布大风蓝色预警信号：预计11日白天到夜间：渤海偏北风7级阵风8级傍晚减弱到5到6级，渤海海峡偏北风6级阵风7级中午增强到7级阵风8级半夜减弱到6级阵风7级，黄海北部偏北风5到6级傍晚增强到7级阵风8级，大连市各县市区偏北风5到6级中午增强到6级阵风7级半 ...全文	未
大风预警大连市气象台2018年12月11日05时18分发布大风蓝色预警信号：预计11日白天到夜间：渤海偏北风7级阵风8级傍晚减弱到5到6级，渤海海峡偏北风6级阵风7级中午增强到7级阵风8级半夜减弱到6级阵风7级，黄海北部偏北风5到6级傍晚增强到7级阵风8级，大连市各县市区偏北风5到6级中午增强到6级阵风7级半夜减弱到5到6级。请注意防范。via大连气象	未
大风黄色预警信号 受强冷空气影响，6-8日我市将有一次持续性较大降雪天气过程	未
大飞机一定比 小飞机安全？丨姗言两语	未
大飞机真排场，带着燕庄坐上改革开放头等舱！	未
大马前总理纳吉布被控滥权 最高或可判20年监禁	未
大马前总理纳吉布被控滥权 罪成可判最高20年监禁	未
大马前总理纳吉布被控滥权 若罪成可判最高20年监禁	未
大马华裔女官员祖父曾是南侨机工 史料揭其抗战故事	未
大马士革曾经是叙利亚最危险的地区之一，那里没有灯也没有电 如今的大马士革正步入正轨，迎来了和平后的首个圣诞节。	未
大马总理	未
大马总理：与新加坡达成协议前 将继续派船到争议海域	未
大马总理称国民太懒会被越南赶超 民众:是国家懒政	未
大马移民局拟采用最新科技 解决入境处拥挤问题	未
大马购物商场爆炸致多人伤亡 中领馆密切关注进展	未
大马路上惊现武林高手，路人疯狂飙车依然跟丢！	未
大魔你咋地了，这根酸黄瓜是怎么变成驾驶员的	未
大鱼吃小鱼 智能手机产业步入寡头时代	未
大鱼大肉吃多了，这份粗粮养生说明书谁都用得上！健康养生大鱼大肉惯了，各类富贵病就容易找上门。想解决这些问题，不妨找粗粮来帮忙。今天，杭小布为你送上一份粗粮养生说明书，快来看 via生命时报	未
大鱼漫画：一座义乌城，半部改革史	未
大鱼漫画：意大利人真的天生不善战吗？	未
大鱼漫画：水+火=电，这是咋算出来的呢？	未
大鱼漫画：特朗普为啥对“建墙”这件事格外上心？	未
大鱼漫画：“蛇皮走位”到底怎么走？	未
大鱼漫画：说个秘密，混巫师圈的都超丑的...	未
大鱼漫画：说个秘密，混巫师圈的都超丑的	未
大鱼漫画：课本之外的袁崇焕	未
大鱼漫画：运动到底多重要？希波战争告诉你	未
大鲁山，又上央视了！	未
大鹿讲堂小学生交通安全常识：安全过马路要这样做	未
大鹿讲堂开车低头族已成为交通事故头号杀手	未
大麦基厉害了！根据Second Spectrum的数据统计，麦基本赛季11次封盖扣篮，是本赛季至今联盟封盖扣篮次数最多的球员！火箭今日主场对阵湖人的比赛正在进行中，目前火箭领先湖人。	未
大麦基因为流感今天将会缺阵，大嘴是不是有机会啦GoLakers	未
大麻是一种成瘾性东西，坚决不要去碰它，引导性毒品，很多人都认为自己意志力顽强，不会成瘾。可悲的是尝试的几乎都会成瘾。	未
大麻镇环境卫生大变样，菜市场都这么干净...	未
《大黄蜂》不成功，导演就回家做耐克接班人	未
《大黄蜂》主创将于12.14访华 揭秘台前幕后	未
大黄蜂内地定档 好莱坞电影大黄蜂 内地1月4日上映。 看预告发现，很甜怎么回事	未
《大黄蜂》“单飞”了	未
《大黄蜂》发＂三变金刚＂特辑 霸天虎阵营反派登场	未
《大黄蜂》发布正片片段 汽车人获名Bumblebee	未
《大黄蜂》发生死激战片段 动作戏向成龙电影取经	未
《大黄蜂》摸头杀，感觉怎么样	未
大黑:不能放过任何一处！	未
大黑拿到了love yourself ，OMORROW X OGETHER 的新商标版权。新项目还是新男团?	未
大鼻孔面对我呼吸风好大 天呐来自鼻孔得风 我眼睛都吹干了	未
大龙开发区公安分局召开干部大会	未
大龙开发区召开铁合金企业运行座谈会	未
大龙开展集中统一整治行动	未
天！naomi割腕了，看着好疼，还是不要做傻事吧。	未
天//@Tiger公子://@铱哥儿:看到po和罪犯妈妈的聊天觉得更可怕了//@Glaucous:判几年请问//@AlohoFelic:总结下，原po被一个有入室抢劫前科的渣男多次入室虐待，16日凌晨被虐待一整夜，被毁容，被伤了腿。报警后，警方多次回电但每次都被渣男抢走手机。渣男在逼她同意不起诉之后离开	未
天一仁和城居民苦不堪言：供了暖，家里却比室外还冷！	未
天一冷就想泡温泉别被忽悠了，小南带你认准真温泉！	未
天一案二审开庭未宣判想了下决定重发。非常认真地看完一开始站ty的和另一个站公诉的两个博主的总结，我觉得评论区真的很可怕。两边的评论区，无一例外用哈哈哈你看你被打脸了吧的心态看这件事，说法的也好，说案情的也好，说人权的也好，大部分是一副你懂个屁的神情看别人。有专门学法的，也有门外汉，也有意见领袖。现在双方基本还是评论区各种带节奏。我把两方评论区里，几个主要的分歧点总结一下。1，yhsq到底怎么定义的是因为涉及耽美，还是因为涉及sq到什么程度成年人看sq读物犯罪吗未成年看sq读物呢向未	未
天一案二审的最后陈述，千言万语听听她自己说的	未
天一案看得我太难受了，捏得动的软柿子，就一定要捏死吗	未
天一猥亵侄子是怎么回事把自己侄子私处捏到红肿，居然敢类比莫言之前还看到有人评论说天一如果能拿诺奖，检察院肯定立刻道歉还看到有人类比白鹿原，我真的服。从头到尾80以上器官描写的也可以这么理直气壮吗	未
天一的案子是个法律问题，当然可以从法律层面从各种角度论证判决的合理性。但它之所以是现在我们所看到的样子，是因为这里面也有法律之外的内容，在县里接到国家级单位移交的线索时，当地在一审时的一系列操作其实完全可以预料到。	未
天上一日地上十年 “偷渡”到太空的微生物有多强	未
天上不会掉馅饼，野生萝莉是陷阱	未
“天上地下”分流，家电乡镇店收编大战一触即发	未
天上地下参北斗 中国北斗系统今起提供全球服务中国卫星导航系统管理办公室主任冉承其今天下午在京宣布，我国北斗三号基本系统完成建设，从今天起开始提供全球服务。这一重大进展标志着北斗系统服务范围由区域扩展为全球，正式迈入全球时代。据他介绍，北斗系统目前在轨工作卫星共33颗，可在全球 ...全文	未
天上地下参北斗 中国北斗系统今起提供全球服务中国卫星导航系统管理办公室主任冉承其今天下午在京宣布，我国北斗三号基本系统完成建设，从今天起开始提供全球服务。这一重大进展标志着北斗系统服务范围由区域扩展为全球，正式迈入全球时代。据他介绍，北斗系统目前在轨工作卫星共33颗，可在全球范围，全天候全天时，为各类用户提供高精度高可靠的定位导航授时服务。（记者赵磊）	未
天上地下，我自泰然	未
//@天上掉下个樱咩咩icon-Sakura: 昨天首页看到没工夫理，原来是骗子，拉黑了	未
天上掉下谢尔曼砸沉德国潜艇，坦克与战列舰对轰，居然还赢过！	未
天上掉钱了遂宁开善路现十余张百元钞票，市民举动亮了！	未
天上掉馅饼的事儿的确没有，但是天上掉祸患却是有可能的！随着城市高层建筑的增多，高空坠物就像是悬在城市上空的利剑，时刻威胁着人们的安全警方提醒：不要高空丢物，做好文明人，保护他人生命财产安全！	未
天上掉馅饼?西安一求职毕业生银行卡里莫名进账23万	未
天上真会掉馅饼思贺来了个送盆活动，一大群阿婆阿伯排队...	未
天上真掉钱了!香港区块链第一人天台撒钞票引疯抢	未
天上飞来大橘侠，有了急病就喊它！	未
天上飞来“百万大订单”？ 不想是个巨坑	未
天下之大，无奇不有//@迷你紫水晶臻:现在是什么样的人也有非常的没有素质。	未
天下办公，唯快不破，用 WPS 文档，随时随地都能跟同事在线协作， 让你的办公效率快到飞起，老板都被惊呆了！ WPS 文档，在线文档真硬核 关注@WPS官方微博 评论并转发微博，未来办公，爽到飞起！吐槽你在工作中遇到的效率问题，即可独享 3000 元现金及评论区所有奖品！ 12 月 13 日通过 ...全文	未
天下古今之庸人，皆以一惰字致败 天下古今之人才，皆以一傲字致败。曾国藩 晚安	未
天下哪有不散的筵席，即使千里搭长棚	未
天下奇葩事 苏州一市民家十多只家禽一夜死光近日，苏州市太仓市一农户家中饲养的十多只鸡鸭一夜间全部死亡，户主怀疑有仇家报复下毒。据农户王某反映，前几天他与一工程老板算账时发生了争吵，他怀疑这次投毒与此人有关。民警初步调查后，将死鸭鹅送检调查，结果未发现有药物中毒。检测部门解释，王某平日家禽饲料用泔脚与米糠搅拌喂养，因泔脚发酵后食盐成份增加，过量食盐鸭鹅会数日内不停排尿或连续拉稀，从而导致体内严重脱水死亡，原来是虚惊一场，并不是投毒案件@太仓发布 @太仓公安	未
天下新闻汇12019年春运从1月21日到3月1日，12月23日可买春运第一天1月21日的票。2北京等11个城市药品集中采购拟中选结果对外公布。与试点城市去年同种药品最低采购价相比，25种药品拟中选价平均降幅达52，原研药吉非替尼片降价76。312月8日，替诺福韦二代产品富马酸丙酚替诺福韦片（TAF）上市，这也是5年来中国获批的唯一一个乙肝新药。（综合新华视点人民网澎湃新闻等）	未
天下新闻汇12019年春运从1月21日到3月1日，12月23日可买春运第一天1月21日的票2北京等11个城市药品集中采购拟中选结果对外公布与试点城市去年同种药品最低采购价相比，25种药品拟中选价平均降幅达52，原研药吉非替尼片降价76312月8日，替诺福韦二代产品富马酸丙酚替诺福韦片（TAF ...全文	未
天下新闻汇1国家医保局设立的举报电话（010-89061396010-89061397）已于11月20日正式开通，公众还可以通过微信邮箱等举报渠道打击骗保行为 2昨日，携程亲子园虐童案在上海市长宁区人民法院一审宣判，8名被告人均因犯虐待被看护人罪被判处刑罚311月26日，耗时5年建成的孔子博物馆 ...全文	未
天下新闻汇1国家医保局设立的举报电话（010-89061396010-89061397）已于11月20日正式开通，公众还可以通过微信邮箱等举报渠道打击骗保行为。 2昨日，携程亲子园虐童案在上海市长宁区人民法院一审宣判，8名被告人均因犯虐待被看护人罪被判处刑罚。311月26日，耗时5年建成的孔子博物馆在山东曲阜开馆试运行，今后将有69万多件孔府文物逐步乔迁新居。4美国洞察号无人探测器26日成功在火星着陆，将首次探究红色星球内心深处的奥秘。（来源：@人民日报@新华视点）	未
天下新闻汇1日前，国家医保局财政部印发通知，鼓励社会各界举报欺诈骗取医疗保障基金行为对符合条件的举报人给予最高额度不超过10万元的奖励2今年遭遇流拍的徐悲鸿油画愚公移山，被湖南广播电视台以2.088亿元（含税）的价格，私洽买下3著名作家二月河于昨晨病逝于北京他 ...全文	未
天下新闻汇1昨日，第五个南京大屠杀死难者国家公祭仪式在侵华日军南京大屠杀遇难同胞纪念馆举行2国务院扶贫办主任刘永富表示，预计今年底，我国现行标准下农村贫困人口将减少85以上，贫困村将退出80左右，贫困县脱贫摘帽50以上3教育部13日举行新闻发布会介绍，随迁子女80进入公办 ...全文	未
天下新闻汇1要网购火车票的注意！铁路部门将于2019年春运期间推出候补购票功能届时，旅客如遇到车票售完的情况，在12306平台支付预购票资金后，如有退票余票，系统将自动购票212月5日，第23届三星杯世界围棋大师赛决赛落下帷幕，中国棋手@棋士柯洁  九段执白击败韩国棋手安国铉，以 ...全文	未
天下新闻汇1近日成立的网络游戏道德委员会，对20款具有道德风险的网络游戏作出责成整改或不予批准的决定。2昨日12时12分，我国在酒泉卫星发射中心用长征二号丁运载火箭，成功将沙特-5A/5B卫星发射升空，搭载发射10颗小卫星，卫星均进入预定轨道。2颗沙特卫星，每颗425千克，设计寿命5年。3天网行动自2015年3月启动以来，已从120多个国家和地区追回外逃人员4833人，其中国家工作人员995人，百名红通人员54人，追回资产103亿余元。（据人民日报央视新闻新华网）	未
天下智慧：有媒体寻求与公司合作未果，随后有不实报道出现天夏智慧10日在互动平台上澄清表示，年底多家媒体有致电来寻求媒体合作，但因特殊情况，未获公司同意，陆续发现个别媒体不实报道，已经提交澄清公告等待交易所批准。公司整体的经营是稳定的，未出现影响公司业绩的重大不利情形。	未
《天下》朱翊钧：吃饭睡觉黏肃肃《千秋》晏无师：吃饭打架逗峤峤《无双》凤霄：吃饭打扮坑去去《成化十四年》隋州：上线做饭，常年掉线。	未
天下秀CEO李檬：借壳ST慧球得到新浪集团审核通过	未
天下秀借壳ST慧球，为背后大股东新浪回A铺路	未
天下秀欲借壳“ST慧球” 背后实际控制人新浪现身	未
《天下第一》翻拍，演员阵容更换，全部采用新人，你能接受吗？	未
天下被网罗 双12包裹超3亿 国家邮政局:请包容快递员据国家邮政局监测数据显示，12月12日全天，邮政快递企业共揽收邮（快）件3.22亿件，比去年同期增长32.5。眼下正值冬季，雨雪严寒天气影响快递的运输和派送。国家邮政局呼吁：天气寒冷，快递员室外作业辛苦，请广大客户给予包容理解。	未
天下被网罗 双12包裹超3亿 国家邮政局:请包容快递员据国家邮政局监测数据显示，12月12日全天，邮政快递企业共揽收邮（快）件3.22亿件，比去年同期增长32.5眼下正值冬季，雨雪严寒天气影响快递的运输和派送国家邮政局呼吁：天气寒冷，快递员室外作业辛苦，请广大客户给予包容理解	未
天下馆藏 1昭陵六骏之飒露紫 2灰色大理石释迦牟尼佛立像.隋代 3彩绘大理石连背光释迦牟尼佛立像.北齐 4菩萨立像.北齐 出自南响堂山石窟二号窟 5彩绘石雕菩萨头像.北齐 出自响堂山石窟 6卢芹斋捐赠给大都会博物馆的佛手 出自响堂山石窟 7佛头 出自响堂山石窟 8元代白瓷 ...全文	未
天不从人愿，事不从你心	未
天为什么这么黑因为牛在天上飞！牛为什么在天上飞因为你在地上吹！	未
“天书病历”的背后是责任感的缺失	未
天了噜！无锡刚刚查获一大批过期冻肉，竟然包括这个知名品牌	未
天了噜！杭州闹市中心，一男子爬上30米高的塔吊！杭州爆料 今天中午，据@青年时报 接到报料称：一男子站在杭州龙翔桥学士路口附近工地的塔吊上面，准备跳楼。记者在现场看到，男子大约四五十岁模样，其所在位置高度近30米。截至14时，该男子仍在塔吊上不肯下来。随后，消防展开救援。消防人员乘坐云梯车至塔吊高处，为男子做好安全防护措施后，两人进入云梯车。20分时，该男子安全降落至地面，警戒解除。	未
天了噜，汤热了。	未
天了噜！英国每一块麦当劳触摸屏上都检测出排泄物，shi里还有毒...	未
天了噜这才是同志生育的最牛掰机构	未
天仙社区道路整治启动 医好多年顽疾杭州建设江干区天仙社区东接机场路南至运河西临铁路北靠天城路，因为之前开发地块较为零碎分散，在没有统筹协调，统一实施的情况下，只能按照各自地块临时进出通道的标准进行建设，道路基本功能不能满足使用，此次天仙庙社区道路整治工程已于11月21日进场施工，先期启动二号路的整治，整个社区5条道路的整治将于2019年8月份完工，整治后将大大改变这个区域的通行状况，提升区域整体面貌。	未
天仪研究院第五次发射任务完成 实现中国商业航天首次批量化生产	未
天价停车位！井陉人凭啥要为它买单！	未
天价停车位！辛集人凭啥要为它买单！辛集那些事	未
天价医疗费告诉你，你想花这钱还不一定有这个机会！	未
天价医疗费的背后，一个医生的忠告......	未
天价小众腕表的背后	未
天价彩礼和奢侈浪费一毛钱关系都没有，因为彩礼钱并没有被消费掉只要算清楚钱的流向，你马上就能知道彩礼背后的人性是什么我老师以前教过我一种算法，这种算法可以给大家做个参考我有次和我老师一起出去吃甜品，他律所里的一个年轻人就跑过来向他借钱，要30万，用工资还他是外地来上海刚毕业 ...全文	未
天价球鞋争先被上脚成香饽饽Air Jordan 花式晒鞋引围观	未
天价礼金猥亵伴娘民政部出手了：全面推进婚俗改革！	未
天价离婚！上市公司董事离婚，转给前妻市值1亿分手费梅轮电梯12月20日晚宣布，公司董事王铼根将其持有的公司1309万股股份转让给了屠晓娟女士。此次交易，王铼根是为执行法院关于其离婚纠纷的《民事调解书》。1309万股股份约占王铼根对梅轮电梯持股总数的六成，目前市值近1亿元。以此观之，王铼根此次离婚损失不小。天价离婚上市公司董事离婚 转给前妻市值1亿分手费	未
天价网络直播王菲演唱会，对音乐行业真有益吗？	未
天价车祸运城一轿车与百万劳斯莱斯相撞，这得赔多少钱	未
天价车祸！运城轿车与百万劳斯莱斯相撞现场，这得赔多少钱	未
天佑工作室主播被网黑，直播摇人约架开干！九天预言仙洋吴迪迟早和好！	未
