斯洛文尼亚一家餐馆推出的活动，如果能在30分钟内吃完这一份巨无霸就能免单，想去试试	未
斯洛文尼亚的梦之岛布莱德湖（Lake Bled）是斯洛文尼亚西北部阿尔卑斯山南麓的一个冰川湖。以教堂为中心的湖中小岛，从远处望过去就像是仙境一般，甚至被称为是欧洲之眼。 这里被誉为欧洲最美丽的角落之一，也是摄影爱好者最钟爱的地方之一。无论日升日落春夏秋冬阴晴雾雪，都能捕捉到绝美的瞬间。	未
斯特拉斯堡市发生枪案 欧洲议会议长：会议仍将继续	未
斯特林勺子点球打飞后，对方门将的表情	未
斯特赖克步战车遥控武器站装载标枪反坦克导弹打靶视频。网页链接目前，斯特赖克装甲车的制式武器是康斯博格M151防御者遥控武器站，使用的是12.7毫米M2机枪或者40毫米Mk 19自动榴弹发射器。还有一款升级后的XM1296斯特赖克ICVD装甲车所配备的是康斯博格MCT-30遥控武器站，使用的是30毫米ATK XM813毒蛇自动炮和7.62毫米同轴机枪。今年上半年，部署在欧洲的美国陆军接收了新版本的斯特赖克（Stryker）88装甲车，该车的通用遥控武器站上配装标枪（Javel	未
斯皮尔伯格改编《罗生门》，拍成10集电视剧	未
斯科尔斯：你不能要求更多了。球员们带着微笑进入比赛，赛后也一样带着微笑。看起来这是完全不同的一支球队了，充满信心，积极的向前传球。对奥莱来说这是多棒的开始啊，希望能够延续下去。	未
斯科尔斯：如果他（埃雷拉）不能完成这样简单的传球，那么他不该在这家俱乐部。	未
斯科尔斯：若波切蒂诺想来，那他就是适合曼联帅位的人近日斯科尔斯在接受采访BBC的时候谈到了热刺主帅波切蒂诺，他认为波切蒂诺很适合曼联，能够为球队带来改变。波切蒂诺就是那个适合曼联帅位的人，如果他想要来曼联，那么主帅的这个位置就是他的。他和媒体之间的关系处理得不错，在球队中的工作也很出色，他提拔了年轻球员，最重要的是他赢下了很多比赛。我知道人们会说他在热刺拥有一支伟大的球队，事实确实如此。但是他在热刺真的能拿到联赛冠军吗我不确定他能做到这一点。不过他来曼联的话，这里能有更多的转会资金，再加上他	未
斯维登董事长罗军：做长租风险很大，回报率只有2%	未
斯莉诗三篇  那个格兰芬多女孩  预言家日报	未
斯莫林在热身时受伤，拜利代替他打首发，琼斯进入替补名单。	未
斯蒂文斯这是要飞去哪记得随身物品要带好哦，免得拿行李致航班延误。	未
斯蒂芬森隔扣裁判	未
斯蒂芬金黑暗力作，恶魔耳语令人瑟瑟发抖！	未
斯诺金农业机械（北京）有限公司招聘信息	未
斯里兰卡“两个总理”僵持不下	未
斯里兰卡内斗鹿死谁手尚未可知，但印度这次为何如此“淡定”	未
斯里兰卡剧变51天：总统与总理的“内战”是如何发生的？	未
斯里兰卡剧变：总统与总理"内战"背后有印度影子	未
斯里兰卡“双总理”僵局结束 “亲华派”总理下课	未
斯里兰卡双总理共存风波结束 亲华强人辞职	未
斯里兰卡双总理共存风波结束 亲华强人辞职(图)	未
斯里兰卡总理拉贾帕克萨正式辞职	未
斯里兰卡总理拉贾帕克萨正式辞职 曾任该国总统	未
斯里兰卡总统任命新一届内阁部长	未
斯里兰卡总统建议政府各部门正常履职	未
斯里兰卡政治拉锯战暂息，反对派仍虎视眈眈	未
斯里兰卡新总理宣布辞职	未
斯里兰卡最高法院裁定总统违宪 政治危机添变数	未
斯里兰卡游记  是旅途中那些微不足道的小事，才能渗透在你灵魂深处	未
斯里兰卡维克勒马辛哈宣誓就任总理	未
斯里兰卡观鲸指南：你在雾霾中瑟瑟发抖，我在热带与鲸共舞	未
斯里兰卡议会通过对被解职总理维克勒马辛哈的信任案	未
//@斯韦爵://@竹林三闲1://@小崔读书汇: 这样的视频可以播放，都是拚死抗争来的。反转付出的代价太大了！	未
斯马特常因母亲去世独自去训练馆训练，痛苦仍然存在在过去，斯马特经常会在比赛中场休息的更衣室里看看手机，因为他在等待自己母亲Camellia的短信。如果斯马特在上半场丢掉了罚篮，妈妈就会开玩笑说他欠自己100美元。其他的时候，当看到有对手试图激怒斯马特时，他的妈妈就会提醒让斯马特把注意力放到比赛中。而更多的是，斯马特的妈妈在中场发来短信目的是想表达她有多么爱自己的儿子，斯马特也会微笑着回复自己也爱她，然后斯马特会继续回到场上一如既往的拼命。但是，斯马特的妈妈在今年9月份因癌症去世，享年63岁。斯马特在	未
新50元纪念钞来了，海南分配46万张	未
新50元纪念钞美呆 网友:是时候把手机支付放一放了	未
新50元纸币来了！总共1.2亿张！长这样...临港人该怎么兑换看这里	未
新50元纸币来了！总共1.2亿张！长这样...青岛人这么兑换	未
新50元纸币来了！长这样！嘉兴人怎么兑换	未
新50元纸币来了！长这样！巧家人怎么兑换	未
新50元纸币来了！长这样！开平人怎么兑换	未
新50元纸币来了！长这样！桓台人怎么兑换	未
新50元纸币来了！长这样！江阴人怎么兑换	未
新50元纸币来了！长这样！海宁人怎么兑换	未
新50元纸币来了！长这样！淄博人怎么兑换	未
新50元纸币来了！长这样！滨州人怎么兑换	未
新50元纸币来了，长这样！潍坊人怎么兑换	未
新50元纸币来了！长这样！登封人怎么兑换	未
新50元纸币来了！长这样！苍溪人怎么兑换	未
新50元纸币来了！长这样！莱芜人怎么兑换	未
新50元纸币要来了，竟然长这样！随州人还不抓紧去换！	未
新iPad Pro的应用适配真是个大问题，苹果保证PPI不变的结果，就是屏幕的尺寸分辨率和比例全都变了。如果保持分辨率不变，PPI不变缩小边框，或者牺牲一点PPI放大屏幕尺寸也行，反正像素点也看不出来，屏幕足够大多一点少一点像素也不会有太大用处，老应用也就不存在适配问题了。	未
新iPhone最新消息，可能用上超声波屏下指纹！	未
新L车主注意 逆行闯红灯未系安全带非机动车道行驶...一律曝光！	未
新ssr式神八岐大蛇技能ss属性一出手就是一打五，然后疯起来连自己都打阴阳师	未
新 YEEZY 发售预警！YEEZY BOOST 350 V2「 STATIC 」12月29日在 adidas 官网及指定店铺发售！今日官方开启「排队码」预约！60个城市，有你的家乡吗祝你好运！	未
新一代3系，320d柴油四驱版，起价45000欧，展车选到了72840欧 德国慕尼黑	未
新一代RAV4美国25500美元起售，中国会卖多少钱	未
新一代RAV4走硬派风，和凯美瑞共享动力，CRV脸色不好看了	未
新一代丰田Supra无伪装实车曝光，将于2019年1月份2019底特律车展正式首发！cars01车闻	未
新一代比亚迪秦Pro EV600申报信息曝光 近日，一组比亚迪秦Pro EV600的申报信息曝光，新车长宽高为分别为476518371515mm，轴距为2718mm动力方面，该车搭载了一台最大功率达到135kW的电动机，最大续航600km电动一族	未
新一代福克斯旅行版要国产了！没想到吧	未
新一代红绿灯倒计时重现岛城，交警提醒：务必注意这两点	未
新一代高铁黑匣子:700摄氏度高温300秒内烧不坏 可抗100G冲击	未
新一周开始，保定市检察院布置了这些重点工作	未
新一周通城天气静稳偏暖 大气扩散条件较差	未
新一和小兰约会途中，看到这样一幕（twi.licue）	未
新一届发审委53位委员候选人公示，其中一位来自安徽！	未
新一届发审委人选公示 券商等五领域人士未入围	未
新一届发审委员候选名单出炉 取消兼职人员	未
新一届发审委委员候选人公布	未
新一年希望失去的东西都能回来	未
新一批“两类公司”11家试点企业名单浮出水面	未
新一批两类公司11家试点企业名单浮出水面近期，多家央企上市公司密集公告控股股东成为国有资本投资公司试点企业，国有资本投资运营公司试点落地提速。21日闭幕的中央经济工作会议提出，做强做优做大国有资本，加快实现从管企业向管资本转变，改组成立一批国有资本投资公司，组建一批国有资本运营公司。新一批两类公司11家试点企业名单浮出水面	未
新一批“南京工匠”选树确定新十大工种	未
新一批曝光！这些南宁车主因为这事要记3分罚150元	未
新一批食品抽检结果公布，速戳查看抽检情况！	未
新一期免购置税新能源车目录公布近日，工信部发布《免征车辆购置税的新能源汽车车型目录（第22批）》。其中，包括63款纯电动乘用车和23款插电式混合动力车，共86款乘用车榜上有名。广丰雷凌PHEV卡罗拉双擎 E领克03 PHEV比亚迪唐EV大众朗逸纯电动版别克VELITE 6等车型上榜。百家车谈	未
新一柜的货已补，活动已经延期，双12纸尿裤没买到的同学还有额度咩//@性感玉米:L和big码是这样的，双11搞活动，三个中奖的兄弟都要了纸尿裤（这个贵）导致进来的货发奖品就发掉了好多，这样，双12的活动我延期到下周新货（40尺大柜）上架了再结束。可以吧//@若隐若月光:L码有货才是定心丸	未
新一次鸦片战争	未
新一波冷空气来袭 南通最低气温将下降8-10℃	未
新一波房屋出租出售，店铺转让信息，有需要的朋友来看看吧	未
新一波造富运动即将开启，别在傻傻的观望了	未
新一股冷空气冷冻全国 寒意直抵华南	未
【新一轮也门和谈】也门政府军与胡塞武装同意换俘	未
新一轮也门和谈今日将举行	未
新一轮也门和谈在瑞典举行	未
新一轮也门和谈开启，也门政府和胡塞武装互放狠话	未
新一轮也门和谈结束 双方同意荷台达停火	未
新一轮也门和谈结束 胡塞武装代表返回萨那	未
新一轮也门和谈重启 谈判双方就荷台达停火问题尚未达成一致	未
新一轮农地改革政策加速制定，土地承包期再延30年细则将出	未
新一轮医疗反腐风暴下，院长的安全之道	未
新一轮巡察公告发布！巡察对象巡察内容举报电话全公开	未
新一轮开始了！溧水这些单位将接受区委巡查组巡查	未
新一轮曝光来了！请速速前往交警部门接受处理！快来看看有你么......	未
新一轮示威抗议活动在巴黎发起 中使馆吁减少出行	未
新一轮红包，今天的这个码领的都是大红包！打开支付宝首页搜索527770093 ，说不定就领个大的呢！	未
新一轮部落对战联赛开始了，可是我好想吃他手里的大火腿哦保护颈椎戳这里开始网页链接	未
新一轮重污染来袭！平遥启动重污染天气黄色（三级）预警！停产限产限行...	未
新一轮降水今天傍晚抵达 周末气温明显下降	未
新一轮降温从今晚开始 明后山城阴雨持续	未
新一轮降雨15日晚开始，一直下到周末	未
新一轮雾霾今起影响全省！未来一周，南通的天气是……	未
新三年旧三年，鸟叔还是没能熬过穆三年不知道天亮了还是天黑了	未
新三板2.0版改革“周年考”交出了怎样一份答卷？	未
“新三板+H股”破冰 股转明确监管要求	未
新三板个税利好：个人转让原始股按20%征税，非原始股免税	未
新三板改革年遇痛点：机构寄情2019年红利落地	未
新三板触发“改革多米诺”	未
新上台区服务村民冬季用电11月30日，@国网枣庄供电公司 组织13名施工人员，在榴园镇壕沟村西南部新上200千伏安台式变压器1台，新立电杆6基，架设绝缘导线0.31千米，敷设下户线21条，为该片区加工作坊养殖场商铺等70余户村民冬季可靠用电提供了保障。	未
新不列颠岛发生5.8级地震 震源深度10千米	未
新不列颠岛地区发生5.9级地震	未
新不列颠岛地区发生5.9级地震 震源深度20千米	未
新不列颠岛地区发生5.9级地震，震源深度20千米	未
新专栏  汶川以后怎么做看看映秀镇党委书记蔡代敏怎么说！	未
新世界发展拟收购广州地铁旗下公司65%股权	未
新世相她在公交上遭眼镜男猥亵，一大汉突然出手将其制服，随后	未
新世相母亲给4个儿子的遗书：谢谢你们照顾我，但我后悔生下你们...	未
新业态新模式//@汨子:转发微博	未
新东方FM丨为自己而活，靠自己而活	未
新东方FM丨我还没有倒下，希望你也一样	未
新东方三大网红跌下神坛这一年	未
新个税专项附加扣除办法年内将出台，首套房认定成焦点	未
新个税政策实施！明年起，苏州人可以少交多少税	未
新“个税法”你看明白了吗？专家教你算笔账！	未
新个税法实施，今年企业发放年终奖要注意了今年一个重大变化是，新个税法正式颁布， 在2018年10月1日至12月31日将先执行新税法过渡期政策，日常月薪发放适用5000元的费用减除标准和新税率。 由于新个税法是在2019年正式全部生效，在2018年12月31日之前（包括当日）发放的年终奖，适用国税发[2005]9号文件老政策（个税起征点为3500元）确定的计算方式，除以12，分摊到各个月份分别计算。 而2019年1月1日之后（包括当日）发放的年终奖，以实际取得为原则，已经构成2019年的收入，不应	未
新个税法实施后纳税为0 买房需“连续纳税”咋证明？	未
新个税法实施，对你年终奖影响多大时至年末，年终奖依旧是老生常谈的话题钱未到账，有人已经盘算着该如何花了重点来了，年终奖是否必须发又该如何发何时发此外，在新个税法实施后，你的年终奖会受影响吗(中新经纬)	未
新个税法实施对年终奖影响多大?这些问题要搞清楚中新经纬客户端12月8日电 (董湘依)时至年末，年终奖依旧是老生常谈的话题。钱未到账，有人已经盘算着该如何花了，而有人只能无奈吐槽：往年都没发，今年更不指望了。重点来了，年终奖是否必须发又该如何发何时发此外，在新个税法实施后，你的年终奖会受影响吗事关你的钱袋子，这些问题都要搞清楚！图片来源:视觉中国新个税法实施对年终奖影响多大?这些问题要搞清楚	未
新个税法实施对年终奖影响多大?这些问题要搞清楚中新经纬客户端12月8日电 (董湘依)时至年末，年终奖依旧是老生常谈的话题钱未到账，有人已经盘算着该如何花了，而有人只能无奈吐槽：往年都没发，今年更不指望了重点来了，年终奖是否必须发又该如何发何时发此外，在新个税法实施后， ...全文	未
新个税法将实施 央行摸底房贷利息	未
新个税法，将红利实实摆到百姓眼前	未
新中产80后，比担心自己变老，你更应该担心这个问题	未
新中国历史上首次：司法部部长担任律师宣誓仪式的监誓人	未
新中国民营经济的隐秘源起	未
新中国首次 司法部长出席律师宣誓仪式并监誓	未
新中国首次无护具传武擂台赛，拳拳到肉，生死由命	未
新中式遇上莫兰迪色系，是这种高级感没错了！	未
新丰人常说借米不借柴，借衣不借鞋原来是这个意思！	未
新丰人常说的打斗四，原来是这样回事！	未
新丰开展夏季破案攻势行动第二次统一清查行动	未
新主播多关照	未
新举措，灵宝人谁对身份证相片不满意可重拍3次	未
新乐市洁净型煤推广情况公示	未
新乐开展沿街门店小餐饮燃煤集中清理整治行动	未
新乐的老同学，你在哪儿再不聚聚我们就都老了....	未
新乡交管最新发布这五处路段隐患突出 路过时要小心！	未
新乡卫辉市公安局看护队伍招聘50人，不限户籍，最后一天	未
新乡取消老年公交卡，你怎么看	未
新乡启动今冬首个重污染天气红色预警	未
新乡天气天气晴好，周末来了	未
新乡女子开宝马，一头扎向高速护栏快废了，只因男友一个动作12月19日，在大广高速新乡段，进口宝马突然撞向高速护栏。在巨大冲击力下，护栏被撞成S形，宝马发动机损毁严重而接近报废。由于护栏保护，车内情侣也因此与死神擦肩而过，而这一切只因男友一个举动造成新乡女子开宝马，一头扎向高速护栏快废了，只因男友一个动作	未
新乡女子开宝马，一头扎向高速护栏快废了，只因男友一个动作12月19日，在大广高速新乡段，进口宝马突然撞向高速护栏。在巨大冲击力下，护栏被撞成S形，宝马发动机损毁严重而接近报废。由于护栏保护，车内情侣也因此与死神擦肩而过，而这一切只因男友一个举动造成网页链接	未
新乡将大范围停电！长达20小时！有你家吗	未
新乡小宝宝刚11个月，却因脑损伤住进ICU！凶手竟是一只气球一个约三厘米长拇指粗细的气球，竟然让一个11月大的晨晨(化名)差点丧命12月11日凌晨，晨晨被紧急送到了新乡医学院第一附属医院网页链接	未
新乡市和鹤壁市公安局：关于检举揭发张伟等人涉黑恶犯罪违法犯罪线索的公告	未
新乡市新增区间测速设备    此处限高，请绕行！	未
新乡广电V直播三千歪树扶正忙  转变作风扬正气	未
新乡延津县招聘审查调查看护人员50人，不限户籍时间11.26-11.30	未
新乡开封...封丘周边多地限行，出门之前先看这里！	未
新乡快评像书签老人那样为文明城市增色	未
新乡快评刘峥式扶老人：扶起文明新乡新高度	未
新乡携款潜逃近20年嫌犯被抓获，“鼠蚁般的日子终于结束”	未
新乡纪委事业单位招聘工作人员	未
新乡职业技术学院回应“奇葩制度”：部分院系管理简单化	未
@新乡车主，下个月车险缴费要实名制！	未
新乡长垣县蒲西街道办事处招聘协税人员，这些专业优先时间至12.5	未
新书  小时候没有玩过我当消防员我是小医生的请举手！	未
新买了一只戒指/(o)/ 完全是冲动购物了。发现我对那种特价清仓之类的真的没有任何抵抗力。当我发现库存有且只有最后一件，就会头脑发热，把东西买下来。现在有点后悔 当然这件事情的骚操作在于一个不到300块钱的戒指竟然提供改圈服务。()	未
新买的龟背竹，就要这样养，少了一步，马上死翘翘！	未
新五区十字路口 车辆行人注意 马路陷阱	未
新井一二三专栏：再见平成时代（七）│最后一个天皇诞生日	未
新交不知你过去如何，老友不识你如今模样。	未
新交规扣分项新增11条，每条都扣12分！	未
新产品发布磁加载沉降一体化污水处理系统：油污悬浮物有机物重金属一站式快速清除	未
新京报:上马前不妨更多公开讨论	未
新京报刊文：多省份明令禁止“家长批改作业”	未
新京报:就这样“放任不管”？	未
新京报：深圳虐童事件直接把孩子带离父母是下策	未
新京报直播关押23年2次发回3判死刑金哲宏杀人案再审宣判今日，备受关注的吉林金哲宏杀人案再审终于迎来宣判日。此前10月24日，吉林省高院对该案进行了再审审理，当庭并未宣判。@新京报 记者第一时间为您带来宣判结果。正在直播： 新京报的微博直播 .	未
新京报直播直击四川宜宾地震现场 抢修救援正进行12月16日12时46分，四川宜宾市5.7级地震。地震造成当地房屋开裂坍塌及山体滑坡。据四川省宜宾市兴文县委宣传部消息，截止16：00，全县共有10人受伤。新京报记者在震后现场直击抢险救援工作。 新京报的微博直播 .	未
新京报直播花总：给点时间我想从漩涡里走出来五星级酒店卫生乱象后，@花总丢了金箍棒 陷舆论漩涡.此前，花总据新闻照片鉴定过多位官员的手表，被认为是网络反腐代表人物也因《装腔指南》揭露某山寨奢侈品协会而受到关注.今天，他将和酒店业研究者从业者敞开心扉直面问题. 新京报的微博直播 ...全文	未
@新京报 记者从深圳市卫生计生委医学伦理专家委员会获悉，该项试验进行前并未向该部门报备，正开会研究此事。免疫艾滋病的基因编辑婴儿	未
新京报评论：紧急状态有特定含义，不是拘留烧杂草者的理由。治理雾霾，当然很重要很紧急，但这说的和法律上的紧急状态不是一个概念。12月8日，河北曲阳县2人因违规烧劣质散煤被行拘，引发舆论一片质疑声。当晚，曲阳县人民政府办公室宣布：内容有误，系工作人员失误所致，没有拘留，只是给予了批评教育。	未
新京报评论聋哑人强迫聋哑人乞讨，弱势岂是犯罪的理由说的是介绍工作，可青海等地的多名聋哑残疾人被带到西安后，却被同为聋哑人的团伙逼迫上街乞讨，完不成就遭训斥威胁，甚至被拿刀威胁切手指期间，两名被骗者反变成了从犯近日，据媒体报道，莲湖区法院开庭审理并当庭判决，5名被告人均 ...全文	未
新京报评论聋哑人强迫聋哑人乞讨弱势岂是犯罪的理由说的是介绍工作，可青海等地的多名聋哑残疾人被带到西安后，却被同为聋哑人的团伙逼迫上街乞讨，完不成就遭训斥威胁，甚至被拿刀威胁切手指。期间，两名被骗者反变成了从犯。近日，据媒体报道，莲湖区法院开庭审理并当庭判决，5名被告人均被判处有期徒刑。 聋哑人强迫聋哑人乞讨，弱势岂是犯罪的理由	未
新京报：谁通过的“基因编辑婴儿”伦理审查？	未
新京报：谁通过的“基因编辑婴儿”伦理审查？(图)	未
新人在火锅店办婚礼 大家想吃啥就用手机点啥近日，网友在朋友圈发布的结婚视频火了！一对重庆小夫妻在杭州举办了一场特殊的麻辣火锅婚礼，被问到为什么在火锅店办婚礼时，新娘小刘表示：现在订婚的酒店好像都排到明年去了大家都比较喜欢吃火锅，想吃什么直接用手机扫码点就是了，既方便又 ...全文	未
新人报到，请多指教。	未
新人求关注 上海初雪 聊个天吧（来自@日子很无聊小姐 的一直播）点击网页链接和Ta亲密交流	未
新人结婚，喜宴刚开席，车子就起火了！宝马X5烧成空架今天中午，绍兴一对新人举办婚礼，忽然有人喊道着火了！着火的地方是车队停车的地方，路边有长串鞭炮的碎屑。不远处，宝马X5剧烈燃烧，旁边的奥迪A6和货车也被引燃。宝马车主说新人是他好友，结婚嘛总是要放鞭炮的。但他不能肯定着火是因鞭炮。预计起火的三辆车加起来超百万。起火原因正在调查。网页链接	未
新人结婚被好友用胶带捆电线杆上 轮番用皮带抽打	未
新人采访 新人采访文字版	未
新：今日急聘	未
新任北京市委常委王宁兼职公布：市委教工委书记	未
新任局长上任路上，见到狡警打人，一个电话直接打到....	未
新任高雄市长韩国瑜：打过陈水扁一巴掌的非典型国民党人	未
新会员制气哭老会员？星巴克回应称调整后更公平	未
新余一名正厅级领导干部接受审查调查	未
新余一女生上学刮到别人的车逃逸后，车主竟然这样做	未
新余丨他从火场中走来，手里还拿着2万现金	未
新余：五位一体跟踪帮教每一个戒毒人员	未
新余停电信息！	未
新余：后花园	未
新余：它从组建至今，49年义务服务 24小时随时待命	未
新余将建设一所小学，目前已进入建设前公示期，拟建在...	未
新余开通一条新的公交线路！	未
新余强戒所：五位一体工作模式 帮助戒毒人员回归社会	未
新余这个小镇有点甜，看完之后你想去吗	未
新余：酒司机同交警较劲换牌易主，终被铁骑队查获	未
新作爬上烟囱来看看：湿地中的红砖塔 / 空格建筑	未
新修订《渔业捕捞许可管理规定》2019年1月1日施行	未
新修订的《军队审计条例》发布	未
新修订的《政府制定价格听证办法》明年初施行	未
“新债王”冈拉克：美股2019年将持续走弱	未
新债王冈拉克：美股2019年将持续走弱冈拉克11日表示，现在美股市场情绪是弱市的开始，并且在2019年会得到持续。他认为，新兴市场的股市表现可能会超越美国。冈拉克认为，标普500指数可能会下跌至2500点下方。美元下一步看跌，美联储2019-2020年将微乎其微收紧甚至不会收紧货币政策。（中证网）	未
新债王冈拉克：非常肯定目前市场处于熊市，标普500指数正朝向新的低点。	未
新元科技筹划控制权变更 新实控人或为常德市财政局	未
新公交已到货，首批纯电动新能源公交车12月中旬上线运营	未
