新建建筑物将强制配建充电设施日前，天津市发改委印发《天津市加快新能源汽车充电基础设施建设实施方案（2018-2020）》。根据《方案》，新建各类建筑物要按照国家及我市有关规定，按比例强制配建充电设施，已建各类建筑物也要按照需求，开展充电设施配建活动。鼓励在已有各类建筑物公共停车场与高速公路服务区等场所配建公共充电基础设施。鼓励在具备条件的加油加气站配建公共快充设施，在物流集散地及公共停车场建设集中式快速充电桩。	未
新建成（都）兰（州）铁路跨越龙门山地震带，与沿线54条泥石流沟交叉，有24条泥石流沟采用桥梁跨越，泥石流通过冲击冲刷淤埋等方式对铁路桥梁安全运行构成严重威胁。中科院成都山地所开展了室内大比例泥石流-桥墩相互作用物理模型试验研究并取得新进展。网页链接	未
新建水渠27.2公里 实测只有8.3公里	未
《新建纯电动乘用车企业管理规定》 2015年第27号令	未
新建铁路天水至陇南线预可行性研究报告评审会召开	未
新建铁路新疆博州支线博尔塔拉站站房双河站站房及相关工程招标	未
新开发银行成为联合国大会观察员	未
新式交通工具占据巴黎街头，有人欢喜有人忧在法国巴黎街头，共享电动踏板车逐渐成为都市人的出行交通新选择。这种新式交通工具正迅速占领大街小巷。它在提供便利的同时，给当地居民造成了很大的烦恼。这些新款踏板车的速度最高可以达到每小时20公里，对走在附近的行人造成一定程度的安全威胁。法国政府已经出台了相关议案，将禁止在人行道上骑行踏板车。但踏板车的拥护者则认为，禁行不能解决问题，应该增加更多专用道来支持这一环保交通工具。（记者杜晓颖韩宝仪）	未
新式取款机 微博视频	未
新式的网红茶饮品牌，究竟在卖什么	未
新式防雾霾发型了解一下	未
新形势下成都宣传思想工作怎么干范锐平强调了这几点！	未
新形势下深圳宣传思想工作如何做这个会议是这样部署的	未
新得罪一年新开始！	未
新德里拟推广电动车应对空气污染	未
新总的表情管理啊	未
新恋情？＂超杀女＂与大布分手后疑恋上27岁女模特	未
新情報只有主題曲草	未
@新战友，你知道我在军营等你吗	未
新房二手房价格倒挂压力缓解 政策效果逐步显现	未
新房供热不达标谁负责暖气漏水管道老化，费用谁担	未
新手也可以完成的钩针大衣马甲	未
新手党速马	未
新手司机喜提新车，当天就撞小区闸机！	未
新手司机驾车坠入50余米陡崖	未
新手开车在拐弯的时候喜欢踩刹车老司机：这样做很危险！	未
新手指南：关于自行车骑游的9个常见问题	未
新手操作大埔一路口小车把摩托撞了	未
新手教练他们曾经都是球队的一员，如今成为了主教练。这四位目前都面临着不同的困境，你更看好哪位索拉里 皇马 联赛第4 欧冠晋级16强加图索 AC米兰 联赛第4 欧联出局亨利 摩纳哥 联赛第19 欧冠出局索尔斯克亚 曼联 联赛第6 欧冠晋级16强	未
新手机滑落不知去处，宿豫好心大姐捡到物归原主	未
新手机滑落不知去处 宿迁大姐捡到物归原主	未
新手爸妈必知：疫苗接种的禁忌和注意事项	未
新手玩家在安全区 搞笑	未
新手美工上路，请注意保持行距！ 街头广告排版车祸现场（via：微博正文）	未
新手葫芦玩家搞清楚这个3个问题，就可以安全入坑了	未
新技术可通过唾液气味筛查口腔癌	未
新技术将致人类灭绝移居外星人类形成新物种	未
新技术是一种真正改变世界的力量，我发现周围护照的老人，多人拿个手机听群里聊天。不知国外老人怎么社交有在国外的说说你们看到的情况。	未
新技能get如何防止被偷拍这些你必须知道！生活中有哪些日常用品有可能被改装成偷拍的微型摄像头除此之外，有哪些场所容易被偷拍偷录戳图学习提高警惕，保护自己！转发提醒你关心的人！（via@人民日报）	未
新技能get//@辣条娘: 噗//@我掉碗里了:从来没接到过这种有趣的电话 是不是他也知道我没钱被骗//@江南大野花:不抓紧装个逼白瞎这场骗局了//@妖妖小精://@人间指南志:很需要	未
新拍照旗舰！华为P30 Pro外形首曝：意外	未
新招聘！多编制岗招830人，年薪15万！	未
新提博越发现有异响，厂家技术人员：驾驶习惯的问题	未
新提醒吴忠55岁猥琐男进女厕偷窥！辅警从洗漱镜发现了端倪	未
新提醒央视曝光！宁夏人注意，赶紧看看家里有没有这种灯，别再用了！	未
新提醒@银川人！交警将对这些路段重点整治！驾驶员和行人都要注意...	未
新政后南京网约车奇缺 打了辆快车，来的竟然是出租车	未
新政后海南免税商品在哪买哪提货最全答案来了	未
新政策出台，和退休人员密切相关！赶紧看，还不晚！	未
新政策，平度农村将有大变化！	未
新政策推出，年底还没考驾照的有福了，网友：考驾照更容易了！	未
新政策！本月起，蚌埠这类人的一笔钱上调了！	未
新政策！瑞安人的电动车还能上路吗三年后将	未
新政策！经房东同意，租户可申请落户泰州！	未
新文化运动这些作者文人都讲了什么，总结一下吧：汉字不灭，中国必亡。因为汉字的艰深，使全中国大多数的假若，永远和前面 进的文化隔离。我是自身受汉字苦痛很深的一个人，因此我坚决主张以新文字来替代这种障碍大众进步的汉字。（引自芬君《鲁迅访问记》）我们必须承认我们自己百事不如人，不但物质不如人，不但机械上不如人，并且政治社会道德不如人中国事事不如人，问题就出在汉字上，汉字不废，中国必亡。我们要从文字开始，全盘西化，全盘西化之不足则充分世界化，改良之不足而革命之。-----胡适《请大家来照照镜子》中国这二	未
新新闻！邯郸市广平县从此再无乡！小县城将有大动作	未
新旧交替	未
新旧图片大对比，桂城这些地方大变样！你还认得出来吗	未
新时代中国改革开放如何再出发？	未
新时代做好基层党建工作之我见	未
新时代国投集团宣传思想工作怎么做 这个会议给出答案！	未
新时代国有企业纪检工作有了方向	未
新时代好警察丨信息导侦胜千里	未
新时代好警察丨刀尖上的禁毒英雄	未
新时代好警察丨风雨接力铸警魂	未
新时代如何有效克服脱离群众危险	未
新时代如何遵守新《条例》落实新《规定》丰泽区委中心组举办学习会	未
新时代宜昌组织和宣传思想工作怎么做?周霁书记划重点了！	未
新时代害虫出没，为躲雾霾，大妈跑进酒店大堂跳广场舞	未
新时代应对历史虚无主义思潮的主要对策	未
新时代 我来讲开讲！风扇股票林高远之间有什么关系	未
新时代，改革开放再出发	未
新时代改革的逻辑	未
新时代文明实践中心如何建设韶关定了五个试点！	未
新时代文明实践  五莲电视台主持人集体转行速来围观！	未
新时代文明实践  如何建设新时代文明实践中心日照岚山这么干！	未
新时代文明实践泗阳县举行12.4国家宪法日普法宣传志愿服务活动	未
新时代文明实践  淄博市淄川区：山路弯弯公益情	未
新时代文明实践  荣成：千人环湖健步走 普法宣传共参与	未
新时代 新作为 新篇章大同市坚决打好污染防治攻坚战	未
【新时代 新作为 新篇章】让数据多跑路，群众少跑路	未
新时代  新征程改革开放40年来，上海市民的出行方式经历哪些变化上海地铁从无到有，从线到网的过程有发生了什么答案尽在庆祝改革开放40周年特别节目节目正在直播中，点击链接观看（网页链接）	未
[新时代 新气象 新作为]西藏日喀则：振兴产业克服脱贫“三力”不足	未
新时代新青年刘心依 一心一依为安全	未
新时代检察职能宣传微视频展播丨《悟空说法》	未
新时代，民航安全管理的主要矛盾是什么	未
新时代的青年故事：长城保护员	未
新时代铁路榜样黄伟：不惧生死，百米危峦上的逆行者	未
新时代青年如何勇挑重担静安区委书记陆晓栋这样说	未
新昌6旬大爷在嵊州疯狂偷车！四个月偷11辆自行车和三轮车，怎么做到的	未
新昌一女干部及工作人员被市纪委通报！@这个岗位确实要负责	未
@新昌囊赶紧来看看！最严电动车新规出台！有疑问的	未
新昌有一批公务车要拍卖(附清单)，最便宜的5000元起...	未
新昌组织召开医保反欺诈警示教育大会	未
新星拒绝巴萨皇马本轮英超，沃特福德3-2击败卡迪夫城，19岁葡萄牙中场多明戈斯-奎纳，打进了自己的英超首球。2017年夏天，他效力西汉姆的时候，就吸引了巴萨皇马的关注。到了2018年，他帮助葡萄牙U19夺得欧洲U19锦标赛冠军。由于在铁锤帮得不到出场机会，于是他选择转会。西甲双雄都向他发出邀请，但是奎纳竟然拒绝他们，因为他转会的目标有两个：在一线队打上比赛，留在伦敦。于是，离伦敦不远的沃特福德，向西汉姆支付了100万镑转会费，签下了这名小将。本赛季，他代表沃特福德出战3场英超，2场联赛杯	未
【新春走军营】当女兵与钢铁战车相遇,注定不一般	未
新晋“80后”副县长 曾长期在中办任职(图)	未
新晚报招聘啦！擅长视频拍摄和制作者优先录用新晚报拟面向社会公开招聘新媒体采编人员。要求大学本科（统招）及以上学历，有三年以上媒体相关工作经验，年龄不超过32周岁。详情	未
新月“立”着？杭州一天文学教师指出小学科学课本月相图有误	未
新机  下周和下下周里，有好多新飞机要交付和开工！	未
新机场拆迁最新进展！廊坊部分村民开始选房了！固安地区的也不远了！	未
新权利须待法律明确后才宜登记发证	未
新来的朋友：问房子孩子家庭关系土地流转宅基地各种闲七杂八的，请移步同名公众号，我这几年勉强聊了小一百篇。知无不言 言无不尽，没办法再多聊一个字了。人称江湖宝瓶掏不尽咸鱼躺着等赚钱正是在下，但也就这么多了。抱歉不回私信了。 老关注者顶一下，谢谢！	未
新来的秘书，无心工作	未
新枣庄八景出炉，看看你的家乡有几处	未
新柳南高速忻城段途经这些地方，请留意你家坟墓是否要迁...	未
新标准来了！低度近视手术后也可报考民航飞行员	未
新标唤醒“沉睡”旧币  不宜流通可光荣“退休”	未
新标唤醒“沉睡”旧币 不宜流通可光荣“退休”	未
新校服外形曝光！毒哥的腰还是那个腰	未
新楼开盘雇女模裸身当展板 妇女报：女性不能被沦为促销的工具和载体11月30日，广西一个名为南站新城的房产项目开盘用女模特裸背当户型展板裸胸当项目名称标识的视频及图片在网上广为传播。江南区工商局商标广告股负责人回应称，该营销活动没有虚假宣传，并不属于虚假广告，至于是否低俗涉黄，应由警方查处界定。@中国妇女报 评论：女性不能被沦为促销的工具和载体。阳光之下，决不允许如此踩踏红线的龌龊营销。	未
新模型让全球汞排放“有据可查”	未
新款50元纸币来了！温州市区分到28万多张！今天开始预约	未
新款iPhone行货国内变相降价	未
新款奥迪A4 Avant路试谍照曝光日前，一组奥迪新款A4 Avant的路试谍照曝光，新车对前脸和车尾设计进行了小幅度修改，新车将于2019年发布新车公社	未
新民早报  春运在即 1月6日可买除夕火车票12月23日起开抢春运火车票，订票时间表请收好2019年春运，从2019年1月21日（腊月十六）开始，到2019年3月1日（正月廿五）结束要抢票回家的小伙伴记住这几个时间点2019年1月5日，可以购买2019年年二十九（2月3日）的火车票2019年1月6日，可以 ...全文	未
新民早报  春运在即 1月6日可买除夕火车票12月23日起开抢春运火车票，订票时间表请收好。2019年春运，从2019年1月21日（腊月十六）开始，到2019年3月1日（正月廿五）结束。要抢票回家的小伙伴记住这几个时间点2019年1月5日，可以购买2019年年二十九（2月3日）的火车票。2019年1月6日，可以购买2019年除夕（2月4日）的火车票。2019年1月7日，可以购买2019年春节（2月5日）的火车票。2019年1月12日，可以购买2019年正月初六（2月10日）的火车票。via新民	未
新民街改造要完工上外三亚附中槟榔河文旅商业街将建设上周三亚都发生了哪些大事	未
新民路一井盖神秘失踪，走过路过要当心！	未
新民镇锦盛煤矿煤矸石随意堆放问题已完成整改	未
新气象冷空气到货！广州发布寒冷预警信号气象部门预计，昨天夜间冷空气自北向南影响广州，气温逐渐下降7到8日，广州市以阴冷天气为主，偶有零星小雨，气温继续下降，昼夜温差减小9日，广州市将有小到中雨。昨天夜间起陆地风力增至4-5级，港区6-8级。从昨天17时13分起，广州市区寒冷黄色预警信号生效，请注意防寒保暖。（新快报记者 许力夫）冷空气来了 广州发布寒冷预警信号	未
新气象棉被先别收起来 今天又有冷空气补充广州市区今晨录得最低气温12度，比昨天高3度，冰蓝鸡腿比昨天稍微解冻了一点，不过今明两天，又有冷空气补充，气温又再有下降，并伴有分散性的小雨体感还会比较寒冷，大家要做好保暖工作广东未来三天天气预计阴冷持续，想看广东下雪的同学，你们有机会 ...全文	未
新气象棉被先别收起来 今天又有冷空气补充广州市区今晨录得最低气温12度，比昨天高3度，冰蓝鸡腿比昨天稍微解冻了一点，不过今明两天，又有冷空气补充，气温又再有下降，并伴有分散性的小雨。体感还会比较寒冷，大家要做好保暖工作。广东未来三天天气预计阴冷持续，想看广东下雪的同学，你们有机会的！(新快报)网页链接	未
新气象！水南镇一村民主动迁祖坟入公墓	未
新沂市疾病预防控制中心自制艾滋病宣传小品	未
新法治银川四名高中生无证驾车拍抖音！警察蜀黍看到之后	未
新泰83岁老人今天走失！家属万分着急，求扩散	未
新泰各地雪景照片，这俊的可了不敌了！	未
新泰多家企业竟是全省行业翘楚！你知道吗	未
新泰市供电公司2018年12月份停电计划！	未
新泽西州一小学课堂上，老师告诉一年级的学生们圣诞老人是假的！圣诞礼物也只是爸妈买来放在树下而已，驯鹿不会飞，精灵的存在是假的！ 这种作为让许多家长感到非常不满，向这名老师提出检举	未
新津人速看！这两种感冒药，全国停用停产！	未
新洲一瘾君子撇下工友驾车逃跑，怎料...	未
新洲全面整治校园周边食品小摊点	未
新洲再打组合拳强拆地铁小镇违建	未
新洲区应急办关于做好低温雨雪天气应对工作的紧急通知	未
新洲区检察院召开三个专项立案监督活动新闻发布会	未
新洲区检察院宪法宣传日开展系列活动	未
新洲区部门联合整治渣土运输车	未
新洲多部门联手 半日拆除项目周边千余平违建	未
新洲强拆11处历史违建	未
新洲微封面第080期：汪文秀(阳逻人)	未
新洲新施公路一越野车深夜失控冲入防护林...	未
新洲：省市院领导到新洲实地查看公益诉讼整改情况	未
新流帮帮忙  深圳某公司寻现金贷电商业务合作	未
新浪100万现金征文大家是不是就看不上会员了	未
新浪100万现金征文 还有十万多字就截稿了	未
新浪20年 12月1日，中午12点见	未
新浪20年12月1日，中午12点见。	未
新浪20年 2014年2月24日沙尔克开通了微博	未
新浪20年20年间，海南人的读报方式怎么变20年前，父辈们常苦守在家门口，等候邮递员骑着自行车前来，从绿色的邮包里掏出一份散发着墨香的海南日报，欣喜地展开，他们从字里行间了解外面的世界，然而，报上多是前一天的新闻20年后，只需关注@海南日报 ，即可在新闻发生瞬间掌握最鲜资讯 ...全文	未
新浪20年不止旅行20年前，10岁的我还没有旅行这个概念，20年后，三十而立的我，闯荡世界七大洲80国。是改变，是成长，是与时代同行。而这个时代，幸有新浪，让陌生在这里汇聚，彼此成为彼此的风景。每一个文字每一张照片每一条视频，都是时代的记录。生日快乐，新浪！乘风破浪继续致敬影响力！	未
新浪20年 别人家的车库 微博视频 新浪20年	未
新浪20年 厦大教授邹振东：新浪不再是一个平台，而是一个世界。你怎么看	未
新浪20年大浪逐新//@小浪同学爱吐槽: 新浪20年生日快乐！[给你小心心]//@Qing: 20年，大浪逐新，与时代同行20年，感恩有你，我们一起接力！我们与你同在！新浪20年	未
新浪20年 小浪每天也在默默关注你	未
新浪20年快被搞成互联网的20年，这还到线下了，难道要搞成互联网颠覆传统媒介的20年么	未
新浪20年我和新浪的故事 已经记不清第一次接触新浪的时间了，那会还玩的是论坛，后来转到博客去了，2012年的时候才开始玩微博。感谢新浪的陪伴，也让我认识了很多新朋友[给你小心心]	未
新浪20年 我要不要改性别。	未
新浪20年 新浪创立于相约98，我是99年进入大学，2000年开始接触网络，还记得当年点击竞技风暴的日子虽然最终没有给新浪体育做过工作，但在这个圈子和新浪有千丝万缕的联系，2010年被新浪体育的兄弟撺掇着又开了微博。时间就是这么一天天过去，发生了太多，以至于今天都会惊讶于新浪竟然刚20岁	未
新浪20年 @曹国伟 我和新浪的故事             我与新浪的故事   说起我与新浪的相识相知到相爱可谓刻骨铭心，不用加引号   如果没有遇到新浪，遇到微博，我现在毫无疑问已经是家乡小城冬日里，正午的墙根底下晒太阳的老汉    2009年春节后，我与威海报业集团解除了工作合同清明节 ...全文	未
新浪20年 @曹国伟 我和新浪的故事 我与新浪的故事 说起我与新浪的相识相知到相爱可谓刻骨铭心，不用加引号。 如果没有遇到新浪，遇到微博，我现在毫无疑问已经是家乡小城冬日里，正午的墙根底下晒太阳的老汉。2009年春节后，我与威海报业集团解除了工作合同。清明节 ...全文	未
新浪20年 @曹国伟 我和新浪的故事 时代与命运看新浪的新闻是挺早的事情，不过真正改变我命运的，其实还是2011年开始在新浪写博客之后。在2008年来到北京，差不多摸爬滚打混了三年，开始有了一些圈子，在和一个科技圈的朋友聊过之后，他给我一个建议，他觉得我对行业的理解还是比较深刻，思维也比较不错，让我试着去写文章。其实我之前也一直写东西，从QQ空间到论坛社区，博客也有更新，也算写作的爱好者，不过并没有什么收获。他告诉我说，你坚持在新浪博客写，以你的才华肯定能写出点名气。于是在2011年的9月2日，	未
新浪20年 有多少小伙伴认为吃素能减肥 微博视频 新浪20年	未
新浪20年猛一看好像 新娘20岁满脑子在想啥	未
新浪20年 表白[给你小心心]@鲜城 @微博内容商业联盟	未
新浪军事出鞘  万里长城十亿兵：从二战美国的案例浅谈战争中的人力动员在上期出鞘中，有网友留言能出一期分析天朝目前战争潜力的出鞘么就像二战期间的美国，其强大的战争动员能力，恐怖的制造效率令人恐惧啊希望能有篇介绍兔子综合战争动员能力的为了回应大家的需求，本期出鞘 ...全文	未
新浪军事出鞘万里长城十亿兵：从二战美国的案例浅谈战争中的人力动员总的来说，中国在战争动员中人力一项的各个方面都有巨大的潜力同时中国目前所面临的问题也恰恰非常类似于二战时期的美国后者在也存在技术工人的生产效率较低科研人才储备较欧洲传统发达国家更弱等问题所以我们推 ...全文	未
新浪军事出鞘 学到源头理自通：一战以来海军理论的发展对中国的影响在之前的出鞘中我们以马汉的视角简单梳理了海权论与制海权理论的由来与发展在留言中有不少网友提出海军航空兵岸防导弹和核武器对于海军理论的影响确实，在马汉生活的年代，这些武器尚未出现或者刚刚起步发展 ...全文	未
新浪军事出鞘 学到源头理自通：一战以来海军理论的发展对中国的影响在之前的《出鞘》中我们以马汉的视角简单梳理了海权论与制海权理论的由来与发展。在留言中有不少网友提出海军航空兵岸防导弹和核武器对于海军理论的影响。确实，在马汉生活的年代，这些武器尚未出现或者刚刚起步发展。马汉的理论必然无法面面俱到。同时，两次世界大战以来，海军本身存在的根基也曾一度被动摇。依附于其的制海权理论也难免饱受非议。本期《出鞘》，我们就来接着上期，结合第一次世界大战的战例，谈谈制海权理论受新装备促成的发展，及	未
新浪军事出鞘学到源头理自通：一战以来海军理论的发展对中国的影响新装备为制海权理论添加了新的表现形式，而制海权理论也在保持核心精神不变的前提下，接受这种新形势来适应时代的发展。正如罗辛斯基所表达的那样，海洋是现代化的工业国家的命脉之一。作为世界最大工业国的中国无论何时都不可能忍受丧失制海权所带来的伤痛。这意味着制海权理论这一通过五百年来的战争实践总结出的经验，在今天仍是我们必须贯彻和发展的。 学到源头理自通：一战以来海军理论的发展对中国的影响	未
新浪军事出鞘 战是和平暴是仁：浅谈T-34坦克是如何从二战烽火中走来的12月3日，俄罗斯坦克制造商乌拉尔车辆制造厂为了庆祝苏联T-34坦克设计师米哈伊尔伊里奇科什金诞辰120周年，在零下20度的严寒条件下，于乌拉尔军事训练场为T-34T-72和T-90三代坦克举办了一场特殊的赛车比赛T-34系列 ...全文	未
新浪军事出鞘战是和平暴是仁：浅谈T-34坦克是如何从二战烽火中走来的虽然在二战期间T-34坦克曾让德军吃过不少苦头，但德军还是不计前嫌地将许多俘获的T-34坦克给投入德军装备序列。一方面，德军会在T-34坦克的车体或炮塔上涂刷大白色十字，以增强敌我装备的战场辨识度另一方面，德国也对T-34坦克进行了部分改装，包括将III号和IV号坦克的车长顶塔改装到T-34坦克上，以及在T-34坦克底盘上加装一门四联装20毫米火炮，而后者则与中国利用T-34坦克车体生产63式自行火炮等有异曲同工之妙。 战	未
新浪军事出鞘菊花人貌自年年：从日本新型护卫舰谈日本海洋政策的调整有时候我们也要抛弃日本发展就是为了针对中国的思维定式，毕竟就算中国海军舰艇编队一夜之间全部消失，日本海自仅面对中国海军航空兵和岸基导弹兵，都不可能争夺到第一岛链之内的制海权那么我们甚至不妨假设，日本寻求一 ...全文	未
新浪军事出鞘菊花人貌自年年：从日本新型护卫舰谈日本海洋政策的调整有时候我们也要抛弃日本发展就是为了针对中国的思维定式，毕竟就算中国海军舰艇编队一夜之间全部消失，日本海自仅面对中国海军航空兵和岸基导弹兵，都不可能争夺到第一岛链之内的制海权。那么我们甚至不妨假设，日本寻求一支攻守平衡的舰队，实则是为了削弱其国防对美国的依赖。而在这样一个情境中，中日两国合则两利，斗则两伤。 菊花人貌自年年：从日本新型护卫舰谈日本海洋政策的调整	未
新浪军事出鞘 雕栏玉砌应犹在：中国该在坦赞铁路改造中扮演什么角色据新华社11月28日报道，就在丹麦等西方国家最近纷纷冻结对坦桑尼亚的援助资金之际，由中国政府援建的达累斯萨拉姆大学图书馆，在当地27日正式移交坦桑尼亚。目前坦桑尼亚正在筹划改造坦赞铁路，那么这个中国最大援外项目的现状如何，参与坦赞铁路改造又会对中国的东非布局有何影响。本期出鞘就来谈中国该如何参与坦赞铁路改造工作。	未
新浪出了个bug，发送出去微博找不到草稿箱里也没了罐罐重新码字大家别着急	未
