新华社揭秘违规相互保：0元加入 出险后每单最多分摊1角钱最近，一款名为相互保的产品蹿红网络然而，其中却存在诸多违规相互保的保费是根据实际发生的赔案进行事后分摊，与备案材料中的费率计算方法存在明显背离而且备案材料中被保险人按10岁为一组划分为6组分别定价被修改为按2 ...全文	未
新华社:没有一项政策是十全十美的 要杜绝朝令夕改新华社：在中国足协20日召开的2018赛季职业联赛总结大会上，有关俱乐部支出注资亏损薪酬奖金等财务指标的一系列帽子正式落地。没有一项政策是十全十美的，中国足球要一步步走向强大，我们眼前迈出的每一步都需要坚实一点再坚实一点，拒绝朝令夕改也拒绝豪赌一场。唯有如此，我们的改革才能汇成通向中国足球走向强大的滚滚洪流。新华社:没有一项政策是十全十美的 要杜绝朝令夕改	未
新华社点名怒批中部某省：机动车限行不能各拍各的脑袋！	未
新华社现场云：甘雨润物细无声	未
新华社：理财市场告别“造富”神话走向规范	未
新华社盯上了辛集皮革下脚料！	未
新华社：破解民企融资难从根本上说要靠改革	未
新华社社评：新时代，改革开放再出发	未
新华社等19家媒体聚焦杭州三堡排涝工程	未
新华社综述：中国在拉美“朋友圈”的感召力越来越强	未
新华社：网游有德，方能致远@新华视点 昨晚发布评论网游有德，方能致远，文中表示网游虚拟空间绝非道德真空地带，对那些以低俗为乐粗俗为美暴力为趣的毁三观网游，设置安检及时叫停，既是对社会负责，也是对行业发展负责。网络不是法外之地，网游企业更不能眼里只有利益，什么时候都不能忘了社会责任。法治与德治并举，自律与他律相济，网游行业才能避免跑偏，才能走稳走好	未
新华社评	未
新华社评：新时代，改革开放再出发	未
新华社评论员	未
新华社评论员：将改革开放进行到底	未
新华社评论员 ：通过改革开放破解前进中的问题	未
新华社评论员：通过改革开放破解前进中的问题	未
新华社评论员：通过改革开放破解前进中的问题——二论贯彻落实中央经济工作会议精神	未
新华社调查儿科看病难：孩子半厘米小伤口清创包扎无医院收诊每到冬季流感高发季，儿科看病难问题就会再次凸显。一面是儿科医疗资源短缺，孩子看病难另一面则是儿科医生群体面临活儿难干人难留等多重困境。儿科问题究竟如何破解记者进行了调查。详情请戳gtgtgt新华社调查儿科看病难：孩子半厘米小伤口清创包扎无医院收诊	未
新华社调查儿科看病难：孩子半厘米小伤口清创包扎无医院收诊每到冬季流感高发季，儿科看病难问题就会再次凸显一面是儿科医疗资源短缺，孩子看病难另一面则是儿科医生群体面临活儿难干人难留等多重困境儿科问题究竟如何破解记者进行了调查详情请戳gtgtgt新华社调查儿科看病难：孩子半厘米小伤口清创包扎无医院收诊	未
新华社调查手机交通卡开卡费：标准各异，有的可退有的不行	未
新华社调查“考研热”：290万人报考，有人为缓冲就业压力	未
新华社：退市新规威力初显，除了“史上最严”还传递出哪些监管信号？	未
新华社郑州11月30日电（记者刘怀丕）记者从郑州市热力总公司获悉，位于郑州市经三路和农科路附近的卡萨公寓，今晨4:10左右发生热力老旧管网爆管，爆管致3人死亡，一人受轻伤已送往医院救治，爆管的具体原因正在调查，有关部门正在全力救援中（完）	未
新华社重庆12月15日电（记者黎华玲柯高阳何宗渝）记者从重庆市綦江区委宣传部了解到，12月15日18时7分许，重庆能投集团渝新能源公司下属逢春煤矿副斜井发生因箕斗连接装置断裂造成箕斗下滑，致现场作业人员10人中7人死亡1人重伤2人轻伤，伤员已紧急送往松藻煤电医院救治事故发生后，重 ...全文	未
新华社重庆12月15日电（记者黎华玲柯高阳何宗渝）记者从重庆市綦江区委宣传部了解到，12月15日18时7分许，重庆能投集团渝新能源公司下属逢春煤矿副斜井发生因箕斗连接装置断裂造成箕斗下滑，致现场作业人员10人中7人死亡1人重伤2人轻伤，伤员已紧急送往松藻煤电医院救治。事故发生后，重庆能投集团和渝新公司负责人到达现场，綦江区主要领导率区应急办公安局安监局卫计委等部门赶赴现场，配合该公司开展救援和善后工作。目前，事故具体原因正在进一步调查之中。（完） 重庆綦江区一煤矿发生运输事故致7	未
新华社：面临下行压力，中国经济形势如何看？	未
新华社首次确认中国第3艘航母研制：已在船台上建造	未
新华社首次确认中国第3艘航母研制：已在船台建造	未
新华社首次确认中国第三艘航母状况：正在有序建造	未
新华社首次确认中国第三艘航母研制：已在船台上有序建造	未
新华网：2020年底前，工勘商业地勘全部转企，取消事业编！	未
新华网东北虎林园：老虎换装增膘越冬	未
新华联18亿转让2家银行股权 挂牌5个月无人问津今日是新华联控股有限公司挂牌转让两家银行股权截止日期，这两个项目分别为转让大兴安岭农商行18的股权宁夏银行13.53的股权，转让底价共计18.04亿元，目前已挂牌5个月，至今仍未成交，而原定信息披露期均为20个工作日，但因未征集到受让人一再延长信息披露。（新京报）	未
新华视点：中央经济工作会议透露出的2019年经济工作信息	未
新华视点：收费标准各异 手机交通一卡通开卡费去哪儿了消费者反映，在使用华为小米锤子等安卓系统手机办理多个城市的交通一卡通时，被收取多少不等的开卡服务费且不退还。当被问及开卡费为何不退时，一些手机厂商在开卡页面相关通告中解释称，虚拟公交卡属于异形卡公交异形卡	未
新华视点评＂基因编辑婴儿＂:大胆创新不应无视伦理	未
//@新华视点:转发微博	未
【新华调查】企业招聘正从普工向技工转变 ——职场供需两旺，为何还会“两难”	未
新华路这片儿地有新动作，涉及一幼六小新华书店热力公司......	未
新华路隧道青山路今早正式通车，上下班快15分钟！	未
新华锐评 新华微评：弱势不是免责的挡箭牌近日，广东一位行人未按交通灯信号横过马路造成行驶中的摩托车乘客死亡，以交通肇事罪被追究刑事责任长久以来，一些人错误地认为行人是交通事故中的弱者，自以为弱势就横行无忌，把安全责任推给机动车一方殊不知，事故不长眼 ...全文	未
新华锐评新华网评：前进路上，我们风雨无阻我们已经走了一段很长的路，但还有更长的路在脚下。一个立志于既不走封闭僵化的老路也不走改旗易帜的邪路的伟大民族，必然会坚定不移地走在自己所选择的道路上。40年来是如此，40年后依然会如此。改革开放四十周年 新华网评：前进路上，我们风雨无阻	未
新华锐评毒品，让最美人生冷酷到底据人民日报法人微博公布，11月26日，一名43岁歌手陈某因吸毒非法持有毒品被北京警方行拘此案正在进一步工作中对歌手陈某而言，其演艺生涯因为毒品划上了休止符，但对于那些还在心存侥幸的人来说，这无异于是一次强烈的警示：远离毒品，珍爱人生，别让彩虹 ...全文	未
新华镇卫生院整体搬迁通告	未
新《南京市地下文物保护条例》 明年3月1日起施行	未
@新县人，真要穿秋裤了，新一批冷空气立马到货！	未
新县婚礼习俗知多少	未
新县这几个小区居民开了运动会这是真的！	未
新发型不满意拿猫出气女子做完新发型后不满意 回家打伤猫向美发店索赔苏州女子去理发，给发型师提供了图片，但是剪后效果与图片不一样，回家之后越想越气，越看越难看，竟然把猫打了更奇葩的是该女子找到理发店要求赔偿5000元给猫做手术对此理发店这样回应女子做新发型不满意 回家打伤猫向美发店索赔	未
新发现 4天3晚拔草比甲米还小众10倍的避世海岛， 含接送机， 春节不涨价	未
新发现BBCCNN相继报道，最新研究发现：雾霾会进入大脑	未
新发现丨与武大樱花齐名的银杏大道成这样了！	未
新发现！引江济淮工程挖到了这些宝贝	未
新发现！海淀山后有个火锅温泉，约吗	未
新变化！你关心的公务员加班补助要来了	未
新变化！公务员加班有补助了你有不	未
新变化！宿迁公积金贷款申请资料变了！	未
新变化！青岛这类人或多发一笔钱！征求意见早安青岛今日有雨	未
新司机们什么意思啊	未
新周末将来临，法官员呼吁理智的“黄背心”莫参与暴力抗议	未
新品面霜sample收到有烟酰胺的我先试试长毛不长	未
新商标法5月1日起实施 声音商标可申请	未
新喀里多尼亚附近发生7.5级地震 触发海啸预警	未
新国标实施之际，你的电动车还能上路吗	未
新圣医院PRP技术治骨科疾病！三针见奇效，关节无需置换（附：龙脊康脊柱专科专家坐诊）	未
新在留资格接收海外劳动力拟增设日语统一考试 海外一年举行6次	未
新圩江镇开展在建工程安全管理大检查	未
新地址新电话公布！来这些单位办事的唐山人千万别走错地儿！	未
“新地球村”的想象	未
//@新坟旧墓：凯迪仕智能锁广告为了提现只用一只手就能开锁，恶搞拆弹士兵多次被炸弹炸伤，变成各种其他形象，依然可以打开家门	未
新型传销，临猗人要小心！快看身边有没有人中招	未
新型传销，你的老婆可能也在做，提醒她们！	未
新型传销，告诉身边的朋友，小心警惕！	未
新型传，销！大学生被骗几率最高，快告诉身边的人！	未
新 型 传 销，大家要小心！快看身边有没有人中招	未
新型传销，大家要小心！快看身边有没有人中招	未
新型传销，大家要小心！快看身边有没有人在做	未
新型传销，无数人被害慘，快告诉身边的人！	未
新型传销，无数女人上当，快告诉身边的人！	未
新型传销，无数女人被坑，快告诉身边的人！	未
新型传销，无数女人被整惨	未
新型传销来了，所有人都要冷静，不然会倾家荡产！	未
新型传销来了，所有人都要冷静，不然会倾家荡产	未
新型传销，永州人要小心！快看身边有没有人中招?	未
新型传销，清远多名女人深陷其中，快告诉身边的人...	未
新型传销，道州人要小心！快看身边有没有人中招?	未
新型儿童毒品已然来袭，父母必须要警惕！请记住，有些食品是不可能在市面上流通的，它只可能是别人拿来给你尝的。警惕零食诱惑，千万不要追求时髦，而去尝试任何包装过度的毒品。珍爱生命，远离毒品via@检察日报	未
新型儿童毒品已然来袭，父母必须要警惕！请记住，有些食品是不可能在市面上流通的，它只可能是别人拿来给你尝的警惕零食诱惑，千万不要追求时髦，而去尝试任何包装过度的毒品珍爱生命，远离毒品via@检察日报	未
新型儿童毒品已然来袭，父母必须要警惕！请记住有些食品是不可能在市面上流通的它只可能是别人拿来给你尝的警惕零食诱惑千万不要追求时髦而去尝试任何包装过度的毒品珍爱生命，远离毒品新型儿童毒品已然来袭，父母必须要警惕！	未
新型儿童毒品已然来袭，父母必须要警惕！请记住，有些食品是不可能在市面上流通的，它只可能是别人拿来给你尝的，警惕零食诱惑，千万不要追求时髦，而去尝试任何包装过度的毒品，珍爱生命，远离毒品新型儿童毒品已然来袭，父母必须要警惕！ via检察日报	未
新型儿童毒品已然来袭，父母必须要警惕！请记住，有些食品是不可能在市面上流通的，它只可能是别人拿来给你尝的，警惕零食诱惑，千万不要追求时髦，而去尝试任何包装过度的毒品，珍爱生命，远离毒品。@检察日报 新型儿童毒品已然来袭，父母必须要警惕！	未
新型儿童毒品已然来袭，父母必须要警惕！请记住，有些食品是不可能在市面上流通的，它只可能是别人拿来给你尝的，警惕零食诱惑，千万不要追求时髦，而去尝试任何包装过度的毒品，珍爱生命，远离毒品。（爆漫画，police公众号） 新型儿童毒品已然来袭，父母必须要警惕！	未
新型学徒新在哪	未
新型抓捕工具，视频不全没看出来为啥被套 由@今日大热门 首发	未
新型毒品入门快23岁中国留学生吸毒致瘫看似糖果包装或者是邮票小画片，您可能想不到，它们其实是新型的毒品！海口海关近日公布一起走私毒品案，查获这类被称为邮票糖果的新型毒品3912.94克。该案抓获涉案人员6名。目前，法院已对部分涉案人员一审开庭，作出有罪判决。新型毒品入门快23岁中国留学生吸毒致瘫	未
新型水上交通工具。。。	未
新型烟花爆竹这个如何。。。 微博视频	未
新型研发机构这一年 “研”：打破垄断 技术领先	未
新型骗局，赶紧告诉家人，越快越好！	未
新垣结衣桥本环奈斋藤飞鸟	未
新城控股及关联方42.52亿“输血”17个地产项目	未
新城控股首次在京独立拿地  产品或以洋房为主	未
新埭民警巡逻路上捡到娃发了朋友圈孩子妈才来认领	未
新基金发行市场冰火两重天，头部效应凸显	未
新塍：江浙交界的千年古镇	未
新增7条道路，1180个停车泊位解锁行路难停车难！	未
新增人民币贷款一点二五万亿	未
新增四城！南这些地方开始实施单双号限行！（收藏）	未
新墨西哥州立图书馆的英文名称是 New Mexico State Library， 缩写是NMSL大家以后跟网友讨论问题可以多用用这个缩写，这是好心，是建议别人去多读点书，提高知识水平，是为了他们着想。	未
新外援加盟难救场 辽宁女篮不敌山东	未
新大洲：拟以2280万欧元转让所持意大利圣劳伦佐游艇公司股权	未
新大米“触电”新零售 阿里助农扩至一线城市(图)	未
新大路路口丢了包，70岁阿姨几天没睡着觉，监控拍到	未
新天地广场里，一商铺占用了消防通道！	未
新天地街（长浜路东新路）沿线计划停水微提醒因地铁3号线施工需要，@杭州水务 将于12月24日9时至12月24日16时对新天地街（长浜路东新路）沿街商铺及用户，包括浙江省工业品市场星城发展大厦等用户，实行计划停水7小时。	未
新天气冻哭！今冬首个棉裤预警发布！宁夏进入需棉裤护体地区！	未
新天皇继位后取消了原来规定的出行时新干线包车和飞机出行时包机。为了节约费用和普通乘客一起乘坐日本新闻	未
新头像	未
新头像如何呀小宝贝们（目前只打算接受赞美）	未
新套路！招聘西安大学生免费培训 获得资料后套取政府补贴近日，一些大学生兼职群流传着一个政府补贴项目兼职的招聘信息，该项目声称给大学生进行电子商务培训，参加该培训需要学生新办理手机卡银行卡(包括U盾)证件照片以及支付宝账号，只要交齐这些资料，学生就可以分批获得600元补贴。业内人士表示，大学生将这些交给陌生人，可能会出现被贷款的情况。详情：	未
新奥迪A7 80.8万起，落地90万，屌不屌，买不买	未
新奥集团王玉锁：用数字技术重构企业内部生产关系	未
新娘出嫁自己吹唢呐！拦都拦不住！	未
新娘和她的伴娘们	未
新娘婚礼上跳起舞了！还结不结婚了！	未
新娘：我有一句MMP一定要讲	未
新娘：找到算你赢 微博视频	未
新娘狠踹婚闹者！谁也不知道在婚礼上会发生什么 这婚看来是结不了了	未
新娘狠踹婚闹者谁也不知道在婚礼上会发生什么 这婚看来是结不了了	未
新娘狠踹婚闹者！谁也不知道在婚礼上会发生什么 这婚看来是结不了了每日笑话微博	未
新娘都是自带嚣张女王气焰的！	未
新婚7个月！这对现役idol CP竟带儿子参加节目  女方甚至才21岁	未
新婚之夜，这对夫妻家里来了不速之客....	未
新婚军嫂跨越千里寻夫，只因太想他了	未
新婚到乡下婆家，一进门泪如雨下	未
新婚尘肺病夫妻 她嫁给了自己的姐夫	未
新婚当天，新娘要一万开门费，营口小伙一怒之下竟然...	未
新婚男子公交上猥亵女乘客，没想到身旁站着辅警，当场被擒住	未
新婚的重庆民警刘彦追击歹徒时牺牲	未
新婚老婆坠崖死亡，三年后悬崖有笑声，老公探头看，瘫在地上	未
新婚老婆堕崖死亡，三年后悬崖有笑声，老公探头看瘫在地上呀！	未
新婚设酒宴几百桌，新郎家属没来，瞧新娘后，明白了	未
新媒体专线11月23日发稿目录	未
新媒体专线11月24日发稿目录	未
新媒体专线11月25日发稿目录	未
新媒体专线11月26日发稿目录	未
新媒体专线11月27日发稿目录	未
新媒体专线11月28日发稿目录	未
新媒体专线11月29日发稿目录	未
新媒体专线11月30日发稿目录	未
新媒体专线12月10日发稿目录	未
新媒体专线12月11日发稿目录	未
新媒体专线12月12日发稿目录	未
新媒体专线12月14日发稿目录	未
新媒体专线12月15日发稿目录	未
新媒体专线12月16日发稿目录	未
新媒体专线12月17日发稿目录	未
新媒体专线12月18日发稿目录	未
新媒体专线12月19日发稿目录	未
新媒体专线12月1日发稿目录	未
新媒体专线12月20日发稿目录	未
新媒体专线12月21日发稿目录	未
新媒体专线12月22日发稿目录	未
新媒体专线12月23日发稿目录	未
新媒体专线12月24日发稿目录	未
新媒体专线12月25日发稿目录	未
新媒体专线12月2日发稿目录	未
新媒体专线12月3日发稿目录	未
新媒体专线12月4日发稿目录	未
新媒体专线12月5日发稿目录	未
新媒体专线12月6日发稿目录	未
新媒体专线12月7日发稿目录	未
新媒体专线12月8日发稿目录	未
新媒体专线12月9日发稿目录	未
新媒体对青年约炮行为的影响，从身体嵌入到精神致幻	未
新媒体环境下广播转型 19新传专题10	未
新媒体环境下，新闻价值发生了哪些变迁	未
新媒体环境下电视媒体的困境与机遇  19新传专题9	未
新媒体究竟新在哪	未
新媒体里取标题是挺很重要的技能。//@主观独立第三方: 贩卖焦虑也算标题党的一种吧	未
新媒汇一秒读懂检察院司法警察日常都干些啥	未
新媒汇取保候审那些事儿	未
新媒：美国又“投身”太平洋建设 意在抗衡中国影响力	未
新宁2018年省级财政扶贫资金用于这49个村修路！看看有你们那吗	未
新宁2名小学生捡到内含银行卡现金若干的钱包，他们是这样做的...	未
新宁一橙农给有关部门写了一封公开信：请严厉打击黑心暴力快递	未
新宁人快来看，农村妇女剁砧板骂架的视频火了！	未
新宁人有这9种行为以后会被限制坐飞机火车看看有你吗	未
新宁人注意，警方提示！收到这条短信，千万别点进去！	未
新宁人注意，这里可以找到月薪一万的工作，很多人都不知道	未
新宁人看看：女子从11楼跳下，竟看到10楼恩爱夫妻正在	未
新宁全县有17名外流贩毒人员，家庭都比较贫困！	未
新宁公交车千呼万唤等不来，新惠公司是这样解释的！	未
新宁县一22岁女子卖淫，在邵阳被抓现行，快看你认识不	未
新宁县公交车千呼万唤等不来，官方这么说！	未
新宁县新惠公交有限公司回应新宁县公交车千呼万唤等不来	未
新宁县砖厂整治！全县已拆除砖厂40家，将设置新型环保砖厂19家	未
新宁各村40岁以上的， 2019年就要面对现实了！	未
新宁土话：美女卖废品，反亏几百块！	未
新宁广场舞大妈占领马路：车不敢撞我们！您怎么看	未
新宁快递员和美女之间反复纠缠，原来是在	未
新宁惊现2.7斤脐橙王，比柚子还大！秒杀前年35万元的天价脐橙！	未
新宁惊现脐橙王，比柚子还大！秒杀前年35万元的天价脐橙！	未
新宁的第一场雪要来了！零下1！连续两天雨夹雪，更可怕的是......	未
新宁纪监委将对财政局教科局交通局总工会残联妇联进行巡察	未
新宁脐橙又火了！很多人都在传	未
新宁至永州高速公路已进入实质化运作阶段，永新不再是梦！	未
新宁这条道路到处坑坑洼洼，村民出行极为不便！	未
新安人生十大谎话全曝光，第八条你绝对中了！	未
新安孟津偃师来了新书记！	未
新安用手机付钱的注意了，现在看还不晚，对你很重要！	未
新安顺廊桥夜景。古安顺廊桥的历史最早可追溯到元朝，在近现代被毁于洪水。这座明清风格的三孔仿古廊桥重建于2002年。超话大神评选四川旅行摄影拍照gilsfotos	未
新官上任 这个“不懂球的胖子”有啥新打算？	未
新官上任，这个“不懂球的胖子”有啥新打算？	未
新客运站发班线路调整看这里，不要搭错车了澧县到津市公交2.5元/次	未
新宪法承认私营经济和外资，古巴版“改革开放”起航	未
新密人快看！2019年放假通知！	未
新密找工作的看过来！郑州市公安局公开招聘100名特勤	未
新密招聘  求职出租  转让二手  本地服务 等便民信息发布	未
新密热力公司供暖通知！请转给家人！	未
新密部分道路停车位取消实行非机动车分道通行！速扩散！	未
新局长到任 国家能源局现任领导班子“一正四副”(图)	未
新居隐医斋	未
新州镇开展娱乐场所涉毒专项宣传检查和中小学校毒品预防知识测试	未
新市区这个项目今天正式开始发放VIP卡	未
新市街改造接近尾声，小编却被一堆井盖圈粉，瞧瞧咋回事	未
新帅确认南安普顿官方宣布，任命51岁的奥地利人，前莱比锡RB主帅拉尔夫-哈森许特尔，为球队的新任主帅，合同期为两年半。	未
​新希望六和拟以最高12亿元回购社会公众股	未
新希望：明年和后年养殖目标有所下调	未
新常态。	未
【新常态 光明论】破解东北转型之困：“有机会不愁人不回来”	未
新干线一班车发生自燃 幸无人员伤亡	未
新年不穿这件去讨红包说不过去了！！	未
新年临近 江苏盱眙冬捕忙	未
新年倒数24天：有没有那么一个人，一直容忍你的小任性，比如，冬天里也愿意随时陪你去吃冰淇淋转发@TA，今天一起第二个半价吧麦当劳陪你倒数2018	未
新年多地迎雾霾 中央气象台今晨发布橙色预警	未
新年将至，中国人带什么俄罗斯特产回家过年？	未
新年将至！点击了解48种常见电信诈骗手法	未
新年愿望：希望明天一觉醒来申诉通过了 我就不用杭州了 我真的好累好痛好晕	未
新年请记住这些民生新规:拐卖婴幼儿最高死刑	未
新年货运动 2018年你最后悔的一件事是什么	未
新店3个月从0到第五层级，这位50后湖南女掌柜只做了这一件事	未
新店开业丨上车的乘客请注意，下一站湖滨东路站	未
新店派出所联合交警中队消防大队送法进校园	未
新康众商宝国：行业已经发生了质变，越是变越有机会	未
新建70.51公里，国家发改委又批复了三个轨道交通项目	未
新建一二级公路不得收费记者从交通部获悉，12月20日起，《收费公路管理条例（修订草案）》公开征求意见，为期一个月。《收费公路管理条例（修订草案）》提高收费公路设置门槛，规定今后新建收费公路必须达到高速公路技术标准，新建一二级公路和独立桥梁隧道不得收费，车辆通行费收入无法满 ...全文	未
新建京雄城际铁路又开三标：中铁十二局18亿中铁建工17亿中咨工程建设监理	未
新建区撞交警的司机！你跑不掉的！	未
新建医院项目窗帘隔帘和导轨如何设计及采购安装  医家之言	未
新建合资轿车、纯电动车项目将调整为备案管理	未
