新公司这边周围有人天天放炮（仗着你偏僻没人管嘛！）搞得我总觉得要过年放假了	未
新公布的《干部人事档案工作条例》，和27年前有哪些区别	未
新关注关于公开征集马海龙涉黑恶犯罪团伙违法犯罪线索敦促涉案人员投案自首的通告	未
新关注又有13批次食品产品不合格！银川这两家拉面馆你去过吗	未
新关注定武高速妖风作怪，小客车被风吹翻在快车道	未
新关注当心被罚！银川又增3条限时公交专用道，12月1日启用	未
新关注紧急扩散！银川两名12岁男孩失联，请大家帮忙寻找...	未
新关注视频曝光 ！男子掐银川公交司机脖子，试图强行打开公交车门抢夺方向盘	未
新关注陕西旅游集团入驻后，中卫沙坡头水镇要大变样	未
新兴一大学生刚毕业就出来稳工，多次被拒绝后，他选择...	未
新兴公安缉毒现场曝光，娱乐场所网吧出租屋为重点部位！	未
新兴平一分钟，兴平在发生着什么	未
新兴平全市召开秋冬季大气污染防治攻坚行动 第一次工作调度会	未
新兴平我市为首个创业担保贷款信用村授牌	未
新兴平我市召开大棚房问题专项清理整治工作领导小组会议	未
新兴平贺建权检查安全生产工作	未
新兴平贺建权检查督导中央环保督察交办问题整改工作	未
新兴某中学门口一精神病男子拿着菜刀游荡，民警一招制服！	未
新兴警方100多人突击检查这两家酒吧！竟然发现......	未
新兴这两间新医院计划2019年建成，看看在哪里	未
新兴这个车主真的是太会停车了，霸道停在路中间！	未
新兴这些地方被曝光深夜噪音扰民，周边居民苦不堪言！	未
新兴铸管：发行不超20亿元绿色债券获发改委核准批复	未
新兴镇黄山屯村东头的小河变成乳白色，气味难闻	未
新兴附近发生一起命案！疑犯在逃！见到这个人马上报警！	未
新兵丨实弹射击？行军拉练？下连可没那么容易…	未
@新兵爸妈：这个彪悍的儿女您还认识吗	未
新兵结业考核，来了！（附大量动图）	未
新兵，这有一份属于你们的日历	未
新兵野营大拉练：负重徒步行军90多公里12月15日，武警福建省总队新兵团在不同片区开展新兵野营大拉练。2000余名新兵将在三天的时间里负重徒步行军90多公里，期间，他们不仅要经受身体意志的挑战，还要经历复杂地形和多变天候的考验。（唐震宇 刘欢 胡鑫 叶虎平 谢华龙）	未
新兵野营大拉练：负重徒步行军90多公里12月15日，武警福建省总队新兵团在不同片区开展新兵野营大拉练2000余名新兵将在三天的时间里负重徒步行军90多公里，期间，他们不仅要经受身体意志的挑战，还要经历复杂地形和多变天候的考验（唐震宇 刘欢 胡鑫 叶虎平 谢华龙）	未
新兵野营拉练这三天与你想的不一样|荔枝军事	未
新军屯镇开展生态环境深度整治第七次集中助拆行动	未
新农合交220元的，快看看	未
新农合从10元涨到220元，这背后......	未
新农合从每人20元涨到现在的220元，临武乡亲你怎么看	未
新农合咋又涨价，真相来啦	未
新农合和社保能同时报销吗两者有啥区别别再傻傻只知道交钱了	未
新农合将有大动作：2019年五类人免费看病，四类人看病不报销	未
新农合政策调整，4种情况不报销，一定要记牢！	未
新农合林州交了220元新农合的快看！真相来啦！	未
新农合要每人交220元，不交可以吗	未
新农村建设 每家每户门口都得画上停车位 一姥爷给外孙也画上了停车位	未
新农村建设者 微博视频	未
新农股份在深交所上市	未
新《准则》《条例》 “新”在哪里？	未
新出炉的全球男女平等报告2018版来了！	未
新出路	未
新刊  改革开放再出发	未
新列车运行图下月5日实施 青盐铁路初期开行6对旅客列车	未
新列车运行图明年1月5日实行 广铁增开动车组旅客列车31.5对	未
新券！汉世刘家 垃圾袋5卷100只，券后4.9	未
//@新剧安利榜:是我本人//@柠檬和狸:是本人了，别人安利的我都不看	未
新剧《男朋友》首播 朴宝剑宋慧乔初次相偶	未
新办一张流量卡，你们觉得这个价格开不开卡在线等！	未
新加坡4天自由行 完全指南花园城市，当然还有花园城市的玩法总结了我去过的 没去过的 吃过的 没吃过的住过的 没住过的 所有的攻略！总有你喜欢的P1：简介P2-4：玩什么P6-7: 吃什么P8-9: 住哪里作者:@叁郎君在路上	未
新加坡一个月400人食物中毒！幼儿园小孩也未能幸免！！！	未
新加坡为什么没有人贩子	未
新加坡史上最严禁烟令实锤，明年起乌节路全面禁烟	未
新加坡同志领养代孕儿子，获高庭批准新加坡高庭三位法官今天中午做出指标性的裁决，允许当地男医生James领养他和同性伴侣通过代孕生育的儿子。据《联合晚报》报道，46岁的James和伴侣从2003开始一起生活，两人决定要孩子之后前往美国，用男医生的精子和匿名女子捐赠的卵子受孕，再由代孕母亲生下儿子，目前这名男孩已经5岁。James想把孩子带回新加坡，但其父亲身份未获承认，相关申请被驳回。他上诉至高庭，最终获准以领养的方式，在法律层面上成为孩子的父亲。三位法官在判决书中指出，各方证据显示，允许James取	未
新加坡大使发言，美国彻底惊讶了！	未
新加坡威武级护卫舰。2000年，新加坡海军与法国签订购买6艘威武级护卫舰的合同，首艘由法建造，2005年交付。其余5艘以技术转移方式由新加坡裕廊船厂建造，单舰造价为1.67亿美元。舰名：威武/刚毅/坚定/不屈/坚强/无畏（舷号68-73）。武器配备包括1座奥托梅莱拉76毫米，32单元紫苑15防空导弹垂直发射系统，2座四联鱼叉反舰导弹发射装置，2座三联鱼雷发射装置（配备Eurotorp公司的A233S鱼雷）。 该级舰舰长110米，宽16米，满载排水量3200吨，比法国的拉斐特要小一点。但是该	未
新加坡将禁止船舶使用open-loop脱硫设备！	未
新加坡法庭首度承认同性恋者领养权 彻底除罪化阻力仍大新加坡高院裁定一位男同性恋者能够合法领养其通过代孕所生的孩子。在审理中，高院主要关注的是领养人能否保障这名男童的权益准许领养是否违反新加坡的公共政策，以及领养人向男童生母所支付的费用来源是否合法等问题 网页链接	未
新加坡“男同”代孕养子获准，将开启同性恋平权讨论	未
新加坡的这栋公寓可以被命名为星期二下午	未
新加坡联合早报报道，传某性侵知名企业家，欲以5000万美金与受害人和解。前几天听到这数我还以为是瞎编的呢，话说这价格不便宜啊，几亿人民币就这么没了。	未
@新加坡航空及胜安航空 日前宣布与@scoot酷航 进行航线业务调整，三家航司将互换部分航线。航线调整预计在2019年4月至2020年下半年间完成。涉及中国的航线包括：胜安航空长沙福州昆明和武汉航线自2019年5月至6月由酷航运营酷航深圳航线自2019年6月起由胜安航空运营。此次调整计划尚待监管部门审批。航空那些事儿 （图一来自路透社）	未
新加坡财长王瑞杰或成李显龙接班人	未
新加坡防长要求香港尽快归还装甲车 中方回应	未
新动作！俄将部署这支部队 控制乌克兰大部分领土上空	未
新势力烧钱大战未了 奇点汽车疑似掉队新造车势力的烧钱大战依然在如火如荼进行，然而已有车企疑似在这场战斗中掉队有传言称，奇点汽车陷入资金紧张困境有内部员工对外宣称，奇点汽车从10月份开始，暂缓发放薪酬 奇点汽车会否成第一个掉队者新势力烧钱大战未了  奇点汽车疑似掉队	未
新化一中学为家乡领导下半旗致哀，谁给的权力	未
新化一白发苍苍的老人欲跳河！他到底有什么想不开的	未
新化：不愿出殡队伍从门前而过，直躺墓穴不让下葬！	未
新化公安：大发神威，活捉人，关了个！	未
新化县长来到荣华乡！听取汇报后指出......	未
新化夜间：突发大火，危急之中	未
新化娄怀高速附近惊现洞居野人，自称来自西藏	未
新化惊现女道长打醮！	未
新化村民发明捕鼠器，抓活的，太厉害了！	未
新化：母牛殉情水中淹死！	未
新化洞居野人，来自西藏真相是	未
新化现扒灰老子你认识不	未
新化男子：花店偷手机，监控曝光！急寻此人线索！	未
新化突发2起车祸！摩托撞碎，小车冲下路基...	未
新化突发车祸：翻下公路30多米！老人	未
新化街头：两车斗气，司机对骂，互不相让！	未
新化:这个村出殡，墓穴里居然惊现活人！现场失控	未
新化这个警察娶个老婆竟火了！省市县镇村都在传！	未
新化这次玩大了，居然上央视	未
新化金凤3村民捕野猪，2人刑拘，1人在逃	未
新化：高龄老人强占门面	未
新北三车相撞 消防成功化解化学品泄漏疑虑(图)	未
新北洋拟发可转债募资9.37亿元 8.37亿元砸向智能零售终端	未
新北洋 拟发行不超9.37亿元可转债	未
新北“淡海轻轨”今起试营 朱立伦率宾客搭乘	未
新区严打超限超载 消灭百吨王滨海新区 22日晚间，29辆大型货车从北塘出发开往东丽方向，而这其中的每一辆车原本核载重量为30多吨，而实际载重量都达到了百吨以上。这29辆百吨王当场被交警查扣，随后，交管治超路政运政及公安等多部门对这29辆车进行联合执法，这也是近期新区查处的规模最大的货车超载。目前，交管部门采取强制措施，将车辆进行暂扣。针对驾驶超载车辆的司机，交警将对其进行记6分，处以2000元罚款的处理。	未
@新区人，出行注意！3条公交线路临时调流...	未
@新区人，这8种初犯交通违法不再处罚！最新测速规范了解下	未
新区已施划免费蓝色停车位4785个（附道路名单）  停车遇到这些情况可报警	未
新区道路正规停车场点位和收费标准公布滨海新区 从新区停车办获悉，所有在道路上设置的停车场都在停车办有记录备案，目前道路停车场正式招标的停车公司只有公众一家，市民可通过收费员是否穿着公众公司制服或者工作证来判断。目前道路停车场收费标准是记次，标准是十元钱一次。	未
新医疗时代即将到来：辽宁人网上看病可用医保支付	未
新医读片男 56岁 发现尿微量白蛋白异常1月余081	未
新千歲等日本多個機場週邊將新設監控攝像頭	未
新华三杯：左手开放生态 右手社会责任	未
新华传媒：公司目前未有改变主营业务的计划和安排	未
新华北街社区联合晋中血站开展义务献血活动	未
新华国际时评：“洞察”号岂止是洞察火星	未
新华国际时评：自欺欺人的又一闹剧	未
新华国际时评 | 英国“脱欧”：无法欢庆的“协议分手”	未
新华微评：别让“炸街族”搅了城市安宁	未
新华微评：别让炸街族搅了城市安宁夜深人静，你是否因刺耳的引擎轰鸣声而难以入睡深夜飙车的炸街族，不仅严重扰民，也给交通安全带来不小隐患，但因查处和取证难度较大，一直是城市治理的难点。日前，上海加强机动车噪声污染治理，首位炸街族因违法行为受到惩处，市民们拍手称快。群众痛点在哪里，管理的着力点就要在哪里。面对任性妄为的炸街族，监管力量不能沉默。只有架起法治的高压线，用好电子警察声呐定位等黑科技，才能提升本领消除盲区，还城市之夜一片安宁。	未
新华微评：别让炸街族搅了城市安宁夜深人静，你是否因刺耳的引擎轰鸣声而难以入睡深夜飙车的炸街族，不仅严重扰民，也给交通安全带来不小隐患，但因查处和取证难度较大，一直是城市治理的难点日前，上海加强机动车噪声污染治理，首位炸街族因违法行为受到惩处，市民们拍手称快群 ...全文	未
新华微评：基因编辑岂能“任性”	未
新华微评：“弱势”不是免责的“挡箭牌”	未
新华微评：扎紧保护儿童的制度“篱笆”	未
新华微评：“星光”难掩毒品的黑	未
新华微评：网游有“德”，方能致远	未
新华微评：网游有德，方能致远近日成立的网络游戏道德委员会，对20款具有道德风险的网络游戏作出责成整改或不予批准的决定。网游虚拟空间绝非道德真空地带，对那些以低俗为乐粗俗为美暴力为趣的毁三观网游，设置安检及时叫停，既是对社会负责，也是对行业发展负责。网络不是法外之地，网游企业更不能眼里只有利益，什么时候都不能忘了社会责任。法治与德治并举，自律与他律相济，网游行业才能避免跑偏，才能走稳走好。	未
新华微评：网游有德，方能致远近日成立的网络游戏道德委员会，对20款具有道德风险的网络游戏作出责成整改或不予批准的决定网游虚拟空间绝非道德真空地带，对那些以低俗为乐粗俗为美暴力为趣的毁三观网游，设置安检及时叫停，既是对社会负责，也是对行业发展负责网络不是法外 ...全文	未
新华微评：网络不是法外之地，网游企业更不能眼里只有利益	未
新华日报头版关注我县两权抵押，让沉睡资源活起来	未
新华时论│多些“一瓶药两条命”的自觉	未
新华时评：体检市场需要扬优惩劣动真格	未
新华时评：体检市场需要扬优惩劣动真格 _ 东方财富网新华社长沙12月17日电题：体检市场需要扬优惩劣动真格湖南知名体检机构美年大健康长期雇佣无资质人员从事体检诊断工作，导致漏诊错诊发生。今年6月被曝光后，卫生主管部门调查确证其存在违规行... 新华时评：体检市场需要扬优惩劣动真格	未
新华时评：剔除阻碍体检行业健康发展的“烂白菜”	未
新华时评：小康不小康 农厕是一桩	未
新华时评：技术应用当在伦理红线前止步26日，来自深圳的研究人员贺建奎宣布，一对基因编辑婴儿于11月在中国健康诞生消息一经公布，旋即引起质疑这项实验涉及的一家医院的当事人对外表示，其实验的医学伦理审查申请有变造嫌疑，医院对此项实验不知情深圳市医学伦理专家委员会已 ...全文	未
新华时评：把稳就业政策压紧压实	未
新华时评：朋友圈海选学术论文？不严肃！	未
新华时评：朋友圈海选学术论文，公正性与严肃性何在？	未
新华时评：环保“回头看”要盯紧“表面光”	未
新华时评：环保回头看要盯紧表面光尽管中央三令五申，并处理了一批极端案例，但在生态环境部近期公布的中央生态环境保护督察回头看典型案例中，假整改表面整改现象仍然存在。回头看是为了更好地向前走。生态环境的好转，关键不在于自上而下发现问题，而是自下而上切实解决问题。污染防治，是必须打赢的三大攻坚战之一，贵在少一些套路，多一些实招贵在久久为功，抓实抓细抓深。新华时评：环保回头看要盯紧表面光	未
新华时评：知艾防艾，别放大对艾滋病的恐惧	未
新华时评：破解民企融资难从根本上说要靠改革	未
新华村有了新集市	未
新华每日电讯：心中有敬畏，环保整改不必等曝光今年以来，新华社陆续曝光了多起破坏生态环境事件，引起较大社会反响。年底，记者专门回访上述事发地，发现这些问题已基本整改，相关责任人也被处理。环保问题经媒体曝光后，相关地方大力整改严肃追责，违法违规行为得到惩治，值得拍手称快。但仔细想想也有缺憾，这些问题中有的早已被中央环保督察组点名批评，有的被群众长期举报反映，为何是媒体报道踢出了临门一脚如果没有媒体监督报道持续跟进，那些对中央环保督察组发现的问题搞虚假整改的地方，是不是就蒙混过关了网页链接	未
《新华每日电讯》：昔日贫瘠山区变身著名旅游新城	未
新华的群众看这里，谁是你的派出所所长谁是你的社区民警都在这里	未
新华社：上天入地的电梯医生！	未
新华社：个人报酬与工作室收入加以区分，维护影视企业及从业人员合法权益	未
新华社：个体命运成长不可能脱离祖国纪录片《我们一起走过致敬改革开放40周年》引发社会关注（来源：中央广播电视总台央视财经）网页链接	未
新华社：中国足协缘何“相中”朴泰夏、金昶伯？	未
新华社五问“毒跑道”：施工，还是施毒	未
新华社全文刊发：改革开放四十年大事记	未
新华社刊发：改革开放四十年大事记	未
新华社刊文：共享单车为何由热点变雷区，行业将拐向何方	未
新华社刚才发的通电中，稳外贸稳外资，以前出现过吗	未
新华社:南京大屠杀为何与我们有关	未
新华社又大篇幅报道中山！这次是因为什么事	未
新华社受权全文发布《关于新形势下党内政治生活的若干准则》《中国共产党党内监督条例》	未
新华社：史上最严停牌新规来了，向任性停牌说不。	未
新华社向全球报道，天长八分之一的人都在干这事！	未
[新华社]增值税改革措施为实体经济减税	未
新华社客户端@新华社中国网事 和@动图宇宙 发起的全民拍动图为改革开放打call 活动，有网友拿自己家老照片做了打call表情，引得其他网友纷纷效仿，这届网友真是厉害了，感觉都是一家子表情包 呀，放上几张给大家看看，是不是回忆感满满@动图宇宙 官微有参与方式，只能帮到你这里了	未
新华社：工信部要求三大运营商，于2019年1月1日起，提供全国手机号「异地」销户服务。很多在外地读书工作的朋友，回家后想把异地号码注销，还得回当地才能注销。现在不用这么麻烦，可以异地注销号码。这功能方便吧	未
新华社快讯：	未
新华社快讯：7日在汉堡召开的德国基督教民主联盟（基民盟）全国代表大会上，基民盟秘书长安妮格雷特·克兰普-卡伦鲍尔被选举为新一届党主席。	未
新华社快讯：中国地震台网正式测定：12月11日10时26分，在南桑威奇群岛地区(南纬58.35度，西经26.37度)发生7.0级地震，震源深度150公里。	未
新华社快讯：中国地震台网正式测定：12月16日12时46分在四川宜宾市兴文县（北纬28.24度，东经104.95度）发生5.7级地震，震源深度12千米。	未
新华社快讯：中国地震台网正式测定：12月21日1时01分，在科曼多尔群岛地区(北纬54.95度，东经164.79度)发生7.4级地震，震源深度20公里。	未
新华社快讯：中国地震台网正式测定：12月24日3时32分在西藏日喀则市谢通门县（北纬30.32度，东经87.64度）发生5.8级地震，震源深度8千米。	未
新华社快讯：中国“藏医药浴法”２８日被正式列入联合国教科文组织人类非物质文化遗产代表作名录。	未
新华社快讯：伦敦股市《金融时报》１００种股票平均价格指数２８日报收于７００４．５２点，比前一交易日下跌１２．３３点，跌幅为０．１８％。	未
新华社快讯：伦敦股市《金融时报》１００种股票平均价格指数４日报收于７０２２．７６点，比前一交易日下跌３９．６５点，跌幅为０．５６％。	未
新华社快讯：伦敦股市《金融时报》１００种股票平均价格指数２７日报收７０１６．８５点，比前一交易日下跌１９．１５点，跌幅为０．２７％。	未
新华社快讯：伦敦股市《金融时报》１００种股票平均价格指数２３日报收６９５２．８６点，比前一交易日下跌７．４６点，跌幅为０．１１％。	未
新华社快讯：伦敦股市《金融时报》１００种股票平均价格指数５日报收６９２１．８４点，比前一交易日下跌１００．９２点，跌幅为１．４４％。	未
新华社快讯：伦敦股市《金融时报》１００种股票平均价格指数１１月３０日报收６９８０．２４点，比前一交易日下跌５８．７１点，跌幅为０．８３％。	未
新华社快讯：印度尼西亚抗灾署23日说，22日晚在该国西部巽他海峡发生的海啸已造成43人死亡。	未
新华社快讯：印度尼西亚抗灾署说，印尼西部巽他海峡22日晚发生的海啸已经造成至少20人死亡、165人受伤。	未
新华社快讯：国家主席习近平与美国总统特朗普当地时间1日在布宜诺斯艾利斯举行会晤。	未
新华社快讯：巴黎股市ＣＡＣ４０股指１１月３０日报收５００３．９２点，较前一交易日下跌２．３３点，跌幅为０．０５％。	未
新华社快讯：德国法兰克福股市DAX指数18日下跌31.31点，跌幅0．29%，报收于10740．89点。	未
新华社快讯：德国法兰克福股市DAX指数6日下跌389.26点，跌幅3．48％，报收于10810．98点。	未
新华社快讯：据中国地震台网中心网站消息，北京时间12月1日1时29分，美国阿拉斯加发生7.2级地震，震中位于北纬61.35度、西经150.06度，震源深度40.0公里。	未
新华社快讯：据中国地震台网中心网站消息，北京时间12月1日1时29分，美国阿拉斯加发生7.2级地震，震中位于北纬61.35度西经150.06度，震源深度40.0公里	未
新华社快讯： 据中国地震台网测定：12月20日19时08分，在新疆克孜勒苏州乌恰县附近发生5.3级左右地震。	未
新华社快讯：据叙利亚媒体25日报道，叙防空系统当天晚间在首都大马士革以西拦截并击落多枚来袭导弹。	未
新华社快讯：据外电报道，巴基斯坦西北部一露天市场２３日发生爆炸，造成人员伤亡。	未
新华社快讯：据日本广播协会报道，驻日美军岩国基地所属的一架FA18战斗机与一架KC130空中加油机6日凌晨在空中相撞，两架飞机坠毁在高知县附近太平洋上。	未
新华社快讯：据日本广播协会报道，驻日美军岩国基地所属的一架FA18战斗机与一架KC130空中加油机6日凌晨在空中相撞，两架飞机坠毁在高知县附近太平洋上	未
新华社快讯：据美国地质调查局地震信息网消息，伊朗萨尔波勒扎哈卜西南２０公里处北京时间２６日０时３７分发生６．３级地震。	未
新华社快讯：据美国地质调查局地震信息网消息，汤加努库附近海域北京时间12月24日7时8分发生6.5级地震。	未
新华社快讯：据美国地质调查局地震信息网消息，美国阿拉斯加州安克雷奇以北１１公里处北京时间１２月１日１时２９分发生６．７级地震。	未
新华社快讯：比利时首相米歇尔18日说，比利时政府将集体辞职。	未
新华社快讯：纽约股市三大股指11日涨跌互现，其中，道指跌0.22%，标普指数跌0.04%，纳斯达克指数涨0.16%。	未
新华社快讯：纽约股市三大股指13日涨跌不一，道指涨0.29%，标普指数跌0.02%，纳斯达克指数跌0.39%。	未
新华社快讯：纽约股市三大股指6日涨跌互现，其中，道指跌0.32%，标普指数跌0.15%，纳斯达克指数涨0.42%。	未
新华社快讯：美国前总统乔治·赫伯特·沃克·布什办公室11月30日晚发表声明证实他于美国中部时间当晚10时许去世，享年94岁。	未
新华社快讯：美国总统特朗普20日说，美国防部长马蒂斯将于明年2月底去职。	未
新华社快讯：美国总统特朗普8日说，白宫办公厅主任约翰·凯利将于今年年底去职。	未
新华社快讯：美国联邦储备委员会19日宣布上调联邦基金利率25个基点，这是美联储今年以来第四次加息。	未
新华社快讯：英国首相特雷莎·梅12日晚在保守党内部的不信任投票中过关，留任该党领袖及英国首相。	未
新华社快讯 载有俄罗斯美国和加拿大宇航员的俄罗斯联盟MS-11飞船北京时间3日19时33分由1枚联盟-FG火箭发射升空	未
新华社快讯：载有俄罗斯、美国和加拿大宇航员的俄罗斯“联盟ＭＳ－１１”飞船北京时间３日１９时３３分由１枚“联盟－ＦＧ”火箭发射升空。	未
新华社成都11月27日电（记者张超群）记者27日从四川乐山市公安局沙湾区分局获悉，一辆轿车27日10时许行至乐山市沙湾区嘉农镇王场村苏沙路16公里处，冲上人行道，撞向路旁的公交站台，造成7人死亡，4人受伤据了解，事发时该公交站台上有部分市民在候车，事故造成5人当场死亡，2人送往医院后不治 ...全文	未
新华社推出“请回答2018”线上、线下活动	未
新华社揭秘相互保：0元加入 出险后每单最多分摊1角钱	未
