汕头这些商业综合体大厦将开放临时停车位！有苏宁广场星湖城等	未
汕头醉酒撒泼女事件又上电视台，这次是....	未
汕头-香港4小时交通圈不是梦！其实百年前汕头到澄海就有轻轨	未
汕尾24岁女子离家后走失，请帮忙转发留意！	未
汕尾335省道新田段发生车祸致二死	未
汕尾一女子一早出门后至今未归，请帮忙扩散留意！	未
汕尾一学生开着摩托车直撞垃圾车，当时想什么	未
汕尾一小车与泥头车较量，差点成粉碎	未
汕尾保利附近路段，突发意外，小车逃过一劫...	未
汕尾保利附近这辆泥土车翻得太平地了！	未
汕尾全城急寻！2盒救命药丢失了	未
汕尾地震局对于今日地震回应....	未
汕尾学生爆猛料！食堂饭菜竟吃出虫子和玻璃块...	未
汕尾市区公交亭前种树，市民意见不一！	未
汕尾市城管执法局加大力度整治泥头车违法行为	未
汕尾市民两盒救命药丢失，全城急寻！希望大家帮忙扩散！	未
汕尾市民注意：停水通知...	未
汕尾某地现蒙面男夜闯村舍偷盗	未
汕尾某海域，发现它的尸体...	未
汕尾某镇出动200多人搜寻10.23命案凶手嫌疑人	未
汕尾海丰：红蚂蚁占领小村子...	未
汕尾渔民捕获百斤大海龟，最终...	未
汕尾渔民捕获这个大家伙后...	未
汕尾电视台：红蚂蚁疫情肆虐村庄  齐力灭杀！	未
汕尾神车手，把车开成这样...	未
汕尾红海湾白沙湖海域再现它的尸体	未
汕尾警方在这个祠堂抓获3人！	未
汕尾贫困村山鸡变凤凰	未
汕尾这个村上电视了...	未
汕尾高中生充错话费要求对方返回！结果令人意外...	未
汗水换物资！黄山挑山工一年迈1000万级台阶穿坏6双鞋 12 月9 日，黄山的最低气温达零下8 度，积雪最深处有数十厘米。崎岖的山路上，肩挑一百多斤货物的挑山工踩着积雪，一步一步，向着山上走去。这位挑山工的画面被广为传播，很多人震撼又动容。他叫方银善，满头白发，但实际上只有53岁，在黄山当挑山工已有三十多年。据悉，黄山风景区目前共有挑山工140 名。一个挑山工一年要挑300 多担货物上山，平均每天走16 里山路，迈3 万多级台阶。汗水换物资！黄山挑山工一年迈1000万级台阶穿坏6双鞋	未
汝城开展中小学食堂问题专项整治督查	未
汝州一支书为村里建了一座银行，就在这儿！	未
汝州一省道清晨现男尸 司机撞人下车查看后逃逸4日7时许，汝州市公安交警大队接警：在纸坊镇东赵落村S238省道发现一男性尸体，疑似交通事故。民警细致勘查后确认为交通事故。从视频监控发现一个令人心寒的细节：肇事车辆撞人后，司机曾下车查看，停留片刻后选择驾车逃逸！详情汝州一省道清晨现男尸 司机撞人下车查看后逃逸	未
汝州人，家中暖气片不热咋办就找他们，有办法！	未
@汝州人！年底了，如果有人在街头求你帮这个忙一定要当心！	未
@汝州人   是谁锯断了限高杆	未
@汝州人  随手拍交通违法行为可以领取红包，你参与了吗	未
汝州市城市管理局全面排查全市机关事业单位公务灶油烟治理情况	未
汝州市机动车限行是真是假权威发布来了！	未
汝州平顶山郑州都限行了！郏县还会远吗	未
汝州微视有图有视频：汝州醉驾男致3车相撞4人受伤！	未
汝州正创卫，岂料散装物料运输车顶风上路，结果肯定是...	未
汝州环卫处召开创文工作专题会议	未
汝州真有一个小区是花园，不信你来看！	未
汝州警方抓获贩毒嫌疑人18人，缉毒近9公斤，成功打掉特大贩毒网络！	未
汝州这些路段的安全隐患，一定要看！	未
汝州钟楼街道兰自军说：我过去是贫困户，现在年入5万多元！	未
汝美城管篇81汝州城管热心帮助迷路小孩找到妈妈	未
江一燕发动冯小刚、赵薇捐幼儿园 想拍支教电影	未
江丙坤「主动脉剥离」装叶克膜彻夜手术6小时结束前海基会董事长江丙坤8日晚间与友人在晶华酒店聚餐，不料席间突然意识不清晕倒，被紧急送往台北马偕医院装上叶克膜急救。前海基会副董事长高孔廉9日中午受访表示，从昨天晚上到今天凌晨将近6小时的手术已经结束了，目前都还平安，在加护病房观察中。ETtoday新闻云 报导：网页链接 (john)	未
江丙坤主动脉剥离装叶克膜彻夜手术6小时结束前海基会董事长江丙坤8日晚间与友人在晶华酒店聚餐，不料席间突然意识不清晕倒，被紧急送往台北马偕医院装上叶克膜急救前海基会副董事长高孔廉9日中午受访表示，从昨天晚上到今天凌晨将近6小时的手术已经结束了，目前都还平安，在加护病房观察中 ...全文	未
江丙坤去世 为两岸和平奔波半生的老人终于可以休息了	未
江丙坤在台北逝世	未
江丙坤曾接受凤凰专访：我常写信给大陆领导	未
江丙坤聚餐昏迷友人证实：医院处理中，有进一步消息再跟大家报告现年85岁的前海基会董事长江丙坤，他8日在晶华酒店聚餐传出昏迷，被送往马偕医院CPR急救对此，前海基会副秘书长三三会副秘书高文诚经简讯证实医院处理中，谢谢关心，有进一步消息再跟大家报告！ ETtoday新闻云 报导： ...全文	未
江丙坤聚餐昏迷友人证实：医院处理中，有进一步消息再跟大家报告现年85岁的前海基会董事长江丙坤，他8日在晶华酒店聚餐传出昏迷，被送往马偕医院CPR急救对此，前海基会副秘书长三三会副秘书高文诚经简讯证实医院处理中，「谢谢关心，有进一步消息再跟大家报告」！ ETtoday新闻云 报导：网页链接 (agent)	未
江丙坤辞世，他是1949年之后国民党正式访大陆第一人	未
江丙坤辞世 他是1949年后国民党正式访大陆第一人	未
江丙坤辞世，他是49年后国民党正式访大陆第一人	未
江丙坤辞世 国民党表达“不舍与哀悼”	未
江丙坤追思会2019年1月举行 遗愿系增修自传	未
江丙坤逝世 国民党文传会发言人：我们永远怀念他	未
江丙坤逝世：“破冰者”走了，但还有多少大佬沉睡	未
江丙坤长子：预计明年一月举行江丙坤追思会	未
江东中路水管爆裂后续 南京市电力公司出动水陆两用车协助水务部门紧急抢修。经查，受淹地区供电主设备都无问题，个别用户安装在地下的供电设备被淹断电。提醒开发商一定要将配电房建在地面上，不能为了节约空间把供电设施建在地下，被水淹之后损失更大。	未
江东中路水管爆裂后续 因昨晚自来水管道爆裂导致的公共财产和私人财产损失，将由保险赔付。车辆被淹可拨打96055，由南京水务公司负责查勘，确认后可以理赔。	未
江东中路水管爆裂 水务集团提醒: 属于降压供水地区（河西南湖集庆门周边）的朋友们请做好储水准备以备停水维修，水务集团已启动应急措施，尽快抢修完成。	未
江东中路水管爆裂 目前城东城南河西水压较低，部分地区已停水，水务集团正在抢修，江东门隧道无法通行，已临时封闭，请注意安全，提前绕行。	未
江东中路附近水管爆裂隧道被淹 水务部门紧急抢修	未
江东大桥上的故事！这一堆烟头火了	未
江东大道二期正建 海口-铺前车程将缩短到半小时	未
江东镇西堤路约20米挡土墙塌方 现场限制通行	未
江东门水管爆裂所有抢修工作已全部结束，通行正常啦	未
江东门的钟声亲手撞响和平大钟，在钟声里回望历史，也在内心深处缅怀同胞！今天上午8点30分，来自河南的李天姝王帅帅朱江清，江苏的王钰雪本小路高林刘晓庆，湖北的夏秀清，安徽的徐东见嘉诚，黑龙江的张立国，一同体验了这具有特殊意义的撞钟仪式。这钟声警醒每一个人：牢记历史不忘国耻珍爱和平！	未
//@江中草:转发微博	未
江亚轮悲歌：70年过去了，没人知道海难为何发生	未
江北550米摩天大楼地块明开拍	未
江北交巡警发布交通管控措施 今明这些区域有限制	未
江北办开展12.4宪法宣传日活动	未
江北区洋河一路//@历史金句:具体地址透露一哈涩	未
江北区部分片区10日将停水8小时	未
江北区部分片区12日将停水8小时	未
江北区部分片区12月4日将停水15个小时	未
江北区部分片区20日将停水3小时 请提前做好储水准备	未
江北区部分片区27日将停水15小时 请提前做好准备	未
江北向西只有6公里远的科学城，竟用了6座立交链接！	未
江北城区南岸宜宾这些地方要停电，最长停13个小时！	未
江北“换乘王”：地铁11号线串起7条地铁线	未
江北新区交警走进校园 为400余名学生上交通安全课	未
江北新区公安分局招聘警务辅助（勤务辅警）人员57名（男49名，女8名）公告	未
江北新区公安分局招聘警务辅助（文职）人员49名公告	未
江北新区计划每年新开工两条过江通道	未
江北新区首个三甲医院将试营业 鼓医本部60名专家坐诊	未
江北机场地区今年查获“黑车”444台	未
江北核心区的摩天大楼要来了	未
江北渝北部分片区7日将停水数小时	未
江北神盘收官！一二手房价差7000元，2小时报名6000组	未
江北第一场雪就要来了！气温骤降，全城挨冻！更恐怖的是....	未
//@江南0003:近亲结婚的孩呀。	未
江南东部华南等地局地有大雨 东北中部降温10℃以上	未
江南之间，三潭印月	未
江南全面转雨，雪线退回北方受北极涡旋东退减弱影响，目前寒潮主力已向东奔向日本，暖湿气流增强并迅猛北上。两方势力消长之下，江南大雪全面转为中到大雨，雪线退回淮河以北。不过这不意味着南方要回暖，因为12.11冷空气又将南下，冰窖湿冷模式还将维持到周末前后。	未
江南公交上线大数据监控平台	未
江南公交又双叕搀迎帮扶、关爱老人	未
江南大道东段即将通车！惠城到博罗仅需15分钟	未
//@江南大野花://@Loki夫人://@M大王叫我来巡山://@尸姐://@恶化cassiopeia君://@Skystar_龍:	未
//@江南大野花://@L冬月T:是的，所以当你学理工科的时候会有人说，女孩子别去学，对女孩太难了。女孩们信以为真，恶性循环但不是这样的，我自己就可以证明，我们女孩子也能学理工科，也能做男生做的工作，也能做得比他们还要好	未
//@江南大野花:别让好人寒心//@顾惜之: //@李子的围脖: //@高十五://@曾鹏宇://@楚惜刀://@潘海天://@王小山: 居然有人认为花总好欺负//@不太老: 唉！//@花总: 小何是2002年疲劳过度去世的。谢谢老榕当年的仗义相助！我们一直记得当年网友们的热心肠。	未
//@江南大野花:后续更加好笑//@全撸剩饭:草//@这位以太太://@北京星权律师事务所: 致博主：北京星权律师事务所并未接受贵方委托，特请贵方即刻作删撤处理，以免误导受众。	未
//@江南大野花:哭着同意 是环境不允许//@颜文字君:帅哥从小就被预定了(   )//@江眉妩:哎//@糖衣炮弹_CopernicK:流泪了。。。//@安提戈涅_WhiteBlade :你说的很对。	未
//@江南大野花://@唧唧子://@-喻白: //@扶招://@仟淮:/@加贝爱蟠桃://@吵死-: //@ALUK_江南_SHOOTER://@卖鱼倩二号摊:/@_向剛花_://@堂本刚的腿毛由我守护://@丨大姨太丨://@裆铺老板汤大咚:	未
//@江南大野花://@唧唧子://@-喻白: //@扶招://@仟淮:/@加贝爱蟠桃://@吵死-: //@ALUK_江南_SHOOTER://@卖鱼倩二号摊:/@_向剛花_://@裆铺老板汤大咚:	未
//@江南大野花:基本礼仪//@段子楼://@商小略://@豆你玩:转发微博	未
//@江南大野花: 太可怕了，希望大家永远都不会遇上这类人//@哇赤加贺: 同意原文和转发里的每一个字//@李路可睜不開死魚眼花鼠花菇涼://@撑伞的Hime:补充一句，不限于男性。//@黒魔道士://@雅加达的Funk兄弟://@西西灯里:搞快跑	未
//@江南大野花:太魔了//@风吹铃铛响叮叮://@内藤君和西瓜酱:今天看到事故原因真的是服了//@碎花是甜到掉牙的兔子:这个故事真的太日本了为了守规矩扔垃圾自行处理120罐	未
//@江南大野花:头皮发麻//@酸雨干冰://@江上客居南://@l鱼苗I:又是多次家暴最终杀妻的//@再世衣锦夜 :今日反婚//@黑猫白袜子 : 唉//@Alexis_Quin :12月还没过完七个了	未
//@江南大野花:扩一下//@种白菜的白素贞://@这是一个很高冷的ID://@Tiger公子://@颜文字君:引起舒适(  」)//@罗蕾莱lorelei:扩散//@猛汉百科的QB君-秽土转生:首页哪位被咸猪手骚扰过的受害者帮忙看原po的评论去警察局作个证	未
//@江南大野花: 支持，有些道德问题不较真今后想起来能憋屈一辈子//@这是一个很高冷的ID://@藤宫裕二:社会正因为有肯较真儿的执着劲才可能进步//@奶爸猫律师:法律很多时候就需要这样不计成本的去追究行为人的责任，才能恫吓那些犯罪的人	未
//@江南大野花:看得有点舒适，这反应更临场//@萝卜吞噬者://@SNH48-王也:大型舒适现场 谁在街上搞我 不要怕我手重 //@海洋球殺人事件://@咸鱼王橙:最右熟读并背诵//@似李的脸脸://@午后狂睡:就像社交网站上跟陌生人开玩笑一样	未
//@江南大野花:第三方应用又神不知鬼不觉地出现了//@夏正正:转给首页//@M大王叫我来巡山://@丸子安利菌:！！好的//@辣条娘:需要//@小狐咖狸:我有14页授权//@系山雨欲来我叶大萌宝:马	未
//@江南大野花:这个视频太可怕了全家人都打小女孩，连小男孩都在耳濡目染欺负她，救救她吧//@美食家大雄:这种父母该坐牢//@曹增辉:麻痹的//@武志红:太可怕了。本以为只是魔鬼母亲，后来发现还有个暴力父亲	未
//@江南大野花://@酒千千千: //@stoness打着哈欠说://@故园湾里://@李子的围脖://@微荫: //@作者C://@头条新闻: 男子泰国杀妻骗保案遇害人母亲发声。节哀。	未
江南小景	未
江南怼暗箱操作，这是有点明显了，明着踩江南上位嘛，而且今年去年都是同一样的情况，也难怪人家看下去了。	未
江南文脉论坛上的江苏人 | 江南，是游子心中最深的牵念	未
江南早人是不能闲的，闲久了，努力一下就以为在拼命。	未
江南春：抓住中产阶级的三爱三怕和三缺由于拼多多的走红，使得对于当下的中国是在消费升级还是消费降级的争议不断发酵，对此，江南春在创业家年会称，拼多多是一个非常强大的公司，实现了中国底层社会的消费升级。他认为当下的中产阶级：爱美爱玩爱健康，怕老怕死怕孤独，缺爱缺心情缺自己，因此，创业也从中寻找机会。江南春：抓住中产阶级的三爱三怕和三缺	未
江南村落遇秋色 一步一履寄闲情	未
江南梨树结出“红苹果”	未
江南水乡忆江南，最忆是杭州	未
江南水乡，除了乌镇西塘，还有这个未被打扰的古镇	未
江南江北未来皆是主城 南京岂止在江南	未
江南的桥，水乡的梦，述说无数静默的话语，呢喃着江南的杏花春雨。 .	未
江南的桥，水乡的梦，述说无数静默的话语，呢喃着江南的杏花春雨。	未
江南秦望富阳安置房建得怎么样了区委书记有最新要求！	未
江南雪，相对于北方的雪景，一点都不逊色。	未
江原道我已经用了大半瓶！	未
//@江友户:所以遇到了天菜都是要藏起来的	未
”江口沉银遗址”发掘确认是战场遗址 不是主动沉银	未
江口沉银银锭刻有四川两任巡抚姓名	未
江和平杨继红胡正荣王晓晖等共议：主流媒体如何借短视频东风聚拢年轻人	未
江城视窗辟谣演练...这些热点，你关注了吗	未
江夏一副区级干部被双开，与一女性长期保持不正当性关系	未
江夏万达广场会不会建何时开始建设看最新官方回复！	未
江夏：偷了电瓶车藏在家中，这个窃贼玩的什么花样	未
江夏公共自行车退卡方式在这里！12月10号截止！速转！	未
江夏区公安局交通大队面向社会公开招聘30人！每月5000元！	未
江夏区四部门联合打击医保骗保	未
《江夏拍客》第22期：你看，城市的脸偷偷地在改变	未
江夏新闻阅读两分钟 知晓江夏事[2018年11月28日]	未
江夏新闻阅读两分钟 知晓江夏事[2018年12月1日]	未
江夏新闻阅读两分钟 知晓江夏事[2018年12月2日]	未
江夏杀鱼哥的架子鼓梦	未
江夏老党员杨利华经济条件不好却不忘帮扶困难群众，每周坚持给低保户送10个鸡蛋	未
江夏车主注意，看到自家车上有这种黑盒子，赶紧报警！	未
江夏辅警胡磊被授予武汉市见义勇为先进个人	未
江夏还有近25万人没交明年的医保！12月5号截止！你交上了吗	未
江夏这个小组又开会了，对村（社区）两委换届工作再部署！	未
江夏面的联合整治来了！按点线面逐步铺开！	未
江天一色无纤尘	未
。。。@江宁交警大队 下次咱们换个做告示牌的店	未
江宁交警部门今早继续全力迎战大雾天气。图为江宁交警大队横溪中队交警辖区相关路况。	未
@江宁亲们，近期雾霾多发，注意出行安全	未
江宁再添两条镇村公交线  谷里中学徐家院云水涧都能到	未
江宁城管试点—南京首条“无人值守”停车收费道路	未
江宁大庙社区开展西气东输安全大检查	未
//@江宁婆婆:前两天美分们都在喊美加司法独立肯定不会保释，今天傻眼了吧。然后加拿大环球时报（和我国那个没关系）还源引路透社消息说，川普表示如果对中美贸易谈判有利，他会介入干预孟晚舟案件。司法独立司法独立 查看图片	未
江宁开发区上市企业八成是民企	未
江宁政务中心可办供水燃气业务	未
江宁淳化这些地方明日计划停电 最长时间长达6个小时	未
江宁溪田有家反四风勤廉教育基地：耕廉于心 践廉于行	未
江宁街道开展新入职工作人员宪法宣誓活动	未
江安人注意！今天起，这些新规将影响你的生活！	未
江安农村公路明年计划新建187公里，县域东西跨度的10倍！	未
江安设立45个非洲猪瘟防控临时检查站，逢车必查，24小时值守	未
江安那些日久岁深的路边小摊，你还记得么	未
江宏杰宣布爱妻福原爱怀二胎：怀孕已6个月，老婆辛苦啦	未
江宏杰宣布福原爱怀二胎，就快要儿女双全了！	未
江宏杰宣布福原爱怀二胎：已怀孕六个月	未
江宏杰宣布福原爱怀二胎，昔日团宠这么快就要儿女双全了！	未
江山今天入冬！接下来最低1，有雨雪！	未
江山市城乡公交票价要调整了上涨还是下调，看这里......	未
江山市城乡公交票价要调整了，怎么个调整法看这里	未
江岸十大人气景点 给武汉打CALL这些人气景点，你们都去过吗	未
江川一小伙上演摸金校尉戏码，不料被巡特警当街拿下！	未
江川人惊呆了！一男子为筹毒资当街抢夺小孩金吊坠！	未
江川人震惊了！蓝翔一小男孩半夜偷开挖掘机！	未
@江干人，你的休闲菜市场待签收！今后买菜就像逛超市！	未
江平：这次司法改革走对了方向	未
江必新：三中全会决定应转变为全国人大决定	未
江户川柯南是黑户，为什么可以上小学，坐飞机坐新干线	未
//@江户川野菜:听到啦//@TooCXK:收到//@困困柚:听到[可憐]	未
江报君帮你办景德镇吕蒙桥至昌飞段无路灯 市路灯管理所：1日已启动准备工作 至少安装51杆11月下旬，有网友反映，景德镇吕蒙桥头至昌飞路段原本有路灯，但因城市规划需要扩建，早在两三年前把路灯拆除，但至今此路段未修复，路灯安装问题也被搁置，存在较大安全隐患景德镇市路灯管理所回应：经 ...全文	未
江报君帮你办景德镇吕蒙桥至昌飞段无路灯 市路灯管理所：1日已启动准备工作 至少安装51杆11月下旬，有网友反映，景德镇吕蒙桥头至昌飞路段原本有路灯，但因城市规划需要扩建，早在两三年前把路灯拆除，但至今此路段未修复，路灯安装问题也被搁置，存在较大安全隐患。景德镇市路灯管理所回应：经咨询相关部门该路段暂时不会有扩建计划，预计工程投入30万，将在道路两旁安装路灯，35至40米一杆，至少安装51杆另因吕蒙桥两侧有限高，工程车无法到桥面施工，将在桥两侧安装射灯，保证桥面有一定的亮度，保障居民安全出行。市	未
江振诚在成都的廊桥THE BRIGDGE开了近一年，是时候去吃吃看了	未
江映蓉被爆料试音《歌手》 本尊回应：时刻准备着	未
江桥：确认过眼神，他是这样的人	未
江毅任国家电力投资集团有限公司总经理	未
//@江氏小盗龙:雀尾螳螂虾，与我们吃的皮皮虾是一家，但的确是海洋中的恐怖杀手。	未
江水冷 ，你不上来我下去！  杭州警察下江救人暖人心	未
江永城区快警正式运行	未
江汉平原货运铁路开通运营 穿越4市打通鱼米之乡货运走廊21日16时54分，随着汽笛一声长鸣，编组16列的调102次货物列车从武汉局集团公司汉西车务段天门东站3道安全开出，这是江汉平原货运铁路开出的第一列货物列车，标志着该铁路正式开通运营，也使江汉平原货运系统更加完善。江汉平原货运铁路 ...全文	未
江汉平原货运铁路正式开通运营	未
//@江江月月年年不见无言：我们00后再过一两年也就要20啦	未
江江江疏影你你你冷吗 我冻到结巴 微博视频	未
《江河水》14日开播：秦昊领导改革，郭涛负责阻力	未
江油26岁女子和5岁儿子煤气中毒   抢救生命120110与时间赛跑	未
江油一服刑犯因漏罪两度押回重审，均获加刑	未
@江油人， 从12月起，这些新规将影响你我生活	未
@江油人：你的社保有大变化！医保养老金失业保险	未
@江油人：司机请注意，江油这些路口新增电子眼！	未
江油人才网：招聘人事	未
江油人才网：招聘前台	未
江油人才网：招聘文员	未
江油人才网：招聘管理员	未
江油人才网：招聘行政助理	未
江油人才网：招聘资料员	未
@江油人：明日以下地区将停气，请互相转告	未
@江油人：明日以下地区将停电，请互相转告	未
@江油人：江油驾考科目三线路调整，请注意	未
江油人注意啦！这个传销组织在绵阳发展会员6000多人	未
江油又端掉一传销窝点   外地19名年轻人梦想赚大钱	未
江油双河口轿车栽进排水渠致一人受伤...	未
江油大场口一私家车与出租相撞，车头损毁多人受伤	未
江油西山公园附近发生车祸，致一人死亡！	未
江油警方争分夺秒，煤气中毒母子转危为安，我为民警点赞！！！	未
江津人注意 ！这些新规将影响你我的生活，每一条都很重要	未
江津老农卖菜十年攒的钱， 藏墙洞被老鼠咬成渣渣！	未
江津这辆车准载30人，却装了38人！驾驶员遭惨了	未
江津这里的群众居然有专属节日还连续过了三年！	未
江浙、东北干部再度交流	未
江浙民营企业家的心里话：政策要有连续性 国企民企应一视同仁	未
江浙沪大批刑侦专家齐聚盐城，到底发了什么......	未
江浙沪探索编制长三角区域PMI，目前仍处内部研究阶段	未
江浙沪等试点导游自由执业 只能从事讲解向导	未
江浙纺织企业：经编和圆机开工率降至5-6成，提前放假回家过年的节奏	未
//@江浙闽:这个必须很恰当//@我叫林大白:崔永元质疑袁隆平，大概就相当于一个患者质疑医生给自己开刀动手术是不是要杀死自己	未
江海街坊注意！下周一，江门市区这些路段将实施临时交通管制！	未
江海街坊请注意！收到这样的10086短信千万别信！	未
江淮之子——周恩来与南京、淮安图片史料展”在梅园新村开展	未
江淮四川等地大雾持续 京津冀周末再遭“霾伏”	未
江淮大众新能源乘用车项目研发中心在合肥开工	未
//@江淮气象: 湿冷，还用讨论嘛！	未
江淮电动车也“火了”，厂家称：已获悉并展开专项调查	未
江淮警事 一个警察子女的十四岁生日	未
江淮警事交通事故现场的担当小姐姐：警察照顾奶奶，我照顾你近日，六安西河口乡发生一起交通事故，一辆三轮车为躲避一轿车发生侧翻，@六安公安在线 民警处理现场发现十多岁的小姐姐正在一旁不停的安慰收到惊吓的弟弟，并安慰奶奶人没事就好ps：会车时请减速慢行，不是所有的意外都能 ...全文	未
江淮警事大雾弥漫锁小城 守护安全有蜀黍近两天，大雾在夜间逐步蔓延，加之高速封闭，X018线等通行压力陡增，拥堵事故发生概率增大，@广德交警 的蜀黍们接连度过三个不眠夜，日夜坚守在道路上疏导道路交通秩序	未
