江淮警事 大雾里步行1小时 上门服务解烦恼 27日一大早，@马鞍山含山公安在线 蜀黍步行1小时来到辖区某村黄大妈家中为其拍摄身份证照片。经了解，黄大妈身份证到期，左腿半年前因交通事故刚装了假肢，行动实在不便，最近因报销医疗费用需要身份证，便一直为此事着急。蜀黍获悉后，上门服务解烦恼。PS：这样的蜀黍值得点赞 马鞍山  佳山乡	未
江淮警事夫妻两自导自演 手机变手镯近日，一女子从合肥快递一部奢华手机至杭州，并为手机保价10万元。然而，该快递在杭州被接收后，里边的手机变成了一个假手镯。@新站公安 经过侦查，发现寄件女子的丈夫苏某是涉事快递公司在杭州的派件员，是其在派件路上调包，试图敲诈公司钱财。而保价手机， ...全文	未
江淮警事 女子离家只差一步，群众报警喊来了蜀黍11月21日，当涂县公安局110指挥中心接到报警称，有位女士醉倒在小区楼道口，接到指令后，民警立即赶到现场，对醉酒女子就行询问，没想到旁边就是女子的住处，但由于饮酒过多，醉倒在家门口，无法开门。最终，民警拿出女士包里的钥匙将门打开，把女士扶进家后才放心离开。 马鞍山  军民路	未
江淮警事安徽警方侦破一特大电信诈骗案 被害人多达4100余人日前，桐城市公安局网监大队通过网上巡查，发现电商大厦武汉百世缘婚恋咨询有限公司利用虚假婚恋网站诱骗他人注册会员实施诈骗通过实地侦查情报拓展分析，警方发现该婚恋咨询有限公司暗藏多个诈骗网站，并分布在合肥安 ...全文	未
江淮警事查酒驾不分男女 千万别有侥幸心理近日，淮北濉溪县交管大队民警在巡查中将心存侥幸的酒驾女司机王某某逮了个正着 交警不是只查男司机不查女司机的嘛王某某央求交警求放过，经测其为饮酒后驾驶ps：谁告诉你，交警不查女司机	未
江淮警事 男子摔跤丢钱包，警民接力寻失主近日，张先生在上班途中意外摔倒，人没事，却把钱包给摔丢了。结果钱包被路过的李先生意外拾到，看到钱包内有许多证件，李先生赶紧将钱包送到@马鞍山楚江公安在线 蜀黍手上，希望蜀黍尽快帮钱包找回主人，蜀黍也不负厚望，十几分钟便找到了失主，交还了钱包。蜀黍提醒大家，骑车时贵重物品一定要放好，同时也要注意安全啊。 马鞍山  佳山乡	未
江淮警事禁毒宣传进校园12月份以来，@黄山歙县王村派出所民警方瑞超和同事已先后到辖区的6个乡镇开展了禁毒专项宣传12日，她和同事又来到长陔中心学校，给同学们宣传禁毒知识她在校园里不仅上好普法课，还指导学生参加全国禁毒知识竞赛，通过小手拉大手打造幸福家庭创建平安村	未
江淮警事雪天路滑车辆侧翻其实没那么简单！12月7日，郎溪大雪，一辆面包车侧翻在马路上，@郎溪公安在线 民警赶到后迅速将驾驶人李某救出，所幸李某只是受到一点轻伤，但蜀黍却在车里闻到浓重的酒味，经酒精检测，李某涉嫌醉酒驾驶酒驾猛于虎，侥幸要不得	未
江淮黄淮等地仍有大雾 部分地区出现特强浓雾	未
江淮黄淮等地有大雾 较强冷空气继续影响北方地区	未
//@江深竹静三两家:两帮黑社会火拼，拼不下来，最后还得找德高望重的话事人吃讲茶	未
//@江渚沙:很黄很暴力呀	未
“江湖之远，庙堂之高”：德法比较下法国“抗议文化”	未
江湖人称 易秒没@TFBOYS-易烊千玺	未
江湖再见曾经为中国足球小将 出战过的三个孩子，如今刘泽华（左）在广州恒大U9，郎达成梁钧皓在广州富力U9！	未
江湖告急，2019厦门瑜伽节4天早鸟价999，倒计时最后3天！	未
//@_江湖夜雨_:转发微博	未
江湖救急！这里有一份小小的问卷需要大家帮忙填一下！看这里网页链接辛苦发一下韩流微博爱豆君会从填写问卷的小可爱们中抽取幸运儿送上小礼物哟	未
江湖结义河源两少年网吧相识后，拿上斧头刀锤疯狂作案	未
江湖老刘12.6收评:扣留事件加速调整进程，补缺之后操作参考两点！	未
江湖行，东西南北分不清撞到墙角不觉，躺在地上数星星！	未
江湖里，庆幸还有你们。	未
江湖，首先是一个要有规矩的江湖。能洁身自好不容易	未
江滨路取直工程开始沥青摊铺  预计将于12月底开通	未
江燕飞：活着不易，为爱留一个出口一家人过日子，真的不需要冷酷到底，伤人又害己。网页链接	未
江珠中高速路段大巴车与货车相撞请求立即救援！！！	未
江疏影戴贝雷帽（p1-p5） 和我戴贝雷帽（p6）  （不仅像武松打虎，还很像老式茶杯盖（p7））	未
江疏影戴贝雷帽和我戴贝雷帽 近日 江疏影东京雨夜街头的照片一流出，网友看后纷纷表示要扔掉自己的贝雷帽  鲜明的对比一万点伤害	未
江疏影晒了一张妹妹的照片 网友说是女版胡歌	未
江疏影穿高领紧身衣秀身材，却被小肚腩抢镜！	未
江疏影首曝与娜扎吵架内幕：为和好我主动亲了她	未
江科室友图鉴04  今天不想撞南墙，只想撞进姑娘的心房！	未
江绍勇到清江慰问困难群众	未
江苏11月30日12月5日：江苏第974站	未
江苏13设区市均遭“霾”伏 亮“霾黄色预警”	未
江苏17所高校PK网络空间安全科研项目	未
江苏18县(市、区)巡视反馈出炉:严肃问题整改	未
江苏2018年共破获保健品诈骗案480余起	未
江苏2018年高考逐分段统计公布 填报志愿需关注	未
江苏2019年艺术类专业省统考本周末展开	未
江苏2019年艺考大幕将拉开！美术类考生达3.15万	未
江苏：2020年前建6万个新能源充电设施 快充网络基本覆盖全省	未
江苏：2020年前推广15万辆新能源汽车	未
江苏：2020年所有行政村通双车道四级路	未
江苏：2022年苏南基本实现农业农村现代化	未
江苏21.2万人参加2019年全国硕士研究生招生考试，25日起开始阅卷	未
江苏21.2万人参加硕士研究生考试 设标准化考点77个	未
江苏2月发现网络安全事件2亿起 超9成为僵尸木马受控	未
江苏300亿元稳就业促创业，明年起见习补贴范围扩大	未
江苏4137名残疾人开上汽车	未
江苏6旬老汉网恋25岁美女孕妇！没想到娃父亲竟是...	未
江苏6部门联合打击整治长江流域江苏段污染环境违法犯罪	未
江苏6部门联合打击整治长江流域污染环境违法犯罪	未
江苏7000多个小区实施垃圾分类 鼓励建立公厕开放联盟	未
江苏VS八一不会打控卫的中锋不是好中锋，肯帝亚两内线闲庭信步下快攻	未
江苏一女老师爆料：已婚男同事多次夜闯她宿舍，校方不处理反而	未
江苏一小学建立惩戒制度引热议 校长:不是真的要打	未
江苏一小学老师表情包评语走红，网友：我都想写作业了	未
江苏一幼儿园请家长扮人贩子：20分钟骗走46个孩子	未
江苏一德集团有限公司陈俊：在事业中疯狂，在生活中沉静	未
江苏一德集团有限公司陈俊：有信心，什么都有了	未
江苏一派出所副所长因公牺牲！战友，一路走好。	未
江苏一男子大街上骑车舞红缨枪！警方：崇拜赵云，有病	未
江苏:上好“必修课” 警醒“看片人”	未
江苏上海等地有浓雾 东北地区北部仍有明显降温	未
江苏下半年首场大范围雾霾来袭 预计持续4天	未
江苏下周最低气温10℃，春天就要来了	未
江苏下雪 2018江苏初雪 8日沿江苏南地区局部大到暴雪，江苏北部最低气温-5江苏省气象台6日下午发布了最新的天气预报显示，大家期待的初雪将从周五夜间正式拉开帷幕，周末雨雪最为集中，预报8日沿江苏南地区局部大到暴雪。虽说此次沿江苏南地区的降雪的主战场，而淮北地区9日晚些时候也可能飘起小雪。（扬子晚报/扬眼记者 于丹丹）省气象台最新预报：8日沿江苏南地区局部大到暴雪，江苏北部最低气...	未
江苏与中国宝武签署战略合作协议 娄勤俭吴政隆会见陈德荣胡望明一行	未
江苏专员办：当好“五员”深化依法监管实践	未
江苏专转本计划招生1.5万人 2019年1月上旬报名	未
江苏专项治理中小学违规办学行为：严禁学校超课程标准、超进度教学	未
江苏严禁进口大包装婴幼儿配方乳粉 到境内分装	未
江苏中小学教师有偿补课不收手一律先停职！12月新规来了12月1日起，一大波新规即将正式上线：扫黄打非举报奖励最高可达60万元军人依法优先出行权益将得到保障在江苏开网约车须通过治安背景审查对精日说不的首部国家公祭地方法规将施行看过来转发周知！江苏新闻出品	未
江苏：中小学生课后服务公益性质为主 最晚18:00结束	未
江苏：中小学课后服务可至晚六点	未
江苏丹阳、句容党政主要领导调整：黄春年、潘群分任市委书记	未
江苏丹阳国道旁无证照黑加油站成“定时炸弹”，缘何治不了？	未
江苏丹阳志愿者开展“暖冬行动” 为老人送上冬被	未
江苏丹阳表彰诚信示范企业商户及个人	未
江苏为农业种植“遮风挡雨”：新增3个中央财政补贴型农险险种	未
江苏为家庭教育立法：不是谁的孩子谁领走，而是谁的责任谁领走	未
江苏举行重大项目现场推进会议 10个项目集中开工	未
江苏五级河长总数5.7万 每条河流都有河长	未
江苏五级河长总数达5.7万 每条河流都有河长	未
江苏交警联合省内院线发布122文明交通倡议	未
@江苏人，这些事“不见面”就能办好	未
江苏今冬首场雾霾将持续7天 "静稳天气"成祸首	未
江苏今夜起寒雨淅沥 11月22日淮北降至0℃	未
江苏今明淮北暴雨来袭 南京高温蠢蠢欲动	未
江苏以税务数据定信用 惠及中小民企20余万户次	未
江苏仪征:新村社区志愿者 服务积分兑大奖	未
江苏传统纺织服装业试水网红经济 老板变主播“带货”	未
江苏信访事项实现“一网通办” 半数信访者选择网上信访	未
江苏入冬首场降雪将至 南京禄口国际机场严阵以待	未
江苏全国首推PPP项目全生命周期法律顾问制度	未
江苏全省大气污染加重 蓝天还要"躲"几天	未
江苏全省首家社区境外人员服务中心落户建邺	未
江苏全面推开 “证照分离”改革 新增药品进口备案等22项内容	未
江苏公安交管“一号窗口”服务十年“不堵”	未
江苏公布中小学违规办学行为专项治理举报电话	未
江苏公布暑假旅游线路成本价 日本8日游8000元	未
江苏公示改革开放40年先进个人人选：民企老总占了三成	未
江苏内斗到什么程度呢同一个镇，两个村，互相之间瞧不起，同一个县，两个镇，互相之间瞧不起，同一个市，两个县，互相之间瞧不起。	未
江苏农村低收入人口30种大病纳入专项救治范围	未
江苏出台2项通行费优惠政策 这些车辆免通行费	未
江苏出台两项通行费优惠政策 这些车免通行费！	未
江苏出台两项通行费优惠政策 这些车免通行费	未
江苏出台政府采购信用管理暂行办法	未
江苏出台政府采购信用管理暂行办法 全面加强政府采购信用管理	未
江苏出台方案推进省委联系服务专家常态化	未
江苏出台无人机严规 “黑飞”可予击落	未
江苏初雪“不像样” 不就是雪粒子嘛！	未
江苏初雪 雪情报告！看雪都下哪儿了7日中午前后，我省沿江和苏南地区开始出现雨雪天气截止17时，南京南部无锡常州无锡苏州等地雨雪量有0.1-7.0毫米，17时溧阳积雪深度达1厘米目前，雨雪回波位于我省东南部地区，预计今天夜里到明天白天沿江和苏南地区阴有小到中雪，局部大雪明天 ...全文	未
江苏初雪 雪情报告！看雪都下哪儿了7日中午前后，我省沿江和苏南地区开始出现雨雪天气。截止17时，南京南部无锡常州无锡苏州等地雨雪量有0.1-7.0毫米，17时溧阳积雪深度达1厘米。目前，雨雪回波位于我省东南部地区，预计今天夜里到明天白天沿江和苏南地区阴有小到中雪，局部大雪明天夜里沿江和苏南地区阴有中雪，局部大到暴雪。大家准备好了吗	未
江苏南京：学生线上提问，老师“抢单”答疑	未
江苏南京诞生首部国家公祭地方立法！精日行为将被处罚	未
江苏南京诞生首部国家公祭地方立法！精日行为将被处罚！23日，江苏省人大常委会会议全票通过《南京市国家公祭保障条例》。明确规定：国家公祭仪式鸣放警报时，所有人默哀一分钟国家公祭设施周边禁止一切公共娱乐活动对精日行为划定法律红线，构成违反治安管理行为的，由公安机关依法给予治安管理处罚构成犯罪的，依法追究刑事责任。重磅  刚刚，省人大全票通过《南京市国家公祭保障条例》！	未
江苏南通一晚托班老师打掐小学生，托班被取缔并退还费用	未
江苏南通载50人大客车在沈海高速侧翻 4人受伤	未
江苏南通载50人大客车在沈海高速侧翻，4人受伤	未
江苏卫视《江河水》将播 秦昊郭涛剧中“斗智斗勇”	未
江苏卫视江河水改革是会得罪人的你们觉得江河身上有什么特点，适合来做改革人	未
江苏卫视江河水江河正面battle秦局长，关于改革的这番言论反击，让咱们秦局哑口无言	未
江苏卫视江河水用故事的形式点拨卢茜@阚清子 ，江河@秦昊 这招你们觉得怎么样她会明白他的深意吗	未
江苏去年审结毒品案5612件 网约车成贩毒新手段	未
江苏又一港口昨日正式开港运行，由三地合建	未
江苏双12快递量预计达2.3亿件 苏州电商卖得最多双11的余温还没过去，双12又来了，剁手党们抢购得如何12月12日，从江苏省邮政管理局了解到，双12当天江苏人已收到1250万件快递，双12期间快递总量预计将达2.3亿件。目前来看，苏州人销售购买力都是最强。@苏州邮政有车生活	未
江苏发布11月份空气质量排名，前十名后十名名单在这…	未
江苏发布11月县(市、区)空气质量排名	未
江苏发布今冬首个暴雪蓝色预警 未来三天持续雨雪	未
江苏发布今冬首个暴雪预警，徐州宿迁连云港等地高速路段实施管制	未
江苏发布学生校服质量抽查报告 ，有产品不合格指标达3项	未
江苏发布《意见》：不得对学龄前儿童进行“小学化”教学	未
江苏发布暴雨黄色预警 南通南部已出现较强降水	未
江苏发布霾黄色预警信号 淮安等已出现中度霾	未
江苏发文：中小学课后服务可至晚上18：00	未
江苏发现H5N6亚型高致病性禽流感疫情！已扑杀家禽31329羽	未
江苏发现H5N6亚型高致病性禽流感疫情！已扑杀家禽31329羽，就在镇江隔壁！	未
江苏发现H5N6亚型高致病性禽流感疫情！那么，鸡鸭还能吃吗	未
江苏发生一起禽流感疫情！扑杀家禽31329羽！	未
江苏口岸启用退证查询统一处理模式	未
江苏可能在雪中告别2018 阴雨中大降温本周开启"湿冷模式"	未
江苏各地依旧灰蒙蒙 瘦西湖景区朦朦胧胧	未
江苏各市房价今年三季度走势如何？	未
江苏：名校老师集体签署拒绝有偿补课承诺书	未
江苏启东海边一鲸鱼搁浅死亡多日 初判为须鲸	未
江苏启动质量兴农环省行活动 千家农产品经营主体纳入追溯平台	未
江苏启动重污染天气蓝色预警	未
江苏启动重污染天气黄色预警	未
江苏启动雾霾天蓝色预警	未
江苏吴中：拟以9000万元增资子公司医药集团	未
江苏国企员工注意啦！1月1日起，你的工资这样改革	未
江苏国信控股子公司江苏信托拟不超8亿元投资证券市场	未
江苏国有金融资产首晒“家底” 总额54080亿元	未
江苏城市集中式饮用水水源地保护攻坚战这样打	未
江苏城管协管员统一着装标准出炉，协管员将有编号	未
江苏多所名校教师因有偿补课等行为被查	未
江苏大雾19点，南京扬州部分地区能见度已经率先低于50米了，这天气开车真是得注意安全，准备高速出行的盆友注意关注路况信息！	未
江苏大雾南京大雾没毛病建议大家上班早高峰选择地铁，公交出行，要么可能堵在路上，要么找不到自己的车了	未
江苏大雾卫星遥感带你感受今早的大雾，图2是提取后的今早7:30雾区示意图，虽然有点江浙沪包邮的趋势，不过，江苏明显是重灾区，大家出行注意交通安全！苏苏也会及时发布最新大雾动态！	未
江苏大雾完了，江苏集体沦陷目前，全省能见度图全线飘红，大部分地区能见度不到100米，早高峰出行压力山大，有高速出行计划点注意关注路况信息，部分高速路段可能封路！	未
江苏女大学生被困获救，送另类锦旗致谢：大雪封山，救我狗命	未
江苏：学校周边要划设学生安全区域	未
江苏安徽江西山东海南贵州西藏青海新疆到农业银行预约人民币70年纪念钞	未
江苏实现信访“一网通办” 半数人选择上网	未
江苏对中小学教师有偿补课“零容忍”	未
江苏对出租车网约车司机出大招！背景不过关不得从业近日，由江苏省公安厅交通运输厅联合制定的《江苏省客运出租汽车行业治安防范管理规定》（以下简称《规定》）正式发布。《规定》对客运出租汽车行业的治安防范管理工作作出明确规定，要求客运出租汽车经营单位的驾驶员须通过公安机关背景核查，符合条件后才能从事经营服务。据悉，《规定》从12月1日起正式施行。江苏对出租车网约车司机出大招！背景不过关不得从业	未
江苏对困难群众救助相关领域政府信息公开定规矩	未
江苏射阳接轨上海按下“快进键”：驻点招商，承接产业转移	未
江苏将为家庭教育立法：谁来教父母成为父母？	未
江苏将推年度综合考核制度 各部门不单独开展	未
江苏将推行年度综合考核制度 各部门原则上不得单独开展全省性考核	未
江苏将现雾霾沙尘混合体，出门一定要	未
江苏将绿色GDP正式纳入官员政绩考核	未
江苏将迎今冬初雪，今天夜间淮北北部局部地区有小雨或小雨夹雪	未
江苏将迎超长雾霾天，学会保护自己	未
江苏小伙吴先生遇一车辆撞上栏杆引发大火，驾驶员和妻儿被困车内。他先救出女子和孩子，要救驾车男子时火越来越大，男子喊我出不去了不要救了，要炸了，可他仍没犹豫，砸开车窗救出男子，仅5秒后车就爆炸。 赞好人！	未
江苏：小升初笔试“面谈” 都不允许！	未
@江苏小微企业，今年有多笔税收政策“大红包”到账，请查收	未
江苏小贷行业大整顿！89家小贷公司要被强制关张(附名单) 近日，江苏省地方金融监督管理局宣布终止全省89家小贷公司相关经营资格，并进行了公示，此次被终止经营的小贷公司数量占到了江苏全部小贷公司总数的近14。 江苏小贷行业大整顿！89家小贷公司要被强制关张(附名单)	未
江苏就业见习补贴范围扩展至16—24岁失业青年	未
江苏工业企业环保风暴中的转型“阵痛”	未
江苏“常州毒地案”二审开庭 土地修复责任分配成焦点	未
江苏年底前完成县级以上水源地保护区排查整治	未
江苏幼儿园请家长扮人贩子 20分钟骗走46个孩子	未
江苏幼儿园请家长扮人贩子 20分钟骗走46个孩子(图)	未
江苏开展劳动用工专项检查 不发高温费小心被查	未
江苏开展秋冬季大气污染防治交叉互查 163家存在问题	未
江苏开辟全国首个“互联网金融消费者权益服务”通道	未
江苏开辟首个服务通道 防范互联网金融风险	未
江苏徐州，8岁男孩马跃中在放学路上捡到一部手机。因担心失主着急，他一个人徒步跑了近2公里路将手机交到派出所。最终，民警联系到失主归还了手机。看到手机被物归原主，马跃中才放心回家	未
江苏徐霞客镇：“网格”连万家 村民可在家“审查”村委工作	未
//@江苏微公益://@玄武区红十字会://@南京发布: 你小时候有哪些梦想	未
@江苏所有国企职工，明年1月1日起，你的工资将这样改革	未
江苏打响水源地保护攻坚战：年底前完成县级以上保护区排查整治	未
江苏扬州打造环保教育基地 亲身体验垃圾“变废为宝”	未
江苏扬州现平流雾 城市建筑如入“云端”	未
江苏拟出台快件箱服务规范 24小时未取应提醒	未
江苏拟出台智能快件箱服务规范，24小时未取快件应提醒	未
江苏持续雾霾天气有望缓解 静候强冷空气“驱霾”	未
江苏挂牌督办治超！货运站超载最高罚30000，企业超载吊销运输许可证	未
江苏推广课后服务 用 “校内辅导”遏制校外培训的野蛮生长	未
江苏推“环保贷” 财政投入4亿撬动银行资金80亿	未
江苏推进群众身边腐败和作风问题整治	未
江苏:擦亮"最后一公里"的监督"探头"	未
江苏改革开放的实践与启示① | 交通基础设施，从滞后到领先	未
江苏改革开放的实践与启示：交通基础设施从滞后到领先	未
江苏改革督察亮出"问题清单" 229项问题将整改	未
江苏政务服务APP“五星级”应用扩容 省直公积金“不见面”提取	未
江苏政务服务网官方微博上线	未
//@江苏政务服务网:泗洪县首次引进了公共信用查询一体机。公共信用查询一体机的使用，省去了人工查询需提供身份证原件复印件并填写相关资料的程序，需要查询报告的人员只需带着本人的身份证原件通过机器扫描识别，比对完成即可打印出本人的个人信用信息查询报告，比人工查询省时省力。	未
江苏政务服务网 留言板：雾霾天气跑操影响孩子健康11月28日，扬州市开发区韦女士反映近期雾霾严重，但树人中学依旧在组织学生跑操，雾霾对学生身体伤害较大，希望相关部门核实处理市教育局回复针对近期雾霾较重的情况，市教育局十分重视，已提醒全市中小学做好预防措施，并提出四项防 ...全文	未
江苏教育厅发文：中小学课后服务可至晚上18：00	未
江苏教育厅发文：中小学课后服务可至晚上18：00江苏省教育厅19日发文，对我省中小学课后服务提出指导性意见。意见提到，家长自愿申请，财政补贴，可适当收费，小学和初中课后服务不晚于18：00。 （南京发布）	未
江苏整治形式主义官僚主义 坚决防止"走过场"	未
“江苏文化周”走进马六甲促“民心相通”	未
江苏新规：客运出租车驾驶员通过治安背景核查后方能从业	未
江苏新规：开网约车须通过治安背景审查	未
江苏新规：校外培训不得晚于20:30结束，不得留作业	未
江苏新闻 今晨江苏大雾弥漫，能见度低，出行注意安全哦今天（21日）清晨，江苏大部分地区被浓雾笼罩，能见度偏低，局部能见度不足50米，请大家上班时注意安全。网页链接	未
江苏新闻全省能见度均将至100米以下截至凌晨四点，全省能见度图全线飘红，大部分地区能见度不到100米，局部出现能见度不足50米的强浓雾。据南京城市交通气象监测信息，南京今天06时能见度50米500米，预计未来12小时能见度为50米2公里。早高峰出行压力山大，大家尽量地铁！有高速出行计划的市民注意关注路况信息（扬子晚报/扬眼 记者 于丹丹） 滚动江苏全省能见度均将至100米以下	未
江苏新闻受雾霾天气影响江苏省苏南地区部分高速公路实行特级交通管制（封闭）措施省交通综合执法局发布：12月1日23:30，目前，受雾霾天气影响，我省苏南地区部分高速公路实行特级交通管制（封闭）措施。具体管制路段如下：泰州大桥， G25长深高速宁杭南京至无锡段， G42沪蓉高速南京至无锡段， G4011扬溧高速， S38常合高速南京常州段，S39江宜高速， S68溧芜高速，S85溧阳支线，S86镇江支线，S87南京支线。（扬子晚报/扬眼记者 石小磊）	未
江苏新闻省气象台发布今年首个暴雪预警，这三个城市注意了，雪要下一夜！大家肯定想不到，这个点居然来个暴雪蓝色预警信号江苏省气象台12月10日20时48分发布暴雪蓝色预警信号目前，徐州宿迁和连云港地区已出现降雪，预计未来12小时内上述地区降雪量将达4毫米以上，可能对交通或者农牧 ...全文	未
江苏旧影1931年，南京郊区乡镇百姓生活	未
江苏昆山:退休女法官成关爱青少年的"纪妈妈"	未
江苏明后两天空气质量以轻度污染为主 3号短时中重度污染	未
江苏明晨最低1℃！秋裤羽绒服在召唤！	未
江苏晒出首份国资"家底":国企资产总额99328亿	未
