球哥这球给老詹，真的帅.救回来之后，三分命中.	未
球哥鲍尔单手劈扣！湖人老板大喊一声：太阳，你咋想的！	未
球场推土机！姚明和奥尼尔都用这招打爆NBA内线	未
球星库里遭遇车祸   座驾被撞人无大碍	未
球星都有豪车，各有不同的养护心得。来看巴神如何对待自己的爱车90后嫌犯掏空被遗忘的玛莎拉蒂	未
球赛即将结束公交摆渡车已经在经十东路南侧1号门前就位。	未
球迷分享的几个足球界的蝴蝶效应：1曼联球迷：曼联2003年把小贝卖到皇马，想从利兹联签下科威尔，但科威尔选择了他认为处在上升期的利物浦。最终曼联转而签下了一个名叫小小罗的小伙子。2桑德兰球迷：凯恩主罚角球让我们两次降级。霍奇森在欧洲杯的失败让英足总仓促地在赛季开始前3周抢走我们的主教练阿勒代斯，莫耶斯仓促上任，买了一些旧将，然后开始崩盘。球队与球迷之间闹崩气氛变坏球队降级莫耶斯下课，留下一堆烂球员和高额费用。气氛继续恶化，再次降级。如果当年凯恩不在对冰岛的比赛中主罚角球，我们不会降级两次。	未
球迷已经陆续散场，龙奥北路龙奥西路荷宁路南口柳康路南口禁止西行(可绕行旅游路或直接东行)，龙奥南路龙奥西路禁止北行交警报路况 经十环山路事故影响双向通行，请绕行重细节平安行	未
球迷眼中的足球江湖：25年联赛留下几个“京鲁”？	未
球迷聊球  本赛季NBA三分之一比赛打完，关于谁会入选全明星首发也是争论不休不过网友晒出的这张图似乎没有异议，按照过去的表现，本赛季全明星东西部首发，或许就是他们几人了！	未
球里的宝可梦：卧槽地震了 ！！	未
球队深夜抵达韦斯卡	未
球队的实力有差距，教练的水平也有差距，表现在就算尤文踢得不好，也能拿到赛前预想的结果。国米的现状是，一旦想在强强或者关键比赛中先立足防守，那自己就很难进球了。这就是球员能力不足。同时教练的用人和思路也将一些原本不算大的差距拉的更大了。现在的国米，实力上是不如上赛季后半段的（如果纳因戈兰总是这种出勤率的话）。夏天的操作其实是拉低了实力上限而补强了整体阵容厚度，从这方面来说其实对于争四是有帮助的，前提是你能用好前场的搭配组合。暂时不多说，等踢完欧冠最后一轮再具体说说球队和教练的问题。最后，我并不认为现在国米	未
球队赛前集中！	未
球队赛前集中图	未
球鞋报道 P.J. 塔克 Nike LeBron 8 South Beach amp Nike KD 4 PE @NikeBasketball	未
球鞋报道 尼克杨  adidas Pro Model My Navi PE @adidasBasketball	未
球鞋报道 巴姆阿德巴约 Air Jordan 14 Custom @Jordan官方微博	未
球鞋报道 拉塞尔威斯布鲁克  Jordan Why Not Zer0.1 PE @Jordan官方微博	未
球鞋报道 斯蒂芬库里  Under Armour Curry 6 PE @UnderArmour	未
球鞋报道 蒙特雷兹哈雷尔 Air Jordan 7 Boondocks Custom @Jordan官方微博	未
球鞋报道 达米恩利拉德  adidas D Lillard 5 @adidasBasketball	未
球鞋潮服剁手倒计时！！ //@我们都是球鞋控: 再不剁手，2018就要过完了，猛戳！	未
球鞋竞拍，今晚 10:00 结束！来看看有你的尺码么图片均为实拍，可查看瑕疵情况及竞拍规则。网页链接	未
球鞋被老爸摔破！初三男生将父母反锁家中，跑去报警近日，余杭公安运河派出所接警室匆匆走进一位少年，这名少年手里拎着一双运动鞋，口中说我的鞋子被砸坏了，我来报案的。原来前段时间，小程跟同学每人出资一半买了双8000元的球鞋，俩人轮流穿。日前，小程花50元洗鞋，其父觉得太贵，一气之 ...全文	未
球馆里面有个球迷举着个牌子说：郎佐模仿了我的跳投	未
琅琅上口的儿歌中 钱乃荣讲起上海民谣中的宝山记忆	未
琅琅平时看存在感真的不太大，但是某一个角度，某一个时刻就会勾你一下魂。	未
理上网来：改革开放	未
理人说理搞旅游，我们的生活发生了很大的变化........，听王嘉俊说桃坪发展	未
理发	未
理发师一刀下，20岁少女变40岁大妈	未
理发师你出来下，我保证不打屎你！！！	未
理发师对我说：你好粗啊，而且很硬。	未
理发师眼中的随便为什么理发师的一厘米和我的一厘米差很多	未
理发师眼中的随便当你纠结要不要剪短发，请回忆一下你的理发师据说这是每个女孩纸共同的病	未
理发师眼中的随便 每次去理发都是一场赌博，而我，从来没有赢过	未
理发的小哥说我白发比以前多了这是要往我头像的模样发展啊	未
理小路邛崃山隧道进口端正式进洞施工	未
理性复盘：中国大拆迁	未
理性的来聊一下你现在使用的手机吧，具体型号是哪款。你对这款手机最满意的是哪方面，最失望的又是哪方面	未
理性看到外国商品。你坐的飞机是美国的，拍照片的镜头是日本的，电冰箱洗衣机的铁是澳洲的，奶粉是新西兰，你老婆的lv是法国的，你买的书是德国海德堡机器印刷的，你的拖鞋是中东石油炼的。你的家具木材是非洲的，你吃的肉蛋禽，饲料是进口玉米。	未
理性看待归还遗失物索要跑腿费打车时遗忘了贵重物品，你会如何找回来如果的哥问你要油费，你会愿意给吗多少钱才合理呢几天前，来长沙出差的蔡先生就遭遇了这样一件事。司机要100元跑腿费，蔡先生支付100元之后拿回了手机，但觉得这并不合理。事件引发了网友热议（12月2日《潇湘晨报》） ...全文	未
理性看待马拉松急救的不规范：因为急救我们才刚刚起步	未
理性面对还是简单站队，基因编辑的未来何去何从	未
理想，不再是骑马喝酒去天涯，而是，再晚我也要回家。	未
理想不再是骑马喝酒去天涯 而是再晚我也要回家	未
理想中的婚姻生活 你从失败的婚姻当中学会了什么，扎心了	未
理想中的婚姻生活，大概就是这样的吧	未
理想主义开发者的窘境：谁来帮助Grin	未
//@理想便宜卖-Matias:确切说是枫叶卡在2009年到期，未续期//@月风_投资笔记 :另外庭上也确认了一个事实，孟是中国公民，她只有枫叶卡没有换加国籍。	未
理想的修道环境	未
理想的女友身材是哪一个	未
理文玖龙春节停机，巨头纸厂齐涨！	未
理智地爱国很重要，或许只有当人们必须为自己在网上的言论负责的时候，一些无脑的谣言才会减少。	未
理智的离开，总比混乱的留下好，虽然都是痛	未
理智讨论，这个人到底484因为攀了一查欧的裙带关系找到工作的，请问他给一查欧下了什么迷魂药	未
//@理查不接稿不接广告://@武啦啦-nana:恶臭//@die不die: 这个世界上有人被抢劫，是因为钱太多//@Alpha帅锤:脑子进水了//@啊竹夭啊://@Swaggyki:傻逼//@Shirai-:啊//@为子酱:呕@丶眼泪君:wtmdxmr//@大望路女青年://@女情儿:魔幻//@Tiger公子:简直不知所谓//@迷影心生:	未
//@理查不接稿不接广告:这次的娜娜没有头！//@町弟噹導://@石崎维他奶茶: 啊啊啊啊啊啊啊啊啊啊啊	未
理疗室一堆白花花的屁股	未
理解万岁！//@溪溪大人:通过理直气壮地欠钱让人相信理直气壮地欠钱是可能的通过变成老赖让人相信变成老赖是可能的通过锤子科技让人相信阿猫阿狗改变世界是不可能的这就是体面的罗丧，哦不罗桑。	未
理解大妈的心情，失去了陪伴自己的小伙伴。所以请大家参与交通时，多听，多看，多注意。	未
理讨你怎么看待AA制	未
理讨你愿意让你的爱豆去当导师吗	未
（理论研究）为什么社保很难降低因为社保还有支出部分。如果要降低征收，支出怎么办补这个缺口，有几个办法：一，降低养老金标准。老头老太要吵了。降低医保金，医院不高兴了。二，用其他税收补。但是各项税收已经有用途了，机关事业发工资，基建，等等。减少哪一块都 ...全文	未
理财子公司10亿门槛：小行直呼高，监管为组团设子公司“开口子”	未
理财子公司不是超级牌照，资管机构站上“统一”起跑线	未
理财子公司与信托牌照、公募基金相比， 有哪些业务做不到？	未
理财子公司产品可直接投资股票 首次购买不要求投资者面签	未
理财子公司兴，信托通道亡？非也	未
理财子公司  再读新规背后的玄机	未
理财子公司冲击报告：一场公募行业的“草木皆兵”	未
理财子公司如何影响资管行业？银行和保险资管部负责人这么说	未
理财子公司应明确差异化定位	未
理财子公司挖角公募人才 资管行业真会硝烟四起？	未
理财子公司是超级牌照？银行直呼“别把我们想成狼”	未
理财子公司来势汹汹 13.36万亿公募基金压力山大	未
理财子公司管理办法正式出炉 近20家银行抢占“赛道”	未
理财子公司落地 22万亿银行理财如何影响你我？	未
理财子公司落地资管格局生变，保险资管的优势在哪里？	未
理财子公司问世在即，银行系公募基金路在何方？	未
理财市场告别“造富”神话走向规范	未
理财支付宝这款全民保，真的能1块钱养老	未
理财，改变的不仅仅是你的钱袋，还有你的生活方式	未
琉球群岛附近发生5.3级地震 震源深度10千米	未
琉璃河现非洲猪瘟疫情！	未
//@琛司机://@有时右逝:比起现实，我算什么作家呀//@专业戳轮胎熊律师: 逮虾户//@克羅迪厄斯柒世: //@夜語菲://@飞龙翩翩:	未
@琢磨先生 和@老道消息 被封我以后都不敢说话了！	未
琪金十周年，价格回到十年前	未
琯头人注意！地震！6.2级！ 震感强烈！	未
琳琅满目！发烧友收藏Xbox One所有官方发行手柄在去年制作了2017版的视频过后，狂热的Xbox爱好者在2018年又带来了新的视频，向大众们展示了微软过去所发行过的Xbox One平台的全部官方手柄详情点击：琳琅满目！发烧友收藏Xbox One所有官方发行手柄	未
//@琳琅荷塘:是的。	未
琴师三火一曲《断肠人》送给隔壁40暴击的弟弟二口女，那一串串白字伤害笑得人面树牙齿直漏风。反观我红方，铁加伤，兵佣嘲讽，珍珠套盾，你的暴风雪能刮得进来吗你蓝急得乱敲打狗棍，我红徐徐图之，稳重求胜。你看到蓝方脑袋上的那朵花了吗你蓝死之时我红所植也，今已亭亭如盖矣。	未
琴心剔透丨 走，到高山农家乐去	未
琼中旅游扶贫助村民端起金饭碗 村民感慨：我嫁给的“苦日子”变甜了	未
琼人闹世不要瞧不起任何人，因为你不知道下一秒会发生什么	未
琼人闹世你想去的地方别人都去过，你爱的人别人都说过！	未
琼岛  雨淅沥沥 雾朦胧胧	未
琼州神庙海南省定安县定城镇春内村罗汉庙	未
琼州神庙海南省定安县定城镇潭榄冼太夫人庙	未
琼州神庙海南省海口市琼华村邓关庙定远古庙	未
琼州神庙海南省海口市长流镇博抚村社主庙	未
琼斯打进乌龙球	未
琼海三市一区指挥部牵头处理金海西一路污水溢流投诉件	未
琼海市公安局探索实施路长制地网天网工程勤务纪实（视频）	未
琼海此处持证相亲，了解一下！	未
琼海这个62800006电话号码太牛了，关键时候能救急，你存好了吗	未
琼海陈氏理事会举行工作会议	未
琼瑶剧金牌女配李丽凤逝世 陈妍希悼念：一路走好	未
琼聊夜话 灵魂拷问：还有十几天就跨年了。。。年初你的憧憬和计划。。。实现了吗	未
瑚动时间 你对现在身份证上的照片满意吗你目前的身份证有效期是多少年身份证相片可重拍3次	未
瑚教授的突然科普戴口罩的正确方法一洗：首先，清洗双手，以免不干净的手污染口罩内面二挂：将口罩横贴在脸部口鼻上，用双手将两端的绳子挂在耳朵上三拉：双手同时向上下方向将口罩的皱褶拉开，使口罩能够完全覆盖住口鼻和下巴四压：最后，用双手的食指紧压鼻梁两侧的金属条，使口罩上端能够紧贴鼻梁。错误示范如下	未
瑚教授的突然科普戴口罩的正确方法一洗：首先，清洗双手，以免不干净的手污染口罩内面二挂：将口罩横贴在脸部口鼻上，用双手将两端的绳子挂在耳朵上三拉：双手同时向上下方向将口罩的皱褶拉开，使口罩能够完全覆盖住口鼻和下巴四压：最后，用双手的食指紧压鼻梁两侧的金属条 ...全文	未
瑚瑚也想出门放风	未
瑚瑚发现了单纯的播天气，已经满足不了大家的需求，你们需要的，是点播天气，点啥是啥的那种	未
瑚瑚知道，大家看到武汉不能飘起你们期望的大片雪花，有些失望其实没有人比预报了这场雪的我们更希望它能如约而至的了下雪需要合适的气温水汽相互配合，当达到某个平衡点，才会下雪昨天武汉水汽充足，但气温不够低今天武汉气温合适，可是本应发展起来的水汽条件，却没能发展起来，最终未能形 ...全文	未
瑚瑚知道，大家看到武汉不能飘起你们期望的大片雪花，有些失望。其实没有人比预报了这场雪的我们更希望它能如约而至的了。下雪需要合适的气温水汽相互配合，当达到某个平衡点，才会下雪。昨天武汉水汽充足，但气温不够低。今天武汉气温合适，可是本应发展起来的水汽条件，却没能发展起来，最终未能形成大家期盼的雪。因为天气形势是不断变化的，预报结论也会相应的做出改变，我们能做的，是不断根据最新的天气形势，订正预报，让它越来越准确各位买好了铲子约好了火锅预订了温泉改变了行程甚至怕下雪堵车昨晚特地开了酒店房	未
《瑜伽师地论》菩萨戒：四十三轻戒（5） ：五不受重宝施戒	未
《瑜伽师地论》菩萨戒：四十三轻戒（6） ： 六障法施戒	未
瑞丽市公安机关召开打私百日攻坚专项行动部署会	未
瑞典Blueair空气净化器粉尘浓度居高不下（误报）	未
瑞典和谈结束，沙特联军总体占优，胡赛武装手上有更多谈判筹码	未
瑞典哥德堡市街头的Nintendo Switch灯箱广告。广告中间的瑞典语意思是有超过一千款游戏。	未
瑞典投资数百万教移民如何正确的与金发女性发生性关系随着瑞典移民与难民的日益增多，强奸连续6年欧洲第一。瑞典政府投资数百万建立了Youmo网，教移民如何正确与金发女性发生性关系，该网站的目标是教导移民健康，性和性别平等。该网站通过阿拉伯语，达里语，索马里语等教导移民如何和金发女郎恋爱，并提供恋爱指数测试和性知识科普。	未
瑞典报纸管圣诞节不叫圣诞节，叫冬季庆典 引发争议俄罗斯媒体报道，瑞典媒体Sydsvenskan在报道圣诞节相关新闻时，使用政治正确的冬季庆典来取代圣诞节一词，引发广泛争议网友讽刺道：圣诞节改名了好的吧，我要在我家的冬季树下打开我的冬季礼物啦还有网友说： ...全文	未
瑞典报纸管圣诞节不叫圣诞节，叫冬季庆典 引发争议俄罗斯媒体报道，瑞典媒体Sydsvenskan在报道圣诞节相关新闻时，使用政治正确的冬季庆典来取代圣诞节一词，引发广泛争议。网友讽刺道：圣诞节改名了好的吧，我要在我家的冬季树下打开我的冬季礼物啦还有网友说：要如何防范恐怖分子袭击，只需把圣诞节改名为冬季庆典就行，这样恐怖分子就不会不开心了。	未
瑞典教授派雇佣军杀入IS控制区，“抓学生回写论文”	未
瑞典最新研究：患有饮食紊乱症的女性更可能是“小偷”	未
瑞典朋友说小时候去广州爷爷家，附近有9路汽车，亲戚们说是狗路黑车。吃饭是塞饭，喝汤是羊汤。好靓的广东话。	未
瑞典海军quot维斯比quot隐身导弹护卫艇K-35卡尔斯塔德号。维斯比(Visby)级是是世界上第一种采用全隐身设计的导弹艇（也被称为轻型护卫艇），排水量约620吨，兼有反舰反潜水雷作战等多种功能，而且火力强大。武器配备包括八联装RBSl5 Mk2反舰导弹系统1座博福斯SAK MK3型57毫米隐身舰炮，4具400毫米鱼雷发射管和巴姆塞RBS23舰空导弹。导弹艇主要用于近海攻击和防御作战，或在其他兵力的协同下，以编队或单艇对敌方大中型水面舰艇实施导弹攻击，也可用于巡逻警	未
瑞典海岸搜救队，在瑞典整个国家，共有四个基地，分别负责瑞典沿海的搜救服务。位于斯德哥尔摩市郊的东海岸基地，大门口，可以清晰地看到SAR的标志和LOGO，就是英文search and rescue的简称，意为搜索和救援。整个飞行队占地不大，就一个机库，机库一边是大门供直升机出入，另一边则分两层，一楼是办公区域，二楼就是生活区。1名指挥员1-2名飞行员2名任务员1名机务人员，也就6-7个人，就能够让救援队顺利运作了。	未
瑞典研究：养娃延年益寿 父母能多活近2年	未
瑞典萨博公司试图打开日本市场拟向其推售电子战吊舱	未
瑞士三角巧克力获清真认证，欧洲极右翼怒了	未
瑞士三角获清真认证，惹怒欧洲极右翼今年4月，瑞士伯尔尼生产的三角巧克力获得了清真认证，在发现这一点后，欧洲部分极右翼坐不住了。据CNN，德国选择党认为，此举体现了欧洲的伊斯兰化，《世界报》称此事可被视为对伊斯兰教的屈服。不少国外网民也不认同，推特上也出现了抵制瑞士三角的标签。 对此，生产厂商亿滋回应：（清真）认证并没有对三角巧克力的原始配方做出任何改变，这意味着更高的食品安全标准。	未
瑞士三角获清真认证，惹怒欧洲极右翼今年4月，瑞士伯尔尼生产的三角巧克力获得了清真认证，在发现这一点后，欧洲部分极右翼坐不住了。据CNN，德国选择党认为，此举体现了欧洲的伊斯兰化，《世界报》称此事可被视为对伊斯兰教的屈服。不少国外网民也不认同，推特上也出现了抵制瑞士三角的标签。 对此，生产厂商亿滋回应：（清真）认证并没有对三角巧克力的原始配方做出任何改变，这意味着更高的食品安全标准。 瑞士三角获清真认证，惹怒欧洲极右翼	未
瑞士与英国签署航空协议 为英国“脱欧”做准备	未
瑞士农场主的中国情结	未
瑞士又出变态胶水，连钢铁都能接！	未
瑞士富尔卡山口半山腰上的一个小旅馆	未
瑞士小伙留学清华后为何来重庆创业？秘密在这里	未
瑞士小镇	未
瑞士微博视频	未
瑞士必坐的少女峰火车	未
瑞士滑雪季这人间天堂一般的小镇，来过一次就不想离开	未
瑞士独旅（via 豆友bibabo的相册：网页链接）	未
瑞士的一个小镇，Grindelwald。 .	未
瑞士的一个小镇，Grindelwald。这里的夜晚，可能就是一个童话故事吧	未
瑞士的九寨沟  Blausee蓝湖	未
瑞士的劳特布鲁恩小镇	未
-瑞士的雪	未
瑞士研制的灭蟑螂神器！一滴一窝端，一支管半年！	未
瑞士贝特默阿尔卑Bettmeralp，是个禁止汽车通行的村庄，只能通过空中索道才能到达这个冰川上的村庄。图schweiz 爱旅行	未
瑞士雀巢日本三得利挪威芙丝水世界各国著名的食品品牌你知道多少	未
//@瑞奇_Issak:Eww//@中华男德讲师麦乐囧://@胡翌霖://@区块链编年史: 转发微博	未
瑞媒：中国将成最大冬季运动国家	未
瑞安11月26日至12月2日停电安排，有你家么	未
瑞安12月3日至12月9日停电安排	未
瑞安一厂房被查！8000双假鞋拉了四辆大卡车	未
瑞安一奶奶心真大，凌晨把小孩锁车内去搓麻将	未
瑞安一箱包厂起火，2人被抓	未
瑞安一轿车冲进河里，车里还有3个老人	未
瑞安中润广场S公馆出事啦！	未
瑞安市11月26日至12月2日停电计划	未
瑞安市12月3日至12月9日停电安排	未
瑞安市气象台发布冷空气消息，高山地区局部有雨夹雪！	未
瑞峰镇趁着赶场天来了一场反恐防恐宣传	未
瑞年出事了！嵊州人熟悉的品牌，没想到背后竟在做这个事情	未
瑞幸9个月亏损8亿瑞幸咖啡财务数据首度曝光：前9个月净亏损8.6亿元 毛利率为-115.5据瑞幸咖啡B轮融资商业计划书显示，2018年前9个月，瑞幸咖啡累计销售收入3.75亿元，净亏损8.57亿元，毛利润-4.33亿元（毛利率为-115.5），据悉，瑞幸咖啡的对标对象星巴克的毛利率则已连续5年超过50。根据瑞幸咖啡的规划，未来相当长的一段时间仍需要通过烧钱换市场。瑞幸咖啡财务数据首度曝光：前9个月净亏损8.6亿元	未
瑞幸9个月亏损8亿这种烧钱模式很典型的，也非常值得投资者思考。靠纯粹的补贴抢占市场，希望用户形成习惯，但实际上一旦优惠券力度小了，马上就是消费人群流失。所以，其实际上就是不断地烧钱扩张市场，足够大了，就有风投进来，然后继续扩张。直到可以上市了，套现股民，就算创业成功了。但资金链 ...全文	未
瑞幸会不会成为下一个ofo	未
瑞幸咖啡b轮融资2亿美元不容易啊，现在连巨头星巴克都开始利润减少了，真看不出瑞幸的优势在哪里	未
瑞幸咖啡B轮融资2亿美元 半年估值翻倍至22亿美元除中金公司是新加入的投资方，其他投资方均为A轮融资投资方，瑞幸咖啡对资金的需求与其长期实行补贴战不无关联，近期，瑞幸咖啡将北京上海两地的免外送费门槛从35元升至55元 瑞幸咖啡B轮融资2亿美元 半年估值翻倍至22亿美元	未
瑞幸咖啡财务数据首度曝光：前9个月净亏损8.6亿元据瑞幸咖啡B轮融资商业计划书显示，2018年前9个月，瑞幸咖啡累计销售收入3.75亿元，净亏损8.57亿元，毛利润-4.33亿元(毛利率为-115.5)。据悉，瑞幸咖啡的对标对象星巴克的毛利率则已连续5年超过50。根据瑞幸咖啡的规划，未来相当长的一段时间仍需要通过烧钱换市场你看好瑞幸吗	未
瑞幸咖啡财务数据首度曝光：前9个月净亏损8.6亿元据金融求职与培训服务商CareerIn获悉的瑞幸咖啡B轮融资商业计划书显示，2018年前9个月，瑞幸咖啡累计销售收入3.75亿元，净亏损8.57亿元，毛利润-4.33亿元（毛利率为-115.5）详情点击：瑞幸咖啡财务数据首度曝光：前9个月净亏损8.6亿元	未
瑞幸咖啡财务数据首度曝光：前9个月净亏损8.6亿元 毛利润-115.5据瑞幸咖啡B轮融资商业计划书显示，2018年前9个月，瑞幸咖啡累计销售收入3.75亿元，净亏损8.57亿元，毛利润-4.33亿元（毛利率为-115.5），据悉，瑞幸咖啡的对标对象星巴克的毛利率则超过50。根据瑞幸咖啡的规划，未来相当长的一段时间仍需要通过烧钱换市场。该公司预计2018年收入7.63亿元，2021年达185亿元，为今年的24倍。据《北京商报》报道， 瑞幸咖啡8月份的用户数为130万，极光大数据在8月31日的	未
瑞幸咖啡财务数据首度曝光：前9个月净亏损8.6亿元 毛利润-115.5据瑞幸咖啡B轮融资商业计划书显示，2018年前9个月，瑞幸咖啡累计销售收入3.75亿元，净亏损8.57亿元，毛利润-4.33亿元（毛利率为-115.5），据悉，瑞幸咖啡的对标对象星巴克的毛利率则超过50。瑞幸咖啡财务数据首度曝光：前9个月净亏损8.6亿元	未
瑞幸咖啡财务数据首度曝光：前9个月净亏损8.6亿元 毛利率为-115.5据瑞幸咖啡B轮融资商业计划书显示，2018年前9个月，瑞幸咖啡累计销售收入3.75亿元，净亏损8.57亿元，毛利润-4.33亿元（毛利率为-115.5），据悉，瑞幸咖啡的对标对象星巴克的毛利率则已连续5年超过50。根据瑞幸咖啡的规划，未 ...全文	未
瑞幸完成2亿美元B轮融资，瑞幸回应收缩补贴传闻：意在鼓励到店12月12日瑞幸宣布完成2亿美元B轮融资，投后估值22亿美元。就瑞星咖啡收缩补贴烧钱告急传闻，瑞幸回应：随着门店覆盖密度的提升，客户到店自提更加方便，适当调高免费配送门槛，能够鼓励更多的用户到店自提，这样能避免浪费，既经济又环保。	未
瑞幸宣布2亿美元融资 堵嘴“收缩补贴”风波	未
瑞幸宣布新融资堵嘴“烧钱告急” 称适度调整补贴鼓励更多到店	未
瑞康医药拟2亿元-4亿元回购股份 回购价不高于13元/股	未
瑞康医药：拟2亿元至4亿元回购股份	未
瑞恩高斯林带女儿洛杉矶外出	未
瑞昌供水发布11月29日停水通知，范围如下请互相转告！	未
瑞昌供水发布低温自来水管防冻提醒，附抢修热线！	未
瑞昌供电公司11月27日停电通知，范围如下请互相转告！	未
瑞昌供电公司11月29日停电通知，范围如下请互相转告！	未
瑞昌供电公司12月2日停电通知，范围如下请互相转告！	未
