甘肃要闻甘肃公布集中式饮用水水源地保护情况记者从省生态环境厅获悉，根据生态环境部水利部《关于印发全国集中式饮用水水源地环境保护专项行动方案的通知》（环环监201825号）和《关于做好全国集中式饮用水水源地环境保护专项行动相关信息报送和公开工作的函》（环办环监函201870号）要求，省生态环境厅将我省今年11月份地表型饮用水水源地存在问题整改进展情况进行公告，请社会各界监督。我省公布集中式饮用水水源地保护情况	未
甘肃要闻 覆盖大兰州都市圈9区18县 环兰城际铁路网规划通过审议近日，兰州市发改委组织稽查工作组对兰州市轨道交通公司的环兰州城际铁路线网规划项目进行了稽查。稽查发现，项目前期工作进展顺利，线网规划主报告已编制完成，并经兰州市政府常务会审议通过，正在上报省政府审查。这标志着覆盖大兰州都市圈9区18县及周边相关区域的城际铁路建设迈出了实质性一步。网页链接	未
甘肃谁认识这一家子今天都在看	未
甘肃身边事甘肃正能量下午救老人晚上捡手机12月12日22时，兰州城关区环卫局保洁三公司的保洁员刘秀霞在盐场堡十字进行保洁作业时，看到不远处有一片纸，迅速上前去捡，却发现地面上的并不是纸，而是一部手机。已经晚上10点多了，刘秀霞在原地等了很久见无人来寻，就于当日下班前交回站队办公室。12月13日早上，站队工作人员与失主联系确认，并将手机归还失主。失主是一位五十多岁的女士，她说手机里有很多重要的联系人，很感谢保洁员。记者了解到，就在同一天下午，刘秀霞在扫马路保洁时，突然发现一位老人在过马路时	未
甘肃车祸，小车冲上房顶，吓人！	未
甘肃、辽宁连打两“老虎”(图/简历)	未
甘肃酒泉戈壁滩广育南北果蔬 建全国和中西亚“菜篮子”	未
甘肃金桥劳务股份有限公司关于公开招聘基层社会救助经办服务人员的公告	未
甘肃铁路运输40载：民众“说走就走”货物“由黑变白”	未
甘肃银行超1亿股将被拍卖	未
甘肃阿克塞丹霞地貌“藏在深山人未识”	未
甘肃阿克塞成群“岩壁精灵”岩羊雪地觅食	未
甘肃陇南40载密织“交通网”：昔日蜀通难 今日可飞越	未
甘肃陇西宏扬空竹队李永凡蜘蛛脱网	未
甘肃：陈娟娟，你在哪里母亲今天下葬，急盼回家！	未
甘肃陈娟娟，母亲下葬，请速回	未
甘肃降雪，多路段交通管制！	未
甘肃靖远受惠“母亲河” 农旅融合“厚积薄发”	未
甘肃靖远推枸杞品牌拓市场 农户称“种植不吃亏”	未
甘肃首个进境水果和进口冰鲜水产品指定口岸正式开通运营	未
甘肃高台黑河湿地成候鸟越冬“天堂”	未
甘肃高官被降至副处 曾是王三运及虞海燕同事	未
甘肃高速公路ETC网点入驻车管所  兰州两邮政网点可补换驾照	未
甘蓝、卷心菜和西兰花防结肠癌	未
//@甘蔗少年:每天捞一捞！早啊	未
甘谷历史名人都在这里......	未
甘谷新兴中学一学生走失，家人万分着急！	未
甘谷最新道路交通管制，关系到你的出行	未
甘谷车主注意：这条道路施工，过往车辆请绕行！	未
甘谷这么多单位和人齐聚大什字广场，为了......	未
甘谷这些地方未来几天停电	未
甘露：从军校教师到海关三级关税专家	未
甚至可以以红土地站大停电为题材拍灾难恐怖片（。	未
甜//@东京80W萝莉总教头海豹Yuki酱:原著梗发红包，原著里好像拿着赵云澜的微信把他一个月的工资都当红包发出去了，乐//@小甜饼漫漫:甜啊//@一枚小桃子君:520//@就爱喋喋不休的喵:全程姨母笑的看完了，太甜了	未
甜到晕倒//@啵啵丸子宝://@54白火山:旋转跳跃	未
//@甜吹:好甜啊//@心尖上一点干干净净地放着你:怎么是粉色的虽然好好看//@云梦小哥哥:为什么是粉色的雪//@暴躁少女继安跳起来并打爆你的头:我以为是肉	未
甜味蛋白微藻粉这些将会是主导未来的食品新科技	未
甜哭我了//@惨绿少年金三坨:加了多少糖啊甜死了	未
甜心穿的这个大灰狼羽绒的另外一个色梅子色大家知道链接吗 评论里面找吧	未
//@甜柚子呀:啥玩意儿//@糖2沫:。。。。。我打开了我许久未登陆过的5sing听一下绝响和色禁，试图给自己洗脑。	未
甜甜！我要投稿室友的爱情！虐死我们了室友和他男朋友是异地恋然后昨天夜里我们这里下了第一场雪，还上了热搜，室友跟他男朋友打电话的时候提到下雪了！然后！她男朋友就买了今天早上五点的火车票来看她！quot我要陪你看第一场雪啊quot初雪，要去做喜欢的事，去见喜欢的人	未
甜甜的//@TiTo先生:幸好有你	未
甜甜的小西西 微博视频	未
甜美小花自称奇葩我们瞄到了一个对表演超严苛的处女座	未
@甜蜜密私房甜品：坐公交车回家，遇到不文明行为，在公交车吸烟，公交车应该是禁烟的吧，怎么就有些人不能遵守规则	未
甜蜜的情侣网页链接	未
甜食应在早餐吃	未
生三子还未嫁入豪门的吴佩慈应该学学这些女人	未
生于1978 | 孙长征：做这一行就是以命换命	未
生于一九七八	未
生于妓院的他们曾站上奥斯卡领奖台，如今却有人定居美国，有人沦为红灯区头牌	未
生产日期“易除抹”不是个小问题	未
生产计划管理PPT	未
生产车间现场管理一文搞定！	未
“生人勿近，后果自负”，狗咬伤人后主人说有警示牌	未
生人可以变成熟人，但是熟人如果变成了生人，会比生人还生分 《陆垚知马俐》	未
生儿子就免不了操心这个问题：包皮到底怎么料理才好呢网页链接	未
生儿子有何用，今早榆林都在看这个儿子和母亲视频！	未
生儿子有何用，大家都在看这儿子和母亲视频！	未
生儿子有啥用，朝阳沈阳大连 ...东北人都看看这个儿子与亲妈的视频	未
生前不孝，死后胡闹！	未
生前没孝，死后乱叫！	未
《生化危机2 完全重制版》将在下个月（1月1131日）推出一个名为 1-Shot Demo 的体验版，虽然你可以随心所欲的玩，但你只有30分钟的时间来完成这个体验版。本作正式版将在2019年1月25日推出。	未
《生化危机2：重制版》主要角色与丧尸们的设定图：	未
《生化危机2：重制版》发售前将举行直播 公布新情报和演示近日卡普空宣布，将于2019年1月22日举行《生化危机2：重制版》发售前特别直播节目。在节目中将带来游戏新情报以及实机演示，还有特别嘉宾最上出场展开访谈等。在直播会场除了游戏周边和海报展示外，还将分发限定周边。观众还能获得《生化危机2：重制版》男前豆腐店的联动商品USB腕带。《生化危机2：重制版》将于2019年1月25日发售，登陆PS4Xbox One和PC平台。	未
《生化危机2：重制版》将添加孤儿院场景卡普空确认《生化危机2：重制版》中会添加一个新的场景供玩家探索浣熊市的孤儿院。该场景设置在孤儿院的儿童活动中心里，有很多彩色的玩具和地毯，但在灾变之后都显得十分灰暗。目前尚不清楚该区域是否只能用来探索搜刮，还是说其中会有一些尸变的小孩。已有几张相关场景图片泄露，从中可看到玩家应该是可以操纵小女孩雪莉进行探索的。	未
《生化危机2 重制版》艾达王海报	未
《生化危机2：重制版》评级17：过场动画含大量限制级内容《生化危机2：重制版》在美国评级机构ESRB现身，被评为M级（适合17岁及以上玩家）详情点击：《生化危机2：重制版》评级17：过场动画含大量限制级内容	未
生吃花生米好不好专家给出答案，原来我们都被骗了！	未
生呛小白虾 微博视频 wave	未
生命只有一次！不闯红灯，是对自己的负责，也是对家人的负责！和@TFBOYS-王源 一起响应号召，做遵守交通的人哦	未
生命在于勤运动关节却需“省着用”	未
生命安全无小事，台铃一直在行动！	未
生命延续！男孩因车祸脑死亡 把心脏留给了67岁老太太一场不幸的车祸，让男孩的生命定格在了20多岁。而他的心脏捐献给了一位在郑州人民医院等待换心手术的李女士女士。幸运的是手术很成功，男孩的心脏为老太太带来了新生。就这样，生命的长度以另一种形式延续。20多岁男孩因车祸脑死亡 把心脏留给了67岁老太太	未
生命是平等的，所有物种和人类是生命共同体保护野生生物，就是保护我们自己12月8日，由@经济观察报 和@广汽丰田 联合举办的践行听自然之道校园分享会暨高校环保辩论大赛在华南理工大学圆满落下帷幕一直致力于自然生态摄影的顾莹老师通过影像告诉我们：动物的野性是自然界赋予他们的生存方 ...全文	未
生命是平等的，所有物种和人类是生命共同体。保护野生生物，就是保护我们自己。12月8日，由@经济观察报 和@广汽丰田 联合举办的践行听自然之道校园分享会暨高校环保辩论大赛在华南理工大学圆满落下帷幕。一直致力于自然生态摄影的顾莹老师通过影像告诉我们：动物的野性是自然界赋予他们的生存方式，不要以人类的文化方式去解读动物世界发生的事情，要尊重自然生命本来的样子。让我们更加真切地感受到野生动物的生存状态和环保的重要性。而高校学子的3场环保辩论赛则让我们对环保有了更多不一样的思考：也许我们不能准确定义和阐释环	未
生命是要看清楚的	未
生命最后一刻停稳28吨油罐车11月21日晚，年仅51岁的辽河油田沈阳采油厂机动采油大队罐车司机张善哲，驾驶中突发疾病。在生命的最后一刻，他忍着剧烈的疼痛，将12米长载有28吨热油的油罐车稳稳停在路边，一头栽在方向盘上，再也没能起来。 生命最后一刻停稳28吨油罐车	未
生命最后十几秒！他忍剧痛拉手刹打双闪，至死牢牢踩着油罐车脚刹！11月21日，辽河油田沈阳采油厂司机张善哲驾车执行运输任务时，突发脑动脉血管瘤破裂在生命的最后一刻，张善哲忍着剧烈疼痛将12米长载有28吨热油的油罐车停在路边后，一头栽在方向盘上，但一只脚却牢牢地踩着脚刹油罐车安全 ...全文	未
生命的意义在于过好平淡  美文摘抄	未
生命的最后十几秒，他做了这个决定（人民日报）	未
生命线（二）接上条。	未
生命赞歌追记因公殉职的榆中县三电工程水利管理处党委书记张卫东	未
生命进入倒计时，她这样选择	未
生命通道岂能被堵塞！	未
生命里有门功课，名叫quot接受quot：接受爱的人离开，接受亲的人离世，接受喜欢的人无论如何也不喜欢自己，接受喜欢的人无论如何也不能在一起以及接受自己的出身相貌天份。无论活多大，每一次在接受面前，我依就像个只会嚎哭的孩子区别是，长大的自己会对自己说接受，是变好的开始 青音	未
生处转熟熟转生，业力消处道力生	未
生女儿后，婆婆让我坐了个牢狱般的月子...	未
生如夏花：等你，在这个冬天	未
生如逆旅单行道，哪有岁月可回头。	未
生姜，我劝你善良//@宝榛的动物园儿ww:希望你们生姜能有自己的生活//@神经病有所好转:被姜骗了许多次，依旧认不出来	未
生姜的孪生兄弟来崇明了快看看它是谁！	未
生娃不再承受10级疼痛 无痛分娩将在全国推广	未
生娃养老医保，年底了，这八个政策变化你知道吗	未
生娃后我做过最错的事，就是千不该万不该不该乱转奶	未
生存手册之那些被忽视的致命危机时有发生的电梯安全事故让人不安，除了乘坐电梯之外，人们在办公室马路上等诸多公共场所里，都可能会遇到一些意想不到的致命危机。如何更好的保护自己，看官请注意：	未
生孩子不再那么痛了，这项技术全国试点！厦门这些医院可以做	未
生孩子前怕孩子缠着老公自己会气死。生完了 巴不得她缠着老公。缠谁谁倒霉！	未
生孩子怕疼？ 无痛分娩了解一下！	未
生孩子，明明知道痛，可却还是生了。投资，明明知道有风险，但还是投了一点都不想付出，却想着月入过万，十几万那是做梦了。成功人的两会：开会培训会。普通人的两会：约会聚会。穷人的两会：这也不会，那也不会。奋斗的人两会：必须会，一定得会！送给自己 。	未
生孩子是一种什么样的体验 听说生孩子比蛋疼疼一百倍，那生之前害怕吗，生的时候怎么熬下来的已经当妈妈的来分享一下吧	未
生孩子有补助了！2019年1月起实施	未
生孩子有补助了！明年1月起实施，南通属于这档！	未
生孩子的时候AA制了吗怀孕你怀五个月 他怀五个月，喂奶他喂一天你喂一天这个样子生完孩子老公要求aa制	未
生完二胎去妊娠纹，一万八后再一万效果她却不满意	未
生完孩子体重增加 女子连吃5年减肥药致精神障碍生下孩子后，身高165厘米的慧女士体重达到130斤，于是决心减肥。5年前她痴迷上一款减肥药。没想到减肥药吃成精神障碍，出现了怀疑自己被跟踪监视满屋子寻找针孔摄像头怀疑丈夫跟女邻居有染而多次上门吵闹等一连串奇怪举动gtgt女子连吃5年减肥药成神经质 医生:别太狠	未
生完孩子含胸驼背胸下垂！体态变差是显老的开始，解决的方法是...	未
生完孩子老公要求aa制关于AA制！你是如何知道这个概念的我是九十年代从《读者》等杂志得知的，中国人虚伪，喜欢抢买单，显得大方，外国人真诚，各付各的，关系简单。后来我就发现AA制源头是自私，所以还是无法适应中国传统文化，细想一下，AA制其实是防止小人的。至于婚姻生活要搞AA制，那又何必结婚生了小孩，女人天然比男人负担要重许多，怎么AA	未
生完孩子老公要求AA制合理吗你能接受恋爱和婚后AA吗	未
生完孩子老公要求aa制既然组成家庭了，那就不是一个人的事。我想这对夫妻谈恋爱的时候就应该是aa制了，这种各怀鬼胎的自私人结婚可以，根本就不适合要孩子。恕我直言，现在aa制的家庭，多是追求独立平等到魔怔的年轻人，男女天生生理结构和社会角色就注定不可能完全平等，等结婚后遇到各种实际问题才知道委屈。要我说自己选的配偶谁也别怪，送你们俩字：活该。	未
生完孩子老公要求AA制有人说，谈钱伤感情其实不谈钱，就没感情。一个男人值得不值得爱，就看他怎么和你谈钱，你就知道了。钱和情都是一样的东西，都是资源，一个人如果没有合作精神，只有自恋，那么你的所有付出都有可能打水漂亲兄弟明算账，何况夫妻结婚前不把一切谈好了，下场就是如此。	未
生完孩子老公要求AA制生完孩子老公要求AA制 举动令人心寒首先必须搞清楚，这AA制谁先提出来的，如果是男人的主张，那么这样的男人他本不该娶老婆，活该一辈子光棍...如果是女人先提倡的，那是你自己酿的酒，苦点也得喝。夫妻生活AA制意味着各自为政，各自为私，你从来不知道吗	未
生完孩子老公要求AA制生活开销 妻子：他又不差钱近日，陈小姐称自己刚生完小孩一个月，在休产假，工资缩水，本想让老公支付这几月开销，没想到老公却要求她之后还给他陈小姐说，老公月入一万五并不差钱，虽婚后一直是AA制，但老公的不懂变通让她感到心寒（都市热报 @人民网） ...全文	未
生完孩子老公要求生活开销AA制 妻子：他又不差钱近日，陈小姐称自己刚生完小孩一个月，在休产假，工资缩水，本想让老公支付这几月开销，没想到老公却要求她之后还给他陈小姐说，老公月入一万五并不差钱，虽婚后一直是AA制，但老公的不懂变通让她感到心寒老公每月工资一万五，我生孩子休产假，他却要和我AA制生活开销 这事你想说	未
生建园区党支部组织志愿者速效清淤	未
生态唐山  唐山市曹妃甸区开展创业大街迎宾路两侧拆违集中行动！	未
生态武汉新推出的《指南》扩大了保护范围，将水域植被等野生动物赖以生存的栖息环境也纳入保护主体。《指南》明确提出：远离是最好的保护，不惊扰破坏野生动物的栖息生活环境不践踏采摘野生动物赖以生存的自然植被不捕杀不食用不放生任何动物等等。 东湖发布最新《野生动物保护指南》，让一鸟一兽自由生活	未
生态武汉罕见候鸟聚集东湖，这里是城市中心的鸟类天堂近两周，天气虽然寒冷，但东湖两大景区马鞍山森林公园以及听涛景区内，频频出现大量候鸟纷飞的壮观景象。作为城市中心的鸟类天堂，东湖的生态野趣吸引了不少观鸟爱鸟摄影师来享受观鸟周末。目前，东湖风景区正在对周边33个湖边塘进行水质清理和提升，将塘中的水排出，目的是方便将塘底淤泥清掉，保障东湖以更好的水环境迎接军运会。	未
生态环保365  12月1日0时启动空气重污染黄色预警	未
生态环保365  生态环境部门严查高排放非道路移动机械	未
生态环保365  空气重污染黄色预警  北京严管工地扬尘	未
生态环保  人民网报道：《 张汉锋：当好河流管家》	未
生态环保  人民网报道：《 邱小梅：管河治水有三铁》	未
生态环保督察回头看中央环保督察批荆州市平时不作为，病急乱投医中央生态环保督察回头看11月4至6日，督察组到荆州市开展下沉督察督察发现，荆州市城区生活污水直排问题整改不力，甚至表面整改，对沿河沿渠排污口一堵了之，造成生活污水倒灌城区街面，群众反映强烈  ...全文	未
生态环保督察回头看  中央环保督察组：贵州黔西南州兴仁市敷衍整改	未
生态环保督察回头看  中央环保督察组通报吉林一水源地保护区3.7万株生态涵养林被砍伐（新华社）	未
生态环保督察回头看  中央生态环保督察下沉 四地假装整改现原形	未
生态环保督察回头看中央生态环保督察组批荆州市：平时不作为，病急乱投医	未
生态环保督察回头看  安徽亳州一副镇长微信群直播督察 为企业放哨	未
生态环保督察回头看  宝鸡市部分县区不作为滥作为 简单粗暴一刀切	未
生态环保督察回头看  平时不作为病急乱投医 湖北荆州治理生活污水直排靠封堵排污口（每日经济新闻）	未
生态环保督察回头看  湖北省严禁环保一刀切行为	未
生态环保督察回头看  贵州多家黄金企业环保意识淡漠被督察组点名	未
生态环保督察回头看  贵州多家黄金企业环保意识淡漠被督察组点名（第一财经）中央生态环保督察回头看贵州省黔西南州被誉为中国金州，为开发该州兴仁市境内的黄金资源，中国黄金集团科技有限公司与贵州省兴仁市黄金公司共同出资组建贵州金兴黄金矿业有限责任公司因环保意识淡漠 ...全文	未
生态环保督察回头看  贵州多家黄金企业环保意识淡漠被督察组点名（第一财经）中央生态环保督察回头看贵州省黔西南州被誉为中国金州，为开发该州兴仁市境内的黄金资源，中国黄金集团科技有限公司与贵州省兴仁市黄金公司共同出资组建贵州金兴黄金矿业有限责任公司。因环保意识淡漠监管不力工作失察，两家公司及其共同组建的金兴公司被中央环保督察组点名批评。 贵州多家黄金企业环保意识淡漠被督察组点名	未
生态环保督察回头看  贵阳市召开专题会议 研究部署开阳县洋水河流域总磷污染问题整改工作	未
生态环保督察回头看  辽宁省鞍山市台安县多个村庄现危废坑塘 油泥油渣总量达3.5万吨	未
生态环保督察回头看  辽宁鞍山监管不力 3.5万吨油泥油倾倒村庄坑塘	未
生态环保督察回头看  遭遇环保问责之后 泰兴市打响环保整改歼灭战（江苏生态环境）中央生态环保督察回头看  11月28日下午，江苏省泰兴经济开发区内，弥漫了一天的雾气还未完全散去，多名身着黄色隔离工作服戴着口罩的工作人员正在一号桥地段固废处置现场紧张忙碌，一旁的塔吊机挖 ...全文	未
生态环保督察回头看  遭遇环保问责之后 泰兴市打响环保整改歼灭战（江苏生态环境）中央生态环保督察回头看11月28日下午，江苏省泰兴经济开发区内，弥漫了一天的雾气还未完全散去，多名身着黄色隔离工作服戴着口罩的工作人员正在一号桥地段固废处置现场紧张忙碌，一旁的塔吊机挖土机轰隆隆不停运转而在长江内侧的芦坝港，3个原本堆积污水废泥的硕大坑塘已被清理一空，等待进一步生态修复。这两处现场，正是生态环境部6月接连公布的两则问责通报的主角。面对问责，泰兴市委市政府痛下决心，打响环保整改歼灭	未
生态环保督察回头看  郴州应对中央环保督察突击拆除	未
生态环保督察回头看  陕西韩城焦化企业走旁门 治理工程无中生有（第一财经）中央生态环保督察回头看谎称2018年已完成干熄焦改造等治理内容，并以改造方案应对督察组，经核实，根本没有完成干熄焦改造任务环保治理设施空转，假治理，真排污中央第二生态环境保护督察组今（3日）晚通报称，陕西韩城市焦化企业敷衍治理，环境问题突出。 陕西韩城焦化企业走旁门 治理工程无中生有	未
生态环保督察回头看  陕西韩城焦化企业走旁门 治理工程无中生有（第一财经）中央生态环保督察回头看谎称2018年已完成干熄焦改造等治理内容，并以改造方案应对督察组，经核实，根本没有完成干熄焦改造任务环保治理设施空转，假治理，真排污中央第二生态环境保护督察组今（ ...全文	未
生态环保立体化防治法规体系建立	未
生态环境修复费用如何计算？最高法回应	未
生态环境好不好，鸟儿很有发言权	未
生态环境检察公益诉讼理论与实践研讨会在开化召开	未
生态环境部11月例行新闻发布会实录	未
生态环境部：2018年水源地环境问题整治任务完成99%	未
生态环境部一周要闻（11.18-11.24）	未
生态环境部：中央环保督察将围填海纳入督察范畴	未
生态环境部：京津冀本轮重污染过程27日结束	未
生态环境部：全国两类入海排污口98%已完成清理	未
生态环境部：全国两类入海排污口98%已经完成清理	未
生态环境部发展改革委自然资源部联合印发《渤海综合治理攻坚战行动计划》生态环境部发展改革委自然资源部联合印发《渤海综合治理攻坚战行动计划》近日，经国务院同意，生态环境部发展改革委自然资源部联合印发了《渤海综合治理攻坚战行动计划》，明确了渤海综合治理工作的总体要求范围与目标重点任务和保障措施，提出了打好渤海综合治理攻坚战的时间表和路线图。三部委联合印发《渤海综合治理攻坚战行动计划》	未
生态环境部发布环保设施向公众开放宣传片	未
生态环境部召开2018年全国环境应急管理工作暨化工园区有毒有害气体环境风险预警体系建设试点工作推进会生态环境部12月17日在广州召开2018年全国环境应急管理工作暨化工园区有毒有害气体环境风险预警体系建设试点工作推进会生态环境部相关负责人出席会议并讲话生态环境部相关负责人表示，试点园 ...全文	未
生态环境部召开2018年全国环境应急管理工作暨化工园区有毒有害气体环境风险预警体系建设试点工作推进会生态环境部12月17日在广州召开2018年全国环境应急管理工作暨化工园区有毒有害气体环境风险预警体系建设试点工作推进会。生态环境部相关负责人出席会议并讲话。生态环境部相关负责人表示，试点园区在建设运行应用等方面积累了很多成熟的经验，建设的预警体系在应急处置和日常监管中发挥了重要作用。同时，还存在技术不够完善管理措施联动不足等问题。各地要深入推广试点经验，明确责任主体，在管和用上下功夫，充	未
