[生活报料]首列复兴号 驶入盐城！通车的日子近了！	未
生活提示11月23日供气供水施工信息	未
生活提示11月25日供气供电施工信息	未
生活提示11月26日供气供电施工信息	未
生活提示11月27日28日供气供水施工信息	未
生活提示11月28日29日供水施工信息	未
生活提示11月29日供气供水施工信息	未
生活提示11月30日供气施工信息	未
生活提示12月1日供气施工信息	未
生活提示12月5日供气施工信息	未
生活提醒！今年双十一还是留下不少坑，下次可长点心吧！	未
生活提醒：电动车不要乱停乱充电啦	未
生活日历12月份，宿迁这些地方要停电！可能有你家。	未
生活日历注意宿迁这些地方12月份要停电！	未
生活早报  啥情况硕士男嫌工作累，居然转行做了小偷，还专挑高档酒下手结果被刑拘了（视频）	未
生活早报  气人！山东一女生投诉快递不送上门，竟收到2件寿衣！还有1张符咒	未
生活早报  飞来横祸！轿车突然掉头，公交车为避让结果撞死骑车男子！	未
生活是一场修行，前行的路上记得要把希望揣在兜里	未
生活，是一种实实在在的生存	未
生活是以诚信为立身之本，要做到诚信就不要轻易许诺，才能避免更多的误会和误解。那些不经过深思熟虑就答应别人的要求，事后又很难做到，枉添了生活的辛苦，给自己的诚信信用体系造成了更多的麻烦，做一个守承诺重信用重信守本的人。	未
生活是否有太多的负担，压得人喘不过气来想要去释放压力跟着专业级探享SUV维特拉一起出发吧，1.4T BOOSTERJET涡轮增压发动机，百公里加速低至8.4秒，澎湃动力带你摆脱枷锁，释放压抑的灵魂。	未
生活是属于每个人自己的感受，不属于任何别人的看法。	未
生活是要两个人一起相扶相持一起面对的，自然要同心同力。	未
生活晚报  为躲雾霾，大妈们冲进酒店大堂跳广场舞：雾霾过了，请我们也不来！	未
生活晚报这波雾霾啥时候能走省生态环境厅发话啦：预计12月3日全面缓解	未
生活有一点我不是太喜欢	未
生活有点苦，我想给你加点甜	未
生活服务14日起长江二桥匝道将在每周末施工，交管部门发布绕行提示从武汉市公安交管部门获悉，为尽量减少施工对道路通行的影响，长江二桥匝道将于2018年12月14日22时起至2019年1月7日止，利用每个周末时间进行维修施工，为保障施工期间道路通行安全，部分匝道将封闭。14日起长江二桥匝道将在每周末施工，交管部门发布绕行提示	未
生活服务 元旦小长假火车票今天开抢！注意啦！12月1日起，就可以预订元旦的火车票了。2019年元旦放假时间是2018年12月30日31日2019年1月1日共3天。于元旦假期时间较短，武汉铁路部门预计湖北省内宜昌襄阳十堰恩施，以及荆州仙桃等方向的中短途客流将大幅增长，动车及高铁火车票会比较紧张。@武汉铁路	未
生活服务公交505路恢复营运 连通宜家荟聚中心与民意一路暂停运营2年多后，11月22日，武汉公交505路正式恢复营运。恢复营运后的公交505路，重设了线路走向，连通宜家荟聚中心与民意一路。恢复后的公交505路线路单程长19.8公里，单程设置站点28个。线路起点站荟聚中心西门的开收班时间是6时至20时，终点站民意一路的开收班时间为7时至21时。	未
生活服务武汉动物园河马天天泡温泉，鳄鱼盖上厚棉被7日记者从武汉动物园了解到，园内为了让动物园安稳过冬，泡温泉开空调捂棉被等各种保暖措施已一起上阵。动物园内的食草区四巨头长颈鹿大象河马犀牛，是最怕冷的动物。为此，这些大型的食草动物被重点照顾，河马躲进了有暖气的空调房里不肯出来。河马馆里的水池水温达18摄氏度以上，河马可以悠然自得地享受温泉。大象居住的馆舍温度超过25摄氏度，犀牛房里也是暖意十足。鳄鱼盖着棉被，一动不动地享受着温暖。长颈鹿的房间则开着浴霸，铺上了干草，以避免它们患上关节	未
生活服务武汉海关提醒：请勿携带邮寄肉类产品入境国外回来，生肉香肠火腿肉干肉脯等千万不要带入境。从武汉海关获悉，自我国8月初发生首例非洲猪瘟疫情以来，武汉海关筑起口岸查验消毒和处理三道关口，有效防控非洲猪瘟疫情从国外传入，并提醒武汉市民，入境请勿携带邮寄肉类产品。据了解，在武汉天河机场，武汉海关采取人-机-犬三位一体查验模式，对旅客携带物100进行查验，一经发现猪肉产品，依法予以截留。	未
生活服务武汉联动调整非居民用天然气售价记者11月29日从武汉市发改委网站看到，该委发布通知，联动调整武汉非居民用天然气销售价格。市发改委表示，启动武汉非居民用天然气销售价格联动机制，联动调整时间为2018年11月1日2019年3月31日。分两步疏导上游门站价格上涨部分。第一步先期疏导以上游基准门站价格上浮20部分，即联动期间非居民用天然气销售价格按每立方米上涨不超过0.38元的基础上，由各天然气经营企业与下游用户平等协商非居民天然气销售价格。第二步2019年3月31日后，市发改委组织对联动期	未
生活服务汉阳新划1218处单车停车位，可停放5万辆共享单车17日上午，汉阳区龙阳大道欧亚达国际广场旁的人行道上，工作人员正在为共享单车划停车线，引导行人有序停放单车。汉阳区城管委占道设施科相关人员介绍，为规范共享单车停放，该区今年新划共享单车停车点位1218处，可停放5万辆共享单车。他说：我们去年划了900多处单车停车位，效果很明显，大多数市民看见地上有停车线，会主动将单车停进来，规范了单车停放。因此今年再新增1200多处。	未
生活服务 江汉路上无人警局，3分钟内自助补办身份证江汉路警务站有个AI自助服务区，这是全市首家具备身份证人脸识别入门系统和AI智能语音引导系统的服务窗口。这意味着，市民可直接刷脸入场办理业务。江汉区公安分局相关负责人介绍，AI自助服务区24小时无人值守，是一间无人警局，主要以群众自主办理为主，由移动迎宾声控智能机器人全程引导服务，设置触摸一体机身份证自助申请终端港澳签注取证机交通违法自助处理机等设备，打破工作时间界限，实现24小时证件的办理与领取。	未
生活服务硚口区特殊困难老人可享补贴，最高800元/月从硚口区民政局获悉，硚口区民政局近日组织召开特殊困难老年人养老服务补贴工作培训会。该区《实施武汉市特殊困难老年人养老服务补贴的方案》正式印发。硚口区经济困难的失能高龄等特殊困难老年人可申请养老服务补贴。根据《实施武汉市特殊困难老年人养老服务补贴的方案》，硚口区经济困难的失能高龄等特殊困难老年人可申请养老服务补贴。经过评估后，老年人可以享受最低100元/月最高800元/月的养老服务补贴。该补贴以虚拟服务额度的形式充值到quot互联网居	未
生活服务类平台暗藏色情服务 通过点赞评论招嫖11月24日上午，一个题为《吃喝玩乐找性服务，上大众点评》的帖子引发关注，文中称不少招嫖人员通过大众点评，以点赞曝光头像的方式，对嫖客进行性交易引流。美团大众方面就此事回复称，已对相关不良账号进行彻底清理，并将清理下线的全部不良账号提供给公安机关。 生活服务类平台暗藏色情服务 通过点赞评论招嫖	未
生活服务 进博会后，加拿大枫糖西班牙火腿跑步来武汉进博会期间，武汉企业签下大额采购订单。眼下，这些新引进的商品正陆续进入武汉超市。这也意味着，市民将在身边的超市买到越来越丰富的全球商品。有意思的是，对武汉市民而言，新引进的商品似乎并不陌生。 进博会后，加拿大枫糖西班牙火腿跑步来武汉	未
生活服务重要通知！本月所有双休，武汉长江二桥匝道依次维修禁止通行武汉长江二桥桥面维修进入最后冲刺期，今日记者从武汉交管部门获悉，长江二桥8个匝道将在双休日依次分批进行维修施工，施工期间禁止机动车通行。匝道维修施工将在2018年12月7日至2018年12月31日进行。其中，12月7日22时至12月10日5时，长江二桥C匝道（中山大道上长江二桥）B匝道（长江二桥下和平大道）禁止机动车通行12月14日22时至12月17日5时，黄浦立交1号匝道（长江二桥下解放大道二七路）2号匝道（解放大道永清街方	未
生活服务野生芦苇暂别江滩，就地还田入泥待来年再见24日，长江二桥附近汉口江滩芦苇荡里，机声隆隆，大片芦苇和荻花被吃进收割机又到江滩芦苇收割季，游客要和芦花荻花说再见了。干透后的荻花一点即燃，有较大火灾隐患，武汉市江滩办负责人称，收割荻花除了要避开火灾，最主要的目的，还是为了这片荻花来年能更好地生长。	未
.生活本来就是一场恶战 给止疼药也好 给巴掌也罢 最终都是要单枪匹马练就自身胆量 谁也不例外	未
生活本来就是一场恶战 给止疼药也好给巴掌也罢最终都是要单枪匹马练就自身胆量谁也不例外	未
生活本身就累，不愿意接近心眼子多的人。	未
生活档次降低那么多//@糗事热博榜://@电影资讯速览:标准一年比一年低//@魅丽广东:2020年怎么办//@九哥信箱:第五条，活出人样	未
生活法国政府推出交通法案，大力发展拼车	未
生活现状，我哭辽	未
生活用品基本靠偷，杭州某高校同寝室4名大一女生被抓	未
生活用品基本靠偷 杭州某高校寝室4名大一女生被抓	未
生活用品基本靠偷 某高校同寝室4名大一女生被抓	未
生活的压力，让我们越来越累，复杂的人心，不得不小心谨慎，活着很累，一个人面对所有，假如身边有个可以说心事的人，或许就会多一些温暖的陪伴。	未
生活的模样 妈妈辛苦劳累一辈子，妈妈第一次去KTV唱歌微博视频 生活的模样	未
生活的模样宝宝发给你的这些消息，你知道多少 微博视频 Tomorrow（剪辑版）	未
生活的模样 意见有分歧，一个要出门，一个不肯出大柱小花微博视频 生活的模样	未
生活的模样母婴V时代因为工作的原因可能会经常出差，Candy没去过的地方如果时间允许我都会尽量的带她同行。有些朋友和粉丝就会问我来回走这么折腾再把孩子折腾病了值不值 我想说在生活中很多人都特别喜欢旅游，因为旅游的过程是特别美好的，不仅能够看美景还能品尝当地的美食. 俗话说：读万卷书不如行万里路！旅途中看到各式各样的生活，自然会思考别人为什么要这么活，我自己应该怎么去活。体验了生命，改变了人生这就是旅行最大的意义。我觉得值得 @微博母婴	未
生活的模样 母婴v时代 婴幼儿的喂养方式分为直接喂养和间接喂养，直接喂养指的就是妈妈直接的母乳喂养，间接喂养指的就是用奶瓶喂养。对于孩子来说，他有很强的选择和判断能力，他自己会选择直接喂养或是使用奶瓶喂养，但是绝大多数的孩子还是会选择直接喂养，这样就会出现一个现象，孩子不喜欢吃奶瓶。许多小宝宝对奶瓶是有抵抗的，这让妈妈们很着急，怕耽误营养吸收，那么宝宝不吃奶瓶怎么办呢，宝宝不喝奶瓶有妙招，下面一起来详细了解了解吧	未
生活的模样 母婴v时代 对于养孩子这方面里的学问可真是有不少呢，作为家长最在乎的当然是孩子的健康问题，如果他能够按照正常的规矩及省长的话讲是再高兴不过的。可是很多家长应该发现孩子会出现一种情况就是跟同龄的孩子相比长得个头不高而且体重也没有达到正常的标准。可以出现这种情况父母肯定也会跟着着急，其实一旦出现这种状况就说明孩子的身体可能已经出现了问题，而如果家长及时发现带孩子去医院做检查的话也能做好新的调整。你说我们在平时照顾孩子的时候一定要仔细一些这样才能够观察到他有哪些变化，那么孩子身体如果出现问	未
生活的模样 母婴v时代 已剁手	未
生活的模样 母婴V时代 自驾出行，别落入这几个安全座椅误区！家长认为抱着孩子坐在后排是安全的，事实是，只要车子开动，都有可能发生碰撞，危险是时刻存在的！请正确使用儿童安全座椅哦！	未
生活的模样 流着鼻涕的小滋润 微博视频 生活的模样	未
生活的模样 祖上留下这套海景房不知怎么投资微博视频 生活的模样	未
生活的模样 雾霾雾霾快快散 微博视频 生活的模样	未
生活真的很苦，但我还是想要一点甜。	未
生活窍门:鱼刺卡喉的救治窍门吞咽橙皮。鱼刺卡喉时，可剥取橙皮，块窄一点，含着慢慢咽下，可化解鱼刺。用维生素C软化。细小鱼刺卡喉，可取维生素C一片，含服慢慢咽下，数分钟后，鱼刺就会软化清除。	未
生活累吗累！生活苦吗苦！有钱吗没有！所以，再难再苦，我都要好好上班，好好赚钱，因为我很穷！	未
生活虽苦，我们也要想尽办法，让自己在苦涩品出甜来。	未
生活表情包 天气冷，有话床上说 ，晚安了	未
生活@西亚斯原来这些养生茶不能乱喝！否则会适得其反。	未
生活资讯听说身份证相片有救了不满意可重拍3次！	未
生活资讯啤酒肚是喝啤酒造成的你冤枉啤酒了	未
生活还得继续坚强——访遭极端组织武装分子袭击的叙利亚村庄	未
生活还要继续，吃个午饭压压惊，评论一下你的午餐，我也照着点一份，抽30人脱非。	未
生活里80的痛苦都来自于工作但是，要知道 如果你不工作就会有100的痛苦来自于没钱所以在工作和没钱之间还是选择拼命工作吧！晚安	未
生活里，只有争吵，没有心跳。	未
生活里总有些事我们无法预料，也把握不了。那就随它去，留给自己一颗自由呼吸的心，飞在微风里。早安。	未
生活里的每个时刻，木内達朗(Tatsuro Kiuchi)	未
生活需要游戏，但人生不能游戏生活需要歌舞，但不能醉生梦死生活需要勇气，但不能鲁莽行事生活需要重复，但不能重蹈覆辙。唯美情经典语录唯美情经典语录	未
生活  青春期不烦恼	未
生源过亿！学生家长为啥给校外培训埋单	未
生物武器和化学武器谁更厉害当然是细菌武器，也就是生物武器更厉害，这种武器基本上是属于不可逆的后果。哪什么是化学武器呢化学武器就是我们俗称的化武，通过载体发射爆炸后通过风，空气，水源等，向人体扩散，人体接触或吞入后导致神经性中毒，皮肤溃烂等导致人员大量快速伤亡。比如大家知道的神经性毒剂，糜烂性毒剂，介子气毒剂等哪什么是生物武器呢生物武器就我们俗称的细菌武器，通过炮弹，导弹，飞机等载体发射有害细菌破坏植物或人体的免疫力或DNA变异，导致人员的大量伤亡。而且是不可逆的杀伤性后果。由此可见，两者之间的区	未
生物界AlphaGo来了！DeepMind推出蛋白质结构预测算法，大胜人类传统模型！	未
生物股份：子公司产品获韩国兽用医药品进口许可	未
生物质锅炉超低排放！未经环评的锅炉不予安装检验！10吨以下锅炉，再见！重点区域35吨以下锅炉，再见！	未
生猪死亡86头！北京市房山区排查出非洲猪瘟疫情农业农村部新闻办公室今天发布消息显示，北京市房山区排查出非洲猪瘟疫情今天（23日）上午9点，农业农村部接到中国动物疫病预防控制中心报告，经确诊，北京市房山区青龙湖镇琉璃河镇各一个养殖场排查出非洲猪瘟疫情截至目前，青龙湖镇某养殖场 ...全文	未
生猪甲状腺、死鱼虾……如何确保这些“垃圾肉”不再上餐桌？	未
生病时的不同表现。崩坏的世界线	未
生病的农民，医药费已经压的喘不过气来，电费是奢侈品！//@以色列777:袁姐冬天用电取暖相对会比较安全一些，用煤的话需要提醒他们注意一氧化碳中毒问题！@袁立	未
生病的时候：嗓子好难受想喝水，水真好，我以后一定要多喝水健康的时候：嘿饮料真好喝！	未
生的再平凡 也是限量版 执法如拉呱 郭Sir就是他	未
生石花种植三闲事之二：修根	未
生离死别，情真意切。	未
生而为人的责任朗读篇	未
《生而为商》，传递社会正能量	未
生肉让顾客上吐下泻上海这家网红酒店遭投诉上海素凯泰酒店是一家被称为泰国网红酒店的所谓奢华酒店，其意大利餐厅近日却被消费者投诉，可能存在食品安全问题。@上海素凯泰酒店Sukhothai 12月9日，陈女士和朋友共6人在该酒店的意大利餐厅La Scala用餐。次日开始，包括她在内的4人均出现较为严重的呕吐腹泻及发烧症状，其中2人就医后诊断为急性肠胃炎或病毒性胃肠炎。食客在素凯泰酒店吃生肉后上吐下泻 酒店曾被举报违法	未
生肖成熟善良懂得疼对象的生肖	未
生肖牛：身边有一贵人足矣，要谨记一件事！	未
生肖狗一生一世婚姻和宿命！	未
生肖猪在海外受宠 多国曾发行过生肖猪邮票	未
生肖羊会特别有财吗	未
生肖羊在2019年会遇到什么好事	未
生肖虎一生一世婚姻和宿命！	未
生肖蛇一生一世婚姻和宿命！	未
生肖马一生一世婚姻和宿命！	未
生肖龙一生一世婚姻和宿命！	未
生育保险和职工基本医疗保险合并试点城市参保人数达1510万人	未
生育保险基金或将并入基本医疗保险基金征缴管理十三届全国人大常委会第七次会议拟将生育保险基金并入基本医疗保险基金征缴和管理。草案指出，此前，根据全国人大常委会授权，国务院在河北省邯郸市等12个试点城市将生育保险基金并入职工基本医疗保险基金征缴和管理，试点经验取得积极成效，可在全国 ...全文	未
生育保险基金或将并入基本医疗保险基金征缴管理十三届全国人大常委会第七次会议拟将生育保险基金并入基本医疗保险基金征缴和管理。草案指出，此前，根据全国人大常委会授权，国务院在河北省邯郸市等12个试点城市将生育保险基金并入职工基本医疗保险基金征缴和管理，试点经验取得积极成效，可在全国推开。 生育保险基金或将并入基本医疗保险基金征缴管理	未
生育成本到底有多高不算不知道，一算吓一跳！养孩子第一年你花了多少（via 呆小贺）	未
生育津贴就是产假工资吗产假工资怎么算生育津贴怎么申请	未
生育登记可尽早，医保报销会用到	未
生蚝店不务正业卖起了烤串，主打是一条大鳗鱼	未
生计困难英国渔民竟将价值18万元的鲈鱼扔回海中！真相令人遗憾	未
生财有道？通风井摇身变“房间”	未
生逢1978|上海话剧界“票房蜜糖”：导演是演员的镜子，更是社会的镜子	未
生长猪体脂率为14左右，育肥猪体脂率为17-19左右最瘦的猪体脂率只有9.3图为不同胖瘦的人的体脂率数据，说自己胖的跟猪似的朋友，请慎重考虑下减肥	未
生鲜传奇王卫：大型卖场百货商超注定衰落，社区店才是未来！	未
用10秒钟就看完的故事，看了不许掉眼泪	未
用15国语言卖纪念品，这个柬埔寨男孩背后的故事，并不那么不美好	未
用502胶堵锁芯 泗洪一修锁匠生意冷清起歪心	未
用502胶堵门锁锁芯，泗洪一修锁匠生意冷清起歪心	未
用60艘导弹艇打造“狼群”？台立法机构：乱花钱	未
用AI让南极望远镜“自查自诊”，这群南京高中生不简单！	未
用Apple pay也是一分钱（不好意思，今天才测试） 查看图片	未
用一个塑料瓶，就能种出一个小菜园	未
用一个手机壳，换我弟弟给我按摩20分钟，从头到脚连手指头都安排了	未
用一句话告诉我你怎么理解因噎废食	未
用一句话形容下	未
用一句话描述你有多懒	未
用一句话证明你家里有矿！	未
用一句话证明你认识他(来源中国正能量)	未
用一句话评价下新郎 微博视频	未
用一块羚羊肉当枕头，生活颓废眼神忧郁聪明绝顶的花豹。	未
用一块羚羊肉当枕头，生活颓废眼神忧郁自豹自弃	未
用一张图叫醒你	未
用一根手指敲出230万字 脑瘫女孩：我的所有尊严源于我的思想一个出生时重度窒息导致脑瘫的唐山女孩陈曦，13岁那年发表处女作《我的世界我的梦》，从此之后就爱上了写作，她说：我的所有尊严源于我的思想。尽管生活不能自理，语言能力受到限制，只能勉强操控一根手指，但是敲出来的字却没有一个是错别字，连标点符号都不需要更改。到目前为止，她发表的作品已累计约230万字。（东方IC）脑瘫女孩自学成才 用一根手指敲出230万字	未
用万用表测量220v线路是不是漏电，咋样测量	未
用三个字写一个谎言，你们的是什么	未
用三个字证明你是哪个省的，不许说地名哦。	未
用三个字证明你是哪个省的，不许说地名哦	未
用不起胰岛素，美国人开始当“药神”	未
用两个字，形容你现在的余额！_____	未
用乘车规则划清权利界线	未
用乳鸽馋出你口水！400万食客都成了这只鸽子的粉丝	未
用了10多年电饭锅才知道，原来这里一定要擦一擦，不然越用越耗电	未
用了10年洗衣机才知道，右下角还隐藏这个机关！	未
用了2年的木质筷子多脏？这种细菌可致癌，一半中国人都感染了	未
用了40年的身份信息，转眼成了别人的！这个人还是她姐！	未
用了5年以上的手机号码， 原来还会受到特殊优待 网友: 套路	未
用了一辈子的百洁布被颠覆！这块万能刷1秒洗净，连用12个月不藏细菌	未
用了六年之久也未能挽回一只流浪猫的心	未
用了几枚制导炸弹//@师伟微博: 震惊，广场舞已经被美帝列为打击对象！	未
用了别人的数据论文结论或者是片段，还是给出具体的姓名链接比较好的，不然就和截图别人微博不带头像昵称一样，有点偷。 网页链接	未
用了四十年的身份信息，转眼成了别人的！这个人还是她姐！	未
用了多年的宽带第一次通知降费了！感觉捡到钱，虽然魔都还是要比老家贵2倍以上	未
用了爆款减肥贴是什么感受	未
用了蔡文姬的圣诞新皮肤之后，就。。。新皮肤还有这种效果呢蔡文姬圣诞皮肤	未
用了这个棉片，我P图再也不用磨皮了！黑头闭口痘痘全滚蛋！	未
用了这么多年，却不知道它们背后藏着的秘密	未
用于治疗乳腺癌的帕妥珠单抗注射液获批上市	未
用于罕见病治疗的艾美赛珠单抗注射液获批上市	未
用云闪付，每天坐公交只要一分钱！！！城区98台公交车已上线！浏阳要搞大事情了！	未
用人不在于如何减少人的短处，而在于如何发挥人的长处	未
用人工智能可以识别吗 //@黑科技在日本: 医生们的有字天书，估计是经过加密的 //@传媒老跟班: //@angel安淇儿:哈哈哈这太厉害了//@国民可爱教主王小涵:配药人员专业解答 查看图片	未
用人的3个层次	未
用什么打鸭子？答案：苏-27（上）	未
用什么打鸭子？答案：苏-27（下）	未
用什么样的心态， 面对酸甜苦辣的生活	未
用你们家乡话怎么说	未
用你们的家乡话，是怎么说的	未
用你们的家乡话说吃饭了！	未
用你们的家乡读出这四张牌。	未
用你们的油竟然能上天是的！我们的油还能灭火！	未
用你们的蓝天，换我们的健康，这笔买卖，我们不干。	未
用你们那的家乡话说喝水	未
用你的优势去覆盖别人的劣势，而不是拿你的劣势去覆盖别人的优势。	未
用你的生日代入，看看你的是什么小编先来，我拉着F君在学校跳广场舞（这是什么羞耻play	未
用你的系统输入法打出我真的三个字，看看自动联想是什么，面对一下自己真实的小内心	未
用假车牌无驾照酒驾，这个兴化司机是什么都敢做	未
用力过度，都不会站稳	未
用医保卡当“钥匙”，连偷了一户人家三次	未
用友网络 股票期权获100%行权	未
用双手“跑”了30余场马拉松的残疾朋友：想看更大的世界	未
用双面胶粘到一块就是歼星舰了	未
用口气熏晕对手，是新战术了	未
用哩招沟女，果然洗得！	未
用四个字形容你想睡的人	未
用地29.6公顷！鄂尔多斯1煤矿计划建设个大项目	未
用地已获行政许可！唐山中心城区要实施两项道路建设工程	未
