瑞昌供电公司12月7日停电通知，范围如下请互相转告！	未
瑞昌码头，正在发生的巨大变化！	未
瑞昌辖区AB类小型汽车摩托车驾驶人超分未处理公告	未
瑞杰和芳芳的乡村振兴梦	未
//@瑞格不是卖内衣的:不怕地狱不恋天堂，不回忆过去，也不惧怕未来。	未
瑞金15名马路杀手顶风作案！	未
瑞金6人炸同花被抓	未
瑞金一大波老司机被曝光！你认识几个	未
瑞金一婚纱店老板跑路了	未
瑞金一未成年摊上大事了	未
瑞金于都会昌天价彩礼被曝光	未
@瑞金人：收到10086这条短信，千万别点！	未
瑞金侦破一命案！	未
瑞金扫黄！四未成年少女被抓	未
瑞金早上有地震真相在这里！	未
瑞金某干部欠10万元不还，这招厉害了！	未
瑞金的宾馆酒楼餐厅要专项整治了！	未
瑞金红都大道发生的一幕	未
瑞金街头发生的一幕	未
瑞金这个22岁警察火了	未
瑞金这些地方明天停电！	未
瑞金邻县小伙卖脐橙超400万元！	未
瑞银：A股股票估值偏低 市场情绪好转股市会迅速反应	未
瑞银增资瑞银证券获证监会核准 为首家通过增资实现控股合资券商的外资金融机构	未
瑞银完成股权变更手续  首家外资控股券商诞生	未
瑞银成为首家通过增持控股合资证券公司的外资金融机构	未
瑞银成首家增持内地合资券商股份至51%的外资金融机构	未
瑞银：改革措施短期不影响经济增速	未
瑞银：标普500指数在明年初可能达到3025点	未
瑞银正式控股瑞银证券，另有合资券商准备就绪、静候监管批复	未
瑞银证券徐宾：2019年首季抢跑货量  港口降费加大行业投资风险瑞银证券工业及基础设施行业分析师徐宾认为，中美贸易战港口收费反垄断改革和港口整合将是影响港口行业长期发展的三个主要因素。 瑞银证券徐宾：2019年首季抢跑货量 港口降费加大行业投资风险	未
瑞银证券股权交割完成 首家外资控股券商正式落地	未
瑞银财富料美联储明年升息两次 亚洲债息压力纾缓瑞银财富管理发表报告预期，美国紧缩政策还有一段过程，料美联储2019年还将升息两次，但美债收益率曲线局部倒挂，及美联储主席鲍威尔对利率略低于中性的评论已显着降低美国政策利率上升的预期，将成为纾缓亚洲利率压力的一个因素 ...全文	未
瑞银钱于军：会根据新政策寻求增持国投瑞银基金股份	未
瑞雪兆丰年：陕飞正式开启冬季“寒战” 停机坪一幕让人振奋	未
瑟瑟发抖14时整点气温：茂名16.9汕头16.8湛江15.8汕尾15.6揭阳15.4潮州14.7阳江14.5深圳13.7东莞12.8珠海12.8惠州12中山11.5肇庆10.1江门9.8广州9.5云浮8.9梅州8.9河源8.7清远8.6佛山8.5韶关7.1。（单位：）亲们觉得冷吗广东实况天气	未
瑟瑟发抖14时整点气温：茂名16.9汕头16.8湛江15.8汕尾15.6揭阳15.4潮州14.7阳江14.5深圳13.7东莞12.8珠海12.8惠州12中山11.5肇庆10.1江门9.8广州9.5云浮8.9梅州8.9河源8.7清远8.6佛山8.5韶关7.1（单位：）亲们觉得冷吗广东实况天气	未
瑟瑟发抖为避免失联，请提前关注@学徒鹌鹑	未
瑟瑟发抖吧，大魔王级冷空气到了，本周一天冷过一天	未
瑟瑟发抖！！寒潮来袭，气温跳水，玉林天气秒入冬.....	未
瑟瑟发抖//@悬疑志: 这个事情让我想到了之前扒过的案件： 敢分手就杀你全家！19年前桶川跟踪狂杀人案的悲剧一再重演 桶川事件之后，日本还发生过非常多起恐怖情人（或甚至只是自以为追求者的陌生人）杀害女性的案子，也才让日本法规渐渐地修正，把尾随监视在固定地点等待等等行为列入管理让受害人可以报案。	未
瑟瑟发抖//@然后下面就没了:可怕//@M大王叫我来巡山:加了滤镜太硬核了//@西升月:我天//@尸姐:丧尸片剧照//@江南大野花:快递榨汁服务已上线//@禽兽叔叔:血腥现场//@李兰陵:补一张当事人加了滤镜。。。 查看图片	未
瑟瑟发抖的来求一张生日会门票	未
瑶山乡组织开展2018年12.1世界  艾滋病日宣传活动	未
瑶池一战，究竟是哪几位天尊出手相助秦牧	未
瑶池能不能当女的	未
瑶泉村有了“摇钱树”	未
瑶海一菜市场门面房内暗藏玄机，有男有女进进出出，这次出事了	未
璀璨了天空//@然后下面就没了:这是真实存在的吗//@夏目家的小诗哥:好闪亮//@Tiger公子://@吃瓜鹅每日速报:夜空中最亮的机//@-菠蘿菠蘿包：唉呀妈呀坐的时候抠两颗下来	未
璧山11月25日-28日这些地方要停电	未
璧山12月流动车管所上门服务时间，你知道吗	未
璧山2000多辆大车子被监视，车内有异常系统马上报警	未
璧山29日-30日这些地方要停电	未
璧山中学的童鞋在哪	未
璧山交巡警流动车管所12月份出行服务计划	未
璧山停电通知，请互相告知	未
璧山再次被央视曝光，原因在这！	未
璧山农村人的29幅图，你知道多少	未
璧山抵制婚嫁恶俗，盯紧关键不放松	未
璧山有孩子的快看！感冒药不能乱吃，严重者会导致耳聋看完泪奔......	未
璧山民政惠民济困保参保工作启动，谁可参保标准是啥惠在哪里	未
瓜不要停，管不要停	未
瓜分补助 来宾市兴宾区住建局危改办原副主任受审	未
瓜刚好到这段世界已经这么冰冷 我们就不要互相伤害了吧 爱才是一切的解答 是哲学家呀	未
瓜女子《赶坡》这才是正宗秦腔	未
瓜娃呀！西安小伙路边下残棋 8700元学费全输完	未
瓜子买好了，浓茶也泡上了，今晚你们不撕个天昏地暗，本瓜友不答应！！！还有好多工作没做	未
瓜子二手车严选直卖店落地重庆	未
瓜子二手车称对千万元罚单已申请行政复议	未
瓜子二手车被罚1250万 背后暗藏瓜子人人销量之争	未
瓜子哥高速随意停车磕瓜子，结果	未
瓜子饮料都准备好了吗直播13:18正式开始！	未
瓜帅一家	未
瓜帅：孔帕尼只是有点抽筋，并无大碍另外他也表示，希望阿圭罗能够在对阵切尔西的比赛中复出	未
瓜帅：现在的问题是我们没有太多球员可供选择。我们现在有很多伤员，有些出战了与埃弗顿比赛的球员还必须接着踢莱斯特城。当然，我们有机会杀入联赛杯半决赛，从我来到曼彻斯特以来，我们没有放弃过任何比赛，友谊赛也不会。我们必须尊重这样的比赛，就像我们上赛季那样，我们会努力赢得比赛。	未
瓜得一匹 （cr.视觉中国）	未
瓜皮  小包子天天等投喂	未
瓜皮  我们眼睛就是真实的大	未
瓜皮我们眼睛就是真实的大 微博视频	未
瓜皮  皮皮收了我的小心心	未
瓜皮 看着我干什么啦	未
瓜皮萌萌不良女和乖乖女的差别 微博视频	未
瓜皮萌萌小孩叛逆怎么办 微博视频	未
瓜皮 萌萌小老鼠要洗了 微博视频	未
瓜皮萌萌  这都什么智障神物	未
瓜组之前有楼主发帖说宁愿听车祸也不愿听假唱，理讨，爱豆音乐现场有必要真唱吗	未
瓜组话题，如果你是港媒，你会为今天马蓉医院逃跑的事起什么标题	未
瓜迪奥拉：像索尔斯克亚这样的年轻教练得到这样的机会，那是因为俱乐部认为他可以做到。我和他很相似，我们都在很年轻的时候，得到了执教机会。我做过很多不同的工作，你不能拿踢球和执教比较，我祝他一切顺利。自从13岁时，我就在巴萨了。了解俱乐部肯定是你的一大优势，你了解那里的人，以及 ...全文	未
瓜迪奥拉和梅西	未
瓜迪奥拉：德布劳内受伤是因祸得福	未
瓜迪奥拉：阿奎罗上场时间仍不确定	未
瓢虫飞上天，首开卫星物联网系统级验证	未
瓦伦西亚试图把巴坎布带回西班牙瓦伦西亚主帅对他进行了调查。瓦伦西亚主帅曾在比利亚雷亚尔和他共事。在瓦伦西亚主帅的召唤下，他愿意回到西班牙。	未
瓦努阿图是南太平洋的岛国。当地20的儿童无法接种必要的疫苗。@联合国儿童基金会 正在与该国政府合作，利用先进的商用无人机技术来克服当地交通不便的障碍，为一些偏远的地区运送所需的疫苗。就在上周，瓦努阿图政府在联合国儿基会的支持下，对无人机运送疫苗进行了2次成功的试飞。这是全球首次政府利 ...全文	未
瓦努阿图群岛南部发生5.2级地震 震源深度48.1公里	未
瓦努阿图群岛发生5.9级地震 震源深度50千米	未
瓦努阿图群岛附近发生6.0级左右地震	未
瓦坎达索命	未
瓦基弗银行主教练古德蒂：米纳斯给我们带来了不小的麻烦	未
瓦屋山上，邮篓姐的13年	未
瓦屋山惊现龙吸水现象看四川瓦屋山雅女湖面上，一根疑似水柱的东西将天上的云层与水面相连。这就是龙吸水现象，据说十多年前也曾出现过类似景象。（@瓦屋山景区）	未
瓦屋山惊现龙吸水现象看四川瓦屋山雅女湖面上，一根疑似水柱的东西将天上的云层与水面相连这就是龙吸水现象，据说十多年前也曾出现过类似景象（@瓦屋山景区）	未
瓦房店大妈误将百草枯当饮料喝，辛亏医院抢救	未
瓦房店大妈错把百草枯当饮料喝，幸亏......	未
瓦房店局部地区低压供水，自来水公司全力抢修中。	未
瓦房店市公安局组织开展 全警上路管交通行动	未
瓦房店建设中的几个大型商场，万城是不是要完成了	未
瓦房店开展打击医保欺诈骗保专项行动，这九类是重点！	未
瓦房店旺角建设中的万城休闲广场，是不是要完成了	未
瓦拉内:	未
瓦拉内一家在迪斯尼乐园	未
瓦拉内:  今天早上训练  HalaMadrid @皇家马德里足球俱乐部	未
//@瓦泉寨矿业:瓦泉寨矿业已向博山区淄博市两级政府递交国家赔偿申请，但两级政府至今充耳不闻。你们还要违法到什么时候	未
瓦罐扯闲篇儿  你  会不	未
瓦罐扯闲篇儿  你  有么	未
//@瓦良格号归来:爱国	未
_//@瓦良格号归来:这个学校负责人脑子进水了	未
瓦锡兰无人渡轮在三个港口之间实现自主航行	未
瓮安信息网最新招聘求职二手转让出租求租求购	未
瓮安：做优茶产业 绿叶变金叶	未
瓮安县编织四张网关爱留守儿童	未
瓮安法院联合县多家单位开展 扫黑除恶宣传月活动	未
瓯江古埠传渔歌，丽水源头藏画乡	未
瓯海大道这里有人上吊自杀@温州草根新闻 网页链接	未
瓯海景山街道严管取缔狗市，给流浪狗找个家	未
瓶中的宇宙：你厨房里的黑洞	未
瓶瓶罐罐般的矮国者，远远未达到任正非的思维水平	未
瓶装啤酒里竟然有棉絮团阜南这家饭店到底怎么回事	未
瓷器大国缘何难觅高端品牌	未
瓷花龙Bugatti Veyron Grandsport Lamp039Or Blanc.全球汽车 汽车	未
《瓷都是我家 禁燃靠大家》	未
甄嬛传：此人全剧只出场过一次，随口一句话差点要了皇上的命！	未
//@甄甄冲冲: 转发微博	未
甘做大漠一磐石——记北部战区陆军某边防旅一营教导员石旭峰	未
甘农大原书记王蒂在其主持重修的实验楼坠亡，亲属称其不抑郁	未
甘南5名先心病患儿抵渝接受免费治疗	未
甘南人的一天城市的骆驼	未
甘南草原的“管护者”：1人护10万亩 白色污染消失	未
//@甘味屋七海://@pocky娘的小号 :搞基是亲和行为之一。可能社会动物在从独居迈向群居合作的过程里，消解同性敌意都是急需迈过的一道坎，攻击力越强的动物越艰难。结果是在保持攻击性与和睦相处之间找一个捷径，就是通过仪式行为确定亲和关系。人可能是在语言完善后才逐步淘汰了搞这种形式	未
·甘孜23名拟任干部进行任前公示 有你认识的吗？	未
·甘孜州公安局长收到重庆游客感谢信	未
甘孜州纪委监委公开曝光3起一卡通治理典型案例	未
甘孜贫困户乔迁新居 从山上搬到村中心建起两层藏式小楼	未
甘州公安交警夜查酒驾常态化	未
甘州区人民法院招聘25名聘用制审判辅助人员的公告	未
甘州法院联手公安抓获45名老赖	未
甘当城市保姆  这群人在寒风中默默无闻	未
甘泉开展大棚房专项清理整治中，拆除大棚工作房18户22间，累计拆除48户52间。	未
甘滇联合加强打击外流贩毒执法	未
甘肃100个县市要涨工资了！补发17个月！（附：县市名单）	未
甘肃：10月份普通员工平均收入3154.42元，这3个岗位挣钱最多	未
甘肃84个县（市区）均有艾滋病病例报告	未
甘肃一中学发生的一幕，万人落泪	未
甘肃一养殖厂探索“租赁”母猪：与村民“共享”致富	未
甘肃一大老虎被公诉！	未
甘肃一家婆媳不和引发血案(视频）	未
甘肃一小车冲上房顶，吓人！	未
甘肃一老师用塑料水管体罚小学生 教育局：教师已停课	未
甘肃一老师用水管打伤十几名小学生 教育局回应	未
甘肃三部门联合印发《通知》，健康扶贫工作有了新规定	未
甘肃下发《通知》明确健康扶贫相关政策，9种情形将不予报销	未
甘肃丨打击医疗骗保行为，瞄准定点医疗机构零售药店和参保人员三大领域	未
甘肃举行生源地信用助学贷款毕业生招聘会“职惠校园”	未
甘肃人大常委会原副书记李建华被开除党籍、政务撤职	未
甘肃人注意：取消编制！这些事业单位将全部转企！改革时间就在	未
甘肃便民信息兰州公交集团:三个月后公交车全线扫码乘车今年上半年，兰州市对所有公交车安装了乘车扫码支付设备，12月9日，记者从兰州公交集团获悉，预计三个月后市内公交车可全面实现扫码乘车。目前，扫码乘车还属于非现金程序的测试体验阶段，通过测试发现问题解决问题。兰州公交集团将加快速度推进此项工作落地，预计三个月后市内所有公交线路可全线实现扫码乘车，届时将极大地方便市民出行。网页链接	未
甘肃便民信息注意啦！兰铁集团2019年学生和务工人员团体车票开售12月13日，中国铁路兰州局集团对管内学生务工人员车票办理相关工作进行了安排部署，正式启动2019年春运学生务工团体车票集中订票工作。据了解，甘肃宁夏两省区各大院校将于1月中旬陆续放寒假，学生客流集中出行持续到1月底。为保障和方便学生购票，兰铁集团采取学生团体票网站优先集中办理学生票预售期延长预售期内预留部分学生票额等措施，所有车站售票窗口客票代售点等售票渠道均安装学生优惠卡识读设备。网页链接	未
甘肃便民兰铁集团出台2019年春运方案：40天预计发送旅客809.4万人增开3对临客12月25日，中国铁路兰州局集团发布2019年春运方案：春运期间，兰铁集团预计发送旅客809.4万人，较2018年同期增长8。其中直通旅客324.1万人，同比增长5管辖内发送旅客485.3万人，同比增长10。根据历年客流规律，春运节前和节后客流高峰日分别为2月3日2月10日以及2月19日，日均发送26万人左右。（兰州全媒体记者 许晗）@每日甘肃网 @兰州铁路 @话兰州 @微博兰州@微博甘肃	未
甘肃:全面摸排外逃人员藏匿地 切断转移赃款通道	未
甘肃八岁女生遭掌掴后突发性耳聋 当地教育局回应八岁女生被体罚致耳聋甘肃八岁女生彤彤连遭班主任老师两次体罚，随后出现恶心呕吐等症状，最后医院检查确定，彤彤的左耳患突发性耳聋对此，当事老师竟这样回应经调查，孩子被打的原因只是因为没有做作业八岁女生遭老师掌掴后患突发性耳聋 教育局回应	未
@甘肃公务员，在基层服务3年以上可申报基层高级职称	未
甘肃农村危房改造如何申请政府发文！	未
甘肃农村危房改造补助标准是多少咋申请权威解答来了	未
甘肃农民泥塑五十载：捏出屋顶上的古代神话世界	未
甘肃农民祖辈四代泥塑脊兽：“手手相传”二百余年	未
甘肃出现的这场沙尘暴上了新华社...	未
甘肃制定大气污染防治条例：用法律武器“治污”	未
甘肃副省长李斌调任国家卫健委副主任	未
甘肃副省长李斌调任国家卫健委副主任(图)	未
甘肃医疗机构将取消就诊卡  居民扫码就医	未
甘肃医疗机构将取消就诊卡 居民扫码就医	未
甘肃华亭市广西荔浦市湖南株洲渌口区同日挂牌，均为撤县设立	未
甘肃卫视  秦安：羲里娲乡 瓜果飘香	未
甘肃卫视这样报道静宁脱贫	未
甘肃印发《通知》，这类人申报基层高级职称有了明确规定	未
甘肃发现长有四个角的怪羊	未
甘肃：启动直升机应急救援服务	未
甘肃启用居民电子健康卡 告别“多卡时代”实现便民就医	未
甘肃唯一口岸公路G215线全线贯通12月4日，在G215线马鬃山口岸至马鬃山镇公路工程施工现场，施工人员正在进行标线边坡护理等收尾工作，标志着甘肃省唯一的口岸公路G215线马鬃山口岸至马鬃山镇公路全线贯通，为马鬃山口岸的复关创造了条件。@甘肃之窗 @甘肃高速@话说甘肃	未
甘肃唯一口岸公路G215线全线贯通  甘青新通道大循高速公路通车运营	未
甘肃嘉峪关四十载嬗变：由戈壁荒滩到 “绿色水城”	未
甘肃四千万扶贫款滞留146天！副厅长被免，经办人降职！	未
甘肃四千万扶贫款滞留146天！快看！副厅长被免，经办人降职！	未
甘肃四字打油诗：村庄冬日那点事	未
甘肃国有资产亮出“家底”：资产总量19333.26亿元	未
甘肃：外送电量中以风电、光伏为主的新能源电量占比近半	未
甘肃：外送电量中新能源电量占比近半	未
甘肃多县撤县设市，陇西也在列真相是...	未
甘肃多地仍污染严重，河西地区成风沙袭击重点区域	未
甘肃多地降雪降温阻出行 中铁兰州局启应急预案保畅通	未
甘肃大学生3D打印出了网红图书馆	未
甘肃天水农民出山记：从“翻山越沟”到“楼上楼下”	未
甘肃天水麦积山石窟	未
甘肃女子卖房，给800条流浪狗建起一个家在甘肃嘉峪关，29岁的笑笑三年陆续收留800只流浪狗，并雇佣一位阿姨帮忙照顾它们。目前，狗狗们每天仅吃狗粮就要花销600余元。除了喂食，流浪狗们还会被绝育处理，避免大量繁殖！	未
甘肃定西一村民擅自安装电网捕野兔，结果出大事了	未
甘肃家里有电动车的，都看一看	未
甘肃将开通“无感支付”试点	未
甘肃平凉：两张全家福里的生活变迁	未
甘肃平凉泾川县：驻村队长的帮扶故事	未
甘肃平凉泾川天价彩礼事件你怎么看请在下方留言	未
甘肃平凉“银税互动”解决民企“融资难 融资贵”	未
甘肃平川“黑毛驴”托起黄土高原农户“创业梦”	未
甘肃：２０１６年减少贫困人口超过一百万	未
甘肃废止《清真食品认证通则》等4项地方标准甘肃废止《清真食品认证通则》等4项地方标准 甘肃省市场监督管理局网站12月13日发布公告，称根据《中华人民共和国标准化法》相关要求，甘肃省市场监督管理局决定废止《清真食品认证通则》等4项甘肃省地方标准，现予以公布。	未
甘肃建四级救灾物资储备体系 灾害信息员逾3万人	未
甘肃开展打击骗取医保基金专项行动回头看，举报有奖励	未
甘肃张掖雪后初霁 皑皑白雪下现“冰雪村落”	未
甘肃微记录丨兰州市西果园镇方正龙：百合田埂上趟出来的农民企业家第五集：移风易俗	未
甘肃惊现四角羊	未
甘肃成立应急管理学院	未
甘肃:把调查研究作为做好工作的基本功	未
甘肃撤县设市，真相原来是这样的...	未
甘肃政务服务网宣传视频长城区大众社区多举措延伸放管服工作	未
甘肃政务服务网--老百姓办事的网站	未
甘肃“政银便民通”全覆盖 营业执照可在银行申领	未
甘肃整治高价彩礼，效果明显！	未
甘肃新设安全生产、教育、旅游调委会“为民解忧”	未
甘肃新闻特别报道静宁	未
甘肃，既接近天堂，又接近地狱！既有阳关，又有魔鬼城！	未
甘肃未成年人观护教育基地全覆盖 帮教涉罪者回归社会	未
甘肃森林消防员“上山入林”开展冬季野营拉练	未
甘肃榆中雪后现雾凇 “玉树琼枝”绵延数十公里	未
甘肃武威市凉州区附近发生3.0级左右地震！	未
甘肃武警官兵“包饺子，迎冬至”女兵展厨艺	未
甘肃武警新兵展开冬训	未
甘肃武都兴养殖业惠农 驻村干部乐当“娘家人”	未
甘肃：母亲已下葬，陈娟娟，你到底在哪里	未
甘肃民勤农村大叔西瓜泡馍当早餐，一口馍馍一口西瓜，吃的真馋人	未
甘肃民勤：农村妈妈家早晨剩的米饭，用土鸡蛋炒起来，很家常	未
甘肃沙尘暴5分钟吞没县城引央视关注	未
甘肃沙尘暴上央视了！	未
甘肃沙尘暴今日影响西宁，持续多久？	未
甘肃沙尘暴引央视关注！	未
甘肃：沙尘暴来袭 沙墙高达上百米	未
甘肃泾川：这个村的女队长不简单！	未
甘肃清水县农户：昔日走南闯北苦 今日家门口上班乐	未
甘肃游客2018年出境游平均花费4609元，你家的账怎么算的	未
甘肃滚滚沙尘吹到青海	未
甘肃玉门戈壁佳品“触网”外销 传统农户变“电商达人”	未
甘肃环县：入户排“黑恶线索” 皮影戏成“宣传载体”	未
甘肃环县村民享高铁建设红利：“既挣钱又学技术”	未
甘肃环县道情皮影艺人借“网络直播”推广传统文化	未
甘肃现大风降温降雪天气 多地沙尘“裹城”阻出行	未
甘肃电投：拟2.42亿元溢价受让关联方持有3家公司股权	未
甘肃男子开车帮朋友接女友 不料车却被朋友骗走	未
甘肃白银市委原书记张智全受审 曾跟苏荣共事了3年	未
甘肃的一场沙尘暴，场景犹如灾难大片！	未
甘肃的一场沙尘暴，惊动了全国百米沙墙犹如灾难大片！（视频）	未
甘肃省17个村拟列入中国传统村落名录	未
甘肃省人大常委会原党组副书记、副主任李建华被开除党籍	未
甘肃省人大常委会原党组副书记李建华被开除党籍、政务撤职	未
甘肃省人民代表大会常务委员会关于批准《兰州市什川古梨树保护条例》的决定	未
甘肃省人民代表大会常务委员会决定任命名单	未
甘肃省人民政府关于撤销华亭县设立县级华亭市的通知	未
甘肃省人民政府发布3名干部任职通知	未
甘肃省人民政府发布一批干部任免	未
甘肃省公立医院实行党委领导下院长负责制	未
甘肃省农村危房改造三年攻坚方案解读！	未
甘肃省博物馆成立纺织品文物保护工作站	未
甘肃省天祝县：唤醒198座“沉睡”的暖棚	未
甘肃省委统战部慰问归侨侨眷：我们要像石榴籽一样抱在一起	未
甘肃省完成多个应急指挥平台整合共享	未
甘肃省废除各项清真认证标准，拨乱反正，废除清真标准此乃善政，鼓掌转发吧！	未
甘肃省强化审计整改力度  前十月问责处理119人	未
甘肃省提拔一批干部，白银2人	未
甘肃省最新干部任前公示！	未
甘肃省白银市总代理温宜尔特水暖炕。	未
甘肃省确定10种地方病定点救治医疗机构按照国家卫健委相关要求，省卫健委12月20日发文，确定10种地方病定点医疗机构。今后，这些地方病的诊断治疗将逐步交由定点医疗机构统一负责。同时规定，地方病患者的诊断治疗遵循属地化管理原则，患者应首选生活居住地的乡镇社区医疗卫生机构就诊，疑难重症患者可按照分级诊疗的要求，逐级转诊。我省确定10种地方病定点救治医疗机构@平凉发布@庆阳发布 @天水发布@甘南发布@陇南发布@酒泉发布@嘉峪关发布@定西发布@白银发布@金昌发布@武威发布@临夏发布@微博甘肃@话说甘肃	未
甘肃省肃南县首次拍摄到国家一级保护动物白尾海雕	未
甘肃省长“双重身份”履职	未
甘肃破除教育发展体制障碍 搭建人才培养“立交桥”	未
甘肃祁连山下现野生大白鹭 冬日“闲庭信步”	未
甘肃籍现任副部级以上官员名录，会宁2人！	未
甘肃籍现任副部级以上官员，看看你老家都有谁	未
甘肃网友刷抖音刷到命案逃犯，获5万悬赏！	未
甘肃罢免村干部，现场拍手叫好	未
甘肃老家:种两亩地不如养一只羊	未
甘肃耄耋老人创业40年做小吃：从扁担吱扭到精装店	未
甘肃舟曲500万立方米滑坡体治理工程开工	未
甘肃舟曲江顶崖滑坡灾害应急治理工程开工	未
