零友爆料威远两个老人去店里做这种事，这套路不像他们能干的事！	未
零友爆料威远的这两个孃孃，你们悄咪咪做的这事被人知道啦！	未
零友爆料威远这个镇上出现的这两个人，你们认识不	未
零友爆料威远这些人太臊皮了！竟然跑去单元楼里做这种事！	未
零友爆料威远这路公交路线已变，大家不要坐错了！	未
零友爆料威远这里尽然长出了古怪的花，肯定你没见过...	未
零售巨头：更多的机器人会带来更多工作岗位	未
零售新十年  黄氏乐燕：要像欧洲的百年老店一样沉淀下来	未
零售网点严控在30户之内，忻府区四部门联动整治烟花爆竹！	未
零售网站 Fanatical 的一篇《轩辕剑》采访中，公开了 DOMO小组正在开发中的《轩辕剑柒》的女性角色建模图。本作的游戏背景设定在西汉，预计会登陆PC和主机。	未
零售药店分类分级管理将推行22日，商务部发布关于《全国零售药店分类分级管理指导意见（征求意见稿）》公开征求意见的通知指出，到2020年，全国大部分省市零售药店分类分级管理制度基本建立，到2025年，在全国范围内统一的零售药店分类分级管理法规政策体系基本建立。对此，北京鼎臣医药管理咨询中心创始人史立臣分析，随着制度的推行，45万多家药店预计超过一半会倒闭。（新京报）	未
零售药店分类分级管理将推行，45万多家药店过半或倒闭近日，商务部发布关于全国零售药店分类分级管理指导意见（征求意见稿），意见指出，到2020年，全国大部分省市零售药店分类分级管理制度基本建立到2025年，在全国范围内统一的零售药店分类分级管理法规政策体系基本建立推广时间点越 ...全文	未
零基础如何自学吉他 什么时候露一手	未
零妹大曝光昨天去万达的人有没有看到这辆车它火了！	未
零妹大曝光氿滨公园一处河堤有塌陷，可能会有危险！@@丁蜀镇通蜀小区，一辆报废车长期占据车位，比较麻烦！	未
零容忍一切残害幼女的不法行为	未
零容忍！三部门回应基因编辑婴儿事件	未
零容忍免疫艾滋病基因编辑婴儿，艾滋病母婴如何阻断传播	未
零容忍！关于欺诈骗保，这些你必须知道近日，国家医保局召开打击欺诈骗取医疗保障基金专项行动通报会，公布了专项行动国家和全国各省举报投诉电话。你知道你所在省份的举报电话吗哪些行为属于违法违规行为欺诈骗保有何严重后果救命钱保命钱，一定要看好！戳图了解转发周知！	未
零容忍！关于欺诈骗保，这些你必须知道近日，国家医保局召开打击欺诈骗取医疗保障基金专项行动通报会，公布了专项行动国家和全国各省举报投诉电话你知道你所在省份的举报电话吗哪些行为属于违法违规行为欺诈骗保有何严重后果救命钱保命钱，一定要看好！戳图了解转发周知！	未
零容忍！凯里多部门联合，开展这项整治！与医保有关	未
零容忍！出重拳！鲅鱼圈启动拆除违建专项行动	未
零容忍！ 北京  前门	未
零容忍！国家医保局公布各地骗保举报电话！旬阳人拨这个号	未
零容忍！国家医保局公布各地骗保举报电话！贵州人拨这个号	未
零容忍！国家卫健委中国科协回应基因编辑婴儿	未
零容忍！！//@头像集: 爱惜自己//@单身的日常: 珍爱生命 远离毒品	未
零容忍！安顺公布骗保举报电话！	未
零容忍！毒贩的子弹从未吝啬！	未
零容忍！青岛四部门联合，严厉打击这一行为！	未
零点就下了！！最后一个半小时！！	未
零点开，不过滤，末班车 查看图片	未
零点播报来了！汝州有哪些重要事情发生2018.11.24	未
零点播报来了！汝州有哪些重要事情发生2018.11.28	未
零点播报来了！汝州有哪些重要事情发生2018.12.7	未
零线为什么会带电会不会电死人零线带电怎么处理	未
零距离接触俄罗斯“爱国者”军事公园新镇园之宝 熊孩子们玩嗨了	未
零距离早安今天是二十四节气中的大雪，民间有谚语小雪封地，大雪封河，从今天过后，北方将会看到千里冰封，万里雪飘的自然景观，而南方也会有雪花飞舞，漫天银色的迷人图画。	未
零距离早安今天是二十四节气中的大雪，民间有谚语小雪封地，大雪封河，从今天过后，北方将会看到千里冰封，万里雪飘的自然景观，而南方也会有雪花飞舞，漫天银色的迷人图画	未
“零距离”服务小微企业 多地“组合拳”解网友困惑(图)	未
零距离视频市疾控中心开展艾滋病宣传日活动	未
零距离视频肥城市高龄老人有补贴吗	未
零距离视频这个小区路面积水从何而来	未
零距离视频 香格里小区电梯罢工 居民出行犯了难	未
零距离进乡村送法治	未
零部件企业迎抢汽车智能化风口丨燕说车市	未
零陵区开展世界艾滋病日宣传活动	未
零陵区招才引智橄榄枝抛向武汉 计划引进161人	未
零陵城区快警正式运行	未
零食包装里的干燥剂千万别扔，它还有这些惊人用途！	未
零食和红包我都收下了	未
零食控速速收了	未
雷东宝他妈真他妈气人，快赶上谢广坤了。	未
雷佳音 x《智族GQ ITEM》12月刊，想把他买回家吗	未
雷佳音 x智族GQ ITEM12月刊，想把他买回家吗	未
雷佳音好忙头哥赶集呢	未
雷佳音早期男扮女装造型被扒 网友大呼：太辣眼！	未
雷佳音 网友近距离见到雷佳音:头没有想象中那么大！看来大头已经成为雷佳音的标志了，网友还说挺失落的，因为雷佳音头不够大....	未
雷佳音花名阿拉雷不是说要给爱豆打电话吗他现在接了，你们又不信！	未
雷佳音这个照骗！哼！()	未
雷佳音这张照片心机很多吗眼尖的快来找找看	未
雷克萨斯UX预售价公布：26.99万37.30万，这个起步价大家怎么看 查看图片	未
雷克萨斯再次被传国产，一汽丰田称暂无消息披露	未
雷克萨斯被传国产， 一汽丰田回应现阶段暂无消息披露	未
雷克萨斯被国产，一汽丰田HOLD住吗车壹条	未
雷军18岁考上武汉大学，19岁就赚了100多万，28岁成为金山公司总经理今天是雷军49岁生日，小米成立8年从无到有，真的是一位很有人格魅力的大佬（这么多年发型没变）	未
雷军为金山30周年庆生，埋下时间胶囊2048年再挖出一度蜜点评乐视：我不是针对谁，30年后的事谁说的清呢。为庆祝金山成立三十周年纪念日，雷军与金山的两名联合创始人求伯君和张旋龙在金山珠海总部埋下一颗时间胶囊，这颗时间胶囊内放有三个人对30年后金山员工的一封信，这颗时间胶囊将会在2048年被打开。	未
雷军今天帅吗大声告诉我	未
雷军出糗干扰议会全球宕机：智能音箱的尴尬往事今天就带大家看看智能音箱界的糗事大百科，究竟智能音箱行业发生过哪些事故又出现了哪些让人尴尬抓狂的时刻详情点击：雷军出糗干扰议会全球宕机：智能音箱的尴尬往事	未
雷军：创办小米时一年半隐姓埋名！大公司CEO几乎都是光杆司令	未
雷军：同学格式化了我的电脑，从此走上当CEO不归路，网友：被逼创业雷布斯雷军说，他28岁就成了金山的总经理，但父亲说还是搞技术靠谱，所以白天当总经理，晚上加班干程序员。但后来一个新同事，把雷军的电脑不小心给格式化了，备份也格式化了，断了雷军的后路，从此走上了当CEO的不归路！雷军：同事格式化了我的电脑，让我走上当CEO的不归路	未
雷军回忆40岁创办小米：衣服都被投资人问得汗湿了	未
雷军：小米IoT目前已支持近2000款设备	未
雷军晒20年前照片，旁边是求伯君杨元庆柳传志计算机工程师，那时的军军帅不帅	未
雷军暗示小米要做____	未
雷军的Are U OK还能这样玩 微博视频	未
雷军的理想与小米的现实	未
雷军的理想与小米的现实小米是一家互联网公司吗尽管早在创业之初雷军就宣讲过自己的答案，但此后8年，小米这家公司却从未逃离由上述论题所引发的自我折磨雷军一度觉得这个新版本的小米创世纪应该能将它的估值推上1000亿美元但至少在今年7月上市时，资本市场只认可了其中的450亿 ...全文	未
雷军的粉丝是我的20倍，然而他卖的手机年销量是我的1333倍，大哥果然是大哥。 查看图片	未
雷军都送车了！这是要成为网红的节奏	未
雷厉风行！就一个星期，市中区一口气拿下300辆僵尸车！	未
雷吉隆:	未
雷吉隆的 皇马训练 日常当然还有按摩环节啦 皇马 halamadrid 微博视频	未
雷士王冬雷：这才是我们真正的杀手锏	未
（雷山境内原省道S308雷山至大塘段公路）K214000K207000路段进行交通管制 公告	未
雷州松竹镇山尾村一男子在佛山走失，老乡们请帮忙留心！	未
雷州话视频：价贱伤农，新鲜辣椒被倒在路边，这一幕让人痛心！	未
雷文蛛。看到这个名字是不是会找蜘蛛身上有什么雷一样的文字或纹路其实它是这类蜘蛛的属名Raveniola的音译，Raven是个人名，吴彦祖的女儿就叫Raven	未
·雷波两名扶贫干部不幸遇难	未
雷波县公安局关于招聘警务辅助工作人员的公告	未
雷洋尸检结果:胃内容物吸入呼吸道致窒息死亡	未
雷神：你们都走开，我自己就是彩虹桥//@精神病院门没关好我跑出来了://@尸姐: 全员桥梁//@触手蜀黍:正义联盟之人均桥梁//@善财神:哈哈哈//@刺客棉条:哈哈哈哈哈哈哈哈哈哈哈哈哈哈哈哈哈哈哈哈哈哈哈哈哈友好交流//@商小略:Hhhhh//@西升月:	未
雷神锤哥虐娃震惊网友！90的澳洲小孩都是这样长大，因为他们在出生的时候就	未
雷老爷子也81岁了代表作品：银翼杀手角斗士异形普罗米修斯12末路狂花火星救援美国黑帮金钱世界.........太多了	未
雷蒙德.卡佛：肥	未
雷蛇在新加坡的新东南亚总部，2020年迁入。这回真成灯厂了。	未
雷诺保留戈恩董事长兼CEO职位，与日产意见相左？	未
雷诺：引擎落后50马力 明年定会缩小差距F1 雷诺领队阿比特布尔告诉《汽车与运动》说：我们在比赛中损失了大约15到20千瓦的发动机功率（20-27bhp），这在一定条件下可以由红牛的底盘来弥补。但在排位赛中，我们估计我们的差距为40千瓦（53bHP]），这是非常严重的。明年，我不想再说我们在排位赛中缺乏太多的动力。我们没有理由不通过冬季的研发来缩小与梅赛德斯和法拉利的差距。雷诺:引擎落后梅奔跃马50马力	未
雷诺敦促日产召集特别股东大会雷诺代理CEO博罗雷致函日产CEO西川提出这一要求，此举将使这家法国汽车制造商能够在日产董事长戈恩被免职后对这家日本企业做出关键任命网页链接	未
雷诺敦促日产召集特别股东大会雷诺代理CEO博罗雷致函日产CEO西川提出这一要求，此举将使这家法国汽车制造商能够在日产董事长戈恩被免职后对这家日本企业做出关键任命。雷诺敦促日产召集特别股东大会	未
雷诺敦促日产召集特别股东大会雷诺代理CEO博罗雷致函日产CEO西川提出这一要求，此举将使这家法国汽车制造商能够在日产董事长戈恩被免职后对这家日本企业做出关键任命雷诺敦促日产召集特别股东大会	未
雷诺暂留戈恩职位 法政府已着手甄选CEO继任者	未
雷赛智能IPO：实控人曾低买高卖公司股份在雷赛智能历次股权转让中，出现了时间相差1个月，但股权转让作价相差较大的情况，实控人李卫平还插手股权受让，成为中间商：一边从员工持股平台（出让方）低价受让持股，一边高价卖出。律师直言，这样的操作使得交易溢价利润落入了实控人口袋，需要警惕其利益输送的可能。雷赛智能IPO：实控人曾低买高卖公司股份	未
雷达回波一条弱雨带，沿着海岸线向东爬行，不时给南部市县带来一些小雨。阴雨天气，外出备伞，注意路面安全！	未
雷达回波一条弱雨带，沿着海岸线向东爬行，不时给南部市县带来一些小雨阴雨天气，外出被伞，注意路面安全！	未
雷达图早晨，新的一周开始了，天气依旧寒冷，南部还飘着小雨，上班上学请注意路面安全 广州  共和路	未
雷达有源对消技术给回波做“手脚”	未
雷锋精神代代传！热心市民捡到一万五拾金不昧，警民合作物归原主	未
雷雨天气将继续，出门记得带伞	未
雷霆2分惜败森林狼，错失西部第一。维金斯终场前14秒滞空上篮奠定胜局。看视频gtgt乔治失绝杀韦少徒砍三双 雷霆负森林狼错失登顶西部良机	未
雷霆3号行动我局刑侦大队视频追迹锁魅影 跨区缉凶破获诈骗案	未
雷霆3号行动我局刑侦大队雷霆出击 江洋大盗落入法网	未
雷霆4号丨四季青派出所：深化严打整治斗争，守护社会平安	未
雷霆4号 拥有一技之长的他，竟做出了这种事	未
雷霆4号 男子唱了一首歌后，竟然吸上毒品！	未
雷霆4号 神马！他故意丢香烟盒在路边，还总有人捡	未
雷霆vs公牛 今日比赛图集（一） ThunderUP	未
雷霆vs公牛 今日比赛图集（二）ThunderUP	未
雷霆VS森林狼裁判报告最后一分钟。格式：第四节 时间[雷霆:森林狼的比分]Q4 00:58.0 [108:108] 威少借亚当斯掩护上篮被唐斯犯规没有吹罚，威少应该执行2次罚球。Q4 00:56.7 [108:108] 因威少被犯规未吹罚，则篮板有效，亚当斯抢篮板被卡文顿犯规，亚当斯应该执行2次罚球。Q4 00:54.6[110:108] 因亚当斯抢板被犯规未吹罚，亚当斯上篮得分，吉布森打手犯规，应该是21，亚当斯再执行一次罚球。Q4 00:48.2 [110:108] 森林狼进攻时唐斯乔治非法掩护犯	未
雷霆再击 警方成功打掉营口一制作假润滑油窝点	未
雷霆出击！我县严厉打击两违6处，共5310平方米。	未
//@雷霆圣殿骑士:Emmmmmmmm //@飞扬的janny:哦 原来如此//@午夜暖茶-又凉了-FYJS:当年在王府井参加某花散步，后来成为知名狗奴群体串联的 某帝都在加留学人员 就是这个NGO的	未
//@雷霆圣殿骑士:终于看到个看懂的，而且补充一点。美国退休人员的很多养老钱靠的是股票，股票的分红和次级衍生品，很多企业抵押给银行换贷款的也是股票和次级衍生品。如果美股有个好歹就凭现在美联储的利率水平是完全撑不住的	未
雷霆官方：你几乎可以听到篮球入网的声音！ThunderUP	未
雷霆官方摄影师晒今天抵达底特律的照片，他拍的照片都是大片的感觉，雷霆男模队真的太帅了，太有感觉了。ThunderUP	未
雷霆现在是保罗-乔治的球队美媒对保罗-乔治和威少进行了15项能力对比！结果显示：威少占优：终结，篮板，机会制造，运动，全面乔治占优：投篮，防守，控球，效率，球商，影响力持平：关键球结果乔治治9：6领先威少！你觉得合理吗NBA吐槽大会	未
雷霆的比赛还用看吗，醒来又是一场保罗乔治	未
雷霆记者EH报道：卡佩拉23个篮板，雷霆打四五号位的内线亚当斯格兰特帕特森诺尔以及纳迪尔一共才20个篮板不是有句话叫：人多力量大吗	未
雷霆赛事预告 胖友们我肥来了，这两天我微博发少了消失了你们懂的。明天早上十点打爵士，大家一起看球啊。一场不落直播，我可真是一个好主页君，送情侣投篮壁纸	未
雷霆 麦迪近日在节目做客时谈谈到了雷霆球星保罗-乔治。被问到乔治有没有机会当选MVP时，麦迪表示：当然有，雷霆本赛季赢了很多。现在他们排西部第2。这个赛季他打出了自己最好的表现，重回巅峰。上赛季是一个令人沮丧的赛季，不管是他个人还是雷霆队，但今年他看起来比任何时候都好，他的防守还是一如既往的好，而在进攻端，当威少低迷时，他能站出来扛起球队前进。威少也牺牲了很多自己的机会，让乔治打出这么棒的表现，所以我觉得当我们谈论mvp时应该谈到乔治。本赛季乔治出战30场比赛，场均35分钟，得到25.5分7.9篮板	未
雷震任广西壮族自治区司法厅厅长	未
雷颐：有关群体性狂热	未
雷颐:福泽谕吉被监控的日本国脸（上）	未
雷颐:福泽谕吉被监控的日本国脸（下）	未
//@雷颐://@萧含12882:一车乘客，不如一个小女孩子//@逐尘之徒: 是非不分，还谴责司机，是人吗有能耐站出来跟不法危险行为较劲，我佩服你。骂人，都不足解我失望之怒。	未
“雷鬼”音乐列入联合国非物质文化遗产名录	未
//@電擊壺 :团长！你在做什么啊团长//@闪闪一口气吃了十碗麻婆 :不要停下来啊//@合金妖王刘成文 :它可能是热的哈哈哈哈哈	未
//@電競國際隊預備成員:哈哈哈哈哈哈哈哈哈哈哈哈哈哈我也是這個題目哈哈哈哈哈哈哈哈哈哈哈//@小羊爱吃酱肘子: 查看图片 //@混日子好快乐:几把笑断了//@你再不来我就要下雪啦://@白鹭火山-:哈哈哈哈哈哈哈哈哈哈哈哈哈哈哈哈哈哈哈哈哈哈哈哈哈哈哈哈哈哈哈哈哈哈哈哈哈哈哈哈哈	未
@電話那頭的妳 看看我吧！！	未
雾中看警出行路上的身影	未
雾入仙境！今早芜湖都丢了，然而，大家最关心的是	未
雾凇沆砀，天与云与山与水，上下一白。湖上影子，惟长堤一痕湖心亭一点与余舟一芥，舟中人两三粒而已。	未
雾化吸入治疗 你做对了吗？	未
雾和霾又来了！今天，天津启动重污染黄色预警......	未
雾和霾将散  然而接档的却是冷雨	未
雾和霾猖狂不了几天了 大家稳住	未
雾和霾组团来捣乱 无锡污染源管控力度加码	未
雾和霾被吹散后，到底去哪儿了原来它是上天入地了	未
雾大！南京长江四桥封闭	未
雾天5类危险路段应对方法	未
雾天出行千万别开远光灯，交警提醒：应打开防雾灯	未
雾天出行指南丨大雾锁城，闯红灯怎么办	未
雾天出行 “雾”必注意	未
雾天开车六大原则，为了你和家人的安全，司机一定要学会	未
雾天开车看不清信号灯，闯了红灯会被罚吗权威回答来了！	未
雾天抢修11月28日，国网江苏检修公司泰州运维站运维人员在500千伏凤城变巡视。运维人员发现某高压开关在连遇大雾天后突发告警信号，紧急联系检修人员许可该开关抢修工作。	未
雾天来袭，樟树交警提示你：雾必注意！	未
雾天行车注意事项近两天出现大雾，大家有木有正确使用灯光呢雾天出行要注意这些：1开启雾灯近光灯，不用远光灯，合理使用喇叭2低速行驶保持车距，避免紧急制动3宁靠中间，不沿路边（但不要轧线行驶）4挡风玻璃除雾切忌边走边擦5确需停车，紧靠路边，乘员远离车辆。	未
雾天行驶要小心:矿坑凤凰庄路口一男子骑摩托与三轮相撞，至今昏迷不醒	未
雾天警情 受大雾影响，宁宣高速溧芜高速全线封闭，沿线收费站已关闭，请车友提前规划好出行路线@平安南京 @平安江苏 @南京交警	未
雾天误闯红灯怎么办采集标准会适当放宽，有疑义可申诉	未
雾天误闯红灯罚不罚合肥交警：抓拍照不清晰不处罚 但要尽量避免雾霾笼罩江淮，不少司机在开车上路时反映遇到红灯因雾大看不清。那么如果因大雾天气实在看不清楚而误闯了红灯，算交通违法吗合肥交警部门表示，此种情况可申请撤销违法记录，抓拍照片不清晰将不会处罚。雾天误闯红灯罚不罚? 合肥交警：抓拍照片不清晰不处罚	未
雾天闯红灯怎么办交警回复：不要怕 请看大屏幕...	未
雾太大，注意安全！邳州老人一头撞上路边大货车！	未
雾太大看不清路潍坊团雾高发路段公布，途经需格外注意！	未
雾太大看不清路烟台18处团雾高发路段公布，途经需格外注意！	未
雾影仙踪！江苏多座跨江大桥成这样11月27日一大早，江苏高速公路全部封闭，多座跨江大桥被浓雾笼罩，宛若进入仙境，有些甚至迷了踪影详情雾影仙踪！江苏多座跨江大桥成这样更多消息请关注网页链接	未
雾必小心！六盘水高速公路团雾易发路段都在这里了！	未
雾必小心！@凉都司机：贵州交警发布全省团雾多方路段安全预警	未
雾必小心！西安交警发布团雾易发路段，赶紧扩散！	未
雾必当心！出门前一定要看能保命！	未
雾必当心！团雾究竟有多可怕进入秋冬季节，团雾天气多发，其能见度低突发性强预测困难等特点，极易造成驾驶人行车时骤然失去视线应对不及时，从而导致交通事故，特别是高速公路易发生多车相撞事故，严重威胁人民群众生命财产安全！戳图了解更多。	未
雾必当心，宜昌这些路段易发团雾！	未
“雾”必注意！江西今晨32县（市）能见度低于500米 未来...	未
雾必注意！盐城一小货车与电瓶车相撞，1人当场死亡！	未
雾必注意！能见度不足100米 湖北部分高速临时交通管制今早07：30湖北全省高速公路实时路况：G70福银高速安居至襄阳北段（双向）因大雾能见度不足100米，实行临时管制。省内其他高速公路通行正常。（@湖北高速交警）因雾，临时关闭各入口收费站的有：G4京港澳高速咸宁南至新店段G4E武深高速嘉鱼东至赤壁南段G59呼北高速渔洋关至白洋段G70福银高速襄阳北至安居段。因施工，G55二广高速襄阳西站临时关闭陈安站入口临时关闭G4京港澳高速军山长江大桥禁止货车通行。（@楚天交通广播）	未
雾来了！霾来了！单双号限行来了！但是南乐这个大哥竟说他不怕限号！	未
雾槽，这寮活动有些厉害啊！四十多位伙伴参与，从两广到江浙再到北京又到东北，横跨了大半个中国的即视感！有条件的话做些视频记录哇，预祝活动圆满成功！号主大提莫也是很有印象的，曾经在弈老板竞猜中换上发哥头像准备当赌神，然后一把没赢倾家荡产。某期视频有上过镜 查看图片	未
雾深深 霾蒙蒙，青浦人挺住！等等，到底是雾还是霾	未
雾还是霾宜兴启动入冬后首个重污染天黄色预警！你需注意这些	未
雾都吃喝玩乐的第4天: 吃香喝辣的日子总很短暂滴这一路没有跑很多景点儿，随缘分和顺眼撸路边儿摊，随性但反而记忆巨深刻旅行就是这样...不刻意不赶场，顺其自然的享受未见和遇见的可能...下次，等天气暖和些的时候再来耍哈哈	未
雾里安大  今天的标题看不清	未
雾里梦幻在烟台，请开启雾天模式！烟台发布大雾预警信号，这些高速路口临时封闭！	未
雾里霾里冬雪里，我在考期等着你	未
雾锁习水今日罕见大雾刷爆习水人的朋友圈！有人 . . . . . .	未
雾锁全城，贵阳的司机出门都气哭了，请雾必收下这份出行指南	未
雾锁城楼：高速关闭，汽渡停航！明天早上必须早点出门！！！	未
雾锁天门	未
雾锁岛城12月3日凌晨开始，岛城突降大雾。当日早上，市区依然笼罩在一片白茫茫雾气中，给市民的交通出行带来一定影响，由于正值交通早高峰，部分路段拥堵严重。（半岛记者 王滨）	未
雾锁扬城！但，锁不住这里的警色	未
雾锁港城，别怕！有警察蜀黍为你拨开迷雾，请放心！	未
“雾锁”申城：多段高速封闭 多条轮渡停航	未
雾锁申城！这些高速已限速限行  男子坐1号线衣服被夹迁怒地铁  沪412斤女生切胃30斤	未
雾锁金陵！江苏省多城陷四面霾伏	未
雾雾雾！今早出门觉得自己成仙了申晨的大雾将持续到	未
雾雾雾，空气质量怎么样出行如何防护	未
雾！雾！雾！笼罩在大雾中的杞县！出行雾必小心！	未
雾雾雾雾，橙色预警！浙江这里最低能见度仅80米上下！	未
雾雾雾雾雾！接下来几天的苏州，还请你早起一个小时！	未
雾雾雾雾雾雾！常州人本周请提前一小时出门！全省将连续6天深陷雾霾困扰	未
雾雾雾雾雾雾！让大苏州从雾变成雾霾的原因居然是这个	未
雾雾雾雾雾雾雾，七天雾！有可能转霾刚刚，苏州气象说...	未
雾雾雾雾雾雾雾雾霾终于还是对长沙下手了，更可怕的是...	未
雾雾雾霾霾霾！今早金坛人又被大雾刷屏！这些事你一定要知道！	未
雾雾雾霾霾霾！据说还有波“土”要吃… 	未
雾雾雾霾霾霾！据说还有波土要吃	未
雾霾Plus自强不吸，倔强修仙	未
