震惊！一场大雪后，哈工程曝光了隐秘几十年的超级工程！昨日黄昏时分，一艘长105米宽68米的航空母舰惊现@哈尔滨工程大学 31号楼陈赓像前的军工操场。是的！哈军工流传多年的传说终于被印证，军工操场下真的有一条航母陈赓大将的雕像就是为了镇住	未
震惊：一女子被面包车三次碾压，司机驾车逃逸	未
震惊！一间小屋子竟然发生了那么多不为人知的事儿	未
震惊！三岁小孩脸上长了密密麻麻的毛，原因却是	未
震惊与克制：直击基因编辑香港峰会大会官方克制，第一天公开发言的讲者都没有直接提到贺建奎的事情大会批评贺的最强音来自中国专家中外专家同时承认技术发展太快，必须加强社会的认知文化管理法规建设，这可以说是贺建奎事件所促成意料之外的结果@知识分子 震惊与克制：直击基因编辑香港峰会	未
震惊！东莞一工厂提前放假回家过年在网上引起热议！网友纷纷表示......	未
震惊丨厉害了老司机！倒换卡闯卡4个月跑单60余次，这下栽了吧！	未
震惊丨感觉黑虫爬满身女子疯狂用杀虫药给自己灭虫	未
震惊丨沭阳名品虞姬城某美容店竟为客户注射假药！更恐怖的是...	未
震惊！中加双语学校要被拍卖了真相到底是什么	未
震惊！中国诞生首个基因编辑婴儿，涉及哪些法律问题	未
震惊！中石化正在悄悄地偷车主们的油吗	未
震惊！为了1桶粉，排队排到上新闻！	未
震惊！为拆楼顶基站，女子一个月累瘦7斤！	未
震惊了上亿人，至今找不到破绽...	未
震惊了！印度铸造工厂机械化程度居然这么高	未
震惊人心！近年大学校园竟成艾滋病高发红灯区，只因无数父母忽视了这件事！	未
[震惊] 仙游某村发现3.5米大蟒蛇网友的回复更惊人...	未
震惊：你以为外卖都是现炒现卖可能是这样做出来的......	未
震惊！你天天都在吃的盐里竟然有塑料！	未
震惊！你点的外卖，半年前就做好了！	未
震惊！保险代理人队伍将要大洗牌，7个保险展业秘籍已被悄悄的传开...	未
震惊！儿子卧室竟藏有许多女性用品	未
震惊全国的简历我叫安徽！	未
震惊！全国酒商最怕的事，这个贵州女孩做到了，行业即将颠覆！	未
震惊全民飞机最难关卡	未
震惊全行业！史上最牛会议，绿佳又在搞什么飞机	未
震惊 六安一辅导班竟成卖淫窝点 现场画面曝光	未
震惊刷爆潮汕微信群分尸案件，真相终于来了！	未
震惊！千万不要拿生命去发生性关系！用报复社会的方式去宣泄心中的愤懑，这些人渣	未
震惊单打就这样爆分老飘论新版（机友评论）	未
震惊！又一铁路局副总被查	未
震惊！同安这群人竟然在小树林里干了这事.....	未
震惊！吐司跳起来了	未
震惊！唐山这个女子谁认识竟干出这种事......	未
震惊！国家突然传来大消息，一场大风暴即将来临！	未
震惊！地铁一号线惊现8位新人结婚原来他们是在......	未
震惊！地面突然凸起，发生的惊人一幕！	未
震惊 墨尔本女留学生回国被海关围堵 掀开裤腿后， 所有人看懵了	未
震惊！外卖里吃出烟头，商家竟回应“再吃下去能吃出一包黄鹤楼”！网友炸了…	未
震惊！外地蟹冲个澡变身阳澄湖大闸蟹！央视刚曝光！	未
震惊！大巴黎发生保险箱系列撬窃案，塞纳河中已捞出15只	未
震惊！天水多家门口惊现诡异字条，你家有没有收到过	未
震惊！天水多小区住户家门口惊现诡异字条，你家有没有收到过	未
震惊！女主播为火陪黑客luo聊反遭敲诈登上新闻！浩南指吴迪太网络忽略兄弟情义！劝言：别激起民愤，树敌太多。	未
震惊！女主播为能捧红陪黑客luo聊反遭敲诈！	未
震惊安国人30年前赶集竟然是这个样子！看完泪流满面！	未
震惊安国火车站将遇上亚洲最大的火车站！	未
震惊安国火车站将遇上亚洲最大的火车站！（附：修建时间公布）	未
震惊！安徽男子出轨十多年，私生子混进户口本！更可怕的是	未
震惊小学女生乘公交被中年男骚扰，视频拍下全过程！	未
震惊：居然这么多假的99的人喝了一辈子都不知道！	未
震惊！山东一50岁老汉拐骗17岁少女做情人，与正妻一起过...	未
震惊！平湖有人包了50万现金大礼，结果出人意料！	未
震惊！广东天气为提醒大家降温需加衣，竟当众假唱！	未
震惊！广西市民看见会飞的快递员！还有TA也飞了起来！	未
震惊 我居然都没用过！	未
震惊晋城某村干部受贿717万！详情曝光	未
震惊！普宁校服现身非洲，央视曝光潮汕捐衣箱背后猫腻...	未
震惊林州谁家有这种1角硬币回家找找值钱了！	未
震惊每天要和1000斤干面！大丰一退役士兵变身馒头大叔	未
震惊！泰州家里有婴幼儿的注意了！赶紧点进来看看！	未
震惊！浓烟滚滚，某市联通集体断网，怎么回事啊！	未
震惊！涟水这里流出的水有异味	未
震惊涿州人！17岁少女抽出粉红色的血，谁有这习惯赶紧改	未
震惊淄博警方拿下一假超人，不能飞！	未
震惊！潍坊这几个烂尾楼又活了！	未
震惊！犯人承认完成90起杀人案逃脱，嗜血足迹遍布美国地图	未
震惊！看看消费失忆症候群你中了几条！	未
震惊！知名主播有钱不升舱真相居然是这个！舍不得穷怕了说实话真的舍不得升舱。坐十几个小时去美国参加全明星吧。希望我的肾别做坏	未
震惊！破产后的隋遇竟然是这样的人划掉渺渺星光	未
震惊！社会发展了，我们却早衰了！	未
震惊！福尔摩斯.唐，剥丝抽茧探真相真相大白！他和她竟干那事.....不转不是中国人！！！//@飘之队-唐朝:前情回顾！附图是曝光的聊天记录的一部分。 查看图片 //@莲子医生Dr:这又是什么瓜吃不明白了//@八拾捌:。	未
震惊！綦江高速路上惊现一男子抢大巴车方向盘（附视频）...	未
震惊：美国没有英雄！	未
震惊！美国研究发现全球1/10死亡事件由吸烟所致	未
震惊老人在床下埋8万现金！13年后挖出来，傻眼了...	未
震惊！联通某地通知：年底之前必须完成这个任务，否则全员通报批评取消评优资格！	未
震惊！莆田又1个千万富翁诞生他的身份竟然是...	未
震惊！莆田发现一枚高危大型炮弹，太可怕了	未
震惊！莆田土豪在九鲤湖违建豪宅！ZF出动60多人强拆！	未
震惊！莆田涵江惊现百万新娘，真相让人...	未
震惊蜀道不再难，秦岭以南2小时直飙这里！！	未
震惊！警察冲进房间，发现4700万现金铺满床，这是在干什么	未
震惊警察冲进房间，发现4700万现金铺满床，这是在干什么	未
震惊！赣州这些女子主动给他们钱，结果	未
震惊！这个也能丢日照一地下停车场惊现这东西......	未
震惊！这些女子主动给他们钱，结果	未
震惊！这位小伙伴竟然这样说自己！	未
震  惊  这几种白酒打死也不敢再喝了，抓紧看看你喝过没！	未
震 惊  这几种白酒打死也不敢再喝了，抓紧看看你喝过没！	未
震惊！这可能是史上最长的公司名	未
震惊！这家70人小公司竟然想重新定义全球零售业！	未
震惊！这家私募违规募资4273万元，还把部分资金转入高管账户，董事长总经理双遭市场禁入5年！	未
震惊！这张外卖单刷爆福州人的朋友圈，背后原因竟是	未
震惊！这种毒凤爪，容县人千万别吃！	未
震惊！这种毒凤爪，宿松人千万别吃！	未
震惊！这种毒凤爪，湛江人千万别吃！	未
震惊！这种毒鸡脚，丰顺人千万别吃！	未
震惊通惠河，你变了！	未
震惊！重污染天气橙色预警下，这段无人机拍摄的高空视频	未
震惊！金晶大道上竟然有一所这样的医院！里面的医护人员.......	未
震惊！除榕津古榕外，平乐这地方也有一棵两千年树龄的大榕树	未
震慑东北的食人恶魔，残杀42人内脏下酒！	未
震泽古鎮。//@电商-李硕:舵爷 下一站是哪里	未
震科普  世界各国关于地震的传说！	未
震荡反弹的概率偏大老丁解盘	未
震荡市中碰券商股不合算，也没有必要。玩次新或问题股模式更合理，既然已经是投机，何不更刺激一些，类似家居板块中的亚振家居，交运板块中的德新交运等一批问题股不是更简单不需要考虑基本面业绩，就是纯投机，严格操作纪律，以及资金特性即可。	未
//@震长:转发微博	未
霉霉想复合？被曝欲挽回7年前分手的男友	未
霉霉演唱会 面部识别据外媒，霉霉今年5月的演唱会使用了面部识别系统来识别跟踪狂。这种系统植入了自助服务终端，秘密记录观看者的面容。观众如果观看终端，就会被设备扫描，处理中心会将面容信息与数据库图片匹配，而数据库中记录了许多霉霉跟踪者的信息。霉霉演唱会启用面部识别系统	未
霉霉演唱会面部识别系统 曾多次被跟踪的霉霉在早前举办的演唱会上，使用了面部识别系统来识别跟踪狂。该系统植入了自助服务终端，秘密记录观看者的面容后，将数据发送到处理中心，并与数据库中的图片匹配。而该数据库中则记录了霉霉的许多跟踪者信息。这东西怎么区分跟踪狂和那些经常去霉霉演唱会的粉丝	未
霍勒迪今天在球哥的防守下10投2中，4分5助攻！霍勒迪赛季场均20.7分。NBA吐槽大会	未
霍华德卡特保罗罗斯安东尼，谁进名人堂最无悬念?NBA	未
霍大耳朵车车脖子为什么可以伸这么长著名网瓷车车微博视频 温泉	未
霍奇森只是个慈祥的爷爷，未来轮到谁给英格兰“背锅”？	未
霍尔果斯为何硬不起来	未
霍山：12月1日-12月3日这些地方停电！涉及面积有点大......	未
霍山一男子交通肇事后找人顶包，结果难逃法眼获得刑罚...	未
@霍山人！国家出手，今后这些行为将严查！	未
霍山人挺住！未来几天有雨雪！这些地方还将停电...	未
霍山但家庙镇中心学校组织开展食品安全教育活动	未
霍山单龙寺镇：开展缅怀革命先烈活动	未
霍山县人民政府关于对运输砂石货运车辆实施禁行限行的通告	未
霍山县住建局：持续开展大气污染防治 严把建筑工地扬尘...	未
霍山县城区限制燃放烟花爆竹，再过一个月就实行	未
霍山县太阳乡：开展反对邪教，崇尚科学集中宣传活动	未
霍山县太阳乡：开展扶贫政策大宣讲活动	未
霍山县重拳出击：开展户外广告设施专项整治...	未
霍山太阳乡：反邪宣传入校园，健康生活乡村传...	未
霍山打掉一制作销售假酒团伙	未
霍山漫水河镇：云海深处是吾乡	未
霍山烧烤摊店注意啦！霍山开展夜市烧烤集中整治行动...	未
霍山：致全体城区居民的一封信！与每个人都密切相关	未
霍山：藏企落户漫水河 深山冲里脱贫忙	未
霍建华女儿近照曝光，继承妈妈美貌，网友：难怪林心如失宠	未
霍建华现身华表奖，孤身一人令人心疼，网友：这就是“老干部”	未
霍思燕曝与嗯哼趣事惹杜江吃醋：先过了老子这关	未
霍思燕穿吊带长裙露香肩秀一字锁骨	未
@霍惊觉忒没溜：河东区程林庄道和永宁路交口，河东公园门口的红绿灯坏了一个礼拜了，公园出来锻炼的老年人过马路挺危险的@天津交警设施处	未
霍格沃茨没有赶走伏地魔，但匈牙利“踢走了”中欧大学	未
霍格沃茨消亡史全世界最不像赫奇帕奇的人混入獾院了，你们看着办吧。Outfit：@临时停车场- /Innocent World/Porter Classic /Dr.Martens	未
霍比特之乡	未
霍特将军对巴巴罗萨行动未能达成最终目标的总结与反思	未
霍芬海姆前锋克拉马里奇在和门兴比赛被提前换下很不高兴，据他自己说他已经追平了梅西连续9场进球的成绩，如果本场比赛再进球就能追平C罗连续10场进球的成绩，这样的机会一辈子也就一次，何况梅西和C罗简直不是人（话糙理不糙）赛后克拉马里奇透露，纳格尔斯曼承认压根没听说过这一统计数据	未
霍英东：赤子之心 敢为天下先	未
霍邱9个拆迁户被拆12年没安置！5户主在等待中离世......	未
霍邱城西湖退湖返田水被抽干！真相或是@霍邱大面积停电来袭！快看有没有你家	未
霍邱这些人有福了 明年这些房屋将重点拆迁， 还有补助	未
霍邱这家企业一下要招2000多人！待遇怎么样自己点开看！	未
霍金最担心的发生了刚刚，深圳传来大消息！	未
霍金超级人类预言深圳市医学伦理专家委员会已启动对深圳和美妇儿科医院伦理问题的调查深圳卫计委26日发布关于《世界首例免疫艾滋病的基因编辑婴儿在中国诞生》声明称，根据医疗卫生机构应当在伦理委员会设立之日起3个月内向本机构的执业登记机关备案，经查，深圳和美妇儿科医院医学伦理委员会这一机构未按要求进行备案。深圳市医学伦理专家委员会已于11月26日启动对该事件涉及伦理问题的调查，对媒体报道的该研究项目的伦理审查书真实性进行核实，有关调查结果将及时向公众进行公布。	未
霍霍霍霍 霍霍霍霍 ......等你留言.....	未
//@霎那间eternal:这才是爱国主义教育。	未
霓虹国的火车站台	未
霓虹处处，车水马龙。漫步夜香港，恍惚入梦境。	未
//@霓虹娘:是的，宁愿不再联系，不再相见。	未
//@霓虹娘://@李知了:嗯//@嗷乌乌乌乌乌:所以我没啥安全感//@一朵读书的云:嗯嗯	未
//@霓虹娘://@爆炸的卡夫卡://@苍蓝钢铁:后街女孩	未
霓虹水果价目一览，想要给生病住院的朋友送去果篮一定要再奋斗10年了[bed凌乱]	未
霓虹灯下的日本	未
霓虹灯国霓虹灯，不夜城中夜归人	未
霓虹这走一趟一个人来是完全ok的（只要不是路痴x	未
_//@霜叶: _//@唐缺_九州:家长应该检讨一下，不应该让儿子练七伤拳	未
//@霜叶: 有病	未
//@霜叶://@白城以北://@乐清公安:如有线索，请第一时间联系警方，联系人：方警官 13738733630或110。目前，男孩仍未找到。	未
//@霜叶:看来很有效啊//@楚惜刀: 为什么会送赠品不多想一下//@蓝淋with蓝小咩:这个吃货精神我是真的服	未
霞：奥拉夫你有点短呢英雄联盟	未
霞山这条路的乌黑和油滑情况正在改观	未
霞浦东冲路建设最新进展，2019年春节前限制性通车	未
霞浦人知道吗身份证相片不满意可以重拍了！还是3次！	未
霞浦人速度围观了驾驶证超分逾期未审验，看看有你没?	未
霞浦体育北路新进度，工人正安装照明路灯！	未
霞浦又一家五星级酒店即将开业真相你也许想不到	未
霞浦天气又快要下雨了	未
霞浦天气明天转阴，后天或将下雨	未
霞浦天气未来三天内：雨！雨！雨！	未
霞浦天气未来几天晴好	未
霞浦天气终于转晴了，但是冬天也到了！	未
霞浦天气连日雨天今放晴，树藏珠玉远山青，雨要停了！	未
霞浦天气阴雨连绵，降温持续	未
霞浦松山天后行宫妈祖金身赴台湾巡安	未
霞浦民宿：上帝在人间找到了天堂	未
霞浦男子左腿反复溃烂，久治不愈！到闽东医院一看	未
霞浦老汉烧草引发森林火灾，主动弥补获判轻刑	未
霞浦街头这些行人闯红灯都上电视了，就问你脸红不脸红?	未
露“事业线”的何止是大唐？	未
露天淋浴，交通无信号灯，你愿意在这个国家生活吗	未
露天烧烤最高罚2万！最严大气污染防治条例将实行	未
露天烧烤罚2万！还有30天广西最严大气污染防治条例实施	未
露天焚烧冒起浓烟 高清探头立即捕捉	未
“露天电影院”柬埔寨站巡映活动走进洞里萨湖渔村	未
“露天电影院”柬埔寨站巡映活动走进边远省份拉达纳基里	未
“露天电影院”柬埔寨站巡映活动首次走进上丁省	未
《露天看台报》报道，去年夏天欧文要求离开骑士，詹姆斯在确认自己无法劝说他留队的情况下，向管理层建议用欧文去换利拉德，但未被采纳。	未
露娜姐妹：两个中国女孩，全人类的难题	未
露宿街头120多天，当他遇见这群人之后 结局暖哭！	未
露肚皮是认怂了吧狗我没仔细观察过，我们家喵子互相打着玩什么的，最后有哪个露了肚皮，确实俩人儿就不打了。当然这可能仅限于追跑打闹的范畴，真要是往死里打的时候这招太危险了吧就说这天早晨起来，正是上班的时候，大街上那是车水马龙。这个推着自行车，轧了内个脚一下儿，其实呢就是蹭了点儿泥，没轧重！要说道个歉就完了吧！这位不言语愣走！内个可不干了：哎哎！说你咧！说你咧！恁么长的那么大个子推你妈车留点神！这个一听也不含糊，干嘛！恁么地啦恁么地了，你轧我脚啦！轧你脚活该！应当轧你嘴！我说你	未
露露 君之味 肉松饭团子	未
露露和娜娜长大后能结婚生子吗基因编辑婴儿的法律追问	未
露露和娜娜长大后能结婚生子吗基因编辑婴儿的法律追问学者表示， 目前，基因编辑的副作用并没有得到证实，在尚未发现基因编辑婴儿生育后代存在疾病风险的情况下，结婚生育是她们的基本权利。 露露和娜娜长大后能结婚生子吗基因编辑婴儿的法律追问	未
霸占我的地方。	未
霸屏天下发博称：2018年12月17日0:00起进行上市前筹备系统调整，调整期间用户无法正常登陆霸屏天下APP，现部分调整已经完成，将于17日下午恢复正常登陆。大伙怎么看	未
霸州11岁女孩上学路上离奇失踪	未
霸州12月份限行表出炉，互相转告！	未
霸州一大批车主车牌号被曝光：快看有你吗明日限号2和7	未
霸州一村拆迁！给补偿款和宅基地！快看是哪村	未
霸州人注意了！停车问题要解决了！12月1日起...	未
霸州人都服他一场脑出血，让一位校长变成一个媒婆！	未
霸州众多村里免费发东西！告诉家里人千万别去领！	未
霸州停电通知第158期：这么多村又要停电了，请相互转告！做好保暖工作！	未
霸州司机注意：眼见不为实，开车时，这几个错觉会要命！	未
霸州多家商户空调外机被偷，监控记录了小偷的一举一动！连管都顺走！	未
霸州女司机被交警拦下扣12分喊冤，司机们千万别忽视这一点	未
霸州女子做按摩一次就差点花掉一万六，请看真相	未
霸州实拍公家单位车被毁现场，开车的注意啦明日限号5和0	未
霸州实拍：男子公然让交警照顾被曝光明日不限号	未
霸州家里有小孩的快看下！这项新规定出来了！	未
霸州家里有白墙的都看看吧！！！	未
霸州惊现奇葩违建，线杆竟然被盖在屋里	未
霸州抓捕现场！丈夫背着妻子出手！	未
霸州有过吃水问题的都看看，这个村干部急了	未
霸州村中飘落大量神秘黑灰，村民提心吊胆要求严查	未
霸州涉及十多个村子的重要桥梁将完工，看看你从这过吗	未
霸州警察进村搜查，嫌疑犯逃跑后主动自首	未
霸州还没申领社保障卡的快看！步骤都在这！	未
霸州这个村真牛，出了这么多名人	未
霸州这个镇的总体规划公示，未来生产总值达175亿元！	未
霸州这些地方下周要停电，有你家吗	未
霸州隆泰小区生擒黑衣男子全过程曝光！	未
霸座！202路车上一位大爷提包占座还和全车人争吵！	未
霸座女大闹京沪高铁称想坐哪就坐哪 被拘留7天据法制晚报，近日，在从上海虹桥开往北京南的G170次高铁列车上，一名女子强行霸占他人座位，声称我想坐哪就坐哪，你有本事把我打死，态度蛮横拒不配合列车工作人员工作，并与周围旅客发生肢体冲突，还叫嚣我是女的，你有本事给我打死，我去你 ...全文	未
霸座女大闹京沪高铁称想坐哪就坐哪 被拘留7天据法制晚报，近日，在从上海虹桥开往北京南的G170次高铁列车上，一名女子强行霸占他人座位，声称我想坐哪就坐哪，你有本事把我打死，态度蛮横拒不配合列车工作人员工作，并与周围旅客发生肢体冲突，还叫嚣我是女的，你有本事给我打死，我去你的！ 严重扰乱了公共交通工具上的秩序。目前，该女子被带回派出所依法，并予以行政拘留7日的处罚 。现场视频网页链接	未
“霸座”蔓延到剧院 法律要跟上步伐	未
霸榜一周的ZEPETO，根本不是社交软件！  产品	未
"霸气书记"一言堂节礼照送照收被查处	未
《霸王别姬》公布幕后花絮 张国荣访谈引网友落泪	未
霸王条款已解决!长春市民已收到美团退款	未
霸王条款蚌埠市民到一家洗浴中心洗澡，自带水竟然被没收！	未
霸王防脱洗发水老板脱发？老板录视频：头发还很多	未
霸迪课堂囤多多Neuron切换地方货币流程！	未
//@霸道大锤爱上我: 卧槽 我完事了//@吸吸不健康:他下面真的在滴水//@手机用户芝加哥911://@兰蓝兰鸟_今天TK滚蛋了吗:操他下面还在滴水//@Hexaaaa:你他妈是不是下一秒就要就地筑巢了	未
//@霸道大锤爱上我:卧槽 我完事了//@吸吸不健康:他下面真的在滴水//@手机用户芝加哥911://@兰蓝兰鸟_今天TK滚蛋了吗:操他下面还在滴水//@Hexaaaa:你他妈是不是下一秒就要就地筑巢了	未
//@霸道大锤爱上我: 卧槽看了好糟心//@l鱼苗I:人为什么可以这么坏//@w你雯啊w:暴力血腥内容，这时候怎么不怕未成年人看到买到了//@麗芙Lif:看哭了心里很难受不过作为五年闲鱼塘主也和官方问过相关类似事件，表示平台是无法监管的，因为目前没有对非保护动物的保护法律	未
//@霸道大锤爱上我://@沉佥:还在继续看。转发一下相关。那个做封面和排版设计的姑娘，仅是做了六本书的排版设计，一共才赚了三千一百块钱，且三千一百块非法所得全都退出来了，还要判她四年再罚款一万。如果我国司法系统认可这就是中国法治体现的公平正义。那我真的没什么可说的了。	未
//@霸道大锤爱上我:触目惊心//@洛晨Andrew_Tom:	未
霸道强吻 这是猥亵妇女 男子青岛被拘：我不知道她已婚影视剧中，经常看到霸气男主苦追女主不成，便当场强吻，借此赢得女主芳心的情节。故事大多虚构，与现实还是有区别的。男子强某却信以为真，向女生告白时强制亲吻，没想到却吓跑了女友。近日，记者从城阳检察院获悉，因强制猥亵妇女罪，男子强某被判处有期徒刑8个月（青岛大众网）网页链接	未
霸道总裁脱衣引尖叫 霸道总裁脱衣秀，一言不合就开撕！营销峰会上，中国@喜眠排汗睡衣 董事长，贾千生现场开怼，直指纯棉七大罪状，情绪激动得根本控制不住他寄几，甚至手动开撕，到底发生了什么排汗睡衣又是什么传送门在此，速戳 喜眠旗舰店 了解更多！	未
霸霸说：做出这道题可以休假一天救救阿雀叭！做对第一个送礼物！	未
霸霸还没给阿雀礼物	未
“霹雳一号”重拳出击！南京集中环保销毁1046台赌博机	未
@霹雳大菁菁：19日晚在嘀嗒出行平台上替朋友叫出租车车到终点，司机选择线上支付49元，我用4元券付款45元同时司机让乘车的我朋友扫他二维码付款49元转天聊天才提到我们付两次费用给嘀嗒平台打电话，回复三个工作日内会给回复，四个工作日我继续打电话告诉我暂时没处理完成，我问具体时间，告诉 ...全文	未
霹雳无敌显瘦的下半身合集评zan来3位一起霹雳瘦今晚买啥大家来互抄一下	未
霾不遛弯，老不胡想。	未
霾出没 别戴隐形眼镜多喝水	未
霾 加 重 ，易县人民政府通告来了！	未
霾又要来！不止北方南方这些地方也要遭殃今天，华北黄淮汾渭平原一带的大气扩散条件将进一步转差，霾还将有所加重。今夜是霾最严重时段，河北中南部沿山地区有重度霾，最低能见度仅为1-2公里。周日，受到弱冷空气影响，华北中北部汾渭平原等地霾天气将短暂好转，华北南部黄淮中北部等地霾天气仍将维持。但是！随着冷空气的南下，受污染物传输的影响，本周日到下周三，安徽江苏上海浙江等地也将有霾现身在此期间黄淮江淮一带部分地区早晨还可能出现大雾，局地有能见度不足200米的强浓雾。	未
霾天开车上路如腾云驾雾 交警蜀黍的这些话你一定要听！	未
霾天气里，戴口罩有用吗	未
霾天里戴口罩真的有用么	未
霾头苦干千言万语，我隔着霾带给你	未
霾将走、沙来袭：京津冀今明局地重污染	未
霾将走沙来袭：京津冀今明局地重污染	未
