雾霾一会儿就散！但下周霾风霾风滨海微服务 今日滨海新区天气晴暖，但空气质量较差，白天有中度霾，提醒大家外出要做好健康防护！今日午后将有弱冷空气来袭，届时西北风风力加大，霾自午后开始减弱夜间将彻底消散。展望下周：滨海新区天气多变，冷空气和霾将交替性出现，不过好在整体气温波动不大。17日-18日，高空一直都是西北气流控制，这绝对是个利好消息！这样的天气系统是不利于霾形成的。而19日开始，静稳天气可能才会再度回归。20日，天空云量增多，转为阴天。19-21日，虽然有出现霾天气的可能，但高空始	未
雾霾不散 特巡不止11月29日，宿迁地区一直持续着雾霾天气，国网江苏检修公司宿迁运维站双泗运维班对500千伏双泗变开展了持续的雾天特巡工作。工作人员重点检查支持瓷瓶等绝缘设备有无电晕放电等现象，及时排除各种异常隐患，保证电网可靠运行。	未
雾霾与限行并起，我该逃至三亚还是在城里继续当绿萝	未
雾霾严重，感冒，孩子咳嗽不止，让来自新西兰的秘密武器帮助你	未
雾霾中，一个阜阳人的一天，看完后笑中带着泪.....	未
雾霾中现耐药菌？北京卫计委回应：耐药性和致病性是不同概念	未
雾霾中的王庆坨	未
雾霾中的王庆坨如今的张德，已经放下加工车轮的手艺，他每天都会站在王庆坨镇车站旁，载着一批又一批来王庆坨了解自行车的人，送他们去自己以前最熟悉的工厂风一吹，雾霾就散了，可王庆坨在共享单车的风吹过之后，雾霾却久久没能散去我们现在当务之急要赶紧去库存张全林说道， ...全文	未
雾霾中的王庆坨这个行业完蛋了！我们现在当务之急要赶紧去库存张全林说道，现在王庆坨大的自行车厂基本不做共享单车一年多以前火热的共享单车如今在王庆坨成了一块烫手山芋共享单车的单子我们不做听到询问能不能接共享单车的单子，金鹤自行车厂销售经理严格对财经网表示，现在 ...全文	未
雾霾中的王庆坨这个行业完蛋了！我们现在当务之急要赶紧去库存。张全林说道，现在王庆坨大的自行车厂基本不做共享单车。一年多以前火热的共享单车如今在王庆坨成了一块烫手山芋。共享单车的单子我们不做。听到询问能不能接共享单车的单子，金鹤自行车厂销售经理严格对财经网表示，现在的王庆坨，只有富士达在做青桔单车，这种情况在一年多以前，根本不会出现，自行车厂商们都被坑惨了，主要是钱要不回来，现在如果要接共享单车的单子，必须要拿出一个好的姿态，要么全款到位，要么向厂家预付50以上的预付款。雾霾中的	未
雾霾之下到底是谁污染了我们的环境	未
雾霾之冬哈尔滨	未
雾霾会进入大脑！申城明天起空气污染有所好转	未
雾霾侵入人体全过程	未
雾霾停工！要放假江苏停限产1.2万家工业企业！	未
雾霾克星将在12月2日到达最近几天，雾霾跟锡城杠上了，虽然太阳天天见，但由于雾霾的原因，有点力不从心，上午磨蹭一阵才能见到，天空像隔了一层面纱一样，而明媚的蓝天，一直躲在霾的身后，让人十分失望。其实不光是我们江苏如此，预计一直至12月2日，受静稳天气影响，安徽上海浙江北部等地的雾霾天气也将持续，雾的主要影响时段在夜间至次日上午，霾的影响基本全天都在，这也是今年影响范围最广持续时间最长的雾霾天气过程。预计12月2日起，偏东风增大，雨水会结伴而来，到时候雾和霾天气将逐渐减轻。	未
雾霾再次来袭！全国79个城市发布空气重污染预警	未
雾霾再次锁城！传授你一套雾霾之下的生存法则	未
雾霾再袭河北！局地特强浓雾！高速大范围关闭！（附最新高速路况）	未
雾霾到底会不会导致肺癌	未
雾霾到底会不会导致肺癌？这次我们把知道的事实都告诉你！	未
雾霾到底会不会导致肺癌这次我们把知道的事实都告诉你！	未
雾霾到底会不会导致肺癌这次我们把知道的事实都告诉你	未
雾霾到底有多伤人，你必须知道！	未
雾霾 南京大雾橙色预警北京已经雾了好多天了，最近总感觉嗓子毛毛的，鼻子也很不舒服雾霾天该注意哪些问题呢健康一冬	未
雾霾又双叒叕来了！合肥疾控专家提醒	未
雾霾又双叒叕来了，谁在因祸得福发霾财	未
雾霾又双叒叕来了！这 3 点需注意	未
雾霾又双叒来了我市今起至12月2日大气污染较重	未
雾霾又双叒来了！穹顶之下的我们该如何应对呢！	未
雾霾又来了！杭州一大早白茫茫，微博朋友圈全在瞎拍	未
雾霾又来了，这些防霾误区，你中枪了吗	未
雾霾又来了阜阳发布重污染橙色预警，24日0时启动级响应！！接下来...	未
雾霾又来！北京12月1日凌晨启动重污染黄色预警	未
雾霾又来！北京12月1日凌晨启动重污染黄色预警经中国环境监测总站会商京津冀及周边地区环境监测中心，受不利气象条件影响，12月12日京津冀地区将出现区域污染过程受局地污染积累及周边区域污染传输共同影响，北京市将发生一次中重度污染过程，预计12月2日夜间起扩散条件逐步好转，空气质量将逐 ...全文	未
雾霾又来！北京12月1日凌晨启动重污染黄色预警经中国环境监测总站会商京津冀及周边地区环境监测中心，受不利气象条件影响，12月12日京津冀地区将出现区域污染过程。受局地污染积累及周边区域污染传输共同影响，北京市将发生一次中重度污染过程，预计12月2日夜间起扩散条件逐步好转，空气质量将逐步改善。北京市空气重污染应急指挥部办公室发布空气重污染黄色预警，黄色预警措施于2018年12月1日0时启动实施。（记者 阚枫）	未
雾霾叠加沙尘 辽宁现入冬后首场大范围空气污染	未
雾霾可以吗//@虎岭少年:我 卷土重来@太宰治疗	未
雾霾可怕，更可怕的是我们当TA是个笑话大众  观点	未
雾霾周一，常州的各位亲，明天早上请早点出门！	未
雾霾周一，镇江新区的各位亲，明天早上请早点出门！	未
雾霾在下一盘大棋！靖江市教育局发出重要提醒	未
雾霾在淮安还要赖上两天 冷空气携雨12月2日到	未
雾霾天三连庄，无锡啥时见晴最新消息：再等5天	未
雾霾天不敢开窗！如何选择合适的家用空气净化器?	未
雾霾天，你会给鼻子洗澡吗	未
雾霾天，你的口罩戴对了吗？这几种口罩戴久了反而会生病……	未
雾霾天，你的口罩戴对了吗这几种口罩戴久了反而会生病	未
雾霾天又双叒叕来了！安全行车必备指南，为安全转！26日20时，江苏省重污染天气黄色预警升级为橙色预警。雾霾天视线受阻，给行车安全带来很大的威胁。十面霾伏，如何做好安全驾驶雾霾天行车用车技巧新老司机必备，转！江苏新闻出品（本台记者陈超）	未
雾霾天 可能孩子更容易中招！	未
雾霾天，多吃这四种食物居然真的有用！	未
雾霾天如何P出蓝天白云	未
雾霾天如何做好自我防护	未
雾霾天宝宝一不小心就会咳咳咳！儿童防雾霾攻略送上	未
雾霾天，室内运动安全吗	未
雾霾天怎么挑口罩呼吸科专家的答案是	未
雾霾天，我们可以做些什么	未
雾霾天拍下的幕！这技术上天了...	未
雾霾天来了，可以囤点口罩	未
雾霾天来了，这个周末该怎么过	未
雾霾天来啦，记得戴口罩哦！近日，北方采暖季到来，空气质量较差，室外雾霾弥漫，室内空气不流通，你准备好口罩了吗众多产品中如何挑选到最实用性价比最高的口罩呢什么情况下必须戴口罩呢哪些人群不适合戴口罩戳图全攻略，赶紧收藏转发吧！	未
雾霾天来袭，口罩你戴对了吗中国疾控中心教你5招，远离污染！	未
雾霾天气，在路上的你还好吗？记者探访“水陆空”三路情况	未
雾霾天气对大棚蔬菜的生长有影响吗	未
雾霾天气对蔬菜生长有影响，你了解吗	未
雾霾天气将持续到周末	未
雾霾天气市民外出最好戴N95口罩近期雾霾天气来袭，尤其是进入供暖季，空气污染可能进一步加重。市疾控中心专家建议，雾霾天气市民外出最好戴N95口罩，但戴口罩不宜过久，以不影响正常呼吸为宜。尤其是抵抗力差的老人孩子以及有呼吸系统心血管疾病的人。雾霾天气个人可以为空气改善做些什么专家表示，市民可以少开私家车，尽量乘坐地铁公交等公共交通工具出行。少抽烟，吸烟会导致周围聚集大量有害气体及PM2.5。少吃烧烤减少燃煤使用，同时对污染严重的企业和车辆进行监督举报。（西安晚报记者 张黎娜 西安日报记者	未
雾霾！天气干燥，多雾霾，最近北京南京杭州等地都有，记得喝点糖水既败火又养颜！	未
雾霾天气来袭，待在家里就一定安全吗	未
雾霾天气注意这10件事情	未
雾霾天气行为指南  周五下午茶	未
雾霾天气请注意出行安全	未
雾霾天气还将持续 市民出行请先查询交通信息	未
雾霾天气预警  雾霾天气行车要领，请您收好！	未
雾霾天气高发期来临！兖州人注意外出的防护哦！	未
雾霾天没有口罩怎么能行	未
雾霾天用	未
雾霾天继续，防护不可少	未
雾霾天要注意啥大夫这么说	未
雾霾天该怎样应对近日，我国部分地区多次被雾霾天气侵袭，雾霾对于健康的影响，也一直是公众关注的热点。在雾霾天气下，怎样尽量减小雾霾对身体的伤害如何选择合适的口罩和空气净化器来保护自己请看本期主持人一一为大家解答。@经济日报 雾霾天该怎样应对	未
雾霾天误闯红灯到底罚不罚怎么办	未
雾霾天误闯红灯，算交通违法吗蜀黍统一回复	未
雾霾天跳广场舞 这群大妈够“拼”的！	未
雾霾天，这位奶奶竟然这样对孩子！	未
雾霾天里要不要戴口罩	未
雾霾天防护指南1尽量减少外出时间2出行时做好健康防护，选择合适的口罩3关闭好门窗4多补充维生素和含硒元素的食物5少戴隐形眼镜	未
雾霾太大，大家要注意安全，飞机的看看需不需要改成高铁，看好自己的东西，路上不要着急，明晚七点才开始呢。易烊千玺燚s成人礼亲爱的，这里没有一个人@TFBOYS-易烊千玺	未
雾霾太大！标题看不见了	未
雾霾太大...这个标题已经看不到了	未
雾霾季来临！学会这几招不当人肉吸霾机	未
雾霾 官方公布！郑州解除重污染天气橙色预警！12月5日，郑州市空气质量预测以轻度或中度污染为主12月6日至12月7日，空气质量预测以良或轻度污染为主	未
雾霾对皮肤的严重不利影响了解一下	未
雾霾对策	未
雾霾将持续6天！常州人挺住，最难熬的时候来了	未
雾霾将持续6天！溧阳人挺住，最难熬的时候来了	未
雾霾将持续到30日！家长们 ：什么时候可以放假	未
雾霾将持续到本月底！富阳这个地方的小伙伴却在晒蓝天！	未
雾霾将散 冷雨登场	未
雾霾将散，冷雨登场	未
雾霾席卷全国！79个城市发布空气重污染预警	未
雾霾席卷全国，你是否安全	未
雾霾席卷全国！来碗阿胶润肺汤，拯救你的肺	未
雾霾当下！比德文领尚带你自强不吸！！	未
雾霾成分是啥？哪的霾最“纯”？治霾也需对症下药 南京开展大气污染源清单调查	未
雾霾，我只吸泗阳的......	未
雾霾我走了各位我们上海见一会是剪视频呢还是玩 Switch 呢 北京首都机场T3航站楼	未
雾霾把持的西安，开挂的人生需要什么样的生活?	未
雾霾持续在线，苏州部分学校今日提前放学！	未
雾霾持续 江苏省内机场高速航道启动应急预案	未
雾霾散去，下周大风频频，还你蓝天白云！	未
雾霾是会呼吸的痛 ，坐标南京 微博视频 雾霾是会呼吸的痛(Demo)	未
雾霾暂未散去！明后天冷空气来袭，随它吹啊吹啊	未
雾霾未尽沙尘又来 12月2日前安徽仍多雾霾天这几天，我省多地都被浓浓的雾霾所笼罩，据气象部门预计，一直到12月2日前，我省都将持续雾霾天，而且更糟糕的是，北方的沙尘随着冷空气南下，我省可能将出现雾霾沙尘三者混合的天气，公众出行需戴好口罩气象部门预计12月2日前我省雾霾天气仍将持续，其 ...全文	未
雾霾未散，沙尘要来了！请做好以下防护	未
雾霾来了。	未
雾霾来了！79座城已发布预警！生态环境部12月1日消息，京津冀及周边地区汾渭平原长三角地区北部正在发生一次大气重污染过程。截至11月30日，已有5个城市发布了红色预警73个城市发布了橙色预警1个城市发布了黄色预警，启动应急管控措施。预计此次污染过程中，区域内边界层高度低于500米，且边界层内的逆温效应会持续存在，将导致PM2.5浓度居高不下。12月3日，随着冷空气到来，笼罩在3大区域的雾霾可能逐渐消散。@新华视点	未
雾霾来了可不是The smog is coming！这么说是错的！	未
雾霾来了，吸进肺里的你根本排不出来！每天吃粒这个，堪比万元洗肺！咳嗽痰多的必备	未
雾霾来了 标题快被挡住了	未
雾霾来了！重污染天气蓝色预警今晚18点启动！扬州人请做好防备！	未
雾霾来袭专家出招拯救你的肺	未
雾霾来袭，你的防雾霾口罩选对了吗	未
雾霾来袭！口罩戴起来，建议老人孩子减少出门  新民早报 [2018.11.28]	未
雾霾来袭，学校在什么情况下可以停课呢咱们宁波早有规定！	未
雾霾来袭！山西将出现重污染天气！明天起，这里要实行单双号限行啦！	未
雾霾来袭！山西将出现重污染天气！这些地方单双号限行！	未
雾霾来袭，市教育局提醒	未
雾霾来袭我市发布重污染天气橙色（二级）预警	未
雾霾来袭！本周浙江天气有些戏精	未
雾霾来袭！榆次重污染天气三级预警！中小学幼儿园停止室外课程出门带口罩	未
雾霾来袭，比小米两兄弟还厉害的老兄竟然是他！	未
雾霾来袭 湖北12地启动重污染天气预警	未
雾霾来袭 能见度不足200米 我们在金寨新老城区拍到了这些画面	未
雾霾来袭，请做好防范！	未
雾霾来袭！这些高速和环路已暂时封闭	未
雾霾来袭！除了吃雾霾，还能吃些什么	未
雾霾来袭，靖江学校停课教育局这样说	未
雾霾来袭，鼻子先抗议了！来听听耳鼻喉科主任的健康建议	未
雾霾比非典还可怕，每天喝几杯，增强呼吸系统的抵抗力！牛哥制造	未
雾霾污染笼罩中华大地，节能减排刻不容缓！安装光伏减少雾霾	未
雾霾沙尘  昨天有站点PM10超1000！	未
雾霾沙尘浓雾这些地方出门请注意！	未
雾霾沙尘混合体连环暴击南京启动三级应急管控，工地管住了吗	未
雾霾沙尘综合体暴击无锡！今天的空气质量中度污染！	未
雾霾治理雾霾是一个系统工程！	未
雾霾消散，南京近期阴雨湿冷！	未
雾霾渐散天气转冷，南京近日阴雨模式	未
雾霾滚出靖江吧！靖江第一场雪正在路上	未
雾霾滤镜，不需要下载	未
雾霾的英语到底是 fogsmog 还是 haze	未
雾霾看不清楚路，阜南这位母亲求助交警快救救我孩子	未
雾霾看不清路！阜南这位妈妈急坏了，快救救我的孩子	未
雾霾 科普：早上湿度大，能见度低，就是雾为主，到了中午雾散了，但还是灰蒙蒙，空气质量差，就是霾。气象上，二者是有严格定义的，但生活中二者相伴相生，很正常，大山里的纯净雾这种是极少数。 交小童在这里提醒各位小伙伴们：雾霾天请减少户外运动，出门戴上口罩呀 via @西安气象	未
雾霾笼城 警察叔叔告诉你，交通出行都要注意啥？（视频）	未
雾霾笼罩 14-15日华北黄淮等地有霾12日，黄淮西部江淮江南北部华北南部等地有轻至中度霾。13日受偏东路弱冷空气影响，京津冀东部霾天气略有缓解14日至15日，华北中南部黄淮西部汾渭平原等地大气扩散条件再次转差，将有轻至中度霾，部分地区重度霾天气。低能见度天气	未
雾霾笼罩 中央气象台12月20日06时发布大雾黄色预警20日早晨至上午，河南东部安徽中部江苏北部和西部湖北中东部湖南北部四川盆地等地的部分地区有大雾，其中，江苏西部湖北中部四川盆地的部分地区有能见度不足200米的强浓雾。低能见度天气	未
雾霾笼罩全国大部 79城启动预警措施	未
雾霾笼罩 华北黄淮等地有霾20日，华北中南部黄淮汾渭平原等地有轻至中度霾，部分地区有重度霾21至23日，受冷空气影响，上述地区霾天气减弱或消散24日，华北中南部黄淮西部等地大气扩散条件再次转差，有轻至中度霾25日至26日，受较强冷空气影响，上述地区霾天气减弱消散。此外，20日早晨至上午，河南东部安徽中部江苏北部和西部湖北中东部湖南北部四川盆地等地的部分地区有大雾，其中，江苏西部湖北中部四川盆地的部分地区有能见度不足200米的强浓雾。低能见度天气	未
雾霾笼罩 图个明白一张图认识雾低能见度天气	未
雾霾 笼罩着江南，可真的是上有天堂 下有苏杭了 同学们出行要注意安全鸭	未
雾霾笼罩！这些地方机场、高速出行受影响	未
雾霾等污染天气里，我们该如何保护自己	未
雾霾缓解待何时请再等一天！	未
雾霾耍赖走不走记者带来最新消息...	未
雾、霾联手毁周末 阴天即将转小雨	未
雾霾能堵死肺泡?梳理2016年十大雾霾谣言	未
雾霾蓝	未
雾霾蓝sangle最后10个: 网页链接	未
雾霾袭城！5城红色预警73城橙色预警，3日起逐渐消散生态环境部12月1日消息，京津冀及周边地区汾渭平原长三角地区北部正在发生一次大气重污染过程截至11月30日，已有5个城市发布了红色预警73个城市发布了橙色预警1个城市发布了黄色预警，启动应急管控措施此次受雾霾影响的地区范 ...全文	未
雾霾袭城！5城红色预警73城橙色预警，3日起逐渐消散生态环境部12月1日消息，京津冀及周边地区汾渭平原长三角地区北部正在发生一次大气重污染过程。截至11月30日，已有5个城市发布了红色预警73个城市发布了橙色预警1个城市发布了黄色预警，启动应急管控措施。此次受雾霾影响的地区范围广，是蓝天保卫战的3大重点区域。国家大气污染防治攻关联合中心组织专家会商认为，一股携带沙尘的冷空气在11月27日掠过京津冀及周边地区，北京天津河北的污染在11月28日出现明显缓解，而河南北部山东西北部的	未
雾霾袭城！南京这类房子火了...	未
雾霾袭城时，心已奔向绿水青山	未
雾霾要来了 标题快被挡住了	未
雾霾要来了 ！泽州启动重污染天气黄色预警！	未
雾霾 起床拉开窗帘我看到灰蒙蒙的天评论留下你的地点和天气我来数一下多少人看到了阳光	未
雾霾返场	未
雾霾返场真相	未
雾霾返场真相12月的首个周末，雾锁西湖，霾伏京师据生态环境部消息，那几天，京津冀及周边地区汾渭平原长三角地区北部发生了一次大气重污染过程伴随着戏谑苦笑和津津乐道的，还有被记起的，曾被雾霾支配的无奈与惶恐去年冬天一度蓝天白云，超额完成任务的北京又成焦点民众不解，雾霾只 ...全文	未
雾霾还将持续三天，南京的你准备好了么？	未
雾霾还将持续，出行注意防范！最新天气情况来了	未
雾霾还要再飘一会！（有图有真相）	未
雾霾这些年为雾霾写了多少诗，恨他，更恨背后的一切	未
雾霾进入人体全过程，2分钟就看懂了。	未
雾霾进入人体全过程，2分钟就看懂了	未
雾霾进入人体全过程，2分钟就看懂了，还是戴上口罩吧！	未
雾霾进入人体全过程，2分钟让人震惊！还是戴上口罩吧！	未
雾霾进入人体全过程，分钟就看懂了，还是戴上口罩吧！	未
雾霾进入大脑你能想象吗最近的研究发现，雾霾中的有毒微粒可直接进入大脑，可能诱导老年痴呆症等疾病。研究人员称这项发现令人非常震惊，2016年初，世界卫生组织警告称，空气污染每年导致300多万人过早死亡。小编瑟瑟发抖污染空气毒性微粒可直接进人类大脑 或诱发老年痴呆	未
雾霾造访北京的因素在这里！	未
雾霾那么大 你想死于甲醛还是PM2.5	未
雾霾都冒烟了！今年冬天怎么过啊	未
雾霾都赖私家车崔永元:都是操蛋砖家的鬼话！治霾治车！	未
雾霾重重，施工不止。霾头苦干，自强不吸。哪来的岁月静好，无非是有人替你负重前行罢了。（@国网渭南供电公司王宝宁 张明）	未
雾霾锁城！传授你一套雾霾之下的生存法则	未
雾霾锁城 ！除了宅在家，你还有这些地方可以去！	未
雾霾锁锡城	未
雾/霾防御措施	未
雾霾！雾霾！雾霾！南乐的空气质量有点儿恐怖	未
雾霾高发期请注意防护！2018年冬的第一场雪什么时候到来	未
雾霾黄色预警 西安一幼儿园今日仍开展户外活动，已被教育局叫停！	未
雾霾黑色预警，可见度创今年最亻	未
需不需要上前和她做一番交流	未
需不需要读研，读博，提前逛逛大型的招聘会就知道了！	未
需关注刘恺威7天才能评论？工作室：因微博BUG	未
需要一次断网式假期你可以考虑法国的这些地方	未
需要两方面思考，旧人口红利总会消失，新人口红利，要求的是对高新技术人才的需求，而非传统的低廉劳动力此外，我还看到另一个数据，那就是国家人口规划中提到了，在2021到2030之间中国的人口总数，会达到一个高峰值14.5亿而且比较明显的是人口不均衡，城市的生育欲望下降（尤其是高知人群）， ...全文	未
需要人帮助的时候	未
需要农家散养土鸡土鸡蛋土黑鸡火鸡的看过来	未
需要发布信息的过来！覆盖张家口近100万用户	未
需要呲醒服务吗	未
需要啊//@是VC呀:！！每天提醒自己做一遍//@芒果的化妆间:太需要了//@茯苓有点儿甜:马//@二次元种草机://@小蛮蛮小:了就当做了吧//@江南大野花:颈椎的确不舒服很久//@圆滚滚的明月大魔王:卧槽做完真的感觉舒服多了。。//@不许动举起狗来: 拯救一下脖子	未
需要心理缓冲地带。//@实在界的鬼脸:幻象（比如圣诞老人的存在）是用来构建现实屏蔽创伤的实在界的。你把幻象撕破，等于把别人的现实大厦拆除，让人直面惨淡的实在界。	未
需要手术，请送医。	未
需要抢票的小伙伴注意，元旦假期火车票开售了！	未
需要拼车的看看	未
需要捞一捞	未
需要用金箍棒通一下吗大！ 查看图片	未
需要的收了先吧	未
需要的晚餐自己做了	未
需要的看过来了	未
需要自己一个人去消化	未
需要调整	未
需要车上大家一起来怼这位大妈	未
需要这波回回血	未
需要！！//@阿庙庙: 转需//@一条仰卧的咸鱼干: //@火烧-瓶颈期://@水蒸气西木://@道下一三://@猫大仓:赶紧下单，我的老腰快不行了	未
需要马一下//@C陈鹏:这个马一下。亚马逊商店书不多	未
需要验证的账号都把截图甩在评论里	未
需输血给消防队打电话？2消防员紧急献血	未
震中附近的网友多注意安全	未
“震动模式”开启 阿拉斯加强震后已发生上千次余震	未
震区附近以及感受到震感的桃子们都安全吧吧吧在担心你们	未
震后8年玉树人生活得怎样? 回访带你看不一样的玉树	未
震后厦门有房开裂? 豆腐渣工程露馅? 官方调查结果公布	未
震后的互救方法	未
震天巨响！佛山中心城区惊现迫击炮弹，警察现场引爆	未
震惊.....	未
「震惊」1.9万亿元！连江这个地方竟然值这么多钱！	未
震惊！2018年11月，全国有这么多官员....	未
震惊！2019年放假安排已出，五一只有一天假，更杯具的是	未
震惊！272居然在打篮球	未
震惊！33岁老汉为还债总做如此危险动作！是_____还是_____	未
震惊！3岁小女孩得乳腺癌，全球第三例	未
震惊！3岁小女孩得了乳腺癌，半世纪以来全球第三例 	未
震惊！4岁双胞胎被人推进水坑溺死，凶手竟是	未
震惊！5000元一晚的五星酒店也脏的可怕是时候拿出这些神器护体了！	未
震惊！61天花了104万，揭秘天价医疗背后惊人真相！	未
震惊75000元变成7500亿！女子翻开自己的房产证，惊住了	未
震惊！90后平均负债12万，背后的真相让人害怕！	未
震惊！Supreme/Dior原来与霍格沃茨和广场舞圈联名过	未
