你的冬日暖暖小甜心上线啦	未
你的出行有指望了！NS增加火车班次，每7分钟一列火车！	未
你的前途与未来 一定会如此绽放	未
你的善良 需要带点锋芒！	未
你的嘴角上扬，说明为人生性乐观，因此会有贵人相助，事业运会比较好。鼻头有肉，有财运，会懂得谋取生活。从整体来看你的面相很好，很有福气，是一个良妻的面相。容易动情，性格比较柔软，天真善良，且内心多愁善感，性格温顺，知道疼人，也会婉转处事，与人为善，遇事会让人一步，对待丈夫也很体贴，家庭幸福美满。	未
你的器官需要打扫了吗 减脂健身必备贴	未
你的回血资金，不过滤哦，机会一样	未
你的圣诞树类型	未
你的圣诞礼物愿望cars01车闻	未
你的城市听到雪落的声音了吗?特别是南方的亲们，盖三层被子的话是会窒息哒哈哈，@苏宁易购 门店为大家贴心准备了采暖家电，优惠力度也是66哒欢迎参与话题 年终犒赏季 ，求转发 赶快戳链接，几大百的券拿走不谢，手慢无网页链接	未
你的城市是什么色彩？让城市更有魅力的色彩原来有这么多学问	未
你的好友向你发射6个小可爱，biubiubiu	未
你的好友群群名是什么 估计群很多，说最活跃的那个吧！	未
你的好消息即将迎面而来	未
你的学校几号放假鸭我的票已经买好咯玩出新年味	未
你的家乡有多大盐城一发话，兄弟城市都沉默了...更让人羡慕的是...	未
你的寝室卫生，合格了吗	未
@ 你的小伙伴请你吃火锅！	未
你的小可爱冬瓜正在向你奔来 微博视频 温泉	未
你的小可爱已上线	未
你的小可爱已经饥肠辘辘，请马上投喂！	未
你的平安夜，不过是中国军人用鲜血换来的！因为有了军人的守护，这个平安夜才会平安！致敬！中国军人！平安夜快乐今年平安夜和谁过	未
你的平安，是他们在守护！	未
你的心愿，他们来实现......	未
//@你的心是否会红r:真爷们佩服//@上官荣雲:英雄无畏，真汉子	未
你的心灵常常是战场在这个战场上你的理性与判断和你的热情与嗜欲开战。早安	未
你的成功就是对我最好的答复，其他的我不知道，也不想知道[给你小心心]	未
你的手指很长手掌大，说明你的掌控欲比较强，从事技术性较强行业比较好。爱享受，人很聪明，但也经常被现实冲昏了头。晚婚，在感情中比较现实，实用主义，而且也比较挑剔。在事业和爱情上经历挫折，看你也学了一门手艺，做手艺人很好，安身立命一辈子，不易速求成功。在婚姻大事上最好听听家里建议，早婚较好。手相面相看相算命	未
你的支持 我的动力 金州勇士微博视频	未
你的收入变了吗？——个税改革新变化调查	未
你的收入在这个城市处在哪个位置在香港，若以家庭為單位，統計處最新數字顯示，要成為全港最高收入的一成家庭，月入需要高達8萬元或以上，即相當於年收入過百萬元，而現時全港有16萬個年收入過百萬的家庭。每月收入4萬元以上，即一對夫婦各月入2萬元計算，則其收入已是全港最高的3成。相反，現時全港有逾半家庭收入不足2.49萬元，其中有27.7萬戶月入不足6000元，佔總數11.1。那上海呢如果家庭人均收入超过10.32万，就是全市最富的前20了。以户均2.68人计算，家庭收入超过28万就是前20的高收入阶层	未
你的旧衣服，可能温暖他们一个冬天	未
你的时间很宝贵，应当分给靠谱的人和事 余生，别和打击你的人在一起	未
你的档案竟然如此重要，中共中央印发《干部人事档案工作条例》	未
你的桶！	未
你的梦想我们在乎 可口可乐环保工厂小记者训练营颁奖典礼将于12月1日举行	未
你的法令纹有救了！2秒瞬时治愈，分分钟美到犯规！	未
你的爱用呢	未
你的爱豆会什么特别厉害的小技能	未
你的特别，只有喜欢的人懂	未
你的生育力还好吗如何保护女性生育力	未
你的电动车还能上路吗浙江这个政策一定要了解！关注今天，浙江省政府新闻办举行国家电动自行车新标准及过渡期有关工作安排新闻发布会。国家市场监督管理总局标委会修订发布的《电动自行车安全技术规范》将于明年4月15日起正式实施。浙江从今年11月1日起实施电动自行车新国标过渡期政策。	未
你的电子身份证驾驶证领了吗手把手教你操作！	未
你的磁场，决定你的命运！	未
你的礼物准备好了吗	未
你的行程定好没张家界等你到白头！	未
你的赚钱方式，决定了你的财富层次！（来源：米筐）	未
你的超甜可口大樱桃已经成熟啦，墨尔本最全的摘樱桃吃吃吃游玩攻略在此！	未
你的足球初恋是谁人为何要追星	未
你的逻辑妖艳得远看好像繁殖季节里一只翩翩起舞的孔雀就连全球第一会杠的洋子看到你都自叹不如啊//@不曾来过丶:有空多读书，少杞人忧天。照你这么说，过两年人工智能和机器人技术发展，组装手机都不用人工了，那工人和国家都完了	未
你的音乐色彩，由你定义。索尼h.ear系列无线蓝牙耳机WI-H700，双十二惊喜价等你入手！ 网页链接	未
你的颜值及格没人工智能AI测试_独家	未
你的颜值能打几分华为AI，为你更美想了解前世今生的秘密吗想知道自己的颜值能打几分吗想获取能帮自己颜值加分的有效方法吗戳链接：网页链接上传照片，HUAWEI HiAI为你的颜值打分	未
《你的马克思已上线》改革开放篇	未
你看！大工下雪啦！	未
你真棒！一句话就为民营企业保住几百万！	未
你真棒 . 充满正能量	未
你真的还不够强大//@东风快递员:所以说不要担心韬光养晦已成过往，更不要扯什么虽远必诛厉害我国妖言祸国，因为成长路上始终有个流氓伴你左右敲诈擂肥，在你想要歇口气的时候敲打你，你真的还不够强大。	未
你眼中的嘉峪关是繁华还是文艺这座城市的AB面，等你来说说	未
你眼中的我，才是我最美的样子三亚客户:@吹吹就不疼了吖	未
你知道世界上最温暖的地方是哪里吗余乔问。应该是温带海洋性气候地区。赵云开一本正经地答。不是。那是哪里世界上最温暖的所在，就是你的风衣口袋。往后余生都是你	未
你知道中江小东河河为什么那么干净吗秘密大曝光！！	未
你知道么这样布置灯光，你也可以打造美轮美奂的家！	未
你知道了吗南方电网电费缴费周期调整为每月一次啦！	未
你知道吗下个月樟树这里将举办一场重大活动，千万不要错过哦！！	未
你知道吗在大连，有人悄悄爱着你	未
你知道吗打瞌睡的时候，将热咖啡倒在老板头上，比喝咖啡更能让你清醒。	未
你知道吗社保卡信息采集微信版正式上线运行啦！！	未
你知道吗 祝你幸福的背后 还藏着一句 我依然爱你。 微博视频	未
你知道吗美国2018年原油产量预计全球居首美国能源信息局本周发布的数据显示，美国2018年原油日均产量预期可达创纪录的1088万桶，意味着美国是全球最大产油国。过去十年间，美国石油产出翻了一番多，显示美国页岩油兴起改变全球能源版图。不过，美国页岩油发展伴随环境代价。美国研究人员今年早些时候提醒，美国页岩油气开采的用水量和废水量自2011年开始大幅增加，表明水力压裂法开采对当地水资源的影响更加显著。	未
你知道吗走路都能赚钱了！	未
你知道，哪一座城市最适合你吗	未
你知道哪些有趣的汽车外号今日问答	未
你知道哪几个省的游客特爱到青海旅行吗你能猜到青海各景区哪几个省的游客最多吗	未
你知道哪几个省的游客特爱到青海旅行吗你能猜到青海各景区哪几个省的游客最多吗青海省智慧旅游大数据知道！快来看看有没有你家乡的省份三江源国家大数据基地	未
你知道哪里有好吃的中式点心嘛	未
你知道哪里的人最爱来宁夏旅游吗让动新闻告诉你！	未
你知道我最喜欢什么神么?橘子的眼神2018KPL秋季赛我在KPL王者荣耀职业联赛选手打CALL榜上为@XQ丶Orange 加油啦，和我一起为他打CALL吧，能不能成为年终人气选手就看大家了！KPL选手打CALL榜	未
你知道我爱你啊 查看图片	未
你知道春秋与战国时代的分界事件是什么吗Gadio我们请来了《幽林怪谈》的制作者，做一次特殊的分享。这款游戏选择了春秋战国的时代作为自己的故事背景，那么春秋战国时期都有哪些神奇的故事呢除了三家分晋，还有一场特殊的叛乱结束了春秋，开启了战国时代，这是怎样的一个故事呢有关孙 ...全文	未
你知道最佳的后视镜视角是如何设置吗 via平安南京	未
你知道沙头哪座山最高吗东袍岭竟排在...！	未
你知道淮安158骨干企业吗如何培育姚书记这样说	未
你知道肯德基有个天使餐厅吗这里上演着我们不知道的浪漫	未
你知道这家店吗正准备周年晚会感恩全市人民.....	未
你知道青海的美食酒店旅游胜地等搜索榜单Top10有哪些吗	未
你知道香蕉圣诞树在哪儿吗快来和小黄人们一起寻找吧！关注@ONEWAY 并转发原微博即有机会获得价值1999元小黄人滑雪服等礼品哦	未
你确定要跟着我学吗 查看图片 //@中华小学妹:求萝卜干攻略！	未
你禅坐蒲团，一盏青灯，一方木鱼，几册经卷，潜心修行，淡泊度日。我贪恋烟火，殷实人家，几间瓦房，四方小院，守着流年，幸福安康。皆缘法也。	未
你离一名优秀的地接导游到底有多远	未
你离减税只差一步！ 33个问题答疑，手把手教你办个税抵扣备受关注的《个人所得税专项附加扣除暂行办法》12月22日正式出炉。税务总局所得税司司长罗天舒24日透露，根据初步统计，目前已有800万左右纳税人填报了个税专项附加扣除信息。作为一个上班族，如何通过申领表格填报来履行自己的告知义务 ...全文	未
你离回家只差一张票啦 来领取专属加速包，预约抢票吧	未
你离新中产还有多远中国3000万家庭财富报告	未
你穿的衣服，藏着你什么价值观？	未
你站在阳台上看风景，看风景的人在楼上看你	未
你简单，世界就是童话心复杂，世界就是迷宫。	未
你绝对不知道上高新城区这条路将打造成（）	未
你绝对想不到雍和宫对面，竟然有这样的好地方！	未
你网购时遇到过哪些来自店家客服的超有趣回复	未
你羡慕我，一身潇洒，无牵无挂，我却羡慕你 有家有他有人等你回家。	未
你羡慕竹结构建筑的精美绝伦，那你知道它们是如何建造的吗	未
你能找到几个彩蛋	未
你能第一眼发现蛇吗搞笑幽默趣闻	未
你脱发吗姜酵滋养头发精华液	未
你若不离不弃，我必生死相依	未
你若厚道，我必友之！	未
你若是狮子，何须再炫耀！	未
你若是狮子，何须炫耀	未
你若是福报足够，就可以万事如意！	未
你若盛开 蝴蝶自来	未
你若花开，招蜂引蝶	未
你若酒驾，我就改嫁！ 任丘的司机朋友们：细节关乎生命 ！！！	未
你若重要，他自会想办法留住你。	未
你行你上马路啊//@主治医湿://@糯米糍女孩_://@你不要脸的样子真可爱://@月辞空山:ok//@樱井宁宁貝:谢谢//@张奶霞:成了//@然后下面就没了:我看行//@段子楼:彳亍口巴//@傲娇酋长:办法竟然如此简单//@追剧小鬼才:谢谢提醒，我是行人	未
你装修有找装修中介吗这些信息要看一下哦	未
你要上电视了！关于征集武穴市创新创业典型的通知关于缴纳2018年度养老保险费	未
你要做一个披荆斩棘无所不能的女英雄， 直到遇见能托付一生的人， 再做一个瓶盖都拧不开的小公主。点赞要么恋爱 要么暴富	未
你要做个可爱的姑娘 不烦世事 满心欢喜别恃宠而骄 别卑贱讨好 别睡的太晚 别爱的太满 .	未
你要克服的是你的虚荣心，是你的炫耀欲	未
你要和我计较，我绝对不会大方。你要特别慷慨，我绝对比你敞亮。你心换我心，真心对真心。	未
你要知道 人间值得 因为只你一个	未
你要知道，改变自己比改变环境更重要	未
你见识过 00后的桌贴 吗大部分桌贴以动漫形象为主，画风普遍复杂，光飘逸的头发和飞扬的衣袂就能占据卡贴的一半面积。还有一些桌贴，清一色的明星。还有几位同学的桌贴，是鲁迅式的。手写的简单的几个字，对自己狠一点！有理想，但不理想化柳传志你见识过00后的桌贴吗	未
你见识过00后的桌贴吗大部分桌贴以动漫形象为主，画风普遍复杂，光飘逸的头发和飞扬的衣袂就能占据卡贴的一半面积。还有一些桌贴，清一色的明星。还有几位同学的桌贴，是鲁迅式的。手写的简单的几个字，对自己狠一点！有理想，但不理想化柳传志（南方周末）	未
你见识过00后的桌贴吗大部分桌贴以动漫形象为主，画风普遍复杂，光飘逸的头发和飞扬的衣袂就能占据卡贴的一半面积还有一些桌贴，清一色的明星还有几位同学的桌贴，是鲁迅式的手写的简单的几个字，对自己狠一点！有理想，但不理想化柳传志（南方周末）	未
你见过81路顶层的无锡风光吗也许以后再见不到了！	未
你见过哪些令你瞠目结舌的神逻辑 搞笑幽默趣闻 红人的诞生 V影响力峰会	未
你见过哪些令你难以忘怀的文字招牌简直太沙雕了！ 搞笑幽默趣闻 红人的诞生 V影响力峰会	未
你见过哪些奇葩的问题搞笑幽默趣闻	未
你见过在夜晚发光的银杏吗武侯今日正式开启永不落幕银杏季	未
你见过或经历过哪些令人感动的陌生人的善举	未
你见过或经历过哪些令人感动的陌生人的善举2004年，我13岁。有一天放学回家，看到院子里坐着一个20多岁的男生。手里捧着碗，狼吞虎咽的吃着饭。 我问妈妈他是谁。妈妈说，是外地人。来这里玩，钱包丢了。那时候电话还不普及，联系不到家人。走了一天走到这里。正好妈妈在院子里洗衣服，就进来要 ...全文	未
你见过最豪的土豪有多豪	未
你见过用铁锹上饭吗，怎么吃才好	未
你见过这样的它吗航拍大雾中的南通，仙境一样！	未
你觉得2018年你最大的成就是什么	未
你觉得SVJ最适合什么颜色cars01豪车拍汽车V峰会	未
你觉得一个合格的朋友需要具备什么样的优秀品质	未
你觉得人生什么时候最需要演技	未
你觉得什么样的女孩撒娇成功率高	未
你觉得哪一个城市是追星圣地	未
你觉得哪三个字温暖了你	未
你觉得哪句话是表示我还爱你的意思。	未
你觉得异地恋中最温暖的瞬间有哪些  （转）	未
你觉得这名中学生说的话，有道理吗中学生bucketscenter：杜兰特伦纳德和戴维斯这三位攻防兼备的精英球员，无法像勒布朗-詹姆斯和史蒂芬-库里一样带领球队达到更高水平，因为他们的进攻组织和领导能力的缺乏！热心网友杜兰特评论：兄弟，滚回去打扫你的宿舍吧，你根本不懂篮球。	未
你觉得这段话送给谁家的粉丝比较合适	未
你认为驾车最应该注意哪个细节? 开车门，看似一个不经意的动作，却能酿成大祸，推荐大家停车后先开一条拳头大小的缝隙，用离车门最远的那只手去开车门，观察清楚后确再下车重细节平安行	未
你认识的人有什么怪癖 一起来分享下吧蜀黍夜查酒驾时刻精神抖擞，不能放过一醉猫	未
你让城市美一点，我们让你暖一点关注深夜环卫工，关爱户外工作者！武汉国美响应倡议，设置24个暖冬驿站！冬日的户外工作者们，累了这里来歇脚，渴了这里有热水，冷了这里来取暖为爱心企业点赞！@武汉城管@武汉国美	未
你让城市美一点，我们让你暖一点关注深夜环卫工，关爱户外工作者！@湖北格力电器 响应倡议，设置37个暖冬驿站！冬日的户外工作者们，累了这里来歇脚，渴了这里有热水，冷了这里来取暖为爱心企业点赞！@武汉城管	未
你该配眼镜了，当然还有理解力也要提高。//@捉迷藏50876:你是那只眼看见四线及以下城市以ov为主了	未
你说什么，我都敢答 真乐无界神武3第十二届音乐盛典咪咕汇 Rhythm狠角色@沙楠杰 狂野来袭。 想提问沙楠杰的小鲨鱼在哪里评论区留下你最想问沙沙的一个问题，12月8日松下电器咪咕汇客厅 现场就有可能被沙楠杰翻牌回答哟！ 快来评论区提问沙沙吧！锁定：网页链接 观看咪咕汇直播，了解更多音乐盛典咪咕汇 精彩内容戳：网页链接 @神武3官博 @咪咕汇 沙楠杰咪咕汇	未
你说什么，我都敢答 真乐无界神武3第十二届音乐盛典咪咕汇，@TIA袁娅维 将做客12月8日松下电器咪咕汇客厅，接受咪咕菌的访问！[给你小心心] 宝宝们有什么想问的问题都可以在这条微博下写出来！届时，袁娅维 将有可能从评论区里pick其中一个问题来回答！谁会被翻牌呢 锁定：网页链接 观看咪咕汇直播，了解更多音乐盛典咪咕汇 精彩内容戳：网页链接 @神武3官博 @咪咕汇 袁娅维咪咕汇	未
你说什么，我都敢答 真乐无界神武3第十二届音乐盛典咪咕汇，真乐匠人@李剑青JQ 将做客12月8日松下电器咪咕汇客厅。 在本微博留下你最想提问的问题，咪咕菌将有可能会在评论里pick一位，被李剑青翻牌回答哦 各位段子手还在等什么赶紧行动吧！锁定：网页链接 观看咪咕汇直播，了解更多音乐盛典咪咕汇 精彩内容戳：网页链接 @神武3官博 @咪咕汇 李剑青咪咕汇	未
你说啊 人一生那么短还要花时间爱错的人何必啊 潇洒一点不好吗做你爱做的事 去爱现在对你好的人去尝试接受你曾经拒绝的人你会发现 每个人 都比他好	未
你说，我们就山居于此吧。胭脂用尽时，桃花就开了。下载网易薄荷 ，遇见薄荷遇见你下载传送门 gtgt网页链接	未
你说牛不牛，2018最具幸福感城市，南京竟然	未
你说的非常有道理。没钱喝劣酒住贫民窟才是真正的幸福。@修善止恶：有钱喝名酒住大别墅的人不一定幸福。	未
你说红叶那么美，我说是的	未
你说：青年兴则国兴我做：少年强则国强！你之所念我之所应 公益路途，你的带领，我们从不停歇 尽我所能，为更多孩子带去明天希望。学识学善学人，当作少年强易烊千玺燚s成人礼	未
你负责貌美如花，我负责健康安全	未
你走了，说祝我幸福。就像一个贼偷走了我所有的钱，还留言说，恭喜发财。网易云音乐《也罢》热评	未
你走了 说祝我幸福就像一个贼偷走了我所有的钱还留言说 恭喜发财 网易云音乐热评《也罢》情感	未
你走的每一步 都为他们增加了一度温暖冬天，对于大多数人而言是一个浪漫的季节，但是对于那些需要帮助的那些人而言，冬天却是一个难熬的季节。今年，上千人在二郎山喇叭河景区参与暖冬行动众筹十亿步挑战，为需要帮助的人送去一份温暖。这个冬天我们与您一起多一步多一度温暖，携一颗爱心上路	未
你越催，孩子越磨蹭！试试这4招，专治孩子磨蹭，太管用了！	未
你跑啊跑追上梦里的那个自己吗晚安小伙伴们FiersdetreBleus 法国队	未
你跪地救人的样子，真的很帅！	未
你身边人缘好的人是否具有以下面相特征呢赶紧看看吧！1面带酒窝还爱笑，这种人不管男女都非常的招人喜欢，特别是长辈或者领导，就喜欢这种表面看起来就乖巧懂事的孩子。2下巴苹果有内凹，这种人福气满满通常会有着非常不错的人缘，他们的晚年生活也会比较的富足。3捧场纹深刻受追捧，这种人不管是作为明星又或者是深入职场，都比较的有号召力，通常会收获不少的追随者，而且贵人缘旺盛。4桃花眼含情有桃花，桃花眼的人异性缘分好是众所周知的，这种人在事业或者是生活上面可以获得异性的帮助。5卧蚕丰盈惹人爱，卧蚕位置丰盈饱满	未
你身边发生过什么微不足道的温暖小事_________________	未
你身边有来大连旅游带了海水当纪念品的朋友吗	未
你身边的巾帼典型  巾帼传大爱，汇力暖人心	未
你输入@ 之后出的第三个人将在这个寒冷的冬天给你带来温暖	未
你过生日都收到过什么奇葩祝福语哈哈哈哈哈	未
你过的好吗	未
你还不知道吧！盐城这个地方的芦花美的令人窒息！	未
你还在打卡景点走马观花 这些会流淌的景象才是人生必不可少的感知！	未
你还在找工作吗这里招聘多岗位人员，符合的快快报名....	未
你还在挖沟埋管子吗?管道快车走一趟全解决啦	未
你还得有能力	未
你还是个不谙世事的孩子，却在我胸膛埋下了火的种子什么时候觉得当兵很骄傲就是这个时候！（CNR国防时空）一号哨位	未
你还有一封利是未领取！关于谷饶文化节...	未
你还有多少惊喜是朕不知道的！//@pangpanggxx:something special	未
你还没去打卡吗明天起，港珠澳大桥穿梭巴士网上限量售票！	未
你这不环保！应该找三四个运输车，一车七八辆全部拉走，公共交通能耗低//@王铜根:你这个问题很好！最佳方案是找20辆板车拖着走，这样不仅解决了续航问题，还实现了自动驾驶。用的时间也最短。//@小南菲:若是蔚来车主集体自驾游，20台车同时出行，如何保证全部同行无一人一车掉队	未
你这气质，一看就是卖电瓶的......刷爆了蓄电池人的朋友圈！	未
你选择了新欢， 我选择了时间	未
你遇到过最温暖的瞬间是什么	未
《你那么甜呀》圣妖新书爆宠来袭！	未
你那叫健身吗让大爷大妈告诉你什么才是真正的健身！众所周知，在所有健身形式中，街头健身最为酷炫。 而老年健身就抓住了这一点，有句老话说的好：健身房出的都是死肌肉，市井里练的才是真修行。 也正是因为如此，诸如高手在民间大隐隐于市的名言才会如此令人信服。网页链接	未
你那里下雪了吗有照片的不妨贴张上来也让我过过眼瘾	未
你那里下雪了吗郧西明天开始将迎来雪景！	未
你邱的不定期塞环节直.接.赞 揪一位小可爱送这支阿玛尼400记得关.注我哦，后天就开[给你小心心][给你小心心][给你小心心]	未
你都不知道他们为了收获那份荣耀，克服了多少难以忍受的痛苦！NBA吐槽大会	未
你都二十五了，有些事情都要懂得了！--分享一些为人处世待人接物的实用技巧	未
你都吃过了吗！我县新增7家省级名特优食品作坊	未
你问我为什么喜欢一个人出去旅行，这就是我的回答。不止旅行 v影响力峰会 @微博旅游	未
你问我，喜欢和爱有什么区别我会回答你：大概就是喜欢一朵花会把它摘下来带回家，爱上一朵花会保有它的自然并为它浇水吧。	未
你问我猜 有请高玩们来看看是什么游戏具体游戏内容是一个小兵去救同伴，获救的同伴有各种各样的能力会加入你的队伍一起救人，求解！	未
你问我猜真有味，青口镇把这项工作玩得不亦乐乎	未
你随手一扔，我耗尽一生！转发即是公益	未
你难以想象的一种老鼠：保护人类生命，备受当地人尊敬	未
你需要每个月赚多少钱才有安全感 小目标 1个亿吧	未
你需要海王的拥抱吗	未
你需要这件羽绒背心 保护你的温暖和风度	未
你靠什么在单位立足	未
你风光时，有无数人绕你周围，但真心为你高兴的没有几个	未
你马上会收到一个好消息	未
佤族歌手杨伟农一首《生活的挑战》	未
佩斯科夫说俄将继续保持与美沟通	未
佩服！102岁奶奶一跃而起，成为全球最年长跳伞玩家澳大利亚一名102岁高龄的老奶奶日前刷新世界纪录，她跟着教练从4300米的高空一跃而下，成为全球最年长的跳伞玩家她跳伞原因不单纯想打破世界纪录，而是想替澳洲运动神经元疾病慈善基金会筹募研究基金10年前，老奶奶67岁的女儿死于这个疾病 ...全文	未
佩服！102岁奶奶一跃而起，成为全球最年长跳伞玩家澳大利亚一名102岁高龄的老奶奶日前刷新世界纪录，她跟着教练从4300米的高空一跃而下，成为全球最年长的跳伞玩家。她跳伞原因不单纯想打破世界纪录，而是想替澳洲运动神经元疾病慈善基金会筹募研究基金。10年前，老奶奶67岁的女儿死于这个疾病，基于对女儿的思念，她想贡献自己微薄的力量，透过跳伞提高民众对该疾病的关注。	未
佩服！去附近小旅馆找找	未
