佩服！站着地铁车厢写作业 这几名南昌中学生红了12月19日下午6点左右，南昌地铁上，三名女学生在噪杂的环境中，站着写化学作业。遇到问题，大家会在一起小声讨论，认真学习的模样引来周边乘客的围观。	未
佩服第一夫人有胆量乘坐此型飞机，难道是“特没谱”想换老婆了？	未
佩杜拉：法布雷加斯希望获得更多的上场时间，西班牙人手上有不少邀约（不仅仅来自欧洲球队），不过鉴于米兰与切尔西不错的合作关系，红黑军团最终得到法布雷加斯的可能性更高。目前各方的情况都比较平静，等待接下去的谈判进展情况。米兰还在跟踪观察萨索洛的邓肯，而切尔西也在积极寻找一旦法布雷加斯离队后的替换人选。	未
佩纳宫，始建于1840年，十九世纪葡萄牙女王玛丽雅二世的丈夫费迪南德的心血，于1995年获联合国教科文组织列为世界遗产。	未
佰草集12月14日盛典活动抢票中奖名单经审核确认及联系，佰草集盛典活动中票名单已经全部产生，现公布如下，恭喜18位幸运粉丝！配图1，为本次Owhat抢票情况，标注合格者为中票者，共13位。配图23，为此前活动名额顺延情况，绿色标注为本次活动中票者，共5位。本次活动实行实名制准入管理，抢票成功者谨记带上本人身份证到场核验身份。名额不得代领不得私下转让，如有发现将取消资格。希望大家听从现场安排，注意安全。近来京城天气较冷，大家注意防寒保暖！这个周五，我们在北京等你@李易峰，不见不散爱上李易峰的	未
佳兆业再获民生银行200亿金融支持	未
佳兆业再获民生银行金融支持200亿	未
佳兆业物业将于12月6日上市 集资净额约2.6亿港元	未
佳兆业物业香港上市筹资3.28亿港元	未
佳和广场  从来不玩虚的！ 3重豪礼等您拿，嗨翻黄金12月！	未
佳木斯  一周停电信息！小伙伴注意一下！	未
佳木斯  元旦小长假和学生票购买攻略来啦	未
“佳木斯大米”标准体系出炉	未
佳木斯  招聘培训：月嫂育婴师催乳师保姆钟点工护工	未
佳木斯机场旅客年吞吐量超80万人次 开辟国内国际航线12条	未
佳源超市低至4.9折起！年终大促来袭！就在12月8日12月16日...	未
佳菱社区歌咏组开课啦	未
《使命召唤14：二战》大锤工作室联合创始人离职动视Sledgehammer Games和动视之间的合作是个非常成功的典型案例。该工作室由前EA Visceral的老将们创立，首先与Infinity Ward合作开发了《使命召唤8：现代战争3》，然后开发了广受欢迎的《使命召唤11：高级战争》，在去年也带来了工作室迄今为止最大的成功《使命召唤14：二战》。据称Sledgehammer联合创始人Glen Schofield将在今年年底退出动视。	未
使命召唤天涯行动  探享延续，天涯行动即将开启	未
《使命召唤》电影已计划续集 邀《黑豹》编剧写剧本	未
《使命召唤 黑色行动4》增加新的迷彩及角色在圣诞节期间的升级之后，现在玩家们可以在本作中通过使用COD点数解锁终极版的Takeo Masaki，并且还可以使用新的枪械迷彩Cipher Reactive Camo。	未
使民间资本进得来稳得住能发展	未
使用PSVR感受宇多田光LIVE现场伴随《王国之心3》OP影像公开，PlayStation 官方还公开了一条关于宇多田光的新消息。2018年宇多田光举办的巡回演唱会Hikaru Utada Laughter in the Dark Tour 2018将推出PS VR应用，PS PLUS会员将可在12月25日先行观赏收录有《王国之心》主题曲《光》的版本，利用PS VR体验LIVE现场氛围。而收录《誓》（《王国之心3》ED曲）与《光》两曲的完整版本会在2019年推出，所有玩家均可免费下载使用。	未
使用过一次性杯子不要丢，简单改造下，一年能帮你省不少钱	未
使量子力学现象成为可能！已创造出超冷量子混合物	未
使馆圣诞礼物来了Spy装备。	未
侃报名尝鲜！上门试驾，不一样的体验！	未
侃报名明天下午，还有一场，北京现代全场送礼！	未
侃爷Kanye West圣诞节全家福。	未
[來]//@纯朴的路人喇嘛:能去的都去吧。团票可以特价	未
《侍魂》新作2019年2季度发售SNK在IPO新闻发布会上宣布，《侍魂》新作将于2019年第二季度发售，登陆PS4/Xbox One/PC/NS平台。这款游戏采用了虚幻4引擎制作，霸王丸娜可露露加尔福特等历代人气角色将以崭新的视觉表现开展激烈的战斗。另外SNK还宣布《拳皇15》预计会在2020年推出。	未
《侍魂》新作即将上线，《拳皇15》正在开发SNK在媒体会议上公布：《侍魂》新作计划于2019年第二季度登陆PC/PS4/Xbox One/NS平台。《拳皇15》正在开发，预计2020年发售。	未
《侍魂》新作将于明年第2季度发售 《拳皇15》开发中今年9月SNK公布了3D《侍魂》新作，新作使用虚幻4引擎打造，画面非常出色。今日SNK在韩国举办IPO记者会，在会上介绍了SNK的业务情况与未来展望。SNK宣布《侍魂》新作将于2019年第二季度发售，登陆PC，PS4，Xbox One和NS平台。而《拳皇》系列新作《拳皇15》已在开发中，准备在2020年推出。腾讯旗下工作室正在开发的一款《合金弹头》手游，也将于2020年面世。	未
《侍魂》系列家用机新作将于 2019 年 第二季度登陆 Nintendo Switch 和其它多平台！此外《拳皇XV》（平台未介绍）和《合金弹头》手游新作预计 2020 年发售。《拳皇XIV》确认即将登陆 Nintendo Switch。SNK 提到，中国市场非常重要，不容忽视。	未
《侍魂：胧月传说》评测：樱花盛开之时，剑客归来之日	未
供大家参考//@选股宝APP:发现一个医药搅局者！毛利高达80，完全不受带量采集影响，它颠覆1000亿市场的独创项目有重磅进展	未
供大家参考//@选股宝APP:国内唯一10倍以上渗透率毛利60连续6个季度业绩增速100	未
供好水服好务  云南省城镇供水协会临沧市2018年供水交流会在沧源县召开	未
供应链金融如何促进产业融合	未
供暖了，为啥她家温暖如春，温度高达26度呢	未
供暖了！供暖了！大昆明要供暖了！12月1日开始，如何申报速看这里	未
供暖了！供暖了！大昆明要供暖了！每立方2.95元，你怎么看	未
供暖倒计时!衡水将于11月10日正式供暖	未
供暖啦取暖小贴士了解一下！河南曝小区收蹭暖费：不用也要缴一半，不缴就停水停电！你怎么看另，关于暖气，你了解多少在供暖前应该做好哪些准备供暖后又需注意哪些问题呢这些容易被忽视的取暖小贴士get一下！想抱暖气！via新华网气象生活 小区蹭暖费 不用也要缴一半	未
供暖季小贴士  暖身 暖心 暖万家（内附H5）.....	未
供暖季聚焦天然气：光汇石油布局天然气供需未来可期	未
供暖气象指数（等级）预报	未
供暖第一天，大雾	未
供电不过夜 取暖有保障12月7日，滨州气温骤降至零下9度，高新区园丁小区空气源热泵设备及配套变压器安装完毕，这是全区首家新能源供暖社区。@国网滨州市滨城区供电公司 上午收到验收申请后，立组织验收送电，并巡检配电设备，消除安全隐患，第一时间为居民冬日清洁取暖提供了电力保障。	未
供电人的凌晨三点钟11月29日凌晨三点钟，@国网淄博供电公司 工作人员前往220千伏冯旺站，经过4个小时，圆满完成1号和2号主变等停电操作，为该站新上间隔扩建设备修试等工作奠定基础。	未
供电保电提质量 新线投运惠民生12月4日，@国网日照供电公司 人员对35千伏黄墩站新建10千伏双疃线路进行电缆压接试验，并将用户接入新线，至此新线正式投运，旧线退出运行，惠及黄墩镇21个村的7556户居民，使88个10千伏变电台区的电压质量得到有效提升，为确保公司迎峰度冬打下基础。	未
供电所长阿不力米提·买买提：服务家乡是责任也是机遇	未
供电设备消缺忙 寒潮考验不慌张下轮寒潮即将来袭，12月17日，@国网莘县供电公司 员工来到35千伏齐南站开展消缺工作。此次消缺工作主要为解决铜铝过度线夹老化发热这一问题，工作人员将所有线夹更换一新，提升了刀闸可靠运行系数，保障变电站设备在用电高峰期稳定运行。	未
供给侧结构性改革持续发力显成效	未
依依美装秀香香莉的鞋子和马威的活动都木有了，反馈都挺不错滴	未
依图医疗发布全球首个AI全部位辅助诊断产品	未
依图科技入局语音识别，欲借助高精确度算法促进行业透明化	未
依图科技发布语音开放平台联袂微软、华为布局语音市场	未
依山临江！贵安周边这个生态公园步行道美翻了！来次富氧清肺之行吧	未
依旧很大，今晚你还领嘛晚安	未
依法治理改革创新  回应期盼路畅人安	未
依赖型人格，说的是你吗@思维派：不要像个落难者，告诉所有人你的不幸 //@活出精彩的小白：坚强，独立变优秀并不容易 //@考研小周老师：学会与自我相处，享受孤独 //@Baasha：孤独不是一件可耻的事 //@与你同舟_：学会奖励自己嘻嘻 //@鎏七七：爱你的人需要你的依赖，那样会给他们一种安全感！	未
依靠企业家精神才能闯出新路	未
依靠多品牌战略，金陵饭店能否“逆袭”？	未
侠哥怎么不多买点呢说实话，现在运行趋势是向下，线下运行，观望是最好的操作，多买点买错了，就赔大了！而且这么多粉丝机构都看着微博，一旦失误，那损失可就老了！大多数人也不止损，买股做短线就又成中线了。所以先搞点，解闷玩，今天黄上白下的队形，而且也到技术支撑位了。	未
侠客岛:为什么说这是今年最值得关注的国际大事？	未
侠客岛：壮阔山河 一路改革	未
侠客岛：壮阔山河，一路改革	未
侠客岛:改革开放40周年 读懂习近平讲话背后的真问题	未
侠盗勇士2019春季赛LPLampLDL出战阵容rw侠客行	未
《侠路相逢》定档12月21日 邵兵姜武双雄对决	未
侦探入门级测试	未
侦破连环画《追踪》(吉林)-刘凤山	未
侧记  向乌兰牧骑致敬内蒙古大兴安岭乌兰牧骑赴首府演出侧记之二	未
侧记  绿色长城的印记 内蒙古大兴安岭乌兰牧骑赴首府演出侧记之一	未
侨建骑楼获立法保护 福建泉州守住侨乡“根”与“魂”	未
“侨爱心光明行”为缅甸曼德勒２００名患者复明	未
“侨爱心光明行”走进缅甸	未
“侨爱心光明行”走进缅甸（侨情乡讯）	未
侨爱播洒甘肃藏区：“马背电视”助牧民打开外面的世界	未
侯明昊 午好，今天也是被侯明昊爱心包围的一天	未
侯明昊 嘉人星动一下路易威登VVV上海和嘉人首位私人导览师@侯明昊Neo 一起穿越旅行，体验@路易威登 的经典美学。 侯明昊LV穿越旅行	未
侯村乡这个村子迎来大喜事！老乡们有福了	未
侯鸿亮称拍《知否》冯绍峰赵丽颖深入了解很默契 	未
侯鸿亮谈赵丽颖冯绍峰恋情：《知否》前就好上了	未
侵华日军南京大屠杀遇难同胞纪念馆，位于南京市建邺区水西门大街418号，通称江东门纪念馆，选址于南京大屠杀江东门集体屠杀遗址及遇难者丛葬地，是中国首批国家一级博物馆，首批全国爱国主义教育示范基地，全国重点文物保护单位，首批国家级抗战纪念设施遗址名录，也是国际公认的二战期间三大惨案纪念馆之一。愿哀思不忘，警钟常鸣，铭记历史，不断向前。	未
便利丨倒计时！福州城区到闽侯只要5分钟！洪山桥右幅桥零点通车！（附视频）	未
便利北京南站出租车排队时间可手机查询	未
便利！在江门地区办理社保卡可以即办即取！	未
便利店可以买药了？首家“便利药店”落户北京朝阳	未
便利店可以卖药了 首家获证店今天落户北京朝阳	未
便利店售药政策落地！北京第一家落户朝阳	未
便利店 如何让夜间消费更便利？	未
便利店，如何让夜间消费更便利？	未
便利店，如何让夜间消费更便利买洗发水吃快餐购报纸杂志小区门口24小时提供服务的便利店，是许多城市街头的一道风景，也成为消费者夜间购物的便利之选。（ 新华网）	未
便利店，如何让夜间消费更便利？(图)	未
便利店开始卖药了？首家“便利药店”落户北京朝阳	未
便利店里可买药 京城有了第一家	未
便利提前30分钟！南马期间地铁运营时间这样调整	未
便利来袭，以后坐高铁，不用换纸质车票，明年全国推广！	未
便利贴 长沙可能要下雪啦长沙市气象局发布强冷空气及雨雪天气消息：预计6-8日，受强冷空气影响，长沙气温降幅68，有小到中雨，北风45级阵风6级 8-9日最低气温0度左右，山区-4-2，大部分地区有雨夹雪或冰雨，高寒山区有中雪及轻冰冻大家要注意防寒保暖呀！图：长沙市气象 ...全文	未
便利  金华司机注意！市区出现一批提前掉头信号灯，等待时间直降！	未
“便利”金融飞入寻常“农户”家	未
便利  银川第一座有直梯的过街天桥正式开放！位置就在这儿！	未
便利首测成功！你的海淘商品可以买火车票回来了	未
便宜	未
便宜的好货如何迎来“野百合的春天”	未
便捷！这些车管业务不用跑车管所了！	未
便民10条铁路新线年底开通！1月5日起启用新运行图	未
便民12月4日更新：洪江区圆通速递招快递员1名等	未
便民丨建平县内最新供求信息免费发布2018.11.24	未
便民丨建平县内最新供求信息免费发布2018.11.28	未
便民丨永安警邮合作再加力，实现邮政22个网点代办10项交管业务	未
便民丨沪60岁以上老年人可免费接种肺炎疫苗	未
便民中卫人以后办身份证就像去ATM机上取钱一样方便，24小时自助服务！	未
便民中心城区开通43路公交车，方便市民前往平凉市政务服务中心	未
便民举措深入落实放管服 为群众省事省力	未
便民信息11月23日精选招聘，房屋出售出租，中影影讯，店铺转让信息	未
便民信息11月26日精选招聘，房屋出售出租，中影影讯，店铺转让信息	未
便民信息11月27日精选招聘，房屋出售出租，中影影讯，店铺转让信息	未
便民信息11月28日精选招聘，房屋出售出租，中影影讯，店铺转让信息	未
便民信息11月30日精选招聘，房屋出售出租，中影影讯，店铺转让信息	未
便民信息12月01日精选招聘，房屋出售出租，中影影讯，店铺转让信息	未
便民信息12月04日精选招聘，房屋出售出租，中影影讯，店铺转让信息	未
便民信息今天的便民信息和停电信息为你送达啦！	未
便民信息今日的便民信息已为您送达！	未
便民信息免费发 东胜最新的出售出租及招聘信息看这里！	未
便民信息免费发布招聘求职出租等便民信息...	未
便民信息固始今日最新房屋招聘店铺信息推荐！（140期）	未
便民信息固始今日最新房屋招聘店铺信息推荐！（142期）	未
便民信息土狗免费送房屋出租，求职招聘信息已更新2018.12.2！	未
便民信息 在咸丰招员工找工作租房子......信息免费发布！	未
便民信息好消息！年底江阴苏通等5座跨江大桥收费站退休小鱼从交通部门获悉，根据国家统一部署，今年底我省将率先试点取消与山东省之间的全部5个高速公路省界收费站，同步要拆除的还包括除南京二桥南京三桥崇启大桥之外的其他5座省内跨江大桥主线收费站，打通高速公路堵点，让出行更顺畅。不过，收费站的拆除，并不意味着不用缴费。相关负责人介绍，这10个收费站应该称为物理拆除，收费大棚今后不存在了，取而代之的是电子感应的龙门架。车辆进入高速公路时领取一张内置传感器的通行卡，记录车辆通行路径信息，在出高	未
便民信息崇阳最新的招聘，快点找个工作，赚钱过年啦！	未
便民信息巧匠装饰启慧教育好机会等你报名！信息已更新2018.12.5！	未
便民信息招聘活动通告/招聘求职/房屋租售，今天为您准时送达！	未
便民信息  晋源区房屋出租 招聘求职 征婚交友 免费发布	未
便民信息最新招聘信息汇总/计生局旁带阁楼的好房子出售/西港桥房屋出租/超市转让	未
便民信息最新鲜的扶沟县求职招聘房屋出租买卖各类信息	未
便民信息第1055期新兴找工作租房 ，点击左下角新兴通	未
便民信息第1056期新兴找工作租房 ，点击左下角新兴通	未
便民信息第1057期新兴找工作租房 ，点击左下角新兴通	未
便民信息第1059期新兴找工作租房 ，点击左下角新兴通 新兴县风情网  昨天	未
便民信息第1068期新兴找工作租房 ，点击左下角新兴通	未
便民信息运城万达广场3楼吉普专柜，招聘数名导购，年龄20-35岁	未
便民信息逸夫小学附近一营业中饭店急转，五十平米，设备齐全。附近学校，公寓，办公楼	未
便民信息金洛郎自助烤肉必斐艾食品好工作等你报名！信息已更新2018.12.7！	未
便民信息：长期收购砂糖橘招聘	未
便民信息随州领秀传媒招人啦各种房屋租售....	未
便民出行必备！明光城区新增一公交线路！	未
便民利民粤省事，越来越省事！	未
便民区办税服务厅迁新居47项证明不用开戳进速看，别错过梁平这些好消息！	未
便民医讯好消息！长阳县医院开通自助机挂号缴费服务啦	未
便民博野最新招聘求职信息（2018年11月27日）	未
便民博野最新招聘求职信息（2018年11月30日）	未
便民又一实事项目落地！嘉定即将新建1个医疗急救分站！	未
便民发布20181123期新增宝丰本地热门招聘求职房屋租售生活服务信息都在这里了，速来围观！	未
便民发布20181128期新增宝丰本地热门招聘求职房屋租售生活服务信息都在这里了，速来围观！	未
便民吴忠本地生活资讯	未
便民塘桥，董家渡轮渡站恢复营运！！！	未
便民好消息！明日起这里也能坐上去合肥的车了！	未
便民好消息！永康掌上医院上线，所有公立医院挂号缴费免排队！	未
便民！@容桂街坊，身份证上的照片可以重拍三次啦！	未
便民常德市政务中心办证免费快递到家	未
便民府谷这些公交车可扫码付费了！快来看看怎么用！	未
便民惠民便民蔬菜直销点 便民利民暖民心	未
便民！我市启动社银联通工程，首批6个银行网点可代办这17项社保业务	未
便民找工作找房子就上乐活万年！	未
便民招聘家具厂家教护士等！更多招聘便民信息上南康在线网！	未
便民招聘家具厂帮工等！更多招聘便民信息上南康在线网！	未
便民招聘收银汽修师傅家具招聘，生活服务等信息	未
便民招聘收银电话客服仓管等！更多招聘便民信息上南康在线网！	未
便民招聘求职出租转让等分类信息 - 免费登记 [515期]	未
便民招聘求职出租转让等分类信息 - 免费登记 [516期]	未
便民招聘求职出租转让等分类信息 - 免费登记 [518期]	未
便民招聘汽贸儿童乐园家具厂等招聘，生活服务等信息	未
便民招聘淘宝家具厂招聘等！更多招聘便民信息上南康在线网！	未
便民招聘美团外送员文员家具厂等！更多招聘便民信息上南康在线网！	未
便民提示小寨东路西影路 今起试行双向通行为充分挖掘大雁塔区域路网通行功能，经筹备调研论证和征求意见，市公安局交通管理局发布通告，12月16日零时起，小寨东路西影路试行双向通行。从慈恩西路至芙蓉东路段增设由西向东两条机动车道和一条非机动车道，试行双向通行。雁塔北路丁字口，行人经地下通道过街，非机动车和机动车东西双向通行，允许东来和北来车辆右转通行。	未
便民提示长安通共享充值机上线 可通过手机自助充值10日，据西安城市一卡通公司消息，近日，长安通全新服务共享充值机面世。作为一款蓝牙设备，无论用户使用苹果或安卓系统，都可以通过手机自助充值，让市民用卡更加方便，交通出行更便捷。据了解，长安通共享充值机使用简单便捷，只需将卡片放置在设备指定区域，打开手机蓝牙功能，按照操作提示即可轻松完成。即日起，凡是千人以上社区院校医院等均可免费申请该设备，申请时请在长安通微信公众号后台留下具体联系方式。长安通不断突破以公共交通领域为主的传统应用模式，将卡片应用	未
便民新举措兰州两家邮政网点可以补换驾照，另外22项业务也可办理	未
便民新举措大同车主们的福音！车辆上牌过户可就近办理了	未
便民新政策陕西新生婴儿父母注意，以后可在网上给娃报户！	未
便民方便！北京城乡居民养老保险可网上变更缴费档次，变更方法看这里！	未
便民服务11月16日 - 11月20日/招二十三号晚上霞浦月波亭公园附近搭建舞台打下手兼职数名	未
便民服务11月21日 - 11月24日/家悦保洁招聘家悦保洁-专注家庭保洁五年家庭保洁员数名	未
便民服务  在牟定招员工找工作租房子......信息免费发布！20181123期	未
便民服务  在牟定招员工找工作租房子......信息免费发布！20181127期	未
便民服务平利三分钟搞定港澳签！	未
便民服务进社区 阳光城开展党建为民活动	未
便民服务重要通知： 领取养老金的企业退休人员，您的资格认证完成了么	未
便民汇12.5神木最新  招聘求职  租房买房  二手信息  免费发布...	未
便民汝阳交友互动信息大全	未
便民洛阳公交车分时段免费乘坐，为期90天！	未
便民清远这家公立小学开通校车啦！设5个站点方便350多名学生	未
便民 漳州首家警保合作示范点正式揭牌	未
便民社保卡可以这样用啦，荣成每个村都应该看看！	未
便民社保卡可以这样用啦，龙口每个村都应该看看！	未
便民竹山今日招聘信息更新城西林业局院内好房出售！	未
便民竹山某新开量贩KTV大量招工千福上庸城好房出售！	未
便民  终于等到你！只要15块钱，从徐家汇坐地铁直达苏州了！	未
便民花都实现不动产登记零跑动，不见面审批！（附获奖晨评）	未
便民贴士 @南京人，下周二，你不但能打车，还可以打公交了。南京将开120条定制公交线，新用户可享50元乘车优惠。打开滴滴出行App-公交-定制公交，输入出发地和目的地，将会推荐十条定制线路，价格为26元不等，使用优惠券后，全程约0.4元即可出行。其中有9条过江线，走大桥隧道江北威尼斯水城等大型小区。定制公交线路详情戳	未
便民贴士 城乡居民医保网上参保缴费制卡，全程不见面服务再升级南京人社不见面服务，通过我的南京APP办理2019年度城乡居民医保参保缴费，还可以网上直接申请社保卡，并且免费邮寄到家，全程服务不见面！这么冷的天躺被窝就可以把事办好，非常棒了！ （南京社保）	未
便民贴士 好消息！南京市职工医保异地联网刷卡可使用个人账户结算啦！为了进一步方便南京市职工基本医疗保险参保人员异地就医，我市开通了医保个人账户异地刷卡直接结算服务。快来了解详情吧。	未
便民贴士 电子保单来袭，小伙伴们来了解一下	未
便民资讯下周，这些专家将坐诊资阳市人民医院（431医院）	未
便民资讯中国储备粮管理集团有限公司招聘900人科技部事业单位2019年度公开招聘便民信息	未
便民资讯中国地震局2019年度事业单位公开招聘内蒙古瑞鸿铁东储运有限责任公司招聘便民信息	未
便民资讯中国石油天然气第六建设有限公司招聘500人伊金霍洛旗青少年宫招聘教师便民信息	未
便民资讯中国铁路呼和浩特局集团有限公司招聘新疆喀什莎车县教育局招聘教师4229人便民信息	未
便民资讯中煤集团内蒙中天合创公司招聘118人中铁呼和浩特局集团有限公司招聘大学专科（高职）毕业生便民信息	未
便民资讯内蒙古北方重工业集团招聘30人内蒙古太古工程有限公司招聘便民信息	未
便民资讯内蒙古医科大学招聘12名工作人员中国铁路财务有限责任公司招聘便民信息	未
便民资讯内蒙古腾宇教育咨询有限公司招聘47人赤峰学院2019年招聘145名高层次人才便民信息	未
便民资讯招聘信息房屋租售车辆转让	未
便民车管所便民服务站与您相约冬季车展！	未
便民这个东西真的好，办事情就像网购那么方便，一键搞定！	未
便民连江最新招聘求职房屋租售二手消息（11月30日）	未
便民连江最新招聘求职房屋租售二手消息（12月01日）	未
