交通卡自助充值明起有优惠！限额5660名便民提示充值交通卡有优惠啦！上海公共交通卡公司说，12月19日-25日，在CVM设备上使用62开头建设银行信用卡充值，可享受充值满200元及以上立减50元的优惠。每位建设银行信用卡持卡人可享受一次优惠。活动名额5660名，先到先得，送完为止。详见	未
交通卡自助充值有优惠！限额5660名充值交通卡有优惠啦！上海公共交通卡公司说，12月19日-25日，在CVM设备上使用62开头建设银行信用卡充值，可享受充值满200元及以上立减50元的优惠。每位建设银行信用卡持卡人可享受一次优惠。详	未
交通厅长谈江苏交通事业“最迫切”任务，圆桌会纵论营造公平环境支持民营经济，新一期思想周刊来了	未
交通哈尔滨公滨路珠江路经纬街保健路等干道打通	未
交通圈炫耀指南：我们国家能裸体开车！	未
交通大同汽车客运东站试运营 城际公交运营启动啦	未
交通大学留学120周年回顾暨发展论坛开幕 分享留学经验	未
交通安全从娃娃抓起！信丰警校共建情景教育基地启动！	未
交通安全从我做起，共创文明新风	未
交通安全 冬季出行，穿带兜帽的衣服尤其要经常检查自己的智商值，以免突破下限而不自知	未
交通安全大会战桐乡市开展珍爱生命 铁拳护航交通安全大会战集中统一行动	未
交通安全大整治四平交管支队铁西大队领导做客四平交通文艺台直播间开展冬季交通安全宣教活动	未
交通安全宣传 为进一步加强中小幼学生的交通安全意识，营造全社会共同关注中小幼学生安全文明出行的良好氛围。12月7日9时，@深圳交警机动训练大队联合宝安幼儿教育集团共同举办了交警铁骑交通安全教育宣传活动。这是本年机训铁骑走进校园的系列交通安全宣传活动之一。	未
交通安全宣传 为进一步加强中小幼学生的交通安全意识，营造全社会共同关注中小幼学生安全文明出行的良好氛围12月7日9时，@深圳交警机动训练大队  联合宝安幼儿教育集团共同举办了交警铁骑交通安全教育宣传活动这是本年机训铁骑走进校园的系列交通安全宣传活动之一	未
交通安全宣传大家齐参与	未
交通安全宣传技能送教下基层暨《平安黔行》摄制工作黔南站圆满结束	未
交通安全宣传课堂又开课啦！	未
交通安全日  你的安全，我来保护	未
交通安全日，滴滴代驾为安全出行打call	未
交通安全日细节关乎生命 安全文明出行	未
交通安全日转眼就要和2018say再见，交通安全日就在今天，现在就实名diss马路杀手一圈赶快立正站好收下官博君这份胜者图鉴，Skr	未
交通安全日这20个细节，关乎每个人的生命！	未
交通安全日，银隆给你安全感	未
交通安全特重要，珍爱生命要记牢	未
交通安全记心间	未
交通安全进校园之普及货车盲区知识	未
交通平峰镇新增一趟公交，以后出行更方便啦！	未
交通强则城市强，交通兴则城市兴！关于江苏高铁建设与发展：当前，江苏在建的铁路项目达到了十个，总里程1712公里，总投资规模高达2600亿元预计2020年全省铁路营运里程要达到四千公里以上，其中高速铁路达到1800公里左右，基本实现以轨道交通为客运主骨架的两小时江苏北沿江高铁时间表已明确， ...全文	未
交通强则城市强，交通兴则城市兴！关于江苏高铁建设与发展：当前，江苏在建的铁路项目达到了十个，总里程1712公里，总投资规模高达2600亿元。预计2020年全省铁路营运里程要达到四千公里以上，其中高速铁路达到1800公里左右，基本实现以轨道交通为客运主骨架的两小时江苏。北沿江高铁时间表已明确，力争十三五期间开工建设，2025年前建成。盐泰锡常宜铁路已纳入正在报批的《江苏省沿江城市群城际轨道交通建设规划（20182025年）》，力争年前规划获得国家发改委批复，获批后加快推进前期工作。张家港地区两条快速	未
交通强国江苏方案正在起草：打造十大样板	未
交通微视频拍摄实用手册来了，拿走不谢！	未
交通整治直击 三轮车：承受着生命所不能承受重！48行动 @深圳交警  @深圳公安	未
交通整治直击 为了您和家人的幸福，请在非机动车道上骑行，佩戴好头盔，遵守交通规则！48行动 @深圳交警  @深圳公安	未
交通整治直击 哥，为何你要挑战这个高度@深圳交警 @深圳公安	未
交通整治直击 夜间，平湖警力在平安大道劝导行人走非机动车道，安全出行@深圳交警  @深圳公安	未
交通整治直击 套牌车跟蜀黍走吧！@深圳公安 @深圳交警	未
交通整治直击 斯基，你知道你开的是什么灯吗@深圳交警 @深圳公安	未
交通整治直击 蜀黍下雨天在平龙路对大客车进行检查！并提醒司机雨天跟车行驶一定要保持安全距离！谨慎行驶！[加油][加油]48行动 @深圳交警 @深圳公安	未
交通整治直击 要开车，还要玩手机，你好忙啊！@深圳交警  @深圳公安	未
交通整治直击 这位妈妈，带娃走机动车道是什么操作头盔呢安全第一@深圳交警 @深圳公安	未
交通文化展现文化水平的时候到了！来看交警警服变迁史	未
交通新机场明年7月投入运行！力争通航30个城市，宜宾人出行更方便！	未
交通未来哈尔滨交通即将逆天！铁路公路全面爆发	未
交通河南高速区间测速路段153处公布，老司机看了也汗	未
交通消息12月3日又新开通一条公交线，快来了解下！	未
交通环境改天换地，石首百年长江大桥梦即将梦圆！	未
交通生活最牛钉子户厉害了瑞士富尔卡山口半山腰上的一个小旅馆，想住这里的赞我鸭！	未
“交通+电商”打造安居增收新引擎 湖南桃江农村焕新颜	未
交通管制广西壮族自治区成立60周年威壮2018奔跑吧广西生态马拉松系列赛（玉林站）交通管制通告	未
交通细节缺陷，就是能力缺陷：看上去很美的雅西高速	未
交通资讯  4.5h金堂飚拢汉中赵淮路将封闭施工！	未
交通运输信用体系建设向纵深发展	未
交通运输改革开放40年：高速铁路、高速公路均居世界第一	未
交通运输部：中国高速铁路、高速公路里程居世界第一	未
交通运输部、住房城乡建设部联合发布指导意见鼓励共享汽车发展	未
交通运输部：全国超过617万辆营运车辆搭载北斗系统	未
交通运输部：推动城市公交车安装视频监控及防护隔离设施	未
交通运输部：推动城市公交车安装视频监控及防护隔离设施财联社12月16日讯，为积极发挥人防物防技防对道路运输安全的支撑保障作用，近日，交通运输部部署开展营运客运汽车安全监控及防护装置整治专项行动行动推动城市公共汽电车和两客一危车辆安装智能视频监控装置，实现驾驶员不安全驾驶行为 ...全文	未
交通运输部：推动城市公交车安装视频监控及防护隔离设施财联社12月16日讯，为积极发挥人防物防技防对道路运输安全的支撑保障作用，近日，交通运输部部署开展营运客运汽车安全监控及防护装置整治专项行动。行动推动城市公共汽电车和两客一危车辆安装智能视频监控装置，实现驾驶员不安全驾驶行为的自动识别自动监控实时报警同时推动城市公共汽电车驾驶区域安装防护隔离设施，有效避免乘客侵扰攻击驾驶员安全驾驶等行为，大幅降低人为因素导致的运输安全事故。（央广网）	未
交通运输部：港珠澳大桥每日运送约6.4万人次	未
交通运输部超额完成新改建农村公路等建设目标	未
交通运输部：进一步降低物流成本，建立民资参与PPP项目制度保障	未
交通运输部：青海新增4条公路通车	未
交通通告关于白云路（莫尼路以北段）供热供水管线改造工程占道施工的通告	未
交通部与福建签订合作协议 铁路机场52个老区县都是建设重点	未
交通部：今年12件实事目标任务全完成 6项超额完成	未
交通部：共享单车行业平稳运行，日使用量在千万人次以上	未
交通部：回报周期长的收费公路偿债期限可超30年	未
交通部：将在六方面推出系列措施促进民营经济发展	未
交通部：收费公路经营拟可超30年	未
交通部：收费公路经营拟可超30年 新建收费路须达高速标准	未
交通部：春节期间继续实施高速路小客车免费通行政策	未
交通银行北京市分行 送金融知识进乡镇(图)	未
交通银行墨尔本分行开业 境外资产规模超万亿	未
交通银行“链交融”上线 以区块链技术赋能资产证券化	未
交通  长安大桥建设过半，石景山东西向大动脉明年通车！	未
交通高峰时段，洛杉矶，1949年	未
交银租赁之夜 维也纳爱乐乐团2018上海音乐会特价门票	未
交驾驶员设计萌萌哒卡通图 提醒你安全文明乘车	未
亦师亦友	未
亦庄再建口袋公园 海棠主题遛弯赏花好去处	未
产业丨探寻灸法养生产业之道太阳灸	未
产业事件迅速刷屏核心供应商名单及概念股曝光	未
产业二次腾飞！阿里半导体“平头哥”落户张江	未
产业互联网激战正酣，金融赛道已现隐形冠军？	未
产业大挪移！这些地区很有料！CHINAPLAS重拳出击！	未
产业带动断“穷根”—— 安徽太和产业扶贫侧记	未
产业强县伊企来走进桐庐聚合家政服务有限公司	未
产业扶贫 选得准还要走得稳（经济观察 脱贫质量如何保证①）	未
产业扶贫礼县大黄走俏国际市场	未
产业梦 青年筑250余名青年齐聚柳叶湖畔共话开放强市 产业立市	未
产业立县邹如龙调度招商引资及重点项目推进工作	未
产业筑牢脱贫路	未
产后瑜伽五个招式，助你变身辣妈！	未
产品4天体验营  0学费，判断你到底是否适合做产品！	未
产品  东京都练马区65万RMB北欧风格公寓，位于动漫发祥地练马区，多站多线可利用，一站即达日本大学！	未
“产品很多，但合适的少”——保险保障离你的期待还有多远？	未
产城景融合建设新家园黔西南州易地扶贫搬迁工作推进会走进洒金新城	未
产妇在客车上生娃 交警全程爱心救助	未
产经  快件更快了！武汉天河机场新增至浦东全货机往返航线	未
产经武汉 一次相当吊起1200辆小车，武汉建桥铁军开架又一世界级大桥悬索桥梁千米跨度高速铁路，当这三样碰撞到一起，又一座世界级大桥在武汉建桥队伍手中诞生。12日11时25分，我国首座公铁两用悬索桥五峰山长江大桥首个大节段钢桁梁架设成功。这座世界级大桥由中铁大桥院设计中铁大桥局施工，是长江江苏段第三座公铁两用大桥，也是世界上运行速度最快运行荷载最大的公铁两用悬索桥。	未
产经武汉吸引社会资本投入113.7亿元，黄陂借三乡工程撬动乡村振兴民宿内，老物件新设施，衬得隐逸小院犹如绝世的桃花源山坡上，草儿绿果儿肥，染得乡间绿道宛若缤纷的水彩画，这是黄陂区杜堂村葛家湾的别致美景。近年来，黄陂区大力倡导市民下乡能人回乡企业兴乡，盘活了大量农村闲置资源，有力推动了以城带乡以工促农城乡融合发展。一批以葛天才吴建顺为代表的能人回乡，给农村带来了发展机遇唤醒了农村活力。截至目前，黄陂区三乡工程直接吸引社会资本投入113.7亿元，其中市民下乡21.6	未
产经武汉武汉首次发布长江航运三大指数7日，武汉会议中心，武汉首次发布长江航运三大指数，即武汉航运中心出口集装箱运价指数（WSCFI）中国长江煤炭运输综合运价指数（CCSFI）及中国长江（商品）汽车滚装运输景气指数（CARPI），三大指数与交通运输部长江航务管理局定期发布的四大指数形成互补，初步构成了长江航运综合指数体系。三大指数的发布，标志着武汉长江中游航运中心话语权得到提升，航运中心建设的信息服务功能实现跨越。	未
产经  江汉大学42个项目在汉转化，签约金额超20亿元	未
享受一个人的生活。	未
享受一个人的生活	未
享受了几天温暖的阳光，个旧未来一周天气又将如何快来了解	未
享受假期的马斯切拉诺。体坛百咖秀	未
享受片刻的安宁。	未
享受现在	未
享受生活中你喜欢做的事情。运动V势力	未
享法妹带你揭秘「巴黎名媛舞会」：今年的19位世界名流后代中，又来了哪几位中国女孩	未
享用地道珍馐，邂逅心灵挚友，《坐看云起时：杭州精品民宿》问世！	未
享誉全球的国际化双语学校落地佛山，直升牛津哈佛！12月1日邀你体验！	未
“享道出行”品牌打造以人为核心的共赢出行生态	未
京BP2337 在北京，如果你恰巧上了这位司机师傅的车，请不要惊讶与您一路同行的，是司机的老伴儿，一位阿尔茨海默症的患者中国目前的阿尔茨海默症患者人数已有600万左右，我们倡议更多人加入让爱回家陪伴空巢老人行动，帮助老人们能安全回家愿我们都心怀善意，爱每一天！@中国交通广播  ...全文	未
京东7FRESH签约西安万和城 明年3月正式开业	未
京东7FRESH西安第三家店签约 明年三月正式开业	未
京东JOY和Hello Kitty 萌幻圣诞上京东听说今年圣诞节，京东JOY联手Hello Kitty建造了一个超萌的粉色圣诞礼物橱窗过够了红绿色传统圣诞的小仙女们，快约上小伙伴儿去感受一下吧  网页链接	未
京东Y事业部总裁杨平：用技术打造全球领先的智能商业体	未
京东万券齐发会场网页链接12/15/18/20点更新品类券，下拉省钱专区这里有几张白条券/支付券	未
京东中投扶贫专区--会宁扶贫馆正式启动上线运营	未
京东企业购进入年末采购狂潮	未
京东到家数字化库存管理系统助商超缩短捡货时间	未
京东发布京鱼座品牌，加码AIoT， 更专注你的智能生活！	未
·京东发起全球首家电商VR/AR产业联盟	未
京东和丰网贷上线 业内：互联网巨头仍看好P2P近日，京东金融APP中上线一款名为和丰网贷产品，但记者发现，京东金融并未花费太多的流量引导和丰网贷的入口，用户需点进财富一栏中的京东小金投，才能跳转到和丰网贷页面。目前，和丰网贷上线所有产品均已售罄。截止到今年7月31日，和丰网贷的经营数据（来源于内部统计）显示，其累计借贷金额达到37.41亿元。京东和丰网贷上线 业内：互联网巨头仍看好P2P	未
京东商城宣布新一轮组织架构调整 ：行业正迎来巨变	未
京东商城年内二调组织架构 设前中后台前台成立平台运营业务部拼购业务部等部门。中台为运营前台业务和提供创新能力的共享平台。后台将为整个商城提供基础设施建设服务支持与风险管控，成立CEO办公室等。前中后台负责人全数向轮值CEO徐雷汇报。京东商城年内二调组织架构 设前中后台	未
·京东大数据:四川80后男性最爱“打白条”网购	未
京东宣布10亿美元股票回购计划- 中国电子商务巨头京东宣布规模为10亿美元的股票回购计划，以此提振其股价水平。受中国经济相关担忧的拖累，再加上该公司首席执行长刘强东此前曾面临性侵指控，京东股价因此承压。详细报道请见：网页链接	未
京东开启“科技+公益”跨界新模式	未
京东拼团1包邮冻疮膏网页链接焗油膏网页链接	未
京东搜索好妹妹追梦人 或直接点：网页链接查看图片	未
京东数字科技与香港城市大学达成战略合作	未
京东数字科技谢锦生:“北斗七星”零售信贷合作机构已超百家	未
京东方投资465亿元在重庆开工建设第6代柔性显示生产线	未
京东旅行年终盘点，一张图看懂明年旅游怎么玩！(图)	未
京东旅行超级领队成都之行	未
京东每天0/10/12/20点 京享值1W 活动页伊利99-40券网页链接	未
京东物流CEO王振辉：供应链从业者的梦想正在成为现实	未
京东物流首家跨境体验中心落户重庆 可扫码下单	未
京东特步圣诞专区拍下半价网页链接 可以用全品券	未
京东网页链接 三只松鼠品牌团里可领108-8/200-15全品券防身	未
京东要做AIoT大生态 推京鱼座独立品牌	未
京东说没有收到你们物流信息 你们说发了 那么你们相互推我找谁//@大疆创新技术支持:您好，核实到您的案例我们已联系您告知检测正常，3号给您寄回了哦，您反馈的多次拨打您电话的问题，相关工作人员也联系您给予了沟通，您可以联系京东客服核实一下快递物流情况，感谢您的支持。	未
京东调整架构	未
@京东超市官方微博，懂生活，但更懂你美素佳儿用源于荷兰自家牧场的高品质奶粉温暖你，双十二，我在京东超市等你网页链接	未
京东超级品牌日最新玩法 京东金融联合40多家银行最高享199元减120元	未
京东金融上线自营P2P平台，1年期标的年化收益6.5%	未
京东金融业务调整路线图： 从金融科技进化为资管科技	未
京东阿婆家的 年货香烤薯片28g10包 宝贝页下领50券 拍2件17.7包邮网页链接	未
京东鞋靴超级品类日，今日正式开抢！	未
京东领券立减：艾叶生姜足贴，泡足粉	未
京东首届大数据峰会 打造智能零售大数据操作系统	未
京京@你，本周民生大事别错过	未
京冀产业协同发展步入快车道 重大合作项目相继落地	未
京冀会展业协同发展（唐山）项目签约仪式在京举行	未
京剧专场：这一段《沙家浜》听的是真过瘾，网友：不愧是国粹！	未
京剧人追忆高玉倩：艺高德劭“李奶奶”	未
京剧名家叶少兰：做京剧演员首先要对表演着迷	未
京剧名家齐聚为党庆生，82岁童祥苓再唱《智取威虎山》	未
京南区域利好频出！固安已成京南双枢纽！	未
京台高速龙泉段改扩建工程正在进行摸底丈量，有您村么...	未
京台高速龙阳段改扩建项目涉陈庄上司林村等十个村！	未
京味话剧《天命》：呈传统曲艺 叙历史变迁	未
京哈高速封闭	未
//@京哥5850175220: 时过境迁，留下诗篇。江南不远，想去偏安。国史古风	未
//@京城一一赵勇:正能量爱心传递	未
京城六大冬日专属乐园你去过哪些	未
京城开启“盛夏”模式 下周一最高气温将冲上34℃	未
京城“靓”妆平安夜	未
京城首家火锅温泉就在咱山后，太适合冬天啦！	未
京山举办大型平安法治建设宣传启动仪式	未
京山五中馨心志愿服务队开展国际志愿者日系列行动	未
京山力争打通公共文化基层服务的最后一公里	未
京山市委书记刘启华一行到协和京山医院调研指导工作	未
京山市直属机关幼儿园举办亲子运动会，现场视频，照片，现场气氛嗨爆了！	未
京山艺馨广场舞《茉莉花》，歌醉舞美	未
京师心智携心理设备亮相第75届中国教育装备展 一心成就伙伴	未
京廊合作打造15个中医药协同专科	未
京张高铁八达岭隧道贯通	未
京张高铁八达岭隧道贯通 全长12.01千米	未
京张高铁八达岭隧道贯通 穿越八达岭长城核心区域	未
京张高铁八达岭隧道贯通 穿越八达岭长城核心区域历经两年零7个月的施工，13日上午，京张高铁正线最长隧道新八达岭隧道顺利贯通。这是京张正线十座隧道中最后一个贯通里程最长且施工难度最大的隧道。它的贯通标志着京张高铁建设取得突破性进展。京张高铁八达岭隧道贯通 穿越八达岭长城核心区域	未
京张高铁八达岭隧道贯通 穿越八达岭长城核心区域历经两年零7个月的施工，13日上午，京张高铁正线最长隧道新八达岭隧道顺利贯通这是京张正线十座隧道中最后一个贯通里程最长且施工难度最大的隧道它的贯通标志着京张高铁建设取得突破性进展京张高铁八达岭隧道贯通 穿越八达岭长城核心区域	未
京张高铁宣化站旁这个小区正在热卖！	未
京张高铁“智能型”复兴号：用云计算、人工智能打造	未
京张高铁最难一步完成！新八达岭隧道今日贯通	未
京张高铁的“智能型”复兴号：用云计算、人工智能等技术打造	未
京投发展公布商业模式新成果(图)	未
“京新大战”今晚上演，首钢队重回老主场迎接“卡位战”	未
京昆高速安康段路面有积雪安康高速交警提醒驾驶员减速慢行今天中午，记者从安康市公安局交警支队高交大队了解到，由于安康境内降温明显，京昆高速麻安高速包茂高速十天高速安康境内均不同程度出现降雪，京昆高速安康段路面有积雪，其余辖区道路无积雪结冰。 降温降雪后，安康高速交警立即联合路政部门，加大路面巡逻密度，及时抛洒融雪剂，排除道路交通隐患。同时，安康高速交警提示过往车辆，雨雪天气，路面湿滑，一定要减速慢行，保持安全车距，有序通行。（文/图 西安晚报记者张松 通讯员徐颢）	未
京昆高速安康段路面有积雪  安康高速交警提醒驾驶员减速慢行今天中午，记者从安康市公安局交警支队高交大队了解到，由于安康境内降温明显，京昆高速麻安高速包茂高速十天高速安康境内均不同程度出现降雪，京昆高速安康段路面有积雪，其余辖区道路无积雪结冰         降温降雪后，安康高速 ...全文	未
京昆高速广元至绵阳段扩容工程项目，此段（）线型基本确定！	未
京汉联唱，中德同庆——法兰克福孔子学院举办2018年圣诞晚会	未
京沈高铁G8151朝阳沈阳北试运行，跟我抢先体验坐高铁吧！（图视频）	未
京沈高铁沈阳至承德段将于29日开通运营	未
京沈高铁辽宁段具备开通条件，大连有望开行至承德高铁据中国铁路沈阳局集团有限公司消息，11月27日，京沈高铁辽宁段开通前最后一次大型施工，即京沈高铁引入沈阳枢纽按本格开通施工顺利完成，标志着京沈高铁辽宁段正式具备开通条件。按照这个工作节奏，预计在一个月后京沈高铁辽宁段正式开通时，大连有望开行至承德朝阳高铁列车。via出行大连	未
京沈高铁辽宁段开通前最后一次大型施工今日完成 京沈高铁辽宁段正式具备开通条件11月27日0时20分，经过近700名现场施工人员6个多小时的连续奋战，京沈高铁辽宁段开通运营前最后一次大型施工京沈高铁引入沈阳枢纽按本格开通施工顺利完成。至此，京沈高铁辽宁段通信信号接触网等四电设备全部调整完毕，京沈高铁辽宁段已正式具备开通条件。随着这次施工的结束，闻名于世的百年老站皇姑屯火车站完成历史使命，正式关闭。为方便周围市民，皇姑屯站的售票业务仍正常办理。	未
京沈高铁辽宁段新通高铁列车时刻表来了！赶快收藏	未
京沈高铁辽宁段新通高铁最新最全列车时刻表来了！	未
京沈高铁辽宁段新通高铁最新最全列车时刻表来了！快收藏	未
京沈高铁辽宁段月末开通！朝阳阜新进京提速10小时！快看这10站是否经过你的家乡	未
京沈高铁辽宁段月末开通！阜新进京提速10小时！快看这10站有没有你想去的地方	未
京沈高铁辽宁段正式具备开通条件	未
京沈高铁辽宁段要开了？长春-北京有望缩短至4小时	未
京沈高铁辽宁段设备全部调整完毕 已具备开通条件	未
京沈高铁辽宁段试运行满月 辽宁号记者抢鲜体验	未
京沈高铁辽宁段预计月末开通！	未
京沪出发机酒全程住星野，赏雪泡汤吃苹果，顺手解锁3年签	未
京沪是我国举办国际会议最多城市	未
京沪铁路常州站南北广场一体化改造工程投入使用	未
京沪高速改扩建工程莱芜至临沂段沥青路面铺筑，计划2021年通车！	未
京沪高速改扩建工程首段沥青路面铺筑 计划2021年通车	未
京沪高速改扩建莱芜至临沂段沥青路面铺筑，计划2021年通车！	未
京沪高铁要上市，其他线路日子过得怎么样11月有两则关于高铁的新闻：我国八纵八横高铁网中最北一横的重要组成部分哈牡高铁正式进入运行试验阶段，预计年末开通运营京沪高速拟最快于明年上半年递交A股上市申请，计划募集资金额高达约300亿元人民币。高铁发展一片欣欣向荣。（新京报）	未
京津冀 清洁取暖再加力（在习近平新时代中国特色社会主义思想指引下——新时代新作为新篇章）	未
京津冀三地大学生同台放歌“2018年北京大学生音乐节”(图)	未
京津冀举办高山滑雪挑战赛	未
京津冀产业转移指南发布：北京打造具有全球影响力的科创中心	未
