京津冀体育产业迈向深度融合发展	未
京津冀台四地青年齐聚河北感受冬奥新机遇	未
京津冀品牌农产品产销对接活动订单超4亿元	未
京津冀城铁动车检修基地等两项目落户唐山高新区	未
京津冀实行144小时过境免签 53个国家旅客受惠	未
京津冀徒步爱好者用脚步“探寻”满清文化历史	未
@京津冀毕业生，收就业创业政策红包了！	未
京津冀 清洁取暖再加力	未
京津冀清洁取暖再加力	未
京津冀清洁取暖再加力 北京平原地区基本实现无煤化	未
京津冀第二届跳绳高峰论坛暨教练员裁判员培训班在京落幕(图)	未
京津冀、长三角、珠三角的博物馆联盟成立	未
京津冀餐饮高峰论坛开幕 直隶官府菜第6代传人收徒	未
京津冀首个网络作家村落户天津静海团泊湖团泊洼网络作家村暨新文化传媒（团泊）小镇12月2日在天津市静海区团泊湖畔揭牌。据悉，团泊洼网络作家村采用政府主导市场化运作的模式，广泛吸引知名网络作家和文化企业入驻。后续通过延伸产业链，打造集网络作家村新媒体村纪录片村跨境电商村为一体的新文化传媒小镇。	未
京津城际开启高铁时代	未
京津城际开启高铁时代（改革开放40年·40个“第一”）	未
京津沪苏浙鲁6省市对口支援青海藏区 8年累计落实资金超100亿元	未
京津联手发力人工智能医药研发平台建设	未
京津高校海峡两岸知识竞赛架起两岸青年交流桥梁	未
京港澳高速上，大货车拖运摔炮突发爆炸！	未
京港澳高速长沙至岳阳段半幅将封闭施工	未
京港联合汇演校园版《牡丹亭》 白先勇冀确立昆曲学术地位	未
“京电号”小火轮保护修复获批，曾搭载邓小平、陈毅渡长江	未
京畿明珠焕新记	未
京秦高速天津段与河北省实现全线双向衔接	未
京秦高速天津段与河北省衔接段全线贯通	未
京胡神童李杨独奏《梅花三弄》棒极了！	未
京蒙牵手促发展，通辽旅游扶贫工作迈向新台阶	未
京藏高速改扩建工程宁蒙界平罗段(西半幅)，试通车了！	未
京藏高速综合整治完成	未
京郊盛夏避暑之地一一龙关申德军	未
京都三日追枫之旅，淡抹浓妆皆是你by@浣熊先生17	未
京都印象：穿越人世间的结界千本鸟居	未
京都大學啟動自行車無線充電運用實驗	未
京都工艺纤维大学的著名保安大爷，每年入秋都将银杏叶扫成各种暖心图案，成为校园一景。校内单身汪纷纷表示，看完很想找对象	未
京都[带着微博去旅行]	未
京都提上日程	未
京都攻略拍着(平)胸脯诉你们：这个值得收藏	未
京都杨谷寺用不同季节收集的枫叶装饰取水钵，水钵中盛下了整个夏天到秋天的转变。twi:chacha_nene_jp	未
京都的红叶观赏处太多了，但我还是首推琉璃光院。这里与市区相比更加僻静，适合一个人坐在这里冥fa想dai。赏罢，立刻下雨。无数红叶被打落料想过后将无红叶可赏。最佳红叶观赏期11月中至12月初，在京都出柳町乘坐前往鞍马方向的电车即可，在八濑比叡山口站下，下车根据指引牌走就行了，脚程五分钟	未
京都红叶 .	未
京都迎来红叶盛季 岚山渡月桥两岸群山色彩斑斓 With the temperature dropping， it is a perfect time to appreciate the foliage changing color from orange hues to reddish tones. Kyoto is one of the most popular destinations for maple leaf viewing in Japan， where the leaves turn	未
京雄城铁雄安站开工建设 预计2020年底投入使用	未
京雄城际铁路开工建设，铁路设备行业或有超额收益	未
京雄城际铁路雄安站开工建设 建成后将实现半小时交通圈	未
京雄城际铁路雄安站开工建设：造型曝光	未
京雄城际铁路雄安站开工建设 预计2020年底投入使用	未
京雄城际雄安站2020年投用！将引入津保津雄高铁滨海资讯 日前，北京至雄安新区城际铁路雄安站开工建设，建设工期24个月，预计2020年底投入使用。中国铁路总公司有关部门负责人介绍，雄安站枢纽同时规划引入北京至雄安新区城际铁路北京至雄安新区至商丘高速铁路天津至保定铁路雄安新区至忻州铁路天津至雄安新区城际铁路等5条高铁和城际线路，融入国家高速铁路网。	未
京鲁争霸足协杯 目前，奥体周边流量即将饱和蜀黍们中午即已到位，望球迷朋友们服从蜀黍指挥，尽量采用公共交通前往祝你们有一个开心又充实的夜晚，期间如有困难找蜀黍！交警报路况	未
亭云微享 转存！20个Word文字处理技巧，变身Word小能手！ 还等什么，各位小可爱们赶紧码住吧！via.央视新闻	未
亭云微享 还在用生日做密码吗九图教你设置高级密码，速收学习！ 银行卡教务信息网校园网微信支付宝各种社交账号，多少ZZUers习惯用同一个密码登录如何设置一个安全性足够高的密码戳图学习菌菌温馨提示：不要再评论区泄露自己的密码信息哦 via人民日报	未
亮了	未
亮了吹吧济南严查酒驾 重细节平安行	未
亮出团建督导员身份，做出共青团工作成绩！	未
亮出江苏最美颜值——第十届江苏省园艺博览会探秘	未
亮剑！仙游县举行扫黑除恶治乱千人誓师大会！（附独家航拍视频）	未
亮剑八闽  小额速执冲锋队来袭，为执行建好一条高速路	未
亮剑八闽  漫漫执行路  默默勤奉献	未
亮剑护河！丰泽区出台工作方案，整治保护辖区内沟河水环境	未
亮哥俱乐部，大咖聚集地，欢迎您	未
亮灯见警，沭阳公安给你满满的安全感	未
“亮灯见警”！盐城大丰警方加强街面见警率  护民平安暖人心	未
亮点啥不到现场也能解决群众诉求	未
亮点请看，电视报道的社区普法	未
亲人之间不欠四种帐不做四件事，太有道理了(人人必读)	未
亲 人 间 不 欠 的 四 种 债！（牢牢记住）	未
亲们陈里微刊第一手资讯的新闻综合微刊如约送上：《微博天下》《首席舆情官》《融媒体在线》《陈里博士看三农》《公益档案》《法治瞭望》，6个主题总有您关心的内容，打开任何一幅图片都有精彩新闻呦。如果你想看详细新闻内容搜索我的微信号：chenliboshi2004进朋友圈按二维码即可查看（可以加好友）另外，你也长按图片进入小程序查看第三种方法那就是把这条微博转发到微信里，然后点开就可以看了！	未
亲历40年国投董事长王会生：四十年来家国梦	未
亲历中国铁路40年注意！钢轨上的这群小黄人要变身啦！与其他岗位职工相比，工务人就显得比较接地气了。他们的工作性质决定了一年四季要与阴晴冷暖为伴。	未
亲历中国铁路40年注意！钢轨上的这群小黄人要变身啦！无数个日日夜夜，夜幕繁星是他们的挚友，破晓晨光是他们的伙伴。走过改革开放四十年的光阴隧道，尽管工务人的作业方式逐渐趋于机械化，但是他们吃苦耐劳的奉献精神从未改变，他们用钢铁一般的脊梁牢牢承托起新时代铁路速度。	未
亲历中国铁路40年送文化列车开到延边来两地铁路职工穿着带有民族特点的工装，喜气洋洋地来到送文化列车上观展，他们边看边交流，不住地竖起大指称赞说：真是太好了！	未
亲历中国铁路40年送文化列车开到延边来幽幽的墨香还在列车中飘荡，悠扬的歌声还在耳畔回响，承载着民族深情的送文化列车鸣响了笛声，在皎洁月色中再次出发，一路高歌向前	未
亲历中国铁路40年送文化列车开到延边来延吉车务段职工李祥在留言簿上写道：筑梦铁路新时代，心手相连延边情，笔墨丹青描绘改革变迁，沈局精神铸就铁路发展，弘扬和传承小东精神，做最美高铁最美人！	未
亲历中国铁路40年送文化列车开到延边来延吉车务段职工杨静也用朝鲜族文字在留言簿下写下了祝送文化列车越开越好的温馨祝福。	未
亲历中国铁路40年送文化列车开到延边来沈阳局集团公司送文化列车斩冰破雪一路前行，于12月11日开进了延边朝鲜族自治州图们延吉地区。	未
亲历四十年（六）：大陆首位台胞社区主任助理 引台湾经验打造大陆社区	未
亲历四十年北塔见证：从贫困牧场到宜居小镇	未
亲历四十年（十五）台湾设计师林国庆：跨足两岸 设计未来	未
亲历四十年故乡的原风景：三台沟里牧家乐	未
亲历四十年《故乡的原风景：千年荒漠变度假乐园》	未
亲历四十年王震的这份军令状，让新疆成为中国重要的棉花基地	未
亲历改革开放，3位正省级领导的讲述带来哪些启迪？	未
亲历改革开放大潮 知名台商李瑞河称“还要迈大步”	未
@亲 如果您有幸接到全国文明城市测评组的街头随访，请为澄海创文打Call！！	未
亲子全家人均200起住太湖景观房，享自助早餐午/晚餐和卡通主题礼包	未
亲子夏令营惊现“女德”语录 竟有网友说挺好的……	未
亲子旅游一家人旅游回来已经快一周了，感觉自己有点不太适应北方的冬天了，反倒是喜欢上南方冬天的舒适，天气不冷不热。我们在厦门时，鼓浪屿的海边吹海风捡贝壳，眼里尽是春天的景色，三角梅的粉艳，树木的翠绿，一点冬天寒冷的气息都没有。看着孩子在沙滩上自由自在玩耍，觉得自己并不是在旅行，而是就生活在这里，正在享受这里的生活。	未
亲子活动就去这儿！几何岛时空旅行体验馆正式开馆	未
亲子游12月，沪上公园这些花展活动等你来上海的公园12月有哪些好玩好看的呢沪上各大公园本月开展特色活动：滨江森林公园的蔬果插画展上海植物园的园艺沙龙一起快来看！ via@乐游上海	未
亲子游  2019春节全家来三亚浪，足足14个项目，一价全包性价比太高！	未
亲子游 三清山，一个满足想象的神仙地	未
亲子游上海又一名镇入选中国历史文化名镇名村，一起来看看吧！周庄乌镇同里，是人们比较熟悉的江南古镇，但要说到上海的古镇，许多人恐怕还有些陌生。近日，住建部第七批中国历史文化名镇名村进行公示，上海市宝山区罗店镇上榜。此前，上海共有12个镇村已入选。TA们都有哪些特色小布替 ...全文	未
亲子游攻略香港迪士尼亲子游攻略，独自带着尖果果也可以有甜蜜的旅行带你出来，不是为了让你记住什么，而是让你享受当时的快乐与幸福。 via：张婕希Jessie	未
亲子爆款人均300，住恐龙主题房享2日恐龙园无限次进出门等	未
亲子餐厅不在少数，这家却能同时满足聚会遛娃美食多重体验	未
亲属走上颁奖台，与10名先进个人和群体共享荣光！	未
“亲情中华·中医名家海外行”访问比利时	未
“亲情中华·中医名家海外行”走进德国	未
“亲情中华·侨聚八闽”庆祝改革开放40周年文艺晚会福州上演	未
“亲情中华”文艺演出走进“中国农村改革第一村”小岗村	未
“亲情中华·欢聚小岗村”庆祝改革开放40周年大型演出安徽上演	未
“亲情中华·欢聚广州”庆祝改革开放40周年文艺晚会在广州举行	未
“亲情中华·欢聚广州”庆祝改革开放40周年文艺晚会广州上演	未
“亲情中华·欢聚广州”文艺晚会走进暨南大学	未
亲情，永远最重要！	未
亲戚一来，阿米乃木大妈的生活五彩斑斓	未
亲戚多了路好走——新疆“民族团结一家亲”见闻	未
亲手做汉堡，吃大餐，还有礼物拿！这个周末一起去麦当劳吧	未
亲手打造下一个爆红的 Talk Show，你也可以	未
亲，有你的快递。	未
亲测好喝！	未
亲测好穿 就是没图//@象學姐:关注一下图8中筒靴剩余30双售完无补（即将恢复原价 查看图片	未
亲测故宫首款游戏书《琳琅图籍》：数十道谜题皆有依据	未
亲测有效丨蓬莱这儿免费领红包啦！您怎么可以不知道！	未
亲测的更让人放心	未
亲测！足不出户，网上办理交管业务，真挺方便的！	未
亲爱的你 严正岚 房东的猫  像草原的辽阔  像星星的闪烁	未
亲爱的同志们，小老弟在新的号里爆料了，之前的那个满了（shgzs_1）这里爆料了，快来看吧 看好号哦，别打错了	未
亲爱的大家，圣诞礼物都给你们的对象准备好了吗圣诞圣诞季	未
亲爱的宝贝们，今天是你们三岁生日，还记得三年前在产房陪着妈咪迎接你们的到来，小小的还不会说话的你们，用宏亮的哭声来告诉大家，我们来啰[太開心]时间过得好快！现在你们也开始上幼兒园了，整天蹦蹦跳跳跑来跑去的，每天总有一堆问题，爸比你要去哪里?  爸比:去工作啊做什么工作呢? 爸比:唱歌 ...全文	未
《亲爱的客栈2》刘涛：保护孩子的纯真有多重要	未
《亲爱的客栈2》杀青：把公益植入综艺，探索精准扶贫新方式	未
《亲爱的客栈2》武艺神回复笑喷众人 网友：真宝藏男孩	未
亲爱的客栈 亲爱的分享今晚湖南卫视腾讯视频，不见不散@亲爱的客栈	未
亲爱的客栈 今晚	未
《亲爱的客栈》全体出游白狼峰  王鹤棣沈月神还原妈妈式拍照	未
亲爱的客栈只要你用了我们表情棣@王鹤棣_Dylan 的表情包我们就是好朋友啦，果然是客栈最靓的崽兄棣伙，快来走一波上芒果TV看亲爱的客栈	未
亲爱的客栈 小鹿妆学起来	未
亲爱的客栈杀青今日亲爱的客栈2在阿尔山市白狼镇顺利杀青。刘涛王珂武艺王鹤棣沈月陈翔马思超与客栈工作人员举行交接仪式。亲爱的客栈2录制正式完结！期待下一次的相遇！客栈3见 阿尔山市	未
亲爱的客栈 第二季杀青还有直播哦，老高这次正式出道，会和客栈员工一起揭秘客栈好多独家消息，现在满脑子都是老高老高老高粉了！	未
亲爱的小仙女们！明日号列车前方到站是南京站，请准备上车的小可爱提前准备好自己的才艺，做好上车准备。上车时请认准12月30日31日 南京时光树音乐社会@沅兒iii（南京市秦淮区石鼓路42号建华大厦1110室）	未
亲爱的小伙伴们，帮我转起来！	未
亲爱的，您的每一个选择，都很重要！平安鄞州建设需要您的支持！	未
亲爱的，我想把锦江风景寄给你	未
亲爱的爸爸妈妈你们好吗访惠聚工作队队员的暖心家书	未
亲爱的玩家：经过几个月的努力，我们最新提交的《战舰少女R》4.1.1版本现已通过苹果商店审核恢复上架。iOS服务器的玩家从今日起可以根据自身需求直接通过iOS商店更新游戏，非常感谢几个月来各位玩家的理解与支持。为表感谢，我们将会为所有玩家发放庆祝恢复上架的邮件，未来的日子里，我们也会继续努力为大家呈现更优质的游戏内容，谢谢各位。	未
亲爱的，穿着高跟鞋走好每一步，你才能知道换上跑鞋的时候，要去哪里。七堇年 《灯下尘》	未
亲生的还不是有优势	未
亲生的阿詹，活爹以你为傲：1，很高兴你成为别人家队伍的小顶梁柱2，你居然这么上镜3，几个月赛程下来我更了解你了，你比我原先以为的更丧，也比我原先以为的更棒。btw，活爹今天接了个活佛的视频电话虽然全程不知道他说啥但哈哈哈哈超开心的	未
亲自送祝福！大中华区圣诞老人，豹子头徐锦江回应红帽子白胡子老人	未
亲身体验，老家小县城月薪4千，生活质量胜过北京月薪税后一万	未
亲，随手拍云山雾海  最在剑门（二）	未
亳州如何打赢这场净土保卫战大家纷纷建言献策	未
亳州市区道路开启洁净模式！看看啥叫深度保洁	未
亳州市隆重举行2018年全国交通安全日主题宣传活动	未
人一多拍照都比较随意了振兴河南烩面20年郑州老字号裕丰源走出第一步子品牌裕府烩面入驻正弘城汤头，浇头，面头，用改良后的烩面来迎合年轻人的口味黑化版河南烩面墨面烩三鲜和干捞炸酱，香麻牛肉，珍菌和经典滋补烩面会不会让你重新爱上吃烩面人均35地址：东风路花园路西南角正弘城8F美食街最里头@正弘城购物中心 郑州美食郑在生活	未
人，一旦没了良心！	未
人一生的7次关键选择：1.选择大学和专业2.选择第一家单位，这决定了你初步格局3.选择老婆老公，这决定了一半人生4.选择职位路径，是走管理线还是专业线5.选择你的工作和生活环境，机会和氛围取决于此6.职业关键决策，选对一步海阔天空，选错皆步步错7.创业或加入梦想中的公司	未
人，一辈子有四次改变命运的机会。一次是含着金钥匙出生，一次是读个好学校找个好工作，一次是通过婚姻来改变。如果以上三次机会你都没有了，那你还有一次唯一的机会，就是靠自己创造一切。没有好命，那就必须有一颗上进的心！	未
人不彪悍枉少年 同时拥有天降和竹马，享受花彪追车李渔守候的彪悍美少女杨夕@万鹏er 今晚19点做客，在线爆料幕后。点击链接预约：网页链接	未
人不彪悍枉少年 @李明德Marcus 今晚19点做客聊天室，仗义二条来啦，预约戳网页链接	未
《人不彪悍枉少年》热播 另类班长侯明昊有够彪	未
《人不彪悍枉少年》花彪送杨夕粉色发卡，要勇敢还要学会抓住时机	未
人不必太富，只要过得温暖。	未
人，不能活得太明白。（很深刻！）	未
人与人之间，最大的吸引力，不是你的容颜，不是你的财富，也不是你的才华，而是，你传递给对方的温暖和踏实，以及传递给对方的那份正能量。	未
人与人之间，最大的吸引力，不是你的容颜不是你的财富也不是你的才华而是，你传递给对方的温暖和踏实，以及传递给对方的那份正能量。	未
人与人之间的闪光时刻，感动//@尸姐:阿姨特别棒//@太皇太后您有喜啦://@M大王叫我来巡山: 好棒！平凡人中的神奇女侠//@江南大野花:多亏了这位英勇的阿姨	未
人世间世事难料啊，没想到这一天竟然提前到来了。今年一月份，中图网官博2018年KPI关键指标之一粉丝量定为40万的时候（如图），我当时真的认为是Mission Impossible，但是下定决心要迎难而上。从那天起，每天真的是绞尽脑汁想着怎样提高微博质量，怎样吸引更多读者...经过夜以继日的辛勤工作和全司上下的共同努力，以及微博好友们的帮扶，更重要的是广大顾客朋友们的支持和包容，今晚终于到40万啦！大家好，我是四十万读书粉丝总教头秃子头中图。高兴归高兴，我的内心有个声音一直在呼唤自己要冷静下来。因为	未
人世间到底存不存在有钱有闲又有爱的老公	未
人为什么要善良这是最好的答案8月22日凌晨1点多，四川乐山正下着瓢泼大雨。当出租车司机陈荣全过桥时，他发现桥栏杆上坐着一个女孩。陈荣全猜想这名女子很可能想要轻生。于是陈师傅立马取消了原本的订单，赶紧掉转了车头。他并没有送她回家，而是直接把她送到了派出所。看见她进了派出所的大门，陈师傅才肯离开。事后，女孩说：那天晚上我在桥上坐了半个多小时，只有他的车停了下来。人为什么一定要善良大概是这世间一切的冷漠，是因为所有人都冷漠而善良是只要有一个人善良，我们就能感受到温暖。	未
人为何要追星 如果我一直追着光走，那我也会跟着闪光，说说你的爱豆有多闪光	未
人为何要追星当然是为了成为更好的自己啦 朱正廷粉丝公益小合集，向山区小朋友捐赠太空科普读物捐赠爱心图书和打印机捐赠爱心衣橱组织环卫公益活动富有爱心且对一件事坚持的态度，不仅是正能量偶像朱正廷的品质，同时也感染着珍珠糖们！棒棒哒，为你们点赞@THEO-朱正廷	未
人书合一！	未
人，交一个知心朋友不容易！	未
人人人人！12月1日仙桃南城将要迎来一场这样的盛会，环球飞车豪车展......火速围观！	未
人人人！漯河这个商场！100公斤黄金大集结！惊爆价2xx元！	未
人人动手 美化家园	未
人人学典型  人人树形象厉害了！和田这个人经过16年的奋斗开了17家美容美发店	未
人人有礼北京联通邀你一起来瓜分百万现金！	未
人人贷获评2018年度中国客户联络中心奖	未
人人车CEO李健获“2018新商业领袖奖”	未
人人都有机会	未
人人都爱巴斯克斯	未
人人都爱郑世珠seisiri/xiuxa_12/floey94evern/gg/rlashrck/_chanxiu_/soraahaha/noon_yoon/xiuxiu00	未
人人都能做的公益  开启月捐，圆乡村孩子一个阅读梦	未
人人都该学会的10个电脑基础技巧，省时高效利落。get	未
人人都需要依靠，都需要被温暖被支持，当你把你的期待愿望都附加在别人身上时，总有一天，对方会不堪重负，落荒而逃。	未
。人们称之为不完美，其实不然，那才是好东西。	未
人体揭秘第75期：霸州还没生娃的乐了！国家发布这个大消息！	未
人体摄影艺术-简优优	未
人保“回A”六涨停开板 独角兽基金尝鲜“超额收益”	未
人像拍照10大速成技巧，新手必备	未
人像摄影小窍门：用你的肢体和摄影师一起构图。	未
人像摄影师金字塔	未
人像摄影摆姿引导技巧大全，人像拍照必学！	未
人像识别、采集DNA......江苏各地创新救助方式 帮助流浪乞讨人员度寒冬	未
人到中年，学会怂一点！	未
人到中老年才明白：生活就是这2个字，一定要牢记！	未
人到老年，健康长寿就是赚！	未
人到老年，拥有这10件宝贝才是真正的人生大赢家！	未
人到老有七件宝，送给40岁 50岁 60岁的弟兄姊妹！	未
人力资源平台调查显示：民企优秀人才需求巨大	未
人力资源社会保障部：个人和小微企业可分别申请最高不超过15万元和300万元的创业担保贷款	未
人力资源社会保障部举办2018年全国人力资源市场高校毕业生就业服务周活动	未
人力资源社会保障部举办高校毕业生就业服务周活动	未
人力资源社会保障部印发《支持海南人力资源和社会保障事业全面深化改革开放的实施意见》	未
人发展的历程就象爬山，每登上一个高度都能看到更远更美的风景很多人留恋眼前的风景，不愿继续努力前行只有一小部分人，才敢于向上攀登只有这些人才能到达那些更高更远的风景，也只有这些人才能体会到如果当初停下脚步会留下多少遗憾只有他们能够居高临下地看着下面的攀登者	未
人口政策为首要议题 澳大利亚政府理事会召开	未
人口翻三倍！环京定居时代来临！	未
人只有两次幸运就好，一次遇见你，一次走到底	未
人和人刚相识的时候总是习惯把最好的一面呈现给对方，相处时间久了各种缺点就渐渐暴露出来，对方把你看的透透的却依然不嫌弃你，那就是朋友了你的脾气会赶走很多人，也会为你留下最真的人，好好珍惜那些真正对你好的人，不要让他们渐渐从你的生活中消失，无论爱情还是友情，不去经营，都会形同陌路	未
人和龙归同和京溪南方医院永泰梅花园纪念堂越秀公园三元里江夏黄边大学城北新造石碁厦滘大石市桥番禺广场等站点将视情况采取限流措施//@广州地铁:嘉禾望岗站新港东站A口广州火车站D口小北站已执行客流控制	未
人品，大于能力！	未
人在做，天在看，好人一生平安	未
人在做，天在看！好人有好报	未
人在做，天在看！都瞧瞧吧！	未
人在年轻的时候，最核心的能力是什么	未
人在江湖走，怎能离了酒（谢谢重庆王骏先生的图片）	未
人在没钱时，才更能看清人心！	未
“人在画中走” 3D版扬州园林不一样感受	未
人在阵地在！这位中国连长，让美军最精锐部队折戟9次	未
人均130万美元年终奖1）美电子烟公司Juul Labs将20亿美元一次性股息，发给旗下1500名员工，平均每个人能拿到130万美元，相当于硅谷底层码农10年底薪2）Juul Labs最新市值已高达380亿美元，相比数月以前翻了一倍，公司两位创始人也一跃成为全球电子烟行业的首批10亿美元级富豪3）在Juul Labs的官 ...全文	未
