你好，旧时光新百广场成立71载场庆暨改革开放四十年生活艺术展12月7日开展@双鹏飞@石家庄新百广场	未
你好，旧时光！这些视频带你见证中国40年变迁	未
你好早安今天，你准备怎么过	未
你好早安十二月有一个特别的节日拥抱情人节 ，在这一天，你最想拥抱的人是谁	未
你好早安 双十二再战，你买了啥	未
你好，明天有人将这张新闻照片称为邻居，有这样的邻居真好！三人成众，让随手拍下的照片有了神奇的构图，连旁观者悬着的心，也因层层托举有了支撑不知从何时起，我们担心现代邻里关系过于淡漠但这番救援场面足以让人相信，恻隐之心人人皆有，古道热肠并未远去里仁为美，爱就在手心	未
你好，民生朋友圈了解一下	未
你好！河南40年1999：河南四级政府全上网 电商催生中原网络第一村	未
你好！河南40年2000：新千年钟声敲响 新郑大新河大诞生	未
你好，河南省生态环境厅！	未
《你好，河南！》看看“一带一路”沿线国家的“歪果仁”咋侃咱河	未
你好，生态环境厅（局）！	未
《你好！生活家》李云迪畅谈琴键背后的故事	未
你好石狮吴梅君：守护梦想，我们一直在路上	未
你好石狮陈旻：创建平安和谐的石狮	未
你好，祁连山！	未
你好，色彩	未
你好，西安	未
你好西安丨新闻早餐速递 12月7日 [语音版]我市举行改革开放40周年成就新闻发布会预计从7日到9日，我省低温天气持续，关中大部陕南将有降雪天气。7日，我市最低温可能降至-66日，国务院办公厅关于2019年部分节假日安排的通知发布，明年劳动节只有5月1日一天假期著名华裔物理学家张首晟，于美国时间12月1日去世，终年55岁。你好西安丨新闻早餐速递 12月7日 [语音版]	未
你好，西安//@成都共青团:你好，西安	未
你好西安 新闻早餐速递 12月1日 [语音版] 金砖国家就世贸组织改革等问题表明共同立场 注意啦！西安今起开通调整这些公交线路 快戳进来瞧瞧 张家口爆燃事故最新：涉事企业15名相关责任人被警方控制。戳链接，听新闻网页链接	未
你好西安新闻早餐速递 12月9日 [语音版]陕西省气象台12月8日10时30分发布低温黄色预警海关总署：前11个月外贸进出口总值超去年我国首个国家公园及自然保护地委员会成立88岁拾荒老人匿名捐款1万元 已坚持行善10年 网页链接	未
你好！贵阳地铁 1 号线	未
你好！这里是佛山新闻网	未
你好，郑州！@郑州晚报	未
你好，银川人！12月的信息包裹已送达，请查收！	未
你好，陌生人！	未
你如此优秀，你的家人知道吗	未
你妇和马竞在历史上曾经交锋过7次，你妇以4胜1平2负进10球丢7球的成绩稍占上风。不过7场对话中有5场是上世纪60年代的国际城市博览会杯的比赛，没有什么参考价值。最近2场交手是在14-15赛季欧冠的小组赛中，你妇以1平1负进0球失1球的战绩稍逊一筹。上次你妇和马竞交锋时曼朱基奇还在马竞阵中，那支尤文也在小组第二出线之后一路披荆斩棘进入了最后的柏林决赛，最后决赛中以1比3的比分不敌拥有MSN的巴萨获得亚军，当时那支拥有皮尔洛马指导比达尔特维斯莫拉塔埃弗拉和博格巴的尤文也算是近些年最强的一届你妇了	未
你！妈！逼！你！结婚了吗红安一单身姑娘的自白，轰动全国！	未
你家乡的文化很美。能来到这里并被热情招待，我很荣幸。谢谢你。  小菊桑托斯欢迎来到我的国家，我非常地感动。能成为史上第一位在头条主赛上出战的土著居民，这对我和我的家庭来说都意义非凡。  太胖图瓦萨PS：太胖的父亲是萨摩亚人 (源自太平洋中部萨摩亚群岛) ，而他的母亲才是正宗的澳大利亚土著居民 。UFC格斗之夜阿德莱德	未
你家住几楼这很重要！快来围观这段视频	未
你家吃过吗这里的大米被一群白琵鹭守候，成为名副其实的生态米，含有多种微量元素！	未
你家大牛没续约哈//@SH蓝色荣耀:@绿地申花官方微博 @马悦 //@李璇R9: 中超队有不少缺门将的，可以招揽叶尔杰提，比如大连队，传说在买门的恒大队。	未
你家孩子会讲故事吗拿大奖的机会来啦！！！！	未
你家小区上榜没连云区这5个小区入选市文明示范小区候选名单！	未
你家有海参么！！！来点！！	未
你家的电安全吗看看咱们供电部都做了哪些保障！	未
你家社区排第几肥东这项工作测评情况出炉啦	未
你家老小区也想加装电梯吗这些干货必须知道无锡身边事日前，无锡月秀花园加装电梯破土动工，很多家住老小区的市民表示也有意加装。具体怎么操作呢《无锡市既有住宅增设电梯暂行办法》明确了流程和操作办法:申请条件:民意征集遵循三分之二同意原则经费承担:以居民自筹经费为主申请程序:简化审批程序，实现一站式受理。具体戳图	未
你家里挂画了吗一些挂画的实用技巧get	未
你，对我来说，是清晨的柠檬水，是冬日午后的暖阳，是梦里的星辰大海。by@绿皮火车照相馆	未
你对明年重庆经济社会发展工作有何期待？ 快来提建议吧	未
你将来到光源，将要看见光明本身  11月27教父训导	未
你小时候幻想自己能学会哪个绝世武功为啥要学那个我先说，我一直希望学会凌波微步，因为那样不用坐公交和地铁了很省钱。	未
你小时候最喜欢的一样玩具是	未
你就是我心中永不凋谢的花朵	未
你就是我的小星星 儿子：妈妈我知道他没带钱，能不能给他买点吃的温暖   你就是我的小星星	未
你就是老天派来搞我的[米奇大哭]//@小甜心收藏家:王源 心动时刻 我看你就是来耽误我的人生的@TFBOYS-王源	未
你就说有没有成功跳过去吧。	未
你已经得到了非常多的赞扬，对你的踢球风格和对巴萨的帮助，你怎么看                                        亚瑟：我很高兴得到这么高的赞扬，但我确信我不是唯一一个让巴萨踢得很好的队员，因为球队里有很多伟大的球员。	未
你已经拥有几项了	未
你已经是个成熟的微博了该学会自己空瓶了	未
你已经走了那么远的路，也许你还可以往前再走一走早安四川图 达古冰川 @sange的图吧	未
你希望谁关注你	未
你带相机我带画笔，会画画的姑娘这样旅行！	未
你帮我一次，我记你终生	未
你常坐的这条公交线路优化调整啦！一定要看，别坐错了车！	未
你平常喜欢做什么消遣我：	未
你应该丰富人生阅历，而不是简历北京您好今天周四，车辆限行尾号是5和0天气晴，气温-8-1天冷多加衣，别冻着了，早安！网页链接	未
你应该爱一个能带给你动力的人，而不是一直让你筋疲力竭的人。	未
你开心吗：	未
你当善良，且有力量，善良也需要锋芒。	未
你当成垃圾扔掉的东西，巧妙利用，再也不浪费！	未
你很美，但是你不够善良没有爱心	未
你得丢开以往的事，才能不断继续前进。《阿甘正传》	未
你心中的七星酒店，是长什么样子呢这次我们邀请你一次泡七家七星酒店，共同见证七星酒店的诞生！即刻成为七星摘星官，你需要：1）戳这里：我们想包你明年所有的七星酒店 点击立即参与才视为有效参与2）关注官微@携程TOP酒店3）带话题够不够七星发微博，并 ...全文	未
你心心念念的线网图可以直接下载啦，关注广州地铁官方微信，马上到手	未
你心心念的智能停车收费要来了，还新增车位600多个！	未
你心目中最喜欢的，火锅品牌是哪个呀口味相同的互相撩一下美食	未
你快来看第一张！！！@惊鸿啊喂	未
你怎么夸一个女孩子	未
你怎么看我选：1234。 （转）据说，美国华人学生学者联谊会对《孟晚舟保释后发朋友圈感谢祖国新闻》的评论，挺的，贬的，都有，有代表性的摘录几条：17本护照，4个外籍娃，1个富爹，家安在墙外，这样的人不感谢祖国，谁感谢 真实中国人的楷模啊。呵呵。2以祖国为傲，却把家安在随时都有可能与祖国为敌的国家，这逻辑真的不懂！3可把祖国给害惨了4衷心祝福晚舟同志平安回家，希望下次在朋友圈中顺便解释一下护照问题。5孟晚舟，女英雄！	未
你怎么看镇江新区平昌这个地方胜似仙境，网友：希望禁止！	未
你怎么能在美好时光里坠落成胖纸	未
你怎样，中国就怎样！新加坡街头，女子一个举动获当地网友狂赞12月8日，新加坡街头，一名红衣女子和一位老者正在一个交通路口处等红灯。天上突下大雨，而那位印度锡克教徒打扮的老者没带伞。只见红衣女子主动为老者撑伞，而她自己大半个身子都暴露在大雨中爱心和善良，是世界上最通用的语言，一个随手善举，便足以抵达每个人的心灵深处。暖心的女士，你真美！网页链接	未
你怎样过早晨，就怎样过一生！	未
你总会去到那些地方，雪山洁白，湖泊干净，全世界都在对你唱情歌。	未
你总会去到那些地方，雪山洁白，湖泊干净，整个世界都在对你唱情歌。 .	未
你总说我心猿意马，怎知我一心想伴你天涯。	未
//@你想不想推个雪人:真的可爱，贯穿始终//@不约儿童的大松子儿://@白昔颜不到两位数不改名://@碧雍:树高千尺，还是一个相声演员。//@玉西熙_L:好哭//@不是小白是小白菜:太好哭了	未
你想了解母婴用户消费偏好吗你想了解母婴产品市场趋势吗《2018年中国母婴用户消费行为洞察白皮书》来了，快扫码解密	未
你想吃吗看拉练路上兵哥哥做的这些特色菜！这样有才的兵哥哥可否来一打美食	未
你想和你的她有一场怎样的婚礼	未
你想和谁，一起走在今年第一场大雪的路上。	未
你想和谁一起走在今年第一场大雪的路上。	未
你想和谁一起过今年的圣诞节 。	未
你想我，我也想你，这样我们就是双想炮。fiveXseven	未
你想要的老公生成器，下载这个APP一键生成。	未
你想象不到的汽车冷知识！ 你想象不到的汽车冷知识！	未
你想象中做瑜伽的样子VS实际上你做瑜伽的样子，是因为在20岁的年龄差之中疯狂徘徊太可爱了吧，简直一毛一样！！	未
你感动的从来就只有你自己	未
你感情不断你备胎无数 并不是因为你迷人 而是你廉价又百搭	未
你愿为他们点赞吗这是一双消防战士的手这双手剪过戒指，开过锁，扛过煤气罐，抱过小猫小狗这双手在烈日下抱着水枪，在暴雨中抱着孩子这双手曾与烈焰抗争，与死神争抢！这是一双万能的消防员的手，辛苦了，致敬！	未
你愿为这位雪中的特警蜀黍转发点赞吗12月1日20时27分，哈密火车站，哈密公安处特警支队的一位特警队员坚守在哈密站，迎接着一天的风雪，他说：旅客的平安，就是我坚守的意义！特警冬训练为战，成效见！[加油]	未
你愿意为退伍老兵点个赞吗 谢谢有你们，中国军人！	未
你愿意为：退伍老兵点个赞吗 谢谢有你们，中国军人！再见，老兵！	未
你愿意为：雪中站岗的中国军人！点个赞吗同样的年纪，为了祖国和人民他们选择默默坚守。向兵哥哥说声：辛苦了！ 微博视频	未
你愿意为：雪中站岗的兵哥哥点个赞吗中国军人眼里没有风雪只有责任！你们辛苦了！致敬	未
你愿意听听我的好奇心吗小海豚爱心图书馆第六季走进福建山区，向孩子们征集好奇心。点击:网页链接 聆听解答孩子们的好奇心，帮助他们实现阅读梦//@爱心图书馆:你愿意听听我的好奇心吗点击:网页链接 一起来聆听解答孩子们的好奇心吧@扬帆计划 @微公益	未
你愿意和导盲犬同行吗导盲犬是温顺聪明训练有素的工作犬，能够帮助视力残疾人正常出行，是他们失而复得的眼睛目前，全国已有多地地铁都允许导盲犬进入，可导盲犬和主人被拒绝的尴尬仍在上演今天是国际残疾人日，愿意让导盲犬和我们共同出入公共场所的，转发支持！爱同行，不拒绝！	未
你愿意和我们一起救助这些小可爱吗	未
你愿意把赞给我们的战士吗	未
你愿意点赞给我们的边防战士吗	未
你我同在，东华帝君的仙境洞府	未
你我文明行，共建文明城，逸园广场数千人手系黄丝带，举起了右手庄严承诺	未
你我的这七项权利是如何保障的？	未
你我金融智能投工具正式上线！	未
你我金融连续3年通过三级等保测评，持续强化信息安全	未
你所不了解的汽改水改造工程，竟然有这么多好处！	未
你所不知道的，江边风景独好	未
你所不知道的茶海，宛若世外桃源荆楚第一羌寨的麻柳溪。 有人去过这里吗	未
你所以为的巧合，不过是另一个人用心的结果	未
你所坚守的，终将成为你的美好生活	未
你手机号后四位，代表你2019能得到的东西	未
你手机里有保存什么帅气小哥哥的照片吗	未
你找到了史诗级化学武器榴莲	未
你投票，妈妈做！“最爱吃的8道故乡菜”投票进行中	未
你拍的哪张相片最有爱图一是在理塘遇见往拉萨朝圣的藏族同胞。图二是行车途中无意间抓拍。图三是像小女孩买了一块石头（50元）其实山里到处都是。图四旅途中一个小山村的聚会。图五六故事很多	未
你接到迪拜酋长的亲切来电了吗	未
你操心的那些事情都会往好的方向发展 [小仙女]	未
你支持杞县限行么	未
你收藏了哪些有时代感的旧物品 快私信@石家庄的事儿 提供过来吧，采用后会为庄亲送上神秘大礼哦 转发微博@2个好友 抽2人送88元红包，抽3人送爱哒气泡酒 快扩散给你的小伙伴来参加！	未
你收集过火花吗	未
你敢@喜欢的人吗。	未
你，明天来我办公室一趟//@讲究怪小盆友:我早就想送了。但是你先付300手续费先。谢谢。	未
你是1还是2 微互动	未
你是一名合格的医学博士吗	未
你是不是也希望有这样的生活......	未
你是不是也记得多久没有说爱我	未
你是不是只认识网红，却不认识这位感动中国人物段爱萍她捐出去的钱能在上海买个大别墅，贴工贴人贴钱建设家乡 微博视频	未
你是买了一个暖壶吗搞笑	未
你是什么人搞笑幽默趣闻 红人的诞生 V影响力峰会	未
你是从什么时候开始喜欢科比的NBA	未
你是作为儿女可以拥有的最好的父亲//@实践情报: 温暖的悼词	未
你是作为儿女可以拥有的最好的父亲，让我们在悲痛中微笑，因为你可以重新抱着罗宾（三岁去世的女儿），并再次握着妈妈的手。	未
你是冬日暖阳梅西	未
你是千军万马来者不惧的强者还是攻城掠地组合多的多面手这一切都不重要，今天2018DIGIX超新星电竞赛深圳决赛正式拉开帷幕！皇室战争的立体装饰，超炫的擂台，还有精美礼品等着你今天谁能问鼎冠军，成为双城霸主，让我们拭目以待。	未
你是否也曾仰望星空，幻想自己在无尽太空中穿行如果那一天到来，星际导航是一种怎样的体验 宇宙老司机高德邀请你立即登船，与太空C计划志愿者们 @王宝强  @张雨绮 @THEO-朱正廷 共赴奇幻的星际之旅！@优酷 @挑战吧太空官博 戳链接：网页链接转发此微博并晒出你的专属星际签证， ...全文	未
你是怎么把包金的那些都保存的这么完好的我认出了好多！！还有小不点儿呢！	未
你是成年人了好吗。	未
你是我最重要的人	未
你是我的索肖， 我的奥莱-索肖， 当天空昏暗， 你依然让我灿烂。 那个阿兰-希勒， 真他妈贵呀， 请不要带走， 我爱的索肖。这是当年阿兰-希勒收到曼联邀请，球队考虑卖掉索肖时，曼联球迷为他们的20号写的chant，朗朗上口，歌词深邃。结果希勒决定死守纽卡，索肖留下，后来他成了索圣，索帅	未
《你是我眼中的山川和海洋》开机 黄圣池担任男一号	未
你是羡慕吧给你送一个 查看图片	未
“你是腐败分子的克星，全国人民的福星”	未
你是金寨的美容师，还是抹黑者！昨天，桂花公园对比鲜明的一幕	未
你是钢炮迷么最喜欢哪一款汽车V峰会	未
你是长沙人啵你喜欢长沙这座城市的生活吗	未
你是鞋控ShoeKong吗不是没关系@你的朋友告诉他/她炫耀鞋子的正确方式就是拥有一面鞋墙带功能的鞋墙你们见过吗	未
你是魔鬼吗另外刚发现电影院那种按摩椅两千左右就能买一台了，有点心动	未
你曾收到过别人寄来的旅途明信片吗有没有什么感动的故事评论里抽3个人，大苏给你们寄明信片旅游约吗旅行灵感季不止旅行	未
你最会P图啦！	未
你最关心最直接最现实利益的事...信阳市人民政府公开征集2019年信阳市十件实事	未
你最关心的宝宝的口粮品质，何不来眼见为实今天，金领冠带着宝妈们来到梦幻纯净的新西兰，开启金领冠品质鉴证之旅！快跟着金领冠，一同探寻纯净奶源的奥秘！	未
你最喜欢吃什么路边摊	未
你最喜欢哪一位的买家秀呢	未
你最喜欢哪一座城市的雪夜	未
你最喜欢哪个	未
你最喜欢哪个9号	未
你最喜欢哪个国家的空姐	未
你最喜欢的3号球员是	未
你最在意的那个心愿 将会在明天实现	未
你最好早点自己懂得这些道理	未
你最常用的一个手机App是：____	未
你最想去哪个地方旅行	未
你最想带谁去！	未
你最想要的年终奖是什么 我想要的当然是蓝月亮七色至尊洗衣液和风行网的VIP会员，2019年过上更加洁净的品质生活，出色一整年！那么你呢关注@风行网 转发微博，并在评论区大声说出来，12月8日抽取一名粉丝送出蓝月亮至尊洗衣液1瓶（颜色随机）@苏宁易购 @苏宁超市	未
你最活跃的群聊名称是什么	未
你最爱的人现在在哪个城市	未
你最近一次觉得街头灯光很美，是什么时候，在哪里旅游约吗	未
你最近有没有遇到什么难事或者不开心的事，说出来可爱的沙雕网友帮你想想办法，或者安慰。	未
你有一份优科豪马的大礼未领取。快戳链接参与吧！	未
你有一份冬日暖阳待签收 @港湾studio wei：847389562	未
你有一份圣诞礼物待领取圣诞节不仅有NBA圣诞大战 还有大礼包可以领取哦詹姆斯库里哈登等超多礼品都在这了！速戳原博参与活动	未
你有一份快递 等待签收	未
你有一份快递等待签收	未
你有一份来自七彩星空神农架龙降坪滑雪场的邀请函	未
你有一颗征服全球的心，还需要	未
你有什么才华我会填坑。  犀牛严选	未
你有什么爱好是坚持了五年以上的	未
你有你的大雪纷飞，我有我的樱花烂漫南涧无量山的樱花开了，攻略在此快拿走！	未
你有制造快乐的习惯吗	未
你有哪些不为人知的小癖好	未
你有哪些打麻将的经验技巧	未
你有哪些用了就不想换的个性签名______________	未
你有多丧都没关系，只要能满血复活就好	未
你有多喜欢我	未
你有没有不得不坚持的事_________________	未
你有没有背起包就走的旅行那种修行一般的苦旅，感受各种情怀和文化而不是看风景的 .	未
你有没有被陌生人感动过 情感	未
你有遇到过吗网友在钦州三娘湾拍下白海豚！三娘湾是国家4A级景区，是海上大熊猫中华白海豚的故乡。11月26日，网友分享了在三娘湾的大海上航拍的中华白海豚如果你的运气足够好，平常这里还可以看到白色灰色粉色的海豚出没哦所以你在三娘湾遇见过海豚吗（via南宁慧视航拍）	未
你朋友看优惠卷快过期了就约你吃饭搞笑幽默趣闻	未
你期待的好事一定会发生。	未
你期待的正在向你走来风雨无阻的那种所以请你再耐心等等	未
你期待福建的雪吗//@天师-卞赟: 粤北山区的冬天还是非常冷的，受地形影响，多次雨雪冰冻，那里也是主战场之一。至于福建，等下一次冷空气吧，也一样得看山区了	未
你来到豆花名宿，就是风景。	未
你来成都，除了带几包或者几条宽窄送给好盆友，还可以送ta什么礼物没错！就是这只熊了，成都，带得走的还有它！随手粉@宽窄有度 @成都熊猫屋 ，宽哥将在12月10日抓2位宽粉送66元现金宽窄汇	未
你来时满目疮痍，你走时锦绣河山！7年前的今天，两弹一星元勋黄纬禄离世。致敬！微博视频	未
你来杭州干嘛//@江宁婆婆:杭州的小伙伴们有福了，今天你们会看到一个熊猫版的我	未
你梦寐以求的东西，会来到你身边。 水逆退散	未
你死后会祝福伴侣和新欢吗为啥要祝福，都死了还怎么祝福啊，这个问题的答案不不是关我屁事么	未
你每转一次私生饭的视频，赞一次私生饭的图，就会让她们看到更大的利益或者机会，那么你家爱豆就会多一分的危险。我是的粉丝，请和我一起抵制私生饭！	未
你永远不知道，男人一个人在家的时候有多嗨搞笑	未
你汤赛场图当你汤被记者告知这是勇士自从10月26日以来队内最顶尖的六名球员（四巨头安德烈-伊格达拉和肖恩-利文斯顿）首次全员出战时（since Oct. 26 with their top six players available），你汤说道：哇喔，那真是过去很久了呢，感觉棒极了，就是这样，感觉很棒，就是这样，哇喔，太棒了。谈到他的水花兄弟库里15000分里程碑时：这太棒了。我相信他会再次做到的，他会再得到15000分的，也许是更多。他训练很努力，他是一个非常出色的领袖，他总充满自信并能够带来快	未
你没看错，我们上新了对于金属镂空书签，东方密语是认真的为了读书和不读书的你们，希望都是值得的[米奇比心]指路牌请见评论哦	未
你没见过的傲徕峰扇子崖！（内附航拍视频俊秀图片）	未
你火了在BK感恩周@ 你的芳心纵火犯活动中，堡堡真的遇见了@你的芳心纵火犯 ，缘分妙不可言，请务必收下这份横行蟹堡堡。	未
你火了 走错片场的小老弟@ZaynZaynZaynZayn，在云点餐活动中，成功引起了堡堡的注意，为了让他长点记性，请这位同学把王道椒香鸡腿 抄10遍，抄完送横行蟹堡堡一份。	未
你点的外卖放心吗佛山2348家餐厅开启后厨直播，看直播>	未
你点赞的样子真帅！四川公安社会化评价来了	未
你爱吃哪里的大米？宁淮粮食产销合作一年超过33万吨	未
你爱的零食是怎么做出来的我们去了良品铺子在荆州的生产车间	未
你爱英剧美剧？这些国家更爱“中剧”	未
你猜得到吗台湾九合一选举和多项公投议题结束后，哪一项是绝对优势通过的是《反核灾食品》，支持优势为七百多万票，不要说福岛地区，就连周边的茨城枥木群马千叶等地区食品都拒绝进口了，人再傻也知道癌症的可怕而大陆公知却跑到福岛洗地，想为核灾食品打开舆论缺口，记住这些帐号	未
你玩过最好吃的礼盒是什么m豆潮玩涂鸦盒是我吃过最好玩的礼盒，不仅有我最爱的m豆人，还能DIY涂鸦上色，两种豆人机任你选择，还能吃到轻脆的新品crispy，一盒满足N种需求，这么好玩又好吃的礼盒不玩一下怎么对得起你时尚潮人的称号呢本月天猫超市狂欢月12月9日-10日上天猫超市大牌狂欢 @天猫超市 购买各种爆款吧，还有机会获得礼品哦，快来戳链接网页链接 @M豆-红豆，作为时尚潮人千万也别忘了打卡上海南京东路m豆巧克力世界的线下狂欢活动噢！来吧一起狂欢 ！	未
你现在最想去哪里旅游	未
你的MX5垫在最底下//@YYP颜宇鹏:不如像破烂场一样，随便堆成一堆，更有感觉啊	未
你的ofo押金拿到了吗 ofo创始人戴威发全员信：为欠的每一分钱负责，勇敢活下去！（澎湃新闻）微博赚钱季	未
你的主队签运如何体育V势力 法国球迷俱乐部	未
你的付出，为何只感动了自己	未
你的健康及格吗一个动作测出来（20岁70岁都适用）每个年龄段都有各自的健康达标线，生命君根据专家的建议，总结了适合20岁70岁的测试方法，并给出相应的提升身体素质的方法。照着做，身体素质就能慢慢变好	未
你的光芒，我来守护！我在热搜星愿树活动为 @王嘉尔 送出守护星愿 王嘉尔时代，我的守护宣言是：尽情做自己想做的事，不受任何干扰，身体健康，事事顺心如意	未
你的兰喵向你投射了一枚安利 请查收 能让我时隔半年再重新写一次长篇安利的东西 相信我 是真的好用！！！！ 偷偷说一下 P5一定不要漏掉	未
你的内脏居然这么脏，清洁说明书备一份，一定用得到！	未
你的军姿，令我安心	未
