人均130万美元年终奖 Juul Labs是目前美国最受欢迎的电子烟，占据了七成市场份额，而且它的利润非常惊人，比传统烟草的利润还要高。电子烟我们都知道很多人在戒烟的时候，会选择用电子烟来缓解烟瘾，而且电子烟中不含有传统烟草的，再加上电子烟几乎是买断式的消费，不像传统香烟那样每年要大量的钱来买烟。青少年大规模抽电子烟也引起了美国官方的注意，他们觉得这样对青少年的身心健康发展不好，所以在亚马逊等一些电商平台都已经下架了Juul电子烟。但尽管如此，Juul电子烟的利润也很惊人。中国有好几亿的烟民，如果他	未
人均200住五星洲际， 泡汤泉， 享下午茶， N多亲子活动玩不停！	未
人均200，观竹海泡温泉，门票酒店一价全含！	未
人均3000能去欧洲半个月！高颜值低消费还免签！一次玩4个欧洲国家不是梦！	未
人均300抢低调奢华的深圳华侨城茵特拉根酒店池畔别墅复式套房！24小时私密泳池私家干蒸4人山林温泉！	未
人均33吃5星级酒店美蛙江团宴99元抢3人成都明宇丽雅饭店美蛙江团套餐午/晚餐通用	未
人均400住柏悦，6折住阿丽拉，双十二才是入手旅行产品最佳时机！	未
人均500西江苗寨宿食游套餐，睡进吊脚楼享冬日瑶浴泡汤，还有露天烤肉趴海洋球池等你来	未
人均GDP过2万美元，城市治理再上层楼	未
人均不超20！顺德这5家多人到飞起的食店，今天我必须曝光！	未
人均享受420元/年！上海灵活就业群体工会经费最新使用办法发布	未
人均花费超2万！这个寒假，你要带孩子出国游学吗？	未
人大代表蔡继明为网约车司机发声，说的真好！	未
人大常委会第七次会议举行第二次全体会议 栗战书出席会议(图)	未
人大常委会第七次会议在京举行 栗战书主持(图)	未
人大常委会第七次会议在京举行；中美经贸磋商继续推进	未
人大新闻张一新副主任参加南京市大气污染防治条例专家论证会法制委主任委员姚正陆向与会专家介绍了《南京市大气污染防治条例（草案）》修改相关情况，来自高校和法律实务界的六名专家围绕环保地方标准大气污染防治监督管理各项制度机动车监测和非道路移动机械管理餐饮油烟防治等问题提出了专业意见建议。	未
人大网坛"举行 城市文明行为促进条例明年将立法	未
人妖国（上）	未
人妻（女性）生存指南	未
人妻战斗力世界第一//@A-soul小波波: 塞西莉亚怎么打赢她的()	未
人家一个13岁一个12岁//@是汽水姐姐呀:完美！我嗑......（快打醒我）	未
人家都限行啦！杞县限行吗	未
人少的优势	未
人山人海！今天，合肥这个地方火了！	未
人山人海，盛况空前！今天近四万人都往磐安这个古老的庙会赶......	未
人工双录半小时，VTM双录最多5分钟！券商铺设一台VTM几万元，却智能化解决多个难题	未
人工智能4.0时代，人机共生才是智能财务的理想蓝图！	未
人工智能中的记忆问题——哲学在智能时代出场的一种方式	未
人工智能产业发展哪里强浙皖联手告诉你答案！	未
人工智能公司Aibee宣布A轮6000万美元融资	未
人工智能前沿实战班，助你拿下CV领域最热门职位	未
人工智能加速无人零售场景落地	未
人工智能助跑“新零售”	未
人工智能和商业智能正助零售企业数字化转型	未
人工智能对保险行业的挑战与展望	未
人工智能改变未来	未
人工智能改变未来（关注·透视新一代人工智能①）	未
人工智能来势汹汹！江苏职校“工业机器人”高手云集	未
人工智能电视标准首次发布 海信AI电视唯一获得六项A+	未
人工智能的下一个五年，全球都在关注这十个人人工智能在上一个五年的发展得益于什么其下一阶段的发展程度取决于什么近日，哈佛商业评论中文版联合数易创研发起了一个针对人工智能行业相关从业者对下一阶段人工智能产业发展的调研，调查结果显示出了人工智能产业发展的三大热点和下一阶段的 ...全文	未
人工智能进军体坛显身手 智能运算笑傲赛场	未
人工智能领域人才紧缺	未
人工智能领域人才紧缺 应届博士生年薪高达80万	未
“人工智能”首进南京中小学课堂	未
“人工流星雨”要来了 日本人工流星卫星明年发射	未
人工耳蜗刷屏，A股两公司布局 国内3大公司估值22亿	未
人已找到！好心人送到派出所的！//@平安武汉:网友求助天冷了，转发帮老人回家！武汉寻人	未
人帅衣服帅，该系列还将于今天和明天在 KIKS BEIJING 线下集合店独家抢先发售！	未
人应该具备两个觉悟：一是勇于从零开始，二是坦然于未完成。	未
人应该具备两个觉悟：一是勇于从零开始，二是坦然于未完成。  周国平	未
人应该具备两个觉悟：一是勇于从零开始，二是坦然于未完成。周国平	未
人应该具备两个觉悟：一是勇于从零开始，二是坦然于未完成  周国平 皓伦王明川	未
人很好//@前进的信使: 转发微博	未
人心易变，只有自己给的，才叫安全感	未
人心难测，请各位保护好自己。	未
人性的26个弱点愿我们以此为鉴，提升自己。	未
人性的光辉	未
人性的美好 需要通过测试吗？	未
人性的考验（深度好文）	未
人总把最好的东西糟蹋以后，才开始感慨人生若只如初见。	未
人手一份人手一份谢谢联合国儿童基金会大使王源	未
人手一份，蟹痴必收的独家宝典，一大波大闸蟹向你走近ing	未
人手一张图，存起来吧！	未
人手一支的打啵神器，好用到尖叫，涂完嘴唇整个冬天不起皮！	未
「人才」11月30日招聘汇总：连江这些企业出手了，你要钱！他要人！简单粗暴只为找到你！	未
「人才」12月1日招聘汇总：连江这些企业求才若渴，贤才留步！这里有你的位置！	未
人才招聘 成都理工大学2019年地学人才招聘计划！	未
人才热线丨洪泽这24家单位正在招聘，点击查看>>>	未
人才盘点素质模型梯队建设人才管理工具包	未
人才科创千年小镇重科创 主动对接引凤凰	未
人才网融康包装诚聘/后勤帮手/人事后勤管理可兼职等（今日更新3条）	未
人才评价机制改革如何打破“标准化”，激发创新活力？听大咖论道！	未
人才鹊桥会四季亲子乐园美食城全面招聘	未
人挡杀人佛挡杀佛重炮李申横扫千军羽毛球年终总决赛总决赛李绍希申昇瓒进决赛	未
人文乡会桥火车站中国第一条民营铁路的重要历史遗存	未
人文医院建设：打造有爱的医院	未
“人文湾区”好戏连台	未
人文社会科学普及基地是普及人文社会科学的重要载体，是倡导科学方法传播科学思想弘扬科学精神的重要途径重庆建川博物馆已于今日被正式命名第四批重庆市人文社会科学普及基地，我们将充分发挥好自身优势，积极参与到人文社会科学普及实践活动中，为提升大众人文社会科学素养贡献最大力量 ...全文	未
人文精神是教育的灵魂	未
人文通城关刀镇密岩山，静谧小村，千年古寺！	未
人无千日好，花无百日红（精辟）	未
人是铁饭是钢，床是磁铁早安，新的一周早安旅行	未
人智学系列  情感 (Feeling)	未
人最大的修养，是知人不评人。	未
人最大的修养，是知人不评人	未
人最大的教养，是原谅父母的不完美	未
人最好不要错过两样东西，最后一班回家的车和一个深爱你的人。	未
人最好千万不要错失机会两样东西，最后一班回家的车和一个深爱你的人。 .	未
人最好趁年轻时就去世，当然，越晚越好  小布什给父亲老布什总统的悼词	未
人最怕：深交后的陌生 （写得真好）	未
人最怕深交后的陌生(同步自@新浪看点)人最怕深交后的陌生	未
人有多自爱	未
人本 蝴蝶结平底雪地靴 74人本家的鞋子上脚都挺舒服的，蝴蝶结设计很别致，加绒的天再冷点也可以穿，可能有些地区已经可以穿了	未
人本蝴蝶结平底雪地靴卷后74旗见店哒蝴蝶结设计很少女呢，里面是加绒的像拖鞋一样舒服，也很暖和呢！！	未
人本起草制定《帆布鞋》标准获批准，规范行业发展	未
人机达摩绝对全场MVP	未
人格上的平等是最大的爱。	未
人比人气死人的意思//@鱼姜: 查看图片//@午后狂睡:精准投放。	未
人比的不是谁能拥有更多，比的是谁更能看开	未
人民公园鹤鸣茶社体验老成都，感受悠闲的盖碗茶时光 摄影拍照Zhu Huihui超话大神评选四川旅行	未
“人民共和国党报论坛”第十五届（2018）年会举行	未
人民创投区块链研究院为第二批特聘专家颁发聘书	未
人民医院产科病房正在改造，改造完成后的收费将怎样	未
人民医院出的！大家看看	未
人民周刊杂志社等中央新闻单位获互联网新闻信息采编发布资质	未
“人民圣火台”拉近奥运与民众（图）	未
人民在我心中 我为警察点个赞	未
人民大会堂演奏《春天的故事》打破惯例 谁定的？	未
人民大会堂见证改革开放的“心声”	未
人民大学副校长：稳消费对经济健康发展重要性远大于稳投资	未
人民大学新校区新动向：大厂拓展区项目开工	未
人民大学的同学们来收图啦另外直播马上就开 编号003今天带大家游韩服	未
人民子弟兵	未
人民币70周年纪念钞30号预约，已被看高到80元！	未
人民币70周年纪念钞来啦！50元一张！等额兑换！30日开始预约	未
人民币70周年钞今晚开抢！快速预约入口在这里	未
人民币两天暴涨千点背后：空头回补，企业结汇回升	未
人民币今天70岁了：这些最强天团你了解多少？	未
人民币发行70周年展在国博开幕	未
人民币发行70周年纪念币纪念钞 300元面额仅3000枚	未
人民币发行70周年纪念钞30日开始预约 发行1.2亿张	未
人民币发行70周年纪念钞30日起可预约，每人限兑20张	未
人民币发行70周年纪念钞今日建行开启预约	未
人民币回吐日内涨幅 重回6.90关口	未
人民币、央行70年：这些“最强天团”你了解多少？	未
人民币对美元收复6.89关口	未
人民币必然会成为世界上最重要的货币影响中国2018年度学者清华大学国家金融研究院院长国际货币基金组织前副总裁朱民，是一位天生的金融外交家他推动了人民币入篮等重大全球治理项目，在从国际货币基金组织离任后，他拒绝了顶级国际机构的工作邀约，扎根国内智库，为中国经济建策建言 ...全文	未
人民币若干元打落在花垣政务中心窗口了！请失主快来领取...	未
人民币计价资产 提振全大盘6.83 好快！	未
人民幣佔國際外匯儲備比約為1% 排名第七	未
人民幸福生活是最大的人权	未
人民幸福生活是最大的人权(望海楼)	未
人民政协报：40次全国政协全体会议有哪些成就与启示	未
人民政协的协商民主实践为非洲国家提供有益启发——记非洲国家驻华使节走进全国政协	未
人民数据与星辰律动正式签约 共建国家级区块链云(图)	未
人民文学奖笛安《景恒街》——人生就是安然渡劫后，未必会得到奖赏	未
人民日报2018中国品牌论坛公告	未
人民日报：40年改革开放是无数拼搏者胼手胝足的奋斗史	未
人民日报：8张图告诉你，何为工作到位	未
人民日报：9件小事，让你受益一生	未
人民日报专访江苏省委书记娄勤俭：不折不扣落实中央支持民营经济政策	未
《人民日报》专题报道天津共青团：服务青年，以青春之我笃定前行	未
人民日报：中国将坚定不移走改革开放之路	未
人民日报：中国是全球经济发展的关键要素	未
人民日报：中国经济的成色是好的底气是足的人民日报刊发答好经济发展新考题时评文章称，面对新问题新挑战和外部环境的变化，中国经济的成色是好的底气是足的，其中一个重要原因就在于我们拥有一个潜力依然巨大的国内市场。今年双11，18.82亿件快递让人再次看到新经济的实力，一些有助 ...全文	未
《人民日报》为德邦快递双11点赞，转型彻底稳了！	未
人民日报为湖北无臂小伙点赞！用双脚照顾母亲，他的故事催人泪下	未
人民日报也点赞！丽水男子身高80厘米，听完他演讲，老板当场捐款10万	未
人民日报乡村观察：三个“坚持”加快推进农业农村现代化	未
人民日报：京津冀 清洁取暖再加力今天出版的@人民日报 头版头条关注清洁取暖。这个采暖季，京津冀地区的清洁取暖工作进展如何本报记者近日在北京天津河北实地采访发现，为打赢蓝天保卫战，三省市措施到位责任到位，全力以赴做好清洁取暖各项工作。网页链接	未
人民日报：京津冀清洁取暖再加力 网页链接	未
人民日报人民网点赞宜昌生态长江美如画 不为产值伤颜值	未
人民日报今天6篇报道点赞四川！快看哪些市州露脸了	未
人民日报今天整版独家揭秘奇迹，这个人如何驯服小强造福人类	未
人民日报:他们的生命，永远定格在2018其中一位如皋人！	未
人民日报：以奋斗姿态将改革进行到底	未
人民日报：以改革开放的姿态继续走向未来	未
人民日报：以负责任态度把握世界经济大方向	未
人民日报仲祖文：新时代全国干部人事档案工作的基本遵循	未
人民日报任仲平：亿万人民的共同事业	未
人民日报任仲平文章：亿万人民的共同事业——纪念改革开放40周年（下）	未
人民日报：共享单车管理要与时俱进 各地规则应有弹性	未
人民日报关注！发生在来安的暖心一幕被全国人民点赞！	未
人民日报关注！发生在滁城的暖心一幕被无数人点赞！	未
人民日报关注：四川罗江一篙撑活乡村振兴和民营经济两条船！	未
人民日报关注安徽这名英雄	未
人民日报关注！追记如皋辅警沈银亮：向前，他总是以这样的生命姿态！	未
人民日报刊南京读者来信：理发店卫生不容忽视	未
《人民日报》刊文介绍山东卫视《美丽中国》创作经验	未
人民日报刊文：以科学态度和正确立场推进改革开放	未
人民日报刊文：以系统思维推进全面依法治国	未
人民日报刊文：坚持规则导向，摒弃实用主义和双重标准	未
人民日报刊文：对实现高质量发展的几点思考	未
人民日报刊文：将一场13亿多人的现代化征程进行到底	未
人民日报刊文：年轻干部要在“左右为难”中成长成熟	未
人民日报刊文：焕发我们民族的变革和开放精神	未
人民日报刊文纪念改革开放40年：亿万人民的共同事业（下）	未
人民日报刊文：翻过“三座大山”，民企会更强健	未
人民日报刊文谈民企融资：疏通货币政策传导机制是关键一环	未
人民日报副总编谈金融科技：新引擎 新挑战 新机遇	未
人民日报：《南京市国家公祭保障条例》实施	未
人民日报发表评论员文章《以改革开放的姿态继续走向未来——论学习贯彻习近平总书记在庆祝改革开放40周年大会重要讲话》	未
人民日报发表评论员文章《在新时代继续把改革开放推向前进——论学习贯彻习近平总书记在庆祝改革开放40周年大会重要讲话》	未
人民日报发表评论员文章：引领世界经济沿着正确轨道向前发展	未
人民日报发表评论员文章《正确认识我国发展的重要战略机遇期——三论贯彻落实中央经济工作会议精神》	未
人民日报：同舟共济，建立更加公正合理的世界经济秩序	未
人民日报:在开放中升华改革气质	未
人民日报：在新时代继续把改革开放推向前进	未
人民日报：坚持规则导向 摒弃实用主义和双重标准	未
人民日报：多一些体恤之心，对基层干部讲好三句话	未
人民日报：太湖重现万顷碧波	未
人民日报央视等55家媒体直播！1000万网友参与！这件大事，你关注了吗	未
人民日报头版：吉利，品牌这样炼成人民日报庆祝改革开放40年百城百县百企调研行栏目今日报道吉利汽车。报道称，从无到有从小到大从弱到强，吉利集团从无技术无资金无人才的土作坊起步，走出一条推动国产汽车工业全球化战略让民族品牌走向世界的造车之路。2017年，吉利汽车总销量124.7万辆，营业收入达928亿元。目前，吉利资产总值超过2000亿元，员工总数超过8万人，连续6年进入世界500强。	未
人民日报头版聚焦商丘：帮扶到田头 群众有奔头	未
人民日报头版聚焦革命老区平山脱贫“摘帽”	未
人民日报，如皋，90后，拆弹专家，帅小伙儿.......	未
人民日报官微点赞“宁波小学生”：12分钟连续4次让座	未
人民日报官微点赞宁波小学生：12分钟连续4次让座近日，浙江宁波慈溪一位四年级小学生瞬间成了网红他在慈溪293路公交车上，短短12分钟连续四次让座，暖心行动在朋友圈刷屏了记者联系上视频中的男孩，他的名字叫黄唯，是慈溪横河龙南小学四年级学生说起这件事，他还有些害羞而黄唯的 ...全文	未
人民日报官微点赞宁波小学生：12分钟连续4次让座近日，浙江宁波慈溪一位四年级小学生瞬间成了网红。他在慈溪293路公交车上，短短12分钟连续四次让座，暖心行动在朋友圈刷屏了。记者联系上视频中的男孩，他的名字叫黄唯，是慈溪横河龙南小学四年级学生。说起这件事，他还有些害羞。而黄唯的妈妈对于儿子在公交车上让座，一点都不意外。她自豪地说，儿子平时外表大大咧咧，其实很暖心，很愿意帮助别人。少年文明，则国文明！	未
人民日报官微点赞宁波小学生：12分钟连续4次让座近日，浙江宁波慈溪一位四年级小学生瞬间成了网红。他在慈溪293路公交车上，短短12分钟连续四次让座，暖心行动在朋友圈刷屏了。记者联系上视频中的男孩，他的名字叫黄唯，是慈溪横河龙南小学四年级学生。说起这件事，他还有些害羞。而黄唯的妈妈对于儿子在公交车上让座，一点都不意外。她自豪地说，儿子平时外表大大咧咧，其实很暖心，很愿意帮助别人。浙江在线 人民日报官微点赞宁波小学生：12分钟连续4次让座	未
人民日报官微点赞宁波小学生：12分钟连续4次让座近日，浙江宁波慈溪一位四年级小学生瞬间成了网红。他在慈溪293路公交车上，短短12分钟连续四次让座，暖心行动在朋友圈刷屏了。记者联系上视频中的男孩，他的名字叫黄唯，是慈溪横河龙南小学四年级学生。说起这件事，他还有些害羞。而黄唯的妈妈对于儿子在公交车上让座，一点都不意外。她自豪地说，儿子平时外表大大咧咧，其实很暖心，很愿意帮助别人。 短短12分钟 连续4次让座！宁波小学生获网友点赞	未
人民日报客户端携今日头条推出微视频 致敬改革开放40周年	未
人民日报  将中医药文化带到世界各地	未
人民日报展望“智慧社会”：激发人工智能的“头雁效应”	未
人民日报:年轻干部要在"左右为难"中成长	未
人民日报广西：拔穷根 奔小康（辉煌60年壮美新广西）	未
人民日报：应对气候变暖 还需持续攻坚	未
人民日报：建设坚强战斗堡垒的制度保证	未
人民日报：引领世界经济沿着正确轨道向前发展	未
人民日报：当前我国民营企业发展面临的机遇与挑战	未
《人民日报》报道陕西西咸新区：新技术让城市更绿色宜居	未
《人民日报》报道顺德工业设计：设计顺德带动产业提质增效	未
《人民日报》：挑战渐冻症的南通舞者	未
人民日报：无锡获得2021年世界跆拳道锦标赛主办权	未
人民日报:"星级服务"应当有"星级品质"	未
人民日报梳理：一年来党建法治等领域重大改革举措落实情况	未
人民日报：正确认识我国发展的重要战略机遇期	未
人民日报：江苏建设“阳光扶贫”监管系统	未
人民日报：沿着“必由之路”逐梦前行	未
人民日报海外版:中国经济长期向好态势不会改变	未
人民日报海外版：“促就业15条”惠民生稳预期	未
人民日报海外版头版刊文：改革开放永无止境	未
人民日报海外版：改革开放　中国与世界共赢	未
人民日报海外版：重塑全球治理体系的中国方案	未
人民日报点评陈羽凡涉毒事件，6句话引用6首歌，网友纷纷点赞！	未
人民日报点赞威海张村镇党委书记门盛庆：把群众的小事办好，就是大事	未
人民日报点赞宁波小学生：12分钟连续4次让座近日，浙江宁波慈溪一位四年级小学生瞬间成了网红。他在慈溪293路公交车上，短短12分钟连续四次让座，最后很多乘客到站，他也终于有座位了。记者联系上视频中的男孩，他的名字叫黄唯，是慈溪横河龙南小学四年级学生。说起这件事，他还有些害羞。而黄唯的妈妈对于儿子在公交车上让座，一点都不意外。她自豪地说，儿子平时外表大大咧咧，其实很暖心！	未
人民日报点赞宝鸡渭河，八百里秦川的血脉关中人家门口的公园	未
人民日报点赞柯洁：他对“胜负心”的拿捏，多了一份沉稳	未
人民日报点赞海口生态环境整治成效12月12日，人民日报第六版以美舍河里泛清波为题，点赞海口市通过科学规划，加强城市精细化管理，控源截污内源治理生态修复景观提升同时进行，干部群众形成合力，让32条水体基本告别黑臭，生态环境整治取得明显成效....（记者计思佳）详戳 ...全文	未
人民日报点赞海口生态环境整治成效12月12日，《人民日报》第六版以《美舍河里泛清波》为题，点赞海口市通过科学规划，加强城市精细化管理，控源截污内源治理生态修复景观提升同时进行，干部群众形成合力，让32条水体基本告别黑臭，生态环境整治取得明显成效....（记者计思佳）详戳网页链接	未
人民日报点赞的拆弹尖兵原来是咱如皋90后帅小伙儿，果认识	未
人民日报点赞西安高新区：干事创业转作风 实业立区谋发展	未
《人民日报》点赞：高邮建立廉政档案做好“体检”预警	未
人民日报环球人物杂志招聘新媒体实习生3枚岗位要求：1. 大学本科及以上学历新闻传播中文新媒体等相关专业优先2. 熟悉微博微信等后台操作，有知名公众号工作实习经历者优先3. 即日可上岗，实习期不低于3个月，每周至少可坐班4天4. 加分项：文字功底扎实，能够独立完成新媒体稿 ...全文	未
人民日报：生态环境保护，永远在路上中国的生态环境保护，是伴随改革开放的步伐掀开历史篇章的。这40年，有太多大事件值得铭记......对生态环境保护工作者来说，这些大事背后，是几十年如一日的艰苦努力。生态环境保护走过40年，我们拥有越来越健全的法律制度，越来越完善的监管体系，越来越多的资金保障和越来越先进的技术储备，但也必须清醒地认识到，全国生态环境依然脆弱，生态安全形势依然严峻，保护与发展矛盾依然突出。生态环境保护，永远在路上（生态论苑）	未
人民日报：用荧屏故事书写改革华章	未
人民日报社总编辑庹震:发扬光大沂蒙精神	未
人民日报社论：筑牢民族复兴的宪法根基	未
人民日报：答好经济发展新考题	未
人民日报系列报道聚焦实体经济：从进博会看实体经济发力点	未
人民日报绿色家园秋冬保蓝天，今年这样干：加强预警应急 夯实减排措施根据中国气象局国家气候中心和生态环境部中国环境监测总站联合会商，今年冬季北方地区大气污染扩散气象条件整体偏差。霾去霾又来，秋冬季北方地区频发的重污染天气依旧是人们的心肺之患。如何更好应对重污染天气记者近日采访了相关人士。加强预警应急夯实减排措施（绿色家园秋冬保蓝天，今年这样干）	未
人民日报：网络剧"出海" 质优方致远	未
人民日报聚焦上海党建新格局：基层组织强，绣花功夫深	未
《人民日报》聚焦贵州：更多群众选择家门口看病	未
人民日报聚焦长三角一体化：打通断头路，发展无边界	未
人民日报：致敬40年，“一棒接着一棒跑下去”	未
人民日报：让你受益一生的9件小事	未
人民日报评党支部工作条例：建设坚强战斗堡垒的制度保证	未
人民日报评刘国梁当选乒协主席：专业人做专业事，众望所归	未
人民日报评论	未
