便民连江最新招聘求职房屋租售二手消息！（12月04日）	未
便民顺义227家暖心驿站专为这些人服务！	未
便民顺义人进五环后可三人合乘定制公交啦！	未
便民顺义木燕路顺密路交通治理工程完工	未
便民顺义河东又有新动作啦！	未
促就业15条惠民生 前10月全国新增就业1200万	未
“促就业15条”惠民生稳预期	未
促就业15条惠民生稳预期 前10月新增就业1200万	未
促就业15条惠民生稳预期 前10月新增就业1200万日前，国务院印发《关于做好当前和今后一个时期促进就业工作的若干意见》，从5个方面提出15条具体措施，稳定和促进就业。相关人士指出，当前我国就业形势总体稳定，但就业压力仍存在。本次出台的《意见》具有很强的针对性创新性和可操作性，为确保当前和今后一个时期就业目标任务完成和就业局势持续稳定提供了有力保障，企业和老百姓能从中获得实实在在的利好。促就业15条惠民生稳预期 前10月新增就业1200万	未
促进专利代理专业化市场化	未
促进亚欧合作对话 博鳌亚洲论坛罗马会议将召开	未
促进变道超车动能转换 高邮解放思想厚植“人才森林”	未
促进宜居宜业宜游环境建设和乡村发展(图)	未
促进扶贫与扶志扶智深度融合	未
促进民间投资“26条”出台	未
促进科技成果转化法执法检查报告建议 抓紧完善相关配套法规规章	未
俄3万精锐主力增兵克里米亚 总兵力超8万 武器部署已就位	未
俄quot最先进机器人quot里面竟装着个大活人 穿帮照流出12月11日举行的致力于机器人技术的青年论坛，在台上跳舞的机器人。英国《独立报》表示，如果这个是真的，那就是世界上最先进的机器人之一。微评：俄国有冒充先进的传统。苏联时期红场上阅兵曾展示全球最先进的武器。俄最先进机器人里面竟装着个大活人 穿帮照流出	未
俄专家：中国发展可再生能源的技术水平甚至超过美国	未
俄中两座大桥的开通将成为两国地区合作的突破性事件俄罗斯远东发展部部长科兹洛夫接受卫星通讯社采访时表示，下列宁斯科耶-同江大桥以及布拉戈维申斯克-黑河大桥的开通将成为俄中地区合作的突破性事件。俄中两座大桥的开通将成为两国地区合作的突破性事件	未
俄乌事态升级？乌克兰国安和国防委决定实施60天战时状态	未
俄乌就扣船事件互放狠话 俄军升级这一＂大杀器＂	未
俄乌杠上了，挺激烈，将如何收场？	未
俄乌飞机谁更强？力量与速度对比，伊尔-112V挑战安-140	未
俄军司令：已制定系列措施应对美在建的反导防御系统	未
俄军强势打脸：图160战略轰炸机不是花瓶，美国没有此类武器！	未
俄军推出高速隐身战斗直升机，时速400公里，秒杀阿帕奇！俄国防部透露该机在试飞中飞出了时速405公里的最大平飞速度而美国的阿帕奇武装直升机的最大航速只有276公里每小时 俄军推出高速隐身战斗直升机，时速400公里，秒杀阿帕奇！	未
俄军明年将举办1.85万次演训 含战略核力量演习	未
俄军最强装备到底是啥？实拍俄最新战机苏57对抗自家S400导弹	未
俄军神秘激光武器已服役！比起这怪物，它也配叫“末日武器”？	未
俄军部署超强导弹，美军毫无压力：我们能20秒发现，85秒摧毁！	未
俄击中美退群命门？最强天眼开机，能同时反击五千枚导弹攻击	未
俄副外长说俄愿就《中导条约》问题与美对话	未
俄南部军区今年军演总数量加倍 网页链接	未
俄叙联军眼看胜利在望美制无人机突现战场 S300紧急启动击落数架	未
俄国防部2020年前将建世界最大武器博物馆	未
俄国防部证明俄图-160轰炸机优于美国B-1B俄罗斯国防部对俄战略轰炸机图-160和美国飞机B1-B轰炸机的性能进行了比较。俄国防部证明俄图-160轰炸机优于美国B-1B	未
俄国防部：质子-M火箭成功将一颗军用卫星送入轨道据俄罗斯国防部信息和大众传播司发布消息，质子-M运载火箭21日在拜科努尔发射场升空，成功将一颗军用卫星送入轨道。网页链接	未
俄土"破镜重圆" 普京决定启动俄土关系正常化进程	未
俄在乌舰缴获大批步枪，乌克兰最新魔改无托步枪比AK还猛轻武专栏	未
俄外交部回应美从叙利亚撤军：具有里程碑意义	未
俄外交部回应美国撤军:为叙问题政治解决创造前景	未
俄外长：中俄印正制定加强三边合作方案 坚持多边经贸体系	未
俄太平洋舰队作战舰艇支队完成对斯里兰卡访问俄罗斯东部军区新闻局太平洋舰队信息保障处发布消息称，太平洋舰队作战舰艇支队24日完成对斯里兰卡科伦坡港的事务性寄港。网页链接	未
俄太平洋舰队兵力因强气旋逼近勘察加半岛而处于高度戒备状态俄罗斯东部军区新闻局太平洋舰队信息保障处发布消息表示，太平洋舰队辅助船队和搜救保障支队值班兵力因强大雪气旋接近勘察加半岛而处于高度戒备状态。网页链接	未
俄媒：中国用S400成功拦截时速1万公里高超音速导弹俄罗斯观点报22日称，中国于12月上旬在国内靶场进行了S400拦截导弹测试，在模拟敌方实施高强度电子干扰条件下，中方使用S400配备的48N6E导弹，在约250公里外成功拦截了速度为每秒3公里(约8.82马赫)的高超音速弹道导弹靶弹。	未
俄媒：俄罗斯可以借鉴中国清洁煤技术据RBK报道，中国煤电产能仍在增长，尽管不如十年前那么快（现在每年增加4，而不是从前的12）。产能规模巨大：超过俄罗斯所有电站（包括燃气电站核电站水电站）四年的发电量。然而即使存在这种量上的差异，也仍然可以找到质方面的相似性，例如，城市空气质量。中国在这方面比俄罗斯严重。网页链接	未
俄媒：俄“轰鸣”号火箭从普列谢茨克发射场成功发射	未
俄媒报道，在结束对驻伊拉克美军基地的秘密视察后，特朗普又飞赴德国，给空军一号加油，也视察了美军驻德国拉姆施泰因空军基地。拉姆施泰因空军基地是美国空军驻欧洲的总部。	未
俄媒:调查称中国大学生就业最爱IT、商业和医疗	未
俄将于明年接装12架苏-57 或装备高超音速导弹	未
俄将参加2019年韩国新加坡组织的海上军演	未
俄希领导人会晤讨论加强能源领域合作	未
俄式外卖送餐员，佛系送餐，一切随缘	未
俄式幽默：这是我见过的最绝的拔火罐！	未
俄总理：贸易战最终不会有赢家 整个世界都在为之买单	未
俄总统新闻秘书佩斯科夫：俄方将继续保持与美沟通	未
俄战略火箭军装备年底前现代化率将达70%	未
俄技术集团：铠甲弹炮合一防空系统完成升级俄罗斯国家技术集团普通武装弹药与特殊化学剂集群工业总经理谢尔盖阿布拉莫夫在接受俄罗斯卫星通讯社采访时表示，铠甲弹炮合一防空系统进行了升级，攻击目标类型得到成功拓展。网页链接	未
俄方官员：俄将继续保持与美沟通	未
俄方:若美国退出中导条约 俄将亮出＂独特＂武器	未
俄方警告：若美退出中导条约，俄将发展“独特类型的武器”	未
俄日韩语全知道！浦东机场问讯台提供多国语言服务浦东机场现场问讯翔音组可提供英语日语韩语西班牙语俄语等多国语言服务，点击国旗选择语言，旅客服务中心即可连线航译组，由上海机场集团外语人才项目组和上海机场边检站外语志愿者服务队志愿者在线翻译	未
俄最大货运航空加入建设菜鸟智能物流骨干网今天，俄罗斯最大的货运航空公司空桥航空正式宣布加入，与菜鸟共同加强智能物流骨干网空运航线建设目前，菜鸟已连接全球114条空运航线，日均飞行232个班次菜鸟的全球空运网络与物流枢纽海运和铁路运输网络海外仓末端设施一起，借助秒级通 ...全文	未
俄最新伊尔76首飞，更换发动机，老瓶装新酒有何优势？	未
俄欧美宇航员搭载“联盟MS-09”飞船在哈安全着陆	未
俄毛军事观察 俄国宣布前卫高超声速武器提前一年进入服役状态。随着西方反导技术的进步，弹道低伸在大气上层可机动的高超声速载具是中俄近十年来发展的重要战略性威慑技术，西方目前还没有可靠的防御手段。高超声速武器实际比传统弹道导弹要慢得多，但飞行高度也低得多，且末端可自由机动，防空导弹无法对抗，恐怕只有定向能技术成熟后才有办法真正对付。	未
俄气今年前１１个月天然气产量增加５．８％	未
俄海军新导弹护卫舰抵达克里米亚	未
俄海军演练对乌克兰作战神器：只需一艘即可单挑乌克兰舰队	未
俄特种部队瞬秒乌克兰海军？快围观俄特种部队宣传片看战力有多强	未
俄研制新型直升机旋翼	未
俄米格－３５轻型战机预计明年完成测试	未
俄罗斯AL-31发动机收敛扩散叶片细节转发收藏 图片鸣谢@彩虹熊_白玮	未
俄罗斯Aviar汽车公司基于1967年Mustang打造的复古纯电动跑车，搭载双电机和100千瓦时电池组，最大马力840匹，百公里加速2.2秒，最大续航为500公里，将于明年上市！cars01车闻 汽车V峰会	未
俄罗斯与欧亚国家30年变迁“全景图”《欧亚新秩序》首发	未
俄罗斯人幸福吗受尊重吗对人类的文明有重大贡献吗	未
俄罗斯人月薪多少才幸福？这项调查给出答案	未
//@俄罗斯什么值得买:小熊曲奇	未
//@俄罗斯什么值得买:帮转	未
俄罗斯吃住行攻略 车友阳光开房车欧亚自驾（1）	未
俄罗斯 各种好吃的糖果500g17.8拍2件2斤只要29.2差不多可以囤年货了。	未
俄罗斯国防部发布2019年国防部日历俄罗斯国防部的设计师们制作了一本带有军事幽默色彩的日历。在日历每个月的月份旁边，印着调侃俄罗斯各军种及武器的军事笑话。网页链接	未
俄罗斯图-160轰炸机和委内瑞拉F-16及苏-30战机在美后院联合训练	未
俄罗斯圣诞老人赤身冬泳、跑步	未
俄罗斯夜空出现巨大火球，新型地空导弹炸成碎片，红旗16B或更强	未
俄罗斯太平洋舰队12月25日接装“响亮”号20380型护卫舰	未
俄罗斯将研制独特武器应对美国退出《中导条约》	未
俄罗斯开始使用位于克里米亚贝尔贝克的新跑道，安148成功降落	未
俄罗斯强力阻止乌克兰海军船只穿越刻赤海峡	未
俄罗斯总统助理：俄已准备好与美展开会谈	未
俄罗斯总统普京支持美国退出叙利亚，称特朗普决定很“正确”	未
俄罗斯战略火箭军装备年底前现代化率将达70%	未
俄罗斯执政党年度会议举行 普京和梅德韦杰夫出席	未
俄罗斯文学名著	未
俄罗斯新星卡恰诺夫给自己制定的2019赛季目标进入前十。你们觉得会实现吗网坛风云	未
俄罗斯旅行必备！马了说不定能用得到	未
俄罗斯极光之行7日详细行程守极光tips，追极光性价比最高的选择[给你小心心]p1 行前功课 p2p3 莫斯科p4p5 摩尔曼斯克p6p7 圣彼得堡p8 贴心小提示（via@芒果味儿少女唷）马蜂窝游记	未
俄罗斯棱堡岸基反舰系统(K-300P)发射P-800超音速反舰导弹	未
俄罗斯：正逐步提高对北极空域监控能力俄罗斯空天军无线电雷达部队司令安德烈科班14日说，该部队在北冰洋中的法兰士约瑟夫地群岛新地岛北地群岛新西伯利亚群岛弗兰格尔岛等地建有基地，进行全天候24小时战斗值班，对北极地区空域的监控能力正逐步提高。2018年以来，俄军共监测和跟踪3000多架次在俄边界附近进行侦察活动的外国飞机。 俄罗斯近年来不断强化在北极地区的军事力量。2014年12月，俄罗斯在北方舰队基础上组建北极战略司令部，负责管辖俄在北极地区部署的所有部队。此外，俄罗斯还计划全部恢复苏联在北	未
俄罗斯民众纪念斯大林诞辰139周年	未
俄罗斯没有计划在亚速海部署新的海军基地，乌克兰此举为赢得选举	未
俄罗斯海军首艘22800型导弹舰入列	未
俄罗斯“涂金胶料—棱堡”高级舰载防空导弹系统2019年将投入作战	未
俄罗斯猎鹰飞行表演队在符拉迪沃斯托克示范表演苏-35S战斗机2月7日，quot俄罗斯猎鹰quot飞行表演队在符拉迪沃斯托克附近的机场举行了一场示范表演，以纪念东部军区歼击航空兵团成立100周年。网页链接	未
俄罗斯画展来青白江啦，免费门票在这里，赶快来拿！	未
俄罗斯短发女孩Maria 吸吸仙气儿.	未
俄罗斯研究人员：新型抗甲型流感病毒复合物研发成功	未
俄罗斯研究张昊琦：俄罗斯的大欧亚战略构想及其内涵	未
俄罗斯科学院远东研究所举行纪念中国改革开放40周年研讨会	未
俄罗斯米格－35即将完成测试：足够皮实耐用	未
俄罗斯米格-35战斗机将配备有源相控阵雷达	未
俄罗斯美女骑警网上晒靓照 不光吸引粉丝 更改变警方形象	未
俄罗斯美少女 Dasha Taran.	未
俄罗斯“联盟MS-11”载人飞船将于3日复飞 将搭载三名宇航员奔赴国际空间站	未
俄罗斯“艺术世家”现身石家庄市美术馆	未
俄罗斯表示将对北约在俄边境附近部署战略精准武器做出应对俄罗斯海军总司令科罗廖夫26日说，北约继续在俄边境附近部署战略精准武器，这对2019年俄军方发展计划产生影响，俄方将对此做出应对。俄国防部机关报《红星报》当天援引科罗廖夫的话报道说，美国和北约在俄边境附近继续部署海基反导系统战 ...全文	未
俄罗斯表示将对北约在俄边境附近部署战略精准武器做出应对据新华社报道，俄罗斯海军总司令科罗廖夫26日说，北约继续在俄边境附近继续部署海基反导系统战略非核精准武器和增加军事基础设施等，北约在俄边境附近的作战准备能力得到提高，这对2019年俄军方发展计划产生影响，俄方将就此做出应对。科罗廖夫表示，2019年俄海军将继续建造和发展高质量新型战舰，与俄其他兵种共同完成战略核遏制非核遏制和维护俄国家利益的任务。	未
俄罗斯贝加尔湖生态游和红色线路知名度最高2018年俄罗斯旅游品牌年度排行榜生态旅游线路单元中，乌里扬诺夫斯克州的贝加尔湖大步道和红色线路项目分别位居第一名和第二名。网页链接	未
俄罗斯超视距检测雷达“集装箱”将在2019年开始担负战斗值班	未
俄罗斯远东重点客源城市旅行商来威考察踩线，我市举办走遍四海 还是威海旅游推介会	未
俄罗斯雪中的红场，灿烂又安静。不止旅行 V影响力峰会	未
俄罗斯领导人新年如何度假？普京和家人过节，梅德韦杰夫索契滑雪	未
俄罗斯驻华大使：我是中国改革开放的见证者	未
俄“联盟”火箭搭载宇航员发射升空 已进入轨道	未
俄“联邦”号飞船将于2025年4月前飞往国际空间站	未
俄联邦安全局介绍2018年反恐成绩	未
俄航天集团：2颗俄卫星和26颗外国卫星将于27日从东方发射场发射俄罗斯国家航天集团证实，携带2颗俄罗斯老人星-V卫星26颗外国航天器的联盟-2.1b火箭将于12月27日从东方航天发射场发射升空。网页链接	未
俄航天集团：新联盟号飞船将于12月前往国际空间站	未
俄警告：若美退出中导条约 俄将亮出“独特”武器	未
俄议员：S-300系统的交付助叙极大提高抗击导弹袭击的能力俄罗斯议员阿列克谢普什科夫在叙利亚遭受导弹袭击后表示，S-300系统的交付极大地提高了叙军队抗击导弹袭击的能力。网页链接	未
俄铝涨25%	未
俄防长：2025年俄军合同兵数量将超47.5万俄罗斯国防部长谢尔盖绍伊古周二表示，2025年俄军合同兵数量将达47.56万，现役义务兵数量将降至22万。网页链接	未
俄韩空气质量改善项目于12月在克麦罗沃州启动俄罗斯克麦罗沃州政府向俄罗斯卫星通讯社透露，计划在今年启动俄韩改善克麦罗沃州空气质量的环保项目。网页链接	未
俄驻华大使举办2018年度新闻发布会 盘点中俄合作成绩单	未
俊男靓女！C罗ins晒了和女友乔治娜儿子迷你罗合照。juventus	未
俊秀还关注了旼炫ins发了评论：旼炫啊应该很忙吧谢谢你今天能来查看图片	未
俗话说冬吃萝卜夏吃姜，萝卜不但适于冬季进补，还可以止咳促消化，团团都忍不住想买几斤了呢我和我的家乡 青春扶贫	未
俗话说：朋友多，好办事领红包也是一样的道理。现在，考验友谊的时刻到了：12月6日至12日，参与1212京东暖暖节红包三人行游戏，只要邀请2位好友，就有机会拆到最高4999元的@京东 无门槛红包！友谊暖了，钱包就暖了钱包暖了，心就更暖。带上你的好朋友，一起来感受暖暖人生吧！快戳大图 网页链接	未
俗话说的好，知己知彼，百战不殆。想要做到安全用电，首先要了解人为什么会触电。	未
保乐力加： 多举措深耕企业社会责任 积极践行可持续发展承诺	未
保住精气神的功法：闭目养神13式	未
保住饭碗	未
保佑今天能平安按时下班	未
保佑我的家人和我的小可爱们	未
保供丨用气高峰将至，为备足粮草，这家能源央企也是拼了	未
保健品直销产业是老年人产业，久盛不衰也因老年人要跟年轻人抗衡，给自己一个暴富机会吧，不然哩，搞电商搞教育搞人工智能，懂吗，搞得过你们年轻人吗传销精神遍布中国，有些也加了很多科技含量，让老人觉得高端，我妈在我这住时，差点被一个什么空气能的传销骗了，她说你们买股票总是赔，这个原始股，你买了准赚。她要证明我们老年人一出手，就知道有没有。	未
保健路地道桥双向开通啦58路364路公交车恢复原线路	未
保健路地道桥双向开通啦58路364路公交车恢复原线路小伙伴请注意！12月新规来了	未
保准牛CEO晁晓娟： 科技赋能，保险业的创新业态	未
保利物业际华三五二二... ...都是家门口的工作机会！张家窝本次招聘岗位更新喽(2018年12月6号)	未
保利近现代书画之夜5.3亿元收槌	未
保卫地球之肾骑护湿地生态，哈啰出行启动蔚蓝保卫战第二站11月24日，哈啰出行在广州市南沙湿地公园发起并主办蔚蓝保卫战第二站。该活动邀请了众多游客及本地市民通过哈啰景区车生态骑游的方式共同参与湿地保护生态观鸟的环保公益，切身体会湿地保护湿地保护的重要性与积极意义。接下来，哈啰出行的蔚蓝保卫战也将持续打响，集聚公众的生态骑游环保力，推动更多生态景区的绿色可持续发展。	未
保卫地球之肾骑护湿地生态，哈啰出行启动蔚蓝保卫战第二站11月24日，哈啰出行在广州市南沙湿地公园发起并主办蔚蓝保卫战第二站该活动邀请了众多游客及本地市民通过哈啰景区车生态骑游的方式共同参与湿地保护生态观鸟的环保公益，切身体会湿地保护湿地保护的重要性与积极意义接 ...全文	未
保卫新丰一方平安， 创建人民满意警队服务管理篇	未
保命贴！必看的高速公路驾驶技巧！	未
保姆太漂亮，女子担心她引诱老公，在家偷装监控，半夜查看后蒙了	未
保姆级攻略麻住！想去台湾玩噜	未
保存周末看//@一桃花折一:看爽片真的很让人身心舒畅//@艾克佐迪亚的亡灵:预告就超给力了，码着先	未
保存好，偷偷看...别不好意思！	未
保存好，晚上个人看，别不好意思！	未
保安培训日记  恩施，保安行业的春天来了	未
保安堆雪人出名了！曾被博物馆请去教孩子们泥塑大雪过后9日一早，杭州一家银行门口出现了一个雪堆的猪八戒：袒胸露腹，手里还抓着条鱼堆雪人的是保安杜金钱，每逢下雪，他都要在自己工作的银行门口堆雪人，因堆得惟妙惟肖而小有名气我堆雪人只是想给路人带来快乐来！戳图感受下大神堆的 ...全文	未
保安堆雪人出名了！曾被博物馆请去教孩子们泥塑大雪过后9日一早，杭州一家银行门口出现了一个雪堆的猪八戒：袒胸露腹，手里还抓着条鱼。堆雪人的是保安杜金钱，每逢下雪，他都要在自己工作的银行门口堆雪人，因堆得惟妙惟肖而小有名气。我堆雪人只是想给路人带来快乐。来！戳图感受下大神堆的雪人！（@都市快报）	未
保安堆雪人出名保安连年堆雪人出名，曾被博物馆请去教孩子们泥塑大雪过后9日一早，杭州一家银行门口出现了一个雪堆的猪八戒：袒胸露腹，手里还抓着条鱼堆雪人的是保安杜金钱，每逢下雪，他都要在自己工作的银行门口堆雪人，因堆得惟妙惟肖而小有名气我堆雪人只是想给路人带来快乐 ...全文	未
保安族：一位保安族人民警察心中的美好生活	未
保安礼仪大全，附视频全面讲解	未
保安连年堆雪人出名前不久杭州大雪，一家银行门口出现了一个雪堆的猪八戒：袒胸露腹，手里还抓着条鱼。形象生动引得路人纷纷驻足观看。堆雪人的是保安杜金钱，每逢下雪，他都要在自己工作的银行门口堆雪人，因堆得惟妙惟肖而小有名气。他说堆雪人只是想给路人带来快乐，也给自己的保安生活添点乐趣。（凤凰网）杭州一保安连年堆雪人出名，曾被博物馆请去教泥塑	未
保定一豪车被贴满卫生巾，忒壮观...保定一男子路边方便，被打成脑出血	未
保定一造纸厂房内突起大火，燃起的黑色浓烟数百米外清晰可见	未
保定农村的速看，发钱了！人人有份！	未
保定市公开征集2019年度惠民实事项目的意见和建议	未
保定市长当主播向世界宣传保定，易县元素走向世界！	未
保定徐水区：改革开放40年硕果累累	未
保定最美检察人展播活动之三十一在平凡的岗位上履行不平凡的职责	未
保定爆料 城市V聚力 好消息，保定东站和火车站停车收费标准今起下调！12月13日，保定晚报记者从我市物价部门获悉，保定东站和保定火车站停车收费标准进行微调，免费时间由20分钟延至40分钟，超出40分钟后，两小时内收费5元超过两小时后，早8时至晚8时加收3元/小时晚8时至次日早8时，加收1 ...全文	未
保定爆料 城市V聚力 这里的收费标准下调啦！一起来看V影响力峰会	未
保定福彩慰问易县特困户	未
保就业，稳发展	未
保山 你好（航拍 青华篇）	未
保山党建微视界第三期《医生的坚守》	未
保山党建微视界第二期《第一书记》	未
保山-关注银杏村短视频大赛，火火火火火	未
保山-图话和你一起奔向爱的海洋	未
保山市四创两争工作成效显著	未
保山市开展2018年全国交通安全日主题活动	未
保山-特刊我市开展世界艾滋病日主题宣传活动	未
保山-聚焦保山小女孩的作文，缘何感动那么多人	未
保山-聚焦橘子红了！约吗	未
保山-速览11月23日保山手机报：我市打黄扫非成效显绿色食品推介在保举行	未
保山-速览12月6日保山手机报：巡视组向施甸反馈情况滇西交易中心落户隆阳	未
保平安	未
保康12个村获评襄阳绿色乡村，看看有你家乡么?	未
保康3人获评隆中工匠称号	未
保康六型建设项目展示之二丨六型检察院建设专题片	未
保康六型建设项目展示之四坚定信念 一路前行	未
保康多个村获得湖北省绿色乡村称号，快看有没有你家乡	未
保德县文化局：脱贫攻坚齐发力 文化惠民谱新篇	未
保德县脱贫攻坚指挥部里的尖刀班脱贫攻坚总指挥部综合办 县扶贫开发中心工作纪实	未
保德：郭家湾飞出扶贫的歌	未
保护专利 南京鼓楼创建5个“正版正货”示范街区	未
保护好我们的环境，让南飞的他们有个栖身之地。	未
保护好科创人才的“好奇心”	未
保护好自己	未
《保护我的是耶和华》	未
保护母亲河，争当河小青丨环保拾荒跑等你来参与！	未
保护水源地！黑龙江108个水源地整治任务，102个已完成整改！	未
保护泥煤	未
保护消费者权益：江陵县工商局多举措持续优化市场消费环境	未
保护濒危文化！丽江市古城区纳西民族音乐协会揭牌！	未
保护眼睛很重要	未
保护知识产权 拉萨海关启动“龙腾”行动	未
保护秦岭 爱我家园专家呼吁长效保护秦岭 让人与自然和谐共生	未
保护秦岭 爱我家园渭南安康竭尽全力守护秦岭的绿水青山	未
保护脖子哈哈	未
保护自己是你的终生必修课 。	未
“保护长城加我一个”长城保护项目(图)	未
保护长江！一个千年码头的绿色变迁	未
保护非遗 迫在眉睫！“昆曲、苏剧、评弹音视频保护传承工程”正式启动	未
