启动联合考察　韩朝合作“铁路先行”	未
启动“鲜美金湖”绿色新引擎！金湖农产品区域公用品牌在沪发布	未
启悦Pro版将超低油耗进行到底，搭载G-INNOTEC全铝VVT高效能发动机，百公里综合工况油耗低至：5.4L，保证动力的同时，实现燃油经济性！转载请标明出处	未
启悦Pro版搭载G-INNOTEC全铝VVT高效能发动机，采用领先的动力与降耗技术，百公里综合工况油耗低至5.4L，享受速度的同时，也无需担心油耗！转载请标明出处	未
启扬高速宝马车燃烧 疑人为纵火（视频）	未
启程出发，目标羊城。这两天大概会分享很多羊城见闻，敬请期待。	未
启程欧洲行！全程无规划说走就走想停就停，随便走的惬意旅行gogogo	未
启航新时代你知道吗，宁夏每分钟外送电量超10万千瓦时！	未
启蒙思想家霍布斯遗作首译首版：《比希莫特论长期国会》（精装本）出版	未
启迪科技园（重庆高新区）多措并举创新孵化见成效	未
吱付宝首页搜索216124198	未
吴世勋吴世勋独孤rewind姜赫 晚间提醒超话排名在三环！现在果机和安卓都能下载超话社区领取积分了！	未
吴世勋心动时刻天气冷下来了，比起热奶茶，更先想到他。原来是一年当中最需要恋爱的季节到了。	未
吴世勋心动时刻男朋友视角	未
吴世勋 本周超话目标：30还差20万多影响力，请将手里的积分全部送给吴世勋[给你小心心] 加油	未
吴世勋 爱心时刻 吴世勋综艺犯人就是你 世勋哥哥一枪命中心脏用美貌夺命晕晕	未
吴世勋爱心时刻官图iTunes181213EXO Digital Booklet LOVE SHOT	未
吴世勋爱心时刻官图melon181213更新1P世勋相关 原图地址：网页链接	未
吴世勋 翻到以前的这个 现在看还是很有感触你看啊，有那么多理由，足够你喜欢他	未
吴中路商圈拥堵怎么破？“溶栓刮骨活血”大法见效	未
吴亦凡《Freedom》MV化身宇航员 开启太空之旅(图)	未
吴亦凡 @Mr_凡先生  从山路自驾行驶，到停机坪眺望再到城市天台以及加油站的乐舞独白，爱上孤独感[给你小心心]	未
吴亦凡@Mr_凡先生 好困啊我就说说，每个博主都有自己想说什么的自由，但是上升讨论到一些的时候，粉丝就别转了。也不用去说博主什么。博主代表他个人观点。我也不知道我在说什么了，总之你们看到觉得有一丁点不妥的东西，直觉哈，就不要转发了。但是也别去管路人。路人不代表我们。	未
吴亦凡//@Mr_凡先生:继续成长 继续努力 不忘初心	未
吴亦凡 吴亦凡《时尚芭莎》2018年12月上 [全文 文字版]November Rain-Mr_凡先生	未
吴亦凡热心公益，以行动诠释梦想，向社会传递青春正能量@Mr_凡先生	未
吴亦凡看蒙圈!小胖哥登台热舞真实身份竟是王祖蓝	未
吴亦凡：音乐是中西方文化的桥梁	未
吴京《流浪地球》再曝预告， 特效炸裂， 又是20亿大片?	未
吴佩琴：学而知不足  一个小社工的随心感悟	未
吴克群 12月7日上周五凌晨四点@吴克群 现身陪你一起过冬天 的公益活动，与一线环卫工人一起清洁道路护栏，携手 @韩红爱心慈善基金会 致敬环卫工作者，呼吁大家注意公共卫生，随手公益，随处公益，少一个随手扔垃圾的人，就是对城市环卫工人的最大关爱。	未
吴兰当选辽源市人大常委会主任 王立平当选辽源市市长 张炜当选辽源市政协主席	未
吴军：为什么我告诉女儿要尽可能上好大学   思享	未
吴冠中画笔下的竹子	未
吴利军：推动跨境资本市场合作项目落地	未
吴协恩:"天下第一村"要夸不倒、吓不倒、难不倒	未
吴卓林与妻子婚后现身街头 蹲地吃甜品很接地气	未
吴哥窟（Angkor Wat）位于柬埔寨西北部，被称作柬埔寨国宝，是吴哥古迹中保存最完好的庙宇，更是被列入世界文化遗产它以其造型雄伟布局平衡比例协调线条优美而闻名于世，饱受称赞，是一座巨大的水上都市，同时也是世界上最大的庙宇	未
//@吴堡公安:每一个生命都值得去努力！	未
吴天墀论刘咸炘：天资颖异而主张守拙，最推崇章学诚	未
吴宏鑫院士忆杨嘉墀院士：光看眼皮底下的，不是好科学家	未
吴宝春麦方上海新天地店的电话是多少 打算送给锦旗过去，就写两岸一家亲 共圆中国梦。	未
吴宣仪下巴不要拿几张照片来说事，看看动图，小选的下巴有问题吗不用多说了吧，小选也是火箭少女颜值担当之一，大家不要乱带节奏，还是关注下她们的作品吧，毕竟国产女团不容易，大家多支持才对	未
吴宣仪：你们在做啥子哟	未
吴宣仪《挑战吧太空》进阶“钢铁甜心” 死“磕”任务做自己的英雄	未
吴宣仪[超话] amp吴宣仪挑战吧太空 以后会更好，我们会一直在@火箭少女101_吴宣仪	未
吴宣仪[超话] amp吴宣仪挑战吧太空 会员版上线啦一起来看调皮小选失重挑战吧@火箭少女101_吴宣仪	未
吴宣仪[超话] amp吴宣仪挑战吧太空 即便难受也要坚持，小选最棒啦@火箭少女101_吴宣仪	未
吴川公益记录片《中秋回家》，在这里我想说：你过年回家吗	未
吴川公益记录片！这里有一个你不熟悉的吴川！	未
吴川江心岛可以种菜休闲娱乐好去处变身农家乐，何以被放养	未
吴川里坡村14年如一日迎万鸟归巢盛景，候鸟天堂望长存	未
吴川黄坡水潭慈佑寺落成仪式现场图集视频	未
吴川黄坡这条危桥改造工程速度之快，年底完工！	未
吴政隆会见中化集团总裁 见证中化连云港循环经济产业园签约	未
吴敏霞全家福	未
吴敏霞晒女儿 祝福诚哥和霞姐还有小西西[圣诞老人] //@张效诚STEVEN: 一家人，新征程，欢迎西西	未
吴新扬：本是同根生，相煎何太急。花纱套利合理性的思考  研报精选	未
吴昕身穿白色公主裙 化身甜美少女魔法老师	未
吴春燕保利唱响新时代之歌  金铁霖、赵季平担任艺术顾问	未
吴晓东在调研市本级重点项目推进情况时强调：全力以赴确保重点项目高质量推进	未
吴晓求等大咖云集 “中国经济报告”把脉2019经济大势	未
吴树俭带队开展大清扫活动	未
吴树俭现场调度推进重点项目	未
吴汉圣出任中央和国家机关工委副书记	未
吴江临近2019年第一场雪将至，你是瑟瑟发抖还是充满期待	未
@吴江人，泡温泉坐游船逛古镇，一次只要1块9毛8！第23期惠民休闲年卡今日上线！	未
吴江容：重燃生命之光  社区康复帮扶个案案例	未
吴涛: 建筑业仍将是国民经济发展支柱产业	未
吴清：上海将进一步加强上海金融中心和科创中心建设财联社12月15日讯，12月15日，2018上海金融论坛正式开幕。上海市副市长吴清致辞表示，上海将进一步加强上海金融中心建设，自贸试验区科创中心建设等，希望在上海建设国际一流的金融生态环境。	未
吴清：上海将进一步加强上海金融中心和科创中心建设财联社12月15日讯，12月15日，2018上海金融论坛正式开幕上海市副市长吴清致辞表示，上海将进一步加强上海金融中心建设，自贸试验区科创中心建设等，希望在上海建设国际一流的金融生态环境	未
吴湖帆旧藏“雷峰塔藏经”上海朵云轩拍出2875万元人民币	未
吴瑞新调研指导新时代文明实践中心建设工作	未
吴磊一秒变脸 上一秒还是温润可亲的斯文公子，下一秒就是桀骜冷漠的世家少爷。绝了	未
吴磊 有你和立顿的关心，这个冬天很温暖	未
吴磊朱一龙一炮而红，揭秘影视选角导演工作	未
吴秀波为经纪人证婚 杨幂李晨半个娱乐圈明星送祝福	未
吴秀波也为保险发声：保险让我更加从容面对一切	未
吴翠云带队到所联系的河北省山东商会走访调研	未
吴翠云：脚下带泥，身上带“味儿”，立足南疆做科研	未
吴英杰与广大教师代表共庆第33个教师节	未
吴英杰与第十三届全运会西藏体育代表团、西藏全国体育先进集体和先进个人代表座谈	未
吴英杰：用对党中央绝对忠诚的实际行动做好西藏工作	未
吴裕泰董事长赵书新：年轻化产品布局未来市场	未
吴谨言俞灏明《外滩钟声》首播获赞：这才是生活剧	未
吴谨言俞灏明新剧首播获赞：这才是生活剧	未
吴谨言偶遇“伯乐”于正 相拥热聊	未
吴谨言告别“初代令妃”  偶遇“伯乐”于正拥抱热聊续旧情	未
吴谨言殷桃《标化人生》开启励志女性职场生存战	未
吴远青:中小券商要结合自己特点 转型从用户需求出发在新浪金麒麟 论坛，联讯证券网络金融部总经理吴远青表示，金融科技很多时候是一种投入，要付出成本，越是行情不好的时候，正是我们对系统进行改造升级的好时候。他表示，中小券商还是要结合自己的特点，真的从用户的需求出发。 ...全文	未
吴迪丨团队签约年限为10年新收两名徒弟，直播间大秀才艺！	未
吴迪丨直播间上演抢榜大战！七兄弟样南，表明立场，支持仙洋	未
吴迪单膝下跪，欲小伊伊为师！改马甲吓跑小伊伊！牌牌琦散打哥白小白做公益，捐款献爱心！	未
吴迪才关注天道网友投稿，在快手的动态里发现吴迪刚才关注了天道，小哥俩平时挺好的怎么才关注，估计是不小心取消了吧	未
吴迪新收两名徒弟，直播间大秀才艺！团队签约年限为10年	未
//@吴铭:中国驻温哥华总领事登门探望孟晚舟。中國駐溫哥華總領事探訪 孟晚舟親迎送	未
吴铮强·寻宋︱延州：范仲淹的主角光环	未
吴镇宇袁咏仪古天乐再合作 《家和万事惊》开年定档1月18日	未
吴雨翔 到家了在路上了21个小时！本来很累，不过一开门看看父母布置好家就很开心浓浓的圣诞节气氛	未
吴青峰为蔡依林新歌填词连改4次：她要求越来越高	未
吴青峰晒与张钧甯张悬合影 被两位美女围绕笑开怀	未
吴青峰晒与杨幂同框合照 两人多次合作终于相逢得见	未
吴鹏深入加勉乡调研指导脱贫攻坚工作	未
吸一口仙气，可能会是我	未
吸一口仙气//@台词先生: 一小时后开，还没上车的赶紧呀。	未
吸一口小可爱们//@欲盖弥彰是不对的:好看//@放开那个空巢老兽: @Coolx4pear 羡慕了//@魔物娘Hakuryu: 养鸡专业户，想rua鸡//@一只咪儿_钻雪的狐狸:@魔物娘Hakuryu来看小可爱//@狐狸社社长乱狐 :[给你小心心][给你小心心]可爱[给你小心心]//@自种天然 : 养鸡专业户	未
吸口仙气//@爱拆快递的安妮: 啾啾啾啾啾明天开哟[米奇比心]	未
吸吸欧气！	未
吸引游客不仅仅需要“明码标价”	未
吸！！！！！快吸这个人啊！！//@酸羊奶丷:如图所示 查看图片	未
吸毒上瘾有多难戒看看这些人的经历吧毒品让最美凋零，请远离毒品！	未
吸毒的羽凡不再最美！毒瘾发作到底多可怕看着都吓人	未
吸溜一口毒姐的美背！ 各职业T8武器外观图赏	未
吸粉大作战《Popular Wars》休闲放置《疯狂舞蹈》 新发现	未
吸雾霾吸毒外出保命神器，过滤99有毒气体，给您一个纯净的呼吸环境。	未
吸霾天，必备的防霾瘦脸口罩，赶紧为家人准备！	未
吹不动也要吹！西甲官方盛赞梅西：外星人今夜降临	未
吹响冲锋号！滦州全面启动违建拆除工作视频	未
吹响新时代改革开放再出发的嘹亮号角	未
吹响消除城区重点易涝区段号角 三部委召开电视电话会部署城市排水防涝设施建设补短板工作	未
吹哨报到 两车道扩宽为六车道！这条著名堵路改造完工明天通车备受关注的安贞路疏堵改造工程目前已全部完工，安贞路改造后全长700米双向六车道，明天将正式恢复通车。改造工程在安贞医院门口设置了临时落客区，安贞路东西路侧停车位及路西四处停车场均已设置到位，共700余个车位。今年年初朝阳区安贞街道吹哨后，区属八部门前来报到，通过对道路重新规划增加车道改造辅路和便道等措施对安贞路及周边交通组织进行了整体升级改造。新路长啥样，戳链接看看[最右]从两车道扩宽为六车道 全长700米的这条路明	未
“吹哨报到”出实效	未
“吹哨报到”:新时代群众路线的成功实践	未
吹哨报到：群众的事就在家门口解决近日，北京市的一项创新探索街乡吹哨，部门报到，摆上了中央深改委第五次会议的案头。这项党建引领基层治理的体制机制创新，被会议定性为聚焦办好群众家门口事，打通抓落实最后一公里的有效做法。吹哨报到：群众的事就在家门口解决查看图片	未
吹啊吹啊你的骄傲放纵！ 查看图片 //@英格兰队球迷俱乐部:冷冷冷 早上要被北京的大风吹死了	未
吹爆MartiDerm玛蒂德肤的油痘套组！真的太好用啦！今天要再囤两套！想让大家也试试()转发中抽取两位宝子各送出一套，周六就开	未
吹着风，守着树，等着您	未
吼吼！参与寻找鄂尔多斯锦鲤活动的小伙伴们戳进来！	未
吼声兄弟们齐举杯同饮欢聚一堂！华里英歌队员及众理事...	未
吾家弹弹 猫薄荷虽好，可不能贪嘴！某弹：滚一边儿去！(  )  微博视频 不开心就要消你呀 (开心消消乐年度开心进行曲)	未
吾悦广场开业在即，新一轮招聘会又来啦，上千岗位等你来	未
吾日三省吾身，今日瘦了吗一双给今年，一双给明年！1，2，3唯品会12.8特卖大会你喜欢的品牌3折封顶燃烧我的卡路里：网页链接	未
//@吾是宝儿:社会的担当，给但总和协会点赞。	未
//@吾是宝儿:让狗有素质，首先人要有素质。这个视频值得看。//@扬韬:对恶狗咬人的自救救人。//@白衣山猫: 转发微博	未
吾辈何以为战 魔兽世界城市集结号第2赛季开启	未
！呀！//@FB-wangylin:搓手手！@中国消防 查看图片	未
呀！上林天晴了，收下小编给你准备的三条上林游线路！（上林时空）	未
呀，变成小蘑菇头了呀！	未
呀呀呀刚下班，我来了[米奇比心][米奇比心]//@M鹿M:为中国高铁点赞	未
呀，影子会说话！你的梦想是什么交大光影魔术给你答案！	未
呀！猞猁！花老师带你逛动物园 微博公开课微博视频	未
呃...可能还是麻烦一下大家，方便的话能帮忙扫一下，谢谢	未
//@呆十三:嗯！//@叫你们经理来:希望大家都能做个自信的人 查看图片	未
呆呆岛小月湾加井岛角头鼻...三亚你绝对没去过的11大冷门景点！	未
呆萌军漫军人的周末时间大揭秘（军漫）	未
呆萌军漫军恋中，如何让对方感受到爱意（军漫）	未
呆萌军漫新兵指导员手绘画作 记录新兵成长点滴近日，一组绘画作品在武警北京总队执勤第四支队的新兵中引发了不小的关注，这组绘画作品创作者是该支队新训四中队的指导员顾广。一幅漫画记录一个故事，一幅漫画见证一段成长。顾广说，军旅最美好的莫过于兵之初，所以我就想通过画笔，记录官兵日常的点点滴滴，为他们留下一份美好的回忆。（姜润邈）	未
呆萌的麋鹿书签制作 微博视频	未
告别任性！ 今天一起学法懂法	未
告别号难挂队太长 陕西省任何医院不得出现儿科停诊和拒诊昨日，省政府新闻办公室就我省提升医疗服务水平，改善群众就医感受举行发布会会上介绍，9.5万份问卷数据显示，我省三级医院门诊和住院患者的总体满意度达到88.71分和92.02分，患者满意度逐步提高群众就医感受明显改善实现地级市内医 ...全文	未
告别号难挂队太长 陕西省任何医院不得出现儿科停诊和拒诊昨日，省政府新闻办公室就我省提升医疗服务水平，改善群众就医感受举行发布会。会上介绍，9.5万份问卷数据显示，我省三级医院门诊和住院患者的总体满意度达到88.71分和92.02分，患者满意度逐步提高群众就医感受明显改善实现地级市内医院就诊一卡通，患者使用统一的就诊卡可以在任一医疗机构就诊今后将进一步加大政府投入，建立健全省市县三级儿童医疗卫生服务体系。合理调整儿科医疗服务价格，提升儿科医师地位及合理的薪酬待遇，充分调动儿科服务体系的	未
《告别回忆-无垢少女-for Dearest 》2019年3月28日发售，PS4/PSVITA/Switch。讲述本篇之后的故事，Fan disc 作品。	未
告别城中看海！宁德市区拟建海绵城市 看看长啥样！	未
告别大象腿，动起来！！！ 微博视频	未
告别婆婆哈哈哈哈哈哈！	未
告别寒冬，我们在2019相聚第二届「权力榜」行业大会暨颁奖典礼	未
告别寒冬，拥抱阳光马上出发去攀枝花！	未
告别巨丑照！公安部最新消息：身份证照片将实现多拍优选，以后你的身份证也可以美美哒	未
告别“抬杆刷卡”！苏通大桥收费站预计本月26号完成“拆除”	未
告别昨夜深圳，今晚在广州草莓哟。	未
告别纸质车票电子客票将于明年在全国推广啦！近日，从中国铁路总公司获悉，铁路部门在海南环岛高铁实行电子客票服务试点，刷身份证扫码进站！此次不仅全面取消高铁车票，在绝大多数一二线城市将同时开通刷脸进高铁站！目前北京上海广州等绝大多数一二线城市都已经支持刷脸进站快速服务！	未
告别老布什｜作为美国总统他保持着四项记录，两项与中国有关	未
告别虎背熊腰！	未
告别虎背熊腰！ 微博视频查看图片	未
告别“跟跑时代” 中国高铁将续写“技术领跑”传奇	未
告别过去，迎接明天！	未
《告台湾同胞书》发表40周年：统一大势不可阻挡	未
告急！告急！最后2天！迪卡侬运动背包启东全城免费送！	未
告急招商率已超90，窗客会罗源百业联盟招商倒计时仅剩5天！罗源即将掀起一场盛事！	未
告诉你个秘密，最鲜美的鱼就在永安这个鱼村里	未
告诉你们一下！券今晚就结束的啦！！//@阿拾是白日梦想家：买了//@麦积山下6080553721：很不错	未
告诉你们一个大秘密：现在打开手机桃.宝搜索资深观众韩梅梅就能获得梅梅为你们准备的超级紅寳哦每天可以领取三次，12.12剁手可叠加使用。(ps：这是一条真爱粉才能看到的浮力博)	未
告诉你们，社保转移真的很简单！网上就能办！	未
告诉你戴姆勒增持北汽胜算多少！	未
告诉大家一个好消息，再跌半个小时这周就结束啦	未
告诉大家一个秘密	未
告诉大家个好消息，2262年可以过两个春节，你们计划怎么过	未
告诉猫扑我的新年愿望暴富暴瘦又到了开始新年许愿，制定新目标的季节了关注@猫扑 ，带话题@一位好友 转发并评论，告诉小扑你的新年愿望或者目标1月1号到5号，每天抽一个朋友打 888元新年目标基金1月3日抽10名送猫扑礼包1月4日抽 1名送小米mix2s1月5日抽 1名 ...全文	未
告诉猫扑我的新年愿望 有多少朋友在今年初定下了目标许下了愿望2018都要过去了，这些愿望又都实现了吗 关注@猫扑 和@ZAKER ，带话题@ 一位好友 转发并评论，说出你的新年愿望或者目标，1月5日抽5名粉丝给500元京东卡。	未
告诉金寨人3个小动作，冬天空调可省电500度！	未
呐，求职的！县妇联帮你介绍工作啦！	未
呐给你红包！快来跟小南交换你的2018感动故事	未
呕心整理了超全的上海迪士尼攻略！多达29个项目介绍，8场演出介绍，游玩小技巧等，希望能帮到你们！（许许许许_许美琪）	未
呕心沥血整理出来的上海旅游攻略，请收下哦 via.爱笑滴猫咪	未
员工卫生海报入职卫生培训手册	未
呜呜呜呜大家看看这个呢 我真的打心底佩服匡扶摇 以为是两条不想干的平行线 其实是父女啊//@205号居民:日子过得令她想不起来也分不出来 人会厌倦但又离不开。我们一再选择重复的东西或许就是接近我们的本质。	未
呜呜呜呜天哪声音太嗲了吧！//@ab豹狐狸:好娇气啊	未
呜呜呜呜收到馒头投喂了。谢谢给我饭同学，你不是给我饭，是给我爱啊	未
呜呜呜！！宝贝乖仔！//@就是爱我的宝贝儿们啊:超棒//@杰恩杰恩:后面还有，世勋说从很小的时候就有零用钱了，上小学的时候，1000韩元也已经是很多钱了，坐公交的话大概也就300韩元，所以花100韩元买年糕吃，其他的用来买垃圾食品和朋友一起吃（从小就是有义气的孩子）	未
呜呜呜，感谢鲨鱼帅帅让我每天再也不用愁没微博可以发了！！	未
呜呜呜，我也要修炼当plmm，我不要在深夜吃自己做的饭了//@M大王叫我来巡山:。太美了吧。这个五官好像洋娃娃。//@江南大野花: 仙女是真实存在的	未
呜呜呜我好爱这个采访[米奇大哭][米奇大哭][米奇大哭]	未
呜呜呜 我羡慕辽 又有姐妹在翻仔评论里网恋成功咯[给你小心心][给你小心心][给你小心心]	未
呜呜呜格莱美实现了 查看图片	未
呜呜呜//@系红领巾的猴子:说岁月眷顾都太肤浅了//@SUM不二: 我真的只会哭绝世美人	未
呜呜我的小可爱	未
呜哇//@kieiiiii:我滴好妈妈呀//@给我碗肉 ://@渡边鱼子酱 :我和我妈住一起 每天都能见到她//@江南大野花 :虽然经常拌嘴，但最爱的是妈妈//@捉奸用小号 ://@几口小羊羔 :快回家啦！！//@朝木Asaki :现在就回家！//@TAT-BOOM-TAT ://@白色况 :我也回家找妈妈吼吼//	未
呜哇！偷袭！	未
周一下午的好状态，先从下午茶开始	未
周一低温上调至13度无咁冻 下周日回暖怕冻的市民有好消息。天文台原先预测下星期一及三会有两个「寒冷低谷」，但今日天文台略为上调星期一的最低气温从12度改为13度，未达寒冷标准，而星期三维持最低12度，意味下星期天气无原先预测寒冷。下周日大致天晴，日间干燥，最高气温达到21度。后星期一（17日）部分时间有阳光，气温介乎16至21度。	未
周一  你绝对知道的资讯短视频平台，多地区，多岗位  梨视频	未
周一夜盘人民币收盘重新站上6.90	未
周一好，又开始一周的清淤疏通工作了。	未
周一工作日的下午，让我们克服拖延症，向着梦想（KPI）进发！	未
周一归家路 路况提前看滨海微服务 天津滨海新区实时路况：新华路立交桥实时路况 猛戳网页链接新港路实时路况 猛戳网页链接海河开启桥实时路况 猛戳网页链接中央大道与新港三号路交口实时路况 猛戳网页链接海门大桥实时路况 猛戳网页链接上海道与和平路交口实时路况 猛戳网页链接上海道实时路况 猛戳网页链接大连道实时路况 猛戳网页链接津塘公路立交桥实时路况 猛戳网页链接中心路地道实时路况 猛戳网页链接二大街与黄海路交口实时路况 猛戳网页链接二大街与南海路交口实时路	未
周一，总是要想办法战胜上班前的小不愿，和琳琅满目的雾霾。@今天又被赵立新圈粉了吗	未
周一早你的城市下雪了吗一起来评论里晒出你拍的雪景美图吧	未
周一早安	未
周一秒杀总有一款是你想要的！	未
周一起床，拥抱太阳，满满的正能量	未
周一过得咋样关注转发，抽10位粉丝各送1G全国流量！	未
周一阳光继续，晨起有大雾	未
周三买家汇粉体圈采购需求信息分享（119）	未
周三回家路上请看实时直播滨海微服务 天津滨海新区实时路况：新华路立交桥实时路况 猛戳网页链接新港路实时路况 猛戳网页链接海河开启桥实时路况 猛戳网页链接中央大道与新港三号路交口实时路况 猛戳网页链接海门大桥 ...全文	未
周三我在重庆问候你们早安！你们在哪里	未
周三招聘11.28：惠安最火的招聘岗位都在这里啦！速看	未
周三招聘12.5：惠安最火的招聘岗位都在这里啦！速看	未
周中市场分析键盘市场已变天，机械键盘已称霸	未
周丽云灵魂的家园档案	未
周丽淇嫁内地演员傅浤鸣 旧爱郑嘉颖送祝福	未
周二上班不迟到，出门之前看路况滨海微服务 天津滨海新区实时路况：新华路立交桥实时路况 猛戳网页链接新港路实时路况 猛戳网页链接海河开启桥实时路况 猛戳网页链接中央大道与新港三号路交口实时路况 猛戳网页链接海门大桥实时路况 猛戳网页链接上海道与和平路交口实时路况 猛戳网页链接上海道实时路况 猛戳网页链接大连道实时路况 猛戳网页链接津塘公路立交桥实时路况 猛戳网页链接中心路地道实时路况 猛戳网页链接二大街与黄海路交口实时路况 猛戳网页链接二大街与南海路交	未
