大家对道系金属贴太热情了，忙不过来，我被徒弟拉来做包装了，努力工作中 铜镀金道系手机贴纸金属贴文创笔记本冰箱贴手账周边太岁平安转运	未
大家就一起围观下吧	未
大家带上话题当代网友的夸人方式去发微博！！参与话题讨论！谢谢你们！	未
大家帮一下菜头	未
大家帮帮吧 //@竹Same:妹子周年的时候把自己的票赠给自家蟹了。愿这份善良可以传递下去，尽了一点绵薄之力，祝愿早日康复 查看图片	未
大家帮忙互动互动，转发，观看之类的微博正文	未
大家帮忙点赞评论也辛苦啦	未
大家平时打手游会看重画质吗还是优先流畅性。	未
大家应该都感受到阳光的温暖了吧，除了光明沙井坪山的同学们大家再撑过今晚和明早，预计寒冷黄色预警明天白天就取消了	未
大家快来动动手参加啦	未
大家快来参与！新浪20年	未
大家快来扫码领大红包，我接连三天扫，都是20元以上！对了，转发我这条微博！可以抽锦鲤10000元现金！	未
大家想要哪个英雄的什么样圣诞皮肤呢王者荣耀	未
大家手机里会不会保存漂亮女孩的照片啊	未
大家手笔：从三个维度观察史学未来发展趋向	未
大家手笔：以科学态度和正确立场推进改革开放	未
大家手笔：以系统思维推进全面依法治国	未
大家手笔:夯实智慧社会的基石	未
大家手笔：夯实智慧社会的基石	未
大家手笔：建设高素质专业化干部队伍	未
大家手笔：把握新机遇  改革再出发	未
大家手笔：更加注重区域发展的均衡性	未
大家扩散一下//@人人爱重庆:人人爱帮忙谁家的狗儿走丢了	未
大家拼拼呢 一杯奶茶的钱就可以拼到3/4杯呢 便宜又划算哦 而且冰的热的都炒鸡好喝	未
大家收很多圣诞礼物	未
大家数据看见就要顺手做哦	未
大家早上好，消息面美国股市爆涨，唯一的利空影响已经消除，盘面上看各大指数底部区域磨底走势，结合消息面今天会出现普涨行情，这个位置坚定持有不会错	未
大家早上好，盘面上看各大指数弱势大跌，是震荡洗盘走势，今天会阳包阴，耐心持有等待爆发，具体操作盘中观察	未
大家早上好鸭周一啦！上班啦！	未
大家早上好鸭终于出太阳了今天！	未
大家早呀昨天的德杯终于一解这么久以来的比赛荒啦，看到熟悉的选手们在赛场上奋战是不是格外让人激动捏昨天的比赛中，iG，RW，TOP，RNG作为首轮胜者挺入第二日的比赛，SDG与JDG则在败者组BO3中分别败给SN与EDG，将告别本次德杯舞台。今天有德玛西亚杯第二日的比赛哟来预测(奶)一波今日赛果吧！2018德玛西亚杯西安站	未
大家早安。[米奇比心]	未
大家早早上点三炮，股票能大赚！	未
大家早早起看NBA圣诞大战NBA	未
大家早！期待已久的总决赛就在明天了，大家激动吗（用加儿最后一根头发发誓，本条微博图文无关）KPL 王者荣耀	未
大家旺！//@Matt旺家:有心用心道德心不忘初心我们持续努力	未
大家明年的目标是什么呀。	未
大家是不是没看到转 发里送一套dyson现在最火的空气卷发棒哈，已经买好了的。 查看图片	未
大家晚上好（吃饱等女儿回家 微博视频	未
大家晚上好。。。 寒冬将至。。。为你读诗。。。 愿此刻我们的心能靠的近一些。。。	未
大家晚上好！那个手游节的活动今天结束，记得把那些积分都用了！！主页君为了发个图！强行找话题也是不容易！	未
大家有听过这个牌子吗销量很好的样子，为啥火的	未
大家有想到目前为止我们小破湖战绩比绿凯好吗 GoLakers	未
大家有没有和男票/女票/朋友，温暖有爱的小故事，分享一下啦评论揪 10位送温暖小红包，明天就开另外， 置顶微博 10套少女心 今晚11:30就开啦  12.17	未
大家有没有类似情况的，有什么好的建议吗	未
大家期待已久的正式岗位招聘欢迎转发传播	未
大家来PK中国共产党支部工作条例（试行）知识自测	未
大家来看一看机器人前几天的日本神户观赛之旅官方纪录短片哈《K球神户行全程回顾超美主持激情尬舞，美食与足球不可或缺》[米奇比心][米奇比心]里面有波多尔斯基 伊涅斯塔 比利亚还有神户牛肉哦[给你小心心][给你小心心]2018日本J联赛 国际足球	未
大家来稳稳//@来强哥快点配合:从垫底到第一，小蟹酷酷嗷//@凯撒蓝护卫队 :宝贝们很棒 稳住前排 再来300加固[加油]	未
大家来给评评理吧	未
大家来说说自己家乡的优点 报个坐标 网络一线 牵珍惜这段缘 万一呢 全国各地的优点	未
大家注意保暖！注意出行安全！	未
大家注意啦。	未
大家注意啦今天晚上8:30-9:30为金沙中国有限公司旗下酒店及度假区「地球一小时x12」活动，澳门威尼斯人的外墙与非主要的室外照明将关掉一小时， 借此提高全球对气候变化的关注。	未
大家注意啦，又可以领红包了打开首页搜索611319148或者用扫描二维码，最高得99！3天有效期，一定要在3天内用掉，别浪费了啊！超市购物，午餐晚餐都可以用的。	未
大家注意啦，现场审核学历证书和身份证都要原件！宝宝们准备好再来现场审核哟！东奥2019初级备考 现场审核更有小奥空降！大家快来抱小奥啦 我们还有东奥通关宝典送给相赠哟（北京丰台）	未
@大家浙GV1K61浙GL679L等车上榜了，快看看有没有你认识的	未
大家点个赞吧，我年纪还小，还太敏感，没法抛弃博得别人好感赢得人家青睐的愿望。//@chaling8:这是我最喜欢的博主之一	未
大家点赞和评论都搞一搞呢 给小帅哥做做数据叭	未
大家的建议小布都看到了，非常非常感谢大家！先送10位小伙伴@lenovo协腾 @大卫丶不可以 @曹轶晨2013 @大中东吐槽君 @潇洒君-666 @AdolescentChat @璐米Miranda @leader王 @水花花 @more努力more幸福 每人电影票两张，联系方式看私信！没中的小伙伴也别急，周五下午我们再来抽15个！	未
大家知道在中国大陆需要通过什么app收看葡超了吗征服你梦想	未
大家红包领起来，用起来	未
大家能够皈依，绝对不是今生偶尔冲动，想要皈依求法那么简单，而是你们千千万万世一直累积下来的福报成熟在今生，依靠在人世间的身体，去脱离轮回，成就佛陀的果位。要成佛，靠这个身体要堕落三恶趣，在轮回中继续漂泊受苦受难，也靠这个身体。大家要珍惜自己的人生，紧跟具德上师系统闻思修佛法，为究竟解脱成佛踏实前行，让此生有因缘福报，为了脱离轮回而精进奋斗，命运正掌握在自己手中！嘎玛仁波切	未
大家自己提高警惕！	未
大家自行脑补英文对白吧//@这里是日本:哇！想看现场版！	未
大家行行好 去扫我红包 希望你出二十块	未
大家觉得拉卡泽特与奥巴梅扬这赛季双剑合璧的效果如何	未
大家记得@一只看脸羊，这么多礼物任你选	未
大家记得转关原po哦加码你的年终奖，天气很冷，给你们送一份冬日温暖你拍TVG了么	未
大家记得领取呀。有人领到好几十块钱呢！	未
大家评论里捞捞我！谢谢大家！	未
大家说画 | 跨越时空，走近省美术馆“大桥记忆”	未
大家请看，这是我们公司最新产品，采用隐形钢丝绳的起重机	未
大家赶紧兑换积分！！1月份起清零！！	未
//@大家车言论:今日最佳	未
大家转起来哦	未
大家还记得我之前推荐过的那个快捷安检吗 我发现了个好东西 就是会员里面可以用积分换快捷登机 不用钱 只要换了以后 可以帮你办好值机头等舱安检做小车车去登机口！我觉得好划算好方便哦！真的很不喜欢排队安检！！	未
大家还记得我们在11月20日发起的这个冬天不太冷 -- 捐冬衣，献爱心活动吗感谢你们积极参与和热情支持。工作人员将大家的爱心捐赠进行了收集打包整理。今天我们带着你们的爱心，正在去往安徽省灵璧县冯庙镇王刘村的路上...精准扶贫暖冬行动农网助农 宿州  虞姬乡	未
大家还记得曾经的奥运冠军吴敏霞吗选择在2016年正式退役的她，选择了张效诚，选择了嫁给爱情！如今这对姐弟恋也修成了正果，即将迎来属于他们的爱情结晶！祝福晋升为妈妈的吴敏霞，也希望这一家人一直幸福下去！	未
大家选好了么等我逛完街就开！	未
大家都太可爱了！//@AKA-今年宗三出塑料小人了没:2333333//@23裆自强: 我死了//@咸鱼中的Yuu:哈哈哈//@坐在路边钓鲨鱼:哈哈哈哈哈哈哈哈哈哈哈哈哈哈哈哈哈哈哈//@紫米小仙:把书关起来，大家就当无事发生	未
大家都得穿着中铁的反光背心参加首架737MAX交付，空铁联运的行动纲要贯彻的很快啊 舟山朱家尖海鲜大排档	未
大家都来参加一下，100积分抽微博之夜门票 查看图片	未
大家都看了吗//@清南地理: 好有意思	未
大家都说白色的，我觉得第四件//@我的奶子最大：哪一件更适合去参加正式点的场合	未
大家随意！ 希望工程一对一助学	未
大容量旅行包16.8出门旅游的时候都能用到，容量也是挺大可以装好多东西	未
大宿迁20年前的宿迁繁华， 您可有印象了	未
大寺镇妇联开展家教家风宣传活动西青在行动各基层妇联通过开展家风宣讲会入户宣传及室外宣传等方式向群众发放《致全镇广大家庭的一封信》及创文宣传材料，号召广大家庭弘扬中华民族优秀传统文化，传承良好家风家训，以家庭的文明和谐促进社会的文明进步。	未
大导演昆汀结婚 梦幻婚礼娶小20岁以色列女模	未
大小姐衣橱 红色工厂终于来到深圳啦	未
大小姐驾到！腾讯首款王者荣耀女性角色智能机器人孙尚香，12.12首发！即日起登录腾讯机器人京东自营旗舰店预约，享双十二优惠价998元！12.6-12.12期间，关注@王者荣耀智能机器人并转发官微孙尚香首发微博，有机会在12月13日获赠孙尚香标准版套装一台！王者荣耀腾讯智能英雄	未
//@大小孩chris:今天12点就截止了 ！没投的抓紧投一下！还有公众号的别忘了！！！！	未
大尾翼超级无敌 汽车V峰会	未
大局已定！2019年重庆要爆发了，重庆人的身价即将暴涨！	未
大局已定！今天起，常熟这个镇的人身价要暴涨了	未
大局已定，今天起，镇原农村户口的将身价暴涨！	未
大局已定！合肥这个区即将全面开挂，身价暴涨！	未
大局已定巫山机场即将正式通航巫山迈入水陆空立体交通新时代	未
大局已定！覃塘区将迎来巨变...	未
大屯乡3000亩椪柑成熟了，等你来采摘	未
大屯打造首家公共法律服务站，给你专业的法律服务	未
大山中必然隐居着仙人，群山环抱之中	未
大山包保护区救治一只国家二级重点保护鸟类！	未
大山包洋芋走上品牌化发展道路，名字就叫大阳窝！	未
大山带你看世界 极峰双子座流星雨浩瀚星空和你的枕头之间，只隔着梦想的距离，那是一个用勤奋与汗水浇灌出的梦来许个愿吧（摄影/@崆山大叔）	未
大山带你看世界这个冬天，想去北海道看漫天飞雪，搭雪国列车（via@知书少年 ）	未
大山带你看世界风韵犹存 清雅雍容中国的筷子（图来源：@故宫博物院）	未
大山阻拦不了我们的 心愿	未
大嵊州40年间的交通大变化！图片见证！	未
大川告诉你2019考研倒计时！请为自己为考研的战友转发加油孤独疲劳彷徨备考的你是否有一瞬想过放弃可努力了那么久怎能在最后一刻退缩请为梦想再坚持一下！4个关键时间点8个冲刺建议，转发为所有考研人加油！（转自@英语老师justin ，via人民日报）	未
大川觉得震感强烈，你们呢愿平安啊！	未
大工程	未
大工程啊！	未
大巴黎2018年最后一次主场比赛！法甲第19轮北京时间12月23日凌晨4:00大巴黎南特我们能否在王子公园球场，用胜利告别这辉煌的一年这里是巴黎	未
大巴黎无悬念领跑，姆巴佩笑傲射手榜。我的看球新主场	未
“大巴黎”法国杯卫冕首战第五级别联赛球队	未
大巴黎的90后生力军们！这里是巴黎	未
《大帅哥》开播 张卫健重回小荧幕演绎励志故事	未
@大帅哥蟑螂爱上上好佳：虾哥真是一直在指引我们通往春暖花开的路上啊！回复：对啊，三年前把咱们军团带出苦难的青蛙岁月，到这里了争取看下能不能把咱们军团成员带上通往未来个个都是百万千万亿万的成功人士之路！真做到了，虾哥退休后不再上来了，整个网上都会流传虾哥的传说！哈哈	未
大师：敏感的人才能拍出好照片	未
大师见面会！kavadlo兄弟上海公益讲座欢迎你	未
大师详解季前赛改动，S9上钻，你准备好了吗（机制篇）	未
大师课堂如何练习双头速度球上篇	未
大师课堂如何练习双头速度球下篇	未
大师逝去，记忆永存	未
大帝2711西蒙斯准三双 76人主场126-101胜猛龙76人队大帝27分11篮板，西蒙斯26分12篮板8助攻，雷迪克22分，科克马兹16分，巴特勒12分7篮板7助攻3抢断，博尔登4分4封盖猛龙队小卡瓦兰伊巴卡皆休战，西亚卡姆26分，洛瑞20分5助攻，鲍威尔13分，范弗里特12分。网页链接	未
大帝-恩比德在常规赛前30场比赛中得到800分400篮板，此前可以做到这一点的分别是大鲨鱼奥尼尔（1999-2000赛季）摩西马龙（1980-82连续两个赛季）和天勾贾巴尔（1976-77赛季）	未
大幅降温直逼零下！冬天避寒去哪儿正确答案在这里	未
大干100天冲刺打击篇平东派出所民警苦苦蹲守12小时，终于等到了最佳抓捕机会	未
大干120天丨当好服务企业店小二！全力以赴促使签约项目落地开工	未
大干120天丨竹屿湾生态整治与修复项目完成85，预计明年4月前完成竣工验收	未
大干120天丨进京旅游推介！平潭与多家企业签订战略协议，涵盖游轮旅游低空飞行	未
大干120天 再添两条路！澳前西路渔港段开放通行，另一条是	未
大干120天  冲刺阶段！坚决打赢城乡人居环境整治攻坚战！	未
大干120天  平潭新增60座公交车候车亭，有你家附近的吗	未
大干120天  攻坚干劲足！征迁干部：趁周末大家休息，可以和大家谈谈心	未
大干120天  积水自我消化！平潭这条背街小巷改造引入台湾工艺	未
大干120天  第一个完成！征迁任务清零！金井湾片区共完成土地征收209.753亩	未
大干120天  预计与京台高速同步通车！坛西大道辅道K7至K9段下个月底完成！	未
大干120天  鸣凤山公园新进展！彩石迷宫闽越唐宋主题石浮雕	未
大干一百天，共创洁美家园	未
大干啦！投资60亿的世界级项目新建一湿地公园！乐山这个地方火了！	未
大年初一！	未
大年初一《日不落酒店》上映  主演爆笑拜年	未
大年初一《日不落酒店》沈腾特别出演外太空来客	未
大广西周一，周二是区定假期（广西壮族自治区成立60周年庆）！	未
大庄镇举办巾帼创业就业工作观摩会	未
大庆成为英语普思考试中国首个示范城	未
大庆新村一越野车真实上演燃烧我的卡路里！	未
大庆有车的赶紧看！交警又出新装备了	未
大庆消防践行“四零”承诺召开消防技术服务推进会	未
大庆社会各界深入学习宣传贯彻党的十九大精神	未
大度霍尔丁谈拉什福德：拉什福德已联系了我，我们很幸运能在老特拉福德球场相互对抗。而受伤只是足球的一部分。我收到了很多人的关爱，我的目标是以更好的状态回归球场。	未
大康农业增资子公司大康食品  每年固定收益增至3800万元	未
大庸桥南庄坪永定老城区停水通知/老木峪定向钻穿越管道回拖工程启动	未
“大开放时代的中国乳业机遇与挑战”课题会议举行	未
大开眼界，1.83秒注塑成型，全球最快！	未
《大开通》汉中交通文旅纪事：川陕公路修筑由来	未
《大开通》汉中交通文旅纪事：百年历经沧桑	未
《大开通》汉中交通文旅纪事：石门石刻保护前后	未
《大开通》汉中交通文旅纪事：西北联大迁汉始末（翻越秦岭）	未
《大开通》汉中交通文旅纪事：西北联大迁汉始末（西迁由来）	未
大张伟放飞自我，即使黑点再多，也依然盖不住其才华	未
大强度腹肌训练想要完美的腹肌和人鱼线，不仅腹部要没有赘肉，还要有强有力的腹肌线条。下面是一套大强度腹肌轰炸动作，每个动作12-15次，共2组。为完美腹肌，虐起来！get	未
大强都快成妇女专家了！	未
大徐去南京参赛啦，还拿了全国二等奖！	未
大快人心！	未
大快人心！乘客因抢夺公交车方向盘获刑3年！网友：干得漂亮，一次判决顶一百次说教！	未
大快人心！终于抓住了！去cp23的妹子们可以放心点了！//@Akira于爷:舒适//@这是一个很高冷的ID ://@Tiger公子 ://@颜文字君 :引起舒适(  」)//@罗蕾莱lorelei :扩散//@猛汉百科的QB君-秽土转生 :首页哪位被咸猪手骚扰过的受害者帮忙看原po的评论去警察局作个证	未
大快题模考评图07  西建大16年初试  革命纪念馆	未
大思路引领大发展，大手笔构建大格局！温县社会治理网格化1N管理模式解读	未
大悟五岳山景点介绍 大悟五岳山一日游攻略	未
大悟县人民医院与武大中南医院消化内科建立深度专科联盟    上海澳华有限公司向人民医院捐赠全套内镜系统设备	未
大悟泉水寨有什么好玩大悟泉水寨森林公园游玩攻略	未
大悟脱贫之路：油茶基地养出生态脱贫鸡	未
//@大懒糖:喜欢//@不正经的日语卡片:冬天来小樽看雪//@日本自由行:冬天的小樽//@带小老公游世界in日本:冬天的小樽，有点阴郁的冷色调	未
大懒糖带你看日本日本红叶季 骑车来看红叶了，祝看到的你红红火火！！ 日本本土寺	未
大懒糖带你看日本 的药妆店Discount DrugStore难波三丁目店新店开张了，这家店最大的特点就是便宜。老板也是老实人，价格已经很低了还能打折，最高减15（免税折扣）。可用支付宝，微信，银联支付，还有中文对应店员，对中国游客是相当贴心了。地点在难波站出站步行两分钟，十分方便。官微还会发放优惠劵，各位可以关注一下@科摩思cosmos 。Ps：商品价格是会变动的，不一定和我当时拍的一样哦	未
大成基金首席经济学家：科创板注册制是创新型国家发动机	未
大战100天 交警保安全为了您平安出行我们永远在路上！	未
大战100天 交警保安全勠力同心 持续保畅	未
大战100天 奋战保平安！-----兰州新区全警动员全力以赴！	未
大战100天玉门高速交警两天拘留四人	未
大战100天 畅通保平安（五）尘诚	未
大战一触即发！！！！！！- //@澳大利亚酋长: Winter is here//@ootwdoria:哇啊啊啊啊啊 //@我乃原生木：啊啊啊啊等不及了	未
大战在即，主教练斯帕莱蒂出席对阵尤文图斯赛前新闻发布会：球队在不断进步，这也给了我更多的自信。双方积分榜上的确存在一定距离，而明天的比赛正是缩小差距的关键机会。我们需要打出自己的特点。达尔伯特和纳因格兰依旧无法出场，他们的伤情有所好转，但都有待进一步观察。无论何时，球迷以及团队的力量都将伴随我们不断前进。ForzaInter JuventusInter	未
大战黄金三年应城市实施以鱼养水战略 修复东西汊湖生态环境	未
大手小手一起搭，“郑和宝船”起航啦	未
大手拉小手  扶贫攻坚，共青团在行动	未
大手笔！义乌一条公路列入省重点建设项目！还有一条通车可期	未
大手笔！南充高铁商务区清泉寺文化小镇城北中央森林公园等有新进展咯！	未
大手笔 大气魄 大格局！乌海擂响战鼓再出发	未
大手笔！小李火车站确定并启动设计！！郑州确定四主多辅铁路格局！	未
大手笔攸县投资逾3亿元兴修水利 预计明年初完工	未
大手笔！毕节投入50多亿元，只为70万居民能喝上一口好水！	未
大手笔！磐安2个项目正式开工，惠及玉山镇岭口新艳等多个村	未
大手笔！荒林养殖场变身公园，永顺镇新增两处城市绿肺	未
大手笔襄阳文化旅游又添一景点，地点就在	未
大批地铁安检人员空中乘务员招聘，工资待遇优，速来看看！	未
大批用户围攻ofo北京总部 现场退押金太壮观了位于北京中关村互联网金融中心的ofo总部，退押金的已经从公司五层一直排到了一层的大楼外，好多都是老头老太太帮着孩子来退押金的！尽管设置了排队指引，但由于前来退款的用户数量很多，队伍已经排到了附近商场门口大厦还为此专门采取特殊措施，其中 ...全文	未
大抵知心有庭树，亭亭一如你风致。	未
大抵知心有庭树，亭亭一如你风致	未
大拇指pose也分很多种的，有右手比赞，左右比赞，高举比赞，还有低着比赞，大家仔细观察区分就行了。	未
大排查 大整治交通安全整治不停歇	未
大提示降温啦！这份安全出行提醒请您收好（第4期）	未
大提速！明年万州到重庆又要多一条高铁！快来看看！	未
大改造！合肥这个区域迎来大变化！涉及红星路老四中光明新村	未
大改造！大升级！连州未来将发生翻天覆地的变化！	未
大改造！燕郊镇46户建档立卡贫困户有福了！	未
大放水！！！十几元几十元很常见 最大99搜 索数字5092399 一 共 有 两 个 红 苞 看 看 你 能 领 多 少	未
大数据AB面： 为什么信贷领域的 “纯数据驱动”值得警惕？	未
大数据今日魔都最火新闻Top5！喜茶喝出套套，静安监管局介入调查	未
大数据图解五批中国传统村落，黔东南和歙县各列市、县级第一	未
大数据时代人人裸奔，我TM相信了！刚才上车和师傅说了一句我去欧亚新生活，然后打开大众点评就这样了，智能到我不敢说话	未
大数据曝光！安徽游客最喜欢去哪个城市旅游	未
大数据有话说丨创新创业教育如何改进，大学生们这么说	未
大数据环境下，高校档案服务如何创新	未
大数据看2018乡村民宿：订单是去年3倍多！这些地方最发达！	未
大数据看民营经济健康发展大会（二）：111条国际航线带你逛全球！	未
大数据管理为幼儿健康成长保驾护航！12月12日下午，我区托幼机构卫生保健大数据管理新模式总结会在桥西区妇幼保健站隆重举行。主要内容是加快幼儿个体健康数据实时传递，提升家长端绑定率。会议的召开，标志着我区托幼机构卫生保健大数据管理新模式正式构建成功。新模式一改往日卫生保健工作管理松散，信息不对称的现状，将托幼机构卫生保健工作纳入我区儿童保健网格化管理体系，通过大数据管理做到信息共享， 程序得到简化，信息更加畅通，提高了工作效率，节约卫生资源，提高托幼机构卫生保健人员的专业水平，提升托幼机构应对突发	未
大数据解读：数据"见证"新一代火箭海南文昌首飞	未
大整治开展百日行动  确保长久安全	未
大整治 德保交巡警开展交通秩序大整治，打造德保县和谐文明交通环境！	未
大斧头飞过来啦！	未
大新县硕龙镇：打造边贸旺镇和旅游名镇两张名片	未
大新治贫兴旅有机联动	未
大方到毕节这条高速公路12月28日通车，5个收费站！大方金海湖七星关区同城化更加紧密	未
大方县公路管理段开展《公路养护安全作业规程》技能竞赛活动	未
大方县召开禁毒工作推进会暨禁毒工作业务专题培训	未
大方县奢香古镇社区：文化服务带动扶贫的易地搬迁新型社区	未
大方县安全生产工作专题调度电视电话会召开	未
大方县对江镇对江村群众勤劳致富奔小康	未
大方县巩固创建国家公共文化服务体系示范工作推进会召开	未
大方县文明交通劝导活动热度不减	未
《大方县烟草制品零售网点合理布局规定（草案）》听证会召开	未
大方县达溪镇加快农村综合环境整治河道治理工程建设，助力脱贫攻坚	未
大方县非洲猪瘟防控工作电视电话会召开	未
大方县马场镇：群众齐参与，修好致富路	未
大方福乐多超市3周年店庆，加25元抢购食用油一桶，送醋一瓶！	未
大族激光新车别克中国新能源家族新添2款车型	未
大日子来了！一起看2019环球时报年会2019环球时报年会马上就要开始了！本次年会主题《中美博弈与世界变局》，此时此刻，年会现场正虚位以待！	未
