千呼万唤孙杨首秀自评:有点紧2018年游泳短池世锦赛 杭州小莲花游泳馆今天的气氛到达了顶峰，在上午的比赛中，孙杨在男子4200米自由泳接力预赛中登场，并携手队友以总成绩第四挺进晚上的决赛。在赛后，因为要先去热身池放松，所以中国队的四位小伙子并没有在采访区驻足，孙杨也只回应了反超是什么感觉这个问题，他如是说：早晨第一枪有点紧，放松一下，晚上争取游好一点。千呼万唤孙杨首秀自评:有点紧 力争晚上游好点 网易体育 @网易新闻客户端	未
千夜拉丁舞12.8周六新开伦巴恰恰零基础（附视频）	未
千夜舞蹈12.816周日周日新开伦巴恰恰软开芭蕾及桑巴牛仔零基础（附视频）	未
千姿百态虎照-难得一见	未
千家公益真的好棒[给你小心心][给你小心心]//@XXXX是嗲精:我们的阅读角诶@钻石少女心1128跟着易烊千玺益起来	未
//@千家无名氏:团结就是力量！千纸鹤不认输	未
//@千家无名氏:跟着易烊千玺益起来 易烊千玺 从凌晨的街道起，从城市的角度蔓延开来。践行公益，传递偶像力量。为公益助力，为环境发声。@TFBOYS-易烊千玺 舒适圈 Dont Tie Me Down-TFBOYS-易烊千玺 亲爱的，这里没有一个人	未
//@千家无名氏:跟着易烊千玺益起来 易烊千玺划破冬日里的阴霾，践行公益最本真的爱意。陪你一起过冬天，关注环卫工人，传递善行善举。@TFBOYS-易烊千玺 Dont Tie Me Down-TFBOYS-易烊千玺亲爱的，这里没有一个人舒适圈	未
千家景点免费玩，全国全省都能用！	未
千岛湖上各式各样的桥美呆了区县连线有山必有水，有水必有桥，小桥流水人家。在千岛湖，有着数不尽的山川河流，同时也有着各式各样的桥，有简易的石蹋步桥，有古朴典雅的独木桥有沉稳厚重的石拱桥有巧夺天工的木拱廊桥，有气势宏伟的钢筋水泥大桥，还有铁索桥	未
千岛湖已经美成了这样，你还坐得住吗如画杭州时下，初冬暮秋的千岛湖美得如童话世界一般。银杏枫叶芦苇梧桐一步秋景，步步为美，国际花园城市的颜值惊艳了世人。	未
千岭童真幼教举办119大型亲子消防运动会！	未
千年古城东阿再现取水炼胶仪式 传统非遗文化长流不息	未
千年古城京都，在雪中幻化成人间仙境！不止旅行 V影响力峰会	未
千年古村小众秘境温州这座小城的秋天美极了！	未
千年古村焕新颜，是你条村么	未
千年古村落，相约黄河情，真相团队作品展示	未
“千年古都”邯郸：全民治霾盼重回碧水蓝天	未
千年古镇的变与不变	未
千年古镇迎来全国知名媒体大咖  黄平旧州再度成为焦点！	未
千年宜春迎新面孔巨匠华地，为宜春而来！	未
千年山歌在变迁中焕生机	未
千年未有之变局：茶界的产业互联网革命运动	未
千年湖乡 灵秀汉川 游览中部西湖 武汉后花园天屿湖@湖北日报 的一直播（下载App-gt网页链接）	未
千年秘方中药科技大品种医保独家，中风和疼痛双领域十亿级品种	未
千年“花灯”挑亮百年“喜气”——长江上游川黔边地一个脱贫村见闻	未
千年荔城 灵马奔腾2018灵山国际半程马拉松赛道急救志愿者集结令	未
千斤顶上装一个架子，还能这样用，真是脑洞大开啊！	未
千树万树霜花开！中国北疆白雪红果交相辉映近日，随着气温一路走低，中国北疆开启了冰封模式黑龙江省绥芬河畔的树木都披上了一层洁白无瑕的霜衣，银装素裹的北疆雪花飞舞，火红的果实迎着风雪挂在枝头，红果白雪交相辉映，给中国北疆增添了一抹别具韵味的美景阳光下，银光闪烁的霜花美 ...全文	未
千灯镇强势推进校外培训机构整治工作，让童年不与培训班划等号	未
千百味  全城征集2011年毕业和结婚的广丰人	未
千真万雀 和阿雀一起迈过坎吧早安	未
千真万雀 早安周末打算去哪里玩鸭	未
千等万等！小新柑终于要开园采摘啦！这个周未带上你的小伙伴快来免费品尝吧！	未
千纸鹤们真的厉害，今年易烊千玺生日粉丝做了400万精准扶贫公益，千玺林希望小学医院医疗车助学。。。。	未
千股桑你好（12.26攒饭票1赞1转3评论）	未
千言万语都是舍不得，好兄弟，球场见。 TheBrotherhood	未
千车竞艳洛杉矶车展	未
千辛万苦得2分，掘金轻轻松松补篮2分。。。	未
千里冰封，万里雪飘！也许真的只有在严冬来到最北方，才会体会这份浩瀚的壮丽的雪景。这里是阿尔山最冷的地方，也是整个世界雾凇持续时间最长的地方，走进这片以桦树为主的林场，它的树干承托着密密匝匝伸向天际玲珑的雪条，这就是所谓的玉树琼花吧。 .	未
千里好风随野色，别有逍遥地上仙	未
千里送比萨关爱暖人心。家住印第安纳波利斯的临终病人摩根对家乡的比萨饼情有独钟念念不忘。位于密歇根州的一家比萨店员谢弗得知后，开车来回七百多公里（相当于上海到南京的路程），深夜将可口的比萨饼送到摩根家，令摩根全家感动不已。网页链接 千里送比萨关爱暖人心	未
千金不换的腌菜秘方！这样做居然比肉还好吃！赶紧收藏	未
千锤百炼铸精钢——南钢参与建设国家重点工程纪实	未
千阳便民信息237期更新了，上来关注服务号，发布更方便！	未
千阳便民信息238期更新了，上来关注服务号，发布更方便！	未
千阳便民信息240期更新了，上来关注服务号，发布更方便！	未
千阳便民信息241期更新了，上来关注服务号，发布更方便！	未
千阳便民信息242期更新了，上来关注服务号，发布更方便！	未
千阳便民信息245期更新了，上来关注服务号，发布更方便！	未
升房型升儿童餐 独家升升升6，000多平室内外温泉区万豪暖冬礼遇 双早温泉票1，133起	未
升温降温！开车上高速的小伙伴们小心团雾出没！	未
升级之后大包多了，现在领了吃饭用	未
升级你的电视音效 从Denon DHT-S316回音壁开始	未
升级农村电网暖民心12月18日，@国网威海市文登区供电公司 员工对界石镇旸哩店子村实施电网升级改造工程，为村民们安装一台100千伏安变压器一台，新立电杆16基，敷设架空绝缘导线2300米。升级改造后，提升了农村电网供电能力，保证农村居民冬天安全可靠用电。	未
升级变电设备 护航地方发展11月26日，@国网海阳供电公司 检修人员在110千伏行村变电站进行10千伏开关柜升级改造工作，提升设备载流量，满足海阳西部高速发展需求。按照海阳市新旧动能转换项目分布，该变电站供电区域将发展新能源汽车等产业，工程的实施将为地方发展提供充足电力保障。	未
升级有人管的体检2.0   如何看爱康的健康管理生态链	未
升维蓄势行大道  第三届中国旅游上市公司峰会在都江堰召开	未
升降升降升降！下周，沈阳的天气很任性了！	未
午休时刻，Artifact启动！	未
午休时间好消息正在向你靠近	未
午后人民币涨幅扩大 在岸汇率最高至6.89	未
午后分享夜晚出行女生如何正确保护自己赶紧学习get这些新技能！	未
午后的塞维利亚被湛蓝的天空和城市的内河附上了一层蓝色的光，低矮的白色建筑在温柔的阳光照射下，看上去洁白无瑕，没有城市的工业感和现代化，温柔而宁静。日落时分的塞维利亚仿佛是遗落在一片混沌里的光芒。远处的日落仿佛只停留在了那一片土地之上，照的彼岸遗世独立光芒万丈。夜晚的塞维利亚亮起了城市的灯光，桥上的白光像一排珍珠，连接着两岸的由近及远的灯光。塞尔维亚也渐渐在夜晚中睡去。fanfan带你去旅行旅行灵感季塞维利亚旅行	未
午夜烛台邓丽君给我们留下的时光--李木生	未
午夜表情  小雪时节，去泰国过夏天。	未
午夜话题还不睡的小夜猫子们都在吃啥呀（欢迎砸图来馋馋本小编）	未
午市盘点丨两市股指放量反弹，沪指站上60日线	未
午市盘点丨金融股午前拉升，沪指上攻2600点	未
午市盘点｜沪深股指低开震荡，钢铁板块逆势走强	未
午报最帅男球员：紫薇力压迪米洛美人居首卡洛斯：希望帮彭帅变得更强	未
午报纳达尔携家人享受巴拿马假期法国队集体抵制新戴杯	未
午报：终于！日本挖的88米巨坑，中国人砸20亿填平了，还成了世界奇迹！	未
午报：美国会新报告鼓吹扩充军备应对中俄两国	未
午盘后，仿制药在乐普医疗恒瑞医药为首的基金重仓股带领下集体跳水这其实也是在年末行情中经常出现的，表面看似乎是一些传闻或消息因素，背后也是各类基金利益群体之间的相互博弈包括2014年排名战那一幕，风格大幅切换，导致各类基金净值的波动，这种现象最值得股民重视其中门道。	未
午评：两市集体窄幅震荡 强势股出现熄火迹象	未
午评：两市高开低走，沪指重返2500点，三大股指集体收红， 采掘服务板块领涨两市早盘高开低走，前期强势股杀跌，指数单边下行。截止中午收盘，沪指涨0.5，深成指涨0.6，创指涨0.5。板块方面，可燃冰采掘服务油品改革证券5G等板块涨幅居前，机场航运创投黄金等板块跌幅居前。	未
午评也不评了，点赞不给力！	未
午评：创业板翻绿跌0.05% 汽车零部件板块走强	未
午评：沪指低位徘徊震荡，创投概念带动做多气氛	未
午评：沪指弱势震荡跌0.57% 环保板块逆势上涨	未
午评：沪指放量大涨2.9%，北上资金净流入95亿元	未
午评：沪指放量高开高走涨1.60% 大基建板块爆发	未
午间一乐2018年度网友搞笑合集，正在吃饭的网友要慎看哦，免得笑喷	未
午间互动 平时你都是怎么报手机号码的留言区看看有没有人跟你一样	未
午间分享齐达内围观中国大妈打麻将齐达内 @Zidane 围观中国大妈打麻将，网友：玄学大师寻找来自东方的神秘力量，毫无违和感	未
午间吃饭喝个可乐听说可口可乐百事可乐合体（图2） 真是自古红蓝出cp啊	未
午间档成新流量洼地，排播意识强化成决胜关键	未
午间简评伴随着中央经济工作会议的出台，今天资金试图发起反弹攻势，方向主要包括两类一类是前期连续重挫的个股开启跌深反弹，仿制药板块表现活跃。若相关个股能够出现并确认强势反弹（收盘放量长红突破5MA或是近期大量高点），则意味着这波机构的下杀暂时告一段落另一类则是受工作会议直接刺激的科技股，以5G（通信设备）为主获得了短线资金的加持。 反弹主线清晰，但量能的部分仍显薄弱，初期价先引量可以接受，但在持续的上攻中量能需逐渐放大才行后续量能不足，这样的普涨结构就很难持续下去，操作上就切忌盲目追高了。若下	未
午餐吃了没，先来领个大包吧 533610485	未
午餐时间要到了，参考一下太子的营养餐单 1. 薯仔 2. 蔬菜 3. 鸡肉 你们中午吃了什么皇马世俱杯 皇马 halamadrid 微博视频	未
午餐饭票到，支 付 宝扫或者首页搜 索9688401 得大红包，最高188 ，每天可领一次	未
午饭时间到 大家扫扫 要花掉哦	未
午饭时间 自制豆腐脑不用磨豆浆，口感嫩滑，码住	未
半价！免费！今天起余姚人去这55个景区有大优惠，整整2个月！	未
半价！免费！周末起，宁波人去这55个景区有大优惠！象山影视城雪窦山普陀山整整2个月！	未
半价！免费！周末起，宁海人去这55个景区有大优惠！整整2个月！	未
半价！免费！宁波人去这55个景区有大优惠，整整2个月！	未
半价！免费！明起余姚人去这55个景区有大优惠，整整2个月！	未
半价！免费！明起宁波人去这55个景区有大优惠，整整2个月！	未
半价！免费！明起慈溪人去这55个景区有大优惠，整整2个月	未
半价就能买到《最忆是杭州》门票，期待不文化杭州12月16日，《最忆是杭州》将告别2018演出季，进入长达两个多月的休演期。12月14日-16日三天，凡市民朋友及观众，均可按门市价5折直接购买《最忆是杭州》门票（儿童票按照成人票门市价半价给予优惠）。抢票时间：12月12日9:00-12月16日19：30，购票方式	未
半价！整整一个月，常州16家景点统统半价啦！恐龙园淹城嬉戏谷都包含在内！	未
半价游黄山！杭黄铁路青盐铁路有望下月通车！	未
半场哈登18分7板4助卡佩拉17分6板保罗10分8助攻	未
半场：基米希阿拉巴破门 拜仁2:0领先汉诺威北京时间2018年12月15日22:30，德甲第15轮，拜仁客场挑战汉诺威。上半场基米希首开纪录，随后阿拉巴扩大比分，拜仁2-0领先汉诺威。详细战报请看网页链接	未
半场战报：里贝里破门 拜仁暂1-0领先法兰克福北京时间12月23日凌晨1点30分，拜仁慕尼黑迎来2018年度收官之战，德甲第17轮作客商业银行球场挑战法兰克福。上半场莱万助攻里贝里首开纪录，拜仁暂时1-0领先法兰克福。详细战报请看网页链接	未
半场战罢，我湖小55-58幅度落后。裤子拿到最高的16分2篮板，詹姆斯9分4篮板7助攻，哈特9分2篮板，球哥3分5篮板3助攻，麦基3分4篮板，钱德勒4分3板，KCP6分。保持专注，继续加油！詹韦最后一次对决2018最后20天詹韦最后一战	未
半场数据: 祖巴茨16分3个篮板2个盖帽库兹玛4个篮板3助攻英格拉姆8分2个篮板詹姆斯2分10篮板5助攻球哥分2个篮板2助攻2次抢断2次盖帽。	未
半场比赛结束，骑士62:46奇才TT汤普森19分11篮板，塞克斯顿17分5助攻	未
半场湖人69-65领先鹈鹕，湖人方面詹姆斯12分6篮板9助攻，祖巴茨12分，英格拉姆10分，隆多8分8助攻鹈鹕戴维斯17分11篮板，兰德尔16分。//@微博NBA: 正在直播NBA常规赛@新奥尔良鹈鹕vs @洛杉矶湖人 ！英格拉姆复出！安东尼-戴维斯率队客场挑战湖人，詹姆斯能否守护主场点击链接掌握比赛实时动态	未
半场结束丨曼城1-2水晶宫上半场比赛京多安打破僵局，随后水晶宫由施卢普追平比分，汤森轰出超级世界波将比分反超。半场结束，曼城1-2落后水晶宫。英超比赛日	未
半场结束，凭借着格雷罗的进球，多特蒙德客场1-0摩纳哥暂时领先！@多特蒙德足球俱乐部 足球，本应如此	未
半场结束，切尔西1-1平维迪奥顿，威廉任意球首开纪录，阿姆帕杜打进乌龙球	未
半场结束  埃弗顿 1-0 沃特福德理查利森面对旧主完成破门，太妃糖暂时一球领先英超比赛日	未
半场结束，巴萨3-0，总比分4-0领先莱昂内萨！	未
半场结束，广东53-48吉林。广东队易建联14分，德莱尼10分，威姆斯12分，周鹏5分，赵睿6分。吉林队琼斯16分，兰佩7分。	未
半场结束，快船主场71-56领先国王。亚历山大11分，哈里斯10分，加里纳利9分，哈雷尔替补出场15分4篮板2抢断2封盖，路威5分4助福克斯15分3助，希尔德9分，博格达诺维奇11分。	未
半场结束，我火57-56暂时领先，登哥16分3板6助，保罗13分4助，卡佩拉8分7板，恩尼斯5分2板，塔克3分2板，戈登9分，格林3分休斯顿火箭	未
半场结束，我火62-56暂时领先，登哥19分5板5助，保罗12分5助，卡佩拉7分6板，塔克6分3板，戈登4分，豪斯10分，内内4分4板！休斯顿火箭	未
半场结束，曼联1比1暂时战平阿森纳。非常激烈的半场。前15分钟曼联占据主动，开赛前5分钟曼联狂风暴雨。15-30分钟阿森纳开始进行回击。曼联	未
半场结束，曼联暂时客场3比1领先卡迪夫城。你的半场观感是_________体育V势力 曼联	未
半场结束！没想到吧，以为要结束了...进球就来了！依靠欧巴的进球，热刺暂时客场1比0领先！奶思！欧巴 查看图片	未
半场结束，湖人63:40领先灰熊！	未
半场结束，湖人65-50勇士！詹姆斯17分库兹玛8分一哥16分KD9分！//@NBA: 首节结束，湖人32-25勇士！詹姆斯8分 ，库兹玛6分杜兰特8分，库里4分！	未
半夜好饿呀看了一下上海这个点外卖还挺多的吃啥好呢	未
半夜睡不着在挑去泰国的战袍，看到这件，绝了，竟然可以解下来当一片大围巾，我爱疯辽	未
半夜风刮得叫人害怕。有一夜入冬的感觉。屋子像一条小船，浮在风的波涛里。夜晚的室内是温暖的，安全的，安安逸逸的躺着，像豆子躺在豆荚里。但似乎住在山间，外面有万壑惊雷般的松涛。实际是城市中心，四周高楼林立，风从无数大厦的间隙穿过，萦绕。四面八方只有风声，萧萧然，铁马冰河入梦来。	未
半小时交通圈！东进区域高快速路网体系规划方案亮相	未
半小时卖了70亿网传深圳一网红盘销售火爆，结果出事了	未
半小时后先开第一波，原博评论中开100个「10元现金红包」 今天佛系更博，大家随意刷刷就好啦	未
《半小时漫画中国史》作者陈磊：让自己喜欢的事变成终身职业	未
半山逸城38万平米二期项目盛大开工！	未
半岛影像初冬童趣近日，岛城进入了初冬，天气还没有特别寒冷，但景致却毫不逊色。初冬时节也成了不少家长带着孩子到户外活动的好时机。11月25日时值周日，温暖的阳光笼罩岛城，不少家长带着孩子到户外活动，中山公园八大关等地挤满了游客，李村河等地呈现出来的好景色也吸引了不少市民。来到户外活动，兴致最高的当属孩子们了，他们兴奋的情绪和充满童真的笑脸，也为岛城的冬季带来一抹温暖的阳光。（半岛记者 吴璟）	未
半岛影像燕儿岛之冬11月26日，燕儿岛山公园里风景优美，是市民观光休闲的好地方。让我们跟随记者的无人机，一起感受高空视角下的燕儿岛山公园的初冬美景（半岛记者 宋泓睿）	未
半岛影像红滩11月23日，胶州湾洋河大桥附近的洋河入海口处，生长在这里的成片碱蓬释放出了充满生机的红色，构成了初冬时节胶州湾一道特色景观。碱蓬是一种盐生植物，经常出现在一些含盐碱土壤的低洼滩涂湿地。（半岛记者 孟达）	未
半岛酒店的圣诞节日下午茶好阔爱哦，感觉置身胡桃夹子的世界（双人high tea吃完晚饭不用吃了	未
半年前为盐通高铁建设让路 半年后搬迁户喜提满意现房	未
半年巨亏5000万，那个销量加起来可绕地球好几圈的香飘飘怎么了	未
半年新增6家子公司，华统股份加速扩张	未
半年融资1.3亿美元，社交电商新贵每日一淘背后的商业逻辑2018年资本市场冷冽的冬天里，社交电商领域的融资却热火朝天。12月11日，每日一淘宣布获得了AB两轮数总计1.3亿美元的融资。其中，A轮融资领投方为DCM，海纳亚洲创投基金（SIG）微光创投跟投，B轮领投方为元生资本，海纳亚洲创投基金（SIG）参与联合投资，DCM元璟资本跟投。很难想象，一长串金主背书下的每日一淘其实是一个新晋社员。成立于2018年4月的每日一淘，是由国内生鲜电商领导者每日优鲜孵化的专业精选社交电商。半年融资1.3亿	未
半斤重大闸蟹、水果型红椒……不出南京就能品尝淮安美味啦	未
半醉半醒日复日，花开花落年复年。	未
华a家 螺蛳粉300g3袋 15.8到手300g一包，料包贼多，味道贼好吃，他家的螺蛳粉好吃耶，性价比也高！	未
华a家 螺蛳粉300g3袋 卷后15.8折合一包才5块多一点 螺蛳粉什么的最好吃啦！你们喜欢吃吗	未
华业资本：实控人已授权管理层寻找优质资产注入上市公司	未
华东地区（上海）灵寿商会成立！！！	未
华东师大在国内高校中率先成立经济委员会	未
华东攀岩嘉年华流水账	未
华东最大的新奇特“观光温室”开园，成盐城农旅融合新亮点	未
华东环保涂装大讲堂开课啦！	未
华东理工大学朱为宏郭志前团队：内标比率型乏氧探针和酶激活AIE探针原位精准检测	未
华东第二条客运大通道，商合杭高铁最新建设进展来啦	未
华严感悟古风	未
华严感悟菊又生	未
华严法讯千佛认供 千佛护持	未
华严法讯大华严禅寺启建21天大佛顶首楞严王神咒灌顶坛场	未
华严瀑布高千尺，不及卿卿爱我情。	未
华为2018年智能手机发货量超过2亿台	未
华为：50G PAM4 产品化已经就绪 为5G商用奠定产业基础财联社12月17讯，华为中国微博12月17日消息，由华为LightCounting光迅科技住友索尔思思博伦以及颖飞等产业链上下游合作伙伴联合发起的第三届50G PAM4技术和产业论坛近日在深圳举行论坛上，产业链上下游伙伴一致表达了对50G PAM4 ...全文	未
华为5G总裁杨超斌：12月底前与5家芯片企业完成互操作测试e公司讯，e公司快讯 华为5G总裁杨超斌在2018中国移动5G创新合作峰会上表示，华为拥有大量5G专利，是5G标准的主要贡献者之一，认同5G时代终端累计费率应该比3G4G时代更低的观点，也只有这样，才能促进5G产业的发展。杨超斌透露，今年12月底之前，华为将完成与5家芯片厂商的互操作测试。 网页链接	未
华为A股小伙伴一览	未
华为CFO孟晚舟:以祖国为傲，以华为为傲	未
华为CFO孟晚舟保释后日记曝光：勇敢不是因为不害怕，而是心中坚守的信念	未
华为CFO孟晚舟保释后日记曝光：勇敢不是因为不害怕，而是心中坚守的信念这是一篇孟写于2018年12月19日的日记：我踏上了去日本的航班，勇敢不是因为不害怕，而是心中坚守的信念宽慰，是因为上苍始终能看到我们的努力，也从不忽略我们付出的努力...网页链接	未
华为GIV预测：到2025年企业对AI采用率将达到86%	未
华为MateBook 13售价公布：4999元起，12月25日线上首销	未
华为nova 4发布：打孔屏设计易烊千玺代言3099元起	未
华为nova 4现场实拍图赏	未
华为P30外观就这样实锤了感觉怎么样，颜值方面。	未
华为为什么值得我们尊重因为它为中国的未来，争得了先机	未
华为举办首届智能计算大会 发布智能计算新战略(图)	未
华为云服务器云礼回馈：最低1折起，2人可拼团华为云服务器日前开启普惠季活动，产品价格低至一折抄底价，同时拼团用户还可以享受两人成团的便利详情点击：华为云服务器云礼回馈：最低1折起，2人可拼团	未
华为从架构跟玩法看比普通美国企业更美式//@跳跳可爱虎:说的好	未
华为何刚：华为手机今年全球发货量即将超2亿台36氪讯，在今日的华为nova 4发布会上，华为消费者业务手机产品线总裁何刚宣布，华为手机2018年度全球发货量预计突破2亿台，同时，2亿quot纪念版手机将在12月25日推出。此外，华为消费者业务CEO余承东也表示，2018年华为智能手机全球发货量即将突破2亿台，这已经大大超过了年初定的目标，华为将继续努力为全球消费者创造价值。	未
华为 像斗士一样！支持任正非的举手 支持持孟晚舟的举手支持国产华为的举手	未
华为全国巡回公益讲座  枪林弹雨中成长	未
华为公司新年贺词：困难越大，荣耀也越大，即将结束的2018年，印证了哲学家西塞罗的这句名言。在这极不平静的一年里，我们从未停下前进的脚步。2018年，公司预计实现销售收入1085亿美元，同比增长21。 华为轮值董事长郭平新年致辞：不经艰难困苦，何来玉汝于成	未
华为公布智能计算新战略：构建全栈全场景解决方案	未
华为内部澄清:在德5G业务正常 积极参与法国5G建设	未
华为再下一城：与葡萄牙最大运营商签5G合同，2019年实现商用 警告川普 用人质要胁没用[加油]	未
华为副总裁今天发文《孟晚舟，其实赢了！》的文章，激励大家用实际行动支持华为，多买华为产品今天华为副总裁余承东发布标题为《孟晚舟，其实我们盈利！》的文章，余承东在文章最后指出：别人在打压我们企业，作为中国一份子，我们要更加支持自己的企业！今天，我们对华为的支持，请别停留在情绪 ...全文	未
华为启动第三次搬迁，共4500人！1.2万人进驻欧洲小镇（附航拍）	未
华为员工自制咖啡杯 印有“灯塔在守候 孟舟晚归航”	未
华为唯一接班人 超级二代孟晚舟	未
华为回应5G报道：全球经营整体稳健，已获25个商用合同	未
