大日子来了！一起看2019环球时报年会2019环球时报年会马上就要开始了！本次年会主题中美博弈与世界变局，此时此刻，年会现场正虚位以待！	未
大早上起来就奋战在购物第一线，一千一千又一千，眼花了，休息一下，一会儿继续，，，	未
大旭老婆：游戏好玩，二胎不要了！小深深开皇帝邀请大司马加入	未
大明山氧离子雪地音乐节开幕啦！这个周末，热雪开滑！大明山景区门票雪地音乐节门票巴士索道滑雪3小时美食券只要1块钱！今晚8：00开抢天气越寒冷，这里越火热！冰天雪地的滑雪场火力全开的动感音乐节各种热门神曲12月22日-23日，开启你的冰雪奇缘	未
《大明平妖传》热映 郭文鹏昊担纲音乐制作(图)	未
大明张天师评传丨张懋丞：文以俊秀 法以术显	未
大明锦衣之妖动乾坤 优昙小姐姐上线，头发都是爱你们的形状[小仙女] 查看图片	未
大晚上的//@King_Ranger:！//@动如岛风:哇！	未
//@大望路女青年:真棒！//@一蚊丁://@M大王叫我来巡山: 进步//@颜文字君://@吃瓜群众CJ:第一次看到//@天涯booby:值得转发//@乔凯文://@简木生--撰稿者:转发微博	未
大木厂镇举行的牛产业观摩活动，大家纷纷表示赞许...	未
大村之声广播室， 唱响扶贫好声音	未
大杭州今天入冬！最强冷空气已到，临安余杭周五有雪！	未
大杭州这个地方实现省级森林城镇全覆盖！	未
大栅栏街道体制改革方案正式落地，新起点上再出发！	未
大树快要压到我家 居民盼着早日解除安全隐患！	未
大校场地块开发慎落子、巧留白  南部新城打造南京城市新中心	未
大校场跑道旁 将建南迁文物博物馆	未
大桥晨光  贵州鸭池河特大桥360度全景图柔情大灰狼200 微博全景图片	未
大桥要恢复通车啦	未
大桥见证了我们半个世纪的爱情	未
“大桥通车50周年纪念跑”下月开跑	未
//@大概是一只PhoebeLi了: 果然接地气的超市，终于在一群暖心广告里出现了蹦迪广告[米奇比心]	未
大概没去过的地方都叫远方，没得到的人都比较难忘。	未
大概没去过的地方都叫远方没得到的人都比较难忘	未
大概，没有去过的地方都叫远方，没有得到的人，都比较难忘。	未
大概，没有去过的地方都叫远方，没有得到的人，都比较难忘。 微博视频	未
大款据报道，这名越南男子经常在社交媒体晒出美食佳肴和各种酒，更令人惊叹的是他晒出的13斤金首饰。这名男子脖子戴着金项链，项链的挂坠几乎和手掌一般大，而他左右手还戴着巨大的金戒指和金手环。他说：我每天都这样。	未
大步向前走，深藏功与名	未
大武口的夜美爆了	未
大比分领先进入第四节 97-67	未
大气池州复建30周年文化惠民演出上演，视频多图带你直击现场	未
大气！铜川药王山景区启用新山门	未
《大汉十三将》主题曲发布：一曲长歌颂英雄，满腔热血报家国	未
大江大河	未
《大江大河》12月10日开播，“还原那个时代的劲头”	未
大江大河上海媒体群访穿着解析	未
大江大河 上车请刷卡，开车请坐稳啦	未
《大江大河》：今年最适合阖家观看的电视剧之一	未
大江大河 今晚	未
《大江大河》今晚开播 童瑶：那个澎湃的时代是值得了解和回味的	未
《大江大河》众主创做客《大戏看北京》 	未
《大江大河》初评：一个好的剧本有多重要	未
大江大河 北京0.971，东方0.527 查看图片	未
大江大河 北京地铁一日游欢迎大家	未
大江大河 四惠站到了，四惠站到了，满眼都是河宝的身影，给你铺天盖地的享受	未
大江大河 大江大河定档1210 还有两天！	未
大江大河定档1210 我与大江合个影 哇！这几天是不是要公交地铁绿色出行了！@王凯kkw	未
《大江大河》将开播 王凯“瘦身”演绎大时代奋斗史	未
《大江大河》将播 王凯杨烁致敬改革开放四十周年(图)	未
大江大河 小杨白馒头，你的青春最闪亮	未
大江大河微博剧场我是骑士猫，小辉的专属餐正在路上放心，我会成为合格的投喂人	未
大江大河我的选择我的路东宝书记的路，是敢为人先，勇往直前的路	未
大江大河 收到来自北北的炫耀20:45必须看！	未
《大江大河》最帅县长上线 王鑫力挺杨烁“大包干”	未
《大江大河》热播 贾媛媛村姑形象备受肯定	未
《大江大河》王凯：演好那一代人风貌，就得再瘦点管住嘴热播剧《大江大河》中，王凯饰演的宋运辉是身在改革的大潮中通过知识改变命运的典型代表。为了演好角色，王凯除了提前留长了头发，还做了大量的功课。查阅资料，向父辈讨教，体味他们眼里闪烁的光芒，仔细揣摩那一代人的风貌 ...全文	未
大江大河看着热情洋溢暖乎乎的，朝气蓬勃有希望。就想挽袖子大干一场	未
大江大河 表情包第二弹@大江大河官微 @回忆里的三八线 投稿	未
《大江大河》追逐改革浪花	未
大江大湖大武汉 云南德宏州带民族歌舞来汉推介旅游，14日还将去天河机场表演12月13日，云南德宏州组织当地歌舞能手飞抵武汉，用歌舞形式，推介德宏旅游资源。14日，这些民族歌舞能手还将在天河机场进行表演。云南德宏州少数民族众多，傣族景颇族等民族同胞能歌善舞。10月28日，武汉开通直飞德宏州首府芒市的航班。武汉游客仅花三个小时，就能飞抵德宏州芒市。明年新航季，瑞丽航空还将计划开行武汉至西双版纳航线。近期武汉飞芒市的机票价格均在500元-700元左右。芒市当地气温在20摄氏度左右，气候宜人，是武汉人	未
大江大湖大武汉请来专家开方子，武汉市旅游委帮抗战第一村抬人气有着抗战第一村美誉的姚家山风景区，如何端出更好的旅游产品专家建议，要以浸润式的旅游体验，激发年轻人了解红色革命历史的兴趣，做出更好的文化底蕴与绿色生态环境相结合的研学产品。11月28日，@武汉市旅游委 第四支部邀来文史专家和旅游界专家，到姚家山景区现场把脉。不仅仅是送思路送方法到企业，武汉市旅游委还与扶贫驻点村开展主题党日活动，以旅游党建促扶贫攻坚。	未
大沥好故事丨为人民服务，党员不退休！水头社区这个小品好暖心！	未
大沥好故事丨为帮助街坊，他种下了整片爱心菜园	未
大沥好故事丨志愿者无偿献血11年！沥苑社区小品感动你了没	未
大沥好故事丨把垃圾变废为宝！快跟着沥西社区这个小品学起来！	未
大沥好故事丨给孤寡老人过父亲节！沥桂社区这个小品超暖心！	未
大沥好故事丨龙狮精神是什么泌冲社区用这个小品话你知！	未
大河中学机器人总动员 让AI触手可及	未
大河网邀专家同步为您解读省十次党代会报告	未
【大河网邀专家解读党代会报告⑧】推进“互联网+”行动 加快建设	未
【大河网邀专家解读党代会报告②】河南发展新优势凸显	未
【大河网邀专家解读党代会报告⑥】河南形成“三个高地”自身优势	未
【大河网邀专家解读党代会报告⑭】绿色发展顺应人民期盼	未
【大河网邀专家解读党代会报告⑪】聚焦社会热点 以点带面深化改	未
@大河边缘1：花生鸟结，过年的糖	未
大沽口炮台遗址博物馆感恩新时代 扬帆中国梦主题活动滨海资讯 1月24日，大沽口炮台遗址博物馆特别企划的感恩新时代 扬帆中国梦主题活动在这个冬日让孩子们深深地感受到了爱的温情。在工作人员的带领下，孩子们缓步踱行于炮台官兵当年浴血奋战的阵地，真切感受他们坚韧不屈的民族气节。战场权作英雄冢，官兵们用自己的生命和鲜血谱写了一曲故垒壮歌，一株株白菊是对先辈们最诚挚的敬意。	未
大波龙虾这么吃！ 微博视频	未
大泫《静悄悄》火了 将登酷狗带来live版	未
大洋洲规模最大的DOTA2 国际赛事，CEG职业联赛将于12月8日-9日北京时间6:30-19:00在澳大利亚墨尔本举行线下决赛！本次线下赛邀请了Ti8冠军OG东南亚劲旅Mineski以及中国军团Newbee.MGB和DBG等8支战队。虎牙主播@黄翔longdd @BurNIng徐志雷 @Dota_情书 将为大家倾情解说！longdd直播间号：678555B神直播间号：520888情书直播间号：991110	未
大洋洲规模最大的Dota2赛事，墨尔本CEG Dota 2 职业联赛将在12月8日-9日在墨尔本会展中心The Plenery举行瞩目赛事！决赛更有Ti8冠军战队OG及中国NEWBEE.MGB，DEATHBRINGER战队出战！熊猫直播60995号房间，以及主播@RANDOM跳刀跳刀丶 219905直播间@墨岩彧 127552直播间将会全程直播！主舞台直播间：网页链接 跳刀跳刀丶直播间：网页链接 墨岩彧直播间：网页链接	未
大洋深处，磨砺胜战刀锋	未
《大浦东》今日开播：文艺要反映现实，尤其要反映改革	未
《大浦东》登陆央视  讲述一代金融人奋斗史	未
大浪淘沙四十年，黔江踏平山路成大道	未
大消息！新余商家集体密谋搞事情！14999元的东西免费拿！	未
大涌的新兵小哥哥们入伍两个多月了！娘家人来看你们啦！	未
大润发抢爆双12要买就趁「五折」	未
大润发：未来将进一步整合欧尚和大润发	未
大温一周好去处：11月24日-30日 圣诞季去哪玩看这里！	未
大温一周好去处：12月1日-12月7日 带你一起玩嗨圣诞季	未
大温周末可能要下雪啦！滑雪季正式开幕，BC省29家滑雪场信息请收藏！	未
大港东城小学项目外檐基本完工滨海资讯 从滨海建投集团了解到，作为新区重点民心工程之一的大港东城小学项目建外檐工程已基本完工，正在进行内装与机电安装工作，预计明年7月全部建成。据了解，大港东城小学坐落于古林街港东新城，总面积16750平方米，为地上四层地下一层，项目于2017年上半年开工建设，规划办学36个班，可容纳1620名学生，共有南北教学楼报告厅风雨操场连廊室外体育场等建筑。	未
大港制万路明年上半年通车滨海新区政民互动 网民留言：制万路是连接大港城区和中塘镇河西片的交通要道，两年前因为修黄港铁路断交施工，工期一拖再拖。天津市住建委回复：经调查，因为南港铁路的施工，大港制万路进行了封闭道路施工，封闭范围一直到与津淄公路交口处，由于制万路与南港铁路立交工程设计方案的调整，原定通车日期需要进行延期，目前铁路设计单位正在完善设计方案，待交通行业主管部门通过方案后开展施工，预计2019年上半年恢复交通。	未
大湾区一周观察：坚定“制造强国”，广东制造业频“触网”	未
大湾区一周观察：广东各地推出“外资十条”，多地合作“加速度”	未
大湾区一周观察：香港楼市冷风频吹、珠海东莞发力跨境电商	未
大湾区共同家园发展基金及青年公益基金在港启动	未
“大湾区共同家园发展基金”及“青年公益基金”正式启动	未
大湾区巡游惠州天坑是如何炼成的	未
大湾区建设推进粤港澳学校交流加深	未
大湾区超级门户的新想象：从《交通枢纽总规》出炉到地铁“六线齐发”	未
大湿说我们可以进四强！	未
大溪地海豚度假酒店，出门就是海豚，羡慕（视频来自网络） 微博视频 答案	未
大溪地这个风景如画的避世密岛，只等你来！	未
大漠勘探(图)	未
大濠公園 地点:810-0051 福岡県福岡市中央区大濠公園1 092-741-2004 「网页链接」 查看图片	未
大焕评如果按人均，北京上海广东浙江遥遥领先，福建要排到江苏之前，居第五山东虽居第七，事实上如果按人均的话可能还得往后排中产数量跟人口流动方向高度吻合全国近九成的跨省流动人口流入到上述六省，而跨省流动人口占全国流动人口的近四成新中产分布地图中国3000万家庭财富报告	未
大熊猫回家之路探访中国首个大熊猫放归地2018年岁末，四川雅安发布这样一则消息：2019年将启动万名港人游雅安活动，邀请香港民众来一趟熊猫老家之旅雅安既是中国大熊猫的发现地，又是首个中国大熊猫野外放归地这个熊猫的老家有哪些精彩的故事一起来看看！ ...全文	未
大熊猫回家之路探访中国首个大熊猫放归地2018年岁末，四川雅安发布这样一则消息：2019年将启动万名港人游雅安活动，邀请香港民众来一趟熊猫老家之旅。雅安既是中国大熊猫的发现地，又是首个中国大熊猫野外放归地。这个熊猫的老家有哪些精彩的故事一起来看看！大熊猫回家之路探访中国首个大熊猫放归地	未
大熊猫濒危的真正原因让人惊叹 萌宠是戏精  V影响力峰会红人的诞生	未
大熊猫，真的是活泼可爱	未
大熊猫系列科普教育及绘画公益活动本次由央视网熊猫频道成都大熊猫繁育研究基地联合主办的大熊猫系列科普教育及绘画公益活动来到了四川省成都市龙泉驿好日子社区活动以熊猫家园我为主题，现场60多组亲子家庭共同参与大家热情地参与到大熊猫的科普学习中来，并创作了不同 ...全文	未
大熊猫肉肉两岁半生日会：直播送它么么哒！29日，承受着万千宠爱的超级网红@大熊猫梅兰 就要在@成都大熊猫繁育研究基地 度过它两岁半的生日啦！自带圆脸的它，伴随着天生的好胃口，最近更是胖出了双下巴。面对如此好捏的大熊猫，你准备好跟@封面直播 一起去送么么哒了吗 华西都市报的微博直播 .	未
大熊猫萌兰 20181119来来来来自迪的灵魂对视！	未
大熊猫贡贡、舜舜在海口与公众见面	未
大熊猫龙凤胎福伴福凤明晨回家！大熊猫龙凤胎回蓉经过数周的精心准备，在奥地利生活两年多的大熊猫龙凤胎福伴福凤2日已踏上了回乡的旅程据中国大熊猫保护研究中心神树坪基地工作人员介绍，双胞胎福凤福伴将于4日凌晨3点到达成都双流国际机场，当天上午9点半到达中国大熊猫 ...全文	未
大爱！90后医生熊敏亮捐献造血干细胞延续生命江西正能量结婚后孕育爱情结晶对每个人来讲是一件十分神圣的事情，当这件事与救人同时摆在一个人面前时，九江市德安县医生熊敏亮的选择让人点赞记者了解到，继今年9月德安县乡村医生尹海龙成功捐献造血干细胞救治一名外国患者后，熊敏亮捐献成功后 ...全文	未
大爱！90后医生熊敏亮捐献造血干细胞延续生命江西正能量结婚后孕育爱情结晶对每个人来讲是一件十分神圣的事情，当这件事与救人同时摆在一个人面前时，九江市德安县医生熊敏亮的选择让人点赞。记者了解到，继今年9月德安县乡村医生尹海龙成功捐献造血干细胞救治一名外国患者后，熊敏亮捐献成功后将成为德安县第二例造血干细胞捐献者，他同时也是全市第12例全市首例90后造血干细胞捐献者。	未
大爱佛山 乐善之城 ，为环卫工人何春玲打call	未
大爱兴县兴县：坚强的七旬老奶奶含辛茹苦拉扯着三个孙子！	未
大爱图一	未
大爱无疆！中江退休老人奉献一生，捐出眼角膜和遗体！	未
大爱无疆顺其自然如期而至再捐50万元20年累计捐款1005万元	未
大爱求生	未
大爱洪城	未
大爱清尘 再次成为锡马唯一公益合作伙伴12月9日晚，在江苏省无锡大剧院2019年比佛利无锡马拉松新年音乐会举办现场，音乐会开场前不断循环播放大爱清尘公益片这是继去年@无锡马拉松 后，大爱清尘再次成为无锡马拉松的公益合作伙伴@王克勤 @姑苏晚报 @新浪体育	未
大爱清尘再次成锡马公益合作伙伴2019年比佛利无锡马拉松新年音乐会马上开始。无锡大剧院在不断巡回播放@大爱清尘 公益片。这是继去年无锡马拉松后，我们再次成为无锡马拉松的公益合作伙伴。	未
大爱清尘再次成锡马公益合作伙伴2019年比佛利无锡马拉松新年音乐会马上开始无锡大剧院在不断巡回播放@大爱清尘 公益片这是继去年无锡马拉松后，我们再次成为无锡马拉松的公益合作伙伴	未
//@大爱清尘-山西: 感恩节里的探访。感谢对尘肺病和尘肺病农民兄弟的支持。@新京报@曹勇-大爱清尘	未
大爱清尘 湄潭计划稳步推进12月17日，@大爱清尘-遵义湄潭工作站 站长周慎凡副站长李正强专职谭明霞熊静一行来到湄潭县创建办汇报协调湄潭计划工作情况会上周站长说要紧紧围绕湄党办发(2016)53号文件和湄党办发(2017)79号文件，这是打造健康湄潭和做好湄潭计划 ...全文	未
大爱清尘第三个正式运营的尘肺病人康复中心柴坪康复中心启动	未
大爱的一只小熊 微博视频	未
大爱荷城丨古稀之年的志愿者阿叔	未
大爷大妈健身各有奇招，硬核老年生活！ 健身专辑	未
大爷您好	未
大爷萌娃同场竞技 500名乒乓球爱好者齐聚“重庆杯”	未
大爷还是你大爷//@水晶男孩鸡大帅:速度是七十迈 心情是自由自在	未
大片张家界景区山岳救援大演练 悬崖高空飞索练本领	未
大片既视感//@斯莱特林17届级长:哈哈哈哈哈哈哈哈哈哈哈哈哈哈@睡到王嘉尔的女人 //@全是沙雕:哈哈哈哈哈哈哈哈哈哈哈哈哈哈哈哈哈哈哈哈哈哈哈哈想看！	未
大片来了！大型政论专题片《必由之路》即将播出	未
大片来袭！株洲市民中心即将投用，内部装修堪比央视演播大厅！	未
大片！永州香柚获央视8个频道免费推介！每天不低于20次播出	未
大牌打折美食超低价，颜值才艺炫耀不停的 龙民节到底有多嗨	未
大牌美食节来啦！12月16日成都五大品牌全城5折！就问你怕不怕！	未
大牌酒店的水壶毛巾等还能放心用吗旅行达人必备黑科技！	未
大牌首秀畅玩非遗 2018上海国际手造博览会邀你赴约	未
大牛一组，喜欢哪一头 全球汽车 汽车	未
大猜想：全球首张55吋打印电视将花落谁家	未
大理90后白族美女从家乡深山挖出紫水晶，带600贫困户一起致富	未
大理90后白族美女从村里挖出紫水晶，带600贫困户一起致富	未
大理人注意！你家城中村的房子要通过消防安全检查，合格才能出租	未
大理剑川一村干部违规享受1头肉牛补助5000元，结果	未
大理南涧婚礼 南涧跳菜 南涧彝族 --公郎 上集	未
大理南涧无量山樱花谷中深藏着一个风景独好的小山村，宛如世外桃源	未
大理双廊255家客栈恢复营业，餐饮恢复126家	未
大理古城赏花指南  万物萧瑟之冬，娇艳欲滴山茶盛放	未
大理市创建全国文明城市，这些内容，每个大理人都应该知晓！	未
大理：我的理想生活，是可以睡到自然醒，和爱的人笑看日落。	未
大理最没存在感的地方，却靠一片樱花拉回关注，错过再等一年！	未
大理洱海  真龙现世啊 微奇观	未
大理洱海，真龙现世啊 微奇观（@中国气象科普 ）	未
大理白族自治州建州60周年 网络媒体大理行记者抵昆	未
大理石EYE SHADOW 70元券微博专享限时领券	未
大理石布加迪Chiron 肿么样cars01豪车拍汽车V峰会	未
大理鹤庆辅警李金奇，真棒！	未
大瑶：小镇烟花 璀璨世界（庆祝改革开放40年基层行·乡镇篇）	未
大田：铁建工地 党徽熠熠	未
大田集镇：广场舞大赛 撬动乡村文化振兴	未
大电臀了解下	未
大疆农业明天将要发 MG 系列农机新品，打算去看看这种农机有什么好玩的地方。	未
大疆创新发布灵眸Osmo口袋云台相机 售价2499元	未
大疆发布二代植保无人机，是升级还是打脸	未
大疆、国泰航空与南非旅游局合作推出曼德拉主题游	未
大疆灵眸OSMO口袋云台相机体验：报告领导，我又想去旅游了	未
大疆灵眸什么的好心动好想要啊！！！这次出去发现iPhone拍拍日常还行，拍旅行还是有点弱了那个手持云台不会抖真的好心动好心动！它不会抖！！不会抖啊！！！	未
大病免费医疗案例系列之他山石1：俄罗斯华人眼中的免费医疗	未
大白兔润唇膏、旺旺雪饼气垫 跨界彩妆看起来很好吃	未
大盐商返乡巩固礼教继续小农经济张华侨	未
大盘V型反弹：沪指涨0.81%，两市成交缩至2674亿元	未
大盘回调的太勉强了，能不能一步到位。使劲来一下宣泄完，日后才会更好的起跳。熬不住的洗出去，主力才能更好的收集筹码，稍微用点资金就能拉起来。我们的票目前还没有受任何影响。 微博股票随手点赞腰缠万贯	未
大盘完成反抽30日线的步奏后，将继续寻底，还是先看2550点左右的支撑，撑不住就再去考验2449点一次。耐心等待大盘企稳放量吧，目前多看少动，没有买卖没有伤害的阶段！	未
大盘把脉@股神孙钥洋 的一直播（下载App-gt网页链接）	未
大盘直击上海莱士午后再度封板 成交额超15亿午后上海莱士再度封板，截止目前，上海莱士报7.82元，成交额超15亿。快讯：上海莱士午后再度封板 成交额超15亿	未
大盘直击午评：上证50重挫1.5沪指跌0.82 银行股全线杀跌截止午间收盘，沪指报2528.73点，跌0.82，深成指报7398.38点，跌0.27创指报1270.46点，涨0.13。从盘面上看，创投猪肉在线教育居板块涨幅榜前列，银行白酒机场航运居板块跌幅榜前列。午评：上证50重挫1.5沪指跌0.82 银行股全线杀跌	未
大盘直击 午评:两市低开高走齐收红创指涨0.92 5G概念股爆发截止午间收盘，沪指报2520.58点，涨幅0.17，深成指报7370.69点，涨幅0.45创指报1282.00点，涨幅0.92。午评：两市低开高走齐收红创指涨0.92 5G概念股爆发	未
大盘直击开盘：两市低开沪指跌0.75 中兴通讯跌5.74截止今日开盘，沪指报2629.82点，跌幅0.75深成指报7854.59点，跌幅0.93创指报1371.34点，跌幅0.75开盘：两市低开沪指跌0.75 中兴通讯跌5.74	未
大盘直击 开盘：两市大幅低开沪指跌0.64 黄金概念股领涨今天开盘，沪指报2589.19点，跌0.64，深成指报7663.26点，跌0.91，创指报1328.06点，跌0.97开盘：两市大幅低开沪指跌0.64 黄金概念股领涨	未
大盘直击开盘：沪指涨0.16创指跌0.12 医药电商板块领跌截止今日开盘，沪指报2609.34点，涨0.16深成指报7741.73点，涨0.09创指报1344.13点，跌0.12。上海莱士复牌一字跌停，封单超160万手。开盘：沪指涨0.16创指跌0.12 医药电商板块领跌 快讯：上海莱士复牌一字跌停 封单超160万手	未
大盘直击 操盘必读李克强：中国将进一步扩大开放，打造内外资企业一视同仁的营商环境。中国有条件有能力应对各种风险挑战，保持经济平稳运行央行：管好货币供给总闸门，进一步疏通货币政策传导渠道中国11月外汇占款环比减少571.3亿元，连续第四个月下降央行17日开展1600亿元逆回购操作深交所：支持上市公司通过并购重组等方式做大做强。将推动放宽创业板上市条件海15家金融机构千亿资金支持50个民营实体项目上海千亿资金支持15家民企，地方官员称以后或还有第二批第三批中基协：私募基金行业首次纳入	未
大盘直击 操盘必读针对商业银行补充资本有关问题，金融委办公室于12月25日召开专题会议，将推动尽快启动永续债发行。展望2019年，高盛认为中国将是整个亚洲市场最值得超配的地区，预计沪深300指数2019年目标点位3700点，相对目前位置有接近20的涨幅，MSCI中国指数上涨15左右。 ...全文	未
大盘直击 收评：三大股指下探回升沪指涨0.1 医药板块领跌截至收盘，沪指报2597.97，涨0.16深指报7592.65，跌0.48创指报1299.18，跌0.86。沪指延续震荡整理格局，创指依旧弱势震荡。收评：三大股指下探回升沪指涨0.1 医药板块领跌	未
大盘直击 收评：三大股指下探回升沪指涨0.1 医药板块领跌沪指延续震荡整理格局，创指依旧弱势震荡上午冲高银行保险等板块午后稍有回落，资金情绪稍显回暖，两市半数个股翻红临近尾盘，壳公司尾盘异动，三大指数小幅拉升，成交量稍显放大，但赚钱效应依旧低迷收评：三大股指下探回升沪指涨0.1 医药板块领跌	未
大盘直击 收评：三大股指高开低走沪指跌1 地产板块弱市逞强截止收盘，沪指报2549.56点，跌1.05，深成指报7418.69点，跌1.48创指报1268.81点，跌1.90。收评：三大股指高开低走沪指跌1 地产板块弱市逞强	未
