大嘴：不说了，准备去荣耀入职做赵明小弟。	未
大噶早！准备好了吗	未
大噶早！周一啦这个明天开！	未
大噶看到了么转 评 赞原视频揪送3个88	未
大国匠人：5分钟了解瓷器界的精灵粉彩瓷	未
大国匠人：观鹰刻砚 他将神韵化入一方砚台	未
大国外交·苏州篇章  近距离感受中国力量	未
大国担当 中国形象——中国海军护航档案	未
【大国看丨改革开放40年】车轮上的美好生活	未
大国重器。	未
大国重器 重就重在讲政治。政治工作永远是我军生命线。空军一班人全面贯彻床总强军思想，引领官兵思想航迹，为训练注入作战灵魂。多次前出西太的轰-2飞行员表示，光有飞得远的新佩剑还不行，更得有飞出去的主心骨。生命线引领新时代练兵备战新航迹，空军实现了常态化前出西太警巡东海战巡南海绕陆巡航。每次展翅大洋振翅海天，空军都在第一时间向海内外发出声音宣示意志，把握了国际舆论主导权。	未
大图丨斗严寒，战冰雪，特战队员零下20度天山腹地挑战极限	未
《大圆满前行》有声书  上师瑜伽「顶礼诸佛对治傲慢（上)」	未
大场面！一百多个村级服务站参加！我县召开村级电商服务站建设暨贫困村电商扶贫工作会！	未
大场面！普宁又有两个村化解百年恩怨，数万人见证，壮观！	未
大场面！武汉精英学校近十辆大巴从老一中前往侏儒，只为这件事...	未
大块当兵的人，退役军人信息采集，你千万不要错过	未
大块要闻！	未
大坛资讯土族之乡：沧海桑田的40年	未
大坛资讯平凡中的不平凡	未
大坛资讯平凡的力量北京榜样五周年大型图片展	未
大坪很多人去参加！全国十三省魏氏宗亲回肇基地祭祖！	未
大坪镇龙湾小学开展第四届科技手工制作展评活动	未
大型一周打榜现场已安排到位！	未
大型互相种草博[小仙女]你们在这条微博下说出想去旅游目的地看有没有当地/去过的小伙伴现身说法！旅游美食交通等方面互助互相，希望大家享受旅行跟美食，玩的开心鸭！！	未
大型全媒体新闻行动《潮起扬子江》12月2日走进宿迁！	未
大型全媒体新闻行动《潮起扬子江》全景展现淮安40年巨变！网友们这样说	未
大型原创交响合唱音画《追梦三江源》西宁上演	未
大型口红拔草现场 转给广大男网友看好吗！我们真的不喜欢死亡芭比粉	未
大型吸猫现场//@喵豹妹:转里送个300！姐妹们冲鸭！	未
大型国企招聘工作人员，工资待遇高，户籍不限，民族不限，赶快转发给身边需要的人！	未
大型复合车铣加工船用巨型曲轴，真是大开眼界。。。	未
大型多人实时在线网络游戏，散户，哎哟。	未
大型展览网上展馆	未
大型工业史诗电视剧《大三线》将在攀枝花拍摄	未
大型打脸现场！大型打脸现场！毛领围巾围脖只要11.9了tips：用天猫积分兑换红包的话，拿下只要1.9	未
大型报告文学《浦东史诗》出版，书写浦东开发开放伟大成就	未
大型招聘会，58家企业，1342个岗位，错过要再等一年	未
大型政论专题片《必由之路》	未
大型政论专题片《必由之路》12月11日播出	未
大型政论专题片《必由之路》（一）“历史之约”4分钟速览	未
大型政论专题片《必由之路》（一）“历史之约”四分钟速览	未
大型政论专题片《必由之路》（七）“大国之盾”一分钟预告	未
大型政论专题片《必由之路》（七）“大国之盾”（八）“共同命运”预告	未
大型政论专题片《必由之路》（七）“大国之盾”速览	未
大型政论专题片《必由之路》丨第二集《关键抉择》一分钟预告	未
大型政论专题片《必由之路》（二）“关键抉择”一分钟预告	未
大型政论专题片《必由之路》(二)“关键抉择”四分钟速览	未
大型政论专题片《必由之路》（二）“关键抉择”四分钟速览	未
大型政论专题片《必由之路》(五)“立国之本”	未
大型政论专题片《必由之路》（五）“立国之本”一分钟预告	未
大型政论专题片《必由之路》（五）立国之本一分钟预告40年沧桑巨变，中国创造出人类发展史上的奇迹，探寻造就奇迹的密码，就是中国共产党的领导。网页链接	未
大型政论专题片《必由之路》(五)“立国之本”四分钟速览	未
大型政论专题片《必由之路》（五）“立国之本”四分钟速览	未
大型政论专题片《必由之路》今天播出第四集	未
大型政论专题片《必由之路》（八）“共同命运”一分钟预告	未
大型政论专题片《必由之路》（六）“兴国之魂”一分钟预告	未
大型政论专题片《必由之路》（六）兴国之魂一分钟预告网页链接	未
大型政论专题片必由之路（六）兴国之魂一分钟预告网页链接	未
大型政论专题片《必由之路》(六)“兴国之魂”预告	未
大型政论专题片《必由之路》（四）“力量之源”四分钟速览	未
大型政论专题片《必由之路》（四）力量之源四分钟速览改革开放40年，他们奋力追赶，不舍昼夜。网页链接	未
大型政论专题片必由之路（四）力量之源四分钟速览改革开放40年，他们奋力追赶，不舍昼夜网页链接	未
大型政论专题片《必由之路》在社会各界引起强烈反响	未
大型政论专题片《必由之路》揭示民族复兴必由之路	未
大型政论专题片《必由之路》 第七集 大国之盾	未
大型政论专题片《必由之路》第七集 “大国之盾” 四分钟速览	未
大型政论专题片必由之路第七集《大国之盾》改革开放40年，信息技术领跑新军事革命。铁律治军革弊鼎新，以重塑威武之师胜战三问，锻造战之必胜的劲旅精兵。军民合作自主创新，提升国之大器英雄辈出，为改革强军洒血奉献！（央视新闻）央视新闻的微博直播	未
大型政论专题片必由之路第七集《大国之盾》改革开放40年，信息技术领跑新军事革命。铁律治军革弊鼎新，以重塑威武之师胜战三问，锻造战之必胜的劲旅精兵。军民合作自主创新，提升国之大器，英雄辈出，为改革强军洒血奉献！央视新闻微直播带你一起看！ 央视新闻的微博直播 .	未
大型政论专题片《必由之路》第七集“大国之盾”速览	未
大型政论专题片《必由之路》第八集 “共同命运”	未
大型政论专题片《必由之路》第八集 共同命运	未
大型政论专题片《必由之路》第八集 “共同命运”四分钟速览	未
大型政论专题片《必由之路》第六集 兴国之魂	未
大型政论专题片《必由之路》第六集 “兴国之魂” 四分钟速览	未
大型政论专题片《必由之路》第六集“兴国之魂”四分钟速览	未
大型政论专题片《必由之路》第四集 力量之源	未
大型政论片《必由之路》主题歌《梦想阳光》发布	未
大型武术剧《武传奇》登陆毛里求斯	未
大型！海丰红场门口大热闹，引群众围观！	未
大型特别节目《扬帆新时代 锦绣新广西》桂林篇广西卫视特别节目扬帆新时代 锦绣新广西今天播出最后一集桂林篇《千古逍遥人间胜境》，全方位展现桂林践行绿水青山就是金山银山发展理念，建设国际旅游胜地国家可持续发展议程创新示范区国家健康旅游示范区取得的成效，展示桂林人民一本蓝图绘到底奋斗新时代，建设新家园的昂扬斗志。 改革开放40周年 广西壮族自治区成立60周年	未
大型电视纪录片《我们一起走过》光盘发售	未
大型电视纪录片《我们一起走过》播出第一集、第二集	未
大型电视纪录片《我们一起走过》播出第一集第二集	未
大型电视纪录片《我们一起走过》播出第五、六集	未
大型电视纪录片《我们一起走过》播出第五集、第六集	未
大型电视纪录片《我们一起走过》第七、八集预告	未
大型电视纪录片《我们一起走过》第七集、第八集	未
大型电视纪录片《我们一起走过》第九集、第十集	未
大型电视纪录片《我们一起走过》第五集、第六集	未
大型电视纪录片《我们一起走过》第十一集、第十二集	未
大型电视纪录片《我们一起走过》第十七、十八集预告	未
大型电视纪录片《我们一起走过》第十七集十八集	未
大型电视纪录片《我们一起走过》第十七集、第十八集	未
大型电视纪录片《我们一起走过》第十五集、第十六集	未
大型电视纪录片《我们一起走过》第十五集第十六集	未
大型电视纪录片《我们一起走过致敬改革开放40周年》第三集第四集网页链接	未
大型电视纪录片《我们一起走过——致敬改革开放40周年》第九集、第十集	未
大型真香现场之《爸妈不让我养宠物》合辑，人间真实！	未
大型真香现场//@冷笑话精选:哈哈哈哈哈太真实了吧	未
大型秀恩爱现场，单身保护好自己	未
大型粉丝面基现场来了哦 点击链接进入观看	未
大型纪录片《一代天娇——红线女》正式启动	未
大型纪录电影《善良的天使》在京举办国内首映礼	未
大型组织更注重专属化服务 移动工作首选蓝信	未
大型综艺事故现场，2018年，感谢这些人冒着生命危险为大家带来的笑容	未
大型美瞳折扣活动现场！双十一都没有那么多活动！错过等一年哦！ 图1日抛，图2是99专区，39其他年抛 不知道怎么挑的可以点开看评论！ 先领券，可以叠加活动使用！网页链接 领完券戳这里网页链接  评论晒单号，每天抽一位返现50元！	未
大型舞台晋剧《关公》山西首演	未
大型舞蹈锦鲤招募现场动一动就有机会得1212现金红包你还不来吗！哈哈哈哈比赛里抓到一个很妖艳的舞蹈：4y98c3的秒拍视频	未
大型航拍玉门记录片《瞰玉门 享自然》即将出炉，快来围观宣传片！	未
大型融媒体新闻行动《潮起扬子江》走进生态之城宿迁	未
大型路桥施工企业新疆交建今天上市啦！新疆交通建设集团股份有限公司是自治区交通建设行业大型企业集团，成立于1999年。公司前身为全民所有制企业新疆北方机械化筑路工程处。公司业务以公路桥梁交通安全设施科技养护路桥试验检测等经营项目为主，具有公路工程施工总承包一级桥梁一级及市政水利铁路交通安全设施试验检测等资质，此外，公司经营范围还包括设备物资采购科技养护交通工程仓储物流智能交通工程造价机械租赁设计咨询等多个领域。股票代码002941	未
大型！连州东陂又有外嫁女集体回娘家，场面轰动！！！	未
大型通俗理论电视节目《改革开放 关键一招》即将播出	未
大型通俗理论电视节目《改革开放关键一招》即将播出	未
大型都汇综合体落户舟山！位置就在这里	未
大型饭圈真实现场 分分钟教你做饭圈女孩你家百事被撕了！不要蹭百事热度谢谢抱走我家雪碧姐姐！！哈哈哈哈太真实了	未
大型饭圈真实现场饭圈必备语录模板，分分钟教你成为饭圈女孩	未
大城交警新动作，14个乡镇交警中队建成启用	未
大城县集中供暖户看一下，汇能供热发来重要通知！	未
大城司机必看！这次，加满一箱能省21元晚安大城	未
大城小伙徒步西藏归来，更神奇的事发生了！	未
大城小伙徒步西藏归来认识了一生挚爱！	未
大城小厨丨万象城推出20元工作午餐，80款餐嗨吃一个月不重样儿！	未
《大城崛起》撰稿人黎笙: 望阅读在闹市里蔚然成风	未
大城梦想 工业强基，激发动能	未
大城梦想 湘南重镇，工业脊梁	未
大城梦想衡阳南北要冲，交通枢纽	未
大城迎来今冬第一场雪！来看不一样的雪景！还有个重要的事说！	未
大埔2019年纯电公交将达到90	未
《大埔县全域旅游发展总体规划》 评审会召开	未
大埔镇：53台电视机送给危房改造贫困户	未
大基建板块午后异动，龙头山东路桥(SZ000498) 再度涨停，成都路桥新疆交建北新路桥集体跟涨。	未
大基建板块午后异动，龙头山东路桥再度涨停，成都路桥新疆交建北新路桥集体跟涨。	未
大塘无数外地人踏足广州的第一个家	未
大夏书店正式开业，这里充满了华东师大的人文精神	未
大外交｜王毅今起访问印度：延续今年双边热度，为明年打前站	未
大大对毛爷爷和邓公的正确思想 定性网页链接	未
大大放缓了我推特号粉丝的增长速度	未
大大谈 我们始终坚持党对军队的绝对领导 网页链接	未
大大谈：让人民生活在天更蓝 山更绿 水更清的优美环境之中 网页链接	未
//@大头学长_:漂漂亮亮	未
大奖耳濡目染结缘体彩 机选领走868万	未
大好河山	未
大妈什么场面没见过搞笑幽默趣闻	未
大妈卖自创烧麦10元一盘，一天卖400盘，生意非常的好！	未
大妈厉害了	未
大妈在高速收费站跳起广场舞背后故事有点暖	未
大妈已完败，广场被蛇精病大叔占领广场舞再也不是大妈的专利了！大叔横空逆袭，舞姿霸气奔放，专治各种不服 ！每日笑话微博	未
大妈带30条围巾20套衣服拍照：就是要美！	未
大妈的午间讨论Topic我们比人更像鬼亚瑟摩根令你难以忘怀的游戏角色你还记得吗	未
大妈组团拦婚车要钱！谁给你们的勇气！	未
大妈：这小伙子吃啥好吃的，看起来好香！	未
大妈霸占酒店大堂跳广场舞：哎哟！政府叫我们全民健身的	未
大姐带你吃购游：12月1号开始西溪湿地又一区域免费开放，请你来命名！	未
大姐带你吃购游：芦雪纷飞 诗情画意 西溪湿地迎来芦花浓时	未
大姐//@追风少年刘全有: //@然后下面就没了://@大懒糖: //@阿瑞呀://@谷大白话:推荐关注她instagram，很阳光 //@Hao_aryu:Sarah在Instagram 上一直被杠精诟病，说她太瘦堂弟去世，为堂弟一家众筹，又被骂。我觉得这么一个瘦小的身体里，藏着一个无比巨大，坚强的灵魂。	未
大姚招聘求职本周最新最全大姚招聘求职信息汇总	未
大姚本地服务最新最全大姚汽车交易二手物品信息汇总	未
大学“严出”时代来临 中国药科大学招募学霸志愿者	未
大学城黑卡吃货节 又要来啦！！！ 12月12-14日，一张小黑卡，吃遍大学城！ 5折疯吃，全城约饭重庆高校身边事	未
大学实习医生到东安紫溪小学开展爱心义诊活动	未
大学应该注意的事为了学业顺利，同学们平时最应该关注的是安全，宿舍实验室和食堂这些重点部位，要注意防火，并掌握基本的逃生技能，平安生活，快乐学习！	未
大学开设减肥课据说当今女孩的梦想：瘦身，成家，吃天下。	未
大学排行榜科学吗？	未
大学毕业回乡创业 “90”后青年与“莓”结缘	未
大学毕业生有必要知道的25个免费论文下载网！写论文绝对用得到，马住！1.中国科学院文献情报中心中科院的学术搜索工具，标注了获取全文的都能跳转到原网页下载2.Open Access Library开放存取图书馆，致力于为学术研究者提供全面及时优质的阅读科技论文3.OATD目前索引来自1000家学术机构超过240万笔论文4.OAIster密歇根大学开发维护的一个优秀开放存取搜索引擎 ，收集了来自536家学术机构590万篇文档5.DART-Europe E-theses Portal欧洲学位论文库，现	未
大学毕业生需在工作中发掘自身不可替代性	未
大学生一定要提高警惕！	未
@大学生们 来看学霸们是如何炼成的	未
大学生原创165套中国风服装 上演本土“维密秀”	未
大学生发明采茶机器人  识别嫩芽精准度高达95%	未
大学生失眠调查 日常失眠治愈系真实雷雨声，带上耳机进来感受被窝的冰冷吧	未
大学生宣讲团招新，我们需要你！	未
大学生应该知道的11个自我提升网 站	未
大学生应该知道的11个自我提升网.站	未
大学生开诚信蒸饺店，意外收获恋情	未
大学生必备技能上班族也要保存哦 这些键盘上的小秘密，会让我们方便很多啦 微博视频	未
大学生必备软件，你知道多少	未
大学生志愿者组团宣讲“低碳环保”	未
大学生恋爱观调查：超7成认为“恋爱使学习和生活更有动力”	未
大学生恋爱观调查：超7成认为恋爱使学习和生活更有动力	未
大学生恋爱观调查：超7成认为恋爱使学习和生活更有动力近日，中国青年网对全国1498名大学生开展了问卷调查，结果显示：有2.07的大学生反对大学期间谈恋爱，认为浪费时间，影响学习近7大学生成谈过恋爱，其中超4成恋爱对象为同校道德人品和性格长相，是大学生最看重的两个恋爱条件超 ...全文	未
大学生手绘：宪法的修改如何改变你我生活	未
大学生数量剧增，第一学历和最高学历哪个更重要	未
大学生期望薪资排名前三位的依次是： 北京：平均期望薪资12992元/月 上海：平均期望薪资12070元/月 南京：平均期望薪资9771元/月	未
大学生未婚同居，到底是走肾，还是走心	未
大学生正式加入养生大军	未
大学生烈士父母生龙凤胎:望他们像哥哥一样有爱心	未
大学生烈士父母生龙凤胎：望他们像哥哥一样有爱心	未
大学生烈士父母高龄诞下试管龙凤胎：望他们像哥哥一样有爱心	未
大学生用雪造出一艘航母下雪了！看看部队里堆出来的雪人，果然是军人风范啊！这样的雪人，绝对能称霸朋友圈！	未
大学生的微信群名，90都让人心跳加速	未
大学生造出节能小车：1 升油能跑 300 多公里	未
大学生雪雕赛尽展“冬之韵”	未
【大学·第7期】中国海洋大学副校长吴立新讲述海洋科技创新、海洋强国建设与构建人...	未
大学考试＂论证西游记为自己所写＂:为激发学生兴趣	未
大学职通车与你有关！就业创业政策红包来了！5日，国务院发布关于促进就业工作的若干意见。符合条件的个人和小微企业，可分别申请最高不超15万和300万创业担保贷款支持就业压力较大地区为失业人员自主创业免费提供经营场地详戳关乎你我，转存了解！	未
大学课程上线 体现开放精神	未
大学路一号 千张图，千种色矿大的颜色在冬日的鹿园在夏日的池塘在春日的物流园在徐州蓝之下的镜湖收好这份矿大的颜色指南拥抱最美的矿大色彩	未
大学路一号 熟悉的路牌指引的是心的归处是梦想的方向每次踏上这片我爱的土地都让人心神激荡	未
【大学·预告】中国海洋大学副校长吴立新主讲	未
大宝三十年，见证“中国之造”传奇	未
大宝剑挥舞完之后，整个人都是贤者状态，完全不在乎赚钱还是亏钱。周末愉快！	未
大宝 美容日霜50g晚霜50g，券后29.9旗舰店的，早霜补水防护，晚霜滋养修护，含芦荟精华，乳木果油，让肌肤水润光滑	未
大宣传 德保交巡警大队积极参加德保县2018年《安全生产法》宣传周活动	未
大家1212打算买些什么好东西喔，来好物共赏一下 (评论里有surprise	未
大家一定要看，里面有老白和托哥，很好哭就对了。[淚]	未
大家一起参与吧，2019和王俊凯公益爱相随	未
大家一起帮忙动动小脑筋()	未
大家一起来奔跑吧！是findoc发起的为小儿癌症患者募集爱心基金的活动 如果大家一起奔跑450万公里 findoc就将捐出450万是爱心活动呀大家一起来吧	未
大家一起熱心公益，一起永遠18歲吧[好喜歡]郭雪芙	未
大家不要光顾着蹲守微博Q币，忘了今天1220游戏安全日在游戏内举报成功也是有机会每人获得100Q币的哟	未
大家中午好，上海好几天没见到太阳，今天晒的全身火辣辣	未
大家为了吉利喜庆的说法。	未
大家今年过年准备去哪儿玩呀！！！目前有没有计划！！！！梨茶话会	未
大家以后上网看求职跟职业规划方面的东西，最好不要参考在路边摆摊的人的建议，哪怕她吹牛说这是真话，你也就当她在放屁。路边摆摊的人没坐过办办公室，对职场一窍不通，听她讲求职，就好比水果摊小贩教你开飞机，这误导的太可怕了。	未
大家会不会认真地记录时间	未
大家关注的韶关综合客运枢纽项目最新消息来了！请点	未
大家再坚持一下，距离退休也就只有三四十年了	未
大家别忘记留言哦 送啦	未
大家动动小手指叭	未
大家医联公众号改版重生，为你激活更专业的医疗资讯	未
大家可以参考	未
大家周末好呀，咱家卡卡带着琦琦出游，现在还没回来呢要不咱们也来一场不可思议的动物旅途吧哔哔哔，来@长隆野生动物世界 坐空中缆车720度观赏动物，或者选择自驾车小火车，坐着观览长颈鹿斑马等动物嗯呐，泥萌的头号爱豆熊猫三胞胎正等着大家呢周末去哪儿欢乐长隆乐游长隆	未
大家喜欢吗	未
大家圣诞快乐礼物已经准备好了，你准备好了吗赞园博，今天就开	未
大家多转发多留意，望早日恢复听觉。//@环球网:希望好心人捡到归还	未
大家多转转//@鹿晗实事群:鹿晗致敬40年 高铁，当代中国闪耀的新名片，让世界感受中国速度！高铁缩短了时间，连接着我们与远方，再也不是虽不能至，心向往之，而是我心向往，说走就走。乘上高铁，平安出行，旅途愉快！	未
大家好！你们期待已久的招聘来了 合肥	未
大家好，你们的贪吃维上线了@黄-雅-琼 @郑思维---	未
大家好，我今天正式成为社畜了	未
大家好，我们是天文在线我们主要发布天文相关内容以及沙雕娱乐内容，凡是看了我们的内容，我不管，你就得关注我们！	未
大家好！我們是獅子合唱團！2016年6月5號獅子合唱團第一次跟大家見面很幸運的獅子遇到了力Q 小強 阿矩這幾位優秀熱血的夥伴很幸運的大家很快的接受獅子也很幸運的獅子一起參加歌手一起入圍金曲獎一起獲得了非常多的肯定但...很遺憾的今天 是獅子合唱團最後一次以這樣的編制為 ...全文	未
大家好，我叫乐清，这是我小时候的照片！	未
大家好，我是云南，这是我的朋友圈	未
大家好 我是肖肖的峡谷 弄混没关系 肖谷是真的 锁了1003年钥匙被我扔海里去了 谢谢大家见证我们的绝美爱情 鞠躬	未
大家好，我是虎牙特工轩子巨2兔，编号520521（直播间号），我已接受组织发布的圣诞心愿任务。各位虎牙水友，只要你在12月17日-12月22日期间评论本条微博发布你的愿望，或者在微博话题虎牙圣诞心愿写下愿望并@我本人，就有机会被我选中并且亲自实现你的愿望。快来发布愿望吧！轩子巨2兔	未
大家好，我是通县老王，一个骑哈雷的厨子。	未
大家好，我是陇东报全媒体，今天我为自己代言！	未
大家好！我来问一下重庆必须打卡的地点和美食店有哪些！下周去两天！我想做做攻略争取把时间都利用上！	未
大家好，我给大家跳一段 微博视频 欧巴欧巴欧巴巴 (Remix)	未
大家好，疯狂购物记录都看了吗	未
大家好这是周末放假的你	未
大家好，这是我的新身份：天津市文化和旅游局！	未
大家如何评价伯恩利1-3利物浦这场比赛54分钟，科克62分钟，米尔纳，奥里吉助攻69分钟，菲尔米诺，范戴克助攻91分钟，沙奇里，萨拉赫助攻	未
大家如何评价切尔西0-1莱斯特城这场比赛51分钟，瓦尔迪，麦迪逊助攻	未
大家如何评价切尔西2-0曼城这场比赛45分钟，坎特，阿扎尔助攻78分钟，路易斯，阿扎尔助攻	未
大家如何评价南安普顿3-2阿森纳这场比赛20分钟，1-0，丹尼英斯，塔尔盖特助攻28分钟，1-1，姆希塔良，蒙雷亚尔助攻44分钟，2-1，丹尼英斯，雷蒙德助攻53分钟，2-2，姆希塔良，拉卡泽特助攻85分钟，3-2，奥斯汀，肖恩朗助攻	未
大家如何评价曼城2-3水晶宫这场比赛27分钟，1-0，京多安，德尔福助攻33分钟，1-1，施卢普，麦克阿瑟助攻35分钟，1-2，汤森51分钟，1-3，米利沃杰维奇85分钟，2-3，德布劳内，B席尔瓦助攻	未
大家如何评价曼联4-1富勒姆这场比赛13分钟，1-0，阿什利杨28分钟，2-0，马塔，拉什福德助攻42分钟，3-0，卢卡库，马塔助攻67分钟，3-1，卡马拉82分钟，4-1，拉什福德，阿什利杨助攻	未
大家如何评价欧冠16强抽签结果曼城VS沙尔克04曼联VS巴黎热刺VS多特蒙德利物浦VS拜仁里昂VS巴萨罗马VS波尔图马竞VS尤文图斯阿贾克斯VS皇马	未
大家如何评价狼队2-1切尔西这场比赛18分钟，齐克，阿扎尔助攻59分钟，希门尼斯，吉布斯怀特助攻63分钟，若塔	未
