周末走起跟着主持人老娘舅去文成嬉嬉喽！观百丈漈飞瀑体验畲族民俗活动，含畲家宴	未
周末趁阳光正好！去宁海最高峰东海之滨走一走吧	未
周末跟我走！带你与崂山的多彩时光相遇	未
周末路况播报 11时，东湖公园举行深圳市第34届菊花展，周末人流车流较大，请前往的市民选择绿色出行	未
周末路况播报 8时至14时，2018深圳国际马拉松赛，在市民中心南广场和深南大道罗湖福田南山双向路段举办，期间，将对相关道路实行交通管制措施，在此提醒广大市民提前规划出行路线。	未
周末路况播报 8时至14时，2018深圳国际马拉松赛，在市民中心南广场和深南大道罗湖福田南山双向路段举办，期间，将对相关道路实行交通管制措施，在此提醒广大市民提前规划出行路线	未
周末逛街指南丨全银川商场优惠信息都在这里了，还有超赞的美食节！	未
周末逛超市，在这人山人海的地方，买点什么好呢 我要上热门@JK珺珺珺 的一直播（下载App-gt网页链接）	未
周末遛娃新去处！成都首个儿童交通友好社区已建好，快去！	未
周末金弹汇	未
周末阅读印度兴起婚礼旅游 外国人花钱就能观礼	未
周末阳光@狂龙十八段 的一直播（下载App-gt网页链接）	未
周末马上来了 去哪儿嗨cars01豪车拍汽车V峰会	未
周末驾到  想河你在天津，来一场博物行	未
周村人想找专业家政保洁家电清洗，请看这里！过年不涨价，预约优惠多！	未
周村帮手机维修，iphone系列品胜电池最低只要60元！	未
周杰伦平安夜晒与儿子合照 父子俩嘟嘴卖萌	未
周杰伦感慨18年前写《斗牛》如今圆梦同台易建联	未
周杰伦撞脸小刺猬近日有粉丝po出一张周杰伦 与小刺猬的照片，令人忍俊不禁你觉得周董像可爱的小刺猬吗	未
周杰伦男粉丝演唱会求婚感性告白 女友神回复	未
周桂生：献身革命 矢志不渝	未
周榜  2018.11.18-2018.11.24河北旅游微信影响力排行榜	未
周榜要不要呢//@一位小肥:看了绝美哥哥 有人想再为他花点表达爱意吗//@一位小肥:可以的话 争取今天追上 明天守榜 不要太被动啦 我们一起冲	未
周永康、薄熙来、孙政才等9虎罕见同框！	未
周汉民：“一带一路”是让中国融入世界	未
周海江：创立党内关爱基金，就是想尽一名党员的绵薄之力	未
周润发王祖贤早年合影	未
周润发王祖贤早年合影周润发和王祖贤是什么神仙组合，男靓女美的合影看起来也太心旷神怡了吧，周润发和王祖贤都惊艳了时代的人啊[给你小心心][给你小心心][给你小心心]。	未
周润发王祖贤早年合影 周润发王祖贤早年合影，感慨那些没有修图的年代。	未
周润发王祖贤早年合影好好看！据悉该照片是1988年俩人拍摄电影长短脚之恋时照的，发哥有点呆萌feel，王祖贤 笑的好像漫画美少女话说我也有类似的黑框眼镜，但戴上完全不是一个效果只能说有颜就是任性美图洗眼	未
周润发王祖贤早年合影 当年的小马哥和小倩，真的纯天然的帅和美	未
周润发王祖贤早年合影感慨时光过得太快了，周润发王祖贤多少80年们心中的男神和女神呢你们怀恋不	未
周润发王祖贤早年合影曝光！两人同戴黑框眼镜，十分青涩！	未
周润发王祖贤早年合影曝光(图1)，看这个黑框眼镜的造型，应是二人在拍摄电影长短脚之恋(1988)时照的	未
周润发王祖贤早年合影没有美颜的时代，王祖贤真的好看周润发真的帅！年轻时的一张合影勾起了所有人对过往的一切回忆！	未
周润发王祖贤早年合影 王祖贤不加修饰的美！ 微博视频	未
周润发王祖贤早年合影，王祖贤真是赤木晴子本人了！	未
周润发王祖贤早年合影 谁还没有年轻过呢二十岁到三十岁一个人最好的时候	未
周润发谈捐身家原因热心市民周润发全副身家56亿做慈善！一句话令人动容。给发哥点赞 热心市民周润发全副身家56亿做慈善！	未
周游世界	未
周炳耀：村民的好支书	未
周煊说  山水平度 :天柱一峰擎日月	未
周王朝发源地，竟在冬季美成仙境，还藏着n多徒步胜地，太低调。不止旅行 v影响力峰会 @微博旅游	未
周知！500张火车票免费送，打电话就可报名	未
周知丨郓城1社区3个村入选山东首批森林乡镇森林村居！有你的家乡吗	未
周知扩散！鄂州这所贯通三区的收费站终于通车啦！	未
周知！正源街等3条公交专用道即将启用！	未
周知//@疯哥了不敌:又出名了@唐山全攻略	未
周知！青岛人才引进落户办理有新变化	未
周礼清：禁毒战线上的医者仁心 平安英雄评选候选人	未
周立波独家专访！道出背后不为人知的秘密！	未
周立波近照曝光 现身纽约与朋友驾车出行	未
周精选石景山第二条地铁大线6号线西延各站高清大图全曝光！	未
周精选石景山金安桥站6号线换乘区域首次曝光！还有多个好消息！	未
周耀旗：蛋白质结构预测的重大突破蛋白质是生物细胞内的分子机器，要想知道蛋白质是怎样工作的，就必须知道机器的结构。如果这个蛋白在某个疾病中起关键作用的话，有了它的结构，就可以设计药物分子来抑制它的功能，这就是为什么用实验方法来解出蛋白质结构出了无限多的Nature，Science，Cell及众多个诺贝尔奖。但 ...全文	未
周聚点郑州师院新鲜事儿	未
周至暖冬行动--关爱大山深处留守老人	未
周至猕猴桃再次火了！5000 吨价值1.08亿元，鲜销呼和浩特	未
周至高速都开到缅甸了...歪的很！	未
周良辅院士工作站落户福州	未
周英明：独臂哥与羊共舞，年收入50万元	未
周蓬安：秒退押金，ofo也崇尚洋人优先(同步自@新浪看点)周蓬安：秒退押金，ofo也崇尚洋人优先	未
周蓬安：高学历棒棒，社会不该提倡(同步自@新浪看点)周蓬安：高学历棒棒，社会不该提倡	未
周觅新歌《寂寞烟火》今天公开音源	未
周详总队长带队赴南京检查易燃易爆企业消防安全并约谈相关人员	未
周边CCTV：大美中国 甘肃临夏	未
周边丨温州首届热气球美食嘉年华盛大开幕！ 快来体验飞行之乐吧	未
周边游仙游县菜溪岩风景区	未
周边社区密集！日照新形成了大连路商业圈！	未
周边补款啦，请不要错过时间哦	未
周重林说书出视频啦	未
周锐Jeffrey公益活动合体颁奖 小沈阳温碧霞获肯定	未
周锐[超话] 正能量的小锐未来可期，123公益日 和@周锐Zee 一起，公益起来[米奇比心]@新浪公益 123链起来	未
周震南 约//@Vin周震南:穿过久侯的森林，遇见这个冬天的周震南。 12月30日哇！2019明日闪耀夜 我们的聚会，你们的狂欢，到时见	未
周鸿祎首度尝试电影配音 混搭华少演绎《甲方乙方》	未
味道煮夫胡萝卜鸡蛋卷饼，孩子超爱吃的早餐	未
味道纯纯，尽享纯甄 各位宝宝们，又到了一年一度最重要的时刻啦！春运回家该提上日程的时候咯记得随时关注售票信息哟	未
味道纯纯，尽享纯甄 报报告！小甄被一群红西柚团团围住了！！他们难道要搞事情	未
味道纯纯，尽享纯甄继上次穿秋裤之后，气温竟然开始回！暖！惹！不过各位小可爱千万不要嘚瑟，注意保暖，才能预防感冒哟	未
呵呵，别问我股票华尔街有句话，得罪人最快的方式就是给他推荐股票职业和业余，最大的差别还是风险控制	未
呵呵，南京的小杆子！	未
呵呵据广州日报讯 （全媒体记者 张喆）国足新一期集训日前在海口竖旗，这是球队出征2019年亚洲杯前的最后一次集训。据悉，与以往磨合技战术为主的集训不同，这次集训将安排大量体能特训，目的是让国脚在亚洲杯赛场上至少不会跑输对手。	未
呵呵，现在炒股的在微博推广有了新花样，给你留言:微博我只看您和某某某，真棒。呵呵。除了我居然还看别人直接拉黑删除留言。	未
呵呵红红火火呵呵哈哈哈呵呵红红火火 查看图片	未
呵护人体的第二个心脏！爱享生活 轻巧省电！有了它，开始一场说走就走的旅程吧！	未
呵护点滴善念，让爱心的种子生根发芽	未
呵，最高温也才-4今天北京将度过一个非常冷的大雪节气	未
呸，你才勤劳，你祖宗八代都勤劳！	未
呸！媳妇那么好看你竟然只顾着做模型！//@黑暗王朝: 以前我也这样...后来开始做模型....	未
@呼伦贝尔人，您有一个红包未领取！	未
呼伦贝尔全国雪地摩托车越野挑战赛落幕	未
呼伦贝尔国家级经济技术开发区提速开放脚步	未
呼伦贝尔海拉尔区：区域共建“活水”促城市基层党建枝繁叶茂	未
呼伦贝尔牙克石交警推出酒驾VIP套餐，速来了解详情！	未
呼呼青年力量践行公益 推动尘肺病防治宣传//@陈雪-大爱清尘: 转发微博	未
呼和浩特7月8日将迎来两大节庆活动	未
呼和浩特 草原青城更宜居	未
呼和浩特免费发放宠物犬嘴套牵狗绳内蒙古自治区呼和浩特市开展文明养犬专项整治行动，新城区街道办事处给辖区养狗居民免费发放宠物犬嘴套牵狗绳等用品，防止狗伤人情况发生。据悉，该社区还在居民楼张贴《致养犬居民的一封信》，倡导居民遛狗时牵狗绳给狗戴宠物犬嘴套。网页链接	未
呼和浩特免费发放宠物犬嘴套牵狗绳内蒙古自治区呼和浩特市开展文明养犬专项整治行动，新城区街道办事处给辖区养狗居民免费发放宠物犬嘴套牵狗绳等用品，防止狗伤人情况发生据悉，该社区还在居民楼张贴致养犬居民的一封信，倡导居民遛狗时牵狗绳给狗戴宠物犬嘴套网页链接	未
呼和浩特又新增821个车位   快看看在哪	未
呼和浩特后花园中的明珠——内蒙古少数民族群众文化体育运动中心	未
呼和浩特市绿地局推进西部城区绿地精细化管理，构建绿意盎然的城市环境	未
呼和浩特—柬埔寨暹粒直飞航线开通	未
呼和浩特 草原青城更宜居	未
呼和浩特：草原青城更宜居	未
呼和浩特 草原青城更宜居（庆祝改革开放40年·百城百县百企调研行）	未
呼和浩特：迈向经济发展先行区	未
呼唤亲情关怀 培树感恩心态涿鹿监狱成功举行亲情帮教活动	未
//@呼唤归来重生: 转发微博	未
呼唤生态治理现代化(图)	未
呼唤生态治理现代化（新时代新步伐）(图)	未
呼市稍美暖人心(图)	未
呼市规划建设高铁西站和林格尔新机场，力争明年开工	未
命大！醉汉从10米高楼层跌落神奇保命，这些急救贴士不得不看！	未
命好不好看哪里嘴	未
@命律MAINLOOP X @食货星球stareat 广州圣诞集市活动来了，这个周末打卡必去！12月22日-24日，一起相约广州花城汇22日中午14:00到晚上22:00...23日早上10:00到晚上22:00 ...24日早上10:00到晚上21:00 连续三天今年zui不一样的圣诞主题美食集市边买边吃边玩！在广州的吃货们，我在命律主题展区等你	未
命最好的亡国之君，亡国前是傀儡，亡国后却拥有了真正的权力	未
命理婚姻走势破解婚姻危机 把握属于自己的幸福婚姻	未
命运以痛吻我，我要报之以歌：先天无臂小伙销售冰糖橙照顾病重母亲，这个坚强孝顺的年轻人需要您的支持！	未
命运多舛却连创第一 这位美国华裔又将成为首名任内产子参议员	未
命运对奇特天赋并不悭吝博尔赫斯	未
命运的抉择——改革开放40周年回顾与思考	未
《命运石之门》10周年LOGO公布AVG神作《命运石之门》将于2019年迎来系列10周年纪念，官方在推特发布了纪念Logo。并在推文中表示：请期待之后的更多内容。也许会有新作推出也不一定。今天正巧是《命运石之门》男主冈部伦太郎的生日，看来这一切都是命运石之门的选择	未
《命运石之门》合集将登Switch外媒消息，日本零售商友都八喜BICCAMERA在其各自官网上架了《命运石之门：Divergencies Assort》，本作为该系列合集，收录了《命运石之门0》《命运石之门：比翼双飞的恋人》《命运石之门：线形拘束的表征图》三部作品，将于2019年3月20日正式发售。	未
咁识撩女，D女俾你沟晒咯！	未
咁识撩女，D女都俾你沟晒啦！	未
咋事儿啊小老弟//@我宇太阳肩并肩:好嗨呦//@渣蜀黍:快手网红学院了//@外国快手系列:好骚啊//@黑皮大叼刘巧巧:哈哈哈哈哈	未
和32位展会上的人聊完后，这些变化点赞最多	未
和@angelababy 一起使用微博定制相框参与我承诺不用穿山甲通乳行动，让极其濒危的穿山甲可以迎来一丝生存的曙光	未
和@Missooorange早上8:30进故宫，这时候的人特别少，空旷的广场气派的建筑，真有一种静静穿越的感觉	未
和TA一起用起来吧！	未
和@万茜 一起用关爱终止流浪，让我们给小动物们一个温暖的家星光公益力	未
和上海限定48小时情缘上海	未
和@不入shicai 喜相逢，一起过夏天	未
和东莞日报一起叹世界，穿越渝湘桂黔四地	未
和中国人打交道，能感受到温暖	未
和之前一样，官方宣布2019年1月1日元旦东京OP塔再次免费开放！宣传图如下。讨论地址 在微博评论区	未
和亲爱的ta一起出去玩吧	未
和人靠一颗心，情与情靠一份真	未
和以往一样，珞妮慢慢地享用她的飞机餐如果飞机在空中飞行两个小时，她有一半的时间在用餐如果飞机经停之后重新起飞飞两个小时，如果还有配餐而不是零食，她还会慢慢吃至少一小时本次航班的空乘姑娘一趟一趟走过，其实是在看珞妮吃完没有估计后来实在忍不住了，采取了高情商的策略，她问珞妮 ...全文	未
和你们分享一个我最近天天在玩的Ta在。是一个AI驱动的平台，Ta的使命是为你找到喜爱的内容和知音。我很喜欢它是因为，现在朋友圈微博已经不敢随便发东西了，即便我微博小号也不敢随便发了，因为上面有好多朋友同学还有同事。就不知道该说些什么。但是Ta在不一样！在这里，你可以只看你感兴趣的内容，不感兴趣的可以直接无视，也会自动给你匹配到与你喜爱的内容相似的小伙伴！特别暖心。而且就是，你的互动成果都会通过Ta在指数和评论区下方的兴趣相关呈现出来。当Ta在指数达到500以上时，你的Ta在页面	未
和你们说实话：拍完时尚达人那条伸腿的视频，我可以负责任的告诉大家：我直到昨天，除了吃饭和上厕所，腿酸得我基本没下床。就在今天，我得知深圳强性降温，一年来最冷的一天。我躺不住了，我要出去走一走，我觉得是时候给深圳人民看看我1500买的加拿大鹅了。	未
和你能快乐相处，但不影响我的喜欢独处不是没你不行，但是有你更好。。。--这就是我的爱情观。友情也适合。 「情感」	未
和使馆君一起逛日本东北地区首屈一指的结缘神社熊野大社距JR奥羽本线赤汤站车程约15分钟左右的地方有一座以结缘著称的神社熊野大社，它与和歌山县的熊野三山长野县和群马县交界处的熊野皇大神社并称日本三熊野，元旦期间会举办岁旦祭，每年约有6万的游客在新年前来参拜。据神话传说，熊野大社的男女神是日本首对求婚结合的神。男神向女神求婚，两神结合。在本殿内侧的刻柱上隐约雕刻了三只兔子，兔子自古以来就被称为结缘的动物，所以大家认为只要找到全部3只兔子，就可以实现	未
“和光同尘”张凡、提俊丰书画展在宿迁市博物馆开幕	未
//@和光者:人类的飞跃//@和光者:老激动了，老板老泪纵横，心仪苍穹	未
和@刘子鹤 一起用爱守护和平，缅怀所有遇难同胞星光公益力	未
和医生朋友最舒服的相处方式	未
和单位小哥哥一起健身 微博视频	未
和卫星联合是物联网的大趋势，华米科技是真的有勇气 华米科技首颗卫星升空，探索基于卫星通讯的紧急救援服务 ，这应该是智能穿戴领域的第一次试水么	未
和各位有趣的人一起聊故宫以东 ，才发现我们生活在一座宝藏城市，这里有传承的文化有说不完的故事，有人要和我一起去探索的故宫以东的风景！！不止旅行 北京	未
和合乡卫生院健康扶贫纪实，和合人你有发言权，你享受了吗	未
和@周冬雨 一起相信小的伟大，帮助贫困儿童，让这个冬天不再寒冷。泰洋星公益	未
和喜欢的人一起去旅行。早安牛人们	未
和喜欢的人去高原，经历一场身心考验小小莎老师 旅行灵感季 旅行新势力 @新浪旅游微博视频 秋冬漫时光	未
和喜欢的人来一次极光旅行	未
和天空合个照	未
和奥运火炬、吉祥物来一场零距离接触吧！2018年全民健身文化推广巡展开启	未
和妹妹一起去温泉旅行吧	未
和@孙艺宁Amy 一起爱公益，爱志愿星光公益力//@大学生知行计划:青春在一起 国际志愿者日 有爱的人最美 和@孙艺宁Amy 青春在一起 ，给大学生志愿者打电话	未
和小伙伴们去旅游 这样拍才有趣 微博视频	未
和小伙伴们约起来吧	未
和小耳朵@米咪Nicole 一起关爱女性自信健康，关注女性问题，关注她公益//@她公益:她公益挑战PADMAN 关爱女性自信健康 尊重性别差异，一起做自信健康美丽女性	未
和平不易！叙利亚首都民众时隔多年再迎圣诞节气氛	未
和平世界佛涛师生书法摄影展在京开幕	未
@和平人注意！12月新规来了，这条规定最高可奖60万！	未
和平方舟医院船将赴11国访问并提供医疗服务	未
和平方舟圆满结束智利友好访问起程回国执行和谐使命-2018任务的中国海军和平方舟医院船8日圆满结束对智利的友好访问，离开瓦尔帕莱索港起程回国和平方舟参加了智利海军成立200周年庆典国际海军阅舰式活动，与多国海军水面舰艇潜艇和飞机同台亮相智利总统皮涅拉出席活动并检阅，数以万计 ...全文	未
和平方舟首次友好访问智利，专程赶来参加这项活动	未
和平永存！	未
“和平许愿墙”现身南京地铁站 活动持续10天	未
和平车主快看！查酒驾时间表新鲜出炉！就在...	未
和平饭店老菜单流出蒜油石斑鱼，每500克130元清蒸石斑鱼，每500克130元这两天，一张像素并不清晰的菜单出现在互联网上。据悉，这张菜单来自和平饭店内的博物馆，记录了上世纪90年代初和平饭店的菜价。通过这张菜单，有心的网友算了一笔账后惊叹：想不到近30年前的海鲜价格比30年后还贵 ...全文	未
和@微博公开课 一起回顾V影响力峰会 各领域发展趋势行业分享大咖成长经验！为你聚合所有干货内容	未
和心爱的人一起来场说走就走的旅行。	未
和心爱的人呆在这儿晒晒太阳，喝喝下午茶，看下远处的雪山，就可以很满足！	未
和忒逗合作的零食盒上市了有水蜜桃干 amp 桃子乌龙茶两种礼盒，戳宝贝详情 get小哥哥同款零食盒	未
和我一起，为TA发声 唐嫣用声音传递爱心，愿那些在生命中艰难前行的人能够重拾希望。在此，@凤凰网-音乐呼吁更多的爱心人士共同参与 @海豚智音官博 一分钟音频录制活动，给需要帮助的人捐出爱心！关注 @海豚智音官博 @凤凰网-音乐转发并艾特1位好友，12月12日抽1个幸运鹅送50Q币礼品一份！请看评论区	未
和@星光公益联盟 一起，助力世界艾滋病日活动，消除误解和歧视	未
和昨天一样zfb 搜581217509有大红包哦，截图谁红包最小请一杯奶茶顺便转发这条抽5个请喝一点点，一小时后就开	未
和智能AI一起玩游戏是怎么样的体验呢今晚7点直播间会到来两位神奇的嘉宾 ，我们一起畅游王者峡谷吧！王者荣耀腾讯智能英雄梦之泪伤	未
和最爱的人一起，去希腊圣托里尼岛看一次爱琴海的日落吧！	未
和最爱的人一起，去希腊圣托里尼岛看一次爱琴海的日落吧	未
和杨洋一起旅行的第二天，我们坐在草地上互拍。	未
和梅西一起踢球是你的梦想。现在，你能做到了。感觉怎么样?  亚瑟：幸福与疯狂的混合体。不久前，当我看到他在电视上踢球，我正在想象着这一切。	未
和歌山县白滨海三叠敷熊野古道和中华拉面。	未
和歌山县白滨海三叠敷熊野古道和中华拉面	未
和火星“谈心”：美国宇航局“洞察”号首席科学家详解探测器	未
和火星“谈谈心”——首席科学家详解“洞察”号探秘火星	未
和@炎亞綸_AaronYan 一起，拥抱慈善的力量，见证爱心的传递。//@轻松筹:星星眼@炎亞綸_AaronYan ，北京见，听说小哥哥有特别环节哦123公益日 和炎亚纶 一起，拥抱慈善的力量，见证爱心的传递。 123链起来	未
和熊一起野餐过休息日不错的方式是去野餐。但是如果朋友们都很忙没时间的话，那么你可以和熊一起。网页链接	未
和爱的人一起丽江旅行，一家环境好的民宿绝对不能忽视...	未
和田今早下起小雪......分享三个和田本地暖心小故事！	未
和男朋友的周年纪念 怎么样能特别一点	未
和眼镜说再见！有哪些犀利的护眼方法每五个中国中学生，有四个人近视近视曾是少数书生的特权，如今变成了普通中国人的标配眼保健操小孔眼镜...真的有效吗什么才是护眼界的霸主戳链接告别眼镜！和眼镜说再见！有哪些犀利的护眼方法	未
和美医疗公告：基因编辑婴儿突破人类底线，从未参与任何环节	未
和@美食家大雄 来吃一家逼格满满的下午茶，门口迎宾跟我说的洋文都一水的伦敦腔	未
和群众在一起把群众事牢记心头  让真情永存心间	未
和群众在一起银装素裹 冬日暖阳 让真情服务涌入心田	未
和老公的回忆邮箱	未
“和而不同书画汇”2018首尔巡展开幕	未
和菜头先生，我是四川绵阳的天使阴小猪，很幸运你之前发过我女儿的作文她现在上高三了，这是她9月30日写的，真希望你看到求指点@和菜头	未
@和菜头  希望菜头叔能给指点一下江湖儿女江湖老：菜园街头的流浪猫们  江湖儿女江湖老：菜园街头的流浪猫们	未
和警察合影不要站中间不要抱手C位不是什么合影都是最好的	未
和警察合影不要站中间不要抱手切记！！！	未
和警察合影不要站中间不要抱手 论跟警察合影的正确姿势这个问题是个伪命题，你看撒老师，站c位也不违和吧，其实关键还是看气质！	未
和谁在一起，的确很重要 (深度好文）	未
和谁在一起舒服，就和谁在一起	未
和谐号动车组首秀宜宾，以后绥江朋友出门可到宜宾坐动车咯！	未
和钱打交道他们这样超越你	未
和闺蜜们一起去旅行的乐趣想想就会嘴角上扬的幸福感	未
和陈坤一起高原雨中徒步，是什么体验旅行灵感季 旅行新势力 小小莎老师 @新浪旅游微博视频 秋冬漫时光	未
和雷探长一起，去看世界另一个尽头的风景。	未
和静县公安局民警战风雪斗严寒，力保受困群众平安	未
和风徐来地，山水宜居州！明天，《潮起扬子江》走进咱徐州！	未
和鸟兽过元旦丨元旦活动总览	未
“咏叹真善美，是歌剧的永恒主题”——访著名指挥家张国勇	未
咏春拳的精髓 看这位老人的这几招！	未
咕力儿歌《拉便便歌》	未
咕咕熊烤冷面500x2袋 卷后9.9（拍下减） 看着好香的样子呀！2袋大约有20片！	未
咕咚与YYsports胜道体育达成合作 围绕商品销售与赛事运营等方面开展	未
咘咘睡前指定要“他”！贾静雯爆料：深得咘姐心	未
咚了龙动强东强	未
咦交警蜀黍怎么为他们点赞	未
咦，小耀丸们登陆游戏的时候有没有发现什么特别的地方鸭想看我的，企鹅电竞62200等你来哦企鹅电竞耀神 耀神 王者荣耀	未
咦，意外发现微博钱包还有点钱，我寻思着年底了也全给你吧赞吧，明天抽个小姐妹，送你啦	未
咦，这个记者好像很清秀啊，皮肤很光滑细腻的说，我都忘记权健火疗是什么东西了，光看记者去了。	未
咩咩咩如皋吴窑镇举办首届山羊文化节	未
咩地方呀，咁高消费噶！	未
