华为回应5G报道：全球经营整体稳健，已获25个商用合同12月19日，针对近日华为5G的相关报道，华为公共及政府事务部发布公告称，部分报道与事实不符，或被错误解读，公司目前全球经营整体稳健。尽管遇到了较大的外部压力和困难，但在商业上仍然取得了不错的成就，现已获得25个5G商用合同，并与全球50多个商业伙伴签署合作协议，5G基站商用发货量已超过10，000个，行业内遥遥领先。	未
华为回应孟晚舟保释：期待美加政府及时公正结束此事！据报道，当地时间11日下午3点多，加拿大不列颠哥伦比亚省高等法院的法官宣布，准许孟晚舟女士获得保释。为此，华为官方回应称：期待美加政府及时公正结束此事..	未
华为回应孟晚舟保释：期待美国和加拿大政府及时公正结束这一事件华为表示，相信加拿大和美国的法律体系后续会给出公正结论。华为一直强调，遵守业务所在国所有适用法律法规。华为期待美国和加拿大政府能及时公正结束这一事件。	未
华为回应近期5G相关报道：全球经营整体稳健华为公共及政府事务部今日发布了一则公告《近期媒体对华为5G相关报道的情况说明》，《说明》中称，最近一段时期，媒体上频频出现华为5G的相关报道，部分报道与事实不符，或被错误解读，在此特别给大家说明一下情况。(IT之家)	未
华为孟总5天前就请迎接一位新的鹰派之王贸易代表-莱特希泽！	未
华为孟晚舟事件只会激发更多斗志，科技从业者当自强不息！	未
华为官方回应孟晚舟获得保释 。 查看图片	未
华为将担任中电标协数据管理应用推进分会重要角色，背后的逻辑是什么	未
华为就孟晚舟获保释发表声明：期待美加政府及时公正结束此事华为表示，相信加拿大和美国的法律体系后续会给出公正的结论。华为一直强调，遵守业务所在国的所有适用法律法规，包括联合国美国和欧盟适用的出口管制和制裁法律法规。期待美国和加拿大政府能及时公正结束这一事件。华为就孟晚舟获保释发表声明：期待美加政府及时公正结束此事	未
华为就孟晚舟获保释发表声明：期待美加政府及时公正结束此事华为表示，相信加拿大和美国的法律体系后续会给出公正的结论华为一直强调，遵守业务所在国的所有适用法律法规，包括联合国美国和欧盟适用的出口管制和制裁法律法规期待美国和加拿大政府能及时公正结束这一事件央视新闻客户端 ...全文	未
华为手机2018年全球发货首破2亿台	未
华为抖音罗永浩同获奖，200媒体人共选行业年度大事	未
华为拿下葡萄牙5G订单！	未
华为接受英国5G网络要求欧洲态度最强硬的就是英国。英国同意华为进入其市场，意味着欧洲市场已经被华为占领。三分天下，中国5G独得亚洲和欧洲，已占其二。留下美国死守本土，偏安一隅。也难怪美国撕破脸面要来横的。但所谓无可奈何花落去，美国这样做只是让全世界都看清了美国的衰弱和落魄，反而会加速其衰落和解体！	未
华为新广告又火了，看完哈哈哈哈哈哈哈哈哈哈哈哈	未
华为新款智能手机登陆日本	未
华为旗下双品牌获天猫“双12”销售双冠	未
华为智能穿戴品鉴会：为运动达人量身定制多款产品(图)	未
华为最技术媒体amp花粉见面会正式开始！华为消费者BG软件部总裁王成录博士登台，与我们分享了EMUI的升级历程和规划，并带来了又一项引起现场欢呼的黑科技Link Turbo全网络聚合加速技术 转发今天华为最技术系列微博，从转发量最高的微博中抽粉丝送华为Mate 20手机！	未
华为梁华：感谢外界关心孟女士和华为25日上午，华为技术有限公司董事长梁华在深圳坂田华为总部接受第一财经等媒体专访时回应看了CFO孟晚舟日记的感受，人间自有真情在quot，也感谢外界对孟女士和华为的关心。第一财经记者注意到，现场就摆有灯塔在守候，晚舟早归航文案的咖啡杯，更早的几天里 ...全文	未
华为游戏中心：至2019年Q1，新游预约数近350款，谁将引爆新的一年	未
华为湘江夜空200余架无人机上演灯光秀：nova 4明日发布 今天晚上，华为在长沙的湘江上空用200多架无人机上演了精彩的灯光秀，展示了nova 4的极点全面屏等要素，效果相当炫酷，一起来看一下吧详情点击：华为湘江夜空200余架无人机上演灯光秀：nova 4明日发布	未
华为湘江夜空200余架无人机灯光秀	未
华为澄清：全球经营整体稳健 已获25个5G商用合同	未
华为的冬天可能来得更冷，更冷一些。我们还太嫩，我们公司经过十年的顺利发展没有经历过挫折，不经过挫折，就不知道如何走向正确道路。磨难是一笔财富，而我们没有经过磨难，这是我们最大的弱点。我们完全没有适应不发展的心理准备，与技能准备。2001年。任正非发表华为的冬天。至今很多话语令人感动。	未
华为的冬天可能来得更冷，更冷一些我们还太嫩，我们公司经过十年的顺利发展没有经历过挫折，不经过挫折，就不知道如何走向正确道路磨难是一笔财富，而我们没有经过磨难，这是我们最大的弱点我们完全没有适应不发展的心理准备，与技能准备2001年任正非发表华为的冬天至今很多话语令 ...全文	未
华为的秘密：5G与7000亿7000亿5G，一个代表规模，一个代表技术对企业来说，规模和技术同样重要只有规模，没有技术，大而不强只有技术，没有规模，强而不大华为恰恰是既有规模，又有技术，真正的强大7000亿5G，一个注解现在，一个昭示未来体量巨大的规模效益，让华为拥有稳定的现金 ...全文	未
华为的经营管理精髓是如何建立的	未
华为研发新系统，不是基于安卓，你们觉得它会成功	未
华为终端云服务近日将数字生活旋风刮到了杭州。「DigiX Talk」解说音乐黑科技，让手机化作随身音乐厅。「DigiX读书会」倡导全民阅读，华为阅读致力打造随身图书馆。「DigiX数字生活实验室」让更多用户体验科技的魅力，共享智慧果实。感谢大家的喜爱，不断突破只为更美好的生活。[加油]	未
华为网络能源：点亮数据中心未来的“诗与远方”	未
华为老兵：我所知道的孟晚舟曾激励父亲到深圳闯荡	未
华为致供应商一封信，苹果年度颁奖典礼，京东开始种菜	未
华为致胜，依然要靠苦练内功！任正非一个多月前的讲话任正非在一个多月前的讲话中说：打赢这一仗，才能获得未来二三十年的和平 没想到，这次的挑战来得如此之大！但是，这一仗依然要打赢，必须要打赢！而且，打赢的核心支撑，依然是苦练内功！！！	未
华为荣耀做了一个叫荣耀亲选的电商平台。看名字和小米有品简直是对仗了	未
华为荣获CNVD漏洞信息报送及应急工作双料突出贡献单位称号！	未
华为获准在印度进行5G测试 印度运营商协会力挺	未
华为获得25份5G商业合同 5G基站发货数超1万个	未
华为董事长：将投入20亿美元构建产品安全体系	未
华为董事长梁华:不赶风口 基础研究是产业振兴的根本既然单纯依靠给生产以机器难以进一步解决提升生产效率客户服务体验和企业运营效率的诸多问题，这就需要给机器赋予新的引擎给机器以智能，让机器拥有语言视觉逻辑分析数据处理身体运动等能力，通过智能机器来进一步释放生产 ...全文	未
华为董事长梁华：困难与挑战只会让华为更坚强今天，大家每人桌子上放了一个杯子，就是园区咖啡厅的员工自发做的，上面印着灯塔在守候晚舟早归航，表达了他们的关心。我本人与孟晚舟共事20多年，当然十分挂念她。从公司运作来看，我们就是聚焦业务服务好客户。困难和挑战只会使我们更坚强。在复杂多变情况下，华为既要活下来，还要抓住机会成长。（华为）华为董事长梁华中国媒体圆桌实录：困难与挑战会让华为更坚强	未
华为董事长梁华：获得26个5G商用合同，未来将投入20亿美元构建安全体系12月25日上午，华为技术有限公司董事长梁华在深圳华为总部，对外界质疑的安全问题5G布局未来业务转型等诸多热点问题进行了回应。饱受安全问题质疑的华为5G业务，在全球的进展正遭遇阻碍，今年以来，美国澳大利亚 ...全文	未
华为董事长梁华：获得26个5G商用合同，未来将投入20亿美元构建安全体系12月25日上午，华为技术有限公司董事长梁华在深圳华为总部，对外界质疑的安全问题5G布局未来业务转型等诸多热点问题进行了回应。饱受安全问题质疑的华为5G业务，在全球的进展正遭遇阻碍，今年以来，美国澳大利亚等国陆续宣布弃用华为的5G设备。尽管遇到外部压力，华为在商业上仍取得了不错的成绩。目前，华为已获得26个5G商用合同，与全球50多个商业伙伴签署合作协议，5G基站商用发货数量也已经超过10000个。梁华说道。华	未
华为董事长谈孟晚舟事件:一切正常 将继续练好内功	未
华为董事长谈孟晚舟事件：公司运作正常 将继续练好内功	未
华为霸气回击：美国用都没用过 拿什么证明华为不安全欲加之罪何患无辞，美帝险恶用心是司马昭之心，面对美国为首的五眼联盟恶意抹黑，华为忍无可忍，近日频发强势回应。继上周（14日）华为新西兰CEO范岩在《新西兰先驱报》发布署名文章后，华为轮值董事长胡厚崑在18日的国际媒体记者会上继续用事实说话，并点名美国：在美国华为设备使用接近于零，拿什么证明华为设备是不安全的呢 华为轮值董事长胡厚崑18日在华为位于东莞的园区召开了一次国际媒体新闻会。华为本次召集了邀请了《纽约时报》《华尔街日报》美联社法新	未
华丽变身的周家桥，40年前是这样子的熟悉周家桥的都知道，这里原来是上海人眼中的下只角，有大量的工厂棚户区社区环境和居民的生活条件都不尽如人意。@上海长宁 说：现在的周家桥已经成为宜商宜居的美丽社区，这期间都发生了什么一起来回忆！	未
华丽变身的周家桥，40年前是这样子的连线各区熟悉周家桥的都知道，这里原来是上海人眼中的下只角，有大量的工厂棚户区社区环境和居民的生活条件都不尽如人意@上海长宁 说：现在的周家桥已经成为宜商宜居的美丽社区，这期间都发生了什么一起来回忆一下吧！  ...全文	未
华丽变身高颜值校园！西海岸这所小学改建工程正式启用！	未
华亭县创新教育扶贫方式 打响贫困代际传递阻击战	未
华亭县召开精准扶贫专项贷款回收续贷工作调度会	未
华亭：清洁煤送到群众家门口！	未
华人240万欧拍下圆明园龙首	未
华人华侨持续热议改革开放40周年：同心共筑中国梦	未
华人华侨热烈欢迎习近平到访阿根廷 	未
华人廖钦和获颁美国男孩女孩俱乐部年度社区服务奖	未
华人神探的第三次婚礼	未
华人移民澳大利亚200周年 澳华历史博物馆讲述华人故事	未
华人音乐家郑宇：在日本掀起“最炫民乐风”	未
华仁药业成国内第8家获注射用复方电解质注射液批件企业	未
华住启动国际化战略 全季酒店首家海外直营店落户新加坡	未
华体照明进军室内的首款产品,在京东众筹进行首发	未
华 你还不感动吗	未
华侨农场小学 踢出一记好球	未
华侨华人与改革开放40周年图片展在巴西圣保罗举行	未
“华侨华人与改革开放40周年”图片展在巴西圣保罗开展	未
“华侨华人与改革开放40周年”图片展在深圳展出	未
“华侨华人与改革开放40周年”图片展在福州开展	未
“华侨华人与改革开放40周年”图片展将在米兰展出	未
“华侨华人与改革开放40周年”图片展杭州开展	未
“华侨华人与改革开放40周年”图片展走进法国	未
“华侨华人与改革开放”主题展在京开幕	未
“华侨华人与改革开放”主题展开幕(图)	未
华侨城亚洲拟8.3亿元出售西安长安国际中心办公大楼	未
华侨大学推出侨情侨史舞台剧	未
华俊男励志歌曲《重见理想》全网首发	未
华俊男新歌《重逢》首发 重拾过去那些回忆	未
华农兄弟：返乡创业用自媒体玩转乡间生活	未
“华创会”首次聚焦区域性资本市场融资融智	未
华创会高科技项目集中登场 兰丁高科获中银集团等战略投资	未
“华北明珠”白洋淀首次拥有权威海图和电子海图	未
华北气温降至-10以下 强冷空气向南推进 网页链接	未
华北黄淮等地有霾 青藏高原东部将有较强雨雪	未
华北黄淮警惕霾伏 南方气温开始回升 网页链接	未
华华喜提VOGUE12月刊内页	未
华南板块急了祈福缤纷汇率先降价抢客！6月卖4.5万 现3.4万/平！	未
华南海博特杯第一届仪器大咖两广足球友谊赛即将开赛	未
华南邀请函  到深圳赴一场造就者之约	未
华发股份35亿元竞得十字门城建50%股权 曲线获得珠海项目	未
华商全媒体 西安问答  交通秩序管理在线答疑互动结束 西安交警将对所有问题逐条解决本期西安问答结束后，西安市公安局交警支队政委杨柳说：今天的现场问答，我们要感谢热心市民和热情参与者，这是对我们城市的爱护体现，这些意见和建议对我们交管工作一定有大的作用，我们一定要高度重视。今 ...全文	未
华商全媒体 西安问答 今日上午9时到11时交警支队政委杨柳带队 解答交通秩序管理问题连日来，不少读者通过华商报新闻热线反映停车难区域性交通拥堵交通标志标线设置不清晰不合理交通违法处理排长队等方面的问题。为了推动此类问题能及时得到回应与解决，今日上午9时到11时，西安市公安 ...全文	未
华商全媒体 西安问答 西安市民杨先生：车让人效果很好，行人不遵守交通规则的现象却很多！首先要感谢交警同志们，去年举办的活动我也参加了，当时我就提出了二环的桥面上全是实线，过了不久二环桥面都变成了虚线，我要给西安交警点赞。今天我想反映的问题是：1机动车在非机动车道随意停放，特 ...全文	未
华商全媒体 西安问答 西安应该推广斑马线灯西安市民反映：应该推广斑马线上的灯带，这个设计很好。还有我想反映的是平常带小孩出去玩的时，发现电瓶车等非机动车会逆行或者上人行道，希望能够加强管理。交警答复：斑马线灯是我们今年全市推广的机动车礼让行人智能系统，整个项目在今年十月进行推广，我们一直在进行效果平估，统计数据。您认可这个设备，也是对我们工作的反馈。关于电瓶车上人行道，按规定应该是推行而过，今年以来我们没有停止过一天对电瓶车违法行人的治理，这也是我们要继续做好的一项工作，比如外卖车辆一味追求时间	未
华商全媒体 西安问答 西安应该推广斑马线灯西安市民反映：应该推广斑马线上的灯带，这个设计很好。还有我想反映的是平常带小孩出去玩的时，发现电瓶车等非机动车会逆行或者上人行道，希望能够加强管理。交警答复：斑马线灯是我们今年全市推广的机动车礼让行人智能系统，整个项目在 ...全文	未
华商公益互助13周年总结表彰会	未
华商基金张博炜：2019年A股市场将回归估值锚	未
华商学院毕业照现场，密集恐惧症慎点，横屏观看效果更佳！	未
华商报带你赏南郑汉山雪景 大雪@华商报 的一直播（下载App-gt网页链接）	未
华商网直播 高颜值来袭！西安地铁四号线首次曝光@华商网 的一直播（下载App-gt网页链接）	未
华商职业学院拍毕业照现场，惊现舞狮助兴！会玩会玩	未
华国锋尘封38年的视频终于公开	未
华埠镇一户多宅整治工作战报   第十七期	未
华埠镇一户多宅整治工作战报   第十八期	未
华夏人寿举牌同洲电子 持股比例超10%	未
华夏人寿二度举牌同洲电子 持股达10%	未
华夏保险秦皇岛中支开展2018年秋季公益行活动	未
华夏幸福：境外子公司增发1.4亿美元高级无抵押定息债券 票面利率9%	未
华夏幸福：境外间接全资子公司增发1.4亿美元高级无抵押定息债券	未
华夏幸福：计划2019年上半年拿地总金额不超过200亿元	未
华夏新地标，金牌大岩板！罗志勇：我们要拿下更多的金牌！	未
华夏武状元青少年武术联赛举行	未
华夏百万年，一起找到回家的路	未
华夏银行：非公开发行申请获证监会审核通过	未
华大基因CEO尹烨：除了巴马，北上广深也是长寿之乡	未
华大基因联合31家同行发布倡议书：坚守伦理规范	未
华大基因联合31家同行发布《自律倡议书》，呼吁坚守伦理	未
华大基因集团联合31家同行发布《自律倡议书》	未
华大妈的标准手势我喜欢	未
华天延吉将发力健康餐饮	未
华天联手天猫探路便利店 餐饮基因下的差异化挑战	未
华安证券：明年A股反弹可期e公司快讯 e公司讯，华安证券2019年投资策略报告会昨日在杭州举行，华安证券首席策略分析师张权认为，A股明年有望迎来反弹。反弹动力主要源自三方面。第一是下跌时间已足够 网页链接	未
华宝尬聊 西成高铁开通一周年，坐过的都来聊聊吧。（图自：@SS3-5179）	未
华容基础设施建设工作推进 这些新要求个个戳中百姓期盼	未
华小商直播高颜值来袭！西安地铁四号线首次曝光@华商网 的一直播（下载App-gt网页链接）	未
华尔街之狼原型欠债1.1亿美元 政府收缴公司股权乔丹-贝尔福（Jordan Belfort）是一位前股票经纪人，是经典电影华尔街之狼（The Wolf of Wall Street）中诈骗犯的人物原型。贝尔福于1999年认罪，操纵投资者购买最终证明毫无价值的股票。法官判处他42个月的监禁，并命令他向这些受害的投资者支付1.1亿美元的赔偿。根据法庭文件，截至11月30日，贝尔福只偿还了这笔款项的一小部分，约128万美元。华尔街之狼原型欠债1.1亿美元 政府收缴公司股权	未
华尔街日报：非农报告公布后 美联储可能放缓其加息步伐最新的非农就业报告显示，美国经济正在增长，但增速不快，不至于让投资者担忧经济过热，这也使得美联储可以对明年进一步加息一事采取观望的态度薪资增速年率录得3.1，符合分析师预期，应该会让美联储有信心考虑，将其政策决定转变为更加依赖于数据的方式，这可能会使2019年及之后的加息步伐放缓。	未
华山之巅！ 微博视频	未
华山大上方隐修险境 PK 中国最险的6大寺庙，绝对让你惊叹不已！	未
华山将打造世界级“绝壁攀登”(图)	未
华山景区门票价格优惠条件及游玩线路最全信息都在这了，收藏出游吧！	未
华州公安：扫黑线索征集！（转载）	未
华师3位学者入选！2018年全球 高被引科学家榜单出炉	未
华彬明年计划将战马饮料推向海外市场	未
华彬集团严彬：逢山开路遇水架桥的功勋企业家	未
华彬集团获第十三届人民企业社会责任奖年度扶贫奖(图)	未
华捷艾米受邀参加国是论坛2018年会 共话“改革与创新”	未
华捷艾米李骊：3D AI/MR时代将是技术驱动发展的新时代	未
华文公司：30年执着，坚守“一字千金”的初心	未
华晨宇冲鸦冲鸦打卡，百度打榜。	未
华晨宇家说想屠广场，我觉得必须满足	未
华晨宇 我们从评评的微博里看到了贤良淑德，希望我们可以跟着评儿一起搭理这个部分，让我们做一名合格的宣传员	未
华晨宇 早安小歌，早安大哥@华晨宇yu	未
华晨宇 视频饭拍 161114东方卫视天籁之战花絮@华晨宇yu 华氏广场舞[米奇比心]	未
华晨宇：这是我拿过最冰手的奖杯啦！陈立农：还可以这样操作啊哎妈呀可冷了	未
华欣帕拉亚纳酒店（The Palayana Hua Hin）整个酒店是绿荫环绕的，有私人的海滩以及非常美味的早餐，非常适合来度假的情侶甚至是家庭。地理位置小偏，但是五公里处有rrc station可以直接到机场，方便，打的过去200thb，去镇上有几班shuttle bus，一人50thb。510元/晚，AGODA：网页链接	未
华泰保险集团董事长王梓木：险企应成为最具社会价值 和社会责任的企业	未
华泰保险集团董事长王梓木：险企应成为最具社会价值和社会责任的企业	未
华泰宏观评11月金融数据：信用纾困政策有望持续出台	未
华泰期货2018年保险+期货预计总赔付超640万元	未
华泰期货总裁徐炜中：期货市场对外开放是顺应变革的必然选择	未
华泰期货王英武：2019年钢材供需将逆转	未
华泰柏瑞11月4只基金逆势跌超2% 投资总监收益垫底	未
华泰证券与证金公司联合推出上交所首单民营企业债券融资支持工具	未
华泰证券：发行GDR并在伦敦证券交易所上市获得中国证监会批复	未
华泰金融点评11月金融数据：社融继续走低 有待政策发力	未
华润80周年人民日报头版刊文：在赓续红色基因中锻造生命力	未
华润元大基金：估值处于低位 减税降费或带来新机遇	未
华润堂门店最新海报！风痛灵追风油虎标...各类保健品精选价	未
华润怡宝： 践行水公益13 年	未
华润新城分别揽获顺义新城两宅地，最高销售限价4.6万/平	未
华润集团纪念成立80周年 发布参与大湾区建设白皮书	未
华润集团获第十三届人民企业社会责任奖年度扶贫奖	未
华灯初上	未
华灯初上夜未央 我的老美邻居们纷纷开始把圣诞灯布置起来了。感觉老美比较注重生活质量。不同的节日会在门框插上不同的旗子，进门的踏垫也会更换屋外的草坪和灌木总是打理的很漂亮屋子里面布置随着四季更换逢年过节一定要送上应景礼物（小白菜都这么大了他们还把她当小孩儿看，今年万圣节还特意包了糖果送过来）而衣物什么就比较随便。邻居家的老头子是洛杉矶有名的刑事律师，他太太和女儿平时拿的包都很平常，两，三百刀那种。而救护动物很积极，也捐很多钱给消防局和无家可归者。前些天他们认领的一个黑人流浪汉（每周去疗养院看他陪	未
华电浙江公司：且看英才竞风流	未
华盛顿举行迷你火车展览	未
华硕全面屏手机专利曝光:跟风伸缩镜头、打孔屏	未
华立大健康产业生态的共生共融	未
华米 OV 什么时候升级 Android 9.0 时间点汇总	未
华米和卫星的合作稳了，无论是在物联网方面的发展，还是提供更专业的监测通讯服务，低轨卫星都是最好的选择	未
华米：我们的征程，是星辰大海 这一次，他们的征程是星辰大海	未
华米科技与TIMEX 天美时达成合作 将进一步拓展全球市场渠道	未
华米科技与TIMEX达成全球市场渠道合作	未
华米科技这是越玩越大竟然往天上发射了一颗商用卫星华米星已经在酒泉卫星发射中心发射成功了，华米科技在全球范围内进行可穿戴设备连接卫星通讯实验，进行野外生命体征监护和救援，是不是突然觉得高科技了	未
华美协进社为４名中美人士颁发“青云奖”	未
华芯通ARM架构国产服务器芯片量产 采用10纳米工艺	未
华芯通发布ARM架构服务器芯片，定位数据中心服务器市场	未
华菱钢铁启动市场化债转股	未
华表奖女星争艳：李冰冰深V唐嫣杨幂露肩 章子怡显高贵范儿	未
华表奖颁奖 尬 尬 尬 尬里给给！史上艺人最多的一次，还不是补税给闹的，满屏求生欲朋友圈全是光鲜亮丽的通告照片，大号和水军今晚赚到了吧，可以安心过年咯！	未
华裔千金的深度抖M之旅	未
华裔妹纸把自己PS成了不同时代的完美身材，看完只想说	未
华裔数学家张益唐：逆境中的数学人生	未
华西希望集团来松桃考察	未
华讯方舟太赫兹科技产业重大项目落户雄安	未
华讯方舟董事长吴光胜：科技与公益结合 饮水思源履行社会责任(图)	未
华谊兄弟公益大使Jeffrey董又霖：冬天了，盖好被子！(图)	未
华谊兄弟等58家浙江领军企业参加长三角文博会	未
华谊，法国，与未来	未
华轩居/翡俪港竣工验收工作推进中 双城国际等13个问题楼盘部分已办妥房产证	未
华软盛世获B轮融资8000万，华广通全面布局小程序移动电商	未
华辩世锦赛半决赛周六开战｜传承保护or转化创新？如何建设大运河文化带	未
