周二上班堵不堵，出门之前看路况滨海微服务 天津滨海新区实时路况：新华路立交桥实时路况 猛戳网页链接新港路实时路况 猛戳网页链接海河开启桥实时路况 猛戳网页链接中央大道与新港三号路交口实时路况 猛戳网页链接海门大桥实时路况 猛戳网页链接上海道与和平路交口实时路况 猛戳网页链接上海道实时路况 猛戳网页链接大连道实时路况 猛戳网页链接津塘公路立交桥实时路况 猛戳网页链接中心路地道实时路况 猛戳网页链接二大街与黄海路交口实时路况 猛戳网页链接二大街与南海路交	未
周二下午两点！骆驼雪地靴！69块！骆驼雪地靴	未
周二免费体验权有没有被小姐姐所吸引，进入冬天，我们也要美美哒。评论区留言你在冬季做过最疯狂的事情，11月28日小丽子抽取1位小可爱免费送出小姐姐神器，一起美美哒。都市丽人文胸套装无钢圈光面性感聚拢女士内衣套装2B8617Z	未
周二我在重庆问候你早安！你在哪里	未
周五不落单，相约可以吧！	未
周五周六有大包首页搜索7827111	未
周五  和罗振宇薛兆丰共事，日薪最高300元，逼格管够  罗辑思维	未
周五咯！周末到咯！要放假咯！每个周五的我 准备放飞辣！	未
周五啦早O	未
周五啦，早安呀[给你小心心]	未
周五坐高铁去香港，搭乘邮轮过个惬意的海上周末	未
周五“大雪”迎“初雪” 大降温来袭	未
周五我在成都问候你早安	未
周五晚梅丸谈喝酒，周六晚糖沁说旅行	未
周五沙龙丨如何在电影里审视风物在旅行中发现风景	未
周五油价可能重回“6元时代”	未
周五湖人将继续客场挑战国王队，个人觉得老詹需要休息一到两场，同意的点赞。	未
周五购疯狂京东超市周五购疯狂陪你过周末！冬天虽冷，还有家居好物送温暖！蒙牛联合福临门维达，@蒙牛乳业 品质好奶 @中粮福临门 香醇好油@维达Vinda 韧性好纸 专场低至2件起5折，全方位承包你的客厅厨房餐桌，带来冬日的一缕温暖！买纯甄百香果送维达抽纸，买特仑苏送福临门食用油更多赠品等你来撩广发信用卡京东支付还可满80减40，新手专享200元神券！！多重优惠，过个暖心冬日！！戳链接查网页链接	未
周五辣！已经下班的请点赞，还在办公室坚持的请评论，就想看看有多少人热爱工作的人。	未
周仲明赴丰宁调研脱贫攻坚工作	未
周信息新桥炸鸡店首开分店啦！新店外卖下单立减10元！	未
周信息门头沟新地标长安大桥建设进度过半 用钢量超鸟巢	未
周信息门头沟有个饭馆吃饭就能摇奖！旅游礼盒礼品啥都有！	未
周先旺：切实履行问责之责 推进全面从严治党	未
周先旺在市政府与市总工会第十四次联席会议上强调  全力支持工会工作扎扎实实为职工办实事	未
周六Outlets实拍：1小时找不到车位，铲雪停车冒雨排队，但店里优惠更狠！	未
周六上午好呀！你们这两个干嘛呀 转fa原po的里面随机揪10个请你们喝HeyJuice的黑金芋泥吧嘻嘻嘻周末真的美滋滋	未
周六上海梅奔见啦	未
周六 下着大雪 还要上班的小盼 急需要你们的拥抱	未
周六别忘了下午茶时间哈，先来个大包吧 562842405	未
周六周日放假，周一正常上班，谢谢各位	未
周六抗日，高手云集！大神爆料	未
周六，教育益家为你带来雪的问候！限30个家庭！	未
周六日古北系列古北系列：赏圣诞小镇 爬长城 日夜景全览	未
周六日常omi又去爬山了，回家告诉我看见了一只野猪和牛一样大 和亲爹外出这次给我的惊喜是：把红外套弄丢了 要么穿反衣服要么乱穿衣服要么直接整丢了onita在家休息一天居然肯乖乖吃药我很震惊，突然变得好体贴妈妈，要知道喂她吃药也是很伤脑细胞的活啊我去了又一城逛街，不夸张的说人山人海啊啊啊，圣诞节要到了 大家都在买买买节日气氛好浓流水账完毕生活的模样母婴V时代	未
周六来溧水捕捞节，看美食大赛享“屏湖鱼宴”	未
周六，海淀北部这个小镇要搞大事情啦！你不来看看吗	未
周六！用云闪付购物5折！利群百盛丽达友客7-11...都能用！	未
周六等你  260余家企事业单位都来了！提供近万个就业岗位！	未
周农当选衡阳市人大主任 周海兵当选市长 廖炎秋当选市政协主席	未
周农当选衡阳市人大常委会主任 周海兵当选衡阳市人民政府市长	未
周冬雨、井柏然担任《演员的品格》学长学姐	未
周冬雨 微醺 写真	未
周冬雨时尚写真遭曝光，网友：亮瞎我的双眼，这确定不是小强吗？	未
周冬雨登封面 另类诠释成熟的一体多面(图)	未
周凯带队开展河长制巡河工作	未
周剑：只有能力体系改变，共享经济等才能真正落地	未
周励淇与丈夫傅浤鸣已完婚：开展了人生新的一页	未
周口人快看！新变化！公务员加班补助要来了	未
周口市公安局隆重举行今冬明春平安守护巡逻防控启动仪式	未
周口要下雪了，你准备好了吗	未
周口谁家还有这些值钱的东西每一件都价值连城！	未
周口身边事 城市V聚力 首富许家印回老家：每户村民发3000块钱V影响力峰会	未
周口这43条路要有新名字了，你有好的建议么?	未
周周有得玩逛公园，游岩洞，登山徒步，让你的冬日不再单调	未
周周讲  守好国家钱袋子！他们出手了	未
周四下午两点！3款定制麂皮绒卫衣！冠啊军的刺绣麂皮绒卫衣，颜色好看，垂顺平整，不爱皱！刺绣也很密sup和北脸的麂皮绒刺绣卫衣，依然是不挑人的经典版型，多色！超厚巨厚的冠啊军羊羔绒卫衣，很厚很厚，顶的上薄袄了定制麂皮绒卫衣！	未
周四凌晨，皇马将坐镇主场迎来欧冠小组赛最后一轮对阵莫斯科中央陆军的比赛。	未
周四好关于造势：势能和背书一定要足够，会不会造势是微商能否成功的重要因素。借势追热永远赢不过造势！	未
周四市场操作策略！	未
周四或将迎来今冬初雪 出行请注意防滑	未
周四招聘货运司机外送员普工多种职位等你来应聘！	未
周四起，贵州大范围雪凝天气有望结束！	未
周大福分步控股ST景谷 郑氏家族资本版图再下一城	未
周大福大湾区门店 明年支援WeChat Pay HK香港周大福珠宝集团有限公司宣布与腾讯签署合作备忘录，明年起，周大福珠宝于内地的指定门店将全面推行WeChat Pay HK，鼓励港人在大湾区以港币电子消费，提升香港消费者的生活体验，全面配合港人在大湾区一小时生活圈概念。周大福大灣區門店 明年支援WeChat Pay HK	未
//@周大那个吹:这也要看技术进步能有多大。要是真的到2030年，重复性工作基本由机器人代替。那么，工作岗位将会稀缺。财政收入主要来源会所得税和捐款。社会物资商品极大的丰富，钱可能不是衡量一个人成功与否的标尺。	未
周天王的周期论被到处用，真的2020大牛市吗不知道，只知道2019从长周期看，可能是谷底。叶檀：重磅！2020年 迎来前所未有的大牛市	未
周姓后裔共聚会 高淳周氏宗亲“千叟宴”连办五年	未
周宏智  希腊 土耳其游记	未
周小川：央行要想有所作为，跟政府保持较紧密关系有助于改革	未
周年早鸟特惠，含税570元起明年暑假元旦后年寒假往返东南亚多地/国内线燃油附加费下调	未
周庄举办2018中国名镇论坛，百人齐聚寻访古镇新生活	未
周延礼：从“点”到“面” 推进上海国际保险中心建设	未
周延礼：预计5-10年内实现互联网+保险中介服务模式	未
周强：准确把握新形势新任务 深入推进扫黑除恶专项斗争	未
周强：深入推进扫黑除恶专项斗争	未
周强：积极探索创新证券诉讼机制，引入更多专业力量参与审案	未
周德睿赴汉寿督导非洲猪瘟防控工作时强调继续严防死守 确保绝对安全	未
周怀喜：见证通信大发展	未
周思源执掌四川音乐学院 该校曾培养出李云迪李宇春	未
​周恩来特型演员刘劲获聘北京世园会形象大使	未
周报上周惠城一手住宅网签688套供应795套 河南岸大幅领先	未
周日上午，鹰潭交警叫你到这个广场领奖品！文末还有1条秘密！	未
周日不加价！2大2小399壕吃熊猫酒店自助美食熊猫梦幻动剧场	未
周日啦！今天湖北大部分地区阳光明媚，不过武汉在内的中东部部分地区有霾周末的最后一天，要抓紧放松抓紧玩儿！你会带着口罩户外活动，还是宅家呢	未
周日小镇	未
周日广马将成史上最冷学会这几招，等于老天助你刷PB！12月9日（本周日），广州马拉松将于上午7点30分起跑！广马升金标点燃跑友们的热情，然而传来的冷空气消息却让人心里一阵凉凉，今晚一股冷空气悄悄抵达广州，广马正日将成为这波持续冷空气中最冷的一天广州市气象台预报当日气温 ...全文	未
周日广马将成史上最冷学会这几招，等于老天助你刷PB！12月9日（本周日），广州马拉松将于上午7点30分起跑！广马升金标点燃跑友们的热情，然而传来的冷空气消息却让人心里一阵凉凉，今晚一股冷空气悄悄抵达广州，广马正日将成为这波持续冷空气中最冷的一天。广州市气象台预报当日气温将维持在911之间，阴天且有小雨。不过，跑步大神们却说，这样的天气，才最容易跑出PB（Personal Best）啊！为什么最冷广马反而有助于跑出PB怎么应战才最有利（记者 邹甜）戳：周日广马将成史上最冷	未
周日晚，川普的小儿子巴伦出席了白宫的圣诞派对，并在派对上见到了他的偶像英国传奇球星鲁尼今年12岁的巴伦酷爱足球，鲁尼是他最喜欢的球星之一老爸川普也是有心了啊！	未
周日法讯	未
周日温州马拉松开跑！交通管制公布，60条公交线路调整	未
周日老鞋致青春 1992年的Nike Air Ballistic Force，球员签名落场版PE，签名来自于哈罗德迈纳，你知道这位球员在全明星周末期间得过哪项大奖么：Russ Bengtson	未
周日见华工科技奔跑天团与你相约光谷！	未
周星驰携《新喜剧之王》再战大年初一 搞笑风格回归(图)	未
周星驰新作《新喜剧之王》定档大年初一，“神器”折凳重现	未
周星驰《新喜剧之王》明年大年初一上映	未
周星驰电影：长大后才知道，句句都是残酷的社会现实[加油]	未
周星驰过56岁生日，林允送祝福：至尊宝 祝你生日快乐	未
周晓东：军营走出的育种专家	未
周晓东：军营走出的育种专家(图)	未
周晓东:成育种专家 献身科技兴农	未
周期轮回！2019年才是我们抄底资产的最佳时机从明年经济趋势下行的现实来推测，财政政策方面会继续落地：宽财政和减税，因为这是目前逆周期调节主要手段货币政策方面则会表现出：宽货币宽信用，甚至是降息的趋势，结构性放水在明年的力度会加大，因为下行压力也大。我们当前面对的现实是什么呢基建受调控影响现在无法全面发力，宽财政又能力有限。要知道基建以前主要还是地方政府在推动，而现在地方政府的举债又严格受限。于是就出现了，放开房价是个问题，压住下行压力又扑面而来。僵局。（米筐投资）周期轮	未
周未探密：人间仙境钟山小蓬莱	未
周未来鹤山这里！不但能玩迪士尼嘉年华，更有1800方星级会所免费体验！	未
周末48行动平安华灯12月23日夜间，@深圳西部高速交警  在机荷高速收费站开展整治，期间共拦查76辆车，纠违26宗。	未
周末48行动 虽然是下午，蜀黍也查酒驾哦	未
周末48行动 蜀黍的传单，要遵守哦	未
周末799宿洲际旗下新酒店， 含自助早晚大餐， 游全城至高泳池	未
周末一起high起来	未
周末不加价！仅29.9元抢万达宝贝王儿童乐园亲子套票！淘气堡旋转飞椅碰碰车海盗船...原价126元！鄞州江北两店通用	未
周末不加价峨眉雪景 温泉佛境！399元抢原价2088元绕佛阁度假酒店！双层loft套房私人服务免费早餐免费加床	未
周末不加收！泡温泉住两房一厅无敌海景房仅需199元，海陵岛唯一带温泉的公寓等待你的到来！	未
周末两个活动上线：皮肤秘宝以及小型充值活动	未
周末两天，央视介绍的福安竹筒酒蜜桃村！完整视频在这，你都看过了吗	未
周末，中美贸易战迎来大拐点，首次影响今日A股气势如虹，但明日是招商策略会，今年最后这一个月A股究竟会如何近期A股再次妖股纵横，剩下的一个半月我们应该这么做！	未
周末了！四姑娘山欢迎你来野！！！	未
周末了常回家看看！关注独居老人，安全过冬有实招	未
周末了，有点小激动	未
周末了，领一个吃饭用吧	未
周末亲子营报名  秘境野骑山林徒步攀树野炊，今冬最酷！	未
周末你们都在干啥顺便抽个66元的小红包吧，转关即可，今晚11点开 。	未
周末元旦古北2日 长城脚下的江南小镇 赏夜景 云岫谷 雾灵湖	未
周末元旦春节798南京空降大彩蛋，澳门威尼斯同款设计酒店，温泉无限次泡，客房70	未
周末元旦火车雪乡已成行 送火车票 哈尔滨 雪乡 雪谷穿越	未
周末元旦火车雾凇岛下周已成行 雪乡 雪谷 哈尔滨 童话般的世界	未
周末元旦 雪乡赠送火车票 这个冬日，一起穿林海，跨雪原，体验醉美北国风光	未
周末元旦雾凇岛赠送火车票 雾凇岛 雪乡雪谷 哈尔滨 索菲亚教堂	未
周末养眼  人民广场大屏幕乌龟车77张图忆回不去的老上海	未
周末冲鸭天气太舒服了 周末刷西湖	未
周末准备去哪里玩呀	未
周末出去浪，记得扫码花红包哦！	未
周末出游攻略出炉啦！吃喝玩乐游，让你嗨起来！采摘狩猎儿童游乐场策马奔腾，看海赏景，让你同时满足！ 不止旅行 V影响力峰会	未
周末分享 Reddit一位网友发的示意图，某件东西或事物在自己心中的价值，真实了...	未
周末到了	未
周末到家收快递，开心都是很低的价格买的，这四件加起来才1000多一点点我可真是个勤俭持家的好少年	未
周末单飞少年车手集合令赛道飞驰，争霸决战！(12.8周六)	未
周末厦门这里最好玩！80的本地人都未必知道！	未
周末去哪儿  人生不值得，但厦门周边值得！安排	未
周末去哪儿北京十所温泉酒店 带你嗨翻整个冬天	未
周末去哪儿听课 想让孩子开开眼界这些公益课别错过！	未
周末去哪儿来南川！让你一日游三景	未
周末去哪儿桃园仙境在宾川，跟着小编吃桃去	未
周末去哪儿江浙一带温泉酒店 走一波	未
周末去哪儿江浙一带温泉酒店 走一波进入2018年的最后一个月了，气温一直在走低，泡汤的好时节来了上一期，我们推荐了京城的温泉酒店，这一期我们打算来聊聊江浙一带的温泉酒店冬天来了，温酒酒店系列走起来江浙一带温泉酒店 走一波 育儿盛典 母婴自媒体大赏	未
周末去哪儿玩：上周没去成的，这周别再错过了！	未
周末去哪儿赞爆！乐山再添一条80公里绿色骑游长廊！	未
周末去哪儿遛娃？2019年南京亲子年票了解一下	未
周末去哪玩更接地气?你觉得呢?假期任性过 生活的模样	未
周末去哪石门国家森林公园看红叶喽！粤赏红叶石门有，何须千里香山寻。13日，素有广州香山美誉的石门国家森林公园红叶节正式揭幕。石门公园内有红叶3000多亩，以枫树山乌桕及槭树等为主，主要分布在田园风景区石门风景区及石灶风景区。走，一起去看红叶！	未
周末去哪里12月去哪儿今年还没玩够的朋友请看这里十二月是一个多彩的月份，从巴哈马的海浪再到澳大利亚的初夏，每一个地方都展现出了无穷的魅力。这一次，我为你精心挑选了10个最值得去的目的地，希望能给你带来新的激情与无穷的灵感gtgtgt12月去哪儿玩	未
周末去哪里广宁给你巴黎春天水岸公园的享受，一家大小免费好去处！	未
周末去看啦！	未
周末去看看	未
周末又带着宝宝去朋友家聚会啦，这次还带了小小一只的佳能瞬彩手机照片打印机去，聚会时拍的图片可以即时打印出来，还能贴在本子里做成宝宝成长手帐，随处摆在家里或贴在冰箱门上也非常可爱！机身小巧轻便，配套的手机 APP 也很好用，可以直接在 APP 里拍照修图，是非常实用轻便有趣又美貌的小物。推荐给大家希望你们也喜欢:-)	未
周末又有3场供需见面活动！3.4万个岗位等您来	未
周末又来啦我是157 评论留下你的叭	未
周末哪凯好玩克灌阳县文市镇月岭古村看庙会耍耍去哈！	未
周末哪里玩儿惠阳有这几个超200年的古村落（公交路线地图）	未
周末啦	未
周末嗨皮 微博视频	未
周末嗨起来！抓住最后的阳光！这些地方约起来	未
周末在家睡的天昏地暗的小可爱们起床了嘛 现在关注并转发点赞本条，在今晚23:00 抽一位送上388元现金红包，本碟来承包你周末宅家的开销。	未
周末，大家一般都会带娃去哪商场公园还是游乐园糕妈带年糕逛了趟大学，省钱省力省心，还能涨见识，大学简直是个随时带来惊喜的遛娃宝库家旁边有大学的，可以带娃逛起来了 比游乐园人少，比商场省钱，这个遛娃好地方一般人都不知道	未
周末大家的主要任务就是睡懒觉是吧老虾一大早就起来了！今天要登岛下去看望下那里奋战在一线的弟兄们，带去组织的问候对吧慰问品足足一船！然后要会说话，争取见到面的第一句话就是我又来晚了！信不信会让人觉得又搞笑又感动！搞笑的是老虾这个人，而感动的是足足一船慰问品！想什么呢对吧嘻嘻	未
周末好！	未
周末好不容易偷得半日闲，还都献给了微博	未
周末好个人创业如何开始就是先免费通过微博微信积累几千人目标客户，然后正式开始卖货及提供服务。最不靠谱的就是一开始就拿着想法到处找融资的创业者。	未
周末好去处丨来钦州这里享受慢调慢生活，让心灵寻找诗和远方	未
周末好去处永清天圆山庄首届热气球风车主题文化旅游节11月24日盛大启幕！门票免费送！	未
周末好如何用微商IP思维提升淘宝系电商的价值：1首先打造淘宝店主的个人IP，即淘宝掌柜必须上传自己的100字简介，个人照片等能体现个人IP的东西，不要再是现在的货架思维模式，人第一，产品第二2将现有的微商代理制度和淘宝天猫店嫁接以人为中心的淘宝和以货架的为中心的淘宝，完全是 ...全文	未
周末好热烈欢迎大家去我的家乡衡阳的五岳之一南岳衡山目睹雾凇奇观话说我上一次遇见已经是10年前了	未
周末安全课堂 这份周末安全提醒请查收11月第4周，消防安全系列4 交通出行，莫忘消防安全@埇桥发布	未
周末将迎今冬第一场雪，武汉各公园已备好应对预案天气预报称本周末武汉将迎来今冬第一场雪，8日预计有中到大雪目前，武汉各公园已备好雨雪天气应对预案5日，武汉市园林和林业局公园广场管理处下发通知，要求各公园管理机构密切关注天气变化，全力做好低温雨雪冰冻防范工作记者从沙湖公园管 ...全文	未
周末小百科  拉链拉不上衣服起球别担心，教你一招快速解决！	未
周末就好好休息一下吧 微博视频	未
周末就是拿来撸的 不经意间的善举 又又又到周末了，来看看我们为你们挑选的周末出行指南。天儿冷也得出去待会儿。（部分活动推荐来自：@elvita威的生活便签 ）	未
周末就来这里吧！上海62家工业旅游景点全指南，看看阿拉杨浦有几家	未
周末就要下雪了！快来这几个绝美民宿里睡过冬天吧！	未
周末就要结束了！一组夕阳下的兵哥哥送给你近日，陆军第82集团军某合成旅在太行山下展开实战化军事训练，夕阳下战士的身姿更加挺拔，脸庞更加坚毅，他们克服艰苦严寒条件，用火热的训练激情演绎自己的军旅青春（作者：陈柯宇   摄影：张小乐）	未
周末干嘛这个中轴线上既熟悉又陌生的的景点，正式向游人开放！	未
周末，应该去浪一浪！	未
周末开！	未
周末开船PG 千年隼	未
周末影响市场重要资讯回顾周末影响市场的重要资讯包括：中央经济工作会议：实施更大规模的减税降费新个税：工资收入将累计扣除 专项扣除细则年末出台菏泽的示范效应：至少30城或跟进 强调取消转让期限。gtgtgt更多周末影响市场重要资讯回顾	未
周末微学堂	未
周末，想带你一起逛棉湖老街	未
周末愉快当清晨的阳光照拂在@长隆野生动物世界 ，这个神奇的动物王国就苏醒了[带着微博去旅行]憨态可掬地吃着竹子的熊猫一脸萌态地抱着树睡觉的考拉，还有各种奇特有趣的动物，都等着大家来玩呢玩到累了，还可以选择空中缆车自驾车小火车等交通方式，悠闲地坐着观览动物，捕获美好哒小周末！欢乐长隆乐游长隆	未
周末我们应该	未
周末我们相约去水唇田心坝硁头村摘草莓吧	未
周末我在重庆问候你早安 今天晚一个小时因为周末	未
周末打开支-福.宝首页搜.索570727547 立即领红包包[微風]	未
周末放假，一定要好好滴犒劳自己，盐亭这些店今天可是打五折哦！	未
周末放假吃顿好的犒劳犒劳自己吧，盐亭这些店今天可是打五折哦！	未
周末文摘丨对进一步完善医疗机构放射性药品使用监管工作的思考	未
周末文苑魏延安：秦岭诗一组	未
周末新去处！又一网红打卡胜地彩虹墙闪现惠州	未
周末，无需理由，出发吧，碧海蓝天，大门岛山脊栈道！	未
周末早上好！今晚拜仁VS汉诺威，22:30不见不散！@PP体育	未
周末，是困顿的开始睡觉刷剧打游戏启悦Pro版不负好时光，带你周末出去浪它搭载防紫外线后窗遮阳帘定速巡航系统高效自动恒温空调独立后排空调出风口等丰富配置，让你尽享一路舒适旅程。	未
周末模式 启动 via夕阳红活动中心	未
周末，欢迎广大wu粉来大广西浪，来不来	未
周末比赛多多，各路高手集合！大神爆料	未
周末活动  来可口可乐博物馆，一起探秘可乐是怎么出生的	未
周末涨知识：慈禧用地暖、溥仪用电话点外卖	未
周末游你与这些优惠，只差一趟高铁的行程！	未
周末游宿迁  走进风景旖旎的红色土地，开启不忘初心之旅	未
周末游宿迁  这一份亲子时光很有料！	未
周末甜饼古言现言都有，放心食用控控推文	未
周末的小目标大家都完成了吗	未
周末的小移人，今天在工作的小伙伴来打卡	未
周末的深圳由中国移动旗下出境服务平台@无忧行JegoTrip开展了一场高颜值的活动无忧补给行动 ，这里也成为了众多爱秀达人和年轻潮人酷炫打卡地。现场的旅行维他命代表了无忧行境外免费通话各种特色功能，吸引了各种目光。你想知道你在旅行中缺乏哪种补给吗快来网页链接 测试一下吧	未
周末看起来吧！	未
周末看银杏	未
周末睡了个懒觉：太阳暖洋洋，空气特别好，被窝都香香的，开心！工作日需要早起：冷风嗖嗖的，空气都有毒，被窝里是冰窖，哭辽.....	未
周末礼物 嘿！	未
周末空中之旅！厦门美炸了的骑行线路，明后天约起	未
周末红包点击快领！	未
周末红包真的很大，十几块二十几块的挺常见，扫起来 查看图片	未
周末约场滑雪吧！	未
周末约着小伙伴来场京畿道一日游吧详细戳网页链接	未
周末线华尖山	未
周末线娘娘山	未
周末美图丨重庆这个高山湿地，私藏万亩火棘，此时已美如仙境	未
周末能让我早起的动力：早饭和你的早安 早安各位	未
【周末观赛指南】中国男篮盼复仇 足协杯悬念揭晓	未
【周末观赛指南】地球最火德比开打 朱婷“主场”争冠	未
【周末观赛指南】皇马剑指三连冠 CBA常规赛过半	未
【周末观赛指南】英超双红会今非昔比 乒羽迎年终收官战	未
周末记得在家看 新七侠五义之屠龙案哦 查看图片	未
周末  诗画小镇有个好玩的大地艺术节浦江山里出现级美公园...	未
周末财经要闻解读 财经V峰会 许家印回老家每户3000块钱@宇辉战舰 的一直播（下载App-gt网页链接）	未
周末走起千岛湖私人订制，宿轻奢酒店看水之灵表演游森林氧吧	未
周末走起楠溪江畔漫步红枫古道，游千年古村奇峰绝壁！含中餐！	未
周末走起武义大红岩，挑战彩色玻璃栈道，仅需109/人！有胆量的就来！	未
