医院，银行，健康，金钱，哪个和你有关系，值得每个人看一看！	未
医院闻书香！市读书协会市人民医院杏林书会成立！	未
匿名作家计划收官：阎连科马伯庸参与 郑执获首奖	未
匿名：南仓道往京津公路方向，桥下原来没有红绿灯和栅栏的时候倍儿顺畅，经常从这过，几乎从没堵过，最近不知什么时候突然加了灯，路中间加了栅栏，每次从这儿过都堵的要死，一堆加塞儿的	未
匿名寄件，跨省点赞这位贵州铜仁医生	未
匿名投稿ID：@杨钰玉我的心动女孩	未
匿名求助：唐山现在哪个游泳馆开放，环境还不错的，有知道的吗	未
十一区超恐怖短片合集废校摄影：网页链接女厕异闻：网页链接红色房间：网页链接市松人偶：网页链接找眼珠：网页链接追魂：网页链接	未
十一周年公众开放日  国家大剧院迎万余观众	未
十一学校迎接教科研中心研训处集体视导	未
十一将成全球黄金周 出境游客预计超600万人次	未
十一月丨城事动态精选	未
十一月中国好人发布，桥头这位大妈被全国人民点赞！	未
十一月作为我的生日月，今年该如何庆祝呢 来个不同的体验吧，直接买张飞机票飞九州！ 九州真的去一次爱一次，可美了！拥有大片自然风光富饶物产历史遗迹等，这次探访熊本森林的阔绿，追寻福冈日落的美，每次都会沉醉于长崎夜景灯海最爱大分地热温泉，超级舒服非常疗效，亲眼看到鹿儿岛火山喷发的震撼，品尝宫崎和牛入口的顶级美味，真的令人回味无穷，流连忘返。 人生不是赶路，是一次又一次的旅游，在旅游中尽情感受一下生活的美！ 分享给想去九州游玩的宝宝们一条 九州旅行 完美攻略盘点日本九州七县旅行关键词	未
十一月初一，吉祥普照。	未
十一月初一恭诵三清宝诰	未
十一月，我登上河伯岭四尖峰赏秋.....	未
十一月文明事这些文明事温暖潍坊人的心！	未
十一月的海风，私藏的三亚度假小时光	未
十一月首张正规专物流单号图一：上海 云南 内蒙古 北京图二：吉林 四川 天津 宁夏 安徽图三：山东 山西 图四：广东图五：广西 新疆 江苏 图六：江西 河北 河南 图七：浙江 海南 图八：湖北 湖南 甘肃 福建图九：贵州 辽宁 重庆 陕西 青海 黑龙江 快递公司为中通。专辑今日开始出库，于9号全部发完。物流信息不会很快显示，请耐心等待。如五天内没有物流信息，请联系代购群管理员。 收到专辑开箱后，未拆专者发现收到版本不对者私聊代购群管理员（需录开箱视频，开箱后发现版本不对，请勿拆专，否则一律无法更	未
十一长假宠物寄养一"窝"难求 最高可达200元一天	未
十万人测评俱乐部 欢迎回家！	未
十万人测评俱乐部 等你来//@ZEALER中国:这是我们官方工作人员给您发的短信，您可以致电确认，欢迎回家	未
十万吨级！广澳港区码头靠泊能力将翻倍丨粤东最高等级集装箱泊位明年投产	未
十万秒伤不是梦！非酋酋长摸着脸颊表示第十次我肯定能强化成功！	未
“十三五”全国城镇污水处理及再生利用设施建设规划出台	未
“十三五”四川以6市州为主体布局新材料产业发展	未
“十三五”四川将加快推进新能源及新能源汽车产业发展	未
十三五规划关键年，北京交出期中成绩单	未
"十三五"规划期中考试成绩单:主要指标达标81.6%	未
十三届全国人大常委会第七次会议12月23日至29日举行	未
十三届全国人大常委会第七次会议举行第二次全体会议 栗战书出席	未
十三届全国人大常委会第七次会议今起举行，这些议程值得关注	未
【十三届全国人大常委会第七次会议】“十三五”目标指标进展符合预期	未
十三届全国人大常委会第七次会议在京举行	未
十三届全国人大常委会第七次会议在京举行 栗战书主持	未
十三届全国人大常委会第七次会议在京举行，栗战书主持	未
十三届全国人大常委会第七次会议在北京举行	未
十三红志后庄弹唱	未
十三载攀汽车芯片“珠峰” 比亚迪欲以第三代半导体掀电动车变革(图)	未
十三部委联合发文：规范光伏扶贫 增强造血能力	未
十个中奖机会，每人100元！快来吧！	未
十个影响你一生的习惯：1运动2早起3少吃4不做旁观者5放慢脚步6整理7变得更强8喝水9冥想10不要欲望过度	未
十个影响你一生的小改变：1运动。2早起。3少吃。4不做旁观者。5放慢脚步。6整理。7变得更强。8喝水。9冥想。10不要欲望过度。	未
十九大代表尼玛石曲：幸福生活甜如蜜	未
十九大代表、昌都市委书记阿布：努力建成藏东经济强区	未
十九大代表次仁巴珍：不忘初心继续服务群众	未
十九大代表白玛央金：“边民的生活一定会越过越好”	未
十九大代表许成仓：奋力推进各项事业全面发展	未
十九大开幕 唐山祥富里社区居民集体观看开幕式自发站起同唱国歌	未
十九大开幕 张家口市第十七中学集体观看开幕会	未
十九大报告在西藏高校师生中引起强烈反响	未
十九大报告诞生记	未
【十九大时光】唐山基层党员群众的知心话	未
【十九大时光】喜迎十九大共筑航空梦活动在石市举行	未
【十九大时光】建行邯郸分行举办“喜迎十九大 健步跟党走”活动	未
【十九大时光】林芝市更章村群众点赞十九大报告	未
【十九大时光】永清县：胜利村走向“新胜利”	未
【十九大时光】河钢石钢：让中国“质”造走向世界	未
【十九大时光】石市桥西区：小区变化大 百姓乐开花	未
【十九大时光】秦皇岛市公安局举办“喜迎十九大 ‘卫士之光’”书画摄影展	未
【十九大时光】邯郸举行“喜迎十九大 童心向党”主题升旗仪式	未
十九大精神唱出来 高淳老戏台变红色大舞台	未
【十九大精神在基层】把党的声音传遍藏韵古地	未
【十九大精神进基层】玉树：十九大精神进社区 百花齐放春满园	未
【十九大精神进机关】七台河市检察机关学习党的十九大精神	未
十九大精神进校园十九大精神文艺演出走进张家口五中	未
【十九大精神进校园】齐齐哈尔学习落实党的十九大精神	未
十九大西藏代表团抵达北京 代表：五年变化翻天覆地	未
十九届中央纪委常委会召开第一次会议 赵乐际主持会议并讲话	未
十二五以来，江西已累计建成2232公里普通国省道畅安舒美示范路！	未
“十二五”各省（区市）节能目标完成情况 2016年第27号公告	未
十二届全国人大常委会第二十八次会议在京举行	未
十二届全国人大常委会第十次会议分组审议关于深化行政审批制度改革加快政府职能转变报告	未
十二月了，是不是要买新衣服啦！	未
十二月份免费设计活动开始，准备装修的小伙伴们可申请报名设计，前十名小伙伴哦	未
十二月份还可以这么绿油油 武汉武汉大学	未
十二月你一定能网恋成功（翻仔有事去了 这条就电脑定时发咯）	未
十二月你好	未
十二月你好，愿你以梦为马，不忘初心	未
十二月你好新的一月就要到了，攻略君祝愿大家一切都顺心顺意，早日脱单_转抽这条，12月1日出二位宝宝平分200元，小小心意，不成敬意，还望笑纳要加油脱单哦！	未
十二月初雪飞来初心暖	未
十二月好事惊喜会不断发生在你身上	未
十二月，愿事事顺心，一切安好！	未
十二月早安正能量一句话	未
十二月桃花满枝头，真爱就在眼前的4个生肖	未
十二月生日的小宝贝这个月都会收到两份大礼。	未
十二月的第一天第一件事就是公布礼物，作为年末节日扎堆还是我的生日月，决定多送一些礼物和大家分享快乐。这个月的礼物文字打不完，看图心动一下！互动榜前十名，都会拥有礼物。关于互动值怎么算其实就是通过转发，点赞，评论累积而已哦也有朋友在反应这个规则不太公平。其实在没有绝对公平的选择下，只希望借由这样的方式，给大家带去一些日常的开心 评论欢迎继续许愿哦！2019年的礼物想要什么	未
十二月，这可是专属于Rivers时间！体育V势力	未
十二月锦鲤 转发这个被爱心包围的大苏并说出你的愿望，你将会收到12月的好运！！！比如今天，我就会从评论里面抽1个人，送一个小红包旅游约吗	未
十二生肖性格优缺点揭秘！一针见血！	未
十二部门联合检查让农民工春节前足额拿到工资	未
十五天建一座城 二十华诞冰雪奇观再起	未
十五的月亮，十六圆月亮园林小品	未
十余专家快速解读中央经济工作会议 九大要点	未
十余年，因为你，我才想要成为一个更好的人	未
十余省市出台路测细则 智能网联汽车驶向“风口”	未
十佳乡村工匠一株花草最高卖十几万，你信不	未
十佳乡村工匠谢娇：林间种下梦想  乡村栽出未来	未
十佳公安民警候选人丁欢：不要人夸好颜色 只愿芬芳满高墙	未
十佳公安民警候选人何斌：无悔从警路 敬业铸警魂	未
十佳公安民警候选人刘瑾：执法尖刀兵 群众守护者	未
十佳公安民警候选人吴跃武：洞庭湖湿地生态卫士	未
十佳公安民警候选人周胜华：铁肩担道义 除恶扬威名	未
十佳公安民警候选人张良：刑侦岗位负重前行  守土有责岁月静好	未
十佳公安民警候选人文武：攻坚克难 利剑除霾	未
十佳公安民警候选人熊伍：凝心聚力带队伍 勇搏激流护民生	未
十佳公安民警候选人聂文：文以贯道的法制教授	未
十佳公安民警候选人胡鲲鹏：一名刑警的炽热情结	未
十佳公安民警候选人范卫：恪尽职守 不辱使命 勇当扫毒禁毒的尖刀兵	未
十佳公安民警候选人郭向军：侦破一线的刀锋战士	未
十佳刑警缪玮杰：用冷静的大脑练就一双火眼金睛	未
十佳团队候选推介11江山市检察院公诉部恪尽职守勇担当，强化队伍铸铁军	未
十佳团队候选推介9龙游县检察院侦查监督部磨砺剑锋保平安	未
十佳奔跑在青春路上的追光者杨刚	未
十佳孝子评选开始啦！来投一票吧	未
十佳干警候选推介9心怀柔情，为未成年人健康成长撑起一片法治蓝天	未
十佳球丨字母哥近乎无敌，乔治末节称神破网！	未
十八大以来7次中央经济工作会议	未
十八大以来推出1600多项改革方案	未
十八届中央第十轮巡视前瞻:推进全覆盖再杀"回马枪"	未
十八届六中全会成为党的建设新里程碑势所必	未
十八已成年，在分界点温柔坦荡，感受不一样的少年飞行@TFBOYS-易烊千玺 Dont Tie Me Down-TFBOYS-易烊千玺	未
十八张图，带你回顾二十一号线建设的大件事	未
十八洞在希望的田野上	未
十八洞村民施成付家：精准脱贫后的幸福生活	未
十八而志 国之栋梁	未
十八而志，责任以行！忻城县高级中学3000多人齐聚举行成人礼	未
“十八般武艺”呵护“南昌蓝”	未
“十八里”，越走越有劲	未
十八集大型电视纪录片《我们一起走过——致敬改革开放40周年》今晚播出	未
十八集大型电视纪录片《我们一起走过——致敬改革开放40周年》播出启动仪式在京举行	未
十六位王者诞生！2018再创哪些奇迹第二届寻找车极限收官丨头条	未
十六朝古都  西安旅游攻略品长安城味道 一份粗糙的吃喝游指南 P1 关于自己 关于西安P2 出行必备 住宿推荐P3 景点推荐 美食推荐P4.6.7.8 线路推荐P9 美食推荐投稿：小小小团妹	未
十几个小区欢呼！昆山鑫源热电厂拆迁在即，官方拍板原址建	未
十几首“阿卡贝拉”版老歌，串起改革开放40年几代人回忆	未
十分主观的Steam游戏推荐又到了一年一度的年末圣诞时期，即便啥都不买，回顾一下今年玩过买过的游戏也是挺有意义的。本站用户药荚s整理了她2018玩过的Steam平台游戏作品，不保证全新，也不见得品质优秀，但说不定就有你错过的有趣作品。就算不买，看看也不妨 网页链接	未
十分到位了//@-我是你的小可爱呀-:@一只大mu鸡 哈哈哈哈哈哈	未
十分感谢微信没有推出情侣卡，手动比心	未
十分钟乐高搭建伦敦塔桥模型，用它开展STEM活动	未
十名砌筑工现场“凹造型” 花式砌墙让人目不暇接	未
十周年庆回顾  点击看活动视频和大咖祝语！	未
十四周集锦体坛百咖秀	未
十四年！“上海最牛钉子屋”将拆除	未
十四张图 穿梭四十年	未
十四张图，穿梭四十年	未
十堰司机在车上放纸板请别贴罚单，交警的回复让所有人点赞	未
十堰要建轻轨官方最新消息是交通全面爆发！	未
十堰要建轻轨市里发布3年计划，城市交通将大爆发！	未
十大公共文化服务品牌会宁县红色文化旅游节	未
十大关键词，回顾P2P的2018	未
十大品牌  神游东方圣地，邂逅儒韵慢城！孔夫子喊你来玩啦！	未
十大国家级田园综合体  解析	未
十大天文图片网站分享	未
十大“淘宝网红主播”双十二传递网络扶贫正能量	未
十大淘宝网红主播双十二传递网络扶贫正能量近日，由工信部中国电子商务协会扶贫办等联合淘宝举办的1212人民的宝贝总决选之电商精准扶贫行动在双十二期间启动，而网红直播参与也是其中的最亮点以薇娅viya烈儿宝贝等为代表的百万粉丝团的淘宝主播积极响应此次活动据了解，本场直播超过 ...全文	未
十大知名校长访谈河北综合广播大型直播《十大知名校长访谈》第五期，主持人李爽对话28中校长董羊城。董羊城校长介绍28中。 源/@本地咨询	未
十大让人反感的交通陋习行为出炉，榜首竟然是这个！	未
十大越剧流派“5城联动” 名家将携“宫廷”剧闹新春	未
十天四国   行程结束	未
十天放肆嗨购！这家折扣奥莱陪伴杭州人的第14个年头，衣就如此划算！	未
//@十字路口的立早菌:天呐 好棒	未
//@十安1372:我要下载下来，激励我	未
十年万和路杭州远洋万和四季：墅级品质 为城市人居代言	未
十年不离不弃！女孩高中大学背着大伯去上学甘肃陇南的秦峰因车祸高位截瘫，由父母照顾。父母离世后，侄女秦梦瑶承担起照顾大伯的任务，整整10年。从12岁到22岁，十年的光阴，3600多个日日夜夜，秦梦瑶给了秦峰生活下去的勇气。为女孩点赞，为这份真情点赞！（兰州晨报）网页链接	未
十年之前，我们是朋友，还可以问候	未
十年之后的你会是什么样的事业如何感情如何财富如何	未
十年，你走过多少路，帮过多少人，吃过多少苦他们这十年，充满艰辛和感恩！十年，泰山义工，花香满城！	未
十年前上交文物 十年后拾金不昧 西安灞桥区一位拾荒老人不平凡的精神世界	未
十年前的今天，曼联夺得世俱杯冠军。 C罗鲁尼特维斯彼时还是队友，弗爵爷还执掌教鞭。十年时间，沧海桑田	未
十年同心 百年同行——百年人寿推出“请为我打分”代理人服务技能评价活动	未
十年同舟路，今朝再扬帆	未
十年后再会！汕头谷饶大坑文化节游行最后一场....	未
十年后的你们追星女孩教育自己的女儿	未
十年如一日坚持服务失独家庭，她用真情和牵挂温暖孤独的心灵	未
十年如一日播音级报站，128司机终于火了！	未
十年“带伯上学” 谱写大爱至诚	未
十年帮助数万人！她说这个事业将做一辈子林志玲19日赴港领取由港澳台湾慈善基金会颁发的爱心奖。该奖项自2002年以来鼓励两岸三地的慈善工作者，今年封她为台湾第一慈善名模。10年来，林志玲投入各项公益领域，数万人受惠，昨获赠的13万美金，也全数捐出帮助儿童教育及医疗用途。林志玲说，这是一份最特别的奖项，坚定了我未来对于慈善事业的决心，任重道远，做一辈子！ @林志玲林志玲热心公益10年来助数万人 获封台湾第一慈善名模	未
十年建设两茫茫，黄冈晨鸣终投产！	未
十年期国债期货主力合约跌幅达到0.42%	未
十年梦圆！昨天，80个标箱的新余制造乘坐五定班列奔向舟山港	未
十年“河长制” 守护绿水青山	未
十年磨一剑！国家级历史文化名城，金华有着这样的故事	未
十年磨一剑 期货人才培养结硕果	未
十年磨一剑 “自然派百变偶像”小沈阳做客PP视频《影人》	未
十年锡婚，绿城用一份厚礼，对南通许下最长情的告白	未
十易其稿，这部150多万字的书记录上海报业33年发展历程	未
十月二十七 丨 铜盂镇集星村恭迎胪岗妈祖！	未
“十月文学高校计划”启动 为文学青年搭建成长平台	未
十月有风，十一月有雨，十二月我希望有你	未
十月的涠洲岛，一切都显得刚刚好，最惬意的是环岛骑行去暮崖看日落。by@屈卫东Mango	未
十月革命“中国团团长”牺牲百年，后人追忆感动列宁的光荣史	未
十点半领花指路：网页链接送花指路：蔡徐坤已收到2553872朵花	未
十点带大家看下零下15度的葫芦岛葫芦山庄！...........好冷 网页链接 或者企鹅电竞 47777房间	未
十点开抢！！车给你们放这里了，你们自己开走吧！！！前1小时第2件0元杰士邦 前30分钟第2件0元冈本	未
十点钟盘面感觉1盘面状态：低量清淡，马放南山。2板块冷热：没有板块热点，小盘地产略活跃。3操作感觉：今日无事，下楼遛狗。4中线趋势：弱平衡。5敏感品种跟踪（不是荐股不能买，用于观察大盘股和小盘股的主力动向）：山西证券，证券跌多涨少，大主力近期干啥呢万顺股份，绿柱线 ...全文	未
十点钟盘面感觉1盘面状态：年底的清淡状态，低开补缺又回落。2板块冷热：没有板块热点，建筑股没劲了。3操作感觉：没买盘，大主力没粮食了吗4中线趋势：弱平衡。5敏感品种跟踪（不是荐股不能买，用于观察大盘股和小盘股的主力动向）：山西证券，大盘金融股没动作，小盘金融股略微活 ...全文	未
十百千万普法工程授牌仪式在温州文成举行	未
十种抗衰老蔬菜排行榜西兰花，富含抗氧化物维生素c及胡萝卜素。冬瓜，富含VC。洋葱，富含硫磺，能帮皮肤和肝脏排毒，重建结缔组织。圆白菜，总的维生素含量比番茄多出3倍。胡萝卜，富含维生素a和胡萝卜素。西红柿 菠菜 香菜 马铃薯 芹菜。	未
十里平流即将重现，沙县生态水系项目最新进展曝光！	未
十里春晓儿童才艺表演大赛开始了！时间地点已确定，快来报名吧	未
"十镇百村"村庄建设启动 盐城投入10亿改善农村住房	未
十问十答：面对一汽丰田亚洲龙 这位内秀的小伙动心了	未
十面霾伏下的镇江雾景，你准备好抗霾了嘛	未
十面霾伏再次来袭 各地变瑶池仙境 如何对雾霾说不！	未
十面霾伏里的光明守护者[给你小心心]雾霾爆表，冷空气携土赶来，但有这样一群人，他们依然坚守在生产检修一线，用自己的实际行动守护着千家万户的光明。图为12月3日，@国网渭南供电公司 变电检修人员在110千伏莲湖变电站，对1号主变35千伏零序渗油套管进行更换。（王宝宁 王飞）	未
十项举措支持中小企业发展  浦口区召开银企座谈会	未
千万不要有以后会越来越好的期待，核心的电池续航问题不解决，什么方法都是白搭。//@非洲无言:换电的确是现在唯一能解决续航焦虑的途径。 现在不成熟，问题也多，以后肯定会越来越好的。 当然，我希望等我死后再普及电动车	未
千万不要自己感动自己	未
千万人在观看！   退伍消防员奋勇救火 儿子赞我爸爸是英雄	未
千万人在观看！  退伍消防员奋勇救火 儿子赞我爸爸是英雄	未
千万别任性！酒泉的非机动车也需有法必依！	未
千万别喝蜂蜜了！！！在忙都要看！！！我是认真的！！！（请转发扩散）	未
千万别在最好的位置上睡觉（深度好文）	未
千万别忽略：18个有用的人情世故 在有专业知识与技能的情况下，人情世故能够帮助我们个人缓和与其他人之间的紧张度，也比较容易让其他人感到与我们交往的愉悦感与适度感。这里例举出对于我 们每个人也许都能用到的日常生活中18个人情世故，而这些人情世故也经常被很多年轻人忽略全民阅读	未
千万别点开！小心掉入南京牛首深秋的温柔陷阱	未
千万别点开！小心掉入太仓深秋的温柔陷阱	未
千万别眨眼！130秒带你重新认识中国航天员今年是中国人民解放军航天员大队成立20周年。这是一个在改革开放大潮中诞生的英雄群体，名副其实的中国天团！一段视频，带你回顾航天员大队成立以来，11位英雄6问太空的经历和成果转存，为中国航天点赞！（央视新闻）网页链接	未
千万别眨眼！这些美景你一辈子都没见过！我要从第一个玩到最后	未
千万粉丝看咸宁！撤地建市20周年，咸宁人转起来	未
千与千寻教会我们的......	未
千人共享108米火锅宴 	未
千人共读赢挑战 栖图“行走中的图书馆”活动为国庆假期添书香	未
千人同跳广场舞启动江苏广场舞大赛	未
千人帮千企多措帮扶！历经铺街道这家企业今年有望实现产值3.8亿元！	未
千人帮千企百日大行动一个月 帮助企业解决1300多个问题	未
千人“盐城论道”基础教育创新  北师大教育集团启动系列公益美育活动	未
千人竞逐北京市健美操锦标赛	未
千人雨中垂钓，泗洪本土选手“梦想成真”获季军	未
千亿企业怡亚通微商负责人（他们已经邀请杜子建作为公司顾问）参加触电会说了我开心的一句话：新浪微博10年，全中国所有专业自媒体中，红了10年的人全中国只有两个人，杜子建及龚文祥确实已经找不到第三个红了10年个人专业自媒体人（其他人都被淘汰或过气了）	未
千亿后时代融信三驾马车：产品品质社区营造平衡打法	未
千亿，哪来那么多钱啊//@庄无邪:有善缘悟净这几个字的人和企业，并以感恩文化的，百分之百是骗子，目前观察毫无例外。	未
千亿帝国掌门：“顺势而为”卢志强	未
千亿新城  民族品牌工程，幸会千年雅安城	未
千亿水深火热的基因编辑市场，现状究竟如何	未
千亿级铝加工和羊业生态！兰州新区两大园区项目开工	未
千亿纾困资金入场，68家上市公司“受援”！	未
千亿美元基金掌舵人华尔街传奇投资人：如何在寒冬寻求投资最优解	未
千件专利成果首次集中推介，这场拍卖会标王竟是它	未
千余名新兵完成军旅生涯“第一跳”（图）	未
千余名新兵，授衔！12月8日，陆军第79集团军某合成旅军歌嘹亮军徽闪亮会场庄严肃穆，千余名新兵昂首挺胸，整装待发，他们准备迎接军人生命中庄严神圣的时刻授衔仪式经过三个月部队教育训练和学习，初步完成了由普通社会青年到一名合格解放军战士的转变（北部战区）	未
“千克”将被重新定义——中国计量将迎来国际单位制重大变革	未
“千克”将被重新定义——我国计量将迎来国际单位制重大变革	未
千克将被重新定义我国计量将迎来国际单位制重大变革千克死了，千克永存国家市场监管总局11日召开国际单位重大变革新闻发布会，随着国际单位制迎来重大变革，从明年5月20日起，中国将开始使用新修订后的国际单位制届时，千克不再依赖实物来体现，计量将会更加方便精准，其误差 ...全文	未
千克将被重新定义！我国计量将迎来国际单位制重大变革国家市场监管总局11日召开国际单位重大变革新闻发布会，随着国际单位制迎来重大变革，从明年5月20日起，中国将开始使用新修订后的国际单位制根据第26届国际计量大会决定，到明年的5月20日，国际千克原器将正式退役，取代它的将 ...全文	未
千分之一概率的抓拍入水瞬间，美得让人窒息。丨摄影师：Chris Chambers	未
千古舞韵，瑜伽竟然可以这么美（内附3 个 瑜伽 视频）	未
千只天鹅飞抵运城这个地方，湖光山色，美成了一幅画，看你去过吗	未
千名好民警（辅警）推选老是无中生有的他，为何还会获得好评	未
