小区消防门被上17把锁 挂锁业主：买别墅就是图清净滟澜洲是四川乐山市一个大型住宅小区，里面有一扇大铁门将高层住宅和别墅区分隔开来。令人震惊的是，这道门竟然被锁了17把锁。小区物业负责人介绍说，只有中间那把黄色小锁是物业的，其他16把链条锁都是别墅区业主挂上去的。有高层住户表示，这是消防通道，存在安全隐患。别墅区业主则表示，别墅区有100多户，高层住宅有1000多户，一旦开了门，高层业主就可以自由出入别墅区，势必会影响别墅区的清净。买别墅就是图的清净安全，这门坚决不能打开！。目前，当地消防部门已	未
小区绿化谁来修剪，阳光和绿化如何兼顾苏州正在	未
小区里藏着爱美的“扫地僧” 每年用银杏叶“绘画”成网红	未
小区黑科技：电动车充电新方案，这些便民措施不容错过高明警讯第45期	未
小升初语文课外文学常识重难点汇总，给孩子收藏！	未
小卡36分吉米空砍3810 猛龙113-102击败76人猛龙近10战9胜，伦纳德36分9篮板5抢断，瓦兰丘纳斯26分8篮板，伊巴卡18分8篮板，洛瑞7分4篮板4助攻76人结束4连胜，巴特勒38分10篮板，雷迪克25分4助攻，恩比德10分12篮板5助攻，西蒙斯8分10篮板11助攻。详细：小卡36分吉米空砍3810猛龙主场力克76人	未
小卡片的公益之旅 建行让劳动者让世界感受上海服务	未
小卡砍下37分6板，第三节5投5中得到15分！率领猛龙126-110击败骑士！	未
小厕所，大民生！双流公厕再现黑科技成都人对美好生活的向往在双流区公兴街道智能公厕，除了普通的蹲厕以外，还配备了智能马桶。可以自动冲洗暖风烘干座圈加热按摩等功能，屋顶照明采用人体感应开关，人进灯亮，人走灯灭。emmm天气这么冷真的好贴心啊嘻嘻厕所革命继续中 双流公厕再现黑科技查看图片	未
小厕所大革命！今年石家庄改造提升公厕244座公共厕所异味重环境差，男女厕位设置比例不合理，身体残障人士公共场所如厕不方便近日，随着石家庄市厕所革命的持续推进，石家庄市民对这些城市公共厕所的传统印象正在转变。据石家庄市环境卫生管理处副处长李文家介绍，今年以来，石家庄市把主城区能够改造提升的244座公厕全部进行改造。目前228座厕所改造提升工作已完成，剩余公厕改造提升工作将在12月25日前全部完成。按照有关规划在主城区内新建100座公厕，采用社会资本特许经营等模式运营。通过加载广告银行自助	未
"小"厕所彰显"大"文明 盐城"厕所革命"补齐民生短板	未
小县城有万亿大生意，哪些县城最土豪你家乡排第几艰难的2018年，拼多多趣头条却活出了新天地。他们成功的秘诀之一，就是深入县城掘金，四线往下的小县城用户成其消费主力。四张图表分享这些最强土豪县城，看看你的家乡在其中吗@大猫财经官微 小县城有万亿大生意，哪些县城最土豪你家乡排第几	未
小可：求抵御寒冬的顶级攻略！北极熊：别怕，这个周末本宝宝出动了！小可：(())看过来，要抱抱...北极熊：这个周末快来上海浦东嘉里中心或合生汇找我小可：除了熊抱，还想对你做点什么怎么办！北极熊：当然...可以！陪聊天陪拍照陪跳舞陪拍视频陪你分享快乐！	未
小可爱们今天都收到花花了吗	未
小可爱们，听说这次四级你已经翻车了，小七送来慰问	未
小可爱们周末好[给你小心心]来看看游记吧//@阿泓泓:迟到一年的日本游记终于写好！卷花评论原博，揪个小可爱颂300大洋啦[给你小心心]	未
小可爱们，我新书的设计封面出来了，来，征求个意见，你们喜欢1还是2	未
小可爱们最近又开始有大红包了基本都是两位数。致富宝首页搜索7001599 领取红包。	未
小可爱们注意咯！今天的维护更新内容已经在@梦幻西游手游 大神号提前发布啦！想要更早了解一手更新资讯那就快去下载网易大神看首发公告吧参与有奖抢评，惊喜周边好礼等着你哦。梦幻西游手游详情猛戳网页链接	未
小可爱们注意啦！第N次梦幻西游手游门派调整圆桌会议正隆重召开！转发评论本条微博，留下你对门派调整的看法，优秀评论就有机会获得梦幻西游音乐盒哦	未
小可爱叮叮猫向你驶来萌萌哒[给你小心心]（视频来源：@胡英俊的张小俪 ） 微博视频	未
小可爱，存一下评论里的图好嘛，给我个大冷天更文的动力（我想喝热奶茶！）	未
小可爱 微博视频 小宇宙	未
小可爱，我佛了佛了	未
小可爱手绘插画插画师：Yllya	未
小可爱//@橙味天塌饱:太可爱啦//@搬六://@陈家阿圆 :提前过年了//@暴躁本宸 :轉發微博	未
小号《寂静》寻一片净土，享一世安然！	未
小号活动支持一下 。。。。。。。。。。	未
小司微播报 收藏2019春运火车票12月23日开抢这份订票时间表要存好2019年春运，1月21日开始到3月1日结束。12月23日可买春运第一天1月21日的票1月6日可买2月4日（除夕）的票1月12日可买2月10日（正月初六）的票1月30日可买最后一天3月1日（正月廿五）的票。（扬子晚报）春运订票时间表 12月23日开抢春运首日火车票！这份订票时间表请收好	未
小司微播报 爱与陪伴不能等待！赡养父母有哪些义务和保障9图了解近日，《宁夏回族自治区老年人权益保障条例》对外公布，独生子女护理假引发关注。截至目前，10余省份均出台相关政策。关于常回家看看，各地如何规定赡养父母，你有哪些政策保障长期护理保险探亲假随迁户口戳转发，收藏！ （人民日报）	未
小司播报 2018年宪法宣传周活动启动 新华社呼和浩特12月2日电（记者刘懿德）2日下午，中央宣传部司法部全国普法办公室在内蒙古自治区呼和浩特市联合举办2018年宪法宣传周活动启动仪式。 2018年宪法宣传周活动启动	未
小品《上门》大伙乐嗨了！	未
小哥哥一看就是讲究人	未
小哥哥小姐姐留步，给电视鲜报投个票可好	未
小哥，我被床仙封印了，麻烦送到门口！一份需要，一份服务你跟外卖小哥曾有过哪些难忘的交集呢今天，外卖已经成为一种生活方式，任何生活服务都可以被轻松解决！今天，我们专门为提供着这些服务的外卖小哥过节，是你们提供了物流基础设施支撑，改变了所有人的生活方式超爱你们（3） ...全文	未
小唯小发手牵手，剁手路上一起走！	未
@小嗲俊 好美呀	未
@小嗲俊 我吧 送你一个	未
@小嘉的小小嘉 @Arbouse- 下次回去一起喝奶茶呀	未
小园帮帮帮  你的全部 小园守护	未
小国比较好治理//@北京厨子卖包包:真牛逼。	未
小圈个人喜欢睡一晚正好到的哦//@哈哈哈嗯嗯嗯额额额:小圈，问你一个问题，中欧航线上有两个航班波，一种是北京时间下午起飞然后当地时间下午到，全程白天飞行。另一种是北京时间凌晨起飞然后当地时间早上到。这两种小圈会选哪一种呢	未
小圈今天乘坐的Euroduplex列车，是阿尔斯通TGV Duplex的第三代车型，于2011年商用，最高运行速度320km/h。目前法国国铁SNCF和摩洛哥国铁ONCF都有运营这款列车。车上提供无线网络，并自带行车信息景点介绍等功能。列车开出一个多小时，整体还算平稳，不过气密性是真的不如国内的列车航旅趣闻	未
小型男Maverick感恩节萌照出炉	未
“小城·大爱”多媒体艺术展在港展出	未
“小城·大爱”艺术展在港展出	未
小城故事羊倌脱贫记	未
小城深处有书声——在葡萄牙感受“中文热”	未
小城镇环境整治精准发力 浙江文成“做美”乡村	未
小声点！让他趴一会吧在北京抓捕任务结束回绍兴途中，没有坐票，6个多小时绍兴市公安局@平安柯桥 滨海派出所民警钱锡灿就这样睡着。作为侦办2018年公安部督办719大宗邮币卡诈骗案中的业务骨干，他半年内走遍12个省市！对于一位基层民警来说，这或许就是工作日常了吧	未
小声逼逼again，16年拿了单曲年冠的Justin Bieber，17年拿了年亚17年拿了年冠的Ed Sheeran，18年拿了年亚所以18年拿了年冠的Drake，19年会拿下______。	未
小声逼逼，今年单曲年榜公鸭，马龙和卡迪比都有两只单曲在前十。	未
小夏八岁啦 2010年的12月1日，小夏发出了第一条微博到今天为止，小夏已经八岁啦下面请在评论区开始祝我生日快乐文案风采大赛！从现在起截止至12月1日20：00，评论区点赞数前三名将有机会获得小夏公仔一只哦	未
小夏轻语 我旅行是因为喜欢到处走动，我享受旅行给我的自由感觉，我很高兴摆脱羁绊责任和义务，我喜爱未知事物我结识一些奇人，他们给我片刻欢愉，有时也给我写作主题我时常腻烦自己，以为借助旅行可以丰富个性，让我略有改观我旅行一趟，回来的时候不会依然故我 毛姆	未
小太阳，电热毯，暖水袋已备齐，准备迎接南方冬天，瑟瑟发抖	未
小奇剧透社之守护神之保险调查 阿百@黄宗泽 和小杜@劉心悠Annie 拿错行李箱，竟然出了这么多糗，打开之后真是惊喜满满来呀互相伤害鸭！who怕who！	未
小奇喊你收礼物丨2019爱奇艺尖叫之夜门票中奖名单公布	未
小奇喊你收礼物丨2019爱奇艺尖叫之夜门票限时抢！	未
小奶鹿鹿纹包 有返图啦！[给你小心心][给你小心心]两侧的地方记得用手推进哦！不然形状就变得方正啦！@NanNanSpecial传销窝点	未
《小妖的金色城堡》开虐 连凯上演＂疼痛式＂演技教学	未
小妖精们准备好了吗双十二马上来了赶紧搓搓小手准备抢货了！悄咪咪说下，咱们家今晚24:00可是有秒杀的哟，一般人我可不告诉她呢快来戳这里提前准备下叭:junping俊平旗舰店	未
小妹夜聊 你的车加满一箱油可以跑______公里	未
小妹夜聊 有没有哪款车，从初代到现在为止一直是你的最爱	未
小妹妹眼睛里发着光：易烊千玺好帅啊	未
小姐们都该看看关于疫苗的那些知识	未
小姐姐一套来喽话不多说pingzan算个送发热小高领哦看起很贵的一套，哈哈哈哈哈裙子搭配靴子超级好看，你们中意吗tukibunny12.12零点update tuki bunny毛小兔	未
小姐姐也太帅了吧	未
小姐姐，你是真的很美网友一天早上在吃早餐，遇见一奶奶向一桌女生乞讨，说想吃早饭肚子饿，图中女生二话不说直接为这位奶奶打来一份早餐，边上的网友目睹了整个过程，着实让人有一丝感动	未
小姐姐十二天泰国旅游攻略献给即将踏上旅程的朋友们，希望对大家有所帮助！	未
小姐姐又布置业啦_	未
小姐姐是个精灵吧	未
小姐姐的笑容瞬间温暖了寒冷的冬天 微博视频	未
小姑娘//@触手蜀黍:上次出门还有人问我读大几，真的开心到鱼尾纹都少几根//@万事屋纸纸酱:下班回家吃麻辣烫，店员问我同学你要什么汤底 我开心到再吃两碗//@M大王叫我来巡山:路过大学附近被叫同学真的那个偷爽哟	未
小姑子瘫痪在床 周口五妯娌轮流照顾23年，五妯娌入选11月孝老爱亲类中国好人榜。希望少一些这种歌颂女性牺牲的光荣榜吧。4个嫂嫂和1个弟媳长达23年为她洗澡换衣喂饭哥哥和弟弟呢，死了么还有什么最美儿媳啊之类的评选，都不喜欢。新闻来源：大河报网页链接	未
小姨妈给云朵们打电话爱豆来电话啦！12月21日-12月23日 我们不见不散不止旅行 V影响力峰会 脚步不停微博视频	未
小威，我微博发了好的，安排了	未
小娄巷历史文化街区的各类土建工作有望在年底前完成正在修复中的小娄巷显现出大宅云集庭院深深的名巷风貌。位于市中心的小娄巷是一条名士之巷，仅明清两朝就出了1位状元13位进士15位举人和近80位秀才，近现代小巷还走出了民主革命家秦毓鎏爱国名将王赓著名学者王永积著名化学家王序著名科学家王选等人。为保护文物的原真性，保留文脉和乡愁，防止拆真建假，小娄巷内所有建筑的修复都执行严格的报批手续，首批16处已通过省级文保单位验收，另有12处正在报批中。据悉，小娄巷历史文化街区的各类土建工作有望在年底前完	未
小娇妻让你每天在家打打游戏看看电视，开心吗	未
@小娜娜娜娜00：今天带着别的城市的朋友们去意式风情街遇到了这个小丑，一直摆手让我们过去，然后我就自己过去了，她就跟我照相，当我们要走，她从她背得袋子里掏出一个卡片是残疾人，然后合影收费20元之前她没有提示过拍照需要花钱什么的！听到这个我们就说不用了，不需要我们几个女孩就要离开， ...全文	未
小娜终于找到了支付宝扫码的致富之路	未
小学女孩印炕，满满的回忆	未
小学数学几何易错知识点汇总图形求面积十大方法总结（附例题解析）	未
小学生为何学中医？浙江中医药大学校长：培养民族自豪感	未
小学生发现西游记漏洞 有意思，话题对应的热门内容是10年qq空间热传的如果把西游记倒过来看，其实更精彩，正看倒看都精彩，和这人生一样魔幻	未
小学生发现西游记漏洞西游记看了二十年，暮然回首，我才发现这才是艺术啊！我承认被惊叹了！	未
小学生和百万的年终总结！！	未
小学生演专业儿童剧能收获什么？	未
小学生演专业儿童剧能收获什么？这部戏告诉你	未
小学生演讲火了：我的梦想就是发财	未
小学生玩转汉字中华汉字文化体验园2018年成果展示会举办。活动中，来自北京市第八十中学实验学校康营分校的40位小学生入园，共同体验汉字的魅力。学生体验了汉字之美展廊巧拼汉字成语达人大富翁木活字印刷汉字盒子等体验坊。	未
小学生用拼音写＂最萌＂失物招领 你愿为他点赞吗？	未
小学生申请换座位抓住爱情勇敢的孩子！当年我都是默默的祈祷可以分在一桌，哪敢嗦出来	未
小学生的作文可以说是非常王者荣耀了	未
小学生进军营活动参观怀特基地131联队的B-2。密苏里州怀特曼（Whiteman AFB）空军基地B-2本来隶属第509轰炸机联队，509联队也是美国空军唯一一个真正意义上具有作战能力的B-2单位。2008年美国空军将同样驻扎在怀特曼基地的131战斗机联队转为国民警卫队第131轰炸机联队，成为美国空中国民警卫队第一个拥有B-2轰炸机的联队。不过国民警卫队131轰炸机联队跟509联队实际上是共享飞机地面设施和配套设施等，只是人员是两批而已。目前怀特空军基地有20架B-2。这也是美国空军全部的数量。	未
小学老师表情包评语获赞 网友：“我都想写作业了！”	未
小学老师表情包评语获赞 网友：我都想写作业了	未
小学老师表情包评语走红，网友羡慕：我都想写作业了！	未
小学联手医院共建爱心基金，为恩施白血病女孩伸援手恩施女孩雨涵身患白血病，治疗花费已超40万元。13日，由武汉儿童医院武汉市育才行知小学与湖北省红十字会联合设立的童心生花基金伸出援手，向雨涵捐款1万元，为她送去冬日暖阳。小学联手医院共建爱心基金，为恩施白血病女孩伸援手	未
小学部开展国家宪法日主题教育活动	未
小孩偷记父母密码，3天花去15万元，看到银行回执单后欣慰笑了	未
！！！！小孩子不要看。//@超大--同步卫星: 高速服务区//@CD伟大的谢三盆_肥爷:转发微博	未
小宇宙大爆发旅行灵感季旅行珍物集 @微博旅游 @新浪旅游 北京周末拍照好去处北京旧物仓世界之花假日广场2层迅速让人穿越到八九十年代，能发现不少之前的旧物面积很大，人也不是很多拍照圣地，手机拍照是免费的，相机可能花钱才可以拍照	未
小宇泽眼角膜移植手术今日进行，这份爱不会停止小宇泽一路走好 今天中午12时，在同仁医院眼科手术室里，两位患有先天性角膜白斑的患儿正在接受角膜移植手术。角膜捐献者，正是曾牵动无数人的跨省转运中学生小宇泽。十一期间，13岁的小宇泽随家人前往内蒙古旅游时发生车祸，需从内蒙古人民医院转至北京天坛医院就诊。网络上发起爱心接力，但这么多人的爱心没能留住孩子，11月20日上午，跨省救援的小宇泽于北京天坛医院去世。为了满足他生前做医生的梦想，小宇泽妈妈决定将他的角膜捐献。后续  小宇泽眼角膜移植手术今	未
小宝为您接力读宪法（3）小宝气象，我是施文轩，现在为你播报	未
小宝宝和爸爸的第一次见面，第一张合影	未
小宝很认真了	未
小宝手工一组生活小素材简笔画，可以陪孩子画个够了！（via：邓瑞宁子绘手帐）	未
小容量不浪费，大火力饭更香，米家小饭煲众筹最后一天啦，来领取169元限时优惠众筹价！	未
小寨东路西影路 今起试行双向通行为充分挖掘大雁塔区域路网通行功能，经筹备调研论证和征求意见，市公安局交通管理局发布通告，12月16日零时起，小寨东路西影路试行双向通行从慈恩西路至芙蓉东路段增设由西向东两条机动车道和一条非机动车道，试行双向通行雁塔北路丁字口，行人经地下通道过 ...全文	未
小小一台暖风机，3秒就能让全身暖起来	未
“小小乌兰牧骑”进社区 用实际行动践行社会主义核心价值观(图)	未
小小反光条 温暖乡村路新坝镇为三轮车粘贴反光条	未
小小年纪却为这个家付出了这么多搞笑	未
小小年纪，满满正能量 微博视频	未
小小年纪跳吉特巴《都是酒精惹的祸》帅！（内附129 个 交谊舞 视频）	未
小小心意呀，还有好多给我也送过小礼物我最开心的事就是因为认识了你们！	未
小小春要有妹妹了？应采儿晒照小腹微凸孕味十足	未
小小的城市里，承载着我最温暖的记忆！快手快手的500个家乡	未
小小的火车票，带你乘上时光列车，穿梭改革开放四十年	未
小小的购物一下 香港特别行政区  上水	未
小小蘑菇竟成了常郭街西村民脱贫致富的好帮手！快来看看	未
小小豆芽大有文章 广州增城警方守护舌尖上的安全	未
小小跨个界，敬请期待	未
小小银球折射人生百态 新民晚报红双喜杯参赛队探访	未
小小面包车，荷载6人，结果下来了50个人，真创了吉尼斯世界纪录 网页链接	未
小小驿站 脱贫支点(民生调查·一线新探索)	未
小居居 微博视频 温泉	未
小岗新生代：改革青春物语	未
小岗纪事 | 不加滤镜，在真实的生活中讲述小岗的故事	未
小岛旅行 vol.1  高松散步：生活是旅行的日常实践	未
小岛片区多路段出现神奇小动物，还会发光！怎么回事	未
//@小岛电影movie:冬天的故宫也是真的美//@创意铺子:故宫！//@生活小智慧:又想骗我去故宫玩了//@灵感旅行市集:太美了吧	未
小岛秀夫刚刚回复TGA主持人Geoff Keighley：祝你明天颁奖礼好运！很抱歉我这次不能到场。	未
小岛秀夫力挺PS Classic，晒照透露神秘代码140.15小岛秀夫近日晒出了自己的 PlayStation Classic ，并且将游戏机包装背面展示给大家看，细心的同学不难发现在初代合金装备名字下面还有特别彩蛋：神秘代码140.15其实这串代码在初代游戏包装背面就有，140.15是斯内克和女主角梅利说悄悄话 ...全文	未
//@小崔读书汇:请网友想办法联系她，我们会尽力帮助她。一是改善教学条件和生活水平，二是到北京让仁医刘海鹰先生看看有无手术的可能性。所有费用由基金会解决。	未
//@小崔读书汇:谢谢@阮雅青北京大妈//@石头霁月://@照妖镜315:给中国最美大妈院阿姨点赞，你也是实话实说的好阿姨	未
小巍	未
小巍！璧璧！雪鹅！	未
小巨蛋牙膏230g29.9到手牙膏界的香奈儿，某东上要128一瓶！按压的使用很方便，也很卫生！	未
小巨蛋牙膏230g29.9到手牙膏颜值很高哦，挤压式的喷嘴，用起来很方便，而且不会有残留	未
小巫互动 早上好！巫酱早安打卡时间谈恋爱对于你来说是	未
小巫师@Joyce-桢桢 的神奇手帐HarryPotter	未
小巴海军战力飙升啊	未
“小巷总理”的故事讲不完 让沪剧一一唱给你听	未
小巷联播在职党员进社区，志愿服务暖人心	未
小巷联播当创城先锋 为党旗增辉	未
小巷联播聚力齐创文明城  同心共筑美家园	未
小布online 广州交通绿化等各方面的城市建设你知多少今天小布早早去到2018广州设计论坛涨知识！多位专家围绕粤港澳大湾区枢纽城市规划设计与建设进行脑力风暴，为广州城市发展建言献策。目前广州拥有世界级空港海港和四通八达的铁路公路交通网络，未来将在湾区中起关键作用。	未
小布专访西安推广甲醇汽车对中国汽车工业和能源多元化意义重大访工信部甲醇汽车试点专家组秘书长魏安力西安市即将投入使用的甲醇汽车对全市300万辆的机动车保有量来说不算多，但从我们国家能源安全环境保护和汽车工业自主品牌地位的角度来看，西安市迈出的这一步具有历史意义。工信部甲醇汽车试点专家组秘书长魏安力，近日接受记者采访时对西安市推广甲醇汽车工作给予了高度评价，他认为西安为我国汽车工业自主品牌的培育和建设做了一个非常好的表率。	未
小布什说，父亲教会我们，当官， 为公众服务是必须的，也是崇高的当政客，也可以当得正直，并且对家庭信仰这样重要的价值观问心无愧。他坚信，我们必须回报国家和社会。	未
小布什追忆老布什“最棒父亲” 称葬礼安排尽快公布	未
小布什追忆老布什＂最棒父亲＂ 称葬礼安排尽快公布	未
小布分享什么是甲醇燃料 今天小布就给大家科普一下随着人们对环保关注程度的提升，清洁能源汽车受到越来越多的关注，甲醇汽车就是其中之一。记者从市工信委了解到，我市也将陆续制定相关政策，支持甲醇汽车发展，目前，我市已成立甲醇汽车产业发展协调领导小组，统筹研究解决推广应用过程中的重大问题。那么，甲醇燃料是汽油吗?是不是环保燃料?甲醇汽车有啥利好政策今天小布就为大家科普一下甲醇燃料的相关知识！网页链接	未
小布分享 央视记者带您走近西安地下综合管廊一起来看网页链接	未
小布夜聊来说一个你家乡的标志性景点，看能不能碰见同乡人。	未
小布提示地铁五号线劳动南路站交通导改公告为确保地铁五号线劳动南路站顺利施工，经相关部门同意，施工单位将于2018年12月18日夜间对劳动南路站六号线车站主体东南角铺盖及劳动南路和南二环十字西南角人行道范围进行部分围挡调整施工，计划工期6个月。施工围挡后，保证双向6个机动车道2个非机动车道。因地铁施工给大家带来不便，敬请谅解。（西安地铁）	未
小布播报今天12月5日，我们一起来看新闻吧！！！	未
小布生日福袋又被抢光啦！留言换福袋，今天继续约呀	未
小布生日送福袋今天的福袋特别重！小布要送咖啡机！小布的福袋越来越重啦！咖啡机浐灞湿地公园门票！咖啡机都送上了，谁还敢说小布不爱你赶紧来参与！今天的福袋特别重！小布要送咖啡机！	未
小帅哥保持这个更推频率！	未
小帐篷，出行必备	未
小年夜来这里看灯彩！第二届溧水秦淮源头灯会紧张筹备中	未
小店内偶遇一位87岁老奶奶，打印机玩的比我还溜！早安，大连！	未
小度语音车载支架正式发售老司机准备好！支走你驾驶烦恼的小度语音车载支架12月10日将正式发售！标准版69元与无线充电版99元同时开抢！除驾驶以外的所有需求，一句小度小度通通帮你搞定！小度小度，导航回家，顺便路过下加油站小度小度，帮我给老婆打个电话小度小度，来一首抒情的歌 你只管开好你的车，剩下的交给小度！友情送上抢购链接：小度商城（dumall.baidu.com）。至于能不能抢到，祝大家好运	未
小庭昊快醒过来吧！义乌这家银行捐款16万余元，有爱就有力量	未
小康城市100强！安徽8地上榜！有你家乡吗	未
小张是一名冻龄美少年，他的年龄像果冻一样是的，小张是一只史莱姆。	未
小微企业//@云中迪声为君来:不光人民币，其他国家的钞票也印的小微企业//@余生伴你么么哒:哈哈哈哈哈哈//@sunwear:这公司怎么这么得瑟//@天眼查:我知道了 查看图片	未
小微企业最高可申300万元创业担保贷款	未
