“小默克尔”当选德国基民盟新主席	未
崔天凯：中美经贸磋商正在深化	未
崔天凯：中美需解决经贸问题但不是零和游戏，必须取得双赢	未
崔天凯:中美需解决经贸问题必须双赢 不是零和游戏	未
崔天凯：共同推进以协调与合作为基调的中美关系	未
崔天凯：解决具体经贸问题不是零和游戏 必须取得双赢结果	未
崔天凯谈中美元首G20会晤：望推动双方在多领域有进展	未
崔天凯谈中美元首G20会晤:望推动双方多领域进展	未
崔天凯送给美国8个字新年礼物：解放思想 实事求是	未
崔晓波出席国际金融论坛全球年会，总结金融科技三大发展阶段	未
崔树：细节之处见大美	未
@崔永元 老师晒出捐款二十万的收据，翠芬们纷纷要求我说点儿什么。我当然对崔老师的爱心捐款表示由衷的钦佩，不过我觉得用微博网友的打赏做捐款，貌似改变了网友们的捐款意向，当初崔老师可是说要用打赏的捐款用于寻找156位烈士家属，咋的了崔老师改主意不找了还是打算请刘海鹰医生代找	未
崔永庆出席“国家大数据战略推进实施前沿问题研讨会”	未
崔珉豪出演《长沙里 9.15》与梅根·福克斯合作	未
崔荣宰百变主唱崔荣宰 图片181207 音银上班新闻图 资源：将军（请勿二改商用 转载请注明出处）	未
崔荣宰 百变主唱崔荣宰图片181218 日巡周边荣宰相关 接收一整套美颜暴击！ cr.namlek 资源：盏盏（请勿二改商用 转载请注明出处）	未
崔荣宰百变主唱崔荣宰图片181222 Nestival 2018 Day2 荣宰手写卡片 韩语： 想念想念太想你了 泰语：想念 cr._baitoey1023 资源：盏盏（请勿二改商用 转载请注明出处）	未
崔荣宰 百变主唱崔荣宰预览181207 新村签售 cr.@silverlining_yj资源：将军（请勿二改商用 转载请注明出处）	未
崔雪莉雅诗兰黛代言人 先下先得哦数量有限 随时截止崔雪莉	未
崔黎书记带领相关部门负责人调研城区棚改和城市建设	未
崔黎带领相关部门负责人召开城市建设现场推进会	未
崖头街道叮！青山社区煮妇课堂开课啦！	未
崭新的气象——改革开放40年变迁系列述评文化篇	未
崽下课啦	未
崽崽多穿点呀	未
崽里子碰到经典销售套路，差点上套！	未
嵊州农村的房子值钱了！只需这么做这项政策已吸资上亿元！（不知道的亏大了）	未
嵊州农村的房子值钱了！这项政策已吸资上亿元！只需这么做	未
嵊州四好农村路，三界告捷，全市冲刺500里	未
嵊州城南又建新小区，一大波设计方案出炉...	未
嵊州城南又建新小区，就在原来的上杨！一大波设计方案出炉	未
嵊州市12.4国家宪法日集中宣传活动暨首个宪法宣传周启动仪式在文化广场举行	未
嵊州这些视频你看了吗1分钟奖励3万元，小视频里有大文明	未
嵊州这几个村上榜市级名单！不一样哦，看看有你家吗	未
嵊州这几个村出名了，上榜市级名单！	未
嵊新汇关于市领导公开约访的预通告文创主题馆招人啦！	未
嵊新汇嵊州这条路将进行交通管制 300多人旗袍秀，别错过直播！	未
嵩县便民11月23号，嵩县便民信息精选更新	未
嵩县便民11月24号，嵩县便民信息精选更新	未
嵩县便民11月26号，嵩县便民信息精选更新	未
嵩县便民11月27号，嵩县便民信息精选更新	未
嵩县便民11月28号，嵩县便民信息精选更新	未
嵩县便民11月30号，嵩县便民信息精选更新	未
嵩县便民12月1号，嵩县便民信息精选更新	未
嵩县便民12月2号，嵩县便民信息精选更新	未
嵩县公益大型公益扶贫节目《脱贫攻坚进行时》走进嵩县	未
嵩县卧龙谷赏秋色	未
嵩县反馈今天下午公园一幕希望能有个应急电话	未
嵩县天桥沟：旅游扶贫到旅游富民	未
嵩县报道人民网评嵩县：生态立县，旅游富民	未
嵩县提醒今天下午二桥头查酒驾有感	未
嵩县旅游嵩县木札岭第二届冰挂旅游节要来了	未
嵩县爱心洛阳凯瑞集团到嵩县于沟村开展爱心帮扶活动	未
嵩县爱心爱心企业到何村乡资助贫困学生	未
嵩县车村镇，深山里的世外桃源	未
嵩县风景95年的老阿姨游石头部落	未
嵩县风景嵩县深山里的世外桃源	未
嵩山一号大道，民生大道，扶贫大道，生态天道，景观大道	未
嵩山论坛2016年会开幕 张宝文出席开幕式	未
嵩山论坛年会昨日开幕 逾百名大咖论道经济文化	未
嵩山论坛有望牵手欧洲开“分号”	未
巅峰内斯塔，放现在什么价格	未
巅峰时期的卢本伟玩斗地主什么水平，只用20万赢到580万-虎扑帖ID：24635920 网页链接	未
巅峰状态的“飞人”，让亚运会变成个人表演|日签	未
巍巍太行里的壮美山城阜平（视频介绍）	未
巍巍的眼镜太真实了吧//@噫_浪里小菠萝: 暖烘烘的。	未
巍通国际物流（上海）有限公司招聘总经理销售海运操作等岗位  航运界	未
川R车主有福了！这里有6万元的油卡等你来领，最高能得1吨油...	未
@川ZXXXXX ， 您是好司机吗快来参加活动瓜分5吨汽油！	未
川会比较偏爱气质小姐姐的打扮这件獭兔狐狸也是主推款，各种风格都好驾驭，出多色哟，理图完成后砸9图 zan中chou1送300券吧 韩国首尔	未
川内2处仙境封山了！但成都周边还有4处免费景点可带娃去耍雪	未
川博3件宝贝上了《国家宝藏》 背后还有一个故事	未
川味看家菜1113	未
川大华西校区钟楼，掩映在一片金色灿烂之间，拍照超有感觉！快来打卡图丨@小唔同学 成都银杏季成都爆料	未
川媒：央视2019春节戏曲晚会将在成都武侯祠设分会场	未
川影当选四川省广告协会副会长单位  黄元文董事长受邀出席会员大会并接受授牌	未
川总：两位才华横溢之人，刚刚完成了一本关于我经济政策的神奇的书，或者他们称之为川普经济学...他们在捕获我长期持有的观点和想法方面做得非常出色。这本书现在正在热销中 -一本主题非常有趣的精彩读物！就差出一本川建国谈（）国（）政了。	未
川总：我很高兴宣布，我们非常有才干的美国国防部副部长帕特里克沙纳罕将从2019年1月1日开始出任代理国防部长。帕特里克在担任副部长和此前在波音任职期间都取得了一系列成就。他会很出色！	未
川总是一名鞠躬尽瘁，为国为民的好总统。看他在坚果里的讲话就知道了：trump in a nutshell 。。	未
川报观察年末巨献  这40年，四川男神李伯清都读过哪些书	未
川普350回家今天，@四川航空 第二架A350顺利抵蓉，川航机队规模也扩大至145架。此架A350首航初步定为11月26日成都北京往返航班，去程3U8547，06:05由成都起飞回程3U8548，10:15由北京起飞。由于这是首架采用川航普通涂装的A350，因此也被网友戏称为川普航空那些事儿	未
川普唱多美股，呼吁抄底机不可失12月25日，在圣诞讲话后的记者问答环节中，刚喷完美联储的川普呼吁：我们的企业是全球最佳，表现也真得不错，有创纪录的数据。所以我认为最近美股深跌的同时，也是个绝佳的买入机会，是个真得特好的买入机会。不过，许多分析师认为美股最近的重挫恰恰是川普的政策及白宫和国会的僵局所致。微博赚钱季	未
川普就在要谈判前接受华街日报采访，其实重要的内容没有说什么东西。就两点，第一是1月1号要实施的关税增长，不大可能取消。（也就是说这一点中国你就别来跟我谈了）二是美联储现在是比中国更大的一个麻烦。从媒体政府公关的角度讲，是想传递什么信息呢肯定是为谈判结果美国看起来美国占了便宜定个调。我们这边要承诺做很多改革，要买很多东西，要放弃中国制造2025，老美要做的则顶多是1月份之后不在其他产品加税，或者是顶天了1月份加的幅度上打几个点的折扣。然后双方在友好协商的气氛中握手言和。	未
川流不息//@重庆事儿:霓虹闪烁了道路//@重庆吃喝玩乐精选:重庆夜重庆生活	未
川渝七日游游玩时间: 1月中旬学生党，穷游为主。加上交通2000左右。以景点住宿图片为主，非常详细，多图。day1 川大day2 熊猫基地 都江堰 锦里day3武侯祠 杜甫草堂 四川省博物馆 宽窄巷子 春熙路 太古里day4重庆 解放碑 洪崖洞day5磁器口 川外小铁路 川美 南山一棵树day6 武隆天坑day7 第三步道 李子坝	未
川渝南下将添新高铁渝湘高铁动工了，广清永线也来了！	未
川渝合作再添新动力 重庆川商发展共同体在渝启航	未
川渝间高速路省界收费站将取消啦！戳这里了解渝籍卡ETC升级	未
川藏第一桥-----大渡河特大桥	未
“川藏第一桥”结束最后质检，雅康高速月底全线通车	未
“川藏第一桥”结束最后质检 雅康高速月底通车	未
川藏铁路拉林段第一座跨雅鲁藏布江大桥铺轨	未
川藏队安全攀登15周年：谢山谢水谢兄弟	未
川西，世外桃源般的上里古镇位于四川省雅安市雨城区境内，四川省十大古镇之一。古镇初名罗绳，旧时为南方丝绸之路，也是临邛古道进入雅安的重要驿站。二水夹明镜，双桥落彩虹，正是对上里古镇生动形象的总体描绘。身临其间，有一种时光倒流回到从前的感觉 .	未
川西之旅沿途花絮	未
川西朝圣之旅，你不能错过的几个圣地！旅行灵感季 带着微博去旅行 @微博旅游	未
川西藏了个世界最大温泉瀑布！还在悬崖上！玩的就是心跳！	未
川越四十年中国有我  家乡 承载着多少美好的回忆 怀念往昔 憧憬未来 小时候的我和现在的我	未
《川越四十年》全媒体直播走进我市 看遂宁40年变迁（视频）	未
川黛 冬日唱诗班女孩 @李子溪BERRY_	未
州关工委办公室开展送温暖进校园活动	未
州残联理事长龙安荣到丹寨督导残疾人康复中心建设项目推进工作	未
州民族中医院医联体合作授牌暨县人民医院弘杏中医馆开诊	未
巡城记点赞台城区又一交通黑点将于近期完成整改	未
巡城记点赞台我市对违建零容忍 即查即拆 提高中心城区首位度	未
巡察心体会系列报道   涂碧波： 强化使命担当  忠诚履职尽责	未
巡展文化列车开到我们身边啦！	未
巡洋舰来两艘//@俄罗斯什么值得买:详细清单，九点开抢，俄罗斯第一品牌牙膏五折再买一送一，一年内有效期，漱口水还有几年保质期全部半价，历史最低，只玩一小时。一小时后全部下架。请大家多买点，这个牙膏品牌老板是普京的人。以后还等他们给我更多好货呢	未
巡演最后3站，12-22广州12-28重庆12-29成都。转发写上你想去的城市，下周二抽出广州，周五抽出重庆成都各5张赠票。票务链接评论见。	未
【巡视一线】紧盯"四风"问题推动立巡立查立改	未
巡视反馈情况公布！有泰来克东龙江桦南桦川汤原绥滨林甸兰西明水！	未
【巡视整改看进展】中国通用技术集团:将巡视整改作为企业"脱胎换骨"重大契机	未
【巡视整改看进展】国家统计局党组：以巡视整改促进统计改革发展	未
【巡视整改看进展】将巡视整改作为企业"脱胎换骨"重大契机	未
【巡视整改看进展】湖南：集中力量解决群众反映强烈的突出问题	未
【巡视整改看进展】辽宁以巡视整改推进环境重塑	未
【巡视整改看进展】驻住房和城乡建设部:监督“探头”推动巡视整改落地见效	未
【巡视整改看进展】驻住房和城乡建设部纪检监察组:监督“探头”推动巡视整改落地见效	未
【巡视整改看进展】黑龙江省委：强化政治担当，认真落实巡视整改主体责任	未
巡视整改筑牢校园安全防线  营造平安育人环境	未
巡逻现场实录2018今晚十点与您相约东方卫视！早安	未
《巡逻现场实录2018》第二集：展示万家灯火下的守夜人	未
《巡逻现场实录2018》第六集直击出警“非常时刻”	未
《巡逻现场实录2018》进行了有关民生问题最得体的记录	未
巡逻现场实录 今晚记得准时收看哦	未
巡逻现场实录 总结的很全面	未
巡逻现场实录控得住大场面，解得了邻里难，精在法理事理情理，细在耐心走心责任心，共筑和谐安全社会敬请期待今天22:00东方卫视巡逻现场实录2018	未
巡逻现场实录控得住大场面，解得了邻里难，精在法理事理情理，细在耐心走心责任心，共筑和谐安全社会。敬请期待今晚21:45 东方卫视《巡逻现场实录2018》	未
巡逻现场实录 有困难找警察 今晚22:10分东方卫视 ，看蜀黍如何化解矛盾[加油]	未
巡逻现场实录 蜀黍的表情包又来啦，杭平华警官在工作中雷厉风行，平时自带喜感，还有点萌萌哒反手一个	未
巡逻现场实录 还记得今年夏天接连来袭的台风吗风雨中的坚守 如果群众需要我们，那我们就尽量地去帮助群众！	未
@巢湖人，重大消息！可以给家人用！医保卡还有这些新变化！	未
巢湖今冬初雪将至！这次冻真格：200余吨融雪剂20余台抢险机械车辆全部到位！	未
巢湖半岛的风水宝地：从六家畈到长临河	未
巢湖又一批规划来袭！半岛生态科学城宋都如意长江中国安全食品研究院都是你关心的	未
巢湖将新增2条公交线路！快看看有没有能到你家的....	未
巢湖综合治理攻坚战打响：2020年蓝藻控制有力 形成环湖生态绿廊12月12日，安徽省政府办公厅公布巢湖综合治理攻坚战实施方案根据方案，到2020年，入湖污染负荷有效削减，河湖水质有效改善，湖区蓝藻控制有力，基本建成环湖生态湿地和生态防护林，形成环湖生态绿廊等巢湖打响综合治理攻坚战 领导干部盲目决策将终身追责	未
工业2018年1-10月份白音华工业园区工业总产值超百亿元	未
工业互联网体系建设指导性文件将出	未
工业互联网发展加速，关注相关概念	未
工业和信息化部副部长解读 《促进大中小企业融通发展三年行动计划》	未
工业品价格保险迎“首秀”复制农产品“保险+期货”模式	未
工业“摇篮”的蝶变传奇——上海杨浦的双创之路	未
工业旅游帮助解决俄企用工荒圣彼得堡公共组织商业俄罗斯旅游和旅游服务委员会主席伊琳娜谢苗诺娃称，最近越来越流行的工业旅游能帮助年轻人和较年长的人合理选择或更换行业，帮助企业克服用工荒。工业旅游帮助解决俄企用工荒	未
工业旅游照亮白银城市转型之路	未
工业游走起！上汽大众养乐多太太乐嘉定这些大咖工厂可预约参观！	未
工业百强县（市）分布16省区市 苏鲁浙等继续领跑	未
工业结晶技术分类发展历程现状详解，千万别错过！	未
工业设计所：打造大飞机的工业之美	未
工业风和极简的混搭，理性到了极点	未
工人意外挖出700年前神秘棺材，居然是这样的！	未
工会之家丨兴海给你家一样的温暖	未
工会是如何按照中央部署扎实推进改革试点工作的？	未
工伤预防 和谐万家2018潍坊市工伤预防公益宣传文艺演出	未
工作ing(_) 微博视频 海绵宝宝片尾曲	未
工作中要怎样展示自己的成果，看起来又不像是在邀功	未
工作人员当托儿 揭秘福袋机“30元赢大奖”套路	未
工作人员当"粉丝" 福袋机"30元赢大奖"套路多	未
工作人员：我们画了一个符合你酷酷形象的卡通鹿！放心 鹿哈：	未
工作人员是个有故事的人。 红人的诞生 V影响力峰会	未
工作人员给我说可能是吴克群颁奖我准备苦练下 为你写诗！22号抓到我有小礼物送 V影响力峰会	未
工作人员连续作战！提前13小时恢复供水	未
工作会议南湖新区召开经济运行工作推进会	未
工作信息河南精神文明建设:从倡导quot五讲四美quot到弘扬时代新风从1981年起，以五讲四美为主要内容的文明礼貌月活动在全国广泛开展。随后几年，五讲四美成为社会主义精神文明建设的指导原则，也成为中原儿女走向文明之路的行为准则。融合实施文明城市创建和百城建设提质工程，推进学雷锋志愿服务制度化建设，加强未成年人思想道德建设，深入开展移风易俗活动通过弘扬时代新风，中原大地凝聚起一股强大的向上向善的力量，为我省改革发展稳定提供了源源不断的精神动力和道德滋养。从倡导五讲四美	未
工作到位的秘诀都在这七个字里（附思维导图）	未
工作动态今天上午，省生态环境厅组织收听收看庆祝改革开放40周年大会。厅领导，在厅机关综合楼办公的机关各处室直属单位干部职工参加。厅其他直属单位在各自驻地组织集中收听收看。	未
工作动态 今天下午，省生态环境厅组织厅志愿服务队20余名志愿者赴光大水务（济南）有限公司参观考察，了解公司发展情况，并听取了公司在环保设施向公众开放方面的有关情况介绍。	未
工作动态区文广局对各镇各社区文化工作进行考核	未
工作动态区文广局：走访入户摸排情况 确保农户温暖过冬	未
工作动态区食药监局取缔一家无证豆制品小作坊  铁山区第二次全国污染源普查质量获市污普办充分肯定	未
工作动态县委办党办业务素质竞赛系列活动正式启动	未
工作动态安全不留死角！醴陵市开展烟花爆竹零售专项整治行动	未
工作动态巉口镇召开全镇基层党组织建设与新型经营主体培育双进双促工作推进会议	未
工作动态市人大常委会视察旅游业发展	未
工作动态  温江区积极开展食品安全互动体验科普知识宣传主题活动	未
工作动态第六期数字城管大讲堂：重庆市江北区数字城管主任曾卿华阐述智慧城管的设计与应用	未
工作动态  这群小小体验员走进科普体验站，零距离感受食品安全	未
工作动态  金牛区食品安全科普体验站之瓜子体验活动	未
工作地机场！初中以上学历可报！湖南空港实业招聘55人！	未
工作坊︱医学史应该打破内外史壁垒，进行跨学科研究	未
工作坊  年度营销战略规划带你实操落地	未
工作坊︱跨领域、跨学科对话：古代中国国家研究的新探索	未
工作太累， 去健康足疗一下！	未
工作室下次可以不要搞那么高饱和的背景墙嘛不要浪费姐姐的颜值 谢谢	未
工作室定下来了！微博长治小歇几在长治的第二个家家了！欢迎随时来找我玩 @所有人吃上一碗刀削面庆祝一下准备收拾！	未
工作成绩突出！毕节10个单位，15人获省表彰	未
工作成绩突出！贵阳这10个单位和15名个人获表彰	未
工作推进永兴镇召开毁田种茶整治工作部署会	未
工作时的心情 岛国网友沢渡的女儿的家庭作业，献给周一的你(twi:amane_sawatari)	未
工作机会山西转型综改示范区财政预算评审中心招聘！	未
工作狗表示很需要	未
工作的周末	未
工作累了记得多放松自己哦	未
工作细胞特别好玩	未
《工作细胞》血小板粘土人 萌到失血急需小可爱救治	未
工作结束，一刷微博，迅速的了解大致情况，赶紧叫了一份外卖，跟上	未
工作群里护士们发过来的心肺复苏培训和突发意外应急演练内科大夫利用休息时间自己去急救中心参加培训并考了个BLS的证我们的护士已经有医疗机构开始挖墙脚了很多时候留住人并发掘出自主能动性的，不只是薪酬，更多的是开心，团队感，同事间的互相关怀 北京首都机场T3航站楼	未
工作间，每一个亮光就是一个焊工	未
工作队边说边干，助力村民把钱赚	未
工作陪娃两不误，只因为多做了这件事！	未
工信部：2025年掌握虚拟现实关键核心专利和标准	未
工信部专家韦乐平：5G投资将达1.2万亿元 投资周期或超8年财联社12月19日讯，据财新报道，近期，工信部通信科委常务副主任韦乐平表示，按照容量站来建设， 5G投资大约为4G的1.5倍，全国总体来看，预计5G投资达1.2万亿元。5G投资周期可能将超过8年。韦乐平解释，5G的工作频段高， 基站多（至少是4G的2 ...全文	未
工信部传大消息：你手机号自由了，可随意转换三大运营商！	未
工信部传来大消息：你的手机号自由了，不换号码也能换运营商工信部于12月起，正式启用quot携号转网quot新流程也就是说，在不换手机号的情况下，随意转换三大运营商哪家套餐便宜就转哪家据了解，目前国内首批试点新携号转网流程的省市为天津湖北云南江西和海南。河南啥时候实现工信部传来大消息：你的手机号自由了，不换号码也能换运营商	未
工信部传来好消息：不换手机号，可随意转换三大运营商！	未
工信部: 修订行业标准 将增加石膏矿渣水泥等多个品种	未
工信部公布11月电信业务使用情况，发现短信业务短信居然又活了。短信增长的主要是服务登录和身份认证等服务持续普及的带动。换句话说发个短信验证码收商家的优惠信息，成了增长点...想想双11双12短信就像前两年春节那样短信拥堵，增长也就不足为奇了。工信部：2018年前11月短信业务量增长12	未
工信部公布2018年物联网集成创新与融合应用项目名单	未
工信部公布机动车准入办法 鼓励技术创新	未
工信部公布电摩资质第一法：电摩标准大局已定！（内有全文链接）	未
工信部公示第三批拟公告符合锂离子电池行业规范条件企业名单	未
工信部再传好消息！明年6月1日起废止摩托车生产准入旧管理办法！	未
工信部、农行推进金融支持县域工业绿色发展工作	未
工信部副部长张克俭：要同步推进网络安全和智能制造	未
工信部：加强国家工业遗产合理利用 发展工业旅游	未
工信部：加快推进制造强国、网络强国建设	未
工信部：加快推进虚拟现实产业发展 进一步拓宽产业融资渠道	未
工信部印发加快推进虚拟现实产业发展指导意见	未
工信部：双积分平台数据报送模块正式上线	未
工信部发布了最新一批可享受车船税减免的车型名单  百家车谈	未
工信部发文加快推进虚拟现实产业发展	未
工信部发文加快推进虚拟现实产业发展财联社12月25日讯，今日，工信部印发《关于加快推进虚拟现实产业发展的指导意见》。到2020年，我国虚拟现实产业链条基本健全，在经济社会重要行业领域的应用得到深化，建设若干个产业技术创新中心。到2025年，我国虚拟现实产业整体实力进入全球前列，掌握虚拟 ...全文	未
工信部发文推进VR发展 2025年掌握核心专利和标准	未
工信部：将积极指导各基础电信运营企业做好5G系统试验的基站部署	未
工信部：将积极指导各基础电信运营企业做好5G系统试验的基站部署，促进我国5G产业健康快速发展	未
工信部：将进一步加大对中小企业发展的支持力度	未
工信部开展商务楼宇宽带垄断专项整治：保障用户自由选择权利	未
工信部：引导金融资本支持纺织业民营、小微企业	未
工信部批复5G试验频率 全国范围规模试验将展开中国电信获3400MHz-3500MHz共100MHz带宽5G试验频率资源移动获2515MHz-2675MHz4800MHz-4900MHz频段5G试验频率资源联通获3500MHz-3600MHz共100MHz带宽5G试验频率资源。按计划，中国将在2019年进行5G试商用，2020年正式商用！（央视）	未
工信部批复5G试验频率 全国范围规模试验将展开中国电信获3400MHz-3500MHz共100MHz带宽5G试验频率资源移动获2515MHz-2675MHz4800MHz-4900MHz频段5G试验频率资源联通获3500MHz-3600MHz共100MHz带宽5G试验频率资源按计划，中国将在2019年进行5G试商用，2020年正式商用！（央视新 ...全文	未
工信部：支持利用国家工业遗产发展旅游	未
工信部数据：1-11月新能源汽车产销破百万辆12月13日消息，据工信部公布的数据显示，11月，新能源汽车产销分别完成17.3万辆和16.9万辆，同比分别增长36.9和37.6。其中，纯电动汽车产销分别完成13.5万辆和13.8万辆详情点击：工信部数据：1-11月新能源汽车产销破百万辆	未
工信部正式发布3大运营商5G频谱（附解析）	未
工信部：积极培育信息消费新业态、新模式	未
工信部：第314批电摩及正三轮品牌产品目录，爱玛新日台铃绿佳榜上有名	未
工信部等4部门印发《促进大中小企业融通发展三年行动计划》通知	未
工信部赛迪研究所副所长陆峰：七大思维加快数字政府建设	未
工信部赛迪研究院赵卫东：以高科技为核心的“小巨人”是未来科创板生力军	未
