寰行中国第三站：郑州，如此生活三十年	未
对2019年的小小期盼	未
对DMZ感兴趣的小伙伴，可以来场DMZ第三地道观光！这里是朝韩隔离区，也是世界上唯一一个可供游客观赏的军事分界线，与一般景点不同，多了几分庄严，却也因此吸引了很多游客，特别有意义，如果觉得枯燥，还可以再去lt来自星星的你gt拍摄地普罗旺斯村逛逛，心动戳网页链接	未
对G20峰会中美元首会晤有何期待？外交部回应	未
对TA说晚安提起法国，小云首先想到的就是葡萄酒香水以及卢浮宫，不得不承认法国似乎已经成了浪漫的代名词。小伙伴都做过哪些浪漫的事转评，小云将抽一位送出华为耳机一副。	未
对一个人用心过头 只会加速他对你的厌倦	未
对不上不存在的，镇魂女孩绝不放弃！！哈哈哈哈哈哈哈哈哈哈哈评论都是人才我的cp必须对得上	未
对不起，我去宁波看秋景了！	未
对不起，我要去宁波了！快来呦，宁波欢迎你	未
对不起，我这辈子铁定留在广西了！因为广西实在是太美了！	未
对中国人免签国家旅行全攻略	未
对中国足球有什么“新年寄语”？球迷评论亮了……	未
对中国青年报的这篇文章，切不要用是否软文去评价，而要看所报道的主体，是不是值得报道，有没有社会价值，能否引起社会共鸣，能否产生良好的宣传效果。	未
对了，今晚再抽送一个价值 198 元的丹麦 PO 泡温杯	未
对了，明天6号晚上有直播哦	未
对于18以上漂亮女生来说，有哪些社会潜规则越早知道越好！	未
对于一名的老司机来说驾驭这个很是easy啊哈哈哈哈哈哈这风驰电掣的感觉嗖嗖嗖26年考了8本驾照	未
对于产后女性，凯格尔运动可以改善产后漏尿等问题哦	未
对于克莱的挣扎，库里说：不只是克莱可以打得更好，我们都可以打得更好，我们可以打得更坚决，给克莱创造更多的机会，更好地转移球。汤普森NBA圣诞大战NBA吐槽大会	未
对于漂亮女生来说，有哪些一定要在20岁前知道的事！ .	未
对于神秘的伊斯坦布尔的旅游，我不知不觉地开始叨逼叨，干货满满，血槽已空。听看看尤其是后半段，有小伙伴听到后半段，感动落泪。	未
对于穆里尼奥的下家，国外机构列出了一串名单，最看好国米和葡萄牙国家队。	未
对于能力有自知的吃瓜群众的操作建议，老粉都很清楚1.沪指进c区 2.老湿的净值突破出新高当然，这两件事很可能就是一件事，误差应该就是几天的事老湿对吃瓜群众算不错了，多余的是你想多了，毕竟大家并不熟，老湿也不是寻常意义上的股票大v，看热闹请注意姿势 老湿流氓的很，我不太在意也关照不到那么多不熟的人	未
对亲情多一点耐心	未
对你们来说怎样才是一个最完美的休息，是去海滩度假还是去外国彻底放空闲逛，随便说说	未
对你来说，送张画就像送张纸那我送你张纸好了...	未
对假冒政府网站整治步步升级(图)	未
对内部资源进行整合重组 南通机场集团化改革向纵深推进	未
对冲基金奇才杰克-施瓦格：如何成为伟大的交易员其中《对冲基金奇才》系列，可以说影响了整整一代人。他称：罗杰斯永远不会通过技术分析赚钱，舒华兹不会通过基本面分析赚钱，但他们的投资表现都极好。对冲基金奇才杰克-施瓦格：如何成为伟大的交易员	未
对出口和经济应该更有信心	未
对变电设备及时消缺 为迎峰度冬筑牢基础12月5日，@国网烟台供电公司 完成220千伏桃村变电站220千伏银桃线216间隔同期PT更换工作。同时对银桃线B相C相CT充气底座裂纹进行消缺处理并顺利送电，保证了设备正常工作以及秋检期间电网的安全稳定运行，为迎峰度冬奠定良好基础。	未
对口帮扶省审计厅省交投集团援建茸安乡阿斯玖村幼儿园揭牌仪式隆重举行	未
对口援疆 惠及芳草湖农场职工群众	未
对古墓的保护，不是只有考古发掘放到博物馆中。尘归尘土归土，保护原状更加重要，在科学之上还有伦理和传统。要杜绝那些故意管理不善而抢救发掘的行为，违规考古与盗墓五十步笑百步而已。	未
对吃的感兴趣	未
对吧嘻嘻，大家的虾军长有没点好玩	未
对哦去年今天我还去见你啦！好快！	未
对啊，在个体的心理研究之外，社会结构的压力制度与法律对人的塑造，更加力量强大。//@俞静F:社会的压力终将弥漫在每个家庭中由个人去承受痛苦。	未
对啊，最重要的是，我怎么可能买广告我就上次双十一买了一次，哇哦阿胖4个月奶粉！	未
对啦！这个原博转赞评还有25个礼物送给大家呢	未
对啦，这个明天开浆！需要买同款的看原博评论哟，两袋还有U惠嘻嘻，天气冷了喝这个贼棒	未
对外大连通，对内大循环！大埔织成一张交通致富网	未
对外开放40年，那些难忘的“第一次”	未
对外开放40年，那些难忘的“第一次”(图)	未
对外开放：发展中国 造福世界	未
对外开放：发展中国 造福世界	未
对外经济贸易大学副校长丁志杰：新时期中国金融开放的三个新特点	未
对外经济贸易大学副校长丁志杰：新时期中国金融开放的三大特点	未
对好莱坞的亚裔来说，现在是最好的时代	未
对宋徽宗的辩护，伊沛霞并不成功	未
对实现高质量发展的几点思考（国际论坛）	未
对家暴说不！安徽上半年发出206份人身保护令：市民反家庭暴认识提高数据显示，2016和2017年两年，安徽各级法院共发出人身保护令105份。而2018年上半年，安徽人身保护令共发出206份。人身保护令数量增加，主要是因人民对反对家庭暴力认识的提高。（图/江苏新闻）网页链接	未
对家暴说不！禅城这场500人的活动很有爱	未
对对对，我知道了，快带着我的祝福滚	未
对我来说 手机充满电量 饿极了吃一口大汉堡 暴雨时在温暖的家里 冬天里穿上厚厚的棉服围巾手套口罩摸着暖气看窗外飘雪 都比爱一个人要有安全感的多	未
对手为何难防波波：你之前看过勒布朗的比赛吗在比赛关键时刻，对手命中了很多投篮，我必须要称赞他们的表现。勒布朗（詹姆斯）是发动机，他命中了几个很棒的三分球。Zo（朗佐-鲍尔）能够攻击篮筐，也能够突破分球给处于空位的队友，他在各个方面都有所表现。这是一场很棒的比赛。波波维奇说道。当被问及在比赛最后时刻，对手为何如此难防，波波维奇说：你之前看过勒布朗的比赛吗他是勒布朗-詹姆斯，这就是他如此难防的原因。	未
对手打破世界纪录，王简嘉禾400米自屈居第二2018杭州世游赛女子400米自由泳决赛中，澳大利亚选手蒂特穆斯以3.53.92打破了世界纪录中国选手王简嘉禾获得第二，中国选手李冰洁获得第三赛后王简嘉禾表示：之前没有和夺冠的澳大利亚选手同场竞技过，有这样的对手挺好的，对自己是一种激励  ...全文	未
对接30条：长治靠政策精准滴灌	未
对接存在问题  卡实时间节点 合力推进绿城韩城项目建设	未
对接香港：专业镇的湾区新脉动	未
对最美通缉犯的起底是否反应过度	未
对未来世界的好奇心是我生活的全部动力	未
对标世界一流水平 重庆组建“世赛班”培养技能人才	未
对标世赛标准 上海市汽车维修行业职业技能竞赛举行	未
对标！知名医疗企业售后部门的KPI是怎样炼成的	未
对比董小姐的经典语录和某些名企业家的经典语录，品一品	未
对！油价又将有新变化，台山车主速看！	未
对，满墙三角梅//@透明罐子里的牛牛:不是的，在鸳鸯，西部建材城旁边，上边好像有个妇产医院！春夏更美，满墙的三角梅	未
对照天气预报表，选择一个良辰吉日//@Tonya_Braginsky__: 我好想去体验所有项目5分钟啊天呐	未
对特定群体开展交通安全宣传教育，营造和谐畅通安全的道路交通环境	未
对症下药！力促专项治理工作落地落实	未
对的最好是熟悉的有店面的就怕小作坊！建议平台实下名//@内涵小表妹: 没有堂食的店面都小心点，尽量别吃，毕竟，堂食的卫生都不一定好	未
对，皮皮虾号的机库面积大幅度增加了，舰载机运转也更加高效，打击能力更强//@何康-Michael:那第二艘17号航母，是不是可以解决这个问题，机库面积是不是能超越出云号	未
“对祖国的爱，要大声唱出来”	未
对美暂停加征25关税商品清单	未
对美暂停加征5关税商品清单。戳图	未
对联里的风景丨天津有个「七里海」	未
对自己好一点！算算你的2019假期怎么安排	未
对自己好点	未
对葡中关系未来充满信心	未
对葡中关系未来充满信心——访葡萄牙外交部对外政策总司长佩雷拉	未
对话3000万港元教育奖金得主：AI将如何改变教育行业	未
对话40年，讲述身边的健康故事——医疗惠民亚克西 	未
对话40年，讲述身边的健康故事（第七集）	未
对话40年，讲述身边的健康故事（第九集）	未
对话｜7岁上港小球迷泪洒中超颁奖，她的故事才是“最佳”	未
对话Chris Dixon：今天的互联网更像是迪士尼乐园，它不再那么令人激动了	未
对话丨“琅琊王”策展人：透物见人，解读文化思潮和艺术审美	未
对话主旨我看懂了：CHERRY键盘好好！	未
对话｜凌利中谈董其昌大展：理解了他，才会更好理解文人画	未
对话刘国梁：张本智和很招人喜欢，他能激发强者的斗志	未
对话区块链现状与未来：“百舸争流”到“价值至上”(图)	未
对话基层一线党员(14)创建森林城市	未
对话基层一线党员(15)找回老城的记忆	未
对话基层一线党员第十四期预告创建森林城市	未
对话《奇葩说》冠军陈铭：马薇薇口中的“标准人”	未
对话小牛电动CEO李彦：上市后压力更大 将重点发力欧洲市场	未
对话德银中国董事长高峰：走向直接投融资是必然趋势	未
对话改革开放亲历者他见证了太仓职业教育异军突起	未
对话新疆交建沈金生：从高速公路工程队到新疆交通基建领军企业  约见资本人	未
对话最美逆行者消防员程磊：我必须更快到达现场因成功救出被困人员自己却被烧伤入院，内蒙古自治区通辽市消防支队奈曼旗消防中队指挥员程磊被网友称赞为最美逆行者11月29日，位于奈曼火车站附近一处平房起火，内有人员被困，程磊和参与救援的队友得知，被困的是一名女学生，当时生死未卜 ...全文	未
对话最美逆行者消防员程磊：我必须更快到达现场因成功救出被困人员自己却被烧伤入院，内蒙古自治区通辽市消防支队奈曼旗消防中队指挥员程磊被网友称赞为最美逆行者。11月29日，位于奈曼火车站附近一处平房起火，内有人员被困，程磊和参与救援的队友得知，被困的是一名女学生，当时生死未卜。程磊当即和队友冲进火海，撞开反锁的房门，将女孩抱抬出。对我们来说，一秒钟就可能会有生命危险。 程磊受伤入院后，获救女孩和母亲将一面奋不顾身，舍己为人的锦旗送到病床前。12月17日，程磊告诉澎湃新闻，虽然这是自己工作	未
对话欧洲珠宝设计师，探索百年珠宝设计哲学	未
对话联想贾朝晖：重点投入电脑智能化 未来三到五年覆盖全部产品	未
对话蔡康永：情商是为了更好地伺候别人？我不要	未
对话贾秀全：世界杯力争小组出线，女足“绽放”需巨大努力	未
对话“逍遥子”张勇：为乡村振兴插上数字经济的翅膀	未
[对话重庆民营企业家] 左宗申：进军通航产业 转型产融结合	未
[对话重庆民营经济]坚守"小齿轮"里的"大世界"	未
对话金软景：在中国打球享受“公主”待遇，离开不是因为钱	未
对越反击战，解放军一个团歼敌681人，打出集体二等功	未
对越反击战越军打仗有特点，火力猛工事强逃跑快能打游击战	未
对越反击战轶事：女兵在战场上如何方便都是个难题	未
对越自卫还击战录像（老兵珍藏纪念版）	未
对面楼的，被围观啦！	未
对颜值经济不能放任自流	未
寺库与威尔仕健身跨界合作 完善高端生活方式布局	未
寺库奢侈品节每个时代，都有抢先一步的人，这次只要你想也可以做到，享智能生活，首选天猫精灵。天猫精灵联合寺库，给你全世界的美好。关注@寺库SECOO @天猫精灵 并转发微博，12月27日抽送gucci香水一瓶。	未
寺库联手凯撒打造1217旅游节 布局生活+旅行服务	未
寺庙门口跳水兵舞，厉害了哦	未
寺街西南营启动首批第三次腾迁	未
寻人！	未
（寻人）万能的微信圈群，帮忙找一下这位诗洞新凤村的年轻人吧！	未
寻人丨82岁老人走失5天，爱心转发	未
寻人卫辉光荣的您赶快来申报吧	未
寻人启事丨@光荣的您，请记得在12月10日前来街道居委会登记信息哟	未
寻人启事十一月三日在新政加油站走失！	未
寻人启事：家人急盼你回家！	未
寻人启事岁月苍苍，人海茫茫，曾经雄关大地经济建设浪潮中有你的身影，告诉我们你在哪	未
寻人启事 急寻兰州战役亲历者见证者老支前和您的后代们	未
寻人启事有谁见过这位嘉会的80岁老人，走失好几天至今未归！急！	未
寻人启事@武汉晚报 @平安武汉 天这么冷，家人在等你回家谭飞，男，45岁，身高一米六八左右，十几年前出过交通事故，有短暂的记忆力，江夏口音，于11月30日上午九点左右在汉口万松园党校附近走丢，当时穿了一件灰棕色的棉袄，下身一条黑色的裤子和一双黑色的皮鞋，身上只有一百多元的现金及一串钥匙? ...全文	未
寻人启事，求舞钢爱心人士扩散（公益）	未
寻人启事！爱心接力！帮助下在邻水走失送养被拐的他们！	未
//@寻人总动员鸣警:世间最美的情书，从来没有题目国史古风	未
//@寻人总动员鸣警:咬定青山不放松，立根原在破岩中。千磨万击还坚劲，任尔东西南北风。国史古风	未
//@寻人总动员鸣警:字字珠玑国史古风	未
//@寻人总动员鸣警:遇一人白首，择一城终老，予一己真心，盼一生偕老。国史古风	未
寻人馆陶王秀红 你快点给我出来！	未
寻味酉阳还记得儿时冬天的味道吗古镇糍粑带你回味！	未
寻回水与上海的缠绵与诗意——上海规划打造世界级滨水区	未
寻图启事NO.1  人民摄影官网封面，你说了算！	未
寻增量空间引入30余品牌 京津佛罗伦萨小镇加大运动占比	未
寻子27年 终于苦尽甘来（图）	未
//@寻子老朱:多一次转发扩散，多一分希望，	未
寻常生活里的一点温暖    Junghyeon Kwon	未
寻年味第四站：人间烟火最朴食	未
寻找1000名邂逅社工会员同行	未
寻找2018年画小警察各组30强名单出炉！接下来，总决赛还有重要任务！	未
寻找2019年第一期海南特区报封面萌主！让你家宝贝一夜之间家喻户晓！！年历宝宝评选开始啦	未
寻找TCL新年锦鲤只要8012年还没有过去，就不要放弃做锦鲤的可能，点开长图寻找新年锦鲤线索，也许你就是TCL要找的人，方法已经告诉你们了，接下来就看你们了！	未
寻找中国小创客官宣来啦十大2018年度中国小创客出炉！经过由戴自更俞敏洪张磊张泉灵汤敏刘慈欣郝景芳和高云峰组成的强大导师团票选，寻找中国创客联合编程猫东方坐标学院及山水创投打造的大型青少年创意公益评选活动完美收官，十大2018年度中国小创客正式诞生！校园钉钉小蓝人工智能系统视觉辅助系统定格动画3D空气净化口罩孩子们的天马行空奇思妙想，让我们看到了关于未来的无限可能！	未
寻找中國好產品。	未
寻找临沂最有面的人！马队长牛肉面全年免费吃！！	未
寻找光荣的您！事关莱芜退役军人和其他优抚对象！	未
寻找光荣的您：兴国退役士兵及其他优抚对象信息采集	未
寻找光荣的您！宾阳县退役军人和其他优抚对象信息采集工作顺利开展	未
寻找光荣的您！退役军人12种优抚对象随州已采集3万人！等着您	未
寻找光荣的您：退役军人事务部关于信息采集工作答记者问	未
寻找光荣的您鹿寨县开展退役军人和其他优抚对象 信息采集工作的公告	未
寻找全椒会玩麻将的人，发红包啦！	未
寻找卡门：儿童歌剧卡门2019年首次登陆中国	未
寻找历史初心，一本写给90后的改革开放40年简史	未
寻找吉卜力。	未
寻找地铁锦鲤我在新浪财经看世界今日起，新浪财经客户端我在新浪财经看世界主题专列就正式发车啦！只要乘坐北京地铁，随手拍下新浪财经海报，并@新浪财经 就有机会成为地铁锦鲤！快来参加吧！活动期间，每周五及跨年期间（12月21号28号31号及1月4号11号）会各抽取1位，共5位锦鲤，并 ...全文	未
寻找地铁锦鲤我在新浪财经看世界寻找地铁锦鲤，你是游走在地铁里的那条幸运lt)))gtltlt吗发现红色系列新浪财经海报，随手拍下@新浪财经，用行动证明你是对的鱼！	未
寻找地铁锦鲤我在新浪财经看世界想前往一年一度的吴晓波频道年终秀与财经大咖面对面交流吗想去往众星云集的微博之夜现场看你的爱豆吗想收获新浪20年限量纪念款周边吗即日起，乘坐北京地铁，随手拍新浪财经海报，@新浪财经就有机会成为地铁锦鲤！转发活动微博，还会获赠额外惊喜奖品哦！ ...全文	未
寻找夜空中最亮的星，爽爽试驾新CS75  爽爽侃车	未
寻找大连冬日之美，这些地方不可错过	未
寻找失联幸运粉丝	未
寻找少帅杨伟东	未
寻找属于您的温泉旅行，尚天然温泉鲁冰花童话王国农民画博物馆套票，只需39.9元。让您舒心让您舒适	未
寻找广饶锦鲤！	未
《寻找战友》第215期	未
寻找新长沙的味道 城市厨房为你揭秘长沙人的生活	未
寻找最需要帮助的人红十字2018扶贫援助行！	未
寻找橙乡最美劳动者江晓明：不让心脏停产的电仪管理工	未
寻找汤阴谁认识这个大姐告诉她出名了！	未
寻找温暖的家就来我爱我家中介	未
寻找滋补行家走进丽水 免费帮忙熬制阿胶	未
寻找灵魂画手，寻找国风英雄创造星会画画的我你赶紧来参加！报名方式见图！王者国风英雄	未
“寻找玄武湖夜景下的青春芳华” 美文征集结果发布	未
寻找神木烈士王怀喜的家人 ，战士长眠南疆，等着你们来祭奠！	未
寻找行业破题点 元洪食品装上“数字引擎”	未
寻找记忆中的年味乡村里的杀猪宴！	未
寻找诗意，不用去远方醉美石牛在等你	未
寻找豫A2S662好心司机，您救的那个孩子出院了车友卢先生想通过河南交通广播寻找一位爱心车主：11月18号12点10分左右，卢先生带着1岁多的孩子在郑州高新区公园茂商场吃饭，孩子突然抽搐，昏迷不醒 ，紧急情况下，一辆豫A2S662 的咖色大众车主自告奋勇送孩子去医院，为了赶时间，沿线闯了好几个红灯，10分钟左右就将孩子送到了医院，今天卢先生的孩子出院了，想找到这位爱心车主，道一声感谢！如果车友们您认识这位豫A2S662 的大众车主。可以跟河南交通广播9601188联系。	未
寻找豫A2S662好心司机，您救的那个孩子出院了车友卢先生想通过河南交通广播寻找一位爱心车主：11月18号12点10分左右，卢先生带着1岁多的孩子在郑州高新区公园茂商场吃饭，孩子突然抽搐，昏迷不醒 ，紧急情况下，一辆豫A2S662 的咖色大众车主自告奋勇送孩子去医院，为了赶时间，沿线闯了好几个红灯 ...全文	未
寻找身边的国防人物：首届福建省国防人物新闻宣传活动启动	未
寻找车钥匙（周五）邢台及京津冀限行	未
寻找车钥匙（周末）邢台及京津冀限行	未
寻找青岛最美女乘客：公交车内她蹲地为老人系鞋带	未
寻找食品行业破题点 元洪食品装上数字引擎	未
寻根寻亲55期望各地尹家人帮忙！（2018.11.24）	未
寻梦丝路，人文天水  甘肃全域旅游内容云品牌体验馆天水馆正式上线啦！	未
寻梦丝路，花儿临夏  甘肃全域旅游内容云品牌体验馆临夏馆正式开馆！	未
【寻梦赤子心】女医师大陆逆袭！因台湾不承认学历：有实力就可以留下来	未
寻母22年前母亲被拐，儿子现在期盼能见一面！	未
寻求室内无人机导航外包合作	未
寻物启事全州人发财的机会来了！8000元现金酬谢！	未
寻物启事房屋出租房屋出售招聘信息门窗安装美容优惠餐厅转让屋地转让旺铺转让树根出售	未
寻物启事  船院的神奇动物你在哪	未
寻甸县县委书记何健升率队调研乡村振兴 青年人才创业实践基地党建带团建工作	未
寻线上增量  屈臣氏1200家店接入京东到家	未
寻芳江西红墙黄叶小道江西师大，不一样的冬日风景（图 / @边境浪人- ） @青春师大	未
寻见血封喉树，钓水库鲜鱼，游欧洲小镇，这趟儋州绿色之旅都齐全了	未
寻觅乐游云南民族村 体味多彩民俗情之傣族	未
寻访最佳环卫驿站 | 以前蹲墙根儿休息的他们，现在有了“第二个家”	未
寻访澳洲华人200年足迹第三集	未
寻访澳洲华人200年足迹第四集	未
寻踪探秘白鹿城一封来自中山公园白鹿的邀请函	未
“寻迹金陵”纪念改革开放四十周年党日活动	未
导师招募  来这里，梧桐为你全方位曝光，搭起业务桥梁！	未
导游告诉你：女人为什么要对自己好点！	未
导游提醒：在乌克兰旅游，有美女敲门，千万不要开！	未
导游、黄包车夫、小学生同场PK  “讲解员大赛”讲述秦淮故事	未
导演樊昊仑新作《我的英雄》拍摄中，分镜头脚本曝光	未
导演田七创作歌曲《执笔为念》字里藏情 落笔成殇	未
导演田七创作歌曲《等不起》缅怀挚友“秃鹰”计春华	未
导演田七创作歌曲《雨花阙》许仙儿演绎一曲宠辱不惊	未
导演田七歌曲《梅花窗下问归期》 政和歌手陆诗敏演唱	未
导演章明新作 《冥王星时刻》展映	未
导演管虎：《外滩钟声》是一部情怀之作	未
导演管虎：《外滩钟声》是情怀之作，邀请父母参演	未
导演肖央现身山西太原 回忆20年前阳泉山村写生经历	未
导演贝纳尔多·贝托鲁奇逝世：凭《末代皇帝》拿下奥斯卡	未
导演贝纳尔多·贝托鲁奇逝世：《末代皇帝》系其经典作	未
导盲犬在地铁上困到打瞌睡，却还在默默坚持！路人的表现也是暖暖的	未
导航：您已经到达重庆，导航结束！！	未
导视设计  数字	未
导读11月30日孝昌新闻	未
导读2018.11.23-保康新闻	未
导读2018.11.26-保康新闻	未
导读2018.11.27-保康新闻	未
导读2018.11.28-保康新闻	未
导读2018.11.30-保康新闻	未
导购销售中的尴尬瞬间，10大策略帮你轻松破解	未
寿光最有钱的几位企业家都在这了！看有你认识的吗	未
寿光有个番茄小镇，美呆了！	未
寿县东大街路面升级改造工地发现石棺，具体有待文物部门进一步探查！	未
寿县公交票价公示....老人免费乘车..	未
寿县同镇在寿县招募合伙人！每乡镇只招一个站长，实现乡村创业梦！	未
寿县：执勤辅警捡手机 及时归还获点赞	未
寿命达30年，国内首座3D打印桥长15米，将亮相上海，想走走吗	未
寿宁大力推进梦龙天池景区建设	未
寿宁妙招姐：教您巧妙用衣架挂毛衣不变形	未
寿宴福如东海，寿比南山	未
寿屋推出《P5D》主人公摩尔加纳手办寿屋公开了《女神异闻录5：星夜热舞》手办ARTFX J 主人公摩尔加纳。其高度25cm，还原了PS4《女神异闻录5：星夜热舞》的封面。发售日期为2019年5月24日，现已开启预定，售价14904日元（含税，约合人民币911元）。	未
寿屋 碧蓝航线 光辉欧根	未
寿阳人注意！省里刚刚通知！2019年1月1日起，养老保险迎来新变化！每月可领	未
封丘2019年城乡居民医保缴费开始啦！如何缴费看这里！	未
封丘人快看！关于封土令，新乡市政府又出新政策！	未
封丘家有煤气灶的速看，这个地方用牙签戳一下，每个月省下一半燃气费！	未
封丘王村乡村村打造特色小镇 避免千村一面	未
封丘车主速看！油价又有新变化！	未
封开县正在全力推进双创工作，关于双创你了解多少	未
封开县科普行在南丰中学启动	未
封开掌圈11.26最新封开求职招聘，房屋买卖，商业资讯汇总！	未
