想参与了！！！//@然后下面就没了:看的想原地爆炸//@纳兰无羁:评论令我热血沸腾//@喜脉洗脉:因为我困了啊，这也不行你事儿也太多了吧，我前任就不像你这样//@梁十一_:你为什么要比我先说晚安！！！	未
想发新年财来西湖花市竞标！今年竞标于12月28日8:0012:00在广州产权交易所综合交易大楼二楼举行，用电子竞标方式报价，记得带智能手机及本人身份证参加。竞标都来了，花街还会远吗2019年西湖花市主题是金猪贺岁，幸福越秀，将于明年2月2日8:30至2月5日2:00举行，地点在西湖路教育路。	未
想变美你还差点什么每个人都想变成小仙女小仙子，但颜值的不争气，让你距离这个小目标还是相距甚远，那么想要变美丽，你还差点啥呢测测吧！立即开始测试gtgt网页链接	未
想吃！	未
想吃“大个头”大闸蟹？现在收摊前价格最合算	未
想吃！//@大懒糖:想试试//@Jun_icy:天呐看起来好治愈//@itnkmk_Cara://@Haruka_人设不崩://@蓝泪_求好运:转发微博	未
想吃瓜还不简单吗搜洗白 碰瓷 造谣 通稿等饭圈爱用关键词，点开实时细找源头，再关注几个树洞账号，还怕吃不到吗小瓜靠搜，大瓜靠运气了	未
想听点好消息，多小都行。转走右边这条微博正文 并分享你最近的好事情，在转发的原微博下抽10人送30元话费	未
想和你一起办一场这样甜甜甜的婚礼	未
想和你一起去大理看海，想和海一起看你 微博视频 我喜欢你胜过削好的水果周末的零食延后的死线冰镇西瓜正中间的那一口肆无忌惮的赖床和空调房里盖棉被的感觉但我就是不敢告诉你	未
想和你一起去旅行	未
想和你一起去看樱花	未
想和你一起去看泸沽湖的星空	未
想和你一起去芬兰看极光	未
想和你一起去西藏	未
想和你一起去雪乡	未
想和你一起去骑车看海。 微博视频	未
想和你一起吃遍每个城市	未
想和你做最温暖的事	未
想和你做男女之间最温暖的事...	未
想和你做男女之间最温暖的事	未
想和你到每一个不同地方去旅行	未
想和你去北海道看雪//@文科班校花酱:太美了吧//@山森支://@俄罗斯事儿君: 太美了//@失足青年唐小亮:哇 好想再去一次北海道啊 自由行那种 //@大懒糖://@七日野鬼:北海道著名的钻石星尘现象。	未
想和你漫步在花海之中。	未
想和你看新年的第一场烟火，当光亮在空中绽放又映在江面时，我就可以知道它的声响能不能盖过我心脏的悸动。/Quantumi_超话大神评选不止旅行	未
想和"北大屠夫"一样成功 西安大学生开店卖烧饼	未
想和哥哥一起旅行	未
想和喜欢的人一块儿去远方旅行 .	未
想和喜欢的人一起去远方旅行	未
想和喜欢的人去一次纽约	未
想和喜欢的人打火锅聊天//@一个可爱Zzz:自闭了	未
想和喜欢的人 拍一组这样的婚纱照	未
想和喜欢的人来一次没有计划说走就走的旅行	未
想和我一起感受冬日的甜蜜融情么快来@Lindt瑞士莲巧克力 天猫超级品类日，点击领取天猫旗舰店优惠券网页链接 加购，12月19日零点购买更优惠，为你的冬日增添美妙，和我一起感受融情时刻。点击直达瑞士莲天猫旗舰店网页链接	未
想和爱的人一起去看樱花	未
想和爱的人一起去野营，每天醒来都是新的风景。	未
想和男模队合影 即刻前往北京深圳地铁站，皇马更衣室等你来探秘！发布微博晒出与皇马球星的合影，带上话题我执纯白我荣耀并@中信银行信用卡 ，有机会获得卡洛斯签名好礼，具体活动见评论。皇马主题信用卡惊喜来袭，有机会送你去伯纳乌朝圣，戳办卡链接 网页链接	未
想唱歌有怕影响别人怎么办可以用这个神器，只唱给自己听！坐公交随身携带随时唱	未
想喝一杯芝士//@胡冬咚d:台盖要喝冰草莓，一级棒	未
想喝了哈//@幕斯:哇那么梦幻//@风吹铃铛响叮叮: 哇！！！！//@尸姐: 好美//@纹身师萬萬:西瓜汁！//@壮士来一发嘛:想去//@EsczYep:西澳，粉红湖，只有上海广州能直飞，到达perth，沿1号公路向北开车6-7百公里，可以在杰拉尔顿坐飞机空中观赏，建议天气晴朗，澳洲春夏季去，不然不粉。	未
想回到中学的时候 要更更更更更努力的 去玩	未
想在YouTube上免费观看经典影片？插播广告是门槛	未
想在家门口找轻松工作的靖安人看过来，这里或许有你想要的	未
想在核聚变获得铃木裕老师的签名可以去WeGame参加这个报名活动游戏制作人铃木裕老师将在16日来到核聚变现场参加舞台活动，和玩家们互动并回答诸多玩家们关心的问题，与此同时@腾讯WeGame 也为粉丝们策划了一场签名合影会，官方将在12月11日下午14:30开启报名页，前70位答题成功的玩家即算报名成功，详情请戳网页链接	未
想在过年前瘦下来的你，现在就该努力！	未
想在这一行存活，就必须要学会同情自己。	未
想在雨天骑车你必须要了解这几招。	未
_(」 )_想埋这个圣诞小猫//@EsczYep:哇这是什么绝世小可爱//@夏目馆长:圣诞快乐喵)o	未
想学真太极来读先辈拳训！	未
想学网红浪漫一把 。结果...童话里都是骗人的！搞笑趣事	未
想学这段舞，开心的时候可以跳！网页链接	未
想客户所想，提供最专业的国际业务服务	未
想尝试一下	未
想带你去看星空万里。 微博视频	未
想带她去丽江，去拉市海骑马吃烤乳猪，去玉龙雪山登冰川公园，去宋城看一生必看的演出丽江千古情，去束河天空之镜拍照打卡，去丽江客栈豆花名宿睡个好觉。 丽江	未
想带“轮友”看世界(图)	未
想开放开看开。	未
想当年｜范文芳版《神雕侠侣》及新加坡古装电视剧	未
想当老师了//@万事屋纸纸酱:哈哈哈哈哈哈哈哈最右这么刺激的吗！！想听八卦了//@人机小战士:我确定老师知道 给老师鞠躬了//@cubeee_z:老师 基本都知道哪个学生跟哪个学生谈恋爱 还会办公室八卦	未
想当这个幸运鹅	未
想当黑猫警长朱迪警官140个警营免费开放，15000份礼物等你来拿......	未
想念这样的明媚天气	未
想想下个月底就要回家过年了，你们激动吗	未
想想大广西有连续4天假期就激动，认真想想去哪里浪了	未
想想明天要见到火星哥。。。很开心	未
想想看前期版本肯定会存在或多或少的BUG，拿来尝鲜还是不错的，担心系统不稳定的话，可以等待稳定版本上线。	未
想感受真实的法式奢华，就去凡尔赛宫吧，那里，有名为奢华的一切含义 .	未
想成为一家伟大的企业，缺乏价值观和企业文化是走不长远的领导力是有人跟随你，并且通过别人获得卓越成果的能力！企业家除了需要带领团队打胜仗，还要懂人心通人性，打造一套可落地可执行的企业文化	未
想成为攻略君牵线 嘉宾，私信@唐山全攻略 牵线两字即可，是不是大家都脱单了	未
想成为温和而有力量的人 有责任心 能把事做好 也能更多地体谅他人 在日月坚持中不断强大早安	未
想扮老虎吸引宝宝//@豆花吧YoonjaeloveBAR:	未
想拥有！！！	未
想拥有！	未
想拥有	未
想拥有一间属于自己的咖啡馆吗想要在咖啡馆尝试多种风格吗别想了！@全家FamilyMart 湃客咖啡快闪店已经帮你实现了！融合线上超多小伙伴们的创意，加入多种风格设计！现场还有超多互动赢新品咖啡，快让湃客咖啡新品温暖你的胃！ 实力湃 造起来 快来线下体验吧，说不定这里就有你的小小创意哦！	未
想提前去体验一下冬奥会的举办地吗吃喝玩浪的攻略请了解一下	未
想提升自己与别人差距，就关注这12个公众号	未
想摘下星星给你 汶川地震让她失去了双腿，她说她是从死人堆里爬出来的，活着就是件幸福的事！  想摘下星星给你	未
想无  文冠路施工现场摩托车另类硬爱有认识的赶紧通知车主吧！	未
想无：潮汕珠姐送妞回家硬爱入去坐	未
想有人一起过圣诞	未
想来一场这样的旅行。	未
想次次看嘻嘻	未
想求职你有一份职场大礼包等待签收！	未
想点餐，在饿了么搞半天，成功注册成一名骑手长春微视点	未
想玩！	未
想玩//@唐山首发:唐山身边事 这也算唐山冬日一特色了，你这么玩儿过没	未
想玩转最潮流“黑科技”？来这里	未
想玩雪看雪的朋友注意啦，龙缸滑雪场即将开放啦！	未
想现场听我讲忍俊不禁的段子吗，记得带上纸巾哦 @微博内容商业联盟 V影响力峰会内容商业影响力 爱豆来电话啦！ 微博视频	未
想用一阵栗子香，唤醒你寒冬沉睡的味蕾。	未
想用公众号发带有贺建奎三个关键词的文章发出去就卡在那里都不让你放出来。欣慰。	未
想留学美国？来听国际教育大咖为你支招	未
想登上互动舞台的小可爱，赶紧向虫娘砸报名表吧，还有不到一周时间就截止了！	未
想看！	未
想看2018年V影响力峰会干货总结@微博公开课@微博新鲜事 和@超话社区精选 一起陪你回顾//@微博新鲜事: 和@微博公开课 一起回顾V影响力峰会 各领域发展趋势行业分享大咖成长经验！为你聚合所有干货内容	未
想看！！！//@一群吹伦:马住！！	未
想看中国力量和澳洲壮汉硬碰硬吗12月15-17号3x3黄金联赛 国际精英赛不要错过！	未
想看好看的小哥哥让我存着发图	未
想看战场硝烟没问题！日前，陆军部队精武-2018军事比武竞赛在皖东地区某训练基地落下帷幕。经过36小时昼夜连贯作业，第76集团军某合成旅参赛队出色完成定向越野阻击援敌等10个课目，比赛画上圆满句号。（相双喜 史玖松 袁宏彦）	未
想看战场硝烟没问题！日前，陆军部队精武-2018军事比武竞赛在皖东地区某训练基地落下帷幕经过36小时昼夜连贯作业，第76集团军某合成旅参赛队出色完成定向越野阻击援敌等10个课目，比赛画上圆满句号（相双喜 史玖松 袁宏彦）	未
想看海王啊啊啊啊啊啊！！！！！！ 澳大利亚悉尼	未
想看男强女强的校园文（别说痛仰我推荐过好几次了哈哈哈哈哈）	未
想看的收了吧！	未
想看！！//@葉子溪Doubleleaf://@年糕好好吃-: //@firenstone_221C: ！！！！//@空巢老精:我来了！//@瓶仄相邪:哇嗷！！！！！//@秦昊研究中心:查看话题详情 天！诚邀大家一起来尖叫！！！	未
想看黄致列//@韩国行:mr.sunhine中Gloria酒店的老板金珉政和剧中OST歌手黄致列的highlight演唱会，绝对不容错过啊。一起约起来去看吧	未
想知道2019年该去哪最佳目的地榜单已经给你安排的明明白白的了	未
想知道今年的Cosme年度榜单里面都有哪些好东西吗 你们都用过哪些呀	未
想知道你的周末安排  杭州  良渚镇	未
想知道是什么样的神车从艾丁湖直冲珠峰，72小时挑战垂直中国 吗? @路虎中国	未
想知道有没有谋杀网友的服务（好烦哦但是竟然有点可爱，结果就是我也想气死他们）	未
想知道膳魔师温暖密语，你们都给拢龙录了什么	未
想知道自己胖在哪它能告诉你！联想Lecoo智能体脂秤，1次上秤可获20项身体数据，精准测量，让健康无处不在网页链接	未
想知道谁摘得双十佳的桂冠名单正在公示，点击进入	未
想知道高速封道情况第一手资料在这里！@所有人，想知道高速封道没第一手资料在这里！	未
想离家出走！郴州偷偷藏着这么多颜值酒店！一起睡吗	未
想穿粉粉的衣服系米白的围巾哈着气捧着热奶茶迈着小短腿跑向喜欢的人跟他说：抱	未
想签单，你必须懂这些接待细节！	未
想精进的程序员看过来	未
想索就说你在几岁时遇上了第一个让你心动的人	未
想约上三五好友一起去海边浪	未
想约上三五好友来一次泰国游	未
想给旅行加点料我给你指条明路吧！	未
想考上公务员，这个机会绝不可错过！	未
想肥家//@太皇太后您有喜啦:还有期末考试的时候//@吃不胖的小5:再坚持坚持就放假了//@啊就是想改个名字:是我本人了 元旦回家 ()//@鬼才君:我//@刘大大大大大脸://@驸马侯三: 双手双脚举起来//@柏正正:Me	未
想脱单了//@我乃原生木:祝福//@Leus-://@当时我就震惊了:天！祝福！//@一直在奋斗的木子:祝福[小仙女][小仙女]//@HeyWarWars:吸一波好运！//@Simon-Patrick：OMG...祝福了//@最好你忘掉333:祝福	未
想致富//@大头和他的朋友们:可以//@噗尺:豪华自行车车队//@话提:想致富了//@喜脉洗脉:哈哈哈哈哈哈哈//@图院长:至尊豪华版致富经	未
想要！	未
想要 @M豆-红豆 的新品那你千万不要错过本月 @天猫超市 狂欢月12月9日至10日天猫超市大牌狂欢活动，爆款直降秒杀产品，pick天猫超市，就能优惠拿到自己心仪的m豆噢，想想都很爽呢！而且m豆巧克力世界豆趣潮玩活动也同步上线噢！在上海的小伙伴们千万别忘了去上海南京东路一探究竟的机会！赶快来吧一起狂欢网页链接	未
想要一夜暴富	未
想要一姐的哈尔斯同款保温杯吗	未
想要一醒来就有热热的草莓牛奶香气的家。想要圣诞节玻璃橱窗暖光下大帽子小胡子的玩偶。想要街角会发光的糖葫芦和巷子口老爷爷卖的七彩风车。想像现在这样一直被你握住手。 圣诞节圣诞响叮当圣诞季	未
想要了解互联网金融行业oCPA，这一篇就够了	未
想要了解花王尿不湿Merries的同学进来哦！蛋总给大家介绍来自@是蛋妈啊 的一直播 （APP下载地址网页链接） @是蛋妈啊 的一直播	未
想要什么搜什么：网页链接保暖内衣：网页链接内裤：网页链接睡衣：网页链接卫衣：网页链接丝袜：网页链接针织衫：网页链接牛仔裤：网页链接运动鞋：网页链接老爹鞋：网页链接	未
想要什么搜什么：网页链接午睡小合集1毛毯：网页链接2睡衣：网页链接3抱枕：网页链接4眼罩：网页链接5耳塞：网页链接6.空调被网页链接7.热垫：网页链接8.挡风板：网页链接9.躺椅：网页链接	未
想要什么搜什么：网页链接吹风机：网页链接束发带：网页链接卷发棒：网页链接行李箱：网页链接四件套：网页链接按摩枕：网页链接姨妈巾：网页链接泡脚桶：网页链接魔术裤：网页链接	未
想要什么搜什么网页链接学生用品合集小风扇 网页链接保温杯 网页链接笔 网页链接台灯网页链接吹风机 网页链接电煮锅 网页链接排插 网页链接笔记本网页链接鼠标垫 网页链接鼠标 网页链接	未
想要什么搜什么：网页链接打底袜网页链接雪地靴网页链接小皮鞋网页链接家居服网页链接电热毯网页链接暖手袋网页链接暖宝贴网页链接晾衣架网页链接收纳箱网页链接	未
想要什么搜什么网页链接数码合集保温杯：网页链接收纳盒：网页链接四件套：网页链接数据线：网页链接鼠标：网页链接键盘：网页链接散热器：网页链接鼠标垫：网页链接U盘：网页链接	未
想要什么搜什么网页链接日常生活必备品，平时求的比较多的！！1纸巾网页链接2牙膏网页链接3毛巾网页链接4洗衣液网页链接5洗发水网页链接6沐浴露网页链接7吹风机网页链接8保温杯网页链接9床上桌网页链接	未
想要什么搜什么：网页链接日用合集1毛毯：网页链接2睡衣：网页链接3抱枕：网页链接4眼罩：网页链接5耳塞：网页链接6空调被：网页链接7挂钩 网页链接8饭盒 网页链接9坐垫网页链接	未
想要什么搜什么网页链接日用合集1毛毯：网页链接2睡衣：网页链接3眼罩：网页链接4垫子：网页链接5空调被：网页链接6取暖器网页链接7抱枕网页链接8挡风板网页链接9躺椅网页链接	未
想要什么搜什么网页链接日用合集1.牙膏：网页链接2.洗发露：网页链接3.洗洁精：网页链接4.洗面乳：网页链接5.洗衣液：网页链接6.洗手液：网页链接7行李箱网页链接8小风扇网页链接9防晒霜网页链接	未
想要什么搜什么网页链接日用合集沐浴露网页链接卸妆水网页链接牙刷网页链接牙膏网页链接防晒霜网页链接面膜网页链接洗发水网页链接两用伞网页链接抽纸网页链接	未
想要什么搜什么网页链接日用合集牙刷：网页链接毛巾：网页链接纸巾：网页链接衣架：网页链接地垫：网页链接垃圾袋：网页链接扫把：网页链接垃圾桶：网页链接拖把：网页链接	未
想要什么搜什么网页链接日用合集牙刷：网页链接毛巾：网页链接纸巾：网页链接衣架：网页链接地垫：网页链接垃圾袋：网页链接扫把：网页链接垃圾桶：网页链接拖把网页链接	未
想要什么搜什么：网页链接束发带网页链接围巾网页链接帽子网页链接发绳网页链接鞋子网页链接包包网页链接卷发棒网页链接葫芦棉网页链接化妆包网页链接	未
想要什么搜什么网页链接美妆合集面膜：网页链接口红：网页链接散粉：网页链接眉笔：网页链接气垫：网页链接腮红：网页链接高光：网页链接睫毛膏：网页链接眼线笔网页链接	未
想要什么搜什么网页链接零食合集1威化饼干网页链接2干脆面网页链接3面包网页链接4泡面网页链接5夹心饼干网页链接6锅巴网页链接7薯片网页链接8辣条网页链接9每日坚果网页链接	未
想要什么搜什么：网页链接面膜网页链接暖手宝网页链接打底裤网页链接去球器网页链接毛衣女网页链接外套女网页链接卫衣女网页链接袜子网页链接护肤套装网页链接	未
想要什么搜索什么：网页链接保暖小合集运动裤：网页链接口罩：网页链接围巾：网页链接文胸：网页链接帽子：网页链接手套：网页链接袜子：网页链接打底裤：网页链接保暖裤：网页链接	未
想要什么搜索什么：网页链接 健身小合集哑铃：网页链接臂力棒：网页链接拉力器：网页链接健身椅：网页链接护腕：网页链接健身垫：网页链接羽毛球拍：网页链接运动水杯：网页链接运动臂包：网页链接	未
想要什么搜索什么：网页链接健身小合集哑铃网页链接臂力棒网页链接拉力器网页链接健身椅网页链接护腕网页链接健身垫网页链接羽毛球拍网页链接运动水杯网页链接运动臂包网页链接	未
想要什么搜索什么：网页链接健身小合集哑铃：网页链接臂力棒：网页链接拉力器：网页链接健身衣：网页链接护腕：网页链接健身垫：网页链接羽毛球拍：网页链接运动水杯：网页链接运动臂包：网页链接	未
想要什么搜索什么：网页链接冬季必备小合集暖宝宝：网页链接暖足贴：网页链接热水袋：网页链接烘鞋器：网页链接暖脚宝：网页链接加热桌垫：网页链接毯子：网页链接取暖器：网页链接电热毯：网页链接	未
想要什么搜索什么： 网页链接冬季暖意小合集1.厚拖鞋网页链接2.实木取暖器网页链接3.干鞋器网页链接4.足浴盆网页链接5.防撞条网页链接6.热水袋网页链接7.毯子网页链接8.电热毯网页链接9.睡衣网页链接	未
想要什么搜索什么：网页链接冬季暖意小合集1.围巾网页链接2.手套网页链接3.耳罩网页链接4.口罩网页链接5.雪地靴网页链接6.厚袜子网页链接7.暖宝宝网页链接8.暖手宝网页链接9.羽绒服网页链接	未
想要什么搜索什么： 网页链接冬季暖意小合集1.靴子网页链接2.保暖内衣网页链接3.羽绒服网页链接4.打底裤网页链接5.内裤网页链接6.文胸网页链接7.毛衣网页链接8.暖足贴 网页链接9.热水袋 网页链接	未
想要什么搜索什么：网页链接女神穿搭小合集连衣裙：网页链接包包：网页链接耳环：网页链接长筒靴：网页链接打底袜：网页链接毛呢外套：网页链接内衣：网页链接暖宝宝：网页链接内裤：网页链接	未
想要什么搜索什么：网页链接女装小合集背带裤：网页链接棉拖鞋：网页链接单肩包：网页链接双肩包：网页链接连衣裙：网页链接风衣：网页链接卫衣：网页链接马丁靴：网页链接小白鞋 ...全文	未
想要什么搜索什么：网页链接家居小合集收纳盒网页链接小风扇网页链接榨汁机网页链接四件套网页链接抽纸网页链接吹风机网页链接洗发水网页链接沐浴露网页链接姨妈巾网页链接	未
想要什么搜索什么：网页链接宿舍专场床帘网页链接台灯网页链接壁纸网页链接床垫网页链接插排网页链接充电宝网页链接收纳箱网页链接懒人桌网页链接电煮锅网页链接	未
想要什么搜索什么：网页链接数码小合集鼠标 网页链接鼠标垫网页链接键盘 网页链接键盘垫 网页链接数据线 网页链接钢化膜 网页链接指环 网页链接充电宝 网页链接耳机 网页链接	未
想要什么搜索什么：网页链接旅游物品小合集旅行箱网页链接 分装瓶 网页链接收纳袋 网页链接雨衣 网页链接旅行背包网页链接内裤网页链接雨鞋网页链接帽子网页链接口罩网页链接	未
想要什么搜索什么：网页链接日常小合集！！1.戒指 网页链接2.拖鞋 网页链接3.睡衣 网页链接4.卫衣 网页链接5.毛巾 网页链接6.鞋子 网页链接7.外套 网页链接8.堆堆袜 网页链接9.长袖 网页链接	未
想要什么搜索什么：网页链接日用合集文胸网页链接内裤网页链接姨妈巾网页链接洗发水网页链接沐浴露网页链接洗面奶网页链接卷发棒网页链接 卸妆棉网页链接化妆包网页链接	未
想要什么搜索什么：网页链接日用合集行李箱网页链接四件套网页链接收纳箱网页链接保温杯男网页链接饭盒网页链接护眼台灯网页链接收纳袋网页链接四件套网页链接枕头网页链接	未
想要什么搜索什么：网页链接早餐大合集来啦！！吃货必备！！面包：网页链接牛奶：网页链接螺蛳粉：网页链接水果：网页链接糕点：网页链接坚果：网页链接速食泡面：网页链接饼干：网页链接代餐：网页链接辣条：网页链接绿豆糕：网页链接火鸡面：网页链接水果干：网页链接小火锅：网页链接速食：网页链接饮品：网页链接	未
想要什么搜索什么：网页链接热门小合集彩妆护肤： 网页链接日用居家： 网页链接呢子大衣： 网页链接保暖内衣： 网页链接棉拖鞋： 网页链接马丁靴： 网页链接打底裤： 网页链接暖宝贴： 网页链接触屏棉手套网页链接	未
想要什么搜索什么：网页链接热门小合集彩妆护肤：网页链接日用居家：网页链接零食：网页链接牛仔外套：网页链接呢子大衣：网页链接保暖内衣：网页链接羽绒服：网页链接针织衫：网页链接哈伦裤：网页链接	未
想要什么搜索什么：网页链接热门小合集袜子网页链接雪地靴网页链接皮鞋网页链接家居服网页链接电热毯网页链接暖手袋网页链接暖宝贴网页链接晾衣架网页链接收纳箱网页链接	未
想要什么搜索什么：网页链接热门小合集钢化膜网页链接手机壳网页链接沐浴露网页链接卸妆水网页链接电动牙刷网页链接文胸网页链接姨妈巾网页链接内裤网页链接耳环网页链接	未
想要什么搜索什么：网页链接美妆合集粉底液网页链接睫毛膏网页链接腮红网页链接化妆棉网页链接修容棒网页链接化妆刷网页链接收纳盒网页链接洗脸巾网页链接散粉刷网页链接	未
想要什么搜索什么：网页链接美妆小合集束发带网页链接_path9001.SE.0amppidmm_12833955_41358310_175316717ampsearchE69D9FE58F91E5B8A6遮阳帽网页链接_path9001.SE.0amppidmm_12833955_41358310_175316717ampsearchE981AEE998B3E5B8BD补水仪网页链接_path9001.SE.0amppidmm_	未
想要什么搜索什么：网页链接美妆小合集束发带网页链接遮阳帽网页链接补水仪网页链接墨镜网页链接发绳网页链接鞋子网页链接包包网页链接卷发棒网页链接葫芦棉网页链接	未
想要什么搜索什么：网页链接美妆小合集气垫网页链接化妆棉网页链接散粉网页链接爽肤水网页链接眼线笔网页链接指甲油网页链接腮红网页链接修容棒网页链接睫毛膏网页链接	未
想要什么搜索什么：网页链接美妆小合集面膜网页链接防晒霜网页链接洗面奶网页链接卸妆水网页链接爽肤水网页链接口红网页链接散粉网页链接眼线笔网页链接眉笔网页链接	未
想要什么搜索什么：网页链接茶水小合集柠檬茶：网页链接玫瑰花茶：网页链接蜂蜜柚子茶：网页链接咖啡：网页链接酸奶：网页链接苏打水：网页链接咖啡网页链接奶茶网页链接豆浆网页链接	未
