悬赏钟山交警征集交通肇事逃逸启事	未
悲剧斯图加特队长根特纳的父亲今天在球场里看完斯图加特2:1战胜柏林的比赛后，在贵宾区突然发病去世，根特纳接受完采访得知消息立即赶去。现场的急救医生未能挽救根特纳父亲的生命。斯图加特全队对此表示哀悼！	未
悲智双运悲是慈悲 ，智是智慧，这是大乘佛教的精神，不但要自己悟出真理，还要以慈悲之心去度化众生。事实上，任何修行不管小乘大乘金刚乘，也许方法有异，但其本质都是一样。因此，只要是正法道，便须符合上述悲智合一之要求。任何修行者必须是方法与智慧的合一，才能圆满，也就是悲智双运。	未
悲痛！南川全城送别，英雄刘彦，一路走好	未
情人，欢爱一场，终将成殇	未
情人节老婆给买了一件颜色鲜艳的冲锋衣，第二天就屁颠屁颠的穿上了。结果上班的时候路过门卫处，保安喊道：那个送快递的，过来登记。	未
情侣之间必做的100件事，转给需要的小伙伴们。	未
情侣互道晚安之后，在王者荣耀偶遇！	未
情侣出游合照参考，给你的男朋友好好看看！	未
情侣出行！景区旅游，防坑指南！	未
情侣吵架这么精彩吗//@四包叔叔:学会了//@然后下面就没了:看的想原地爆炸//@纳兰无羁:评论令我热血沸腾//@喜脉洗脉:因为我困了啊，这也不行你事儿也太多了吧，我前任就不像你这样//@梁十一_:你为什么要比我先说晚安！！！！	未
情侣吵架都是这样开始的 永远不要跟女生讲道理太真实了哈哈哈哈哈哈哈哈哈哈哈哈	未
情侣在一起1个月vs1年后，太真实了...	未
情侣头像丨谢谢你骗我的时候用心了。	未
情侣头像了解一下	未
情侣头像 关注@情侣头像手册	未
情侣头像无水印右下角点赞拿图	未
情侣头像走一波记得戳评论收原图哦	未
情侣小套路  我的网卡了，发送的全是爱心	未
情侣拍照姿势参考	未
情侣旅游拍照姿势合集 假期旅行肯定用得上。	未
情侣的日常甜	未
情侣间独处时最好的水果是蜜柚因为此时只有MeYou。//@刘飞履:收到4个红柚称了一下加上箱子9.7斤多点，内蒙古呼和浩特离得太远，一点也没冻不苦酸甜，会回购。	未
情商公益课堂  情商决定你未来成就的高度	未
情商是个好东西。 （转）	未
情商高的人为何容易成功，智商高的人为何不爱交朋友（黑白先生）	未
情商高的男生撩女孩是怎么样的高情商撩妹技巧	未
情境教育走过40年创新路 南通李吉林老师两套新书首发	未
情怀，任天堂的纪念版迷你红白机。	未
情感12.2 我喜欢上了一位处女座男生。我主动加的他，他:我好像记得你我:真的吗！开心 他:你是那天坐我后面的小黄? 我:我是小白小黄是我朋友，长得很漂亮的虽然我也不丑但是完全没小黄有女人味，他知道他想错人了后就感觉有一点失去兴趣了，虽然说过他不是颜控，但我的自尊心已经被 ...全文	未
情感各位草莓布丁小可爱大家好，因为实在是想不明白自己了所以想问问各位，我基本上没有恋爱经验，曾经有两次但都只有一个星期不到，两段感情都是自己不喜欢对方而分手，虽然很抱歉但对于拖着对方的自己也很愧疚。到大学毕业一直没有找男朋友，经常有人告白但是长相都不是我的菜，我挺颜控的，而且很内向怕生，对于那种第一次见面就告白的男生我都觉得很可怕，但是从朋友开始相处又浑身不自在。以为自己恐男但是还会追爱豆....现在的问题是，目前有熟人介绍的一个男生，长相在我眼里一般但是不会立刻讨厌的那种，兴趣爱好大部分相同，目前	未
情感帖在恋爱里，女朋友的一些小动作，好温暖。	未
情感 这个世界已经不浪漫到什么程度了呢 微博视频 情感	未
情报速递出境游增速趋稳，泰国明年2月将启用电子签证服务	未
情暖2018，诉说那些锦旗背后的故事与感动	未
情暖夕阳 关爱老人 南阳义工联走进高新敬老院	未
情暖童心助梦飞翔宜昌市流动少年宫爱心帮扶教育公益活动走进远安	未
情歌King舞蹈Queen艺声金请夏合作新歌17日公开	未
情洒万里 命运与共——解读习近平主席四国访问署名文章	未
情洒万里，命运与共——解读习近平主席四国访问署名文章	未
情洒万里 命运与共 解读习近平四国访问署名文章	未
情洒通江扶贫路记浙川东西部扶贫协作干部张春根	未
情满泉集 围合幸福西青新鲜事日前，大寺镇泉集里社区组织辖区内的老年人开展了情满泉集围合幸福编织活动。老人们一边织一边聊着家常，气氛非常和谐。社区志愿者还心系辖区内困难群众，学着一起编织，并将成品围巾送给困难群众，令活动更加有意义。	未
情牵天山，爱传万家！长治市恒爱行动温暖了这个冬天	未
情系千里 山海相连  滨医附院8名医务人员代表山东赴渝开展支医工作！	未
情系夕阳暖人心，康正慰问凝真情	未
情系山城，电亮巴渝！重庆电网40年发展回眸	未
情系教育石泉26名特困教师获公益基金资助	未
情系敬老院 冬日送温暖丨康正江苏淮安车城爱心公益行	未
情系母校，攸县25岁上市企业董事长向攸县三中爱心捐赠15万元	未
情系西藏爱心传递 宿迁市民募集冬衣让孩子们温暖过冬	未
情系贫困学子 爱在千年古郡暖冬行动邀您来参与	未
情诗再美也不及你美	未
情话书签丨希望吹过我的风，能绕过几个圈去抱你	未
情话满分却不值得嫁的生肖男	未
惊！！！3组红色三明密码破译了，第一组带你走进红色时空	未
惊不惊喜！Stussy x Nike SB Zoom Blazer Mid发售版本竟是无豹纹版，同时会给到一个豹纹模具让你定制专属于你的鞋款。两双联名鞋款均于12月7日登陆Stussy线上线下商店DSM洛杉矶与伦敦。而由滑手Lance Mountain定制的豹纹版也将以限量48双的形式推出。	未
惊不惊喜吓不吓人搞笑	未
惊不惊喜太姥山被授予旅游影视基地！	未
惊不惊喜，意不意外	未
惊了//@soft_cute：她到底有多白 有多美这张图告诉你 查看图片	未
。。。惊了，魔改79//@-逆光飞行-:因为79一直以来貌似都是精度很好很趁手的一把武器呀//@猪头不卖-FIA皖舵:如假包换//@一只三丁包: 79改得他亲妈都不认识了话说那是79吧//@猪头不卖-FIA皖舵: 转发微博	未
惊出冷汗！忻州十里后四岁幼童独自过马路，交警暖心救助	未
惊动中央的4分钱超产奖背后，是蛇口40年风景的诞生历程	未
惊动全城！泗洪花园口又添一座新地标...	未
惊动金融圈！近2000亿中信证券并购广州证券，还要100%控股	未
惊！南通竟然藏着一条世界美食街，整整三天，疯狂打折！	未
惊叫来袭！容县都峤山玻璃吊桥升级7D玻璃特效，就怕你不敢上	未
惊呆了！一辆送外卖的踏板摩托车在綦江高速上飞驰....	未
惊呆了！一马拉松选手心肺复苏后推开医生继续跑，然后…	未
惊呆了！一马拉松选手心肺复苏后推开医生继续跑，然后11月25日，在2018绍兴国际马拉松上发生惊魂一幕，一名选手晕倒接受心脏复苏后，醒来不顾医生和工作人员的劝阻，依然坚持比赛。（新华社）惊呆了！一马拉松选手心肺复苏后推开医生继续跑，然后	未
惊呆了！兵哥哥飞一般的速度！被中国军人帅到的点赞	未
惊呆了！厉害了我的姐！海安长途汽车站惊现霸座女！！！（现场视频）	未
惊呆了！浅井镇这个年轻人5个月的销售额竟然超过.......	未
惊呆了这么细致施工节点对应sketchup模型。	未
惊呆了！这位司机竟然在高速上逆行	未
惊呆了！这只纯债基金“年化收益10万倍”，成立后第3天就暴涨	未
惊呆了！阿森纳再次领先！曼联闪电扳平！一顿操作猛如虎	未
惊呆！厦门-北京只需30分钟！超级高铁要来了	未
惊呆！咸宁菜场里的这群大爷大妈们，才是文案界的泰斗！	未
惊呆！水产批发门市 竟私藏600多只珍稀动物死体	未
惊呆！澳洲海关查看华人小哥手机微信，然后把他遣返了！真实案例！	未
惊呆！陪娃写作业，妈妈考到教师资格证！孩子：我成功带出一名人民教师...	未
惊喜  中卫这一路段沿线征地拆迁费会有多少?大家快来看下	未
惊喜元旦还没到，固原人居然提前放价了原来是因为这件事！	未
惊喜！坐公交到钟楼终于不怕找不到东南西北了	未
惊！堪比苏州园林吗樟树如此社区园林实在罕见！！	未
惊天大案！14.5亿水产品走私专项行动告捷，查证3万余吨！	未
《惊天大逆转》发海报	未
惊天工程 之 关西国际机场//@纪录片之家:纪录片之家字幕团队译制探索频道 惊天工程 之 关西国际机场 Impossible Engineering - Ultimate Airport//@纪录片之家字幕组:	未
惊奇！80岁老太太来佛成寺做义工！	未
惊奇后面的特效太suai了！！！	未
惊奇手札之爷爷	未
惊奇手札:乡村怪咖(2)	未
惊奇手札：乡村怪咖（一）	未
惊奇！温州动物园，动物都跑出来了	未
惊奇队长正式预告来了！	未
惊奇队长正式预告片	未
《惊奇队长》第二支预告解析，看起来！	未
惊奇队长自制Livephoto 双星形态	未
惊奇队长预告中的橘猫	未
惊心动魄2分半！大连俩申通货车上演追逐赛 疯狂别车	未
惊心动魄！安溪近年来交通事故监控视频曝光！平安才是回家最近的路！	未
惊心动魄！美皮滑艇爱好者从18米高瀑布落下	未
惊！沈阳高颜值商场今日开业！网红店扎堆！速来打卡！	未
《惊涛飓浪》上映 导演特辑揭秘实景拍摄艰辛	未
《惊涛飓浪》“爱情孤舟”5城环游 惊现热吻观众	未
惊燕美景大家说 今晨的北海公园，虽然天空不太透亮，但依旧掩盖不了它的美摄影：程宝纪	未
惊燕美景大家说 冬日已至，今晨的北京植物园略显萧索，湖面已开始结冰摄影：朱凤君	未
惊燕美景大家说 冰挂如瀑，冰溪涓涓今天本市气温较低，白天最高气温只有1，目前大部地区气温只有-2到-4，出行注意防寒保暖。拍摄：朱凤君摄于门头沟区王平瓜草地	未
惊爆！交易学堂中线擒牛，短期获利52！	未
惊爆！禹州颍河两岸又有大动作！已开始招标总投资4500多万！	未
惊爆！龟峰脚下生态度假旅游村寻求承包对象，周围景点美爆了...	未
惊现天空之城的南京，感觉就像个仙境	未
惊艳  萧山这个地方出现网红花海！很多人都去拍照打卡了！	未
惊！莆田系加油站已超2万座！这些加油站竟是他们的......	未
《惊蛰》卫视热播 田牧童大胆挑战谍战剧 	未
惊！西塔新开了家烤肉店，竟然可以自选烤肉，最大的好处就在于你可以想要多少就要多少，感觉自己在菜市场挑肉一样得劲儿！胖熊果断每样肉来了一点，这简直是肉食控们的天堂好不好！！！推荐指数：[星星][星星][星星][星星][半星]不瞒你说，胖熊一直很喜欢原滋原味的肉，所以蘸调料吃的时候一般也是点到为止，琵琶叶切得很薄，烤的过程需要不断翻面，不过胖熊手残给烤糊了，哈哈哈哈哈，服务员小哥哥给烤出来的肉吃起来特别细嫩鲜甜，肉味超浓郁，美滋滋你知道吗胸口肉搭配锡纸酸菜一起烤，可以说是一绝！不是你想想	未
惊讶！运城盐湖区五言诗体报告6000字	未
惊！野生海鲜尽可以全山西配送上门！买海鲜不用去菜市场不用去超市还可以直接送到家	未
惊险15岁男孩卡在了嘉定货运列车里！幸得消防部门成功解救	未
惊险一幕，住2楼以上的新乐人都应该看看！	未
惊险一幕！住电梯楼的芷江人都应该看看！	未
惊险！五华一学生离家出走后竟走上高速逆行，还有一位老人...	未
惊险 京昆高速霍州段五车相撞，霍州消防紧急救援...（内附视频）	未
惊险！今天凌晨，郊尾某村一小汽车狠狠撞向民房！	未
惊险！佛山中心城区惊现战时炸弹，视频还原公安引爆全过程！	未
惊险！停靠在宁波站的高铁顶部闪现火花！还有响声	未
惊险！凌晨高速上一辆火车直冲收费站，过程犹如拍大片！	未
惊险刺激！天河实验幼儿园小朋友亲身体验穿越火线！	未
惊险刺激潸然泪下欣喜万分2018的旅行留下太多动容瞬间，也记录了每个人不止旅行 的自我成长与突破。不论目的地有多远，只要脚步不停，就能收获旅行的力量。点击聚合圈脚步不停 快来一起分享你的旅行故事！更有机会赢取现金奖励！	未
惊险刺激！金华斗牛了解一下！	未
惊险却温暖的一幕！一对母子滑入东风渠中，10多名热心人手拉手施救	未
惊险！古雷港高速口一货车因这事冲上收费站安全岛	未
惊险！女孩从前车上滚落，他紧急刹车后的动作温暖了朋友圈	未
惊险！家住五华的一学生离家出走后竟走上高速逆行，还有一位老人...	未
惊险！山西高速上一面包车突然自燃...	未
惊险！日照一私家车冲破大桥护栏	未
惊险！朝阳大桥上一幕！开车的都看看	未
惊险！梅州一学生离家出走后竟走上高速逆行，还有一位老人...	未
惊险！汕尾龟龄岛海域一施工船触礁进水，17名船员成功获救！	未
惊险！海阳高速上一头猪在来回乱窜	未
惊险！涿州鼓楼大街起火事件，火势凶猛，浓浓黑烟笼罩天空！	未
惊险！男孩过马路被撞飞，躺地10秒后竟奇迹般爬起	未
惊险！老人误入高速公路，随后出现了暖心的一幕	未
惊险！莆永高速永春湖洋出口附近：两辆大货车追尾，翻下山坡起火	未
惊险！青岛飞广州航班氧气罩脱落紧急备降，亲历者：今天我生日，来这么刺激的（视频）	未
惊险  飞行员首飞遇特情成功处置 网友：这才叫冷静	未
惊险驾驶员刮倒电瓶车后倒车撞垮围墙砸烂下方车辆现场又现暖心一幕！	未
惊！青岛诞生了一项世界纪录，竟全是它们做的	未
惊魂一刻！一辆冒着火球的车辆冲向漳浦一高速收费站	未
惊魂！不要命的奔跑，了解两个120能保命！	未
惊魂！新手女司机油门当刹车，飞车铲进惠州一商场电梯间！	未
惊魂！邵阳隆回一公交车，上演抢方向盘一幕...	未
惠东199元抢富绅居休闲山庄标准房送2张御汤温泉门票	未
惠东冬季约泡大作战199元抢富绅居休闲山庄标准房送2张御汤温泉门票	未
惠东午夜出动200多名警力清查酒吧，喜欢蒲吧的人请自爱！	未
惠农公安积极开展振奋精神兴区富民大学习大调研大讨论活动	未
惠农区人大主任邵珠宝一行视察我区禁毒示范创建工作	未
惠农区禁毒办召开创建全国禁毒示范城市推进会	未
“惠升管业”杯宿迁市篮球秋季甲乙级联赛闭幕	未
惠及14个行政村岩前冬修农田水利工程加快施工：争取12月底完工！	未
惠及8000多老人，东阳居家养老服务中心这样做...	未
惠及你我的好消息，以后出行越来越方便了，攸县全面推进城乡客运一体化	未
惠及农村老兵，这个优抚新模式，有望全国推广	未
惠山古镇，秋色正浓@江苏微旅游  @新浪无锡  @江苏气象  @无锡市旅游局  @江苏卫视新闻眼  @无锡气象	未
惠州丨双人999，抢五星润杨溪谷90双床房（带泡池），早晚餐无限次温泉！	未
惠州交通隆生大桥主桥元旦前有望通车！！！	未
惠州人赶紧看！春节假期或将延长至15天网友：非常支持，希望今年实现	未
惠州全域旅游新媒体营销系列评选活动开始啦！	未
惠州公交站点大变化！上百个站点有变！快戳进来看清楚！	未
惠州出发！1999元机票食住全包出国，多彩缅甸我来了	未
惠州周边0元拍照圣地！周末花两天时间足够了	未
惠州周边竟藏了个彩色房子小镇，拍照自带滤镜！	未
惠州和苏州哪个更适合居住?谢谢邀请，2018年中国最具幸福感城市调查结果刚刚出炉，受到了众多网友的关注，有以下城市入选：现在，人们愈来愈关心自己居住城市是否宜居是否具有幸福感从宜居来看，惠州和苏州两个城市有以下的特点：1文化底蕴苏州拥有数百年的历史积淀，是当之无愧的文 ...全文	未
惠州商圈新消息！西湖站商业综合体已经开建，预计2020年底竣工！逛吃逛吃又多一地！	未
惠州四天出行攻略出行基本资料巽寮湾酒店巽寮湾美食双月湾酒店三角洲岛哈斯塔特 奥地利小镇via.@阿臻哦	未
惠州将新增大批学位！惠城区第十六小学第四十二学校有了新进展啦	未
惠州居然有个现实版天空之城，梦幻如仙境	未
惠州年度最冷天气要！来！了！广东最高温才7度！	未
惠州新开河北桥预计春节前可通车！	未
《 惠州民协文艺志愿队首次服务》李惠平	未
惠州雄心：争当大湾区东岸战略腹地和枢纽门户	未
惠更斯7连红！多位高手全中！大神爆料	未
惠更斯8场全中！多位高手大红！大神爆料	未
惠更斯惊天11连红！老程3场全中！大神爆料	未
惠来这个海滨小镇，流传着一个神奇的故事！你听长辈说过吗	未
惠民县公安局交巡警大队积极开展122全国交通安全日活动	未
惠民县新时代文明实践分中心：打造聚人聚心的百姓之家	未
惠民好消息！2020年普惠性幼儿园覆盖率达80	未
惠民实事顺民意  民生项目暖民心	未
惠民工程肇庆大桥扩建进入白热化阶段，桥道双通承载城市间经济命脉！	未
惠民心贴心 利企零距离 丹东市公安局真抓做实营商环境	未
惠民政策 不用花钱的免费体检，赶紧约起来！！！	未
惠民文艺演出走进南京迈皋桥街道	未
惠民明光市城乡居民养老保险民生工程 政策问答（三）	未
惠民游特惠丨滑雪木屋别墅度假酒店童话王国，让这个冬天不再冷！	未
惠民王珏现场推进明光经开区配套基础设施建设工作	未
惠民生、筑精品——南京援疆“量身定制”，为伊宁留下“江苏情”	未
惠民顺义46个小区智能燃气表预计本月底更换完毕！	未
惠民顺义这些小区更换智能燃气表	未
惠而浦（whirlpool）蒸汽挂烫机WI-JM1408H家用 熨烫机液体平衡系统 高效节能 四档功率调节 能满足您对不同面料的熨烫要求 网页链接	未
惠能达大功率家用吹风机理发店发廊不伤发电吹风静音宿舍冷热风筒 100元券微博专享限时领券	未
惠若琪 20181221 北京	未
//@惠若琪粉丝后援会:惠若琪周日见2018行动者联盟公益盛典	未
惠英红主演迷你剧《心冤》，聚焦香港三大奇案	未
惠英红空降《朗读者》 讲述荣光背后的传奇人生	未
惠阳注意了，有个大汉专假扮美女，已有500多人上当！	未
惧怕以色列空袭，伊朗民兵阵地升起俄罗斯国旗，防护远超S300	未
惨剧推动立法!法国议会通过＂禁止打屁股法案＂	未
惨叫是可以加成的	未
惨，镇江智慧大道和学府路交叉路口车祸！网友：愿逝者安息！	未
想Get奈总同款口 红！！	未
想Hold住今冬最时髦的大号毛衣， 穿搭方法全在这里！	未
想lucky一把不是没可能[Aloha]自己动动手指就能当分母，The Ordinary家坠hot的咖啡因精华给你要不要[给你小心心][米奇比心][给你小心心]biu爱心发射	未
想一路顺畅和地图了解一下	未
想下雪，想雨停！	未
想不到！容西镇祖立村里，村民们都兴奋起来了！	未
想不到有一天「吃」可以成为养家糊口的利器是时候晒出你的食品订单了！	未
想不到标题，就想把这条微信留给我们最出色的辅警兄弟	未
想不到的地铁之一车厢太美，你到底会不会开车	未
想不到！这个乡建起了首个休闲景观小公园！就在。。。	未
//@想不开就躲开: 回复@王小牧:证监会：头一次看见韭菜这么主动，我很欣慰//@王小牧:明年不是要上市吗估计是好股，买买买	未
想不想看看雪夜里的魔幻城堡上海迪士尼实用攻略，避开人潮，淡季走起[小仙女]上海迪士尼全攻略，从零开始也不用慌！ - 马蜂窝	未
想不想给自己家的墙也画上每天回家都能赏心悦目	未
想为你的头像戴上圣诞帽吗	未
想买的东西留到了双十二 送你一份收取快递安全须知！ 微博视频	未
想买辆电动汽车评测一下了，特斯拉的Model X现在值得入手吗	未
想了解一个城市就去逛逛街边的小店坐一趟穿梭巴士向路人问路和店主闲聊一个城市的温度就在这三言两语间逐渐清晰了 fanfan带你去旅行旅行灵感季奈良旅行日本奈良	未
想了解上海改革开放40年？这本新书用40个案例告诉你	未
想了解@宁波交警 辖区高速公路收费站进口是否开启，可以进入宁波交警微信公众号信息查询-交通路况高速入口查询，不仅可以查看相关高速进口开启关闭情况，还可以了解具体的车道通行情况并可以通过监控查看收费进口画面	未
想了解更多，可以看这篇[米奇比心]	未
：想你们啊啊啊啊啊啊啊啊整齐划一，训练有素	未
想你陪我一起去感受最狂的风，最静的海。monmon的旅行今年过了一个不一样的生日，其实也没有特意订到这一天去旅行，机票行程安排的刚好是这一天而已。这个季节的仙本那卡帕莱水屋不必提前半年了，很好定，而且两晚我们换了不同的房间住。出发前仙本那每天都是雨，过去之后雨只是在晚上下，白天天气非常好。我们的行程是：武汉-昆明-吉隆坡-卡帕莱-仙本那-沙巴。回头可以跟大家分享攻略。 马来西亚卡帕莱	未
想你陪我一起去感受最狂的风，最静的海微博时尚说 @微博时尚 今年过了一个不一样的生日，其实也没有特意订到这一天去旅行，机票行程安排的刚好是这一天而已这个季节的仙本那卡帕莱水屋不必提前半年了，很好定，而且两晚我们换了不同的房间住出发前仙本那每天都是雨，过去之后雨只是在晚上下 ...全文	未
想做一个白嫩的小仙女吗看下面	未
想做一条咸鱼，好几千的腕表，希望在远方，低至二百，更多详情胃：kxo886	未
想免费学摄影，请到商都  壹和传媒	未
想养！！	未
想出门和朋友看电影吃火锅然后心满意足地回家网上开黑//@段子楼:想过年了//@_琼琚Qle:美好//@外卖小哥金城武:已无心工作//@文科班校花酱:快要放假啦！//@一只考鸭阿:真的超级无敌迫切！！！！！！！！！！！！！！无时无刻！！！！！！	未
想到了与网友痛骂学校的欢乐时光//@太皇太后您有喜啦:怎么回事小老弟//@M大王叫我来巡山: 是什么改变了我//@尸姐:我：骂得好//@万事屋纸纸酱:虽然这样说不太好..我不知道你们是不是这样子...反正我是	未
想到所爱之人，冬日也会变得温暖。:）早安各位	未
想办卡了//@喝哇哈哈长大:give me five//@顾一游：喵喵之力 您接好啊	未
想办理业务撞就完了搞笑幽默趣闻	未
想包下2.3公里，523600平方米，35幢高楼组成的钱江新城灯光秀求婚我们探听到了这些秘密！	未
想去12月，对自己好点鸭！[给你小心心]醉美随拍 醉美随拍	未
想去1！//@泰国资讯指南:泰国资讯 那么美！想去！	未
想去中山植物园看红枫的小伙伴注意啦//@云中微博：数量比去年多，目前红了一部分，最佳观赏时间应该这月底下月初。	未
想去了//@牛奶可可de妈咪:妈咪安利 台湾自由行攻略！	未
想去京都看红叶	未
想去体验一下	未
想去体验港珠澳大桥的街坊注意！今天起，大桥穿梭巴士限量售票！	未
想去体验港珠澳大桥的街坊注意！即日起，大桥穿梭巴士限量售票！	未
想去八廓街转转	未
想去台湾！夜市天堂！	未
想去山里呼吸新鲜空气	未
想去成都养老啦	未
想去拉萨看一看	未
想去旅行	未
想去旅行，把不开心的事都丢在路上，回来的时候只剩开心的自己。	未
想去河北//@尸姐:怎么这么好笑啊//@所长别开枪是我: 哇哦！//@白娘娘:震惊！河北《千寻千寻》现场探秘	未
想去泰国的小伙伴快了解了解吧	未
@想去海边的哈尔滨人，厦门湾推介会明天等你来  现在就报名吧	未
想去玩！//@Dear慧慧最酷啊：去过合肥万达乐园，超好玩//@一台DV:啊啊啊啊啊简直都想去	未
想去玩一下古三！！！	未
想去的举手，在这条评论里抽四个小可爱一起去现场玩呀！	未
想去看夜景//@重庆吃喝玩乐精选:超美的重庆生活	未
想去看看！	未
想去看看	未
想去看粉色花雨吗明年春天，下塘河畔与你相约！	未
想去香港逛吃的小伙伴们码住！	未
想去龙泉山庄度假	未
