“小默克尔”当选德国基民盟新主席	未
山城志愿者 今天上午山城志愿者与巴蜀常青藤义工团理工大学爱心社在谢家湾的建川博物馆举行纪念重庆解放的活动，志愿者参观抗战博物馆后并与工作人员沟通了解开展志愿服务的合作事宜	未
山城重庆不愿意只从这座城市路过P1 写在前面/交通/民宿推荐P2 皇冠大扶梯/较场口/好吃街P3 武隆天坑地缝景区P4 南山一棵树P5 长江索道/南滨路/洪崖洞/解放碑P6 川美涂鸦街/李子坝/鹅岭二厂P7P8P9 美食推荐测评via.@麻线线	未
山塘片区全力推进“易积水片区改造工程”	未
山头店乡40多万斤萝卜滞销，别让良心萝卜凉心！（附视频）	未
山寨出品	未
山寨香水廉价充电宝盲盒贩卖机来袭，但不会给你带来美好一夜之间，名目多样的盲盒贩卖机席卷合肥各大商场，体验价通常为30元。山寨香水廉价充电宝打开礼盒并不会如同其宣传的那样，会感到美好的事情发生。工商：不算虚假宣传，但无法清晰定义是否违法。盲盒贩卖机席卷合肥各大商场 山寨香水搞砸心情	未
山居24小时  观树山，享鲜氧生活	未
山岩，混沌，自由：抵达中国的勒内·夏尔	未
山峦连绵，冰雪皎洁，原来在玉龙雪山旅拍如此之美。 丽江巨甸古镇(民主路)	未
山峰闪闪发亮摄影师 Guillaume Bertrandi 来自于法国西部城市南特（Nantes），酷爱登山的他在攀登位于阿尔卑斯山西部的阿尔沃针峰（Massif des Arves）的途中，拍下了这组照片。即便山上已经能够看到积雪，在太阳的照射下，闪闪发亮的山峰还是显现出温暖的颜色。Photo by Guillaume Bertrand	未
山师情头，独你一份	未
山形美观，峰如刀刃，远看绵绵起伏，如虬龙蜿蜒。遇摩擦振动，便会殷殷发声，轻若丝竹，重如雷鸣，徒步鸣沙山！ .	未
山形美观，峰如刀刃，远看连绵起伏，如虬龙蜿蜒。遇摩擦振动，便会殷殷发声，轻若丝竹，重如雷鸣，徒步鸣沙山！	未
山无棱天地合乃敢与君绝看个科普被感动到了	未
山无棱，天地合，才敢与君绝。	未
山有仙而名  景因情而美初冬，走进古柏苍翠的药王山	未
山有峰顶，海有彼岸，漫漫长途，终有回转，余味苦涩，终有回甘。《一切都是最好的安排》	未
山林索途 岳镇渊渟上汽大众途岳临安行	未
//@山桂贰://@筑盛计划GALGAME: 妈呀，靶向包//@抱团教教众-纸鱼子 :还是这个好//@颜文字君 :行走的人民币_gt//@我朋友是个奇葩 :还要什么香奈儿//@文科班校花酱 :想要拥有//@水晶男孩鸡大帅 :虽然只是个布袋 压倒一切名牌	未
山楂小院  住进温暖如春的山里小院，围炉夜话，艳遇大雪纷飞	未
山歌剧《春闹》唱响全国	未
山歌声中听广西变迁	未
山水不算面积吗，山水旅游资源创造利润可不比工厂少，而且持久。//@上善若水wjl:杭州山地多，去看下影响图好么	未
山水墨画中 电业人用脚步编制经纬今日，荣成市迎来2018年末第一场大雪。@国网荣成市供电公司 输电巡视人员冒着风雪分组进山下乡，对全市多条重点输电线路进行巡视检查，部分线路属于山区，大雪已经将道路淹没，但没有延误电力人的脚步，跌跌撞撞，只为确保电网安全稳定运行。	未
山水暖你 壮乡等你冬游广西旅游推介会在兰州举行！	未
山水环抱着我的家乡，家乡又环抱着淳朴善良的人们。快手快手的500个家乡	未
山水盆景的植物种植	未
山水门户世界之窗老镇新风淮州新城这样打造七彩沱江名片	未
山河可鉴！限时拼团，低至买1送1	未
山河披绿富长汀（庆祝改革开放40年·百城百县百企调研行）	未
山河智能：SA60L累计交付近百架	未
山浪家风好故事  我眼中的严氏家风	未
山海关重回5A级景区！全国5A级景区你去过哪几家	未
山海协作生态旅游文化产业园规划编制评审会召开	未
《山海经》里的海外奇遇	未
山海齐协作，杭衢一家亲！两地民宿和来料加工业擦出新火花	未
山猫科普 了不起的医学成就：全球首例用死亡捐赠者移植子宫怀孕生下健康女婴负责这起移植手术的巴西圣保罗大学医院医师爱生八个（Dani Ejzenberg）表示，他们于2016年9月为一名32岁妇女移植了一个死者捐赠子宫。爱生八个医师团队成功地吻合了供体子宫和病人的静脉动脉子宫主韧带等。移植手术后5个月内，病人子宫未出现排斥现象且有规律月经。移植手术完成7个月10天后，研究团队将受病人先前冷冻保存的受精卵植入子宫内，使该名妇女顺利怀孕，并于去年底通过剖腹产成功诞下重2550克的女婴。这项刊登在《柳叶	未
山环水抱茶园绕， 在与灵隐寺咫尺之遥的避世奢华地， 享出尘世外假期， 免升地暖套房	未
山线绿道：市民休闲、娱乐、锻炼的好去处(图)	未
《山羊不吃天堂草》走进北大演出	未
《山羊不吃天堂草》首次走进北京大学开展演出活动(图)	未
山羊吃掉2万欧元现金被报复，支付宝这评论犀利了据外媒报道，塞尔维亚中部一只名为Belka的山羊吃掉了主人2万欧元现金，随后被做成了烤肉。对此，支付宝转发相关新闻并发出了神评论详情点击：山羊吃掉2万欧元现金被报复，支付宝这评论犀利了	未
山翠自成微雨色，溪花不隐乱泉声秋冬季有没有什么养肺胜地推荐呢	未
山西11地市彩礼排行榜刚刚公布！网友炸锅了	未
山西：1亿元补助支持6个城郊农业示范县（市、区）建设	未
山西20名年轻人两月排出本土音乐剧 诠释“如何爱妈妈”	未
山西30条：让民营企业轻装上阵政府官员现场解读！	未
山西6部门集中解读支持民营经 济“30条”释放利好	未
山西6部门集中解读支持民营经济“30条”释放利好	未
山西VS北京 第一节结束，残阵北京客场26-19领先山西，北京队艾伦-杰克逊投中压哨三分。	未
山西：一夜暴富的贫困户...（小郭跑腿）	未
山西三家省属科研院所转制企业揭牌，省长楼阳生出席并揭牌	未
山西：三类项目不得申报保障房配套项目中央预算内投资	未
山西临县启用30兆瓦大型光伏扶贫电站	未
山西为民企定制“营养套餐”	未
山西交城“网”尽农特产 打造电商扶贫新业态	未
山西交城食用菌产业铺就脱贫致富路	未
山西人以后开证明不用去派出所了，网上全能办！	未
山西：今年煤层气地面抽采量将超56亿立方米	未
山西：今年煤层气地面抽采量将超56亿立方米财联社12月15日讯，从山西省自然资源厅获悉，今年山西省煤层气地面抽采量预计超过56亿立方米，较去年增加5亿立方米，利用量占全国90左右截至2017年底，山西省煤层气累计探明储量6675亿立方米，另有致密砂岩气探明储量3509亿立方米，已建产能86亿立方 ...全文	未
山西今年煤层气地面抽采量超56亿立方米，利用量占全国九成	未
山西发布支持民营经济发展若干意见 鼓励民营企业在科创板等上市	未
山西发现东魏冠军将军、豫州长史孟鸿墓	未
山西古交举行首届民警荣誉仪式 新老民警传递为民初心	未
山西召开正和岛岛邻机构论坛 晋商抱团取暖共谋发展	未
@山西司机们，明天汽油又降价啦！	未
山西各种特色美食小吃，都认识不有你想吃的吗探秘最山西旅行灵感季	未
山西向社会开放108个国企混改项目 账面净值超过340亿元	未
山西启用就业创业证电子证书 手机可查验	未
山西:"四突出"抓好纪检监察干部教育培训	未
山西:“四突出”抓好纪检监察干部教育培训	未
山西地区民居上的砖雕石雕木雕装饰	未
山西地方特色大菜，有认识的吗想吃不旅行灵感季探秘最山西太原山西会馆(和平南路店)	未
山西培育技术技能人才 7100余师生参加职业院校技能大赛	未
山西：多举措抓落实 增强民企获得感	未
山西太原尖草坪公安举行警察荣誉仪式 老中青民警传承使命与责任	未
山西太原投资三千万打造“两节”民间文化大餐	未
山西太原探索多种医养结合模式打通养老“最后一公里”	未
山西太原民众踊跃预约猪年生肖纪念币	未
山西女篮主场大胜河北	未
山西:完善"四风"问题联动协作查处机制	未
山西密集发布利好政策支持民企发展	未
山西小三娘栗桂莲晋剧清唱	未
山西建投安装擂响转型战鼓  吹响推进装配式建筑集结号	未
山西彩礼排行榜刚刚公布！有图为证，网友炸锅了	未
山西怀仁：北方小城的尊师重教史 见证40年教育巨变	未
山西支持民营企业发展  明年力争减免税费275亿元以上	未
山西文旅走进中国传媒大学，推介三晋大地厚重文化	未
山西文旅集团：伴随希望出生，直指产业转型	未
山西新的社会阶层人士迈步在新时代道路上 ！	未
山西晋城:把握四个环节 增强日常监督实效	未
山西晋祠打个卡，来过吗旅行灵感季探秘最山西太原晋祠胜境	未
山西晚报19周年特刊印象山晚	未
山西最有钱煤老板名单！到底多有钱	未
山西最有钱煤老板名单！到底多有钱还有柳林...	未
山西汲取深圳国企改革经验 对外开放再提速	未
山西沁县“抓鸡队”日抓鸡上万只 村民脱贫增收	未
山西潞城：投资百亿元上项目 打造精细化工航母	未
山西的一座神秘寺院，保存着中国唯一的五代寺观壁画，也是中国古建筑史的分水岭	未
山西省2018年成人高校招生高起本层次录取中，征集志愿时间截止至6日下午17时	未
山西省侨联访问团出访阿联酋和毛里求斯 冀深化友谊	未
山西省十三届人大二次会议将于明年1月25日在太原召开	未
山西省太原市清徐县动真碰硬确保环境问题整改落实到位（山西环保发布）中央生态环保督察回头看想不到儿时臭气熏天的一条渠，短时间就变了样子，政府真是为百姓办了件好事12月5日上午，山西省太原市清徐县东湖街办南营留社区居民刘宝平站在寒冷的雪地里，心里却暖乎乎的有群众向中央 ...全文	未
山西省第22届摄影艺术展在太原美术馆开幕	未
山西省第十三届人民代表大会第二次会议于2019年1月25日在太原召开	未
山西省纪委监委出台意见 六大举措护航民营经济健康发展	未
山西省运城市稷山县永祥焦化厂浓烟直排！！！	未
山西省阳泉市第十二中学 党建工作实现“五子登科”	未
山西真金白银支持民营企业发展 明年力争减免税费275亿元以上	未
山西着力做好煤炭绿色高效清洁利用	未
山西立法完善村民委员会民主议事制度	未
山西简政放权再加码 实现立项管理最简最优	未
山西组织部长调研晋煤：做好年轻干部的培养选拔	未
山西能源革命：煤层气产能利用量约占全国九成	未
山西:补短板强作风 从严锤炼"打铁人"	未
山西襄垣“传承文脉 留住乡愁” 推进非遗保护工作	未
山西转型综改示范区营造公平透明营商环境	未
山西这些人将得到救助，满足条件就可以申请...	未
山西途乐家旅游开发有限公司月薪3.5K提成！包食宿三险一金！	未
山西长治妇女坚守“贴布绣”技艺近50年 带村民找到脱贫路	未
山路上的一道彩虹穿梭于大山深处的健康使者	未
山里孩子的守望者：两名教师坚守教学30年	未
山阳县采取六个加强推进中省环保督察反馈问题整改	未
@山阳残疾儿童，康复救助又出新政策，最高补贴6万元！	未
山顶看日出，海边放烟花，教堂听钟声，都是我想和你做的事，所以你快出现吧。微博视频 幻命	未
山顶航母	未
山高水险，我们来日方长。	未
岁宝百货近3亿港元收购富元国际19%股权 本周四复牌	未
《岁月与旅行》丨走进藏族人家，聆听有温度的故事......	未
岁月如梭，2018年尾声来临，V影响力峰会启动在即回溯过往在微博的经历，你与民众关心的医疗热点有过什么交集，或者有过什么有趣的故事借此次V影响力峰会的机会，快来说说你的经历吧官方线上全方位推广助力活动，参与立得V峰会惊喜大礼包哦！惊喜不断，快 ...全文	未
“岁月如歌 光影四十” ——浙江省庆祝改革开放40周年影展即将启动	未
岁月峥嵘改革开放40周年 看肥东公安管窥祖国繁荣昌盛	未
岁月昆明闹市中心竟然有这样一座清幽的道观，古风盎然	未
岁月波澜有人陪，余生悲欢有人听 喜欢坪 伦 收	未
岁月的花开，开到茶蘼，一瞬的烟花，犹如繁华过后的一场梦境。美食大v秀新浪20年V影响力峰会	未
岁月磨不平最初的真心	未
岁月静好！带你在崇明邂逅一座院子	未
岁末年初给女票送礼物绝对是技术活，天猫双旦礼遇季，还在纠结送礼的男孩纸，戳开了解一下详细清单，实名制担保不会踩雷。 网页链接	未
岁末旅游季，安排上日本游的小伙伴，围观小哥哥如何机智表演翻译一下。好好看，好好学	未
岁末最后大促"双12"明天登场 快来看看省钱攻略	未
岁末随感：夏日午后，夏日的风	未
岂止三成//@梁斌penny:房地产行业至少有三成功劳//@刘成林_NLPR:激动人心的40年！1978年你在干什么	未
岐山人小时候过年才能吃的一道菜，让人回味无穷！	未
岐山人，新版50元人民币来啦！	未
岑溪石博会期间交通管制通告，还能免费坐公车...	未
岑溪这里有一大片花海，菊花矮牵牛一串红约17000盆，种植面积达十亩	未
岗位众多！广州地铁设计研究院招聘	未
岗位年薪最高170万！这份紧缺人才目录公布，找的是不是你	未
岗位招聘七险一金高薪招销售	未
岗位招聘店员月休4天高提成有饭补	未
岗位招聘急聘招聘运营专员	未
岗位招聘新媒体运营不限年龄不限学历	未
岗位招聘普工待遇好长白班可借支	未
岗位招聘行政专员双休工作简单	未
岗位练兵 绽放星光！练好这四样你就可以出道啦！冬日里，寒风凛冽训练馆，热火朝天。一大批警察正在赶来集合，他们在干嘛原来是浙江省乔司监狱2018年度民警岗位年检活动综合考评暨岗位大练兵会操比武开始啦！为了巩固和提升岗位大练兵成果，切实做到五个过硬，积极推进岗位练兵常态化制度化，进一步增强警察警体技能，监狱开展了2018年民警岗位大练兵会操比武。12支参赛队276名民警4大项16个科目，隆隆战鼓声中谁能C位出道我们拭目以待！岗位练兵 绽放星光！练好这四样你就可以出道啦！	未
岙里山隧道口路面最后一压，沿海高速路面全线完工！	未
@岚山大学生创业者注意啦！这里首年免费！	未
岚山的初秋与幽悠by@heykawai	未
岛上故事 转发赠书//@叶佳桐:本期将从转发的朋友中抽出一名赠送押井守《我每天只工作3小时》 查看图片	未
岛国一主人看了网上别人家博美玩雪的美照，甚是羡慕，也带自家狗狗出门拍雪景...结果是感人的 V影响力峰会红人的诞生 萌宠部落格	未
岛国一妹子，看菜单上的猕猴桃酒很神奇！就点了一杯...没想到端上来真的是这样 美食	未
岛国一妹子自己做了小黄鸡主题蛋包饭，原本很萌很开心，可放上番茄酱盖上盖子后顿时命案现场	未
岛国一对新人婚礼，这可能是你见过最萌的捧戒指童子乖惨了  网页链接	未
岛国一网友前些天给一只狸喂了些饭，结果这几天家门口就经常有新鲜的栗子，童话世界里面才有的画面！	未
岛国山形县银山温泉，如梦似幻的感觉好像进入千与千寻动漫世界	未
岛国惊现人皮面具，不只是老司机福音	未
岛国新闻直播这么的欢快的吗	未
岛岸联动！南山这个千年古城要走向世界了！	未
@岛民们，离岛免税购物提额至3万元，还不限次！！！	未
岩佃村：八个一宣传活动促脱贫	未
岩手縣新建大學著力培養災後醫療護理人才	未
岭南，冬月。广州旅行	未
岭南学界痛失东南亚研究英才，他们这样回忆庄礼伟教授治学为人点滴	未
岭南画派赵少昂黎雄才关山月杨善深合作画展开展	未
岳云鹏或搭档孙越再登春晚 冯巩第33次相约除夕夜	未
岳堡扶贫干部	未
岳武高速（潜山段）东延线开工建设	未
岳母的点上来！	未
岳池人快看，岳池某超市免费扫码领礼品吗赶紧告诉家人，越快越好！	未
岳池人的快去捉这个高颜值美女，警方重重有赏！	未
岳池有望新增一个3A级景区，您知道是哪里吗	未
岳池的山，岳池的水，岳池的女娃儿长得美！	未
岳行山川 我主我路 你好，世界！无人机摄影大赛开始啦！快来参赛吧！	未
岳西主簿：这是全国生态示范乡镇，这里美的不仅是风景......	未
岳西公安交警积极组织开展122 全国交通安全日 主题宣传活动	未
岳西县妇联举办凝聚社会合力 共促岳西发展劳动竞赛	未
岳西多地迎来首场降雪  开启冰雪模式	未
岳金林在宕昌县督查东西扶贫协作工作	未
岳金林在文县督查指导东西扶贫协作工作	未
岳金林深入康县开展东西扶贫协作督查	未
岳阳事业单位招聘100(含编制)这些岗位等你来挑选！	未
岳阳人有口福了！这些东西将可直接运到岳阳！	未
岳阳医院牵手10家社区 打造上海东北片区胸痛疾病抢救“高速公...	未
岳阳墙上拉面，以爱之名，你吃过了吗	未
岳阳女子精心做局，18人入套，500万元打水漂......	未
岳阳市妇幼对面港九湾小区房屋出租！奇家岭希望门门口空门面转让！	未
岳阳旋律琴行会展中心 克利夫兰音乐学院国际钢琴大师班	未
岳阳湘阴县招聘医疗卫生专业技术人员103人！	未
岳阳烧烤甲天下！	未
岳麓书院收费：大学如何更好地开放	未
岷县召开渭武高速岷县服务区设计方案意见征求会	未
岷县小美女跳广场舞！	未
岸上风景君须记 大新县雷平镇那岸村	未
岸绿景美  一组数据带您了解九十九湾水系连通工程进展....	未
峃口大桥正式通车！	未
峄城又一片区棚改啦！仅一天，征收工作便完成84...	未
峡谷史诗级battle！嘴皮上来一场打野的较量！	未
峡谷神秘力量降临，我给你萌把三个彩蛋都扒出来了。今天水晶也不推了，就针对三个彩蛋开开脑洞吧	未
峥嵘岁月 嘹亮如歌——老中青音乐人相聚上海追忆改革开放往事	未
峥嵘岁月斗争会场上人山人海，红旗招展，口号声此起彼伏	未
峨眉乐河景观带开建！预计春节前正式开放	未
峨眉交警全力以赴，您的平安交警蜀黍来守护！	未
峨眉人的高铁时代已经来临！只要8小时！就可以坐车到香港超啦！	未
峨眉人速看！提前退休真的确认了！只要符合这些条件就可以！	未
峨眉山女背山工：放假让儿子回来当游客今年6月，42岁的邓淑芳负重200斤，运送建筑材料登峨眉山的照片，震撼了无数人。而这样的负重，她每天大约要背10趟，每趟可以挣20元。女儿出嫁，儿子才读初一，邓淑芳说，当背山工就是为了供娃娃读书，读书了以后才有前途。她还说，虽然爸爸妈妈都是背山工，但她想让儿子暑假回来当游客，看看美丽的峨眉山！	未
峨眉新添一休闲去处！寨子深处 茶里飘香	未
峨眉的川桃公路可以通车了一起去现场看看吧！	未
峨眉的川桃公路可以通车了我们一起去现场看看吧	未
峰会之后又逢君，习近平说这事创造中阿关系史新纪录 	未
峰会之后又逢君，习近平说这事创造中阿关系史新纪录	未
峰会之后又逢君，习近平说这件事创造了中阿关系史上新纪录	未
峰会消息正开会呢。老川说：正加劲努力达成deal。还说，中国方面出现了好的迹象。另外布宜诺斯艾利斯警方说，场外发现了八枚简易汽油弹。	未
峰会直播V影响力峰会 医疗V峰会 12月22日，由微博健康医疗新浪健康爱问医生主办的2018V影响力峰会健康医疗发展论坛盛大开幕，新浪高级副总裁曹增辉行业领袖段涛陈静瑜顾锋微博大V@整形医生修志夫微博健康医疗运营负责人董英志等嘉宾汇聚一堂，围绕赋能健康医疗的主题，分别 ...全文	未
峰会直播V影响力峰会 医疗V峰会 微博健康医疗运营负责人董英志分享，他认为，医生大V作为医疗领域的品牌标杆，可以通过线下诊疗导流精准患者合规的医药设备广告传播和内容输出在线咨询等三大途径实现导流媒体知识三种品牌价值变现。据介绍，目前爱问医生平台已逐步形成以社交诊疗工具服务流量与运营数据服务和认证与合规服务为一体的一站式互联网运营闭环体系。	未
峰会直播  中外投资名家联袂，解密2019Alpha机会！@华尔街见闻APP 的一直播（下载App-gt网页链接）	未
峰会直播微博高级副总裁@曹增辉  在V影响力峰会将为大家深度解读微博的运营策略。 北京国家会议中心	未
峰岚！峰岚！峰岚！	未
峰峰家住滏阳新村的都看看吧！	未
峰峰放心消费创建示范单位名单新鲜出炉！	未
峰峰邯郸定制公交正式开始运营了！	未
崀山百里脐橙连崀山产业扶贫耀三湘 第四届脐橙文化旅游节	未
崂山海上名山第一，一个让您流连忘返的人间仙境！	未
崆峒区新增3辆收集车和500果皮箱	未
崇安寺老钟楼预计年底开放作为无锡文化地标之一的崇安寺老钟楼（无锡县图书馆旧址）已修缮一新。崇安寺老钟楼为省级文保建筑，此次修缮主要解决屋面出现渗水木构糟朽油漆剥离等问题。老钟楼预计年底向市民开放。	未
崇尚英雄《人民日报》央视等追记江苏如皋辅警沈银亮	未
崇州妇幼今冬流感来袭，你准备好安全应对了没	未
崇州巨变城建升级换代 休闲通行步入新时代	未
崇州民间河长开始巡河啦！	未
崇州青们关心的2019年部分节假日安排出炉啦！春节这样休！	未
崇左的24小时，你能找到几个扶绥的画面  扬帆新时代 锦绣新广西	未
崇德向善受人敬！	未
崇德向善受人敬！ 蓝天仪仗队致敬农民英雄李有才12月6日，空军八一飞行表演队队长曹振忠上校，致敬舍己救人的农民英雄李有才: 人间有爱，星空有你！	未
崇德向善和谐宜居 大庆市创建全国文明城市巡礼	未
崇明东滩观鸟季已到，来一场说走就走的湿地之行冬季，去东滩感受芦清水秀，飞鸟凌空的诗意，纷扰的思绪都会变得舒展和温和每年的11月至次年的3月正值崇明东滩观鸟的最佳时节，何不趁这个好时节去东滩湿地公园，来一场说走就走的湿地之行地址：崇明区陈家镇东旺大道风车处电话：021-39367 ...全文	未
崇明中学：引导学生学业和职业贯通发展	未
崇明“博士农场”即日起可申报 可获一次性20万元开办补贴	未
崇明变迷雾森林 建筑似空中仙境般屹立最近几天，你被上海大雾刷屏了吗雾中建筑，如同空中仙境般屹立朦朦胧胧的日出，微光与白雾交相辉映，在如此仙境中游走一番，你会不会心醉以为自己可能还在梦中，没有醒来让我们一起走进雾中崇明，走进人间仙境[给你小心心]网页链接	未
崇明味道  这里是一个用桔子搭起的乐园	未
崇明岛大爱城：生态岛屿上的3000亩康养之城	未
崇明明珠湖公园推出门票半价活动，部分游乐项目免费体验！	未
崇明有个创业孵化园，帮助青年创客实现梦想	未
崇明有种呆萌的林中精灵，可是国家二级重点保护动物哦	未
崇明西北部，当年的围垦小镇，如今美出了诗意！	未
崇明这个公园里呆萌的TA，可是国家二级重点保护动物哦	未
崇明这个地方的老地名，每一个都有段神秘故事	未
崇礼国际滑雪节启动 期间将举办125项赛事及活动	未
崇礼国际滑雪节将举办国际雪联世界杯等上百项活动	未
崇礼滑雪节持续至明年3月，7大雪场全有优惠	未
崇礼网红滑雪小镇！住宿雪票餐食，人均300，房态紧张，速抢	未
崇祯五年十二月，余住西湖。大雪三日，湖中人鸟声俱绝。是日更定矣，余拿一小舟，拥毳衣炉火，独往湖心亭看雪。雾淞沆砀，天与云与山与水，上下一白。湖上影子，惟长堤一痕，湖心亭一点，与余舟一芥，舟中人两三粒而已。//@汉唐三三:云赏雪	未
崔世安会见辽宁省省长唐一军一行 双方共商合作实现发展共赢	未
崔世安将赴江苏考察苏澳合作园区	未
崔世安：澳门全面参与中国深化改革开放战略部署	未
崔世安：澳门全面参与国家深化改革开放战略部署	未
崔健：爵士乐是未来的音乐	未
崔升豪谈健康之道(图)	未
崔大使送给美国的新年礼物	未
