感恩公益音乐会 敲棒好消息！荔枝妹等了一年的公益音乐会将于12月8日在广州星海音乐厅举办啦这一次我们可以帮助3000名孩子，用声音，在一起本次公益音乐会的门票也会用于帮助白血病等困境儿童筹款，让我们一起守护生命陪伴温暖	未
感恩南京最黑暗时刻国际友人的救助 南京安全区和平徒步活动开始报名啦	未
感恩南京最黑暗时刻国际友人的救助 南京安全区和平徒步活动开始报名啦 感恩南京最黑暗时刻国际友人的救助 南京安全区和平徒步活动开始报名啦	未
感恩同行，一路有你  清扬茂业带你体验真假吃鸡！抓紧上车	未
感恩同行丨中兴关怀高寒区老用户活动启幕！	未
《感恩》壶关：一个店一群人感动全城	未
感恩女生//@维克多刺猬://@一个小写的S://@jacarpaner: //@追风少年刘全有 :差点被你绕进去了//@我朋友是个奇葩 ://@COLD-BLUE-DAY5 :真实//@水晶男孩鸡大帅 :希望姐妹们都做这样大气的girl	未
感恩季  泰康拜博助你成为别人家的企业	未
感恩就像早间你送来的葱油饼	未
感恩，感动，正能量立！正因为有你们，我们才一直与温暖前行！//@袁立:终于关注我们啦我们在长沙附近的娄底，桑植，涟沅，安化，兴化，攸县，岚山，做了450个尘肺病家庭孩子的助学，今年一年。希望有更多的湖南当地的志愿者与企业，关注到肺病家庭，因为你们离湖南尘肺病患者更近。	未
感恩  我的爸爸妈妈 ！	未
感恩所有教导过我 帮助过我的老师们前辈们感恩所有为我们默默付出的工作人员们感恩全力支持我的家人朋友们还要感恩最重要的你们一路很长 感恩相伴love u all.爱豆感恩节谢谢你们	未
感恩改革开放 澳大利亚闽商分享“创业故事”	未
感恩月免费耳鼻喉检查！还送空气净化器降噪耳机等万元大礼	未
感恩有你。	未
感恩有你们	未
感恩有你垣曲：你在我的世界路过 温暖了整个冬天	未
感恩有你有你们	未
感恩有你，来看我的直播，给你最温暖的陪伴。 微博直播	未
感恩有你的365天，邀你共享万人免费宴丨农商行水秀宴就是要把你们宠上天！	未
感恩有您 情暖环卫青华外国语小学感恩节关爱环卫工人活动	未
感恩 查看图片	未
感恩特辑中国驾照在美国如何开车	未
感恩的节日，火鸡什么的只是外国节日形式，关键是感恩的心，感恩父母生养，感恩朋友的关心，感恩大家的支持，更感恩黄咪的陪伴。谢谢大家，节日愉快。	未
感恩站在我身后支持我的人。	未
感恩第三年受邀参与V影响力峰会，12月21日12月23日北京国家会议中心，2019制造更多开心，芒妈在现场等你呦V影响力峰会聚焦V视界	未
感恩，继续嗨3天	未
感恩节0元门票，创意版的昭院动物园一定要了解下！	未
感恩节丨只想好好宠你！（内有旅行茶具大礼包）	未
感恩节 免费午餐  请你好好吃饭 冬天到啦，一碗热饭菜就让人心生温暖呢！支持@免费午餐，每4元，就可以帮助乡村孩子们在这个寒冷的季节吃上一餐热腾腾的饭菜！而且，餐妞妞悄悄告诉你，通过如下方式捐赠，还可以看到免费午餐爱心传播大使 @景甜   人美心善的大甜甜哦  当 ...全文	未
感恩节后记丨冬天悄然来临，这里温暖如春！	未
感恩节完达山有奖回馈！   杉杉妈爷爷那一代就是喝完达山的乳制品长大的，到杉杉已经四世同堂，还是在喝完达山完达山作为农垦老品牌，是许多家庭代代见证传承的好乳品今天是感恩节，完达山值此之际发起六十年信任之选，感恩见证回馈新老粉丝的活动，感恩大家60年如一日支持完达山 ...全文	未
感恩节最感谢谁？特朗普：我自己	未
感恩节特辑丨水富市居家养老邻里守望 感恩有你 主题活动	未
感恩节的小科普	未
感恩节种牙 春节任性吃	未
感恩节里的仪式感：看这群扬州娃的感恩Party如何high！	未
感恩节魔术师约翰逊晒全家福	未
感恩许愿纳福还是请几张中国味门神年画管用	未
感恩 鳄鱼：咦Thanksgiving Day诶	未
感悟人生！	未
感悟  从村官到公务员，我的成长感悟	未
感悟 好心，永远有好报	未
感悟清风幻影丨有暖气的楼房	未
感悟点滴生活中，很多人希望有所得，以为拥有的东西越多就会越快乐，于是沿着追寻获得的路走下去，有一天却发觉，忧郁，无奈，困惑，伤心，无聊，一切不快乐，都是因为渴望拥有的东西太多，在不知不觉中，我们已经执迷于某个事物上了生活中，也有很多人知道，懂得舍得，才能获得！	未
感悟点滴谁有历经千辛万苦的意志，谁就能达到任何目的坚持者能在命运风暴中奋斗机会只对进取有为的人开放，庸人永远无法光顾多想想自己的错，就会慢慢忘记别人的过爱若疼痛，就不叫爱爱若卑微，便不再是爱总有些事放不下，让人忘了时间总有些事必须放下，因为还有明天	未
感情中所谓的安全感其实很简单与旁人保持距离与爱人保持深情	未
感情这事，不负彼此就好，想要不负此生太难。没有办法和喜欢的人在一起其实是人生的常态。昨天晚上，在听田馥甄唱的那首新歌《爱了很久的朋友》。歌里面有句歌词听得我特别难受。「最后我们变成爱了很久的朋友，可笑在爱到血肉模糊时候，泪水能补救，可惜到伤疤结在心头。」一直都觉得，这是爱情里最心酸的状态了，爱到最后，我们变成了爱了很久的朋友。不知道你们能不能懂那种感觉，就是很多年后，心知肚明站在眼前这个人，彼此都不会再相爱了，甚至连那种没办法在一起的那种怨恨难过都没有了。就是那种，我们不会老死不相往来，但也不会再有刻	未
“感知中国——中国西部文化行”走进俄罗斯	未
感觉今年都是满脑子工作的状态，大家给我推荐一些娱乐项目 （电影院除外，我就这个去的多）	未
感觉全世界的人都在发微博 就我在乎的那个人不发就像进了个大超市琳琅满目的东西应有尽有 可就没有我想吃的那只大羊腿	未
感觉好暖(//////)//@太皇太后您有喜啦:(  )羡慕//@开心大笑鹅:啊//@文科班校花酱:执子之手 与子偕老	未
感觉工作和生活都更有动力了呢中超联赛 中超2018	未
感觉很久没发（9）图了                  一台敲好看的 812superfast蓉城车摄IMACARmerAMan .....@爱擎海  @迪拜-24@-局长别开枪-   @Brian_13 @PS3保罗@Top-Cars@全球汽车改装资讯@FrostPhotography  @跑车Race @小栗KomLee @千寻berlinetta@全球超跑@Key-Board-King	未
感觉快过年了特别想吃八宝饭小时候期待过年就是想吃这个因为平时家里也不会买八宝饭吃别告诉我你们过年都不吃八宝饭	未
感觉我的粉丝都挺内敛，基本上不跟我互动。	未
感觉手里拿个球拍更适合啊	未
感觉掌握了一些了不得的小技巧	未
感觉更像火腿或者切片的松茸//@长歌经年:感谢这位市民，虽然我没看出北极熊的形状	未
感觉网易这个19元/月的大白金卡很划算，送2年的网易云音乐黑胶VIP 2年，现在存100元还能得200元。	未
感觉能吃撑//@M大王叫我来巡山:盘子用来兜底吗这份量谁顶得住啊//@江南大野花:分量感人//@Big鬼Dick舅Futa:。。。//@古橋文乃丶:所以那个盘子拿来干嘛的。。//@第三类面包接触:沃日//@三司绫濑的月匈垫 :卧槽//@苏苏怎么叫_咕咕咕 :给我一点就好了//@伊吹便当 :干你娘塞爆	未
感觉自己技术不行//@到遥远的以后h:太实用了	未
感觉还挺招财的	未
感觉这个新疆女孩大概率颜值偏高	未
感谢4年的悉心照顾，老人硬塞红包给医生，结果很暖心我就是想让你们拿着这些钱好好去吃个饭，没想到却给你们添了麻烦。12月18日，88岁的余世芳奶奶再次来到武汉市第六医院。这是老伴去世后，她第二次来到医院。您把钱收好，心意我们心领了，感谢您对我们的信任，我们只是做了应该做的。 ...全文	未
感谢@SixtoryOfficial_TH 看见照片真的有感动到！	未
感谢上野国立科学博物馆，解决了我几十年的困惑终于分清这几种牛肚了！	未
感谢上野国立科学博物馆，解决了我十几年的困惑终于分清这几种牛肚了！	未
感谢中国企业家杂志多年对我的鼓励与支持	未
感谢中国尘肺病防治基金会理事长黄毅先生邀请，袁立女士参加了在长沙举行的，围炉话征尘尘肺病专家及各定点医院院长专家学者座谈会参会的有各地志愿者及医院院长，还有国家卫健委职业健康司副司长王建东先生，中国职业健康协会副理事长马骏先生，中国疾病预防控制中心职业卫生首席专家李德宏先生 ...全文	未
感谢交警辛苦！朋友们雪天路滑，能不出门就别出门吧！	未
感谢今天的李弄让我明白了我的意义	未
感谢今天苍云贴吧负责人帮忙出面整理。关于今天的问题。1，我不是主办和策划已证明。谢谢各位。作为念破本地土著我是想做个歌会，欢迎各位来坐坐，情急之下打错了一个词，后面发现立刻改正，这个截图片面会造成误会。希望不要被有心人带节奏。谢谢大家，也谢谢群主后面的支持。2，关于七秀各位的疑问，秀秀说她最近身体不好委托我帮忙上号发一点消息，情急之下她不知道该找谁，信得过我就麻烦我了，我就上来了，但是我就发着一条，也说了我不参与。别的啥也没说。之前红尘的事还在眼前，大家那时候对我的信任，我连夜陪大家一起整理的东西，今天	未
感谢会克制的芦苇	未
感谢信牵出温暖故事：“卢警官对我们就像亲人一样”	未
感谢信致滦南这位无名的好心人，谢谢你！	未
感谢冒着风雪送来宵夜的外卖小哥	未
感谢军校，竟然治好了我这么多的“疑难杂症”	未
感谢@十三乱 协调当地官方对接	未
感谢右边//@王希希ss://@崔老师后援会:回复@爱海-无涯:非常感谢！去后请联系北京永源基金会，把情况向工作人员说明。电话，010-59483308//@爱海-无涯:回复@崔老师后援会:我是淮南的，离丁集不到40公里。愿意跑腿，可以吗	未
感谢各位网民对我微博的关注 在此次事件当中，我衷心感谢罗湖警方真诚的沟通和帮助，现在事情已经得到了解决，希望大家不要对该事件进行评论和转发！再次感谢各位的支持和帮助！	未
感谢大姐持续扶助与鼓励！//@迟夙生律师: 克勤弟总是在努力工作着。//@王克勤:湄潭计划稳步推进//@王睿璇-大爱清尘: 转发微博	未
感谢大家一直以来对歪瓜出品的支持！12月21日-12月23日，北京偶遇不V影响力峰会 V电商势无界	未
感谢大家支招 由于没借到高速拉条 借了个六星针女花鸟卷 我这边返魂香骑驴少女镜姬日和坊镜姬小僧镜姬椒图，对面一速多动镰鼬 二速兔子 三速蓬莱钢筋 大舅和荒 只要荒尾速收割不弄死花鸟卷就能翻盘	未
感谢大家的支持，峰哥已于今晨平安抵京，希望长途飞行后可以好好休息 因考虑安全等多种因素，后援仅在北京会员群内发出不走v通知，并告知如有接机，请务必遵守秩序 非常理解大家许久未见机场峰的心情，但在今天的接机过程中出现了一些非常不和谐的景象，须引以为戒 希望大家可以自觉维 ...全文	未
感谢大家的支持，想当锦鲤的速转，不设置过滤。再转我这条追送3个66.66.红包。12.17开！ 查看图片	未
感谢大家辛苦参与抢楼活动，活动结束会进行审核，会公布最终名单，谢谢大家	未
感谢官方爸爸治好了我多年的颈椎病，让我可以备战明天开启的新一轮部落对战联赛	未
感谢官方解说狂人李九瓶子琪琪，斗鱼主播托米温柚有痕和触手主播塑梦集体为@王者荣耀 游戏安全发声，号召玩家们一起拒绝消极游戏行为和抵制买分卖分玩家，峡谷的游戏环境需要大家共同维护！记住，不是一个人的王者，而是团队的荣耀[星星]1220游戏安全日	未
感谢宠物之家小猫版网友的帮助！收到他们的爱心基金9500 直接转入医院鹏峰的账户了，为毛孩子们付掉了9500的医药费，感激不尽	未
感谢小平！40年前的今天，没有小平的改革开放，就没有今天的一切	未
感谢小朋友这么捧场 我们家所有甜品都会坚持干净卫生无添加，让大家吃的健康又安心	未
感谢小橘@林彦俊 在艾滋病日传递正能量，温暖陪伴，消除歧视，艾让我们在一起星光公益力	未
感谢微博和英雄联盟V影响力峰会 游戏V势力	未
感谢微博官方的邀请，但我不会去参加V峰会。@微博财经	未
感谢@微博明星@微博科普 @微博读书 @微博历史 @微博科技 @微博军事 等兄弟领域的支持！	未
感谢所有，目前所有画已售空，仅余公益周边的义卖捐助，有意向愿意帮助的可联系我们，最后，代替所有孩子们，谢谢每个善良的你们愿意帮助他们 后续参与本次公益活动的明细会统计公布，谢谢	未
感谢拥挤的地铁	未
感谢提供线索！//@梁莹0606: @沈阳身边事 @沈阳大小事 铁西区卫工街七马路西侧一个中国移动网点，我是开车路过看到的，去了好多的消防车 ，已经收尾了，有无人员伤亡不清楚//@沈阳大小事:沈阳爆料 麻烦把情况详细说一下，几点，哪里，火势如何，有无伤亡	未
感谢支持//@Ansom_yang:下单了！	未
感谢支持//@CJ-牛牛: 本地期刊已经很难买到了，看来要网购一本	未
感谢支持。我一定来，12月22号北京见	未
感谢@新浪旅游 @微博旅游 喜提微博十大影响力旅游大V2019继续探索世界发现不一样的美不止旅行V影响力峰会 北京国家会议中心	未
感谢新浪[给你小心心]让隔着屏幕的彼此拉进了心的距离 接收能量 传递力量 新浪20年我和新浪的故事 祝新浪20岁生日快乐 我们一起致敬影响力	未
感谢时间，让我明白	未
感谢时间，让我明白，人生什么最重要	未
感谢曲沃78岁白内障老人照顾截瘫儿子25年不易 侯马五官科医院多次上门问诊为其做复明手术	未
感谢有你们为我们出行保驾护航//@广州铁路: 40年微电影 致敬40年 我们的房车今天，让我们一起听听广铁供电检修师傅们讲述《我们的房车》故事，了解高铁供电接触网工们别样的房车生活，一起见证中国铁路供电检修装备的飞速发展。我与中国铁路40年	未
感谢有你！六年初心不改，会魔术想听你说...	未
感谢有你//@南京头条:	未
感谢有你  我市这样迎第33个国际志愿者日	未
感谢有你 缘聚于此丨康正广东深圳车城员工生日会	未
感谢朝阳群众揭发，小仙女戏真多，被曝光马上换名字头像了下次要不要来暴张照，据说你的双眼皮是天生的	未
感谢！//@林熊猫:致敬！//@回忆专用小马甲:向英雄致敬//@四包叔叔:好！//@M大王叫我来巡山: 司机棒！小女孩也机智！//@Mian_弥安://@夏正正:好人好报//@这是一个很高冷的ID://@崬坡先生:打爆他的狗头	未
感谢每一次相遇 我们一起成长@惠基金 体育为社会 我们在路上	未
感谢理性的路人们[给你小心心]//@芒果酱_XUE:很想转一下这条，当然，很多显而易见的东西摆着，而有些人不是眼盲，是心盲。眼盲是蠢，心盲是坏。心盲吃瓜，就是坏和恶罢了。	未
感谢生命中与你相逢@郑医器官移植中心	未
感谢@盐酥鸡悦_ 送来的宝可梦曲奇！虽然被快递碎了可依然能感受到美貌与好味！	未
感谢老东家中国银行的罗行长，来喜投网交流指导工作，还给我带来了生日礼物，即使离开中行多年，但仍然还是老中行人	未
感谢//@肖朝兵: 天气寒冷，一线执勤的同志们要注意保暖！//@深圳交警:上班天气天气寒冷：预计早晨6-9时，全市阴天间多云气温10-12相对湿度75-85偏北风3-4级，沿海和高地最大阵风6-7级全市大部分地区能见度在10-20公里。寒冷黄色预警信号生效中，及时添衣	未
感谢@西安市禁毒委员会办公室 @西安公安 @长安公安 @长安区禁毒委员会办公室 以及领导的信任 幕后英雄，才是真英雄[加油]我估计有的人今晚又要气的睡不着觉了	未
感谢这些中国人，用造谣把爱国做成了一门大生意	未
感谢这些亲临现场的CFer，但是因为特殊原因，还望理解	未
感谢@鄢烈山 爆料，这次去福岛参观的媒体有：环球人物，澎湃网，界面网，深圳卫视，湖南卫视。	未
感谢里皮教练把我的梦想保留到最后一刻！对未来的挑战和期望大于遗憾！ 无论何时何地，我都会是中国队最忠诚的战士和球迷！中国队亚洲杯加油，兄弟们加油	未
感谢@铁路小亨 罗老师寄来的台历每张图都是他去国外或国内实地拍摄的	未
感谢阳湖菜市场，让我在这里变成了一个月半子！	未
感谢@韩栋 传递星光公益力，让我们一起消除歧视，关爱艾滋病宝宝的健康成长[给你小心心]	未
感谢鲨姐//@闵塔鲨:高定男孩 王源源	未
愿一切和平。	未
愿一切顺利	未
愿世界和平	未
愿你一个人，安静而丰盛，两个人，温暖而踏实请guan.注@芯話	未
愿你三冬暖，不惧风雪寒。	未
愿你三冬暖 愿你春不寒 愿你天黑有灯 下雨有伞 愿你一路上 有良人相伴	未
愿你三冬暖，愿你春不寒愿你天黑有灯，下雨有伞愿你一路上，有良人相伴。	未
愿你三冬暖蓝海酒店集团冬季送温暖，真情暖人心	未
愿你们都拥有	未
愿你：口中有德，目中有人，心中有爱，行中有善。	未
愿你喜欢的人 也偷偷的喜欢你	未
愿你在2018年的最后一个月收到好消息	未
愿你在这里收获一场难忘的旅行  不可不知的丽江  旅游篇	未
愿你夜里有灯，梦里有人，卡里有钱，平安喜乐，得偿所愿。	未
愿你安好	未
愿你心怀希望，面向阳光。	未
愿你成为温暖的人[给你小心心]	未
愿你成为这样的女子：不炫耀，不争吵，做一个博学的女子不空洞，不浮躁，做一个丰盈的女子即便生命枯竭，亦在优雅中变老  亦舒	未
愿你所遇之人皆良人	未
愿你找到	未
愿你拥有牵手就是一辈子的爱 161cmamp173cm	未
愿你有平凡的一天，去过向往的生活	未
愿你每天早上醒来收到的都是不断的好消息！	未
愿你的城市有清风，有烈酒，也有良人为你守候 .	未
愿你的小脾气喜欢的人都懂	未
愿你能勇敢的辞去旧人，也能勇敢的迎接新人。	未
愿你能成为这样的女孩	未
愿你能找到一个保护你一生的人	未
愿你被世界温暖 不再寒冷	未
愿你被世界温柔以待，愿有人对你说上一世晚安	未
愿你被坚定的选择	未
愿做萤光 照亮他人(图)	未
愿关注我的女孩子们全都美梦成真	未
愿君早旋返，及此荷花鲜。	未
愿和平 永存！ 国家公祭日	未
愿天堂仍有奔跑的玫瑰7号//@张呈栋: 愿天堂仍有您飞翔的身影！	未
愿女人都能被这世界温柔相待。	未
愿好人一生平安	未
愿好人有好报	未
愿平安	未
愿平安一生	未
愿平安无事	未
愿开开心心，钱包鼓鼓的！！	未
愿往后路途 你的深情不再枉付	未
愿往后路途你的深情再也不枉付。.	未
//@愿心愿之心:大A不挺，还有缺口没补完呢，港港需自强，拿出老港人的血拼精神吧。	未
愿意帮助她的朋友请扫她微信二维码联系即可 查看图片	未
愿意把钱给老婆管的3个生肖男人，还很会赚钱，最让老婆安心	未
愿我们身边都有一个在风雨里不离不弃的人。	未
愿所有女孩都能遇到一个爱自己的男孩！	未
愿所有的荣归故里，都能回报家乡	未
愿把房子安在山谷，沐浴着阳光，漫步在宁静的乡村小道上。	未
愿早日康复！	未
愿有一人，陪你看尽苍山洱海，风花雪月大理客户：@让我们聆听阳光在碰撞	未
愿有人作伴 凑一桌吃饭 讲讲废话 把真实的生活都过完	未
愿有人陪你三生三世十里桃花 共你鲜衣怒马 驰骋天涯	未
愿有人陪你并肩作战	未
愿望·信心·梦想——写在2018两岸企业家峰会年会举行之际	未
愿望成真！男子捡到许愿气球后助陌生女童完成心愿	未
愿望有四个	未
愿每一个经历生门的女人，背后都有一个值得你拿命去拼的男人	未
愿每个人都能遇到自己的良人，而后平安喜乐的过一辈子。	未
愿每个你听过很多道理，然后过好这一生。	未
愿爱实现。	未
愿用爱参与留守儿童成长 “后备箱图书馆”回访成都芋河村小学	未
愿看到这个视频的朋友，每天都有个好心情！ 微博视频	未
愿看到这条微博的你 也能找到属于你的多啦A梦	未
愿终有一世 你将皈依我或来世你渡我 可愿私享世界旅行灵感季西安旅行 （如是行道者，松风水月华。拍于：西安卧龙禅寺） 西安卧龙寺	未
愿这个冬日，有一场温暖的相遇	未
愿这座城市里的每一个你，都能在冬日里拥有温暖的家	未
愿逝者安息！伤者早日康复！//@人民日报: 卫健委：派出国家专家组指导伤员救治28日上午，国家卫健委派出卫生应急办公室和北京积水潭医院北京安定医院的重症医学烧伤心理危机干预专家共5人，组成国家医疗专家组，赶赴当地指导伤员救治和心理安抚等工作。 网页链接	未
愿逝者安息受伤人员早日康复	未
愿逝者安息，和平与正义永存！	未
愿逝者安息 和平永存	未
愿逝者安息，和平永存！	未
愿逝者安息，和平永存	未
愿逝者安息，和平永存！ 公祭日	未
愿逝者安息，和平永存。勿忘国耻，吾辈自强	未
愿逝者安息，和平永存！ 国家公祭日 //@李靳宇: 可以宽恕，但不可以忘却。让我们铭记，和平让世界更美好	未
愿逝者安息，和平永存！//@王源微吧:公祭日 愿逝者安息，和平永存！	未
愿逝者安息，愿和平永存	未
愿逝者安息，愿生者前进。我们将踏过先辈用流血和牺牲铺就的道路，用不忘历史和砥砺奋进走出属于中国的新时代	未
愿逝者安息//@杨幂官方粉丝团:勿忘国耻，吾辈自强。愿逝者安息，和平永存！	未
愿逝者走好，正义永存。	未
愿都平平安安的	未
愿雾霾不再，愿《冬日的阳光》，温暖着你我	未
慈世平：期待能看到湖人打进决赛慈世平在近日接受采访时谈到了现在的这支湖人。他说：詹姆斯能加盟湖人非常酷，但你知道对我来说，我与莺歌还有祖巴茨一起打过球，所以我为这些年轻的家伙感到激动，我也同样为兰斯感到激动，从我个人角度，作为一名湖人球迷，能看到湖人在本赛季有机会打进季后赛是非常振奋人心的一件事，我很确定勒布朗不会只满足于季后赛首轮。很多人能带领湖人打到第四或第五，但勒布朗能帮湖人拿到西部第一，所以我非常期待能看到湖人打进最后的决赛。湖人现在取得18胜12负的战绩，暂时位列西部第4。	未
慈利公安召开专题党委会传达贯彻枫桥经验纪念大会精神	未
慈利市即将新建机场，你支持修在哪个乡镇	未
慈善儿童筹款	未
慈善拍品赏析之南山慈云琉璃茶具 第四届华夏信财洲际酒店集团慈善晚宴	未
慈善文化进校园  重庆举行首届慈善诗歌朗诵会	未
慈善理念薪火相传 牛根生获得2018爱心奖他从家境贫寒的养牛娃出身，一手缔造了蒙牛帝国。近些年他从商场转身公益，悄悄办了学校建了医院种了树，打造出另一只牛老牛基金会，在全球各地的公益项目规模已超过 13 个亿。他是第13届2018爱心奖得奖人 牛根生。公益之心代代相传，牛 ...全文	未
慈济社会筑梦远行爱建信托慈善助学项目在无锡启动	未
慈溪的这个好嫂子被评为中国好人	未
慈溪空降10000上海街，吃喝玩乐全都有	未
慈溪这家只有一张桌子的店，在朋友圈迅速走红	未
_//@慈溪风少:_//@悬壶问茶:_//@铁与火-白孟宸:要感恩，同时也要记得报仇。谁组织，谁在背后支持，都要小本子记下一个个算账，百倍千倍奉还，才能保证我们的安全	未
慈禧六十大寿：民众一贫如洗，她却众人簇拥，还收获一辆小汽车	未
慈阳投资完成私募管理人登记 法定代表人为史朝兴	未
慎选“功能性”保暖内衣	未
慕了，我以前那个号阳光信用698	未
慕婷空气棉柔卫生巾2盒 16.9这款卫生巾的反馈评价都很好的啊，用起来很舒服，不会感到闷！这个包装也很好看	未
慕容晓晓酷狗首唱《包围圈》引万人围观	未
！！！！！//@慕色成歌飞绛雪: ！！！！//@白叶生:	未
