封开掌圈11.27最新封开求职招聘，房屋买卖，商业资讯汇总！	未
封开掌圈11.28最新封开求职招聘，房屋买卖，商业资讯汇总！	未
封开掌圈12.1最新封开求职招聘，房屋买卖，商业资讯汇总！	未
封开掌圈12.2最新封开求职招聘，房屋买卖，商业资讯汇总！	未
封禁5年终于重映，每个成年人都该看	未
封藏2018！这可能是今年买到桃花源大合院的唯一机会了！	未
封路6个月11条公交线路调整！龙岗人，这波出行消息请收好！	未
封路一大波公交线路调整！深圳交通有新变化，千万别坐错了！	未
封闭式阳台设计参考小户型装修 家居微盘点	未
封闭管养正式结束 长江隧道恢复全天24小时通行	未
封面人物柴碧云一位碧海蓝天 云淡风轻人如其名的高级女子她的美 有一种来源于不哗众取宠有别于普众的高级	未
封面故事唐代的长安不仅是商业枢纽和物资汇聚之地，达官贵人才子佳人生活的空间，更是信仰之都来自波斯的商人带来了景教祆教摩尼教作为当时实际上的佛教世界中心，从印度中亚而来的佛教僧侣，只有到达长安，才能登上传法事业的顶峰，而来自东瀛和新罗的学问僧们，又把从长 ...全文	未
封面生活牢记！16条健康警戒线这16条警戒线关乎你的健康甚至寿命长短，不妨对照一下，如果超过了警戒线，一定要提高警惕！	未
封面速读 中共中央举行纪念刘少奇同志诞辰120周年座谈会广州国际花卉艺术展下周开幕 奥运冠军进乡村，圆孩子们乒乓梦周末到黄花岗公园看秋菊争奇斗艳为拍抖音火锅泼人，男子被判刑半年。更多详情：网页链接	未
封面速读 庆祝改革开放40周年大会12月18日上午在京举行2018中国森林旅游节昨开幕养犬四件套今起可领取，广州警方：可在指定地点免费领从化推出首条最美婚旅线路，起点为西和风情小镇 终点为温泉财富小镇详情：网页链接	未
封面速读省卫健委上线民声热线表示，九价宫颈癌疫苗供应紧张情况有望缓解：九价HPV疫苗明年或加大供应，详见A04金红棉影展今年新增午夜场，广州纪录片节周六起展映，60余部影片放映近百场次，详见A09这艘极地巨轮 广州制造，详见A03市民齐来找茬 曝光不文明现象：广州是我家  ...全文	未
封面速读 省卫健委：为免市民熬夜抢号，将调整医院预约挂号时间 全国首家纪录片展示中心亮相广图 齐来建言献策，共建美好城市广州第二机场落户增城正果镇更多详情：网页链接	未
射埠十大村霸名单出炉！各个都是狠角色，令人闻风丧胆！	未
射干丰收，朱家场一个村民组产值就达230万！	未
射我！！！！//@大仙儿是个蓝胖子 :小爱神冲呀！！！！	未
射手之最最诚实最不修边幅最不记恨最好赌最怕无聊最爱往外跑最丢三忘四最乐观最易犯罪最不会烦恼最会临时抱佛脚最快乐最有肚量最会伤人心最不重视纪律最不会判断是非动作最快最喜欢刺激最不会看脸色最容易交到坏朋友最多帅哥最不爱用功最会突发奇想	未
射手榜并列第一昙花一现萨拉赫YNWA	未
射阳设100个党报免费阅读点	未
将专利转化为生产力 我国拟修法促进专利实施运用	未
将中医药文化带到世界各地	未
将中医药文化带到世界各地（庆祝改革开放40年·百城百县百企调研行）	未
@将乐人看《将乐新闻》，11月23日精彩视频戳这里	未
@将乐人看《将乐新闻》，11月26日精彩视频戳这里	未
@将乐人看《将乐新闻》，11月30日精彩视频戳这里	未
@将乐人看《将乐新闻》，12月3日精彩视频戳这里	未
将乐的26家好企业，任你挑选！将乐招聘	未
将乐的父老乡亲们，这几场文艺演出，你们都去看了吗壮阔东方潮 奋进新时代	未
将乐越来越美了！又迎来一个绿水工程  我的将乐 我的河	未
将乐这些企业用高薪召唤有梦想的你，快来吧！将乐招聘	未
将于12月27日发售的Air Jordan 1 体育画报配色！	未
将于19年1月22日发售的哈根达斯期间限定樱桃蛋奶派售价294日元 微博视频	未
将于明天发售的老兵节配色韦德战靴WOW 7 Veteran。	未
将于明年回归的Air Jordan 11 Low 「Navy Snakeskin」终于曝光了实物图片。详情请见:网页链接	未
将于本月22日正式发售的Air Jordan 8 Air Raid	未
将从12月3日起运营一个月的首尔地铁2号线防弹少年团车间是站姐们联合进行的event，实在太漂亮啦！	未
将佛法的心要精义透彻理解，长期实修	未
将信件安全送达是我们的第一使命：英国皇家邮政与小男孩暖心互动据法媒12月1日报道，英国苏格兰皇家邮政公司收到一封特殊信件，一名7岁的小男孩希望通过他们，将自己的一封信送给已经去世的父亲，以祝他生日快乐。这名小男孩名叫Jase，在信上，他歪歪扭扭地写到，邮递员先生，您能将这封信带给我远在天堂的父亲吗，他的生日要到了，谢谢。之后苏格兰皇家邮政向Jase回信表示，我们想告诉你，我们已经成功把信寄给了你远在天堂的父亲，躲避星星和其它太空物体给我们造成了不小的难题，但这封无比重要的信件还是送了出去。	未
将公益做轻，美赞臣和世界上最轻量级的战士一起战斗	未
将公祭日主题融入当天教学 药大老师课堂3分钟讲历史	未
将  军	未
将军	未
将军  公开唱多房地产，安信策略会高首席讲话要点！	未
将创新DNA注入青少活动 中国三星致敬改革开放40年(图)	未
将十九大精神融入青藏线建设	未
《将夜》插曲的打造，具体包括冯提莫演唱的《心形宇宙》李玉刚老师演唱的《夜将至》胡夏演唱的《悠悠岁月》庄心妍演唱的《真心》房东的猫演唱的《蝴蝶之夏》这五首歌曲，代岳东不仅参与到词曲创作中并且主导制作，最终实现在保证跟《将夜》剧作主题配合的基底上将歌曲塑造出高度风格化的形态。 五首插曲除却具备常规意义上的赏听特质，最终产生出更重要的意义：通过音乐成为更好的人，其中包括自我认知关系修复世界善美。这对于剧作插曲来讲，已经算是超额完成任务。从这角度来讲，代岳东所关注的其实是基于音乐层面的有价值的创作，	未
将夜最近尤其好看！人在家中坐，狗粮天上来，将夜宁缺隆庆结婚现场直播有宿缘的人，一生是宿敌，缘分天注定	未
将太空垃圾一网打尽！南京学生夺冠“未来太空学者大会”	未
将婚姻进行到底！新余大型铜婚夫妇重温婚礼纪念活动拉开帷幕	未
将小角落利用起来，就是一间毫不逊色的书房！	未
将心比心的善良，是最高级的修养（下）连线中，快来围观 天天正能量超话]@琪琪Alina 的一直播（下载App-gt网页链接）	未
将思政融入专业课堂 药大开展课程思政三分钟活动	未
将抗艾进行到底，阿克苏有一群用责任温暖生命的人	未
将推广到全县！公安50余家乡村诊所配药间等地方均安装高清智能摄像头	未
将改革开放进行到底——习近平总书记在庆祝改革开放40周年大会上的重要讲话在各地引起强烈反响	未
【将改革开放进行到底】坚持扩大开放 建设高水平市场经济和开放体制	未
　　——“将改革开放进行到底”百姓宣讲活动在全国各地掀起热潮	未
将改革开放进行到底系列访谈丨陈慥：让过桥米线回归本源	未
将改革开放进行到底——论学习贯彻习近平总书记在庆祝改革开放40周年大会重要讲话精神	未
将改革开放进行到底赵村：告别蛤蟆窝 圆梦新生活	未
【将改革开放进行到底】马化腾谈了这些感想！腾讯要在这三方面继续发力	未
将改革进行到底全国巡回宣讲团走进杨泗港大桥项目部	未
【将改革进行到底】刘永好：新希望要将创新创业进行到底	未
“将改革进行到底”彰显新时代共产党人执政的坚定自信	未
【将改革进行到底】深交所：传承改革先锋精神 加大改革创新力度	未
将无数女性被吓到不敢如厕的鬼后，转身就嫁超级富豪，漂亮的皮囊值万金	未
将有大发展！住在石河子这个团场的人有福了！	未
将沿边地区打造成开发开放的高地——广西做足“边”文章	未
将泉河变综自改造进行到底11月28日，国网徐州供电公司变电检修室工作人员依旧奋战在泉河变综自改造现场。经过前期忙碌的设备更换电缆敷设，工程进行到端子接线保护调试新的阶段。检修人员必将凭借自己过硬的专业技能助力泉河变顺利变身！	未
将爆改进行到底八卦轮的美化及改良	未
将爱传播到底---第四所临水酒业关爱儿童之家在临水镇中心学校正式揭牌	未
将特朗普女儿拒之门外的名媛舞会，今年邀请了三位华人女孩	未
将督查激励措施由24项增至30项	未
将知道！原来新沂地标性建筑戴斯酒店这么唠害！	未
将者新知丨新版50元纪念币下周开抢！	未
将者真知丨寄托了3000年信念的城市邯郸	未
将自己写入历史，C罗生涯最重要比赛	未
将薪酬与碳排放挂钩 壳牌为高管关心环境提供新动力荷兰皇家壳牌公司为其高管关心环境提供了一个的强有力的新动力。这家英荷能源公司周一表示，在投资者的压力下，它将从2020年开始制定短期碳排放目标。该公司计划将高管薪酬与实现目标挂钩。将薪酬与碳排放挂钩 壳牌为高管关心环境提供新动力	未
尉氏农村280元一桌的结婚酒席，看看这些菜带劲不！	未
尉氏新增20座移动公厕，有效破解城区如厕难！	未
尊享没有理由，随时随地的舒适才是王道！即日起至2019年1月15日，深航部分国内航线登机口升舱，只要299元，想想就很激动通过深圳航空 APP，深航官微赶紧行动起来，便捷随心，想升就升 再也不用担心升舱复杂啦！	未
尊敬的@TFBOYS-易烊千玺 您好，在圣诞前夕，我们特别推出[认识333我很高兴]活动，您已被选为幸运鹅，领取请回复:1.我要请333吃饭2.我要给333一个红包3.我要给333一个圣诞礼物4.我要发一条9宫格自拍微博机不可失，时不再来，心动不如行动。退订请回复:sksofgevajxydfakzpxnfbeqwertyuiopgajskakwbdvxgahwotbrcagsjxbdhshdgsjdkdbshfgshdkxbansoxuctebtngkajchevasdfghjklqkfurbhajg	未
尊敬的万和用户您好，小万已为您反馈啦，您先别着急，工作人员正在为您核实处理，记得保持手机畅通哦！ 万和的质量差，服务差，谁有同样的体验?	未
尊敬的万和用户，服务无止境，感谢您的建议。请您私信留下联系方式（姓名电话地址），小万将安排工程师小哥为那您提供专享服务，或拨打万和服务电话400-830-8383进行咨询。祝您生活愉快！ 关于收费?	未
尊敬的用户，系统判定该订单异常，平台为保障消费者利益已优先为您办理了退款，后续有任何问题都可以联系多多客服哦	未
尊敬的粉丝，您好：目前您的2018使用进度如下93系统已经为您把这一年里的霉运全部删除，陪伴您迈入2019的都是好运和幸福，请查收！	未
尊敬的陈浩老师，感谢您的关心，在我最痛苦的时候给予的支持和帮助。报告陈浩老师，最近几天终于可以睡好了。可最近听说您要当多军总司令，我又要睡不好了，这叫原总司令情可以堪总得有个先来后到不是要不和您商量商量，先当个副总司令如何	未
尊贵的希思黎会员，感谢您一直以来对我们希思黎官方旗舰店的支持与厚爱，希思黎会员奢宠来袭，使用时间截止到12月31日每个ID限领一张，逾期不补！单笔订单满1000-300优惠券：网页链接单笔订单满2000-600优惠券网页链接单笔订单满3000-900优惠券网页链接	未
尊重他们的劳动成果，只需要顺手而行	未
尊重代表主体地位 充分发挥代表作用	未
尊重代表主体地位 充分发挥代表作用——改革开放40年来人大代表工作综述	未
尊重别人的心意，才是最重要的心意。	未
尊重孩子内心，让其发现自我、创造自我 “春天的问候”关切青少年的健康成长	未
尊重生命，从我做起！爱心教育基地	未
尊重科学规律 推进乡村振兴	未
尊重自己为人的行动力，就要对每一个生命存有最基本的敬畏心。	未
尋找真愛粉 1212双十二新品秀....好礼送送@pamela-peng 的一直播（下载App-gt网页链接）	未
對哦，之前不是有個jns肺活量排行榜嘛横山5000ml大倉4520ml丸山4230ml村上4140ml安田3810ml錦戶3250ml真的是在fc遊戲裡體現得淋漓盡致	未
小8资讯大型正规名企招聘正式在编工人50 人！！！	未
小8资讯安徽工程大学第五食堂招两名洗碗女工，工资2500元	未
小8资讯带个心上人回家过年！80 90交友看这里...	未
小8资讯找工作 征婚交友 寻物 芜湖新鲜资讯看这里...	未
小8资讯芜湖最权威的本土资讯！都在这里戳	未
小8资讯芜湖本土的信息发布，赶紧戳进来	未
小CK今晚开，赞一下，安排上	未
小CK包今天就开，赞一下，安排上	未
小e游记：带你探寻用电的故事	未
小h 我今天要发一张全家福	未
小h 来！你们认认！	未
小P孩体型新世界的大门打开了！	未
小U日历  巧用食盐除异味！	未
小Z今天化身数学老师，帮持家的你算算Prime会员能为您省下多少钱！真划算，真特权！快快加入我们Prime会员的大家庭吧！	未
小Z爱海淘 喜欢海淘希望买到一手的尖货，但同样也不能错过享受海淘的各项优惠  那么， 亚马逊海外购开通Prime会员到底划不划算 你算过这笔账吗 亚马逊Prime会员到底有多划算	未
小丁经纪人：丁彦雨航除了梦想就是情义，也重利益	未
//@小个邓亚萍: 这是我记忆当中最难忘的一场比赛，你们还记得吗也希望这样的经历能带给你们不一样的感触和力量[加油]相信体育的力量	未
小中微推敲可爱！梯形小动物简笔画6岁女孩5次办画展引发热议，看完你是否都想开始画画了呢又可爱又简单的梯形简笔画，哄小朋友写手帐都可以！速速转起（合家欢阿欢阿欢 ）	未
小中微推这组图温暖了寒冬！你愿为全身结冰的消防员转发吗8日，辽宁大连一幢老式建筑突然起火，短时间内火势蔓延很快。大连市消防支队中山区大队消防指战员英勇奋战，成功将火灾扑灭。由于当天平均气温较低，消防队员全身结冰。网友：北方的冬天真是冷冷冷，辛苦了！转发致敬！	未
@小丸子咩咩羊：来公安医院做糖耐量鉴定的小伙伴，从昨天开始每日限号20个。请大家掌握好时间。	未
小丽子除了宠溺之外，关于更重要的在下面！网页链接	未
小乔与宝莱坞女星结婚 印度办婚礼融合两地风俗	未
小乡村，大变样，好生活(图)	未
小事一桩，本来就是应该做的，说是温暖全城有点夸大其辞了。//@微博热点:转发微博	未
小事儿值得坚持吗陈铭颜如晶提前开战坚持考研这等大事没争议，但坚持结果看起来毫无伟大之处的小事儿呢近日，奇葩说陈铭颜如晶，就小事儿值得坚持PK观点，真实上演陈铭说啥我都信	未
小事情 大民生——西藏大力推进景区景点“厕所革命”工作综述	未
小事用心办，大治理就有了！	未
“小事”用心办，大治理就有了　武汉青山区“四全”社区治理观察	未
小事  都是小事，但我坚持下来了	未
小云彩游记澳门很大	未
小产品玩出全球大市场，永嘉这个总投资超12亿元项目开工奠基啦	未
小亮扶贫鸡，脱贫很给力！	未
“小人参”助草原鸡远走高飞	未
小仓鼠这个圆滚滚又丰满的小屁屁太治愈啦 睡觉的时候还要先放气	未
[小仙女]优设专访！火遍追波的设计工作室 Zajno Crew 是如何设计动效的围观戳优设专访！火遍追波的设计工作室Zajno Crew是如何设计动效的设计工作室 Zajno Crew，他们的设计作品在专业平台 DribbbleBehanceCSS Design Awards 上备受好评。	未
[小仙女][小仙女]//@一万个面包://@进击的阿木君:好看//@今天也要加油鸭鸭鸭:轰总太帅了啊啊啊！！！！	未
[小仙女][小仙女]加湿器！哪个小可爱的加湿器快点抱走奥罗德 usb静音加湿器 29奥罗德期间店哒换季皮肤干到不行，还是得备一个这个小巧迷你，放车上放家里都方便30ml的半夜不用起床加水，静音出雾，睡觉也能用，晚上还能当个小夜灯	未
小仙女当然要放花香味的屁啦	未
小仙女必备的丸子头	未
小仙女必看	未
[小仙女]直接赞原视频，抽一人送TF 黑管一支。 [小仙女]转发原视频，再抽一人送Mac dubonnet一支，12月25日开！	未
小伊伊一脚将散打哥踢出直播间！驴家班阿宇开启户外直播挑战户外主播地位	未
小众温泉599限时抢！泡华东第一泉夜宿唐风园林中，高铁可达！	未
小众温泉人均200宿露台房， 含早晚餐， 下午茶， 泡火山温泉， 元旦可订	未
@小伙伴们，一大波好岗位等你来选！赶紧转给身边需要的人！	未
小伙伴们，今晚故宫以东有大事件发生！ 神秘嘉宾带你走进@王府井 解码一段传奇历史。那些古老而又时尚的新奇而又熟悉的未知而又亲切的正向我们走来！记得跟紧东子，不要错过好看好玩好吃又有十足养分的皇城文化大餐！	未
小伙伴们，你们要的公众号来啦，之前私信我的小伙伴们多多关注起来，每天都有更新哦	未
小伙伴们，你那里下雪了吗这个冬天，你想和谁一起看雪呢一起来听这首《雪落下的声音》网页链接	未
小伙伴们，后天三亚见 珠海	未
小伙伴们在x宝逛的话可以戳进我们店关注一下里面微淘目前在搞盖楼活动哦随便回几条就ok了一切都靠缘分	未
小伙伴们在城市V聚力 微博城市影响力论坛偶遇@晋城通 了吗V影响力峰会	未
小伙伴们大家都要保护好自己呀	未
小伙伴们，来一起关注中政委两微一端	未
小伙伴们，求助辛苦了一年更博，好想拿个奖状回家，恳请大家动动发财的小手帮我投下票吧。找到@室内设计师-颜亮 名字下面三个选项，可以同时点击投3票，每天都可重复投。拜托了，爱你们和我去见大V吧	未
小伙伴们，泥萌喜欢哪一部呀	未
小伙伴们注意啦，这个电话请您一定要代表苍南接听！	未
小伙伴们注意！忻州12月1日0时-4日0时限行	未
小伙伴们约起来	未
小伙伴们约起来吧	未
小伙伴们约起来呀	未
小伙伴们觉得美食最多的城市在哪里 北京  前门	未
小伙伴们赶紧收！	未
小伙伴发来求救信号：雾霾侵袭，求推荐空气净化器其实，逃离雾霾，so easy！	未
小伙伴来电：吃吃 从口碑app 外卖端口进 每天可以领三次饿了吗红包 还挺大的	未
小伙伴来电：自行了解！	未
小伙儿长得还挺帅国际足球	未
小伙出狱，所有狱警都敬礼欢送，太牛了	未
小伙参加赣南脐橙博览会，现场的脐橙免费吃，小伙吃了一个又一个	未
小伙发明不怕水绝缘连电插排，解决安全难题，获几十个专利！	未
小伙只改了个名字，官方却送了他永久嬴政，天美果真良心！	未
小伙在台州错拿漂亮女孩行李箱，打开一看眼睛亮了	未
小伙在开州拍的视频，简直太赞了！	未
小伙在脑中装电极抑制疾病 植入脑起搏器治癫痫获成功	未
小伙夜里摆摊，孕妻陪伴在旁称在一起就不冷	未
小伙子们加油干，年终奖有多少就看这一场了	未
小伙子喜欢看心理学的书	未
小伙子城府够深的啊搞笑幽默趣闻 红人的诞生 V影响力峰会	未
小伙子应该锻炼一下身体了	未
小伙子很实在，现在很难再吃到这么纯的土蜂蜜了，希望继续保持下去，点赞	未
小伙子很实在，现在很难再看到这么纯的土蜂蜜了，希望继续保持下去，点赞	未
小伙寒风中晕倒街头 协警这个举动17万人点赞	未
小伙带女朋友回老家，父亲装穷试探女孩，结局太感人了！	未
小伙开车回家，结局亮了！	未
小伙当“网红厨子” 吸粉千万月入五六万	未
小伙当网红厨子 吸粉千万月入五六万精瘦的身板腼腆的笑容带有四川味的普通话一个个细节勾勒出了新晋网络红人王刚在粉丝们眼里的印象。12月11日上午，为了配合今日头条宣传海报的拍摄，王刚一大早便来到工作室，按照摄影师的要求进行准备工作。回忆起当初抱着玩一玩的心态进入美食视频领域，如今却已经成了他，乃至全家人的一份事业。 （新华网） 小伙当网红厨子 吸粉千万月入五六万	未
小伙成功靠老板，从此大路向前不回头！	未
小伙来相亲，大家乐嗨！	未
小伙给母亲买了一件全店最便宜的，得知真相感动了！	未
小伙请客吃饭，边看边乐！	未
小伙过年赶集市，走都走不动，太热闹了，最后花12买个菜筐	未
​小伙高速上设定时速118公里后，睡着了……	未
小伙高速上设定时速118公里巡航 然后睡着了	未
。//@小何同学的用户名:身边的人在让我变成小孩 感谢他们//@失落宇航员://@你是山鬼吗:谢谢你让我变成小孩。	未
小俊的飞行日记 晚安宝贝	未
小偷偷走流浪猫卖给烧烤店和饭店以后还能愉快地吃烧烤吗	未
小偷歪打正着，真好笑！	未
小偷的年终总结，谁读谁受益	未
小僵美图 僵小鱼 真想开通甜甜圈代吃业务，不收费，只负责吃就好	未
小儿推拿治厌食简单有效！儿推专家邰先桃已开通预约挂号服务	未
小兔崽子也需要有伙伴 .	未
小公园社区深入落实文明城市创建迎检	未
//@小冬东201807：每天要转发你们的推送好多次，好多干货，都看不过来啦	未
小凤PK|董明珠和雷军的十亿赌约迎来大结局，谁才是最后赢家？	未
小刀口猜想之仙女嫦娥未来走位出装打法官方在报道了嫦娥的技能后，大家也在热烈探讨嫦娥这个英雄的特点。通过对于技能的解读，个人觉得嫦娥可能会走上杨玉环名不副实的道路，嫦娥名义上为法坦（边路），实则走中单。对于嫦娥的解读将会分为两点进行：被动防御被动输出主动技能1.被动防御：嫦娥不能轻易贴脸对手描述：自身法力值产生的护盾抵挡伤害，每1点蓝量抵挡2.5点伤害嫦娥的被动实现了王者荣耀游戏里一个新的玩法蓝量换血量。这么听上去只要有蓝，在对面破盾能力不强伤害不高的时候嫦娥可以无视对面的输出而近距离	未
小分队出动吗！！！！	未
小刚几真的太可爱了。感觉她在我头上拉屎我都可以接受。	未
小剑客冬日狭路相逢 奥运冠军仲满送祝福	未
小加复读机再次上线：RNG.M发布冬季冠军杯出征名单	未
小加来教你怎么玩胖子了梦奇在今年春季赛前半段成为了T1级别的边路，AD梦奇能够自行带穿一路，成为线霸级别的存在。但是后期一刀砍下来，梦奇在KPL赛场上彻底消失。在今年秋季赛，常规赛QGhappy与RNG.M拿出梦奇，一胜一负。随后因为全局BP的出现，梦奇再一次回归赛场。梦奇在赛场上边线掌控力足够，重要的是梦奇可以跨过盾山的大招直接打到后排，对于盾山阵容也是一种克制。 铭文：当前梦奇主要携带法强铭文：10梦魇10心眼10狩猎梦奇的坦度跟法术强度相关，同时法强也提升了梦奇的伤害。 出装：梦	未
小加考古：历年KPL奖金池回顾随着KPL不断发展成熟，奖金也在不断增加：首届KPL总奖金池仅为185万，但也创造了当时移动电竞记录，冠军获得80万奖金。17年春季赛增长到220万，冠军收获100万。17年秋季赛总奖金280万，冠军奖金120万。18年春季赛时，奖金爆发式增长到1200万，冠军收获500万到了本届KPL奖金池不变依旧为1200万。谁将收获500万冠军奖金周六总决赛见啊！！KPL王者荣耀	未
小勺是我们工作室最擅长烘焙的小伙伴，今后会给大家带来很多美腻又好吃的点心刚出道做了一款基础双层蛋糕，其实是为了我的圣诞蛋糕做准备的，我的蛋糕也出现在视频里了，你们能截到图吗	未
小北亲测有效淘宝购物省钱秘笈被曝光！不仅有优惠券还有返利，而且还送红包	未
小区保安遇车祸 社区居民一天募集近7万爱心款助其渡难关	未
小区成为创建重灾区丨古堰如画吸引众多游客丨东三街两电动车发生碰撞！	未
