“小默克尔”当选德国基民盟新主席	未
尼玛木当选四川阿坝州政协主席	未
//@尼禄1228:维也纳德云社圣诞封箱演出。//@军事历史之古今评谈: //@全球转播:转发微博	未
尼米兹号、里根号和罗斯福号三艘航母齐聚西太平洋 准备军演	未
尽享安慕希，美味不可挡安慕希美食学院浓浓安慕希搭配锋味美食为生活添活粒快来与小安一起揭秘安慕希的更多美味搭配吃法！！	未
尽在不言中。	未
尽孝驿站  春节不打烊，尽孝驿站陪你过大年！	未
尽心尽力做事，坚持自己 PP视频《影人》节目独家专访任素汐	未
尽忠报国抗日捐躯的英雄——郑作民	未
尽快使用哦	未
尽快去办理激活社保卡的紧急通知！！快告诉家里老人！	未
尽快推出资本市场“手术刀式”精准改革举措	未
尽情买！海南离岛旅客免税购物限额增至3万元，不限次！	未
尽本分得到的福报	未
尽点绵薄之力，好人有好报，一切都会好起来的	未
尽管你很累，但你还是要在梦想的道路上，不断前行！运动V势力	未
尽管吃到败战，但皇马仍以小组第一晋级了欧冠淘汰赛阶段的赛事，具体对阵情况需要等待周五的抽签不过在此之前，北京时间今晚，西班牙足协将会就国王杯1/8决赛的对决进行率先抽签，没有回避原则。	未
尽管我数学不好，但我仍会在作业上首先写上我霸气潇洒的 解。 情感	未
尽管被开除，但SNH48是第一个走原创之路，也是目前这个模式里发展的最好的一个团，已经说明了一切。	未
尾单来了！六星级邮轮世界梦号带你海上跨年，拥抱碧海蓝天过暖冬！	未
尾号带9，拿来换酒！汾酒集团好酒进万家惠民活动邯郸盛大开启！	未
尾田捐5千万救灾熊本 在家乡打造＂路飞铜像＂谢恩	未
尾盘1小时主力抢筹，多头剑指2700！	未
尾盘，上证指数 主要贡献度：依次为中国石化 恒瑞医药 农业银行 中国银行 中国石油 工商银行	未
尾盘资金跑步入场了。。。。。赞一个，看看还有多少人活着！	未
尾秋去过一次青州宋城的人，都会对这里浓浓的历史念念不忘。	未
局势升级！乌国安和国防委员会决定实施60天战时状态	未
局地共建   共创食安 市食药监局泗阳县政府召开食药安全局地共建座谈会	未
局地煤炭吃紧价格上涨 煤电博弈进入年底定调关键期	未
局室快报冬日送暖红盾敬老，南湖工商开展敬老助老活动	未
局座一首逮虾户，教你战舰漂移的技术	未
局座化身“小爷爷”忆往昔 勇气与温情暖炸《火力无限》	未
局部的科普都很有趣//@M大王叫我来巡山:非常值得扩散的科普//@水晶男孩鸡大帅:转一下集合//@一只屁眼://@视奸菌://@烂仔宝贝://@陈狗晨://@西里划啦 ://@采蘩祁祁Nick :转发	未
局长亲授党课同心协力打造讲廉洁有担当的蕉城公安队伍	未
局长已连续4年被评为福布斯最具影响力女性 -	未
屁屁型抱枕！具有揉捏拍埋抱躺等多种功能，这是什么魔鬼设计	未
屁股，哪一代好看V影响力峰会汽车V峰会	未
屁股太大会不会卡住 搞笑	未
屁股太美了！//@空气娘Kuuki:射了//@KONELA:喜欢//@寒鸦_Gray:这个力量感太美了	未
层次高的人，都不会活在自己的感动里	未
居住证120积分是孩子在上海上学的先决条件！	未
//@居北爱心站:镇魂的存在，真的已经远远超越了一部剧本身的意义。实际上，对他们来说是三个月短暂的相处，对我们来说，也不过是一个多月的网剧。但真的仅仅是短暂的同事，和心血来潮的追剧么不是的呀。那份沉甸甸的真心，要带着爱，和感恩，才能体会的到。	未
居委会主任当上了省委委员：工作上方便了很多	未
居家养老服务送上门！四级养老服务体系让300多万老人老有所养	未
居家和社区养老服务首次纳入照顾服务项目9项重点任务全部着眼老年人生活诉求和实际需求	未
居家必备 之 行走的美容院，一起看看ta的神奇之处吧	未
居家旅行必备	未
居民们乐了！门头沟这个小区安上了健身器材！	未
居民做饭致煤气罐失火 这位勇敢的辅警冲了进去	未
居民动手美化社区 小区窨井盖也可以萌萌哒！在上海宝昌路600弄小区内，居民在窨井盖上画出了各种卡通图案，包括小猪佩奇皮卡丘愤怒的小鸟等据悉，这属于社区美化项目的其中一项，是在专业团队的支持下，由社区大小业主们共同参与的社区希望通过美化活动，挖掘更多有想法有创意的年轻志愿 ...全文	未
居民动手美化社区 小区窨井盖也可以萌萌哒！在上海宝昌路600弄小区内，居民在窨井盖上画出了各种卡通图案，包括小猪佩奇皮卡丘愤怒的小鸟等。据悉，这属于社区美化项目的其中一项，是在专业团队的支持下，由社区大小业主们共同参与的。社区希望通过美化活动，挖掘更多有想法有创意的年轻志愿者，向社区持续输送活力。（王子涛）	未
居民录入信息到这个平台后，以后到社区办事就方便了	未
居民楼“上宅下店”油烟扰民  南京这个区有望破题|荔枝特报	未
“居民漫谈会”让社区决策更惠民	未
居民身份证照今后将实现多拍优选 可申请重拍3次	未
居民身份证照今后将实现多拍优选，可申请重拍3次	未
居民身份证相片将实现“多拍优选”	未
居民身份证相片将实现多拍优选 可申请重拍3次	未
居然之家滕州北辛店金道商贸城滕州68个项目立项！	未
居然有一个红包还挺大的哈哈哈哈哈，那就在zhuan发（原博）里抽一位小伙伴获得这份好运气吧 查看图片	未
居然有人在寄语里推销鬼魂术和百花露收到这句祝福后我决定风里雨里国境等你！	未
居然有防地震床太棒了，再也不用怕地震了	未
居然有高清！//@Lamb羊羊_TURBO:	未
居然看到了小袖之手，以前地域鬼王双妖琴吸血姬和小小黑拼脸用她还蛮多的，放到痴里感觉也不错。针女式神可用小天狗，奶狗刷痴可是一把好手	未
居然觉得还挺好用//@M大王叫我来巡山:看多了真的看出了可爱的感觉//@颜文字君:马克(  」)//@善财神:萌汉酱	未
居然还有！！！！！！！！不过我昨晚就抢了，反正每月都需要，赶紧囤起来啊！！！自由点12包只要39.9	未
居行好消息！带着身份证就能免费做体质监测！	未
居行整个12月，浦东各社区卫生服务中心都提供艾滋病免费咨询检测服务	未
居行本周六起，新辟一条公交线！连接6号线/12号线	未
居行这里将新增社区综合管理中心，提供一站式服务	未
屈臣氏上线京东到家 两强联手发力美妆即时消费	未
屋内暖气暖，你上火了吗	未
屋外小雨绵绵屋内温暖如春	未
屋漏偏逢连夜雨，船迟又遇打头风。守护好你的押金。	未
“屏幕改变命运”，亟待改变的还有教育政策	未
屏都街道：南北余村结对共建再出发	未
【展品背后的故事】“一切工作都是开创性的”	未
【展品背后的故事】"你是腐败分子的克星,全国人民的福星"	未
【展品背后的故事】“保证改革顺利进行必须有好的党风”	未
【展品背后的故事】“监察监督向基层延伸，群众高兴得很”	未
展品背后的故事  监察监督向基层延伸，群众高兴得很	未
【展品背后的故事】“释放持续加强纪律建设强烈信号”	未
展商推介  天顺源，打造清真肉业领军品牌	未
展展与罗罗再唱《沙漠骆驼》	未
“展展与罗罗”首次曝光《沙漠骆驼》珍藏手稿	未
展播不忘初心牢记使命主题微视频：11年从引婚到守婚	未
展播不忘初心牢记使命主题微视频：80后义工社党支部	未
展望2019之中国股市：政策托底是关键 年中或迎拐点分析师普遍认为，在2019年中国经济基本面增长继续下行政策逐步托底的格局之下，股市预计呈N型震荡上升，下半年机会更大，且多为结构性行情。关键在于政策力度，若政策能出现有力拐点，明年中国股市有望走出底部。展望2019之中国股市：政策托底是关键 年中或迎拐点	未
展望2019——有哪些新趋势和好玩目的地即将上线？	未
展望2019经济大势 复旦EMBA举办2018中国企业家高峰论坛	未
展望丨七大交易所寄语改革开放40周年	未
展望“智慧社会”：增强勇闯“无人区”的原创力	未
展现大爱之心和大美之艺	未
展现文化水平的时候到了！来看交警警服变迁史  交通文化	未
展现社区事务受理服务风貌 沉浸式表演《温暖如灯》今上演	未
展示一下山东花花馒头	未
展示大师手工艺之美，上海虹口多伦路增设“百匠工坊”	未
展示导游好形象，传播行业正能量	未
展示最真的哭与笑 这档节目要求演员表达真实	未
展示最高水平 重庆举行第二届住院医师规培临床技能竞赛	未
展览预告  以道自娱  林肇祺先生诞辰150周年纪念展（厦门站）	未
展馆随手走一波 东莞广东现代国际展览中心	未
属兔人，过了这个坎儿，将可一帆风顺！	未
属兔的人会在12月份一帆风顺，喜上加喜！超级准	未
屠龙宝刀，点击就送！只需5本，非洲建国不是梦！	未
屡屡爱心如丝丝阳光，在寒冬温暖孩子们的心@爱心包裹项目	未
屡次登上央视的大美柳州，在每天这个时候，美到你惊叹	未
履程发售提醒 AIR JORDAN 8 RETROAIR RAID，12月22日发售，一家三口又有同框的机会啦，激动么images via Sneaker Politics	未
履程发售提醒 Supreme 本周发售一览，卫衣毛衣羽绒服以及头套帽子来袭，你准备好过冬了吗by supreme_leaks_news	未
履程发售提醒Supreme 本周发售一览，看起来都是很暖和的装备，最快发售应该是帽子了。by supreme_leaks_news	未
履程映画  红花配绿叶 ，有了绿叶的衬托，玫瑰才能开的更娇艳！高清无码网盘：网页链接下载密码：cf3j  红花配绿叶	未
履程现场 小编来到 PEAK 我，就是颠覆发布会现场神神秘秘的毒液科技终于正式跟大家见面，它的真名叫做P4U搭载这些技术的态极跑鞋与它一同亮相。不知道这项技术能否助力匹克在跑鞋市场上打出新天地什么时候会用到篮球鞋上呢	未
履程美筑 源庐（音译）社区中心，连社区活动中心都这么豪华了，这社区得啥样啊位置：重庆设计：Challenge Design：prism images / arch-exist	未
履程趣事 React  270 ，会是明年Air Max Day的主推款么image via bubblekoppe	未
履程趣事 你可知道它的学名：Slate Moore Photography	未
履程轰鸣 E Rossa 概念摩托车这样的摩托车你会喜欢吗by rmngvn_dsng	未
履程轰鸣 我要买GTR，买辆奔驰给你啊 ！我要买GTR！奔驰加劳力士我要买GTR！我要是开GTR.我会_________by gtr272	未
履程鞋事adidas YEEZY BASKETBALL 篮球鞋款将于2019年春季发售！你会用它来打球吗by YEEZY MAFIA	未
履程鞋事 StockX 在底特律推出了无人机交付服务，已有四名顾客用这种方式成功收到了他们的鞋子。同时他们位于纽约的快闪店为卖家提供现场认证和即时支付的业务，卖家可以将产品放到店里，认证完成后就可以得到付款。这样的送货加交易方式，可能会为球鞋市场带来翻天覆地的变化。各位鞋友你们接受这种交易形式吗image via StockX	未
履程鞋事 最近的橄榄球队PE越来越多，甚至有些配色非常好看，比如这双 Air Jordan 6 Oregon Ducks PE，你们觉得怎么样images via SneakerBarDetoit	未
履职近2年 军纪委专职副书记罕见出镜透露这些细节	未
履职近两年 军纪委专职副书记罕见出镜为了啥？	未
屯昌农博会农产品产销对接及采购项目签约仪式召开 签约达12.1842亿元	未
屯着点红装准备过年啦	未
山p！！！	未
山上有个5A景区，山下打造5A城市！这里是西樵	未
山下学堂首期新人班发布 首登杂志封面回顾学习经历	未
山丘 本色抽纸120抽16包29.9到手纸是必须品的，消耗比较大，需要的不要错过机会	未
山东10日起局部将迎来暴雪	未
山东10日起局部将迎来暴雪 最低温度将达-12℃	未
山东136亿打造内河水运大动脉，小清河复航工程招标进行中	未
山东137区县一般公共预算收入排名出炉！莱西竟排在	未
山东17市前三季度县域GDP公布，青岛超第二名济南近一半	未
山东：两年统筹400余亿元支持生态建设	未
山东为百余万教职工送编制、职称、绩效工资等改革“礼包”	未
山东企事业单位招聘2300余人！	未
山东儒商大会推介项目600个 集中签约额已超5000亿元	未
山东公布500个森林村居名单，嘉祥三个村庄入选	未
山东再添两家省属国企：文旅集团、颐养集团同时揭牌	未
山东“净网2018”专项行动破案逾三千起	未
山东：升级生态环境监管执法省生态环境厅日前出台《山东省进一步强化生态环境保护监管执法实施方案》，从压实企业责任强化日常监管运用科技手段完善权力和责任清单等方面，提升监管执法效能，推动企业守法成为常态。同时，山东省生态环境厅要求，加大对一刀切行为的督察问责力度，坚决避免以生态环境保护为借口紧急停工停业停产等简单粗暴行为。对符合生态环境保护要求的企业，不得采取集中停产整治措施。对环保一刀切行为，将纳入督察问责范畴，发现一起查处一起。山东升级生态环境监管执法	未
山东卫视让生态节目又有新样板《美丽中国》让绿色号召落地生根	未
山东即墨这个镇被《人民日报》点赞！发展见证改革开放40年巨变	未
山东又要新添10家4A景区，青岛两大景区登榜！	未
山东发出首张高速公路复合通行卡　	未
山东发出首张高速公路复合通行卡	未
山东：发布环境空气质量形势预报（12月6日12日）经会商，未来一周，我省扩散条件整体较好，沿海地区以优良为主，内陆地区以良至轻度污染为主，其中，9-10日，扩散条件稍差，鲁中的济南淄博，鲁西北的德州聊城，鲁南的济宁菏泽可能会出现中度污染，具体形势有待临近研判。 山东省环境空气质量形势预报（2018年12月6日12日）	未
山东品牌40周年峰会召开 聚焦品牌高端化发展	未
山东国际车展明天开幕，咱们不见不散！经过3月有余的紧张准备，第十届山东国际车展将于明天，也就是12月6日正式拉开大幕，截至本月9日结束，为期四天据悉，本次车展汇集了70余个品牌的300多款车型共同参展，涵盖了从3万元至百余万元的汽油车和新能源车，占用了会展中心3号4号及6号三个展馆作 ...全文	未
山东地方国企上市公司债转股第一单出炉 山东路桥核心子公司启动市场化债转股	未
山东：坚定文化自信 为新时代文化强省建设注入新动能	未
山东：城市低保平均标准达每人每月529元	未
山东大美雪景	未
山东好人之星臧义好夫妇--夫妻二人把生命余热奉献给文化公益事业	未
山东威海:上好"三堂课" 管住微权力	未
山东宁海街道：创新物业党建联建1N工作法	未
山东富豪排行榜发布！临沂最有钱的竟然是...	未
山东寿光蔬菜18年12月02日12月03日价格行情	未
山东将全面启动三级医院绩效考核！	未
山东将添10个国家4A级景区，青岛这两个地方上榜了	未
山东巨变40年中国有我我的家乡，我的济南，我的泉城，这个承载了我所有儿时回忆地方，是我最爱的城市	未
山东平安产险与山东农业大学机电学院签署校企合作协议	未
山东平安产险举行2018年度客服技能大比武	未
山东平度儿童文化体育中心开工 总投资30亿(图)	未
山东平邑九间棚村：荒山岭的致富经	未
山东成中国农产品进出口贸易“领跑者”	未
山东成立省级层面医养健康和文旅集团	未
山东打响饮用水水源水质保护攻坚战 2020年省控重点河流消除劣五类水体	未
山东抗癌药专项集中采购圆满完成 抗癌药降价我省抗癌药价格将迎来全面下调。记者从省政府新闻办召开的发布会上获悉，我省抗癌药物专项集中采购工作已经圆满完成，降价效果显著，386个中标产品较医疗机构原采购价格平均下降17.4，最大降幅达82.6，在全国各省专项集中采购中处于最低价格水平。网页链接	未
山东招聘辅警90人！专科可报	未
山东提升对民营企业知识产权质押融资支持力度	未
山东援疆"触屏可及" 远程医疗百姓受益	未
山东教育卫视《英雄少年》启动 浩星辉煌承制	未
山东新媒体大平台海报新闻客户端上线，将打通县域融媒建设	未
山东新添10家4A景区，其中1家在泰安，关键还免费！免费！免费！	未
山东新规保护台胞投资 国台办：优化台商投资环境	未
山东新闻山东提速！首次一年内同时开通两条铁路，两小时交通圈成型9日，济青高铁青盐铁路按图行车试验据悉，济青高铁青盐铁路预计12月26日通车运营，济青1小时40分钟就可通达其中，济青高铁全线设11站，青盐铁路山东境内共设7个车站济青高铁青盐铁路开通运营后，山东将新增高 ...全文	未
山东新闻山东提速！首次一年内同时开通两条铁路，两小时交通圈成型9日，济青高铁青盐铁路按图行车试验。据悉，济青高铁青盐铁路预计12月26日通车运营，济青1小时40分钟就可通达。其中，济青高铁全线设11站，青盐铁路山东境内共设7个车站。济青高铁青盐铁路开通运营后，山东将新增高铁运营里程约559.5公里，日照滨州等城市首开动车，山东铁路历史上首次一年内同时开通两条铁路。 山东提速！首次一年内同时开通两条铁路，两小时交通圈成型	未
山东日照获批国家海洋经济示范区	未
山东明年全面启动对三级公立医院的绩效考核	未
山东未来三年将再招收1.5万名公费师范生	未
山东江苏两省人民有福了！省界高速收费站年底前首批取消	未
山东济南：四社联动 打造共建共治共享社区治理格局	未
山东清洁能源地热供暖郓城模式示范应用座谈会召开	未
山东潍坊一火锅店请千名环卫工人免费吃火锅	未
山东烟台：2023年旅游接待人数要超过1.4亿人次	未
山东：环境健康风险管理研究试点项目启动会在五莲县召开环境健康风险管理工作具有较强的创新性挑战性和全局性，为了解制度建设过程中存在的难点，探索有效建设路径和系统解决方案，生态环境部决定将山东省日照市五莲县作为首批国家环境健康风险管理试点地区。11月28日，山东省环境健康风险管理试点研究项目启动会在日照市五莲县召开，安排部署试点项目工作任务，推进环境健康风险管理试点工作开展。生态环境部法规与标准司副司长王开宇山东省生态环境厅二级巡视员鞠振平出席启动会并讲话。网页链接	未
山东省五老志愿者家庭教育报告会在济南召开	未
山东省优化口岸营商环境 涉及港口多个环节	未
山东省医养健康产业协会正式成立	未
山东省“十三五”前两年GDP年均增7.5%	未
《山东省学校安全条例》1月1日施行 校园欺凌记入综合素质评价	未
山东省居家创业就业脱贫项目展举办	未
山东省岚山农商行流动汽车银行践行普惠金融	未
《山东省建设项目环境影响评价文件质量考核办法》解读2017年2月，《山东省建设项目环境影响评价文件质量考核办法（试行）》正式实施，填补了国内环评文件质量没有具体考核方法的空白。《办法》实施近两年来，对于提高我省环境影响评价文件质量，加强环境影响评价机构的监督管理，起到了重要作用。为更好地发挥环评的源头预防作用，结合新形势新要求新问题，山东省环境保护厅对《办法》进行了修改完善，加严了考核要求和处理力度。网页链接	未
山东省携256个项目赴香港推介 旨在重点领域深化鲁港合作	未
山东省新时代文明实践志愿服务队骨干人员培训班在济南举办	未
山东省滨州市财政局强化信息公开工作不断提高政府采购透明度	未
山东省菏泽市财政：建立“五个统一”机制创新公共资源配置方式	未
山东省高等学校长青联盟成立大会举行	未
山东科技职业学院2018年公开招聘工作人员119名，快来报名！	未
山东老乡，欢迎来黑龙江走亲戚！19日，2018黑龙江省冬季文化旅游推介会第二站，在山东省济南市领秀城贵和购物中心的世纪星滑冰场上盛大启幕。推介会上，山东省和黑龙江省文化和旅游厅签订了战略合作协议由10家山东主流媒体组成的回龙江走亲戚旅游踩线团进行了发团仪式山东旅游达人现场分享 ...全文	未
山东老张探险南京灵异场所雨花台	未
山东聊城：成功创建国家森林城市 城市绿 生态美 百姓富（人民日报）2016年聊城开始创建国家森林城市，今年10月15日被正式授予国家森林城市称号。林业是城市最重要的绿色基础设施，让市民抬头见绿出门有林荫附近有公园，随时随地亲近自然享受绿色，更好满足群众求富求美求健康的愿望，就是为群众办实事办好事。聊城市委书记徐景颜说。城市绿 生态美 百姓富	未
山东肥城农村妇女在人民会堂的演讲，全体泪奔，轰动国人！	未
山东胶州：白鹭亮翅 12月18日，白鹭在山东省胶州市大沽河入海口湿地休憩嬉戏。 新华社发（王昭脉 摄）	未
山东艺术学院建校60周年美术作品展 在北京中国美术馆举行(图)	未
山东菏泽取消楼市限售 房地产板块走强	未
山东菏泽调整住房限售政策 专家谈楼市调控如何正确引导预期	未
山东菏泽调整住房限售政策，专家谈楼市调控如何正确引导预期	未
山东蒜农喜获丰收 称“千年等一回”	未
山东：认真做好重污染天气应对工作为积极有效应对区域性重污染天气过程，按照区域应急联动统一部署，我省认真组织积极行动，截止11月25日18时，全省各级环保部门共出动执法监察人员20399人次，检查企业18219家次，检查施工工地7046个。济南淄博枣庄东营潍坊济宁泰安莱芜临沂德州聊城滨州菏泽13市共停产企业6229家，限产企业8877家，停工工地4333个。网页链接	未
山东：让沂蒙精神发扬光大	未
山东：让沂蒙精神在新时代发扬光大	未
山东贫困村客运站点建成率达99.3%	未
山东  跑半马迎新年，赏白沙河冬景！前20瓜分赛事奖金！	未
山东辅警招聘！不限户籍	未
山东迎大风雨雪气温大降 冷空气活跃雾霾将散	未
山东郯城县：特色资源变产业	未
山东采暖季用电按居民阶梯电价第一档电价标准执行近日，山东省发改委省住建厅联合下发了关于完善清洁取暖价格政策的通知，扩大了电代煤气代煤价格政策适用范围，将电代煤气代煤价格政策实施范围由7个传输通道城市，扩大至全省17城市。山东采暖季用电按居民阶梯电价第一档电价标准执行	未
山东：“阳光存折”惠及85万多贫困群众	未
山东首个大型实物化学元素周期表现身青岛农业大学（图）	未
山东高校“抱团”发展成立长青联盟 首抓教学资源共享	未
@山东高法 @山东交警  @山东卫视 @山东商报 @山东公安 @山东交通出行 @山东省人民检察院 @山东高速交警 11.22日，高速（烟台到莱州方向）发生一起严重交通事故，鲁 FA610警（通过监控得到），鸣笛追停擦身擦过的120急救车，车上4人均得到及时抢救，转危为安！求帮忙找到这名见义勇为的司机，万分感激！	未
山东高速：不低于3.21亿转让济南建设20股权转让后，公司仍持有济南建设公司40的股权，并间接持有西城置业40的股权，为济南建设公司并列第一大股东。此次股权挂牌转让符合国家混改政策导向，可引进民营资本等优秀战略合作者。山东高速：不低于3.21亿转让济南建设20股权	未
@山东鲁能 球员或许会在明年的香港贺岁杯中遇到托雷斯了。话说托雷斯的亲笔签名球衣有没有人想要的中超联赛 中超2018	未
山丹人速收藏！全国胸痛中心急救地图发布，甘肃9家医院图上有名	未
山丹星火商贸暖冬行动活动回顾	未
山丹高速公路全部恢复通行	未
山之魂 水之韵 龙泉岩樟又见桃花源	未
山乡婚礼话变迁	未
//@山人老凡: 日出天地正，煌煌辟晨曦国史古风	未
山光晴抹黛，湖气暖腾烟	未
山地自行车精彩画面第二弹.......	未
山城巷十八梯白象街，老街老生活复活了	未
