想要什么搜索什么：网页链接零食合集懒人火锅：网页链接螺蛳粉网页链接火鸡面：网页链接牛板筋:网页链接麻辣小鱼网页链接牛肉干网页链接鸭脖：网页链接辣条网页链接鸡爪网页链接	未
想要什么搜索什么：网页链接零食小合集水果网页链接饼干网页链接糕点网页链接坚果网页链接蜜饯网页链接养身茶网页链接卤味网页链接休闲零食网页链接薯片网页链接	未
想要什么搜索什么：网页链接饰品小合集耳饰网页链接项链网页链接墨镜网页链接眼镜网页链接手表网页链接手饰网页链接帽子网页链接发饰网页链接美瞳网页链接	未
想要什么来这里搜：网页链接日用合集1.卫生巾：网页链接2.洗衣液：网页链接3.洗发水：网页链接4.沐浴露：网页链接5.化妆棉：网页链接6.卫生纸网页链接1.牙刷网页链接2.牙膏网页链接3.毛巾网页链接	未
想要什么来这里搜：网页链接日用合集1.卫生巾：网页链接2.洗衣液：网页链接3.洗发水：网页链接4.沐浴露：网页链接5.化妆棉：网页链接6.卫生纸网页链接7牙刷网页链接8.牙膏网页链接9.毛巾网页链接	未
想要什么来这里搜：网页链接日用合集水乳：网页链接隔离：网页链接面膜：网页链接面霜：网页链接精华：网页链接去角质：网页链接洗发露：网页链接沐浴露：网页链接洗面奶：网页链接	未
想要什么来这里搜：网页链接日用合集笔：网页链接笔袋：网页链接书包：网页链接文件夹：网页链接笔记本：网页链接纸：网页链接收纳袋网页链接四件套网页链接枕头网页链接	未
想要什么来这里搜：网页链接日用合集笔：网页链接笔袋：网页链接书包：网页链接文件夹：网页链接笔记本：网页链接草稿纸：网页链接收纳袋网页链接四件套网页链接枕头网页链接	未
想要入相机的可以来做功课啦	未
想要全家够用的家轿 看看雪佛兰沃兰多	未
想要八种风格的家？交给全装大师吧	未
想要台历的老铁们，看这里！明天，我们就去免费发台历啦！	未
想要和心爱的人去一次西藏	未
想要完美的腹肌，你必须知道这些事	未
想要带你去浪漫的土耳其，去看图兹盐湖，天空之境，不用加滤镜的风景。土耳其客户：@吹啊吹啊我赤脚你怕了嘛	未
想要带你去浪漫的土耳其，真想来一场说走就走的旅行，不管去哪里	未
想要想要想要！	未
想要//@扒姐来了: ！！！感觉可以放心买！//@Forrest泽: 买起来	未
想要来找我合影签名的粉丝们注意了为了方便大家安排时间出行，我们把粉丝见面会由24号（周一）改到了明天23号（周日）时间还是下午17:00-18:00 地点：杭州顾家大厦2楼 汗颜运动空间 带你参观造价3000万的杭州最高大上健身房，免费入场！谢谢大家 @ProFitApparel @OLIMP欧力姆官微 @汗颜运动空间 杭州	未
想要涨工资从关注这些有营养的微信号开始吧！	未
想要独占年终派对C位	未
想要瘦身的小伙伴赶紧马住吧	未
想要的功能它都有，想不到的功能它也有，逆天了，我的讯飞翻译机2.0。今日 @讯飞翻译机 2.0再度升级：支持语言增加至51种新增普通话与粤语的互译翻译平均响应时间缩短外，更首发行业A.I.翻译。新年送新译想流浪就去远方，想体验就行动把双12记得要把握机会，最后帮你们到这里	未
想要的都能实现	未
想要这个圣诞礼物	未
想要这样的旅行！	未
想让自己的人生变得更有价值，就多看看这些微信号吧	未
想说走就走可找不到路又担心车难停交通太堵肿么办别担心，这款出游神器你值得拥有。移路上有你	未
想象一下：美空军F-35隐形战斗机装备激光	未
想起了那句我和海////涛到底谁好看	未
想起当年利物浦0-1输给切尔西，杰队滑倒，痛失冠军主动权，下一轮3-0领先水晶宫，结果被水晶宫3-3，最后被曼城追上饮恨冠军，苏牙痛苦流泪画面难忘。。。	未
想跟你一起去巴黎	未
想跟阿米尔汗一起过圣诞节简单！第一步戳链接 网页链接网页链接 进入抢票通道，第二步购票完成get电影票的小伙伴们，准备好去看米叔的新作1228印度暴徒 吧！目前已在各平台开启预售，24日还有机会提前观影。这场年末狂欢，千万不容错过！	未
想跳楼轻生的先过了消防员叔叔这一关！生命可不是玩笑哦	未
想躺在大理洱海边，感受下面朝大海春暖花开的心境。	未
想躺在大理洱海边，来体会下面朝大海春暖花开的心境。 .	未
想进去和它们一起游//@浪里赤条小粗林:天啊好美啊	未
想逃离十面霾伏快到山水秘境吸吸氧！只有1的人才知道的洗肺清心地，离上海还不到3h车程	未
想邮寄一份冬日的温暖满盈于字里行间的缝隙里交织在有条不紊的排列中/旬柚	未
想问一下，我爆料T公司的新品，和某些东西出过岔子吗我很好奇哦，从Pro2s到r1好像都没错吧	未
想问下大家有什么好看的书可以推荐一下的吗我也看手机看累了	未
想问下有这种男人吗搞笑幽默趣闻	未
想问你们觉得 轮休和双休哪个好各有各的好：固定双休时间固定休息规律，方便和家人朋友安排事情制定约会。轮休每逢周一到周五去看电影逛商场都能错过周末高峰，结账不用排长队，还有仿佛翘班的快感	未
想问城管的赶快 《阳光问政》11月29日开播	未
想问问大家，vscocam和snapseed，大家对哪个更有兴趣做录屏教程的话，更想学哪个是想系统的了解软件以及里面的功能，还是只想粗暴的要调色结果这两个是我最常用的修图软件，在加上一个Foodie，基本涵盖了99的修图需求。另外，vsco也是可以给视频调色的。	未
想靠在那个臂弯里看书，谁帮我P一下谢谢各位大佬	未
想面对面听专家分享调解经这个可以有！11月13日至17日，人民调解大讲堂第一巡回宣讲团赴江苏浙江两省进行宣讲。人民调解专家郑宗瑶和陈凤英用朴实的语言鲜活的案例专业的知识清晰的思路，把自己的调解心经分享给现场和屏幕前所有的聆听者。江苏浙江两省近2500余名人民调解员听讲，其中，400多人现场听课，2000余人视频听课。一起去现场看看想面对面听专家分享调解经这个可以有！	未
想飞去热带岛屿游泳by@张找地er 超话大神评选V影像力	未
想飞就飞 成为春航绿翼会员都有哪些好处即日起至2018年12月31日，绿翼会员购买航班至2019年2月9日的可额外获得票价10的积分，积分可用于直接抵扣之后票价，买票更划算！ 本活动积分有效期至2019年12月31日	未
想飞就飞 春秋航空宁波出发冬春航线，直飞大连重庆青岛桂林银川等地国内新航线机票99元起，点击链接选择你的下一站飞行吧gtgt 网页链接	未
想飞就飞 马上就要到圣诞节和元旦啦，今年要去哪里跨年呢双旦狂欢季，机票暖心价，飞境外机票最低9元起，点击链接计划跨年旅行啦gtgt 网页链接	未
想魂穿鹿店长手中的炸鸡想拿到限量明信片成为锦鲤！那就来 肯德基圣诞快乐送 ，下单圣诞欢享桶立省45元，还送可乐1瓶！把他捧在手心一起过圣诞KFC宅急送男友力发射ing戳链接：网页链接get鹿店长的爱心男友力	未
惹，实//@欧美二线品牌:公然不是朝阳区了！//@江宁婆婆:实锤来了//@平安北京:情况通报毒品，让最美凋零。	未
惹火的圣诞树一点就着，4秒烧到顶！必看的圣诞树消防安全小贴士！	未
愁连山旧城村超10万斤番薯滞销，谁来帮帮他们?	未
愈挫愈勇！这个小伙为了实现梦想也是拼了！	未
愉快的周末又开始啦，没起床的请点赞	未
愉快的周末又要开始了，留下大区和id，寻找一起开黑的小伙伴吧英雄联盟夜聊	未
愉快的在大长春穿着单衣单裤蹦蹦跳跳的走在繁荣路上，仿佛一朵发出春天气息的小猫咪	未
意中经济文化交流中心在罗马诞生	未
意侨领：《告台湾同胞书》发表40周年 推进两岸发展	未
《意外关系》发片尾曲 小青岛诙谐搞笑自成一派	未
意外捡到会做饭会算账会揍贱人的全能男神肿么办	未
意外收获！网友长江泛舟竟拍到成群江豚水中嬉戏	未
意大利2018年人均收入评估报告出炉 米兰收入最高	未
意大利Burano布拉诺岛，一个童话里的彩色王国。这个小岛是个宁静安详的渔港，极富悠闲的度假气息，被称为威尼斯的童话小岛。彩色岛规定岛上的居民每年必须刷一次房子，于是，富有激情的布拉诺岛居民，按照自己喜欢的颜色粉刷自己家的房子，岛上因此多了个美名彩色岛。	未
意大利F-35战机在欧洲首先达到初始作战能力，阿门多拉已装备8架	未
意大利SIRMIONE小镇，有些风景就那么静静地躺在时光里，却那么动人。	未
意大利乡村度假酒店  100多年历史建筑的文艺复兴	未
意大利企业家希望融入“一带一路”建设发展	未
意大利侨爱慈善协会牵手青田农村儿童献爱心	未
意大利再打开国门 获准在海上漂泊的342名难民登陆	未
意大利北部华侨华人餐饮业协会成立 周斌任会长	未
意大利古城锡耶纳举行无鞍赛马节 场面惊心动魄(组图)	未
意大利国宝级合唱团 新年献演江苏大剧院	未
意大利国家德比今夜来袭，不见不散	未
意大利国家德比 你记忆最深的一幕是哪一个欢迎分享！	未
意大利国民清洁神器！5秒变新家，横扫9大污渍，赐你去污洪荒之力！	未
意大利太远 到南博看“文艺复兴三杰”	未
意大利媒体《米兰体育报》的消息：伊卡尔迪是皇马冬季转会窗的第一目标。他在等待国米的新合约，虽然他有可能在明年加盟皇马。皇马转会传闻怎么有种拿皇马抬价的感觉	未
意大利巨型浮动码头：3000米长，可同时容纳1万多人！	未
意大利德龙×天猫超级品牌日 ——尽兴德龙，因意而慢	未
意大利总理：维护社会稳定和金融秩序至关重要	未
意大利斯佩罗小镇，不是热门旅游地，少有人曾听闻它的名字。偶然一瞥，会被这满城的灿烂鲜花迷住 .	未
意大利斯佩罗小镇，不是热门旅游地，少有人曾听闻它的名字。偶然一瞥，会被这满城的灿烂鲜花迷住	未
意大利旅行攻略意大利真的是一个值得去的地方，有和法国不一样的浪漫。无论是大都市米兰罗马，还是小渔村里奥马焦雷，都有着各自的风情。图1-7：米兰 威尼斯 佛罗伦萨 五渔村 罗马图8：小记tips图9：美食推荐祝大家旅程愉快啦作者:@熙曦糖	未
意大利沿海小镇Sperlonga	未
意大利移民人数持续增长 已达社会人口总量10%	未
意大利米兰14岁华人男孩拾金不昧 获意媒点赞	未
意大利著名雕塑家瓦尔波特首度来华举办个展	未
意大利设计公司 Pininfarina 推出终极跑车 Hypercar Battista以创始人之名命名的 Battista 为纯电 Hypercar，全车搭载 Rimac 提供的全电能动力系统，拥有 1，900 匹马力1，696 lb-ft 扭矩以及极速 250 mph 的强悍实力，同时 0 至 100 公里加速在 2 秒内即可完成。详情请点击：网页链接	未
意大利超模Vittoria Ceretti连登三场纽约2019早秋大秀的秀场，并为Chanel大秀开场，Versace和Alexander Wang大秀的表现也各有风格，业务能力相当优秀。	未
意大利足球教练协会主席表示愿与中国开展教练培训合作	未
意将斥资逾2亿欧元重建断桥 号称“千年不倒”	未
意念取暖	未
意念回复	未
意拳详细的练法及其秘传的心法（附视频）	未
意欲何为谷歌母公司将百万只蚊子释放到人口稠密城市！	未
意甲-切沃vs国际米兰全场比赛结束，上半场国米由佩里西奇打破僵局取得领先，下半场进入补时阶段，39岁的意甲老将佩利西耶挑射建功为切沃扳平比分。最终双方1-1战平！	未
意甲单场：亚特兰大一球胜拉齐奥	未
意甲圣诞赛事！奉上两场黄金时间段的对决！19:30 弗罗西诺内 VS AC米兰 解说嘉宾：@石庆圣 李彦 本场直播gtgt网页链接22:00 亚特兰大 VS 尤文图斯 解说嘉宾：@李欣 @董路 本场直播gtgt网页链接	未
意甲实时积分榜和射手榜	未
意甲第15轮赛果与积分榜。我们领先的优势依旧是8分。	未
意甲综合：尤文轻取斯帕尔 C罗升至射手榜首位	未
意甲综合：罗马战平国际米兰 AC米兰逆转帕尔马	未
意甲综合：那不勒斯主场大胜 卡利亚里战平罗马	未
意足协主席：全力申办2028年欧锦赛	未
意达科技登陆新三板	未
//@愛崽:易烊千玺微公益成立一年半筹款逾200万元，千玺林生态扶贫项目现已超过百万。@TFBOYS-易烊千玺 受邀担任中国绿化基金会公益大使我国首个00后偶像粉丝的公益基金。生态屋顶关爱抗战老兵环卫工人先天性疾病儿童领养濒危物种等，还有一直以来的爱心包裹和免费午餐，跟着偶像益起来。	未
愛心曲奇暖萬家你今日買咗曲奇未呀[给你小心心][给你小心心]做善事人會靚啲外，仲會有曲奇食添原來係愛心曲奇暖萬家慈善活動好多位有愛心嘅女神男神同應屆港姐都出錢又出力為仁濟緊急援助基金籌募經費上網同電視都買到！！咁方便，你支持咗未呀TVB 愛心曲奇暖萬家 邝洁楹 张宝儿 女神 网页链接	未
感人：一大货车翻下百米陡坡，50人手拉手爬坡救司机！	未
感人！四川大货车翻下100米陡坡 50多人手拉手爬坡救司机	未
感人！大货车翻下100米陡坡，50人手拉手爬坡救司机	未
感人，已发红包，我尽快过去近一点开店。另请@Fonnp 仔细阅读全文	未
感人幸存者讲述52年前东山渔民在台湾海峡的惊险经历	未
感人：我的保洁阿姨为了方便跟我们打扫公司和家的卫生，在附近购置了一套370平的平层豪宅，刚才开心的跟我说，以后阿姨离你们近了，打扫卫生多方便呀！	未
感人！新化籍干部为官30年，还欠3万元！	未
感人！新娘自己主持婚礼 等待姗姗来迟的消防员新郎微博视频	未
感人！深夜偶遇花垣迷路儿童，披星戴月安全送家	未
感人瞬间，没有PS的照片，第一张就被治愈了	未
感人！老司机在巴中翻下百米陡坡，50余人手拉手开展生命大营救.....	未
感人身边事 网友@爱芒果小妞 近日早上在洛阳瀍河区一公交车站等车时拍下了温暖有爱的一幕：老爷爷蹲在地上，用颤抖的双手给老奶奶拉棉袄拉链，拉完还给老奶奶整理一下衣服，最后拉着老奶奶的手继续等公交。陪伴是最长情的告白，愿每个人都能找到那个待你如初的人！	未
感兴趣的可以听听噢	未
感兴趣的可以看看！	未
感兴趣的可以看看哦！	未
感兴趣的学学吧！	未
感兴趣的学起来	未
感兴趣的来看看了	未
感兴趣的试试看	未
感冒发烧吃这个天见效！值得一看	未
感冒越来越严重，我还得从零下5度的北京回到零下20度的乌鲁木齐，太刺激了！！	未
感动2018//@阿粪青://@農呋:太感人了//@pro军:好人	未
感动！300名中学生在国博唱响《歌唱祖国》	未
感动50里山路，38道大弯宜昌四兄弟用轮椅推着母亲走了10多个小时	未
感动！62岁阿婆真情告白：老伴儿，你的安全我的牵挂	未
感动！70岁阿婆西康路桥下卖酒酿，20年风雨无阻，全上海都在扩散	未
感动！78岁婆婆坚持十年给独居老人送饭十年来，西昌市西溪乡西溪村五组的马正敏夫妇，一直无微不至地照顾着独居老人马联国。马联国一个人独居了数十年，在村里也没有亲戚，他有些智力低下，无法正常说话，一只眼睛已失明。之前，马正敏夫妇俩每天做好饭后都会送到马联国家中，即使有事在外，也会嘱托家人按时送饭，风雨无阻。四年前，马正敏的丈夫因病不幸去世，她仍坚持每天送饭。78岁婆婆坚持十年每天给74岁老人送饭，背后的故事让人泪目	未
感动！78岁婆婆坚持十年给独居老人送饭十年来，西昌市西溪乡西溪村五组的马正敏夫妇，一直无微不至地照顾着独居老人马联国马联国一个人独居了数十年，在村里也没有亲戚，他有些智力低下，无法正常说话，一只眼睛已失明之前，马正敏夫妇俩每天做好饭后都会送到马联国家中，即使有事在外， ...全文	未
感动  不仅仅是场国际音乐会，他们这次来，还为了萧山一群特殊的孩子	未
感动中国2018年度候选人公布，程开甲王继才杜富国在榜日前，央视网公布了感动中国2018年度候选人物。在21位候选人物中，有中国核司令程开甲守岛卫国的王继才和妻子王仕花扫雷英雄杜富国见义勇为吕保民等多位现役军人和退休退伍军人以及民兵。（中国军视网 央视网）  ...全文	未
感动中国大奖。//@体坛殳海：第一，德拉维多瓦菜鸟赛季就场均18分钟，詹姆斯回归后他任何一个月的月薪都不止2万美元第二，J.R.和香珀特2015年1月才被交易到骑士，2014年没有他们第三，德拉唯一可知的两封公开信都是写给整个克利夫兰的。下次伪造公开信，咱别用第三人称写啊	未
感动，人性之光	未
感动！人民公仆为人民，河北省直机关公务员为缘捐髓	未
感动！他蹲在地上用手一点点捡起了地上的碎玻璃20日，网友@美美美萌2015 在吉林长春街头看到了这样一幕：一位环卫工蹲在地上，用手一点点将地上碎玻璃捡起，看着这个侧影，好心酸，好怕他割破了手。他们在工作中，有时候不得不用手去清理垃圾，当你在丢弃垃圾时，尖锐物品请简单处理一下，体谅一下环卫工的辛劳！此时东北的气温已降至零下，希望我们在这个冬天能给环卫工人更多的温暖。@中国长安网	未
感动 你的需求我关注！ 爱心团队来到青龙大森店村	未
感动！//@侯宁:至情至性，催人泪下！	未
感动全网！寻访捐千元神秘流浪汉：不受施舍，每天读书浙江宁波，一名流浪汉捐献了1000元，请民警转交给困难学子，他的善举感动全网。一家面馆老板称，流浪汉捐献的钱都来之不易，他平时只吃4块钱的面。一位水果摊贩也夸流浪汉人好，称他从不接受施舍，每天都会看到他看书。	未
感动全美！爱犬守候老布什灵柩，送前总统走完最后一程	未
感动！出租司机携病妻运营：已持续1年多因儿女在外，妻子患病需要时刻有人陪伴身边。北京一名的哥携患了阿尔茨海默症的妻子共同运营出租车，一般妻子坐在副驾驶。	未
感动到不行	未
感动到哭 微博视频	未
感动@南阳志愿者，今天是属于你们的节日！	未
感动！古县南垣乡孙寨村95户村民喝上自来水，老人笑了，村民的心暖了！	未
感动！古蔺康兴医院为了病人号召大家做了这样的事！	未
感动！只为守护一个承诺，一家四代免费摆渡141年	未
感动！只那一眼，便是9年从未间断的问候！	未
感动//@吃瓜群众CJ:第一次看到	未
“感动吉林”十大人物评选之10号候选人：杨春武	未
“感动吉林”十大人物评选之13号候选人：丁华	未
“感动吉林”十大人物评选之14号人物：高威威	未
“感动吉林”十大人物评选之15号候选人：宽城区人民检察院 未检团队（桔子姐姐）	未
“感动吉林”十大人物评选之16号候选人：任长忠	未
“感动吉林”十大人物评选之17号候选人：孙吉发	未
“感动吉林”十大人物评选之18号候选人：张关存	未
“感动吉林”十大人物评选之19号候选人：薛志军	未
“感动吉林”十大人物评选之2号候选人：贺婉婷	未
“感动吉林”十大人物评选之3号候选人：朱敬云	未
“感动吉林”十大人物评选之6号候选人：刘凤英	未
“感动吉林”十大人物评选之7号候选人：孟晓萍	未
“感动吉林”十大人物评选之9号候选人：武大靖	未
感动哭了//@芋饺今天也在勤劳地搬砖：chrome的圣诞礼物	未
感动//@大懒糖:可爱//@阿粪青:好甜qwq//@自驾去旅行吧:好甜啊突然泪目	未
感动！大象宝宝救了落水路人野兽也有温情！国外一直像宝宝看到有人在水中挣扎，以为落水了急忙下水救人请不要再伤害这些温顺的动物，没有消费，就没有伤害 .  微博视频	未
感动她为阳朔一棵千年古树众筹2万多元！	未
感动宝坻集体宝坻区对口扶贫队成员：扶贫路上的生死救援	未
感动寒风中的送餐大军演绎校园版舐犊情深	未
感动就在身边	未
感动工商不小心摔伤后，身边的师生让她觉得这个冬天很温暖	未
感动。我的祖国	未
感动指导员，我想向您请个假	未
感动！新生儿命悬一线！这个砀山人一个举动刷爆合肥朋友圈...	未
感动无数人的视频，通渭人都看看	未
感动无数情男情女的一首情歌，再忙也要听听	未
感动无腿村医李菊洪走坏24只小板凳，行程8万多公里服务村民6000多人次，这才是真正的白衣天使	未
感动//@有人叫我睡神:看的还是很感动的。	未
感动！海军战士的背影再次刷爆朋友圈	未
感动淄博这位老人每天鞠躬1000次！原因让人落泪	未
感动！爱情最美的样子，老夫妻地铁牵手而行虽然他们老了，身体不如年轻的时候，但从两口子手牵手的画面里，仿佛看到了爱情的模样！最美牵手，好温暖	未
感动的想哭	未
感动瞬间今早，宿州磬云路抛洒渣土，环卫工人跪地铲除。	未
感动社区12306技术部主任：春运高峰日一天被刷了1600亿次中国铁道科学研究员电子所副总工程师12306技术部主任单杏花今年44岁，从事铁路信息系统研发和重大工程工作已有二十多年她带领团队研发铁路12306售票系统，针对高峰期海量并发访问恶意抢票等难题进行了技术攻关，为亿万旅客出行提供 ...全文	未
感动竹山国际大酒店海宁皮草城回收旧衣物捐赠 用爱心温暖贫困山区	未
感动！老布什爱犬守候灵柩前 完成最后使命送别主人	未
感动荆州候选人：王梅：初心永不改，红梅花常开	未
感动！衢州85岁老奶奶做出最珍贵早餐：只卖5角钱，27年从不涨价	未
感动谢谢二姐的关注，双胞胎家属的联系方式已经微博私信。//@张歆艺: 怎么能帮帮这个家庭	未
感动！这对夫妻让人肃然起敬，用18平米筑起三个孩子的深圳梦	未
感动！重庆一13岁少年卖画救患癌姑姑！	未
"感动重庆十大人物"评选活动走进嘉西村	未
"感动重庆十大人物"评选走进大渡口 市民现场投票	未
感动重庆生活	未
感动青县道德模范展播敬业奉献篇韩荣	未
感動不已。	未
感受一下今日的妖风	未
感受一下别人家的海鲜宴！	未
感受一下吉娘娘20年前的秀这是天神下凡吧	未
感受一下安达的气温 查看图片	未
感受一下工作人员对王子异的评价看见工作人员都会认真地问好道谢，听别人说话会认真耐心的聆听，时刻关照周围人的情绪和感受。@王子异 是我们的温柔陷阱没错了。每天想魂穿工作人员.. 被王子异暖到了	未
感受一下父母年轻时的颜值他们也曾年轻过 情感	未
感受一下的氛圍	未
感受一下西成高铁上的美食	未
感受下西安的蛋菜夹馍时尚V势力美妆V赏	未
感受下这波Ugg x Bape	未
感受互联网文化，聆听时代之声	未
感受古老盐卤历史，嗨翻圣诞趴！海汤神泉2000张限量门票等你来抢！	未
感受宁静，而不是打破这份宁静	未
感受成都冲击波 ！10位民营企业家24小时全记录	未
感受新兵让子弹飞的瞬间！	未
感受莫斯科“慢生活”	未
感受高质量发展｜江苏首个气象防灾科普馆浦口气象防灾科普基地完工	未
感叹大自然的美随手抓起一件暖暖自己穿空了真的要多出去走走	未
感叹！小榄这40年的发展奇迹，是这样一步步走过来！	未
感同身受如何才能做好质量管理工作	未
感君一回顾。	未
感性爆发！厉旭新专辑制作两篇MV 预告片公开	未
《感恩》	未
感恩BlueCharm的朋友们，特别喜欢这组照片和那天的经历， 希望我们都能活出树的精神！	未
感恩//@一蚊丁: 感谢科学//@M大王叫我来巡山: 未来会越来越好的//@尸姐:啊//@这是一个很高冷的ID://@刺客棉条://@spark不夜城://@Tiger公子:真好//@香喷喷一锅肉:转发微博	未
感恩一路帮助过我的所有人！	未
感恩之旅，傲澜组织优秀员工及家属畅玩西双版纳	未
感恩，什么是感什么是恩人生必读	未
感恩今生相遇的每个人	未
