“小默克尔”当选德国基民盟新主席	未
小鼠实验显示：核桃或可提高记忆和认知能力	未
小龙女p图大赛对不起，这个比赛姐单方面宣布，瓦妮莎获胜！！！	未
小龙女吴卓林晒与太太恩爱合影：爱令我们坚强	未
“小龙女”李若彤新造型！短发美出新高度，一个眼神撩到我了	未
小龙女结婚晒娇妻, 妈妈吴绮莉同框晒小鲜肉 网友: 各自幸福	未
少侠好身手！一位老人摔倒在扶梯上，烟台政务中心一名工作人员仅用3秒，便从十米外的座位飞身翻桌，跳上扶梯，将老人救起！	未
少侠好身手！一位老人摔倒在扶梯上，烟台政务中心一名工作人员仅用3秒，便从十米外的座位飞身翻桌，跳上扶梯，将老人救起！ 更多精彩内容，可以进我微博看！	未
少儿英语AI课堂叮咚课堂获数千万元A轮融资	未
少儿英语 Proud Kids 成决胜网和百度年度教育大奖得主	未
少吃碳水能燃烧更多热量，更能维持苗条身材	未
少女出走会岳西网友，好在	未
@-少女包青天- 关于读书的碎碎念网页链接Paperi内容精选	未
少女心 戳个赞你即将收到一个好消息	未
少女心甜品系列 .	未
少女情怀总是诗 圣诞节快到啦，你的愿望是什么呢悄悄告诉我我去拜托圣诞老人帮你实现哦出镜@萌玘 摄影@喵小天meow	未
少女情怀总是诗超话大神评选V影像力 可愛多琦起风了（Cover 高橋優-《》） photo@虾儿-	未
少女情怀总是诗超话大神评选V影像力 白醋少女摄影@是王嫩嫩出镜@白醋少女	未
少女情怀总是诗超话大神评选V影像力 脑海中起毛球的记忆黑色毛衣photo@要喝一杯吗_	未
少女感又回来了众女明星同台比美，杨幂艳压群芳	未
少女教开团  这里有一份吃不胖的秘籍，记得来领！	未
少女时代秀英出道12年 确定SOLO出道发表新曲	未
少女跳嘉陵江轻生，蓬安的哥姚长海跳江救人！	未
少女通勤两不误，粉嫩的可以掐出水的店铺有哪些时尚	未
少室山头琴未冷，风陵渡口似闻声。人间自有情难老，不信娇女白发生。心中最具灵性的小东邪哪版郭襄比较灵	未
少将乔良：可控的非战争军事行动是南海问题最佳应对方式少将乔良：可控的非战争军事行动是南海问题最佳应对方式	未
少年不负流光，易无反顾，易路向前。	未
《少年亚当》《明日情缘》入围2019圣丹斯电影节	未
少年。。。你想要。。。力量吗。。。	未
少年，你渴望22元三件套的力量吗	未
少年，你的飞行技术在全国排第几	未
少年卢克・加纳罗马获炫技赛冠军 被曝4岁起就作独奏表演	未
少年探险家的原生态冒险之旅寒假贵州格凸河营（812岁专场）	未
少年科学粉  为什么歙砚被誉为四大名砚之首	未
少林寺举办千年国宝佛经大展 展出横跨1500余年国宝佛经	未
少校说交通曝光！这些开车的人，没有给海安这座城市加分！	未
少爷发图：当我还是个小男孩的时候，有时候我去拍戏，我妈妈就会奖励我带我去哈姆莱丝玩具店。今年我去买圣诞礼物的时候，去乐高玩具店给我侄子买了一个乐高德拉科。滑板平衡界新星June Saito在下面评论：你侄子已经有了一个真正的德拉科叔叔了，所以乐高版的德拉科就只是一个小奖励而已。	未
少见！博州出现珍稀鸟类侏鸬鹚	未
少跑路好办证重庆警方这17项便民举措不要太方便！速度了解！	未
少通社TV莆田：我是小小传承人公益课堂开课	未
少通社小记者走进莆田市地震局 学习地震科普知识	未
尔56家保姆级探店攻略，好吃的也有拍照刷街都有，有机会一定要去感受感受（作者：徐徐徐徐boy）损姐爱旅游	未
尔康周杰乡下豪宅气势恢宏，与自家千亩农场构成一幅太极图	未
尔腾 可撕式粘毛器1手柄3卷纸 卷后7.9拍最后一个选项 ，斜撕设计，方便使用，日常清理灰尘，纸屑必备啊！！	未
《尕妹是桃花三月开》杨全梅	未
尕小伙唱青海花儿，确实很受听！	未
尖兵之翼多用途无人机凌空展翼航空工业自主研制的第100架翼龙无人机今天通过验收，正式交付海外客户，这创下中国无人机出口的新记录，标记了我国完全自主知识产权的翼龙系列无人机发展跃上新高度。多用途无人机被誉为21世纪的尖兵之翼。航空工业成都所于2005年将中空长航时察打一体无人机作为突破口，开始了翼龙无人机的自主研制。翼龙项目十余年来砥砺前行，获得了国际市场的一致好评，成为我国航空产品出口的新名片和深受海外用户信任的明星产品。中航（成都）无人机公司总经理李永光说，翼龙无人机团队平	未
尖参VS闹增拉毛《河源之恋》（附现场视频）	未
尖叫吧！气温重回20，随州这个地方要嗨爆！过山车摩天轮...免费玩！	未
尖山坡隧道贯通：四川南向通道建设迈入新阶段	未
尖货返场我吃过最好吃不会腻的麦片，承包英国人餐桌160年之久！	未
尘世中的一份清醒，浊事中的一份清白。珍珠与你的坚持，都是与生俱来。	未
尘土飞扬，硝烟弥漫，约你一起到实爆现场看一看	未
尘埃落定，突出重围一部分法鸡战士已经杀入本赛季欧冠16强登贝莱哥哥的一波操作真是太骚了FiersdetreBleus 欧冠	未
尘封百年，甲午海战致远舰设计图在英国重见天日	未
尘肺农民康复站 陕西镇安柴坪尘肺病康复中心组织康复锻炼12月14日，@大爱清尘-陕西 柴坪镇尘肺病康复中心组织日常康复活动，指导员曾双医生现场为当地的尘肺病农民兄弟做常规项目检查，登记信息，并带领大家一起做八段锦康复操，大爱清尘康复专员熊启志现场协助积极锻炼，增强抵抗力，希 ...全文	未
尘肺农民康复站陕西首个尘肺人康复中心正式启动11月28日，大爱清尘陕西省镇安县柴坪镇康复中心在柴坪中心卫生院正式启动揭牌这是大爱清尘在全国第三个正式运营的尘肺病人康复中心，也是陕西省首个尘肺病人康复中心镇安县县委宣传部副部长文明办主任李俊，镇安县卫生局副局长高 ...全文	未
尚品生活好想搭上札幌开往小樽的雪国列车，感受一下这静谧	未
尚客优品落户江苏徐州 打造旅途中的美好生活空间	未
尚客优品闪耀安徽芜湖 加速中档酒店集团化进程	未
尚未加群成功的兔民们一定要记得加群哦有任何问题可以咨询群中管理员欢迎加入勉吧五辑后续代购二群，群聊号码：956443292	未
尝试一下继续chou三位song	未
尝试用一篇长文讲清楚中国宪法与国家宪法日：中国历史上第一个具有宪法性质的法律文件是大清国颁布的《钦定宪法大纲》，当时经历了鸦片战争八国联军侵华中日甲午海战，清政府为挽救颓局，实施庚子新政，被迫开始进行改革，使清朝成为君主立宪政体的国家。于是大清朝以《大日本帝国宪法》 ...全文	未
尝试过一个人旅行吗第一次一个人去旅行是几岁呢	未
尝鲜电信高清通话，夺万元年终奖	未
尤克里里入门教程（102讲）：网页链接吉他入门教程三十全集（30P）：网页链接架子鼓自学教程（49集）：网页链接复音口琴教程（7讲）：网页链接钢琴即兴伴奏教程：网页链接古典吉他教程：网页链接民谣吉他教程（77集）：网页链接笛子演奏入门教程（8集）：网页链接古筝入门教程（40集）：网页链接流行钢琴基础教学：网页链接二胡初级教程（136集）：网页链接葫芦丝演奏教学（6集）：网页链接	未
尤妈妈社交网站上发布昨天抢热火主场看球的照片，美啊希望小公主一定像你多一些！	未
尤文vs国米：国家德比剧本前瞻	未
尤文vs都灵大名单，极限中场模式	未
尤文图斯之夜即将在NBA布鲁克林篮网队主场上演	未
尤文图斯大礼包上线时间还有1个小时！	未
尤文图斯的后卫鲁加尼是巴萨1月份的收购选择之一「sport」	未
尤文图斯迎战国米米兰，意大利国家德比本周打响	未
尤文图斯这个数字真是令人羡慕嫉妒	未
尤文官方：坎塞罗右膝内侧半月板选择性切除手术成功，唉	未
尤文官方社交账号发推纪念在2003年的今天，尤文中场内德维德赢得当年的金球奖	未
尤文宝宝团。大伙儿都能对上号吗给小可爱们找爸爸ForzaJuventus	未
尤文宣布和巴西左后卫阿莱士-桑德罗完成续约，新合同到2023年夏天。桑德罗的年薪将上涨到500万欧元，并且有浮动奖金条款。	未
尤文巨星迷你罗携老父亲与队友合影	未
尤文欧冠无忧，全力出击联赛国米难抵挡	未
尤文积分追平欧洲纪录	未
尤文队友还原真实C罗尤文图斯中场小将本坦库尔谈起C罗时，他表示在训练中C罗就像一只野兽，而在球场下他像一个孩子，非常喜欢开玩笑。网页链接	未
尤文队员为三星公司推出的Galaxy A7尤文定制版拍摄宣传海报	未
尤权会见参加改革开放40周年庆祝活动的海外侨胞和归侨侨眷代表	未
　　尤权出席并讲话	未
尤权在广东调研时强调：为民族复兴凝心聚力	未
尤权广东调研：为民族复兴凝心聚力	未
尤权：海外侨胞和归侨侨眷是改革开放的重要参与者和贡献者	未
尤权率中央代表团三分团在广西梧州看望慰问各族各界干部群众	未
尤权率中央代表团三分团在广西玉林看望慰问各族各界干部群众	未
尤权率中央代表团三分团在广西贵港看望慰问各族各界干部群众	未
尤权率中央代表团三分团在贵港看望慰问各族各界干部群众	未
尤溪这10个地方，一定要玩遍！你想先去哪	未
尤里米国际讲师pk大赛香港站（现场照）！	未
尤长靖一起来为尤长靖做数据吧 12月26日控评轮博及其他日常任务汇总1控评任务1转赞评施妮薇 网页链接2亚洲新歌榜 网页链接3完美的餐厅 网页链接4优酷 网页链接5浙江卫视思想跨年 网页链接6天天向上 网页链接7NTsnap 网页链接8浙江卫视中国蓝 网页链接 （海底捞）9转赞评网易考拉官方微博 网页链接10领跑2019演唱会 网页链接 （海底捞）2轮博任务转发老师博 网页链接思想跨年博 网页链接圣诞博 网页链接那吾博 网页链接3每日必做小任务QQ	未
尤长靖尤你相伴 长进不断 办理招商银行信用卡微博送花活动招行又有新的活动啦！通过这个链接网页链接 滑动切换找到小尤专属办理界面，每有一张新办理卡，招行将会给@尤长靖 送一朵花花，之前办过的也可以重新办理，有信用卡需求的西柚们可以从小尤专属链接办理，顺便为他赢取鲜花哦！P.S.一定要从中首发的这个链接办理才能计尤长靖数据哦	未
尤长靖 我决不允许你们错过弟弟的绝美生图！崽！爱心是用来比的，而不是你拿来索命的工具	未
尤长靖[超话]唤醒时光 尤你一起 快来接收新的手机背景图吧@尤长靖	未
尤长靖[超话] 尤长靖 Christmas有你 还记得大明湖畔的瓶瓶，等你们的打卡视频呀一起完成给@尤长靖 的圣诞礼物哟	未
尤长靖[超话] 尤长靖新歌 尤长靖第四首个人单曲将于明天上午十点正式上线我们的尤老师又出新作品了真的是非常有才华的男孩子期待他的作品	未
尤长靖[超话]想一起旅旅游	未
//@尧帝第38代传人:实力摆拍。小车都不一定有这辆摩托车贵。	未
尧栾西高速尧栾段土建6标工程总进度达68，计划2020年底建成通车	未
尧都区委书记陈纲亲临迎春街南延工程现场！	未
尧都区这些村子就要大发展了！再不用羡慕城里人了！	未
就业一人，脱贫一户灵璧县扶贫工厂居家就业助脱贫	未
就业上海12345市民服务热线专场招聘会来啦！	未
就业上海上享实业集团有限公司招聘工作人员5人	未
就业上海商学院招聘一批工作人员，有适合你的岗位吗	未
就业事业编制！天津部分事业单位招聘399人，火速报名！	未
就业导航11月24日，宿迁便民方舟有大型综合招聘会！@宿迁人社 招聘会时间：周六（2018年11月24日) 上午9：0011：30招聘会地点：宿迁市人力资源市场（便民方舟1号楼2楼）乘车路线：市内30230381313202301318808105到便民方舟站下车即可 。	未
就业导航转需，泗阳县交通产业集团有限公司招聘工作人员12名！	未
就业导航速看！京东全国客服中心最新职位来袭	未
就业援藏为西藏籍毕业生提供就业岗位逾4万个	未
就业有位来准备面试转存看看吧！花5分钟就能读完的面试技巧28个面试技巧，送给找工作的你。祝大家成功找到心仪的工作！	未
就业有位来准备面试转存看看吧！花5分钟就能读完的面试技巧28个面试技巧，送给找工作的你祝大家成功找到心仪的工作！	未
就业有位来 准备面试转存看看吧！花5分钟就能读完的面试技巧28个面试技巧，送给找工作的你。祝大家成功找到心仪的工作！源@央视新闻	未
就业有位来 愿大家都能找到一份心仪的工作	未
就业有位来转给职场新人！有用！都是Excel常用公式！求和平均数最大值标准差如何查找重复值如何自动标出符合条件的数值进阶版Excel超实用技巧分享！	未
“就业”正在新疆喀什民众心中“开花结果”	未
就业沪上50多家文化单位集中招聘！近300个岗位等你来	未
就你辣！（配图吸引了我hhh）//@众生皆苦你是娃哈哈呀:正在思考买什么新唇釉！ 查看图片	未
就像候鸟南飞，就像万河归海，希望你，是为我而来	未
就像风筝，约束， 是为了飞得更高 。	未
就几十块盘，处理完就要等下次了，想收的欢迎联系邮箱 hd@yyets.com	未
就出现在赣江！全城关注	未
就刚刚，众多扬州人涌向花都汇，就为这件事现场大气磅礴，振奋人心！	未
就发生在江西，这一幕被网友拍下，感动无数人！	未
就国外的沙漠旅游来说，阿布扎比的里瓦沙漠拥有极为优越的地理位置，面朝阿拉伯湾，背靠金色沙滩，是少有的大海和沙漠共存的好地方。网页链接 非凡阿布扎比 @阿布扎比旅游局	未
就在11月24日！芜湖人独门独院的院落生活盛世启幕！	未
就在11月27日周二上午10点！南乐人必须注意！	未
就在12月份！郑阜铁路临泉站开工建设啦	未
就在下个月，梧州环城高速全线通车，梧州交通要大变了...	未
就在下周六！张家港这280家企业5500多个岗位等你来！	未
就在今天，安庆公安入驻抖音啦！	未
就在今天，我想让你好好听听这首歌，唱给唐山人的歌！	未
就在今天，我要曝光奉新这家爱心超市！	未
就在今天！汾阳交警直播查车！小伙伴们速来围观！	未
就在今天！焦亚飞局长带队检查危化品安全生产工作，他要求	未
就在今晚哦！有兴趣的玩家可千万不要错过了！！！	未
就在今晚！请锁定CCTV-7 ，乡村振兴看中国上山下海游城阳！	未
就在佛山附近，粉色花海大爆发啦！这次不用人挤人！	未
就在刚刚，奉贤5号线通过专家评审！站台周边设施紧锣密鼓进行中	未
就在前天！  乐清又上央视啦！	未
就在南昌！周日赶快去这地方集合，去到就是赚到...太值了！	未
就在后天！临沂百家企业联合招聘！高薪职等你来！	未
就在嘉定！中科院专利首次来沪竞拍，7个项目现场签约！	未
就在城阳，399元买专柜级羊绒大衣！买一件再送一件，快去抢	未
就在市中心，我找到了伦敦同款集装箱！地铁2号线还直达	未
就在平乐工业园区！这家企业招人啦！	未
就在新天地马当路159号这个LeTAO旁边喔！围挡已经有了！查看图片 //@Sternwanggg:求地址啊啊啊啊啊	未
//@就在旅行: 三门峡天鹅摄影展 摄影家的天堂[带着微博去旅行][带着微博去旅行][带着微博去旅行]	未
就在明天！2018深圳警营开放日来了，全市各区都有！免费免票参与！	未
就在明天，2018首届乡村旅游美食大赛等你来！	未
就在明天丨通山石门村乡村旅游节云上直播 让我们一起嗨起来	未
就在明天！免费吃！半价游！	未
就在明天！大雾再次上演，合肥即将进入雾里看花模式！	未
就在明天！武林八大门派集结顺德踢馆，谁敢应战	未
就在明天，紫金伟达的士又免费乘坐，请拨打电召热线7776668	未
就在明天！自贡第30届大型人才招聘会等你来(附部分企业名单)	未
就在明天！青山区2018年度就业创业装备制造业园区企业用工专场招聘会	未
就在明年！黄石人将看到一个5A标准的仙岛湖！	未
就在明晚，这件大事将抖动全扬州，去现场就会抢到彩蛋！	未
就在昨日，340平米的康复治疗中心正式运行！	未
就在本周六！柳州一土豪过生日，现场疯狂送现金，赶紧去！	未
就在江湾路！我悄悄打探了这个神秘的购衣天堂...	未
就在这个月！这些幼儿园按普惠性收费，最高每月750元今天，北京日报客户端记者从北京市发改委获悉，从本月开始，天通苑地区4所幼儿园已实施普惠性收费政策，收费标准相较过去大幅降低，根据幼儿园级类，每生每月收取600元或750元（餐费除外）。这4所幼儿园是日光彩虹幼儿园东方剑桥天通中苑幼儿园东方剑桥天通东苑幼儿园育树家幼儿园。网页链接	未
就在长沙！！航拍世界最大室内冰雪乐园	未
就差你啦，赞就送	未
就当来纯度假了哈利路亚！！！	未
就很喜欢	未
就很梦幻啊//@瑟曦兰尼斯特:嗷嗷嗷嗷嗷嗷嗷//@-夙月-:哈哈哈哈哈哈右边//@_____single-：你听，是基编哭的声音	未
就想问问，成都这个女厕所的正确使用方法图丨@笨笨笨笨笨乖 成都爆料	未
就明天！12.12旺仔俱乐部主题门店正式开业啦！！	未
就明天啦！送酵素	未
就是一点也不意外的结果 但是也是能想到的最好结果 我觉得不错呀以后6或n或1或maybe7都高兴！	未
就是啥啥都做得好	未
就是想让卖狗的老板看到，请良心卖狗 微博视频	未
就是明天了	未
就是明天啦	未
就是明天开！黑红脚趾1000元现金！赞原博关注@Tiffany王大艺	未
就是这一秒的我//@霓虹娘:关灯也是啊//@李知了:太写实了	未
就是这个产品经理对我说：AMAZFIT米动健康手环系列这次更新后，绑定APP的时间约等于原来的30！欢迎大家试一试，看看他是不是吹牛了	未
就是这么任性！兴化汉釜宫自助餐券免费送，兴化人燥起来！	未
就是这么任性！看小店街头飘摇的海草	未
就服这个BGM ！	未
就现在，即刻开启你的智能生活！关注@联想 转评本条微博，抽送联想智能插座一只！	未
就知道你肯定会分享这次假期哒工作辛苦啦我们哥哥17号要做汇报去不了北京 18号见哈！爱你！！	未
就等你了！京东面向新沂招人啦！	未
就等你了//@各国美食学起来YOU: 大家选好了么等我逛完街就开！	未
就等这最后一天呢，后来一定会居上天下码商狂欢节	未
就算满身是刺，也一定会有人温暖掉你的盔甲来爱你	未
就诊流程早孕中孕晚孕攻略	未
就赶脚，摆在柜台里卖的会很好	未
就近办新增点养老中心开业喜获金马奖西湖区这些好消息你get了吗	未
就这个形状吧 查看图片 //@江西气象微博: 想好送我什么形状的云朵了吗@中国气象数据网	未
就这地主家的傻儿子们洗澡有啥意义啊洗完第二天又是一只完美的泥猴	未
就这样吧，做一个节能环保低消耗的人类好了。	未
就这样吧，做一个节能环保低消耗的人类好了	未
就问你，你喜欢这件球衣吗	未
就问你敢不敢dong下雪啦，下雪啦！雪地里来了一群小画家。小鸡画棉袄，小狗画空调，小鸭画冰箱，你要画个啥关注@品康佳冰箱洗衣机 随手粉 @科龙空调 ，转发微博，说说冬天来啦你有什么抗dong神器，12月12日揪一只小可爱连送12个月花点时间鲜花，每月1束。	未
就问大家羡慕不羡慕国际足球 中超联赛 中超2018 //@日本J联赛官方微博: 机器人和@刘语熙rachel 老师相处几天感觉，语熙姐真的人超好，一点儿都没有明星架子2018日本J联赛 @日本球迷俱乐部	未
尴尬！上个月全市查获47起酒驾，平昌居首位...	未
尴尬了，我刚到机场休息室，一个很漂亮的服务员给我端了一堆早餐。问题是我在家吃了，已经吃不下了，她会不会觉得我不给她面子	未
尴尬！安倍猛夸特朗普中期选举是“历史性胜利”	未
//@尸姐:到底是什么味道！//@付玥玥:文笔满分。。//@这是一个很高冷的ID: 我：好闻喜欢//@M大王叫我来巡山:你的鼻子会写文//@喜脉洗脉:我:挺香//@Tiger公子 :好复杂啊哈哈//@江南大野花 :怀疑吃了菌	未
//@尸姐://@江南大野花:感动 温情//@所木://@井上敏树厨://@月岛白子的传说://@就汤://@__橙三岁://@鹿巻:温暖//@北境魚卷://@y双海_求一切顺利://@空巢老精 ://@瓶仄相邪 :哇！	未
尹中卿：加快增强自主创新能力 维护国家产业安全今年以来，面对错综复杂的国内外形势，我国成功应对了一系列风险挑战，经济发展概括起来有三句话：一是总体平稳，二是稳中有进，三是继续保持在合理区间，攻坚战依然艰巨严峻未来我国产业需要适应创新发展，强化科技创新引领，加快增强自主创新能 ...全文	未
尹丽龙当选河北曲周县副县长、代县长，原县长已任县委书记	未
尹力来乐山调研：鼓励争创全省经济副中心，是省委赋予乐山的重要使命	未
尹学芸作品研讨会在京召开	未
尹学芸新作《菜根谣》：关于人性的温暖与底层自尊	未
尹学芸《菜根谣》：现当代优秀女作家身上常有女巫的性质	未
尹新天：专利法修正草案有望在明年得到通过	未
尹正20181128 北京上海 出发早班机辛苦啦[给你小心心][给你小心心][给你小心心]@尹正
尹正“以鞋会友”引白敬亭关注 微博互动超级有爱	未
尹烨：要给科技的力量加上人性光辉，才能给人类造福而不是添乱12月9日，华大基因CEO尹烨在2018三亚财经国际论坛上表示怎么让精准医疗变成普惠医疗，这个是科学家投资者和产业工作者努力的方向我们要给科技的力量加上人性光辉，才能给人类造福而不是添乱同时，他表示，担心医疗技术定价 ...全文	未
尹胜雅赴荷兰拍摄画报 面带微笑展知性美貌	未
尹青郭轻松律师给基因编辑新生儿的一封信	未
尹鸿、刘晓庆谈改革开放初期电影创作	未
尹鸿、宁静谈中国电影的多样性与丰富性	未
《尺八·一声一世》揭幕广州国际纪录片节	未
尼克-杨中国行即将开启 亲临3X3黄金联赛国际精英赛(图)	未
尼克-杨今日上场8分钟，三分球3投2中得6分。欢迎回来，杨少侠	未
尼克·杨将现身三对三篮球黄金联赛国际精英赛	未
尼克  胡哲12月9日巡回演讲 - 南昌站	未
尼勒克县教育局开展世界艾滋病日主题宣传教育活动	未
尼古拉斯·凯奇分享入行30年经历	未
尼古拉斯凯奇最爱吴宇森导演 望退休移居澳门	未
《尼尔》交响音乐会SE宣布于今年9月举办的《尼尔 交响音乐会12018》将于2019年2月27日发售蓝光版，价格6300日元税。其中将收录公演演奏的全21首乐曲，以及朗读部分和背景影像，首发购买特典则是台本。	未
《尼尔:机械纪元》2B小姐姐将于12月18日参战《灵魂能力6》！此前我们曾报道了《灵魂能力6》将和《尼尔:机械纪元》联动推出角色2B的消息，今日官方公布了此弹DLC的具体上线日期，2B小姐姐将于12月18日加入《灵魂能力6》的战场！DLC还将新增《尼尔 机械纪元》对战场景服装以及BGM。下周，玩家们就能在《灵魂能力6》中玩到官方的2B小姐姐啦。尼尔:机械纪元灵魂能6	未
尼尔森报告：16岁以上人群超过40对足球更感兴趣  懒熊体育 尼尔森报告：16岁以上人群超过40对足球更感兴趣  懒熊体育	未
尼尔:自动人形 尤尔哈年度版正式公布，这一版本包含游戏的全部DLC与特典，将于2019年2月21日登陆PS4 而Steam版将在2019年2月27日推出，原版将于2月26日停止下载	未
尼康Z7的显微摄影：看不见的那个美，由它来记录	未
尼日利亚举行中国改革开放40周年专题研讨会	未
尼日利亚总统媒体与宣传事务特别助理：非洲将从互联网大会中受益	未
尼日利亚赴华培训人员分享在中国学习经历感受	未
尼泊尔之行：世界最远的旅程，是从身体到心灵	未
尼泊尔博卡拉“一带一路”爱心医务室正式挂牌	未
尼泊尔官员表示全力支持旅游业汉语人才培训班	未
尼泊尔庆祝国家水稻日 民众互泼泥浆祈福(组图)	未
尼泊尔自由行攻略[给你小心心]	未
