民国“中央国术场”修缮完工：两岸“武林高手”齐聚切磋武艺	未
水利部：172项重大水利工程已开工132项 在建投资规模超1万亿e公司讯，水利部总规划师汪安南今日在新闻发布会上表示，目前，172项重大水利工程已批复立项134项，累计开工132项，在建投资规模超过1万亿元，今年《政府工作报告》提出的目标任务提前完成。引江济淮工程滇中引水工程西江大藤峡水利枢纽淮河出山店水库等一批标志性工程陆续开工建设，已有23项重大水利工程相继建成，提升了流域区域水安全保障能力。	未
水利部：2018年将全面完成河长制湖长制改革任务	未
水利部专家组到我县调研河长制工作今日你会看到5条佤山快讯	未
水利部：今年目标任务提前完成，19项重大水利工程相继建成	未
水利部副部长蒋旭光到高陂水利枢纽工程调研时强调：要切实抓好工程质量控制和安全管理工作	未
水利部：南水北调工程对改善中国生态环境作用巨大	未
水利部:我国重大水利工程项目贫困区占56%	未
水利部：持续推进水利志愿服务工作	未
水利部暗访农村饮水安全工作：部分工程水源保护仍是突出短板	未
水利部有关负责人：南水北调工程取得重要生态效益	未
水利部：水利投资对相关产业的拉动作用非常明显	未
水利部长江水利委员会长江科学院招聘48人	未
水务局:多措并举增强干部作风  不断探索促进工作落实（附视频）	未
水务行业仪器仪表供采对接会推进采购新变革	未
水务讯息排水集团西部公司泵站分公司全力做好泵站设备抢修工作	未
水务讯息水务集团持续推进重点民生工程	未
水务讯息铁西营业分公司收到滑翔七小区居民的感谢信	未
水勿忧，不仅仅是清理水线，还有四大功能！	未
水唇镇全力推进两违整治工作	未
水唇镇道路建设工作有序推进	未
水域探秘神秘的食火鸡你了解多少	未
水塔宝源老醋坊(图)	未
水墨婺源，梦幻时称 微博视频	未
水墨画  刘懋善	未
水多//@开水族馆的生物男:这批爱媛品质很好，好像最后一批了_宝贝详情	未
水头一楼两间半出租 可做各种用途	未
水头个村将花费1.5亿打造，国家AAA景区 ！	未
水头建了一栋大楼！它的作用很大	未
水头这些文化礼堂好气派 有你们村吗	未
水岸臻居紫气东升，华山之阳已成旅游热点	未
水师营一工厂急售！不动产证营业执照齐全，接手即可营业	未
水彩山水古元 作品	未
水彩手绘	未
水彩风景27-镜湖与水里木	未
水往低处流：2019年的投资机会在哪里	未
水很深，值得一看	未
水很深 值得一看 以防上当 你做过哪些蠢事	未
水晶宫3-1曼城！米利沃杰维奇点球命中！	未
水晶宫扳平比分，施卢普进球！曼城1-1水晶宫	未
//@水晶男孩鸡大帅:求放开那只鸡吧！//@七条千景:的正确玩法啊//@逡巡二狗子:这鸡是改造过的吗//@-一瓶甘油-:为什么人家连鸡都能掐出调//@追光的星鬼 ://@弗兰肯斯壳不可偏废 :啊啊啊啊啊啊啊啊啊啊啊啊啊啊钢伴eddy又出现了！！！！！！！！	未
水暖电热毯48抗寒小能手，不需要有人给暖被窝了，交给它，一整晚都让你能暖呼呼的	未
水更清，景更美！八里店这个长，真赞！	未
水木清华 早安	未
水果姐联手众星开慈善演唱会 拍卖共进午餐机会	未
“水果姐”花5万美元，拍下与男友约会机会	未
水果店挂历套路：买200送挂历120代金劵1年免费水果	未
水果的养生之道，吃水果也有门道哦	未
水果篮子新动画视觉图登上纽约时代广场	未
水果篮子重制新动画 视觉图出现在纽约时代广场！	未
水果蒸着吃，营养能翻倍！快为家人收藏吧	未
水果行情农业情报中国水果连锁超市果多美低价进军蔬菜领域中美贸易战停火	未
水泊梁山风景区演出恢复公告！	未
水泥灰-奔驰S63 AMG 性能车讯汽车V峰会V影响力峰会	未
水清岸美！曲江新区推进生态治水，给你一汪会呼吸的南湖水！	未
水清景美 宝山罗泾镇塘湾村持续推进环境整治	未
水清景美生态优，君竹河综合治理有望春节前全部完工	未
水清鱼肥助增收(图)	未
水湄物语：为什么不要做最强的那个人	未
水源保护攻坚战书记带头再检水保区，以回头看落实两断三清	未
水源地保护攻坚2018澧河是河南省漯河市城区主要饮用水源，是市民的大水缸。为确保饮用水源地安全，漯河市各部门积极作为配合联动，共同推进水源地保护区整改工作。	未
水源地保护攻坚 89项环境问题提前清零，深圳饮用水水源地保护演绎特区速度（第一财经）	未
水源地保护攻坚保卫碧水清流 宝鸡拆除嘉清水源地违建1.8万平方米	未
水源地保护攻坚  双鸭山市寒葱沟饮用水水源地环境问题完成整改	未
水源地保护攻坚  河南三个强化 抓好落实 推进水源地环境问题整治取得实效	未
水源地保护攻坚  漯河市各部门配合联动 共同推进水源地保护区整改工作	未
水源地保护攻坚  精准施策 攻坚克难 内蒙古完成2018年水源地环境问题整治	未
水源地保护攻坚  重庆市铜梁区彭水县大溪沟秀山县实现销号清零	未
水源地保护攻坚  黑河市全面完成市级饮用水水源地环境问题整治	未
水滴筹 爱心接力！一个刚满十八岁男孩的求助信！	未
水滴筹爱心接力！挽救封开县罗董这个家庭吧！	未
水灯节那天，人们在海边放天灯许下心愿，我静静坐在沙滩上，看着它们飞上了天空变成星星。晚安。 微博视频	未
水环境治理领域PPP项目绩效考核分析	未
水生野生动物保护宣传月启动 长江江豚仅剩千只	未
水痘爆发 初一学生停课21天 空中课堂接力不停课	未
水碾河：东门人的绝版回忆！	未
水磨沟  在山水之间，岁月细流	未
水立方将变冰立方！[吃驚]据报道，作为北京奥运会的标志性场馆，国家游泳中心（水立方）启动改造，将变身冰立方，以满足北京2022年冬奥会的需求！据悉，冰立方将在保有水立方水上功能的基础上新增冰上功能，承接冰壶轮椅冰壶比赛项目，预计2020年7月完成永久改造。	未
水立方将变冰立方 承接冬奥会项目12月26日，国家游泳中心水立方正式开始改造，预计2020年7月完成永久改造，变身冰立方，以满足北京2022年冬奥会需求！据改造方案，冰立方将在保有水立方水上功能的基础上新增冰上功能，承接冰壶轮椅冰壶比赛项目。	未
“水立方”首推“月光如水”艺术季实现多赢(图)	未
水美福清福清这个湖，飞来了白鹭，美得不像样	未
水舞银蛇，鸟瞰呼伦贝尔草原的莫日格勒河	未
水草小百科红头趴趴熊	未
水草小百科豹纹红蝴蝶	未
水草萋萋鱼翔浅底清水绿岸...这里是七星岩里湖！	未
//@-水蛋蛋-:为我们大绿皮女孩正名了！！	未
水西公园明年5月还要变样，未来将通2条地铁！还有这些值得一去的新改造公园	未
水西公园秋意正浓抓住秋天的尾巴，走出家门观赏秋日的水西公园。（苏娟摄） 网页链接	未
水诏安大力整治农村人居环境，梅岭四都宜居宜业宜游美如画！	未
水逆必备，入了草莓晶，现在要等待爱情的到来了，嘻嘻嘻，团贴戳微博正文	未
水逆水逆快走开	未
水逆退散！//@Destiny7宿命:接！必须接！！	未
水逆退散 一切都会好起来的	未
水逆退散，诸事皆宜  沙坡尾趣浪指南 vol.52	未
水逆退散 转发！愿一切顺利	未
水钵里的枫叶京都杨谷寺用枫叶装饰取水钵，水钵中盛下了整个夏天到秋天的转变太美了(twichacha_nene_jp)	未
水长，致远2019年中国宏观年报全文兴业证券王涵团队：对未来中国经济与金融市场来说，有两条主线值得关注。首先，金融市场的流动性期限可能会不断变长（水长），这会改变整个金融市场的生态，2017年可能只是一个预演，其次，政策开始着手去解决一些长期的问题，尽管对短期经济会有一定影响，但中长期来看，我们可以更加乐观一些（致远）。兴证宏观水长，致远2019年中国宏观年报全文	未
水陆法会第六日丨光明诸天降福瑞，三宝垂慈净业成	未
“水韵江苏”推介会 在捷克布拉格举行	未
永不倒的泰山	未
永不凋谢的雪莲花——记全国道德模范提名奖获得者斯朗卓玛	未
永丰大灶 唤起回忆	未
永乐江上80后水上环卫工何金林	未
永乐江镇入选醉美湘镇 走过路过投一票再走	未
永兴县五成村：激活旅游产业致富引擎	未
永别了，二月河！一代文学巨擘二月河长眠于南阳	未
永别阿Q：表演艺术家严顺开落葬，“金凤凰奖”赠予福寿园	未
永和一家人，同根同生长，永和原创音乐《朝阳牡丹开》全网上线！	未
永和的干部请注意！脱贫攻坚一定要牢记这23个常识问题！	未
永善务基 脐橙乘扶贫快递销沿海！	未
永善县举行122全国交通安全日主题活动启动仪式	未
永善警方联合开展平安创建宣传活动	未
永嘉县全域旅游和5A景区创建每周战报（第32期）	未
永嘉县全域旅游和5A景区创建每周战报（第33期）	未
永城公交车可以扫码支付啦！	未
永城惊现男女混合汗蒸房免费蒸游泳洗澡门票免费送不限量....	未
永城政法委这措施真给力！为老百姓的治安财产上个双保险！	未
永城新增25个电子警察（卡口）即将启动！	未
永城最新出租汽车行业红黑榜出炉！	未
永城金博大广场3周年庆，泰国免费六日游！	未
//@永失完治的莉香丿:确实哦，两次地震还有大暴雨台风希望来年风调雨顺，一切平安	未
永宁立交明天9点通车！成温邛沿线市民往返四环路更加方便	未
永安北高速口三起饮酒后驾车被查获	未
永安小陶班车上的正能量！！	未
永安检察： 请和我一起做宪法的守护者践行者	未
永安百货购物优惠日扫货攻略！YSL兰蔻CK...套装特卖优惠	未
永定，久等了  山水美墅，验资盛启！	未
永定区多人被通报/天门小学获奖/武陵源贫困群众又有好政策（更多）	未
永定区委书记王金福调研全区生态环保攻坚工作	未
永定区长陈荣水一行前往南山凤凰城项目调研	未
永定：投入3.8亿元打造城区首个6车道主干路创业大道	未
永定河流域启动跨省区综合治理与生态修复工程	未
永定致富有新路，鸵鸟养进村	未
永定重铺通往广东大埔县道606线，元旦前可完工	未
@永寿人，12月新规来了，第一条规定最高就可奖60万元！	未
永寿县召开贫困退出自查自评工作动员部署会 苏晓梅主持并讲话 王飞安排当前重点工作	未
永川一男子驾驶三轮车侧翻，这些驾驶技巧要掌握！	未
永川区冬日阳光温暖你我 扶贫助农爱心义卖，让这个冬天不寒冷	未
永川区实施爱心牵手一户多残家庭帮扶项目成效初显	未
永川又一项大工程主体已完工，预计明年投入使用	未
永川城西城南在建这个项目，与大家息息相关！	未
永川头条今天，永川霸屏重庆新闻频道！	未
永川头条泪目...这几个永川人感动了一座城！	未
永川相亲网统一发对象啦，永川单身的小伙伴赶紧领取！	未
永川这个地方快修好了，孩子们又多了个新去处！	未
永川这座城市新地标已主体完工，明年投用！	未
永州万达广场即将开工建设又多一个逛街的好去处！	未
永州公交车票价要涨！1元变2元！	未
永州出发飞抵26个城市！冬季旅游指南请查收	未
永州大道首段完工啦！今年有望全线贯通	未
永州大道首段通车啦！	未
永州宁远县招聘教师180人！	未
永州将建国际体育森林公园	未
永州市离退休干部党建工作现场会在东安召开	未
[永州] 徒步穿越大湘西江华站鸣金2千多人穿越神州瑶都	未
永州或迎第一场雪！你准备好了吗	未
永州新青年16年，看他从农村小伙到行政总厨的蜕变路	未
永州这个村红啦，种辣椒成全国一村一品示范村！	未
永州邓小应上榜11月中国好人！	未
永平用吹响脱贫攻坚冲锋号的方式庆祝州庆	未
@永康人 学习身边的榜样！快来pick你心中的道德模范！	未
永康人期待已久的这几条路终于通车！快去抄一下近路！	未
永康保存最完整的老街即将改造完成，还不去穿越一下	未
永志不忘！81年前的南京，是每个人心头的刺青……	未
永恒不变的A	未
永新：世界艾滋病预防日主题宣传	未
永新社会保险费可微信缴费啦！	未
《永无岛》 一起出发去找永无岛，好不好 photo by.@布魯斯小島	未
永昌街道党工委书记周玉军谈清廉	未
永春县动员部署创建国家公共文化服务体系示范区工作	未
永春县电子商务协会换届，颜聪法当选新一届会长	未
永春最新便民信息：房屋出售招聘求职转让招租统统在这里点进来就有机会！	未
永泰有片诗情画意的桃花源，它在......	未
永泰能源：公司股票及债券将于12月10日复牌	未
永泰能源复牌、高管增持，获招商证券力挺	未
永泰能源拟近期完成“17永泰能源CP004”、“17永泰能源CP005”付息	未
永泰能源：明起复牌 公司生产经营、金融债务等稳定	未
永泰能源：明起复牌，公司生产经营、金融债务等稳定	未
永清环保：中标河北项目 加速全国市场拓展	未
永登11.24最新招聘求职信息！快来看，说不定就找到适合自己的	未
永登11.26最新招聘求职信息！快来看，说不定就找到适合自己的	未
永登12.06招聘求职信息 高薪工作优秀人才，快来挑选！	未
永登土羊被央视报道！这次出大名啦	未
永登招聘外卖骑手及业务员，工资35005800上不封顶！快抢更多岗位	未
永登昨晚下雪，今天早上发生的一幕温暖全城！	未
永福人还有这项特权，快来看看吧	未
永福本地大型水果交易市场有望诞生，以后买卖水果更方便了！	未
永续青年和他们的六亩水稻田 江宁乡村可持续生活实验	未
永葆创新精神 将改革开放进行到底	未
永赢基金五周年：走独具特色的银行系基金公司发展之路	未
永辉兄弟分家：张轩松拿下超市 张轩宁为云创大股东	未
永辉出席中国食品安全年会 打造彩食鲜食品安全之道	未
永辉重塑自有品牌架构 “永辉优选”布局中高端	未
永达传媒乌鲁木齐局兰州局高铁动车冠名招商	未
永远在我需要的时候拥抱我	未
永远无法领会到大肠面的精髓虽然勉强可以吃一口中国的各地饮食，总有当地人爱得销魂，外地人满脸懵呆的特色小吃	未
永远爱你救助的黄白萌喵虎王找上海爱心领养	未
《永远的兵》献给踏上新征程的老班长	未
@永远的军号：退伍不褪色 永葆军人好本色生命里有了当兵的历史，足以自豪一生。前不久，全国20位最美退役军人先进事迹向全社会发布， 从各类新闻报道中得知他们退役后，积极响应党的号召，自力更生自主创业，立足本职敬业奉献，成为了不同战线的实干家和开拓者。他们退伍不褪色，转业不转志，他们身上永远是军人的作风，他们品质里永远是军人的优秀，他们追求中永远是军人的理想，他们工作上永远是军人的标准。然而今天，几位老战友给我发来微信，说以前网上流传的一些退伍老兵在山东平度聚集并与特警对峙的视频有结论了，是极个	未
永远的巴山红叶王瑛	未
永远的温情——三位中共一大代表的家书	未
永陵二十四伎乐乐器穿越时空 再现成都成都人对美好生活的向往锦城丝管日纷纷，半入江风半入云此曲只应天上有，人间能得几回闻这是唐代大诗人杜甫对彼时成都繁弦急管的无尽赞美，亦是千年前这座古代东方音乐之都的真实写照唐音铿锵永陵二十四伎乐音乐文化展正在永陵 ...全文	未
永靖县北京盛世祥泰投资有限公司洽谈会暨枣园整体建设项目意向协议书签约仪式举行	未
求个暖！30就行！@休闲璐	未
求助12.3洞娘和小甜心们好！这里高三，然后明年春季学校会照例去莆田湄洲岛拜拜。已经和同学约好到时候一起穿制服。我已经打算穿月野金一本配山吹短裙。结果今天另一个同学说，穿短裙不能拜拜，她说她去南海穿短裙被赶出来有没有去过湄洲岛的小姐妹吗如果不跪拜，就进去烧香，寺庙我能进得去吗真的不想在外面尴尬。或者穿优等生可以进去吗如果可以的话，裙子大概到哪里才行优马叔叔的店暂时看不了，想伸手求求可以搭配月野金一本的优等生呀。谢谢大家！[给你小心心][给你小心心]	未
求助一下大家，别墅这边冬天真的冷，有什么办法么，安全第一！	未
求助一哈，谁知道浙大邵逸夫医院附近有什么适合谈事的餐厅环境好点比较安静的那种。约了皮肤科的专家，想看看能给大家带来点什么内容！大家想要什么形式的内容也可以说说！	未
求助！众筹，帮忙转发	未
求助！妈妈请您握紧我的手！我们一起战胜疾病！	未
求助！我CM的对象居然是室友！！怎么破	未
求助求助，男生冬天用什么洗面奶和香香比较好呀我去年买的用完了	未
求助给社会各界爱心人士的一封信，希望大家能帮帮这位网友...	未
求助，这个月办什么活动鸭！！！	未
求助阿常好，各位plmm大家好，有一个问题想请教大家，这里前段时间在闲收到一条小裙子，写着produced by kanko，但是水洗标又写着尾悠崎（上海）贸易有限公司，现在我想把这条裙子出掉，搞不懂这算是日制吗还是日本授权的中国工厂加工的还是说是山，谢谢各位了[给你小心心]	未
求助首页！！！谁有唐砖张智尧袁咏仪的帝后cut吗！！！！！！！急需了	未
求//@失语氧气a: //@Unbestandig:我的2019：暴富	未
求婚须知搞笑幽默趣闻	未
求小偷的心里阴影面积。搞笑幽默趣闻	未
求带上。。。	未
求得此签，每事大吉。	未
求扩散！	未
求扩散！帮杞县老太太爱心寻找杞县电动车三轮司机！	未
求扩散！江苏省直公积金可以“不见面”提取啦！	未
求是：把改革开放的旗帜举得更高更稳	未
求是杂志社原社长李捷等8位专家受聘任社科院新闻所专家顾问	未
求求了还是贴雪鹅美图吧评论了里别下雪了，我真的好冷//@錦衣夜行焱十一: 今日大雪	未
求波合影 1WMQ4M	未
求生赢  丛林生存的指导原则	未
求知是人的本性当你在好奇探索争论时，已经走在了通往知识的路上2018年，有哪些健康医疗事件值得人们剖析和思考2019年，有哪些新鲜的医疗领域观点正在酝酿和爆发领取请回答2019长图，回顾与你息息相关的医疗热点吧！大V云集，看看谁上榜了@微博问答	未
求科普！！	未
求租给我一个仓库！我能给你一个传奇！	未
求老铁们为这条微淘点赞，C道出位！点击链接网页链接	未
求职今日最新个人求职信息出炉，找优秀人才，请往这儿看！	未
求职小伙伴速来围观！这些泰国企业正在招聘！	未
求职必知！收好这份五险一金实用说明书求职关心有无健身房下午茶引发热议，我们在求职过程中，总能听到五险一金的说法。五险一金应该怎么缴纳医疗保险断缴三个月会清零退休了就能领取养老保险吗关于五险一金，你该知道的这里都有！戳图转给即将走上工作岗位的小伙伴！	未
求职招聘 11月24日，米易最新求职招聘信息！	未
求职招聘 11月25日，米易最新求职招聘信息！	未
求职招聘 11月26日，米易最新求职招聘信息！	未
求职招聘 11月29日，米易最新求职招聘信息！	未
求职招聘 11月30日，米易最新求职招聘信息！	未
求职招聘 12月1日，米易最新求职招聘信息！	未
求职招聘 12月2日，米易最新求职招聘信息！	未
求职招聘易县11月23日最新求职招聘信息	未
求职招聘易县11月26日最新求职招聘信息	未
求职招聘易县11月27日最新求职招聘信息	未
求职招聘易县11月28日最新求职招聘信息	未
求职招聘易县11月29日最新求职招聘信息	未
求职招聘易县11月30日最新求职招聘信息	未
求职招聘易县12月2日最新求职招聘信息	未
求职招聘租房二手天气信息免费发布每日更新（11月25日）	未
求职招聘租房二手天气信息免费发布每日更新（11月26日）	未
求职招聘租房二手天气信息免费发布每日更新（11月27日）	未
求职招聘租房二手天气信息免费发布每日更新（11月29日）	未
求职招聘租房二手天气信息免费发布每日更新（11月30日）	未
求职招聘租房二手天气信息免费发布每日更新（12月1日）	未
求职者的好消息！12月烟台将举办多场招聘会，还有这些企业...	未
求财神爷对我好点，财运旺旺，财源滚滚	未
求贤引才，盐城送真金给真心！推十条新政签百余项目，发上亿资助资金	未
求贤若渴待遇优厚！内江面向全国急召280人	未
求轻奶，谢谢	未
汇业评论  《慈善组织保值增值投资活动管理暂行办法》解读	未
汇丰发力粤港澳大湾区：在珠三角2020年实现营业收入倍增	未
汇丰晋信原副总曹庆加盟中庚基金	未
汇丰维持香港最优惠贷款利率在5.125%不变	未
汇丰调查：内地女性对舒适退休生活的财务信心低于男性	未
汇丰银行举牌安徽合力 打响QFII第一枪	未
汇付天下为上海国家会计学院第二届校友日活动打电话！	未
汇名堂中医馆首届膏方节12月9日盛大开幕，名老中医免费义诊免费赠送土鸡蛋！	未
汇桔网与分众传媒正式达成全面深度战略资本合作！	未
汇桔网、建设银行联手发布“知商快贷” 助力中小微科创企业融资难题	未
汇添富基金董事长李文：金融科技创新需要制度规则变革实现	未
汇美舍水活晶透爽肤水160ml 19汇美舍！香薰护理及精油的代表品牌，他家的这kuan水活晶透爽肤水，-70的券，到手只要19！！！京东要116的啊！！	未
汇聚乡村振兴的社会力量	未
汇聚传统车企老炮 爱驰汽车打造最靠谱新能源车	未
汇聚大师，对话时代  2018上海金融论坛暨国际金融家论坛成立仪式即将启幕	未
汇聚天下英才，共筑未来之城！中国雄安集团招聘宣传片来啦	未
汇聚爱心助学筑梦北京青基会携捐赠企业到通江县开展捐赠活动	未
汇聚爱心递温暖管理工程学院匿名募捐活动	未
汇聚西藏各方力量 夯实共同思想基础	未
汇通能源：拟2.3亿元参设基金 投资新能源等领域创新项目	未
汇金购物广场招商登记全城启动！	未
汇集在温江这些大街小巷的美食，你可曾吃过	未
汇顶科技活体指纹获云丁科技高端智能门锁商用	未
汉中11.24肇事致人死亡逃逸案成功告破	未
汉中一列特殊使命的绿皮车，火了	未
汉中一商贩收枣皮途中偶遇大熊猫 兴奋感叹：好肥呀！	未
汉中乘坐11路公交滴，赶紧看！	未
汉中交通方便快捷了。	未
汉中人看世界，地质与旅游科普之世界地质公园	未
汉中再增3条铁路，未来将成综合交通枢纽中心！	未
汉中再增三条铁路，已着手谋划铁路联络线！	未
汉中再增两条高铁，现已着手谋划！	未
汉中再增两条高铁线路，现已着手谋划！	未
汉中再新开通一路公交车！	未
汉中千年银杏黄袍加身	未
汉中吉利车友走进城固敬老院献爱心，让这个冬天不再冷	未
汉中城固机场12月恢复乌鲁木齐航线，新增温州航线！	未
汉中城固机场航线又有新变化！连接两座城市	未
汉中孝老爱亲楷模！	未
汉中将被打造成重点区域性节点城市	未
汉中将被重点打造成区域性节点城市	未
汉中开年会吃年夜饭，竟然有如此高大上的地方！	未
汉中快结婚的注意了，有个好政策	未
汉中户外达人赤身挑战龙头山千里冰封！	未
汉中最新招聘11月25日	未
汉中最新招聘 11月28日	未
汉中最新招聘 11月29日	未
汉中最新招聘11月30日	未
汉中最新招聘12月1日	未
汉中最新招聘12月2日	未
汉中最新招聘信息  11月26日	未
汉中最新招聘信息12月4日	未
汉中最新招聘信息12月7日	未
汉中最新白菜价机票！比火车便宜	未
汉中最新高铁时刻表！	未
汉中最新高铁时刻表！记得收藏！	未
汉中机场恢复和新增航线！	未
汉中江景好房，本周有大事要发生！	未
汉中爱骑电动车的，赶紧看！	未
汉中牛人徒步穿越了连城山-云雾山	未
汉中自助广告免费找工作.发招聘.转让租售.优惠交友	未
汉中警车被贴罚单，网友点赞！	未
