民国“中央国术场”修缮完工：两岸“武林高手”齐聚切磋武艺	未
汉中身边事 城市V聚力 为这位白衣女子点赞V影响力峰会	未
汉中身边事 照片定格的秋之绚烂//@汉中同城:汉中身边事 在照片中回忆那份绚烂，黎坪印象！	未
汉中这6个村庄堪称现实版桃花源	未
汉中这个医生被新华社晒照点赞！	未
汉中这处秘境与西乡三花石同名！却有不一样的山水风光	未
汉中这条高速公路，明年开建！	未
汉中门匝道桥将于11月24日拆除	未
汉中门大街匝道桥本周六晚拆除！交通出行攻略快快收藏	未
汉中门大街匝道桥爆破拆除！	未
汉中高铁最新时刻表，另附普速列车表	未
汉中黎坪景区的绝美四季，去一次是不够的！	未
汉中龙头山又刷屏了大雪后的景色，美哭了	未
汉十高铁明年12月通车 汉口到十堰不用两小时汉十高铁是湖北主导投资建设的第一条高铁，武汉至十堰高铁为双线客运专线，线路全长399.126公里，设计时速350公里，从汉孝城际孝感东站引出，途经安陆随州襄阳十堰等地，全线共设13座站房，总投资520亿元建成后，乘火车从汉口到十堰的时间将缩短 ...全文	未
汉十高铁通车时间终于定下来啦 ！	未
汉南至武当山飞行快线明年将开通海口至北海水上飞机航线将开通	未
汉口至前川公交将换成大巴，重回高速下月运营	未
汉台区龙江街道办：五聚焦一活用汇聚脱贫攻坚合力	未
汉台潘家河停车区建成投用 316国道再刷新颜值	未
汉唐古郡，淮海名区！大型全媒体新闻行动《潮起扬子江》明天走进泰州	未
汉唐文商赴美上市新闻发布会暨“和平小天使”赛事启动	未
汉唐远行 古道新风	未
汉嘉设计冲击四连板	未
汉堡峰会开幕，中欧强调深化战略伙伴关系，展望数字化合作	未
汉堡峰会开幕：欧洲政商界希望与中国加强“一带一路”合作	未
汉堡希望成为中国“一带一路”倡议强有力的合作伙伴——访德国汉堡市长彼得·辰切尔	未
汉密尔顿被PETA（善待动物组织）评为年度人物。PETA创始人说：事实证明，汉密尔顿不仅是伟大的车手，也是动物保护组织的有力盟友。我们很荣幸他能鼓励粉丝跟随他的脚步，放弃肉类，乳制品和其他动物产品。汉密尔顿本人也多次在社交媒体上发声，支持这一行为。	未
汉密尔顿被PETA（善待动物组织）评为年度人物PETA创始人说：事实证明，汉密尔顿不仅是伟大的车手，也是动物保护组织的有力盟友我们很荣幸他能鼓励粉丝跟随他的脚步，放弃肉类，乳制品和其他动物产品汉密尔顿本人也多次在社交媒体上发声，支持这一行为	未
汉密尔顿骑摩托的技术，超过了马奎兹驾驶F1的技术	未
汉川空气质量全省垫底！省生态环境厅通报全省1-10月空气质量综合指数！	未
汉拿山烤肉！100元代金券秒杀！隔老远就能闻到肉香	未
汉文化！ 微博视频	未
汉族，世界上唯一一个失去自己服饰的民族。其实我们的服饰才是最美的同意的转！	未
汉林镇召开非洲猪瘟疫情防控工作推进会	未
汉江流域农业博览会在湖北襄阳开幕	未
汉能助波音打造平流层太阳能无人机，中国“智造”深入全球	未
汉能单玻三曲汉瓦产品获TüV莱茵认证证书	未
汉能参加“第20届日本环境与未来能源展EcoPro2018 展会”	未
汉能张彬：薄膜太阳能或将3-5年走进千家万户	未
汉能王永海：解读汉能移动能源控股集团的商业模式	未
汉能薄膜发电集团有限公司获第十三届人民企业社会责任奖绿色发展	未
汉语热升温：中国新选拔汉语教师志愿者5885人	未
汉语热持续升温 中国2019年新选拔汉语教师志愿者5885人	未
“汉语盘点2016”今启动	未
汉语盘点2018大幕开启——字词锦鲤，等你来领(图)	未
汉语盘点2018：“奋”当选年度国内字	未
“汉语盘点2018”年度字词出炉 ：“奋”“改革开放四十年”当选	未
汉语盘点2018揭晓 “改革开放四十年”等当选年度字词	未
“汉语盘点”年度字词：“奋”勇向前，热潮难“退”	未
汉长安城遗址申遗区9村群众安置分房圆满结束 1.5万名群众陆续搬进新房	未
汉阳树尝鲜高精尖体检 武汉古树之最你知道吗	未
汉阳陵回民街高家大院西安西安，有点一样，却又不一样的西安巴士日记 从美到美好	未
汉阴两湖两峡水利风景区项目有序推进	未
汉阴扫黑除恶专项斗争领导小组调研扫黑除恶专项斗争工作	未
汉韵薪传公益朗读大会，你的朗朗之声传中国	未
汕头人周边温泉线路大汇总，让你一个冬天都泡不完	未
汕头城市大动脉正在延伸！这些道路建设有最新进展！	未
汕头夜市美食攻略，揭秘汕头人的深夜食堂！	未
汕头市叁橙电子商务有限公司招聘美工，月薪达4500元	未
汕头某村闹热，这个跳英歌的大妈火了！	未
汕头第一印象很重要！来看看这个联合专项督查	未
汕头谷饶文化节游行，这支队伍的秩序很整齐！	未
汕头高颜值网红亲子乐园来了，2个家庭只需36元就可以玩到爆！	未
汕尾人注意：入冬成功，周末会更冷...	未
汕尾市与省同步举行广东省百万禁毒志愿者服务联盟启动仪式	未
汕尾市红色文化协会派员到北京慰问彭士禄院士	未
汕尾红色文化旅游主题系列活动开幕	未
汕尾警声丨第294期：守护平安的110	未
汕尾这个镇将打造全国最大机器人小镇...	未
汕昆高速广东段12月底全线贯通 广东乡村振兴再迎红利	未
汕汾公路的汾是指哪里? 有一段神奇而感人的传说	未
汕湛高速公路又传来喜讯：约1.5公里的五联山隧道右线贯通啦！	未
汕湛高速公路德庆段建设情况如何看看这里就知道了	未
汗颜！日本五星级酒店打扫卫生也被全程拍了！603间客房，7小时连轴扫，对比之下日本才算真正的业界良心！	未
汝城民生工程建设 加速推进	未
汝州一村庄入选省级传统村落，最高将获财政补助500万！正在公示！	未
汝州停电信息 / 好消息，汝州市区这几条路新增了300多个停车位！	未
汝州城市一天一天的变的干净整洁，那是因为他们......	未
汝州市人民建议征集办公室发出通知	未
汝州市机动车限行，限行时间区域措施都在这儿，很详细！	未
汝州招聘汝州本地每日招聘信息	未
汝州，永不满足！陈天富书记带队赴襄城县郏县考察学习	未
《汝海风云》制作阵容曝光 金牌监制为电影护航	未
汝龙译《契诃夫小说全集》由人民文学出版社出版	未
江丙坤十七度回闽 福建发唁电感念其“关心乡祉”	未
江东中路沿线预计今日10点全面恢复供水	未
江东中路爆管路面预计21日上午恢复	未
江东人物民警周凯峰：千钧一发迎难化险，刑警本色不忘初心	未
江东新区人民有福啦以后通行不只有胜利桥啦！！！	未
江东门隧道恢复单向通车	未
江北交巡警邀您在交通游戏中"决战"	未
江北公交大调整方案出炉！开辟24条过江公交！10条线路经长江大桥过江	未
江北办净化文化市场 营造健康环境	未
江北办汉城国际商圈党委走进巴山工区，感悟巴山精神	未
江北新区不动产登记再提速 符合条件的现场办结	未
江北新区不动产登记提速，符合条件的现场办结、当场发证	未
江北新区与中金资本达成战略合作 共同设立15亿元投资基金	未
江北新区举办“青年戏剧节”征名仪式	未
江北新区又双叒叕招聘！49名警务辅助（文职）57名巡特警支队勤务辅警！速速来报名！	未
江北新区启用首个 国际化人才公寓	未
江北新区大厂街道首届“金牌社工”技能大赛决赛举行	未
江北新区将建2栋超300米大楼	未
江北新区打造全省首个木结构零碳建筑	未
江北新区新拍卖地块将建2栋摩天大楼 高度超300米	未
江北新区核心地块12.96亿拍出，将建300米以上高楼	未
江北新区横江大道快速化改造项目即将启动	未
江北新开一体检中心，率先开展健康防癌管理	未
江北渝北将再添一条南北快速通道！此外，开车的你还要注意这些信息！	未
江南100赛道无痕在行动  我们奔跑江南之巅，一路只留下了脚印	未
江南一定是一部诗稿。读一行，时光微芒，眼中一个季节，纷纷嫣红翻一页，岁月温润，手心一杯暖茶，盈盈一水。时光叠成一座小镇，往事裁出一袖水乡，一块青石映花，一曲流水照月。你来时，苏堤春晓走时，平湖秋月。喜悦，忧伤，写在一行，读时泪两行。	未
//@江南大野花:亲眼看到的话会彻底呆住吧太仙太美了	未
！！//@江南大野花: 天啦真的话就太好了！！//@林水妖:哇！据说家人卖了很多财产保证了五年间的医疗，太好了！守得云开见月明！//@红麟or阿莹-废材组: 太好了！//@果子狸爬大树: //@00David_Cheung00: NB！！//@蓝翔精英李大栓:啊啊啊啊啊	未
//@江南大野花:好全面的总结//@眼儿媚滴春://@夏囧寻://@良平你开心就好: //@樹乃空://@白牙篝火佬阿炮://@想咬人的青山里TF青: //@铃铛铛今天码字了吗:大数据还是挺有意思的	未
//@江南大野花:好没骨气哦//@M大王叫我来巡山:助力倒闭//@-森谷moriya-://@天涯历知幸:是的鸭//@阿花花酱:除了部分人记性不好，更大的原因是很多人压根就不知道这件事儿或者说这个牌子。所以我们要帮忙扩散，让更多人知道鸭	未
//@江南大野花: 工作室请不要压制美丽//@系红领巾的猴子:为什么不让发//@仙水人家:太仙了吧！！！！！！！//@大野师匠: 我的天呐[米奇大哭]	未
//@江南大野花:很好很舒适//@辣条娘: 引起舒适//@洞洞家养仓鼠小天使-我叫妖儿://@锦衣夜行青行灯:引起舒适//@lalalailai:给汕头警方点赞@平安汕头//@高举反男权的大旗前进: 内容引起舒适 //@在在李://@zepfer: 警方干得漂亮	未
//@江南大野花:看不够的故宫美景//@系红领巾的猴子:12月去的时候下一次雪吧//@鲁一围: [给你小心心]//@丨西园雅集丨://@影像视觉杨:拍不够看不厌的是故宫！	未
//@江南大野花:致敬英雄//@挖希挖希://@御原凛音厨w://@黒羽莉夏://@Big鬼Dick舅Futa://@wL_NOW://@夏沫呦呦呦呦呦://@青冥童子://@満艦飾光頭_:	未
江南天池亲子探险  高山滑雪仰望星空古道徒步民俗体验	未
“江南女婿”博格：江南，给世界提供了另一条路	未
江南女子：文人骚客耗时2000年打造的超级IP	未
江南女子是一个超级IP自谢朓提出江南佳丽这一概念之后，经过600多年的传承和发扬，在青楼名伎和文人骚客的合力打造下，江南女子终于在历史舞台上大放异彩，并成为中华民族的文化基因代代相传，并最终成为一个超级IP文化溯源  江南女子：文人骚客耗时2000年打造的超级IP	未
江南女子是一个超级IP自谢朓提出江南佳丽这一概念之后，经过600多年的传承和发扬，在青楼名伎和文人骚客的合力打造下，江南女子终于在历史舞台上大放异彩，并成为中华民族的文化基因代代相传，并最终成为一个超级IP。金庸老爷子笔下每个江南女子都清新脱俗温婉动人。所以小龙女每次出新版，难免被人吐槽，过后又被怀念。文化溯源江南女子：文人骚客耗时2000年打造的超级IP	未
江南好吃又文艺的一条路线，美到爆却少有人知！	未
江南文脉论坛回眸|名篇华章，江南的文学存在	未
江南文脉论坛回眸|忆江南，解读历史密码启示未来	未
江南春：拼多多实现了底层社会的消费升级 中产阶级有三爱三怕和三缺分众传媒创始人江南春表示，今天的中产阶级有三爱三怕和三缺：爱美爱玩爱健康怕老怕死怕孤独缺爱缺心情缺自己。当你的生意在这三爱三怕三缺里时，就不会受到经济浪潮的影响。分众传媒江南春：拼多多实现了底层社会的消费升级	未
江南春：消费到底在升级还是降级	未
//@江南梁柏梧:盛世好人。	未
江南的腊月还留着初秋的温柔海盐绮园   不止旅行 新年旅行 Via@请叫我安大侠	未
江南福地 常来常熟！未来三年，旅游融合发展！	未
江南菖蒲大会：名家植蒲与名家画蒲相映“雅趣”	未
江南西这条老街，每一口都是传奇！	未
江口坝社区三支队伍聚力引导社区妇女新作为	未
江城视窗视察对接宣传...更多资讯戳进来！	未
江城长寿的“懒腰”（行天下）(图)	未
江夏公司开展健康与你同行冬季徒步活动	未
江夏区市场监督管理局湖泗监管所坚持服务为民 再获民众点赞	未
江夏区用人单位为这9类人申报公益性岗位，可享受补贴！	未
江夏召开文明城市建设工作会议，下一步要这么做	未
《江夏拍客》第21期：乡愁是什么	未
江宁举行第三届 大学生求职能力大赛	未
江宁区首例“田园综合体”项目以全省第一获批	未
江宁多条市政道路即将施工，最高投资八亿元，涉及禄口淳化...	未
江宁探案录 两周年官宣我们的江宁探案录马上两岁啦我们线上准备了超多好玩的游戏节目就等你来撩还有各种小周边小惊喜随机掉落（据策划小姐姐说还会有某公交司机身影哦）如果你迫不及待就想了解更多资讯，欢迎加入我们的QQ群：4376879592018的最后一个月，我要预约 ...全文	未
江宁探案录 江宁婆婆签售会本周会和上海杭州的朋友们见面不用预约，但现场座位有限，先到先得哦！当地小伙伴来说说室温如何，能不能穿洞洞鞋大裤衩呀其他城市的活动也在筹备中！	未
江宁最贵的一条路，竟然在这里	未
江宁科苑社区和南京市消协联办“跳蚤市场” 教会市民如何放心消费	未
江宁秣陵试点“党建+业委会”，激活小区治理“一盘棋”	未
江宁红旗社区“双百行动”亮新招 一个手机可掌握辖区所有企业生产状况	未
江宁红旗社区开展消防演练 提升农村小微企业安全生产意识	未
江宁路老地方，方便的朋友来捧场一下义卖吧！！要付房租了，急	未
江宁非标车车主，12月15日前，赶紧填好这张表！	未
江安18个乡镇配备纪检干事，有问题找他们，高效又靠谱	未
江安滨江路小郡肝串串天天5折，啤酒喝1件送2件，持续10天	未
江小涓出任清华公管学院院长 近年深耕互联网经济	未
江小白三只松鼠猪猪侠12月7日在郑州手把手教你打造超级IP！	未
江小白：年轻化是一种战略选择，不是一场营销策划	未
江山城区新一批交通电子监控设备即将启用，详情请戳	未
江山如画，与君同赏	未
江山市第四届项目谋划擂台赛鸣锣开赛！你最关注哪一个	未
江山的梧桐大道，美到窒息......	未
江山这家商场店庆，有了这份攻略，省下的岂止一点！	未
江岸青年之家绿色音符周六公益系列课堂开始报名啦！	未
江川2018年开渔节，一大波发家致富呢机会，已掌握在小九手中！	未
江干新添洗肺公园！有23个足球场那么大！预计2019年下半年开工建设！	未
江平：保护民营企业家利益，分清三个界限非常重要 ！	未
江平西路一期项目部分场地已平整到位 北部快速路将实质性施工	未
//@江氏小盗龙: 很有意思的变化图，海军的兴衰和国运有着最直接的联系啊	未
江汉大学举办今年首场百万校友资智回汉专场	未
江油人才网：招聘保洁	未
江油人才网：招聘销售	未
江油即将开始昌明河上游综合改造	未
江油市广播电视台考察团一行莅什考察交流融媒体建设工作	未
江油马路湾附近拍下一组照片，感动网友...	未
江津人！抢！抢！抢！价值288元的富硒特产大礼包！	未
江津人看过来！ 1条评论100块，赶紧点进来！	未
江浙沪的一只土鳖在本地洗浴中心的一天快乐之旅。（上）前情介绍：本人，干眼严重（在治疗，不用推荐药水什么的哈），皮肤也特别干。但奇怕冷，一旦环境冷，我整个人心情会超差，动作都会慢很多，并且有种想把世界灭了的冲动。江浙沪的冬天，室外10度，室内6度。我们家，因为空间挑高太高，你们脑补农村自建房，空调加热器在客厅都是无效的，只有房间还有用一点，但我又是干皮干眼，空调打了3小时，流鼻血了。于是我近期爆郁闷最近马工超级累，两份工，公司年底加活儿，每天累的惨兮兮的。我天真的认为，我们可以去洗浴中心放松一下	未
江浙沪皖，长三角9城市地铁实现一卡通	未
江浙沪野奢泡汤季  精选5家温泉好宿养生SPA佛系躺看山观云壁炉烤火，进补膳食过冬	未
江海国际旅游节开幕 南通森林野生动物园开门迎客	未
江海志愿者队伍又添生力军 “ABC”环保志愿服务队在港闸成立	未
江海路快速化改造工程第一个项目率先施工，明年六月工程动手！	未
江淮新款iEVA50将推出，新车的长宽高分别为459017651490毫米，轴距为2710毫米预计最大续航里程将超过500公里电动一族	未
江淮警事大雪纷飞  扶贫路上暖心雪警在身边12月7日，大雪纷飞，桐城的蜀黍不忘大山里的帮扶对象，山高沟深，路窄弯曲，蜀黍们冒风雪进山入户，查看贫困户的生活状况，询问家中困难需求在扶贫的路上，在贫困户的家里，在护送群众回家的车上，帮贫济困，暖心雪警不忘初心	未
江淮警事 女富二代打赏心仪男主播200多万 结果一名女富二代小雯(化名)被一位英俊帅气的男主播深深地吸引了，前后为他打赏200多万元谁知道这位男主播竟然有家室小雯随后谈了一名天长的男朋友常某，为了帮女友拿回一笔25万元的欠款，常某带人赶赴山东，逼迫对方写下欠条，常某因敲 ...全文	未
江淮警事 守护我们的绿水青山 淮南警方破获一起环境污染案中国进入新时代，生态环境保护摆在更加突出的位置。全社会都在尊重自然顺应自然保护自然，为共同建设美丽中国而砥砺前行时，有人却在利益的驱使下，置法律于不顾，投入巨资实施污染环境的犯罪行为。结果必然难逃法律制裁！ ...全文	未
江淮风暴广德法院六项措施助力执行攻坚战	未
江湖人称素鸡排，外酥里嫩的脆皮豆腐是也，咬一口真是回味无穷	未
，江湖传言，大家吃个瓜就好了	未
江湖召集本周六佛山功夫文化节 龙光玖龙郡齐集各门派切磋！	未
江湖热闹，因你而起。	未
江理工学子手绘“法制漫画” 弘扬宪法精神	未
江疏影白宇合影俏皮卖萌 笑称是“长大”的缘份	未
江疏影的半裙遮肉又时髦	未
江科最神奇的队伍宿管阿姨	未
江苏10地最高气温超过了40℃ 再熬一周，8月1日高温有望缓解	未
江苏19家纺服企业列入国家重点跟踪培育自主品牌 总数列全国第三	未
江苏300亿民生资金稳就业促创业 提调创业贷款	未
江苏40年培养54.95万研究生	未
江苏40年来累计培养研究生54.95万人	未
江苏4项目入选国家级工业遗产，我省将加强工业遗产保护利用	未
江苏5座跨江大桥收费站拆除工作将在12月25日前后完成	未
江苏6大城市入围中国可持续发展百强城市排行榜，分别是无锡南京苏州南通扬州徐州6个城市	未
江苏上半年居民人均可支配收入18266元	未
江苏下雪 8日沿江苏南地区局部大到暴雪，江苏北部最低气温-5江苏省气象台6日下午发布了最新的天气预报显示，大家期待的初雪将从周五夜间正式拉开帷幕，周末雨雪最为集中，预报8日沿江苏南地区局部大到暴雪虽说此次沿江苏南地区的降雪的主战场，而淮北地区9日晚些时候也可能飘起小雪（ ...全文	未
江苏“不见面审批”便民高效获点赞	未
江苏：世界杯一周来查获1400多名“酒司机”	未
江苏两条高速开工建设 苏皖间再增出省新通道	未
江苏中医药将加速国际推广	未
江苏中烟2019年招聘，徐州37人！	未
江苏丹阳退休教师不甘寂寞再“上岗” 传承文化扬新风	未
江苏举办中医药健康文化知识大赛 90名选手参赛	未
江苏举行促进民企发展银企对接会30个项目签约授信总额达300亿	未
江苏乡村振兴战略5年规划来了，设下26个小目标	未
@江苏人 好消息！雾霾后天就要散了，但是下周的寒潮将一秒入冬！	未
江苏今年建成较大规模体育公园700个 健身设施成标配！	未
江苏代表团赴陕西推进对口扶贫协作	未
江苏仿制药质量和疗效怎么样？这20个品种很领先！	未
“江苏企业对外投资交流联盟”正式成立	未
江苏企业环保治理需求发布平台上线，百万“红包”等你来拿！	未
江苏侨界人士在南京分享改革开放40年心路历程	未
江苏保障儿童白血病药品供应 救助贫困家庭	未
江苏先进材料技术创新中心启动建设	未
江苏全力加强气象防灾减灾 让预警信息跑得比灾害更快	未
江苏全省气温回升 将迎来今冬第二次“脏空气”	未
江苏全面建立河长制一周年：落实五级河长5.7万余人	未
江苏六个项目入选工业互联网试点示范项目	未
江苏再次现场督办张家港环境问题 要求迅速整改	未
江苏军训服产品质量怎么样？权威抽查报告来啦！	未
江苏农机修理工技能大比拼 一等奖得主除了获授“江苏技能状元”称号还享省劳模等待遇	未
江苏冬春农田水利建设传递新导向：既建大工程，又润阡陌地	未
江苏出入境迎来办证高峰 近期办证需预留充足时间	未
江苏出台意见细化服务民企措施	未
江苏出台推进医养结合新政策 家庭病床等费用将纳入医保支付	未
@江苏创投机构 长三角区域一体化来了！机遇也来了	未
江苏制定工业互联网发展计划 培育3万个工业APP	未
江苏制定的这个保险政策为全国首创，投保可享受财政保险费补贴	未
江苏力推政务服务“一网通办”年访问量达4.5亿	未
江苏加快发展智能制造：2020年将建成1000家智能车间	未
江苏十大主题名宴梅兰宴，见过的厨师屈指可数	未
江苏南京诞生首部国家公祭地方立法！精日行为将被处罚 11月23日，《南京市国家公祭保障条例》获全票通过，该《条例》将从2018年12 月13日起正式生效。《条例》明确规定：国家公祭仪式鸣放警报时，所有人默哀一分钟国家公祭设施周边禁止一切公共娱乐活动对精日行为划定法律红线，构成违反治安管理行为的，由公安机关依法给予治安管理处罚构成犯罪的，依法追究刑事责任。重磅  刚刚，省人大全票通过《南京市国家公祭保障条例》！	未
江苏南京诞生首部国家公祭地方立法！精日行为将被处罚23日，《南京市国家公祭保障条例》获全票通过。明确规定：国家公祭仪式鸣放警报时，所有人默哀一分钟国家公祭设施周边禁止一切公共娱乐活动对精日行为划定法律红线。 铭记历史，珍爱和平，吾辈自强！	未
江苏南京诞生首部国家公祭地方立法！精日行为将被处罚！23日，《南京市国家公祭保障条例》获全票通过。规定：国家公祭仪式鸣放警报时，所有人默哀一分钟国家公祭设施周边禁止一切公共娱乐活动对精日行为划定法律红线，构成犯罪的，依法追究刑事责任。@人民日报	未
江苏南水北调启动2018-2019年度调水 将向山东调出1个“骆马湖”	未
江苏南通：假日景点迎“绿色”蝶变  “城市客厅”获	未
江苏卫视一本好书，@学徒王自健 解读未来简史，带您探索未来世界，畅游知识的海洋！今天16：30，不见不散 ！	未
江苏卫视我们的四十年江苏卫视幸福剧场刚和二叔喜相逢，准备施展抱负，二叔就被抓了正在商量如何救二叔，钱又被抢了打中歹徒后，最终成功与二叔再次喜相逢这一次来深圳的开场，真的妙不可言呐！	未
江苏卫视点赞扬州“愚公”护河队	未
江苏印发机器人产业发展行动计划 目标3年打造千亿级产业集群	未
江苏又有两条高速开工建设 计划工期均为3年12月18日上午，溧阳至福建宁德高速公路江苏段高淳至安徽宣城高速公路江苏段开工建设，我省又将新增两条对接安徽的出省通道。两条高速公路，计划工期均为三年。（江苏交通广播）	未
江苏又有两条高速开工建设 计划工期均为3年12月18日上午，溧阳至福建宁德高速公路江苏段高淳至安徽宣城高速公路江苏段开工建设，我省又将新增两条对接安徽的出省通道两条高速公路，计划工期均为三年（江苏交通广播）	未
江苏又有四地被评为国家生态文明建设示范市县	未
